abo	a b ɔ	584
absolwent	a p s ɔ l v ɛ n t	0
absolwentka	a p s ɔ l v ɛ n t k a	0
afrika	a f rʲ i k a	4
ako	a k ɔ	819
albanarka	a l b a n a r k a	0
albanaŕ	a l b a n a rʲ	0
ale	a l ɛ	376
alojs	a l ɔ j s	2
awto	a w t ɔ	1
awtor	a w t ɔ r	9
azija	a z i j a	1
baba	b a b a	1
babce	b a p t͡s ɛ	0
banana	b a n a n a	3
bananu	b a n a n u	0
banka	b a n k a	2
bankach	b a n k a x	0
bankami	b a n k a mʲ i	0
banki	b a n kʲ i	2
banku	b a n k u	1
barana	b a r a n a	0
barlinja	b a r lʲ i nʲ a	7
barliń	b a r lʲ i nʲ	5
barwa	b a r v a	6
baz	b a s	2
baza	b a z a	4
baze	b a z ɛ	0
bazowy	b a z ɔ w ɨ	0
bcha	p x a	0
beja	b ɛ j a	0
bejach	b ɛ j a x	0
bit	bʲ i t	0
bjachaŕ	bʲ a x a rʲ	0
bjerjech	bʲ ɛ rʲ ɛ ç	0
bjerjechmej	bʲ ɛ rʲ ɛ ç m ɛ j	0
bjerjechmy	bʲ ɛ rʲ ɛ ç m ɨ	0
bjerjechu	bʲ ɛ rʲ ɛ ç u	0
bjerjecy	bʲ ɛ rʲ ɛ t͡s ɨ	0
bjerješo	bʲ ɛ rʲ ɛ ʃ ɔ	0
bjerještej	bʲ ɛ rʲ ɛ ʃ t ɛ j	0
bjerješćo	bʲ ɛ rʲ ɛ ɕ t͡ɕ ɔ	0
bjerjo	bʲ ɛ rʲ ɔ	2
bjerjom	bʲ ɛ rʲ ɔ m	0
bjerjomej	bʲ ɛ rʲ ɔ m ɛ j	0
bjerjomy	bʲ ɛ rʲ ɔ m ɨ	0
bjerjotej	bʲ ɛ rʲ ɔ t ɛ j	0
bjerjośo	bʲ ɛ rʲ ɔ ɕ ɔ	0
bjerjoš	bʲ ɛ rʲ ɔ ʃ	1
bjeŕ	bʲ ɛ rʲ	0
bjeŕtej	bʲ ɛ rʲ t ɛ j	0
bjeŕśo	bʲ ɛ rʲ ɕ ɔ	0
blida	b l i d a	6
blido	b l i d ɔ	8
bliska	b l i s k a	2
bliski	b l i s kʲ i	0
bliskich	b l i s kʲ i x	0
bliskim	b l i s kʲ i m	0
bliskimi	b l i s kʲ i mʲ i	0
blisko	b l i s k ɔ	49
blědy	b l ɪ d ɨ	0
bob	b ɔ p	0
bobr	b ɔ b r	2
boce	b ɔ t͡s ɛ	9
boga	b ɔ ɡ a	16
bogaty	b ɔ ɡ a t ɨ	4
bok	b ɔ k	29
bom	b ɔ m	117
boma	b ɔ m a	3
brane	b r a n ɛ	0
bratš	b r a t ʃ	6
braś	b r a ɕ	1
bridki	b rʲ i t kʲ i	0
brjaza	b rʲ a z a	1
brjaze	b rʲ a z ɛ	0
brjoze	b rʲ ɔ z ɛ	15
brjuch	b rʲ u x	1
brod	b r ɔ t	2
broda	b r ɔ d a	0
brodach	b r ɔ d a x	0
brodami	b r ɔ d a mʲ i	0
brodom	b r ɔ d ɔ m	0
brodu	b r ɔ d u	0
brona	b r ɔ n a	0
broń	b r ɔ nʲ	0
brošma	b r ɔ ʃ m a	0
bruk	b r u k	3
bruse	b r u s ɛ	0
bubon	b u b ɔ n	0
buducy	b u d u t͡s ɨ	0
bujny	b u j n ɨ	0
buk	b u k	11
butra	b u t r a	1
buwoł	b u w ɔ w	0
buź	b u ɕ	0
buźom	b u ʑ ɔ m	0
buźtej	b u ɕ t ɛ j	0
buźćo	b u ɕ t͡ɕ ɔ	0
bydle	b ɨ d l ɛ	6
bydlenje	b ɨ d l ɛ nʲ ɛ	0
bydli	b ɨ d l i	9
bydlim	b ɨ d l i m	0
bydlit	b ɨ d l i t	0
bydlił	b ɨ d l i w	5
bydliś	b ɨ d l i ɕ	0
byk	b ɨ k	2
byli	b ɨ l i	104
byłej	b ɨ w e j	18
byśe	b ɨ ɕ ɛ	0
bój	b ɛ j	0
bójał	b ɛ j a w	1
bójaś	b ɛ j a ɕ	1
bóje	b ɛ j ɛ	0
bójm	b ɛ j m	0
ból	b ɛ l	0
ból	b ɨ l	0
ból	b ʊ l	0
bóleł	b ɛ l ɛ w	0
bóleł	b ɨ l ɛ w	0
bóleł	b ʊ l ɛ w	0
bóleś	b ɛ l ɛ ɕ	0
bóleś	b ɨ l ɛ ɕ	0
bóleś	b ʊ l ɛ ɕ	0
bóli	b ɛ l i	0
bóli	b ɨ l i	0
bóli	b ʊ l i	0
bósučki	b ɛ s u t͡ʃ k i	0
bósučki	b ɨ s u t͡ʃ k i	0
bósučki	b ʊ s u t͡ʃ k i	0
bósy	b ɛ s ɨ	1
bósy	b ɨ s ɨ	1
bósy	b ʊ s ɨ	1
bóžy	b ɛ ʒ ɨ	5
bóžy	b ɨ ʒ ɨ	5
bóžy	b ʊ ʒ ɨ	5
běch	bʲ ɪ x	0
běchmej	bʲ ɪ x m e j	0
běchmy	bʲ ɪ x m ɨ	0
běchu	bʲ ɪ x u	3
běły	bʲ ɪ w ɨ	24
běšo	bʲ ɪ ʃ ɔ	6
běštej	bʲ ɪ ʃ t e j	1
běšćo	bʲ ɪ ɕ t͡ɕ ɔ	0
běžaś	bʲ ɪ ʒ a ɕ	0
błogi	b ɔ ɡʲ i	0
błota	b w ɔ t a	13
błoto	b w ɔ t ɔ	0
bźez	b ʑ ɛ s	69
b́edro	bʲ ɛ d r ɔ	0
candaŕ	t͡s a n d a rʲ	0
capla	t͡s a p l a	0
caple	t͡s a p l ɛ	0
carne	t͡s a r n ɛ	24
carnem	t͡s a r n ɛ m	0
cas	t͡s a s	161
casa	t͡s a s a	44
case	t͡s a s ɛ	6
ceja	t͡s ɛ j a	0
ceje	t͡s ɛ j ɛ	1
ceji	t͡s ɛ j i	0
cele	t͡s ɛ l ɛ	17
ceptaŕ	t͡s ɛ p t a rʲ	9
cerw	t͡s ɛ r f	0
cerwjeny	t͡s ɛ r vʲ ɛ n ɨ	20
cesa	t͡s ɛ s a	0
cesta	t͡s ɛ s t a	1
cesto	t͡s ɛ s t ɔ	148
cesty	t͡s ɛ s t ɨ	0
cesć	t͡s ɛ s t͡ɕ	3
ceło	t͡s ɛ w ɔ	2
charta	x a r t a	1
chlěw	x l ɪ w	0
chrobry	x r ɔ b r ɨ	2
chroma	x r ɔ m a	0
chrome	x r ɔ m ɛ	0
chromy	x r ɔ m ɨ	0
chrust	x r u s t	0
chto	x t ɔ	7
chudy	kʰ u d ɨ	1
chudy	x u d ɨ	1
chyliś	x ɨ l i ɕ	0
chytšy	x ɨ t ʃ ɨ	0
chójźiś	x ɛ j ʑ i ɕ	0
chóra	x ɛ r a	0
chóra	x ɨ r a	0
chóra	x ʊ r a	0
chóre	x ɛ r ɛ	2
chóre	x ɨ r ɛ	2
chóre	x ʊ r ɛ	2
chórem	x ɛ r ɛ m	0
chórem	x ɨ r ɛ m	0
chórem	x ʊ r ɛ m	0
chórgoj	x ɛ r ɡ ɔ j	30
chórgoj	x ɨ r ɡ ɔ j	30
chórgoj	x ʊ r ɡ ɔ j	30
chórobny	x ɛ r ɔ b n ɨ	0
chórobny	x ɨ r ɔ b n ɨ	0
chórobny	x ʊ r ɔ b n ɨ	0
chórowni	x ɛ r o w nʲ i	0
chórowni	x ɨ r o w nʲ i	0
chórowni	x ʊ r o w nʲ i	0
chórownja	x ɛ r o w nʲ a	1
chórownja	x ɨ r o w nʲ a	1
chórownja	x ʊ r o w nʲ a	1
chóry	x ɛ r ɨ	2
chóry	x ɨ r ɨ	2
chóry	x ʊ r ɨ	2
chórych	x ɛ r ɨ x	1
chórych	x ɨ r ɨ x	1
chórych	x ʊ r ɨ x	1
chóśebuski	x ɛ ɕ ɛ b u s kʲ i	0
chóśebuski	x ɨ ɕ ɛ b u s kʲ i	0
chóśebuski	x ʊ ɕ ɛ b u s kʲ i	0
chóśebuz	x ɛ ɕ ɛ b u s	14
chóśebuz	x ɨ ɕ ɛ b u s	14
chóśebuz	x ʊ ɕ ɛ b u s	14
chóśebuza	x ɛ ɕ ɛ b u z a	4
chóśebuza	x ɨ ɕ ɛ b u z a	4
chóśebuza	x ʊ ɕ ɛ b u z a	4
chłodno	x ɔ d n ɔ	0
chłodny	x ɔ d n ɨ	0
co	t͡s ɔ	29
cogo	t͡s ɔ ɡ ɔ	0
cole	t͡s ɔ l ɛ	0
comu	t͡s ɔ m u	0
cora	t͡s ɔ r a	6
coš	t͡s ɔ ʃ	1
což	t͡s ɔ ʃ	55
crjej	t͡s rʲ ɛ j	0
crjop	t͡s rʲ ɔ p	0
cukor	t͡s u k ɔ r	5
cut	t͡s u t	0
cuzy	t͡s u z ɨ	1
cyni	t͡s ɨ nʲ i	6
cynim	t͡s ɨ nʲ i m	0
cynimej	t͡s ɨ nʲ i m e j	0
cynimy	t͡s ɨ nʲ i m ɨ	1
cynitej	t͡s ɨ nʲ i t e j	0
cynił	t͡s ɨ nʲ i w	7
cyniś	t͡s ɨ nʲ i ɕ	9
cyniśo	t͡s ɨ nʲ i ɕ ɔ	1
cyniš	t͡s ɨ nʲ i ʃ	0
cynje	t͡s ɨ nʲ ɛ	4
cyste	t͡s ɨ s t ɛ	0
cysty	t͡s ɨ s t ɨ	1
cytanje	t͡s ɨ t a nʲ ɛ	2
cłowjek	t͡s w ɔ j ɛ k	9
cłowjek	t͡s w ɔ vʲ ɛ k	9
da	d a	41
dalej	d a l ɛ j	50
dali	d a l i	3
dalina	d a l i n a	0
daloko	d a l ɔ k ɔ	21
damast	d a m a s t	0
dan	d a n	1
dana	d a n a	2
dane	d a n ɛ	1
daneje	d a n ɛ j ɛ	1
danje	d a nʲ ɛ	0
dank	d a n k	1
danki	d a n kʲ i	3
danku	d a n k u	0
danu	d a n u	1
dany	d a n ɨ	2
dat	d a t	0
dawno	d a w n ɔ	2
dawny	d a w n ɨ	0
dej	d ɛ j	20
dejanje	d ɛ j a nʲ ɛ	0
dejał	d ɛ j a w	4
dejaś	d ɛ j a ɕ	0
deje	d ɛ j ɛ	3
deri	d ɛ rʲ i	0
deriś	d ɛ rʲ i ɕ	0
dešć	d ɛ ɕ t͡ɕ	0
dirigent	dʲ i rʲ i ɡʲ ɛ n t	2
dirigentka	dʲ i rʲ i ɡʲ ɛ n t k a	0
diskutowaś	dʲ i s k u t ɔ w a ɕ	0
dla	d l a	110
do	d ɔ	1102
dobra	d ɔ b r a	3
dobre	d ɔ b r ɛ	8
dobrego	d ɔ b r ɛ ɡ ɔ	2
dobrej	d ɔ b r ɛ j	0
dobrem	d ɔ b r ɛ m	1
dobremu	d ɔ b r ɛ m u	0
dobrota	d ɔ b r ɔ t a	0
dobru	d ɔ b r u	1
dobry	d ɔ b r ɨ	8
dobrych	d ɔ b r ɨ x	2
dobrym	d ɔ b r ɨ m	0
dobrymi	d ɔ b r ɨ mʲ i	0
dole	d ɔ l ɛ	0
dom	d ɔ m	21
doma	d ɔ m a	9
domy	d ɔ m ɨ	5
dosć	d ɔ s t͡ɕ	9
doł	d ɔ w	2
dołojce	d ɔ w ɔ j t͡s ɛ	19
drap	d r a p	0
drapaś	d r a p a ɕ	0
drjewo	d rʲ ɛ w ɔ	18
drježdźany	d rʲ ɛ ʑ d ʑ a n ɨ	5
drob	d r ɔ p	0
droba	d r ɔ b a	0
drobami	d r ɔ b a mʲ i	0
droby	d r ɔ b ɨ	0
droga	d r ɔ w ɡ a	12
droga	d r ɔ ɡ a	12
droge	d r ɔ ɡʲ ɛ	1
drogich	d r ɔ ɡʲ i x	0
drogowy	d r ɔ w ɡ ɔ w ɨ	0
droze	d r ɔ w z ɛ	6
droze	d r ɔ z ɛ	6
droznje	d r ɔ z nʲ ɛ	0
droždźeje	d r ɔ ʑ d͡ʑ ɛ j ɛ	8
drugi	d r u ɡʲ i	29
drugich	d r u ɡʲ i x	51
du	d u	10
dub	d u p	2
dubach	d u b a x	0
dubje	d u bʲ ɛ	0
dut	d u t	0
dute	d u t ɛ	0
duś	d u ɕ	0
dwa	d w a	72
dwór	d w ɛ r	2
dwór	d w ɨ r	2
dwór	d w ʊ r	2
dwě	d vʲ ɪ	44
dym	d ɨ m	1
dyma	d ɨ m a	3
dług	d w u k	0
dłujki	d w u j kʲ i	28
estniska	ɛ s t nʲ i s k a	3
ezel	ɛ z ɛ l	0
fabrice	f a b rʲ i t͡s ɛ	1
fabrika	f a b rʲ i k a	0
fabriki	f a b rʲ i kʲ i	0
fagot	f a ɡ ɔ t	0
familija	f a mʲ i lʲ i j a	6
fanfara	f a n f a r a	0
fara	f a r a	0
faram	f a r a m	0
faraŕ	f a r a rʲ	16
faru	f a r u	1
fary	f a r ɨ	0
fasada	f a s a d a	0
ferije	f ɛ rʲ i j ɛ	0
fidle	fʲ i d l ɛ	0
formowaś	f ɔ r m ɔ w a ɕ	1
gaby	ɡ a b ɨ	3
gad	ɡ a t	0
gada	ɡ a d a	0
gadam	ɡ a d a m	0
galerija	ɡ a l ɛ rʲ i j a	27
gano	ɡ a n ɔ	0
garba	ɡ a r b a	2
gardina	ɡ a r dʲ i n a	0
garona	ɡ a r ɔ n a	0
gat	ɡ a t	0
gdy	d ɨ	2
gdyby	d ɨ b ɨ	0
gib	ɡʲ i p	0
gibanje	ɡʲ i b a nʲ ɛ	4
gjarb	ɡʲ a r p	0
gjardy	ɡʲ a r d ɨ	0
gjardło	ɡʲ a r d w ɔ	0
gjarsć	ɡʲ a r s t͡ɕ	0
glej	ɡ l ɛ j	7
glědaś	ɡ lʲ ɪ d a ɕ	1
gnida	ɡ nʲ i d a	0
gnězdo	ɡ nʲ ɪ z d ɔ	3
gowjedo	ɡ ɔ j ɛ d ɔ	0
gowjedo	ɡ ɔ vʲ ɛ d ɔ	0
goły	ɡ ɔ w ɨ	1
grali	ɡ r a l i	0
granice	ɡ r a nʲ i t͡s ɛ	8
grat	ɡ r a t	0
graśe	ɡ r a ɕ ɛ	10
grima	ɡ rʲ i m a	0
grob	ɡ r ɔ p	0
grobje	ɡ r ɔ bʲ ɛ	0
grod	ɡ r ɔ t	13
grody	ɡ r ɔ d ɨ	0
gromaźe	ɡ r ɔ m a ʑ ɛ	33
groni	ɡ r ɔ nʲ i	52
groza	ɡ r ɔ z a	0
groze	ɡ r ɔ z ɛ	0
grozu	ɡ r ɔ z u	0
guba	ɡ u b a	4
gus	ɡ u s	0
gusta	ɡ u s t a	4
guste	ɡ u s t ɛ	0
gustem	ɡ u s t ɛ m	1
gusto	ɡ u s t ɔ	30
gustu	ɡ u s t u	1
gusty	ɡ u s t ɨ	0
gwězda	ɡ vʲ ɪ z d a	6
gymnazium	ɡ ɨ m n a z i u m	4
gód	ɡ ɛ t	0
gód	ɡ ɨ t	0
gód	ɡ ʊ t	0
gódy	ɡ ɛ d ɨ	0
gódy	ɡ ɨ d ɨ	0
gódy	ɡ ʊ d ɨ	0
gójś	ɡ ɛ j ɕ	0
góla	ɡ ɛ l a	3
góla	ɡ ɨ l a	3
góla	ɡ ʊ l a	3
gólc	ɡ ɛ l t͡s	2
gólc	ɡ ɨ l t͡s	2
gólc	ɡ ʊ l t͡s	2
góle	ɡ ɛ l ɛ	8
góle	ɡ ɨ l ɛ	8
góle	ɡ ʊ l ɛ	8
góleśa	ɡ ɛ l ɛ ɕ a	0
góleśa	ɡ ɨ l ɛ ɕ a	0
góleśa	ɡ ʊ l ɛ ɕ a	0
góra	ɡ ɛ r a	32
góra	ɡ ɨ r a	32
góra	ɡ ʊ r a	32
górach	ɡ ɛ r a x	15
górach	ɡ ɨ r a x	15
górach	ɡ ʊ r a x	15
góram	ɡ ɛ r a m	0
góram	ɡ ɨ r a m	0
góram	ɡ ʊ r a m	0
górami	ɡ ɛ r a m ɨ	0
górami	ɡ ɨ r a m ɨ	0
górami	ɡ ʊ r a m ɨ	0
górce	ɡ ɛ r t͡s ɛ	0
górce	ɡ ɨ r t͡s ɛ	0
górce	ɡ ʊ r t͡s ɛ	0
górjejce	ɡ ɛ rʲ ɛ j t͡s ɛ	26
górjejce	ɡ ɨ rʲ ɛ j t͡s ɛ	26
górjejce	ɡ ʊ rʲ ɛ j t͡s ɛ	26
górka	ɡ ɛ r k a	6
górka	ɡ ɨ r k a	6
górka	ɡ ʊ r k a	6
górki	ɡ ɛ r kʲ i	10
górki	ɡ ɨ r kʲ i	10
górki	ɡ ʊ r kʲ i	10
góru	ɡ ɛ r u	7
góru	ɡ ɨ r u	7
góru	ɡ ʊ r u	7
góry	ɡ ɛ r ɨ	9
góry	ɡ ɨ r ɨ	9
góry	ɡ ʊ r ɨ	9
góršy	ɡ ɛ r ʃ ɨ	0
góršy	ɡ ɨ r ʃ ɨ	0
góršy	ɡ ʊ r ʃ ɨ	0
gósć	ɡ ɛ s t͡ɕ	1
gósć	ɡ ɨ s t͡ɕ	1
gósć	ɡ ʊ s t͡ɕ	1
gósća	ɡ ɛ s t͡ɕ a	0
gósća	ɡ ɨ s t͡ɕ a	0
gósća	ɡ ʊ s t͡ɕ a	0
gósćeńc	ɡ ɛ s t͡ɕ ɛ nʲ t͡s	4
gósćeńc	ɡ ɨ s t͡ɕ ɛ nʲ t͡s	4
gósćeńc	ɡ ʊ s t͡ɕ ɛ nʲ t͡s	4
gósći	ɡ ɛ s t͡ɕ i	0
gósći	ɡ ɨ s t͡ɕ i	0
gósći	ɡ ʊ s t͡ɕ i	0
gótowa	ɡ ɛ t ɔ w a	0
gótowa	ɡ ɨ t ɔ w a	0
gótowa	ɡ ʊ t ɔ w a	0
gótowy	ɡ ɛ t ɔ w ɨ	2
gótowy	ɡ ɨ t ɔ w ɨ	2
gótowy	ɡ ʊ t ɔ w ɨ	2
gózdź	ɡ ɛ s t͡ɕ	0
gózdź	ɡ ɨ s t͡ɕ	0
gózdź	ɡ ʊ s t͡ɕ	0
gózdźa	ɡ ɛ z d͡ʑ a	1
gózdźa	ɡ ɨ z d͡ʑ a	1
gózdźa	ɡ ʊ z d͡ʑ a	1
gózdźe	ɡ ɛ z d͡ʑ ɛ	0
gózdźe	ɡ ɨ z d͡ʑ ɛ	0
gózdźe	ɡ ʊ z d͡ʑ ɛ	0
gózdźik	ɡ ɛ z d ʑ i k	0
gózdźik	ɡ ɨ z d ʑ i k	0
gózdźik	ɡ ʊ z d ʑ i k	0
góńtwowaś	ɡ ɛ nʲ t w o w a ɕ	0
góńtwowaś	ɡ ɨ nʲ t w o w a ɕ	0
góńtwowaś	ɡ ʊ nʲ t w o w a ɕ	0
góźina	ɡ ɛ ʑ i n a	2
góźina	ɡ ɨ ʑ i n a	2
góźina	ɡ ʊ ʑ i n a	2
gładkich	ɡ w a t kʲ i x	0
gładko	ɡ w a t k ɔ	1
głupy	ɡ u p ɨ	0
hengist	h ɛ ŋʲ ɡʲ i s t	0
historiske	h i s t ɔ rʲ i s kʲ ɛ	22
how	ɔ w	133
hurje	h u rʲ ɛ	0
huroma	h u r ɔ m a	0
huru	h u r u	0
hyś	ɨ ɕ	2
informacija	i n f ɔ r m a t͡s i j a	1
inženjer	i n ʒ ɛ nʲ ɛ r	2
inženjerka	i n ʒ ɛ nʲ ɛ r k a	0
jacmjeń	j a t͡s mʲ ɛ nʲ	0
jaden	j a d ɛ n	84
jagnje	j a ɡ nʲ ɛ	0
jagnjeśina	j a ɡ nʲ ɛ ɕ i n a	0
jagoda	j a ɡ ɔ d a	9
jajach	j a j a x	0
jajce	j a j t͡s ɛ	0
jajko	j a j k ɔ	3
jajo	j a j ɔ	0
jano	j a n ɔ	311
jara	j a r a	2
jare	j a r ɛ	1
jarem	j a r ɛ m	0
jary	j a r ɨ	0
jasne	j a s n ɛ	5
jasno	j a s n ɔ	0
jasny	j a s n ɨ	4
jasnych	j a s n ɨ x	1
jastśeb	j a s t͡ɕ ɛ p	0
jastśebik	j a s t͡ɕ ɛ bʲ i k	0
jastśebja	j a s t͡ɕ ɛ bʲ a	0
jatšy	j a t͡ʃ ɨ	0
jazor	j a z ɔ r	29
jazoro	j a z ɔ r ɔ	3
jazw	j a s	0
jašćeŕ	j a ɕ t͡ɕ ɛ rʲ	0
je	j ɛ	91
jeb	j ɛ p	0
jeba	j ɛ b a	0
jebany	j ɛ b a n ɨ	0
jebat	j ɛ b a t	0
jedle	j ɛ d l ɛ	0
jeglicka	j ɛ ɡ l i t͡s k a	0
jeje	j ɛ j ɛ	100
jelenica	j ɛ l ɛ nʲ i t͡s a	0
jeleń	j ɛ l ɛ nʲ	0
jerjeł	j ɛ rʲ ɛ w	4
jerła	j ɛ r w a	0
jež	j e ʃ	0
jich	j i x	138
jima	j i m a	2
jogo	j ɔ ɡ ɔ	265
jogurt	j ɔ ɡ u r t	0
joli	j ɔ l i	0
južo	j u ʒ ɔ	101
jědro	j ɪ d r ɔ	9
jědu	j ɪ d u	0
jěsć	j ɪ s t͡ɕ	14
jětša	j ɪ t ʃ a	0
jěza	j ɪ z a	1
jězd	j ɪ s t	0
jězdźiś	j ɪ z d͡ʑ i ɕ	0
jězyk	j ɪ z ɨ k	3
jěł	j ɪ w	1
jěś	j ɪ ɕ	1
jěźech	j ɪ ʑ ɛ ç	0
jěźechmej	j ɪ ʑ ɛ ç m ɛ j	0
jěźechmy	j ɪ ʑ ɛ ç m ɨ	0
jěźechu	j ɪ ʑ ɛ ç u	0
jěźecy	j ɪ ʑ ɛ t͡s ɨ	0
jěźenje	j ɪ ʑ ɛ nʲ ɛ	0
jěźešo	j ɪ ʑ ɛ ʃ ɔ	0
jěźeštej	j ɪ ʑ ɛ ʃ t e j	0
jěźešćo	j ɪ ʑ ɛ ɕ t͡ɕ ɔ	0
jěźo	j ɪ ʑ ɔ	1
jěźom	j ɪ ʑ ɔ m	0
jěźony	j ɪ ʑ ɔ n ɨ	0
k	k	408
kacka	k a t͡s k a	0
kaka	k a k a	0
kakawa	k a k a w a	0
kake	k a kʲ ɛ	2
kamel	k a m ɛ l	0
kamela	k a m ɛ l a	0
kamele	k a m ɛ l ɛ	0
kamjeny	k a mʲ ɛ n ɨ	0
kamjeń	k a mʲ ɛ nʲ	2
kani	k a nʲ i	0
kanja	k a nʲ a	0
kanka	k a n k a	0
kanki	k a n kʲ i	0
kanu	k a n u	0
kanuna	k a n u n a	0
kapa	k a p a	0
kapow	k a p ɔ w	0
kapu	k a p u	0
kara	k a r a	0
karnikel	k a r nʲ i kʲ ɛ l	3
karpa	k a r p a	0
karu	k a r u	0
kawce	k a w t͡s ɛ	0
kawka	k a w k a	0
kawkach	k a w k a x	0
kawkami	k a w k a mʲ i	0
kawki	k a w kʲ i	0
kawč	k a w t͡ʃ	0
kenž	kʲ ɛ n ʃ	113
ketšup	kʲ ɛ t ʃ u p	0
kiju	kʲ i j u	1
kim	kʲ i m	0
kjarcma	kʲ a r t͡s m a	2
kjarm	kʲ a r m	0
kjałbasa	kʲ a w b a s a	0
klěb	k l ɪ p	2
klěcaś	k l ɪ t͡s a ɕ	0
klěkaś	k lʲ ɪ k a ɕ	0
klěś	k l ɪ ɕ	1
klěšće	k l ɪ ɕ t͡ɕ ɛ	0
kmótš	k m ɛ t͡ʃ	0
kmótš	k m ɨ t͡ʃ	0
kmótš	k m ʊ t͡ʃ	0
knigły	k nʲ i ɡ w ɨ	25
kněni	k nʲ ɪ nʲ i	0
kněz	k nʲ ɪ s	4
kněžna	k nʲ ɪ ʒ n a	2
kobołk	k ɔ b o w k	7
kobra	k ɔ b r a	0
kobrami	k ɔ b r a mʲ i	0
kobru	k ɔ b r u	0
kobry	k ɔ b r ɨ	0
kobyła	k ɔ b ɨ w a	0
kofer	k ɔ f ɛ r	0
kogo	k ɔ ɡ ɔ	0
kokot	k ɔ k ɔ t	5
kokoš	k ɔ k ɔ ʃ	0
kokoška	k ɔ k ɔ ʃ k a	0
komar	k ɔ m a r	0
komora	k ɔ m ɛ r a	0
komu	k ɔ m u	4
kopyto	k ɔ p ɨ t ɔ	0
koło	k o w ɔ	2
kołp	k ɔ w p	0
kraba	k r a b a	1
kralik	k r a l i k	0
krogul	k r ɔ ɡ u l	0
krotko	k r ɔ t k ɔ	19
krowa	k r o w a	2
ku	k u	32
kuba	k u b a	1
kuchnja	k u x nʲ a	0
kukawa	k u k a w a	0
kulka	k u l k a	4
kunu	k u n u	0
kupnice	k u p nʲ i t͡s ɛ	0
kura	k u r a	0
kuram	k u r a m	0
kurami	k u r a mʲ i	0
kurce	k u r t͡s ɛ	0
kurka	k u r k a	0
kurki	k u r kʲ i	0
kuru	k u r u	0
kurwota	k u r w ɔ t a	0
kusa	k u s a	1
kusam	k u s a m	0
kusaś	k u s a ɕ	0
kuždy	k u ʒ d ɨ	31
kwět	k vʲ ɪ t	0
kwětk	k vʲ ɪ t k	0
kócka	k ɛ t͡s k a	6
kócka	k ɨ t͡s k a	6
kócka	k ʊ t͡s k a	6
kócor	k ɛ t͡s ɔ r	0
kócor	k ɨ t͡s ɔ r	0
kócor	k ʊ t͡s ɔ r	0
kólaso	k ɛ l a s ɔ	1
kólaso	k ɨ l a s ɔ	1
kólaso	k ʊ l a s ɔ	1
kóleno	k ɛ l ɛ n ɔ	0
kóleno	k ɨ l ɛ n ɔ	0
kóleno	k ʊ l ɛ n ɔ	0
kónja	k ɛ nʲ a	1
kónja	k ɨ nʲ a	1
kónja	k ʊ nʲ a	1
kónju	k ɛ nʲ u	0
kónju	k ɨ nʲ u	0
kónju	k ʊ nʲ u	0
kónopje	k ɛ n ɔ pʲ ɛ	0
kónopje	k ɨ n ɔ pʲ ɛ	0
kónopje	k ʊ n ɔ pʲ ɛ	0
kórjeń	k ɛ rʲ ɛ nʲ	2
kórjeń	k ɨ rʲ ɛ nʲ	2
kórjeń	k ʊ rʲ ɛ nʲ	2
kóryto	k ɛ r ɨ t ɔ	0
kóryto	k ɨ r ɨ t ɔ	0
kóryto	k ʊ r ɨ t ɔ	0
kós	k ɛ s	2
kós	k ɨ s	2
kós	k ʊ s	2
kósa	k ɛ s a	0
kósa	k ɨ s a	0
kósa	k ʊ s a	0
kósam	k ɛ s a m	0
kósam	k ɨ s a m	0
kósam	k ʊ s a m	0
kóse	k ɛ s ɛ	0
kóse	k ɨ s ɛ	0
kóse	k ʊ s ɛ	0
kósu	k ɛ s u	1
kósu	k ɨ s u	1
kósu	k ʊ s u	1
kósć	k ɛ s t͡ɕ	0
kósć	k ɨ s t͡ɕ	0
kósć	k ʊ s t͡ɕ	0
kót	k ɛ t	0
kót	k ɨ t	0
kót	k ʊ t	0
kóta	k ɛ t a	0
kóta	k ɨ t a	0
kóta	k ʊ t a	0
kótary	k ɛ t a r ɨ	0
kótary	k ɨ t a r ɨ	0
kótary	k ʊ t a r ɨ	0
kótow	k ɛ t o w	0
kótow	k ɨ t o w	0
kótow	k ʊ t o w	0
kóza	k ɛ z a	0
kóza	k ɨ z a	0
kóza	k ʊ z a	0
kózoł	k ɛ z o w	0
kózoł	k ɨ z o w	0
kózoł	k ʊ z o w	0
kózyrožk	k ɛ z ɨ r o ʃ k	0
kózyrožk	k ɨ z ɨ r o ʃ k	0
kózyrožk	k ʊ z ɨ r o ʃ k	0
kóń	k ɛ nʲ	3
kóń	k ɨ nʲ	3
kóń	k ʊ nʲ	3
kóńc	k ɛ nʲ t͡s	19
kóńc	k ɨ nʲ t͡s	19
kóńc	k ʊ nʲ t͡s	19
kóńck	k ɛ nʲ t s k	1
kóńck	k ɨ nʲ t s k	1
kóńck	k ʊ nʲ t s k	1
kóńcowaś	k ɛ nʲ t s o w a ɕ	0
kóńcowaś	k ɨ nʲ t s o w a ɕ	0
kóńcowaś	k ʊ nʲ t s o w a ɕ	0
kóśeł	k ɛ ɕ ɛ w	0
kóśeł	k ɨ ɕ ɛ w	0
kóśeł	k ʊ ɕ ɛ w	0
kóža	k ɛ ʒ a	11
kóža	k ɨ ʒ a	11
kóža	k ʊ ʒ a	11
kśebjat	k ɕ ɛ bʲ a t	1
kśebjata	k ɕ ɛ bʲ a t a	0
kśemjeń	k ɕ ɛ mʲ ɛ nʲ	0
kśidło	k ɕ i d w ɔ	1
kśiwy	k ɕ i w ɨ	0
kśě	k ɕ ɪ	3
kśěn	k ɕ ɪ n	0
kśěł	k ɕ ɪ w	8
kśěś	k ɕ ɪ ɕ	0
kšej	k ʃ ɛ j	0
kšupa	k ʃ u p a	0
kšupy	k ʃ u p ɨ	2
kšuty	k ʃ u t ɨ	2
kšuška	k ʃ u ʃ k a	1
kšyśe	k ʃ ɨ ɕ ɛ	1
lan	l a n	0
lanka	l a ŋ k a	0
law	l a w	4
lawk	l a w k	0
lažaś	l a ʒ a ɕ	0
laže	l a ʒ ɛ	21
lažčejšy	l a ʃ t͡ʃ ɛ j ʃ ɨ	0
leśe	l ɛ ɕ ɛ	2
lic	l i t͡s	0
lice	l i t͡s ɛ	5
licho	l i x ɔ	3
lichy	l i x ɨ	2
lico	l i t͡s ɔ	0
licy	l i t͡s ɨ	13
licyś	l i t͡s ɨ ɕ	2
lip	l i p	0
lipa	l i p a	1
lipat	l i p a t	0
lipaś	l i p a ɕ	0
lipoma	l i p ɔ m a	0
lipsk	l i p s k	5
list	l i s t	10
lista	l i s t a	3
listy	l i s t ɨ	1
liška	l i ʃ k a	4
lod	l ɔ t	2
lube	l u b ɛ	0
lubje	l u bʲ ɛ	0
lubjej	l u bʲ ɛ j	59
lubowaś	l u b ɔ w a ɕ	3
lud	l u t	29
luta	l u t a	0
lute	l u t ɛ	0
lutem	l u t ɛ m	0
lutu	l u t u	0
luty	l u t ɨ	0
luź	l u ɕ	6
lěkaŕ	l ɪ k a rʲ	0
lěpšy	l ɪ p ʃ ɨ	2
lěs	l ɪ s	9
lěto	l ɪ t ɔ	37
lěwy	l ɪ w ɨ	2
lězć	l ɪ s t͡ɕ	3
lěśe	l ɪ ɕ ɛ	419
mack	m a t͡s k	3
macka	m a t͡s k a	0
mackach	m a t͡s k a x	0
mackami	m a t͡s k a mʲ i	0
macki	m a t͡s kʲ i	0
mackom	m a t͡s k ɔ m	0
maju	m a j u	165
mak	m a k	19
maka	m a k a	2
makam	m a k a m	0
maki	m a kʲ i	0
maku	m a k u	0
malina	m a l i n a	0
malinami	m a l i n a mʲ i	0
mamam	m a m a m	0
mamu	m a m u	1
mamy	m a m ɨ	6
mapa	m a p a	1
mapje	m a pʲ ɛ	0
marchwej	m a r x w ɛ j	0
marchwje	m a r x j ɛ	0
marchwje	m a r x vʲ ɛ	0
marjank	m a r j a ŋ k	0
masle	m a s l ɛ	0
masło	m a s w ɔ	0
małe	m a w ɛ	26
mało	m a w ɔ	25
maś	m a ɕ	16
mech	m ɛ x	1
mecha	m ɛ x a	0
mej	m ɛ j	1
mimo	mʲ i m ɔ	174
miła	mʲ i w a	1
miłe	mʲ i w ɛ	1
miłego	mʲ i w ɛ ɡ ɔ	0
miłej	mʲ i w e j	0
miłemu	mʲ i w ɛ m u	0
miły	mʲ i w ɨ	0
miłych	mʲ i w ɨ χ	3
miłym	mʲ i w ɨ m	1
miłymi	mʲ i w ɨ mʲ i	3
mjac	mʲ a t͡s	0
mjadwjeź	mʲ a d j e ɕ	14
mjadwjeź	mʲ a d vʲ e ɕ	14
mjasec	mʲ a s ɛ t͡s	41
mjatel	mʲ a t ɛ l	0
mjazy	mʲ a z ɨ	152
mjod	mʲ ɔ t	1
mlaś	m l a ɕ	0
mloko	m l ɔ k ɔ	23
moderne	m ɔ d ɛ r n ɛ	3
mrěś	m rʲ ɪ ɕ	0
muce	m u t͡s ɛ	1
mucha	m u x a	1
mudra	m u d r a	0
muku	m u k u	5
mul	m u l	0
mula	m u l a	0
mulam	m u l a m	0
mule	m u l ɛ	0
muli	m u l i	0
mulu	m u l u	0
muše	m u ʃ ɛ	0
muž	m u ʃ	8
muže	m u ʒ ɛ	2
myli	m ɨ l i	0
mysli	m ɨ s l i	3
myslit	m ɨ s l i t	0
mysliś	m ɨ s l i ɕ	0
myslony	m ɨ s l ɔ n ɨ	2
myt	m ɨ t	0
myś	m ɨ ɕ	3
myśe	m ɨ ɕ ɛ	1
myš	m ɨ ʃ	1
móc	m ɛ t͡s	15
móc	m ɨ t͡s	15
móc	m ʊ t͡s	15
móct	m ɛ t͡s t	0
móct	m ɨ t͡s t	0
móct	m ʊ t͡s t	0
módle	m ɛ d l ɛ	0
módle	m ɨ d l ɛ	0
módle	m ʊ d l ɛ	0
módli	m ɛ d l i	0
módli	m ɨ d l i	0
módli	m ʊ d l i	0
módlim	m ɛ d l i m	0
módlim	m ɨ d l i m	0
módlim	m ʊ d l i m	0
módlił	m ɛ d l i w	0
módlił	m ɨ d l i w	0
módlił	m ʊ d l i w	0
módliś	m ɛ d l i ɕ	0
módliś	m ɨ d l i ɕ	0
módliś	m ʊ d l i ɕ	0
módra	m ɛ d r a	13
módra	m ɨ d r a	13
módra	m ʊ d r a	13
módre	m ɛ d r ɛ	9
módre	m ɨ d r ɛ	9
módre	m ʊ d r ɛ	9
módru	m ɛ d r u	1
módru	m ɨ d r u	1
módru	m ʊ d r u	1
módry	m ɛ d r ɨ	7
módry	m ɨ d r ɨ	7
módry	m ʊ d r ɨ	7
mógli	m ɛ ɡ l i	4
mógli	m ɨ ɡ l i	4
mógli	m ʊ ɡ l i	4
mógu	m ɛ ɡ u	78
mógu	m ɨ ɡ u	78
mógu	m ʊ ɡ u	78
mógł	m ɛ k	5
mógł	m ɨ k	5
mógł	m ʊ k	5
mógła	m ɛ ɡ w a	2
mógła	m ɨ ɡ w a	2
mógła	m ʊ ɡ w a	2
mógłej	m ɛ ɡ w ɛ j	0
mógłej	m ɨ ɡ w ɛ j	0
mógłej	m ʊ ɡ w ɛ j	0
mógło	m ɛ ɡ w ɔ	5
mógło	m ɨ ɡ w ɔ	5
mógło	m ʊ ɡ w ɔ	5
mój	m ɛ j	11
mója	m ɛ j a	5
móje	m ɛ j ɛ	2
mójej	m ɛ j ɛ j	1
mójo	m ɛ j ɔ	0
mól	m ɛ l	0
mól	m ɨ l	0
mól	m ʊ l	0
móla	m ɛ l a	0
móla	m ɨ l a	0
móla	m ʊ l a	0
mólach	m ɛ l a x	0
mólach	m ɨ l a x	0
mólach	m ʊ l a x	0
mólam	m ɛ l a m	0
mólam	m ɨ l a m	0
mólam	m ʊ l a m	0
móle	m ɛ l ɛ	0
móle	m ɨ l ɛ	0
móle	m ʊ l ɛ	0
móli	m ɛ l i	0
móli	m ɨ l i	0
móli	m ʊ l i	0
mólu	m ɛ l u	0
mólu	m ɨ l u	0
mólu	m ʊ l u	0
móri	m ɛ rʲ i	0
móri	m ɨ rʲ i	0
móri	m ʊ rʲ i	0
mórjo	m ɛ rʲ ɔ	26
mórjo	m ɨ rʲ ɔ	26
mórjo	m ʊ rʲ ɔ	26
mórzgi	m ɛ r z ɡʲ i	2
mórzgi	m ɨ r z ɡʲ i	2
mórzgi	m ʊ r z ɡʲ i	2
móst	m ɛ s t	1
móst	m ɨ s t	1
móst	m ʊ s t	1
móžo	m ɛ ʒ ɔ	117
móžo	m ɨ ʒ ɔ	117
móžo	m ʊ ʒ ɔ	117
móžom	m ɛ ʒ ɔ m	1
móžom	m ɨ ʒ ɔ m	1
móžom	m ʊ ʒ ɔ m	1
móžomej	m ɛ ʒ ɔ m ɛ j	0
móžomej	m ɨ ʒ ɔ m ɛ j	0
móžomej	m ʊ ʒ ɔ m ɛ j	0
móžomy	m ɛ ʒ ɔ m ɨ	13
móžomy	m ɨ ʒ ɔ m ɨ	13
móžomy	m ʊ ʒ ɔ m ɨ	13
móžotej	m ɛ ʒ ɔ t ɛ j	3
móžotej	m ɨ ʒ ɔ t ɛ j	3
móžotej	m ʊ ʒ ɔ t ɛ j	3
móžoš	m ɛ ʒ ɔ ʃ	13
móžoš	m ɨ ʒ ɔ ʃ	13
móžoš	m ʊ ʒ ɔ ʃ	13
mě	mʲ ɪ	107
měch	mʲ ɪ x	0
měki	mʲ ɪ kʲ i	0
měra	mʲ ɪ r a	7
měri	mʲ ɪ rʲ i	2
měrim	mʲ ɪ rʲ i m	0
měrił	mʲ ɪ rʲ i w	0
měriś	mʲ ɪ rʲ i ɕ	1
měrje	mʲ ɪ rʲ ɛ	9
měso	mʲ ɪ s ɔ	14
města	mʲ ɪ s t a	79
městno	mʲ ɪ s t n ɔ	130
město	mʲ ɪ s t ɔ	221
měsćanaŕ	mʲ ɪ s t͡ɕ a n a rʲ	0
měsćańske	mʲ ɪ s t͡ɕ a nʲ s kʲ ɛ	11
měsćański	mʲ ɪ s t͡ɕ a nʲ s kʲ i	5
měto	mʲ ɪ t ɔ	7
mězdze	mʲ ɪ z d͡z ɛ	4
mězga	mʲ ɪ z ɡ a	2
měŕ	mʲ ɪ rʲ	0
měś	mʲ ɪ ɕ	19
měź	mʲ ɪ ɕ	0
mła	m w a	0
młode	m w ɔ d ɛ	24
młoźinske	m ɔ ʑ i n s kʲ ɛ	4
młoźinski	m ɔ ʑ i n s kʲ i	1
na	n a	1966
naga	n a ɡ a	4
nage	n a ɡʲ ɛ	11
nagi	n a ɡʲ i	1
nagich	n a ɡʲ i x	2
nagim	n a ɡʲ i m	0
nagimi	n a ɡʲ i mʲ i	0
nagu	n a ɡ u	0
nakup	n a k u p	0
nalěwo	n a l ɪ w ɔ	5
nan	n a n	27
nana	n a n a	10
napšawo	n a p ʃ a w ɔ	4
nas	n a s	6
nałpa	n a w p a	0
ned	n ɛ t	9
nejgóršy	n ɛ j ɡ ɛ r ʃ ɨ	0
nejgóršy	n ɛ j ɡ ɨ r ʃ ɨ	0
nejgóršy	n ɛ j ɡ ʊ r ʃ ɨ	0
nich	nʲ i x	25
nim	nʲ i m	133
nima	nʲ i m a	2
nimcowka	nʲ i m t͡s o w k a	1
nime	nʲ i m ɛ	0
niska	nʲ i s k a	1
niskich	nʲ i s kʲ i x	1
nisko	nʲ i s k ɔ	1
njasł	nʲ a s	0
njebjo	nʲ ɛ bʲ ɔ	4
njejdu	nʲ ɛ j d u	0
njejo	nʲ ɛ j ɔ	152
njejsmej	nʲ ɛ j s m ɛ j	0
njejsmy	nʲ ɛ j s m ɨ	2
njejsom	nʲ ɛ j s ɔ m	3
njejstej	nʲ ɛ j s t ɛ j	4
njejsu	nʲ ɛ j s u	55
njejsy	nʲ ɛ j s ɨ	0
njejsćo	nʲ ɛ j s t͡ɕ ɔ	0
njejźo	nʲ ɛ j ʑ ɔ	4
njejźom	nʲ ɛ j ʑ ɔ m	0
njejźomej	nʲ ɛ j ʑ ɔ m ɛ j	0
njejźoš	nʲ ɛ j ʑ ɔ ʃ	0
njekśě	nʲ ɛ k ɕ ɪ	0
njerěšny	nʲ ɛ rʲ ɪ ʃ n ɨ	0
njetopyŕ	nʲ ɛ t ɔ p ɨ rʲ	0
njewjedro	nʲ ɛ j ɛ d r ɔ	0
njewjedro	nʲ ɛ vʲ ɛ d r ɔ	0
njewjericka	nʲ ɛ j ɛ rʲ i t͡s k a	1
njewjericka	nʲ ɛ vʲ ɛ rʲ i t͡s k a	1
njeźela	nʲ ɛ ʑ ɛ l a	1
noc	n ɔ t͡s	5
nocach	n ɔ t͡s a x	0
nocami	n ɔ t͡s a mʲ i	0
nocka	n ɔ t͡s k a	0
nocy	n ɔ t͡s ɨ	14
noga	n ɔ ɡ a	2
nogi	n ɔ ɡʲ i	8
nokś	n ɔ k ɕ	0
nos	n ɔ s	2
nose	n ɔ s ɛ	7
nowe	n ɔ w ɛ	21
nowo	n ɔ w ɔ	3
nowy	n o w ɨ	25
noze	n ɔ z ɛ	10
nož	n ɔ ʃ	0
nožyce	n ɔ ʒ ɨ t͡s ɛ	0
numer	n u m ɛ r	3
nutśi	n u t͡ɕ i	0
ně	nʲ ɪ	3
něco	nʲ ɪ t͡s ɔ	13
někotary	nʲ ɪ k ɔ t a r ɨ	1
něnt	nʲ ɪ n t	6
něnto	nʲ ɪ n t ɔ	63
padali	p a d a l i	1
paduch	p a d u x	0
palach	p a l a x	0
palc	p a l t͡s	1
pale	p a l ɛ	0
pali	p a l i	2
palica	p a l i t͡s a	0
palice	p a l i t͡s ɛ	0
palim	p a l i m	0
palimy	p a l i m ɨ	0
palit	p a l i t	0
palił	p a l i w	0
paliła	p a l i w a	0
paliło	p a l i w ɔ	0
paliś	p a l i ɕ	1
paliśo	p a l i ɕ ɔ	0
pališ	p a l i ʃ	0
palona	p a l ɔ n a	0
palone	p a l ɔ n ɛ	0
palony	p a l ɔ n ɨ	0
papa	p a p a	0
papje	p a pʲ ɛ	0
paprika	p a p rʲ i k a	0
papriku	p a p r i k u	1
park	p a r k	7
parka	p a r k a	1
pas	p a s	2
pasam	p a s a m	0
pase	p a s ɛ	0
pata	p a t a	1
patu	p a t u	0
paw	p a w	0
pawa	p a w a	0
pawk	p a w k	0
paśpula	p a ɕ p u l a	0
pcha	p x a	0
pcołka	t͡s ɔ w k a	0
pile	pʲ i l ɛ	0
pili	pʲ i l i	1
pisał	pʲ i s a w	19
pisaś	pʲ i s a ɕ	8
pit	pʲ i t	0
pite	pʲ i t ɛ	0
pitu	pʲ i t u	0
pity	pʲ i t ɨ	0
piwo	pʲ i w ɔ	22
piła	pʲ i w a	0
piłam	pʲ i w a m	0
piło	pʲ i w ɔ	0
piły	pʲ i w ɨ	0
piś	pʲ i ɕ	2
piśe	pʲ i ɕ ɛ	4
pjac	pʲ a t͡s	0
pjelch	pʲ ɛ l x	3
pjelniś	pʲ ɛ l nʲ i ɕ	0
pjenjeze	pʲ ɛ nʲ ɛ z ɛ	12
pjerina	pʲ ɛ rʲ i n a	1
pjero	pʲ ɛ r ɔ	0
pla	p l a	61
plasta	p l a s t a	0
plasć	p l a s t͡ɕ	0
plěś	p l ɪ ɕ	0
politika	p ɔ l i tʲ i k a	11
politiki	p ɔ l i tʲ i kʲ i	4
pomoc	p ɔ m ɛ t͡s	3
popjeł	p ɔ pʲ ɛ w	0
powrjoz	p o w rʲ ɔ s	0
powědański	p o vʲ ɪ d a nʲ s kʲ i	0
powědaś	p o vʲ ɪ d a ɕ	8
powědaś	p ɔ j ɪ d a ɕ	8
powěźeś	p o vʲ ɪ ʑ e ɕ	1
powěźeś	p ɔ j ɪ ʑ e ɕ	1
połny	p o w n ɨ	0
prama	p r a m a	0
pramu	p r a m u	0
pranje	p r a nʲ ɛ	0
proch	p r ɔ x	2
proga	p r ɔ ɡ a	0
progi	p r ɔ ɡʲ i	0
prose	p r ɔ s ɛ	0
prozniny	p r ɔ z nʲ i n ɨ	0
prozny	p r ɔ z n ɨ	2
prěcny	p rʲ ɪ t͡s n ɨ	0
prědk	p rʲ ɪ t k	0
prědny	p rʲ ɪ d n ɨ	90
prězy	p rʲ ɪ z ɨ	1
psa	p s a	1
psy	p s ɨ	2
ptašk	p t a ʃ k	14
ptaškowy	p t a ʃ k ɔ w ɨ	0
pusta	p u s t a	0
puste	p u s t ɛ	0
pusty	p u s t ɨ	0
puta	p u t a	0
putam	p u t a m	0
putu	p u t u	0
pyrje	p ɨ rʲ ɛ	0
pytali	p ɨ t a l i	1
pytanje	p ɨ t a nʲ ɛ	5
pyto	p ɨ t ɔ	0
pó	p ɛ	580
pó	p ɨ	580
pó	p ʊ	580
pód	p ɛ t	129
pód	p ɨ t	129
pód	p ʊ t	129
pódla	p ɛ d l a	34
pódla	p ɨ d l a	34
pódla	p ʊ d l a	34
pódomk	p ɛ d ɔ m k	0
