pódomk	p ɨ d ɔ m k	0
pódomk	p ʊ d ɔ m k	0
póla	p ɛ l a	12
póla	p ɨ l a	12
póla	p ʊ l a	12
pólach	p ɛ l a x	8
pólach	p ɨ l a x	8
pólach	p ʊ l a x	8
pólack	p ɛ l a t͡s k	0
pólack	p ɨ l a t͡s k	0
pólack	p ʊ l a t͡s k	0
pólak	p ɛ l a k	1
pólak	p ɨ l a k	1
pólak	p ʊ l a k	1
póli	p ɛ l i	1
póli	p ɨ l i	1
póli	p ʊ l i	1
pólka	p ɛ l k a	0
pólka	p ɨ l k a	0
pólka	p ʊ l k a	0
pólo	p ɛ l ɔ	5
pólo	p ɨ l ɔ	5
pólo	p ʊ l ɔ	5
pólsce	p ɛ l s t͡s ɛ	0
pólsce	p ɨ l s t͡s ɛ	0
pólsce	p ʊ l s t͡s ɛ	0
pólska	p ɛ l s k a	21
pólska	p ɨ l s k a	21
pólska	p ʊ l s k a	21
pólske	p ɛ l s kʲ ɛ	3
pólske	p ɨ l s kʲ ɛ	3
pólske	p ʊ l s kʲ ɛ	3
pólski	p ɛ l s kʲ i	86
pólski	p ɨ l s kʲ i	86
pólski	p ʊ l s kʲ i	86
pólskich	p ɛ l s kʲ i x	2
pólskich	p ɨ l s kʲ i x	2
pólskich	p ʊ l s kʲ i x	2
pólskim	p ɛ l s kʲ i m	1
pólskim	p ɨ l s kʲ i m	1
pólskim	p ʊ l s kʲ i m	1
pólskimi	p ɛ l s kʲ i mʲ i	0
pólskimi	p ɨ l s kʲ i mʲ i	0
pólskimi	p ʊ l s kʲ i mʲ i	0
pólsku	p ɛ l s k u	2
pólsku	p ɨ l s k u	2
pólsku	p ʊ l s k u	2
pólu	p ɛ l u	4
pólu	p ɨ l u	4
pólu	p ʊ l u	4
pólšćina	p ɛ l ɕ t͡ɕ i n a	2
pólšćina	p ɨ l ɕ t͡ɕ i n a	2
pólšćina	p ʊ l ɕ t͡ɕ i n a	2
pón	p ɛ n	36
pón	p ɨ n	36
pón	p ʊ n	36
pónjeźela	p ɛ nʲ ɛ ʑ ɛ l a	0
pónjeźela	p ɨ nʲ ɛ ʑ ɛ l a	0
pónjeźela	p ʊ nʲ ɛ ʑ ɛ l a	0
pónjeźele	p ɛ nʲ ɛ ʑ ɛ l ɛ	3
pónjeźele	p ɨ nʲ ɛ ʑ ɛ l ɛ	3
pónjeźele	p ʊ nʲ ɛ ʑ ɛ l ɛ	3
póra	p ɛ r a	2
póra	p ɨ r a	2
póra	p ʊ r a	2
póram	p ɛ r a m	0
póram	p ɨ r a m	0
póram	p ʊ r a m	0
pórat	p ɛ r a t	0
pórat	p ɨ r a t	0
pórat	p ʊ r a t	0
póraś	p ɛ r a ɕ	0
póraś	p ɨ r a ɕ	0
póraś	p ʊ r a ɕ	0
pósoł	p ɛ s ɔ w	1
pósoł	p ɨ s ɔ w	1
pósoł	p ʊ s ɔ w	1
pótom	p ɛ t ɔ m	67
pótom	p ɨ t ɔ m	67
pótom	p ʊ t ɔ m	67
pówětš	p ɛ vʲ ɪ t͡ʃ	0
pówětš	p ɨ vʲ ɪ t͡ʃ	0
pówětš	p ʊ vʲ ɪ t͡ʃ	0
pěsk	pʲ ɪ s k	0
pěsć	pʲ ɪ s t͡ɕ	0
pěta	pʲ ɪ t a	1
pětk	pʲ ɪ t k	0
pětka	pʲ ɪ t k a	2
pětkach	pʲ ɪ t k a x	0
pětkam	pʲ ɪ t k a m	0
pětkami	pʲ ɪ t k a mʲ i	0
pětki	pʲ ɪ t kʲ i	0
pětkoma	pʲ ɪ t k ɔ m a	0
pětkow	pʲ ɪ t k ɔ w	0
pětkowu	pʲ ɪ t k ɔ w u	0
pětku	pʲ ɪ t k u	0
pěś	pʲ ɪ ɕ	50
pěšy	pʲ ɪ ʃ ɨ	0
pławiś	p w a vʲ i ɕ	0
płotno	p w ɔ t n ɔ	0
płowy	p ɔ w ɨ	0
pług	p w u k	1
pśechwatanje	p ɕ ɛ x w a t a nʲ ɛ	0
pśechójźowaś	p ɕ ɛ x ɛ j ʑ ɔ w a ɕ	1
pśed	p ɕ ɛ t	111
pśedešćnik	p ɕ ɛ d ɛ ɕ t͡ɕ nʲ i k	0
pśez	p ɕ ɛ s	272
pśi	p ɕ i	534
pśichod	p ɕ i x ɔ t	7
pśigótowaś	p ɕ i ɡ ɛ t o w a ɕ	3
pśigótowaś	p ɕ i ɡ ɨ t o w a ɕ	3
pśigótowaś	p ɕ i ɡ ʊ t o w a ɕ	3
pśigótujo	p ɕ i ɡ ɛ t u j ɔ	3
pśigótujo	p ɕ i ɡ ɨ t u j ɔ	3
pśigótujo	p ɕ i ɡ ʊ t u j ɔ	3
pśijaśel	p ɕ i j a ɕ e l	3
pśědu	p ɕ ɪ d u	0
pśědł	p ɕ ɪ t	0
pśěsć	p ɕ ɪ s t͡ɕ	0
pśěźo	p ɕ ɪ ʑ ɔ	0
pśěźom	p ɕ ɪ ʑ ɔ m	0
pšenice	p ʃ ɛ nʲ i t͡s ɛ	0
pšose	p ʃ ɔ s ɛ	0
pšosyś	p ʃ ɔ s ɨ ɕ	1
pšut	p ʃ u t	0
rad	r a t	5
rada	r a d a	9
radijo	r a dʲ i j ɔ	0
rado	r a d ɔ	0
rady	r a d ɨ	4
radło	r a d w ɔ	0
rak	r a k	4
raka	r a k a	1
rakach	r a k a x	0
rakam	r a k a m	0
raki	r a kʲ i	0
raku	r a k u	1
ramje	r a mʲ ɛ	0
rdžaś	r d͡ʒ a ɕ	0
ricali	rʲ i t͡s a l i	0
rice	rʲ i t͡s ɛ	0
rjemjeń	rʲ ɛ mʲ ɛ nʲ	0
rjeśaz	rʲ ɛ ɕ a s	1
rjobro	rʲ ɔ b r ɔ	0
rjobło	rʲ ɔ b w ɔ	0
rod	r ɔ t	128
roda	r ɔ d a	36
rodach	r ɔ d a x	1
rodam	r ɔ d a m	1
rodami	r ɔ d a mʲ i	10
rodom	r ɔ d ɔ m	4
rody	r ɔ d ɨ	11
roga	r ɔ ɡ a	1
rogam	r ɔ ɡ a m	0
roj	r ɔ j	0
roja	r ɔ j a	0
roju	r ɔ j a	0
ros	r ɔ s	0
rosa	r ɔ s a	1
rose	r ɔ s ɛ	0
rosć	r ɔ s t͡ɕ	3
row	r ɔ w	4
rowny	r ɔ w n ɨ	11
rozgranjaś	r ɔ z ɡ r a nʲ a ɕ	2
ruce	r u t͡s ɛ	4
ruda	r u d a	1
rudam	r u d a m	0
rudawy	r u d a w ɨ	0
rudu	r u d u	0
rudy	r u d ɨ	0
ruka	r u k a	5
ruma	r u m a	5
ryba	r ɨ b a	0
rybarnik	r ɨ b a r nʲ i k	0
rybce	r ɨ p t͡s ɛ	0
rybnica	r ɨ b nʲ i t͡s a	0
rys	r ɨ s	6
ryt	r ɨ t	0
ryzy	r ɨ z ɨ	0
rza	r z a	0
rěc	rʲ ɪ t͡s	195
rěd	rʲ ɪ t	7
rědki	rʲ ɪ t kʲ i	2
rědne	rʲ ɪ d n ɛ	3
rědny	rʲ ɪ d n ɨ	1
rěka	rʲ ɪ k a	23
rězaś	rʲ ɪ z a ɕ	0
sada	s a d a	10
sarna	s a r n a	0
saźe	s a ʑ ɛ	3
sec	s ɛ t͡s	0
sedym	s ɛ d ɨ m	24
sedło	s ɛ d w ɔ	20
sej	s ɛ j	2
sejźe	s ɛ j ʑ ɛ	24
sejźeł	s ɛ j ʑ ɛ w	2
sejźeś	s ɛ j ʑ ɛ ɕ	1
sejźi	s ɛ j ʑ i	3
sejźim	s ɛ j ʑ i m	0
semje	s ɛ mʲ ɛ	7
sena	s ɛ n a	1
seno	s ɛ n ɔ	0
sera	s ɛ r a	0
serbiske	s ɛ r bʲ i s kʲ ɛ	3
serbskich	s ɛ r s kʲ i x	37
serce	s ɛ r t͡s ɛ	0
serp	s ɛ r p	0
serpa	s ɛ r p a	0
serpam	s ɛ r p a m	0
skócyś	s k ɛ t͡s ɨ ɕ	0
skócyś	s k ɨ t͡s ɨ ɕ	0
skócyś	s k ʊ t͡s ɨ ɕ	0
skóro	s k ɛ r ɔ	12
skóro	s k ɨ r ɔ	12
skóro	s k ʊ r ɔ	12
skót	s k ɛ t	0
skót	s k ɨ t	0
skót	s k ʊ t	0
skóńcowaś	s k ɛ nʲ t͡s ɔ w a ɕ	0
skóńcowaś	s k ɨ nʲ t͡s ɔ w a ɕ	0
skóńcowaś	s k ʊ nʲ t͡s ɔ w a ɕ	0
slě	s lʲ ɪ	0
slěpy	s l ɪ p ɨ	0
slěwka	s l ɪ w k a	0
slězy	s l ɪ z ɨ	2
smej	s m ɛ j	1
smjerś	s mʲ ɛ r ɕ	1
smy	s m ɨ	2
snědanje	s nʲ ɪ d a nʲ ɛ	0
snědaś	s nʲ ɪ d a ɕ	0
sněg	s nʲ ɪ k	2
sobota	s ɔ b ɛ t a	1
socha	s ɔ x a	0
sodło	s ɔ d w ɔ	0
sol	s ɔ l	4
soli	s ɔ l i	3
som	s ɔ m	28
sona	s ɔ n a	0
sonje	s ɔ nʲ ɛ	0
sotša	s ɔ t͡ʃ a	5
sotše	s ɔ t͡ʃ ɛ	0
sotšu	s ɔ t͡ʃ u	0
spali	s p a l i	1
spane	s p a n ɛ	0
spałej	s p a w ɛ j	0
spański	s p a nʲ s kʲ i	0
spaś	s p a ɕ	1
spaštej	s p a ʃ t ɛ j	0
spice	s pʲ i t͡s ɛ	0
spicy	s pʲ i t͡s ɨ	0
spitej	s pʲ i t ɛ j	0
sport	s p ɔ r t	7
sporty	s p ɔ r t ɨ	0
sprjewja	s p rʲ ɛ j a	0
sprjewja	s p rʲ ɛ vʲ a	0
spódobaś	s p ɛ d ɔ b a ɕ	0
spódobaś	s p ɨ d ɔ b a ɕ	0
spódobaś	s p ʊ d ɔ b a ɕ	0
spóra	s p ɛ r a	0
spóra	s p ɨ r a	0
spóra	s p ʊ r a	0
spóraś	s p ɛ r a ɕ	1
spóraś	s p ɨ r a ɕ	1
spóraś	s p ʊ r a ɕ	1
spě	s pʲ ɪ	0
srjejź	s rʲ ɛ j ɕ	8
stadle	s t a d l ɛ	0
stadło	s t a d w ɔ	1
stare	s t a r ɛ	23
starej	s t a r ɛ j	6
stareje	s t a r ɛ j ɛ	9
stareju	s t a r ɛ j u	2
starjejše	s t a rʲ ɛ j ʃ ɛ	0
starjejšej	s t a rʲ ɛ j ʃ ɛ j	4
stary	s t a r ɨ	21
stej	s t ɛ j	170
stil	s tʲ i l	4
stilist	s tʲ i l i s t	0
stilistika	s tʲ i l i s tʲ i k a	0
stog	s t ɔ k	0
stoga	s t ɔ ɡ a	0
stojał	s t ɔ j a w	2
stojaś	s t ɔ j a ɕ	7
stojm	s t ɔ j m	0
stole	s t ɔ l ɛ	0
stoł	s t ɔ w	2
strow	s t r o w	0
studowaś	s t u d ɔ w a ɕ	0
studěrowaś	s t u dʲ ɪ r ɔ w a ɕ	2
stwórtk	s t w ɛ r t k	1
stwórtk	s t w ɨ r t k	1
stwórtk	s t w ʊ r t k	1
styri	s t ɨ rʲ i	53
stśěła	s t͡ɕ ɪ w a	0
suche	s u x ɛ	15
sucho	s u x ɔ	0
suchy	s u x ɨ	8
sup	s u p	0
supa	s u p a	0
swinja	s vʲ i nʲ a	1
swój	s w ɛ j	28
swója	s w ɛ j a	0
swóje	s w ɛ j ɛ	22
swójej	s w ɛ j ɛ j	7
swójźba	s w ɛ j ʑ b a	29
swět	s vʲ ɪ t	12
swětki	s vʲ ɪ t kʲ i	0
swěty	s vʲ ɪ t ɨ	5
swětły	s vʲ ɪ t w ɨ	0
sykora	s ɨ k ɔ r a	0
sylny	s ɨ l n ɨ	0
syn	s ɨ n	32
syna	s ɨ n a	4
syra	s ɨ r a	0
syre	s ɨ r ɛ	7
syrotny	s ɨ r ɔ t n ɨ	0
syry	s ɨ r ɨ	0
syte	s ɨ t ɛ	0
syto	s ɨ t ɔ	0
syłoj	s ɨ w ɔ j	0
syłojik	s ɨ w ɔ j i k	2
syłojk	s ɨ w ɔ j k	0
sćo	s t͡ɕ ɔ	1
sćěna	s t͡ɕ ɪ n a	5
sćěnje	s t͡ɕ ɪ nʲ ɛ	1
słodki	s w ɔ t kʲ i	0
słodkich	s w ɔ t kʲ i x	6
słoma	s w ɔ m a	2
słomce	s w ɔ m t͡s ɛ	0
słomka	s w ɔ m k a	0
słomkach	s w ɔ m k a x	0
słowo	s w o w ɔ	47
słyńco	s w ɨ nʲ t͡s ɔ	8
słyšaś	s w ɨ ʃ a ɕ	2
tabela	t a b ɛ l a	3
tak	t a k	195
taktika	t a k tʲ i k a	0
taktiki	t a k tʲ i kʲ i	0
tapeta	t a p ɛ t a	0
tasa	t a s a	0
tase	t a s ɛ	0
taska	t a s k a	0
taski	t a s kʲ i	0
tasku	t a s k u	0
tasow	t a s ɔ w	0
tej	t ɛ j	55
teja	t ɛ j a	1
teje	t ɛ j ɛ	35
teju	t ɛ j u	5
teke	t ɛ kʲ ɛ	729
telewizor	t ɛ l ɛ vʲ i z ɔ r	0
tenraz	t ɛ n r a s	1
terasa	t ɛ r a s a	0
terase	t ɛ r a s ɛ	0
tkali	t k a l i	0
tkałej	t k a w ɛ j	0
toaleta	t o a l ɛ t a	0
togodla	t ɔ ɡ ɔ d l a	87
toporišćo	t ɔ p ɔ rʲ i ɕ t͡ɕ ɔ	0
torm	t ɔ r m	8
trěś	tʲ rʲ ɪ ɕ	0
tu	t u	42
tucne	t u t͡s n ɛ	2
tuni	t u nʲ i	0
tur	t u r	0
twarda	t w a r d a	1
twardy	t w a r d ɨ	3
twarjenja	t w a rʲ ɛ nʲ a	6
twarjenje	t w a rʲ ɛ nʲ ɛ	14
twój	t w ɛ j	1
twója	t w ɛ j a	1
twóje	t w ɛ j ɛ	2
twójej	t w ɛ j ɛ j	0
twóŕ	t w ɛ rʲ	0
twóŕ	t w ɨ rʲ	0
twóŕ	t w ʊ rʲ	0
tyźeń	t ɨ ʑ ɛ nʲ	2
tłocy	t w ɔ t͡s ɨ	1
tłocym	t w ɔ t͡s ɨ m	0
tłocył	t w ɔ t͡s ɨ w	0
tłocyś	t w ɔ t͡s ɨ ɕ	0
tśi	t ɕ i	71
tśmjel	t ɕ mʲ ɛ l	2
tśmjeń	t͡ɕ mʲ ɛ nʲ	0
tśo	t͡ɕ ɔ	1
tśěsć	t͡ɕ ɪ s t͡ɕ	0
tšawa	t͡ʃ a w a	1
w	w	3441
wama	w a m a	0
wariś	w a rʲ i ɕ	0
wałma	w a w m a	1
wałtora	w a w t ɔ r a	0
we	w ɛ	350
wej	w ɛ j	1
wence	w ɛ n t͡s ɛ	0
widlicki	vʲ i d l i t͡s kʲ i	3
wiki	vʲ i kʲ i	8
wina	vʲ i n a	0
wino	vʲ i n ɔ	3
wita	vʲ i t a	0
witali	vʲ i t a l i	0
witaś	vʲ i t a ɕ	0
witśe	vʲ i t͡ɕ ɛ	0
wiźenje	vʲ i ʑ ɛ nʲ ɛ	0
wiźeś	vʲ i ʑ ɛ ɕ	9
wjacor	j a t͡s ɔ r	6
wjacor	vʲ a t͡s ɔ r	6
wjasele	j a s ɛ l ɛ	3
wjasele	vʲ a s ɛ l ɛ	3
wjasoły	j a s ɔ w ɨ	0
wjasoły	vʲ a s ɔ w ɨ	0
wjasć	j a s t͡ɕ	2
wjasć	vʲ a s t͡ɕ	2
wjele	j ɛ l ɛ	178
wjele	vʲ ɛ l ɛ	178
wjelgin	j ɛ l ɡʲ i n	143
wjelgin	vʲ ɛ l ɡʲ i n	143
wjelike	j ɛ l i kʲ ɛ	61
wjelike	vʲ ɛ l i kʲ ɛ	61
wjeliki	j ɛ l i kʲ i	55
wjeliki	vʲ ɛ l i kʲ i	55
wjelk	j ɛ l k	0
wjelk	vʲ ɛ l k	0
wob	ɔ p	9
wobjed	ɔ bʲ ɛ t	0
wobjedowali	ɔ bʲ ɛ d ɔ w a l i	0
wobjedował	ɔ bʲ ɛ d ɔ w a w	0
wobjedowaś	ɔ bʲ ɛ d ɔ w a ɕ	0
woblico	ɔ b l i t͡s ɔ	3
wobwóco	ɔ b w ɛ t͡s ɔ	0
wobwóco	ɔ b w ɨ t͡s ɔ	0
wobwóco	ɔ b w ʊ t͡s ɔ	0
wobwócyjo	ɔ b w ɛ t͡s ɨ j ɔ	0
wobwócyjo	ɔ b w ɨ t͡s ɨ j ɔ	0
wobwócyjo	ɔ b w ʊ t͡s ɨ j ɔ	0
wogeń	ɔ ɡʲ ɛ nʲ	8
woglěd	ɔ ɡ l ɪ t	3
woglědaś	ɔ ɡ l ɪ d a ɕ	1
wogon	ɔ ɡ ɛ n	1
woko	ɔ k ɔ	2
wokoło	ɔ k ɔ w ɔ	109
wokuń	ɔ k u nʲ	0
wrjeśeno	rʲ ɛ ɕ ɛ n ɔ	0
wu	u	2
wuchac	u x a t͡s	1
wucho	u x ɔ	1
wudra	u d r a	0
wugoŕ	u ɡ ɔ rʲ	0
wul	u l	0
wula	u l a	0
wule	u l ɛ	0
wulicowaś	u l i t͡s ɔ w a ɕ	2
wulk	u l k	0
wulu	u l u	0
wumje	u mʲ ɛ	0
wumrějo	u m rʲ e j ɔ	0
wumrěł	u m rʲ ɪ w	19
wumrěś	u m rʲ ɪ ɕ	1
wuměra	u mʲ ɪ r a	0
wuměraju	u mʲ ɪ r a j u	0
wuměram	u mʲ ɪ r a m	0
wuměrał	u mʲ ɪ r a w	0
wuměraś	u mʲ ɪ r a ɕ	0
wutšoba	u t͡ʃ ɔ b a	0
wutšobnje	u t͡ʃ ɔ b nʲ ɛ	0
wuž	u ʃ	0
wy	w ɨ	12
wó	w ɛ	174
wó	w ɨ	174
wó	w ʊ	174
wóda	w ɛ d a	26
wóda	w ɨ d a	26
wóda	w ʊ d a	26
wódaj	w ɛ d a j	0
wódaj	w ɨ d a j	0
wódaj	w ʊ d a j	0
wódajtej	w ɛ d a j t ɛ j	0
wódajtej	w ɨ d a j t ɛ j	0
wódajtej	w ʊ d a j t ɛ j	0
wódajśo	w ɛ d a j ɕ ɔ	0
wódajśo	w ɨ d a j ɕ ɔ	0
wódajśo	w ʊ d a j ɕ ɔ	0
wódce	w ɛ t t͡s ɛ	0
wódce	w ɨ t t͡s ɛ	0
wódce	w ʊ t t͡s ɛ	0
wódka	w ɛ t k a	0
wódka	w ɨ t k a	0
wódka	w ʊ t k a	0
wódkach	w ɛ t k a x	0
wódkach	w ɨ t k a x	0
wódkach	w ʊ t k a x	0
wódkami	w ɛ t k a mʲ i	0
wódkami	w ɨ t k a mʲ i	0
wódkami	w ʊ t k a mʲ i	0
wódki	w ɛ t kʲ i	0
wódki	w ɨ t kʲ i	0
wódki	w ʊ t kʲ i	0
wódkow	w ɛ t k ɔ w	0
wódkow	w ɨ t k ɔ w	0
wódkow	w ʊ t k ɔ w	0
wódy	w ɛ d ɨ	27
wódy	w ɨ d ɨ	27
wódy	w ʊ d ɨ	27
wójak	w ɛ j a k	0
wójca	w ɛ j t͡s a	1
wójowaŕ	w ɛ j o w a rʲ	0
wójowaś	w ɛ j ɔ w a ɕ	1
wólša	w ɛ l ʃ a	1
wólša	w ɨ l ʃ a	1
wólša	w ʊ l ʃ a	1
wón	w ɛ n	293
wón	w ɨ n	293
wón	w ʊ n	293
wóna	w ɛ n a	182
wóna	w ɨ n a	182
wóna	w ʊ n a	182
wónej	w ɛ n ɛ j	5
wónej	w ɨ n ɛ j	5
wónej	w ʊ n ɛ j	5
wóni	w ɛ nʲ i	209
wóni	w ɨ nʲ i	209
wóni	w ʊ nʲ i	209
wóno	w ɛ n ɔ	33
wóno	w ɨ n ɔ	33
wóno	w ʊ n ɔ	33
wórjech	w ɛ rʲ ɛ x	3
wórjech	w ɨ rʲ ɛ x	3
wórjech	w ʊ rʲ ɛ x	3
wós	w ɛ s	1
wós	w ɨ s	1
wós	w ʊ s	1
wósa	w ɛ s a	0
wósa	w ɨ s a	0
wósa	w ʊ s a	0
wósach	w ɛ s a x	0
wósach	w ɨ s a x	0
wósach	w ʊ s a x	0
wósam	w ɛ s a m	0
wósam	w ɨ s a m	0
wósam	w ʊ s a m	0
wósami	w ɛ s a m i	0
wósami	w ɨ s a m i	0
wósami	w ʊ s a m i	0
wóse	w ɛ s ɛ	0
wóse	w ɨ s ɛ	0
wóse	w ʊ s ɛ	0
wósebny	w ɛ s ɛ b n ɨ	6
wósebny	w ɨ s ɛ b n ɨ	6
wósebny	w ʊ s ɛ b n ɨ	6
wósk	w ɛ s k	0
wósk	w ɨ s k	0
wósk	w ʊ s k	0
wósoba	w ɛ s ɔ b a	9
wósoba	w ɨ s ɔ b a	9
wósoba	w ʊ s ɔ b a	9
wósoma	w ɛ s ɔ m a	0
wósoma	w ɨ s ɔ m a	0
wósoma	w ʊ s ɔ m a	0
wósow	w ɛ s ɔ w	1
wósow	w ɨ s ɔ w	1
wósow	w ʊ s ɔ w	1
wósowu	w ɛ s ɔ w u	0
wósowu	w ɨ s ɔ w u	0
wósowu	w ʊ s ɔ w u	0
wósoł	w ɛ s ɔ w	0
wósoł	w ɨ s ɔ w	0
wósoł	w ʊ s ɔ w	0
wósu	w ɛ s u	0
wósu	w ɨ s u	0
wósu	w ʊ s u	0
wósy	w ɛ s ɨ	2
wósy	w ɨ s ɨ	2
wósy	w ʊ s ɨ	2
wót	w ɛ t	1609
wót	w ɨ t	1609
wót	w ʊ t	1609
wóte	w ɛ t ɛ	4
wóte	w ɨ t ɛ	4
wóte	w ʊ t ɛ	4
wótergi	w ɛ t ɛ r ɡʲ i	34
wótergi	w ɨ t ɛ r ɡʲ i	34
wótergi	w ʊ t ɛ r ɡʲ i	34
wótmólowany	w ɛ t m ɛ l ɔ w a n ɨ	0
wótmólowany	w ɨ t m ɨ l ɔ w a n ɨ	0
wótmólowany	w ʊ t ʊ ɛ l ɔ w a n ɨ	0
wótmólowaś	w ɛ t m ɛ l ɔ w a ɕ	0
wótmólowaś	w ɨ t m ɨ l ɔ w a ɕ	0
wótmólowaś	w ʊ t m ʊ l ɔ w a ɕ	0
wótšy	w ɛ t͡ʃ i	1
wótšy	w ɨ t͡ʃ ɨ	1
wótšy	w ʊ t͡ʃ ɨ	1
wóz	w ɛ s	0
wóz	w ɨ s	0
wóz	w ʊ s	0
wózu	w ɛ z u	0
wózu	w ɨ z u	0
wózu	w ʊ z u	0
wózyk	w ɛ z ɨ k	0
wózyk	w ɨ z ɨ k	0
wózyk	w ʊ z ɨ k	0
wózyś	w ɛ z ɨ ɕ	0
wózyś	w ɨ z ɨ ɕ	0
wózyś	w ʊ z ɨ ɕ	0
wóśc	w ɛ ɕ t͡s	0
wóśc	w ɨ ɕ t͡s	0
wóśc	w ʊ ɕ t͡s	0
wě	vʲ ɪ	2
wěc	vʲ ɪ t͡s	2
wědomnosć	vʲ ɪ d ɔ m n ɔ s t͡ɕ	11
wěnc	vʲ ɪ n t͡s	1
wětš	vʲ ɪ t͡ʃ	10
wětšy	vʲ ɪ t͡ʃ ɨ	13
wězaś	vʲ ɪ z a ɕ	0
wěźeś	vʲ ɪ ʑ ɛ ɕ	2
włos	w ɔ s	1
włose	w ɔ s ɛ	0
wšake	ʃ a kʲ ɛ	23
wšyken	ʃ ɨ kʲ ɛ n	0
wšykne	ʃ ɨ k n ɛ	59
wšykno	ʃ ɨ k n ɔ	4
z	s	1571
z	z	1571
za	z a	828
zajmowaś	z a j m ɔ w a ɕ	0
zarz	z a r s	0
zarza	z a r z a	0
zasej	z a s ɛ j	46
zasejwiźenje	z a s ɛ j vʲ i ʑ ɛ nʲ ɛ	0
ze	z ɛ	641
zeleny	z ɛ l ɛ n ɨ	22
zeleznica	z ɛ l ɛ z nʲ i t͡s a	5
zelezo	z ɛ l ɛ z ɔ	0
zemi	z ɛ mʲ i	26
zemiska	z ɛ mʲ i s k a	0
zemiskam	z ɛ mʲ i s k a m	0
zemiski	z ɛ mʲ i s kʲ i	0
zemisku	z ɛ mʲ i s k u	0
zemja	z ɛ mʲ a	11
zemju	z ɛ mʲ u	16
zgnity	z ɡ nʲ i t ɨ	0
zgórjelc	z ɡ ɛ rʲ ɛ l t͡s	2
zgórjelc	z ɡ ɨ rʲ ɛ l t͡s	2
zgórjelc	z ɡ ʊ rʲ ɛ l t͡s	2
zmakaś	z m a k a ɕ	1
znamje	z n a mʲ ɛ	9
zub	z u p	0
zwěrje	z vʲ ɪ rʲ ɛ	19
zyma	z ɨ m a	5
zymnica	z ɨ m nʲ i t͡s a	0
złego	z w ɛ ɡ o	4
złej	z w ɛ j	0
złota	z w ɔ t a	0
złote	z w ɔ t ɛ	3
złotego	z w ɔ t ɛ ɡ o	1
złotej	z w ɔ t ɛ j	0
złotemu	z w ɔ t ɛ m u	0
złoto	z w ɔ t ɔ	1
złoty	z w ɔ t ɨ	2
złotych	z w ɔ t ɨ x	0
złotym	z w ɔ t ɨ m	0
złotymi	z w ɔ t ɨ mʲ i	0
zły	z w ɨ	0
złym	z w ɨ m	0
čaj	t͡ʃ a j	1
łdza	d͡z a	0
łojach	w ɔ j a x	0
łoje	w ɔ j ɛ	0
łojś	w ɔ j ɕ	0
łopata	w ɔ p a t a	0
łopatka	w ɔ p a t k a	0
łoski	w ɔ s kʲ i	0
łoskich	w ɔ s kʲ i x	0
łosos	w ɔ s ɔ s	0
łyko	w ɨ k ɔ	0
ŕ	rʲ	0
ś	ɕ	1
śamny	ɕ a m n ɨ	4
śańki	ɕ a n kʲ i	1
śele	ɕ ɛ l ɛ	0
śichy	ɕ i x ɨ	0
śopły	ɕ ɔ p w ɨ	0
śpa	ɕ p a	1
śěgaś	ɕ ɪ ɡ a ɕ	0
śěgnuś	ɕ ɪ ɡ n u ɕ	1
śěsny	ɕ ɪ s n ɨ	0
śěsto	ɕ ɪ s t ɔ	0
śěło	ɕ ɪ w ɔ	8
śěžki	ɕ ɪ ʃ kʲ i	2
šery	ʃ ɛ r ɨ	1
škobrjonk	ʃ k ɔ b rʲ ɔ ŋ k	0
škrja	ʃ k rʲ a	0
škrjok	ʃ k rʲ ɔ k	6
škóra	ʃ k ɛ r a	28
škóra	ʃ k ɨ r a	28
škóra	ʃ k ʊ r a	28
škórc	ʃ k ɛ r t͡s	0
škórc	ʃ k ɨ r t͡s	0
škórc	ʃ k ʊ r t͡s	0
šołta	ʃ o w t a	8
štunda	ʃ t u n d a	0
šula	ʃ u l a	14
šule	ʃ u l ɛ	20
šyś	ʃ ɨ ɕ	0
šćenje	ɕ t͡ɕ ɛ nʲ ɛ	0
źaržaś	ʑ a r ʒ a ɕ	0
źeń	ʑ ɛ nʲ	36
źinsa	ʑ i n s a	103
źiśe	ʑ i ɕ ɛ	6
źiśelc	ʑ i ɕ e l t͡s	0
źiśi	ʑ i ɕ i	30
źom	ʑ ɔ m	0
źomej	ʑ ɔ m ɛ j	0
źomy	ʑ ɔ m ɨ	0
źotej	ʑ ɔ t ɛ j	0
źowce	ʑ ɔ w t͡s ɛ	0
źowćo	ʑ o w t ɕ ɔ	13
źośo	ʑ ɔ ɕ ɔ	0
źoš	ʑ ɔ ʃ	0
źěd	ʑ ɪ t	0
źěl	ʑ ɪ l	65
źěle	ʑ ɪ l ɛ	46
źěliś	ʑ ɪ lʲ i ɕ	3
źěsna	ʑ ɪ s n a	0
źěłaś	ʑ ɪ w a ɕ	10
źěło	ʑ ɪ w ɔ	26
žaba	ʒ a b a	1
žeńska	ʒ ɛ nʲ s k a	12
žona	ʒ ɔ n a	3
žorawa	ʒ ɔ r a w a	0
žołma	ʒ ɔ w m a	0
žołw	ʒ o w	0
žołź	ʒ ɔ w ɕ	0
žrěbc	ʒ rʲ ɪ p t͡s	0
žrěbje	ʒ rʲ ɪ bʲ ɛ	0
žurnal	ʒ u r n a l	0
žurnalist	ʒ u r n a l i s t	1
žurnalistka	ʒ u r n a l i s t k a	2
žyto	ʒ ɨ t ɔ	2
žywjenje	ʒ ɨ j ɛ nʲ ɛ	28
žywjenje	ʒ ɨ vʲ ɛ nʲ ɛ	28
žywy	ʒ ɨ w ɨ	27
žyś	ʒ ɨ ɕ	0
