ँ	ə̃	0
ं	ə̃ m	0
ं	ə̃ n	0
ं	ə̃ ŋ	0
ं	ə̃ ɲ	0
ं	ə̃ ɳ	0
अंदाज़	ə n̪ d̪ äː z	0
अच्छापन	ə t͡ʃː ä p ə n	0
अतिथि	ə t̪ ɪ t̪ʰ i	0
अधर्म	ə dʱ ə r m	0
अधिकारी	ə dʱ ɪ k a r i	0
अनाम	ə n aː m	0
अनुकरण	ə n ʊ k ə r ə ɳ	0
अनुच्छेद	ə n ʊ t ʃʰː eː d	0
अनुपम	ə n ʊ p ə m	0
अफीम	ə pʰ i m	0
अलार्म	ə l̪ ɑː ɾ m	0
अलार्म	ə l̪ ɑː ɾ ə m	0
अश्लीलता	ə ʃ l iː l t̪ aː	0
आ	äː	15104
आटा	ɑː ʈ ɑ	0
आदि	ɑː d̪ i	0
आराम	ɑː ɾ ɑː m	0
ई	iː	357
उंस	ʊ n s	0
उपयोगिता	ʊ p j o ɡ ɪ t̪ aː	0
औसत	ɔː s ə t̪	1260
कंजूस	k ə̃ ɲ d͡ʒ uː s	0
कठिनता	k ə ʈʰ ɪ n t̪ ɑː	0
कपाल	k ə p a l	0
कब	k ə b	1197
करके	k ə r k e	0
करण	k ə r ə ɳ	472
करता	k ə r t a	0
करती	k ə r t i	0
करते	k ə r t e	0
करनेवाला	k ə r n e ʋ aː l aː	0
कला	k ə l ɑː	0
कामी	k aː m iː	0
कामुक	k a m ʊ k	0
कामुकता	k a m ʊ k t̪ a	0
कालिज	k ä l ɪ d͡ʒ	0
कालिज	k ɒ l ɪ d͡ʒ	0
काव्य	k aː ʋ j ə	0
कि	k ɪ	0
केंद्रीकरण	k e n̪ d̪ ɾ iː k ə ɾ ə ɳ	0
क्योंकि	k j ũ k i	0
खड़ा	kʰ ə ɽ aː	0
खड़ी	kʰ ə ɽ iː	0
खड़े	kʰ ə ɽ eː	0
खरोंचना	kʱ ə ɾ õ t͡ʃ n a	0
ख़ुदावंद	x ʊ d̪ a ʋ ə n d̪	0
गणतंत्र	ɡ ə ɳ t̪ ə n t̪ r ə	0
गणराज्य	ɡ ə ɳ ɾ ɑː d͡ʒ j ə	0
गांव	ɡ ɑ̃ː ʊ	0
गाली	ɡ ɑː l iː	0
गुरमुखी	ɡ ʊ r m ʊ kʰ i	0
गौरवशाली	ɡ ə ʊ r ə ʋ ʃ aː l iː	0
घड़ी	ɡʱ ə ɽ iː	0
चूमना	t ʃ uː m n a	0
चोद	t ʃ o d̪	0
चोदना	t ʃ o d̪ n a	0
छत	t ʃʰ ə t̪	607
छवि	t ʃʰ ə ʋ i	0
छायाकार	t̪ ʃʰ aː j aː k aː r	0
छुपा	t ʃʰ ʊ p aː	0
छोटी	t ʃʰ o ʈ i	0
छोटे	t ʃʰ o ʈ e	0
छौंक	t͡ʃʰ ɔː ŋ k	0
जपना	d͡ʒ ə p n̪ ɑː	0
जलचालित	d͡ʒ ə l t͡ʃ aː l ɪ t̪	0
जलाना	d͡ʒ ə l̪ ɑ̟ː n̪ ɑ̟ː	0
जवान	d ʒ ə ʋ äː n	0
जानकारी	d ʒ ɑ n k ɑ r i	0
जानवरो	d ʒ a n ʋ ə r o	0
जानवरों	d ʒ a n ʋ ə r õ	0
जीना	d͡ʒ i n a	0
जीवन	d͡ʒ iː ʋ ə n	0
जूलाई	d ʒ u l a i	0
झगड़ना	d͡ʒʱ ə ɡ ə ɽ n a	0
डिल्डो	ɖ ɪ l ɖ o	0
तुलसीदास	t̪ ʊ l s̪ iː d̪ aː s̪	0
थी	t̪ʰ i	0
थे	t̪ʰ e	0
दबंग	d̪ ə b ə̃ ŋ ɡ	0
दाहिना	d aː ɦ ɪ n aː	0
दिलरुबा	d̪ ɪ l r ʊ b aː	0
देख	d e kʰ	0
देखकर	d e kʰ ə r	0
देखके	d e kʰ e	0
देखने	d e kʰ n e	0
देखनेवाला	d e kʰ n e ʋ a l a	0
देखिए	d e kʰ ɪ e	0
देखो	d e kʰ o	0
धूल	d̪ʱ uː l	0
नदियाँ	n ə d i j ɑ̃ː	0
नदियो	n ə d i j o	0
नामोत्पत्ति	n ɑː m oː t p ə t̪ i	0
निंदासा	n ĩ n d̪ aː s aː	0
निरोध	n ɪ r o d̪ʱ	0
निहत्था	n ɪ ɦ ə t̪ t̪ʰ aː	0
पतंग	p ə t̪ ə ŋ ɡ	0
पता	p ə t̪ ä	0
परिवार	p ə r ɪ ʋ aː r	0
पाँव	p ɑ̃ː ʊ	0
पाकिस्तानी	p aː k ɪ s t̪ aː n̪ iː	0
पागलख़ाना	p ɑː ɡ ə l x ɑː n ɑː	0
पूंजीवाद	p ũː n d ʒ iː ʋ aː d̪	0
पूजा	p u d͡ʒ ɑ	0
पेय	p eː	0
पोंछना	p õ t͡ʃʰ n a	0
प्रकार	p r ə k a r	0
प्रतिशोध	p ɾ ə t̪ ɪ ʃ o d̪ʱ	0
प्रयोगात्मक	p ɾ ə j oː ɡ ɑ t̪ m ə k	0
प्रवीण	p r ə ʋ i ɳ	0
प्रवीणता	p r ə ʋ i ɳ t̪ a	0
प्रसाद	p ɾ ə s ɑː d̪	0
प्रामाणिक	p r aː m aː n ɪ k	0
फलो	pʰ ə l o	0
फलों	pʰ ə l õ	0
फूलो	pʰ u l o	0
फूलों	pʰ u l õ	0
फैलना	pʰ ɛ l n aː	0
बजे	b ə d͡ʒ e	0
बनाऊंगी	b ə n ɑ ũː ŋ ɡ iː	0
बर्खा	b ə ɾ kʰ a	0
बहस	b ɛ ɦ s	1766
बहस	bʱ ɛː s	1766
बहादुर	b ɑ ɦ ɑː d̪ ʊ ɾ	0
बहुत	b ɔ h ɔ t̪	0
बहुभाषीय	b ə ɦ u bʱ ɑː ʂ i j ə	0
बादल	b ɑː d ə l	0
बुद्धिमान	b ʊ dːʱ ɪ m aː n	0
बोलने	b o l n e	0
बोलिए	b o l ɪ e	0
बोलो	b o l o	0
भक्तो	bʱ ə k t̪ o	0
भक्तों	bʱ ə k t̪ õ	0
भयावह	bʱ ə j aː ʋ ə ɦ	0
भला	bʱ ə l a	0
भली	bʱ ə l i	0
भूत	bʱ uː t̪	0
भोजन	bʱ o d ʒ ə n	0
मदिरा	m ə d̪ ɪ r aː	0
मलना	m ə l n a	0
महानगर	m ɑ̟ ɦ ɑ̟ː n ə ɡ ə ɾ	0
महासागर	m ə ɦ ɑ s ɑ ɡ ə r	0
मानवविज्ञान	m aː n ə v ɪ ɡ j aː n	0
मानवशास्त्र	m aː n ə v ʃ aː s t r ə	0
मुखमैथुन	m ʊ kʰ m ɛ t̪ʰ ʊ n	0
मुखाभिगम	m ʊ kʰ aː bʱ ɪ ɡ ə m	0
मैं	m ə ɪ̯	0
यह	j eː	78525
यह	j ə ɦ ə	78525
यादाश्त	j aː d̪ aː ʃ t̪	0
रत्न	ɾ ə t̪ ə n̪	0
रस्म	ɾ ə s m	0
रस्म	ɾ ə s ə m	0
रहा	r ə ɦ ä	0
रही	r ə ɦ i	0
रहे	r ə ɦ e	0
रीत	ɾ i t̪	0
रुत	ɾ ʊ t̪	0
लाजवर्द	l̪ ɑː d͡ʒ ʋ ə ɾ d̪	0
लिख	l ɪ kʰ	0
लिखता	l ɪ kʰ t a	0
लिखती	l ɪ kʰ t i	0
लिखते	l ɪ kʰ t e	0
लिखा	l ɪ kʰ a	0
लिखिए	l ɪ kʰ i e	0
लिखी	l ɪ kʰ i	0
लिखे	l ɪ kʰ e	0
लिखो	l ɪ kʰ o	0
वासना	ʋ aː s n̪ aː	0
विकिपीडिया	w ɪ k ɪ p iː ɖ ɪ j aː	0
विश्वास	b ɪ ʃ ʋ ɑː s	0
विश्वास	ʋ ɪ ʃ ʋ ɑː s	0
वेश्यावृत्ति	ʋ eː ʃ j aː ʋ r ɪ tː i	0
व्यक्तिक	ʋ j ə k t̪ ɪ k	0
व्यक्तिगत	ʋ j ə k t̪ i ɡ ə t̪	0
शरीरो	ʃ ə r i r o	0
शरीरों	ʃ ə r i r õ	0
शवयात्रा	ʃ ə ʋ j ɑː t̪ ɾ ɑ	0
शानदार	ʃ ɑː n̪ d̪ ɑː ɾ	0
शालीनता	ʃ a l i n t̪ a	0
शालीनतापूर्वक	ʃ a l i n t̪ a p u r ʋ ə k	0
शाह	ʃ ɑː	0
शिश्नो	ʃ ɪ ʃ n̪ o	0
शिश्नों	ʃ ɪ ʃ n̪ õ	0
शुभ	ʃ ʊ bʱ	0
श्यान	ʃ j aː n̪	0
श्यानता	ʃ j aː n̪ t̪ aː	0
श्वेत	ʃ ʋ eː t̪	0
संक्षय	s ə ŋ k ʃ ə j	0
सदस्य	s ə d̪ ə s j ə	0
समझदार	s ə m ə d ʒʱ d̪ aː r	0
समस्या	s ə m ə s j aː	0
समुदाय	s ə m ʊ d̪ ɛ	0
सहचर	s ɛ ɦ t͡ʃ ɑ ɾ	3
सहज	s ɛʱ ɛ d͡ʒ	364
साम्राज्य	s ɑː m r ɑː d͡ʒ j ə	0
सुलभ	s ʊ l a bʱ	0
सूंघना	s ũ ɡʱ n a	0
सूचनात्मक	s uː t ʃ n̪ aː t̪ m ə k	0
सैकंड	s ɛ k ə̃ ɳ ɖ	0
सैकण्ड	s ɛ k ə ɳ ɖ	0
सोचना	s o t ʃ n̪ aː	0
स्तंभन	s t ə̃ m bʱ ə̃ n	0
स्वभाव	s w ə bʱ ɑ̟ː ʋ	0
हिमपात	ɦ ɪ m p ɑ t	0
हिमालय	ɦ ɪ m ɑː l ə j	0
हिमालय	ɦ ɪ m ɑː l ɛ	0
हो	ɦ o	0
हों	ɦ õ	0
