cubiculum	k ʊ b ɪ k ʊ ɫ̪ ʊ̃ˑ
cubiculāris	k ʊ b ɪ k ʊ ɫ̪ aː r ɪ s
cubiculārius	k ʊ b ɪ k ʊ ɫ̪ aː r i ʊ s
cubiculātus	k ʊ b ɪ k ʊ ɫ̪ aː t̪ ʊ s
cubicus	k ʊ b ɪ k ʊ s
cubitālis	k ʊ b ɪ t̪ aː lʲ ɪ s
cubus	k ʊ b ʊ s
cubāns	k ʊ b ãː s
cubēnsis	k ʊ b ẽː s ɪ s
cubīle	k ʊ b iː l ɛ
cuciō	k ʊ k i oː
cucuma	k ʊ k ʊ m a
cucumerifōrme	k ʊ k ʊ m ɛ r ɪ f oː r m ɛ
cucumerifōrmis	k ʊ k ʊ m ɛ r ɪ f oː r m ɪ s
cucumerifōrmēs	k ʊ k ʊ m ɛ r ɪ f oː r m eː s
cucumerīnus	k ʊ k ʊ m ɛ r iː n̪ ʊ s
cucumifōrme	k ʊ k ʊ m ɪ f oː r m ɛ
cucumifōrmis	k ʊ k ʊ m ɪ f oː r m ɪ s
cucumifōrmēs	k ʊ k ʊ m ɪ f oː r m eː s
cucumis	k ʊ k ʊ m ɪ s
cucumīs	k ʊ k ʊ m iː s
cucurbita	k ʊ k ʊ r b ɪ t̪ a
cucūlla	k ʊ k uː l lʲ a
cucūllus	k ʊ k uː l lʲ ʊ s
cucūlus	k ʊ k uː ɫ̪ ʊ s
cuferion	k ʊ f ɛ r i ɔ n̪
cui	k ʊ j
cuidam	k ʊ ɪ d̪ ãˑ
cujuscemodī	k ʊ j j ʊ s k ɛ m ɔ d̪ iː
cujusmodī	k ʊ j j ʊ s m ɔ d̪ iː
culcitra	k u l̠ʲ t͡ʃ i t̪ r a
culcitra	k ʊ ɫ̪ k ɪ t̪ r a
culex	k ʊ l ɛ k s
culillus	k ʊ lʲ ɪ l lʲ ʊ s
culleō	k ʊ l lʲ e oː
culmen	k ʊ ɫ̪ m ɛ n̪
culmus	k ʊ ɫ̪ m ʊ s
culpa	k ʊ ɫ̪ p a
culpātiō	k ʊ ɫ̪ p aː t̪ i oː
culpō	k ʊ ɫ̪ p oː
culter	k ʊ ɫ̪ t̪ ɛ r
cultiō	k ʊ ɫ̪ t̪ i oː
cultor	k ʊ ɫ̪ t̪ ɔ r
cultrīx	k ʊ ɫ̪ t̪ r iː k s
cultūra	k ʊ ɫ̪ t̪ uː r a
culullus	k ʊ ɫ̪ ʊ l lʲ ʊ s
culīna	k ʊ lʲ iː n̪ a
culīnāria	k ʊ lʲ iː n̪ aː r i a
culīnāria	k ʊ lʲ iː n̪ aː r i aː
culīnārie	k ʊ lʲ iː n̪ aː r i ɛ
culīnāris	k ʊ lʲ iː n̪ aː r ɪ s
culīnārius	k ʊ lʲ iː n̪ aː r i ʊ s
culīnāriās	k ʊ lʲ iː n̪ aː r i aː s
culīnāriō	k ʊ lʲ iː n̪ aː r i oː
culīnāriōs	k ʊ lʲ iː n̪ aː r i oː s
culīnārī	k ʊ lʲ iː n̪ aː r iː
cumba	k ʊ m b a
cumera	k ʊ m ɛ r a
cummi	k ʊ m m ɪ
cummis	k ʊ m m ɪ s
cumque	k ʊ ŋ kᶣ ɛ
cumulus	k ʊ m ʊ ɫ̪ ʊ s
cumulō	k ʊ m ʊ ɫ̪ oː
cumānia	k ʊ m aː n̪ i a
cuneifōrmis	k ʊ n̪ e ɪ f oː r m ɪ s
cuneifōrmēs	k ʊ n̪ e ɪ f oː r m eː s
cuneus	k ʊ n̪ e ʊ s
cuneō	k ʊ n̪ e oː
cunimundus	k ʊ n̪ ɪ m ʊ n̪ d̪ ʊ s
cuningeria	k ʊ n̪ ɪ ŋ ɡ ɛ r i a
cuniō	k ʊ n̪ i oː
cunnilingus	k ʊ n̪ n̪ ɪ lʲ ɪ ŋ ɡ ʊ s
cunīculus	k ʊ n̪ iː k ʊ ɫ̪ ʊ s
cunīculāriae	k ʊ n̪ iː k ʊ ɫ̪ aː r i a e̯
cunīculōsus	k ʊ n̪ iː k ʊ ɫ̪ oː s ʊ s
cupiditās	k ʊ p ɪ d̪ ɪ t̪ aː s
cupidus	k ʊ p ɪ d̪ ʊ s
cupidō	k ʊ p ɪ d̪ oː
cupiennius	k ʊ p i ɛ n̪ n̪ i ʊ s
cupiō	k ʊ p i oː
cuppa	k ʊ p p a
cuppae	k ʊ p p a e̯
cupra	k ʊ p r a
cupresseus	k ʊ p r ɛ s s e ʊ s
cupressifer	k ʊ p r ɛ s s ɪ f ɛ r
cupressinus	k ʊ p r ɛ s s ɪ n̪ ʊ s
cupressus	k ʊ p r ɛ s s ʊ s
cupressētum	k ʊ p r ɛ s s eː t̪ ʊ̃ˑ
cuprum	k ʊ p r ʊ̃ˑ
cupāvō	k ʊ p aː w oː
cupīdō	k u p iː d̪ ɔ
cupīdō	k ʊ p iː d̪ oː
curacaoēnsis	k ʊ r a s a u̯ ẽː s ɪ s
curcuba	k ʊ r k ʊ b a
curculiō	k ʊ r k ʊ lʲ i oː
curdicus	k ʊ r d̪ ɪ k ʊ s
curiatius	k ʊ r i a t̪ i ʊ s
curicta	k ʊ r ɪ k t̪ a
curidius	k ʊ r ɪ d̪ i ʊ s
curiga	k ʊ r ɪ ɡ a
curium	k ʊ r i ʊ̃ˑ
curius	k ʊ r i ʊ s
curmiliaca	k ʊ r m ɪ lʲ i a k a
curriculum	k u r r iː k u l u m
curriculum	k ʊ r r ɪ k ʊ ɫ̪ ʊ̃ˑ
currus	k ʊ r r ʊ s
currīlis	k ʊ r r iː lʲ ɪ s
currō	k ʊ r r oː
currūlis	k ʊ r r uː lʲ ɪ s
cursiō	k ʊ r s i oː
cursor	k ʊ r s ɔ r
cursuālis	k ʊ r s ʊ aː lʲ ɪ s
cursārius	k ʊ r s aː r i ʊ s
cursōrius	k ʊ r s oː r i ʊ s
curtilius	k ʊ r t̪ ɪ lʲ i ʊ s
curtius	k ʊ r t̪ i ʊ s
curtus	k ʊ r t̪ ʊ s
curtō	k ʊ r t̪ oː
curunda	k ʊ r ʊ n̪ d̪ a
curve	k ʊ r w ɛ
curvidēns	k ʊ r w ɪ d̪ ẽː s
curvilīneus	k ʊ r w ɪ lʲ iː n̪ e ʊ s
curvipēs	k ʊ r w ɪ p eː s
curvirōstris	k ʊ r w ɪ r oː s t̪ r ɪ s
curvus	k ʊ r w ʊ s
curvās	k ʊ r w aː s
curvī	k ʊ r w iː
curvōs	k ʊ r w oː s
curūlis	k ʊ r uː lʲ ɪ s
cuscolium	k ʊ s k ɔ lʲ i ʊ̃ˑ
cuspidō	k ʊ s p ɪ d̪ oː
cuspius	k ʊ s p i ʊ s
cusus	k ʊ s ʊ s
cutiliae	k ʊ t̪ ɪ lʲ i a e̯
cutis	k ʊ t̪ ɪ s
cutucuēnsis	k ʊ t̪ ʊ k ʊ ẽː s ɪ s
cutīcula	k ʊ t̪ iː k ʊ ɫ̪ a
cuzcoēnsis	k ʊ z k ɔ ẽː s ɪ s
cyaneae	k y a n̪ e a e̯
cyanellus	k y a n̪ ɛ l lʲ ʊ s
cyanopterus	k y a n̪ ɔ p t̪ ɛ r ʊ s
cyanē	k y a n̪ eː
cyathus	k y a t̪ʰ ʊ s
cybaeus	k ʏ b a e̯ ʊ s
cybindis	k ʏ b ɪ n̪ d̪ ɪ s
cybistra	k ʏ b ɪ s t̪ r a
cyclamen	k ʏ k ɫ̪ a m ɛ n̪
cyclamīnos	k ʏ k ɫ̪ a m iː n̪ ɔ s
cycloborus	k ʏ k ɫ̪ ɔ b ɔ r ʊ s
cyclus	k ʏ k ɫ̪ ʊ s
cyclōps	k e k l o p s
cyclōps	k ʏ k ɫ̪ oː p s
cyclōps	t͡ʃ iː k l ɔ p s
cydara	k ʏ d̪ a r a
cydnus	k ʏ d̪ n̪ ʊ s
cygnus	k ʏ ŋ n̪ ʊ s
cyitis	k y ɪ t̪ ɪ s
cylindricollis	k ʏ lʲ ɪ n̪ d̪ r ɪ k ɔ l lʲ ɪ s
cylindricus	k ʏ lʲ ɪ n̪ d̪ r ɪ k ʊ s
cylindrus	k ʏ lʲ ɪ n̪ d̪ r ʊ s
cyllēnē	k ʏ l lʲ eː n̪ eː
cymbium	k ʏ m b i ʊ̃ˑ
cymithārra	k ʏ m ɪ t̪ʰ aː r r a
cyna	k ʏ n̪ a
cynaetha	k ʏ n̪ a e̯ t̪ʰ a
cynanchē	k ʏ n̪ a ŋ kʰ eː
cynanchēs	k ʏ n̪ a ŋ kʰ eː s
cynanē	k ʏ n̪ a n̪ eː
cynapsēs	k ʏ n̪ a p s eː s
cynismus	k ʏ n̪ ɪ s m ʊ s
cynocephalus	k ʏ n̪ ɔ k ɛ pʰ a ɫ̪ ʊ s
cynomazon	k ʏ n̪ ɔ m a z z ɔ n̪
cynops	k ʏ n̪ ɔ p s
cynthus	k ʏ n̪ t̪ʰ ʊ s
cynūria	k ʏ n̪ uː r i a
cyparissia	k ʏ p a r ɪ s s i a
cypasis	k ʏ p a s ɪ s
cyphanta	k ʏ pʰ a n̪ t̪ a
cyprius	k ʏ p r i ʊ s
cyprus	k ʏ p r ʊ s
cyprus	t͡ʃ iː p r u s
cypsela	k ʏ p s ɛ ɫ̪ a
cypselus	k ʏ p s ɛ ɫ̪ ʊ s
cyretiae	k ʏ r ɛ t̪ i a e̯
cyrrhus	k ʏ r r ʊ s
cytae	k ʏ t̪ a e̯
cythnos	k ʏ t̪ʰ n̪ ɔ s
cythēra	k ʏ t̪ʰ eː r a
cytinium	k ʏ t̪ ɪ n̪ i ʊ̃ˑ
cytinus	k ʏ t̪ ɪ n̪ ʊ s
cytisus	k ʏ t̪ ɪ s ʊ s
cytōrus	k ʏ t̪ oː r ʊ s
cyzicēnus	k ʏ z z ɪ k eː n̪ ʊ s
cācabus	k aː k a b ʊ s
cācabāceus	k aː k a b aː k e ʊ s
cācabātus	k aː k a b aː t̪ ʊ s
cācus	k aː k ʊ s
cādūceus	k aː d̪ uː k e ʊ s
cāius	k aː i ʊ s
cāius	k aː j ʊ s
cāius	ɡ aː i ʊ s
cāius	ɡ aː j ʊ s
cāiātiō	k aː i aː t̪ i oː
cālātia	k aː ɫ̪ aː t̪ i a
cālātīnus	k aː ɫ̪ aː t̪ iː n̪ ʊ s
cālīginōsus	k aː lʲ iː ɡ ɪ n̪ oː s ʊ s
cālīgāte	k aː lʲ iː ɡ aː t̪ ɛ
cālīgātis	k aː lʲ iː ɡ aː t̪ ɪ s
cālīgātiō	k aː lʲ iː ɡ aː t̪ i oː
cālīgātus	k aː lʲ iː ɡ aː t̪ ʊ s
cālīgātīs	k aː lʲ iː ɡ aː t̪ iː s
cālīgātō	k aː lʲ iː ɡ aː t̪ oː
cālīgō	k aː lʲ iː ɡ oː
cālīgōsus	k aː lʲ iː ɡ oː s ʊ s
cālō	k aː ɫ̪ oː
cānaster	k aː n̪ a s t̪ ɛ r
cāneō	k aː n̪ e oː
cāniceps	k aː n̪ ɪ k ɛ p s
cānidius	k aː n̪ ɪ d̪ i ʊ s
cānius	k aː n̪ i ʊ s
cānus	k aː n̪ ʊ s
cānēre	k aː n̪ eː r ɛ
cānēscō	k aː n̪ eː s k oː
cānīs	k aː n̪ iː s
cānō	k aː n̪ oː
cānōs	k aː n̪ oː s
cānūtus	k aː n̪ uː t̪ ʊ s
cārex	k aː r ɛ k s
cārica	k aː r ɪ k a
cārinō	k aː r ɪ n̪ oː
cāris	k aː r ɪ s
cāritās	k aː r ɪ t̪ aː s
cārus	k aː r ʊ s
cāseus	k aː s e ʊ s
cāseārius	k aː s e aː r i ʊ s
cāsiārius	k aː s i aː r i ʊ s
cāsuāle	k aː s ʊ aː l ɛ
cāsuālis	k aː s ʊ aː lʲ ɪ s
cāsābundus	k aː s aː b ʊ n̪ d̪ ʊ s
cāvannus	k aː w a n̪ n̪ ʊ s
cēbuānus	k eː b ʊ aː n̪ ʊ s
cēbuānus	t͡ʃ ɛ b u aː n u s
cēdar	k eː d̪ a r
cēlāre	k eː ɫ̪ aː r ɛ
cēlātor	k eː ɫ̪ aː t̪ ɔ r
cēlō	k eː ɫ̪ oː
cēna	k eː n̪ a
cēnitō	k eː n̪ ɪ t̪ oː
cēnsennia	k ẽː s ɛ n̪ n̪ i a
cēnseō	k ẽː s e oː
cēnsor	k ẽː s ɔ r
cēnsor	t͡ʃ ɛ n s ɔ r
cēnsus	k ẽː s ʊ s
cēnsēre	k ẽː s eː r ɛ
cēnsōrius	k ẽː s oː r i ʊ s
cēnsōrēs	k ẽː s oː r eː s
cēnsūra	k ẽː s uː r a
cēnulentus	k eː n̪ ʊ l ɛ n̪ t̪ ʊ s
cēnō	k eː n̪ oː
cēpam	k eː p ãˑ
cēpheus	k eː pʰ e ʊ s
cēphēius	k eː pʰ eː i ʊ s
cēphēnes	k eː pʰ eː n̪ ɛ s
cēphēus	k eː pʰ eː ʊ s
cēphīsus	k eː pʰ iː s ʊ s
cēpācius	k eː p aː k i ʊ s
cēpītis	k eː p iː t̪ ɪ s
cēreus	k eː r e ʊ s
cērinthus	k eː r ɪ n̪ t̪ʰ ʊ s
cērium	k eː r i ʊ̃ˑ
cērussa	k eː r ʊ s s a
cērāta	k eː r aː t̪ a
cērāta	k eː r aː t̪ aː
cērāte	k eː r aː t̪ ɛ
cērātō	k eː r aː t̪ oː
cērītis	k eː r iː t̪ ɪ s
cērōsus	k eː r oː s ʊ s
cēterus	k eː t̪ ɛ r ʊ s
cētius	k eː t̪ i ʊ s
cētus	k eː t̪ ʊ s
cībalae	k iː b a ɫ̪ a e̯
cīccum	k iː k k ʊ̃ˑ
cīdalārius	k iː d̪ a ɫ̪ aː r i ʊ s
cīdelārius	k iː d̪ ɛ ɫ̪ aː r i ʊ s
cīdlārius	k iː d̪ ɫ̪ aː r i ʊ s
cīlō	k iː ɫ̪ oː
cīmex	k iː m ɛ k s
cīmōn	k iː m oː n̪
cīncius	k iː ŋ k i ʊ s
cīnctōrium	k iː ŋ k t̪ oː r i ʊ̃ˑ
cīnyps	k iː n̪ ʏ p s
cīpus	k iː p ʊ s
cītreus	k iː t̪ r e ʊ s
cītrātus	k iː t̪ r aː t̪ ʊ s
cīvicus	k iː w ɪ k ʊ s
cīvis	k iː w ɪ s
cīvitās	k iː w ɪ t̪ aː s
cīvitās	t͡ʃ iː v i t̪ a s
cīvitātula	k iː w ɪ t̪ aː t̪ ʊ ɫ̪ a
cīvīle	k iː w iː l ɛ
cīvīlis	k iː w iː lʲ ɪ s
cīvīlis	t͡ʃ i v iː l i s
cīvīlista	k iː w iː lʲ ɪ s t̪ a
cīvīlista	t͡ʃ i v i l i s t̪ a
cīvīliter	k iː w iː lʲ ɪ t̪ ɛ r
cīvīliter	t͡ʃ i v iː l i t̪ ɛ r
cīvīlitās	k iː w iː lʲ ɪ t̪ aː s
cī̆trētum	k iː t̪ r eː t̪ ʊ̃ˑ
cī̆trētum	k ɪ t̪ r eː t̪ ʊ̃ˑ
cōbaltīnus	k oː b a ɫ̪ t̪ iː n̪ ʊ s
cōbion	k oː b i ɔ n̪
cōda	k oː d̪ a
cōdex	k oː d̪ ɛ k s
cōdīa	k oː d̪ iː a
cōgitanda	k oː ɡ ɪ t̪ a n̪ d̪ a
cōgitanda	k oː ɡ ɪ t̪ a n̪ d̪ aː
cōgitandus	k oː ɡ ɪ t̪ a n̪ d̪ ʊ s
cōgitābundus	k oː ɡ ɪ t̪ aː b ʊ n̪ d̪ ʊ s
cōgitāns	k oː ɡ ɪ t̪ ãː s
cōgitāta	k oː ɡ ɪ t̪ aː t̪ a
cōgitāta	k oː ɡ ɪ t̪ aː t̪ aː
cōgitātis	k oː ɡ ɪ t̪ aː t̪ ɪ s
cōgitātus	k oː ɡ ɪ t̪ aː t̪ ʊ s
cōgitātīs	k oː ɡ ɪ t̪ aː t̪ iː s
cōgitātūra	k oː ɡ ɪ t̪ aː t̪ uː r a
cōgitātūra	k oː ɡ ɪ t̪ aː t̪ uː r aː
cōgitāverimus	k oː ɡ ɪ t̪ aː w ɛ r iː m ʊ s
cōgitāverimus	k oː ɡ ɪ t̪ aː w ɛ r ɪ m ʊ s
cōgitāveris	k oː ɡ ɪ t̪ aː w ɛ r iː s
cōgitāveris	k oː ɡ ɪ t̪ aː w ɛ r ɪ s
cōgitāveritis	k oː ɡ ɪ t̪ aː w ɛ r iː t̪ ɪ s
cōgitāveritis	k oː ɡ ɪ t̪ aː w ɛ r ɪ t̪ ɪ s
cōgitō	k oː ɡ ɪ t̪ oː
cōgitō	k ɔː d͡ʒ i t̪ ɔ
cōlentum	k oː l ɛ n̪ t̪ ʊ̃ˑ
cōleus	k oː l e ʊ s
cōleātus	k oː l e aː t̪ ʊ s
cōlus	k oː ɫ̪ ʊ s
cōlātum	k oː ɫ̪ aː t̪ ʊ̃ˑ
cōlātūrus	k oː ɫ̪ aː t̪ uː r ʊ s
cōlī	k oː lʲ iː
cōlō	k oː ɫ̪ oː
cōmacum	k oː m a k ʊ̃ˑ
cōme	k oː m ɛ
cōmessābundus	k oː m ɛ s s aː b ʊ n̪ d̪ ʊ s
cōmicus	k oː m ɪ k ʊ s
cōmis	k oː m ɪ s
cōmissor	k oː m ɪ s s ɔ r
cōmissābundus	k oː m ɪ s s aː b ʊ n̪ d̪ ʊ s
cōmissātiō	k oː m ɪ s s aː t̪ i oː
cōmitō	k oː m ɪ t̪ oː
cōmoedia	k oː m o e̯ d̪ i a
cōmoedus	k oː m o e̯ d̪ ʊ s
cōmptus	k oː m p t̪ ʊ s
cōmum	k oː m ʊ̃ˑ
cōnectō	k oː n̪ ɛ k t̪ oː
cōnexa	k oː n̪ ɛ k s a
cōnexa	k oː n̪ ɛ k s aː
cōnexiō	k oː n̪ ɛ k s i oː
cōnexum	k oː n̪ ɛ k s ʊ̃ˑ
cōnexī	k oː n̪ ɛ k s iː
cōnexīs	k oː n̪ ɛ k s iː s
cōnexō	k oː n̪ ɛ k s oː
cōnexōrum	k oː n̪ ɛ k s oː r ʊ̃ˑ
cōnfactum	k õː f a k t̪ ʊ̃ˑ
cōnfactus	k õː f a k t̪ ʊ s
cōnfarreātiō	k õː f a r r e aː t̪ i oː
cōnfectiō	k õː f ɛ k t̪ i oː
cōnfectiōnārius	k õː f ɛ k t̪ i oː n̪ aː r i ʊ s
cōnfector	k õː f ɛ k t̪ ɔ r
cōnfectrīx	k õː f ɛ k t̪ r iː k s
cōnfectōrium	k õː f ɛ k t̪ oː r i ʊ̃ˑ
cōnfectōrārius	k õː f ɛ k t̪ oː r aː r i ʊ s
cōnfectūra	k õː f ɛ k t̪ uː r a
cōnfectūrārius	k õː f ɛ k t̪ uː r aː r i ʊ s
cōnfer	k õː f ɛ r
cōnferciō	k õː f ɛ r k i oː
cōnfersus	k õː f ɛ r s ʊ s
cōnfertifolius	k õː f ɛ r t̪ ɪ f ɔ lʲ i ʊ s
cōnferva	k õː f ɛ r w a
cōnfervae	k õː f ɛ r w a e̯
cōnferveō	k õː f ɛ r w e oː
cōnfervās	k õː f ɛ r w aː s
cōnferō	k õː f ɛ r oː
cōnfessiō	k õː f ɛ s s i oː
cōnfessiō	k ɔ n f ɛ s s i ɔ
cōnfessor	k õː f ɛ s s ɔ r
cōnfestim	k õː f ɛ s t̪ ɪ̃ˑ
cōnficiēns	k õː f ɪ k i ẽː s
cōnficiō	k õː f ɪ k i oː
cōnfigūrātiō	k õː f ɪ ɡ uː r aː t̪ i oː
cōnfigūrō	k õː f ɪ ɡ uː r oː
cōnfingō	k õː f ɪ ŋ ɡ oː
cōnfirmātiō	k õː f ɪ r m aː t̪ i oː
cōnfirmō	k õː f ɪ r m oː
cōnfiscō	k õː f ɪ s k oː
cōnfiteor	k õː f ɪ t̪ e ɔ r
cōnfiteor	k ɔ n f iː t̪ ɛ ɔ r
cōnflagrant	k õː f ɫ̪ a ɡ r a n̪ t̪
cōnflagrāns	k õː f ɫ̪ a ɡ r ãː s
cōnflagrātiō	k õː f ɫ̪ a ɡ r aː t̪ i oː
cōnflagrō	k õː f ɫ̪ a ɡ r oː
cōnfluō	k õː f ɫ̪ ʊ oː
cōnflāgēs	k õː f ɫ̪ aː ɡ eː s
cōnflātilis	k õː f ɫ̪ aː t̪ ɪ lʲ ɪ s
cōnflīctiō	k õː f lʲ iː k t̪ i oː
cōnflīctātiō	k õː f lʲ iː k t̪ aː t̪ i oː
cōnflīctō	k õː f lʲ iː k t̪ oː
cōnflīgātus	k õː f lʲ iː ɡ aː t̪ ʊ s
cōnflīgō	k õː f lʲ iː ɡ oː
cōnflō	k õː f ɫ̪ oː
cōnfodiō	k õː f ɔ d̪ i oː
cōnfoederandum	k õː f o e̯ d̪ ɛ r a n̪ d̪ ʊ̃ˑ
cōnfoederandum	k ɔ n f ɛ d̪ ɛ r a n̪ d̪ u m
cōnfoederandus	k õː f o e̯ d̪ ɛ r a n̪ d̪ ʊ s
cōnfoederandus	k ɔ n f ɛ d̪ ɛ r a n̪ d̪ u s
cōnfoederātiō	k õː f o e̯ d̪ ɛ r aː t̪ i oː
cōnfoederātus	k õː f o e̯ d̪ ɛ r aː t̪ ʊ s
cōnfoederātus	k ɔ n f ɛ d̪ ɛ r aː t̪ u s
cōnfoederō	k õː f o e̯ d̪ ɛ r oː
cōnfoederō	k ɔ n f ɛː d̪ ɛ r ɔ
cōnfortārēs	k õː f ɔ r t̪ aː r eː s
cōnfortō	k õː f ɔ r t̪ oː
cōnforāneus	k õː f ɔ r aː n̪ e ʊ s
cōnfoveō	k õː f ɔ w e oː
cōnfragōsus	k õː f r a ɡ oː s ʊ s
cōnfricō	k õː f r ɪ k oː
cōnfringō	k õː f r ɪ ŋ ɡ oː
cōnfrāctiō	k õː f r aː k t̪ i oː
cōnfugitum	k õː f ʊ ɡ ɪ t̪ ʊ̃ˑ
cōnfugiō	k õː f ʊ ɡ i oː
cōnfulgeō	k õː f ʊ ɫ̪ ɡ e oː
cōnfundō	k õː f ʊ n̪ d̪ oː
cōnfundō	k ɔ n f u n̪ d̪ ɔ
cōnfutuō	k õː f ʊ t̪ ʊ oː
cōnfābulor	k õː f aː b ʊ ɫ̪ ɔ r
cōnfīdant	k õː f iː d̪ a n̪ t̪
cōnfīdentiloquus	k õː f iː d̪ ɛ n̪ t̪ ɪ ɫ̪ ɔ kʷ ʊ s
cōnfīdō	k õː f iː d̪ oː
cōnfīgō	k õː f iː ɡ oː
cōnfīnis	k õː f iː n̪ ɪ s
cōnfīnius	k õː f iː n̪ i ʊ s
cōnfīō	k õː f iː oː
cōnfōrmis	k õː f oː r m ɪ s
cōnfōrmitās	k õː f oː r m ɪ t̪ aː s
cōnfōrmātiō	k õː f oː r m aː t̪ i oː
cōnfōrmō	k õː f oː r m oː
cōnfūcius	k õː f uː k i ʊ s
cōnfūsus	k õː f uː s ʊ s
cōnfūtātiō	k õː f uː t̪ aː t̪ i oː
cōnfūtātor	k õː f uː t̪ aː t̪ ɔ r
cōnfūtō	k õː f uː t̪ oː
cōniger	k oː n̪ ɪ ɡ ɛ r
cōnor	k oː n̪ ɔ r
cōnsabrum	k õː s a b r ʊ̃ˑ
cōnsacrō	k õː s a k r oː
cōnsaepiō	k õː s a e̯ p i oː
cōnsalūtātiō	k õː s a ɫ̪ uː t̪ aː t̪ i oː
cōnsalūtō	k õː s a ɫ̪ uː t̪ oː
cōnsanguineus	k õː s a ŋ ɡᶣ ɪ n̪ e ʊ s
cōnsanguinius	k õː s a ŋ ɡᶣ ɪ n̪ i ʊ s
cōnsarcinō	k õː s a r k ɪ n̪ oː
cōnsarriō	k õː s a r r i oː
cōnsauciō	k õː s a u̯ k i oː
cōnscelerō	k õː s k ɛ l ɛ r oː
cōnscendō	k õː s k ɛ n̪ d̪ oː
cōnscientia	k õː s k i ɛ n̪ t̪ i a
cōnscindō	k õː s k ɪ n̪ d̪ oː
cōnscissiō	k õː s k ɪ s s i oː
cōnscius	k õː s k i ʊ s
cōnsciō	k õː s k i oː
cōnscreor	k õː s k r e ɔ r
cōnscrībillō	k õː s k r iː b ɪ l lʲ oː
cōnscrībō	k õː s k r iː b oː
cōnscrīptiō	k õː s k r iː p t̪ i oː
cōnscrīptor	k õː s k r iː p t̪ ɔ r
cōnscēnsiō	k õː s k ẽː s i oː
cōnscīscō	k õː s k iː s k oː
cōnsecrātiō	k õː s ɛ k r aː t̪ i oː
cōnsecrātor	k õː s ɛ k r aː t̪ ɔ r
cōnsecrātrīx	k õː s ɛ k r aː t̪ r iː k s
cōnsecrō	k õː s ɛ k r oː
cōnsector	k õː s ɛ k t̪ ɔ r
cōnsectāneus	k õː s ɛ k t̪ aː n̪ e ʊ s
cōnsectārius	k õː s ɛ k t̪ aː r i ʊ s
cōnsectātor	k õː s ɛ k t̪ aː t̪ ɔ r
cōnsecō	k õː s ɛ k oː
cōnsentia	k õː s ɛ n̪ t̪ i a
cōnsentius	k õː s ɛ n̪ t̪ i ʊ s
cōnsentiēns	k õː s ɛ n̪ t̪ i ẽː s
cōnsentiō	k õː s ɛ n̪ t̪ i oː
cōnsentāneus	k õː s ɛ n̪ t̪ aː n̪ e ʊ s
cōnsenēscō	k õː s ɛ n̪ eː s k oː
cōnsepeliō	k õː s ɛ p ɛ lʲ i oː
cōnsequor	k õː s ɛ kʷ ɔ r
cōnsequus	k õː s ɛ kʷ ʊ s
cōnsequutiō	k õː s ɛ kʷ ʊ t̪ i oː
cōnsermōnor	k õː s ɛ r m oː n̪ ɔ r
cōnserva	k õː s ɛ r w a
cōnserver	k õː s ɛ r w ɛ r
cōnservābilis	k õː s ɛ r w aː b ɪ lʲ ɪ s
cōnservātiō	k õː s ɛ r w aː t̪ i oː
cōnservātor	k õː s ɛ r w aː t̪ ɔ r
cōnservātrīx	k õː s ɛ r w aː t̪ r iː k s
cōnservātīvus	k õː s ɛ r w aː t̪ iː w ʊ s
cōnservō	k õː s ɛ r w oː
cōnsessiō	k õː s ɛ s s i oː
cōnsidius	k õː s ɪ d̪ i ʊ s
cōnsilior	k õː s ɪ lʲ i ɔ r
cōnsilium	k õː s ɪ lʲ i ʊ̃ˑ
cōnsiliārius	k õː s ɪ lʲ i aː r i ʊ s
cōnsiliātor	k õː s ɪ lʲ i aː t̪ ɔ r
cōnsiliōsus	k õː s ɪ lʲ i oː s ʊ s
cōnsilēscō	k õː s ɪ l eː s k oː
cōnsilīnum	k õː s ɪ lʲ iː n̪ ʊ̃ˑ
cōnsimilis	k õː s ɪ m ɪ lʲ ɪ s
cōnsimilō	k õː s ɪ m ɪ ɫ̪ oː
cōnsipiō	k õː s ɪ p i oː
cōnsistō	k õː s ɪ s t̪ oː
cōnsistōriānus	k õː s ɪ s t̪ oː r i aː n̪ ʊ s
cōnsocer	k õː s ɔ k ɛ r
cōnsocius	k õː s ɔ k i ʊ s
cōnsociābilis	k õː s ɔ k i aː b ɪ lʲ ɪ s
cōnsociātiō	k õː s ɔ k i aː t̪ i oː
cōnsociō	k õː s ɔ k i oː
cōnsolida	k õː s ɔ lʲ ɪ d̪ a
cōnsolidam	k õː s ɔ lʲ ɪ d̪ ãˑ
cōnsolidā	k õː s ɔ lʲ ɪ d̪ aː
cōnsolidās	k õː s ɔ lʲ ɪ d̪ aː s
cōnsolidātiō	k õː s ɔ lʲ ɪ d̪ aː t̪ i oː
cōnsolidātor	k õː s ɔ lʲ ɪ d̪ aː t̪ ɔ r
cōnsolidīs	k õː s ɔ lʲ ɪ d̪ iː s
cōnsolidō	k õː s ɔ lʲ ɪ d̪ oː
cōnsonus	k õː s ɔ n̪ ʊ s
cōnsonō	k õː s ɔ n̪ oː
cōnsorannī	b ɛ l ɛ n̪ d̪ iː
cōnsors	k õː s ɔ r s
cōnsortiō	k õː s ɔ r t̪ i oː
cōnspargō	k õː s p a r ɡ oː
cōnspectus	k õː s p ɛ k t̪ ʊ s
cōnspergō	k õː s p ɛ r ɡ oː
cōnspicillātus	k õː s p ɪ k ɪ l lʲ aː t̪ ʊ s
cōnspiciō	k õː s p ɪ k i oː
cōnspicor	k õː s p ɪ k ɔ r
cōnspicuus	k õː s p ɪ k ʊ ʊ s
cōnspicābundus	k õː s p ɪ k aː b ʊ n̪ d̪ ʊ s
cōnspondeō	k õː s p ɔ n̪ d̪ e oː
cōnspuimur	k õː s p ʊ ɪ m ʊ r
cōnspurcō	k õː s p ʊ r k oː
cōnspuō	k õː s p ʊ oː
cōnspīrātiō	k õː s p iː r aː t̪ i oː
cōnspīrō	k õː s p iː r oː
cōnstabiliō	k õː s t̪ a b ɪ lʲ i oː
cōnstantia	k õː s t̪ a n̪ t̪ i a
cōnstantīnopolītānus	k õː s t̪ a n̪ t̪ iː n̪ ɔ p ɔ lʲ iː t̪ aː n̪ ʊ s
cōnstantīnus	k õː s t̪ a n̪ t̪ iː n̪ ʊ s
cōnstantīnus	k ɔ n s t̪ a n̪ t̪ iː n u s
cōnstituent	k õː s t̪ ɪ t̪ ʊ ɛ n̪ t̪
cōnstitum	k õː s t̪ ɪ t̪ ʊ̃ˑ
cōnstituō	k õː s t̪ ɪ t̪ ʊ oː
cōnstitūtiō	k õː s t̪ ɪ t̪ uː t̪ i oː
cōnstitūtīvus	k õː s t̪ ɪ t̪ uː t̪ iː w ʊ s
cōnstrictiō	k õː s t̪ r ɪ k t̪ i oː
cōnstrictor	k õː s t̪ r ɪ k t̪ ɔ r
cōnstringō	k õː s t̪ r ɪ ŋ ɡ oː
cōnstruō	k õː s t̪ r ʊ oː
cōnstrūctiō	k õː s t̪ r uː k t̪ i oː
cōnstrūctiō	k ɔ n s t̪ r u k t͡s i ɔ
cōnstupeō	k õː s t̪ ʊ p e oː
cōnstuprō	k õː s t̪ ʊ p r oː
cōnstāns	k õː s t̪ ãː s
cōnstēllātiō	k õː s t̪ eː l lʲ aː t̪ i oː
cōnstīpō	k õː s t̪ iː p oː
cōnstō	k õː s t̪ oː
cōnsuantae	k õː s ʊ a n̪ t̪ a e̯
cōnsubstantiālis	k õː s ʊ p s t̪ a n̪ t̪ i aː lʲ ɪ s
cōnsubstantiālis	k ɔ n s u p s t̪ a n t͡s i aː l i s
cōnsul	k õː s ʊ ɫ̪
cōnsul	k ɔ n s u l
cōnsultant	k õː s ʊ ɫ̪ t̪ a n̪ t̪
cōnsultante	k õː s ʊ ɫ̪ t̪ a n̪ t̪ ɛ
cōnsultantēs	k õː s ʊ ɫ̪ t̪ a n̪ t̪ eː s
cōnsultum	k õː s ʊ ɫ̪ t̪ ʊ̃ˑ
cōnsultus	k õː s ʊ ɫ̪ t̪ ʊ s
cōnsultātiō	k õː s ʊ ɫ̪ t̪ aː t̪ i oː
cōnsulāris	k õː s ʊ ɫ̪ aː r ɪ s
cōnsulāriter	k õː s ʊ ɫ̪ aː r ɪ t̪ ɛ r
cōnsulāritās	k õː s ʊ ɫ̪ aː r ɪ t̪ aː s
cōnsulārius	k õː s ʊ ɫ̪ aː r i ʊ s
cōnsulātus	k õː s ʊ ɫ̪ aː t̪ ʊ s
cōnsulō	k õː s ʊ ɫ̪ oː
cōnsummātiō	k õː s ʊ m m aː t̪ i oː
cōnsummātor	k õː s ʊ m m aː t̪ ɔ r
cōnsummō	k õː s ʊ m m oː
cōnsurgō	k õː s ʊ r ɡ oː
cōnsurrēctiō	k õː s ʊ r r eː k t̪ i oː
cōnsuādeō	k õː s w aː d̪ e oː
cōnsuēscō	k õː s w eː s k oː
cōnsuēscō	k ɔ n s v ɛ s k ɔ
cōnsuētum	k õː s ʊ eː t̪ ʊ̃ˑ
cōnsuētūdō	k õː s w eː t̪ uː d̪ oː
cōnsuō	k õː s ʊ oː
cōnsānēscō	k õː s aː n̪ eː s k oː
cōnsānō	k õː s aː n̪ oː
cōnsēmineus	k õː s eː m ɪ n̪ e ʊ s
cōnsēminālis	k õː s eː m ɪ n̪ aː lʲ ɪ s
cōnsēnsus	k õː s ẽː s ʊ s
cōnsēpiō	k õː s eː p i oː
cōnsīderantia	k õː s iː d̪ ɛ r a n̪ t̪ i a
cōnsīderābilis	k õː s iː d̪ ɛ r aː b ɪ lʲ ɪ s
cōnsīderātus	k õː s iː d̪ ɛ r aː t̪ ʊ s
cōnsīderō	k õː s iː d̪ ɛ r oː
cōnsīdō	k õː s iː d̪ oː
cōnsīgnō	k õː s iː ŋ n̪ oː
cōnsōbrīna	k õː s oː b r iː n̪ a
cōnsōbrīnus	k õː s oː b r iː n̪ ʊ s
cōnsōlor	k õː s oː ɫ̪ ɔ r
cōnsōlābilis	k õː s oː ɫ̪ aː b ɪ lʲ ɪ s
cōnsōlāmen	k õː s oː ɫ̪ aː m ɛ n̪
cōnsōlātiō	k õː s oː ɫ̪ aː t̪ i oː
cōnsōlātor	k õː s oː ɫ̪ aː t̪ ɔ r
cōnsōlātīvus	k õː s oː ɫ̪ aː t̪ iː w ʊ s
cōnsōlātōrius	k õː s oː ɫ̪ aː t̪ oː r i ʊ s
cōnsōlātōrī	k õː s oː ɫ̪ aː t̪ oː r iː
cōnsōlō	k õː s oː ɫ̪ oː
cōnsōpiō	k õː s oː p i oː
cōnsūmere	k õː s uː m eː r ɛ
cōnsūmere	k õː s uː m ɛ r ɛ
cōnsūmō	k õː s uː m oː
cōnsūtus	k õː s uː t̪ ʊ s
cōntiō	k o n tʲ o
cōntiō	k oː n̪ t̪ i oː
cōntiō	k ɔ n t͡s i ɔ
cōntiōnor	k oː n̪ t̪ i oː n̪ ɔ r
cōntiōnābundus	k oː n̪ t̪ i oː n̪ aː b ʊ n̪ d̪ ʊ s
cōnus	k oː n̪ ʊ s
cōnābilis	k oː n̪ aː b ɪ lʲ ɪ s
cōnāmen	k oː n̪ aː m ɛ n̪
cōnātiō	k oː n̪ aː t̪ i oː
cōnītor	k oː n̪ iː t̪ ɔ r
cōnīum	k oː n̪ iː ʊ̃ˑ
cōnīventia	k oː n̪ iː w ɛ n̪ t̪ i a
cōnīveō	k oː n̪ iː w e oː
cōnūbium	k oː n̪ uː b i ʊ̃ˑ
cōphēn	k oː pʰ eː n̪
cōpiōsus	k oː p i oː s ʊ s
cōpula	k oː p ʊ ɫ̪ a
cōpulātiō	k oː p ʊ ɫ̪ aː t̪ i oː
cōpulātrīx	k oː p ʊ ɫ̪ aː t̪ r iː k s
cōpulō	k oː p ʊ ɫ̪ oː
cōpāïs	k oː p aː ɪ s
cōpōnius	k oː p oː n̪ i ʊ s
cōram	k oː r ãˑ
cōrnīx	k oː r n̪ iː k s
cōte	k oː t̪ ɛ
cōturnīx	k oː t̪ ʊ r n̪ iː k s
cũ	k ʊ̃ˑ
cūbāna	k uː b aː n̪ a
cūbāna	k uː b aː n̪ aː
cūbāne	k uː b aː n̪ ɛ
cūbānus	k uː b aː n̪ ʊ s
cūbānās	k uː b aː n̪ aː s
cūbānī	k uː b aː n̪ iː
cūbānō	k uː b aː n̪ oː
cūbānōs	k uː b aː n̪ oː s
cūcubō	k uː k ʊ b oː
cūcūsus	k uː k uː s ʊ s
cūdendum	k uː d̪ ɛ n̪ d̪ ʊ̃ˑ
cūlus	k uː ɫ̪ ʊ s
cūlī	k uː lʲ iː
cūna	k uː n̪ a
cūnae	k uː n̪ a e̯
cūnaxa	k uː n̪ a k s a
cūnctor	k uː ŋ k t̪ ɔ r
cūnctābundus	k uː ŋ k t̪ aː b ʊ n̪ d̪ ʊ s
cūnctātum	k uː ŋ k t̪ aː t̪ ʊ̃ˑ
cūnctō	k uː ŋ k t̪ oː
cūnābulum	k uː n̪ aː b ʊ ɫ̪ ʊ̃ˑ
cūnīna	k uː n̪ iː n̪ a
cūpreus	k uː p r e ʊ s
cūpula	k uː p ʊ ɫ̪ a
cūrante	k uː r a n̪ t̪ ɛ
cūriosolītēs	k uː r i ɔ s ɔ lʲ iː t̪ eː s
cūriātus	k uː r i aː t̪ ʊ s
cūriēnus	k uː r i eː n̪ ʊ s
cūriōsitās	k uː r i oː s ɪ t̪ aː s
cūriōsus	k uː r i oː s ʊ s
cūrātēla	k uː r aː t̪ eː ɫ̪ a
cū̆stōdia	k uː s t̪ oː d̪ i a
cū̆stōdia	k ʊ s t̪ oː d̪ i a
cū̆stōdiō	k uː s t̪ oː d̪ i oː
cū̆stōdiō	k ʊ s t̪ oː d̪ i oː
cū̆stōdēs	k uː s t̪ oː d̪ eː s
cū̆stōdēs	k ʊ s t̪ oː d̪ eː s
cū̆stōs	k uː s t̪ oː s
cū̆stōs	k ʊ s t̪ oː s
cȳaneus	k yː a n̪ e ʊ s
cȳanēscēns	k yː a n̪ eː s k ẽː s
cȳmaticus	k yː m a t̪ ɪ k ʊ s
cȳmatium	k yː m a t̪ i ʊ̃ˑ
cȳmōsus	k yː m oː s ʊ s
cȳnus	k yː n̪ ʊ s
cȳrus	k yː r ʊ s
cȳrus	t͡ʃ iː r u s
cȳrēneus	k yː r eː n̪ e ʊ s
cȳrēnē	k yː r eː n̪ eː
cȳzicus	k yː z z ɪ k ʊ s
dabitha	d̪ a b ɪ t̪ʰ a
dabla	d̪ a b ɫ̪ a
dabrona	d̪ a b r ɔ n̪ a
dactylicus	d̪ a k t̪ ʏ lʲ ɪ k ʊ s
dactylifer	d̪ a k t̪ ʏ lʲ ɪ f ɛ r
dactylus	d̪ a k t̪ ʏ ɫ̪ ʊ s
dactylō	d̪ a k t̪ ʏ ɫ̪ oː
daedalus	d̪ a e̯ d̪ a ɫ̪ ʊ s
daemon	d̪ a e̯ m ɔ n̪
daemon	d̪ ɛː m ɔ n
daemoniacus	d̪ a e̯ m ɔ n̪ i a k ʊ s
daemonicus	d̪ a e̯ m ɔ n̪ ɪ k ʊ s
dahūria	d̪ a h uː r i a
dahūricus	d̪ a h uː r ɪ k ʊ s
daix	d̪ a ɪ k s
dalecarlia	d̪ a l ɛ k a r lʲ i a
dalivus	d̪ a lʲ ɪ w ʊ s
dalluntum	d̪ a l lʲ ʊ n̪ t̪ ʊ̃ˑ
dalmaticus	d̪ a ɫ̪ m a t̪ ɪ k ʊ s
damascēnus	d̪ a m a s k eː n̪ ʊ s
damasippus	d̪ a m a s ɪ p p ʊ s
damassī	d̪ a m a s s iː
damastium	d̪ a m a s t̪ i ʊ̃ˑ
damastēs	d̪ a m a s t̪ eː s
damnia	d̪ a m n̪ i a
damnificus	d̪ a m n iː f i k u s
damnificus	d̪ a m n̪ ɪ f ɪ k ʊ s
damnor	d̪ a m n̪ ɔ r
damnum	d̪ a m n̪ ʊ̃ˑ
damnābilis	d̪ a m n̪ aː b ɪ lʲ ɪ s
damnās	d̪ a m n̪ aː s
damnātus	d̪ a m n̪ aː t̪ ʊ s
damnātīcius	d̪ a m n̪ aː t̪ iː k i ʊ s
damnātōrius	d̪ a m n̪ aː t̪ oː r i ʊ s
damnīs	d̪ a m n̪ iː s
