iūrisprūdentia	j uː r ɪ s p r uː d̪ ɛ n̪ t̪ i aː
iūrisprūdēns	j u r i s p r uː d̪ ɛ n s
iūrisprūdēns	j uː r ɪ s p r uː d̪ ẽː s
iūrista	j u r i s t̪ a
iūrista	j uː r ɪ s t̪ a
iūrulentus	j uː r ʊ l ɛ n̪ t̪ ʊ s
iūrāmentum	j u r a m ɛ n̪ t̪ u m
iūrāmentum	j uː r aː m ɛ n̪ t̪ ʊ̃ˑ
iūrātus	j uː r aː t̪ ʊ s
iūrātīvus	j u r a t̪ iː v u s
iūrātīvus	j uː r aː t̪ iː w ʊ s
iūrātōrius	j u r a t̪ ɔː r i u s
iūrātōrius	j uː r aː t̪ oː r i ʊ s
iūsculum	j uː s k ʊ ɫ̪ ʊ̃ˑ
iūsiūrandum	j uː s j uː r a n̪ d̪ ʊ̃ˑ
iūstificus	j uː s t̪ ɪ f ɪ k ʊ s
iūstificō	j uː s t̪ ɪ f ɪ k oː
iūstitia	j uː s t̪ ɪ t̪ i a
iūstus	j uː s t̪ ʊ s
iūsum	j u s õ
iūsum	j uː s ʊ̃ˑ
iūsum	j uː z u m
iūverimus	j uː w ɛ r iː m ʊ s
iūverimus	j uː w ɛ r ɪ m ʊ s
iūveris	j uː w ɛ r iː s
iūveris	j uː w ɛ r ɪ s
iūveris	j ʊ w eː r ɪ s
iūveritis	j uː w ɛ r iː t̪ ɪ s
iūveritis	j uː w ɛ r ɪ t̪ ɪ s
iū̆xtā	j u k s t̪ a
iū̆xtā	j ʊ k s t̪ aː
jabolēnus	j a b ɔ l eː n̪ ʊ s
jacetānī	j a k ɛ t̪ aː n̪ iː
jactanticulus	j a k t̪ a n̪ t̪ ɪ k ʊ ɫ̪ ʊ s
jacter	j a k t̪ ɛ r
jactitābundus	j a k t̪ ɪ t̪ aː b ʊ n̪ d̪ ʊ s
jactitō	j a k t̪ ɪ t̪ oː
jactābilis	j a k t̪ aː b ɪ lʲ ɪ s
jactābundus	j a k t̪ aː b ʊ n̪ d̪ ʊ s
jactāns	j a k t̪ ãː s
jactō	j a k t̪ oː
jaculor	j a k ʊ ɫ̪ ɔ r
jaculus	j a k ʊ ɫ̪ ʊ s
jaculābilis	j a k ʊ ɫ̪ aː b ɪ lʲ ɪ s
jaculātōrius	j a k ʊ ɫ̪ aː t̪ oː r i ʊ s
jamaicēnsis	j a m a j k ẽː s ɪ s
japonicus	j a p ɔ n̪ ɪ k ʊ s
jasōnium	j a s oː n̪ i ʊ̃ˑ
javanicus	j a w a n̪ ɪ k ʊ s
javanēnsis	j a w a n̪ ẽː s ɪ s
javānus	j a w aː n̪ ʊ s
javēnsis	j a w ẽː s ɪ s
jaxamatae	j a k s a m a t̪ a e̯
jecinerōsus	j ɛ k ɪ n̪ ɛ r oː s ʊ s
jecorīna	j ɛ k ɔ r iː n̪ a
jecorīna	j ɛ k ɔ r iː n̪ aː
jejūnus	j ɛ j j uː n̪ ʊ s
jejūnō	j ɛ j j uː n̪ oː
jilinēnsis	j ɪ lʲ ɪ n̪ ẽː s ɪ s
joculor	j ɔ k ʊ ɫ̪ ɔ r
joculāris	j ɔ k ʊ ɫ̪ aː r ɪ s
jocus	j ɔ k ʊ s
jocō	j ɔ k oː
jocōsus	j ɔ k oː s ʊ s
johorēnsis	j ɔ h ɔ r ẽː s ɪ s
joppē	j ɔ p p eː
jordanēnsis	j ɔ r d̪ a n̪ ẽː s ɪ s
jubeō	j ʊ b e oː
jugulodigastricus	j ʊ ɡ ʊ ɫ̪ ɔ d̪ ɪ ɡ a s t̪ r ɪ k ʊ s
jugulō	j ʊ ɡ ʊ ɫ̪ oː
jugō	j ʊ ɡ oː
julī	j ʊ lʲ iː
junceus	j ʊ ŋ k e ʊ s
juncētum	j ʊ ŋ k eː t̪ ʊ̃ˑ
jungō	j ʊ ŋ ɡ oː
juninēnsis	j ʊ n̪ ɪ n̪ ẽː s ɪ s
junta	j ʊ n̪ t̪ a
juntārum	j ʊ n̪ t̪ aː r ʊ̃ˑ
juntās	j ʊ n̪ t̪ aː s
juntīne	j ʊ n̪ t̪ iː n̪ ɛ
juntīnus	j ʊ n̪ t̪ iː n̪ ʊ s
juppiter	j ʊ p p ɪ t̪ ɛ r
juvenculus	j ʊ w ɛ ŋ k ʊ ɫ̪ ʊ s
juvencus	j ʊ w ɛ ŋ k ʊ s
juvenis	j ʊ w ɛ n̪ ɪ s
juventius	j ʊ w ɛ n̪ t̪ i ʊ s
juvenēscō	j ʊ w ɛ n̪ eː s k oː
juvenīlis	j ʊ w ɛ n̪ iː lʲ ɪ s
juvenīlēs	j ʊ w ɛ n̪ iː l eː s
juvāvum	j ʊ w aː w ʊ̃ˑ
juvō	j ʊ w oː
juxtanucleāris	j ʊ k s t̪ a n̪ ʊ k l e aː r ɪ s
juxtapapillāris	j ʊ k s t̪ a p a p ɪ l lʲ aː r ɪ s
jānitrīcēs	j aː n̪ ɪ t̪ r iː k eː s
jēntō	j eː n̪ t̪ oː
jērē̆mī̆ās	j eː r ɛ m i aː s
jērē̆mī̆ās	j ɛ r ɛː m i a s
jōcundus	j oː k ʊ n̪ d̪ ʊ s
jōcundātiō	j oː k ʊ n̪ d̪ aː t̪ i oː
jōcundē	j oː k ʊ n̪ d̪ eː
jōcundō	j oː k ʊ n̪ d̪ oː
jōnā	j oː n̪ a
jōnā	j oː n̪ aː
jōnās	j oː n̪ aː s
jūbilō	j uː b ɪ ɫ̪ oː
jūcundor	j uː k ʊ n̪ d̪ ɔ r
jūcundus	j uː k ʊ n̪ d̪ ʊ s
jūcundō	j uː k ʊ n̪ d̪ oː
jūdiciālis	j uː d̪ ɪ k i aː lʲ ɪ s
jūdiciārius	j uː d̪ ɪ k i aː r i ʊ s
jūdicēs	j uː d̪ i t͡ʃ ɛ s
jūdicēs	j uː d̪ ɪ k eː s
jūdicō	j uː d̪ ɪ k oː
jūger	j uː ɡ ɛ r
jūgerum	j uː d͡ʒ ɛ r u m
jūgerum	j uː ɡ ɛ r ʊ̃ˑ
jūlias	j uː lʲ i a s
jūliobona	j uː lʲ i ɔ b ɔ n̪ a
jūliobrīga	j uː lʲ i ɔ b r iː ɡ a
jūnctīnus	j uː ŋ k t̪ iː n̪ ʊ s
jūnōnicola	j uː n̪ oː n̪ ɪ k ɔ ɫ̪ a
jūpiter	j uː p ɪ t̪ ɛ r
jūridiciālis	j uː r ɪ d̪ ɪ k i aː lʲ ɪ s
jūris	j uː r ɪ s
jūsjūrandum	j uː s j uː r a n̪ d̪ ʊ̃ˑ
jūstificō	j uː s t̪ ɪ f ɪ k oː
jūstus	j uː s t̪ ʊ s
jūturna	j uː t̪ ʊ r n̪ a
kaalaēnsis	k a a ɫ̪ a ẽː s ɪ s
kagoshimēnsis	k a ɡ ɔ s ɪ m ẽː s ɪ s
kalendae	k a l ɛ n̪ d̪ a e̯
kalendae	k a l ɛ n̪ d̪ ɛ
kalendās	k a l ɛ n̪ d̪ aː s
kalium	k a lʲ i ʊ̃ˑ
kamerunēnsis	k a m ɛ r ʊ n̪ ẽː s ɪ s
karachiēnsis	k a r a kʰ i ẽː s ɪ s
karakumēnsis	k a r a k ʊ m ẽː s ɪ s
karibaēnsis	k a r ɪ b a ẽː s ɪ s
karthāgō	k a r t̪ aː ɡ ɔ
karthāgō	k a r t̪ʰ aː ɡ oː
kartāgō	k a r t̪ aː ɡ oː
kartāgō	k a r t̪ aː ɡ ɔ
kauaiēnsis	k a u̯ a j ẽː s ɪ s
kerguelēnsis	k ɛ r ɡ ɛ l ẽː s ɪ s
kijevēnsis	k ɪ j j ɛ w ẽː s ɪ s
kilifiēnsis	k ɪ lʲ ɪ f i ẽː s ɪ s
kilonēnsis	k ɪ ɫ̪ ɔ n̪ ẽː s ɪ s
kinabaluēnsis	k ɪ n̪ a b a ɫ̪ ʊ ẽː s ɪ s
kivuēnsis	k ɪ w ʊ ẽː s ɪ s
kolymēnsis	k ɔ lʲ ʏ m ẽː s ɪ s
koraiēnsis	k ɔ r a j ẽː s ɪ s
kumaonēnsis	k ʊ m a ɔ n̪ ẽː s ɪ s
kurdicus	k ʊ r d̪ ɪ k ʊ s
kurilēnsis	k ʊ r ɪ l ẽː s ɪ s
kuriēnsis	k ʊ r i ẽː s ɪ s
kururiēnsis	k ʊ r ʊ r i ẽː s ɪ s
kētōsiredūcēns	k eː t̪ oː s ɪ r ɛ d̪ uː k ẽː s
labarum	ɫ̪ a b a r ʊ̃ˑ
labda	ɫ̪ a b d̪ a
labdacismus	ɫ̪ a b d̪ a k ɪ s m ʊ s
labefactātis	ɫ̪ a b ɛ f a k t̪ aː t̪ ɪ s
labefactātiō	ɫ̪ a b ɛ f a k t̪ aː t̪ i oː
labefactātīs	ɫ̪ a b ɛ f a k t̪ aː t̪ iː s
labefactāverimus	ɫ̪ a b ɛ f a k t̪ aː w ɛ r iː m ʊ s
labefactāverimus	ɫ̪ a b ɛ f a k t̪ aː w ɛ r ɪ m ʊ s
labefactāveris	ɫ̪ a b ɛ f a k t̪ aː w ɛ r iː s
labefactāveris	ɫ̪ a b ɛ f a k t̪ aː w ɛ r ɪ s
labefactāveritis	ɫ̪ a b ɛ f a k t̪ aː w ɛ r iː t̪ ɪ s
labefactāveritis	ɫ̪ a b ɛ f a k t̪ aː w ɛ r ɪ t̪ ɪ s
labefactō	ɫ̪ a b ɛ f a k t̪ oː
labellum	ɫ̪ a b ɛ l lʲ ʊ̃ˑ
laberius	ɫ̪ a b ɛ r i ʊ s
labeātēs	ɫ̪ a b e aː t̪ eː s
labeō	ɫ̪ a b e oː
labeōsus	ɫ̪ a b e oː s ʊ s
labia	ɫ̪ a b i a
labium	l aː b i u m
labium	ɫ̪ a b i ʊ̃ˑ
labiālis	l a b i aː l i s
labiēnus	ɫ̪ a b i eː n̪ ʊ s
labiōsus	ɫ̪ a b i oː s ʊ s
labranda	ɫ̪ a b r a n̪ d̪ a
labrum	ɫ̪ a b r ʊ̃ˑ
laburnum	ɫ̪ a b ʊ r n̪ ʊ̃ˑ
labyrintheus	ɫ̪ a b ʏ r ɪ n̪ t̪ʰ e ʊ s
labyrinthus	l a b i r i n̪ t̪ u s
labyrinthus	ɫ̪ a b ʏ r ɪ n̪ t̪ʰ ʊ s
labīcum	ɫ̪ a b iː k ʊ̃ˑ
labō	ɫ̪ a b oː
labōrandum	ɫ̪ a b oː r a n̪ d̪ ʊ̃ˑ
labōrifer	ɫ̪ a b oː r ɪ f ɛ r
labōriōsus	ɫ̪ a b oː r i oː s ʊ s
labōriōsē	ɫ̪ a b oː r i oː s eː
labōrā	ɫ̪ a b oː r aː
labōrātor	l a b ɔ r aː t̪ ɔ r
labōrātor	ɫ̪ a b oː r aː t̪ ɔ r
labōrātōrium	ɫ̪ a b oː r aː t̪ oː r i ʊ̃ˑ
labōrō	ɫ̪ a b oː r oː
labōsus	ɫ̪ a b oː s ʊ s
lac	ɫ̪ a k
lacca	ɫ̪ a k k a
laccar	ɫ̪ a k k a r
lacer	ɫ̪ a k ɛ r
lacerante	ɫ̪ a k ɛ r a n̪ t̪ ɛ
lacerantēs	ɫ̪ a k ɛ r a n̪ t̪ eː s
lacerius	ɫ̪ a k ɛ r i ʊ s
lacerna	l a t͡ʃ ɛ r n a
lacerna	ɫ̪ a k ɛ r n̪ a
lacerta	ɫ̪ a k ɛ r t̪ a
lacertōsus	ɫ̪ a k ɛ r t̪ oː s ʊ s
lacerābilis	ɫ̪ a k ɛ r aː b ɪ lʲ ɪ s
lacerātis	ɫ̪ a k ɛ r aː t̪ ɪ s
lacerātiō	ɫ̪ a k ɛ r aː t̪ i oː
lacerātor	ɫ̪ a k ɛ r aː t̪ ɔ r
lacerātrīx	ɫ̪ a k ɛ r aː t̪ r iː k s
lacerātīs	ɫ̪ a k ɛ r aː t̪ iː s
lacerāverimus	ɫ̪ a k ɛ r aː w ɛ r iː m ʊ s
lacerāverimus	ɫ̪ a k ɛ r aː w ɛ r ɪ m ʊ s
lacerāveris	ɫ̪ a k ɛ r aː w ɛ r iː s
lacerāveris	ɫ̪ a k ɛ r aː w ɛ r ɪ s
lacerāveritis	ɫ̪ a k ɛ r aː w ɛ r iː t̪ ɪ s
lacerāveritis	ɫ̪ a k ɛ r aː w ɛ r ɪ t̪ ɪ s
lacerō	ɫ̪ a k ɛ r oː
lacessit	l a t͡ʃ ɛ s s i t̪
lacessit	ɫ̪ a k ɛ s s ɪ t̪
lacessō	ɫ̪ a k ɛ s s oː
lachēs	ɫ̪ a kʰ eː s
laciaca	ɫ̪ a k i a k a
lacimurga	ɫ̪ a k ɪ m ʊ r ɡ a
laciniātus	ɫ̪ a k ɪ n̪ i aː t̪ ʊ s
lacippō	ɫ̪ a k ɪ p p oː
laciō	ɫ̪ a k i oː
lacmōn	ɫ̪ a k m oː n̪
lacobrīga	ɫ̪ a k ɔ b r iː ɡ a
lacrima	ɫ̪ a k r ɪ m a
lacrimula	ɫ̪ a k r ɪ m ʊ ɫ̪ a
lacrimābilis	ɫ̪ a k r ɪ m aː b ɪ lʲ ɪ s
lacrimābundus	ɫ̪ a k r ɪ m aː b ʊ n̪ d̪ ʊ s
lacrimātis	ɫ̪ a k r ɪ m aː t̪ ɪ s
lacrimātiō	ɫ̪ a k r ɪ m aː t̪ i oː
lacrimātīs	ɫ̪ a k r ɪ m aː t̪ iː s
lacrimāverimus	ɫ̪ a k r ɪ m aː w ɛ r iː m ʊ s
lacrimāverimus	ɫ̪ a k r ɪ m aː w ɛ r ɪ m ʊ s
lacrimāveris	ɫ̪ a k r ɪ m aː w ɛ r iː s
lacrimāveris	ɫ̪ a k r ɪ m aː w ɛ r ɪ s
lacrimāveritis	ɫ̪ a k r ɪ m aː w ɛ r iː t̪ ɪ s
lacrimāveritis	ɫ̪ a k r ɪ m aː w ɛ r ɪ t̪ ɪ s
lacrimō	ɫ̪ a k r ɪ m oː
lacrimōsus	ɫ̪ a k r ɪ m oː s ʊ s
lacrimōsē	ɫ̪ a k r ɪ m oː s eː
lacringī	ɫ̪ a k r ɪ ŋ ɡ iː
lacruma	ɫ̪ a k r ʊ m a
lacrumābundus	ɫ̪ a k r ʊ m aː b ʊ n̪ d̪ ʊ s
lacryma	ɫ̪ a k r ʏ m a
lacta	ɫ̪ a k t̪ a
lactantius	ɫ̪ a k t̪ a n̪ t̪ i ʊ s
lacteolus	ɫ̪ a k t̪ e ɔ ɫ̪ ʊ s
lacteus	ɫ̪ a k t̪ e ʊ s
lacturnus	ɫ̪ a k t̪ ʊ r n̪ ʊ s
lactātiō	ɫ̪ a k t̪ aː t̪ i oː
lactēns	ɫ̪ a k t̪ ẽː s
lactōra	ɫ̪ a k t̪ oː r a
lactūca	ɫ̪ a k t̪ uː k a
lactūcārius	ɫ̪ a k t̪ uː k aː r i ʊ s
lacumacēs	ɫ̪ a k ʊ m a k eː s
lacus	ɫ̪ a k ʊ s
lacusta	ɫ̪ a k ʊ s t̪ a
lacustris	ɫ̪ a k ʊ s t̪ r ɪ s
lacōnia	ɫ̪ a k oː n̪ i a
lacōnicus	ɫ̪ a k oː n̪ ɪ k ʊ s
lacūna	ɫ̪ a k uː n̪ a
lacūnō	ɫ̪ a k uː n̪ oː
lacūnōsus	ɫ̪ a k uː n̪ oː s ʊ s
laecānius	ɫ̪ a e̯ k aː n̪ i ʊ s
laelia	ɫ̪ a e̯ lʲ i a
laelius	ɫ̪ a e̯ lʲ i ʊ s
laena	ɫ̪ a e̯ n̪ a
laenās	ɫ̪ a e̯ n̪ aː s
laeotomus	ɫ̪ a e̯ ɔ t̪ ɔ m ʊ s
laepia	ɫ̪ a e̯ p i a
laesiō	ɫ̪ a e̯ s i oː
laetevirēns	ɫ̪ a e̯ t̪ ɛ w ɪ r ẽː s
laetificō	l ɛ t̪ iː f i k ɔ
laetificō	ɫ̪ a e̯ t̪ ɪ f ɪ k oː
laetissimus	ɫ̪ a e̯ t̪ ɪ s s ɪ m ʊ s
laetitia	l ɛ t̪ iː t͡s i a
laetitia	ɫ̪ a e̯ t̪ ɪ t̪ i a
laetus	ɫ̪ a e̯ t̪ ʊ s
laetābundus	ɫ̪ a e̯ t̪ aː b ʊ n̪ d̪ ʊ s
laetīlius	ɫ̪ a e̯ t̪ iː lʲ i ʊ s
laetō	ɫ̪ a e̯ t̪ oː
laetōrius	ɫ̪ a e̯ t̪ oː r i ʊ s
laevicollis	ɫ̪ a e̯ w ɪ k ɔ l lʲ ɪ s
laevigātus	ɫ̪ a e̯ w ɪ ɡ aː t̪ ʊ s
laevius	ɫ̪ a e̯ w i ʊ s
laevus	ɫ̪ a e̯ w ʊ s
laevī	ɫ̪ a e̯ w iː
laevīnus	ɫ̪ a e̯ w iː n̪ ʊ s
laeāna	ɫ̪ a e̯ aː n̪ a
lagania	ɫ̪ a ɡ a n̪ i a
lagina	ɫ̪ a ɡ ɪ n̪ a
laginē	ɫ̪ a ɡ ɪ n̪ eː
lagunēnsis	ɫ̪ a ɡ ʊ n̪ ẽː s ɪ s
lagōpūs	ɫ̪ a ɡ oː p uː s
lagōus	ɫ̪ a ɡ ɔ ʊ s
lagūsa	ɫ̪ a ɡ uː s a
lalasis	ɫ̪ a ɫ̪ a s ɪ s
lallō	ɫ̪ a l lʲ oː
lamberēs	ɫ̪ a m b ɛ r eː s
lambrus	ɫ̪ a m b r ʊ s
lambō	ɫ̪ a m b oː
lamia	l aː m i a
lamia	ɫ̪ a m i a
lampada	ɫ̪ a m p a d̪ a
lampadiō	ɫ̪ a m p a d̪ i oː
lampadō	ɫ̪ a m p a d̪ oː
lampagō	ɫ̪ a m p a ɡ oː
lampas	ɫ̪ a m p a s
lampsa	ɫ̪ a m p s a
lampōnia	ɫ̪ a m p oː n̪ i a
lampōnius	ɫ̪ a m p oː n̪ i ʊ s
lamsē	ɫ̪ ãː s eː
lamus	ɫ̪ a m ʊ s
lamyrus	ɫ̪ a m ʏ r ʊ s
lamētus	ɫ̪ a m eː t̪ ʊ s
lancea	ɫ̪ a ŋ k e a
lanceola	ɫ̪ a ŋ k e ɔ ɫ̪ a
lanceolātus	ɫ̪ a ŋ k e ɔ ɫ̪ aː t̪ ʊ s
lanceātus	ɫ̪ a ŋ k e aː t̪ ʊ s
lanceō	ɫ̪ a ŋ k e oː
lancifolius	ɫ̪ a ŋ k ɪ f ɔ lʲ i ʊ s
lancinātūrus	ɫ̪ a ŋ k ɪ n̪ aː t̪ uː r ʊ s
lancinō	ɫ̪ a ŋ k ɪ n̪ oː
lanciō	ɫ̪ a ŋ k i oː
lancī	ɫ̪ a ŋ k iː
langarus	ɫ̪ a ŋ ɡ a r ʊ s
langobardus	ɫ̪ a ŋ ɡ ɔ b a r d̪ ʊ s
langobrīga	ɫ̪ a ŋ ɡ ɔ b r iː ɡ a
langueō	ɫ̪ a ŋ ɡᶣ e oː
languidus	ɫ̪ a ŋ ɡᶣ ɪ d̪ ʊ s
languor	ɫ̪ a ŋ ɡʷ ɔ r
languēre	ɫ̪ a ŋ ɡᶣ eː r ɛ
languēscō	ɫ̪ a ŋ ɡᶣ eː s k oː
langŭēre	ɫ̪ a ŋ ɡ ʊ eː r ɛ
lanipēs	ɫ̪ a n̪ ɪ p eː s
lanista	ɫ̪ a n̪ ɪ s t̪ a
lanius	ɫ̪ a n̪ i ʊ s
laniābāminī	ɫ̪ a n̪ i aː b aː m ɪ n̪ iː
laniātis	ɫ̪ a n̪ i aː t̪ ɪ s
laniātīs	ɫ̪ a n̪ i aː t̪ iː s
laniāverimus	ɫ̪ a n̪ i aː w ɛ r iː m ʊ s
laniāverimus	ɫ̪ a n̪ i aː w ɛ r ɪ m ʊ s
laniāveris	ɫ̪ a n̪ i aː w ɛ r iː s
laniāveris	ɫ̪ a n̪ i aː w ɛ r ɪ s
laniāveritis	ɫ̪ a n̪ i aː w ɛ r iː t̪ ɪ s
laniāveritis	ɫ̪ a n̪ i aː w ɛ r ɪ t̪ ɪ s
lanos	ɫ̪ a n̪ ɔ s
lanterna	ɫ̪ a n̪ t̪ ɛ r n̪ a
lanthanum	ɫ̪ a n̪ t̪ʰ a n̪ ʊ̃ˑ
lanx	ɫ̪ a ŋ k s
laoticus	ɫ̪ a ɔ t̪ ɪ k ʊ s
lapathum	ɫ̪ a p a t̪ʰ ʊ̃ˑ
laphiās	ɫ̪ a pʰ i aː s
laphystium	ɫ̪ a pʰ ʏ s t̪ i ʊ̃ˑ
lapicīda	ɫ̪ a p ɪ k iː d̪ a
lapideus	ɫ̪ a p ɪ d̪ e ʊ s
lapidicīda	ɫ̪ a p ɪ d̪ ɪ k iː d̪ a
lapidāria	ɫ̪ a p ɪ d̪ aː r i a
lapidārie	ɫ̪ a p ɪ d̪ aː r i ɛ
lapidāris	ɫ̪ a p ɪ d̪ aː r ɪ s
lapidārius	ɫ̪ a p ɪ d̪ aː r i ʊ s
lapidāriās	ɫ̪ a p ɪ d̪ aː r i aː s
lapidāriō	ɫ̪ a p ɪ d̪ aː r i oː
lapidāriōs	ɫ̪ a p ɪ d̪ aː r i oː s
lapidārī	ɫ̪ a p ɪ d̪ aː r iː
lapidātis	ɫ̪ a p ɪ d̪ aː t̪ ɪ s
lapidātīs	ɫ̪ a p ɪ d̪ aː t̪ iː s
lapidāverimus	ɫ̪ a p ɪ d̪ aː w ɛ r iː m ʊ s
lapidāverimus	ɫ̪ a p ɪ d̪ aː w ɛ r ɪ m ʊ s
lapidāveris	ɫ̪ a p ɪ d̪ aː w ɛ r iː s
lapidāveris	ɫ̪ a p ɪ d̪ aː w ɛ r ɪ s
lapidāveritis	ɫ̪ a p ɪ d̪ aː w ɛ r iː t̪ ɪ s
lapidāveritis	ɫ̪ a p ɪ d̪ aː w ɛ r ɪ t̪ ɪ s
lapidēscēns	l a p i d̪ ɛ ʃ ʃ ɛ n s
lapidēscēns	ɫ̪ a p ɪ d̪ eː s k ẽː s
lapidēscō	l a b e ð e s k o
lapidēscō	l a p i d̪ ɛ s k ɔ
lapidēscō	ɫ̪ a p ɪ d̪ eː s k oː
lapidō	ɫ̪ a p ɪ d̪ oː
lapillus	ɫ̪ a p ɪ l lʲ ʊ s
lapis	ɫ̪ a p ɪ s
lapithās	ɫ̪ a p ɪ t̪ʰ a s
lappius	ɫ̪ a p p i ʊ s
lapurdum	ɫ̪ a p ʊ r d̪ ʊ̃ˑ
lapēthus	ɫ̪ a p eː t̪ʰ ʊ s
laquear	ɫ̪ a kᶣ e a r
laqueus	ɫ̪ a kᶣ e ʊ s
laqueārius	ɫ̪ a kᶣ e aː r i ʊ s
laqueātus	ɫ̪ a kᶣ e aː t̪ ʊ s
laranda	ɫ̪ a r a n̪ d̪ a
larbason	ɫ̪ a r b a s ɔ n̪
larcius	ɫ̪ a r k i ʊ s
larendānī	ɫ̪ a r ɛ n̪ d̪ aː n̪ iː
largificus	ɫ̪ a r ɡ ɪ f ɪ k ʊ s
largifluus	ɫ̪ a r ɡ ɪ f ɫ̪ ʊ ʊ s
largiloquus	ɫ̪ a r ɡ ɪ ɫ̪ ɔ kʷ ʊ s
largior	ɫ̪ a r ɡ i ɔ r
largitās	ɫ̪ a r ɡ ɪ t̪ aː s
largitūdō	ɫ̪ a r ɡ ɪ t̪ uː d̪ oː
largiusculus	ɫ̪ a r ɡ i ʊ s k ʊ ɫ̪ ʊ s
largiō	ɫ̪ a r ɡ i oː
largus	ɫ̪ a r ɡ ʊ s
largīmentum	ɫ̪ a r ɡ iː m ɛ n̪ t̪ ʊ̃ˑ
largītiō	ɫ̪ a r ɡ iː t̪ i oː
largītor	ɫ̪ a r ɡ iː t̪ ɔ r
larix	ɫ̪ a r ɪ k s
lartidius	ɫ̪ a r t̪ ɪ d̪ i ʊ s
larunda	ɫ̪ a r ʊ n̪ d̪ a
larus	ɫ̪ a r ʊ s
larymna	ɫ̪ a r ʏ m n̪ a
larynx	ɫ̪ a r ʏ ŋ k s
larārium	ɫ̪ a r aː r i ʊ̃ˑ
larī	ɫ̪ a r iː
lascuta	ɫ̪ a s k ʊ t̪ a
lascīvia	ɫ̪ a s k iː w i a
lascīviō	ɫ̪ a s k iː w i oː
lascīvus	ɫ̪ a s k iː w ʊ s
lascīvībundus	ɫ̪ a s k iː w iː b ʊ n̪ d̪ ʊ s
lasia	ɫ̪ a s i a
lasiōn	ɫ̪ a s i oː n̪
lassulus	ɫ̪ a s s ʊ ɫ̪ ʊ s
lassunnī	ɫ̪ a s s ʊ n̪ n̪ iː
lassus	ɫ̪ a s s ʊ s
lassātis	ɫ̪ a s s aː t̪ ɪ s
lassātīs	ɫ̪ a s s aː t̪ iː s
lassāverimus	ɫ̪ a s s aː w ɛ r iː m ʊ s
lassāverimus	ɫ̪ a s s aː w ɛ r ɪ m ʊ s
lassāveris	ɫ̪ a s s aː w ɛ r iː s
lassāveris	ɫ̪ a s s aː w ɛ r ɪ s
lassāveritis	ɫ̪ a s s aː w ɛ r iː t̪ ɪ s
lassāveritis	ɫ̪ a s s aː w ɛ r ɪ t̪ ɪ s
lassō	ɫ̪ a s s oː
lastaurus	ɫ̪ a s t̪ a u̯ r ʊ s
lastigi	ɫ̪ a s t̪ ɪ ɡ ɪ
latebra	ɫ̪ a t̪ ɛ b r a
latentēs	ɫ̪ a t̪ ɛ n̪ t̪ eː s
later	ɫ̪ a t̪ ɛ r
laterculus	ɫ̪ a t̪ ɛ r k ʊ ɫ̪ ʊ s
laterculēnsis	ɫ̪ a t̪ ɛ r k ʊ l ẽː s ɪ s
latericulus	ɫ̪ a t̪ ɛ r ɪ k ʊ ɫ̪ ʊ s
laterniō	ɫ̪ a t̪ ɛ r n̪ i oː
laterālis	ɫ̪ a t̪ ɛ r aː lʲ ɪ s
laterālēs	ɫ̪ a t̪ ɛ r aː l eː s
laterāmen	ɫ̪ a t̪ ɛ r aː m ɛ n̪
laterīcius	l a t̪ ɛ r iː t͡ʃ i u s
laterīcius	ɫ̪ a t̪ ɛ r iː k i ʊ s
latex	l aː t̪ ɛ k s
latex	ɫ̪ a t̪ ɛ k s
lateō	l aː t̪ ɛ ɔ
lateō	ɫ̪ a t̪ e oː
latibulum	ɫ̪ a t̪ ɪ b ʊ ɫ̪ ʊ̃ˑ
laticeps	ɫ̪ a t̪ ɪ k ɛ p s
laticollis	ɫ̪ a t̪ ɪ k ɔ l lʲ ɪ s
laticornis	ɫ̪ a t̪ ɪ k ɔ r n̪ ɪ s
latidēns	ɫ̪ a t̪ ɪ d̪ ẽː s
latifasciātus	ɫ̪ a t̪ ɪ f a s k i aː t̪ ʊ s
latifrōns	ɫ̪ a t̪ ɪ f r õː s
latipennis	ɫ̪ a t̪ ɪ p ɛ n̪ n̪ ɪ s
latitarsis	ɫ̪ a t̪ ɪ t̪ a r s ɪ s
latitābundus	ɫ̪ a t̪ ɪ t̪ aː b ʊ n̪ d̪ ʊ s
latitō	ɫ̪ a t̪ ɪ t̪ oː
latium	ɫ̪ a t̪ i ʊ̃ˑ
latius	ɫ̪ a t̪ i ʊ s
latmus	ɫ̪ a t̪ m ʊ s
latovicī	ɫ̪ a t̪ ɔ w ɪ k iː
latris	ɫ̪ a t̪ r ɪ s
latrunculus	ɫ̪ a t̪ r ʊ ŋ k ʊ ɫ̪ ʊ s
latrō	ɫ̪ a t̪ r oː
latrōcinium	ɫ̪ a t̪ r oː k ɪ n̪ i ʊ̃ˑ
latrōcinor	ɫ̪ a t̪ r oː k ɪ n̪ ɔ r
latus	l aː t̪ u s
latus	ɫ̪ a t̪ ʊ s
latviānus	ɫ̪ a t̪ w i aː n̪ ʊ s
latēbrōsus	ɫ̪ a t̪ eː b r oː s ʊ s
latēns	l aː t̪ ɛ n s
latēscō	ɫ̪ a t̪ eː s k oː
latīna	ɫ̪ a t̪ iː n̪ a
latīnitās	ɫ̪ a t̪ iː n̪ ɪ t̪ aː s
latīnus	ɫ̪ a t̪ iː n̪ ʊ s
latīnē	ɫ̪ a t̪ iː n̪ eː
laubia	l a o̯ β j a
laubia	ɫ̪ a u̯ b i a
laudanda	ɫ̪ a u̯ d̪ a n̪ d̪ a
laudanda	ɫ̪ a u̯ d̪ a n̪ d̪ aː
laudant	ɫ̪ a u̯ d̪ a n̪ t̪
laudantī	ɫ̪ a u̯ d̪ a n̪ t̪ iː
laudanum	ɫ̪ a u̯ d̪ a n̪ ʊ̃ˑ
laudat	ɫ̪ a u̯ d̪ a t̪
laudis	ɫ̪ a u̯ d̪ ɪ s
laudor	ɫ̪ a u̯ d̪ ɔ r
laudābam	ɫ̪ a u̯ d̪ aː b ãˑ
laudābant	ɫ̪ a u̯ d̪ aː b a n̪ t̪
laudābat	ɫ̪ a u̯ d̪ aː b a t̪
laudābilis	ɫ̪ a u̯ d̪ aː b ɪ lʲ ɪ s
laudābimus	ɫ̪ a u̯ d̪ aː b ɪ m ʊ s
laudābis	ɫ̪ a u̯ d̪ aː b ɪ s
laudābit	ɫ̪ a u̯ d̪ aː b ɪ t̪
laudābitis	ɫ̪ a u̯ d̪ aː b ɪ t̪ ɪ s
laudābunt	ɫ̪ a u̯ d̪ aː b ʊ n̪ t̪
laudābāmus	ɫ̪ a u̯ d̪ aː b aː m ʊ s
laudābās	ɫ̪ a u̯ d̪ aː b aː s
laudābātis	ɫ̪ a u̯ d̪ aː b aː t̪ ɪ s
laudābō	ɫ̪ a u̯ d̪ aː b oː
laudāmus	ɫ̪ a u̯ d̪ aː m ʊ s
laudāre	ɫ̪ a u̯ d̪ aː r ɛ
laudārier	ɫ̪ a u̯ d̪ aː r i ɛ r
laudārī	ɫ̪ a u̯ d̪ aː r iː
laudās	ɫ̪ a u̯ d̪ aː s
laudātis	ɫ̪ a u̯ d̪ aː t̪ ɪ s
laudātiō	l a u̯ d̪ aː t͡s i ɔ
laudātiō	ɫ̪ a u̯ d̪ aː t̪ i oː
laudātor	ɫ̪ a u̯ d̪ aː t̪ ɔ r
laudātī	ɫ̪ a u̯ d̪ aː t̪ iː
laudātīs	ɫ̪ a u̯ d̪ aː t̪ iː s
laudātūra	ɫ̪ a u̯ d̪ aː t̪ uː r a
laudātūra	ɫ̪ a u̯ d̪ aː t̪ uː r aː
laudāverimus	ɫ̪ a u̯ d̪ aː w ɛ r iː m ʊ s
laudāverimus	ɫ̪ a u̯ d̪ aː w ɛ r ɪ m ʊ s
laudāveris	ɫ̪ a u̯ d̪ aː w ɛ r iː s
laudāveris	ɫ̪ a u̯ d̪ aː w ɛ r ɪ s
laudāveritis	ɫ̪ a u̯ d̪ aː w ɛ r iː t̪ ɪ s
laudāveritis	ɫ̪ a u̯ d̪ aː w ɛ r ɪ t̪ ɪ s
laudāverō	ɫ̪ a u̯ d̪ aː w ɛ r oː
laudāvimus	ɫ̪ a u̯ d̪ aː w ɪ m ʊ s
laudāvistis	ɫ̪ a u̯ d̪ aː w ɪ s t̪ ɪ s
laudāvistī	ɫ̪ a u̯ d̪ aː w ɪ s t̪ iː
laudāvit	ɫ̪ a u̯ d̪ aː w ɪ t̪
laudāvērunt	ɫ̪ a u̯ d̪ aː w eː r ʊ n̪ t̪
laudāvī	ɫ̪ a u̯ d̪ aː w iː
laudō	ɫ̪ a u̯ d̪ oː
laumellum	ɫ̪ a u̯ m ɛ l lʲ ʊ̃ˑ
laurea	ɫ̪ a u̯ r e a
laurentius	l a u̯ r ɛ n t͡s i u s
laurentius	ɫ̪ a u̯ r ɛ n̪ t̪ i ʊ s
laureola	ɫ̪ a u̯ r e ɔ ɫ̪ a
laureus	ɫ̪ a u̯ r e ʊ s
laureātus	ɫ̪ a u̯ r e aː t̪ ʊ s
lauriacum	ɫ̪ a u̯ r i a k ʊ̃ˑ
laurifolius	ɫ̪ a u̯ r ɪ f ɔ lʲ i ʊ s
lauriger	ɫ̪ a u̯ r ɪ ɡ ɛ r
laurocerasus	l a u̯ r ɔ t͡ʃ ɛː r a z u s
laurocerasus	ɫ̪ a u̯ r ɔ k ɛ r a s ʊ s
laurus	ɫ̪ a u̯ r ʊ s
laurāgō	ɫ̪ a u̯ r aː ɡ oː
laurās	ɫ̪ a u̯ r aː s
laurētum	ɫ̪ a u̯ r eː t̪ ʊ̃ˑ
laurīnus	ɫ̪ a u̯ r iː n̪ ʊ s
laurīs	ɫ̪ a u̯ r iː s
laus	ɫ̪ a u̯ s
lausus	ɫ̪ a u̯ s ʊ s
lautus	ɫ̪ a u̯ t̪ ʊ s
laver	ɫ̪ a w ɛ r
laverna	ɫ̪ a w ɛ r n̪ a
laverniō	ɫ̪ a w ɛ r n̪ i oː
lavātiō	ɫ̪ a w aː t̪ i oː
lavō	ɫ̪ a w oː
lawrencium	ɫ̪ a u̯ r ɛ ŋ k i ʊ̃ˑ
lax	ɫ̪ a k s
laxante	ɫ̪ a k s a n̪ t̪ ɛ
laxantēs	ɫ̪ a k s a n̪ t̪ eː s
laxiflōrus	ɫ̪ a k s ɪ f ɫ̪ oː r ʊ s
laxitās	ɫ̪ a k s ɪ t̪ aː s
laxus	ɫ̪ a k s ʊ s
laxāmentum	ɫ̪ a k s aː m ɛ n̪ t̪ ʊ̃ˑ
laxātis	ɫ̪ a k s aː t̪ ɪ s
laxātīs	ɫ̪ a k s aː t̪ iː s
laxāverimus	ɫ̪ a k s aː w ɛ r iː m ʊ s
laxāverimus	ɫ̪ a k s aː w ɛ r ɪ m ʊ s
laxāveris	ɫ̪ a k s aː w ɛ r iː s
laxāveris	ɫ̪ a k s aː w ɛ r ɪ s
laxāveritis	ɫ̪ a k s aː w ɛ r iː t̪ ɪ s
laxāveritis	ɫ̪ a k s aː w ɛ r ɪ t̪ ɪ s
laxō	ɫ̪ a k s oː
lazulum	ɫ̪ a z z ʊ ɫ̪ ʊ̃ˑ
leaena	l e a e̯ n̪ a
lebadēa	l ɛ b a d̪ eː a
lebaea	l ɛ b a e̯ a
lebedus	l ɛ b ɛ d̪ ʊ s
lebinthos	l ɛ b ɪ n̪ t̪ʰ ɔ s
lebēna	l ɛ b eː n̪ a
lebēs	l ɛ b eː s
lechaeum	l ɛ kʰ a e̯ ʊ̃ˑ
lechiēnī	l ɛ kʰ i eː n̪ iː
lectisternium	l ɛ k t̪ ɪ s t̪ ɛ r n̪ i ʊ̃ˑ
lectulus	l ɛ k t̪ ʊ ɫ̪ ʊ s
lectulārius	l ɛ k t̪ ʊ ɫ̪ aː r i ʊ s
lectum	l ɛ k t̪ ʊ̃ˑ
lectus	l ɛ k t̪ ʊ s
lectuārius	l ɛ k t̪ ʊ aː r i ʊ s
lectīca	l ɛ k t̪ iː k a
lectīcula	l ɛ k t̪ iː k ʊ ɫ̪ a
lectīcārius	l ɛ k t̪ iː k aː r i ʊ s
lederata	l ɛ d̪ ɛ r a t̪ a
ledō	l ɛ d̪ oː
lege	l ɛ ɡ ɛ
legedia	l ɛ ɡ ɛ d̪ i a
legionicus	l ɛ ɡ i ɔ n̪ ɪ k ʊ s
legiuncula	l ɛ ɡ i ʊ ŋ k ʊ ɫ̪ a
legiō	l ɛ ɡ i oː
legiōnārius	l ɛ ɡ i oː n̪ aː r i ʊ s
legulus	l ɛ ɡ ʊ ɫ̪ ʊ s
legātis	l ɛ ɡ aː t̪ ɪ s
legēns	l ɛ ɡ ẽː s
legēs	l ɛ ɡ eː s
legō	l ɛ ɡ oː
legūmen	l ɛ ɡ uː m ɛ n̪
legūminōsa	l ɛ ɡ uː m ɪ n̪ oː s a
legūminōsa	l ɛ ɡ uː m ɪ n̪ oː s aː
legūminōsus	l ɛ ɡ uː m ɪ n̪ oː s ʊ s
legūminōsās	l ɛ ɡ uː m ɪ n̪ oː s aː s
legūminōsō	l ɛ ɡ uː m ɪ n̪ oː s oː
legūminōsōs	l ɛ ɡ uː m ɪ n̪ oː s oː s
lelegēs	l ɛ l ɛ ɡ eː s
lemavī	l ɛ m a w iː
lembus	l ɛ m b ʊ s
lemincum	l ɛ m ɪ ŋ k ʊ̃ˑ
lemovīcēs	l ɛ m ɔ w iː k eː s
lemurēs	l ɛ m ʊ r eː s
lemūria	l ɛ m uː r i a
leniceps	l ɛ n̪ ɪ k ɛ p s
lentia	l ɛ n̪ t̪ i a
lentidius	l ɛ n̪ t̪ ɪ d̪ i ʊ s
lentior	l ɛ n̪ t̪ i ɔ r
lentipēs	l ɛ n̪ t̪ ɪ p eː s
lentitūdō	l ɛ n̪ t̪ ɪ t̪ uː d̪ oː
lentius	l ɛ n̪ t̪ i ʊ s
lentulus	l ɛ n̪ t̪ ʊ ɫ̪ ʊ s
lentus	l ɛ n̪ t̪ ʊ s
lentē	l ɛ n̪ t̪ eː
lentīscifer	l ɛ n̪ t̪ iː s k ɪ f ɛ r
lentīscus	l ɛ n̪ t̪ iː s k ʊ s
lentō	l ɛ n̪ t̪ oː
leonnātus	l e ɔ n̪ n̪ aː t̪ ʊ s
leonticē	l e ɔ n̪ t̪ ɪ k eː
leontios	l e ɔ n̪ t̪ i ɔ s
leontopetalon	l e ɔ n̪ t̪ ɔ p ɛ t̪ a ɫ̪ ɔ n̪
leontopetalī	l e ɔ n̪ t̪ ɔ p ɛ t̪ a lʲ iː
leontopetalō	l e ɔ n̪ t̪ ɔ p ɛ t̪ a ɫ̪ oː
leontēs	l e ɔ n̪ t̪ ɛ s
leontīnī	l e ɔ n̪ t̪ iː n̪ iː
leonēnsis	l e ɔ n̪ ẽː s ɪ s
leopardus	l e ɔ p a r d̪ ʊ s
lepetymnus	l ɛ p ɛ t̪ ʏ m n̪ ʊ s
lepidopterus	l ɛ p ɪ d̪ ɔ p t̪ ɛ r ʊ s
lepidus	l ɛ p ɪ d̪ ʊ s
lepidus	l ɛː p i d̪ u s
lepidōtis	l ɛ p ɪ d̪ oː t̪ ɪ s
lepra	l ɛ p r a
lepreum	l ɛ p r e ʊ̃ˑ
leprōsus	l ɛ p r oː s ʊ s
leptis	l ɛ p t̪ ɪ s
leptophyllus	l ɛ p t̪ ɔ pʰ ʏ l lʲ ʊ s
leptoptilos	l ɛ p t̪ ɔ p t̪ ɪ ɫ̪ ɔ s
leptorhynchus	l ɛ p t̪ ɔ r ʏ ŋ kʰ ʊ s
leptus	l ɛ p t̪ ʊ s
lepus	l ɛ p ʊ s
lepusculus	l ɛ p ʊ s k ʊ ɫ̪ ʊ s
lepīnus	l ɛ p iː n̪ ʊ s
lepōs	l ɛ p oː s
lerna	l ɛ r n̪ a
letrinī	l ɛ t̪ r ɪ n̪ iː
lettonicus	l ɛ t̪ t̪ ɔ n̪ ɪ k ʊ s
leucadia	l e u̯ k a d̪ i a
leucippus	l e u̯ k ɪ p p ʊ s
leucochrȳsos	l e u̯ k ɔ kʰ r yː s ɔ s
leucophthalmos	l e u̯ k ɔ pʰ t̪ʰ a ɫ̪ m ɔ s
leucopoecilos	l e u̯ k ɔ p o e̯ k ɪ ɫ̪ ɔ s
leucrion	l e u̯ k r i ɔ n̪
leuctra	l e u̯ k t̪ r a
leucōnium	l e u̯ k oː n̪ i ʊ̃ˑ
leucūrus	l e u̯ k uː r ʊ s
leunī	l e u̯ n̪ iː
levenna	l ɛ w ɛ n̪ n̪ a
levicollis	l ɛ w ɪ k ɔ l lʲ ɪ s
leviculus	l ɛ w ɪ k ʊ ɫ̪ ʊ s
levidēnsis	l ɛ w ɪ d̪ ẽː s ɪ s
levifīdus	l ɛ w ɪ f iː d̪ ʊ s
levigāre	l ɛ w ɪ ɡ aː r ɛ
levigāverimus	l ɛ w ɪ ɡ aː w ɛ r iː m ʊ s
levigāverimus	l ɛ w ɪ ɡ aː w ɛ r ɪ m ʊ s
levigāveris	l ɛ w ɪ ɡ aː w ɛ r iː s
levigāveris	l ɛ w ɪ ɡ aː w ɛ r ɪ s
levigāveritis	l ɛ w ɪ ɡ aː w ɛ r iː t̪ ɪ s
levigāveritis	l ɛ w ɪ ɡ aː w ɛ r ɪ t̪ ɪ s
levigō	l ɛ w ɪ ɡ oː
levipēs	l ɛ w ɪ p eː s
levis	l ɛ w ɪ s
leviter	l ɛ w ɪ t̪ ɛ r
levitās	l ɛ w ɪ t̪ aː s
levus	l ɛ w ʊ s
levāmen	l ɛ w aː m ɛ n̪
levāmentum	l ɛ w aː m ɛ n̪ t̪ ʊ̃ˑ
levāna	l ɛ w aː n̪ a
levāre	l ɛ w aː r ɛ
levātis	l ɛ w aː t̪ ɪ s
levātīs	l ɛ w aː t̪ iː s
levāverimus	l ɛ w aː w ɛ r iː m ʊ s
levāverimus	l ɛ w aː w ɛ r ɪ m ʊ s
levāveris	l ɛ w aː w ɛ r iː s
levāveris	l ɛ w aː w ɛ r ɪ s
levāveritis	l ɛ w aː w ɛ r iː t̪ ɪ s
levāveritis	l ɛ w aː w ɛ r ɪ t̪ ɪ s
levēs	l ɛ w eː s
levītēs	l ɛ w iː t̪ eː s
levō	l ɛ w oː
lexicon	l ɛ k s ɪ k ɔ n̪
lexis	l ɛ k s ɪ s
lexiānae	l ɛ k s i aː n̪ a e̯
leōnātus	l e oː n̪ aː t̪ ʊ s
leōnātō	l e oː n̪ aː t̪ oː
leōnīnus	l e oː n̪ iː n̪ ʊ s
leōsthenēs	l e oː s t̪ʰ ɛ n̪ eː s
libadion	lʲ ɪ b a d̪ i ɔ n̪
libadē	lʲ ɪ b a d̪ eː
libanochrūs	lʲ ɪ b a n̪ ɔ kʰ r uː s
libanēnsis	lʲ ɪ b a n̪ ẽː s ɪ s
libanōtis	lʲ ɪ b a n̪ oː t̪ ɪ s
libelliō	lʲ ɪ b ɛ l lʲ i oː
libellus	lʲ ɪ b ɛ l lʲ ʊ s
libenter	lʲ ɪ b ɛ n̪ t̪ ɛ r
liberiēnsis	lʲ ɪ b ɛ r i ẽː s ɪ s
libiciī	lʲ ɪ b ɪ k i iː
libisōsona	lʲ ɪ b ɪ s oː s ɔ n̪ a
libitum	lʲ ɪ b ɪ t̪ ʊ̃ˑ
libnius	lʲ ɪ b n̪ i ʊ s
libriger	lʲ ɪ b r ɪ ɡ ɛ r
librārium	lʲ ɪ b r aː r i ʊ̃ˑ
librārius	lʲ ɪ b r aː r i ʊ s
librāriō	lʲ ɪ b r aː r i oː
librō	lʲ ɪ b r oː
liburnicus	lʲ ɪ b ʊ r n̪ ɪ k ʊ s
liburnī	lʲ ɪ b ʊ r n̪ iː
libya	lʲ ɪ b y a
libycus	lʲ ɪ b ʏ k ʊ s
libyssa	lʲ ɪ b ʏ s s a
libyssus	lʲ ɪ b ʏ s s ʊ s
