pulcherrimus	p ʊ ɫ̪ kʰ ɛ r r ɪ m ʊ s
pulchra	p ʊ ɫ̪ kʰ r a
pulchra	p ʊ ɫ̪ kʰ r aː
pulchritūdō	p ʊ ɫ̪ kʰ r ɪ t̪ uː d̪ oː
pulchrē	p ʊ ɫ̪ kʰ r eː
pulla	p ʊ l lʲ a
pulla	p ʊ l lʲ aː
pullariae	p ʊ l lʲ a r i a e̯
pullulus	p ʊ l lʲ ʊ ɫ̪ ʊ s
pullulō	p ʊ l lʲ ʊ ɫ̪ oː
pullārius	p ʊ l lʲ aː r i ʊ s
pullātus	p ʊ l lʲ aː t̪ ʊ s
pullēiāceus	p ʊ l lʲ eː j aː k e ʊ s
pullīnus	p ʊ l lʲ iː n̪ ʊ s
pulmentum	p ʊ ɫ̪ m ɛ n̪ t̪ ʊ̃ˑ
pulmō	p ʊ ɫ̪ m oː
pulpa	p ʊ ɫ̪ p a
pulpitum	p ʊ ɫ̪ p ɪ t̪ ʊ̃ˑ
pulpus	p ʊ ɫ̪ p ʊ s
pulpō	p ʊ ɫ̪ p oː
puls	p ʊ ɫ̪ s
pulsō	p ʊ ɫ̪ s oː
pulte	p ʊ ɫ̪ t̪ ɛ
pultiphagus	p ʊ ɫ̪ t̪ ɪ pʰ a ɡ ʊ s
pulverizō	p ʊ ɫ̪ w ɛ r ɪ z z oː
pulverulentus	p ʊ ɫ̪ w ɛ r ʊ l ɛ n̪ t̪ ʊ s
pulvis	p ʊ ɫ̪ w ɪ s
pulvīllus	p ʊ ɫ̪ w iː l lʲ ʊ s
pulvīnus	p ʊ ɫ̪ w iː n̪ ʊ s
pulvīnātus	p ʊ ɫ̪ w iː n̪ aː t̪ ʊ s
pungentēs	p ʊ ŋ ɡ ɛ n̪ t̪ eː s
pungō	p ʊ ŋ ɡ oː
puppis	p ʊ p p ɪ s
puppus	p ʊ p p ʊ s
purgitō	p ʊ r ɡ ɪ t̪ oː
purpura	p ʊ r p ʊ r a
purpura	p ʊ r p ʊ r aː
purpureus	p ʊ r p ʊ r e ʊ s
purpuriō	p ʊ r p ʊ r i oː
purpurārius	p ʊ r p ʊ r aː r i ʊ s
purpurātus	p ʊ r p ʊ r aː t̪ ʊ s
purpurō	p ʊ r p ʊ r oː
pusanēnsis	p ʊ s a n̪ ẽː s ɪ s
pusilla	p ʊ s ɪ l lʲ a
pusilla	p ʊ s ɪ l lʲ aː
pusillanimis	p ʊ s ɪ l lʲ a n̪ ɪ m ɪ s
pusillianimis	p ʊ s ɪ l lʲ i a n̪ ɪ m ɪ s
pusillitās	p ʊ s ɪ l lʲ ɪ t̪ aː s
pusillulus	p ʊ s ɪ l lʲ ʊ ɫ̪ ʊ s
pusillus	p ʊ s ɪ l lʲ ʊ s
pustulātus	p ʊ s t̪ ʊ ɫ̪ aː t̪ ʊ s
pustulōsus	p ʊ s t̪ ʊ ɫ̪ oː s ʊ s
puteolī	p ʊ t̪ e ɔ lʲ iː
puter	p ʊ t̪ ɛ r
puteus	p ʊ t̪ e ʊ s
putrefaciō	p ʊ t̪ r ɛ f a k i oː
putrefacta	p ʊ t̪ r ɛ f a k t̪ a
putrefacta	p ʊ t̪ r ɛ f a k t̪ aː
putrefactās	p ʊ t̪ r ɛ f a k t̪ aː s
putrefactō	p ʊ t̪ r ɛ f a k t̪ oː
putrefactōs	p ʊ t̪ r ɛ f a k t̪ oː s
putrefactūrus	p ʊ t̪ r ɛ f a k t̪ uː r ʊ s
putrerētur	p ʊ t̪ r ɛ r eː t̪ ʊ r
putreō	p ʊ t̪ r e oː
putridus	p ʊ t̪ r ɪ d̪ ʊ s
putus	p ʊ t̪ ʊ s
putāmen	p ʊ t̪ aː m ɛ n̪
putō	p ʊ t̪ oː
pycnītis	p i k n iː t̪ i s
pycnītis	p ʏ k n̪ iː t̪ ɪ s
pycta	p ʏ k t̪ a
pydna	p ʏ d̪ n̪ a
pyelus	p y ɛ ɫ̪ ʊ s
pygela	p ʏ ɡ ɛ ɫ̪ a
pygmaeus	p ʏ ɡ m a e̯ ʊ s
pylae	p ʏ ɫ̪ a e̯
pylus	p ʏ ɫ̪ ʊ s
pyra	p ʏ r a
pyralis	p ʏ r a lʲ ɪ s
pyranthus	p ʏ r a n̪ t̪ʰ ʊ s
pyrasus	p ʏ r a s ʊ s
pyretus	p ʏ r ɛ t̪ ʊ s
pyrgī	p ʏ r ɡ iː
pyrifolius	p ʏ r ɪ f ɔ lʲ i ʊ s
pyrifōrmis	p ʏ r ɪ f oː r m ɪ s
pyrius	p ʏ r i ʊ s
pyrnus	p ʏ r n̪ ʊ s
pyropum	p ʏ r ɔ p ʊ̃ˑ
pyrotechnicus	p i r ɔ t̪ ɛ k n i k u s
pyrotechnicus	p ʏ r ɔ t̪ ɛ kʰ n̪ ɪ k ʊ s
pyrrha	p ʏ r r a
pyrālis	p ʏ r aː lʲ ɪ s
pyxis	p ʏ k s ɪ s
pyxuratēs	p ʏ k s ʊ r a t̪ eː s
pyxītēs	p ʏ k s iː t̪ eː s
pābulor	p aː b ʊ ɫ̪ ɔ r
pābulum	p aː b ʊ ɫ̪ ʊ̃ˑ
pābulāris	p aː b ʊ ɫ̪ aː r ɪ s
pābulārius	p aː b ʊ ɫ̪ aː r i ʊ s
pābulātiō	p aː b ʊ ɫ̪ aː t̪ i oː
pābulātor	p aː b ʊ ɫ̪ aː t̪ ɔ r
pābulātōrius	p aː b ʊ ɫ̪ aː t̪ oː r i ʊ s
pābulōsus	p aː b ʊ ɫ̪ oː s ʊ s
pāce	p aː k ɛ
pāce	p aː t͡ʃ ɛ
pācem	p a k ɛ̃ˑ
pācem	p aː t͡ʃ ɛ m
pācifer	p aː k ɪ f ɛ r
pācificus	p aː k ɪ f ɪ k ʊ s
pācificātiō	p aː k ɪ f ɪ k aː t̪ i oː
pācificātor	p aː k ɪ f ɪ k aː t̪ ɔ r
pācificātōrius	p aː k ɪ f ɪ k aː t̪ oː r i ʊ s
pācificē	p aː k ɪ f ɪ k eː
pācificō	p aː k ɪ f ɪ k oː
pāctilis	p aː k t̪ ɪ lʲ ɪ s
pācuvius	p aː k ʊ w i ʊ s
pācālis	p aː k aː lʲ ɪ s
pācātiō	p aː k aː t̪ i oː
pācātor	p aː k aː t̪ ɔ r
pācātum	p aː k aː t̪ ʊ̃ˑ
pācātē	p aː k aː t̪ eː
pācātōrius	p aː k aː t̪ oː r i ʊ s
pāgella	p aː ɡ ɛ l lʲ a
pāgina	p aː d͡ʒ i n a
pāgina	p aː ɡ ɪ n̪ a
pāginula	p aː ɡ ɪ n̪ ʊ ɫ̪ a
pāginālis	p aː ɡ ɪ n̪ aː lʲ ɪ s
pāginātus	p aː ɡ ɪ n̪ aː t̪ ʊ s
pāgus	p aː ɡ u s
pāgus	p aː ɡ ʊ s
pāgāna	p aː ɡ aː n̪ a
pāgāna	p aː ɡ aː n̪ aː
pāgānicus	p aː ɡ aː n̪ ɪ k ʊ s
pāgānismus	p aː ɡ aː n̪ ɪ s m ʊ s
pāgānitās	p aː ɡ aː n̪ ɪ t̪ aː s
pāgānus	p aː ɡ aː n̪ ʊ s
pāgānō	p aː ɡ aː n̪ oː
pāgātim	p aː ɡ aː t̪ ɪ̃ˑ
pāgēnsis	p aː ɡ ẽː s ɪ s
pākistānēnsis	p aː k ɪ s t̪ aː n̪ ẽː s ɪ s
pāla	p aː l a
pāla	p aː ɫ̪ a
pālam	p aː ɫ̪ ãˑ
pālem	p aː l ɛ̃ˑ
pālor	p aː ɫ̪ ɔ r
pālus	p aː l u s
pālus	p aː ɫ̪ ʊ s
pālābundus	p aː ɫ̪ aː b ʊ n̪ d̪ ʊ s
pālātiō	p aː ɫ̪ aː t̪ i oː
pālātus	p aː ɫ̪ aː t̪ ʊ s
pālō	p aː ɫ̪ oː
pānatārius	p a n a t̪ aː r i u s
pānatārius	p aː n̪ a t̪ aː r i ʊ s
pānatērius	p a n a t̪ ɛː r i u s
pānatērius	p aː n̪ a t̪ eː r i ʊ s
pānetārius	p a n ɛ t̪ aː r i u s
pānetārius	p aː n̪ ɛ t̪ aː r i ʊ s
pāniceus	p aː n̪ ɪ k e ʊ s
pānicium	p aː n̪ ɪ k i ʊ̃ˑ
pānicoctārius	p aː n̪ ɪ k ɔ k t̪ aː r i ʊ s
pānicum	p aː n̪ ɪ k ʊ̃ˑ
pānificium	p aː n̪ ɪ f ɪ k i ʊ̃ˑ
pānis	p aː n̪ ɪ s
pānāriolum	p aː n̪ aː r i ɔ ɫ̪ ʊ̃ˑ
pānārium	p aː n̪ aː r i ʊ̃ˑ
pānārius	p aː n̪ aː r i ʊ s
pānōsus	p aː n̪ oː s ʊ s
pāpiliō	p aː p ɪ lʲ i oː
pāpinius	p aː p ɪ n̪ i ʊ s
pāpius	p aː p i ʊ s
pārentis	p aː r ɛ n̪ t̪ ɪ s
pāricīda	p aː r ɪ k iː d̪ a
pārēns	p aː r ẽː s
pāscitō	p aː s k ɪ t̪ oː
pāscor	p a s k ɔ r
pāscor	p aː s k ɔ r
pāscuus	p aː s k ʊ ʊ s
pāscārī	p a s k aː r i
pāscō	p a s k ɔ
pāsiphaa	p a s e f a a
pāsiphaa	p a z iː f a a
pāsiphaa	p aː s ɪ pʰ a a
pāsiphaē	p a s e f a e
pāsiphaē	p a z iː f a ɛ
pāsiphaē	p aː s ɪ pʰ a eː
pāsta	p aː s t̪ a
pāsta	p aː s t̪ aː
pāstae	p aː s t̪ a e̯
pāstor	p aː s t̪ ɔ r
pāstrīx	p a s t̪ r i k s
pāstrīx	p aː s t̪ r iː k s
pāstōrālis	p aː s t̪ oː r aː lʲ ɪ s
pāstōrīcius	p aː s t̪ oː r iː k i ʊ s
pāstūre	p aː s t̪ uː r ɛ
pāvōnīnus	p aː w oː n̪ iː n̪ ʊ s
pāxillus	p aː k s ɪ l lʲ ʊ s
pēdagōgō	p eː d̪ a ɡ oː ɡ oː
pēdagōgōs	p eː d̪ a ɡ oː ɡ oː s
pēdasum	p eː ɛ d̪ a s ʊ̃ˑ
pēdiculī	p eː d̪ ɪ k ʊ lʲ iː
pēdis	p eː d̪ ɪ s
pēditum	p eː d̪ ɪ t̪ ʊ̃ˑ
pēducaeus	p eː d̪ ʊ k a e̯ ʊ s
pēdīcellus	p eː d̪ iː k ɛ l lʲ ʊ s
pēdīcātor	p eː d̪ iː k aː t̪ ɔ r
pēganum	p eː ɡ a n̪ ʊ̃ˑ
pēgasus	p eː ɡ a s ʊ s
pēguntium	p eː ɡ ʊ n̪ t̪ i ʊ̃ˑ
pējōre	p eː j oː r ɛ
pējōribus	p eː j oː r ɪ b ʊ s
pējōris	p eː j oː r ɪ s
pējōrum	p eː j oː r ʊ̃ˑ
pēlamis	p eː ɫ̪ a m ɪ s
pēlamys	p eː ɫ̪ a m ʏ s
pēlex	p eː l ɛ k s
pēlium	p eː lʲ i ʊ̃ˑ
pēminōsus	p eː m ɪ n̪ oː s ʊ s
pēna	p eː n̪ a
pēnelops	p eː n̪ ɛ ɫ̪ ɔ p s
pēnicillātus	p eː n̪ ɪ k ɪ l lʲ aː t̪ ʊ s
pēniculus	p eː n̪ ɪ k ʊ ɫ̪ ʊ s
pēniculus	p ɛ n iː k u l u s
pēniculāmenta	p eː n̪ ɪ k ʊ ɫ̪ aː m ɛ n̪ t̪ a
pēniculāmentum	p eː n̪ ɪ k ʊ ɫ̪ aː m ɛ n̪ t̪ ʊ̃ˑ
pēnis	p e n e s
pēnis	p eː n̪ ɪ s
pēnis	p ɛː n i s
pēnsantī	p ẽː s a n̪ t̪ iː
pēnsat	p ẽː s a t̪
pēnsilis	p ẽː s ɪ lʲ ɪ s
pēnsitō	p ẽː s ɪ t̪ oː
pēnsor	p ẽː s ɔ r
pēnsum	p ẽː s ʊ̃ˑ
pēnsus	p ẽː s ʊ s
pēnsās	p ẽː s aː s
pēnsātī	p ẽː s aː t̪ iː
pēnsī	p ẽː s iː
pēnsīs	p ẽː s iː s
pēnsō	p ẽː s ɔ
pēnsō	p ɛ n s ɔ
pēnsōs	p ẽː s oː s
pēnultima	p eː n̪ ʊ ɫ̪ t̪ ɪ m a
pēnultima	p eː n̪ ʊ ɫ̪ t̪ ɪ m aː
pēnultime	p eː n̪ ʊ ɫ̪ t̪ ɪ m ɛ
pēnultimus	p eː n̪ ʊ ɫ̪ t̪ ɪ m ʊ s
pēnultimī	p eː n̪ ʊ ɫ̪ t̪ ɪ m iː
pēnultimō	p eː n̪ ʊ ɫ̪ t̪ ɪ m oː
pēnēus	p eː n̪ eː ʊ s
pēnīnsula	p eː n̪ ĩː s ʊ ɫ̪ a
pēnīnsulāris	p eː n̪ ĩː s ʊ ɫ̪ aː r ɪ s
pēnīnsulārēs	p eː n̪ ĩː s ʊ ɫ̪ aː r eː s
pēnūria	p eː n̪ uː r i a
pēra	p ɛː r a
pērula	p eː r ʊ ɫ̪ a
pētitarus	p eː t̪ ɪ t̪ a r ʊ s
pētrōnius	p eː t̪ r oː n̪ i ʊ s
pīcam	p iː k ãˑ
pīcumnus	p iː k ʊ m n̪ ʊ s
pīcus	p iː k ʊ s
pīcēnum	p iː k eː n̪ ʊ̃ˑ
pīeria	p iː ɛ r i a
pīla	p iː ɫ̪ a
pīlentum	p iː l ɛ n̪ t̪ ʊ̃ˑ
pīleum	p iː l e ʊ̃ˑ
pīleus	p iː l e ʊ s
pīleātus	p iː l e aː t̪ ʊ s
pīlius	p iː lʲ i ʊ s
pīlum	p iː ɫ̪ ʊ̃ˑ
pīlumnus	p iː ɫ̪ ʊ m n̪ ʊ s
pīlus	p iː ɫ̪ ʊ s
pīlāte	p iː ɫ̪ aː t̪ ɛ
pīlātus	p iː ɫ̪ aː t̪ ʊ s
pīlātō	p iː ɫ̪ aː t̪ oː
pīlō	p iː ɫ̪ oː
pīna	p iː n̪ a
pīnaster	p iː n̪ a s t̪ ɛ r
pīneus	p iː n̪ e ʊ s
pīnifer	p iː n̪ ɪ f ɛ r
pīniger	p iː n̪ ɪ ɡ ɛ r
pīnsus	p ĩː s ʊ s
pīnus	p iː n̪ ʊ s
pīnārius	p iː n̪ aː r i ʊ s
pīnētum	p iː n̪ eː t̪ ʊ̃ˑ
pīpientis	p iː p i ɛ n̪ t̪ ɪ s
pīpizō	p iː p ɪ z z oː
pīrustae	p iː r ʊ s t̪ a e̯
pīrāta	p iː r aː t̪ a
pīrāticus	p iː r aː t̪ ɪ k ʊ s
pīsistratus	p iː s ɪ s t̪ r a t̪ ʊ s
pītuītōsus	p iː t̪ ʊ iː t̪ oː s ʊ s
pōculentus	p oː k ʊ l ɛ n̪ t̪ ʊ s
pōculum	p oː k ʊ ɫ̪ ʊ̃ˑ
pōdex	p oː d̪ ɛ k s
pōgōniās	p oː ɡ oː n̪ i aː s
pōlulus	p oː ɫ̪ ʊ ɫ̪ ʊ s
pōlīa	p oː lʲ iː a
pōmifer	p oː m ɪ f ɛ r
pōmum	p oː m ʊ̃ˑ
pōmānus	p oː m aː n̪ ʊ s
pōmērium	p oː m eː r i ʊ̃ˑ
pōmētia	p oː m eː t̪ i a
pōmōna	p oː m oː n̪ a
pōnant	p oː n̪ a n̪ t̪
pōnere	p oː n̪ eː r ɛ
pōnere	p oː n̪ ɛ r ɛ
pōns	p õː s
pōnēns	p oː n̪ ẽː s
pōnō	p oː n̪ oː
pōpuleus	p oː p ʊ l e ʊ s
pōpulētum	p oː p ʊ l eː t̪ ʊ̃ˑ
pōrus	p oː r ʊ s
pōtiō	p oː t̪ i oː
pōtiōnō	p oː t̪ i oː n̪ oː
pōtor	p oː t̪ ɔ r
pōtus	p oː t̪ ʊ s
pōtābilis	p oː t̪ aː b ɪ lʲ ɪ s
pōtātō	p oː t̪ aː t̪ oː
pōtēre	p oː t̪ eː r ɛ
pōtīna	p oː t̪ iː n̪ a
pōtō	p oː t̪ oː
pōtōrius	p oː t̪ oː r i ʊ s
pō̆lypus	p ɔ lʲ ʏ p ʊ s
pō̆lypus	p ɔː l i p u s
pūberulus	p uː b ɛ r ʊ ɫ̪ ʊ s
pūblica	p uː b lʲ ɪ k a
pūblica	p uː b lʲ ɪ k aː
pūblicitās	p uː b lʲ ɪ k ɪ t̪ aː s
pūblicus	p uː b lʲ ɪ k ʊ s
pūblicānus	p uː b lʲ ɪ k aː n̪ ʊ s
pūblicō	p uː b lʲ ɪ k oː
pūblilius	p uː b lʲ ɪ lʲ i ʊ s
pūblius	p uː b lʲ i ʊ s
pūblī	p uː b lʲ iː
pūblīpor	p uː b lʲ iː p ɔ r
pūgiunculus	p uː ɡ i ʊ ŋ k ʊ ɫ̪ ʊ s
pūgiō	p uː d͡ʒ i ɔ
pūgnātrīx	p u ɲ ɲ aː t̪ r i k s
pūgnātrīx	p uː ŋ n̪ aː t̪ r iː k s
pūlex	p uː l ɛ k s
pūlicārius	p uː lʲ ɪ k aː r i ʊ s
pūmex	p uː m ɛ k s
pūmilus	p uː m ɪ ɫ̪ ʊ s
pūncticollis	p uː ŋ k t̪ ɪ k ɔ l lʲ ɪ s
pūnctifrōns	p uː ŋ k t̪ ɪ f r õː s
pūnctigerus	p uː ŋ k t̪ ɪ ɡ ɛ r ʊ s
pūnctillum	p uː ŋ k t̪ ɪ l lʲ ʊ̃ˑ
pūnctim	p uː ŋ k t̪ ɪ̃ˑ
pūnctipennis	p uː ŋ k t̪ ɪ p ɛ n̪ n̪ ɪ s
pūnctiuncula	p uː ŋ k t̪ i ʊ ŋ k ʊ ɫ̪ a
pūnctiō	p u ŋ k t͡s i ɔ
pūnctiō	p uː ŋ k t̪ i oː
pūnctulum	p uː ŋ k t̪ ʊ ɫ̪ ʊ̃ˑ
pūnctulātus	p uː ŋ k t̪ ʊ ɫ̪ aː t̪ ʊ s
pūnctum	p ʊ ŋ k t̪ ʊ̃ˑ
pūnctuō	p uː ŋ k t̪ ʊ oː
pūnctātus	p uː ŋ k t̪ aː t̪ ʊ s
pūnctōrium	p uː ŋ k t̪ oː r i ʊ̃ˑ
pūnctūra	p uː ŋ k t̪ uː r a
pūnctūra	p uː ŋ k t̪ uː r aː
pūniceus	p uː n̪ ɪ k e ʊ s
pūnicus	p uː n̪ ɪ k ʊ s
pūniō	p uː n̪ i oː
pūnītis	p uː n̪ iː t̪ ɪ s
pūnītor	p uː n̪ iː t̪ ɔ r
pūnītīs	p uː n̪ iː t̪ iː s
pūnīverimus	p uː n̪ iː w ɛ r iː m ʊ s
pūnīverimus	p uː n̪ iː w ɛ r ɪ m ʊ s
pūnīveris	p uː n̪ iː w ɛ r iː s
pūnīveris	p uː n̪ iː w ɛ r ɪ s
pūnīveritis	p uː n̪ iː w ɛ r iː t̪ ɪ s
pūnīveritis	p uː n̪ iː w ɛ r ɪ t̪ ɪ s
pūpam	p uː p ãˑ
pūpe	p uː p ɛ
pūpilla	p uː p ɪ l lʲ a
pūpius	p uː p i ʊ s
pūpus	p uː p u s
pūpus	p uː p ʊ s
pūrgātīvus	p uː r ɡ aː t̪ iː w ʊ s
pūrgātōrius	p uː r ɡ aː t̪ oː r i ʊ s
pūribus	p uː r ɪ b ʊ s
pūrificō	p uː r ɪ f ɪ k oː
pūrulentus	p uː r ʊ l ɛ n̪ t̪ ʊ s
pūrus	p uː r ʊ s
pūsulātus	p uː s ʊ ɫ̪ aː t̪ ʊ s
pūsus	p uː s ʊ s
pūteō	p uː t̪ e oː
pūtide	p uː t̪ ɪ d̪ ɛ
pūtidior	p uː t̪ ɪ d̪ i ɔ r
pūtidissime	p uː t̪ ɪ d̪ ɪ s s ɪ m ɛ
pūtidissimus	p uː t̪ ɪ d̪ ɪ s s ɪ m ʊ s
pūtidissimē	p uː t̪ ɪ d̪ ɪ s s ɪ m eː
pūtidius	p uː t̪ ɪ d̪ i ʊ s
pūtidus	p uː t̪ ɪ d̪ ʊ s
pūtidē	p uː t̪ ɪ d̪ eː
pȳgargus	p yː ɡ a r ɡ ʊ s
pȳgidium	p yː ɡ ɪ d̪ i ʊ̃ˑ
pȳgidiālis	p yː ɡ ɪ d̪ i aː lʲ ɪ s
pȳramidālis	p yː r a m ɪ d̪ aː lʲ ɪ s
pȳramidātus	p yː r a m ɪ d̪ aː t̪ ʊ s
pȳramis	p yː r a m ɪ s
pȳramus	p yː r a m ʊ s
pȳrēnāicus	p yː r eː n̪ aː ɪ k ʊ s
pȳtheās	p yː t̪ʰ e aː s
pȳthia	p iː t̪ i a
pȳthia	p yː t̪ʰ i a
pȳthia	p yː t̪ʰ i aː
pȳthium	p iː t̪ i u m
pȳthium	p yː t̪ʰ i ʊ̃ˑ
pȳthius	p iː t̪ i u s
pȳthius	p yː t̪ʰ i ʊ s
pȳthon	p yː t̪ʰ ɔ n̪
pȳthopolis	p yː t̪ʰ ɔ p ɔ lʲ ɪ s
pȳthō	p iː t̪ ɔ
pȳthō	p yː t̪ʰ oː
pȳthōnicus	p yː t̪ʰ oː n̪ ɪ k ʊ s
quadra	kʷ a d̪ r a
quadrangulus	kʷ a d̪ r a ŋ ɡ ʊ ɫ̪ ʊ s
quadrangulāris	kʷ a d̪ r a ŋ ɡ ʊ ɫ̪ aː r ɪ s
quadrangulātus	kʷ a d̪ r a ŋ ɡ ʊ ɫ̪ aː t̪ ʊ s
quadrantālis	kʷ a d̪ r a n̪ t̪ aː lʲ ɪ s
quadrantārius	kʷ a d̪ r a n̪ t̪ aː r i ʊ s
quadriangulus	kʷ a d̪ r i a ŋ ɡ ʊ ɫ̪ ʊ s
quadricarīnātus	kʷ a d̪ r ɪ k a r iː n̪ aː t̪ ʊ s
quadricolor	kʷ a d̪ r ɪ k ɔ ɫ̪ ɔ r
quadricornis	kʷ a d̪ r ɪ k ɔ r n̪ ɪ s
quadridentātus	kʷ a d̪ r ɪ d̪ ɛ n̪ t̪ aː t̪ ʊ s
quadriduum	kʷ a d̪ r ɪ d̪ ʊ ʊ̃ˑ
quadriduānus	kʷ a d̪ r ɪ d̪ ʊ aː n̪ ʊ s
quadridēns	kʷ a d̪ r ɪ d̪ ẽː s
quadriennis	kʷ a d̪ r i ɛ n̪ n̪ ɪ s
quadrifidus	kʷ a d̪ r ɪ f ɪ d̪ ʊ s
quadrifluus	kʷ a d̪ r ɪ f ɫ̪ ʊ ʊ s
quadriflōrus	kʷ a d̪ r ɪ f ɫ̪ oː r ʊ s
quadrifolius	kʷ a d̪ r ɪ f ɔ lʲ i ʊ s
quadriforis	kʷ a d̪ r ɪ f ɔ r ɪ s
quadrifurcus	kʷ a d̪ r ɪ f ʊ r k ʊ s
quadrifārius	kʷ a d̪ r ɪ f aː r i ʊ s
quadrifīnālis	kʷ a d̪ r ɪ f iː n̪ aː lʲ ɪ s
quadrifōrmis	kʷ a d̪ r ɪ f oː r m ɪ s
quadrigamus	kʷ a d̪ r ɪ ɡ a m ʊ s
quadrigeminus	kʷ a d̪ r ɪ ɡ ɛ m ɪ n̪ ʊ s
quadrigōnus	kʷ a d̪ r ɪ ɡ oː n̪ ʊ s
quadriiugis	kʷ a d̪ r ɪ j j ʊ ɡ ɪ s
quadriiugus	kʷ a d̪ r ɪ j j ʊ ɡ ʊ s
quadriiugī	kʷ a d̪ r ɪ j j ʊ ɡ iː
quadrilaterus	k w a d̪ r i l aː t̪ ɛ r u s
quadrilaterus	kʷ a d̪ r ɪ ɫ̪ a t̪ ɛ r ʊ s
quadrilīneātus	kʷ a d̪ r ɪ lʲ iː n̪ e aː t̪ ʊ s
quadrimaculātus	kʷ a d̪ r ɪ m a k ʊ ɫ̪ aː t̪ ʊ s
quadringenta	kʷ a d̪ r ɪ ŋ ɡ ɛ n̪ t̪ a
quadringentae	kʷ a d̪ r ɪ ŋ ɡ ɛ n̪ t̪ a e̯
quadringentēsimus	kʷ a d̪ r ɪ ŋ ɡ ɛ n̪ t̪ eː s ɪ m ʊ s
quadringentī	kʷ a d̪ r ɪ ŋ ɡ ɛ n̪ t̪ iː
quadripartiō	kʷ a d̪ r ɪ p a r t̪ i oː
quadripartītiō	kʷ a d̪ r ɪ p a r t̪ iː t̪ i oː
quadripartītus	kʷ a d̪ r ɪ p a r t̪ iː t̪ ʊ s
quadripartītō	kʷ a d̪ r ɪ p a r t̪ iː t̪ oː
quadripūnctātus	kʷ a d̪ r ɪ p uː ŋ k t̪ aː t̪ ʊ s
quadrispīnōsus	kʷ a d̪ r ɪ s p iː n̪ oː s ʊ s
quadrisētus	kʷ a d̪ r ɪ s eː t̪ ʊ s
quadrivium	k w a d̪ r iː v i u m
quadrivium	kʷ a d̪ r ɪ w i ʊ̃ˑ
quadrum	kʷ a d̪ r ʊ̃ˑ
quadrupedāns	kʷ a d̪ r ʊ p ɛ d̪ ãː s
quadruplex	kʷ a d̪ r ʊ p l ɛ k s
quadruplicō	kʷ a d̪ r ʊ p lʲ ɪ k oː
quadruplus	kʷ a d̪ r ʊ p ɫ̪ ʊ s
quadruplō	kʷ a d̪ r ʊ p ɫ̪ oː
quadrupēs	kʷ a d̪ r ʊ p eː s
quadrus	kʷ a d̪ r ʊ s
quadrāgintā	k w a d̪ r a d͡ʒ i n̪ t̪ a
quadrāgintā	kʷ a d̪ r aː ɡ ɪ n̪ t̪ aː
quadrāgēnārius	kʷ a d̪ r aː ɡ eː n̪ aː r i ʊ s
quadrāgēsimus	kʷ a d̪ r aː ɡ eː s ɪ m ʊ s
quadrāle	kʷ a d̪ r aː l ɛ
quadrāns	kʷ a d̪ r ãː s
quadrātae	kʷ a d̪ r aː t̪ a e̯
quadrātica	kʷ a d̪ r aː t̪ ɪ k a
quadrātica	kʷ a d̪ r aː t̪ ɪ k aː
quadrāticae	kʷ a d̪ r aː t̪ ɪ k a e̯
quadrāticam	kʷ a d̪ r aː t̪ ɪ k ãˑ
quadrātice	kʷ a d̪ r aː t̪ ɪ k ɛ
quadrāticum	kʷ a d̪ r aː t̪ ɪ k ʊ̃ˑ
quadrāticus	kʷ a d̪ r aː t̪ ɪ k ʊ s
quadrāticārum	kʷ a d̪ r aː t̪ ɪ k aː r ʊ̃ˑ
quadrāticās	kʷ a d̪ r aː t̪ ɪ k aː s
quadrāticī	kʷ a d̪ r aː t̪ ɪ k iː
quadrāticīs	kʷ a d̪ r aː t̪ ɪ k iː s
quadrāticō	kʷ a d̪ r aː t̪ ɪ k oː
quadrāticōrum	kʷ a d̪ r aː t̪ ɪ k oː r ʊ̃ˑ
quadrāticōs	kʷ a d̪ r aː t̪ ɪ k oː s
quadrātor	kʷ a d̪ r aː t̪ ɔ r
quadrātum	kʷ a d̪ r aː t̪ ʊ̃ˑ
quadrātus	kʷ a d̪ r aː t̪ ʊ s
quadrātārius	kʷ a d̪ r aː t̪ aː r i ʊ s
quadrātē	kʷ a d̪ r aː t̪ eː
quadrātūra	kʷ a d̪ r aː t̪ uː r a
quadrī	kʷ a d̪ r iː
quadrīga	kʷ a d̪ r iː ɡ a
quadrīgae	kʷ a d̪ r iː ɡ a e̯
quadrīgula	kʷ a d̪ r iː ɡ ʊ ɫ̪ a
quadrīgulae	kʷ a d̪ r iː ɡ ʊ ɫ̪ a e̯
quadrīgālis	kʷ a d̪ r iː ɡ aː lʲ ɪ s
quadrīgārius	kʷ a d̪ r iː ɡ aː r i ʊ s
quadrīgātus	kʷ a d̪ r iː ɡ aː t̪ ʊ s
quadrō	kʷ a d̪ r oː
quaedam	kʷ a e̯ d̪ ãˑ
quaerere	kʷ a e̯ r eː r ɛ
quaerere	kʷ a e̯ r ɛ r ɛ
quaeritō	kʷ a e̯ r ɪ t̪ oː
quaerēns	kʷ a e̯ r ẽː s
quaerō	k w ɛː r ɔ
quaestiō	k w ɛ s t̪ i ɔ
quaestiō	kʷ a e̯ s t̪ i oː
quaestiōnārius	k w ɛ s t̪ i ɔ n aː r i u s
quaestiōnārius	kʷ a e̯ s t̪ i oː n̪ aː r i ʊ s
quaestor	k w ɛ s t̪ ɔ r
quaestor	kʷ a e̯ s t̪ ɔ r
quaestuōsus	kʷ a e̯ s t̪ ʊ oː s ʊ s
quaestōrius	kʷ a e̯ s t̪ oː r i ʊ s
quaetus	kʷ a e̯ t̪ ʊ s
quamdiū	kʷ a n̪ d̪ i uː
quamquam	kʷ a ŋ kʷ ãˑ
quandō	k w a n̪ d̪ ɔ
quandō	kʷ a n d o
quandō	kʷ a n̪ d̪ oː
quandōcumque	k w a n̪ d̪ ɔː k u ŋ k w ɛ
quandōcumque	kʷ a n̪ d̪ oː k ʊ ŋ kᶣ ɛ
quandōquidem	kʷ a n̪ d̪ oː kᶣ ɪ d̪ ɛ̃ˑ
quanquam	kʷ a ŋ kʷ ãˑ
quantillus	kʷ a n̪ t̪ ɪ l lʲ ʊ s
quantitātīvus	kʷ a n̪ t̪ ɪ t̪ aː t̪ iː w ʊ s
quantulus	kʷ a n̪ t̪ ʊ ɫ̪ ʊ s
quantum	kʷ a n̪ t̪ ʊ̃ˑ
quantumvīs	kʷ a n̪ t̪ ʊ m w iː s
quantus	kʷ a n̪ t̪ ʊ s
quantuscumque	k w a n̪ t̪ u s k u ŋ k w ɛ
quantuscumque	kʷ a n̪ t̪ ʊ s k ʊ ŋ kᶣ ɛ
quantuslibet	k w a n̪ t̪ u s l i b ɛ t̪
quantuslibet	kʷ a n̪ t̪ ʊ s lʲ ɪ b ɛ t̪
quantusvīs	kʷ a n̪ t̪ ʊ s w iː s
quartīnius	kʷ a r t̪ iː n̪ i ʊ s
quartīnus	kʷ a r t̪ iː n̪ ʊ s
quasi	k w aː z i
quasi	kʷ a s ɪ
quassus	kʷ a s s ʊ s
quassābilis	kʷ a s s aː b ɪ lʲ ɪ s
quassābundus	kʷ a s s aː b ʊ n̪ d̪ ʊ s
quassātiō	kʷ a s s aː t̪ i oː
quassātūra	kʷ a s s aː t̪ uː r a
quaternārius	kʷ a t̪ ɛ r n̪ aː r i ʊ s
quaternī	kʷ a t̪ ɛ r n̪ iː
quatiō	kʷ a t̪ i oː
quattuor	k w a t̪ t̪ u ɔ r
quattuor	kʷ a t̪ t̪ ʊ ɔ r
quattuordecim	k w a t̪ t̪ u ɔ r d̪ ɛ t͡ʃ i m
quattuordecim	kʷ a t̪ t̪ ʊ ɔ r d̪ ɛ k ɪ̃ˑ
quattuorvir	kʷ a t̪ t̪ ʊ ɔ r w ɪ r
quattuorvirālis	kʷ a t̪ t̪ ʊ ɔ r w ɪ r aː lʲ ɪ s
quattuorvirātus	kʷ a t̪ t̪ ʊ ɔ r w ɪ r aː t̪ ʊ s
quelea	kᶣ ɛ l e a
quem	kᶣ ɛ̃ˑ
quemadmodum	k w ɛ m a d̪ m ɔ d̪ u m
quemadmodum	kᶣ ɛ m a d̪ m ɔ d̪ ʊ̃ˑ
querceus	k w ɛ r t͡ʃ ɛ u s
querceus	kᶣ ɛ r k e ʊ s
quercicolus	kᶣ ɛ r k ɪ k ɔ ɫ̪ ʊ s
quercus	kᶣ ɛ r k ʊ s
quercēns	kᶣ ɛ r k ẽː s
quercēta	kᶣ ɛ r k eː t̪ a
quercētum	kᶣ ɛ r k eː t̪ ʊ̃ˑ
quercētī	kᶣ ɛ r k eː t̪ iː
quercētō	kᶣ ɛ r k eː t̪ oː
queribundus	kᶣ ɛ r ɪ b ʊ n̪ d̪ ʊ s
queror	kᶣ ɛ r ɔ r
querquedula	kᶣ ɛ r kᶣ ɛ d̪ ʊ ɫ̪ a
querquernī	kᶣ ɛ r kᶣ ɛ r n̪ iː
querquētula	kᶣ ɛ r kᶣ eː t̪ ʊ ɫ̪ a
querquētulānus	kᶣ ɛ r kᶣ eː t̪ ʊ ɫ̪ aː n̪ ʊ s
querquētum	kᶣ ɛ r kᶣ eː t̪ ʊ̃ˑ
querulus	kᶣ ɛ r ʊ ɫ̪ ʊ s
querulē	k w ɛː r u l ɛ
querulē	kᶣ ɛ r ʊ l eː
querulōsus	kᶣ ɛ r ʊ ɫ̪ oː s ʊ s
querēla	kᶣ ɛ r eː ɫ̪ a
queō	kᶣ e oː
quia	kᶣ i a
quianam	kᶣ i a n̪ ãˑ
quicquam	kᶣ ɪ k kʷ ãˑ
quicquid	kᶣ ɪ k kᶣ ɪ d̪
quid	kᶣ ɪ d̪
quidem	kᶣ ɪ d̪ ɛ̃ˑ
quietēnsis	kᶣ i ɛ t̪ ẽː s ɪ s
quindiuēnsis	kᶣ ɪ n̪ d̪ i ʊ ẽː s ɪ s
quippiam	kᶣ ɪ p p i ãˑ
quirquir	kᶣ ɪ r kᶣ ɪ r
quirrītō	kᶣ ɪ r r iː t̪ oː
quirīnius	kᶣ ɪ r iː n̪ i ʊ s
quirīnus	k w i r iː n u s
quirīnus	kᶣ ɪ r iː n̪ ʊ s
quirīnālia	k w i r i n aː l i a
quirīnālia	kᶣ ɪ r iː n̪ aː lʲ i a
quirīnālis	k w i r i n aː l i s
quirīnālis	kᶣ ɪ r iː n̪ aː lʲ ɪ s
quirītō	kᶣ ɪ r iː t̪ oː
quis	kᶣ ɪ s
quisnam	kᶣ ɪ s n̪ ãˑ
quisquam	kᶣ ɪ s kʷ ãˑ
quisque	k w i s k w ɛ
quisque	kᶣ ɪ s kᶣ ɛ
quisquilia	kᶣ ɪ s kᶣ ɪ lʲ i a
quisquis	kᶣ ɪ s kᶣ ɪ s
quitēnsis	kᶣ ɪ t̪ ẽː s ɪ s
quitūrus	kᶣ ɪ t̪ uː r ʊ s
quiēs	kᶣ i eː s
quiēscō	k w i ɛ s k ɔ
quiēscō	kᶣ i eː s k oː
quiētor	kᶣ i eː t̪ ɔ r
quiētus	kᶣ i eː t̪ ʊ s
quiētō	kᶣ i eː t̪ oː
quiētūdō	kᶣ i eː t̪ uː d̪ oː
quiēvī	kᶣ i eː w iː
quod	k w ɔ d̪
quod	kʷ ɔ d̪
quodsī	kʷ ɔ t̪ s iː
quondam	kʷ ɔ n̪ d̪ ãˑ
quoniam	kʷ ɔ n̪ i ãˑ
quoque	kʷ oː kᶣ ɛ
quoque	kʷ ɔ kᶣ ɛ
quosenum	kʷ ɔ s ɛ n̪ ʊ̃ˑ
quot	kʷ ɔ t̪
quotiēnscumque	k w ɔ t͡s i ɛ n s k u m k w ɛ
quotiēnscumque	kʷ ɔ t̪ i ẽː s k ʊ m kᶣ ɛ
quotus	kʷ ɔ t̪ ʊ s
quotīdiāne	kʷ ɔ t̪ iː d̪ i aː n̪ ɛ
quotīdiānus	kʷ ɔ t̪ iː d̪ i aː n̪ ʊ s
quotīdiānās	kʷ ɔ t̪ iː d̪ i aː n̪ aː s
quotīdiānī	kʷ ɔ t̪ iː d̪ i aː n̪ iː
quotīdiānō	kʷ ɔ t̪ iː d̪ i aː n̪ oː
quotīdiānōs	kʷ ɔ t̪ iː d̪ i aː n̪ oː s
quousque	k w ɔ u s k w ɛ
quousque	kʷ ɔ ʊ s kᶣ ɛ
quum	kʷ ʊ̃ˑ
quādī	kʷ aː d̪ iː
quālificō	kʷ aː lʲ ɪ f ɪ k oː
quālis	kʷ aː lʲ ɪ s
quārtadecimānī	kʷ aː r t̪ a d̪ ɛ k ɪ m aː n̪ iː
quārtus	k w a r t̪ u s
quārtus	kʷ aː r t̪ ʊ s
quārtusdecimus	k w a r t̪ u s d̪ ɛː t͡ʃ i m u s
quārtusdecimus	kʷ aː r t̪ ʊ s d̪ ɛ k ɪ m ʊ s
quārtāle	kʷ aː r t̪ aː l ɛ
quārtālis	k w a r t̪ aː l i s
quārtālis	kʷ aː r t̪ aː lʲ ɪ s
quārtālī	kʷ aː r t̪ aː lʲ iː
quārtānus	kʷ aː r t̪ aː n̪ ʊ s
quārum	kʷ aː r ʊ̃ˑ
quārē	k w aː r ɛ
quātenus	kʷ aː t̪ ɛ n̪ ʊ s
quīcum	kᶣ iː k ʊ̃ˑ
quīcumque	kᶣ iː k ʊ ŋ kᶣ ɛ
quīcunque	kᶣ iː k ʊ ŋ kᶣ ɛ
quīdam	kᶣ iː d̪ ãˑ
quīn	kᶣ iː n̪
quīnctius	kᶣ iː ŋ k t̪ i ʊ s
quīnctīlius	kᶣ iː ŋ k t̪ iː lʲ i ʊ s
quīncū̆nx	kᶣ iː ŋ k uː ŋ k s
quīncū̆nx	kᶣ iː ŋ k ʊ ŋ k s
quīndecim	k w i n̪ d̪ ɛ t͡ʃ i m
quīndecim	kᶣ iː n̪ d̪ ɛ k ɪ̃ˑ
quīndecimvir	kᶣ iː n̪ d̪ ɛ k ɪ m w ɪ r
quīndecimvirālis	kᶣ iː n̪ d̪ ɛ k ɪ m w ɪ r aː lʲ ɪ s
quīndecimvirātus	kᶣ iː n̪ d̪ ɛ k ɪ m w ɪ r aː t̪ ʊ s
quīngenta	kᶣ iː ŋ ɡ ɛ n̪ t̪ a
quīngentae	kᶣ iː ŋ ɡ ɛ n̪ t̪ a e̯
quīngentēsimus	k w i n̠ʲ d͡ʒ ɛ n̪ t̪ ɛː z i m u s
quīngentēsimus	kᶣ iː ŋ ɡ ɛ n̪ t̪ eː s ɪ m ʊ s
quīngentī	k w i n̠ʲ d͡ʒ ɛ n̪ t̪ i
quīngentī	kᶣ iː ŋ ɡ ɛ n̪ t̪ iː
quīnquangulus	kᶣ iː ŋ kʷ a ŋ ɡ ʊ ɫ̪ ʊ s
quīnque	k w i ŋ k w ɛ
quīnque	kᶣ iː ŋ kᶣ ɛ
quīnquefasciātus	kᶣ iː ŋ kᶣ ɛ f a s k i aː t̪ ʊ s
quīnquefolius	kᶣ iː ŋ kᶣ ɛ f ɔ lʲ i ʊ s
quīnquennis	k w i ŋ k w ɛ n n i s
quīnquennis	kʷ i n kʷ ɛ n n e s
quīnquennis	kᶣ iː ŋ kᶣ ɛ n̪ n̪ ɪ s
quīnquennium	kᶣ iː ŋ kᶣ ɛ n̪ n̪ i ʊ̃ˑ
quīnquennālis	kᶣ iː ŋ kᶣ ɛ n̪ n̪ aː lʲ ɪ s
quīnquepartītus	kᶣ iː ŋ kᶣ ɛ p a r t̪ iː t̪ ʊ s
quīnquepertītus	kᶣ iː ŋ kᶣ ɛ p ɛ r t̪ iː t̪ ʊ s
quīnquevir	kᶣ iː ŋ kᶣ ɛ w ɪ r
quīnquevirālis	kᶣ iː ŋ kᶣ ɛ w ɪ r aː lʲ ɪ s
quīnquevirātus	kᶣ iː ŋ kᶣ ɛ w ɪ r aː t̪ ʊ s
quīnquiplex	kᶣ iː ŋ kᶣ ɪ p l ɛ k s
quīnquiplicō	kᶣ iː ŋ kᶣ ɪ p lʲ ɪ k oː
quīnquiēs	kᶣ iː ŋ kᶣ i eː s
quīnquāgintā	k w i ŋ k w a d͡ʒ i n̪ t̪ a
quīnquāgintā	kᶣ iː ŋ kʷ aː ɡ ɪ n̪ t̪ aː
quīnquāgēnsimus	kᶣ iː ŋ kʷ aː ɡ ẽː s ɪ m ʊ s
quīnquāgēnārius	kᶣ iː ŋ kʷ aː ɡ eː n̪ aː r i ʊ s
quīnquāgēsimus	kᶣ iː ŋ kʷ aː ɡ eː s ɪ m ʊ s
quīnquātrūs	kᶣ iː ŋ kʷ aː t̪ r uː s
quīntipor	kᶣ iː n̪ t̪ ɪ p ɔ r
quīntus	k w i n̪ t̪ u s
quīntus	kᶣ iː n̪ t̪ ʊ s
quīntusdecimus	k w i n̪ t̪ u s d̪ ɛː t͡ʃ i m u s
quīntusdecimus	kᶣ iː n̪ t̪ ʊ s d̪ ɛ k ɪ m ʊ s
quīntīlis	kᶣ iː n̪ t̪ iː lʲ ɪ s
quīntīnus	kᶣ iː n̪ t̪ iː n̪ ʊ s
quīntīnō	kᶣ iː n̪ t̪ iː n̪ oː
quīnārius	kᶣ iː n̪ aː r i ʊ s
quīnātus	kᶣ iː n̪ aː t̪ ʊ s
quīnī	kᶣ iː n̪ iː
quīppe	kᶣ iː p p ɛ
quōcircā	kʷ oː k ɪ r k aː
quōminus	kʷ oː m ɪ n̪ ʊ s
quōmodo	k w ɔː m ɔ d̪ ɔ
quōmodo	kʷ oː m ɔ d̪ ɔ
quōquam	kʷ oː kʷ ãˑ
quōque	k w ɔː k w ɛ
quōque	kʷ oː kᶣ ɛ
quōrum	kʷ oː r ʊ̃ˑ
rabbonī	r a b b ɔ n̪ iː
rabidus	r a b ɪ d̪ ʊ s
rabiōsulus	r a b i oː s ʊ ɫ̪ ʊ s
rabiōsus	r a b i oː s ʊ s
rabocentus	r a b ɔ k ɛ n̪ t̪ ʊ s
rabulēius	r a b ʊ l eː j ʊ s
rabīrius	r a b iː r i ʊ s
racēmifer	r a k eː m ɪ f ɛ r
racēmor	r a k eː m ɔ r
racēmus	r a k eː m ʊ s
racēmārius	r a k eː m aː r i ʊ s
racēmātus	r a k eː m aː t̪ ʊ s
racēmōsus	r a k eː m oː s ʊ s
racīlius	r a k iː lʲ i ʊ s
racōviam	r a k oː w i ãˑ
radagaisus	r a d̪ a ɡ a ɪ s ʊ s
radiophōnum	r a d̪ i ɔ pʰ oː n̪ ʊ̃ˑ
radium	r a d̪ i ʊ̃ˑ
radium	r aː d̪ i u m
radius	r a d̪ i ʊ s
radiātilis	r a d̪ i aː t̪ ɪ lʲ ɪ s
radiātiō	r a d̪ i aː t̪ i oː
