ی	eː
ی	iː
ی	j
ی	j e
ء	ʔ
ا	ɒː l e f
را	a
آب	a w
دی	d e j
دژ	d e ʒ
دژ	d o ʒ
در	d æ
جم	d͡ʒ æ m
هم	h æ m
هر	h æ ɾ
ها	h ɒː
ها	h ɔː
ـی	iː
یک	j e
یک	j e k
یک	j e kʲ
که	kʲ e
که	kʰ o h
کس	kʰ o s
که	kʲ æ h
کم	kʲ æ m
کس	kʲ æ s
می	m e
مغ	m o ɣ
من	m æ
نه	n eː
نه	n oː
نه	n æ
نم	n æ m
نه	n æ ʔ
را	o
پس	pʰ æ s
پر	pʰ æ ɾ
پا	pʰ ɒː
رگ	r æ ɡ
سد	s æ dː
تر	t æ ɾ
چر	t ʃ e ɾ
چه	t ʃʰ e
چم	t ʃʰ e m
چم	t ʃʰ æ m
چش	t͡ʃ e ʃ
چش	t͡ʃ æ ʃ
چی	t͡ʃʰ iː
وش	v æ ʃ
خو	x o ʊ
خو	x æ v
ضد	z e d̪
هم	æ m
را	ɾ a
شب	ʃ a w
ژی	ʒ eː
ژی	ʒ iː
را	ɾ o
گل	ɡ o l
قم	ɢ o m
قو	ɢ uː
غم	ɢ æ m
عن	ʔ æ n
ها	ɒː
گل	ɡʲ e l
گچ	ɡʲ æ t͡ʃ
آذر	aː ð a ɾ
بزه	b e z eʰ
برش	b o ɾ e ʃ
بور	b oː ɾ
بود	b uː d̪
بوم	b uː m
بور	b uː ɾ
بدن	b æ d æ n
بحث	b æ h s
بله	b æ l e
برگ	b æ ɾ ɡ
برگ	b æː ɾ ɡ
ببا	b ʏ b ɒː
دلم	d o l o m
دوش	d uː ʃ
دست	d æ s tʰ
دقه	d æ ɣ e
جدا	d ʒ e d̪ d̪ æ n
جگر	d ʒ e ɡʲ æ ɾ
جدا	d ʒ i d̪ d̪ æ n
جیب	d ʒ iː b
جفت	d ʒ o f t̪ʰ
جنگ	d ʒ æ ŋ ɡ
جگر	d ʒ ɪ ɡʲ æ ɾ
دهن	d̪ æ h æ n
دری	d̪ æ ɾ iː
جغه	d͡ʒ e ɣ ɣ e
جقه	d͡ʒ e ɣ ɣ e
جثه	d͡ʒ o s s e
جغد	d͡ʒ o ɣ d̪
جمع	d͡ʒ æː m ʔ
فهم	f æ h m
فتح	f æ t̪ h
فرض	f æ ɾ z
فقر	f æ ɣ ɾ
فهم	f æː h m
فرض	f æː ɾ z
فقر	f æː ɣ ɾ
حیف	h e i̯ f
هلن	h e l e n
حرف	h e ɾ æ f
هتل	h o t̪ʰ e l
هفت	h æ f t̪
حیف	h æ i̯ f
هست	h æ s t̪ʰ
حتی	h æ t̪ʰː ɒː
هوا	h æ v ɒː
هفت	h æː f t̪
هلو	h ʊ l uː
یهو	j e h o
یکا	j e kʰ ɒː
یوغ	j uː ɣ
یمن	j æ m æ n
یتا	j æ t ɒː
یزد	j æ z d
یزد	j æː z d
کیک	k e ɪ̯ k
کیک	k eː k
کمی	k æ m i
کیف	kʲ e j f
کیف	kʲ i j e f
کیف	kʲ iː f
کیف	kʲ iː j e f
کین	kʲ iː n
کدم	kʰ o d̪ o m
کمک	kʰ o m æ kʲ
کون	kʰ o n
کنش	kʰ o n e ʃ
کرک	kʰ o ɾ k
کول	kʰ oː l
کول	kʰ uː l
کون	kʰ uː n
کور	kʰ uː ɾ
کفش	kʲ æ f ʃ
ککه	kʲ æ kʲ æ
کنه	kʲ æ n e
کرک	kʲ æ ɾ k
کرک	kʲ æ ɾ æ k
کاج	kʰ ɒː d͡ʒ
کاک	kʰ ɒː kʰ
کام	kʰ ɒː m
لاف	l ɒː f
لاغ	l ɒː ɣ
مثل	m e s e
مثل	m e s l
مثل	m e s l e
مصر	m e s ɾ
متر	m e t̪ ɾ
مژه	m e ʒ æ
میغ	m iː ɣ
موز	m o u z
مژه	m o ʒ e
موز	m oː z
مجد	m æ dː ʒ e d
مکه	m æ k kʲ e
ممد	m æ m m æ d̪
مرا	m æ n o
منو	m æ n o
مثل	m æ s æ l
مچد	m æ t s t s e d
مچد	m æ t ʃ t ʃ e d
موز	m æ u z
مگس	m æ ɡ æ s
مرگ	m æ ɾ ɡ
مرا	m æ ɾ ɒː
مگر	m æ ɡʲ e
مگر	m æ ɡʲ æ ɾ
منع	m æː n
مجد	m æː ʒ d
ماچ	m ɒ t͡ʃʰ
مار	m ɒː ɾ
نیم	n eː m
نیا	n i j ɒː
نیم	n iː m
نیز	n iː z
نوچ	n o t͡ʃ
نوم	n o u̯ m
نون	n u n
نون	n uː n
نوچ	n uː t͡ʃ
نفس	n æ f s
نفت	n æ f t
نفس	n æ f æ s
نسل	n æ s l
نسخ	n æ s x
نود	n æ v æ d̪
نری	n æ ɾ iː
نغز	n æ ɣ z
نفس	n æː f s
نسل	n æː s l
نسخ	n æː s x
نغز	n æː ɣ z
ناک	n ɒː k
ناو	n ɒː v
پشک	p e ʃ æ
پشک	p e ʃ æ k
پشک	p ʊ ʃ æ k
پدر	pʰ e d̪ æ ɾ
پکن	pʰ e kʲ æ n
پسر	pʰ e s æ ɾ
پیر	pʰ iː ɾ
پلو	pʰ o l o
پلو	pʰ o l o ʊ̯
پسر	pʰ o s æ ɾ
پوچ	pʰ uː t͡ʃ
پلو	pʰ æ l æ ʊ̯
پنج	pʰ æ̃ d͡ʒ
پلو	pʰ ʊ l æ ʊ̯
پای	pʰ ɒː j
قلا	q e l ɒː
قلا	q æ l ɒː
قلا	q ɛ l ɒː
رژه	r e ʒ e
ریش	r iː ʃ
رزا	r o z ɑː
رزا	r o z ɒː
رده	r æ d̪ e
رمه	r æ m e
رمق	r æ m æ ɢ
رژه	r æ ʒ e
رعد	r æː d
راک	r ɒ k
ران	r ɒ n
راس	r ɒ s
راک	r ɒː k
ران	r ɒː n
صدا	s e d ɒː
سمج	s e m e d͡ʒ
سپر	s e pʰ æ ɾ
سفی	s f iː
سیخ	s iː x
سیر	s iː ɾ
سنت	s o nː æ t̪ʰ
سوز	s o w z
صدا	s æ d ɒː
سده	s æ d̪ e
سفر	s æ f æ ɾ
سطر	s æ t ɾ
سخت	s æ x t̪ʰ
صعب	s æ ʔ b
سرد	s æ ɾ d
سرک	s æ ɾ æ kʰ
صرع	s æ ɾ ʔ
صعب	s æː b
سرد	s æː ɾ d
صرع	s æː ɾ ʔ
طیف	t e i̯ f
تکه	t e k k e
تند	t o n d
تخس	t o x s
توژ	t uː ʒ
تشی	t æ ʃ iː
طعم	t æ ʔ m
طعم	t æː m
چوغ	t ʃ uː ɣ
چلو	t ʃʰ e l o
چلو	t ʃʰ e l o ʊ̯
چیز	t ʃʰ iː z
چلو	t ʃʰ æ l æ ʊ̯
چمن	t ʃʰ æ m æ n
چند	t ʃʰ æ n d̪
تیر	tʰ iː ɾ
تمب	tʰ o m b
تشک	tʰ o ʃ æ k
تپه	tʰ æ p pʰ e
تسو	t̪ æ s u
طاس	tʰ ɒː s
تار	tʰ ɒː ɾ
چین	t͡ʃ i n
چین	t͡ʃ iː n
ترک	t̪ʰ o ɾ k
تخم	t̪ʰ o χ m
چرک	t͡ʃ o ɾ æ k
ترف	t̪ʰ æ ɾ f
تاب	t̪ʰ ɒː b
چاد	t͡ʃ ɒː d
چرت	t͡ʃʰ e ɾ t
چرا	t͡ʃʰ e ɾ ɒː
چشا	t͡ʃʰ e ʃ ɒː
چرت	t͡ʃʰ o ɾ t
چکش	t͡ʃʰ æ k kʰ o ʃ
چپت	t͡ʃʰ æ pʰ æ tʰ
چپر	t͡ʃʰ æ pʰ æ ɾ
چرت	t͡ʃʰ æ ɾ t
چرخ	t͡ʃʰ æ ɾ x
چرخ	t͡ʃʰ æː ɾ x
وین	v i j æ n
وفا	v æ f ɒː
وقت	v æ x
وقت	v æ x tʰ
وقت	v æ x t̪ʰ
وضع	v æ z ʔ
وغا	v æ ɣ ɒː
وضع	v æː z
واس	v ɒ s e
واس	v ɒ sː e
واش	v ɒː ʃ
وقت	w æ q t
خوی	x e j
خرس	x e ɾ s
خشم	x i ʃ m
خین	x iː n
خوی	x o j
خنک	x o n æ kʲ
خود	x oː d
خود	x oː ð
خوب	x uː b
خود	x uː d̪
خون	x uː n
خشم	x æ ʃ m
زدن	z e d̪ e n
ذکر	z e kʰ ɾ
ضلع	z e l
ضلع	z e l ʔ
ضلع	z eː l
زیگ	z iː ɡ
زود	z uː d
ضبط	z æ b t
زدن	z æ d̪ æ n
ظفر	z æ f æ ɾ
ذکر	z æ kʲ æ ɾ
عکس	æ k s
اما	æ mː ɒː
اشک	æ ʃ kʲ
اگر	æ ɡʲ e
اگه	æ ɡʲ e
اگر	æ ɡʲ æ ɾ
عید	ʔ e i̯ d
شکم	ʃ e kʲ æ m
ژله	ʒ e l e
اسم	ʔ e s m
ژست	ʒ e s t̪
این	ʔ i n
عید	ʔ iː d
شما	ʃ o m ɒː
اون	ʔ o n
شتر	ʃ o tʰ o ɾ
قطر	ɢ o t̪ ɾ
قول	ɢ o u̯ l
گرج	ɡ o ɾ d͡ʒ
قرص	ɢ o ɾ s
گوز	ɡ o ʊ z
گرگ	ɡ o ɾ ɡ
قطر	ɢ oː t̪ ɾ
گوز	ɡ oː z
رود	ɾ uː d̪
قوی	ɢ uː j e
غوک	ɢ uː k
غوز	ɢ uː z
قوش	ɢ uː ʃ
ابد	ʔ æ b æ d̪
ابر	ʔ æ b ɾ
قبا	ɢ æ b ɒː
عدس	ʔ æ d̪ æ s
شهر	ʃ æ h ɾ
علی	ʔ æ l iː
غلط	ɢ æ l æ t̪ʰ
امر	ʔ æ m r
عمل	ʔ æ m æ l
قند	ɢ æ n d
غنا	ɢ æ n ɒː
قصد	ɢ æ s t̪
عصر	ʔ æ s ɾ
قطر	ɢ æ t̪ʰ æ ɾ
قوی	ɢ æ v iː
عزر	ʔ æ z r
غزل	ɢ æ z æ l
غرب	ɢ æ ɾ b
قرن	ɢ æ ɾ n
گوز	ɡ æ ʊ z
ابر	ʔ æː b ɾ
شهر	ʃ æː h ɾ
شمع	ʃ æː m
امر	ʔ æː m r
عصر	ʔ æː s ɾ
شرع	ʃ æː ɾ ʔ
غرق	ɢ æː ɾ ɣ
شما	ʃ ʊ m ɒː
اون	ʔ ʊ n
شاد	ʃ ɒː d̪
عاج	ʔ ɒː d͡ʒ
آوا	ʔ ɒː v ɒː
غار	ɢ ɒː ɾ
آرش	ʔ ɒː ɾ æ ʃ
آبی	ɒː b iː
گرم	ɡʲ e ɾ æ m
گرا	ɡʲ e ɾ ɒː
آلش	ɒː l æ ʃ
گور	ɡʲ æ v ɾ
گور	ɡʲ æ w ɾ
گرم	ɡʲ æː ɾ m
آره	ɑː ɾ e
آشوب	aː ʃ oː b
بیضه	b e i̯ z e
بیرق	b e i̯ ɾ æ ɣ
بلیت	b e l iː t
بنین	b e n iː n
برنج	b e ɾ e n d͡ʒ
برنج	b e ɾ ɪ n d͡ʒ
بینش	b iː n e ʃ
بلور	b o l uː ɾ
بلند	b o l æ n d̪
بزرگ	b o z o ɾ ɡ
بزرگ	b o z u ɾ ɡ
بشکه	b o ʃ kʲ e
بودن	b u d æ n
بودن	b uː d̪ æ n
بومی	b uː m iː
بوته	b uː tʰ e
بیضه	b æ i̯ z e
بیرق	b æ i̯ ɾ æ q
بلال	b æ l ɒː l
بستن	b æ s tʰ æ n
بخشش	b æ x ʃ e ʃ
برنج	b æ ɾ e n d͡ʒ
برفی	b æ ɾ f iː
بعضی	b æ ʔ z iː
برای	b æ ɾ ɒː j e
بلیت	b ɪ l iː t
بالا	b ɒː l ɒː
باور	b ɒː v æ ɾ
بازو	b ɒː z uː
بانگ	b ɒː ŋ ɡ
دهلی	d e h l i
دژها	d e ʒ h ɒː
دریا	d e ɾ j ɒː
دژها	d e ʒ ɒː
دخدر	d o x d e ɾ
دشمن	d o ʃ m æ n
درست	d o ɾ o s t
دفعه	d æ f ʔ e
دلیل	d æ l iː l
دعوت	d æ ʔ v æ t
دعوت	d æː v æ t
جنسی	d ʒ e n s iː
جیجه	d ʒ iː d ʒ e
جنبش	d ʒ o n b e ʃ
جنوب	d ʒ o n uː b
جوزف	d ʒ o z e f
جوغن	d ʒ u ɣ æ n
جهاد	d ʒ æ h ɒː d
جنوب	d ʒ æ n uː b
جالب	d ʒ ɒː l e b
دادا	d ɒː d ɒː
دماغ	d̪ i m ɒː ɣ
دیزی	d̪ iː z iː
دویی	d̪ o iː
دهان	d̪ æ h æ n
دهان	d̪ æ h ɒː n
دمشق	d̪ æ m e ʃ ɣ
دژند	d̪ æ ʒ æ n d̪
دادن	d̪ ɒː d̪ æ n
جلوه	d͡ʒ e l v e
جودو	d͡ʒ o d̪ o
جمله	d͡ʒ o m l e
جوجه	d͡ʒ uː d͡ʒ e
جهان	d͡ʒ æ h ɑ n
جلاد	d͡ʒ æ lː ɑː d
جمال	d͡ʒ æ m ɒː l
جعفر	d͡ʒ æ ʔ f æ r
جعفر	d͡ʒ æː f æ r
جهود	d͡ʒ ʊ h uː d
جابر	d͡ʒ ɒː b e ɾ
جاده	d͡ʒ ɒː d̪ d̪ e
جاده	d͡ʒ ɒː d̪ e
جاهل	d͡ʒ ɒː h e l
اغوا	e ɣ v ɒː
عقاب	e ɣ ɒː b
فلفل	f e l f e l
فلان	f e l ɒ n
فلان	f o l ɒ n
فساق	f o s ɒː ɣ
فرصت	f o ɾ s æ t̪
فدات	f æ d̪ ɒː t̪
فندق	f æ n d o ɣ
فندک	f æ n d̪ æ kʲ
فصیح	f æ s iː h
فرید	f æ ɾ iː d
فقیر	f æ ɣ iː ɾ
فرنگ	f æ ɾ æ ŋ ɡ
فاسق	f ɒː s e ɣ
همان	h a m uː
هیکل	h e i̯ kʲ æ l
هفده	h e v d æʰ
هشتن	h e ʃ t æ n
هیور	h eː w æ ɾ
هجده	h i ʒ d æ
هفده	h iː v d æʰ
هیره	h iː ɾ e
حجتی	h o d͡ʒː æ tʰ iː
حسین	h o s e i̯ n
هرمز	h o ɾ m o z
حقوق	h o ɣ u ɢ
حقوق	h oː ɢ
هومن	h uː m æ n
حمید	h æ m iː d
همان	h æ m u n
همان	h æ m ɒː n
حماس	h æ m ɒː s
هنوز	h æ n u
هنوز	h æ n u z
هنوز	h æ n uː
هستی	h æ s tʰ iː
حشفه	h æ ʃ f e
حشیش	h æ ʃ iː ʃ
هرزه	h æ ɾ z e
هرزه	h æ ɾ z æ
حشره	h æ ʃ æ ɾ e
حشره	h æ ʃ ɾ e
هرگز	h æ ɾ ɡʲ e z
حاکم	h ɒː kʲ e m
حالی	h ɒː l eː
حامد	h ɒː m e d
یهود	j æ h uː d̪
یلدا	j æ l d ɒ
یلدا	j æ l d ɒː
یعنی	j æ n i
یتیم	j æ tʰ iː m
یعنی	j æ ʔ n iː
یعنی	j æː n iː
کنیا	k e n j ɒː
کنده	k o n d e
کنده	k æ n d e
کنگر	k æ ŋ ɡʲ æ ɾ
کردن	kʰ a d̪ a n
کلید	kʲ e l iː d̪
کردن	kʲ e ɾ d æ n
کرند	kʰ e ɾ e n d
کشمش	kʲ e ʃ m e ʃ
کشتی	kʲ e ʃ t̪ʰ iː
کشور	kʲ e ʃ v æ ɾ
کینه	kʲ iː n e
کیسه	kʲ iː s e
کشمش	kʲ iː ʃ m iː ʃ
کشتی	kʲ iː ʃ t̪ʰ iː
کدام	kʰ o d̪ ɒː m
کلنگ	kʰ o l æ ŋ ɡ
کمیل	kʰ o m e i̯ l
کولی	kʰ o u̯ l iː
کردی	kʰ o ɾ d̪ iː
کشتی	kʰ o ʃ t̪ʰ iː
کرند	kʰ o ɾ æ n d
کودک	kʰ uː d̪ æ kʲ
کونی	kʰ uː n iː
کوسه	kʰ uː s e
کوچک	kʰ uː t ʃʰ e kʲ
کوچک	kʰ uː t ʃʰ æ kʲ
کوچه	kʰ uː t͡ʃʰ e
کورم	kʰ uː ɾ æ m
کبود	kʲ æ b uː d
کفاش	kʲ æ f f ɒː ʃ
کفتر	kʲ æ f tʰ æ ɾ
کمتر	kʲ æ m t̪ʰ æ ɾ
کمند	kʲ æ m æ n d
کمان	kʲ æ m ɒ n
کمال	kʲ æ m ɒː l
کمان	kʲ æ m ɒː n
کندن	kʲ æ n d æ n
کثیف	kʲ æ s iː f
کویر	kʲ æ v iː ɾ
کردن	kʲ æ ɾ d æ n
کژدم	kʲ æ ʒ d̪ o m
کرکس	kʲ æ ɾ kʲ æ s
کشتی	kʲ æ ʃ t̪ʰ iː
کرفس	kʲ æ ɾ æ f s
کژال	kʲ æ ʒ ɒ l
کدام	kʰ ʊ d̪ u m
کامی	kʰ ɒ m iː
کاهو	kʰ ɒː h uː
کالا	kʰ ɒː l ɒː
کامل	kʰ ɒː m e l
کاسه	kʰ ɒː s e
کاوه	kʰ ɒː v e
کاذب	kʰ ɒː z e b
کاظم	kʰ ɒː z e m
لباس	l e b ɒː s
لفاف	l e f ɒː f
لیلا	l e j l ɒː
لگام	l e ɡ ɒː m
لیبی	l iː b iː
لوخن	l uː x æ n
لحظه	l æ h z e
لحظه	l æ h z æ
لندن	l æ n d̪ æ n
لطیف	l æ tʰ iː f
لوید	l æ v iː d
لوید	l æ w eː d
لذیذ	l æ z iː z
لشکر	l æ ʃ kʲ æ ɾ
مهدی	m e h d̪ iː
مرسی	m e ɾ s iː
مهدی	m eː d̪ iː
مهدی	m eː t̪ iː
محال	m o h ɑː l
مندن	m o n d æ n
منشی	m o n ʃ iː
مثبت	m o s b æ t̪ʰ
مسکو	m o s kʰ o
متون	m o t̪ʰ uː n
مخمر	m o x a m m e ɾ
مرده	m o ɾ d e
مقیم	m o ɣ i m
مقیم	m o ɣ iː m
مشکل	m o ʃ kʲ e l
مؤمن	m o ʔ m e n
مروت	m o ɾ o vː æ tʰ
مردد	m o ɾ æ d̪ d̪ æ d̪
مؤمن	m oː m e n
موفق	m u v a f f a k
مبنا	m æ b n ɒː
مجلس	m æ d͡ʒ l e s
مهدی	m æ h d̪ iː
مهسا	m æ h s ɒː
مکتب	m æ k tʰ æ b
مکان	m æ kʰ ɒ n
ملکه	m æ l e k e
ملکه	m æ l æ k e
منبع	m æ m b æ ʔ
منزل	m æ n z e l
مسکه	m æ s kʲ e
مسکه	m æ s kʲ æ
مصون	m æ s uː n
مطلع	m æ t̪ l æ ʔ
مذهب	m æ z h æ b
مشهد	m æ ʃ h æ d̪
مریض	m æ ɾ iː z
مرکز	m æ ɾ kʲ æ z
مغرب	m æ ɢ r e b
مقطع	m æ ɣ t̪ʰ æ ʔ
مغاک	m æ ɣ ɒː kʲ
مایه	m ɒː j e
مالی	m ɒː l iː
مانی	m ɒː n iː
نشان	n e ʃ ɒ n
نژاد	n e ʒ ɒː d̪
نگاه	n e ɡ ɒː h
نیست	n eː s
نیزه	n eː z æ
نیجر	n iː d͡ʒ e ɾ
نیرو	n iː ɾ uː
نگاه	n iː ɡ ɒː
نوکر	n o k æ ɾ
نخست	n o x o s t
نقطه	n o x t̪ʰ e
نوبت	n o ʊ b æ t̪ʰ
نوکر	n o ʊ k æ ɾ
نروژ	n o ɾ v e ʒ
نبید	n æ b iː d
نبید	n æ b iː ð
نجفی	n æ d͡ʒ æ f iː
نهنگ	n æ h æ ŋ ɡ
نهان	n æ h ɒ n
نهاد	n æ h ɒː d̪
نصیب	n æ s iː b
نسیم	n æ s iː m
نوید	n æ v iː d
نخیر	n æ x e j ɾ
نخود	n æ x o d̪
نخست	n æ x o s t
نخود	n æ x oː d̪
نخیر	n æ χ æ j ɾ
نرگس	n æ ɾ ɡʲ e s
نشئه	n æː ʃ e
نوید	n ʊ w eː d
نوید	n ʊ w eː ð
نادر	n ɒː d̪ e ɾ
ناقص	n ɒː ɣ e s
ناگه	n ɒː ɡʲ æ h
عبید	o b e i̯ d̪
الاغ	o l ɒː ɣ
آنچه	o n t ʃʰ e
عقاب	o ɣ ɒː b
پژاک	p e ʒ ɒː k
پشمک	p æ ʃ m æ k
پاسخ	p ɒː s o x
پیدا	pʰ e j d̪ ɒː
پسته	pʰ e s t̪ʰ e
پسته	pʰ e s t̪ʰ æ
پسرک	pʰ e s æ ɾ æ k
پگاه	pʰ e ɡ ɒː h
پوده	pʰ uː d e
پوشش	pʰ uː ʃ e ʃ
پلید	pʰ æ l iː d̪
پنبه	pʰ æ m b e
پنیر	pʰ æ n iː ɾ
پچین	pʰ æ t͡ʃː iː n
پشتو	pʰ æ ʃ t̪ʰ o
پگاه	pʰ æ ɡ ɒː h
پسته	pʰ ɪ s t̪ʰ æ
پارچ	pʰ ɒ ɾ t͡ʃʰ
پارو	pʰ ɒː ɾ uː
قرآن	q o ɾ ʔ ɒː n
قبلا	q æ b l æ n
قلبی	q æ l b iː
قصاب	q æ s s ɒː b
قاغذ	q ɒː ɣ o z
قاغذ	q ɒː ɣ æ z
رشتن	r e ʃ t æ n
ریدن	r iː d̪ æ n
رفتن	r o f tʰ æ n
رستم	r o s t æ m
رستن	r o s t æ n
رتیل	r o tʰ e i̯ l
روغن	r o ʊ̯ ɢ æ n
رویا	r oː j ɒː
روغن	r oː ɢ æ n
ردیا	r æ dː e pʰ ɒː
رفیق	r æ f iː ɣ
رفتن	r æ f tʰ æ n
رسمی	r æ s m iː
رسما	r æ s m æ n
رستن	r æ s t æ n
رعیت	r æ ʔ j æ t
رشتن	r æ ʃ t æ n
رعیت	r æː j æ t
رعنا	r æː n ɒː
رستم	r ʊ s t a m
راست	r ɒː s tʰ
سیشل	s e j ʃ e l
سنار	s e n ɒː ɾ
صنار	s e n ɒː ɾ
سپهر	s e pʰ e h ɾ
سپاه	s e pʰ ɒː h
ستون	s e tʰ uː n
ستدن	s e t̪ʰ æ d̪ æ n
سینه	s iː n e
سفال	s o f ɒː l
سهیل	s o h e i̯ l
سکان	s o k k ɒ n
سکان	s o k ɒ n
سنتی	s o nː æ t̪ʰ iː
سوئد	s o ʔ e d̪
سرفه	s o ɾ f e
سرین	s o ɾ iː n
ثریا	s o ɾ æ j j ɒː
سوئد	s u ʔ e d̪
سوره	s uː ɾ e
صبوح	s æ b uː h
صفحه	s æ f h e
صفحه	s æ f h æ
سفیر	s æ f iː ɾ
سهند	s æ h æː n d̪
صلیب	s æ l iː b
سمیر	s æ m iː ɾ
سنار	s æ n ɒː ɾ
سوار	s æ v ɒː ɾ
سرده	s æ ɾ d̪ e
سریع	s æ ɾ iː
سعید	s æ ʔ iː d̪
سرور	s æ ɾ v æ ɾ
سنگک	s æ ŋ ɡʲ æ kʲ
سبیل	s ɪ b iː l
ستون	s ʊ tʰ uː n
ساحل	s ɒː h e l
ساحر	s ɒː h e ɾ
توگو	t oː ɡ oː
تونس	t uː n e s
چکاد	t ʃ e k ɒː d
چیست	t ʃ eː s
چهار	t ʃ æ h ɒː ɾ
چکاد	t ʃ æ k ɒː d
چردن	t ʃ æ r d æ n
چهار	t ʃ ɒ h ɒː ɾ
چقدر	t ʃ ɪ q a
چوکی	t ʃ ɐ u̯ k iː
چطور	t ʃʰ e t̪ʰ o u̯ ɾ
چطور	t ʃʰ e t̪ʰ oː ɾ
چیدن	t ʃʰ iː d̪ æ n
چرخه	t ʃʰ æ ɾ x e
چابک	t ʃʰ ɒː b o k
چاله	t ʃʰ ɒː l e
چانه	t ʃʰ ɒː n e
چاقو	t ʃʰ ɒː ɣ uː
تفنگ	tʰ o f æ ŋ ɡ
تمبک	tʰ o m b æ kʲ
تنبک	tʰ o m b æ kʲ
توسی	tʰ uː s iː
طوطی	tʰ uː tʰ iː
تکوک	tʰ æ kʰ uː k
تنبل	tʰ æ m b æ l
تمشک	tʰ æ m e ʃ k
تقیه	tʰ æ ɣ i j e
ترین	t̪ æ ɾ i n
ترین	t̪ æ ɾ iː n
ترسا	tʰ æ ɾ s ɒː
تاپه	tʰ ɒ p p a
طاها	tʰ ɒː h ɒː
ترکی	t̪ʰ o ɾ kʲ iː
تمیز	t̪ʰ æ m iː z
تنفس	t̪ʰ æ n æ f f o s
توهم	t̪ʰ æ v æ hː o m
تنگه	t̪ʰ æ ŋ ɡ e
تغار	t̪ʰ æ ɣ ɒː ɾ
تازی	t̪ʰ ɒː z iː
چنین	t͡ʃʰ e n iː n
چنان	t͡ʃʰ e n ɒː n
چنار	t͡ʃʰ e n ɒː ɾ
چشمه	t͡ʃʰ e ʃ m e
چیست	t͡ʃʰ iː e
چیست	t͡ʃʰ iː s
چرمه	t͡ʃʰ æ ɾ m e
چروک	t͡ʃʰ ʊ ɾ uː k
چالش	t͡ʃʰ ɒː l e ʃ
ویسی	v e i̯ s iː
ویکی	v i k iː
ویکی	v iː k iː
ویژه	v iː ʒ e
ویگن	v iː ɡʲ e n
وحشی	v æ h ʃ iː
ورزش	v æ ɾ z e ʃ
ورقه	v æ ɾ æ ɣ e
وجود	v ʊ d ʒ uː d
واژن	v ɒː ʒ æ n
خرفت	x e ɾ eː f t̪ʰ
خوید	x iː d
خفتن	x o f t̪ʰ æ n
خفاش	x o fː ɒː ʃ
خصوص	x o s uː s
خونه	x uː n e
خمیر	x æ m iː ɾ
خسیس	x æ s iː s
خستن	x æ s t æ n
خایه	x ɒː j e
خانم	x ɒː n ʊ m
خائن	x ɒː ʔ e n
خوید	xʷ eː d
خوید	xʷ eː ð
زبان	z e b ɒː n
زرنگ	z e ɾ æ ŋ
زغال	z o ɣ ɒː l
زحمت	z æ h m æ t̪ʰ
زنبق	z æ m b æ q
زنبق	z æ m b æ ɣ
ضمیر	z æ m iː ɾ
زندی	z æ n d i
ظریف	z æ ɾ iː f
زانو	z ɒː n uː
زاوش	z ɒː v o ʃ
زاغی	z ɒː ɣ iː
ابجد	æ b d͡ʒ æ d
عجیب	æ d ʒ iː b
احمق	æ h m æ ɣ
انبه	æ m b e
عمیق	æ m iː ɣ
اصیل	æ s iː l
اوان	æ v ɒ n
عظیم	æ z iː m
اعظم	æ z æ m
اعظم	æ ʔ z æ m
اعضا	æ ʔ z ɒː
اعضا	æː z ɒː
گوزن	ɡ a w a z n
قبرس	ɢ e b ɾ e s
عبرت	ʔ e b ɾ æ t̪
غیرت	ɢ e i̯ ɾ æ t
شکمی	ʃ e kʲ æ m iː
شکار	ʃ e kʰ ɒː ɾ
قسمت	ɢ e s m æ tʰ
شرکت	ʃ e ɾ kʲ æ t̪ʰ
قرمز	ɢ e ɾ m e z
عراق	ʔ e ɾ ɒː ɣ
شگفت	ʃ e ɡʲ e f t̪ʰ
شگرف	ʃ e ɡʲ æ ɾ f
گینه	ɡ iː n e
عیسی	ʔ iː s ɒː
شیعه	ʃ iː ʔ e
ژیرش	ʒ iː ɾ e ʃ
گجیک	ɡ o d ʒ iː k
شجاع	ʃ o d ʒ ɒː
شجاع	ʃ o d ʒ ɒː ʔ
قدرت	ɢ o d̪ ɾ æ t̪ʰ
گفته	ɡ o f t̪ʰ e
گفتن	ɡ o f t̪ʰ æ n
الگو	ʔ o l ɡ uː
گنبد	ɡ o m b æ d
عمان	ʔ o m m ɒ n
گنده	ɡ o n d̪ e
شستن	ʃ o s t æ n
قطبی	ɢ o tʰ b iː
غربت	ɢ o ɾ b æ tʰ
اردن	ʔ o ɾ d̪ o n
شعله	ʃ o ʔ l e
ششتن	ʃ o ʃ t æ n
قرآن	ɢ o ɾ ʔ ɒː n
شعبه	ʃ oː b a
شعله	ʃ oː l e
قرآن	ɢ oː ɾ ɒ n
گولو	ɡ u l uː
الگو	ʔ u l ɡ uː
قوطی	ɢ u tʰ iː
غرور	ɢ u ɾ uː ɾ
قوها	ɢ uː h ɒː
گونه	ɡ uː n e
قبلا	ɢ æ b l æ n
ابرو	ʔ æ b ɾ uː
شدید	ʃ æ d̪ iː d̪
رهبر	ɾ æ h b æ ɾ
شهید	ʃ æ h iː d̪
شهوت	ʃ æ h v æ tʰ
شهاب	ʃ æ h ɒː b
قلبی	ɢ æ l b iː
قلعه	ɢ æ l ʔ e
الان	ʔ æ l ɒ n
الان	ʔ æ l ʔ ɒ n
شنبه	ʃ æ m b e
عمان	ʔ æ m m ɒ n
قصاب	ɢ æ s s ɒː b
اساس	ʔ æ s ɒː s
عطسه	ʔ æ t s e
قطار	ɢ æ t ɒː ɾ
قطور	ɢ æ tʰ uː ɾ
شخصی	ʃ æ x s iː
قضیب	ɢ æ z iː b
عظیم	ʔ æ z iː m
قزاق	ɢ æ z z ɒ ɣ
غزال	ɢ æ z ɒː l
ژرفا	ʒ æ ɾ f ɒː
قریه	ɢ æ ɾ i j e
غریب	ɢ æ ɾ iː b
شریک	ʃ æ ɾ iː k
ارزش	ʔ æ ɾ z e ʃ
شراب	ʃ æ ɾ ɒː b
عراق	ʔ æ ɾ ɒː ɣ
قرار	ɢ æ ɾ ɒː ɾ
رهبر	ɾ æː b æ ɾ
قلعه	ɢ æː l e
گیاه	ɡ ɪ j ɒː h
گنبد	ɡ ʊ m b æ d
گنبد	ɡ ʊ m b æ ð
گابن	ɡ ɒː b o n
آبزن	ʔ ɒː b z æ n
شاهد	ʃ ɒː h e d̪
ژاکت	ʒ ɒː kʲ æ t
قالی	ɢ ɒː l iː
آمین	ʔ ɒː m i n
شانه	ʃ ɒː n e
شانه	ʃ ɒː n æ
قاتل	ɢ ɒː t̪ʰ e l
آزاد	ʔ ɒː z ɒː d
قارچ	ɢ ɒː ɾ t ʃʰ
آشور	ʔ ɒː ʃ uː ɾ
آبرو	ɒː b e ɾ uː
گردو	ɡʲ e ɾ d̪ uː
گرفت	ɡʲ e ɾ e f tʰ
گران	ɡʲ e ɾ u n
گرون	ɡʲ e ɾ u n
گران	ɡʲ e ɾ ɒ n
گیتا	ɡʲ i tʰ ɒː
گیتی	ɡʲ iː tʰ iː
گیتا	ɡʲ iː tʰ ɒː
آنچه	ɒː n t ʃʰ e
آسام	ɒː s ɒː m
آوام	ɒː v ɒ m
گوزن	ɡʲ æ v æ z n
گرما	ɡʲ æ ɾ m ɒː
آشوب	ɒː ʃ oː b
آغوش	ɒː ɣ uː ʃ
آرنج	ɒː ɾ æ n d ʒ
انوشه	a n oː ʃ a
بهداد	b e h d ɒː d
بهنام	b e h n ɒː m
بهناز	b e h n ɒː z
بهزاد	b e h z ɒː d
بهروز	b e h ɾ uː z
بهراد	b e h ɾ ɒː d
بیروت	b e j ɾ uː t̪
بلژیک	b e l ʒ i k
برجیس	b e ɾ d ʒ e j s
برجیس	b e ɾ d ʒ iː s
برزیل	b e ɾ e z i l
برزیل	b e ɾ e z iː l
برشتن	b e ɾ e ʃ tʰ æ n
برلین	b e ɾ l i n
برهنه	b e ɾ æ h n e
بنگال	b e ŋ ɡ ɒː l
برادر	b e ɾ ɒː d æ ɾ
بیدار	b iː d̪ ɒː ɾ
بیستم	b iː s t̪ʰ o m
بنیاد	b o n j ɒː d̪
بزرگی	b o z o ɾ ɡʲ iː
بهمان	b æ h m ɒ n
بحرین	b æ h ɾ e j n
بلوچی	b æ l uː t͡ʃ iː
بستنی	b æ s t̪ʰ æ n iː
بنگال	b æ ŋ ɡ ɒː l
برادر	b æ ɾ ɒː d æ ɾ
بادام	b ɑː d̪ uː m
بادام	b ɑː d̪ ɒː m
بافتن	b ɒː f tʰ æ n
باحال	b ɒː h ɒː l
باکره	b ɒː kʲ e ɾ e
باغچه	b ɒː x t ʃ e
باغچه	b ɒː x t ʃ æ
باختن	b ɒː x t̪ʰ æ n
باغچه	b ɒː ɣ t ʃ æ
باران	b ɒː ɾ uː n
بارون	b ɒː ɾ uː n
دقیقه	d a q a
دیوید	d e i̯ v i d
دقیقه	d e j ɣ e
دلدار	d e l d ɒː ɾ
دلگیر	d e l ɡʲ iː ɾ
دژاوو	d e ʒ ɒː v uː
دینار	d eː n ɑː ɾ
دیوان	d eː w a n
دینار	d iː n ɑː ɾ
دیوان	d iː v ɒ n
دربین	d o ɾ b iː n
دونسن	d uː n e sː æ n
دهانی	d æ h ɒː n iː
دستور	d æ s t̪ uː ɾ
درونه	d æ ɾ oː n æ
درگاه	d æ ɾ ɡ ɒː h
جدایی	d ʒ o d̪ ɒː j iː
جهانی	d ʒ æ h ɒː n iː
جوانی	d ʒ æ v ɒː n iː
جزیره	d ʒ æ z iː ɾ e
جنگجو	d ʒ æ ŋ d ʒ uː
جگوار	d ʒ æ ɡ v ɒː ɾ
درونه	d ʊ ɾ oː n æ
درونه	d ʊ ɾ uː n e
دلسوز	d̪ e l s uː z
دلتنگ	d̪ e l t̪ʰ æ ŋ ɡ
دنبال	d̪ o m b ɒː l
دونات	dʰ o n ɒː tʰ
دشوار	d̪ o ʃ v ɒː ɾ
دوانی	d̪ æ v ɒː n iː
دلسوز	d̪ ɪ l s oː z
دادگر	d̪ ɒː d̪ ɡ æ ɾ
دامنه	d̪ ɒː m æ n e
جستجو	d͡ʒ o s t̪ʰ o d͡ʒ uː
جستجو	d͡ʒ o s t̪ʰ u d͡ʒ uː
جوراب	d͡ʒ uː ɾ ɒː b
جمشید	d͡ʒ æ m ʃ i d
جمشید	d͡ʒ æ m ʃ iː d
جعفری	d͡ʒ æː f æ ɾ i
جوراب	d͡ʒ ʊ ɾ ɒː b
جاوید	d͡ʒ ɒː v iː d̪
ابهام	e b h ɒː m
ایالت	e j ɒː l æ t̪ʰ
امکان	e m kʰ ɒː n
امسال	e m s ɒː l
امروز	e m ɾ u
امروز	e m ɾ uː z
انزال	e n z ɒː l
اثبات	e s b ɒː tʰ
اسحاق	e s h ɒː ɢ
اسلاو	e s l ɒː v
اسپین	e s pʰ iː n
اظهار	e z h ɒː ɾ
عرفان	e ɾ f ɒː n
اقامت	e ɣ ɒː m æ t̪ʰ
اعلام	eː l ɒː m
فلورا	f e l o ɾ ɑː
فلورا	f e l o ɾ ɒː
فنجان	f e n d ʒ u n
فنجان	f e n d ʒ ɒ n
فرشته	f e ɾ e ʃ tʰ e
فشردن	f e ʃ o ɾ d̪ æ n
فواره	f æ v v ɒː ɾ e
فرهنگ	f æ ɾ h æ ŋ ɡ
فریبا	f æ ɾ iː b ɒː
فریاد	f æ ɾ j ɒː d̪
فرمان	f æ ɾ m uː n
فرمان	f æ ɾ m ɒː n
فرنود	f æ ɾ n uː d
فرنوش	f æ ɾ n uː ʃ
فرسنگ	f æ ɾ s æ ŋ ɡ
فرسنگ	f æ ɾ s æː ŋ ɡ
فرزند	f æ ɾ z æ n d̪
فرزاد	f æ ɾ z ɒː d
فرنگی	f æ ɾ æ ŋ ɡʲ iː
فریان	f æ ɾ ɪ j ɒ n
فرگرد	f æ ɾ ɡʲ æ ɾ d̪
فروهر	f ʊ ɾ uː h æ ɾ
فاحشه	f ɒː h e ʃ e
هزینه	h a z eː n a
هجران	h e d͡ʒ ɾ ɒ n
هندسه	h e n d̪ e s e
هیجان	h iː d ʒ ɒː n
حکومت	h o kʰ uː m æ t̪ʰ
هلندی	h o l æ n d̪ iː
هوشنگ	h oː ʃ æ ŋ ɡ
هوشنگ	h uː ʃ æ ŋ ɡ
هوشنگ	h uː ʃ æː ŋ ɡ
هزینه	h æ z iː n e
هذیان	h æ z j uː n
هذیان	h æ z j ɒː n
هذیان	h æ z æ j ɒː n
حقیقی	h æ ɣ iː ɣ iː
هرزگی	h æ ɾ z e ɡʲ iː
هرزگی	h æ ɾ z æ ɡʲ iː
هامون	h ɒː m uː n
هاشمی	h ɒː ʃ e m iː
امسال	i m s ɒː l
اسفند	i s f a n d̪
ایجاد	iː d ʒ ɒː d
ایمان	iː m ɒ n̪
اینجا	iː n d ʒ ɒː
یونان	j uː n ɒ n
یونان	j uː n ɒː n
یهودی	j æ h uː d̪ iː
یازده	j ɒː z d æ h
کنگره	k o ŋ ɡ ɾ e
کومور	k oː m oː ɾ
کلپوک	k æ l p uː k
کیهان	kʲ e i̯ h ɒː n
کیوان	kʲ e i̯ v ɒː n
کلیسا	kʲ e l iː s ɒː
کنایه	kʲ e n ɒː j e
کریمه	kʲ e ɾ iː m e
کرمان	kʲ e ɾ m ɒ n
کرایه	kʲ e ɾ ɒː j e
کیمیا	kʲ iː m i j ɒː
کسشعر	kʰ o s e ʃ e ɾ
کسشعر	kʰ o s ʃ e ɾ
کشتار	kʰ o ʃ tʰ ɒː ɾ
کودتا	kʰ uː d e tʰ ɒː
کوروش	kʰ uː ɾ o ʃ
کبوتر	kʲ æ b uː tʰ æ ɾ
کهربا	kʲ æ h ɾ o b ɒː
کم‌تر	kʲ æ m t̪ʰ æ ɾ
کنیسه	kʲ æ n iː s e
کربلا	kʲ æ ɾ b æ l ɒː
کشمیر	kʲ æ ʃ m iː ɾ
کرگدن	kʲ æ ɾ ɡʲ æ d æ n
کلوچه	kʰ ʊ l uː t͡ʃʰ e
کاپوت	kʰ ɒ pʰ u t
کابوس	kʰ ɒː b uː s
کاملا	kʰ ɒː m e l æ n
کانال	kʰ ɒː n ɒː l
کاربر	kʰ ɒː ɾ b æ ɾ
کاشتن	kʰ ɒː ʃ t̪ʰ æ n
کارگر	kʰ ɒː ɾ ɡʲ æ ɾ
لپتون	l e pʰ t̪ʰ o n
لسوتو	l e s oː t oː
لیوان	l iː v ɒː n
لبنان	l o b n ɒ n
لوبیا	l u b i i̯ ɒː
لبخند	l æ p x æ n d̪
لعنتی	l æː n æ tʰ i
مهران	m e h ɾ ɒː n
ملیکا	m e l i kʰ ɒ
مناره	m e n ɒː ɾ e
مریلا	m e ɾ i l ɒ
مشکات	m e ʃ kʰ ɒː tʰ
میترا	m i t ɾ ɒ
می‌گم	m i ɡʲ æ m
مبتدی	m o b t̪ʰ æ d̪ iː
مهاجم	m o h ɒː d ʒ e m
