ه	a
برخوردار	b æ ɾ xʷ æ ɾ d ɒː ɾ
به‌آفرید	b ɪ h   ɒː f a ɾ iː d
باحال‌تر	b ɒː h ɒː l t æ ɾ
بامزه‌تر	b ɒː m æ z e t æ ɾ
باریک‌تر	b ɒː ɾ iː k t æ ɾ
دبیرستان	d a b i ɾ i s tʰ ɔː n
دبیرستان	d a b iː ɾ i s tʰ ɑː n
دبیرستان	d a b iː ɾ ɪ s tʰ ɒː n
دبیرستان	d e b iː ɾ e s tʰ uː n
دپارتمان	d e p ɒ r tʰ e m ɒ n
دبیرستان	d æ b iː ɾ e s tʰ ɒː n
انگلستان	e n ɡ e l e s t uː n
انگلستان	e n ɡ e l e s t ɒː n
عشق‌آباد	e ʃ ɣ ɒː b ɒː d
هندوستان	h e n d uː s t uː n
هندوستان	h e n d uː s t ɒː n
هندوستان	h i n d u s t ɔː n
هندوستان	h i n d uː s t ɑː n
هندوستان	h ɪ n d uː s t ɒː n
انگلستان	i n ɡ i l i s t ɑː n
انگلستان	i n ɡ i l i s t ɔː n
عشق‌آباد	i ʃ q ɑː b ɑː d
عشق‌آباد	i ʃ q ɔː b ɔː d
ایرانیان	iː ɾ ɒː n i j ɒː n
کوتاه‌تر	k uː t ɒː h t æ ɾ
می‌خواهم	m iː x ɒː h æ m
می‌خواهم	m iː x ɒː m
نجس‌ترین	n æ d ʒ æ s t æ ɾ iː n
نزدیک‌تر	n æ z d iː k t æ ɾ
ناخواسته	n ɒː x ɒː s t a
ناخواسته	n ɔː x ɔː s t a
ناخواسته	n ɒː x ɒː s t e
ناخواسته	n ɑː xʷ ɑː s t a
استاندار	o s tʰ uː n d ɒː ɾ
استاندار	o s tʰ ɒː n d ɒː ɾ
ازبکستان	o z b æ k e s t ɒː n
اردیبهشت	o ɾ d̪ iː b e h e ʃ t̪ʰ
پرطرفدار	p o ɾ t æ ɾ æ f d ɒː ɾ
سپهسالار	s e p æ h s ɒː l ɒː ɾ
سیاه‌گوش	s i j ɒː h ɡ oː ʃ
سورپرایز	s u r p e ɾ ɒ j z
سورپرایز	s u r p ɾ ɒ j z
سیاره‌ها	s æ j ɒː ɾ e h ɒː
سپهسالار	s ɪ p æ h s ɒː l ɒː ɾ
تمیزترین	t æ m iː z t æ ɾ iː n
تاریک‌تر	t ɒː ɾ iː k t æ ɾ
ازبکستان	u z b a k i s t ɑː n
ازبکستان	u z b a k i s t ɔː n
ویژگی‌ها	v iː ʒ e ɡ iː h ɒː
خوشنویسی	x o ʃ n e v iː s iː
خوشگل‌تر	x o ʃ ɡ e l t æ ɾ
خانوادگی	x uː n e   v ɒː d e   ɡ iː
خانوادگی	x ɑː n a   v ɑː d a   ɡ iː
خانوادگی	x ɔː n a   v ɔː d a   ɡ iː
خانوادگی	x ɒː n a   w ɒː d a   ɡ iː
خانوادگی	x ɒː n e   v ɒː d e   ɡ iː
خاص‌ترین	x ɒː s tʰ æ ɾ iː n
زیباترین	z iː b ɒː t æ ɾ iː n
الماس‌ها	æ l m ɒː s h ɒː
شیرین‌تر	ʃ iː ɾ iː n t æ ɾ
انگلستان	ɪ n ɡ ɪ l ɪ s t ɒː n
استادانه	ʔ o s tʰ ɒː d̪ ɒː n e
استادانه	ʔ u s tʰ ɑː d̪ ɑː n a
استادانه	ʔ u s tʰ ɔː d̪ ɔː n a
ازبکستان	ʊ z b a k ɪ s t ɒː n
ابری‌ساز	ʔ æ b ɾ iː s ɒː z
ژرف‌ترین	ʒ æ ɾ f t æ ɾ iː n
عشق‌آباد	ɪ ʃ q ɒː b ɒː d
استادانه	ʔ ʊ s tʰ ɒː d̪ ɒː n a
شاهانشاه	ʃ ɒː h uː n ʃ ɒː h
شاهانشاه	ʃ ɑː h ɑː n ʃ ɑː h
شاهانشاه	ʃ ɒː h ɒː n ʃ ɒː h
شاهانشاه	ʃ ɔː h ɔː n ʃ ɔː h
آرژانتین	ɒː ɾ ʒ ɒː n t iː n
بیمارستان	b e m ɔː ɾ i s t ɔː n
بیمارستان	b eː m ɑː ɾ i s t ɑː n
بیمارستان	b eː m ɒː ɾ ɪ s t ɒː n
بیمارستان	b iː m ɒː ɾ e s t uː n
بیمارستان	b iː m ɒː ɾ e s t ɒː n
بیمارترین	b iː m ɒː ɾ t æ ɾ iː n
ایران‌ویج	e ɾ ɔː n v e d ʒ
ایران‌ویج	eː ɾ ɑː n v eː d ʒ
ایران‌ویج	eː ɾ ɒː n w eː d ʒ
فراموشیدن	f æ ɾ ɒː m uː ʃ iː d̪ æ n
ایمان‌دار	i m ɔː n d ɔː ɾ
ایمان‌دار	iː m uː n d ɒː ɾ
ایمان‌دار	iː m ɑː n d ɑː ɾ
ایمان‌دار	iː m ɒː n d ɒː ɾ
ایران‌ویج	iː ɾ ɒː n v iː d ʒ
کوچک‌ترین	k uː t ʃ e k t æ ɾ iː n
کهکشان‌ها	k æ h k æ ʃ ɒː n h ɒː
کالیفرنیا	k ɒː l iː f o r n i j ɒː
کارواژگان	k ɒː r v ɒː ʒ e ɡ ɒː n
میرزاخانی	m i ɾ z ɒː x ɒː n iː
میرزاخانی	m iː ɾ z ɒː x ɒː n iː
مجازات‌ها	m o d ʒ ɒː z ɒː t h ɒː
مشکل‌ترین	m o ʃ k e l t æ ɾ iː n
نمایندگان	n æ m ɒː j æ n d e ɡ ɒː n
پناهندگان	p æ n ɒː h æ n d e ɡ ɒː n
قرغیزستان	q ɪ ɾ ɣ iː z ɪ s t ɒː n
ساده‌ترین	s ɒː d e t æ ɾ iː n
سامانه‌ها	s ɒː m ɒː n e h ɒː
تازه‌ترین	t ɒː z e t æ ɾ iː n
واژه‌نامه	v ɒː ʒ e n ɒː m e
خسته‌خانه	x a s t a   x ɑː n a
خسته‌خانه	x a s t a   x ɒː n a
خسته‌خانه	x a s t a   x ɔː n a
خسته‌خانه	x æ s t e   x uː n e
خسته‌خانه	x æ s t e   x ɒː n e
خوانندگان	x ɒː n æ n d e ɡ ɒː n
زیست‌شناس	z iː s t ʃ e n ɒː s
ابرنواختر	æ b æ ɾ n o ʊ æ x t æ ɾ
عجیب‌ترین	æ d ʒ iː b t æ ɾ iː n
افغانستان	ʔ a f ɣ ɑː n i s t ɑː n
افغانستان	ʔ a f ɣ ɔː n i s t ɔː n
افغانستان	ʔ a f ɣ ɒː n ɪ s t ɒː n
اسپهسالار	ʔ e s p æ h s ɒː l ɒː ɾ
شلوغ‌ترین	ʃ o l uː ɣ t æ ɾ iː n
ابری‌سازی	ʔ æ b ɾ iː s ɒː z iː
افغانستان	ʔ æ f ɣ ɒː n e s t ɒː n
گزاف‌ترین	ɡ æ z ɒː f t æ ɾ iː n
اسپهسالار	ʔ ɪ s p æ h s ɒː l ɒː ɾ
شاهزادگان	ʃ ɒː h z ɒː d e ɡ ɒː n
باحال‌ترین	b ɒː h ɒː l t æ ɾ iː n
بامزه‌ترین	b ɒː m æ z e t æ ɾ iː n
باریک‌ترین	b ɒː ɾ iː k t æ ɾ iː n
جامعه‌شناس	d ʒ ɒː m e ʔ e ʃ e n ɒː s
کوتاه‌ترین	k uː t ɒː h t æ ɾ iː n
کارواژه‌ها	k ɒː r v ɒː ʒ e h ɒː
نزدیک‌ترین	n æ z d iː k t æ ɾ iː n
رستوران‌ها	r e s t o ɾ ɒː n h ɒː
ستاره‌شناس	s e t ɒː ɾ e ʃ e n ɒː s
تاریک‌ترین	t ɒː ɾ iː k t æ ɾ iː n
خوشگل‌ترین	x o ʃ ɡ e l t æ ɾ iː n
زیست‌شناسی	z iː s t ʃ e n ɒː s iː
زمین‌شناسی	z æ m iː n ʃ e n ɒː s iː
احمدی‌نژاد	æ h m æ d iː n e ʒ ɒː d
شیرین‌ترین	ʃ iː ɾ iː n t æ ɾ iː n
مردم‌سالاری	m a ɾ d u m   s ɑː l ɑː ɾ iː
مردم‌سالاری	m a ɾ d u m   s ɔː l ɔː ɾ iː
مردم‌سالاری	m a ɾ d ʊ m   s ɒː l ɒː ɾ iː
مردم‌سالاری	m æ ɾ d o m   s ɒː l ɒː ɾ iː
شکسته‌نستعلیق	ʃ ɪ k æ s t æ n æ s t æ ʔ l iː q
