ی	eː
بنگلادش	b æ ŋ ɡ e l ɒː d̪ e ʃ
برگزیدن	b æ ɾ ɡ o z iː d̪ æ n
برازیدن	b æ ɾ ɒː z iː d̪ æ n
برگردان	b æ ɾ ɡʲ æ ɾ d uː n
برگردان	b æ ɾ ɡʲ æ ɾ d ɒː n
بزرگمهر	b ʊ z ʊ ɾ ɡ m ɪ h ɾ
بازرگان	b ɒː z æ ɾ ɡ ɒ n
دلگیرتر	d e l ɡʲ iː ɾ tʰ æ ɾ
دوستانه	d uː s tʰ uː n e
دوستانه	d uː s tʰ ɒː n e
دراییدن	d æ ɾ ɒː j iː d æ n
جستجوها	d ʒ o s tʰ o d ʒ uː h ɒː
جوشاندن	d ʒ uː ʃ uː n d æ n
جوشوندن	d ʒ uː ʃ uː n d æ n
جوشاندن	d ʒ uː ʃ ɒː n d æ n
دگرگونی	d̪ e ɡʲ æ ɾ ɡ uː n iː
دخترباز	d̪ o x t̪ʰ æ ɾ b ɒː z
دشوارتر	d̪ o ʃ v ɒː ɾ t̪ʰ æ ɾ
درخواست	d̪ æ ɾ x ɒː s t̪ʰ
دانمارک	d̪ ɒ n m ɒː ɾ k
دانشکده	d̪ ɒː n e ʃ kʲ æ d̪ e
جنوبگان	d͡ʒ o n uː b e ɡ ɒː n
جهانگیر	d͡ʒ æ h ɒ ŋ ɡʲ iː ɾ
انقلابی	e n ɣ e l ɒː b iː
استفاده	e s tʰ e f ɒː d e
استحمار	e s tʰ e h m ɒː r
اتازونی	e tʰ ɒː z uː n iː
اجتماعی	e ʒ t̪ʰ e m ɒː ʔ iː
فروردین	f a ɾ w a ɾ d̪ iː n
فرستاده	f e ɾ e s t̪ʰ ɒː d̪ e
فیلیپین	f i l i pʰ i n
فروشنده	f o ɾ uː ʃ æ n d̪ e
فهموندن	f æ h m uː n d æ n
فاسق‌ها	f ɒː s e ɣ h ɒː
هنرپیشه	h o n æ ɾ pʰ iː ʃ e
هفت‌سین	h æ f t̪ s i n
هماهنگی	h æ m ɒː h æ ŋ ɡʲ iː
حسب‌حال	h æ s b e h ɒː l
هخامنشی	h æ x ɒ m æ n e ʃ iː
ایجادها	iː d ʒ ɒː d h ɒː
ایجادها	iː d ʒ ɒː d ɒː
ایستادن	iː s tʰ ɒː d æ n
کشاورزی	kʲ e ʃ ɒː v æ ɾ z iː
کردستان	kʰ o ɾ d̪ e s t̪ʰ ɒː n
کونی‌ها	kʰ uː n iː h ɒː
کم‌ترین	kʲ æ m t̪ʰ æ ɾ iː n
کرباسچی	kʲ æ ɾ b ɒː s t͡ʃʰ iː
کاتولیک	kʰ ɒː tʰ o l iː k
کارشناس	kʰ ɒː ɾ ʃ e n ɒː s
لباس‌ها	l e b ɒː s h ɒː
لباس‌ها	l e b ɒː s ɒː
میانمار	m i j ɒ n m ɒː ɾ
مسلمانم	m o s æ l m ɒː n æ m
مومیایی	m uː m i j ɒː j iː
مردونگی	m æ ɾ d̪ uː n e ɡʲ iː
مغاک‌تر	m æ ɣ ɒː kʰ t̪ʰ æ ɾ
ماندگار	m ɒ n d̪ e ɡ ɒː ɾ
نگریستن	n e ɡʲ æ ɾ iː s t̪ʰ æ n
نیرومند	n iː ɾ uː m æː n d̪
نوترینو	n uː t̪ʰ ɾ iː n o
نوازنده	n æ v ɒː z æ n d̪ e
نیوشیدن	n ɪ j uː ʃ iː d æ n
نارگیله	n ɒː ɾ ɡʲ iː l e
امیدوار	o m iː d̪ v ɒː ɾ
امیدوار	o mː iː d̪ v ɒː ɾ
استوانه	o s tʰ o v ɒː n e
استوانه	o s tʰ o w ɒː n æ
پژوهیدن	p e ʒ uː h iː d̪ æ n
پیوسیدن	p æ j uː s iː d æ n
پراکندن	p æ ɾ ɒː k æ n d æ n
پیرترین	pʰ iː ɾ tʰ æ ɾ iː n
پیراستن	pʰ iː ɾ ɒː s t̪ʰ æ n
پرتکاپو	pʰ o ɾ t̪ʰ æ kʰ ɒː pʰ uː
پرستیدن	pʰ æ ɾ æ s t̪ʰ iː d̪ æ n
پارلمان	pʰ ɒ ɾ l e m ɒ n
پارلمان	pʰ ɒ ɾ l o m ɒ n
رستاخیز	r e s t̪ʰ ɒː x iː z
روشنگری	r o ʊ ʃ æ n ɡ æ ɾ i
رصدخانه	r æ s a d̪ x ɒː n e
رستاخیز	r æ s t̪ʰ ɒː x iː z
رنگارنگ	r æ ŋ ɡ ɒː ɾ æ ŋ ɡ
راجستان	r ɒː d͡ʒ æ s tʰ ɒ n
راهبردی	r ɒː h b o ɾ d iː
سکالیدن	s e k ɒː l iː d æ n
سکرفیدن	s e kʲ æ ɾ f iː d̪ æ n
سه‌ماهه	s e m ɒː h e
سه‌شنبه	s e ʃ æ m b e
سخنرانی	s o x æ n ɾ ɒː n iː
سرفه‌ها	s o ɾ f e h ɒː
سخت‌کوش	s æ x t̪ kʰ uː ʃ
سرده‌ها	s æ ɾ d̪ e h ɒː
سنگاپور	s æ ŋ ɡ ɒː pʰ uː ɾ
سراینده	s æ ɾ ɒː j æ n d̪ e
ساختمان	s ɒː x tʰ e m uː n
ساختمان	s ɒː x tʰ e m ɒː n
چیزبرگر	t ʃʰ iː z b e ɾ ɡʲ e ɾ
چسباندن	t ʃʰ æ s b uː n d æ n
چسبوندن	t ʃʰ æ s b uː n d æ n
چسباندن	t ʃʰ æ s b ɒː n d æ n
تحلیلگر	tʰ æ h l iː l ɡʲ æ ɾ
تمشک‌ها	tʰ æ m e ʃ k h ɒː
ترساندن	tʰ æ ɾ s uː n d æ n
ترسوندن	tʰ æ ɾ s uː n d æ n
ترساندن	tʰ æ ɾ s ɒː n d æ n
تغییرات	tʰ æː ɣ iː ɾ ɒː t
تکواندو	t̪ʰ e k v ɒ n d̪ o
توانستن	t̪ʰ uː n e s t̪ʰ æ n
توانستن	t̪ʰ uː n e sː æ n
توانستن	t̪ʰ æ v ɒː n e s t̪ʰ æ n
تراشیدن	t̪ʰ æ ɾ ɒː ʃ iː d̪ æ n
ونزوئلا	v e n e z u e l ɒː
ویراستن	v iː ɾ ɒː s t̪ʰ æ n
ولسوالی	v o l o s v ɒː l iː
والسلام	v æ sː æ l ɒː m
واشنگتن	v ɒː ʃ e ŋ ɡ t o n
واروژان	v ɒː ɾ uː ʒ ɒ n
ولسوالی	w o l o s w ɒː l iː
خرامیدن	x e ɾ ɒː m iː d æ n
خداحافظ	x o d̪ ɒː f e z
خسروانی	x o s ɾ o v ɒː n iː
خسروانی	x o s ɾ æ v ɒː n iː
خوش‌مزه	x o ʃ m æ z e
خوش‌نمک	x o ʃ n æ m æ kʲ
خوراندن	x o ɾ uː n d æ n
خوروندن	x o ɾ uː n d æ n
خوراندن	x o ɾ ɒː n d æ n
خوزستان	x uː z e s tʰ ɒ n
خبرنگار	x æ b æ ɾ n e ɡ ɒː ɾ
خرامیدن	x æ ɾ ɒː m iː d æ n
خراشیدن	x æ ɾ ɒː ʃ iː d æ n
خوابیدن	x ɒː b i d æ n
خایه‌ها	x ɒː j e h ɒː
خواستار	x ɒː s t̪ʰ ɒː ɾ
زیواندن	z iː v ɒ n d̪ æ n
افروختن	æ f r uː x t æ n
افراختن	æ f ɾ ɒː x t̪ʰ æ n
افراشتن	æ f ɾ ɒː ʃ t̪ʰ æ n
احمق‌تر	æ h m æ x t̪ʰ æ ɾ
احمق‌ها	æ h m æ ɣ h ɒː
احمق‌ها	æ h m æ ɣ ɒː
انباشتن	æ m b ɒː ʃ t æ n
امین‌تر	æ m iː n tʰ æ ɾ
عمیق‌تر	æ m iː x t̪ʰ æ ɾ
انداختن	æ n d ɒː x t æ n
عوامانه	æ v ɒː mː m ɒː n e
عظیم‌تر	æ z iː m t̪ʰ æ ɾ
ارمنیان	æ ɾ m æ n iː j ɒː n
عربستان	æ ɾ æ b e s t̪ʰ ɒː n
ارغمچین	æ ɾ ɣ æ m t͡ʃʰ i n
انگیختن	æ ŋ ɡʲ iː x tʰ æ n
غیررسمی	ɢ e i̯ ɾ e ɾ æ s m iː
اسپانیا	ʔ e s pʰ ɒ n i j ɒ
اسپانیا	ʔ e s pʰ ɒː n i j ɒː
اسرائیل	ʔ e s ɾ ɒː ʔ iː l
انگلیسی	ʔ e ŋ ɡ e l iː s iː
ایتالیا	ʔ i t̪ʰ ɑ l i j ɒ
گفته‌ها	ɡ o f t̪ʰ e h ɒː
گفتگوها	ɡ o f t̪ʰ e ɡ uː h ɒː
گفتگوها	ɡ o f t̪ʰ o ɡ uː h ɒː
گفتگوها	ɡ o f t̪ʰ u ɡ uː h ɒː
اوکراین	ʔ o k ɾ ɒ j n
شماریدن	ʃ o m ɒː r iː d æ n
استادها	ʔ o s tʰ ɒː d̪ h ɒː
استادان	ʔ o s tʰ ɒː d̪ ɒ n
گذرنامه	ɡ o z æ ɾ n ɒː m e
گرجستان	ɡ o ɾ d͡ʒ e s t̪ʰ ɒ n
گرجستان	ɡ o ɾ d͡ʒ e s t̪ʰ ɒː n
قورباغه	ɢ uː ɾ b ɒː ɣ e
شبانگاه	ʃ æ b ɒː ŋ ɡ ɒː h
شهریاری	ʃ æ h ɾ i ɒː ɾ iː
الجزایر	ʔ æ l d͡ʒ æ z ɒː e ɾ
عطسه‌ها	ʔ æ t s e h ɒː
عظیم‌تر	ʔ æ z iː m t̪ʰ æ ɾ
آناهیتا	ʔ ɒ n ɒ h i tʰ ɒ
انگلیسی	ʔ ɪ ŋ ɡ ɪ l iː s iː
قالیباف	ɢ ɒː l iː b ɒː f
شاخه‌ها	ʃ ɒː x e h ɒː
شانگهای	ʃ ɒː ŋ ɡ h ɒː j
آشامیدن	ʔ ɒː ʃ ɒː m iː d̪ æ n
آب‌گوشت	ɒː b ɡ uː ʃ t̪ʰ
آمیریان	ɒː m iː ɾ j ɒː n
آمرزیدن	ɒː m o ɾ z iː d̪ æ n
آماسیدن	ɒː m ɒː s iː d æ n
آرزومند	ɒː ɾ e z uː m æː n d̪
آرامگاه	ɒː ɾ uː m ɡ ɒː
آرنج‌ها	ɒː ɾ æ n ʒ ɒː
آرامگاه	ɒː ɾ ɒː m ɡ ɒː h
برادرانه	b e ɾ ɒː d̪ æ ɾ ɒː n æ
بی‌ستاره	b iː s e t̪ʰ ɒː ɾ e
بنیادگرا	b o n j ɒː d̪ ɡʲ æ ɾ ɒː
برادرانه	b æ ɾ ɒː d̪ æ ɾ uː n e
برادرانه	b æ ɾ ɒː d̪ æ ɾ ɒː n e
بازرگانی	b ɒː z æ ɾ ɡ ɒː n iː
دانشنامه	d̪ ɒː n e ʃ n ɒː m e
داروخانه	d̪ ɒː ɾ uː x ɒː n e
جهانگیری	d͡ʒ æ h ɒ ŋ ɡʲ iː ɾ iː
جامه‌دان	d͡ʒ ɒː m e d ɒ n
امامزاده	e m ɒː m z ɒː d̪ e
اسفندیار	e s f æ n d̪ i j ɒː ɾ
استانبول	e s t ɒ m b o l
فرنگستان	f æ ɾ æ ŋ ɡʲ e s t̪ʰ ɒː n
هم‌اکنون	h æ m æ k n u n
کلاشینکف	kʲ e l ɒ ʃ i ŋ kʰ o f
کشتی‌گیر	kʰ o ʃ t̪ʰ iː ɡʲ iː ɾ
کون‌گشاد	kʰ u ŋ ɡ o ʃ ɒː d
کریستوفر	kʰ ɾ iː s tʰ o f e ɾ
کابوس‌ها	kʰ ɒː b uː s h ɒː
کامپیوتر	kʰ ɒː m pʰ j uː t̪ʰ e ɾ
لپتون‌ها	l e pʰ t̪ʰ o n h ɒː
لپتون‌ها	l e pʰ t̪ʰ o n ɒː
لاریجانی	l ɒː ɾ iː d͡ʒ ɒː n iː
منطقه‌ها	m e n tʰ æ ɣ e h ɒː
محمدجواد	m o h æ mː æ d͡ʒː æ v ɒː d
مزخرف‌تر	m o z æ x ɾ æ f t̪ʰ æ ɾ
مغولستان	m o ɣ o l e s t̪ʰ ɒ n
موزامبیک	m uː z ɒː m b iː k
ماهیتابه	m ɒ j tʰ ɒ b e
نمی‌دونم	n e m iː d uː n æ m
نمی‌دانم	n e m iː d ɒː n æ m
نوستالژی	n o s tʰ ɒ l ʒ iː
навохтан	n æ v ɒː x tʰ æ n
پیکربندی	pʰ e i̯ kʲ æ ɾ b æ n d iː
پستاندار	pʰ e s t̪ʰ uː n d̪ ɒː ɾ
پستاندار	pʰ e s t̪ʰ ɒː n d̪ ɒː ɾ
پتروسیان	pʰ e tʰ ɾ o s i j ɒ n
پتروسیان	pʰ e tʰ ɾ o s i j ɒː n
پرطرفدار	pʰ o ɾ tʰ æ ɾ æ f d ɒː ɾ
پراکندگی	pʰ æ ɾ ɒː kʲ æ n d̪ e ɡʲ iː
پاکستانی	pʰ ɒː kʲ e s t̪ʰ ɒː n iː
راجستانی	r ɒː d͡ʒ æ s tʰ ɒː n iː
سیرالئون	s e j e ɾ ɒː l e oː n
سپهسالار	s e pʰ æ h s ɒː l ɒː ɾ
سپاسگزار	s e pʰ ɒː s ɡ o z ɒː ɾ
سوازیلند	s e v ɒː z iː l æ n d
سیاه‌گوش	s i j ɒː h ɡ uː ʃ
سوراخ‌ها	s uː ɾ ɒː x h ɒː
سوراخ‌ها	s uː ɾ ɒː x ɒː
سوازیلند	s uː ɒː z iː l æ n d
ساحره‌ها	s ɒː h e ɾ e h ɒː
تانزانیا	t ɒː n z ɒː n j ɒː
چهارشنبه	t ʃʰ æ h ɒː ɾ ʃ æ m b e
چهارشنبه	t ʃʰ ɒ h ɒː ɾ ʃ æ m b e
چاق‌ترین	t ʃʰ ɒː x tʰ æ ɾ iː n
تهرانجلس	tʰ e h ɾ ɒ n d͡ʒ e l e s
تابستانی	tʰ ɒː b e s tʰ ɒː n iː
تکنولوژی	t̪ʰ e kʰ n o l o ʒ iː
تکیه‌گاه	t̪ʰ e kʲ ɪ j e ɡ ɒː h
تازه‌کار	t̪ʰ ɒː z e kʰ ɒː ɾ
تاریخدان	t̪ʰ ɒː ɾ iː x d̪ ɒ n
تاریخدان	t̪ʰ ɒː ɾ iː x d̪ ɒː n
اردیبهشت	u ɾ d̪ iː b i h i ʃ t̪ʰ
خواهرانه	x ɒː h æ ɾ uː n e
خواهرانه	x ɒː h æ ɾ ɒː n e
خال‌کوبی	x ɒː l kʰ uː b iː
زیمبابوه	z iː m b ɒː b v e
زرین‌کوب	z æ ɾː ɪ ŋ kʰ uː b
انبوییدن	æ m b uː j iː d̪ æ n
انجامیدن	æ n d ʒ ɒː m iː d æ n
ارمنستان	æ ɾ m æ n e s t̪ʰ ɒː n
قزاقستان	ɢ a z z ɒː ɣ e s t̪ʰ ɒ n
ایرانشهر	ʔ iː ɾ ɒ n ʃ æ h ɾ
استرالیا	ʔ o s t̪ ɾ ɑː l i j ɒː
استرالیا	ʔ o s t̪ʰ o ɾ ɑː l i j ɒː
گربه‌سان	ɡ o ɾ b e s ɒː n
گرسنه‌تر	ɡ o ɾ o s n e t̪ʰ æ ɾ
اورانیوم	ʔ o ɾ ɒ n i j o m
علی‌نژاد	ʔ æ l iː n e ʒ ɒː d̪
قابل‌فهم	ɢ ɒː b e l e f æː h m
شاه‌دانه	ʃ ɒː h d̪ ɒː n e
آیت‌الله	ɒː j æ tʰ o lː ɒː h
آمریکایی	ɒː m ɾ iː kʰ ɒː j iː
آپارتمان	ɒː pʰ ɒː ɾ t̪ʰ e m ɒ n
آتش‌فشان	ɒː tʰ æ ʃ f e ʃ ɒː n
به‌آفریدی	b e h ɒː f æ ɾ iː d̪ iː
بلغارستان	b o l ɣ ɒː ɾ e s t̪ʰ ɒ n
برگرداندن	b æ ɾ ɡʲ æ ɾ d ɒ n d æ n
بازشناختن	b ɒː z ʃ e n ɒː x t̪ʰ æ n
دلگیرترین	d e l ɡʲ iː ɾ tʰ æ ɾ iː n
دوجنس‌گرا	d o d ʒ e n s ɡʲ e ɾ ɒː
دوجنس‌گرا	d o d ʒ e n s ɡʲ æ ɾ ɒː
دشوارترین	d̪ o ʃ v ɒː ɾ t̪ʰ æ ɾ iː n
فرهنگستان	f æ ɾ h æ ŋ ɡ e s t ɒː n
هخامنشیان	h æ x ɒ m æ n e ʃ iː ɒ n
هخامنشیان	h æ x ɒ m æ n e ʃ iː ɒː
ایمان‌دار	iː m ɒː n d̪ ɒː ɾ
مگردومیان	m e ɡʲ e ɾ d u m j ɒː n
مردم‌شناس	m æ ɾ d̪ o m ʃ e n ɒː s
مغرب‌زمین	m æ ɣ ɾ e b z æ m iː n
مغاک‌ترین	m æ ɣ ɒː kʰ t̪ʰ æ ɾ iː n
نوازندگان	n æ v ɒː z æ n d e ɡ ɒː n
پالایشگاه	pʰ ɒː l ɒː j e ʃ ɡ ɒː h
رنگ‌آمیزی	r æ ŋ ɡ ɒː m iː z iː
سری‌لانکا	s e ɾ i l ɒ ŋ k ɒ
صفحه‌کلید	s æ f h e kʲ e l iː d̪
ترکمنستان	t̪ʰ o ɾ kʲ æ m æ n e s t̪ʰ ɒ n
ترکمنستان	t̪ʰ o ɾ kʲ æ m æ n e s t̪ʰ ɒː n
تاجیکستان	t̪ʰ ɒː d͡ʒ iː kʲ e s t̪ʰ ɒ n
تاجیکستان	t̪ʰ ɒː d͡ʒ iː kʲ e s t̪ʰ ɒː n
ویکی‌پدیا	v iː k iː p e d i j ɒː
خون‌شناسی	x uː n ʃ e n ɒː s iː
زمین‌لرزه	z æ m i n l æ ɾ z e
زمین‌لرزه	z æ m iː n l æ ɾ z e
احمق‌ترین	æ h m æ x t̪ʰ æ ɾ iː n
امین‌ترین	æ m iː n tʰ æ ɾ iː n
عمیق‌ترین	æ m iː x t̪ʰ æ ɾ iː n
عظیم‌ترین	æ z iː m t̪ʰ æ ɾ iː n
قرغیزستان	ɢ e ɾ ɣ iː z e s tʰ ɒ n
قرقیزستان	ɢ e ɾ ɣ iː z e s tʰ ɒ n
انگلیس‌ها	ʔ e ŋ ɡʲ e l iː s h ɒː
گربه‌ماهی	ɡ o ɾ b e m ɒː h iː
قهوه‌خونه	ɢ æ h v e x uː n e
عظیم‌ترین	ʔ æ z iː m t̪ʰ æ ɾ iː n
قهوه‌خونه	ɢ æː v e x uː n e
انگلیس‌ها	ʔ ɪ ŋ ɡʲ ɪ l iː s ɒː
آذربایجان	ʔ ɒː z æ ɾ b ɒː j e d͡ʒ ɒː n
آسمانخراش	ɒː s e m ɒ n x æ ɾ ɒː ʃ
بنیادگرایی	b o n j ɒː d̪ ɡʲ æ ɾ ɒː j iː
برگردان‌ها	b æ ɾ ɡʲ æ ɾ d ɒː n h ɒː
دگرجنس‌گرا	d e ɡʲ æ ɾ d ʒ e n s ɡʲ e ɾ ɒː
دگرجنس‌گرا	d e ɡʲ æ ɾ d ʒ e n s ɡʲ æ ɾ ɒː
هم‌جنس‌گرا	h æ m d ʒ e n s ɡʲ e ɾ ɒː
هم‌جنس‌گرا	h æ m d ʒ e n s ɡʲ æ ɾ ɒː
کشتی‌گیرها	kʰ o ʃ tʰ iː ɡʲ iː ɾ h ɒː
کشتی‌گیرها	kʰ o ʃ tʰ iː ɡʲ iː ɾ ɒː
کشتی‌گیران	kʰ o ʃ tʰ iː ɡʲ iː ɾ ɒː n
کاروان‌سرا	kʰ ɒː ɾ v ɒ n s æ ɾ ɒː
مهمان‌پرست	m e h m ɒ n pʰ æ ɾ æ s t
مزخرف‌ترین	m o z æ x ɾ æ f t̪ʰ æ ɾ i n
مردم‌شناسی	m æ ɾ d̪ o m ʃ e n ɒː s iː
ماداگاسکار	m ɒː d ɒː ɡ ɒː s k ɒː ɾ
نوازنده‌ها	n æ v ɒː z æ n d e h ɒː
رنگارنگ‌تر	r æ ŋ ɡ ɒː ɾ æ ŋ t̪ʰ æ ɾ
رنگین‌کمان	r æ ŋ ɡʲ iː ŋ kʲ æ m uː n
رنگین‌کمان	r æ ŋ ɡʲ iː ŋ kʲ æ m ɒː n
تخت‌روانچی	tʰ æ x tʰ e ɾ æ v ɒ n t͡ʃʰ i
خانواده‌ها	x u n e v ɒː d̪ e ɒː
خانواده‌ها	x ɒ n e v ɒː d̪ e h ɒː
زندگی‌نامه	z e n d̪ e ɡʲ iː n ɒː m e
شترگاوپلنگ	ʃ o tʰ o r ɡ ɒː v p æ l æ ŋ ɡ
گرسنه‌ترین	ɡ o ɾ o s n e t̪ʰ æ ɾ iː n
بورکینافاسو	b uː ɾ k iː n ɒː f ɒː s o
یکتاپرستانه	j e k t̪ʰ ɒː pʰ æ ɾ æ s t̪ʰ ɒː n e
نژادپرستانه	n e ʒ ɒː d̪ pʰ æ ɾ æ s t̪ʰ uː n e
نژادپرستانه	n e ʒ ɒː d̪ pʰ æ ɾ æ s t̪ʰ ɒː n e
خواجه‌امیری	x ɒː d͡ʒ e æ m iː ɾ i
خال‌کوبی‌ها	x ɒː l kʰ uː b iː h ɒː
شیطان‌پرستی	ʃ e j t̪ʰ ɒː n pʰ æ ɾ æ s t̪ʰ i
همجنسگراهراس	h æ m d ʒ e n s ɡ e ɾ ɒ h æ ɾ ɒ s
همجنسگراهراس	h æ m d ʒ e n s ɡ æ ɾ ɒ h æ ɾ ɒ s
رنگارنگ‌ترین	r æ ŋ ɡ ɒː ɾ æ ŋ t̪ʰ æ ɾ iː n
همجنس‌گراهراس	h æ m d ʒ e n s ɡ e ɾ ɒ h æ ɾ ɒ s
همجنس‌گراهراس	h æ m d ʒ e n s ɡ æ ɾ ɒ h æ ɾ ɒ s
شکسته‌نستعلیق	ʃ e kʲ æ s tʰ e n æ s tʰ æː l iː ɣ
