ه	a
ققنوس	ˑ q a q n uː s ~ q u q n uː s
ققنوس	ˑ q a q n uː s ~ q ʊ q n uː s
اقرار	ɪ q ɾ ɒː ɾ
عثمان	ʊ s m ɒː n
استاد	ʊ s t ɒː d
ـستان	ɪ s t ɒː n
رباعی	ɾ u b ɑː ʔ iː
رباعی	ɾ u b ɔː ʔ iː
گفتگو	ɡ u f t u ɡ uː j
گفتگو	ɡ u f t u ɡ ɵː j
گنجشک	ɡ u n d ʒ i ʃ k
گذشته	ɡ u z a ʃ t a
گذشتن	ɡ u z a ʃ t a n
گذشته	ɡ u ð a ʃ t a
گذشتن	ɡ u ð a ʃ t a n
روباه	ɾ uː b ɒː h
گودرز	ɡ uː d æ ɾ z
روسیه	ɾ uː s i j e
شوربا	ʃ uː ɾ b ɒː
گورخر	ɡ uː ɾ e x æ ɾ
گوگرد	ɡ uː ɡ e ɾ d
گورخر	ɡ uː ɾ x æ ɾ
شوروی	ʃ uː ɾ æ v iː
اظهار	ɪ z h ɒː ɾ
اضافه	ɪ z ɒː f a
عباسی	ʔ æ b b ɒː s iː
افیون	ʔ æ f j uː n
شهادت	ʃ æ h ɒː d̪ æ t̪
البرز	ʔ æ l b o ɾ z
البرز	ʔ æ l b u ɾ z
الماس	ʔ æ l m ɒː s
شلوار	ʃ æ l v ɒː ɾ
شلوار	ʃ æ l w ɒː ɾ
الموت	ʔ æ l æ m uː t
انبار	ʔ æ m b ɒː ɾ
غمگین	ɣ æ m ɡ iː n
انجمن	ʔ æ n d͡ʒ o m æ n
ازگیل	ʔ æ z ɡ iː l
اژدها	ʔ æ ʒ d æ h ɒː
رباعی	ɾ ʊ b ɒː ʔ iː
گفتگو	ɡ ʊ f t ʊ ɡ uː j
گنجشک	ɡ ʊ n d ʒ ɪ ʃ k
شنیدن	ʃ ɪ n iː d a n ~ ʃ ʊ n iː d a n
شناسی	ʃ ɪ n ɒː s iː
اسلام	ʔ ɪ s l ɒː m
گذشته	ɡ ʊ z a ʃ t a
گذشتن	ɡ ʊ z a ʃ t a n
ققنوس	ˑ ɣ æ ɣ n uː s ~ ɣ o ɣ n uː s
ئەگەر	ɛ ɡ ɛ r
گرفتن	ɡ ɪ ɾ ɪ f t a n
روباه	ɾ ɵː b ɔː h
شاداب	ʃ ɒː d ɒː b
شاهین	ʃ ɒː h iː n
شاهان	ʃ ɒː h ɒː n
آکندن	ʔ ɒː k æ n d æ n
قانون	ɢ ɒː n uː n
شاپور	ʃ ɒː p uː ɾ
شوربا	ʃ ɵː ɾ b ɔː
شاگرد	ʃ ɒː ɡ e ɾ d̪
شاگرد	ʃ ɑː ɡ i ɾ d̪
شاگرد	ʃ ɔː ɡ i ɾ d̪
شاگرد	ʃ ɒː ɡ ɪ ɾ d̪
گاراژ	ɡ ɒː ɾ ɒː ʒ
آبنوس	ɒː b n uː s
آبشار	ɑː b ʃ ɑː ɾ
آبشار	ɒː b ʃ ɒː ɾ
آبشار	ɔː b ʃ ɔː ɾ
آدینه	ɔː d i n a
آدینه	ɑː d iː n a
آدینه	ɒː d iː n a
آدینه	ɒː d iː n e
آفرین	ɔː f a ɾ i n
آفرین	ɑː f a ɾ iː n
آفرین	ɒː f a ɾ iː n
آفرین	ɒː f e ɾ iː n
آفرین	ɒː f æ ɾ iː n
آهسته	ɒː h e s t e
آهسته	ɑː h i s t a
آهسته	ɔː h i s t a
آهسته	ɒː h ɪ s t a
آینده	ɑː j a n d a
آینده	ɒː j a n d a
آینده	ɔː j a n d a
آینده	ɒː j æ n d e
آلودن	ɒː l uː d æ n
آمیزش	ɒː m iː z e ʃ
آموزش	ɑː m oː z i ʃ
آموزش	ɒː m oː z ɪ ʃ
آموزش	ɒː m uː z e ʃ
آموزش	ɔː m ɵː z i ʃ
آسمان	ɒː s e m ɒː n
آسیاب	ɒː s i j ɒː b
آسمان	ɒː s m ɒː n
آوازه	ɑː v ɑː z a
آوازه	ɔː v ɔː z a
آوازه	ɒː v ɒː z e
آوازه	ɒː w ɒː z a
آزردن	ɒː z o ɾ d æ n
آذرخش	ɒː z æ ɾ æ x ʃ
آذرخش	ɒː ð æ ɾ æ x ʃ
آذرخش	ɒː ð ɾ æ x ʃ
آرایش	ɒː ɾ ɒː j e ʃ
آرایش	ɑː ɾ ɑː j i ʃ
آرایش	ɔː ɾ ɔː j i ʃ
آرایش	ɒː ɾ ɒː j ɪ ʃ
آرامی	ɒː ɾ ɒː m iː
افسانه	a f s ɑː n a
افسانه	a f s ɒː n a
افسانه	a f s ɔː n a
انگبین	a n ɡ u b i n ~ a n ɡ a b i n
انگبین	a n ɡ u b iː n ~ a n ɡ a b iː n
انگبین	a n ɡ ʊ b iː n ~ a n ɡ a b iː n
اسکدار	a s k u d ɑː ɾ
اسکدار	a s k u d ɔː ɾ
اسکدار	a s k ʊ d ɒː ɾ
ارغوان	a ɾ ɣ a v ɑː n ~ a ɾ ɣ u v ɑː n
ارغوان	a ɾ ɣ a v ɔː n ~ a ɾ ɣ u v ɔː n
ارغوان	a ɾ ɣ a w ɒː n ~ a ɾ ɣ ʊ w ɒː n
بختیار	b a x t i j ɑː ɾ
بختیار	b a x t i j ɒː ɾ
بختیار	b a x t i j ɔː ɾ
بهترین	b e h t a ɾ i n
بهترین	b e h t æ ɾ iː n
بی‌هوش	b e h ɵː ʃ
بیچاره	b e t ʃ ɔː ɾ a
بیدادی	b eː d ɒː d iː
بی‌هوش	b eː h oː ʃ
بیچاره	b eː t ʃ ɑː ɾ a
بیچاره	b eː t ʃ ɒː ɾ a
بیرونی	b eː ɾ uː n iː
بهترین	b i h t a ɾ iː n
بیدادی	b iː d ɒː d iː
بی‌هوش	b iː h uː ʃ
بیچاره	b iː t ʃ ɒː ɾ e
بیرونی	b iː ɾ uː n iː
بیگانه	b iː ɡ ɒː n e
بوسیدن	b oː s iː d æ n
بوستان	b oː s t a n
بوییدن	b u   j i d a n
بوسیدن	b uː s iː d æ n
بوستان	b uː s t æ n
بوییدن	b uː   j iː d a n
بوییدن	b uː   j iː d æ n
بلعیدن	b æ l ʔ iː d̪ æ n
بختیار	b æ x t e j ɒː ɾ
بختیار	b æ x t i j ɒː ɾ
برنامه	b æ ɾ n ɒː m æ
بهترین	b ɪ h t a ɾ iː n
بیابان	b ɪ j ɒː b ɒ n
بیابان	b ɪ j ɒː b ɒː n
بادرنگ	b ɑː d ɾ a n ɡ
بادرنگ	b ɒː d ɾ a n ɡ
بادرنگ	b ɔː d ɾ a n ɡ
بادرنگ	b ɒː d ɾ æ n ɡ
بایستی	b ɒː j æ s t iː
بوستان	b ɵː s t a n
بازیچه	b ɒː z iː t ʃʰ e
باغبان	b ɒː ɣ b uː n
باغبان	b ɑː ɣ b ɑː n
باغبان	b ɒː ɣ b ɒː n
باغبان	b ɔː ɣ b ɔː n
باردار	b ɑː ɾ d ɑː ɾ
باردار	b ɒː ɾ d ɒː ɾ
باردار	b ɔː ɾ d ɔː ɾ
باژدار	b ɑː ʒ d ɑː ɾ
باژدار	b ɒː ʒ d ɒː ɾ
باژدار	b ɔː ʒ d ɔː ɾ
باغ‌ها	b ɒː ɣ h ɒː
دلگیری	d e l ɡʲ iː ɾ iː
دیوانه	d e v ɔː n a
دیوانه	d eː v ɑː n a
دیوانه	d eː w ɒː n a
دیوانه	d iː v uː n e
دیوانه	d iː v ɒː n e
دانشجو	d uː n e ʃ d ʒ uː j
دستگاه	d æ s t ɡ ɒː h
دردمند	d æ ɾ d m æ n d
جمهوری	d ʒ o m h uː ɾ iː
جمهوری	d ʒ u m h u ɾ iː
جمهوری	d ʒ u m h uː ɾ iː
جمهوری	d ʒ ʊ m h uː ɾ iː
دانشجو	d ɒː n e ʃ d ʒ uː j
دانشجو	d ɑː n i ʃ d ʒ uː j
دانشجو	d ɔː n i ʃ d ʒ ɵː j
دانشجو	d ɒː n ɪ ʃ d ʒ uː j
ابتکار	e b t e k ɒː ɾ
افتخار	e f t e x ɒː ɾ
امتحان	e m t e h uː n
امتحان	e m t e h ɒː n
انفجار	e n f e d ʒ ɒː ɾ
انتحار	e n t e h ɒː ɾ
انتشار	e n t e ʃ ɒː ɾ
انعکاس	e n ʔ e k ɒː s
اسفناج	e s f e n ɒː d͡ʒ
اسکندر	e s k æ n d æ ɾ
استیون	e s t iː v e n
اختیار	e x t e j ɒː ɾ
اختصار	e x t e s ɒː ɾ
اختیار	e x t i j ɒː ɾ
ایرانی	e ɾ ɔː n   iː
ایرانی	eː ɾ ɑː n   iː
ایرانی	eː ɾ ɒː n   iː
فریفتن	f a ɾ e f t a n ~ f i ɾ e f t a n
فریفتن	f a ɾ eː f t a n ~ f i ɾ eː f t a n
فریفتن	f a ɾ eː f t a n ~ f ɪ ɾ eː f t a n
فرمایش	f a ɾ m ɑː j i ʃ
فرمایش	f a ɾ m ɔː j i ʃ
فرمایش	f a ɾ m ɒː j ɪ ʃ
فراموش	f a ɾ ɑː m oː ʃ
فراموش	f a ɾ ɒː m oː ʃ
فراموش	f a ɾ ɔː m ɵː ʃ
فریدون	f e ɾ e i̯ d uː n
فریفتن	f e ɾ iː f t æ n ~ f e ɾ iː f t æ n
فروختن	f o ɾ uː x t æ n
فروختن	f u ɾ oː x t a n
فروختن	f u ɾ ɵː x t a n
فهمیدن	f æ h m iː d æ n
فریفتن	f æ ɾ iː f t æ n ~ f e ɾ iː f t æ n
فرمایش	f æ ɾ m ɒː j e ʃ
فرآیند	f æ ɾ ɒː j æ n d
فراموش	f æ ɾ ɒː m uː ʃ
فریدون	f ɪ ɾ eː d uː n
فروختن	f ʊ ɾ oː x t a n
همچنین	h a m t ʃ a n i n
همچنین	h a m t ʃ a n iː n
همساده	h o m s ɒː d e
هوشیار	h oː ʃ j ɑː ɾ
هوشیار	h oː ʃ j ɒː ɾ
هوشیار	h uː ʃ j ɒː ɾ
همساده	h æ m s ɒː d e
همچنین	h æ m t ʃ e n iː n
همچنین	h æ m t ʃ æ n iː n
هوشیار	h ɵː ʃ j ɔː ɾ
ابتکار	i b t i k ɑː ɾ
ابتکار	i b t i k ɔː ɾ
افتخار	i f t i x ɑː ɾ
افتخار	i f t i x ɔː ɾ
احترام	i h t̪ i ɾ ɒː m
امتحان	i m t i h ɑː n
امتحان	i m t i h ɔː n
انفجار	i n f i d ʒ ɑː ɾ
انفجار	i n f i d ʒ ɔː ɾ
انتحار	i n t i h ɑː ɾ
انتحار	i n t i h ɔː ɾ
انتشار	i n t i ʃ ɑː ɾ
انتشار	i n t i ʃ ɔː ɾ
اسکندر	i s k a n d a ɾ
اختیار	i x t i j ɑː ɾ
اختیار	i x t i j ɔː ɾ
اختصار	i x t i s ɑː ɾ
اختصار	i x t i s ɔː ɾ
ایرانی	iː ɾ uː n   iː
ایرانی	iː ɾ ɒː n   iː
کودکان	k uː d æ k ɒː n
کهکشان	k æ h k e ʃ ɒː n
کهکشان	k æ h k æ ʃ ɒː n
کاروان	k ɒː ɾ w ɒː n
کاغذها	k ɒː ɣ æ z h ɒː
لزوماً	l o z uː m æ n
میخانه	m a j x ɑː n   a
میخانه	m a j x ɒː n   a
میخانه	m a j x ɔː n   a
مردانه	m a ɾ d ɑː n a
مردانه	m a ɾ d ɒː n a
مردانه	m a ɾ d ɔː n a
مهربان	m e h ɾ a b ɔː n   ~ m e h ɾ u b ɔː n
مهرداد	m e h ɾ d ɒː d
مهرداد	m e h ɾ d ɔː d
مهربان	m e h ɾ æ b ɒː n   ~ m e h ɾ o b ɒː n
مهربان	m e h ɾ ɒː b uː n   ~ m e h ɾ o b uː n
میخانه	m e j x uː n   e
میخانه	m e j x ɒː n   e
معماری	m e ʔ m ɒː ɾ iː
معماری	m e ʔ m ɔː ɾ iː
معماری	m eː m ɒː ɾ iː
مهربان	m i h ɾ a b ɑː n   ~ m i h ɾ u b ɑː n
مهرداد	m i h ɾ d ɑː d
معماری	m i ʔ m ɑː ɾ iː
مجازات	m o d ʒ ɒː z ɒː t
مستقیم	m o s t e ɣ iː m
مستقیم	m o s t æ ɣ iː m
مسلمون	m o s æ l m uː n
مولانا	m o w l ɒː n ɒː
مرغ‌ها	m o ɾ ɣ h ɒː
مشاهده	m o ʃ ɒː h æ d e
مستقیم	m u s t a q i m
مستقیم	m u s t a q iː m
مسجدها	m æ s d ʒ e d h ɒː
مولانا	m æ w l ɒː n ɒː
مردانه	m æ ɾ d uː n e
مردانه	m æ ɾ d ɒː n e
مهربان	m ɪ h ɾ a b ɒː n   ~ m ɪ h ɾ ʊ b ɒː n
مهرداد	m ɪ h ɾ d ɒː d
مستقیم	m ʊ s t a q iː m
معماری	m ɪ ʔ m ɒː ɾ iː
مادیان	m ɒː d i i̯ ɒː n
نوروزی	n a v ɾ ɵː z iː
نوروزی	n a w ɾ oː z iː
نکونام	n e k uː n ɒː m
نمودار	n e m u d ɒː ɾ
نمایان	n e m ɒː j ɒː n
نشلیدن	n e ʃ e l iː d æ n
نژادها	n e ʒ ɒː d h ɒː
نیازها	n iː j ɒː z h ɒː
نوروزی	n o u ɾ uː z iː
نواختر	n o ʊ æ x t æ ɾ
نوروزی	n oː ɾ uː z iː
نوشیدن	n uː ʃ iː d æ n
نجس‌تر	n æ d ʒ æ s t æ ɾ
نکونام	n æ k oː n ɒː m
نمایان	n æ m ɒː j ɒː n
نریمان	n æ ɾ eː m ɒː n
ناوخدا	n ɒː v x o d ɒː
پهلوان	p a h l a   v ɑː n
پهلوان	p a h l a   v ɔː n
پهلوان	p a h l a   w ɒː n
پیشوند	p e ʃ v a n d
پیشوند	p eː ʃ v a n d
پیشوند	p eː ʃ w a n d
پیشوند	p iː ʃ v æ n d
پرسیدن	p o ɾ s iː d æ n
پوشیدن	p oː ʃ iː d a n
پودینه	p u d i n a
پرسیدن	p u ɾ s i d a n
پرسیدن	p u ɾ s iː d a n
پودینه	p uː d iː n a
پودینه	p uː d iː n e
پوزخند	p uː z x æ n d
پوشیدن	p uː ʃ iː d æ n
پدیدار	p æ d iː d ɒː ɾ
پهلوان	p æ h l e   v uː n
پهلوان	p æ h l e   v ɒː n
پریشان	p æ ɾ eː ʃ ɒː n
پشیمان	p æ ʃ iː m ɒː n
پرتگاه	p æ ɾ t ɡ ɒː h
پرسیدن	p ʊ ɾ s iː d a n
پادشاه	p ɒː d e ʃ ɒː h
پادشاه	p ɑː d i ʃ ɑː h
پادشاه	p ɔː d i ʃ ɔː h
پادشاه	p ɒː d ɪ ʃ ɒː h
پوشیدن	p ɵː ʃ i d a n
پارسال	pʰ ɒː ɾ s ɒː l
قندهار	q a n d a h ɑː ɾ
قندهار	q a n d a h ɒː ɾ
قندهار	q a n d a h ɔː ɾ
قلاووز	q u l ɔː v u z
قلاووز	q u l ɑː v uː z
قلمدان	q æ l æ m d ɒː n
قلاووز	q ʊ l ɒː w uː z
روحانی	r o ʊ h ɒː n iː
روادید	r æ v ɒː d̪ iː d̪
سرندیپ	s a r a n d iː p
سوداگر	s a v d ɔː ɡ a ɾ
سوداگر	s a w d ɑː ɡ a ɾ
سوداگر	s a w d ɒː ɡ a ɾ
سرجوخه	s a ɾ d ʒ u x a
سرجوخه	s a ɾ d ʒ uː x a
سرنشین	s a ɾ n i ʃ i n
سرنشین	s a ɾ n i ʃ iː n
سرنشین	s a ɾ n ɪ ʃ iː n
سرگیجه	s a ɾ ɡ i d ʒ a
سرگیجه	s a ɾ ɡ iː d ʒ a
صبحانه	s o b h ɒː n e
سنت‌ها	s o n æ t h ɒː
سوداگر	s o u d ɒː ɡ æ ɾ
سریانی	s o ɾ j ɒː n iː
سوداگر	s oː d ɒː ɡ æ ɾ
سوسمار	s uː s m ɒː r
سرجوخه	s æ ɾ d ʒ uː x e
سقرلات	s æ ɣ e ɾ l ɒː t
سرنشین	s æ ɾ n e ʃ iː n
سرگیجه	s æ ɾ ɡ iː d ʒ e
سامانه	s ɒː m ɒː n e
ترسیدن	t a ɾ s i d a n
ترسیدن	t a ɾ s iː d a n
تیرداد	t iː ɾ d ɒː d
تلویحی	t æ l v iː h iː
تمیزتر	t æ m iː z t æ ɾ
ترسیدن	t æ ɾ s iː d æ n
ترسایی	t æ ɾ s ɒː j iː
ترکیدن	t æ ɾ æ kʲ iː d æ n
تقریبا	t æ ɣ ɾ iː b æ n
چرخیدن	t ʃ e ɾ x i d̪ æ n
چرخیدن	t ʃ æ ɾ x i d̪ æ n
واژگان	v ɒː ʒ e ɡ ɒː n
خربوزه	x a ɾ b u z a
خربوزه	x a ɾ b uː z a
خوشحال	x o ʃ h ɒː l
خورشید	x o ɾ ʃ iː d
خراسان	x o ɾ ɒː s ɒː n
خوشحال	x u ʃ h ɔː l
خورشید	x u ɾ ʃ e d
خراسان	x u ɾ ɔː s ɔː n
خواندن	x uː n d æ n
خربوزه	x æ ɾ b uː z e
خوشحال	x ʊ ʃ h ɒː l
خورشید	x ʊ ɾ ʃ eː d
خراسان	x ʊ ɾ ɒː s ɒː n
خاکستر	x ɒː k e s t æ ɾ
خاکستر	x ɑː k i s t a ɾ
خاکستر	x ɔː k i s t a ɾ
خاکستر	x ɒː k ɪ s t a ɾ
خواندن	x ɒː n d a n
خواندن	x ɔː n d a n
خواندن	x ɒː n d æ n
خواستن	x ɒː s t a n
خواستن	x ɔː s t a n
خواستن	x ɒː s t æ n
خاص‌تر	x ɒː s tʰ æ ɾ
خاویار	x ɒː v i j ɒː ɾ
خوارزم	x ɒː ɾ æ z m
خوشحال	xʷ a ʃ h ɑː l
خراسان	xʷ a ɾ ɑː s ɑː n
خورشید	xʷ u ɾ ʃ eː d
خواندن	xʷ ɑː n d a n
خواستن	xʷ ɑː s t a n
خوارزم	xʷ ɒː ɾ æ z m
زنانگی	z a n ɑː n a   ɡ iː
زنانگی	z a n ɒː n a   ɡ iː
زنانگی	z a n ɔː n a   ɡ iː
زراوند	z a ɾ ɑː v a n d
زراوند	z a ɾ ɔː v a n d
زراوند	z a ɾ ɒː w a n d
زمستان	z e m e s t uː n
زمستان	z e m e s t ɒː n
زمستان	z i m i s t ɑː n
زمستان	z i m i s t ɔː n
زیباتر	z iː b ɒː t æ ɾ
زیویدن	z iː v iː d æ n
زورمند	z oː ɾ m a n d
زرناپا	z u r n ɒː p ɒː
زورمند	z uː ɾ m æ n d
زنانگی	z æ n ɒː n e   ɡ iː
زراوند	z æ ɾ ɒː v æ n d
زمستان	z ɪ m ɪ s t ɒː n
زنانگی	z ɒː n uː n e   ɡ iː
زورمند	z ɵː ɾ m a n d
زراوند	z ɒː ɾ ɒː v æ n d
افسانه	æ f s uː n e
افسانه	æ f s ɒː n e
افشردن	æ f ʃ o ɾ d æ n
المزده	æ l æ m z æ d e
انگبین	æ n ɡ o b iː n ~ æ n ɡ æ b iː n
اپاختر	æ p ɒː x t æ ɾ
اسکدار	æ s k o d ɒː ɾ
اتم‌ها	æ t o m h ɒː
ارغنون	æ ɾ ɣ æ n uː n
ارغوان	æ ɾ ɣ æ v ɒː n ~ æ ɾ ɣ o v ɒː n
شوکران	ʃ a v k a ɾ ɔː n
شوکران	ʃ a w k a ɾ ɑː n
شوکران	ʃ a w k a ɾ ɒː n
ابتکار	ɪ b t ɪ k ɒː ɾ
شناختن	ʃ e n ɒː x t æ n
شپش‌ها	ʃ e p e ʃ h ɒː
اسپریس	ʔ e s p æ ɾ eː s
گریستن	ɡ e ɾ iː s t æ n
افتخار	ɪ f t ɪ x ɒː ɾ
احترام	ɪ h t̪ ɪ ɾ ɒː m
شکستنی	ʃ i k æ s t̪ æ n iː
شناختن	ʃ i n ɑː x t a n
شناختن	ʃ i n ɔː x t a n
امتحان	ɪ m t ɪ h ɒː n
انفجار	ɪ n f ɪ d ʒ ɒː ɾ
انتحار	ɪ n t ɪ h ɒː ɾ
انتشار	ɪ n t ɪ ʃ ɒː ɾ
شکلاتی	ʃ o kʰ o l ɒ tʰ i
قلاووز	ɣ o l ɒː v uː z
گسترده	ɡ o s t æ ɾ d e
گستردن	ɡ o s t æ ɾ d æ n
شوکران	ʃ o u k æ ɾ ɒː n
گذاشتن	ɡ o z ɒː ʃ t æ n
گریختن	ɡ o ɾ iː x t æ n
شوکران	ʃ oː k ɒː ɾ uː n
گوسفند	ɡ oː s f a n d ~ ɡ oː s p a n d
روزگار	ɾ oː z ɡ ɒː ɾ
اسکندر	ɪ s k a n d a ɾ
گلستان	ɡ u l i s t̪ ɒː n
ژوپیتر	ʒ u p i t e ɾ
گستردن	ɡ u s t a ɾ d a n
گذاشتن	ɡ u z ɔː ʃ t a n
گذاشتن	ɡ u ð ɑː ʃ t a n
گریختن	ɡ u ɾ e x t a n
گریختن	ɡ u ɾ eː x t a n
رودابه	ɾ uː d ɒː b e
رودابه	ɾ uː d ɒː b æ
ژولیدن	ʒ uː l iː d æ n
گوسفند	ɡ uː s f e n d
گوسفند	ɡ uː s f æ n d ~ ɡ uː s p æ n d
گوساله	ɡ uː s ɒː l e
روزگار	ɾ uː z e ɡ ɒː ɾ
اختیار	ɪ x t i j ɒː ɾ
اختصار	ɪ x t ɪ s ɒː ɾ
اهریمن	ʔ æ h ɾ iː m æ n
شهریور	ʃ æ h ɾ iː v æ ɾ
شهرزاد	ʃ æ h ɾ z ɒː d
غمگینی	ɢ æ m ɡ iː n iː
قندهار	ɣ æ n d æ h ɒː ɾ
قندهار	ɣ æ n d ɒː h ɒː ɾ
اسپریس	ʔ æ s p æ ɾ eː s
اسپریس	ʔ æ s p ɾ eː s
ژرف‌تر	ʒ æ ɾ f t æ ɾ
گرمابه	ɡ æ ɾ m ɒː b e
گرزمان	ɡ æ ɾ æ z m ɒː n
شناختن	ʃ ɪ n ɒː x t a n
گستردن	ɡ ʊ s t a ɾ d a n
گذاشتن	ɡ ʊ z ɒː ʃ t a n
گریختن	ɡ ʊ ɾ eː x t a n
آبگینه	ʔ ɒː b ɡ iː n e
آبگینه	ʔ ɒː b ɡ iː n æ
شادمان	ʃ ɒː d m ɒː n
گائیدن	ɡ ɒː j iː d æ n
رایانه	ɾ ɒː j uː n e
رایانه	ɾ ɑː j ɑː n a
رایانه	ɾ ɒː j ɒː n a
رایانه	ɾ ɔː j ɔː n a
رایانه	ɾ ɒː j ɒː n e
ژامبون	ʒ ɒː m b o n
آمیختن	ʔ ɒː m eː x t æ n
آمیختن	ʔ ɒː m iː x t æ n
آمارگر	ʔ ɒː m ɒː ɾ ɡ æ ɾ
ژاندرم	ʒ ɒː n d æ r m
قانونی	ɢ ɒː n uː n iː
گوسفند	ɡ ɵː s f a n d ~ ɡ ɵː s p a n d
آستانه	ʔ ɒː s t ɒː n e
آستانه	ʔ ɒː s t ɒː n æ
روزگار	ɾ ɵː z ɡ ɔː ɾ
گهواره	ɡʲ a h v ɑː ɾ a
گهواره	ɡʲ a h v ɔː ɾ a
گهواره	ɡʲ a h w ɒː ɾ a
آبلیمو	ɒː b l iː m uː
آدم‌ها	ɒː d æ m h ɒː
آفریدن	ɒː f æ ɾ iː d æ n
آموختن	ɑː m oː x t a n
آموختن	ɒː m oː x t a n
آموختن	ɒː m uː x t æ n
آموختن	ɔː m ɵː x t a n
آویختن	ɒː v iː x t æ n
آزموده	ɔː z m u d a
آزموده	ɑː z m uː d a
آزموده	ɒː z m uː d a
آزموده	ɒː z m uː d e
آزمایش	ɒː z m ɒː j e ʃ
آزمایش	ɑː z m ɑː j i ʃ
آزمایش	ɔː z m ɔː j i ʃ
آزمایش	ɒː z m ɒː j ɪ ʃ
گهواره	ɡʲ æ h v ɒː ɾ e
برزیستن	b a r z iː s t æ n
بی‌وقفه	b eː w æ q f æ
بیمارتر	b iː m ɒː ɾ t æ ɾ
بی‌نظیر	b iː n æ z iː ɾ
بی‌وقفه	b iː v æ ɣ f e
بی‌شمار	b iː ʃ o m ɒː ɾ
باستانی	b ɒː s t ɒː n iː
دیسک‌ها	d iː s k h ɒː
دروغ‌ها	d o ɾ uː ɣ h ɒː
جلوگیری	d ʒ e l o u ɡ iː ɾ iː
جلوگیری	d ʒ e l oː ɡ iː ɾ iː
جلوگیری	d ʒ i l a v ɡ i ɾ iː
جلوگیری	d ʒ i l a w ɡ iː ɾ iː
جواب‌ها	d ʒ æ v ɒː b h ɒː
جلوگیری	d ʒ ɪ l a w ɡ iː ɾ iː
دانشمند	d ɒː n e ʃ m æ n d
دارفلفل	d ɒː ɾ f e l f e l
دارفلفل	d ɑː ɾ f i l f i l
دارفلفل	d ɔː ɾ f i l f i l
دارفلفل	d ɒː ɾ f ɪ l f ɪ l
فهماندن	f a h m ɑː n d a n
فهماندن	f a h m ɒː n d a n
فهماندن	f a h m ɔː n d a n
فضازمان	f a z ɑː z a m ɑː n
فضازمان	f a z ɒː z a m ɒː n
فضازمان	f a z ɔː z a m ɔː n
فهماندن	f æ h m uː n d æ n
فهماندن	f æ h m ɒː n d æ n
فضازمان	f æ z ɒː z æ m ɒː n
فرمانده	f æ ɾ m ɒ n d e h
فروردین	f æ ɾ v æ ɾ d̪ iː n
فراموشی	f æ ɾ ɒː m uː ʃ iː
فضازمان	f ɒː z ɒː z ɒː m uː n
هواپیما	h a v ɑː p a j m ɑː
هواپیما	h a v ɔː p a j m ɔː
هواپیما	h a w ɒː p a j m ɒː
هندوانه	h e n d e v ɒː n e
هیچ‌وقت	h e t ʃ v a q t
هیچ‌وقت	h eː t ʃ v a q t
هیچ‌وقت	h eː t ʃ w a q t
هیچ‌وقت	h iː t ʃ v æ ɣ t
هفته‌ها	h æ f t e h ɒː
هواپیما	h æ v ɒː p e j m ɒː
کنفرانس	k o n f e ɾ ɒː n s
کوهستان	k oː h i s t ɑː n
کوهستان	k oː h ɪ s t ɒː n
کوهستان	k uː h e s t ɒː n
کوچک‌تر	k uː t ʃ e k t æ ɾ
کوهستان	k ɵː h i s t ɔː n
مطبوعات	m a t b u ʔ ɔː t
مطبوعات	m a t b uː ʔ ɑː t
مطبوعات	m a t b uː ʔ ɒː t
مردانگی	m a ɾ d ɑː n a   ɡ iː
مردانگی	m a ɾ d ɒː n a   ɡ iː
مردانگی	m a ɾ d ɔː n a   ɡ iː
مشکل‌ها	m o ʃ k e l h ɒː
مشکل‌تر	m o ʃ k e l t æ ɾ
مروارید	m o ɾ v ɒː ɾ iː d
مروارید	m o ɾ w ɒː ɾ iː d
مومیایی	m oː m i j ɒː j iː
مومیایی	m uː m i j ɒː j iː
مطبوعات	m æ t b uː ʔ ɒː t
مطبوعات	m æ t b uː ɒː t
مردانگی	m æ ɾ d uː n e   ɡ iː
مردانگی	m æ ɾ d ɒː n e   ɡ iː
مروارید	m æ ɾ w ɒː ɾ iː d
مادرانه	m ɑː d a ɾ ɑː n a
مادرانه	m ɒː d a ɾ ɒː n a
مادرانه	m ɔː d a ɾ ɔː n a
مادرانه	m ɒː d æ ɾ ɒː n e
مادرانه	m ɒː d ɒː ɾ uː n e
مازریون	m ɑː z a ɾ j oː n
مازریون	m ɒː z a ɾ j oː n
مازریون	m ɔː z a ɾ j ɵː n
مازریون	m ɒː z æ ɾ j uː n
مارمولک	m ɔː ɾ m u l a k
مارمولک	m ɑː ɾ m uː l a k
مارمولک	m ɒː ɾ m uː l a k
مارمولک	m ɒː ɾ m uː l æ k
نستعلیق	n a s t a ʔ l i q
نستعلیق	n a s t a ʔ l iː q
نیرومند	n iː ɾ uː m æ n d̪
نماینده	n æ m ɒː j æ n d e
نستعلیق	n æ s t æ ʔ l iː ɣ
نستعلیق	n æ s t æː l iː ɣ
استخوان	o s t o x ɒ n
اقیانوس	o ɣ j ɒː n uː s
پذیرفتن	p a z i ɾ u f t a n
پذیرفتن	p a z iː ɾ ʊ f t a n
پذیرفتن	p a ð iː ɾ u f t a n
پذیرفتن	p e z iː ɾ o f t æ n
پیشنهاد	p e ʃ n i h ɔː d
پروگرام	p e ɾ o ɡ e ɾ ɒː m
پیشنهاد	p eː ʃ n i h ɑː d
پیشنهاد	p eː ʃ n ɪ h ɒː d
پیادگان	p iː j ɒː d e ɡ ɒː n
پیشنهاد	p iː ʃ n e h ɒː d
پیرترین	p iː ɾ t æ ɾ iː n
پروگرام	p o ɾ o ɡ e ɾ ɒː m
پوهنتون	p oː h a n t uː n
پناهنده	p æ n ɒː h æ n d e
پذیرفتن	p æ z iː ɾ o f t æ n
پروگرام	p ɾ o ɡ ɾ ɒː m
پاکستان	p ɒː k e s t ɒː n
پاکستان	p ɑː k i s t ɑː n
پاکستان	p ɔː k i s t ɔː n
پاکستان	p ɒː k ɪ s t ɒː n
قبرستان	q a b ɾ i s t ɑː n
قبرستان	q a b ɾ i s t ɔː n
قبرستان	q a b ɾ ɪ s t ɒː n
رستوران	r e s t o ɾ ɒː n
سه‌بعدی	s e b o ʔ d iː
سلیمانی	s o l e j m ɒː n iː
سورپریز	s u r p i ɾ i z
سورپریز	s u r p ɾ i z
سرانجام	s æ ɾ æ n d͡ʒ ɒː m
ثابت‌ها	s ɒː b e tʰ h ɒː
ساده‌تر	s ɒː d e t æ ɾ
تغییرات	t æ ɣ j iː ɾ ɒː t
تقریباً	t æ ɣ ɾ iː b æ n
تابستان	t ɒː b e s t uː n
تابستان	t ɒː b e s t ɒː n
تابستان	t ɑː b i s t ɑː n
تابستان	t ɔː b i s t ɔː n
تابستان	t ɒː b ɪ s t ɒː n
تازه‌تر	t ɒː z e t æ ɾ
تاریخچه	t ɔː ɾ i x t ʃ a
تاریخچه	t ɑː ɾ iː x t ʃ a
تاریخچه	t ɒː ɾ iː x t ʃ a
تاریخچه	t ɒː ɾ iː x t ʃ e
اوگاندا	u ɡ ɔː n d ɔː
اوگاندا	uː ɡ uː n d ɒː
اوگاندا	uː ɡ ɑː n d ɑː
اوگاندا	uː ɡ ɒː n d ɒː
واژه‌ها	v ɒː ʒ e h ɒː
خداحافظ	x o d ɒː h ɒː f e z
خشکوندن	x o ʃ k uː n d æ n
خشکاندن	x o ʃ k ɒː n d æ n
خوشنویس	x o ʃ n e v iː s
خراسانی	x o ɾ ɒː s ɒː n iː
خداحافظ	x u d ɑː h ɑː f i z
خداحافظ	x u d ɔː h ɔː f i z
خراسانی	x u ɾ ɔː s ɔː n iː
خانواده	x uː n e   v ɒː d e
خزندگان	x æ z æ n d e ɡ ɒː n
خداحافظ	x ʊ d ɒː h ɒː f ɪ z
خراسانی	x ʊ ɾ ɒː s ɒː n iː
خاکستری	x ɒː k e s t æ ɾ
خاکستری	x ɑː k i s t a ɾ
خاکستری	x ɔː k i s t a ɾ
خاکستری	x ɒː k ɪ s t a ɾ
خانواده	x ɑː n a   v ɑː d a
خانواده	x ɔː n a   v ɔː d a
خانواده	x ɒː n a   w ɒː d a
خانواده	x ɒː n e   v ɒː d e
خواننده	x ɒː n æ n d e
خواستار	x ɒː s t̪ ɒː ɾ
خراسانی	xʷ a ɾ ɑː s ɑː n iː
زبان‌ها	z æ b ɒː n h ɒː
عجیب‌تر	æ d ʒ iː b t æ ɾ
امین‌ها	æ m iː n h ɒː
اخترمار	æ x t æ ɾ m ɒː ɾ
ریگستان	ɾ e ɡ i s t ɔː n
ریگستان	ɾ eː ɡ i s t ɑː n
ریگستان	ɾ eː ɡ ɪ s t ɒː n
ریگستان	ɾ iː ɡ e s t uː n
ریگستان	ɾ iː ɡ e s t ɒː n
شلوغ‌تر	ʃ o l uː ɣ t æ ɾ
امیدیار	ʔ o m iː d y ɒː ɾ
گذراندن	ɡ o z æ ɾ ɒ n d æ n
اورشلیم	ʔ o ɾ ʃ æ l iː m
شغال‌ها	ʃ o ɣ ɒː l ɒː
روزنامه	ɾ oː z   n ɑː m a
روزنامه	ɾ oː z   n ɒː m a
گورستان	ɡ oː ɾ i s t ɑː n
گورستان	ɡ oː ɾ ɪ s t ɒː n
رودخانه	ɾ uː d x ɒː n e
روزنامه	ɾ uː z   n uː m e
روزنامه	ɾ uː z   n ɒː m e
گورستان	ɡ uː ɾ e s t uː n
گورستان	ɡ uː ɾ e s t ɒː n
قبرستان	ɣ æ b ɾ e s t uː n
قبرستان	ɣ æ b ɾ e s t ɒː n
شنبلیله	ʃ æ m b æ l iː l e
شنبلیله	ʃ æ m b æ l iː l æ
گزاف‌تر	ɡ æ z ɒː f t æ ɾ
شغال‌ها	ʃ æ ɣ ɒː l h ɒː
شاهنشاه	ʃ ɑː h a n ʃ ɑː h
شاهنشاه	ʃ ɒː h a n ʃ ɒː h
شاهنشاه	ʃ ɔː h a n ʃ ɔː h
شاهنامه	ʃ ɒː h n uː m e
شاهنامه	ʃ ɑː h n ɑː m a
شاهنامه	ʃ ɒː h n ɒː m a
شاهنامه	ʃ ɔː h n ɔː m a
شاهنامه	ʃ ɒː h n ɒː m e
شاهزاده	ʃ ɒː h z ɒː d e
شاهنشاه	ʃ ɒː h æ n ʃ ɒː h
روزنامه	ɾ ɵː z   n ɔː m a
گورستان	ɡ ɵː ɾ i s t ɔː n
آموزگار	ɑː m oː z ɡ ɑː ɾ
آموزگار	ɒː m oː z ɡ ɒː ɾ
آموزگار	ɒː m uː z ɡ ɒː ɾ
آموزگار	ɔː m ɵː z ɡ ɔː ɾ
آشوب‌ها	ɒː ʃ uː b h ɒː
بفرمایید	b e f æ ɾ m ɒː j iː d
به‌آفرید	b e h   ɔː f a ɾ i d
به‌آفرید	b e h   ɒː f e ɾ iː d
به‌آفرید	b e h   ɒː f æ ɾ iː d
بلافاصله	b e l ɒː f ɒː s e l e
به‌آفرید	b i h   ɑː f a ɾ iː d
برخوردار	b æ ɾ x o ɾ d ɒː ɾ
برخوردار	b æ ɾ x u ɾ d ɒː ɾ
