ه	a
چینی	t ʃ i n iː
چقدر	t ʃ i q a d a ɾ
چیزی	t ʃ i z e
چراغ	t ʃ i ɾ ɑː ɣ ~ t ʃ a ɾ ɑː ɣ
چراغ	t ʃ i ɾ ɔː ɣ ~ t ʃ a ɾ ɔː ɣ
چینی	t ʃ iː n iː
چیست	t ʃ iː s t
چیزی	t ʃ iː z eː
چیزی	t ʃ iː z iː
چنین	t ʃ o n iː n
چنان	t ʃ o n ɒː n
چکمه	t ʃ æ k m e
چربی	t ʃ æ r b iː
ترنج	t ʊ ɾ a n d ʒ
چهره	t ʃ ɪ h ɾ a
چقدر	t ʃ ɪ q a d a ɾ
ترشی	t ʊ ɾ ʃ iː
ترنج	t ʊ ɾ ʊ n d ʒ
چراغ	t ʃ ɪ ɾ ɒː ɣ ~ t ʃ a ɾ ɒː ɣ
طاقت	t ɑː q a t
طاقت	t ɒː q a t
طاقت	t ɔː q a t
تازه	t ɑː z a
تازه	t ɒː z a
تازه	t ɔː z a
تازه	t ɒː z e
طاقت	t ɒː ɣ æ t
چاشت	t ʃʰ ɒː ʃ tʰ
چشمه	t͡ʃ æ ʃ m æ
عنصر	u n s u ɾ
آمدن	uː m æ d æ n
آمار	uː m ɒː ɾ
آنجا	uː n d ʒ ɒː
وقتی	v a q t e
وقتی	v a q t eː
وسیع	v a s e ʔ
وسیع	v a s iː ʔ
وعده	v a ʔ d a
ونوس	v e n uː s
وسیع	v e s iː
والا	v æ e l l ɒː
وسیع	v æ s iː ʔ
وعده	v æ ʔ d e
وقتی	v æ ɣ t iː
وعده	v æː d e
والا	v ɒː l ɒː
وارث	v ɑː r e s
واژه	v ɑː ʒ a
واژه	v ɔː ʒ a
واژه	v ɒː ʒ e
وقتی	w a q t eː
وسیع	w a s iː ʔ
وعده	w a ʔ d a
واژه	w ɒː ʒ a
خیلی	x a j l iː
خربز	x a ɾ b u z
خربز	x a ɾ b ʊ z
خیلی	x e j l iː
خیار	x e j ɒː ɾ
خویش	x e ʃ
خویش	x eː ʃ
خدیو	x i d eː w
خیار	x i j ɑː ɾ
خیار	x i j ɒː ɾ
خیار	x i j ɔː ɾ
خویش	x iː ʃ
خدای	x o d ɒː j
خوره	x o rː æ h
خوره	x o ɾ e
خرما	x o ɾ m ɒː
خروس	x o ɾ uː s
خونه	x oː n æ
خرما	x u ɾ m ɑː
خرما	x u ɾ m ɔː
خانه	x uː n e
خدیو	x æ d eː w
خدیو	x æ d iː v
ختنه	x æ tʰ n e
خزان	x æ z ɒː n
خربز	x æ ɾ b o z
خروس	x ɾ o s
خرما	x ʊ ɾ m ɒː
خروس	x ʊ ɾ oː s
خواب	x ɒː b
خواب	x ɔː b
خالق	x ɒː l e ɣ
خالق	x ɑː l i q
خالق	x ɔː l i q
خالق	x ɒː l ɪ q
خانه	x ɑː n a
خانه	x ɒː n a
خانه	x ɔː n a
خانه	x ɒː n e
خارج	x ɒː ɾ e d ʒ
خارج	x ɑː ɾ i d ʒ
خارج	x ɔː ɾ i d ʒ
خارج	x ɒː ɾ ɪ d ʒ
خویش	xʷ eː ʃ
خواب	xʷ ɑː b
زبان	z a b ɑː n
زبان	z a b ɒː n
زبان	z a b ɔː n
زمین	z a m i n
زمین	z a m iː n
زمان	z a m ɑː n
زمان	z a m ɒː n
زمان	z a m ɔː n
زیبا	z e b ɔː
زمین	z e m iː n
زنده	z e n d e
زئوس	z e uː s
زرشک	z e ɾ e ʃ k
زگیل	z e ɡ iː l
زشتی	z e ʃ t iː
زیبا	z eː b ɑː
زیبا	z eː b ɒː
زنده	z i n d a
زیبا	z iː b ɒː
زیاد	z iː j ɒː d
زیره	z iː ɾ e
زیره	z iː ɾ æ
ظهور	z o h uː ɾ
زورق	z o w ɾ a q
زورق	z o w ɾ æ ɣ
ظهور	z u h u ɾ
ظهور	z u h uː ɾ
زبان	z æ b ɒː n
زمین	z æ m iː n
زمان	z æ m ɒː n
زنبق	z æ n b æ q
ضخیم	z æ x iː m
ظهور	z ʊ h uː ɾ
زیاد	z ɪ j ɒː d
زنده	z ɪ n d a
زبان	z ɒː b uː n
زاده	z ɑː d a
زاده	z ɒː d a
زاده	z ɔː d a
زاده	z ɒː d e
زمان	z ɒː m uː n
ذاتی	z ɒː t iː
ابرش	æ b ɾ æ ʃ
امین	æ m iː n
اندی	æ n d eː
انار	æ n ɒː ɾ
اصلی	æ s l iː
اولی	æ v v æ l iː
اشرج	æ ʃ r æ d ʒ
اعضا	æ ʔ z ɒ
شبنم	ʃ a b n a m
گندم	ɡ a n d u m
گندم	ɡ a n d ʊ m
شوهر	ʃ a v h a ɾ
گوهر	ɡ a v h a ɾ
روشن	ɾ a v ʃ a n
شوهر	ʃ a w h a ɾ
گوهر	ɡ a w h a ɾ
روشن	ɾ a w ʃ a n
گشتن	ɡ a ʃ t a n
عجان	ʔ e d ʒ ɒː n
شیدا	ʃ e j d ɒː
قیچی	ɣ e j t ʃ iː
شکال	ʃ e k ɒː l
گیسو	ɡ e s u
شوید	ʃ e v iː d
گزاف	ɡ e z ɒː f
ریشه	ɾ e ʃ a
قرمز	ɣ e ɾ m e z
قشنگ	ɢ e ʃ æ ŋ ɡ
گیسو	ɡ eː s uː
گیتی	ɡ eː t iː
شیوا	ʃ eː w ɒː
ریشه	ɾ eː ʃ a
شیشه	ʃ i ʃ a
قیمت	ɣ iː m æ t
گیسو	ɡ iː s uː
گیتی	ɡ iː t iː
گیتا	ɡ iː t ɒː
شیوا	ʃ iː v ɒː
شیشه	ʃ iː ʃ a
ریشه	ɾ iː ʃ e
شیشه	ʃ iː ʃ e
عنصر	ʊ n s ʊ ɾ
شدنی	ʃ o d æ n iː
شکال	ʃ o k ɒː l
گلپر	ɡ o l p æ ɾ
شلوغ	ʃ o l uː ɣ
گلاب	ɡ o l ɒː b
شمال	ʃ o m ɒː l
امید	ʔ o mː iː d
گناه	ɡ o n ɒː h
شروع	ʃ o r uː ʔ
شوهر	ʃ o u h æ ɾ
گوهر	ɡ o u h æ ɾ
روشن	ɾ o u ʃ æ n
شعبه	ʃ o ʔ b e
گربه	ɡ o ɾ b e
اشتر	ʔ o ʃ t o ɾ
گروه	ɡ o ɾ uː h
گرزه	ɡ o ɾ z e
گشاد	ɡ o ʃ ɒː d
شغال	ʃ o ɣ ɒː l
گراز	ɡ o ɾ ɒː z
شورا	ʃ o ʊ̯ ɾ ɒː
شعبه	ʃ oː b e
شوهر	ʃ oː h æ ɾ
گوهر	ɡ oː h æ ɾ
گویش	ɡ oː j i ʃ
گویش	ɡ oː j ɪ ʃ
رومی	ɾ oː m iː
شوخی	ʃ oː x iː
گوشه	ɡ oː ʃ a
شوره	ʃ oː ɾ e
گوشت	ɡ oː ʃ t
روشن	ɾ oː ʃ æ n
ققنس	ˑ q a q n u s ~ q u q n u s
ققنس	ˑ q a q n ʊ s ~ q ʊ q n ʊ s
گلپر	ɡ u l p a ɾ
گلاب	ɡ u l ɑː b
گلاب	ɡ u l ɔː b
امید	ʔ u mː e d
امید	ʔ u mː eː d
گناه	ɡ u n ɑː h
گناه	ɡ u n ɔː h
شعبه	ʃ u ʔ b a
گربه	ɡ u ɾ b a
گروه	ɡ u ɾ oː h
گرزه	ɡ u ɾ z a
شورا	ʃ u ɾ ɔː
گروه	ɡ u ɾ ɵː h
گویش	ɡ uː j e ʃ
رومی	ɾ uː m iː
شوخی	ʃ uː x iː
گوشه	ɡ uː ʃ e
گوشت	ɡ uː ʃ t
شوره	ʃ uː ɾ æ
شورا	ʃ uː ɾ ɑː
شورا	ʃ uː ɾ ɒː
شبنم	ʃ æ b n æ m
ابری	ʔ æ b ɾ iː
قفسه	ɢ æ f æ s e
قهوه	ɣ æ h v e
شیدا	ʃ æ j d ɒː
ایام	ʔ æ j j ɒː m
غیرت	ɣ æ j ɾ æ t
ژکفر	ʒ æ k f æ ɾ
شلغم	ʃ æ l ɣ æ m
گندم	ɡ æ n d o m
گردن	ɡ æ r d æ n
روند	ɾ æ v æ n d
گزاف	ɡ æ z ɒː f
ژرفی	ʒ æ ɾ f iː
گشتن	ɡ æ ʃ t æ n
عروس	ʔ æ ɾ uː s
قشنگ	ɢ æ ʃ æ ŋ ɡ
عقرب	ʔ æ ɣ ɾ æ b
شغال	ʃ æ ɣ ɒː l
گلپر	ɡ ʊ l p a ɾ
گلاب	ɡ ʊ l ɒː b
امید	ʔ ʊ mː eː d
گناه	ɡ ʊ n ɒː h
ققنس	ˑ ɣ æ ɣ n o s ~ ɣ o ɣ n o s
شعبه	ʃ ʊ ʔ b a
گربه	ɡ ʊ ɾ b a
گروه	ɡ ʊ ɾ oː h
گرزه	ɡ ʊ ɾ z a
قابل	ɣ ɒː b e l
شاعر	ʃ ɒː e ɾ
غایب	ɣ ɒː j e b
قایق	ɢ ɒː j e ɣ
غایب	ɣ ɑː j i b
غایب	ɣ ɔː j i b
گویش	ɡ ɵː j i ʃ
شاید	ʃ ɒː j æ d
غایب	ɣ ɒː j ɪ b
ژاله	ʒ ɑː l a
ژاله	ʒ ɒː l a
ژاله	ʒ ɔː l a
ژاله	ʒ ɒː l e
رومی	ɾ ɵː m iː
قاسم	ɢ ɒː s e m
عاصی	ʔ ɒː s iː
شاخه	ʃ ɒː x e
شوخی	ʃ ɵː x iː
آخور	ʔ ɒː x o ɾ
آخور	ʔ ɒː xʷ æ ɾ
گوشه	ɡ ɵː ʃ a
شعبه	ʃ ɵː ʔ b a
آرزو	ʔ ɒː ɾ e z uː
شاعر	ʃ ɒː ʔ e ɾ
شاعر	ʃ ɑː ʔ i ɾ
شاعر	ʃ ɔː ʔ i ɾ
گاری	ɡ ɒː ɾ iː
قاقم	ɢ ɑː ɢ o m
گوشت	ɡ ɵː ʃ t
شاعر	ʃ ɒː ʔ ɪ ɾ
شورا	ʃ ɵː ɾ ɔː
آغاز	ʔ ɒː ɣ ɒː z
آبان	ɒː b ɒː n
آهار	ɑː h ɑː ɾ
آهار	ɒː h ɒː ɾ
آهار	ɔː h ɔː ɾ
آمدن	ɑː m a d a n
آمدن	ɒː m a d a n
آمدن	ɔː m a d a n
آمدن	ɒː m æ d æ n
آمار	ɑː m ɑː ɾ
آمار	ɒː m ɒː ɾ
آمار	ɔː m ɔː ɾ
آنجا	ɑː n d ʒ ɑː
آنجا	ɒː n d ʒ ɒː
آنجا	ɔː n d ʒ ɔː
انار	ɒː n ɒː ɾ
آسان	ɒː s uː n
آسیا	ɒː s ɪ j ɒː
آسان	ɑː s ɑː n
آسان	ɒː s ɒː n
آسان	ɔː s ɔː n
آچار	ɑː t ʃ ɑː ɾ
آچار	ɒː t ʃ ɒː ɾ
آچار	ɔː t ʃ ɔː ɾ
عاشق	ɒː ʃ e ɣ
عاشق	ɑː ʃ i q
عاشق	ɔː ʃ i q
آژیر	ɒː ʒ iː ɾ
آشتی	ɒː ʃ t iː
آشوب	ɒː ʃ uː b
آژیر	ɔː ʔ ʒ i ɾ
آژیر	ɑː ʔ ʒ iː ɾ
آژیر	ɒː ʔ ʒ iː ɾ
عاشق	ɒː ʃ ɪ q
ابزار	a b z ɑː ɾ
ابزار	a b z ɒː ɾ
ابزار	a b z ɔː ɾ
افسوس	a f s oː s
افسوس	a f s ɵː s
افرنگ	a f ɾ a n ɡ
افغان	a f ɣ ɑː n
افغان	a f ɣ ɒː n
افغان	a f ɣ ɔː n
اورنگ	a v ɾ a n ɡ
اورنگ	a w ɾ a n ɡ
اخبار	a x b ɑː ɾ
اخبار	a x b ɒː ɾ
اخبار	a x b ɔː ɾ
بدبخت	b a d b a x t
بخاطر	b a   x ɑː t i ɾ i
بخاطر	b a   x ɔː t i ɾ i
بخاطر	b a   x ɒː t ɪ ɾ ɪ
بغداد	b a ɣ d ɑː d
بغداد	b a ɣ d ɒː d
بغداد	b a ɣ d ɔː d
بردار	b a ɾ d ɑː ɾ
بردار	b a ɾ d ɒː ɾ
بردار	b a ɾ d ɔː ɾ
بدرود	b e d ɾ uː d
بهبود	b e h b uː d
بیمار	b e m ɔː ɾ
بسیار	b e s j ɒː ɾ
بخاطر	b e   x ɒː t e ɾ e
بیشتر	b e ʃ t a ɾ
بیمار	b eː m ɑː ɾ
بیمار	b eː m ɒː ɾ
بیشتر	b eː ʃ t a ɾ
بسیار	b i s j ɑː ɾ
بسیار	b i s j ɔː ɾ
بیمار	b iː m ɒː ɾ
بیشتر	b iː ʃ t æ ɾ
بیرون	b iː ɾ uː n
بهتان	b o h t u n
بهتان	b o h t ɒ n
بحران	b o h ɾ uː n
بحران	b o h ɾ ɒː n
بخارا	b o x ɒː ɾ ɒː
بریدن	b o ɾ iː d æ n
بحران	b u h ɾ ɑː n
بوران	b uː ɾ ɒ n
بدبخت	b æ d b æ x t
بهاری	b æ h ɒː ɾ iː
بسنده	b æ s æ n d e
بغداد	b æ ɣ d ɒː d
بردار	b æ ɾ d ɒː ɾ
بحران	b ʊ h ɾ ɒː n
بسیار	b ɪ s j ɒː ɾ
بخارا	b ʊ x ɒː ɾ ɒː
بحران	b ɵː h ɾ ɔː n
بایست	b ɒː j e s t
بامزه	b ɒː m æ z e
بازار	b ɑː z ɑː ɾ
بازار	b ɒː z ɒː ɾ
بازار	b ɔː z ɔː ɾ
باریک	b ɒː ɾ iː k
بارود	b ɒː ɾ uː d
باروت	b ɒː ɾ uː t
باران	b ɒː ɾ ɒː n
باغات	b ɒː ɣ ɒː t̪
دقیقه	d a q i q a
دقیقه	d a q iː q a
دستار	d a s t ɒː ɾ
دهقان	d e h q ɔː n
دهقان	d e h ɣ uː n
دهقان	d e h ɣ ɒː n
دندان	d e n d ɒː n
دقیقه	d e ɣ iː ɣ e
دهقان	d i h q ɑː n
دیروز	d i ɾ ɵː z
دیروز	d iː ɾ oː z
دیروز	d iː ɾ uː z
دلفین	d o l f iː n
درودن	d o ɾ uː d æ n
دلفین	d æ l f iː n
دندان	d æ n d ɒː n
دنیدن	d æ n iː d æ n
دقیقه	d æ ɣ iː ɣ e
درگاه	d æ ɾ ɡ ɒː h
دهقان	d ɪ h q ɒː n
جوراب	d ʒ oː ɾ ɒː b
جانور	d ʒ uː n v æ ɾ
جویدن	d ʒ æ v iː d æ n
جانور	d ʒ ɑː n v a ɾ
جانور	d ʒ ɔː n v a ɾ
جانور	d ʒ ɒː n v æ ɾ
جانور	d ʒ ɒː n w a ɾ
داماد	d ɒː m ɒː d
داوود	d ɒː v uː d
داوود	d ɒː w uː d
داشتن	d ɑː ʃ t a n
داشتن	d ɒː ʃ t a n
داشتن	d ɔː ʃ t a n
داشتن	d ɒː ʃ t æ n
دلسوز	d̪ i l s oː z
جمشید	d͡ʒ æ m ʃ eː d
جمشید	d͡ʒ æ m ʃ iː d
جعفری	d͡ʒ æ ʔ f æ ɾ iː
ابریق	e b ɾ iː ɣ
اجازه	e d ʒ ɒː z e
افطار	e f t ɒː ɾ
امضاء	e m z ɒː
امروز	e m ɾ uː z
انکار	e n k ɒː ɾ
اسفند	e s f æ n d̪
ـستان	e s t uː n
ـستان	e s t ɒː n
اتمام	e t m ɒː m
اتفاق	e tː e f ɒː ɣ
اظهار	e z h ɒː ɾ
اضافه	e z ɒː f e
اقرار	e ɣ ɾ ɒː ɾ
اراده	e ɾ ɒː d e
ارادت	e ɾ ɒː d æ t
ایران	e ɾ ɔː n
ایشان	e ʃ ɔː n
ایران	eː ɾ ɑː n
ایران	eː ɾ ɒː n
ایشان	eː ʃ ɑː n
ایشان	eː ʃ ɒː n
فهرست	f e h ɾ e s t
فهرست	f e h ɾ i s t
فردوس	f e ɾ d o u s
فردوس	f e ɾ d oː s
فرشته	f e ɾ e ʃ t e
فهرست	f i h ɾ i s t
فردوس	f i ɾ d a v s
فردوس	f i ɾ d a w s
فروهر	f o ɾ uː h æ ɾ
فروهر	f u ɾ oː h æ ɾ
فلاخن	f æ l ɒː x æ n
فغفور	f æ ɣ f uː ɾ
فرشته	f æ ɾ ɪ ʃ t æ
فرانک	f æ ɾ ɒː n æ k
فهرست	f ɪ h ɾ ɪ s t
فایده	f ɒ j d e
فردوس	f ɪ ɾ d a w s
فرشته	f ɪ ɾ ɪ ʃ t æ
فایده	f ɒː j e d e
فامیل	f ɒː m iː l
فانوس	f ɒː n uː s
فائده	f ɒː ʔ e d e
فارسی	f ɑː ɾ s iː
فارسی	f ɒː ɾ s iː
فارسی	f ɔː ɾ s iː
همیشه	h a m   e ʃ a
همیشه	h a m   eː ʃ a
حیوان	h e j v ɒː n
هجران	h i d͡ʒ ɾ ɒː n
حدادی	h æ dː ɒː d iː
همسده	h æ m s e d æ
همیشه	h æ m   iː ʃ e
حقیقت	h æ ɣ iː ɣ æ tʰ
هامون	h ɒː m uː n
ابریق	i b ɾ i q
ابریق	i b ɾ iː q
اجازه	i d ʒ ɑː z a
اجازه	i d ʒ ɔː z a
افطار	i f t ɑː ɾ
افطار	i f t ɔː ɾ
امروز	i m ɾ oː z
امروز	i m ɾ ɵː z
انکار	i n k ɑː ɾ
انکار	i n k ɔː ɾ
اقرار	i q ɾ ɑː ɾ
اقرار	i q ɾ ɔː ɾ
ـستان	i s t ɑː n
ـستان	i s t ɔː n
اظهار	i z h ɑː ɾ
اظهار	i z h ɔː ɾ
اضافه	i z ɔː f a
اضافه	i ð ɑː f a
ایران	iː ɾ uː n
ایشان	iː ʃ uː n
ایران	iː ɾ ɒː n
ایشان	iː ʃ ɒː n
یگانه	j e ɡ ɒː n e
یخچال	j æ x t ʃ ɒː l
یزدان	j æ z d ɒː n
یگانه	j æ ɡ ɒː n æ
یافتن	j ɑː f t a n
یافتن	j ɒː f t a n
یافتن	j ɔː f t a n
یافتن	j ɒː f t æ n
یاکند	j ɒː kʲ æ n d
یاسمن	j ɑː s a m a n
یاسمن	j ɒː s a m a n
یاسمن	j ɔː s a m a n
یاسمن	j ɒː s æ m æ n
یاساق	j ɒː s ɒː q
یاساء	j ɒː s ɒː ʔ
یاقوت	j ɒː ɣ uː t
کمزور	k a m z oː ɾ
کمزور	k a m z ɵː ɾ
کشیدن	k a ʃ i d a n
کشیدن	k a ʃ iː d a n
کردار	k e ɾ d ɒː ɾ
کشیدن	k e ʃ iː d æ n
کریمه	k e ɾ iː m e
کردار	k i ɾ d ɑː ɾ
کردار	k i ɾ d ɔː ɾ
کرایه	k i ɾ ɒː j æ
کیمیا	k iː m i j ɒː
کنسرت	k o n s e ɾ t
کنگره	k o n ɡ r e
کنکور	k o ŋ k uː r
کوفته	k oː f t a
کوتاه	k oː t ɑː h
کوتاه	k oː t ɒː h
کوفته	k uː f t e
کوتاه	k uː t ɒː h
کبوتر	k æ b oː t æ ɾ
کبوتر	k æ b uː t æ ɾ
کم‌کم	k æ m k æ m
کمزور	k æ m z uː ɾ
کنعان	k æ n ʔ ɒː n
کشیدن	k æ ʃ iː d æ n
کشکول	k æ ʃ k uː l
کردار	k ɪ ɾ d ɒː ɾ
کوفته	k ɵː f t a
کوتاه	k ɵː t ɔː h
کاریز	k ɔː ɾ e z
کاریز	k ɑː ɾ eː z
کاریز	k ɒː ɾ eː z
کاریز	k ɒː ɾ iː z
لوبیا	l oː b i i̯ ɒː
لوبیا	l uː b i i̯ ɒː
لبخند	l æ b x æ n d
مجروح	m a d ʒ ɾ uː h
مجروح	m a d ʒ ɾ ɵː h
مفعول	m a f ʔ u l
مفعول	m a f ʔ uː l
میدان	m a j d ɑː n
میدان	m a j d ɒː n
میدان	m a j d ɔː n
ممنوع	m a m n uː ʔ
ممنوع	m a m n ɵː ʔ
منیژه	m a n iː ʒ a
منابع	m a n ɔː b e ʔ
منابع	m a n ɑː b i ʔ
منابع	m a n ɒː b ɪ ʔ
موضوع	m a v z ɵː ʔ
موضوع	m a w z uː ʔ
مردان	m a ɾ d ɑː n
مردان	m a ɾ d ɒː n
مردان	m a ɾ d ɔː n
معروف	m a ʔ ɾ u f
معشوق	m a ʔ ʃ u q
معروف	m a ʔ ɾ uː f
معشوق	m a ʔ ʃ uː q
مهمان	m e h m uː n
مهمان	m e h m ɒː n
مهمان	m e h m ɔː n
میدان	m e j d uː n
میدان	m e j d ɒː n
مقداد	m e ɣ d ɒː d
مقدار	m e ɣ d ɒː ɾ
مهمان	m i h m ɑː n
مقدار	m i q d ɑː ɾ
مقدار	m i q d ɔː ɾ
میرزا	m i ɾ z ɔː ~ m i ɾ z ɔː
میرزا	m iː ɾ z ɒː ~ m e ɾ z ɒː
میرزا	m iː ɾ z ɑː ~ m i ɾ z ɑː
میرزا	m iː ɾ z ɒː ~ m ɪ ɾ z ɒː
می‌گم	m iː ɡ æ m
متخلف	m o t æ x æ l l e f
موضوع	m o u z uː ʔ
موافق	m o v ɒː f e ɣ
مختلف	m o x t æ l e f
مرداد	m o ɾ d̪ ɒː d̪
معجزه	m o ʔ d͡ʒ e z e
مرغان	m o ɾ ɣ ɒː n
مومیا	m oː m i j ɒː
موضوع	m oː z uː
مورچه	m oː ɾ t ʃ a
متخلف	m u t a x a l l i f
مختلف	m u x t a l i f
مومیا	m uː m i j ɒː
مورچه	m uː ɾ t ʃ e
مدهوش	m æ d h u ʃ
مجروح	m æ d ʒ ɾ uː h
مفعول	m æ f uː l
مفعول	m æ f ʔ uː l
ممنوع	m æ m n uː
ممنوع	m æ m n uː ʔ
منیژه	m æ n iː ʒ e
منابع	m æ n ɒː b e ʔ
مراکش	m æ r ɒː k e ʃ
مسعود	m æ s ʔ uː d
مردها	m æ ɾ d h ɒː
مردان	m æ ɾ d uː n
مردان	m æ ɾ d ɒː n
مریضی	m æ ɾ iː z iː
مروزی	m æ ɾ v e z iː
مروزی	m æ ɾ v æ z iː
مروزی	m æ ɾ w æ z iː
معروف	m æ ʔ ɾ uː f
مشغول	m æ ʃ ɣ uː l
معشوق	m æ ʔ ʃ uː ɣ
مغرور	m æ ɣ ɾ uː ɾ
معروف	m æː ɾ uː f
مهمان	m ɪ h m ɒː n
مقدار	m ɪ q d ɒː ɾ
متخلف	m ʊ t a x a l l ɪ f
مختلف	m ʊ x t a l ɪ f
ماهور	m ɒː h uː ɾ
مازوج	m ɔː z u d ʒ
مازوج	m ɑː z uː d ʒ
مازوج	m ɒː z uː d ʒ
ماشین	m ɒː ʃ iː n
مورچه	m ɵː ɾ t ʃ a
نوروز	n a v ɾ ɵː z
نوروز	n a w ɾ oː z
نیایش	n e j ɒː j e ʃ
نیوشا	n i j oː ʃ ɒː
نیایش	n i j ɒː j e ʃ
نیایش	n i j ɑː j i ʃ
نیایش	n i j ɔː j i ʃ
نیایش	n i j ɒː j ɪ ʃ
نوروز	n o u ɾ uː z
نوروز	n oː ɾ uː z
ندارد	n æ d ɒː r æ d
نهفتن	n æ h o f t æ n
نمکین	n æ m æ k iː n
نمایه	n æ m ɒː j e
نسرین	n æ s ɾ iː n
نعناع	n æ ʔ n ɒː ʔ
نالون	n ɒː l uː n
نالان	n ɒː l ɒː n
ناخدا	n ɒː x o d ɒː
ناخدا	n ɒː x o d̪ ɒː
ناخدا	n ɑː x u d̪ ɑː
ناخدا	n ɔː x u d̪ ɔː
ناخدا	n ɒː x ʊ d̪ ɒː
عثمان	o s m ɒː n
استاد	o s t ɒː d
استان	o s tʰ ɒː n
اورنگ	o u ɾ æ n ɡ
عضوها	o z v h ɒ
اورنگ	oː ɾ æ n ɡ
پردیس	p a ɾ d e s
پردیس	p a ɾ d eː s
پرهیز	p a ɾ h e z
پرهیز	p a ɾ h eː z
پیاله	p e j ɒː l e
پروسه	p e ɾ o s e
پروژه	p e ɾ o ʒ e
پیاده	p i j ɒː d e
پیاله	p i j ɑː l a
پیاله	p i j ɒː l a
پیاله	p i j ɔː l a
پیاله	p i j ɒː l e
پیرتر	p iː ɾ t æ ɾ
پرکار	p o ɾ k ɒː ɾ
پروسه	p o ɾ o s e
پروژه	p o ɾ o ʒ e
پوشاک	p oː ʃ ɑː k
پوشاک	p oː ʃ ɒː k
پودنه	p u d i n a
پودنه	p uː d e n e
پودنه	p uː d i n a
پودنه	p uː d ɪ n a
پوشاک	p uː ʃ ɒː k
پیاده	p æ j ɒː d æ
پنجره	p æ n d͡ʒ æ ɾ æ
پردیس	p æ ɾ d iː s
پرهیز	p æ ɾ h iː z
پشمین	p æ ʃ m iː n
پشتون	p æ ʃ t uː n
پرویز	p æ ɾ v iː z
پرویز	p æ ɾ w eː z
پرنده	p æ ɾ ɪ n d æ
پرگار	p æ ɾ ɡ ɒː ɾ
پروسه	p ɾ o s e
پروژه	p ɾ o ʒ e
پاییز	p ɔː i z
پاییز	p ɑː iː z
پاییز	p ɒː iː z
پاپوش	p ɒː p oː ʃ
پارسه	p ɒː ɾ s e
پوشاک	p ɵː ʃ ɔː k
پاداش	pʰ ɑː d̪ ɑː ʃ
پاداش	pʰ ɒː d̪ ɒː ʃ
پاداش	pʰ ɔː d̪ ɔː ʃ
قرمزی	q i ɾ m i z iː
قندوز	q o n d uː z
قلاوز	q u l ɑː v u z
قلاوز	q u l ɔː v u z
قشنگی	q æ ʃ æ n ɡ iː
قلاوز	q ʊ l ɒː w ʊ z
قرمزی	q ɪ ɾ m ɪ z iː
رفتار	r æ f t ɒː r
صنوبر	s a n a v b a ɾ
صنوبر	s a n a w b a ɾ
صندوق	s a n d u q
صندوق	s a n d uː q
سوگند	s a v ɡ a n d
سوگند	s a w ɡ a n d
سپاهی	s e p ɒː h iː
ستاره	s e t ɒː ɾ e
سیزده	s e z d a h
سژناک	s e ʒ n ɒː k
سیزده	s eː z d a h
ستاره	s i t ɑː ɾ a
ستاره	s i t ɔː ɾ a
سیلاس	s iː l ɒː s
سیستم	s iː s tʰ e m
سیزده	s iː z d æ h
سهراب	s o h ɾ ɒː b
سوگند	s o u ɡ æ n d
سریدن	s o ɾ iː d æ n
سوختن	s oː x t a n
سوگند	s oː ɡ æ n d
سهراب	s u h ɾ ɑː b
سوخته	s uː x t e
سوختن	s uː x t æ n
سوریه	s uː ɾ i j e
صورتى	s uː ɾ æ tʰ iː
صورتی	s uː ɾ æ tʰ iː
سمیعی	s æ m iː ʔ iː
صندوق	s æ n d uː ɣ
صندلی	s æ n d æ l iː
صنوبر	s æ n o u b æ ɾ
صنوبر	s æ n oː b æ ɾ
سرداب	s æ ɾ d ɑː b
سردار	s æ ɾ d ɒː ɾ
سرکار	s æ ɾ k ɒː ɾ
سهراب	s ʊ h ɾ ɒː b
ستاره	s ɪ t ɒː ɾ a
صابون	s ɒː b uː n
صاعقه	s ɒː e ɣ e
سهراب	s ɵː h ɾ ɔː b
سالار	s ɒː l ɒː ɾ
ثانیه	s ɑː n i j a
ثانیه	s ɒː n i j a
ثانیه	s ɔː n i j a
ثانیه	s ɒː n i j e
سوختن	s ɵː x t a n
صاعقه	s ɒː ʔ e ɣ e
صاعقه	s ɑː ʔ i q a
صاعقه	s ɔː ʔ i q a
صاعقه	s ɒː ʔ ɪ q a
تجربه	t a d ʒ ɾ u b a ~ t a d ʒ ɾ i b a
تجربه	t a d ʒ ɾ ʊ b a ~ t a d ʒ ɾ ɪ b a
تفریح	t a f ɾ e h
تفریح	t a f ɾ iː h
طیاره	t a j j ɑː ɾ a
طیاره	t a j j ɒː ɾ a
طیاره	t a j j ɔː ɾ a
ترازو	t a ɾ ɔː z u
ترازو	t a ɾ ɑː z uː
ترازو	t a ɾ ɒː z uː
تهران	t e h ɾ uː n
تهرون	t e h ɾ uː n
تهران	t e h ɾ ɒː n
تهران	t e h ɾ ɔː n
طیاره	t e j j ɒː ɾ e
تیزاب	t e z ɔː b
تعداد	t e ʔ d ɒː d
تعداد	t e ʔ d ɔː d
تعداد	t eː d ɒː d
تیزاب	t eː z ɑː b
تیزاب	t eː z ɒː b
تهران	t i h ɾ ɑː n
تعداد	t i ʔ d ɑː d
تیزاب	t iː z ɒː b
تنبان	t o m b ɒ n
تجربه	t æ d ʒ ɾ o b e ~ t æ d ʒ ɾ e b e
تجربی	t æ d ʒ ɾ o b iː
تفریح	t æ f ɾ iː h
تکفور	t æ k f uː ɾ
تندیس	t æ n d iː s
تنیدن	t æ n iː d æ n
تصحیح	t æ s h iː h
تقدیر	t æ ɣ d iː ɾ
تغییر	t æ ɣ j iː ɾ
تعلیم	t æ ʔ l i m
تقصیر	t æ ɣ s iː ɾ
ترازو	t æ ɾ ɒː z uː
چگونه	t ʃ e ɡ uː n e
تهران	t ɪ h ɾ ɒː n
چگونه	t ʃ i ɡ u n a
چگونه	t ʃ i ɡ uː n a
تعداد	t ɪ ʔ d ɒː d
چگونه	t ʃ ɪ ɡ uː n a
تاجور	t ɒː d ʒ v æ ɾ
تاجور	t ɒː d ʒ w æ ɾ
چشمان	t ʃʰ e ʃ m ɒː
چشمان	t ʃʰ e ʃ m ɒː n
طاووس	t ɔː v u s
طاووس	t ɑː v uː s
طاووس	t ɒː v uː s
طاووس	t ɒː w uː s
تازگی	t ɑː z a   ɡ iː
تازگی	t ɒː z a   ɡ iː
تازگی	t ɔː z a   ɡ iː
تازگی	t ɒː z e   ɡ iː
چشمان	t ʃʰ æ ʃ m ɒː
چشمان	t ʃʰ æ ʃ m ɒː n
تاریخ	t ɔː ɾ i x
تاریخ	t ɑː ɾ iː x
تاریخ	t ɒː ɾ iː x
ترازو	t ɒː ɾ ɒː z uː
چاشنی	t ʃʰ ɒː ʃ n iː
توزیع	tʰ o ʊ̯ z iː ʔ
تعارف	tʰ æ ʔ ɒː ɾ o f
عثمان	u s m ɑː n
عثمان	u s m ɔː n
استاد	u s t ɑː d
استاد	u s t ɔː d
آموزش	uː m uː z e ʃ
ویستا	v i s t ɒ
وروجک	v o ɾ uː d͡ʒ æ kʲ
وروجک	v u ɾ u d͡ʒ e kʲ
وزیدن	v æ z iː d æ n
خربزه	x a ɾ b u z a
خربزه	x a ɾ b ʊ z a
خرگوش	x a ɾ ɡ oː ʃ
خرگوش	x a ɾ ɡ ɵː ʃ
خودرو	x o d ɾ o u
خودرو	x o d ɾ oː
خوشبو	x o ʃ b uː j
خرداد	x o ɾ d̪ ɒː d̪
خوراک	x o ɾ ɒː k
خوردن	x oː ɾ d æ n
خودرو	x u d ɾ a v
خوشبو	x u ʃ b ɵː j
خوراک	x u ɾ ɔː k
خونین	x uː n iː n
خانگی	x uː n æː ɡ iː
خوردن	x v u ɾ d æ n
خندون	x æ n d uː n
خندان	x æ n d ɒ n
خزیدن	x æ z iː d æ n
خزینه	x æ z iː n e
خزینه	x æ z iː n æ
خزنده	x æ z æ n d e
خزاعی	x æ z ɒː ʔ iː
خربزه	x æ ɾ b o z e
خریدن	x æ ɾ iː d æ n
خرگوش	x æ ɾ ɡ uː ʃ
خودرو	x ʊ d ɾ a w
خوشبو	x ʊ ʃ b uː j
خوراک	x ʊ ɾ ɒː k
خواجه	x ɒː d ʒ a
خواجه	x ɔː d ʒ a
خواجه	x ɒː d ʒ e
خواهر	x ɒː h a ɾ
خواهر	x ɔː h a ɾ
خواهر	x ɒː h æ ɾ
خاموش	x ɑː m oː ʃ
خاموش	x ɒː m oː ʃ
خاموش	x ɒː m uː ʃ
خاموش	x ɔː m ɵː ʃ
خانگی	x ɑː n a ʔ ɡ iː
خانگی	x ɒː n a ʔ ɡ iː
خانگی	x ɔː n a ʔ ɡ iː
خانگی	x ɒː n æ ʔ ɡ iː
خوردن	x ɵː r d a n
خاتمه	x ɒː t e m e
خاتمه	x ɑː t i m a
خاتمه	x ɔː t i m a
خاتمه	x ɒː t ɪ m a
خاطره	x ɒː tʰ e ɾ e
خارجه	x ɒː ɾ e d ʒ e
خارجه	x ɑː ɾ i d ʒ a
خارجه	x ɔː ɾ i d ʒ a
خارجه	x ɒː ɾ ɪ d ʒ a
خودرو	xʷ a d ɾ a w
خوشبو	xʷ a ʃ b uː j
خوراک	xʷ a ɾ ɑː k
خواجه	xʷ ɑː d ʒ a
خواهر	xʷ ɑː h a ɾ
زنبور	z a m b u ɾ
زنبور	z a m b uː ɾ
زنانه	z a n ɑː n a
زنانه	z a n ɒː n a
زنانه	z a n ɔː n a
زندگی	z e n d e   ɡ iː
زندان	z e n d uː n
زندان	z e n d ɒː n
زرشکی	z e ɾ e ʃ k iː
زندگی	z i n d a   ɡ iː
زندان	z i n d ɑː n
زندان	z i n d ɔː n
زیستن	z iː s t æ n
زنبور	z æ m b uː ɾ
زنانه	z æ n ɒː n e
ضربان	z æ ɾ æ b ɒː n
زندگی	z ɪ n d a   ɡ iː
زندان	z ɪ n d ɒː n
زنانه	z ɒː n uː n e
ابزار	æ b z ɒː ɾ
ادیان	æ d j ɒː n
افسوس	æ f s uː s
افرنگ	æ f ɾ æ n ɡ
افغان	æ f ɣ ɒː n
اهواز	æ h w ɒː z
اخبار	æ x b ɒː ɾ
اگرچه	æ ɡ æ ɾ t ʃ e
شیطان	ʃ a j t ɑː n
شیطان	ʃ a j t ɒː n
شیطان	ʃ a j t ɔː n
شلوار	ʃ a l v ɔː ɾ
روشنی	ɾ a v ʃ a n iː
روشنی	ɾ a w ʃ a n iː
ابریق	ɪ b ɾ iː q
اجازه	ɪ d ʒ ɒː z a
شیطان	ʃ e j t uː n
شیطان	ʃ e j t ɒː n
شکستن	ʃ e kʲ æ s t̪ʰ æ n
شنیدن	ʃ e n iː d æ n ~ ʃ o n iː d æ n
شناسی	ʃ e n ɒː s iː
گربسن	ɡ e r b e s æ n
اسلام	ʔ e s l uː m
اسلام	ʔ e s l ɒː m
ریختن	ɾ e x t a n
گرفتن	ɡ e ɾ e f t æ n
قرمزی	ɣ e ɾ m e z iː
گشنیز	ɡ e ʃ n iː z
شیراز	ʃ e ɾ ɔː z
ریختن	ɾ eː x t a n
شیراز	ʃ eː ɾ ɑː z
شیراز	ʃ eː ɾ ɒː z
افطار	ɪ f t ɒː ɾ
شنیدن	ʃ i n i d a n ~ ʃ u n i d a n
شنیدن	ʃ i n iː d a n ~ ʃ u n iː d a n
شناسی	ʃ i n ɑː s iː
شناسی	ʃ i n ɔː s iː
اسلام	ʔ i s l ɑː m
اسلام	ʔ i s l ɔː m
گرفتن	ɡ i ɾ i f t a n
ریختن	ɾ iː x t æ n
شیرین	ʃ iː ɾ iː n
شیراز	ʃ iː ɾ ɒː z
امروز	ɪ m ɾ oː z
انکار	ɪ n k ɒː ɾ
رباعی	ɾ o b ɒː iː
رباعی	ɾ o b ɒː ʔ iː
گدازه	ɡ o d ɒː z e
گفتگو	ɡ o f t o ɡ uː j
گلدان	ɡ o l d ɒː n
گلابی	ɡ o l ɒː b iː
قلاوز	ɣ o l ɒː v o z
قندوز	ɢ o n d uː z
گنجشک	ɡ o n d ʒ e ʃ k
روشنی	ɾ o u ʃ æ n iː
گذشته	ɡ o z æ ʃ t e
گذشتن	ɡ o z æ ʃ t æ n
گرختن	ɡ o ɾ eː x t æ n
گرختن	ɡ o ɾ oː x t æ n
روباه	ɾ oː b ɑː h
روباه	ɾ oː b ɒː h
گودرز	ɡ oː d æ ɾ z
شوربا	ʃ oː ɾ b ɑː
شوربا	ʃ oː ɾ b ɒː
روشنی	ɾ oː ʃ e n iː
گورخر	ɡ oː ɾ x æ ɾ
گوگرد	ɡ oː ɡ ɪ ɾ d
ققنوس	ˑ q a q n u s ~ q u q n u s
