ی	eː
مهاجر	m o h ɒː d ʒ e ɾ
متوسط	m o t̪ʰ æ v æ sː e t̪ʰ
مخالف	m o x ɒː l e f
مزخرف	m o z æ x ɾ æ f
معجزه	m o ʔ d͡ʒ e z e
مشیری	m o ʃ iː ɾ iː
معتبر	m o ʔ t̪ʰ æ b æ ɾ
مجتبی	m o ʒ t̪ʰ æ b ɒː
مشتری	m o ʃ t̪ʰ æ ɾ iː
مشترک	m o ʃ t̪ʰ æ ɾ æ kʲ
مرغاب	m o ɾ ɣ ɒː b
معجزه	m oː d͡ʒ e z e
معتبر	m oː t̪ʰ æ b æ ɾ
ماندن	m u n d æ n
مرداد	m u ɾ d̪ ɒː d̪
مومیا	m uː m i j ɒː
موندن	m uː n d æ n
مانده	m uː n d̪ e
موریس	m uː ɾ iː s
مدفون	m æ d f uː n
مجاری	m æ d ʒ ɒː ɾ iː
مدینه	m æ d̪ iː n e
مفتون	m æ f t̪ʰ uː n
مفقود	m æ f ɣ uː d
مهیار	m æ h j ɒː ɾ
محمود	m æ h m uː d̪
مهنوش	m æ h n uː ʃ
مکنزی	m æ kʲ e n z i
مکنزی	m æ kʲ e n z iː
مکیدن	m æ kʲ iː d æ n
ملوان	m æ l æ v ɒ n
منطقه	m æ n tʰ æ ɣ e
مقاله	m æ q ɒː l æ
مسیحی	m æ s iː h iː
مسئله	m æ s ʔ æ l e
مساجد	m æ s ɒː d ʒ e d
مترسک	m æ t æ ɾ s æ k
مذهبی	m æ z h æ b iː
مزرعه	m æ z ɾ æ ʔ e
مذاهب	m æ z ɒː h e b
مرجان	m æ ɾ d͡ʒ ɒ n
مشهور	m æ ʃ h uː ɾ
مرطوب	m æ ɾ tʰ uː b
معشوق	m æ ʃ uː ɣ
مرضیه	m æ ɾ z i j e
مقاله	m æ ɣ ɒː l e
مغاره	m æ ɢ ɒː r e
مغاره	m æ ɣ ɒː r æ
مسعود	m æː s uː d
ماندن	m ɒ n d æ n
مالته	m ɒː l tʰ æ
ماموت	m ɒː m uː t̪ʰ
مانده	m ɒː n d̪ e
مانند	m ɒː n æ n d
مارها	m ɒː ɾ h ɒː
معشوق	m ɒː ʃ uː q
نهادن	n e h ɒː d æ n
نمودن	n e m uː d̪ æ n
نسبتا	n e s b æ t̪ʰ æ n
نوشتن	n e v e ʃ t̪ʰ æ n
نگندن	n e ɡ æ n d æ n
نشستن	n e ʃ æ s t̪ʰ æ n
نژادی	n e ʒ ɒː d̪ iː
نشانه	n e ʃ ɒː n e
نگاره	n e ɡ ɒː ɾ e
نیستی	n eː s tʰ iː
نیوشا	n i j u ʃ ɒ
نیستی	n iː s tʰ iː
نیستم	n iː s t̪ʰ æ m
نجومی	n o d ʒ uː m iː
نوزاد	n o z ɒː d̪
نوزاد	n o ʊ z ɒː d̪
نوشین	n oː ʃ eː n
نوزده	n uː z d æʰ
نوشین	n uː ʃ iː n
نهادن	n æ h ɒː d æ n
نمایش	n æ m ɒː j e ʃ
نسرین	n æ s ɾ i n
نتیجه	n æ t̪ʰ iː d͡ʒ e
نوشتن	n æ v e ʃ t̪ʰ æ n
نزدیک	n æ z d̪ iː kʲ
نعناع	n æː n ɒː
ناحیه	n ɒː h i j e
ناهید	n ɒː h iː d
نایاب	n ɒː j ɒː b
آن‌ها	o n ɒː
اتریش	o t̪ ɾ i ʃ
اوردن	o v o r d æ n
آوردن	o v o ɾ d̪ æ n
عضوها	o z v h ɒː
عضوها	o z v ɒː
اروپا	o ɾ uː p ɒː
آنقدر	oː q a
پژواک	p e ʒ v ɒː k
پژواک	p æ ʒ v ɒː k
پانید	p ɒː n iː d
پانید	p ɒː n iː ð
پارسا	p ɒː ɾ s ɒː
پدرام	pʰ e d̪ ɾ ɒː m
پیمان	pʰ e i̯ m ɒː n
پندار	pʰ e n d̪ ɒː ɾ
پستان	pʰ e s t̪ʰ uː n
پستان	pʰ e s t̪ʰ ɒː n
پرینه	pʰ e ɾ iː n e
پژمان	pʰ e ʒ m ɒ n
پژوهش	pʰ e ʒ uː h e ʃ
پیختن	pʰ iː x tʰ æ n
پیشین	pʰ iː ʃ iː n
پیرتر	pʰ iː ɾ tʰ æ ɾ
پیروز	pʰ iː ɾ uː z
پیشاب	pʰ iː ʃ ɒː b
پرکار	pʰ o ɾ kʰ ɒː ɾ
پولاد	pʰ oː l ɒː d
پولاد	pʰ oː l ɒː ð
پوتین	pʰ u tʰ i n
پویان	pʰ uː j ɒ n
پولاد	pʰ uː l ɒː d
پوسته	pʰ uː s t̪ʰ e
پدیده	pʰ æ d̪ iː d̪ e
پدرام	pʰ æ d̪ ɾ ɒː m
پهپاد	pʰ æ h pʰ ɒː d̪
پنجره	pʰ æ n d͡ʒ e ɾ e
پنجاب	pʰ æ n d͡ʒ ɒː b
پرهام	pʰ æ ɾ h ɒː m
پریدن	pʰ æ ɾ iː d æ n
پریوش	pʰ æ ɾ iː v æ ʃ
پریشب	pʰ æ ɾ iː ʃ æ b
پشمین	pʰ æ ʃ m i n
پشمین	pʰ æ ʃ m iː n
پژوهش	pʰ æ ʒ uː h e ʃ
پرویز	pʰ æ ɾ v iː z
پرواز	pʰ æ ɾ v ɒː z
پرنده	pʰ æ ɾ æ n d e
پاپوش	pʰ ɒ pʰ u ʃ
پاریس	pʰ ɑ ɾ i s
پاپوش	pʰ ɒː pʰ uː ʃ
پارسه	pʰ ɒː ɾ s e
پارسی	pʰ ɒː ɾ s iː
پارتی	pʰ ɒː ɾ t̪ʰ iː
ریحان	r e i̯ h u n
ریحان	r e i̯ h ɒ n
ریحان	r e i̯ h ɒː n
رسیدن	r e s iː d̪ æ n
ربودن	r o b uː d æ n
رعایا	r o ʔ ɒː j ɒː
روزبه	r oː z b ɪ h
روزبه	r uː z b e h
روزمه	r uː z m æ h
رفتار	r æ f t̪ʰ ɒː ɾ
رنگین	r æ ŋ ɡʲ iː n
رامین	r ɒː m iː n
راسته	r ɒː s t̪ʰ e
سندان	s e n d ɒ n
سنگال	s e n e ɡ ɒː l
سپریغ	s e p æ ɾ iː ɣ
سپیده	s e pʰ iː d e
سپردن	s e pʰ o ɾ d̪ æ n
سپهبد	s e pʰ æ h b o d
سپنتا	s e pʰ æ n t̪ ɒː
ستردن	s e t o ɾ d̪ æ n
ستایش	s e t ɒː j e ʃ
ستودن	s e tʰ uː d æ n
ستاره	s e t̪ʰ ɒː ɾ e
سرشتن	s e ɾ e ʃ t æ n
سینما	s i n e m ɒː
سینما	s i n æ m ɒː
سیلاغ	s iː l ɒː ɣ
سیمین	s iː m i n
سیمین	s iː m iː n
سیمرغ	s iː m o ɾ ɣ
سینزه	s iː n z æʰ
سخنگو	s o x æ ŋ ɡ uː
سوئیس	s u ʔ i s
سودان	s uː d ɒː n
سولاخ	s uː l ɒː x
سوراخ	s uː ɾ ɒː x
صفحات	s æ f æ h ɒː tʰ
سهستن	s æ h e s t̪ʰ æ n
سیاره	s æ j ɒː ɾ e
سلیمی	s æ l iː m iː
سمیعی	s æ m iː ʔ i
سمیرا	s æ m iː ɾ ɒː
سندان	s æ n d ɒ n
سنجاب	s æ n d ʒ ɒː b
سنتور	s æ n t̪ʰ uː ɾ
سپریغ	s æ p ɾ iː ɣ
سرطان	s æ r æ t ɒː n
سرباز	s æ ɾ b ɒː z
سرکوب	s æ ɾ kʰ uː b
سرکار	s æ ɾ kʰ ɒː ɾ
سرخوش	s æ ɾ x o ʃ
سنگین	s æ ŋ ɡʲ iː n
سیامک	s ɪ j ɒː m æ k
سرودن	s ʊ ɾ uː d̪ æ n
ثابتی	s ɒː b e tʰ i
صادقی	s ɒː d e ɣ iː
سادگی	s ɒː d̪ e ɡʲ iː
ساحره	s ɒː h e ɾ e
ساختن	s ɒː x tʰ æ n
سازها	s ɒː z h ɒː
تندپز	t o n d p æ z
توجیه	t o ʊ d͡ʒ iː h
توبره	t oː b ɾ æ
توبره	t uː b ɾ e
تسبیح	t æ s b iː h
تعلیم	t æ ʔ l iː m
تعلیم	t æː l iː m
چیندن	t ʃ iː n d æ n
تافتن	t ɒː f t æ n
تاختن	t ɒː x t æ n
چمدان	t ʃʰ æ m e d̪ uː n
چمدان	t ʃʰ æ m e d̪ ɒː n
تهرون	tʰ e h ɾ uː n
تکرار	tʰ e k ɾ ɒː ɾ
تمساح	tʰ e m s ɒː h
تهرون	tʰ eː ɾ uː n
توزیع	tʰ oː z iː
توسکا	tʰ u s kʰ ɒ
تفضلی	tʰ æ f æ zː o l iː
تکاپو	tʰ æ kʰ ɒː pʰ uː
تنبسه	tʰ æ m b æ s e
تمایل	tʰ æ m ɒː j o l
تنیدن	tʰ æ n iː d æ n
ترجمه	tʰ æ ɾ d ʒ o m e
تایید	tʰ æː iː d
تصحیح	tʰ æː s iː
تصحیح	tʰ æː s iː h
تغییر	tʰ æː ɣ iː ɾ
تاریک	tʰ ɒː ɾ iː k
تیمچه	t̪ʰ iː m t͡ʃ e
تیرگی	t̪ʰ iː ɾ e ɡʲ iː
تیرگی	t̪ʰ iː ɾ ə ɡʲ iː
توصیف	t̪ʰ o s iː f
ترکیه	t̪ʰ o ɾ kʲ i j e
توصیف	t̪ʰ o ʊ s iː f
ترابی	t̪ʰ o ɾ ɒː b iː
طوفان	t̪ʰ uː f ɒː n
تبریز	t̪ʰ æ b ɾ iː z
تهدید	t̪ʰ æ h d̪ iː d̪
تلمود	t̪ʰ æ l m uː d̪
تنبور	t̪ʰ æ m b uː ɾ
تمرین	t̪ʰ æ m ɾ iː n
تماشا	t̪ʰ æ m ɒː ʃ ɒː
تصویر	t̪ʰ æ s v iː ɾ
تجدید	t̪ʰ æ ʒ d̪ iː d̪
تشکیل	t̪ʰ æ ʃ kʲ iː l
ترتیب	t̪ʰ æ ɾ t̪ʰ iː b
چغاله	t͡ʃ æ ɢ ɒː l e
ترانه	t̪ʰ æ ɾ ɒː n e
تنبور	t̪ʰ æ̃ b uː ɾ
تاجیک	t̪ʰ ɒː d ʒ iː kʲ
تازیک	t̪ʰ ɒː z iː kʲ
تعارف	t̪ʰ ɒː ɾ o f
چکیدن	t͡ʃʰ e kʲ iː d æ n
چلچله	t͡ʃʰ e l t͡ʃʰ e l e
چشیدن	t͡ʃʰ e ʃ iː d æ n
چیزها	t͡ʃʰ iː z h ɒː
چیزها	t͡ʃʰ iː z ɒː
چوگان	t͡ʃʰ o ʊ̯ ɡ ɒ n
چوگان	t͡ʃʰ oː ɡ ɒ n
چندین	t͡ʃʰ æ n d̪ i n
چریدن	t͡ʃʰ æ ɾ iː d æ n
چنگال	t͡ʃʰ æ ŋ ɡ ɒː l
چنگیز	t͡ʃʰ æ ŋ ɡʲ iː z
اومدن	u m æ d æ n
آن‌ها	u n ɒː
آنقدر	u ŋ ɣ æ d̪
وجدان	v e d ʒ d ɒː n
ولایت	v e l ɒː j æ t̪ʰ
ویژگی	v iː ʒ e ɡʲ iː
وجدان	v o d ʒ d ɒː n
وجودی	v o d ʒ uː d iː
ودیعه	v æ d iː j e
ودیعه	v æ d iː ʔ e
وظیفه	v æ z iː f e
وگرنه	v æ ɡʲ æ ɾ n æ
وضعیت	v æː z i i̯ æ t
واکنش	v ɒː kʰ o n e ʃ
والده	v ɒː l e d̪ e
وظیفه	w æ z iː f æ
خدافظ	x o d̪ ɒː f e z
خدایی	x o d̪ ɒː j iː
خوردن	x o ɾ d̪ æ n
خرسند	x o ɾ s æ n d̪
خوشگل	x o ʃ ɡʲ e l
خرداد	x u ɾ d̪ ɒː d̪
خمیده	x æ m iː d e
خندسن	x æ n d e s æ n
خندسن	x æ n d s æ n
خزاعی	x æ z ɒː ʔ iː
خواهش	x ɒː h e ʃ
خاستن	x ɒː s tʰ æ n
خارجی	x ɒː ɾ e d ʒ iː
زدودن	z o d u d̪ æ n
ضمیمه	z æ m iː m e
زمانی	z æ m ɒː n iː
زنونه	z æ n uː n e
زواره	z æ v ɒː ɾ e
ضرورت	z æ ɾ uː ɾ æ t̪ʰ
زنگنه	z æ ŋ ɡʲ e n e
زنگنه	z æ ŋ ɡʲ æ n e
زاهدی	z ɒː h e d̪ iː
افکار	æ f kʰ ɒː ɾ
اهواز	æ h v ɒː z
انوشه	æ n uː ʃ e
انعام	æ n ʔ ɒː m
اسماء	æ s m ɒː
ازگیل	æ z ɡʲ i l
اریحا	æ ɾ iː h ɒː
ارمنی	æ ɾ m æ n iː
عروسک	æ ɾ uː s æ kʲ
ارسطو	æ ɾ æ s t uː
انگشت	æ ŋ ɡ o ʃ t̪ʰ
انگشت	æ ŋ ɡʲ e ʃ t̪ʰ
انوشه	ʔ a n oː ʃ a
غژگاو	ɣ a ʒ ɡ ɔː v
عبارت	ʔ e b ɒː ɾ æ t̪
احسان	ʔ e h s ɒ n
شکوفه	ʃ e k uː f e
الیکا	ʔ e l i kʰ ɒ
قلیان	ɢ e l j uː n
شمردن	ʃ e m o r d æ n
ژنرال	ʒ e n e ɾ ɒː l
اژدها	ʔ e ʒ d e h ɒː
احسان	ʔ eː s ɒ n
آلمان	ɑ l m ɒ n
گجرات	ɡ o d͡ʒ æ ɾ ɒː t
گفتار	ɡ o f t̪ʰ ɒː ɾ
شکوفه	ʃ o k uː f e
شکلات	ʃ o kʰ o l ɒː tʰ
گلناز	ɡ o l n ɒː z
غلغله	ɢ o l ɣ o l e
شمردن	ʃ o m o r d æ n
گنجشک	ɡ o n d͡ʒ iː ʃ k
گستاخ	ɡ o s tʰ ɒː x
اتراق	ʔ o t̪ ɾ ɒ ɣ
اتراق	ʔ o t̪ ɾ ɒː ɣ
گزیدن	ɡ o z iː d̪ æ n
گوریل	ɡ o ɾ iː l
گرسنه	ɡ o ɾ o s n e
گشودن	ɡ o ʃ uː d̪ æ n
گرگان	ɡ o ɾ ɡ ɒ n
گوسان	ɡ oː s ɒ n
گوسان	ɡ oː s ɒː n
گشودن	ɡ u ʃ uː d̪ æ n
گوسان	ɡ uː s ɒ n
گوسان	ɡ uː s ɒː n
گوشتی	ɡ uː ʃ t̪ʰ iː
گوگرد	ɡ uː ɡʲ e ɾ d
شب‌ها	ʃ æ b h ɒː
شبانه	ʃ æ b uː n e
شب‌ها	ʃ æ b ɒː
شباهت	ʃ æ b ɒː h æ t̪ʰ
شبانه	ʃ æ b ɒː n e
شبانه	ʃ æ b ɒː n æ
قدیمی	ɢ æ d̪ iː m iː
افیون	ʔ æ f j uː n
افیون	ʔ æ f j ʊ n
اهورا	ʔ æ h uː ɾ ɒː
شهرها	ʃ æ h ɾ ɒː
البته	ʔ æ l b æ tʰ e
قلیان	ɢ æ l j uː n
قلیان	ɢ æ l j ɒː n
شمیدن	ʃ æ m iː d æ n
شمشیر	ʃ æ m ʃ eː ɾ
غمگین	ɢ æ m ɡ i n
غمگین	ɢ æ m ɡ iː n
شمشیر	ʃ æ m ʃ iː ɾ
انوشه	ʔ æ n uː ʃ e
شقایق	ʃ æ q ɒː j e q
قصیده	ɢ æ s iː d̪ e
عظیمی	ʕ æ z iː m iː
قزوین	ɢ æ z v i n
قزوین	ɢ æ z v iː n
عقیده	ʔ æ ɣ iː d e
شریفی	ʃ æ ɾ iː f iː
غریزه	ɢ æ ɾ iː z e
اشکان	ʔ æ ʃ kʰ ɒ n
اشکان	ʔ æ ʃ kʰ ɒː n
عروسک	ʔ æ ɾ uː s æ kʲ
ارزان	ʔ æ ɾ z ɒ n
قشنگی	ɢ æ ʃ æ ŋ ɡʲ iː
غژگاو	ɢ æ ʒ ɡ ɒː v
غژگاو	ɣ æ ʒ ɡ ɒː w
شقایق	ʃ æ ɣ ɒː j e ɣ
شهرها	ʃ æː ɾ ɒː
آیدین	ʔ ɒ j d i n
آنقدر	ɒ ŋ ɣ æ d̪ æ ɾ
آنقدر	ɒ ŋ ɣ æ d̪ ɾ
آبچین	ʔ ɒː b t͡ʃʰ i n
قافله	ɢ ɒː f e l e
قافیه	ɢ ɒː f i j e
قاهره	ɢ ɒː h e r e
شاهین	ʃ ɒː h iː n
گالری	ɡ ɒː l e ɾ iː
قاموس	ɢ ɒː m uː s
گوسان	ɡ ɵː s ɔ n
آرمان	ʔ ɒː ɾ m ɒː n
آبروی	ɒː b e ɾ uː j
آبتنی	ɒː b t̪ʰ æ n iː
آبشار	ɑː b ʃ ɒː ɾ
آدمکش	ɒː d̪ æ m kʰ o ʃ
گرایش	ɡʲ e ɾ ɒː j e ʃ
آفتاب	ɒː f t̪ʰ ɒː b
گیومه	ɡʲ i j uː m e
گیلاس	ɡʲ iː l ɒː s
گیتار	ɡʲ iː tʰ ɒː ɾ
آمادن	ɒː m ɒː d æ n
آن‌ها	ɒː n h ɒː
آسمان	ɒː s e m uː n
آسمون	ɒː s e m uː n
آسودن	ɒː s uː d æ n
آوردن	ɒː v o ɾ d̪ æ n
آوردن	ɒː v æ ɾ d̪ æ n
آزادی	ɒː z ɒː d̪ iː
گنجور	ɡʲ æ n d͡ʒ uː ɾ
گوازه	ɡʲ æ v ɒː z e
گزیدن	ɡʲ æ z iː d̪ æ n
گرایش	ɡʲ æ ɾ ɒː j e ʃ
آغشتن	ɒː ɣ e ʃ t æ n
گیومه	ɡʲ ɪ j ʊ m e
آشفته	ɒː ʃ o f t̪ʰ e
آغشتن	ɒː ɣ o ʃ t æ n
آرامش	ɒː ɾ uː m e ʃ
آرشام	ɒː ɾ ʃ ɒː m
آرامش	ɒː ɾ ɒː m e ʃ
ببخشید	b e b æ x ʃ iː d̪
ببخشید	b e b æ x ʃ iː n
بلاروس	b e l ɒ ɾ u s
برهنگی	b e ɾ æ h n e ɡʲ iː
بنگاله	b e ŋ ɡ ɒː l e
بی‌باک	b eː b ɒː k
بی‌باک	b eː b ɔː k
بیهوده	b eː h uː d̪ æ
بی‌صدا	b eː s æ d ɒː
بی‌باک	b iː b ɒː k
بیهوده	b iː h uː d̪ e
بی‌صدا	b iː s e d ɒː
بیرجند	b iː ɾ d͡ʒ æː n d̪
بنیادی	b o n j ɒː d̪ iː
برونئی	b o ɾ uː n e iː
بلعیدن	b æ l iː d̪ æ n
بخشیدن	b æ x ʃ iː d̪ æ n
بخشودن	b æ x ʃ uː d̪ æ n
برنامه	b æ ɾ n ɒː m e
بنگاله	b æ ŋ ɡ ɒː l e
برادری	b æ ɾ ɒː d̪ æ ɾ iː
بلعیدن	b æː l iː d̪ æ n
بیابان	b ɪ j ɒː b u n
بابونه	b ɒː b uː n e
بادبان	b ɒː d̪ b ɒ n
بادکنک	b ɒː t kʰ o n æ kʲ
بازگشت	b ɒː z ɡʲ æ ʃ t̪
باردار	b ɒː ɾ d̪ ɒː ɾ
بارانی	b ɒː ɾ uː n iː
بارانی	b ɒː ɾ ɒː n iː
دل‌شکن	d e l ʃ e k æ n
درویدن	d e ɾ æ v iː d æ n
دزدیدن	d o z d iː d æ n
دزدیدن	d o zː iː d æ n
دونستن	d uː n e s tʰ æ n
دانستن	d uː n e sː æ n
دونستن	d uː n e sː æ n
دستگاه	d æ s t ɡ ɒː h
دوازده	d æ v ɒː z d æ h
درباره	d æ ɾ b ɒ ɾ e
درباره	d æ ɾ b ɒ ɾ e j e
درباره	d æ ɾ b ɒː ɾ e j e
دریاچه	d æ ɾ j ɒː t ʃʰ e
دانیال	d ɒ n i j ɒː l
جنبیدن	d ʒ o m b i d æ n
جاندار	d ʒ ɒː n d̪ ɒː ɾ
دارنده	d ɒː ɾ æ n d e
دارنده	d ɒː ɾ æ n d æ
دلفریب	d̪ e l f æ ɾ iː b
دیدگاه	d̪ iː d̪ ɡ ɒː h
دوچرخه	d̪ o t ʃʰ æ ɾ x e
دوشنبه	d̪ o ʃ æ m b e
دانستن	d̪ uː n e s t̪ʰ æ n
دماوند	d̪ æ m ɒː v æ n d̪
دانستن	d̪ ɒː n e s t̪ʰ æ n
دانستن	d̪ ɒː n̪ ɪ s t̪ʰ a n
داستان	d̪ ɒː s t̪ʰ ɒː n
داریوش	d̪ ɒː ɾ j uː ʃ
دارچین	d̪ ɒː ɾ t͡ʃʰ i n
داروغه	d̪ ɒː ɾ uː ɣ e
جیبوتی	d͡ʒ iː b uː t iː
جانباز	d͡ʒ ɒː m b ɒː z
جانماز	d͡ʒ ɒː n æ m ɒː z
احتلام	e h t̪ʰ e l ɒː m
احترام	e h t̪ʰ e ɾ ɒː m
اکتشاف	e k t̪ʰ e ʃ ɒː f
امروزه	e m ɾ uː z e
انتخاب	e n t̪ʰ e x ɒː b
انگنار	e n ɡ e n ɒː ɾ
اسلاوی	e s l ɒː v iː
اسپریس	e s p æ ɾ iː s
اتیوپی	e t j uː p iː
اعتماد	e t̪ʰ e m ɒː d̪
اقتصاد	e x tʰ e s ɒː d
اریتره	e ɾ iː t ɾ e
اعتقاد	e ʔ tʰ e ɣ ɒː d
اشتباه	e ʃ t̪ʰ e b ɒː h
اعتبار	e ʔ t̪ʰ e b ɒː ɾ
اعتماد	e ʔ t̪ʰ e m ɒː d̪
ارتعاش	e ɾ t̪ʰ e ʔ ɒː ʃ
انقلاب	e ɴ ɣ e l ɒː b
فلسطین	f e l e s t̪ʰ i n
فلسطین	f e l e s t̪ʰ iː n
فرسادن	f e r s ɒː d æ n
فریدون	f e ɾ e i̯ d uː n
فیروزه	f iː ɾ uː z e
فهمیدن	f æ h m i d æ n
فهمیدن	f æ m i d æ n
فرهنگی	f æ ɾ h æ ŋ ɡʲ iː
فرهادی	f æ ɾ h ɒː d iː
فریماه	f æ ɾ iː m ɒːʰ
فرینام	f æ ɾ iː n ɒː m
فرمودن	f æ ɾ m uː d̪ æ n
فرزانه	f æ ɾ z ɒː n e
فریانه	f æ ɾ ɪ j ɒː n e
فرانسه	f æ ɾ ɒ n s e
فرادیس	f æ ɾ ɒː d iː s
فرانسه	f æ ɾ ɒː n s e
فراگیر	f æ ɾ ɒː ɡʲ iː ɾ
فهمیدن	f æː m i d æ n
فالوده	f ɒː l uː d̪ e
هیچ‌کس	h iː t͡ʃ k æ s
هیچ‌کس	h iː ʃ k æ s
هوشمند	h o ʃ m æ n
هوشمند	h uː ʃ m æ n d̪
همبرگر	h æ m b e ɾ ɡʲ e ɾ
همسایه	h æ m s ɒː j e
همچنان	h æ m t ʃʰ e n ɒː n
هخامنش	h æ x ɒ m æ n e ʃ
این‌ها	i n h ɒː
این‌ها	i n ɒː
این‌ها	iː n h ɒː
این‌ها	iː n ɒː
یکدفعه	j e kʲ d æ f e
یتیمان	j æ tʰ iː m ɒː n
کشورها	k e ʃ v æ ɾ h ɒː
کامستن	k ɒː m e s t̪ʰ æ n
کامرون	k ɒː m e ɾ uː n
کیهانی	kʲ e i̯ h uː n iː
کیهانی	kʲ e i̯ h ɒː n iː
کشاورز	kʲ e ʃ ɒː v æ ɾ z
کشاورز	kʲ e ʃ ɒː w æ ɾ z
کشاورز	kʲ i ʃ ɔː w æ ɾ z
کنجکاو	kʰ o n t ʃ kʰ ɒː v
کوبیدن	kʰ uː b iː d̪ æ n
کفش‌ها	kʲ æ f ʃ ɒː
کلانتر	kʲ æ l ɒ n t̪ʰ æ ɾ
کمترین	kʲ æ m t̪ʰ æ ɾ iː n
کمربند	kʲ æ m æ ɾ b æ n d̪
کمربند	kʲ æ m æ ɾ b æː n d̪
کمانچه	kʲ æ m ɒ n t͡ʃʰ e
کماکان	kʲ æ m ɒː kʰ ɒ n
کابینه	kʰ ɒ b i n e
کالباس	kʰ ɒ l b ɒ s
کامیون	kʰ ɒ m i j o n
کامران	kʰ ɒ m ɾ ɒ n
کاهربا	kʰ ɒː h ɾ o b ɒː
کامران	kʰ ɒː m ɾ ɒː n
کاندوم	kʰ ɒː n d o m
کاربرد	kʰ ɒː ɾ b o ɾ d̪
کاروان	kʰ ɒː ɾ e v ɒ n
کارتون	kʰ ɒː ɾ t̪ʰ uː n
کاروان	kʰ ɒː ɾ v ɒ n
لیسیدن	l iː s iː d̪ æ n
لهستان	l æ h e s t̪ʰ ɒ n
لهستان	l æ h e s t̪ʰ ɒː n
لزوماً	l ʊ z uː m æ n
لاجورد	l ɒː d͡ʒ e v æ ɾ d
لاجورد	l ɒː d͡ʒ v æ ɾ d
لاجورد	l ɒː d͡ʒ w æ ɾ d
لاجورد	l ɒː d͡ʒ æ v æ ɾ d
لاجورد	l ɒː d͡ʒ æ w æ ɾ d
لاژورد	l ɒː ʒ v æ ɾ d
لاژورد	l ɒː ʒ æ v æ ɾ d
مجموعه	m a d͡ʒ m uː ʔ e
میرنده	m iː ɾ æ n d e
مهاجرت	m o h ɒː d ʒ e ɾ æ t̪ʰ
مکافات	m o kʰ ɒː f ɒː tʰ
مستطیل	m o s t̪ʰ æ t̪ʰ iː l
مسلمان	m o s æ l m ɒ n
مصاحبه	m o s ɒː h e b e
متشکرم	m o t̪ ʃ æ kʲ e ɾ æ m
متشکرم	m o t̪ʰ e ʃ æ kʲː e ɾ æ m
مترادف	m o t̪ʰ æ ɾ ɒː d̪ e f
متعارف	m o t̪ʰ æ ʔ ɒː ɾ e f
مخالفت	m o x ɒː l e f æ tʰ
مذاکره	m o z ɒː kʲ e ɾ e
مشکلات	m o ʃ kʲ e l ɒː tʰ
مرتضوی	m o ɾ t̪ʰ æ z æ v iː
معادله	m o ʔ ɒː d̪ e l e
مولانا	m oː l ɒː n ɒː
مسلمان	m u s æ l m ɒ n
مجدانی	m æ d͡ʒ d ɒː n iː
مردونه	m æ ɾ d uː n e
ماهیچه	m ɒː h iː t ʃʰ e
مالدیو	m ɒː l d iː v
مالیدن	m ɒː l iː d̪ æ n
مالاوی	m ɒː l ɒː v iː
نکونام	n e kʰ uː n ɒː m
نگاشتن	n e ɡ ɒː ʃ t æ n
نیلوفر	n eː l oː f æ ɾ
نیجریه	n iː d͡ʒ e ɾ j e
نیلوفر	n iː l oː f æ ɾ
نیلوفر	n iː l uː f æ ɾ
نورانی	n uː ɾ ɒː n iː
نمکدان	n æ m æ k d ɒ n
نواختن	n æ v ɒː x tʰ æ n
نریمان	n æ ɾ iː m ɒ n
نابینا	n ɒː b iː n ɒː
نام‌ها	n ɒː m h ɒː
نامیدن	n ɒː m iː d̪ æ n
نام‌ها	n ɒː m ɒː
ناودان	n ɒː v d̪ uː n
ناودان	n ɒː v d̪ ɒː n
نارنجی	n ɒː ɾ e n d ʒ iː
ناگهان	n ɒː ɡʲ æ h ɒ n
افتادن	o f tʰ ɒː d æ n
پوسیدن	p uː s iː d æ n
پژمردن	p æ ʒ m o ɾ d̪ æ n
پدرانه	pʰ e d̪ æ ɾ uː n e
پدرانه	pʰ e d̪ æ ɾ ɒː n e
پسرونه	pʰ e s æ ɾ uː n e
پسرانه	pʰ e s æ ɾ ɒː n e
پیچیدن	pʰ iː t͡ʃʰ iː d̪ æ n
پرتقال	pʰ o ɾ tʰ e ɣ ɒː l
پرتغال	pʰ o ɾ tʰ o ɣ ɒː l
پرتقال	pʰ o ɾ tʰ o ɣ ɒː l
پولدار	pʰ uː l d̪ ɒː ɾ
پانزده	pʰ uː n z d̪ æʰ
پوزخند	pʰ uː s x æ n d̪
پنجابی	pʰ æ n d ʒ ɒː b iː
پریشان	pʰ æ ɾ iː ʃ uː n
پریروز	pʰ æ ɾ iː ɾ uː z
پریشان	pʰ æ ɾ iː ʃ ɒː n
پرتگاه	pʰ æ ɾ t ɡ͡ɣ ɒː h
پروانه	pʰ æ ɾ v ɒː n e
پرستار	pʰ æ ɾ æ s t̪ʰ ɒː ɾ
پالودن	pʰ ɒ l uː d̪ æ n
پالوده	pʰ ɒː l uː d̪ e
پانزده	pʰ ɒː n z d̪ æʰ
رساندن	r e s u n d̪ æ n
رساندن	r e s ɒ n d̪ æ n
روحانی	r oː h ɒː n iː
رونوشت	r uː n e v e ʃ t̪
روزانه	r uː z ɒː n e
رفتگان	r æ f t e ɡ ɒ n
رقصیدن	r æ q s iː d æ n
روش‌ها	r æ v e ʃ h ɒː
روش‌ها	r æ v e ʃ ɒː
رواندا	r æ v ɒː n d ɒː
رقصنده	r æ x s æ n d̪ e
رقصیدن	r æ ɣ s iː d æ n
سندباد	s e n d b ɒː d
سپوختن	s e pʰ uː x tʰ æ n
سه‌تار	s e t̪ʰ ɒː ɾ
سلیمان	s o l e i̯ m ɒ n
سومالی	s uː m ɒː l iː
سندباد	s æ m b ɒː d
سندباد	s æ m b ɒː ð
سمرقند	s æ m æ ɾ q æ n d̪
سمرقند	s æ m æ ɾ ɣ æ n d̪
سندباد	s æ n d b ɒː d
سنجاقک	s æ n d͡ʒ ɒː ɣ æ kʲ
سقرلات	s æ ɣ e ɹ l ɒː t
سرنوشت	s æ ɾ n e v e ʃ t̪ʰ
سرپرست	s æ ɾ pʰ æ ɾ æ s t̪ʰ
سرچشمه	s æ ɾ t͡ʃʰ e ʃ m e
صبحانه	s ʊ b uː n e
سندباد	s ɪ m b ɒː d
سندباد	s ʊ m b ɒː d
سندباد	s ɪ m b ɒː ð
سندباد	s ʊ m b ɒː ð
ساحرها	s ɒː h e ɾ h ɒː
ساحرها	s ɒː h e ɾ ɒː
ساحرات	s ɒː h e ɾ ɒː t̪ʰ
سالانه	s ɒː l uː n e
سالانه	s ɒː l ɒː n e
ساعتچی	s ɒː æ t͡ʃʰː iː
تفسیدن	t æ f s i d æ n
چوچوله	t ʃʰ uː t ʃʰ uː l e
تاوستن	t ɒː v e s t̪ʰ æ n
چهارده	t ʃʰ æ h ɒː ɾ d̪ æʰ
چهارصد	t ʃʰ æ h ɒː ɾ s æ d̪
چاق‌تر	t ʃʰ ɒː x tʰ æ ɾ
چهارده	t ʃʰ ɒː ɾ d̪ æʰ
چهارصد	t ʃʰ ɒː ɾ s æ d̪
ترکیدن	tʰ e ɾ e kʲ iː d æ n
ترکیدن	tʰ e ɾ kʲ iː d æ n
ترکیدن	tʰ æ ɾ kʲ iː d æ n
تقوایی	tʰ æ ɣ v ɒː iː
ترکیدن	tʰ æ ɾ æ kʲ iː d æ n
ترابری	tʰ æ ɾ ɒː b æ ɾ iː
تاجیکی	tʰ ɒː d ʒ iː kʲ iː
تهرونی	t̪ʰ e h ɾ uː n iː
تک‌شاخ	t̪ʰ æ k ʃ ɒː x
تناسلی	t̪ʰ æ n ɒː s o l iː
تایوان	t̪ʰ ɒ j v ɒ n
تاجبخش	t̪ʰ ɒː d͡ʒ b æ x ʃ
تاشکند	t̪ʰ ɒː ʃ kʲ æ n d̪
چسبیدن	t͡ʃʰ æ s b iː d æ n
چایدان	t͡ʃʰ ɒː i d ɒ n
اورمزد	u ɾ m æ z d
ویرایش	v iː ɾ ɒː j e ʃ
وخشیدن	v æ x ʃ iː d̪ æ n
ورزیدن	v æ ɾ z iː d̪ æ n
وانستن	v ɒː n e s t̪ʰ æ n
واقعیت	v ɒː ɣ e ʔ iː j æ t̪ʰ
خدایان	x o d ɒː j ɒː n
خداوند	x o d ɒː v æ n d
خودکار	x o d̪ kʰ ɒː ɾ
خوسیدن	x o w s iː d æ n
خونیرث	x uː n iː ɾ æ s
خمیدگی	x æ m iː d e ɡʲ iː
خندیدن	x æ n d̪ iː d̪ æ n
خطرناک	x æ tʰ æ ɾ n ɒː k
خونیرث	xʷ a n iː ɾ a θ
زرناپا	z o r n ɒː pʰ ɒː
زنونگی	z æ n uː n e ɡʲ iː
زرتشتی	z æ ɾ t̪ʰ o ʃ t̪ʰ iː
زامبیا	z ɒː m b j ɒː
احمقان	æ h m æ ɣ ɒː n
عکس‌ها	æ k s h ɒː
عکس‌ها	æ k s ɒː
علیرضا	æ l iː ɾ e z ɒː
انگنار	æ n ɡ e n ɒː ɾ
ارزیدن	æ r z iː d æ n
اسپریس	æ s p æ ɾ iː s
اسپریس	æ s p ɾ iː s
اخلاقی	æ x l ɒː ɣ iː
اردشیر	æ ɾ d̪ e ʃ iː ɾ
اردشیر	æ ɾ d̪ æ ʃ eː ɾ
اردشیر	æ ɾ d̪ æ ʃ iː ɾ
شهریور	ʃ a h ɾ eː w a ɾ
شکیفتن	ʃ e k iː f t æ n
شکننده	ʃ e kʲ æ n æ n d e
شکستنی	ʃ e kʲ æ s t̪ʰ æ n iː
شکارچی	ʃ e kʰ ɒː ɾ t ʃʰ iː
انتظار	ʔ e n t e z ɒː ɾ
اصفهان	ʔ e s f æ h ɒ n
انکیدو	ʔ e ŋ kʲ i d u
گرویدن	ɡ e ɾ æ v iː d̪ æ n
انگلیس	ʔ e ŋ ɡʲ e l iː s
ایسلند	ʔ i s l æ n d̪
ریچارد	ɾ i t͡ʃ ɒː ɾ d̪
ایرلند	ʔ i ɾ l æ n d̪
ایروان	ʔ iː ɾ æ v ɒ n
آمریکا	ɑ m ɾ iː k ɒ
آمریکا	ɑ m ɾ iː k ɒː
گداختن	ɡ o d̪ ɒː x t̪ʰ æ n
گجراتی	ɡ o d͡ʒ æ ɾ ɒː tʰ iː
گفتمان	ɡ o f t̪ʰ e m ɒː n
گلستان	ɡ o l e s t̪ʰ ɒː n
گل‌نزن	ɡ o l n æ z æ n
رومانی	ɾ o m ɒː n iː
قربونت	ɢ o ɾ b u n e t̪
گرسنگی	ɡ o ɾ o s n e ɡʲ iː
گرگ‌ها	ɡ o ɾ ɡ h ɒː
اسفناج	ɛ s f e n ɒː d͡ʒ
شانزده	ʃ uː n z d̪ æʰ
شورباه	ʃ uː ɾ b ɒː
ابریشم	ʔ æ b ɾ iː ʃ æ m
شباهنگ	ʃ æ b ɒː h æ ŋ ɡ
افکندن	ʔ æ f kʲ æ n d̪ æ n
شهبازی	ʃ æ h b ɒː z iː
شهوانی	ʃ æ h v ɒː n iː
غلیواج	ɢ æ l iː v ɒː d ʒ
علیرضا	ʔ æ l iː ɾ e z ɒː
غلتیدن	ɢ æ l t i d æ n
قلمدان	ɢ æ l æ m d ɒ n
اندودن	ʔ æ n d uː d æ n
شب‌کور	ʃ æ p kʰ uː ɾ
گردیدن	ɡ æ r d iː d æ n
اساتید	ʔ æ s ɒː tʰ iː d̪
عنکبوت	ʔ æ ŋ kʲ æ b uː tʰ
عراقچی	ʔ æ ɾ ɒː ɣ t͡ʃʰ i
شهردار	ʃ æː h ɾ d̪ ɒː ɾ
شهرزاد	ʃ æː ɾ z ɒː d
آباژور	ʔ ɒ b ɒ ʒ uː ɾ
گلستان	ɡ ʊ l ɪ s t̪ʰ ɒː n
انتظار	ʔ ɪ n t ə z ɒː ɾ
انگلیس	ʔ ɪ ŋ ɡʲ ɪ l iː s
آب‌راه	ʔ ɒː b ɾ ɒː h
آبادان	ʔ ɒː b ɒː d̪ ɒ n
آبادان	ʔ ɒː b ɒː d̪ ɒː n
آهوپای	ʔ ɒː h uː pʰ ɒː i̯
آمارگر	ʔ ɒː m ɒː ɾ ɡʲ æ ɾ
شانزده	ʃ ɒː n z d̪ æʰ
آستانه	ʔ ɒː s t ɒː n e
آتش‌بس	ʔ ɒː tʰ æ ʃ b æ s
گاومیش	ɡ ɒː v m iː ʃ
گاومیش	ɡ ɒː w m eː ʃ
ژاژومک	ʒ ɒː ʒ uː m æ k
آفتابی	ɒː f t̪ʰ ɒː b iː
آهنگین	ɒː h æ ŋ ɡʲ i n
آهنگین	ɒː h æ ŋ ɡʲ iː n
گیلگمش	ɡʲ i l ɡʲ æ m e ʃ
گیلانی	ɡʲ iː l ɒː n iː
آلودگی	ɒː l uː d e ɡʲ iː
آلودگی	ɒː l uː d æ ɡ iː
آزمودن	ɒː z m uː d æ n
گندیدن	ɡʲ æ n d iː d æ n
گنجینه	ɡʲ æ n d͡ʒ iː n e
آنگولا	ɒː ŋ ɡ uː l ɒː
بنیامین	b e n j ɒː m i n
بنیامین	b e n j ɒː m iː n
بیشترین	b iː ʃ t̪ʰ æ ɾ iː n
بزرگمهر	b o z o ɾ ɡ m e h ɾ
بوروندی	b uː ɾ uː n d iː
بوقلمون	b uː ɣ æ l æ m uː n
برداشتن	b æ ɾ d̪ ɒː ʃ t̪ʰ æ n
برخاستن	b æ ɾ x ɒː s t̪ʰ æ n
