zero	z e r o	2510
zevzec	z e v z e k	2
zgomotos	z ɡ o m o t o s	36
zgârcit	z ɡ ɨ r t͡ʃ i t	0
ziarist	z i a r i s t	248
zibelină	z i b e l i n ə	0
zicală	z i k a l ə	0
zimbru	z i m b r u	82
zinc	z i n k	147
zmeură	z m e u r ə	0
zoolog	z o o l o ɡ	20
zoologă	z o o l o ɡ ə	0
zori	z o rʲ	86
zugrăvi	z u ɡ r ə v i	0
zvelt	z v e l t	9
zvăpăiat	z v ə p ə j a t	0
zâmbet	z ɨ m b e t	0
zâmbi	z ɨ m b i	0
zârnă	z ɨ r n ə	0
zăbală	z ə b a l ə	0
zănatic	z ə n a t i k	0
zăpăceală	z ə p ə t͡ʃ e̯ a l ə	0
zău	z ə w	0
îl	ɨ l	17
îmbelșugat	ɨ m b e l ʃ u ɡ a t	0
îmbătat	ɨ m b ə t a t	0
îmbătrânit	ɨ m b ə t r ɨ n i t	0
împinge	ɨ m p i n d͡ʒ e	0
împuțit	ɨ m p u t͡s i t	0
înalt	ɨ n a l t	1
încerca	ɨ n t͡ʃ e r k a	0
încercare	ɨ n t͡ʃ e r k a r e	1
încet	ɨ n t͡ʃ e t	0
închinător	ɨ ŋ c i n ə t o r	0
închis	ɨ ŋ k i s	1
încins	ɨ n t͡ʃ i n s	0
încrede	ɨ n k r e d e	0
încăpea	ɨ n k ə p e̯ a	0
încăpățânat	ɨ ŋ k ə p ə t͡s ɨ n a t	0
îndată	ɨ n d a t ə	0
îndeajuns	ɨ n d e a ʒ u n s	0
îndemna	ɨ n d e m n a	0
îndepărta	ɨ n d e p ə r t a	0
îndepărtat	ɨ n d e p ə r t a t	0
îndoială	ɨ n d o j a l ə	0
îndoielnic	ɨ n d o j e l n i k	0
îndrăzneț	ɨ n d r ə z n e t͡s	0
îndărătnic	ɨ n d ə r ə t n i k	0
înfigăreț	ɨ n f i ɡ ə r e t͡s	0
înfipt	ɨ n f i p t	0
înfocat	ɨ n f o k a t	0
înfometa	ɨ n f o m e t a	0
înger	ɨ n d ʒ e r	0
îngeresc	ɨ n d͡ʒ e r e s k	0
înghețat	ɨ ŋ ɟ e t͡s a t	0
îngrijit	ɨ ŋ ɡ r i ʒ i t	0
îngrozitor	ɨ ŋ ɡ r o z i t o r	0
îngust	ɨ ŋ ɡ u s t	0
îngâmfat	ɨ ŋ ɡ ɨ m f a t	0
înlăcrimat	ɨ n l ə k r i m a t	0
înotător	ɨ n o t ə t o r	0
înotători	ɨ n o t ə t o rʲ	0
înroșit	ɨ n r o ʃ i t	0
însemnătate	ɨ n s e m n ə t a t e	0
însorit	ɨ n s o r i t	0
înspre	ɨ n s p r e	0
înstelat	ɨ n s t e l a t	0
însă	ɨ n s ə	1
însărcinat	ɨ n s ə r t͡ʃ i n a t	0
însărcinată	ɨ n s ə r t͡ʃ i n a t ə	0
întins	ɨ n t i n s	0
întinsa	ɨ n t i n s a	0
întinse	ɨ n t i n s e	0
întinsul	ɨ n t i n s u l	0
întinsă	ɨ n t i n s ə	0
întinși	ɨ n t i n ʃʲ	0
întoarce	ɨ n t o̯ a r t͡ʃ e	0
întors	ɨ n t o r s	0
întort	ɨ n t o r t	0
între	ɨ n t r e	4
întreagă	ɨ n t r e̯ a ɡ ə	0
întreg	ɨ n t r e ɡ	0
întrista	ɨ n t r i s t a	0
întru	ɨ n t r u	1
întrucât	ɨ n t r u k ɨ t	0
întrucâtva	ɨ n t r u k ɨ t v a	0
întunecat	ɨ n t u n e k a t	0
întuneric	ɨ n t u n e r i k	0
întâi	ɨ n t ɨ j	1
întâietate	ɨ n t ɨ j e t a t e	0
întâietăți	ɨ n t ɨ j e t ə t͡sʲ	0
învechit	ɨ n v e k i t	0
înveninat	ɨ n v e n i n a t	0
învinge	ɨ n v i n d͡ʒ e	0
învingător	ɨ n v i ŋ ɡ ə t o r	0
învins	ɨ n v i n s	1
învolt	ɨ n v o l t	0
învățat	ɨ n v ə t͡s a t	0
înzestrat	ɨ n z e s t r a t	0
înțelept	ɨ n t͡s e l e p t	0
își	ɨ ʃʲ	0
ă	ə	2
ăia	ə j a	0
ăl	ə l	0
ăleia	ə l e j a	0
ălora	ə l o r a	0
ăluia	ə l u j a	0
ăst	ə s t	0
ăstora	ə s t o r a	0
ăstuia	ə s t u j a	0
ţ	t s e	0
șa	ʃ a	0
șablon	ʃ a b l o n	0
șah	ʃ a h	0
șaisprezece	ʃ a j s p r e z e t͡ʃ e	0
șaisprezecea	ʃ a j s p r e z e t ʃ e̯ a	0
șaisprezecelea	ʃ a j s p r e z e t͡ʃ e l e̯ a	0
șaizecea	ʃ a j z e t͡ʃ e̯ a	0
șaizeci	ʃ a j z e t͡ʃʲ	0
șaizecilea	ʃ a j z e t͡ʃ i l e̯ a	0
șaișpe	ʃ a j ʃ p e	0
șaișpea	ʃ a j ʃ p e̯ a	0
șaișpelea	ʃ a j ʃ p e l e̯ a	0
șamoa	ʃ a m o̯ a	0
șaptea	ʃ a p t e̯ a	0
șaptelea	ʃ a p t e l e̯ a	0
șaptesprezece	ʃ a p t e s p r e z e t͡ʃ e	0
șaptesprezecea	ʃ a p t e s p r e z e t͡ʃ e̯ a	0
șaptesprezecelea	ʃ a p t e s p r e z e t͡ʃ e l e̯ a	0
șaptezecea	ʃ a p t e z e t͡ʃ e̯ a	0
șaptezeci	ʃ a p t e z e t͡ʃʲ	0
șaptezecilea	ʃ a p t e z e t͡ʃ i l e̯ a	0
șapteșpe	ʃ a p t e ʃ p e	0
șapteșpea	ʃ a p t e ʃ p e̯ a	0
șapteșpelea	ʃ a p t e ʃ p e l e̯ a	0
șasea	ʃ a s e̯ a	0
șaselea	ʃ a s e l e̯ a	0
șchiop	ʃ c o p	0
școlar	ʃ k o l a r	0
șes	ʃ e s	0
șevalet	ʃ e v a l e t	0
șiret	ʃ i r e t	0
șmecher	ʃ m e k e r	0
șobolan	ʃ o b o l a n	0
șoim	ʃ o j m	0
șontâc	ʃ o n t ɨ k	0
șopârlă	ʃ o p ɨ r l ə	0
șosetă	ʃ o s e t ə	0
șters	ʃ t e r s	0
șterși	ʃ t e r ʃʲ	0
știrb	ʃ t i r b	0
șubred	ʃ u b r e d	0
ț	t͡s e	1
țeapăn	t͡s e̯ a p ə n	0
țeline	t͡s e l i n e	0
țelină	t͡s e l i n ə	0
țestos	t͡s e s t o s	0
țigan	t͡s i ɡ a n	0
țigancă	t͡s i ɡ a ŋ k ə	0
țigani	t͡s i ɡ a nʲ	0
țigănesc	t͡s i ɡ ə n e s k	0
țigănește	t͡s i ɡ ə n e ʃ t e	0
țigăni	t͡s i ɡ ə n i	0
țigănie	t͡s i ɡ ə n i e	0
ține	t͡s i n e	0
ținut	t͡s i n u t	0
țuică	t͡s u j k ə	0
țările	t s ə r i l e	0
țărilor	t s ə r i l o r	0
țărănesc	t͡s ə r ə n e s k	0
букурешть	b u k u r e ʃ tʲ	0
леу	l e w	1
молдовенеск	m o l d o v e n e s k	0
молдовеняскэ	m o l d o v e n e̯ a s k ə	0
урсс	u ɛ r ɛ s ɛ s	0
