oficială	o f i t͡ʃ i a l ə	0
ofilit	o f i l i t	7
ofta	o f t a	93
oi	o j	607
oiță	o i t͡s ə	0
olandeză	o l a n d e z ə	0
olimpic	o l i m p i k	398
oliv	o l i v	11
olog	o l o ɡ	3
oltul	o l t u l	12
omeni	o m e n i	3
omenos	o m e n o s	3
omletă	o m l e t ə	0
omnipotent	o m n i p o t e n t	6
omnipotență	o m n i p o t e n t͡s ə	0
omniprezent	o m n i p r e z e n t	8
omniprezența	o m n i p r e z e n t͡s a	0
omniprezențe	o m n i p r e z e n t͡s e	0
omniprezenței	o m n i p r e z e n t͡s e j	0
omniscient	o m n i s t͡ʃ i e n t	9
omogen	o m o d͡ʒ e n	25
omor	o m o r	327
oncolog	o n k o l o ɡ	21
oncologă	o n k o l o ɡ ə	0
ondulat	o n d u l a t	10
onest	o n e s t	113
oniric	o n i r i k	5
onomatopeic	o n o m a t o p e i k	0
operațional	o p e r a t͡s i o n a l	0
opt	o p t	2035
opta	o p t a	446
optimist	o p t i m i s t	491
optsprezece	o p t s p r e z e t͡ʃ e	10
optsprezecea	o p t s p r e z e t͡ʃ e̯ a	2
optsprezecelea	o p t s p r e z e t͡ʃ e l e̯ a	0
optulea	o p t u l e̯ a	43
optzecea	o b z e t͡ʃ e̯ a	1
optzecea	o p t z e t͡ʃ e̯ a	1
optzeci	o b z e t͡ʃʲ	15
optzeci	o p t z e t͡ʃʲ	15
optzecilea	o b z e t͡ʃ i l e̯ a	0
optzecilea	o p t z e t͡ʃ i l e̯ a	0
optșpe	o p t ʃ p e	0
optșpea	o p t ʃ p e̯ a	0
optșpelea	o p t ʃ p e l e̯ a	0
opus	o p u s	796
opărit	o p ə r i t	0
ora	o r a	13998
oranj	o r a n ʒ	15
oraș	o r a ʃ	0
orb	o r b	127
orbeț	o r b e t͡s	0
orchestral	o r c e s t r a l	38
orfan	o r f a n	32
orgolios	o r ɡ o l i o s	18
ori	o rʲ	9063
oricine	o rʲ t͡ʃ i n e	859
oricum	o rʲ c u m	3444
oricând	o rʲ k ɨ n d	1
oriunde	o rʲ u n d e	415
ornat	o r n a t	26
ornitolog	o r n i t o l o ɡ	17
ornitologă	o r n i t o l o ɡ ə	0
ortodox	o r t o d o k s	246
ortoped	o r t o p e d	17
ortopedist	o r t o p e d i s t	0
ortopedistă	o r t o p e d i s t ə	0
ortopedă	o r t o p e d ə	0
osos	o s o s	212
ostenit	o s t e n i t	15
osu	o s u	71
otrăvitor	o t r ə v i t o r	0
oxigen	o k s i d͡ʒ e n	143
p	p e	6529
pacient	p a t͡ʃ i e n t	332
pacientă	p a t͡ʃ i e n t ə	0
pahar	p a h a r	385
pahare	p a h a r e	118
paisprezece	p a j s p r e z e t͡ʃ e	12
paisprezecea	p a j s p r e z e t͡ʃ e̯ a	1
paisprezecelea	p a j s p r e z e t͡ʃ e l e̯ a	0
paișpe	p a j ʃ p e	0
paișpea	p a j ʃ p e̯ a	0
paișpelea	p a j ʃ p e l e̯ a	0
paleontolog	p a l e o n t o l o ɡ	4
paleontologă	p a l e o n t o l o ɡ ə	0
palid	p a l i d	21
pansexual	p a n s e k s u a l	4
panteră	p a n t e r ə	0
pantof	p a n t o f	21
papagal	p a p a ɡ a l	78
paralitic	p a r a l i t i k	1
paraliza	p a r a l i z a	62
parazitar	p a r a z i t a r	6
parazitologie	p a r a z i t o l o d͡ʒ i e	4
parcurs	p a r k u r s	416
pardon	p a r d o n	242
participiu	p a r t i t͡ʃ i p j u	0
pastor	p a s t o r	2191
pat	p a t	1573
patinare	p a t i n a r e	1
patolog	p a t o l o ɡ	3
patologist	p a t o l o d͡ʒ i s t	0
patologistă	p a t o l o d͡ʒ i s t ə	0
patologă	p a t o l o ɡ ə	0
patra	p a t r a	456
patrulea	p a t r u l e̯ a	332
patruzecea	p a t r u z e t͡ʃ e̯ a	2
patruzeci	p a t r u z e t͡ʃʲ	45
patruzecilea	p a t r u z e t͡ʃ i l e̯ a	0
pașnic	p a ʃ n i k	0
pe	p e	185535
pederastic	p e d e r a s t i k	0
pedestru	p e d e s t r u	1
pediatru	p e d i a t r u	43
pediatră	p e d i a t r ə	0
peiorativ	p e j o r a t i v	14
pelican	p e l i k a n	54
penibil	p e n i b i l	352
pentatlonist	p e n t a t l o n i s t	0
pentatlonistă	p e n t a t l o n i s t ə	0
periculos	p e r i k u l o s	454
peristaltic	p e r i s t a l t i k	1
permanente	p e r m a n e n t e	2861
persan	p e r s a n	18
personaj	p e r s o n a ʒ	478
perturbator	p e r t u r b a t o r	4
peruchier	p e r u k i e r	0
peruvian	p e r u v i a n	60
peruș	p e r u ʃ	0
pervers	p e r v e r s	80
pescos	p e s k o s	2
pescăresc	p e s k ə r e s k	0
peste	p e s t e	16464
peștele	p e ʃ t e l e	0
peștii	p e ʃ t iː	0
picioare	p i t͡ʃ o̯ a r e	1329
picior	p i t͡ʃ j o r	561
pictat	p i k t a t	65
pictură	p i k t u r ə	0
piept	p j e p t	397
pieptos	p j e p t o s	0
piersică	p j e r s i k ə	0
pietros	p j e t r o s	8
pijama	p i ʒ a m a	74
pilot	p i l o t	1446
pilota	p i l o t a	49
pilotaseră	p i l o t a s e r ə	0
pilotați	p i l o t a t͡sʲ	0
piramidă	p i r a m i d ə	0
pisic	p i s i k	19
pisicuță	p i s i k u t͡s ə	0
pisică	p i s i k ə	0
pisoi	p i s o j	24
pitulice	p i t u l i t͡ʃ e	0
pix	p i k s	92
pizdos	p i z d o s	0
pizmaș	p i z m a ʃ	0
planetar	p l a n e t a r	60
plecare	p l e k a r e	311
pleoapă	p l e o̯ a p ə	0
pleoapă	p l e̯ o̯ a p ə	0
pletoric	p l e t o r i k	0
pleșuv	p l e ʃ u v	0
plicticos	p l i k t i k o s	5
plictisitor	p l i k t i s i t o r	45
plin	p l i n	1802
plointe	p l o i n t e	0
plumbos	p l u m b o s	1
plumburiu	p l u m b u r i w	0
plus	p l u s	7890
pluti	p l u t i	7
plutitor	p l u t i t o r	6
plută	p l u t ə	0
plânge	p l ɨ n d ʒ e	0
plâns	p l ɨ n s	0
plăcintă	p l ə t͡ʃ i n t ə	0
plăcut	p l ə k u t	0
plănui	p l ə n u i	0
plăpând	p l ə p ɨ n d	0
poarcă	p o̯ a r k ə	0
podolog	p o d o l o ɡ	0
podologă	p o d o l o ɡ ə	0
pofticios	p o f t i t͡ʃʲ o s	5
poftim	p o f t i m	29
poftim	p o f ↗ t i m	29
polar	p o l a r	529
polisier	p o l i s i e r	0
politicos	p o l i t i k o s	306
poloneze	p o l o n e z e	47
pomeni	p o m e n i	112
pompier	p o m p i e r	29
popesc	p o p e s k	2
popilnic	p o p i l n i k	0
poporan	p o p o r a n	0
popou	p o p o w	7
popular	p o p u l a r	10202
porcesc	p o r t͡ʃ e s k	4
porcin	p o r t͡ʃ i n	17
pornografia	p o r n o ɡ r a f i a	86
pornografic	p o r n o ɡ r a f i k	12
portal	p o r t a l	2608
portocaliu	p o r t o k a l i w	285
portofel	p o r t o f e l	60
portughez	p o r t u ɟ e z	128
portugheză	p o r t u ɟ e z ə	0
porumbac	p o r u m b a k	1
posedare	p o s e d a r e	0
posibil	p o s i b i l	2663
potaie	p o t a j e	14
potasiu	p o t a s j u	68
potecă	p o t e k ə	0
potent	p o t e n t	144
poștal	p o ʃ t a l	0
precaut	p r e k a u t	15
precis	p r e t͡ʃ i s	413
preconiza	p r e k o n i z a	50
precum	p r e k u m	4284
prefix	p ɾ e f i k s	14
prefixal	p r e f i k s a l	0
prefixală	p r e f i k s a l ə	0
pregnant	p r e ɡ n a n t	449
preistoric	p r e i s t o r i k	6
prelung	p r e l u ŋ ɡ	21
prelungi	p r e l u n d͡ʒ i	121
prelungit	p r e l u n d͡ʒ i t	336
preoțesc	p r e o t͡s e s k	0
prepuțial	p r e p u t͡s i a l	0
prescrie	p r e s k r i e	62
prescurtare	p r e s k u r t a r e	2
presocialist	p r e s o t͡ʃ i a l i s t	0
pretențios	p r e t e n t͡s i o s	0
prezent	p r e z e n t	4444
prezenta	p r e z e n t a	2803
prețios	p r e t͡s i o s	0
pricepe	p r i t͡ʃ e p e	219
prier	p r j e r	1
prim	p r i m	1451
prima	p r i m a	14023
primar	p r i m a r	2290
primejdios	p r i m e ʒ d i o s	9
primăvară	p r i m ə v a r ə	0
prin	p r i n	26765
principal	p r i n t͡ʃ i p a l	12644
prins	p r i n s	3609
printre	p r i n t r e	4622
prispă	p r i s p ə	0
proaspăt	p r o̯ a s p ə t	0
problematic	p r o b l e m a t i k	171
proctolog	p r o k t o l o ɡ	0
proctologă	p r o k t o l o ɡ ə	0
profan	p r o f a n	20
profesor	p r o f e s o r	3461
profitabil	p r o f i t a b i l	74
profund	p r o f u n d	451
programabil	p r o ɡ r a m a b i l	2
promorar	p r o m o r a r	5
proporțional	p r o p o r t͡s i o n a l	0
prost	p r o s t	2330
prozaic	p r o z a i k	4
prudent	p r u d e n t	176
prune	p r u n e	88
prânz	p r ɨ n z	0
prăjit	p r ə ʒ i t	0
psihiatru	p s i h i a t r u	80
psihiatră	p s i h i a t r ə	0
psihofizician	p s i h o f i z i t͡ʃ i a n	0
psihofiziciană	p s i h o f i z i t͡ʃ i a n ə	0
psiholog	p s i h o l o ɡ	144
psihologă	p s i h o l o ɡ ə	0
pubertate	p u b e r t a t e	8
public	p u b l i k	16598
pucios	p u t͡ʃʲ o s	0
pugilist	p u d͡ʒ i l i s t	50
pugilistă	p u d͡ʒ i l i s t ə	0
pulos	p u l o s	13
pulpană	p u l p a n ə	0
pulpos	p u l p o s	10
puls	p u l s	157
pumă	p u m ə	0
pur	p u r	1808
purgatoriu	p u r ɡ a t o r i u̯	4
purificator	p u r i f i k a t o r	2
purpuriu	p u r p u r i w	3
pustie	p u s t i e	47
pustiu	p u s t i w	73
putea	p u t e̯ a	14894
puternic	p u t e r n i k	1995
putred	p u t r e d	65
puturos	p u t u r o s	19
pușcă	p u ʃ k ə	0
puținătate	p u t͡s i n ə t a t e	0
pâine	p ɨ j n e	0
pântecos	p ɨ n t e k o s	0
până	p ɨ n ə	1
pârî	p ɨ r ɨ	0
păcătos	p ə k ə t o s	0
păduchios	p ə d u c o s	0
pădureț	p ə d u r e t͡s	0
păduros	p ə d u r o s	0
păgân	p ə ɡ ɨ n	0
păi	p ə j	0
păios	p ə j o s	0
păpădie	p ə p ə d i e	0
părăsit	p ə r ə s i t	0
păsărească	p ə s ə r e̯ a s k ə	0
păsăresc	p ə s ə r e s k	0
păsăroi	p ə s ə r o j	0
pătat	p ə t a t	0
pătlăgea	p ə t l ə d͡ʒ a	0
pătlăgică	p ə t l ə d͡ʒ i k ə	0
pătrat	p ə t r a t	0
r	e r	3909
r	r e	3909
rac	r a k	107
rachetă	ʀ a k e t ə	0
rachiu	r a k i w	35
radioactiv	r a d i o a k t i v	46
rai	r a j	972
raluca	r a l u k a	329
ramolit	r a m o l i t	8
rapid	r a p i d	3681
ras	r a s	2103
rațional	r a t͡s i o n a l	0
raționalizabil	r a t͡s i o n a l i z a b i l	0
rață	r a t͡s ə	0
reabilita	r e a b i l i t a	31
reavăn	r e̯ a v ə n	0
rebeliune	r e b e l i u n e	6
reciclat	r e t͡ʃ i k l a t	24
recunoaște	r e k u n o̯ a s t e	0
reduce	r e d u t ʃ e	2808
redundant	r e d u n d a n t	74
referendum	r e f e r e n d u m	2206
reflectat	r e f l e k t a t	36
refuza	r e f u z a	617
regal	r e ɡ a l	301
regalist	r e ɡ a l i s t	5
regesc	r e d͡ʒ e s k	4
regicid	r e d͡ʒ i t͡ʃ i d	1
regim	r e d͡ʒ i m	929
regula	r e ɡ u l a	1347
regulat	r e ɡ u l a t	224
relaxat	r e l a k s a t	94
religios	r e l i d͡ʒ i o s	179
ren	r e n	544
renumit	r e n u m i t	77
renunța	r e n u n t͡s a	0
reparabil	r e p a r a b i l	2
repede	r e p e d e	2145
repeziți	r e p e z i t͡sʲ	0
rescrie	r e s k r i j e	8
rest	r e s t	5711
retras	r e t r a s	606
reveni	r e v e n i	904
reveni	r e v e nʲ	904
rezemați	r e z e m a t͡sʲ	0
rezident	r e z i d e n t	73
reziduat	r e z i d u a t	0
rezistibil	r e z i s t i b i l	0
reține	r e t͡s i n e	0
ridicat	r i d i k a t	1742
risc	r i s k	998
riscuri	r i s k u rʲ	297
riveran	r i v e r a n	2
roib	r o j b	0
roman	r o m a n	8516
romancier	r o m a n t͡ʃ i e r	19
român	r o m ɨ n	7
românesc	r o m ɨ n e s k	3
românește	r o m ɨ n e ʃ t e	0
româneștilor	r o m ɨ n e ʃ t i l o r	0
românia	r o m ɨ n i a	50
româniei	r o m ɨ n i j e j	8
ros	r o s	586
rotocol	r o t o k o l	3
rotund	r o t u n d	70
rotunjit	r o t u n ʒ i t	11
roz	r o z	237
roză	r o z ə	0
roșcat	r o ʃ k a t	0
roșie	r o ʃ i e	0
roșie	r o ʃ j e	0
roșu	r o ʃ u	0
ruginiu	r u d͡ʒ i n i w	4
ruina	r u i n a	234
ruinare	r u i n a r e	1
rumegător	r u m e ɡ ə t o r	0
rupt	r u p t	502
rus	r u s	4458
ruse	r u s e	452
rusă	r u s ə	0
rută	r u t ə	0
rușinos	r u ʃ i n o s	0
râios	r ɨ j o s	0
râmlenesc	r ɨ m l e n e s k	0
râncaci	r ɨ ŋ k a t͡ʃʲ	0
rânced	r ɨ n t͡ʃ e d	0
rând	r ɨ n d	1
rână	r ɨ n ə	0
râpos	r ɨ p o s	0
răgușit	r ə ɡ u ʃ i t	0
rămas	r ə m a s	0
rămași	r ə m a ʃʲ	0
rămuros	r ə m u r o s	0
răpciune	r ə p t͡ʃ u n e	0
răpitor	r ə p i t o r	0
răposat	r ə p o s a t	0
răpănos	r ə p ə n o s	0
răsunător	r ə s u n ə t o r	0
răszice	r ə s z i t͡ʃ e	0
rătăcit	r ə t ə t͡ʃ i t	0
rău	r ə w	1
răutăcios	r ə u t ə t͡ʃʲ o s	0
răzbate	r ə z b a t e	0
răzleț	r ə z l e t͡s	0
rășinos	r ə ʃ i n o s	0
rățoi	r ə t͡s o j	0
s	e s	56296
s	s	56296
s	s e	56296
sa	s a	233387
sacristan	s a k r i s t a n	5
sal	s a l	3088
sal	s aː l	3088
salariat	s a l a r i a t	97
salt	s a l t	1765
salut	s a l u t	216
saluta	s a l u t a	71
salve	s a l v e	256
samoan	s a m o a n	23
sapient	s a p i e n t	0
sare	s a r e	851
satanic	s a t a n i k	43
satisfăcut	s a t i s f ə k u t	0
satisfăcător	s a t i s f ə k ə t o r	0
saudit	s a u d i t	68
sașiu	s a ʃ i w	0
scandiu	s k a n d j u	0
scaucă	s k a u k ə	0
schepsis	s k e p s i s	1
schilod	s c i l o d	1
schimb	s k i m b	2790
schimba	s k i m b a	1666
schior	s k i o r	12
scit	s t͡ʃ i t	3
sclave	s k l a v e	4
sclavi	s k l a vʲ	96
sclavă	s k l a v ə	0
scorni	s k o r n i	1
scorpion	s k o r p j o n	150
scorțișoară	s k o r t s i ʃ o̯ a r ə	0
scrimer	s k r i m e r	2
scroafă	s k r o̯ a f ə	0
scufundat	s k u f u n d a t	57
sculptat	s k u l p t a t	17
scump	s k u m p	585
scund	s k u n d	20
scurt	s k u r t	2219
scutec	s k u t e k	5
scârbos	s k ɨ r b o s	0
scălan	s k ə l a n	0
scăldat	s k ə l d a t	0
scămos	s k ə m o s	0
se	s e	554115
seara	s e̯ a r a	4343
searbăd	s e̯ a r b ə d	0
seară	s e̯ a r ə	0
sec	s e k	797
secol	s e k o l	260
secret	s e k r e t	2100
secretariat	s e k r e t a r i a t	122
secundar	s e k u n d a r	124
secvențial	s e k v e n t͡s i a l	0
sefard	s e f a r d	4
seismolog	s e i s m o l o ɡ	5
seismologă	s e i s m o l o ɡ ə	0
seleniu	s e l e n j u	16
semicerc	s e m i t͡ʃ e r k	18
semiotician	s e m i o t i t͡ʃ i a n	0
semioticiană	s e m i o t i t͡ʃ i a n ə	0
senin	s e n i n	562
sentiment	s e n t i m e n t	519
septembrie	s e p t e m b r i j e	6225
ser	s e r	105180
serios	s e r i o s	1606
servus	s e r v u s	11
setos	s e t o s	8
sexologia	s e k s o l o d͡ʒ i a	8
sexos	s e k s o s	313
sfat	s f a t	293
sferic	s f e r i k	2
siberian	s i b e r i a n	45
sictir	s i k t i r	37
sictir	s ɨ k t i r	37
sie	s i e	222
sieși	s i e ʃʲ	0
silabic	s i l a b i k	0
siliciu	s i l i t͡ʃ j u	7
simbol	s i m b o l	253
simetric	s i m e t r i k	6
simula	s i m u l a	106
sincer	s i n t͡ʃ e r	934
sine	s i n e	34785
sinergie	s i n e r d͡ʒ i e	1
singur	s i ŋ ɡ u r	3551
singuratec	s i ŋ ɡ u r a t e k	0
singuratic	s i ŋ ɡ u r a t i k	14
sinistru	s i n i s t r u	59
sinonim	s i n o n i m	40
sirian	s i r i a n	134
sistem	s i s t e m	3158
slang	s l e n ɡ	246
slav	s l a v	75
slavă	s l a v ə	0
slobod	s l o b o d	8
slugarnic	s l u ɡ a r n i k	10
slut	s l u t	66
slăbănog	s l ə b ə n o ɡ	0
soacră	s o̯ a k r ə	0
soc	s o k	378
social	s o t͡ʃ i a l	22962
sociolog	s o t͡ʃ i o l o ɡ	29
sociologă	s o t͡ʃ i o l o ɡ ə	0
socotit	s o k o t i t	51
socru	s o c r u	27
sodiu	s o d j u	71
sofisticat	s o f i s t i k a t	35
solar	s o l a r	2685
solemn	s o l e m n	105
solid	s o l i d	2225
solstițiu	s o l s t i t s i u̯	0
somat	s o m a t	55
somnambulism	s o m n a m b u l i s m	3
somnoros	s o m n o r o s	8
soporific	s o p o r i f i k	1
sora	s o r a	576
sos	s o s	720
soție	s o t͡s i j e	0
spaniol	s p a n i o l	338
spanioli	s p a n i o lʲ	96
spaniolă	s p a n i o l ə	0
sparge	s p a r d͡ʒ e	118
spargere	s p a r d͡ʒ e r e	26
spart	s p a r t	556
sparți	s p a r t͡sʲ	0
spate	s p a t e	1314
specific	s p e t͡ʃ i f i k	1717
spera	s p e r a	920
speranță	s p e r a n t s ə	0
sperare	s p e r a r e	0
speriat	s p e r i a t	370
spinos	s p i n o s	0
spirit	s p i r i t	2370
spiritual	s p i r i t u a l	727
spornic	s p o r n i k	1
sprijin	s p r i ʒ i n	824
sprijini	s p r i ʒ i n i	246
sprinten	s p r i n t e n	364
spumos	s p u m o s	9
spune	s p u n e	11209
spurcat	s p u r k a t	12
spus	s p u s	17893
spân	s p ɨ n	0
spălare	s p ə l a r e	0
spălător	s p ə l ə t o r	0
spătos	s p ə t o s	0
stabil	s t a b i l	756
stagiune	s t a d͡ʒ u n e	55
stanifer	s t a n i f e r	0
statistic	s t a t i s t i k	172
statistician	s t a t i s t i t͡ʃ i a n	18
statisticiană	s t a t i s t i t͡ʃ i a n ə	0
stea	s t e̯ a	1191
steaua	s t e̯ a w a	9423
stei	s t e j	10
sterp	s t e r p	10
stetoscop	s t e t o s k o p	3
stil	s t i l	4226
stingher	s t i ŋ ɟ e r	11
straniu	s t r a n j u	54
stricat	s t r i k a t	222
strigat	s t r i ɡ a t	205
structural	s t r u k t u r a l	295
structurat	s t r u k t u r a t	78
strugure	s t̪ ɾ u ɡ u ɾ e	4
struț	s t r u t͡s	0
strâmb	s t r ɨ m b	0
strâmt	s t r ɨ m t	0
strângător	s t r ɨ ŋ ɡ ə t o r	0
străbunic	s t r ə b u n i k	0
străin	s t r ə i n	0
strălucitor	s t r ə l u t͡ʃ i t o r	0
strănepot	s t r ə n e p o t	0
străvechi	s t r ə v e c	0
străveziu	s t r ə v e z i w	0
studentă	s t u d e n t ə	0
stufos	s t u f o s	16
stupi	s t u p i	14
stupi	s t u pʲ	14
stupină	s t u p i n ə	0
stâng	s t ɨ ŋ ɡ	0
stăpânitor	s t ə p ɨ n i t o r	0
sub	s u b	9674
submarin	s u b m a r i n	42
subsonic	s u b s o n i k	4
substantiv	s u b s t a n t i v	160
subteran	s u b t e r a n	160
subtil	s u b t i l	84
suburban	s u b u r b a n	257
subțire	s u b t͡s i r e	0
sudic	s u d i k	27
suedeze	s u e d e z e	25
suficient	s u f i t͡ʃ i e n t	1228
sugaci	s u ɡ a t͡ʃʲ	1
sugar	s u ɡ a r	1098
suge	s u d͡ʒ e	96
sulc	s u l k	1
suleget	s u l e d͡ʒ e t	0
sulf	s u l f	17
sulfuros	s u l f u r o s	15
sunător	s u n ə t o r	0
superior	s u p e r i o r	8180
suplu	s u p l u	18
supranațional	s u p r a n a t͡s i o n a l	0
suprem	s u p r e m	228
sur	s u r	7677
surd	s u r d	36
sure	s u r e	5571
surprinzător	s u r p r i n z ə t o r	0
surâs	s u r ɨ s	0
susceptibil	s u s t͡ʃ e p t i b i l	16
suspensor	s u s p e n s o r	3
susura	s u s u r a	5
suta	s u t a	2131
sute	s u t e	2233
sutime	s u t i m e	2
sutălea	s u t ə l e̯ a	0
sâmbătă	s ɨ m b ə t ə	0
sângera	s ɨ n d͡ʒ e r a	0
sângeriu	s ɨ n d͡ʒ e r i w	0
sânt	s ɨ n t	0
sârb	s ɨ r b	0
sârguincios	s ɨ r ɡ u i n t͡ʃʲ o s	0
să	s ə	8
săcret	s ə k r e t	0
sălciu	s ə l t͡ʃ i w	0
săltăreț	s ə l t ə r e t͡s	0
sămânțos	s ə m ɨ n t͡s o s	0
săptămânal	s ə p t ə m ɨ n a l	0
sărat	s ə r a t	1
sărman	s ə r m a n	0
sătul	s ə t u l	0
săturat	s ə t u r a t	0
său	s ə w	2
t	t e	3642
ta	t a	17356
tahitian	t a h i t i a n	9
tainic	t a j n i k	23
talcioc	t a l t͡ɕ ɵ k	7
tandru	t a n d r u	30
tanti	t a n tʲ	117
tanzanian	t a n z a n i a n	24
tarantulă	t a r a n t u l ə	0
tatu	t a t u	126
tavan	t a v a n	74
taxi	t a k s i	1258
tehnic	t e h n i k	981
tehnică	t e h n i k ə	0
tehnologic	t e h n o l o d͡ʒ i k	141
tembel	t e m b e l	31
temniță	t e m n i t s ə	0
temperatură	t e m p e r a t u r ə	0
temporar	t e m p o r a r	358
temător	t e m ə t o r	0
tendință	t e n d i n t͡s ə	0
tenisman	t e n i s m a n	22
tenismană	t e n i s m a n ə	0
tenta	t e n t a	1135
teoretic	t e o r e t i k	430
teoric	t e o r i k	0
terapeutic	t e r a p e u t i k	57
terestru	t e r e s t r u	16
terț	t e r t͡s	0
terțiu	t e r t͡s i w	0
testa	t e s t a	725
testicular	t e s t i k u l a r	29
tibetan	t i b e t a n	59
ticălos	t i k ə l o s	0
timid	t i m i d	120
timișoarei	t i m i ʃ o̯ a r e j	0
timișorean	t i m i ʃ o r e̯ a n	0
timonier	t i m o n i e r	3
timpuriu	t i m p u r i w	35
tine	t i n e	5469
tins	t i n s	21
tip	t i p	3488
tipa	t i p a	201
tipă	t i p ə	0
tiramisu	t i r a m i s u	22
tisă	t i s ə	0
titan	t i t a n	349
toamnă	t o̯ a m n ə	0
tocat	t o k a t	112
tocit	t o t͡ʃ i t	16
tomată	t o m a t ə	0
tomnatic	t o m n a t i k	2
tongan	t o ŋ ɡ a n	15
tortura	t o r t u r a	629
tortură	t o r t u r ə	0
tot	t o t	67388
totuși	t o t u ʃʲ	0
tovărășesc	t o v ə r ə ʃ e s k	0
toxic	t o k s i k	360
tradiție	t r a d i t͡s i e	0
traduce	t r a d u t ʃ e	288
traductor	t r a d u k t o r	69
traiectorie	t r a j e k t o r i e̯	20
tramvai	t r a m v a j	280
trandafiriu	t r a n d a f i r i w	1
transatlantic	t r a n s a t l a n t i k	44
transcendental	t r a n s t͡ʃ e d e n t a l	40
transcrie	t r a n s k r i e	9
transparent	t r a n s p a r e n t	397
transpune	t r a n s p u n e	25
transpunere	t r a n s p u n e r e	4
tranzient	t r a n z i e n t	0
tranzitiv	t r a n z i t i v	0
tranzițional	t r a n z i t͡s i o n a l	0
trata	t r a t a	5254
tratament	t r a t a m e n t	2020
traversa	t r a v e r s a	159
trebui	t r e b u i	8550
trecut	t r e k u t	10036
trecător	t r e k ə t o r	0
treia	t r e j a	1297
treilea	t r e j l e̯ a	1115
treisprezece	t r e j s p r e z e t͡ʃ e	21
treisprezecea	t r e j s p r e z e t͡ʃ e̯ a	4
treisprezecelea	t r e j s p r e z e t͡ʃ e l e̯ a	11
treizecea	t r e j z e t͡ʃ e̯ a	0
treizeci	t r e j z e t͡ʃʲ	70
treizecilea	t r e j z e t͡ʃ i l e̯ a	0
treișpe	t r e j ʃ p e	0
treișpea	t r e j ʃ p e̯ a	0
treișpelea	t r e j ʃ p e l e̯ a	0
tren	t r e n	1429
triatlonist	t r i a t l o n i s t	0
triatlonistă	t r i a t l o n i s t ə	0
tridimensional	t r i d i m e n s i o n a l	106
trinidadian	t r i n i d a d i a n	10
trist	t r i s t	884
trivial	t r i v i a l	115
trișa	t r i ʃ a	0
trompetă	t r o m p e t ə	0
tron	t r o n	207
trota	t r o t a	6
trudit	t r u d i t	15
trândav	t r ɨ n d a v	0
trântit	t r ɨ n t i t	0
trăgător	t r ə ɡ ə t o r	0
trăsnit	t r ə s n i t	0
trăsătură	t r ə s ə t u r ə	0
tu	t u	11670
tucan	t u k a n	20
tulbure	t u l b u r e	68
tunisian	t u n i s i a n	49
tuns	t u n s	60
turc	t u r k	230
turcescu	t u r t͡ʃ e s k u	101
turistic	t u r i s t i k	252
turkmen	t u r k m e n	58
turn	t u r n	4011
tutela	t u t e l a	352
tuvaluan	t u v a l u a n	0
tuși	t u ʃ i	0
tâmp	t ɨ m p	0
tâmpit	t ɨ m p i t	0
târziu	t ɨ r z i w	4
tăcut	t ə k u t	0
tăi	t ə j	0
tăios	t ə j o s	0
tătic	t ə t i k	0
tău	t ə w	1
u	u	63637
ubicuității	u b i k u i t ə t s i	0
ubicuu	u b i k u u	3
ubicuu	u b i k uː	3
ud	u d	371
udat	u d a t	24
udmurt	u d m u r t	14
uimi	u j m i	14
ulm	u l m	124
ultim	u l t i m	296
uman	u m a n	434
umbelă	u m b e l ə	0
umbrelă	u m b r e l ə	0
umbros	u m b r o s	4
umbră	u m b r ə	0
umed	u m e d	78
umil	u m i l	33
umple	u m p l e	313
un	u n	457378
una	u n a	203193
unchi	u ŋ kʲ	42
undeva	u n d e v a	995
undiță	u n d i t͡s ə	0
undrea	u n d r e̯ a	3
unduios	u n d u j o s	0
undă	u n d ə	0
unealtă	u n e̯ a l t ə	0
unei	u n e j	12301
unguresc	u ŋ ɡ u r e s k	28
unidirecțional	u n i d i r e k t͡s i o n a l	0
uniform	u n i f o r m	639
unilateral	u n i l a t e r a l	328
unire	u n i r e	99
unor	u n o r	8489
unsprezece	u n s p r e z e t͡ʃ e	68
unsprezecea	u n s p r e z e t͡ʃ e̯ a	7
unsprezecelea	u n s p r e z e t͡ʃ e l e̯ a	0
unsuros	u n s u r o s	1
untos	u n t o s	2
untură	u n t u r ə	0
unu	u n u	679
unui	u n u j	15507
unșpe	u n ʃ p e	0
unșpea	u n ʃ p e̯ a	0
unșpelea	u n ʃ p e l e̯ a	0
ura	u r a	548
uragan	u r a ɡ a n	12
urcare	u r k a r e	71
urcat	u r k a t	987
ureche	u r e k e	210
uriaș	u r i a ʃ	0
urina	u r i n a	283
urină	u r i n ə	0
urmă	u r m ə	1
urmări	u r m ə r i	0
următor	u r m ə t o r	0
urolog	u r o l o ɡ	15
urologă	u r o l o ɡ ə	0
uruguayan	u r u ɡ w a j a n	20
urzeală	u r z e̯ a l ə	0
urzică	u r z i k ə	1
urât	u r ɨ t	0
urî	u r ɨ	0
uscat	u s k a t	235
ustensilă	u s t e n s i l ə	0
usturător	u s t u r ə t o r	0
util	u t i l	448
utila	u t i l a	126
utile	u t i l e	170
utili	u t i lʲ	23
uzi	u zʲ	49
uzină	u z i n ə	0
v	v	5464
v	v e	5464
vag	v a ɡ	95
vagabond	v a ɡ a b o n d	48
vai	v a j	24084
valah	v a l a x	29
valoare	v a l o̯ a r e	3860
valon	v a l o n	9
valoros	v a l o r o s	203
vamal	v a m a l	98
van	v a n	486657
vanadiu	v a n a d j u	2
vanitos	v a n i t o s	6
vapor	v a p o r	602
vara	v a r a	4006
vară	v a r ə	0
vechi	v e kʲ	2726
vecin	v e t͡ʃ i n	297
vecini	v e t͡ʃ i nʲ	325
vecină	v e t͡ʃ i n ə	0
venera	v e n e ɾ a	61
venerare	v e n e r a r e	4
venerație	v e n e r a t s i e	0
veneric	v e n e r i k	0
venezuelean	v e n e z u e l e̯ a n	11
venă	v e n ə	0
verandă	v e r a n d ə	0
verbină	v e r b i n ə	0
verde	v e r d e	6047
vergur	v e r ɡ u r	0
vergură	v e r ɡ u r ə	0
verișoară	v e r i ʃ o̯ a r ə	0
verosimil	v e r o s i m i l	6
versatile	v e r s a t i l e	147
versatili	v e r s a t i lʲ	3
verzui	v e r z u j	7
vesel	v e s e l	109
via	v i a	19995
victorios	v i k t o r i o s	33
vid	v i d	370
vie	v i e	757
viermănos	v j e r m ə n o s	0
viețui	v j e t͡s u i	0
viguros	v i ɡ u r o s	23
vii	v i j	2010
vii	v iː	2010
viitor	v i i t o r	2967
vinaț	v i n a t͡s	0
vindecător	v i n d e k ə t o r	0
vindicativ	v i n d i k a t i v	2
vine	v i n e	4666
vineri	v i n e rʲ	6287
vinicer	v i n i t͡ʃ e r	0
vinos	v i n o s	199
vinovat	v i n o v a t	825
vioi	v i o j	40
viol	v i o l	218
viola	v j o l a	631
violent	v i o l e n t	962
violet	v i o l e t	173
viperă	v i p e r ə	0
vipt	v i p t	0
viral	v i r a l	444
virgin	v i r d͡ʒ i n	523
virgină	v i r d͡ʒ i n ə	0
viril	v i r i l	26
virile	v i r i l e	11
virilitatea	v i r i l i t a t e̯ a	2
virilității	v i r i l i t ə t s i	0
virnanț	v i r n a n t͡s	0
virolog	v i r o l o ɡ	1
virologă	v i r o l o ɡ ə	0
virotic	v i r o t i k	0
viroză	v i r o z ə	0
virtuos	v i r t u o s	36
vitamină	v i t a m i n ə	0
viteaz	v i t e̯ a z	17
viteză	v i t e z ə	0
viticultor	v i t i k u l t o r	8
vitreg	v i t r e ɡ	61
vitrină	v i t r i n ə	0
vită	v i t ə	0
viu	v i w	2249
vizibil	v i z i b i l	281
vișină	v i ʃ i n ə	0
viță	v i t͡s ə	0
vlăstar	v l ə s t a r	0
voastre	v o̯ a s t r e	371
voce	v o t͡ʃ e	374
voinic	v o j n i k	14
voință	v o i n t͡s ə	0
voios	v o j o s	7
volbură	v o l b u r ə	0
voltaj	v o̞ l t a ʒ	28
vor	v o r	38043
vorbăreț	v o r b ə r e t͡s	0
vostru	v o s t r u	431
vouă	v o w ə	0
voștri	v o ʃ t r i	0
vrajă	v r a ʒ ə	0
vrea	v r e̯ a	7714
vrednic	v r e d n i k	18
vremelnic	v r e m e l n i k	18
vreun	v r e u n	1401
vreun	v r e̯ u n	1401
vro	v r o	23
vrun	v r u n	0
vulcan	v u l k a n	148
vulcanolog	v u l k a n o l o ɡ	0
vulcanologă	v u l k a n o l o ɡ ə	0
vulgar	v u l ɡ a r	248
vâlced	v ɨ l t͡ʃ e d	0
vânjos	v ɨ n ʒ o s	0
vânos	v ɨ n o s	0
vântos	v ɨ n t o s	0
vână	v ɨ n ə	0
vânăt	v ɨ n ə t	0
vânătă	v ɨ n ə t ə	0
vârtos	v ɨ r t o s	0
vâscos	v ɨ s k o s	0
vă	v ə	1
vădos	v ə d o s	0
văduv	v ə d u v	0
văduvă	v ə d u v ə	0
văr	v ə r	0
văratic	v ə r a t i k	0
vărgat	v ə r ɡ a t	0
vărui	v ə r u i	0
văzuți	v ə z u t͡sʲ	0
whisky	u j s k i	459
whisky	w i s k i	459
wikționar	w i k t͡s i o n a r	0
x	i k s	8796
z	z e	3529
z	z e t	3529
zadarnic	z a d a r n i k	22
zahăr	z a h ə r	0
zambian	z a m b i a n	77
zarzavagioaică	z a r z a v a d͡ʒ w a i̯ k ə	0
zarzavagiu	z a r z a v a d͡ʒ i w	0
zarzără	z a r z ə r ə	0
zbici	z b i t͡ʃ i	0
zdravăn	z d r a v ə n	0
zeamă	z e̯ a m ə	0
zece	z e t͡ʃ e	2505
zecea	z e t͡ʃ e̯ a	64
zecelea	z e t͡ʃ e l e̯ a	26
zeci	z e t͡ʃʲ	2231
zecimal	z e t͡ʃ i m a l	0
zecime	z e t͡ʃ i m e	12
zeiță	z e i t͡s ə	0
zemos	z e m o s	5
