a	a
aball	a v a l͈
abbán	a b aː n
abis	a vʲ i sʲ
abis	a vʲ i s
abissiu	a vʲ i sʲ u
abla	a v l a
acair	a ɡ i rʲ
acaldam	a ɡ a l͈ d a ṽ
accai	a k i
accastar	a k a s t a r
accat	a k a d
accatar	a k a d a r
accathar	a k a θ a r
accobar	a k o v a r
accobra	a k o v r a
accobri	a k o v r i
accomlatar	a k o ṽ l a d a r
accomol	a k o ṽ o l
accomoltar	a k o ṽ o l͈ t a r
accrann	a k r a n͈
accrannaib	a k r a n͈ i vʲ
accuis	a k u sʲ
achair	a x i rʲ
acht	a x t
achta	a x t a
adágainn	a ð aː ɣ i n͈ʲ
adágathar	a ð aː ɣ a θ a r
adágathar	a ð aː ɣ a ð a r
adágur	a ð aː ɣ u r
adáichfer	a ð aː xʲ fʲ e r
adáichfethar	a ð aː xʲ fʲ e θ a r
adáichfethar	a ð aː xʲ fʲ e ð a r
adaig	a ð i ɣʲ
adaig	a ð a ɣʲ
adáigther	a ð aː ɣʲ θʲ e r
adáigther	a ð aː ɣʲ ðʲ e r
adaill	a ð a l͈ʲ
adall	a ð a l͈
adaltras	a ð a l͈ t r a s
ádam	aː ð a ṽ
adamrae	a ð a ṽ r e
adamraigedar	a ð a ṽ r i ɣʲ e ð a r
adamraigetar	a ð a ṽ r i ɣʲ e d a r
adamraigetar	a ð a ṽ r i ɣʲ e d a r
adamraigther	a ð a ṽ r i ɣʲ θʲ e r
adamraigthi	a ð a ṽ r i ɣʲ θʲ i
adamrigther	a ð a ṽ r i ɣʲ θʲ e r
adamrugur	a ð a ṽ r u ɣ u r
adarc	a ð a r k
adarcae	a ð a r k e
adarcaib	a ð a r k i vʲ
adbar	a ð v a r
adceid	a ð kʲ e ðʲ
adceithe	a ð kʲ e θʲ e
adcess	a ð kʲ ɛ s
adcessa	a ð kʲ ɛ s a
adchess	a ð xʲ ɛ s
adchí	a ð xʲ iː
adchiam	a ð xʲ i a ṽ
adchíther	a ð xʲ iː θ e r
adchobrai	a ð x o v r i
adchobrat	a ð x o v r a d
adchodados	a ð x o d a ð o s
adchomlatar	a ð x o ṽ l a d a r
adchotadsam	a ð x o d a ð s a ṽ
adchotar	a ð x o d a r
adchotate	a ð x o d a d e
adcí	a ð kʲ iː
adciam	a ð kʲ i a ṽ
adcichitis	a ð kʲ i xʲ i dʲ i sʲ
adcichlus	a ð kʲ i x l u s
adcíther	a ð kʲ iː θ e r
adcladat	a ð k l a ð a d
adclaid	a ð k l a ðʲ
adcobra	a ð k o v r a
adcobrai	a ð k o v r i
adcobraim	a ð k o v r i mʲ
adcobrat	a ð k o v r a d
adcobrinn	a ð k o v r i n͈ʲ
adcodados	a ð k o d a ð o s
adcomaltar	a ð k o ṽ a l͈ t a r
adcomla	a ð k o ṽ l a
adcomlat	a ð k o ṽ l a d
adcomlatar	a ð k o ṽ l a d a r
adcosantae	a ð k o s a n͈ t e
adcosna	a ð k o s n͈ a
adcosnae	a ð k o s n e
adcosnai	a ð k o s n͈ i
adcosnainn	a ð k o s n i n͈ʲ
adcosnat	a ð k o s n a d
adcot	a ð k o d
adcota	a ð k o d a
adcotad	a ð k o d a ð
adcotade	a ð k o d a ð e
adcotadsam	a ð k o d a ð s a ṽ
adcotadus	a ð k o d a ð u s
adcotar	a ð k o d a r
adcotat	a ð k o d a d
adcotate	a ð k o d a d e
adcotatsat	a ð k o d a d s a d
adcotedae	a ð k o d e ð e
adcuaid	a ð k u i ðʲ
adeirrig	a ð e r͈ʲ i ɣʲ
adella	a ð e l͈ a
adellat	a ð e l͈ a d
adelliub	a ð e l͈ʲ i u̯ v
aderrius	a ð e r͈ʲ i u̯ s
adersetar	a ð e r͈ʲ sʲ e d a r
adfét	a ð fʲ eː d
adfíadam	a ð fʲ iː a̯ ð a ṽ
adfíadar	a ð fʲ iː a̯ ð a r
adfíadar	a ð iː a̯ ð a r
adfíadat	a ð fʲ iː a̯ ð a d
adgair	a ð ɡ a rʲ
adgairid	a ð ɡ a rʲ i ðʲ
adgaur	a ð ɡ a u̯ r
adgén	a ð ɡʲ eː n
adgénammar	a ð ɡʲ eː n a m a r
adgéntar	a ð ɡʲ eː n͈ t a r
adgéuin	a ð ɡʲ eː u̯ nʲ
adgládathar	a ð ɡ l aː ð a θ a r
adgnin	a ð ɡʲ nʲ i nʲ
adgúisiu	a ð ɡ uː sʲ u
adgúset	a ð ɡ uː sʲ e d
adgúsi	a ð ɡ uː sʲ i
adgústis	a ð ɡ uː sʲ tʲ i sʲ
adíadar	a ð iː a̯ ð a r
adib	a ðʲ i vʲ
adidchotatsat	a ð i ð x o d a d s a d
adidgéuin	a ð i ð ɣʲ eː u̯ nʲ
adilgnigidir	a ðʲ i lʲ ɡʲ nʲ i ɣʲ i ðʲ i rʲ
adindchomlat	a d i n͈ d x o ṽ l a d
admat	a ð m a d
admidethar	a ð mʲ i ðʲ e θ a r
adnoí	a ð n͈ oː i̯
adobragart	a d o v r a ɣ a r͈ t
adopair	a ð o b i rʲ
adrad	a ð r a ð
adragart	a ð r a ɣ a r͈ t
adráigsetar	a ð r͈ aː ɣʲ sʲ e d a r
adráigsetar	a ð r͈ aː xʲ sʲ e d a r
adrími	a ð r͈ʲ iː ṽʲ i
adrochomolta	a ð r o x o ṽ o l͈ t a
adrochomul	a ð r͈ o x o ṽ u l
adrograd	a ð r͈ o ɣ r a ð
adroilli	a ð r͈ o l͈ i
adruamraigset	a ð r͈ u a ṽ r i ɣʲ sʲ e d
adruchoisséni	a ð r u x o sʲ eː nʲ i
adtluchedar	a ð t l u xʲ e ð a r
adtreba	a ð tʲ rʲ e v a
áed	aː i̯ ð
áedacán	aː i̯ ð a ɡ aː n
aeir	a e rʲ
aer	a e r
áes	aː i̯ s
áesmar	aː i̯ s ṽ a r
afraic	a f r i kʲ
ag	a ɣ
ág	aː ɣ
ága	aː ɣ a
agad	a ɣ a ð
agair	a ɣ i rʲ
agat	a ɣ a d
ágatar	aː ɣ a d a r
ágathar	aː ɣ a θ a r
águr	aː ɣ u r
aicce	a kʲ e
aiccend	a kʲ e n͈ d
aicci	a kʲ i
aicher	a xʲ e r
áichfetar	aː xʲ fʲ e d a r
aichre	a xʲ rʲ e
aicned	a ɡʲ nʲ e ð
aicniud	a ɡʲ nʲ u ð
aicsenaib	a kʲ sʲ e n i vʲ
aicsin	a kʲ sʲ i nʲ
aicsu	a kʲ sʲ u
aidche	a ðʲ xʲ e
aidchi	a ðʲ xʲ i
aidlignigitir	a ðʲ lʲ i ɡʲ nʲ i ɣʲ i dʲ i rʲ
aiges	a ɣʲ e s
áigetar	aː ɣʲ e d a r
aigid	a ɣʲ i ðʲ
áigsetar	aː ɣʲ sʲ e d a r
áigther	aː ɣʲ θʲ e r
áigther	aː ɣʲ ðʲ e r
áigthiu	aː ɣʲ θʲ u
ail	a lʲ
aile	a lʲ e
ailid	a lʲ i ðʲ
ailide	a lʲ i ðʲ e
ailidetu	a lʲ i ðʲ e d u
ailidi	a lʲ i ðʲ i
ailte	a i lʲ tʲ e
aimdetar	a mʲ ðʲ e d a r
aimmded	a mʲ ðʲ e ð
ain	a nʲ
ainder	a n͈ʲ dʲ e r
aingel	a ŋʲ ɡʲ e l
aingel	a nʲ ɣʲ e l
aingid	a nʲ ɣʲ i ðʲ
aingil	a ŋʲ ɡʲ i lʲ
aingil	a nʲ ɣʲ i lʲ
ainimm	a nʲ i m
ainmm	a nʲ mʲ
air	a rʲ
aird	a r͈ʲ dʲ
airde	a r͈ʲ dʲ e
aire	a rʲ e
airegdae	a rʲ e ɣ ð e
airegdu	a rʲ e ɣ ð u
airfitech	a rʲ fʲ i dʲ e x
airg	a rʲ ɡʲ
airid	a rʲ i ðʲ
aís	aː i̯ s
aís	aː i̯ sʲ
aisil	a sʲ i lʲ
aite	a dʲ e
aithche	a θʲ xʲ e
aithchi	a θʲ xʲ i
aithgéuin	a θʲ ɣʲ eː u̯ nʲ
aithgnintar	a θʲ ɣʲ nʲ i n͈ t a r
aithirge	a θʲ i rʲ ɣʲ e
aithirgi	a θʲ i rʲ ɣʲ i
aithirgid	a θʲ i r ɣʲ i ðʲ
aithirrestar	a θʲ i r͈ʲ e s t a r
aithirset	a θʲ i r sʲ e d
aithirsid	a θʲ i r sʲ i ðʲ
aithmet	a θʲ ṽʲ e d
aithne	a θʲ nʲ e
aiti	a dʲ i
aitt	a tʲ
áitt	aː tʲ
álaind	aː l i n͈ d
albu	a l b u
allaid	a l͈ i ðʲ
allas	a l͈ a s
altae	a l͈ t e
altram	a l͈ t r a m
am	a m
amail	a ṽ i lʲ
amal	a ṽ a l
amar	a ṽ a r
ammait	a m i dʲ
ammus	a m u s
amrae	a ṽ r e
anáil	a n aː lʲ
anál	a n aː l
análfadach	a n aː l f a ð a x
and	a n͈ d
aní	a n͈ʲ iː
anim	a nʲ i ṽʲ
anim	a nʲ i m
anís	a n͈ʲ iː s
anísiu	a n͈ʲ iː sʲ i u̯
anmain	a n m i nʲ
anman	a n m a n
anme	a n m e
anmin	a n m i nʲ
ansam	a n͈ s a ṽ
anse	a n͈ s e
anúas	a n͈ uː a̯ s
ap	a b
apad	a b a ð
apid	a b i ðʲ
apstal	a b s t a l
ar	a r
arachrin	a r a xʲ rʲ i nʲ
aracotar	a r a k o d a r
áram	aː r a v̄
arán	a r aː n
ararethi	a r a rʲ e θʲ i
ard	a r͈ d
arda	a r͈ d a
ardu	a r͈ d u
árem	aː rʲ e ṽ
argaib	a r ɡ a vʲ
argat	a r ɡ a d
arreith	a r r͈ʲ e θʲ
arsaid	a r͈ s i ðʲ
arsidetu	a r s i ðʲ e d u
art	a r͈ t
áru	aː r u
asagú	a s a ɡ uː
asagúsi	a s a ɡ uː sʲ i
ásaid	aː s i ðʲ
asbeir	a s bʲ e rʲ
asbiur	a s bʲ i u̯ r
ascnae	a s k n e
asinchobra	a s i n x o v r a
asmbeir	a s mʲ bʲ e rʲ
asruguset	a s r u ɣ u sʲ e d
ass	a s
assagúiset	a s a ɡ uː sʲ e d
assagúsea	a s a ɡ uː sʲ a
assu	a s u
at	a t
at	a d
ata	a d a
ata	a t aː
atacomla	a d a ɡ o ṽ l a
ataella	a d a e l͈ a
atannaigi	a d a n a ɣʲ nʲ i
atanneirrig	a d a n͈ʲ e r͈ʲ i ɣʲ
ataré	a d a r͈ʲ eː
atatgéntar	a d a d ɣʲ eː n͈ t a r
atbaill	a d v a l͈ʲ
atbath	a d v a θ
atchessa	a d xʲ ɛ s a
atcomla	a d ɡ o ṽ l a
atdubelliub	a d u v e l͈ʲ i u̯ v
atgairith	a d ɣ a rʲ i ðʲ
atgairith	a d ɣ a rʲ i θʲ
athair	a θ i rʲ
athchumtach	a θ x u ṽ d a x
atlugud	a t l u ɣ u ð
atobaig	a d o v a ɣʲ
atobcí	a d o v kʲ iː
atomaig	a d o m a ɣʲ
atomriug	a d o ṽ rʲ i u̯ ɣ
atreig	a d rʲ e ɣʲ
atrobair	a d r o v i rʲ
attá	a t t aː
attaí	a t t aː i̯
attó	a t t oː
attotaig	a d o d a ɣʲ
áu	aː u̯
aub	a u̯ v
bachlach	b a x l a x
bachlaig	b a x l i ɣʲ
bad	b a ð
badb	b a ð v
badb	b a ð v
báid	b aː ðʲ
baile	b a lʲ e
balb	b a l v
balba	b a l v a
ban	b a n
bán	b aː n
bána	b aː n a
banscál	b a n s k aː l
báo	b aː u̯
baramail	b a r a ṽ i lʲ
bard	b a r͈ d
bardu	b a r͈ d u
bas	b a s
bás	b aː s
basa	b a s a
bat	b a d
bé	bʲ eː
bec	bʲ e ɡ
beca	bʲ e ɡ a
bech	bʲ e x
bedg	bʲ e ð ɡ
bedgach	bʲ e ð ɡ a x
beich	bʲ e xʲ
béim	bʲ eː mʲ
bein	bʲ e nʲ
beir	bʲ e rʲ
beires	bʲ e rʲ e s
beirid	bʲ ɛ ɾʲ ə dʲ
beirid	bʲ e rʲ i ðʲ
beit	bʲ e dʲ
bél	bʲ eː l
bélmar	bʲ eː l ṽ a r
bélrae	bʲ eː l͈ r e
bélrai	bʲ eː l͈ r i
bem	bʲ e ṽ
ben	bʲ e n
benaid	bʲ e n i ðʲ
benair	bʲ e n i rʲ
bendacht	bʲ e n͈ d a x t
benn	bʲ e n͈
béo	bʲ eː u̯
béoigidir	bʲ eː u̯ i ɣʲ i ðʲ i rʲ
beothu	bʲ e u̯ θ u
ber	bʲ e r
bera	bʲ e r a
berach	bʲ e r a x
beram	bʲ e r a ṽ
berar	bʲ e r a r
berat	bʲ e r a d
bero	bʲ e r o
berr	bʲ e r͈
berra	bʲ e r͈ a
bert	bʲ e r͈ t
bés	bʲ eː s
beth	bʲ e θ
bethaid	bʲ e θ i ðʲ
bethu	bʲ e θ u
beuch	bʲ e u̯ x
bí	bʲ iː
bia	bʲ i a
biad	bʲ i a ð
bíad	bʲ iː a̯ ð
bic	bʲ i ɡʲ
bice	bʲ i ɡʲ e
bid	bʲ i ðʲ
bíid	bʲ iː i ðʲ
bile	bʲ i lʲ e
bili	bʲ i lʲ i
bir	bʲ i r
bir	bʲ i r
bir	bʲ i rʲ
birr	bʲ i r͈ʲ
birre	bʲ i r͈ʲ e
birt	bʲ i r͈ʲ tʲ
bís	bʲ iː s
biter	bʲ i dʲ e r
bith	bʲ i θ
bith	bʲ i θʲ
biur	bʲ i u̯ r
bíuu	bʲ iː u̯
blíadain	bʲ lʲ iː a̯ ð i nʲ
bó	b oː
bocht	b o x t
boí	b oː i̯
boin	b o nʲ
boinenn	b o nʲ e n͈
boladmar	b o l a ð ṽ a r
bolg	b o l ɡ
bona	b o n a
borb	b o r b
borba	b o r b a
botach	b o d a x
brain	b r a nʲ
bran	b r a n
brao	b r aː u̯
bráthair	b r aː θ i rʲ
bráthardae	b r aː θ a r ð e
bréc	bʲ rʲ eː ɡ
brécach	bʲ rʲ eː ɡ a x
brecc	bʲ rʲ e k
breg	bʲ rʲ e ɣ
breib	bʲ rʲ e bʲ
bréin	bʲ rʲ eː nʲ
brén	bʲ rʲ eː n
bréthir	bʲ rʲ eː θʲ i rʲ
bréthre	bʲ rʲ eː θʲ rʲ e
brí	bʲ rʲ iː
bríathar	bʲ rʲ iː a̯ θ a r
brig	bʲ rʲ i ɣʲ
bríg	bʲ rʲ iː ɣ
bríg	bʲ rʲ iː ɣʲ
brigit	bʲ rʲ i ɣʲ i dʲ
brígmar	bʲ rʲ iː ɣ ṽ a r
bris	bʲ rʲ i sʲ
brisid	bʲ rʲ i sʲ i ðʲ
brisis	bʲ rʲ i sʲ i sʲ
briste	bʲ rʲ i sʲ tʲ e
brister	bʲ rʲ i sʲ tʲ e r
bristi	bʲ rʲ i sʲ tʲ i
brithem	bʲ rʲ i θʲ e ṽ
brittach	bʲ rʲ i t a x
bróc	b r oː ɡ
brocc	b r o k
broin	b r o nʲ
brón	b r oː n
brónach	b r oː n a x
broon	b r o o n
brúmar	b r uː ṽ a r
bruth	b r u θ
bruthmar	b r u θ ṽ a r
bú	b uː
búachaill	b uː a̯ x i l͈ʲ
búaid	b uː a̯ ðʲ
buide	b u ðʲ e
buiden	b u ðʲ e n
buidi	b u ðʲ i
buidin	b u ðʲ i nʲ
builg	b u lʲ ɡʲ
buinne	b u n͈ʲ e
buirbe	b u rʲ bʲ e
bun	b u n
burb	b u r b
cach	k a x
cách	k aː x
cacht	k a x t
cáech	k aː i̯ x
cáel	k oː i̯ l
cáel	k aː i̯ l
cáelán	k aː i̯ l aː n
cáera	k aː i̯ r a
cailech	k a lʲ e x
caille	k a l͈ʲ e
cáin	k aː nʲ
cainnt	k a n͈ʲ tʲ
caire	k a rʲ e
caithig	k a θʲ i ɣʲ
caittín	k a tʲ iː nʲ
camm	k a m
camma	k a m a
cammu	k a m u
canaid	k a n i ðʲ
capall	k a p a l͈
caratrad	k a r a d r a ð
catán	k a t aː n
cath	k a θ
catha	k a θ a
cathach	k a θ a x
cathaige	k a θ i ɣʲ e
cathaigecht	k a θ i ɣʲ e x t
cathair	k a θ i rʲ
cathaír	k a θ aː i̯ rʲ
catho	k a θ o
cathracha	k a θ r a x a
cathraig	k a θ r i ɣʲ
catt	k a t
caur	k a u̯ r
caurad	k a u̯ r a ð
cech	kʲ e x
céile	kʲ eː lʲ e
ceilid	kʲ e lʲ i ðʲ
céilide	kʲ eː lʲ i ðʲ e
cell	kʲ e l͈
cellach	kʲ e l͈ a x
cen	kʲ e n
cene	kʲ e n e
cenél	kʲ e nʲ eː l
cenn	kʲ e n͈
cenna	kʲ e n͈ a
cerc	kʲ e r k
cerca	kʲ e r k a
cercdae	kʲ e rʲ k ðʲ e
cerd	kʲ e r͈ d
cern	kʲ e r n
cert	kʲ e r͈ t
certa	kʲ e r͈ t a
certu	kʲ e r͈ t u
cet	kʲ e d
cét	kʲ eː d
cethair	kʲ e θ i rʲ
cethramad	kʲ e θ r a ṽ a ð
cétmad	kʲ eː d ṽ a ð
cétnae	kʲ eː d n͈ e
cétni	kʲ eː d n͈ i
cétnidetu	kʲ eː d n͈ i ðʲ e
ceto	kʲ e d o
céul	kʲ eː u̯ l
chaire	x a rʲ e
chamm	x a m
chamma	x a m a
chapall	x a p a l͈
chath	x a θ
chaur	x a u̯ r
chéile	xʲ eː lʲ ə
chell	xʲ e l͈
chen	ç e n
chenél	kʲ e nʲ eː l
chenna	xʲ e n͈ a
chert	xʲ e r͈ t
chet	xʲ e d
chid	xʲ i ð
chinn	xʲ i n͈ʲ
chír	xʲ iː r
chirce	xʲ i rʲ kʲ e
chirt	xʲ i r͈ t
chirt	xʲ i r͈ʲ tʲ
chlúasaib	x l uː a̯ s i vʲ
chnámi	x n aː ṽ i
choirp	x o rʲ pʲ
chois	x o sʲ
chomalnad	x o ṽ a l͈ n͈ a ð
chon	x o n
chor	x o r
chos	x o s
chosmailius	x o s ṽ i lʲ u s
chretid	xʲ rʲ e dʲ i ðʲ
chretim	xʲ rʲ e dʲ i ṽʲ
chríst	xʲ rʲ iː s t
chríst	xʲ rʲ iː sʲ tʲ
chroich	x r o xʲ
chú	x uː
chuir	x u rʲ
chúl	x uː l
chumachtae	x u ṽ a x t e
chumachtaig	x u ṽ a x t i ɣʲ
cía	kʲ iː a̯
cíall	kʲ iː a̯ l͈
cían	kʲ iː a̯ n
cid	kʲ i ð
cimbid	kʲ i mʲ bʲ i ðʲ
cing	kʲ i ŋʲ ɡʲ
cingid	kʲ i ŋʲ ɡʲ i ðʲ
cininfil	kʲ i nʲ i nʲ fʲ i lʲ
cinn	kʲ i n͈ʲ
cír	kʲ iː r
circ	kʲ i rʲ kʲ
circe	kʲ i rʲ kʲ e
ciúin	kʲ iː u̯ nʲ
ciúine	kʲ iː u̯ nʲ e
ciúnas	kʲ iː u̯ n a s
claidbiu	k l a ðʲ vʲ u
claidib	k l a ðʲ i vʲ
claidid	k l a ðʲ i ðʲ
claidiub	k l a ðʲ u v
claind	k l a n͈ʲ dʲ
cland	k l a n͈ d
clár	k l aː r
cloc	k l o ɡ
clocach	k l o ɡ a x
clocán	k l o ɡ aː n
cloch	k l o x
clú	k l uː
clúas	k l uː a̯ s
clúasaib	k l uː a̯ s i vʲ
cluichigedar	k l u xʲ i ɣʲ e ð a r
cluichigidir	k l u xʲ i ɣʲ i dʲ i rʲ
cnáim	k n aː ṽʲ
cnámai	k n aː ṽ i
cnocc	k n o k
cnoccach	k n o k a x
cnoccán	k n o k aː n
cnú	k n uː
cochall	k o x a l͈
cocubus	k o ɡ u v u s
cóecatmad	k oː i̯ ɡ a d ṽ a ð
cóem	k oː i̯ ṽ
cóemgen	k oː i̯ ṽ ɣʲ e n
coibnesta	k o vʲ nʲ e s t a
cóic	k oː ɡʲ
coíca	k oː i̯ ɡ a
cóiced	k oː ɡʲ e ð
coím	k oː i̯ vʲ
coím	k oː i̯ v
coin	k o nʲ
cois	k o sʲ
coll	k o l͈
colmáin	k o l m aː nʲ
colmán	k o l m aː n
columb	k o l u m b
comáirem	k o ṽ aː rʲ e ṽ
comalnad	k o ṽ a l͈ n͈ a ð
comarbbae	k o ṽ a r b e
commann	k o m a n͈
comsuidigud	k o ṽ h u ðʲ i ɣ u ð
con	k o n
cona	k o n a
conboing	k o n b o ŋʲ
condansamailter	k o n͈ d a n s a ṽ i l͈ʲ tʲ e r
congaib	k o n ɡ a vʲ
congair	k o n ɡ a rʲ
conicc	k o n i ɡʲ
conidrofoilsigsetar	k o nʲ i ð r o f o l͈ sʲ i ɣʲ sʲ e d a r
conn	k o n͈
connachta	k o n͈ a x t a
conrig	k o n r͈ʲ i ɣʲ
consecha	k o n sʲ e x a
contuili	k o n͈ t u lʲ i
cor	k o r
cormac	k o r m a k
corp	k o r p
cos	k o s
cosc	k o s k
coscitir	k o sʲ kʲ i dʲ i rʲ
cosmail	k o s ṽ i l
cosmailius	k o s ṽ i lʲ u s
cossa	k o s a
cotarsnatu	k o d a r s n͈ a d u
creitem	kʲ rʲ e dʲ e ṽ
creitid	kʲ rʲ e dʲ i ðʲ
creitim	kʲ rʲ e dʲ i ṽʲ
creitim	kʲ rʲ e dʲ i mʲ
crenaid	kʲ rʲ e n i ðʲ
cretim	kʲ rʲ e dʲ i ṽʲ
cretim	kʲ rʲ e dʲ i mʲ
cride	kʲ rʲ i ðʲ e
cridi	kʲ rʲ i ðʲ e
críst	kʲ rʲ iː s t
críst	kʲ rʲ iː sʲ tʲ
croch	k r o x
croich	k r o xʲ
crott	k r o t
cruim	k r u ṽʲ
cruimther	k r u ṽʲ θʲ e r
cú	k uː
cúan	k uː a̯ n
cúán	k uː aː n
cuil	k u lʲ
cuilén	k u lʲ eː n
cuilenn	k u lʲ e n͈
cuir	k u rʲ
cuire	k u rʲ e
cuirethar	k u rʲ e θ a r
cuit	k u dʲ
cúl	k uː l
cullach	k u l͈ a x
cumachtach	k u ṽ a x t a x
cumachtae	k u ṽ a x t e
cumachtaig	k u ṽ a x t i ɣʲ
cummae	k u m e
cummatu	k u m a d u
cumscaigthetu	k u ṽ s k i ɣʲ θʲ e d u
cumung	k u ṽ u ŋ ɡ
curad	k u r a ð
cúram	k uː r a m
cúramach	k uː r a m a x
dá	d aː
dagdae	d a ɣ ð e
dagníat	d a ɣʲ nʲ iː a d
dagníu	d a ɣʲ nʲ iː u̯
daim	d a ṽʲ
daimid	d a ṽʲ i ðʲ
daingen	d a ŋʲ ɡʲ e n
daltae	d a l͈ t e
daltán	d a l͈ t aː n
dalugub	d a l͈ u ɣ u v
dam	d a ṽ
dama	d a ṽ a
damait	d a ṽ i dʲ
damán	d a ṽ aː n
dano	d a n o
dath	d a θ
daum	d a u̯ ṽ
daumu	d a u̯ ṽ u
dé	dʲ eː
dé	dʲ eː
dea	dʲ e a
deacht	dʲ e a x t
decha	dʲ e x a
dechellt	dʲ e xʲ e l͈ t
dechellt	dʲ eː xʲ e l͈ t
dechmad	dʲ e x ṽ a ð
dechraigidir	dʲ e x r i ɣʲ i ðʲ i rʲ
dechrigmir	dʲ e x r i ɣʲ mʲ i rʲ
deidbir	dʲ e ðʲ vʲ i rʲ
deithbir	dʲ e θʲ vʲ i rʲ
delb	dʲ e l v
demin	dʲ e ṽʲ i nʲ
demniu	dʲ e ṽʲ nʲ u
dénim	dʲ eː nʲ i mʲ
deorad	dʲ eː u̯ r a ð
derb	dʲ e r v
derc	dʲ e r k
derg	dʲ e r ɡ
dess	dʲ e s
dét	dʲ eː d
di	dʲ i
dí	dʲ iː
dia	dʲ i a
día	dʲ iː a̯
día	dʲ iː a̯
dían	dʲ iː ə n
diandaithirsid	dʲ iː a̯ n͈ d a θʲ i r sʲ i ðʲ
dich	dʲ i x
didiu	dʲ i ðʲ i u̯
dígal	dʲ iː ɣ a l
díglae	dʲ iː ɣ l e
diib	dʲ i i vʲ
dílenn	dʲ iː lʲ e n͈
díliu	dʲ iː lʲ u
díriuch	dʲ iː rʲ i u̯ x
ditá	dʲ i t ɑː
ditaam	dʲ i t a a ṽ
dliged	dʲ lʲ i ɣʲ e ð
dligid	dʲ lʲ i ɣʲ i ðʲ
dligud	dʲ lʲ i ɣ u ð
do	d o
dó	d oː
doadbat	d o a ð v a d
doadbit	d o a ð v i dʲ
doairbertar	d o h a rʲ bʲ e r d a r
doairbir	d o h a rʲ bʲ i rʲ
doáirci	d o h aː rʲ ɡʲ i
dobeir	d o bʲ e rʲ
doberam	d o bʲ e r a ṽ
dobur	d o v u r
doclaid	d o k l a ðʲ
docuirethar	d o k u rʲ e θ a r
dodcadchae	d o ð ɡ a ð x e
dodcadchai	d o ð ɡ a ð x i
dóenacht	d oː i̯ n a x t
dóer	d oː i̯ r
doeth	d o h e θ
dofich	d o fʲ i xʲ
dofúaid	d o f uː a̯ ðʲ
dofuissim	d o f u sʲ i mʲ
dogní	d o ɡʲ nʲ iː
dogníat	d o ɡʲ nʲ iː a d
dogníu	d o ɡʲ nʲ iː u̯
dogoa	d o ɡ o a
doib	d o i vʲ
doicc	d o hʲ i ɡʲ
dóid	d oː ðʲ
doíni	d oː i̯ nʲ i
doír	d oː i̯ rʲ
doíre	d oː i̯ rʲ e
doirse	d o r͈ʲ sʲ e
doirseo	d o r͈ʲ sʲ o
dolega	d o l͈ʲ e ɣ a
doléici	d o l͈ʲ eː ɡʲ i
dolugub	d o l͈ u ɣ u v
doluigi	d o l͈ u ɣʲ i
dolus	d o l u s
dom	d o m
dom	d o ṽ
domén	d o mʲ eː n
domnall	d o ṽ n a l͈
domoiniur	d o m o nʲ u r
domoiniur	d o m u nʲ u r
domuinethar	d o m u nʲ e θ a r
domun	d o ṽ u n
don	d o n
dona	d o n a
dongní	d o ŋʲ nʲ iː
dongníat	d o ŋʲ nʲ iː a d
donn	d o n͈
dorat	d o r͈ a d
dorchacht	d o r x a x t
dorchatus	d o r x a d u s
dorus	d o r u s
dosom	d o s o m
doté	d o tʲ eː
dotéis	d o tʲ eː ʃ
dotét	d o tʲ eː d
dothuit	d o t u tʲ
dotuit	d o t u tʲ
douic	d o h i ɡʲ
droch	d r o x
drochet	d r o xʲ e d
druí	d r uː i̯
druid	d r u i ðʲ
druimm	d r u mʲ
duaisilbi	d u a sʲ i lʲ vʲ i
dub	d u v
dubach	d u v a x
dubae	d u v e
dugní	d u ɡʲ nʲ iː
dúib	d uː vʲ
dúibsi	d uː vʲ sʲ i
dúildetu	d uː lʲ dʲ e d u
dúin	d uː nʲ
duine	d u nʲ e
duit	d u tʲ
dún	d uː n
dúna	d uː n a
dungní	d u ŋʲ nʲ iː
dusclaid	d u s ɡ l a ðʲ
dusclaid	d u s k l a ðʲ
é	eː
ebla	e v l a
ecguiste	e ɡ u sʲ tʲ e
ecguisti	e ɡ u sʲ tʲ i
ech	e x
echlach	e x l a x
echu	e x u
eclais	e ɡ l i sʲ
écsamail	eː ɡ s a ṽ i lʲ
ed	e ð
égept	eː ɣʲ e p t
égept	eː ɣʲ e f t
eich	e xʲ
eirbthi	e rʲ bʲ θʲ i
ellach	e l͈ a x
ellug	e l͈ u ɣ
engach	e ŋ ɡ a x
eó	eː o̯
eochaid	eː u̯ x i ðʲ
epir	e bʲ i rʲ
eplet	e bʲ lʲ e d
epscop	e b s k o b
epur	e b u r
erbaid	e r b i ðʲ
errach	e r͈ a x
espáin	e s pʲ aː nʲ
esséirge	e sʲ eː rʲ ɣʲ e
esséirgu	e sʲ eː rʲ ɣʲ u
esta	e s t a
estais	e s t i sʲ
estar	e s t a r
ét	eː d
éta	eː d a
étach	eː d a x
étada	eː d a ð a
étade	eː d a ð e
étai	eː d i
étaid	eː d i ðʲ
étaitis	eː d i dʲ i sʲ
étar	eː d a r
etarscara	e d a r s k a r a
etarscartha	e d a r s k a r θ a
etarscarthae	e d a r s k a r θ e
étaste	eː d a s t e
état	eː d a d
étatais	eː d a d i sʲ
étatham	eː d a θ a ṽ
étatsat	eː d a d s a d
eter	e dʲ e r
eth	e θ
étis	eː dʲ i sʲ
étite	eː dʲ i dʲ e
ette	e tʲ e
etti	e tʲ i
faceird	f a ɡʲ e r͈ʲ dʲ
facherred	f a xʲ e r͈ʲ e ð
fáelán	f aː i̯ l aː n
fáid	f aː ðʲ
fáilid	f aː lʲ i ðʲ
fáilte	f aː lʲ tʲ e
fairrge	f a r͈ ɡʲ e
fáith	f aː θʲ
fásach	f aː s a x
fáth	f aː θ
féchem	fʲ eː xʲ e ṽ
fecht	fʲ e x t
feidid	fʲ e ðʲ i ðʲ
féin	fʲ eː nʲ
fel	fʲ e l
fén	fʲ eː n
fer	fʲ e r
fér	fʲ eː r
fercaigidir	fʲ e r ɡ i ɣʲ i ðʲ i rʲ
fercaigthe	fʲ e r ɡ i ɣʲ θʲ e
ferg	fʲ e r ɡ
ferge	fʲ e rʲ ɡʲ e
ferge	fʲ e r ɡ e
fergus	fʲ e r ɣ u s
fern	fʲ e r͈ n͈
ferr	fʲ e r͈
fés	fʲ eː s
fescor	fʲ e s k o r
fessin	fʲ e sʲ i nʲ
festa	fʲ e s t a
festae	fʲ e s t e
festais	fʲ e s t i sʲ
fet	fʲ e d
fíacail	fʲ iː a̯ k i lʲ
fíad	fʲ iː a̯ ð
fíadach	fʲ iː a̯ ð a x
fiche	fʲ i xʲ e
fichid	fʲ i xʲ i ðʲ
fil	fʲ i lʲ
filed	fʲ i lʲ e ð
fili	fʲ i lʲ i
filid	fʲ i lʲ i ðʲ
fine	fʲ i nʲ e
fíne	fʲ iː nʲ e
fini	fʲ i nʲ i
fíni	fʲ iː nʲ i
finn	fʲ i n͈
fir	fʲ i rʲ
fír	fʲ iː r
fír	fʲ iː rʲ
fíre	fʲ iː rʲ e
firend	fʲ i rʲ e n͈ d
firend	fʲ i rʲ e n͈
firennach	fʲ i rʲ e n͈ a x
fíriánaigidir	fʲ iː rʲ i aː n i ɣʲ i ðʲ i rʲ
fíriánigedar	fʲ iː r i aː n i ɣʲ e ð a r
fis	fʲ i u̯ s
fis	fʲ i s
fissi	fʲ i sʲ i
fitir	fʲ i dʲ i rʲ
fíu	fʲ iː u̯
fiur	fʲ i u r
flaith	f l a θʲ
fled	fʲ lʲ e ð
fliuch	fʲ lʲ i u̯ x
foácaib	f o h aː ɡ i vʲ
foálgi	f o h aː lʲ ɣʲ i
foceird	f o kʲ e r͈ʲ dʲ
foceirr	f o kʲ e r͈ʲ
focerdam	f o kʲ e r͈ d a ṽ
focerdat	f o kʲ e r͈ d a d
focerrad	f o kʲ e r͈ a ð
focertar	f o kʲ e r d a r
focheirt	f o xʲ e r͈ʲ dʲ
fochid	f o x i ðʲ
fochidi	f o x i ðʲ i
focicher	f o kʲ i xʲ e r
focul	f o k u l
fodaim	f o d a ṽʲ
fodaimid	f o d a ṽʲ i ðʲ
fodaraithminedar	f o d a r͈ a θʲ mʲ i nʲ e ð a r
fodmat	f o ð ṽ a d
fogaib	f o ɡ a vʲ
fogur	f o ɣ u r
foillsigthir	f o l͈ sʲ i ɣʲ θʲ i rʲ
foilsigdde	f o l͈ʲ sʲ i ɣʲ dʲ e
foilsigedar	f o l͈ sʲ i ɣʲ e ð a r
foilsigidir	f o l͈ʲ sʲ i ɣʲ i ðʲ i rʲ
foilsigthe	f o l͈ʲ sʲ i ɣʲ θʲ e
foilsigthi	f o l͈ʲ sʲ i ɣʲ θʲ i
foir	f o rʲ
foircnea	f o rʲ kʲ nʲ a
foirmtech	f o rʲ mʲ dʲ e x
foísitin	f oː i̯ sʲ i dʲ i nʲ
foísitiu	f oː i̯ sʲ i dʲ i u̯
foloing	f o l͈ o ŋʲ ɡʲ
folt	f o l͈ t
fonn	f o n͈
for	f o r
fora	f o r a
foraithminedar	f o r a θʲ mʲ i nʲ e ð a r
forálaig	f o ʀ aː l i ɣʲ
forcain	f o r k a nʲ
forcanat	f o r k a n a d
forcell	f o rʲ ɡʲ e l͈
forcenna	f o r kʲ e n͈ a
forchanat	f o r x a n a d
foreith	f o r͈ʲ e θʲ
format	f o r m a d
formuinethar	f o r m u nʲ e θ a r
formut	f o r m u d
forsa	f o r͈ s a
forsammitter	f o r͈ s a mʲ i dʲ e r
fortachtaigedar	f o r͈ t a x t i ɣʲ e ð a r
fortachtaigid	f o r͈ t a x t i ɣʲ i ðʲ
fota	f o d a
frac	f r a k
frecndairc	fʲ rʲ e k n͈ d i rʲ kʲ
fri	fʲ rʲ i
fris	fʲ rʲ i sʲ
frisgair	fʲ rʲ i s ɡ a rʲ
friu	fʲ rʲ i u̯
friusom	fʲ rʲ i u̯ s o m
fuchertat	f u xʲ e r͈ d a d
fuil	f u lʲ
fuilech	f u lʲ e x
fuilide	f u lʲ i ðʲ e
ful	f u l
fulaing	f u l i ŋʲ ɡʲ
fulang	f u l a ŋ ɡ
fuscerdam	f u s ɡʲ e r͈ d a ṽ
gabál	ɡ a v aː l
gabor	ɡ a v o r
gabul	ɡ a v u l
gáel	ɡ aː i̯ l
gáeth	ɡ aː i̯ θ
gáethach	ɡ aː i̯ θ a x
gaibes	ɡ a vʲ e s
gaibid	ɡ a vʲ i ðʲ
gairid	ɡ a rʲ i ðʲ
gaiscedach	ɡ a sʲ kʲ e ð a x
garit	ɡ a rʲ i dʲ
gé	ɡʲ eː
géc	ɡʲ eː ɡ
géiss	ɡʲ eː sʲ
gela	ɡʲ e l a
gelach	ɡʲ e l a x
gell	ɡʲ e l͈
gellach	ɡʲ e l͈ a x
gemred	ɡʲ e ṽʲ rʲ e ð
gen	ɡʲ e n
gessi	ɡʲ e sʲ i
gíall	ɡʲ iː a̯ l͈
gil	ɡʲ i lʲ
gile	ɡʲ i lʲ e
gili	ɡʲ i lʲ i
gillán	ɡʲ i l͈ aː n
gilu	ɡʲ i l u
gláedach	ɡ l aː i̯ ð a x
glan	ɡ l a n
glas	ɡ l a s
gleinn	ɡʲ lʲ e n͈ʲ
glenn	ɡʲ lʲ e n͈
glenn	ɡʲ lʲ e n͈ʲ
glicc	ɡʲ lʲ i kʲ
glinn	ɡʲ lʲ i n͈ʲ
glinne	ɡʲ lʲ i n͈ʲ e
glóir	ɡ l oː rʲ
glór	ɡ l oː r
glúin	ɡ l uː nʲ
glún	ɡ l uː n
gnáth	ɡ n aː θ
gnáthach	ɡ n aː θ a x
gníid	ɡʲ nʲ iː i ðʲ
gním	ɡʲ nʲ iː ṽ
gnímu	ɡʲ nʲ iː ṽ u
gobae	ɡ o v e
goídel	ɡ oː i̯ ðʲ e l
goirt	ɡ o r͈ʲ tʲ
grád	ɡ r aː ð
grian	ɡʲ rʲ i a n
grían	ɡʲ rʲ iː a̯ n
gríanach	ɡʲ rʲ iː a̯ n a x
gúalach	ɡ uː a̯ l a x
gúforcell	ɡ uː o rʲ ɡʲ e l͈
guid	ɡ u ðʲ
guide	ɡ u ðʲ e
guidi	ɡ u ðʲ i
guidid	ɡ u ðʲ i ðʲ
guidimm	ɡ u ðʲ i mʲ
í	iː
iach	i a x
iacób	iː a̯ k oː b
iaich	i a xʲ
íar	iː a̯ r
íarn	iː a̯ r n
íarum	iː a̯ r u ṽ
íasacht	iː a̯ s a x t
íasc	iː a̯ s k
ibid	i vʲ i ðʲ
icc	i ɡʲ
ícc	iː k
ícc	iː kʲ
idib	i ðʲ i vʲ
il	i l
ilardatu	i l a r ð a d u
ildatu	i l͈ d a d u
ímáig	iː ṽ aː ɣʲ
imb	i mʲ bʲ
imbe	i mʲ bʲ e
imbed	i mʲ bʲ e ð
imbide	i mʲ bʲ i ðʲ e
imchomarc	i m x o ṽ a r k
imdae	i m ð e
imfen	i mʲ fʲ e n
imme	i mʲ e
immib	i mʲ i vʲ
immurgu	i m u r ɣ u
ind	i n͈ d
indaithirset	i n͈ d a θʲ i r sʲ e d
indí	i n͈ʲ dʲ iː
indidit	i n͈ʲ dʲ i ðʲ i dʲ
indocbál	i n͈ d o ɡ v aː l
indráigne	i n͈ d r aː ɣʲ nʲ e
ingen	i nʲ ɣʲ e n
ingen	i ŋʲ ɡʲ e n
ingenrad	i nʲ ɣʲ e n r a ð
ingreimm	i nʲ ɣʲ rʲ e mʲ
inloing	i n͈ l͈ o ŋʲ ɡʲ
innocht	i n͈ o x t
inse	i n͈ s e
inse	i n͈ʲ sʲ e
intí	i n͈ʲ tʲ iː
intinn	i n͈ʲ tʲ i n͈ʲ
intísiu	i n͈ʲ tʲ iː sʲ i u̯
irar	i r a r
ires	i rʲ e s
iris	i rʲ i sʲ
irisse	i rʲ i sʲ e
irlam	i r l͈ a ṽ
irlamu	i r l͈ a ṽ u
ís	iː s
ísel	iː sʲ e l
isin	i s i n
ísin	iː sʲ i nʲ
isind	i s i n͈ d
ísle	iː sʲ lʲ e
íss	iː s
íssu	iː s u
it	i t
it	i d
ith	i θ
ith	i θʲ
ithe	i θʲ e
ithid	i θʲ i ðʲ
ithim	i θʲ i mʲ
itius	i dʲ i u̯ s
la	l a
lá	l͈ aː
labar	l a v a r
labraithir	l͈ a v r i θʲ i rʲ
labramar	l͈ a v r a m a r
labratar	l a v r a d a r
labrither	l͈ a v r i θʲ e r
lac	l͈ a ɡ
lacht	l͈ a x t
lachu	l͈ a x u
láech	l͈ aː i̯ x
láib	l͈ aː vʲ
laigen	l͈ a ɣʲ e n
laigid	l͈ a ɣʲ i ðʲ
laigin	l͈ a ɣʲ i nʲ
laignib	l͈ a ɣʲ nʲ i vʲ
laigniu	l͈ a ɣʲ nʲ u
láine	l͈ aː nʲ e
lám	l͈ aː ṽ
láma	l͈ aː ṽ a
lán	l͈ aː n
lár	l͈ aː r
lasar	l͈ a s a r
lat	l a t
láthar	l͈ aː θ a r
lebor	l͈ʲ e v o r
lég	l͈ʲ eː ɣ
lega	l͈ʲ e ɣ a
legad	l͈ʲ e ɣ a ð
legaid	l͈ʲ e ɣ i ðʲ
légaid	l͈ʲ eː ɣ i ðʲ
legar	l͈ʲ e ɣ a r
legas	l͈ e ɣ a s
léicid	l͈ʲ eː ɡʲ i ðʲ
léimm	l͈ʲ eː mʲ
léine	l͈ʲ eː nʲ ə
léir	l͈ʲ eː rʲ
leith	l͈ʲ e θʲ
leithe	l͈ʲ e θʲ e
lepaid	l͈ʲ e b i ðʲ
lés	l͈ʲ eː s
leth	l͈ʲ e θ
lethan	l͈ʲ e θ a n
