a	a
lethar	l͈ʲ e θ a r
leu	lʲ e u̯
liacc	l͈ʲ i a ɡ
líach	l͈ʲ iː a̯ x
líath	l͈ʲ iː a̯ θ
lib	lʲ i vʲ
lie	l͈ʲ i e
lige	l͈ʲ i ɣʲ e
lín	l͈ʲ iː n
lín	l͈ʲ iː nʲ
lingid	l͈ʲ i ŋʲ ɡʲ i ðʲ
liter	l͈ʲ i tʲ e r
liunn	l͈ʲ i u̯ n͈
llong	l͈ o ŋ ɡ
loch	l͈ o x
lochlannach	l͈ o x l a n͈ a x
lod	l͈ o ð
lóeg	l͈ oː i̯ ɣ
lóg	l͈ oː ɣ
loigic	l͈ o ɣʲ i kʲ
loing	l͈ o ŋʲ ɡʲ
lomm	l͈ o m
lon	l͈ o n
long	l͈ o ŋ ɡ
lotar	l͈ o d a r
lour	l͈ o u r
lúaith	l͈ uː a̯ θʲ
lúath	l͈ uː a̯ θ
luch	l͈ u x
lucht	l͈ u x t
lud	l͈ u ð
lugaid	l͈ u ɣ i ðʲ
lugu	l͈ u ɣ u
luid	l͈ u ðʲ
luide	l͈ u ðʲ e
lus	l͈ u s
macc	m a k
maccidóndu	m a kʲ i ð oː n͈ d u
maccu	m a k u
macthae	m a k θ e
macthi	m a k θ i
mad	m a ð
máel	m aː i̯ l
mag	m a ɣ
maicc	m a kʲ
maid	m a ðʲ
maidid	m a ðʲ i ðʲ
maig	m a ɣʲ
maigden	m a ɣʲ dʲ e n
maisse	m a sʲ e
maissi	m a sʲ i
maith	m a θʲ
maithe	m a θʲ e
maithi	m a θʲ i
mana	m a n a
manach	m a n a x
manainn	m a n i n͈ʲ
manid	m a nʲ i ðʲ
már	m aː r
mára	m aː r a
marbaid	m a r v i ðʲ
marc	m a r k
marcach	m a r k a x
margad	m a r ɡ a ð
marmar	m a r m a r
masu	m a s u
máthar	m aː θ a r
mathgamain	m a θ ɣ a ṽ i nʲ
máthir	m aː θ i rʲ
mbard	m b aː r͈ d
mbas	m b a s
mbás	m b aː s
mbat	m b a d
mberes	mʲ bʲ e rʲ e s
mbí	mʲ bʲ iː
mbona	m b o n a
mbréthre	mʲ bʲ rʲ eː θʲ rʲ e
mbris	mʲ bʲ rʲ i sʲ
mé	mʲ eː
medb	mʲ e ð v
méine	mʲ eː nʲ e
méit	mʲ eː dʲ
menmae	mʲ e n m e
mér	mʲ eː r
mescae	mʲ e s k e
mescaid	mʲ e s k i ðʲ
mescc	mʲ e s k
mesctha	mʲ e s k θ a
messe	mʲ e sʲ e
metrapoil	mʲ e t r a p o lʲ
mí	mʲ iː
míad	mʲ iː a̯ ð
mían	mʲ iː a̯ n
míanach	mʲ iː a̯ n a x
mide	mʲ i ðʲ e
midi	mʲ i ðʲ i
midithir	mʲ i ðʲ i θʲ i rʲ
míl	mʲ iː lʲ
míl	mʲ iː l
míle	mʲ iː lʲ e
mís	mʲ iː sʲ
mís	mʲ iː s
mísa	mʲ iː s a
mitter	mʲ i dʲ e r
mlas	m l a s
mná	m n aː
mnaí	m n aː i̯
moídid	m oː i̯ ðʲ i ðʲ
moídim	m oː i̯ ðʲ i mʲ
móin	m oː nʲ
móir	m oː rʲ
moirb	m o rʲ vʲ
móire	m oː rʲ e
molad	m o l a ð
molaidir	m o l i ðʲ i rʲ
molid	m o l i ðʲ
molt	m o l͈ t
molto	m o l͈ t o
molur	m o l u r
mór	m oː r
móra	m oː r a
morbi	m o rʲ vʲ i
mrugaib	m r u ɣ i vʲ
mruig	m r u ɣʲ
mucc	m u k
muccaid	m u k i ðʲ
muccaidecht	m u k i ðʲ e x t
muccár	m u k aː r
muccfoil	m u k o lʲ
mug	m u ɣ
muide	m u ðʲ e
muilt	m u l͈ʲ tʲ
muinethar	m u nʲ e θ a r
múinid	m uː nʲ i ðʲ
muinteras	m u n͈ʲ tʲ e r a s
mumu	m u ṽ u
múnigid	m uː nʲ i ɣʲ i ðʲ
múr	m uː r
nach	n͈ a x
nách	n͈ aː x
náimtea	n͈ aː ṽʲ dʲ a
náire	n͈ aː rʲ e
námae	n͈ aː ṽ e
nathir	n a θ i rʲ
nathracha	n͈ a θ r a x a
ndé	n͈ʲ dʲ eː
ndea	n͈ʲ dʲ e a
ndodcadchai	n͈ d o ð ɡ a ð x i
ndoirse	n͈ d o r͈ʲ sʲ e
nduit	n͈ d u tʲ
neich	n͈ʲ e xʲ
neir	n͈ʲ e rʲ
nél	n͈ʲ eː l
nem	n͈ʲ e ṽ
ner	n͈ʲ e r
nert	n͈ʲ e r t
nglas	ŋ ɡ l a s
ní	n͈ʲ iː
nia	n͈ʲ i a
nícon	n͈ʲ i k o n
nídan	nʲ iː d a n
nim	n͈ʲ i ṽʲ
nime	n͈ʲ i ṽʲ e
nini	n͈ʲ i n͈ʲ i
nipi	n͈ʲ i bʲ i
níssu	n͈ʲ iː s u
nísu	n͈ʲ iː s u
níta	n͈ʲ iː d a
nó	n͈ oː
nobtá	n͈ o v t aː
nocht	n͈ o x t
nodafortachtaigedar	n͈ o ð a f o r͈ t a x t i ɣʲ e ð a r
noí	n͈ oː i̯
noídiu	n͈ oː i̯ ð i u̯
nóin	n͈ oː nʲ
nommoídim	n͈ o ṽ ṽ oː i̯ ðʲ i mʲ
nonchretid	n͈ o n xʲ rʲ e dʲ i ðʲ
nonda	n͈ o n͈ d a
nondad	n͈ o n͈ d a ð
nondobmolor	n͈ o n͈ d o v m o l o r
notail	n͈ o d a lʲ
núa	n͈ uː a̯
núall	n͈ uː a̯ l͈
nudubfeil	n͈ u d u v fʲ e lʲ
oc	o ɡ
óc	oː ɡ
océn	o ɡʲ eː n
ochtmad	o x t ṽ a ð
ocus	o ɡ u s
odb	o ð b
óen	oː i̯ n
og	o ɣ
oí	oː i̯
oínfer	oː i̯ nʲ e r
oíngus	oː i̯ n ɣ u s
oisén	o sʲ eː n
ól	oː l
olann	o l a n͈
olc	o l k
olchenae	o l xʲ e n e
oldaas	o l d a a s
oll	o l͈
olla	o l͈ a
ollam	o l͈ a ṽ
ón	oː n
opar	o b a r
orcaid	o r ɡ i ðʲ
hóre	oː rʲ e
othar	o θ a r
peccad	pʲ e k a ð
pecthae	pʲ e k θ e
persan	pʲ e r͈ s a n
persin	pʲ e r͈ s i nʲ
petur	pʲ e d u r
phersan	fʲ e r͈ s a n
phóca	f oː ɡ a
pipur	pʲ i b u r
póc	p oː ɡ
póca	p oː ɡ a
precept	pʲ rʲ e ɡʲ e p t
pridchaid	pʲ rʲ i ð x i ðʲ
pridchim	pʲ rʲ i ð x i mʲ
pridchite	pʲ rʲ i ð x i dʲ e
promaid	p r o ṽ i ðʲ
rád	r͈ aː ð
ráidid	r͈ aː ðʲ i ðʲ
rainn	r͈ a n͈ʲ
raithnech	r͈ a θʲ nʲ e x
ral	r͈ a l
rala	r͈ a l a
ranna	r͈ a n͈ a
ranngabáil	r͈ a n͈ ɣ a v aː lʲ
ranngabálae	r͈ a n͈ ɣ a v aː l e
ráth	r͈ aː θ
ré	r͈ʲ eː
recht	r͈ʲ e x t
reg	r͈ʲ e ɣ
rega	r͈ʲ e ɣ a
regad	r͈ʲ e ɣ a ð
regam	r͈ʲ e ɣ a ṽ
regas	r͈ʲ e ɣ a s
regat	r͈ʲ e ɣ a d
reithe	r͈ʲ e θʲ e
reithid	r͈ʲ e θʲ i ðʲ
relic	r͈ʲ e lʲ i ɡʲ
remib	r͈ʲ e ṽ i v
remor	r͈ʲ e ṽ o r
rét	r͈ʲ eː d
rétglu	r͈ eː d ɣ l u
rethit	r͈ʲ e θ i dʲ
réud	r͈ʲ eː u̯ ð
rí	r͈ʲ iː
rig	r͈ʲ i ɣ
ríg	r͈ iː ɣ
ríg	r͈ iː ɣʲ
riga	r͈ʲ i ɣ a
rígad	r͈ʲ iː ɣ a ð
rigas	r͈ʲ i ɣ a s
rígdae	r͈ʲ iː ɣ ð e
rím	r͈ʲ iː ṽ
rímid	r͈ʲ iː ṽ i ðʲ
roadamrigther	r͈ o a ð a ṽ r i ɣʲ θʲ e r
robá	r o b aː
robat	r o v a d
robem	r o bʲ e ṽ
robsa	r͈ o v s a
robsat	r͈ o v s a d
robummar	r͈ o v u m a r
rochluinemmar	r o x l u nʲ e m a r
rocluinemmar	r o k l u nʲ e m a r
rocluinethar	r o k l u nʲ e θ a r
rofinnadar	r͈ o fʲ i n͈ a ð a r
rofoilsigsetar	r͈ o f o l͈ʲ sʲ i ɣʲ sʲ e d a r
rofoilsigthea	r͈ o f o l͈ʲ sʲ i ɣʲ θʲ a
roib	r͈ o vʲ
rolá	r͈ o l͈ aː
roláis	r͈ o l͈ aː sʲ
ros	r͈ o s
rosc	r͈ o s k
rót	r͈ oː d
roth	r͈ o θ
rouic	r͈ o h u ɡʲ
rúad	r͈ uː a̯ ð
rubai	r͈ u v i
ruc	r͈ u ɡ
rufáilsigset	r͈ u f aː l͈ʲ sʲ i ɣʲ sʲ e d
rúin	r͈ uː nʲ
ruis	r͈ u sʲ
rumaith	r͈ u m a θʲ
rún	r͈ uː n
rúsc	r uː s k
sacart	s a ɡ a r͈ t
sáer	s aː i̯ r
saigid	s a ɣʲ i ðʲ
sáil	s aː lʲ
sáile	s aː lʲ e
saír	s aː i̯ rʲ
sál	s aː l
sála	s aː l ə
salainn	s a l i n͈ʲ
salann	s a l a n͈
sam	s a ṽ
samail	s a ṽ i lʲ
samailter	s a ṽ i l͈ʲ tʲ e r
samain	s a ṽ i nʲ
samlaidir	s a ṽ l i ðʲ i rʲ
samrad	s a ṽ r a ð
sanasán	s a n a s aː n
sásta	s aː s t a
scaraid	s k a r i ðʲ
scáth	s k aː θ
sceid	sʲ kʲ e i ðʲ
sceith	sʲ kʲ e θʲ
scél	sʲ kʲ eː l
scoth	s k o θ
scríbaid	sʲ kʲ rʲ iː v i ðʲ
sé	sʲ eː
sebac	sʲ e v a k
sechmaill	sʲ e x m i l͈ʲ
sechmall	sʲ e x m a l͈
secht	sʲ e x t
seise	sʲ e sʲ e
séitig	sʲ eː dʲ i ɣʲ
sén	sʲ eː n
senatóir	sʲ e n a d oː rʲ
serb	sʲ e r v
serc	sʲ e r k
sercach	sʲ e r k a x
sescatmad	sʲ e s k a d ṽ a ð
sét	sʲ eː d
séta	sʲ eː d a
sí	sʲ iː
siair	sʲ i a rʲ
sib	sʲ i vʲ
síd	sʲ iː ð
síd	sʲ iː ðʲ
sídach	sʲ iː ð a x
side	sʲ i ðʲ e
sidi	sʲ i ðʲ i
sieir	sʲ i e rʲ
síi	sʲ iː
sinis	sʲ i nʲ i sʲ
sinni	sʲ i n͈ʲ i
sír	sʲ iː r
sissi	sʲ i sʲ i
siu	sʲ i u̯
siur	sʲ i u r
sláinte	s l͈ aː n͈ʲ tʲ ə
slán	s l͈ aː n
slíab	sʲ l͈ʲ iː a̯ v
slicht	sʲ l͈ʲ i x t
slis	sʲ l͈ʲ i s
slis	sʲ l͈ʲ i sʲ
slisne	sʲ l͈ʲ i sʲ n͈ⁿ e
slóg	s l͈ oː ɣ
slógu	s l͈ oː ɣ u
slóig	s l͈ oː ɣʲ
snechtae	sʲ n͈ʲ e x t a
sní	sʲ n͈ʲ iː
snig	sʲ n͈ʲ i ɣʲ
snigid	sʲ n͈ʲ i ɣʲ i ðʲ
snisni	sʲ n͈ʲ i sʲ n͈ʲ i
so	s o
socamail	s o k a ṽ a lʲ
sodain	s o ð i nʲ
sóer	s oː i̯ r
soiscél	s o sʲ kʲ eː l
soiscélae	s o sʲ kʲ eː l e
solus	s o l u s
son	s o n
són	s oː n
sona	s o n a
sorn	s o r͈ n͈
soscéli	s o sʲ kʲ eː l i
spirut	s pʲ i r u d
spled	s pʲ lʲ e ð
sráit	s r aː dʲ
sróine	s r oː nʲ e
srón	s r oː n
sróna	s r oː n a
sruth	s r u θ
súan	s uː a̯ n
subach	s u v a x
suide	s u ðʲ e
suidi	s u ðʲ i
suidigidir	s u ðʲ i ɣʲ i ðʲ i rʲ
suidiu	s u ðʲ u
súil	s uː lʲ
súile	s uː lʲ e
súilib	s uː lʲ i vʲ
súla	s uː l a
súlo	s uː l o
sund	s u n͈ d
tá	t aː
taat	t a a d
tabairt	t a v i r͈ʲ tʲ
tabur	t a v u r
táeb	t aː i̯ v
táet	t aː i̯ d
taig	t a ɣʲ
tair	t a rʲ
tairb	t a rʲ vʲ
tál	t̪ˠ ɑː lˠ
tál	t̪ˠ æː lˠ
talam	t a l a ṽ
talmain	t a l ṽ i nʲ
talman	t a l ṽ a n
tan	t a n
tanae	t a n e
tánaise	t aː n i sʲ e
tánaisi	t aː n i sʲ i
tarb	t a r v
tarsno	t a r͈ s n͈ o
tart	t a r͈ t
tart	t a r͈ d
tarta	t a r͈ t a
tarta	t a r͈ d a
té	tʲ eː
tech	tʲ e x
teg	tʲ e ɣ
teglach	tʲ e ɣ l a x
téiged	tʲ eː ɣʲ e ð
teine	tʲ e nʲ e
téis	tʲ eː sʲ
téit	tʲ eː dʲ
téite	tʲ eː dʲ e
tengad	tʲ e ŋ ɡ a ð
tengae	tʲ e ŋ ɡ e
terc	tʲ e r k
terga	tʲ e r ɣ a
tergam	tʲ e r ɡ a ṽ
tét	tʲ eː d
téta	tʲ eː d a
thabairt	θ a v i r͈ʲ tʲ
thabirt	θ a v i r͈ʲ tʲ
thair	θ a rʲ
tharb	θ a r v
tharta	θ a r͈ t a
tharta	θ a r͈ d a
thé	θʲ eː
theg	θʲ e ɣ
theine	θʲ e nʲ e
théta	θʲ eː d a
thig	θʲ i ɣʲ
thoísegu	θ oː i̯ sʲ e ɣ u
thol	θ o l
thorud	θ o r u ð
tíagme	tʲ iː a̯ ɣ m e
tíagmi	tʲ iː a̯ ɣ m i
tías	tʲ iː a̯ s
ticed	tʲ i ɡʲ e ð
tig	tʲ i ɣʲ
tige	tʲ i ɣʲ e
tigiu	tʲ i ɣʲ i u̯
tír	tʲ iː r
tír	tʲ iː rʲ
tíre	tʲ iː rʲ e
tiug	tʲ i u̯ ɣ
tlacht	t l a x t
tó	t oː
tog	t o ɣ
toga	t o ɣ a
togu	t o ɣ u
toísech	t oː i̯ sʲ e x
toísegu	t oː i̯ sʲ e ɣ u
toísig	t oː i̯ sʲ i ɣʲ
tol	t o l
tolg	t o l ɡ
tomus	t o ṽ u s
tonn	t o n͈
topar	t o b a r
torad	t o r a ð
torc	t o r k
torrach	t o r͈ a x
torud	t o r u ð
tosach	t o s a x
tosuch	t o s u x
trá	t r aː
traig	t r a ɣʲ
tráth	t r aː θ
tre	tʲ rʲ e
trí	tʲ rʲ iː
trícho	tʲ rʲ iː x o
tris	tʲ rʲ i s
triunni	tʲ rʲ i u̯ n͈ʲ i
trom	t r o m
tú	t uː
túailnge	t uː a̯ lʲ ŋʲ e
túath	t uː a̯ θ
tuit	t u tʲ
tuiter	t u tʲ e r
turcbál	t u r ɡ v aː l
tús	t uː s
tussu	t u s u
úadisi	uː a̯ dʲ i sʲ i
úan	uː a̯ n
húare	uː a̯ rʲ e
úas	uː a̯ s
úasal	uː a̯ s a l
úath	uː a̯ θ
úathbás	uː a̯ θ v aː s
úathmar	uː a̯ θ ṽ a r
uball	u v a l͈
uic	u ɡʲ
uile	u lʲ e
uili	u lʲ i
uinnius	u n͈ʲ u s
uisce	u sʲ kʲ e
ulad	u l a ð
ulaid	u l i ðʲ
ulaith	u l i θʲ
ulath	u l a θ
hulltu	u l͈ t u
hulltu	h u l͈ t u
ulod	u l o ð
uloth	u l o θ
hultaib	u l͈ d i vʲ
hultaib	h u l͈ d i vʲ
ultaib	u l͈ d i vʲ
ultu	u l͈ t u
ungae	u ŋ ɡ e
