ࢳ	ŋ	0
ࢳ	ŋ a	0
ࢴ	ɡ	0
ࢴ	ɡ a	0
அஃகம்	ʔ a ɡ a m	0
அகங்காரம்	ʔ a ɡ a ŋ ɡ aː ɾ̪ a m	0
அகங்கை	ʔ a ɡ a ŋ ɡ a ɪ̯	0
அகதி	ʔ a ɡ a d̪ i	0
அகத்தாழம்	ʔ a ɡ a t̪ː aː ɻ a m	0
அகத்துக்காரர்	ʔ a ɡ a t̪ː u kː aː ɾ̪ a ɾ̪	0
அகத்துக்காரி	ʔ a ɡ a t̪ː u kː aː ɾ̪ i	0
அகந்தை	ʔ a ɡ a n̪ d̪ a ɪ̯	0
அகப்பு	ʔ a ɡ a pː u	0
அகப்பை	ʔ a ɡ a pː a ɪ̯	0
அகம்	ʔ a ɡ a m	0
அகரமுதலி	ʔ a ɡ a ɾ̪ a m u d̪ a l̪ i	0
அகரம்	ʔ a ɡ a ɾ̪ a m	0
அகரவரிசை	ʔ a ɡ a ɾ̪ a ʋ a ɾ̪ i s a ɪ̯	0
அகராதி	ʔ a ɡ a ɾ̪ aː d̪ i	0
அகற்று	ʔ a ɡ a ʈː ɾ u	0
அகலம்	ʔ a ɡ a l̪ a m	0
அகழி	ʔ a ɡ a ɻ i	0
அகவன்மகள்	ʔ a ɡ a ʋ a n m a ɡ a ɭ	0
அக்கச்சி	ʔ a kː a t͡ʃː i	0
அக்கா	ʔ a kː aː	0
அக்காமார்	ʔ a kː aː m aː ɾ̪	0
அக்காள்	ʔ a kː aː ɭ	0
அக்கினி	ʔ a kː i n i	0
அக்கினிகர்ப்பம்	ʔ a kː i n i ɡ a ɾ̪ pː a m	0
அக்கினிகுண்டம்	ʔ a kː i n i ɡ u ɳ ɖ a m	0
அக்கினிகோத்திரம்	ʔ a kː i n i ɡ oː t̪ː i ɾ̪ a m	0
அக்கினிச்சுவாலை	ʔ a kː i n i t͡ʃː u ʋ aː l̪ a ɪ̯	0
அக்கினித்தம்பம்	ʔ a kː i n i t̪ː a m b a m	0
அக்கினியாஸ்திரம்	ʔ a kː i n i j aː s t̪ i ɾ̪ a m	0
அக்கு	ʔ a kː u	0
அக்குள்	ʔ a kː u ɭ	0
அக்கை	ʔ a kː a ɪ̯	0
அக்கைச்சி	ʔ a kː a ɪ̯ t͡ʃː i	0
அங்கம்	ʔ a ŋ ɡ a m	0
அங்குலி	ʔ a ŋ ɡ u l̪ i	0
அஞ்ஞை	ʔ a ɲː a ɪ̯	0
அடங்கு	ʔ a ɖ a ŋ ɡ u	0
அடவி	ʔ a ɖ a ʋ i	0
அடி	ʔ a ɖ i	0
அடிகேயா	ʔ a ɖ i ɡ eː j aː	0
அடிக்கடி	ʔ a ɖ i kː a ɖ i	0
அடித்தளம்	ʔ a ɖ i t̪ː a ɭ a m	0
அடிமை	ʔ a ɖ i m a ɪ̯	0
அடுத்த	ʔ a ɖ u t̪ː a	0
அடுப்பு	ʔ a ɖ u pː u	0
அடைக்காய்	ʔ a ɖ a ɪ̯ kː aː j	0
அட்டை	ʔ a ʈː a ɪ̯	0
அணிகம்	ʔ a ɳ i ɡ a m	0
அணில்	ʔ a ɳ i l̪	0
அணு	ʔ a ɳ u	0
அண்டை	ʔ a ɳ ɖ a ɪ̯	0
அண்ணன்	ʔ a ɳː a n	0
அண்ணா	ʔ a ɳː aː	0
அண்ணி	ʔ a ɳː i	0
அதிகாரம்	ʔ a d̪ i ɡ aː ɾ̪ a m	0
அது	ʔ a d̪ u	0
அத்தியாபகன்	ʔ a t̪ː i j aː b a ɡ a n	0
அத்தை	ʔ a t̪ː a ɪ̯	0
அனுபவம்	ʔ a n u b a ʋ a m	0
அனுமன்	ʔ a n u m a n	0
அன்னம்	ʔ a nː a m	0
அன்பளிப்பு	ʔ a n p a ɭ i pː u	0
அன்பு	ʔ a n p u	0
அப்பம்	ʔ a pː a m	0
அப்பா	ʔ a pː aː	0
அப்பால்	ʔ a pː aː l̪	0
அப்புறம்	ʔ a pː u r a m	0
அமிர்தம்	ʔ a m i ɾ̪ t̪ a m	0
அமெரிக்கா	ʔ a m e ɾ̪ i kː aː	0
அமைதி	ʔ a m a ɪ̯ t̪ i	0
அமையம்	ʔ a m a ɪ̯ j a m	0
அம்மா	ʔ a mː aː	0
அம்மாய்	ʔ a mː aː j	0
அயோத்தி	ʔ a j oː t̪ː i	0
அரசன்	ʔ a ɾ̪ a s a n	0
அரசாங்கம்	ʔ a ɾ̪ a s aː ŋ ɡ a m	0
அரசு	ʔ a ɾ̪ a s u	0
அரவிந்தம்	ʔ a ɾ̪ a ʋ i n̪ d̪ a m	0
அரிசி	ʔ a ɾ̪ i s i	0
அரிவாள்	ʔ a ɾ̪ i ʋ aː ɭ	0
அரிவாள்மணை	ʔ a ɾ̪ i ʋ aː ɭ m a ɳ a ɪ̯	0
அருகு	ʔ a ɾ̪ u ɡ u	0
அரைநெல்லி	ʔ a ɾ̪ a ɪ̯ n̪ e l̪ː i	0
அர்ஜுனன்	ʔ a ɾ̪ d͡ʑ u n a n	0
அறிவாய்வியல்	ʔ a r i ʋ aː j ʋ i j a l̪	0
அறிவி	ʔ a r i ʋ i	0
அறிவியல்	ʔ a r i ʋ i j a l̪	0
அறிவு	ʔ a r i ʋ u	0
அறுகோணம்	ʔ a r u ɡ oː ɳ a m	0
அறை	ʔ a r a ɪ̯	0
அற்பகதம்	ʔ a r p a ɡ a d̪ a m	0
அலகு	ʔ a l̪ a ɡ u	0
அலுவல்	ʔ a l̪ u ʋ a l̪	0
அலை	ʔ a l̪ a ɪ̯	0
அலைப்	ʔ a l̪ a ɪ̯ p	0
அலைப்பு	ʔ a l̪ a ɪ̯ pː u	0
அலைப்பேசி	ʔ a l̪ a ɪ̯ pː eː s i	0
அல்	ʔ a l̪	0
அளவை	ʔ a ɭ a ʋ a ɪ̯	0
அளி	ʔ a ɭ i	0
அளேரியம்	ʔ a ɭ eː ɾ̪ i j a m	0
அழிவு	ʔ a ɻ i ʋ u	0
அழு	ʔ a ɻ u	0
அவசியம்	ʔ a ʋ a s i j a m	0
அவதாரம்	ʔ a ʋ a d̪ aː ɾ̪ a m	0
அவதி	ʔ a ʋ a d̪ i	0
அவன்	ʔ a ʋ a n	0
அவரை	ʔ a ʋ a ɾ̪ a ɪ̯	0
அவல்	ʔ a ʋ a l̪	0
அவள்	ʔ a ʋ a ɭ	0
அவுஸ்திரேலியா	ʔ a ʋ u s t̪ i ɾ̪ eː l̪ i j aː	0
அவை	ʔ a ʋ a ɪ̯	0
ஆ	ʔ aː	725
ஆக்கம்	ʔ aː kː a m	0
ஆங்கிலம்	ʔ aː ŋ ɡ i l̪ a m	0
ஆடம்பரம்	ʔ aː ɖ a m b a ɾ̪ a m	0
ஆடல்	ʔ aː ɖ a l̪	0
ஆடு	ʔ aː ɖ u	0
ஆடை	ʔ aː ɖ a ɪ̯	0
ஆட்சி	ʔ aː ʈ t͡ʃ i	0
ஆட்டன்	ʔ aː ʈː a n	0
ஆட்டுப்பால்	ʔ aː ʈː u pː aː l̪	0
ஆணவம்	ʔ aː ɳ a ʋ a m	0
ஆண்	ʔ aː ɳ	0
ஆண்குறி	ʔ aː ɳ k u r i	0
ஆண்டவன்	ʔ aː ɳ ɖ a ʋ a n	0
ஆண்டு	ʔ aː ɳ ɖ u	0
ஆண்பால்	ʔ aː ɳ p aː l̪	0
ஆதாம்	ʔ aː d̪ aː m	0
ஆந்தை	ʔ aː n̪ d̪ a ɪ̯	0
ஆபரணம்	ʔ aː b a ɾ̪ a ɳ a m	0
ஆபிச்	ʔ aː b i t͡ʃ	0
ஆமை	ʔ aː m a ɪ̯	0
ஆயர்	ʔ aː j a ɾ̪	0
ஆயிரம்	ʔ aː j i ɾ̪ a m	0
ஆயுதம்	ʔ aː j u d̪ a m	0
ஆய்	ʔ aː j	0
ஆய்வு	ʔ aː j ʋ u	0
ஆரம்	ʔ aː ɾ̪ a m	0
ஆர்த்தி	ʔ aː ɾ̪ t̪ː i	0
ஆர்மீனியா	ʔ aː ɾ̪ m iː n i j aː	0
ஆறு	ʔ aː r u	0
ஆளி	ʔ aː ɭ i	0
ஆள்	ʔ aː ɭ	0
ஆழிப்பேரலை	ʔ aː ɻ i pː eː ɾ̪ a l̪ a ɪ̯	0
ஆவல்	ʔ aː ʋ a l̪	0
ஆஸ்திரேலியா	ʔ aː s t̪ i ɾ̪ eː l̪ i j aː	0
இ	ʔ i	748
இங்குஷேத்தியா	ʔ i ŋ ɡ u ʂ eː t̪ː i j aː	0
இங்கே	ʔ i ŋ ɡ eː	0
இசை	ʔ i s a ɪ̯	0
இசைக்கருவி	ʔ i s a ɪ̯ kː a ɾ̪ u ʋ i	0
இசைப்பாட்டு	ʔ i s a ɪ̯ pː aː ʈː u	0
இசைவு	ʔ i s a ɪ̯ ʋ u	0
இஞ்சி	ʔ i ɲ d͡ʑ i	0
இடி	ʔ i ɖ i	0
இடியாப்பம்	ʔ i ɖ i j aː pː a m	0
இடு	ʔ i ɖ u	0
இடுப்பு	ʔ i ɖ u pː u	0
இடையினம்	ʔ i ɖ a ɪ̯ j i n a m	0
இட்டம்	ʔ i ʈː a m	0
இட்டு	ʔ i ʈː u	0
இட்லி	ʔ i ʈ l̪ i	0
இணை	ʔ i ɳ a ɪ̯	0
இதயம்	ʔ i d̪ a j a m	0
இது	ʔ i d̪ u	0
இந்தி	ʔ i n̪ d̪ i	0
இந்தியர்	ʔ i n̪ d̪ i j a ɾ̪	0
இந்தியா	ʔ i n̪ d̪ i j aː	0
இந்து	ʔ i n̪ d̪ u	0
இனப்படுகொலை	ʔ i n a pː a ɖ u ɡ o l̪ a ɪ̯	0
இனம்	ʔ i n a m	0
இன்பம்	ʔ i n p a m	0
இன்று	ʔ i n r u	0
இப்போது	ʔ i pː oː d̪ u	0
இயங்குதளம்	ʔ i j a ŋ ɡ u d̪ a ɭ a m	0
இயம்	ʔ i j a m	0
இயல்	ʔ i j a l̪	0
இயல்பு	ʔ i j a l̪ p u	0
இயல்புகணம்	ʔ i j a l̪ p u ɡ a ɳ a m	0
இயேசு	ʔ i j eː s u	0
இரசாயனம்	ʔ i ɾ̪ a s aː j a n a m	0
இரண்டு	ʔ i ɾ̪ a ɳ ɖ u	0
இரவு	ʔ i ɾ̪ a ʋ u	0
இராகம்	ʔ i ɾ̪ aː ɡ a m	0
இராசகுமாரி	ʔ i ɾ̪ aː s a ɡ u m aː ɾ̪ i	0
இராசி	ʔ i ɾ̪ aː s i	0
இராமாயணம்	ʔ i ɾ̪ aː m aː j a ɳ a m	0
இரு	ʔ i ɾ̪ u	0
இருபால்சேர்க்கை	ʔ i ɾ̪ u b aː l̪ t͡ʃ eː ɾ̪ kː a ɪ̯	0
இருமல்	ʔ i ɾ̪ u m a l̪	0
இரும்பு	ʔ i ɾ̪ u m b u	0
இரை	ʔ i ɾ̪ a ɪ̯	0
இரைப்பை	ʔ i ɾ̪ a ɪ̯ pː a ɪ̯	0
இறகு	ʔ i r a ɡ u	0
இறக்கை	ʔ i r a kː a ɪ̯	0
இறால்	ʔ i r aː l̪	0
இறைச்சி	ʔ i r a ɪ̯ t͡ʃː i	0
இலக்கணம்	ʔ i l̪ a kː a ɳ a m	0
இலக்கிய	ʔ i l̪ a kː i j a	0
இலக்கியம்	ʔ i l̪ a kː i j a m	0
இலக்கு	ʔ i l̪ a kː u	0
இலங்கை	ʔ i l̪ a ŋ ɡ a ɪ̯	0
இலட்சம்	ʔ i l̪ a ʈ t͡ʃ a m	0
இலட்சுமணன்	ʔ i l̪ a ʈ t͡ʃ u m a ɳ a n	0
இலத்தீன்	ʔ i l̪ a t̪ː iː n	0
இலவசம்	ʔ i l̪ a ʋ a s a m	0
இலை	ʔ i l̪ a ɪ̯	0
இல்	ʔ i l̪	0
இல்லகம்	ʔ i l̪ː a ɡ a m	0
இல்லக்கிழத்தி	ʔ i l̪ː a kː i ɻ a t̪ː i	0
இல்லத்தரசி	ʔ i l̪ː a t̪ː a ɾ̪ a s i	0
இல்லம்	ʔ i l̪ː a m	0
இல்லாள்	ʔ i l̪ː aː ɭ	0
இல்லை	ʔ i l̪ː a ɪ̯	0
இள	ʔ i ɭ a	64
இளநீர்	ʔ i ɭ a n̪ iː ɾ̪	0
இழப்பு	ʔ i ɻ a pː u	0
இஸ்லாமாபாத்	ʔ i s l̪ aː m aː b aː t̪	0
ஈ	ʔ iː	638
ஈகை	ʔ iː ɡ a ɪ̯	0
ஈடு	ʔ iː ɖ u	0
ஈட்டு	ʔ iː ʈː u	0
ஈனில்	ʔ iː n i l̪	0
ஈரல்	ʔ iː ɾ̪ a l̪	0
ஈழம்	ʔ iː ɻ a m	0
உ	ʔ u	92
உஃப	ʔ u f a	0
உகளம்	ʔ u ɡ a ɭ a m	0
உசுபெக்கிசுத்தான்	ʔ u s u b e kː i s u t̪ː aː n	0
உச்சரிப்பு	ʔ u t͡ʃː a ɾ̪ i pː u	0
உச்சி	ʔ u t͡ʃː i	0
உடம்பு	ʔ u ɖ a m b u	0
உடல்	ʔ u ɖ a l̪	0
உடுக்கை	ʔ u ɖ u kː a ɪ̯	0
உணவு	ʔ u ɳ a ʋ u	0
உண்	ʔ u ɳ	0
உண்மை	ʔ u ɳ m a ɪ̯	0
உதடு	ʔ u d̪ a ɖ u	0
உதவி	ʔ u d̪ a ʋ i	0
உதவு	ʔ u d̪ a ʋ u	0
உத்தரி	ʔ u t̪ː a ɾ̪ i	0
உன்	ʔ u n	0
உப்பு	ʔ u pː u	0
உம்	ʔ u m	0
உயரம்	ʔ u j a ɾ̪ a m	0
உயிரணு	ʔ u j i ɾ̪ a ɳ u	0
உயிரியல்	ʔ u j i ɾ̪ i j a l̪	0
உயிரிழப்பு	ʔ u j i ɾ̪ i ɻ a pː u	0
உயிரெழுத்து	ʔ u j i ɾ̪ e ɻ u t̪ː u	0
உயிர்	ʔ u j i ɾ̪	0
உயிர்த்தெழு	ʔ u j i ɾ̪ t̪ː e ɻ u	0
உயிர்வேதியியல்	ʔ u j i ɾ̪ ʋ eː d̪ i j i j a l̪	0
உரிமை	ʔ u ɾ̪ i m a ɪ̯	0
உருசியா	ʔ u ɾ̪ u s i j aː	0
உரை	ʔ u ɾ̪ a ɪ̯	0
உரோம்	ʔ u ɾ̪ oː m	0
உறக்கம்	ʔ u r a kː a m	0
உலகம்	ʔ u l̪ a ɡ a m	0
உலோகம்	ʔ u l̪ oː ɡ a m	0
உளவு	ʔ u ɭ a ʋ u	0
உள்	ʔ u ɭ	0
உள்ளங்கை	ʔ u ɭː a ŋ ɡ a ɪ̯	0
உழவர்	ʔ u ɻ a ʋ a ɾ̪	0
உழவு	ʔ u ɻ a ʋ u	0
உவமை	ʔ u ʋ a m a ɪ̯	0
உவர்மம்	ʔ u ʋ a ɾ̪ m a m	0
ஊடகம்	ʔ uː ɖ a ɡ a m	0
ஊட்டி	ʔ uː ʈː i	0
ஊதியம்	ʔ uː d̪ i j a m	0
ஊது	ʔ uː d̪ u	0
ஊத்தப்பம்	ʔ uː t̪ː a pː a m	0
ஊனம்	ʔ uː n a m	0
ஊர்	ʔ uː ɾ̪	0
ஊர்காவல்	ʔ uː ɾ̪ k aː ʋ a l̪	0
ஊர்க்கதை	ʔ uː ɾ̪ kː a d̪ a ɪ̯	0
ஊர்வன	ʔ uː ɾ̪ ʋ a n a	0
ஊறுகாய்	ʔ uː r u ɡ aː j	0
ஊற்று	ʔ uː ʈː ɾ u	0
ஊழல்	ʔ uː ɻ a l̪	0
எஃகு	ʔ e ɡ u	0
எங்கே	ʔ e ŋ ɡ eː	0
எசுத்தோனியா	ʔ e s u t̪ː oː n i j aː	0
எடு	ʔ e ɖ u	0
எட்டு	ʔ e ʈː u	0
எண்ணங்கள்	ʔ e ɳː a ŋ ɡ a ɭ	0
எண்ணம்	ʔ e ɳː a m	0
எதிர்பால்சேர்க்கை	ʔ e d̪ i ɾ̪ p aː l̪ t͡ʃ eː ɾ̪ kː a ɪ̯	0
என்	ʔ e n	0
என்ன	ʔ e nː a	0
எப்படி	ʔ e pː a ɖ i	0
எமன்	ʔ e m a n	0
எரி	ʔ e ɾ̪ i	0
எரிமலை	ʔ e ɾ̪ i m a l̪ a ɪ̯	0
எருது	ʔ e ɾ̪ u d̪ u	0
எருமை	ʔ e ɾ̪ u m a ɪ̯	0
எறும்பு	ʔ e r u m b u	0
எற்பாடு	ʔ e r p aː ɖ u	0
எலி	ʔ e l̪ i	0
எலும்பு	ʔ e l̪ u m b u	0
எழுது	ʔ e ɻ u d̪ u	0
எழுத்து	ʔ e ɻ u t̪ː u	0
எழுவாய்	ʔ e ɻ u ʋ aː j	0
எஸ்பெராண்டோ	ʔ e s p e ɾ̪ aː ɳ ɖ oː	0
ஏ	ʔ eː	1605
ஏணி	ʔ eː ɳ i	0
ஏன்	ʔ eː n	0
ஏப்ரல்	ʔ eː p ɾ̪ a l̪	0
ஏரி	ʔ eː ɾ̪ i	0
ஏலக்காய்	ʔ eː l̪ a kː aː j	0
ஏலம்	ʔ eː l̪ a m	0
ஏழு	ʔ eː ɻ u	0
ஏவாள்	ʔ eː ʋ aː ɭ	0
ஐ	ʔ a ɪ̯	1438
ஐதரசன்	ʔ a ɪ̯ t̪ a ɾ̪ a s a n	0
ஐநூறு	ʔ a ɪ̯ n̪ uː r u	0
ஐந்து	ʔ a ɪ̯ n̪ d̪ u	0
ஐம்பது	ʔ a ɪ̯ m b a d̪ u	0
ஐம்பொன்	ʔ a ɪ̯ m b o n	0
ஐயம்	ʔ a ɪ̯ j a m	0
ஐரோப்பா	ʔ a ɪ̯ ɾ̪ oː pː aː	0
ஒ	ʔ o	52
ஒகையோ	ʔ o ɡ a ɪ̯ j oː	0
ஒடி	ʔ o ɖ i	0
ஒட்டகம்	ʔ o ʈː a ɡ a m	0
ஒன்பது	ʔ o n p a d̪ u	0
ஒன்று	ʔ o n r u	0
ஒரு	ʔ o ɾ̪ u	0
ஒற்றுமை	ʔ o ʈː ɾ u m a ɪ̯	0
ஒலி	ʔ o l̪ i	0
ஒளி	ʔ o ɭ i	0
ஒழுக்கம்	ʔ o ɻ u kː a m	0
ஒவ்வாமை	ʔ o ʋː aː m a ɪ̯	0
ஓ	ʔ oː	679
ஓடம்	ʔ oː ɖ a m	0
ஓடு	ʔ oː ɖ u	0
ஓடை	ʔ oː ɖ a ɪ̯	0
ஓட்டல்	ʔ oː ʈː a l̪	0
ஓது	ʔ oː d̪ u	0
ஓநாய்	ʔ oː n̪ aː j	0
ஔ	ʔ a ʊ̯	3
ஔடதம்	ʔ a ʊ̯ ʈ a d̪ a m	0
ககனம்	k a ɡ a n a m	0
கங்கு	k a ŋ ɡ u	0
கஞ்சாவை	k a ɲ d͡ʑ aː ʋ a ɪ̯	0
கடற்கரை	k a ɖ a r k a ɾ̪ a ɪ̯	0
கடல்	k a ɖ a l̪	0
கடல்நீர்	k a ɖ a l̪ n̪ iː ɾ̪	0
கடவுள்	k a ɖ a ʋ u ɭ	0
கடி	k a ɖ i	0
கடிகாரம்	k a ɖ i ɡ aː ɾ̪ a m	0
கடிதம்	k a ɖ i d̪ a m	0
கடுங்கோபம்	k a ɖ u ŋ ɡ oː b a m	0
கடுதாசி	k a ɖ u d̪ aː s i	0
கடை	k a ɖ a ɪ̯	0
கடைவாய்ப்பல்	k a ɖ a ɪ̯ ʋ aː j pː a l̪	0
கட்சி	k a ʈ t͡ʃ i	0
கட்டில்	k a ʈː i l̪	0
கட்டு	k a ʈː u	0
கணம்	k a ɳ a m	0
கணவன்	k a ɳ a ʋ a n	0
கணிதம்	k a ɳ i d̪ a m	0
கணினி	k a ɳ i n i	0
கணையாழி	k a ɳ a ɪ̯ j aː ɻ i	0
கண்	k a ɳ	0
கண்ணாடி	k a ɳː aː ɖ i	0
கண்ணீர்	k a ɳː iː ɾ̪	0
கண்மாய்	k a ɳ m aː j	0
கதவு	k a d̪ a ʋ u	0
கதை	k a d̪ a ɪ̯	0
கத்தரிக்காய்	k a t̪ː a ɾ̪ i kː aː j	0
கத்தி	k a t̪ː i	0
கத்திரி	k a t̪ː i ɾ̪ i	0
கத்திரிக்காய்	k a t̪ː i ɾ̪ i kː aː j	0
கந்தகம்	k a n̪ d̪ a ɡ a m	0
கனடா	k a n a ɖ aː	0
கன்னடம்	k a nː a ɖ a m	0
கன்னம்	k a nː a m	0
கன்று	k a n r u	0
கப்பல்	k a pː a l̪	0
கமலம்	k a m a l̪ a m	0
கயிறு	k a j i r u	0
கரடி	k a ɾ̪ a ɖ i	0
கரண்டி	k a ɾ̪ a ɳ ɖ i	0
கரி	k a ɾ̪ i	0
கரிமம்	k a ɾ̪ i m a m	0
கரு	k a ɾ̪ u	0
கருப்பு	k a ɾ̪ u pː u	0
கருப்பை	k a ɾ̪ u pː a ɪ̯	0
கருமம்	k a ɾ̪ u m a m	0
கருமையான	k a ɾ̪ u m a ɪ̯ j aː n a	0
கரும்பு	k a ɾ̪ u m b u	0
கருவி	k a ɾ̪ u ʋ i	0
கர்த்தர்	k a ɾ̪ t̪ː a ɾ̪	0
கர்நாடகம்	k a ɾ̪ n̪ aː ɖ a ɡ a m	0
கறவை	k a r a ʋ a ɪ̯	0
கறி	k a r i	0
கறுவா	k a r u ʋ aː	0
கற்பூரம்	k a r p uː ɾ̪ a m	0
கலகம்	k a l̪ a ɡ a m	0
கலம்	k a l̪ a m	0
கலயம்	k a l̪ a j a m	0
கலை	k a l̪ a ɪ̯	0
கலைக்களஞ்சியம்	k a l̪ a ɪ̯ kː a ɭ a ɲ d͡ʑ i j a m	0
கலைச்சொல்	k a l̪ a ɪ̯ t͡ʃː o l̪	0
கலைஞர்	k a l̪ a ɪ̯ ɲ a ɾ̪	0
கல்	k a l̪	0
கல்யாணம்	k a l̪ j aː ɳ a m	0
கல்லீரல்	k a l̪ː iː ɾ̪ a l̪	0
கல்வி	k a l̪ ʋ i	0
கல்விக்கூடம்	k a l̪ ʋ i kː uː ɖ a m	0
களம்	k a ɭ a m	0
களவு	k a ɭ a ʋ u	0
களை	k a ɭ a ɪ̯	0
கள்ளம்	k a ɭː a m	0
கழித்தல்	k a ɻ i t̪ː a l̪	0
கழுவு	k a ɻ u ʋ u	0
கவிஞர்	k a ʋ i ɲ a ɾ̪	0
கவிதை	k a ʋ i d̪ a ɪ̯	0
காகம்	k aː ɡ a m	0
காகிதம்	k aː ɡ i d̪ a m	0
காக்கை	k aː kː a ɪ̯	0
காசு	k aː s u	0
காடு	k aː ɖ u	0
காடைக்கண்ணி	k aː ɖ a ɪ̯ kː a ɳː i	0
காதணி	k aː d̪ a ɳ i	0
காதல்	k aː d̪ a l̪	0
காது	k aː d̪ u	0
காந்தம்	k aː n̪ d̪ a m	0
கானலி	k aː n a l̪ i	0
காபி	k aː b i	0
காபூல்	k aː b uː l̪	0
காப்ச்சா	k aː p t͡ʃː aː	0
காப்பியம்	k aː pː i j a m	0
காமம்	k aː m a m	0
காய்	k aː j	0
காய்கறி	k aː j k a r i	0
காரம்	k aː ɾ̪ a m	0
காராமணி	k aː ɾ̪ aː m a ɳ i	0
கார்த்தூம்	k aː ɾ̪ t̪ː uː m	0
கார்மம்	k aː ɾ̪ m a m	0
காறையெலும்பு	k aː r a ɪ̯ j e l̪ u m b u	0
காற்றழுத்தமானி	k aː ʈː ɾ a ɻ u t̪ː a m aː n i	0
காற்று	k aː ʈː ɾ u	0
காலணி	k aː l̪ a ɳ i	0
காலம்	k aː l̪ a m	0
காலை	k aː l̪ a ɪ̯	0
கால்	k aː l̪	0
காளான்	k aː ɭ aː n	0
காளை	k aː ɭ a ɪ̯	0
காவல்	k aː ʋ a l̪	0
காவு	k aː ʋ u	0
கிட்ட	k i ʈː a	0
கித்தார்	k i t̪ː aː ɾ̪	0
கிராம்பு	k i ɾ̪ aː m b u	0
கிருட்டிணன்	k i ɾ̪ u ʈː i ɳ a n	0
கிரேக்கம்	k i ɾ̪ eː kː a m	0
கிறிஸ்துமஸ்	k i r i s t̪ u m a s	0
கிளவி	k i ɭ a ʋ i	0
கிளி	k i ɭ i	0
கிளிமெண்டி	k i ɭ i m e ɳ ɖ i	0
கிளை	k i ɭ a ɪ̯	0
கிழக்கு	k i ɻ a kː u	0
கிழங்கு	k i ɻ a ŋ ɡ u	0
கிழவன்	k i ɻ a ʋ a n	0
கிழவி	k i ɻ a ʋ i	0
கீழே	k iː ɻ eː	0
கீழ்	k iː ɻ	0
குங்குமப்பூ	k u ŋ ɡ u m a pː uː	0
குங்குமம்	k u ŋ ɡ u m a m	0
குஞ்சி	k u ɲ d͡ʑ i	0
குடம்	k u ɖ a m	0
குடல்வால்	k u ɖ a l̪ ʋ aː l̪	0
குடி	k u ɖ i	0
குடிசை	k u ɖ i s a ɪ̯	0
குடிநீர்	k u ɖ i n̪ iː ɾ̪	0
குடில்	k u ɖ i l̪	0
குடும்பம்	k u ɖ u m b a m	0
குடை	k u ɖ a ɪ̯	0
குட்டி	k u ʈː i	0
குணம்	k u ɳ a m	0
குண்டம்	k u ɳ ɖ a m	0
குண்டி	k u ɳ ɖ i	0
குதிரை	k u d̪ i ɾ̪ a ɪ̯	0
குன்றின்	k u n r i n	0
குன்று	k u n r u	0
குப்பி	k u pː i	0
குமாரத்தி	k u m aː ɾ̪ a t̪ː i	0
குமாரன்	k u m aː ɾ̪ a n	0
குமார்	k u m aː ɾ̪	0
குமிழி	k u m i ɻ i	0
கும்பிடு	k u m b i ɖ u	0
குயவன்	k u j a ʋ a n	0
குரங்கு	k u ɾ̪ a ŋ ɡ u	0
குரல்	k u ɾ̪ a l̪	0
குரல்வளை	k u ɾ̪ a l̪ ʋ a ɭ a ɪ̯	0
குரு	k u ɾ̪ u	0
குருகுலம்	k u ɾ̪ u ɡ u l̪ a m	0
குருடன்	k u ɾ̪ u ɖ a n	0
குருடு	k u ɾ̪ u ɖ u	0
குருதி	k u ɾ̪ u d̪ i	0
குருத்து	k u ɾ̪ u t̪ː u	0
குறங்கு	k u r a ŋ ɡ u	0
குறி	k u r i	0
குறுமை	k u r u m a ɪ̯	0
குலம்	k u l̪ a m	0
குலை	k u l̪ a ɪ̯	0
குள்ளம்	k u ɭː a m	0
குழி	k u ɻ i	0
குழிவு	k u ɻ i ʋ u	0
குவளை	k u ʋ a ɭ a ɪ̯	0
குவார்ட்சு	k u ʋ aː ɾ̪ ʈ t͡ʃ u	0
குவியம்	k u ʋ i j a m	0
குவியல்	k u ʋ i j a l̪	0
கூகை	k uː ɡ a ɪ̯	0
கூடம்	k uː ɖ a m	0
கூடாரத்தில்	k uː ɖ aː ɾ̪ a t̪ː i l̪	0
கூடு	k uː ɖ u	0
கூடை	k uː ɖ a ɪ̯	0
கூட்டம்	k uː ʈː a m	0
கூட்டல்	k uː ʈː a l̪	0
கூத்தாட	k uː t̪ː aː ɖ a	0
கூத்து	k uː t̪ː u	0
கூனைப்பூ	k uː n a ɪ̯ pː uː	0
கூரைவீடு	k uː ɾ̪ a ɪ̯ ʋ iː ɖ u	0
கூறு	k uː r u	0
கூறை	k uː r a ɪ̯	0
கூலம்	k uː l̪ a m	0
கூளி	k uː ɭ i	0
கெட்ட	k e ʈː a	0
கேரளம்	k eː ɾ̪ a ɭ a m	0
கை	k a ɪ̯	0
கைப்பை	k a ɪ̯ pː a ɪ̯	0
கொக்கு	k o kː u	0
கொசு	k o s u	0
கொஞ்சம்	k o ɲ d͡ʑ a m	0
கொண்டாட்டம்	k o ɳ ɖ aː ʈː a m	0
கொம்பு	k o m b u	0
கொள்ளை	k o ɭː a ɪ̯	0
கொழும்பு	k o ɻ u m b u	0
கோ	k oː	0
கோடி	k oː ɖ i	0
கோடிமுனை	k oː ɖ i m u n a ɪ̯	0
கோட்டம்	k oː ʈː a m	0
கோட்டை	k oː ʈː a ɪ̯	0
கோணவியல்	k oː ɳ a ʋ i j a l̪	0
கோபம்	k oː b a m	0
கோபுரம்	k oː b u ɾ̪ a m	0
கோமான்	k oː m aː n	0
கோமி	k oː m i	0
கோயம்புத்தூர்	k oː j a m b u t̪ː uː ɾ̪	0
கோயில்	k oː j i l̪	0
கோழி	k oː ɻ i	0
கோவைக்காய்	k oː ʋ a ɪ̯ kː aː j	0
சகோதரி	t͡ʃ a ɡ oː d̪ a ɾ̪ i	0
சக்கரை	t͡ʃ a kː a ɾ̪ a ɪ̯	0
சங்கம்	t͡ʃ a ŋ ɡ a m	0
சட்டி	t͡ʃ a ʈː i	0
சட்டை	t͡ʃ a ʈː a ɪ̯	0
சட்னி	t͡ʃ a ʈ n i	0
சணல்	t͡ʃ a ɳ a l̪	0
சண்டை	t͡ʃ a ɳ ɖ a ɪ̯	0
சதுரங்கம்	t͡ʃ a d̪ u ɾ̪ a ŋ ɡ a m	0
சத்தியம்	t͡ʃ a t̪ː i j a m	0
சந்தனம்	t͡ʃ a n̪ d̪ a n a m	0
சந்திப்பு	t͡ʃ a n̪ d̪ i pː u	0
சனி	t͡ʃ a n i	0
சப்தசோதனைக்குழல்	t͡ʃ a p t̪ a s oː d̪ a n a ɪ̯ kː u ɻ a l̪	0
சப்பாத்தி	t͡ʃ a pː aː t̪ː i	0
சப்போட்டா	t͡ʃ a pː oː ʈː aː	0
சமசுகிருதம்	t͡ʃ a m a s u ɡ i ɾ̪ u d̪ a m	0
சமயம்	t͡ʃ a m a j a m	0
சமோசா	t͡ʃ a m oː s aː	0
சம்பளம்	t͡ʃ a m b a ɭ a m	0
சரி	t͡ʃ a ɾ̪ i	0
சர்க்கரை	t͡ʃ a ɾ̪ kː a ɾ̪ a ɪ̯	0
சலவைக்காரர்	t͡ʃ a l̪ a ʋ a ɪ̯ kː aː ɾ̪ a ɾ̪	0
சாதம்	t͡ʃ aː d̪ a m	0
சாப்பாட்டுக்கடை	t͡ʃ aː pː aː ʈː u kː a ɖ a ɪ̯	0
சாம்பல்	t͡ʃ aː m b a l̪	0
சாயங்காலம்	t͡ʃ aː j a ŋ ɡ aː l̪ a m	0
சாறு	t͡ʃ aː r u	0
சாலி	t͡ʃ aː l̪ i	0
சாலை	t͡ʃ aː l̪ a ɪ̯	0
சாளரம்	t͡ʃ aː ɭ a ɾ̪ a m	0
சாவி	t͡ʃ aː ʋ i	0
சிகப்பு	t͡ʃ i ɡ a pː u	0
சிகரட்	t͡ʃ i ɡ a ɾ̪ a ʈ	0
சிகரம்	t͡ʃ i ɡ a ɾ̪ a m	0
சிங்கப்பூர்	t͡ʃ i ŋ ɡ a pː uː ɾ̪	0
சிங்கம்	t͡ʃ i ŋ ɡ a m	0
சிதறியம்	t͡ʃ i d̪ a r i j a m	0
சிநேகிதன்	t͡ʃ i n̪ eː ɡ i d̪ a n	0
சினை	t͡ʃ i n a ɪ̯	0
சினைப்பை	t͡ʃ i n a ɪ̯ pː a ɪ̯	0
சின்டி	t͡ʃ i n ʈ i	0
சின்ன	t͡ʃ i nː a	0
சிரித்தை	t͡ʃ i ɾ̪ i t̪ː a ɪ̯	0
சிரிப்பு	t͡ʃ i ɾ̪ i pː u	0
சிற	t͡ʃ i r a	0
சிறகு	t͡ʃ i r a ɡ u	0
சிறுகதை	t͡ʃ i r u ɡ a d̪ a ɪ̯	0
சிறுநீரகம்	t͡ʃ i r u n̪ iː ɾ̪ a ɡ a m	0
சிறுமை	t͡ʃ i r u m a ɪ̯	0
சிறுவன்	t͡ʃ i r u ʋ a n	0
சிலந்தி	t͡ʃ i l̪ a n̪ d̪ i	0
சீக்கிரம்	t͡ʃ iː kː i ɾ̪ a m	0
சீடை	t͡ʃ iː ɖ a ɪ̯	0
சீரகம்	t͡ʃ iː ɾ̪ a ɡ a m	0
சீழ்	t͡ʃ iː ɻ	0
சுட்டாமுட்டி	t͡ʃ u ʈː aː m u ʈː i	0
சுட்டுவிரல்	t͡ʃ u ʈː u ʋ i ɾ̪ a l̪	0
சுண்டெலி	t͡ʃ u ɳ ɖ e l̪ i	0
சுண்ணம்	t͡ʃ u ɳː a m	0
சுதந்தரம்	t͡ʃ u d̪ a n̪ d̪ a ɾ̪ a m	0
சுந்தரம்	t͡ʃ u n̪ d̪ a ɾ̪ a m	0
சுனாமி	t͡ʃ u n aː m i	0
சுனை	t͡ʃ u n a ɪ̯	0
சுரம்	t͡ʃ u ɾ̪ a m	0
சுருட்டு	t͡ʃ u ɾ̪ u ʈː u	0
சுருதி	t͡ʃ u ɾ̪ u d̪ i	0
சுருளி	t͡ʃ u ɾ̪ u ɭ i	0
சுரை	t͡ʃ u ɾ̪ a ɪ̯	0
சுறா	t͡ʃ u r aː	0
சுற்று	t͡ʃ u ʈː ɾ u	0
சுற்றுச்சூழல்	t͡ʃ u ʈː ɾ u t͡ʃː uː ɻ a l̪	0
சுவடி	t͡ʃ u ʋ a ɖ i	0
சுவாசம்	t͡ʃ u ʋ aː s a m	0
சுவாசியா	t͡ʃ u ʋ aː s i j aː	0
சுவையான	t͡ʃ u ʋ a ɪ̯ j aː n a	0
சூரியன்	t͡ʃ uː ɾ̪ i j a n	0
சூழலியல்	t͡ʃ uː ɻ a l̪ i j a l̪	0
சூழல்	t͡ʃ uː ɻ a l̪	0
செங்	t͡ʃ e ŋ	0
செங்கந்தகம்	t͡ʃ e ŋ ɡ a n̪ d̪ a ɡ a m	0
செங்கிழங்கு	t͡ʃ e ŋ ɡ i ɻ a ŋ ɡ u	0
செச்சினியா	t͡ʃ e t͡ʃː i n i j aː	0
செடி	t͡ʃ e ɖ i	0
