ࢳ	ŋ	0
வண்ணாத்திப்பூச்சி	ʋ a ɳː aː t̪ː i pː uː t͡ʃː i	0
வனம்	ʋ a n a m	0
வன்தங்கம்	ʋ a n t̪ a ŋ ɡ a m	0
வன்பொருள்	ʋ a n p o ɾ̪ u ɭ	0
வன்மை	ʋ a n m a ɪ̯	0
வன்வெள்ளி	ʋ a n ʋ e ɭː i	0
வம்சம்	ʋ a m t͡ʃ a m	0
வரவேற்கிறேன்	ʋ a ɾ̪ a ʋ eː r k i r eː n	0
வருகமஞ்சள்	ʋ a ɾ̪ u ɡ a m a ɲ d͡ʑ a ɭ	0
வருடம்	ʋ a ɾ̪ u ɖ a m	0
வருணன்	ʋ a ɾ̪ u ɳ a n	0
வருஷம்	ʋ a ɾ̪ u ʂ a m	0
வரை	ʋ a ɾ̪ a ɪ̯	0
வலி	ʋ a l̪ i	0
வலிப்பு	ʋ a l̪ i pː u	0
வல்லினம்	ʋ a l̪ː i n a m	0
வல்லை	ʋ a l̪ː a ɪ̯	0
வளமை	ʋ a ɭ a m a ɪ̯	0
வளம்	ʋ a ɭ a m	0
வளர்ச்சி	ʋ a ɭ a ɾ̪ t͡ʃː i	0
வளையல்	ʋ a ɭ a ɪ̯ j a l̪	0
வழி	ʋ a ɻ i	0
வா	ʋ aː	0
வாக்காளர்	ʋ aː kː aː ɭ a ɾ̪	0
வாக்கியம்	ʋ aː kː i j a m	0
வாக்கு	ʋ aː kː u	0
வாந்தி	ʋ aː n̪ d̪ i	0
வானம்	ʋ aː n a m	0
வானவில்	ʋ aː n a ʋ i l̪	0
வானியல்	ʋ aː n i j a l̪	0
வாய்	ʋ aː j	0
வாரம்	ʋ aː ɾ̪ a m	0
வார்த்தை	ʋ aː ɾ̪ t̪ː a ɪ̯	0
வால்	ʋ aː l̪	0
வாள்	ʋ aː ɭ	0
வாழைப்பழம்	ʋ aː ɻ a ɪ̯ pː a ɻ a m	0
விடுவி	ʋ i ɖ u ʋ i	0
விண்கலம்	ʋ i ɳ k a l̪ a m	0
விண்ணுளவி	ʋ i ɳː u ɭ a ʋ i	0
விண்மீன்	ʋ i ɳ m iː n	0
விதை	ʋ i d̪ a ɪ̯	0
விதைப்பை	ʋ i d̪ a ɪ̯ pː a ɪ̯	0
விநாடி	ʋ i n̪ aː ɖ i	0
விந்து	ʋ i n̪ d̪ u	0
வினவு	ʋ i n a ʋ u	0
வினா	ʋ i n aː	0
வினை	ʋ i n a ɪ̯	0
வினைச்சொல்	ʋ i n a ɪ̯ t͡ʃː o l̪	0
வினைவியம்	ʋ i n a ɪ̯ ʋ i j a m	0
விமானம்	ʋ i m aː n a m	0
வியாழன்	ʋ i j aː ɻ a n	0
விரல்	ʋ i ɾ̪ a l̪	0
விரைவில்	ʋ i ɾ̪ a ɪ̯ ʋ i l̪	0
விலங்கியல்	ʋ i l̪ a ŋ ɡ i j a l̪	0
விலங்கு	ʋ i l̪ a ŋ ɡ u	0
விலயம்	ʋ i l̪ a j a m	0
விலை	ʋ i l̪ a ɪ̯	0
வில்	ʋ i l̪	0
விவசாயி	ʋ i ʋ a s aː j i	0
வீடு	ʋ iː ɖ u	0
வீட்டுக்காரி	ʋ iː ʈː u kː aː ɾ̪ i	0
வெங்காயம்	ʋ e ŋ ɡ aː j a m	0
வெடிமருந்து	ʋ e ɖ i m a ɾ̪ u n̪ d̪ u	0
வெட்டுக்கிளி	ʋ e ʈː u kː i ɭ i	0
வெண்டை	ʋ e ɳ ɖ a ɪ̯	0
வெற்றிலை	ʋ e ʈː ɾ i l̪ a ɪ̯	0
வெல்லம்	ʋ e l̪ː a m	0
வெள்ளரி	ʋ e ɭː a ɾ̪ i	0
வெள்ளி	ʋ e ɭː i	0
வேட்டி	ʋ eː ʈː i	0
வேதம்	ʋ eː d̪ a m	0
வேதியியல்	ʋ eː d̪ i j i j a l̪	0
வேப்பமரம்	ʋ eː pː a m a ɾ̪ a m	0
வேம்பு	ʋ eː m b u	0
வேர்	ʋ eː ɾ̪	0
வேர்வை	ʋ eː ɾ̪ ʋ a ɪ̯	0
வேறு	ʋ eː r u	0
வேறுபாடு	ʋ eː r u b aː ɖ u	0
வேற்றுமை	ʋ eː ʈː ɾ u m a ɪ̯	0
வேலை	ʋ eː l̪ a ɪ̯	0
வேலைக்காரன்	ʋ eː l̪ a ɪ̯ kː aː ɾ̪ a n	0
வேலையாள்	ʋ eː l̪ a ɪ̯ j aː ɭ	0
வைப்பு	ʋ a ɪ̯ pː u	0
வௌவால்	ʋ a ʊ̯ ʋ aː l̪	0
ஸ்தலம்	s t̪ a l̪ a m	0
ஸ்ரீ	s ɾ̪ iː	0
ஹக்காசியா	h a kː aː s i j aː	0
ஹொங்கொங்	h o ŋ ɡ o ŋ	0
ா	a	0
ி	i	0
ீ	iː	0
ு	u	0
ூ	uː	0
ெ	e	0
ே	eː	0
ை	a i	0
