ࢳ	ŋ	0
செடிகொடி	t͡ʃ e ɖ i ɡ o ɖ i	0
செந்	t͡ʃ e n̪	0
சென்னை	t͡ʃ e nː a ɪ̯	0
செம்	t͡ʃ e m	0
செம்பு	t͡ʃ e m b u	0
செய்தல்	t͡ʃ e j t̪ a l̪	0
செழியன்	t͡ʃ e ɻ i j a n	0
செவி	t͡ʃ e ʋ i	0
செவ்வாய்	t͡ʃ e ʋː aː j	0
செவ்விரும்பு	t͡ʃ e ʋː i ɾ̪ u m b u	0
சேதி	t͡ʃ eː d̪ i	0
சேப்பங்கிழங்கு	t͡ʃ eː pː a ŋ ɡ i ɻ a ŋ ɡ u	0
சேய்	t͡ʃ eː j	0
சேய்மை	t͡ʃ eː j m a ɪ̯	0
சேவல்	t͡ʃ eː ʋ a l̪	0
சொத்து	t͡ʃ o t̪ː u	0
சொந்த	t͡ʃ o n̪ d̪ a	0
சொற்பிறப்பியல்	t͡ʃ o r p i r a pː i j a l̪	0
சொற்பொழிவு	t͡ʃ o r p o ɻ i ʋ u	0
சொற்றொடர்	t͡ʃ o ʈː ɾ o ɖ a ɾ̪	0
சொல்	t͡ʃ o l̪	0
சொல்லாட்சி	t͡ʃ o l̪ː aː ʈ t͡ʃ i	0
சொல்லியல்	t͡ʃ o l̪ː i j a l̪	0
சொல்வளம்	t͡ʃ o l̪ ʋ a ɭ a m	0
சோதிடம்	t͡ʃ oː d̪ i ɖ a m	0
சோம்பு	t͡ʃ oː m b u	0
சோறு	t͡ʃ oː r u	0
சோலை	t͡ʃ oː l̪ a ɪ̯	0
சோளம்	t͡ʃ oː ɭ a m	0
சௌக்கியமா	t͡ʃ a ʊ̯ kː i j a m aː	0
ஜங்கிள்	d͡ʑ a ŋ ɡ i ɭ	0
ஜனவரி	d͡ʑ a n a ʋ a ɾ̪ i	0
ஜன்னல்	d͡ʑ a nː a l̪	0
ஜப்பான்	d͡ʑ a pː aː n	0
ஜலம்	d͡ʑ a l̪ a m	0
ஜெருசலேம்	d͡ʑ e ɾ̪ u s a l̪ eː m	0
ஜோடி	d͡ʑ oː ɖ i	0
ஞானம்	ɲ aː n a m	0
ஞாயிறு	ɲ aː j i r u	0
டிராகன்	ʈ i ɾ̪ aː ɡ a n	0
தக்காளி	t̪ a kː aː ɭ i	0
தங்கம்	t̪ a ŋ ɡ a m	0
தங்கை	t̪ a ŋ ɡ a ɪ̯	0
தசை	t̪ a s a ɪ̯	0
தடி	t̪ a ɖ i	0
தட்டு	t̪ a ʈː u	0
தண்ணீர்	t̪ a ɳː iː ɾ̪	0
தந்தை	t̪ a n̪ d̪ a ɪ̯	0
தன்மை	t̪ a n m a ɪ̯	0
தப்பு	t̪ a pː u	0
தமக்கை	t̪ a m a kː a ɪ̯	0
தமிழிலக்கணம்	t̪ a m i ɻ i l̪ a kː a ɳ a m	0
தமிழ்	t̪ a m i ɻ	0
தமிழ்நாடு	t̪ a m i ɻ n̪ aː ɖ u	0
தம்பம்	t̪ a m b a m	0
தம்பி	t̪ a m b i	0
தம்புரா	t̪ a m b u ɾ̪ aː	0
தயிர்	t̪ a j i ɾ̪	0
தருமம்	t̪ a ɾ̪ u m a m	0
தர்ச்சனி	t̪ a ɾ̪ t͡ʃː a n i	0
தறி	t̪ a r i	0
தற்சனி	t̪ a r t͡ʃ a n i	0
தற்பால்சேர்க்கை	t̪ a r p aː l̪ t͡ʃ eː ɾ̪ kː a ɪ̯	0
தலை	t̪ a l̪ a ɪ̯	0
தலைவன்	t̪ a l̪ a ɪ̯ ʋ a n	0
தளம்	t̪ a ɭ a m	0
தவம்	t̪ a ʋ a m	0
தவளை	t̪ a ʋ a ɭ a ɪ̯	0
தவிள்	t̪ a ʋ i ɭ	0
தாகெஸ்தான்	t̪ aː ɡ e s t̪ aː n	0
தாடி	t̪ aː ɖ i	0
தாதை	t̪ aː d̪ a ɪ̯	0
தானியம்	t̪ aː n i j a m	0
தான்	t̪ aː n	0
தாமரை	t̪ aː m a ɾ̪ a ɪ̯	0
தாயகம்	t̪ aː j a ɡ a m	0
தாய்	t̪ aː j	0
தாய்மொழி	t̪ aː j m o ɻ i	0
தார்	t̪ aː ɾ̪	0
தாலாட்டு	t̪ aː l̪ aː ʈː u	0
தாளம்	t̪ aː ɭ a m	0
தாளித்தல்	t̪ aː ɭ i t̪ː a l̪	0
தாவரம்	t̪ aː ʋ a ɾ̪ a m	0
தாவரவியல்	t̪ aː ʋ a ɾ̪ a ʋ i j a l̪	0
தாஸ்மானியா	t̪ aː s m aː n i j aː	0
திங்கள்	t̪ i ŋ ɡ a ɭ	0
தினம்	t̪ i n a m	0
தியானம்	t̪ i j aː n a m	0
திரவிடம்	t̪ i ɾ̪ a ʋ i ɖ a m	0
திராட்சை	t̪ i ɾ̪ aː ʈ t͡ʃ a ɪ̯	0
திராவிட	t̪ i ɾ̪ aː ʋ i ɖ a	0
திருட்டு	t̪ i ɾ̪ u ʈː u	0
திருவனந்தபுரம்	t̪ i ɾ̪ u ʋ a n a n̪ d̪ a b u ɾ̪ a m	0
திரைப்படம்	t̪ i ɾ̪ a ɪ̯ pː a ɖ a m	0
தீ	t̪ iː	0
தீனம்	t̪ iː n a m	0
தீனி	t̪ iː n i	0
தீனிப்பை	t̪ iː n i pː a ɪ̯	0
தீமுறி	t̪ iː m u r i	0
தீவு	t̪ iː ʋ u	0
துணி	t̪ u ɳ i	0
துத்தம்	t̪ u t̪ː a m	0
துயில்	t̪ u j i l̪	0
துரியான்	t̪ u ɾ̪ i j aː n	0
துருக்மெனிஸ்தான்	t̪ u ɾ̪ u k m e n i s t̪ aː n	0
துளசி	t̪ u ɭ a s i	0
துளுவம்	t̪ u ɭ u ʋ a m	0
துவாரம்	t̪ u ʋ aː ɾ̪ a m	0
தூண்டில்	t̪ uː ɳ ɖ i l̪	0
தூரம்	t̪ uː ɾ̪ a m	0
தெகுரான்	t̪ e ɡ u ɾ̪ aː n	0
தெரிவி	t̪ e ɾ̪ i ʋ i	0
தெரு	t̪ e ɾ̪ u	0
தெலுங்கு	t̪ e l̪ u ŋ ɡ u	0
தெஹரான்	t̪ e h a ɾ̪ aː n	0
தேங்காய்	t̪ eː ŋ ɡ aː j	0
தேசகன்	t̪ eː s a ɡ a n	0
தேசபாஷை	t̪ eː s a b aː ʂ a ɪ̯	0
தேசம்	t̪ eː s a m	0
தேசாசாரம்	t̪ eː s aː s aː ɾ̪ a m	0
தேசாதிபதி	t̪ eː s aː d̪ i b a d̪ i	0
தேனீ	t̪ eː n iː	0
தேன்	t̪ eː n	0
தேர்	t̪ eː ɾ̪	0
தேற்கு	t̪ eː r k u	0
தேவன்	t̪ eː ʋ a n	0
தேவாலயம்	t̪ eː ʋ aː l̪ a j a m	0
தேவை	t̪ eː ʋ a ɪ̯	0
தொடர்பு	t̪ o ɖ a ɾ̪ p u	0
தொலைக்காட்சி	t̪ o l̪ a ɪ̯ kː aː ʈ t͡ʃ i	0
தொலைபேசி	t̪ o l̪ a ɪ̯ p eː s i	0
தொல்லியல்	t̪ o l̪ː i j a l̪	0
தொழிற்சாலை	t̪ o ɻ i r t͡ʃ aː l̪ a ɪ̯	0
தொழில்	t̪ o ɻ i l̪	0
தோசம்	t̪ oː s a m	0
தோப்பி	t̪ oː pː i	0
தோலியல்	t̪ oː l̪ i j a l̪	0
தோல்	t̪ oː l̪	0
நகம்	n̪ a ɡ a m	0
நகரம்	n̪ a ɡ a ɾ̪ a m	0
நகை	n̪ a ɡ a ɪ̯	0
நகைச்சுவை	n̪ a ɡ a ɪ̯ t͡ʃː u ʋ a ɪ̯	0
நக்கு	n̪ a kː u	0
நட	n̪ a ɖ a	68
நடனம்	n̪ a ɖ a n a m	0
நடிகர்	n̪ a ɖ i ɡ a ɾ̪	0
நடு	n̪ a ɖ u	0
நடை	n̪ a ɖ a ɪ̯	0
நட்சத்திரமண்டலம்	n̪ a ʈ t͡ʃ a t̪ː i ɾ̪ a m a ɳ ɖ a l̪ a m	0
நட்சத்திரம்	n̪ a ʈ t͡ʃ a t̪ː i ɾ̪ a m	0
நன்மை	n̪ a n m a ɪ̯	0
நன்றாக	n̪ a n r aː ɡ a	0
நன்றி	n̪ a n r i	0
நபம்	n̪ a b a m	0
நரகம்	n̪ a ɾ̪ a ɡ a m	0
நரம்பியல்	n̪ a ɾ̪ a m b i j a l̪	0
நரம்பு	n̪ a ɾ̪ a m b u	0
நரி	n̪ a ɾ̪ i	0
நல்	n̪ a l̪	0
நவில்	n̪ a ʋ i l̪	0
நா	n̪ aː	0
நாகம்	n̪ aː ɡ a m	0
நாக்கு	n̪ aː kː u	0
நாங்கள்	n̪ aː ŋ ɡ a ɭ	0
நாடா	n̪ aː ɖ aː	0
நாடு	n̪ aː ɖ u	0
நாடோடி	n̪ aː ɖ oː ɖ i	0
நாட்டம்	n̪ aː ʈː a m	0
நாணயம்	n̪ aː ɳ a j a m	0
நாணல்	n̪ aː ɳ a l̪	0
நான்	n̪ aː n	0
நான்கு	n̪ aː n k u	0
நாம்	n̪ aː m	0
நாய்	n̪ aː j	0
நாரை	n̪ aː ɾ̪ a ɪ̯	0
நாளை	n̪ aː ɭ a ɪ̯	0
நாள்	n̪ aː ɭ	0
நாழிகை	n̪ aː ɻ i ɡ a ɪ̯	0
நித்திலம்	n̪ i t̪ː i l̪ a m	0
நினைவகம்	n̪ i n a ɪ̯ ʋ a ɡ a m	0
நிறமாலையியல்	n̪ i r a m aː l̪ a ɪ̯ j i j a l̪	0
நிலக்கடலை	n̪ i l̪ a kː a ɖ a l̪ a ɪ̯	0
நிலம்	n̪ i l̪ a m	0
நிலவு	n̪ i l̪ a ʋ u	0
நிலா	n̪ i l̪ aː	0
நிலை	n̪ i l̪ a ɪ̯	0
நில்	n̪ i l̪	0
நிழல்	n̪ i ɻ a l̪	0
நீ	n̪ iː	0
நீங்க	n̪ iː ŋ ɡ a	0
நீதி	n̪ iː d̪ i	0
நீரகம்	n̪ iː ɾ̪ a ɡ a m	0
நீராவி	n̪ iː ɾ̪ aː ʋ i	0
நீர்	n̪ iː ɾ̪	0
நீர்வளம்	n̪ iː ɾ̪ ʋ a ɭ a m	0
நீலம்	n̪ iː l̪ a m	0
நீலிரும்பு	n̪ iː l̪ i ɾ̪ u m b u	0
நீளம்	n̪ iː ɭ a m	0
நுதல்	n̪ u d̪ a l̪	0
நுரையீரல்	n̪ u ɾ̪ a ɪ̯ j iː ɾ̪ a l̪	0
நூறு	n̪ uː r u	0
நூலகம்	n̪ uː l̪ a ɡ a m	0
நூலறிவு	n̪ uː l̪ a r i ʋ u	0
நூல்	n̪ uː l̪	0
நெசவு	n̪ e s a ʋ u	0
நெஞ்சு	n̪ e ɲ d͡ʑ u	0
நெய்	n̪ e j	0
நெருப்பு	n̪ e ɾ̪ u pː u	0
நேரம்	n̪ eː ɾ̪ a m	0
நேற்று	n̪ eː ʈː ɾ u	0
நோய்	n̪ oː j	0
பகரம்	p a ɡ a ɾ̪ a m	0
பகர்	p a ɡ a ɾ̪	0
பகல்	p a ɡ a l̪	0
பக்கம்	p a kː a m	0
பக்தி	p a k t̪ i	0
பங்களா	p a ŋ ɡ a ɭ aː	0
பசலிப்பழம்	p a s a l̪ i pː a ɻ a m	0
பசளி	p a s a ɭ i	0
பசியம்	p a s i j a m	0
பசு	p a s u	0
பச்சை	p a t͡ʃː a ɪ̯	0
பட	p a ɖ a	1078
படம்	p a ɖ a m	0
படி	p a ɖ i	0
படிக்காரம்	p a ɖ i kː aː ɾ̪ a m	0
படிப்பறிவு	p a ɖ i pː a r i ʋ u	0
படிப்பு	p a ɖ i pː u	0
படிவம்	p a ɖ i ʋ a m	0
பட்டாணி	p a ʈː aː ɳ i	0
பட்டு	p a ʈː u	0
பட்டை	p a ʈː a ɪ̯	0
பணம்	p a ɳ a m	0
பண்டம்	p a ɳ ɖ a m	0
பண்டாரம்	p a ɳ ɖ aː ɾ̪ a m	0
பண்டிகை	p a ɳ ɖ i ɡ a ɪ̯	0
பண்டிதன்	p a ɳ ɖ i d̪ a n	0
பண்பாடு	p a ɳ p aː ɖ u	0
பண்பு	p a ɳ p u	0
பதிப்பகம்	p a d̪ i pː a ɡ a m	0
பதிமுகம்	p a d̪ i m u ɡ a m	0
பதிவகம்	p a d̪ i ʋ a ɡ a m	0
பதுமம்	p a d̪ u m a m	0
பத்து	p a t̪ː u	0
பனி	p a n i	0
பன்றி	p a n r i	0
பன்றிக்குட்டி	p a n r i kː u ʈː i	0
பம்பரம்	p a m b a ɾ̪ a m	0
பயணம்	p a j a ɳ a m	0
பயணி	p a j a ɳ i	0
பயனர்	p a j a n a ɾ̪	0
பயன்	p a j a n	0
பயம்	p a j a m	0
பயிர்	p a j i ɾ̪	0
பயிற்சி	p a j i r t͡ʃ i	0
பயிற்சியாளர்	p a j i r t͡ʃ i j aː ɭ a ɾ̪	0
பய்யன்	p a jː a n	0
பரங்கி	p a ɾ̪ a ŋ ɡ i	0
பரிதியம்	p a ɾ̪ i d̪ i j a m	0
பருப்பதம்	p a ɾ̪ u pː a d̪ a m	0
பருப்பு	p a ɾ̪ u pː u	0
பருவதம்	p a ɾ̪ u ʋ a d̪ a m	0
பரோட்டா	p a ɾ̪ oː ʈː aː	0
பர்வதம்	p a ɾ̪ ʋ a d̪ a m	0
பறவை	p a r a ʋ a ɪ̯	0
பறவையியல்	p a r a ʋ a ɪ̯ j i j a l̪	0
பலம்	p a l̪ a m	0
பலவு	p a l̪ a ʋ u	0
பலாப்பழம்	p a l̪ aː pː a ɻ a m	0
பலுக்கல்	p a l̪ u kː a l̪	0
பல்	p a l̪	0
பள்ளி	p a ɭː i	0
பள்ளிக்கூடம்	p a ɭː i kː uː ɖ a m	0
பழச்சாறு	p a ɻ a t͡ʃː aː r u	0
பழமை	p a ɻ a m a ɪ̯	0
பழம்	p a ɻ a m	0
பழீயம்	p a ɻ iː j a m	0
பழைய	p a ɻ a ɪ̯ j a	0
பாகற்காய்	p aː ɡ a r k aː j	0
பாகு	p aː ɡ u	0
பாசம்	p aː s a m	0
பாசுரம்	p aː s u ɾ̪ a m	0
பாசை	p aː s a ɪ̯	0
பாடசாலை	p aː ɖ a s aː l̪ a ɪ̯	0
பாடம்	p aː ɖ a m	0
பாடல்	p aː ɖ a l̪	0
பாட்டி	p aː ʈː i	0
பாட்டு	p aː ʈː u	0
பானை	p aː n a ɪ̯	0
பாம்பாட்டி	p aː m b aː ʈː i	0
பாம்பு	p aː m b u	0
பாயசம்	p aː j a s a m	0
பாராட்டு	p aː ɾ̪ aː ʈː u	0
பாரிஸ்	p aː ɾ̪ i s	0
பார்	p aː ɾ̪	0
பார்லி	p aː ɾ̪ l̪ i	0
பார்வை	p aː ɾ̪ ʋ a ɪ̯	0
பார்வையாளர்	p aː ɾ̪ ʋ a ɪ̯ j aː ɭ a ɾ̪	0
பாறை	p aː r a ɪ̯	0
பாறையியல்	p aː r a ɪ̯ j i j a l̪	0
பாற்பசு	p aː r p a s u	0
பாலுறவு	p aː l̪ u r a ʋ u	0
பாலூட்டி	p aː l̪ uː ʈː i	0
பாலைவனம்	p aː l̪ a ɪ̯ ʋ a n a m	0
பால்	p aː l̪	0
பாஷ்கொர்டொஸ்தான்	p aː ʂ k o ɾ̪ ʈ o s t̪ aː n	0
பாஷ்தூ	p aː ʂ t̪ uː	0
பிகு	p i ɡ u	0
பிகுபண்ணுதல்	p i ɡ u b a ɳː u d̪ a l̪	0
பிகுப்பட்டை	p i ɡ u pː a ʈː a ɪ̯	0
பிகுவேற்றுதல்	p i ɡ u ʋ eː ʈː ɾ u d̪ a l̪	0
பிங்கதிருட்டி	p i ŋ ɡ a d̪ i ɾ̪ u ʈː i	0
பிங்கம்	p i ŋ ɡ a m	0
பிங்கலகேசி	p i ŋ ɡ a l̪ a ɡ eː s i	0
பிங்கலம்	p i ŋ ɡ a l̪ a m	0
பிங்கலை	p i ŋ ɡ a l̪ a ɪ̯	0
பிசகுசொல்லுதல்	p i s a ɡ u s o l̪ː u d̪ a l̪	0
பிசகுதல்	p i s a ɡ u d̪ a l̪	0
பிசகுநாறுதல்	p i s a ɡ u n̪ aː r u d̪ a l̪	0
பிசக்குதல்	p i s a kː u d̪ a l̪	0
பிசங்கம்	p i s a ŋ ɡ a m	0
பிசங்கற்சீலை	p i s a ŋ ɡ a r t͡ʃ iː l̪ a ɪ̯	0
பிசங்குதல்	p i s a ŋ ɡ u d̪ a l̪	0
பிசண்டம்	p i s a ɳ ɖ a m	0
பிசண்டிலன்	p i s a ɳ ɖ i l̪ a n	0
பிசனம்	p i s a n a m	0
பிசம்	p i s a m	0
பிசறுதல்	p i s a r u d̪ a l̪	0
பிசாசக்கை	p i s aː s a kː a ɪ̯	0
பிசாசடித்தல்	p i s aː s a ɖ i t̪ː a l̪	0
பிசாசன்	p i s aː s a n	0
பிசாசர்	p i s aː s a ɾ̪	0
பிசாசாடுதல்	p i s aː s aː ɖ u d̪ a l̪	0
பிசாசுபிடித்தல்	p i s aː s u b i ɖ i t̪ː a l̪	0
பிசாத்து	p i s aː t̪ː u	0
பிசான்	p i s aː n	0
பிசி	p i s i	0
பிசிதாசனர்	p i s i d̪ aː s a n a ɾ̪	0
பிசினரக்கு	p i s i n a ɾ̪ a kː u	0
பிசினரிசி	p i s i n a ɾ̪ i s i	0
பிசினி	p i s i n i	0
பிசின்பட்டை	p i s i n p a ʈː a ɪ̯	0
பிசிர்தல்	p i s i ɾ̪ t̪ a l̪	0
பிசிறுலாடு	p i s i r u l̪ aː ɖ u	0
பிசுகுதல்	p i s u ɡ u d̪ a l̪	0
பிசுக்கோத்து	p i s u kː oː t̪ː u	0
பிசுனம்	p i s u n a m	0
பிசுபிசுத்தவன்	p i s u b i s u t̪ː a ʋ a n	0
பிசுபிசெனல்	p i s u b i s e n a l̪	0
பிசுமந்தச்சூரணம்	p i s u m a n̪ d̪ a t͡ʃː uː ɾ̪ a ɳ a m	0
பிச்சு	p i t͡ʃː u	0
பிச்சுப்பை	p i t͡ʃː u pː a ɪ̯	0
பித்தப்பை	p i t̪ː a pː a ɪ̯	0
பித்தம்	p i t̪ː a m	0
பின்	p i n	0
பின்மொழிநிலையல்	p i n m o ɻ i n̪ i l̪ a ɪ̯ j a l̪	0
பிரபஞ்சம்	p i ɾ̪ a b a ɲ d͡ʑ a m	0
பிரபந்தம்	p i ɾ̪ a b a n̪ d̪ a m	0
பிரமாதமான	p i ɾ̪ a m aː d̪ a m aː n a	0
பிராயம்	p i ɾ̪ aː j a m	0
பிறப்பு	p i r a pː u	0
பிறப்புவழி	p i r a pː u ʋ a ɻ i	0
பிறவி	p i r a ʋ i	0
பிறவிக்கடல்	p i r a ʋ i kː a ɖ a l̪	0
பிறவிக்குணம்	p i r a ʋ i kː u ɳ a m	0
பிறவிக்குருடன்	p i r a ʋ i kː u ɾ̪ u ɖ a n	0
பிறவிப்பயன்	p i r a ʋ i pː a j a n	0
பிறிதின்கிழமை	p i r i d̪ i n k i ɻ a m a ɪ̯	0
பிறிதுசாபம்	p i r i d̪ u s aː b a m	0
பிற்பகல்	p i r p a ɡ a l̪	0
பிற்பக்கம்	p i r p a kː a m	0
பிற்பாடர்	p i r p aː ɖ a ɾ̪	0
பீட்ரூட்	p iː ʈ ɾ̪ uː ʈ	0
பீர்க்கங்காய்	p iː ɾ̪ kː a ŋ ɡ aː j	0
பீர்க்கம்	p iː ɾ̪ kː a m	0
புகை	p u ɡ a ɪ̯	0
புடவை	p u ɖ a ʋ a ɪ̯	0
புட்டி	p u ʈː i	0
புட்பம்	p u ʈ p a m	0
புட்பாகம்	p u ʈ p aː ɡ a m	0
புணர்ச்சி	p u ɳ a ɾ̪ t͡ʃː i	0
புண்டை	p u ɳ ɖ a ɪ̯	0
புதன்	p u d̪ a n	0
புதிய	p u d̪ i j a	0
புது	p u d̪ u	0
புதுச்சேரி	p u d̪ u t͡ʃː eː ɾ̪ i	0
புதுமை	p u d̪ u m a ɪ̯	0
புத்தகம்	p u t̪ː a ɡ a m	0
புத்தன்	p u t̪ː a n	0
புயல்	p u j a l̪	0
புரியாத்தியா	p u ɾ̪ i j aː t̪ː i j aː	0
புருவம்	p u ɾ̪ u ʋ a m	0
புறம்	p u r a m	0
புறவு	p u r a ʋ u	0
புறா	p u r aː	0
புற்றுநோய்	p u ʈː ɾ u n̪ oː j	0
புலவர்	p u l̪ a ʋ a ɾ̪	0
புலி	p u l̪ i	0
புளி	p u ɭ i	0
புள்ளி	p u ɭː i	0
புஸ்தகம்	p u s t̪ a ɡ a m	0
பூ	p uː	0
பூச்சி	p uː t͡ʃː i	0
பூண்டு	p uː ɳ ɖ u	0
பூனை	p uː n a ɪ̯	0
பூமி	p uː m i	0
பெட்டி	p e ʈː i	0
பெண்	p e ɳ	0
பெண்கரு	p e ɳ k a ɾ̪ u	0
பெண்குறி	p e ɳ k u r i	0
பெண்சனம்	p e ɳ t͡ʃ a n a m	0
பெண்டாட்டி	p e ɳ ɖ aː ʈː i	0
பெண்பால்	p e ɳ p aː l̪	0
பெயர்	p e j a ɾ̪	0
பெயர்க்கு	p e j a ɾ̪ kː u	0
பெயர்ச்சி	p e j a ɾ̪ t͡ʃː i	0
பெயர்த்திரிசொல்	p e j a ɾ̪ t̪ː i ɾ̪ i s o l̪	0
பெயர்த்துரை	p e j a ɾ̪ t̪ː u ɾ̪ a ɪ̯	0
பெயர்புறம்	p e j a ɾ̪ p u r a m	0
பெயர்ப்படு	p e j a ɾ̪ pː a ɖ u	0
பெயர்ப்பு	p e j a ɾ̪ pː u	0
பெயர்வழி	p e j a ɾ̪ ʋ a ɻ i	0
பெயர்வேற்றுமை	p e j a ɾ̪ ʋ eː ʈː ɾ u m a ɪ̯	0
பெரிய	p e ɾ̪ i j a	0
பெருக்கல்	p e ɾ̪ u kː a l̪	0
பெருக்கல்வாய்பாடு	p e ɾ̪ u kː a l̪ ʋ aː j p aː ɖ u	0
பெருங்காயம்	p e ɾ̪ u ŋ ɡ aː j a m	0
பெர்லின்	p e ɾ̪ l̪ i n	0
பெளதிகம்	p e ɭ a d̪ i ɡ a m	0
பேசு	p eː s u	0
பேச்சாளர்	p eː t͡ʃː aː ɭ a ɾ̪	0
பேச்சு	p eː t͡ʃː u	0
பேச்சுவார்த்தை	p eː t͡ʃː u ʋ aː ɾ̪ t̪ː a ɪ̯	0
பேதிமருந்து	p eː d̪ i m a ɾ̪ u n̪ d̪ u	0
பேனா	p eː n aː	0
பேராசிரியர்	p eː ɾ̪ aː s i ɾ̪ i j a ɾ̪	0
பை	p a ɪ̯	0
பைவன்	p a ɪ̯ ʋ a n	0
பொன்	p o n	0
பொம்மை	p o mː a ɪ̯	0
பொருள்	p o ɾ̪ u ɭ	0
பொழில்	p o ɻ i l̪	0
போ	p oː	0
போதை	p oː d̪ a ɪ̯	0
போதைப்பொருள்	p oː d̪ a ɪ̯ pː o ɾ̪ u ɭ	0
போதைமருந்து	p oː d̪ a ɪ̯ m a ɾ̪ u n̪ d̪ u	0
போன்றீயம்	p oː n r iː j a m	0
போராட்டம்	p oː ɾ̪ aː ʈː a m	0
போர்	p oː ɾ̪	0
போலிஷ்	p oː l̪ i ʂ	0
மக	m a ɡ a	45
மகன்	m a ɡ a n	0
மகள்	m a ɡ a ɭ	0
மகிமை	m a ɡ i m a ɪ̯	0
மகிழம்	m a ɡ i ɻ a m	0
மகிழ்	m a ɡ i ɻ	0
மகிழ்ச்சி	m a ɡ i ɻ t͡ʃː i	0
மக்களாட்சி	m a kː a ɭ aː ʈ t͡ʃ i	0
மங்குசுத்தான்	m a ŋ ɡ u s u t̪ː aː n	0
மஞ்சன்	m a ɲ d͡ʑ a n	0
மஞ்சள்	m a ɲ d͡ʑ a ɭ	0
மஞ்ஞை	m a ɲː a ɪ̯	0
மணல்	m a ɳ a l̪	0
மணி	m a ɳ i	0
மணிக்கட்டு	m a ɳ i kː a ʈː u	0
மண்	m a ɳ	0
மண்டலம்	m a ɳ ɖ a l̪ a m	0
மண்வளம்	m a ɳ ʋ a ɭ a m	0
மதம்	m a d̪ a m	0
மதறாஸ்	m a d̪ a r aː s	0
மதியம்	m a d̪ i j a m	0
மதிராஸ்	m a d̪ i ɾ̪ aː s	0
மத்ரித்	m a t̪ ɾ̪ i t̪	0
மந்திரி	m a n̪ d̪ i ɾ̪ i	0
மனசு	m a n a s u	0
மனம்	m a n a m	0
மனிதன்	m a n i d̪ a n	0
மனிதவளம்	m a n i d̪ a ʋ a ɭ a m	0
மனிதவியல்	m a n i d̪ a ʋ i j a l̪	0
மனைவி	m a n a ɪ̯ ʋ i	0
மயிர்	m a j i ɾ̪	0
மயில்	m a j i l̪	0
மரம்	m a ɾ̪ a m	0
மருட்டுதல்	m a ɾ̪ u ʈː u d̪ a l̪	0
மருத்துவம்	m a ɾ̪ u t̪ː u ʋ a m	0
மருத்துவர்	m a ɾ̪ u t̪ː u ʋ a ɾ̪	0
மருந்தகம்	m a ɾ̪ u n̪ d̪ a ɡ a m	0
மருந்து	m a ɾ̪ u n̪ d̪ u	0
மருந்துக்கடை	m a ɾ̪ u n̪ d̪ u kː a ɖ a ɪ̯	0
மர்தோவியா	m a ɾ̪ t̪ oː ʋ i j aː	0
மலச்சிக்கல்	m a l̪ a t͡ʃː i kː a l̪	0
மலம்	m a l̪ a m	0
மலர்க்கடை	m a l̪ a ɾ̪ kː a ɖ a ɪ̯	0
மலேசியா	m a l̪ eː s i j aː	0
மலை	m a l̪ a ɪ̯	0
மழை	m a ɻ a ɪ̯	0
மழைநீர்	m a ɻ a ɪ̯ n̪ iː ɾ̪	0
மாங்காய்	m aː ŋ ɡ aː j	0
மாங்கிஸ்	m aː ŋ ɡ i s	0
மாணாக்கி	m aː ɳ aː kː i	0
மாண்	m aː ɳ	0
மாண்பு	m aː ɳ p u	0
மாதம்	m aː d̪ a m	0
மாதிரி	m aː d̪ i ɾ̪ i	0
மான்	m aː n	0
மாமிசம்	m aː m i s a m	0
மாமியார்	m aː m i j aː ɾ̪	0
மாம்பழம்	m aː m b a ɻ a m	0
மாரிகாலம்	m aː ɾ̪ i ɡ aː l̪ a m	0
மார்பகம்	m aː ɾ̪ p a ɡ a m	0
மாற்றுமருந்து	m aː ʈː ɾ u m a ɾ̪ u n̪ d̪ u	0
மாலை	m aː l̪ a ɪ̯	0
மாவு	m aː ʋ u	0
மிகவும்	m i ɡ a ʋ u m	0
மிகுதல்	m i ɡ u d̪ a l̪	0
மிருகம்	m i ɾ̪ u ɡ a m	0
மிருதங்கம்	m i ɾ̪ u d̪ a ŋ ɡ a m	0
மிளகாய்	m i ɭ a ɡ aː j	0
மிளகு	m i ɭ a ɡ u	0
மீன்	m iː n	0
முகக்குறி	m u ɡ a kː u r i	0
முகம்	m u ɡ a m	0
முகை	m u ɡ a ɪ̯	0
முச்சம்	m u t͡ʃː a m	0
முடி	m u ɖ i	0
முடியாட்சி	m u ɖ i j aː ʈ t͡ʃ i	0
முட்டாள்	m u ʈː aː ɭ	0
முட்டை	m u ʈː a ɪ̯	0
முதலை	m u d̪ a l̪ a ɪ̯	0
முதுமை	m u d̪ u m a ɪ̯	0
முன்	m u n	0
முன்னொட்டு	m u nː o ʈː u	0
மும்பை	m u m b a ɪ̯	0
முயல்	m u j a l̪	0
முரசு	m u ɾ̪ a s u	0
முருங்கை	m u ɾ̪ u ŋ ɡ a ɪ̯	0
முறுக்கு	m u r u kː u	0
முற்றிலும்	m u ʈː ɾ i l̪ u m	0
முலை	m u l̪ a ɪ̯	0
முலையூட்டி	m u l̪ a ɪ̯ j uː ʈː i	0
முளைக்கீரை	m u ɭ a ɪ̯ kː iː ɾ̪ a ɪ̯	0
முள்நாறிப்	m u ɭ n̪ aː r i p	0
முள்ளங்கி	m u ɭː a ŋ ɡ i	0
முழங்கால்	m u ɻ a ŋ ɡ aː l̪	0
முஸ்லிம்	m u s l̪ i m	0
முஸ்லீம்	m u s l̪ iː m	0
மூக்கண்ணாடி	m uː kː a ɳː aː ɖ i	0
மூக்கன்	m uː kː a n	0
மூக்கு	m uː kː u	0
மூங்கில்	m uː ŋ ɡ i l̪	0
மூதாய்	m uː d̪ aː j	0
மூது	m uː d̪ u	0
மூன்று	m uː n r u	0
மூலம்	m uː l̪ a m	0
மூளை	m uː ɭ a ɪ̯	0
மெட்ராஸ்	m e ʈ ɾ̪ aː s	0
மென்தங்கம்	m e n t̪ a ŋ ɡ a m	0
மென்பொருள்	m e n p o ɾ̪ u ɭ	0
மென்மை	m e n m a ɪ̯	0
மென்வெள்ளி	m e n ʋ e ɭː i	0
மெய்	m e j	0
மெய்யியல்	m e jː i j a l̪	0
மெய்யெழுத்து	m e jː e ɻ u t̪ː u	0
மெல்	m e l̪	0
மெல்லினம்	m e l̪ː i n a m	0
மெல்லிய	m e l̪ː i j a	0
மேகம்	m eː ɡ a m	0
மேசை	m eː s a ɪ̯	0
மேஜை	m eː d͡ʑ a ɪ̯	0
மேற்கு	m eː r k u	0
மேலும்	m eː l̪ u m	0
மேல்	m eː l̪	0
மை	m a ɪ̯	0
மைதா	m a ɪ̯ t̪ aː	0
மொழி	m o ɻ i	0
மொழிபெயர்ப்பு	m o ɻ i b e j a ɾ̪ pː u	0
மொழியியல்	m o ɻ i j i j a l̪	0
மோசம்	m oː s a m	0
மோதிரம்	m oː d̪ i ɾ̪ a m	0
யமன்	j a m a n	0
யானை	j aː n a ɪ̯	0
யாமம்	j aː m a m	0
யார்	j aː ɾ̪	0
யுத்தம்	j u t̪ː a m	0
யோனி	j oː n i	0
ரகசியம்	ɾ̪ a ɡ a s i j a m	0
ரசம்	ɾ̪ a s a m	0
ரவை	ɾ̪ a ʋ a ɪ̯	0
ரஷ்யா	ɾ̪ a ʂ j aː	0
ருசரகம்	ɾ̪ u s a ɾ̪ a ɡ a m	0
ரூபாய்	ɾ̪ uː b aː j	0
ரொட்டி	ɾ̪ o ʈː i	0
ரோகம்	ɾ̪ oː ɡ a m	0
ரோம்	ɾ̪ oː m	0
லக்ஷம்	l̪ a k ʂ a m	0
லட்சம்	l̪ a ʈ t͡ʃ a m	0
லட்டு	l̪ a ʈː u	0
லாடம்	l̪ aː ɖ a m	0
லிஸ்பன்	l̪ i s p a n	0
லீக்டன்ஸ்டைன்	l̪ iː k ʈ a n s ʈ a ɪ̯ n	0
லுங்கி	l̪ u ŋ ɡ i	0
வகு	ʋ a ɡ u	0
வகுத்தல்	ʋ a ɡ u t̪ː a l̪	0
வகை	ʋ a ɡ a ɪ̯	0
வங்காளதேசம்	ʋ a ŋ ɡ aː ɭ a d̪ eː s a m	0
வங்காளம்	ʋ a ŋ ɡ aː ɭ a m	0
வடக்கு	ʋ a ɖ a kː u	0
வடிவியல்	ʋ a ɖ i ʋ i j a l̪	0
வடை	ʋ a ɖ a ɪ̯	0
வடைப்பருப்பு	ʋ a ɖ a ɪ̯ pː a ɾ̪ u pː u	0
வணக்கம்	ʋ a ɳ a kː a m	0
வண்ணத்துப்பூச்சி	ʋ a ɳː a t̪ː u pː uː t͡ʃː i	0
