a	aː
selotep	s ɛ l ɔ t ɛ p
senedd	s ɛ n ɛ ð
serch	s ɛ r χ
seren	s ɛ r ɛ n
sêr	s eː r
sesiwn	s ɛ ʃ ʊ n
sgandinafaidd	s ɡ a n d ɪ n a v a i̯ ð
sgandinafia	s ɡ a n d ɪ n a v j a
sgarff	s ɡ a r f
sgert	s ɡ ɛ r t
sgileffaith	s ɡ iː l ɛ f a i̯ θ
sgileffaith	s ɡ iː l ɛ f ɛ θ
sgil	s ɡ iː l
sgîl	s ɡ iː l
sgil	s ɡ ɪ l
sgìl	s ɡ ɪ l
sgiwen	s ɡ i u̯ ɛ n
sgôr	s ɡ oː r
sgrechian	s ɡ r ɛ χ j a n
sgrech	s ɡ r eː χ
sgwâr	s ɡ w aː r
sgwrsio	s ɡ ʊ r ʃ o
sgwrs	s ɡ ʊ r s
shibwns	ʃ ɪ b ʊ n s
shibwnsyn	ʃ ɪ b ʊ n s ɨ̞ n
siaced	ʃ a k a d
siaced	ʃ a k ɛ d
siafio	ʃ a v j ɔ
siân	ʃ aː n
siarad	ʃ a r a d
sidan	s ɪ d a n
sillafu	s ɪ ɬ a v ɨ
sillgoll	s ɪ ɬ ɡ ɔ ɬ
sil	s iː l
sinc	s ɪ ŋ k
siocledi	ʃ ɔ k l ɛ d i
siocled	ʃ ɔ k l a d
siocled	ʃ ɔ k l ɛ d
sioned	ʃ ɔ n ɛ d
siôn	ʃ oː n
siopa	ʃ ɔ p a
siop	ʃ ɔ p
si	s iː
siwan	ʃ ʊ a n
siwan	s ɪ u̯ a n
siwgr	ʃ ʊ ɡ r
siwgr	ʃ ʊ ɡ ʊ r
siwrnai	ʃ ʊ r n a
siwrnai	ʃ ʊ r n a i̯
siwrnai	ʃ ʊ r n ɛ
siwr	ʃ uː r
slej	s l ɛ d͡ʒ
smygu	s m ə ɡ ɨ
snwcer	s n ʊ k a r
snwcer	s n ʊ k ɛ r
sodlau	s ɔ d l a
sodlau	s ɔ d l a ɨ̯
sodlau	s ɔ d l ɛ
söolegwr	s ɔ ɔ l ɛ ɡ ʊ r
söolegwyr	s ɔ ɔ l ɛ ɡ w ɨ̞ r
söolegydd	s ɔ ɔ l ɛ ɡ ɨ̞ ð
sothach	s ɔ θ a χ
stafell	s d a v a ɬ
stafell	s d a v ɛ ɬ
stopiem	s d ɔ p j ɛ m
stopio	s d ɔ p j ɔ
stopi	s d ɔ p i
stori	s d ɔ r i
stryd	s d r ɨː d
stŵr	s d uː r
sut	s ɨ̞ d
sut	s ɨ̞ t
swllt	s uː ɬ t
swnllyd	s ʊ n ɬ ɨ̞ d
sŵn	s uː n
swnt	s ʊ n t
swper	s ʊ p a r
swper	s ʊ p ɛ r
swshi	s ʊ ʃ i
swshi	s uː ʃ i
sw	s uː
swyddogaeth	s ʊ ɨ̯ ð ɔ ɡ a ɨ̯ θ
swyddogaeth	s ʊ ɨ̯ ð ɔ ɡ ɛ θ
swydd	s uː ɨ̯ ð
swynol	s ʊ ɨ̯ n ɔ l
swyno	s ʊ ɨ̯ n ɔ
swyn	s uː ɨ̯ n
sychu	s ə χ ɨ
sylfaenol	s ə l v e ɨ̯ n ɔ l
sylfaen	s ə l v a ɨ̯ n
sylffwr	s ə l f ʊ r
sylwebu	s ə l w ɛ b ɨ
sylwi	s ə l w i
sylw	s ə l u
sylw	s ɪ l u
symudliw	s ə m ɨ̞ d l ɪ u̯
symudol	s ə m ɨ d ɔ l
synnwyr	s ə n w ɨ̞ r
syrthio	s ə r θ j ɔ
syth	s iː θ
syth	s ɨː θ
tachwedd	t a χ w ɛ ð
tad	t aː d
taen	t aː ɨ̯ n
taenu	t e ɨ̯ n ɨ
taeog	t e ɨ̯ ɔ ɡ
taeogtref	t e ɨ̯ ɔ ɡ t r ɛ v
taeru	t e ɨ̯ r ɨ
tafarn	t a v a r n
tafarnwr	t a v a r n ʊ r
taflod	t a v l ɔ d
tafod	t a v ɔ d
tafwys	t a v ʊ ɨ̯ s
tai	t a i̯
taith	t a i̯ θ
talaf	t a l a
talaf	t a l a v
talais	t a l ɪ ʃ
talais	t a l a i̯ s
talais	t a l ɛ ʃ
talais	t a l ɛ s
talai	t a l a i̯
talai	t a l ɛ
talan	t a l a n
talant	t a l a n t
tala	t a l a
talcen	t a l k a n
talcen	t a l k ɛ n
taleb	t a l ɛ b
taled	t a l ɛ d
talem	t a l ɛ m
talen	t a l ɛ n
talent	t a l ɛ n t
taler	t a l ɛ r
tales	t a l ɛ s
talet	t a l ɛ t
taliadau	t a l j a d a
taliadau	t a l j a d a ɨ̯
taliadau	t a l j a d ɛ
tali	t a l i
talit	t a l ɪ t
talom	t a l ɔ m
talon	t a l ɔ n
talo	t a l ɔ
tal	t a l
tal	t aː l
tâl	t aː l
talu	t a l ɨ
tân	t aː n
tanwydd	t a n w ɨ̞ ð
tâp	t aː p
tarianau	t a r j a n a
tarianau	t a r j a n a ɨ̯
tarianau	t a r j a n ɛ
tarian	t a r j a n
taro	t a r ɔ
tarw	t a r u
taten	t a t a n
taten	t a t ɛ n
tato	t a t ɔ
tatws	t a t ʊ s
tatŵs	t a t uː s
tatŵ	t a t uː
tawa	t a u̯ a
tawel	t a u̯ ɛ l
tawe	t a u̯ ɛ
tawn	t a u̯ n
taw	t a u̯
tebyg	t ɛ b ɪ ɡ
tebyg	t ɛ b ɨ̞ ɡ
teg	t eː ɡ
teigrod	t e i̯ ɡ r ɔ d
teigr	t e i̯ ɡ r
teimlad	t e i̯ m l a d
teimlo	t e i̯ m l ɔ
teipio	t e i̯ p j ɔ
teisennau	t e i̯ ʃ ɛ n a ɨ̯
teisennau	t e i̯ s ɛ n a
teisennau	t e i̯ s ɛ n a ɨ̯
teisennau	t e i̯ s ɛ n ɛ
teisennau	t ɪ ʃ ɛ n a
teisennau	t ɪ ʃ ɛ n ɛ
teisen	t ɪ ʃ a n
teisen	t e i̯ ʃ a n
teisen	t e i̯ ʃ ɛ n
teisen	t e i̯ s a n
teisen	t e i̯ s ɛ n
teisen	t ɪ ʃ ɛ n
tei	t e i̯
teithio	t e i̯ θ j ɔ
telais	t ɛ l a i̯ s
teledu	t ɛ l ɛ d ɨ
telid	t ɛ l ɪ d
telir	t ɛ l ɪ r
teli	t ɛ l i
telynores	t ɛ l ə n ɔ r a s
telynores	t ɛ l ə n ɔ r ɛ s
telynor	t ɛ l ə n ɔ r
telyn	t ɛ l ɨ n
tenau	t ɛ n a
tenau	t ɛ n a ɨ̯
tenau	t ɛ n ɛ
terfyniad	t ɛ r v ə n j a d
terfynol	t ɛ r v ə n ɔ l
terfyn	t ɛ r v ɨ n
terfynu	t ɛ r v ə n ɨ
terfysgwr	t ɛ r v ə s ɡ ʊ r
teulu	t e ɨ̯ l ɨ
tewach	t ɛ u̯ a χ
tewed	t ɛ u̯ ɛ d
tewi	t ɛ u̯ i
tew	t eː u̯
tewyn	t ɛ u̯ ɨ̞ n
teyrnaddoliant	t e ɨ̯ r n a ð ɔ l j a n t
teyrnas	t e ɨ̯ r n a s
teyrn	t e ɨ̯ r n
tgau	t ɡ a ɨ̯
thad	θ aː d
thalai	θ a l a i̯
thalai	θ a l ɛ
thala	θ a l a
thalcen	θ a l k a n
thalcen	θ a l k ɛ n
thaler	θ a l ɛ r
thaliadau	θ a l j a d a
thaliadau	θ a l j a d a ɨ̯
thaliadau	θ a l j a d ɛ
thali	θ a l i
thalo	θ a l ɔ
thal	θ a l
thâl	θ aː l
thân	θ aː n
tharianau	θ a r j a n a
tharianau	θ a r j a n a ɨ̯
tharianau	θ a r j a n ɛ
tharian	θ a r j a n
thaw	θ a u̯
theigrod	θ e i̯ ɡ r ɔ d
theigr	θ e i̯ ɡ r
thei	θ e i̯
thewed	θ ɛ u̯ ɛ d
thewi	θ ɛ u̯ i
thew	θ eː u̯
theyrnaddoliant	θ e ɨ̯ r n a ð ɔ l j a n t
thi	θ iː
thorrent	θ ɔ r ɛ n t
thorrid	θ ɔ r ɪ d
thor	θ ɔ r
thraed	θ r aː ɨ̯ d
thrawant	θ r a u̯ a n t
threfydd	θ r ɛ v ɨ̞ ð
thre	θ r eː
throed	θ r oː ɨ̯ d
throes	θ r oː ɨ̯ s
thrown	θ r o u̯ n
thro	θ r oː
thrwyddedau	θ r ʊ ɨ̯ ð ɛ d a
thrwyddedau	θ r ʊ ɨ̯ ð ɛ d a ɨ̯
thrwyddedau	θ r ʊ ɨ̯ ð ɛ d ɛ
thrwydded	θ r ʊ ɨ̯ ð a d
thrwydded	θ r ʊ ɨ̯ ð ɛ d
thud	θ ɨː d
thu	θ ɨː
thŵr	θ uː r
thyrrau	θ ə r a
thyrrau	θ ə r a ɨ
thyrrau	θ ə r ɛ
thŷ	θ ɨː
'th	θ
tir	t iː r
ti	t iː
titr	t ɪ t r
tiwb	t ɪ u̯ b
tlawd	t l a u̯ d
tlws	t l uː s
toddf	t ɔ ð v
toddyf	t ɔ ð ɨ̞ v
toes	t oː ɨ̯ s
toiled	t ɔ i̯ l a d
toiled	t ɔ i̯ l ɛ d
ton	t ɔ n
torheulo	t ɔ r h e ɨ̯ l ɔ
torrai	t ɔ r a i̯
torrai	t ɔ r ɛ
torran	t ɔ r a n
torra	t ɔ r a
torrem	t ɔ r ɛ m
torren	t ɔ r ɛ n
torrent	t ɔ r ɛ n t
torres	t ɔ r ɛ s
torret	t ɔ r ɛ t
torrid	t ɔ r ɪ d
torri	t ɔ r i
torro	t ɔ r ɔ
torsen	t ɔ r s ɛ n
torth	t ɔ r θ
tor	t ɔ r
to	t oː
traddodiadol	t r a ð ɔ d j a d ɔ l
traddodiad	t r a ð ɔ d j a d
tradwy	t r a d ʊ ɨ̯
traed	t r aː ɨ̯ d
traeth	t r aː ɨ̯ θ
trafod	t r a v ɔ d
trais	t r a i̯ s
tra	t r aː
trawant	t r a u̯ a n t
trawsenw	t r a u̯ s ɛ n u
trefgordd	t r ɛ v ɡ ɔ r ð
trefi	t r ɛ v i
trefor	t r ɛ v ɔ r
trefydd	t r ɛ v ɨ̞ ð
trefynwy	t r ɛ v ə n ʊ ɨ̯
treigladau	t r e i ɡ l a d a
treigladau	t r e i ɡ l a d a ɨ̯
treigladau	t r e i ɡ l a d ɛ
treigladau	t r e i ɡ l j a d a
treigladau	t r e i ɡ l j a d ɛ
treiglad	t r e i̯ ɡ l a d
treiglad	t r e i̯ ɡ l j a d
treisiol	t r e i̯ ʃ ɔ l
treisio	t r e i̯ ʃ ɔ
treisiwr	t r e i̯ ʃ ʊ r
trenau	t r ɛ n a
trenau	t r ɛ n a ɨ̯
trenau	t r ɛ n ɛ
trên	t r eː n
tre	t r eː
trigeiniau	t r ɪ ɡ e i̯ n j a
trigeiniau	t r ɪ ɡ e i̯ n j a ɨ̯
trigeiniau	t r ɪ ɡ e i̯ n j ɛ
trin	t r iː n
trist	t r iː s t
tri	t r iː
troan	t r ɔ a n
troa	t r ɔ a
trodd	t r oː ð
troed	t r oː ɨ̯ d
troen	t r oː ɨ̯ n
troer	t r oː ɨ̯ r
troes	t r oː ɨ̯ s
troet	t r oː ɨ̯ t
trof	t r oː v
troid	t r ɔ i̯ d
trois	t r ɔ i̯ ʃ
trois	t r ɔ i̯ s
troi	t r ɔ i̯
trôi	t r oː i̯
trolïau	t r ɔ l ɪ a
trolïau	t r ɔ l ɪ a ɨ̯
trolïau	t r ɔ l ɪ ɛ
troli	t r ɔ l i
trom	t r ɔ m
troseddu	t r ɔ s ɛ ð ɨ
tros	t r ɔ s
tro	t r oː
trown	t r o u̯ n
trueni	t r ɪ ɛ n ɨ
trwchus	t r ʊ χ ɨ̞ s
trwm	t r ʊ m
trwsgl	t r ʊ s ɡ l
trwyddedau	t r ʊ ɨ̯ ð ɛ d a
trwyddedau	t r ʊ ɨ̯ ð ɛ d a ɨ̯
trwyddedau	t r ʊ ɨ̯ ð ɛ d ɛ
trwydded	t r ʊ ɨ̯ ð a d
trwydded	t r ʊ ɨ̯ ð ɛ d
trwynol	t r ʊ ɨ̯ n ɔ l
trwyn	t r uː ɨ̯ n
trwyth	t r uː ɨ̯ θ
trwy	t r uː ɨ̯
trybedd	t r ə b ɛ ð
trydan	t r ə d a n
trydanwr	t r ə d a n ʊ r
trydedd	t r ɪ d ɛ ð
trydedd	t r ə d a ð
trydedd	t r ə d ɛ ð
trydydd	t r ə d ɨ̞ ð
try	t r ɨː
tsimpansî	t ʃ ɪ m p a n s iː
tudalen	t ɨ̞ d a l a n
tudalen	t ɨ̞ d a l ɛ n
tud	t ɨː d
turtur	t ɨ̞ r t ɨ̞ r
twf	t uː v
twll	t ʊ ɬ
twmffat	t ʊ m f a t
twndish	t ʊ n d ɪ ʃ
twp	t ʊ p
twrch	t ʊ r χ
twrci	t ʊ r k i
twrf	t ʊ r v
twr	t ʊ r
tŵr	t uː r
twymynau	t ʊ ɨ̯ m ə n a ɨ̯
twymyn	t ʊ ɨ̯ m ɨ̞ n
tybaco	t ə b a k ɔ
tybio	t ə b j ɔ
tybiwyd	t ə b j ʊ ɨ̯ d
tydy	t ə d i
tyfu	t ə v ɨ
tylluan	t ə ɬ ɨ̞ a n
tymor	t ə m ɔ r
tyndra	t ə n d r a
tynnu	t ə n ɨ
tyred	t ə r ɛ d
tyrrau	t ə r a
tyrrau	t ə r a ɨ
tyrrau	t ə r ɛ
tyrru	t ə r ɨ
tyr	t ɨ̞ r
tyst	t ɨː s d
tŷ	t ɨː
tywydd	t ə u̯ ɨ̞ ð
tywyll	t ə u̯ ɨ̞ ɬ
uchel	ə χ a l
uchel	ə χ ɛ l
uchelwr	ɨ̞ χ ɛ l ʊ r
uchelwydd	ɨ̞ χ ɛ l w ɨ̞ ð
uchel	ɨ̞ χ ɛ l
ufelai	ɨ̞ v ɛ l a i̯
ugain	ɪ ɡ a i̯ n
ugain	ɪ ɡ j a n
ugeiniau	ɪ ɡ e i̯ n j a
ugeiniau	ɪ ɡ e i̯ n j a ɨ̯
ugeiniau	ɪ ɡ e i̯ n j ɛ
ulai	ɨ̞ l a i̯
ulyfai	ɨ̞ l ə v a i̯
unai	ɨ̞ n a i̯
unais	ɨ̞ n ɪ ʃ
unais	ɨ̞ n a i̯ s
unais	ɨ̞ n ɛ ʃ
unais	ɨ̞ n ɛ s
una	ɨ̞ n a
unan	ɨ̞ n a n
undeg	ɨ̞ n d ɛ ɡ
unem	ɨ̞ n ɛ m
unen	ɨ̞ n ɛ n
unes	ɨ̞ n ɛ s
unet	ɨ̞ n ɛ t
uniawn	ɨ̞ n j a u̯ n
unid	ɨ̞ n ɪ d
uni	ɨ̞ n i
unioni	ɨ̞ n j ɔ n i
unir	ɨ̞ n ɪ r
unit	ɨ̞ n ɪ t
unllygeidiog	ɨː n ɬ ə ɡ e i̯ d j ɔ ɡ
un	ɨː n
uno	ɨ̞ n ɔ
unrhyw	ɨ̞ n r̥ ɨ̞ u̯
unset	ɨ̞ n s ɛ t
unwaith	ɨ̞ n w a i̯ θ
unwaith	ɨ̞ n w ɛ θ
urddau	ɨ̞ r ð a
urddau	ɨ̞ r ð a ɨ̯
urddau	ɨ̞ r ð ɛ
urdd	ɨ̞ r ð
utganaf	ɨ̞ t ɡ a n a v
utganu	ɨ̞ t ɡ a n ɨ
utgorn	ɨ̞ t ɡ ɔ r n
utgyrn	ɨ̞ t ɡ ɨ̞ r n
uwchben	ɨ̞ u̯ χ b ɛ n
uwd	ɨ̞ u̯ d
w	ʊ
wahanol	w a h a n ɔ l
wain	w a i̯ n
wair	w a i̯ r
wario	w a r j ɔ
wddf	ʊ ð u
wddf	ʊ ð v
wddf	ʊ ð ʊ v
weddïo	w ɛ ð ɪ ɔ
weddi	w ɛ ð i
wedi	w ɛ d i
weithiau	w e i̯ θ j a
weithiau	w e i̯ θ j a ɨ̯
weithiau	w e i̯ θ j ɛ
weld	w ɛ l d
weled	w ɛ l ɛ d
wele	w ɛ l ɛ
wella	w ɛ ɬ a
well	w ɛ ɬ
wel	w ɛ l
wennol	w ɛ n ɔ l
wenoliaid	w ɛ n ɔ l j a i̯ d
wenoliaid	w ɛ n ɔ l j ɛ d
wfft	ʊ f d
wiciadur	w ɪ k j a d ɨ̞ r
winoedd	w ɪ n ɔ ɨ̯ ð
win	w iː n
wiwerod	w ɪ u̯ ɛ r ɔ d
wiwer	w ɪ u̯ a r
wiwer	w ɪ u̯ ɛ r
wlad	w l aː d
wledydd	w l ɛ d ɨ̞ ð
wng	ʊ ŋ
wnsach	ʊ n s a χ
woc	w ɔ k
wrth	ʊ r θ
ŵr	uː r
w	w
wyau	ʊ ɨ̯ a ɨ̯
wyau	ʊ i̯ a
wyau	ʊ i̯ ɛ
wybodaeth	w ɨ̞ b ɔ d a ɨ̯ θ
wybodaeth	w ɨ̞ b ɔ d ɛ θ
wybodaeth	w ə b ɔ d a ɨ̯ θ
wybodaeth	w ə b ɔ d ɛ θ
wybod	ʊ b ɔ d
wybod	w ɨ̞ b ɔ d
wybr	ʊ ɨ̯ b r
wychach	w ə χ a χ
wyched	w ə χ ɛ d
wych	w ɨː χ
wyddion	w ə ð j ɔ n
ŵydd	uː ɨ̯ ð
wŷdd	w ɨː ð
wyf	uː ɨ̯ v
ŵyll	uː ɨ̯ ɬ
wyll	w ɨ̞ ɬ
wylo	ʊ ɨ̯ l ɔ
ŵyl	uː ɨ̯ l
wyneb	w ɨ̯ n a b
wyneb	w ɨ̯ n ɛ b
wyn	w ɨ̞ n
wŷn	w ɨː n
wyres	ʊ ɨ̯ r a s
wyres	ʊ ɨ̯ r ɛ s
ŵyr	uː ɨ̯ r
wŷr	w ɨː r
wysg	uː ɨ̯ s ɡ
wystl	w ɨ̞ s d l
wys	w ɨː s
wythfed	ʊ ɨ̯ θ v a d
wythfed	ʊ ɨ̯ θ v ɛ d
wythnos	ʊ s n ɔ s
wythnos	ʊ s ɔ s
wythnos	ʊ ɨ̯ θ n ɔ s
wythnos	ʊ θ n ɔ s
wyt	uː t
wyt	uː ɨ̯ t
wy	uː ɨ̯
ychen	ə χ ɛ n
ychwanegiad	ə χ w a n ɛ ɡ j a d
ychwanegu	ə χ w a n ɛ ɡ ɨ
ychydig	ə χ ə d ɨ̞ ɡ
ychydig	χ ə d ɨ̞ ɡ
ych	ɨː χ
ydfran	ə d v r a n
ydw	ə d u
ydw	ə n d u
ydw	n d u
ydy	ə d i
ydy	ə n d i
ydy	n d i
'y	ə
y	ə
yfed	ə v a d
yfed	ə v ɛ d
yfory	ə v ɔ r ɨ
yfory	v ɔ r ɨ
yf	ɨː v
yma	ə m a
ymarfer	ə m a r v a r
ymarfer	ə m a r v ɛ r
ymasiad	ə m a ʃ a d
ymddiddan	ə m ð ɪ ð a n
ymddwyn	ə m ð ʊ ɨ̯ n
ymdeimlad	ə m d e i̯ m l a d
ymenyn	ə m ɛ n ɨ̞ n
ymherodr	ə m h ɛ r ɔ d r
ymhlith	ə m h l iː θ
ymlacio	ə m l a k j ɔ
ymuno	ə m ɨ̞ n ɔ
ymweld	ə m w ɛ l d
ymwelwr	ə m w ɛ l ʊ r
ymyl	ə m ɨ̞ l
yna	ə n a
yn	ə n
yng	ə ŋ
ynn	ɨ̞ n
yr	ə r
ysaf	ə s a v
ysboncio	ə s b ɔ ŋ k j ɔ
ysbryd	ə s b r ɪ d
ysbryd	ə s b r ɨ̞ d
ysbrydol	ə s b r ə d ɔ l
ysbrydoli	ə s b r ə d ɔ l i
ysbyty	ə s b ə t ɨ
ysgawen	ə s ɡ a u̯ a n
ysgawen	ə s ɡ a u̯ ɛ n
ysgaw	ə s ɡ a u̯
ysglodyn	ə s ɡ l ɔ d ɨ̞ n
ysglodyn	s ɡ l ɔ d ɨ̞ n
ysgrifen	ə s ɡ r ɪ v ɛ n
ysgrifennu	ə s ɡ r ɪ v ɛ n ɨ
ysgrifennu	s ɡ r ɪ v ɛ n ɨ
ysgrifennu	s ɡ w ɛ n ɨ
ysgrifen	s ɡ r ɪ v a n
ysgrifen	s ɡ r ɪ v ɛ n
ysgubor	ə s ɡ ɨ̞ b ɔ r
ysguthan	ə s ɡ ɨ̞ θ a n
ysguthan	s ɡ ɨ̞ θ a n
ysmygu	ə s m ə ɡ ɨ
ystad	ə s d a d
ystafell	ə s d a v ɛ ɬ
ystafell	s d a v a ɬ
ystafell	s d a v ɛ ɬ
ystifflog	ə s d ɪ f l ɔ ɡ
ystradwel	ə s d r a d w ɛ l
ystyr	ə s d ɨ̞ r
ystyried	ə s d ə r j ɛ d
ysu	ə s ɨ
ywen	ə u̯ ɛ n
ywen	ɪ u̯ ɛ n
ywen	ɨ̞ u̯ ɛ n
yw	ɪ u̯
yw	ɨ̞ u̯
