a	aː
cyfrif	k ə v r ɪ
cyfrif	k ə v r ɪ v
cyfrifol	k ə v r ɪ v ɔ l
cyfrifon	k ə v r ɪ v ɔ n
cyfrifwr	k ə v r ɪ v ʊ r
cyfrifydd	k ə v r ɪ v ɨ̞ ð
cyfrinach	k ə v r ɪ n a χ
cyfrin	k ə v r ɪ n
cyfrol	k ə v r ɔ l
cyfrwngddarostyngedigaeth	k ə v r ʊ ŋ ð a r ɔ s d ə ŋ ɛ d ɪ ɡ a ɨ̯ θ
cyfrwngddarostyngedigaeth	k ə v r ʊ ŋ ð a r ɔ s d ə ŋ ɛ d ɪ ɡ ɛ θ
cyfrwy	k ə v r ʊ ɨ̯
cyfrwyo	k ə v r ʊ ɨ̯ ɔ
cyfyng	k ə v ɨ̞ ŋ
cyhyd	k ə h ɨː d
cyhydnos	k ə h ə d n ɔ s
cyhyr	k ə h ɨ̞ r
cyhyrog	k ə h ə r ɔ ɡ
cylchgrawn	k ə l χ ɡ r a u̯ n
cylchgrawn	k ɨ̞ l χ ɡ r a u̯ n
cylchu	k ə l χ ɨ
cylion	k ə l j ɔ n
cyllell	k ə ɬ a ɬ
cyllell	k ə ɬ ɛ ɬ
cyll	k ɨ̞ ɬ
cymaint	k ə m a i̯ n t
cymaint	k ə m ɛ n t
cymal	k ə m a l
cymharu	k ə m h a r ɨ
cymorthion	k ə m ɔ r θ j ɔ n
cymorth	k ə m ɔ r θ
cymraeg	k ə m r aː ɡ
cymraeg	k ə m r a i̯ ɡ
cymraeg	k ʊ m r aː ɡ
cymraesau	k ə m r e ɨ̯ s a
cymraesau	k ə m r e ɨ̯ s a ɨ̯
cymraesau	k ə m r e ɨ̯ s ɛ
cymraes	k ə m r aː ɨ̯ s
cymreig	k ə m r e i̯ ɡ
cymro	k ə m r ɔ
cymru	k ə m r ɨ̞
cymryd	k ə m r ɨ̞ d
cymry	k ə m r ɨ̞
cymylau	k ə m ə l a
cymylau	k ə m ə l a ɨ̯
cymylau	k ə m ə l ɛ
cymysgedd	k ə m ə s ɡ ɛ ð
cynaeafu	k ə n e ɨ̯ a v ɨ
cynaeafu	k n e ɨ̯ a v ɨ
cynaniad	k ə n a n j a d
cynddrwg	k ə n ð r ʊ ɡ
cynffon	k ə n f ɔ n
cyngerdd	k ə ŋ ɛ r ð
cynghori	k ə ŋ h ɔ r i
cynghrair	k ə ŋ r̥ a i̯ r
cynghrair	k ə ŋ r̥ ɛ r
cyngor	k ə ŋ ɔ r
cyn‌gyd	k ə ŋ ɡ ɨ̞ d
cyn‌gyd	k ə ŋ ɨ̞ d
cyngyd	k ə ŋ ɡ ɨ̞ d
cyngyd	k ə ŋ ɨ̞ d
cynhadledd	k ə n h a d l ɛ ð
cynhaeaf	k ə n h a ɨ̯ a v
cynhorthwy	k ə n h ɔ r θ ʊ ɨ̯
cynhyrchu	k ə n h ə r χ ɨ
cyn	k ɨ n
cŷn	k ɨː n
cynnau	k ə n a
cynnau	k ə n a ɨ̯
cynnau	k ə n ɛ
cynnig	k ə n ɪ ɡ
cynnud	k ə n ɨ̞ d
cynnull	k ə n ɪ ɬ
cynnwrf	k ə n ʊ r ə v
cynnwys	k ə n ʊ ɨ̯ s
cynnydd	k ə n ɨ̞ ð
cynnyrch	k ə n ɨ̞ r χ
cyntaf	k ə n t a
cyntaf	k ə n t a v
cyntedd	k ə n t ɛ ð
cyntefin	k ə n t ɛ v ɪ n
cynyddu	k ə n ə ð ɨ
cyrchu	k ə r χ ɨ
cyrraedd	k ə r a ð
cyrraedd	k ə r a ɨ̯ ð
cyrraedd	k ə r ɛ ð
cyrsiau	k ə r ʃ a
cyrsiau	k ə r ʃ a ɨ̯
cyrsiau	k ə r ʃ ɛ
cysgu	k ə s ɡ ɨ
cyswllt	k ə s ʊ ɬ d
cysylltair	k ə s ə ɬ d a i̯ r
cysylltiad	k ə s ə ɬ d j a d
cysylltnod	k ə s ə ɬ d n ɔ d
cysylltu	k ə s ə ɬ d ɨ
cythraul	k ə θ r a l
cythraul	k ə θ r a ɨ̯ l
cythraul	k ə θ r ɛ l
cythreuliaid	k ə θ r e ɨ̯ l j a i̯ d
cythreuliaid	k ə θ r e ɨ̯ l j ɛ d
cywir	k ə u̯ ɪ r
cywyddau	k ə w ə ð a
cywyddau	k ə w ə ð a ɨ̯
cywyddau	k ə w ə ð ɛ
da	d aː
dad	d aː d
dadiol	d a d j ɔ l
dadlau	d a d l a
dadlau	d a d l a ɨ̯
dadlau	d a d l ɛ
dadl	d a d l
dadleuol	d a d l e ɨ̯ ɔ l
dadleuon	d a d l e ɨ̯ ɔ n
dadwisgo	d a d w ɪ s ɡ ɔ
dadwreiddio	d a d ʊ r ɛ ɨ̞̯ ð j ɔ
daear	d e ɨ̯ a r
daearfoch	d e ɨ̯ a r v ɔ χ
dafydd	d a v ɨ̞ ð
dail	d a i̯ l
daioni	d a j ɔ n i
dala	d a l a
dalan	d a l a n
dalcen	d a l k a n
dalcen	d a l k ɛ n
dal	d a l
dâl	d aː l
daled	d a l ɛ d
dalen	d a l ɛ n
daler	d a l ɛ r
dales	d a l ɛ s
dalet	d a l ɛ t
dalfa	d a l v a
dalia	d a l j a
daliadau	d a l j a d a
daliadau	d a l j a d a ɨ̯
daliadau	d a l j a d ɛ
daliaf	d a l j a v
dali	d a l i
dalit	d a l ɪ t
dalo	d a l ɔ
dalom	d a l ɔ m
dalu	d a l ɨ̞
dan	d a n
dân	d aː n
danfon	d a n v ɔ n
dangos	d a ŋ ɔ s
dannoedd	d a n ɔ ɨ̯ ð
dant	d a n t
dâr	d aː r
darianau	d a r j a n a
darianau	d a r j a n a ɨ̯
darianau	d a r j a n ɛ
darian	d a r j a n
darllen	d a r ɬ a n
darllen	d a r ɬ ɛ n
darlunio	d a r l ɨ̞ n j ɔ
darpar	d a r p a r
darparu	d a r p a r ɨ
datblygiad	d a t b l ə ɡ j a d
dathlu	d a θ l ɨ
datys	d a t ɨ̞ s
dau	d a ɨ̯
daw	d a u̯
dawn	d a u̯ n
dawnsio	d a u̯ n ʃ ɔ
ddafydd	ð a v ɨ̞ ð
ddail	ð a i̯ l
ddant	ð a n t
ddarllen	ð a r ɬ a n
ddarllen	ð a r ɬ ɛ n
ddaru	ð a r ɨ̞
ddathlu	ð a θ l ɨ
dde	ð eː
ddegfed	ð ɛ ɡ v a d
ddegfed	ð ɛ ɡ v ɛ d
ddeilen	ð e i̯ l a n
ddeilen	ð e i̯ l ɛ n
ddelo	ð ɛ l ɔ
ddeng	ð eː ŋ
ddeset	ð ɛ s ɛ t
ddeuddeg	ð e ɨ̯ ð a ɡ
ddeuddeg	ð e ɨ̯ ð ɛ ɡ
ddeuddegfed	ð e ɨ̯ ð ɛ ɡ v a d
ddeuddegfed	ð e ɨ̯ ð ɛ ɡ v ɛ d
ddim	ð ɪ m
ddoe	ð oː ɨ̯
ddoli	ð ɔ l i
ddolis	ð ɔ l ɪ s
ddos	ð oː s
ddown	ð o u̯ n
dduw	ð ɨ u̯
ddwywaith	ð ʊ ɨ̯ w a i̯ θ
ddwywaith	ð ʊ ɨ̯ w ɛ θ
ddyn	ð ɨː n
deall	d ɛ a ɬ
decaf	d ɛ k a v
dechrau	d ɛ χ r a
dechrau	d ɛ χ r a ɨ̯
dechrau	d ɛ χ r ɛ
deddfu	d ɛ ð v ɨ
de	d eː
deffro	d ɛ f r ɔ
defnyddio	d ɛ v n ə ð j ɔ
defnyddiwr	d ɛ v n ə ð j ʊ r
deg	d eː ɡ
degfed	d ɛ ɡ v a d
degfed	d ɛ ɡ v ɛ d
dei	d e i̯
deigr	d e i̯ ɡ r
deigrod	d e i̯ ɡ r ɔ d
deigryn	d e i̯ ɡ r ɨ n
deilen	d e i̯ l a n
deilen	d e i̯ l ɛ n
delais	d ɛ l a i̯ s
delem	d eː l ɛ m
delem	d ɛ l ɛ m
delen	d ɛ l ɛ n
delent	d eː l ɛ n t
delent	d ɛ l ɛ n t
deler	d ɛ l ɛ r
deles	d ɛ l ɛ s
delet	d ɛ l ɛ t
delfryd	d ɛ l v r ɨ̞ d
deli	d ɛ l ɨ̞
delir	d ɛ l ɪ t
delit	d ɛ l ɪ t
delo	d ɛ l ɔ
delom	d ɛ l ɔ m
delw	d ɛ l u
deng	d eː ŋ
derbyn	d ɛ r b ɨ̞ n
derbynfa	d ɛ r b ə n v a
derbyniad	d ɛ r b ə n j a d
derbyniol	d ɛ r b ə n j o l
derbynneb	d ɛ r b ə n ɛ b
derbynnydd	d ɛ r b ə n ɪ ð
derbynnydd	d ɛ r b ə n ɨ̞ ð
deri	d ɛ r ɪ
derw	d ɛ r ʊ
derwen	d ɛ r w ɛ n
derwydd	d ɛ r w ɨ̞ ð
derwyddiaeth	d ɛ r w ə ð j a ɨ̯ θ
derwyddiaeth	d ɛ r w ə ð j ɛ θ
des	d eː s
desen	d ɛ s ɛ n
deses	d ɛ s ɛ s
deset	ð ɛ s ɛ t
dest	d ɛ s d
deuddeg	d e ɨ̯ ð a ɡ
deuddeg	d e ɨ̯ ð ɛ ɡ
deuddegfed	d e ɨ̯ ð ɛ ɡ v a d
deuddegfed	d e ɨ̯ ð ɛ ɡ v ɛ d
deugain	d e i̯ ɡ a i̯ n
deugain	d e i̯ ɡ ɛ n
deugeiniau	d e i̯ ɡ e i̯ n j a
deugeiniau	d e i̯ ɡ e i̯ n j a ɨ̯
deugeiniau	d e i̯ ɡ e i̯ n j ɛ
deunydd	d e ɨ̯ n ɨ̞ ð
deusaith	d e ɨ̯ s a i̯ θ
dewch	d ɛ u̯ χ
dew	d eː u̯
dewed	d ɛ u̯ ɛ d
dewi	d ɛ u̯ i
dewis	d ɛ u̯ i s
dewr	d ɛ u̯ r
deyrnaddoliant	d e ɨ̯ r n a ð ɔ l j a n t
dial	d ɪ a l
diarhebion	d i a r h ɛ b j ɔ n
diawl	d ʒ a u̯ l
diddordeb	d ɪ ð ɔ r d a b
diddordeb	d ɪ ð ɔ r d ɛ b
diddorol	d ɪ ð ɔ r ɔ l
di	d iː
didranc	d ɪ d r a ŋ k
dienw	d ɪ ɛ n ʊ
difetha	d ɪ v ɛ θ a
digwyddaf	d ɪ ɡ w ə ð a f
digwydd	d ɪ ɡ w ɨ̞ ð
dihareb	d ɪ h a r ɛ b
dihuno	d ɪ h ɨ̞ n ɔ
dileu	d ɪ l e ɨ̯
dillad	d ɪ ɬ a d
dilledyn	d ɪ ɬ ɛ d ɨ̞ n
dilyn	d ɪ l i n
dilyn	d ɪ l ɨ̞ n
dim	d ɪ m
dinas	d ɪ n a s
diod	d ɪ ɔ d
diolch	d ɨ̞ ɔ l χ
diolchgarwch	d ɨ̞ ɔ l χ ɡ a r ʊ χ
dirmyg	d ɪ r m ɨ̞ ɡ
dirmygu	d ɪ r m ə ɡ ɨ
dirmygus	d ɪ r m ə ɡ ɨ̞ s
dirwy	d ɪ r ʊ ɨ̯
disgwyl	d ɪ s ɡ ʊ ɨ̯ l
disgybl	d ɪ s ɡ ɪ b l
disgybl	d ɪ s ɡ ɨ̞ b l
disgyn	d ɪ s ɡ ɪ n
disgyn	d ɪ s ɡ ɨ̞ n
diwedd	d ɪ u̯ a ð
diwedd	d ɪ u̯ ɛ ð
diwethaf	d ɪ u̯ ɛ θ a
diwethaf	d ɪ u̯ ɛ θ a v
diwethaf	d w ɛ θ a
diwethaf	d w ɪ θ a
diwrnod	d ʊ r n ɔ d
diwrnod	d ɪ u̯ r n ɔ d
diwyd	d ɪ u̯ ɨ̞ d
diwyr	d ɪ ʊ ɨ̯ r
do'ch	d oː χ
dod	d oː d
dodi	d ɔ d ɪ
doedd	d oː ɨ̯ ð
doeddech	d ɔ ɨ̯ ð a χ
doeddech	d ɔ ɨ̯ ð ɛ χ
doedden	d ɔ ɨ̯ ð a n
doedden	d ɔ ɨ̯ ð ɛ n
doeddet	d ɔ ɨ̯ ð a t
doeddet	d ɔ ɨ̯ ð ɛ t
doeddwn	d ɔ ɨ̯ ð ʊ n
doem	d oː ɨ̯ m
doen	d oː ɨ̯ n
doer	d oː ɨ̯ r
doet	d oː ɨ̯ t
dof	d oː v
dogfen	d ɔ ɡ v ɛ n
doid	d ɔ i̯ d
doi	d ɔ i̯
doir	d ɔ i̯ r
dois	d ɔ i̯ ʃ
dois	d ɔ i̯ s
doit	d ɔ i̯ t
dòl	d ɔ l
dolen	d ɔ l a n
dolen	d ɔ l ɛ n
dolffin	d ɔ l f ɪ n
dolffiniaid	d ɔ l f ɪ n j a i̯ d
dolffiniaid	d ɔ l f ɪ n j ɛ d
dolïau	d ɔ l ɪ a
dolïau	d ɔ l ɪ a ɨ̯
dolïau	d ɔ l ɪ ɛ
doliau	d ɔ l j a
doliau	d ɔ l j a ɨ̯
doliau	d ɔ l j ɛ
doli	d ɔ l i
dolis	d ɔ l ɪ s
dolur	d ɔ l ɨ̞ r
do'n	d oː n
dor	d ɔ r
dorra	d ɔ r a
dorrai	d ɔ r a i̯
dorrai	d ɔ r ɛ
dorrent	d ɔ r ɛ n t
dorrid	d ɔ r ɪ d
dorsen	d ɔ r s ɛ n
dos	d oː s
dowd	d o u̯ d
down	d o u̯ n
draed	d r aː ɨ̯ d
drawant	d r a u̯ a n t
dre	d r eː
drefydd	d r ɛ v ɨ̞ ð
dro	d r oː
droed	d r oː ɨ̯ d
droen	d r oː ɨ̯ n
droet	d r oː ɨ̯ t
droid	d r ɔ i̯ d
dros	d r ɔ s
drown	d r o u̯ n
drudwen	d r ɨ̞ d w ɛ n
drwg	d r uː ɡ
drws	d r uː s
drwyddedau	d r ʊ ɨ̯ ð ɛ d a
drwyddedau	d r ʊ ɨ̯ ð ɛ d a ɨ̯
drwyddedau	d r ʊ ɨ̯ ð ɛ d ɛ
drwydded	d r ʊ ɨ̯ ð a d
drwydded	d r ʊ ɨ̯ ð ɛ d
drwy	d r uː ɨ̯
dry	d r ɨː
drygioni	d r ə ɡ j ɔ n i
dryw	d r ɪ u̯
du	d ɨː
dug	d ɨː ɡ
duw	d ɨ u̯
dw	d ʊ
dw	d w
dweud	d e i̯ d
dweud	d w e i̯ d
dwfn	d ʊ v n
dwfn	d ɨ̞ v n
dwfr	d ʊ v r
dwg	d uː ɡ
dŵr	d uː r
dwrgi	d ʊ r ɡ ɪ
dwy	d uː ɨ̯
dwyieithog	d ʊ ɨ̯ j e i̯ θ ɔ ɡ
dwylo	d ʊ ɨ̯ l ɔ
dwyn	d uː ɨ̯ n
dwyrain	d ʊ ɨ̯ r a i n
dwyrain	d ʊ ɨ̯ r ɛ n
dwys	d uː ɨ̯ s
dwyt	d uː t
dwyt	d uː ɨ̯ t
dwywaith	d ʊ ɨ̯ w a i̯ θ
dwywaith	d ʊ ɨ̯ w ɛ θ
dybarth	d ə b a r θ
dyblu	d ə b l ɨ
dychwelyd	d ə χ w ɛ l ɨ̞ d
dŷ	d ɨː
dy	d ə
dydw	d ə d ʊ
dydy	d ə d ɨ̞
dydy	d ə d i
dyfeiswragedd	d ə v e i̯ s w r a ɡ ɛ ð
dyfeiswraig	d ə v e i̯ s w r a i̯ ɡ
dyffryn	d ə f r ɨ̞ n
dyfi	d ə v ɪ
dyfnion	d ə v n j ɔ n
dyfrdwy	d ə v r d ʊ ɨ̯
dyfrfarch	d ə v r v a r χ
dyfrgi	d ə v r ɡ ɪ
dyfynnod	d ə v ə n ɔ d
dylan	d ə l a n
dylanwad	d ə l a n w a d
dylu	d ə l ɨ̞
dyma	d ə m a
dyn	d ɨː n
dynion	d ə n j ɔ n
dynladdiad	d ɨː n l a ð j a d
dynleiddiad	d ɨː n l e i̯ ð j a d
dynleiddiaid	d ɨː n l e i̯ ð j a i̯ d
dynleiddiaid	d ɨː n l e i̯ ð j ɛ d
dyr	d ɨ̞ r
dyrrau	d ə r a
dyrrau	d ə r a ɨ
dyrrau	d ə r ɛ
dysgu	d ə s ɡ ɨ̞
dysgwr	d ə s ɡ ʊ r
eang	ɛ a ŋ
ebargofiant	ɛ b a r ɡ ɔ v j a n t
ebol	ɛ b ɔ l
eboles	ɛ b ɔ l ɛ s
ebrill	ɛ b r ɪ ɬ
ebychnod	ɛ b ə χ n ɔ d
ecogyfeillgar	ɛ k ɔ ɡ ə v e i̯ ɬ ɡ a r
edau	ɛ d a
edau	ɛ d a ɨ̯
edau	ɛ d ɛ
eddy	ɛ ð ɨ̞
edfryd	ɛ d v r ɨ̞ d
edliw	ɛ d l ɪ u̯
edn	ɛ d n
edrych	ɛ d r a χ
edrych	ɛ d r ɨ̞ χ
edwyn	ɛ d w ɨ̞ n
e	eː
efallai	ɛ ɬ a
efallai	ɛ v a ɬ a
efallai	ɛ v a ɬ a i̯
efallai	ɛ v a ɬ ɛ
efallai	v a ɬ a
efallai	v a ɬ ɛ
efallai	w a ɬ ɛ
efengylu	ɛ v ɛ ŋ ə l ɨ
ef	eː v
effaith	ɛ f a i̯ θ
effaith	ɛ f ɛ θ
efo	ɛ v ɔ
efrog	ɛ v r ɔ ɡ
efwr	eː v ʊ r
efwr	ɛ v ʊ r
efydd	ɛ v ɨ̞ ð
efyrnwy	ɛ v ə r n ʊ ɨ̯
egluro	ɛ ɡ l ɨ r ɔ
eglwys	ɛ ɡ l ʊ ɨ̯ s
egwyddor	ɛ ɡ ʊ ɨ̯ ð ɔ r
egwyl	ɛ ɡ ʊ ɨ̯ l
ehedydd	ɛ h ɛ d ɨ̞ ð
ehöeg	e h ɔ ɛ ɡ
eiddew	e i ð ɛ u̯
eid	e i̯ d
ei	e i̯
eilir	e i̯ l ɪ r
eira	e i̯ r a
eir	e i̯ r
eiriadurwr	e i̯ r j a d ɨ̞ r ʊ r
eiriadurwyr	e i̯ r j a d ɨ̞ r w ɨ̞ r
eirin	e i̯ r ɪ n
eirlithrad	e i r l ɪ θ r a d
eirlys	e i̯ r l ɨ̞ s
eirth	e i̯ r θ
eisiau	e i̯ ʃ a ɨ̯
eisiau	ɪ ʃ ɔ
eistedd	e i̯ s d ɛ ð
eisteddfodau	e i̯ s d ɛ ð v ɔ d a ɨ̯
eisteddfodau	s d ɛ ð v ɔ d a
eisteddfodau	s d ɛ ð v ɔ d ɛ
eisteddle	e i̯ s d ɛ ð l ɛ
eistedd	ɪ s d a
eistedd	ɪ s d ɛ
eith	e i̯ θ
elai	ɛ l a i̯
elain	ɛ l a i̯ n
elech	ɛ l ɛ χ
eled	ɛ l ɛ d
êl	eː l
elem	ɛ l ɛ m
elen	ɛ l ɛ n
eleni	ɛ l ɛ n ɪ
eleni	l ɛ n ɪ
elent	ɛ l ɛ n t
eler	ɛ l ɛ r
elet	ɛ l ɛ t
elfed	ɛ l v ɛ d
elfen	ɛ l v ɛ n
elid	ɛ l ɪ d
eliffant	ɛ l ɪ f a n t
elin	ɛ l ɪ n
elir	ɛ l ɪ r
elit	ɛ l ɪ t
elli	ɛ ɬ ɪ
elltydd	ɛ ɬ d ɨ̞ ð
eloch	ɛ l ɔ χ
elo	ɛ l ɔ
elom	ɛ l ɔ m
elont	ɛ l ɔ n t
elsai	ɛ l s a i̯
elsech	ɛ l s ɛ χ
elsem	ɛ l s ɛ m
elsent	ɛ l s ɛ n t
elsid	ɛ l s ɪ d
elsit	ɛ l s ɪ t
elswn	ɛ l s ʊ n
elwa	ɛ l w a
elw	ɛ l ʊ n
elwn	ɛ l ʊ n
elwyf	ɛ l ʊ ɨ̯ v
elych	ɛ l ɨ̞ χ
elyn	ɛ l ɨ̞ n
emiw	ɛ m ɪ u̯
emrys	ɛ m r ɨ̞ s
enfys	ɛ n v ɨ̞ s
enghraifft	ɛ ŋ̊ r a i̯ f d
enghraifft	ɛ ŋ̊ r ɛ f d
engyl	ɛ ŋ ɨ̞ l
ennill	ɛ n ɪ ɬ
enw	ɛ n u
enwog	ɛ n w ɔ ɡ
eog	ɛ ɔ ɡ
eogiaid	ɛ ɔ ɡ j a i̯ d
eogiaid	ɛ ɔ ɡ j ɛ d
eraill	ɛ r ɪ ɬ
eraill	ɛ r a i ɬ
erchyll	ɛ r χ ɨ̞ ɬ
erfyn	ɛ r v ɨ n
ergyd	ɛ r ɡ ɨ̞ d
erioed	ɛ r j oː ɨ̯ d
erioed	r j oː ɨ̯ d
eryr	ɛ r ɨ̞ r
erys	ɛ r ɨ̞ s
es	eː s
esgaladur	ɛ s ɡ a l a d ɨ̞ r
esgid	ɛ s ɡ ɪ d
esgyrn	ɛ s ɡ ɨ̞ r n
est	ɛ s d
estron	ɛ s d r ɔ n
estrys	ɛ s d r ɨ̞ s
etifeddu	ɛ t ɪ v ɛ ð ɨ
euog	e ɨ̯ ɔ ɡ
euthum	e ɨ̯ θ ɨ̞ m
ewch	ɛ ʊ̯ χ
ewin	ɛ u̯ ɪ n
ewro	ɛ u̯ r ɔ
fab	v aː b
fachgenyn	v a χ ɡ ɛ n i̞ n
fach	v aː χ
fadfall	v a d v a ɬ
faen	v aː ɨ̯ n
faet	v aː ɨ̯ t
fag	v aː ɡ
faint	v a i̯ n t
fair	v a i̯ r
fam	m a m
fampir	v a m p ɪ r
faneg	v a n a ɡ
faneg	v a n ɛ ɡ
fara	v a r a
farnau	v a r n a
farnau	v a r n a ɨ̯
farnau	v a r n ɛ
farn	v a r n
fasen	s a n
fasen	s ɛ n
fasen	v a s a n
fasen	v a s ɛ n
fasen	v ə s a n
fasen	v ə s ɛ n
fathemateg	v a θ ɛ m a t ɛ ɡ
fawn	v a u̯ n
fawrth	v a u̯ r θ
fechan	v ɛ χ a n
fedi	v ɛ d ɪ
fedra	v ɛ d r a
felly	ɬ ɨ̞
felly	v ɛ ɬ ɨ̞
fel	v ɛ l
felyn	v ɛ l ɨ̞ n
ferch	v ɛ r χ
ferfenw	v ɛ r v ɛ n u
fersiwn	v ɛ r ʃ ʊ n
fether	v ɛ θ ɛ r
fe	v eː
ffa	f aː
ffair	f a i̯ r
ffeindiaf	f e i̯ n d j a
ffeindiaf	f e i̯ n d j a v
ffeindiaf	f ɪ n d j a
ffeindio	f e i̯ n d j ɔ
ffeindio	f ɪ n d j ɔ
ffenest	f ɛ n a s d
ffenest	f ɛ n ɛ s d
ffenestr	f ɛ n a s d
ffenestr	f ɛ n ɛ s d
ffenestr	f ɛ n ɛ s d r
ffenestri	f ɛ n ɛ s d r i
ffêr	f eː r
ffesant	f ɛ s a n t
ffigys	f ɨ̞ ɡ ɨ̞ s
ffili	f ɪ l ɪ
ffilm	f ɪ l m
ffilmiau	f ɪ l m j a
ffilmiau	f ɪ l m j a ɨ̯
ffilmiau	f ɪ l m j ɛ
ffionau	f ɪ ɔ n a
ffionau	f ɪ ɔ n a ɨ̯
ffionau	f ɪ ɔ n ɛ
ffion	f ɪ ɔ n
fflamgwr	f l a m ɡ ʊ r
fflapjac	f l a p d͡ʒ a k
fflworin	f l ʊ ɔ r ɪ n
fflyd	f l ɨː d
fflyd	f l iː d
ffoi	f o i̯
ffôi	f oː i̯
ffonau	f ɔ n a
ffonau	f ɔ n a ɨ
ffonau	f ɔ n ɛ
ffon	f ɔ n
ffôn	f oː n
fforc	f ɔ r k
ffowlyn	f o u̯ l ɨ̞ n
ffrancwr	f r a ŋ k ʊ r
ffrancwyr	f r a ŋ k w ɨ̞ r
ffrengig	f r ɛ ŋ ɪ ɡ
ffres	f r ɛ ʃ
ffrind	f r ɪ n d
ffrwchnedd	f r ʊ χ n ɛ ð
ffrwd	f r uː d
ffrwyth	f r uː ɨ̯ θ
ffugenwau	f ɨ̞ ɡ ɛ n w a
ffugenwau	f ɨ̞ ɡ ɛ n w a ɨ̯
ffugenwau	f ɨ̞ ɡ ɛ n w ɛ
ffugenw	f ɨ̞ ɡ ɛ n ʊ
ffurf	f ɨ̞ r v
ffurfio	f ɨ̞ r v j ɔ
ffurfiol	f ɨ̞ r v j ɔ l
ffwciaf	f ʊ k j a v
ffwcio	f ʊ k j ɔ
ffwrcho	f ʊ r χ ɔ
ffwrn	f ʊ r n
ffy	f ɨː
ffyn	f ɨ̞ n
ficer	v ɪ k a r
ficer	v ɪ k ɛ r
fil	v iː l
fi	v iː
flaidd	v l a i̯ ð
fleiddiaid	v l e i̯ ð j a i̯ d
fleiddiaid	v l e i̯ ð j ɛ d
fleiddiau	v l e i̯ ð j a
fleiddiau	v l e i̯ ð j a ɨ̯
fleiddiau	v l e i̯ ð j ɛ
flin	v l iː n
flodau	v l ɔ d a
flodau	v l ɔ d a ɨ̯
flodau	v l ɔ d ɛ
flodyn	v l ɔ d ɨ̞ n
fod	v oː d
foes	v oː ɨ̯ s
fol	v ɔ l
fôn	v oː n
fordydd	v ɔ r d ɨ̞ ð
fore	v ɔ r a
fore	v ɔ r ɛ
fôr	v oː r
fory	v ɔ r ɨ
fo	v oː
frain	v r a i̯ n
frân	v r aː n
frecwast	v r ɛ k w a s t
frenin	v r ɛ n ɪ n
frith	v r iː θ
fri	v r iː
froch	v r oː χ
fron	v r ɔ n
frys	v r ɨː s
fûm	v ɨː m
fur	v ɨː r
fu	v ɨː
fẁg	v ʊ ɡ
fwg	v uː ɡ
fwlfa	v ʊ l v a
fwltur	v ʊ l t ɨ̞ r
fwyaf	v ʊ ɨ̯ a
fwyaf	v ʊ ɨ̯ a v
fwyd	v uː ɨ̯ d
fwy	v uː ɨ̯
fyned	v ə n ɛ d
fynyddoedd	v ə n ə ð ɔ ɨ̯ ð
fynydd	v ə n ɨ̞ ð
fyr	v ɨ̞ r
fys	v ɨː s
gacha	ɡ a χ a
gachai	ɡ a χ a i̯
gachai	ɡ a χ ɛ
gachais	ɡ a χ a i̯ s
gachais	ɡ a χ ɛ s
gach	ɡ aː χ
gachen	ɡ a χ ɛ n
gaches	ɡ a χ ɛ s
gad	ɡ aː d
gadael	ɡ a d a l
gadael	ɡ a d a ɨ̯ l
gadael	ɡ a d ɛ l
gadawed	ɡ a d a u̯ ɛ d
gadd	ɡ aː ð
gae	ɡ aː ɨ̯
gaeaf	ɡ e ɨ̯ a
gaeaf	ɡ e ɨ̯ a v
gaeafgysgu	ɡ e ɨ̯ a v ɡ ə s ɡ ɨ
gaed	ɡ aː ɨ̯ d
gael	ɡ aː l
gael	ɡ aː ɨ̯ l
gaen	ɡ a i̯ n
gaen	ɡ aː ɨ̯ n
gafael	ɡ a v a l
gafael	ɡ a v a ɨ̯ l
gafael	ɡ a v ɛ l
gafas	ɡ a v a s
gaf	ɡ aː v
gaffai	ɡ a f a i̯
gaffed	ɡ a f ɛ d
gaffel	ɡ a f ɛ l
gaffent	ɡ a f ɛ n t
gaffer	ɡ a f ɛ r
gafr	ɡ a v r
gafrewig	ɡ a v r ɛ w ɪ ɡ
gain	ɡ a i̯ n
gaint	ɡ a i̯ n t
gair	ɡ a i̯ r
gais	ɡ a i̯ s
gait	ɡ a i̯ t
gâl	ɡ aː l
galan	ɡ a l a n
galed	ɡ a l a d
galed	ɡ a l ɛ d
galenigion	ɡ a l ɛ n ɪ ɡ j ɔ n
galennig	ɡ a l ɛ n ɪ ɡ
galeted	ɡ a l ɛ t ɛ d
gall	ɡ a ɬ
galla	ɡ a ɬ a
gallai	ɡ a ɬ a i̯
gallai	ɡ a ɬ ɛ
gallan	ɡ a ɬ a n
gallant	ɡ a ɬ a n t
galled	ɡ a ɬ ɛ d
gallen	ɡ a ɬ ɛ n
galler	ɡ a ɬ ɛ r
galli	ɡ a ɬ ɪ
gallo	ɡ a ɬ ɔ
gallu	ɡ a ɬ ɨ
galluog	ɡ a ɬ i ɔ ɡ
galluog	ɡ a ɬ iː ɔ ɡ
galluog	ɡ a ɬ ɨ ɔ ɡ
galluogi	ɡ a ɬ ɨ ɔ ɡ i
galon	ɡ a l ɔ n
galw	ɡ a l u
galwes	ɡ a l w ɛ s
galwyn	ɡ a l ʊ ɨ̯ n
gana	ɡ a n a
ganai	ɡ a n a i̯
gan	ɡ a n
gân	ɡ aː n
ganen	ɡ a n ɛ n
ganer	ɡ a n ɛ r
ganes	ɡ a n ɛ s
gani	ɡ a n ɪ
ganit	ɡ a n ɪ t
gan	ɡ ɪ n
gano	ɡ a n ɔ
gansai	ɡ a n s a i̯
ganu	ɡ a n ɨ̞
gara	ɡ a r a
garai	ɡ a r a i̯
garai	ɡ a r ɛ
garais	ɡ a r ɪ ʃ
garais	ɡ a r a i̯ s
garais	ɡ a r ɛ ʃ
garais	ɡ a r ɛ s
garan	ɡ a r a n
garanod	ɡ a r a n ɔ d
garant	ɡ a r a n t
gar	ɡ a r
gardd	ɡ a r ð
gardd	ɡ aː r ð
garej	ɡ a r ɛ d ʒ
garem	ɡ a r ɛ m
garen	ɡ a r ɛ n
garent	ɡ a r ɛ n t
garer	ɡ a r ɛ r
gares	ɡ a r ɛ s
garest	ɡ a r ɛ s t
garet	ɡ a r ɛ t
gari	ɡ a r ɪ
garit	ɡ a r ɪ t
garnau	ɡ a r n a
garnau	ɡ a r n a ɨ̯
garnau	ɡ a r n ɛ
garo	ɡ a r ɔ
gartre	ɡ a r t r a
gartre	ɡ a r t r ɛ
gartref	ɡ a r t r a
gartref	ɡ a r t r ɛ
gartref	ɡ a r t r ɛ v
garu	ɡ a r ɨ̞
garw	ɡ a r ʊ
garw	ɡ a r u
garw	ɡ aː r u
gas	ɡ aː s
gastell	ɡ a s d a ɬ
gastell	ɡ a s d ɛ ɬ
gath	ɡ aː θ
gato	ɡ a t ɔ
gawn	ɡ a u̯ n
gaws	ɡ a u̯ s
gefeilles	ɡ ɛ v e i̯ ɬ ɛ s
gefell	ɡ ɛ v ɛ ɬ
gefnau	ɡ ɛ v n a
gefnau	ɡ ɛ v n a ɨ̯
gefnau	ɡ ɛ v n ɛ
gefn	ɡ ɛ v n
gei	ɡ e i̯
geifr	ɡ e i̯ v r
geiriadur	ɡ e i̯ r j a d ɨ̞ r
geiriadurwr	ɡ e i̯ r j a d ɨ̞ r ʊ r
geiriadurwyr	ɡ e i̯ r j a d ɨ̞ r w ɨ̞ r
gelai	ɡ ɛ l a i̯
gelen	ɡ ɛ l ɛ n
gelet	ɡ ɛ l ɛ t
gell	ɡ ɛ ɬ
gelli	ɡ ɛ ɬ ɪ
gellygen	ɡ ɛ ɬ ə ɡ ɛ n
gelyn	ɡ ɛ l ɨ̞ n
gêm	ɡ eː m
gemwaith	ɡ ɛ m w a i̯ θ
genedigaeth	ɡ ɛ n ɛ d ɪ ɡ a ɨ̯ θ
genedigaeth	ɡ ɛ n ɛ d ɪ ɡ ɛ θ
gên	ɡ eː n
genidol	ɡ ɛ n ɪ d ɔ l
geni	ɡ ɛ n ɪ
gerais	ɡ ɛ r a i̯ s
ger	ɡ ɛ r
geri	ɡ ɛ r ɪ
gerir	ɡ ɛ r ɪ r
ges	ɡ eː s
gest	ɡ ɛ s t
gestyll	ɡ ɛ s d ɨ̞ ɬ
gimbill	ɡ ɪ m b ɪ ɬ
glanach	ɡ l a n a χ
glanaf	ɡ l a n a
glanaf	ɡ l a n a v
glaned	ɡ l a n ɛ d
glanhau	ɡ l a n h a ɨ̯
glan	ɡ l a n
glân	ɡ l aː n
glasach	ɡ l a s a χ
glased	ɡ l a s ɛ d
glasgoch	ɡ l a s ɡ ɔ χ
glas	ɡ l aː s
glaswellt	ɡ l a s w ɛ ɬ d
glawio	ɡ l a u̯ j ɔ
glaw	ɡ l a u̯
gleision	ɡ l e i̯ ʃ ɔ n
glew	ɡ l ɛ u̯
glin	ɡ l iː n
gloan	ɡ l ɔ a n
glo	ɡ l oː
glosen	ɡ l ɔ s ɛ n
glwb	ɡ l ʊ b
glybiau	ɡ l ə b j a
glybiau	ɡ l ə b j a ɨ̯
glybiau	ɡ l ə b j ɛ
glyw	ɡ l ɪ u̯
gna	ɡ n aː
gnawn	ɡ n a u̯ n
gnei	ɡ n e i̯
gnwd	ɡ n uː d
gobaith	ɡ ɔ b a i θ
gobaith	ɡ ɔ b ɛ θ
gobeithio	ɡ ɔ b e i̯ θ j ɔ
goddef	ɡ ɔ ð ɛ
goddef	ɡ ɔ ð ɛ v
goddrych	ɡ ɔ ð r ɨ̞ χ
goddrychol	ɡ ɔ ð r ə χ ɔ l
goed	ɡ oː ɨ̯ d
goeg	ɡ oː ɨ̯ ɡ
goes	ɡ oː ɨ̯ s
gofalus	ɡ ɔ v a l ɨ̞ s
gof	ɡ oː v
gofynnod	ɡ ɔ v ə n ɔ d
gofyn	ɡ ɔ v ɨ̞ n
gogledd	ɡ ɔ ɡ l a ð
gogledd	ɡ ɔ ɡ l ɛ ð
gogleddol	ɡ ɔ ɡ l ɛ ð ɔ l
gog	ɡ oː ɡ
gog	ɡ ɔ ɡ
gogs	ɡ ɔ ɡ s
golchi	ɡ ɔ l χ ɪ
gôl	ɡ oː l
golosg	ɡ ɔ l ɔ s ɡ
goludog	ɡ ɔ l ɨ̞ d ɔ ɡ
golwg	ɡ ɔ l ʊ ɡ
golwr	ɡ ɔ l ʊ r
golygfeydd	ɡ ɔ l ə ɡ v e ɨ̯ ð
gorchaw	ɡ ɔ r χ a u̯
gorchuddio	ɡ ɔ r χ ɨ̞ ð j ɔ
gorchudd	ɡ ɔ r χ ɪ ð
gorchudd	ɡ ɔ r χ ɨ̞ ð
gorffennaf	ɡ ɔ r f ɛ n a v
gorffen	ɡ ɔ r f a n
gorffen	ɡ ɔ r f ɛ n
gorfodog	ɡ ɔ r v ɔ d ɔ ɡ
gorfodtref	ɡ ɔ r v ɔ d t r ɛ v
goriad	ɡ ɔ r j a d
gorlifaf	ɡ ɔ r l ɪ v a v
gorlifo	ɡ ɔ r l ɪ v ɔ
gorllewin	ɡ ɔ r ɬ ɛ u̯ ɪ n
gormod	ɡ ɔ r m ɔ d
gor	ɡ ɔ r
gorsaf	ɡ ɔ r s a v
gorwel	ɡ ɔ r w ɛ l
gostyngaidd	ɡ ɔ s d ə ŋ a i̯ ð
gosyn	ɡ ɔ s ɨ̞ n
graff	ɡ r a f
grawnwin	ɡ r a u̯ n w ɪ n
greda	ɡ r ɛ d a
gredo	ɡ r ɛ d ɔ
gref	ɡ r eː v
greto	ɡ r ɛ t ɔ
grêt	ɡ r eː t
grist	ɡ r iː s t
grug	ɡ r ɨː ɡ
grwth	ɡ r uː θ
gryf	ɡ r ɨː v
gu	ɡ ɨː
gusanau	ɡ ɨ̞ s a n a
gusanau	ɡ ɨ̞ s a n a ɨ̯
gusanau	ɡ ɨ̞ s a n ɛ
gusan	ɡ ɨ̞ s a n
gusanu	ɡ ɨ̞ s a n ɨ̞
gut	ɡ ɨ̞ t
gwadd	ɡ w aː ð
gwaedu	ɡ w e ɨ̯ d ɨ
gwaed	ɡ w aː i̯ d
gwaethaf	ɡ w e ɨ̯ θ a
gwaethaf	ɡ w e ɨ̯ θ a v
gwaeth	ɡ w aː ɨ̯ θ
gwagedd	ɡ w a ɡ ɛ ð
gwag	ɡ w aː ɡ
gwahanol	ɡ w a h a n ɔ l
gwahanu	ɡ w a h a n ɨ
gwain	ɡ w a i̯ n
gwair	ɡ w a i̯ r
gwalch	ɡ w a l χ
gwallt	ɡ w aː ɬ d
gwall	ɡ w a ɬ
gwanwynau	ɡ w a n w ə n a
gwanwynau	ɡ w a n w ə n a ɨ̯
gwanwynau	ɡ w a n w ə n ɛ
gwanwyn	ɡ w a n w ɨ̞ n
gwario	ɡ w a r j ɔ
gwarthal	ɡ w a r θ a l
gwar	ɡ w a r
gwâr	ɡ w aː r
gwastraff	ɡ w a s d r a f
gwau	ɡ w a ɨ̯
gwawn	ɡ w a u̯ n
gwddf	ɡ ʊ ð u
gwddf	ɡ ʊ ð v
gwddf	ɡ ʊ ð ʊ v
gwddw	ɡ ʊ ð ʊ
gwddwg	ɡ ʊ ð ʊ ɡ
gwdihŵ	ɡ ʊ d ɪ h uː
gweddïau	ɡ w ɛ ð ɪ a
gweddïau	ɡ w ɛ ð ɪ a ɨ̯
gweddïau	ɡ w ɛ ð ɪ ɛ
gweddïon	ɡ w ɛ ð ɪ ɔ n
gweddïo	ɡ w ɛ ð ɪ ɔ
gweddi	ɡ w ɛ ð ɪ
gweddïwr	ɡ w ɛ ð ɪ ʊ r
gweedig	ɡ w ɛ ɛ d i ɡ
gwefan	ɡ w ɛ v a n
gweinidog	ɡ w e i̯ n ɨ̞ d ɔ ɡ
gweithgaredd	ɡ w e i̯ θ ɡ a r ɛ ð
gweithio	ɡ w e i̯ θ j ɔ
gweithiwr	ɡ w e i̯ θ j ʊ r
gwelais	ɡ w ɛ l ɪ ʃ
gwelais	ɡ w ɛ l a i̯ s
gwelais	ɡ w ɛ l ɛ ʃ
gwelais	ɡ w ɛ l ɛ s
gweld	ɡ w ɛ l d
gweled	ɡ w ɛ l ɛ d
gwelen	ɡ w ɛ l ɛ n
gweles	ɡ w ɛ l ɛ s
gwelet	ɡ w ɛ l ɛ t
gwella	ɡ w ɛ ɬ a
gwellt	ɡ w eː ɬ d
gwelsen	ɡ w ɛ l s ɛ n
gwely	ɡ w ɛ l ɨ
gwenhwyfar	ɡ w ɛ n h ʊ ɨ̯ v a r
gwenith	ɡ w ɛ n ɪ θ
gwennol	ɡ w ɛ n ɔ l
gwenoliaid	ɡ w ɛ n ɔ l j a i̯ d
gwenoliaid	ɡ w ɛ n ɔ l j ɛ d
gwenu	ɡ w ɛ n ɨ̞
gwen	ɡ w ɛ n
gwên	ɡ w eː n
gwenwyn	ɡ w ɛ n w ɨ̞ n
gwenynen	ɡ w e n ə n a n
gwenynen	ɡ w e n ə n ɛ n
gwenyn	ɡ w ɛ n ɨ̞ n
gwerdd	ɡ w ɛ r ð
gwernen	ɡ w ɛ r n ɛ n
gwernog	ɡ w ɛ r n ɔ ɡ
gwern	ɡ w ɛ r n
gwerthu	ɡ w ɛ r θ ɨ
gwerth	ɡ w ɛ r θ
gwesty	ɡ w ɛ s t ɨ
gwe	ɡ w eː
gwg	ɡ uː ɡ
gwinoedd	ɡ w ɪ n ɔ ɨ̯ ð
gwin	ɡ w iː n
gwir	ɡ w iː r
gwisgo	ɡ w ɪ s ɡ ɔ
gwisg	ɡ w iː s ɡ
gwiwerod	ɡ w ɪ u̯ ɛ r ɔ d
gwiwer	ɡ w ɪ u̯ a r
gwiwer	ɡ w ɪ u̯ ɛ r
gwladgarol	ɡ w l a d ɡ a r ɔ l
gwladgarwr	ɡ w l a d ɡ a r ʊ r
gwlad	ɡ w l aː d
gwlanog	ɡ w l a n ɔ ɡ
gwledd	ɡ w l eː ð
gwledig	ɡʷ l ɛ d ɪ ɡ
gwledydd	ɡ w l ɛ d ɨ̞ ð
gwleidyddol	ɡ w l e i̯ d ə ð ɔ l
gwleidydd	ɡ u l e i̯ d ɨ̞ ð
gwlychu	ɡ l ə χ i
gwlychu	ɡ w l ə χ ɨ
gwlych	ɡ w l ɨː χ
gwneud	ɡ n e ɨ̯ d
gwneud	n e ɨ̯ d
gwneud	ɡ w n e ɨ̯ d
gẃraidd	ɡ ʊ r a i̯ ð
gwraidd	ɡ w r a i̯ ð
gwraig	ɡ w r a i̯ ɡ
gwrandawaf	ɡ w r a n d a w a v
gwrando	ɡ w r a n d ɔ
gwreiddiadur	ɡ ʊ r ɛ ɨ̞̯ ð j a d ɨ̞ r
gwreiddiol	ɡ w r e i̯ ð j ɔ l
gwreiddio	ɡ ʊ r ɛ ɨ̞̯ ð j ɔ
gwrol	ɡ ʊ r ɔ l
gwrs	ɡ ʊ r s
gwrthod	ɡ ʊ r θ ɔ d
gwrthrychol	ɡ ʊ r θ r ə χ ɔ l
gwrthrych	ɡ ʊ r θ r ɨ̞ χ
gwrthwynebair	ɡ ʊ r θ w ɨ̞ n ɛ b a i̯ r
gŵr	ɡ uː r
gwyach	ɡ ʊ ɨ̯ a χ
gwyar	ɡ ʊ ɨ̯ a r
gwybodaeth	ɡ ʊ b ɔ d a ɨ̯ θ
gwybodaeth	ɡ w ɨ̞ b ɔ d a ɨ̯ θ
gwybodaeth	ɡ w ɨ̞ b ɔ d ɛ θ
gwybodaeth	ɡ w ə b ɔ d a ɨ̯ θ
gwybodaeth	ɡ w ə b ɔ d ɛ θ
gwybod	ɡ ʊ b ɔ d
gwybod	ɡ w ɨ̞ b ɔ d
gwychach	ɡ w ə χ a χ
gwyched	ɡ w ə χ ɛ d
gwych	ɡ w ɨː χ
gwyddau	ɡ ʊ ɨ̯ ð a
gwyddau	ɡ ʊ ɨ̯ ð a ɨ̯
gwyddau	ɡ ʊ ɨ̯ ð ɛ
gwyddbwyll	ɡ w ɨ̞ ð b ʊ ɨ̯ ɬ
gwydden	ɡ w ɨ̞ ð ɛ n
gwyddion	ɡ w ə ð j ɔ n
gwyddon	ɡ w ə ð ɔ n
gwyddor	ɡ ʊ ɨ̯ ð ɔ r
gŵydd	ɡ uː ɨ̯ ð
gwŷdd	ɡ w ɨː ð
gwyfyn	ɡ w ə v ɨ̞ n
gwylan	ɡ ʊ ɨ̯ l a n
gwylio	ɡ w ɪ l j ɔ
gwylio	ɡ w ɨ̞ l j ɔ
gwylliaid	ɡ ʊ ɨ̯ ɬ j a i̯ d
gwylliaid	ɡ ʊ ɨ̯ ɬ j ɛ d
gwylliaid	ɡ w ɨ̞ ɬ j a i̯ d
gwylliaid	ɡ w ɨ̞ ɬ j ɛ d
gwyllon	ɡ w ə ɬ ɔ n
gwyllt	ɡ w ɨː ɬ d
gŵyll	ɡ uː ɨ̯ ɬ
gwyll	ɡ w ɨ̞ ɬ
gŵyl	ɡ uː ɨ̯ l
gwŷl	ɡ w ɨː l
gwyndyd	ɡ ʊ ɨ̯ n d ɨ̞ d
gwynedd	ɡ u ɨ̯ n ɛ ð
gwyneira	ɡ w ɨ̞ n e i̯ r a
gwyneth	ɡ w ɨ̞ n ɛ θ
gwynnach	ɡ w ə n a χ
gwynnu	ɡ w ə n ɨ
gwynt	ɡ w ɨ̞ n t
gwyn	ɡ w ɨ̞ n
gwŷn	ɡ w ɨː n
gwyrddion	ɡ w ə r ð j ɔ n
gwyrdd	ɡ w ɨ̞ r ð
gŵyr	ɡ uː ɨ̯ r
gwŷr	ɡ w ɨː r
gwyryf	ɡ w ə r ɨ v
gwystl	ɡ w ɨ̞ s d l
gwys	ɡ w ɨː s
gŵyth	ɡ uː ɨ̯ θ
gwy	ɡ uː ɨ̯
gyda	ɡ ɨ̞ d a
gydag	ɡ ɨ̞ d a ɡ
gyfiawnder	ɡ ə v j a u̯ n d ɛ r
gyfreithiwr	ɡ ə v r e i̯ θ j ʊ r
gymaint	ɡ ə m a i̯ n t
gymaint	ɡ ə m ɛ n t
gymorth	ɡ ə m ɔ r θ
gymru	ɡ ə m r ɨ̞
gyrraf	ɡ ə r a v
gyrru	ɡ ə r ɨ
gyrrwr	ɡ ə r ʊ r
gythraul	ɡ ə θ r a l
gythraul	ɡ ə θ r a ɨ̯ l
gythraul	ɡ ə θ r ɛ l
gythreuliaid	ɡ ə θ r e ɨ̯ l j a i̯ d
gythreuliaid	ɡ ə θ r e ɨ̯ l j ɛ d
haber	h a b ɛ r
habwyd	h a b ʊ ɨ̯ d
hach	aː χ
hachos	h a χ ɔ s
hadar	h a d a r
haddo	h a ð ɔ
hadeilad	h a d e i̯ l a d
haden	h a d ɛ n
had	h aː d
hadolygu	h a d ɔ l ə ɡ ɨ̞
hadran	h a d r a n
hadu	h a d ɨ̞
hadwaenent	h a d w e ɨ̯ n ɛ n t
haelwyd	h e ɨ̯ l ʊ ɨ̯ d
haen	h aː ɨ̯ n
haf	h aː
haf	h aː v
hafren	h a v r ɛ n
hagor	h a ɡ ɔ r
hail	h a i̯ l
hais	h a i s
halen	h a l a n
halen	h a l ɛ n
halibalŵ	h a l ɪ b a l uː
hamerica	h a m ɛ r ɪ k a
hamod	h a m ɔ d
hamser	h a m s a r
hamser	h a m s ɛ r
hances	h a n k a s
hances	h a n k ɛ s
hanes	h a n a s
hanes	h a n ɛ s
hanfon	h a n v ɔ n
hangen	h a ŋ a n
hangen	h a ŋ ɛ n
hanner	h a n a r
hanner	h a n ɛ r
hannwyd	h a n ʊ ɨ̯ d
hanodd	h a n ɔ ð
hapus	h a p ɨ̞ s
harall	h a r a ɬ
harbwr	h a r b ʊ r
hardal	h a r d a l
hardaloedd	h a r d a l ɔ ɨ̯ ð
harddach	h a r ð a χ
hardded	h a r ð ɛ d
hardd	h a r ð
harglwydd	h a r ɡ l ʊ ɨ̯ ð
harian	h a r j a n
harlwy	h a r l u ɨ̯
haros	h a r ɔ s
