a	aː
â	a
ab	a b
abad	a b a d
abadaeth	a b a d a ɨ̯ θ
abadaeth	a b a d ɛ θ
abades	a b a d
abathocroalaidd	a b a θ ɔ k r ɔ a l a i̯ ð
abatir	a b a t ɪ r
abaty	a b a t ɨ
aber	a b ɛ r
aberdâr	a b ɛ r d aː r
aberdaugleddau	a b ɛ r d a ɨ̯ ɡ l ɛ ð a
aberdaugleddau	a b ɛ r d a ɨ̯ ɡ l ɛ ð a ɨ̯
aberdaugleddau	a b ɛ r d a ɨ̯ ɡ l ɛ ð ɛ
abergofiant	a b ɛ r ɡ ɔ v j a n t
abertawe	a b ɛ r t a u̯ ɛ
aberteifi	a b ɛ r t e i̯ v ɪ̞
aberth	a b ɛ r θ
aberthged	a b ɛ r θ ɡ ɛ d
aberthu	a b ɛ r θ ɨ̞
aberystwyth	a b ɛ r ə s t w ɨ̞ θ
abl	a b l
abladol	a b l a d ɔ l
absenoldeb	a b s ɛ n ɔ l d ɛ b
abwyd	a b ʊ ɨ̯ d
academaidd	a k a d ɛ m a i̯ ð
academaidd	a k a d ɛ m ɛ ð
ac	a k
ach	aː χ
achosaf	a χ ɔ s a v
achos	a χ ɔ s
achosi	a χ ɔ s i
achos	χ ɔ s
achub	a χ ɨ̞ b
achwyn	a χ ʊ ɨ̯ n
actiaf	a k t j a v
acti	a k t i
actio	a k t j ɔ
acw	a k u
ad	aː d
adael	a d a l
adael	a d a ɨ̯ l
adael	a d ɛ l
adain	a d a i̯ n
adain	a d ɛ n
adanedd	a d a n ɛ ð
adar	a d a r
adarydda	a d a r ə ð a
adarydd	a d a r ɨ̞ ð
adawed	a d a u̯ ɛ d
addawa	a ð a u̯ a
addo	a ð ɔ
addoldy	a ð ɔ l d ɨ̞
addolgar	a ð ɔ l ɡ a r
addoliad	a ð ɔ l j a d
addoli	a ð ɔ l i
addolwr	a ð ɔ l ʊ r
addurn	a ð ɨ̞ r n
addurno	a ð ɨ̞ r n ɔ
addysg	a ð ɨ̞ s ɡ
addysgu	a ð ə s ɡ ɨ̞
adeilad	a d e i̯ l a d
adeiladu	a d e i̯ l a d ɨ
aden	a d ɛ n
adenydd	a d ɛ n ɨ̞ ð
aderyn	a d ɛ r ɨ̞ n
aderyn	d ɛ r ɨ̞ n
adfer	a d v a r
adfer	a d v ɛ r
adferaf	a d v ɛ r a
adferaf	a d v ɛ r a v
adferant	a d v ɛ r a n t
adferent	a d v ɛ r ɛ n t
adferf	a d v ɛ r v
adfero	a d v ɛ r ɔ
adio	a d j ɔ
adlaw	a d l a u̯
adnabod	a d n a b ɔ d
adnabyddant	a d n a b ə ð a n t
adnabyddi	a d n a b ə ð ɪ
adnabyddus	a d n a b ə ð ɨ̞ s
adnabyddwch	a d n a b ə ð ʊ χ
adnabyddwn	a d n a b ə ð ʊ n
adnebydd	a d n ɛ b ɨ̞ ð
adnodd	a d n ɔ ð
adolygu	a d ɔ l ə ɡ ɨ̞
adra	a d r a
adran	a d r a n
adre	a d r a
adre	a d r ɛ
adref	a d r a
adref	a d r ɛ
adref	a d r ɛ v
adrodd	a d r ɔ ð
adroddaf	a d r ɔ ð a
adroddaf	a d r ɔ ð a v
adroddiad	a d r ɔ ð j a d
adwaen	a d w a ɨ̯ n
adwaenai	a d w e ɨ̯ n a i̯
adwaenant	a d w e ɨ̯ n a n t
adwaenech	a d w e ɨ̯ n ɛ χ
adwaenem	a d w e ɨ̯ n ɛ m
adwaenent	a d w e ɨ̯ n ɛ n t
adwaenid	a d w e ɨ̯ n ɪ d
adwaenir	a d w e ɨ̯ n ɪ r
adwaenit	a d w e ɨ̯ n ɪ t
adwaenoch	a d w e ɨ̯ n ɔ χ
adwaenom	a d w e ɨ̯ n ɔ m
adwaenost	a d w e ɨ̯ n ɔ s d
adwaenwch	a d w e ɨ̯ n ʊ χ
adwaenwn	a d w e ɨ̯ n ʊ n
adwaenynt	a d w e ɨ̯ n ɨ̞ n t
adweinaf	a d w e i̯ n a v
adweini	a d w e i̯ n i
adweinid	a d w e i̯ n ɪ d
adweinir	a d w e i̯ n ɪ r
adwen	a d w ɛ n
adwthio	a d ʊ θ j ɔ
aech	aː ɨ̯ χ
aed	aː ɨ̯ d
aeled	e ɨ̯ l ɛ d
aelod	e ɨ̯ l ɔ d
aelwyd	e ɨ̯ l ʊ ɨ̯ d
aem	aː ɨ̯ m
aent	aː ɨ̯ n t
aer	aː ɨ̯ r
aeronen	e ɨ̯ r ɔ n a n
aeronen	e ɨ̯ r ɔ n ɛ n
aeron	e ɨ̯ r ɔ n
aethai	e ɨ̯ θ a i̯
aethant	e ɨ̯ θ a n t
aeth	aː θ
aeth	aː ɨ̯ θ
aethech	e ɨ̯ θ ɛ χ
aethem	e ɨ̯ θ ɛ m
aethent	e ɨ̯ θ ɛ n t
aethid	e ɨ̯ θ ɪ d
aethit	e ɨ̯ θ ɪ t
aethoch	e ɨ̯ θ ɔ χ
aethom	e ɨ̯ θ ɔ m
aethon	e ɨ̯ θ ɔ n
aethont	e ɨ̯ θ ɔ n t
aethost	e ɨ̯ θ ɔ s d
aethpwyd	e ɨ̯ θ p ʊ ɨ̯ d
aethwn	e ɨ̯ θ ʊ n
af	aː
afalau	a v a l a
afalau	a v a l a ɨ̯
afalau	a v a l ɛ
afalau	v a l a
afalau	v a l ɛ
afal	a v a l
afallen	a v a ɬ ɛ n
afan	a v a n
afanc	a v a ŋ k
afanen	a v a n ɛ n
af	aː v
affrica	a f r ɪ k a
aflwyddiannus	a v l ʊ ɨ̯ ð j a n ɨ̞ s
afocado	a v ɔ k a d ɔ
afon	a v ɔ n
afonfarch	a v ɔ n v a r χ
afonfeirch	a v ɔ n v e i̯ r χ
afraid	a v r a i̯ d
afu	a v ɨ̞
ag	a ɡ
ager	a ɡ ɛ r
agora	a ɡ ɔ r a
agoraf	a ɡ ɔ r a
agoraf	a ɡ ɔ r a v
agorai	a ɡ ɔ r a i̯
agor	a ɡ ɔ r
agoret	a ɡ ɔ r ɛ t
agoriad	a ɡ ɔ r j a d
agori	a ɡ ɔ r i
agos	a ɡ ɔ s
agweddi	a ɡ w ɛ ð ɪ
âi	aː i̯
aidd	a i̯ ð
aifft	a i̯ f t
ail	a i̯ l
aillt	a i̯ ɬ d
ailosod	a i̯ l ɔ s ɔ d
air	a i̯ r
ais	a i̯ s
ait	a i̯ t
âl	aː l
alarch	a l a r χ
alaw	a l a u̯
alban	a l b a n
albwm	a l b ʊ m
all	a ɬ
alla	a ɬ a
allai	a ɬ a i̯
allai	a ɬ ɛ
allan	a ɬ a n
allanfa	a ɬ a n v a
allant	a ɬ a n t
allen	a ɬ ɛ n
aller	a ɬ ɛ r
allgofnodi	a ɬ ɡ ɔ v n ɔ d i
alli	a ɬ i
allo	a ɬ ɔ
allor	a ɬ ɔ r
allt	aː ɬ t
alltud	a ɬ d ɨ̞ d
allwedd	a ɬ w ɛ ð
allweddell	a ɬ w ɛ ð ɛ ɬ
allwthio	a ɬ ʊ θ j ɔ
almaen	a l m a ɨ̯ n
almaeneg	a l m e ɨ̯ n ɛ ɡ
almaenwr	a l m e ɨ̯ n ʊ r
almanac	a l m a n a k
alwminiwm	a l ʊ m ɪ n j ʊ m
amaethyddiaeth	a m e ɨ̯ θ ə ð j a ɨ̯ θ
amaethyddiaeth	a m e ɨ̯ θ ə ð j ɛ θ
am	a m
amau	a m a
amau	a m a ɨ̯
amau	a m ɛ
amcan	a m k a n
amcangyfrif	a m k a ŋ ɡ ə v r ɪ
amcangyfrif	a m k a ŋ ɡ ə v r ɪ v
amddiffyn	a m ð ɪ f ɨ̞ n
amddiffynnaf	a m ð ɪ f ə n a v
ameba	a m ɛ b a
america	a m ɛ r ɪ k a
amffibiad	a m f ɪ b j a d
amguedd	a m ɡ ɨ̞ ɛ ð
amgueddfa	a m ɡ ɨ̞ ɛ ð v a
amgyffred	a m ɡ ə f r ɛ d
amgylch	a m ɡ ɨ̞ l χ
amgylchedd	a m ɡ ə l χ ɛ ð
amgylcheddol	a m ɡ ə l χ ɛ ð ɔ l
amhenodol	a m h ɛ n ɔ d ɔ l
amheuaeth	a m h e ɨ̯ a ɨ̯ θ
amheuaeth	a m h e ɨ̯ ɛ θ
amheuaf	a m h e ɨ̯ a
amheuaf	a m h e ɨ̯ a v
amlach	a m l a χ
amlen	a m l ɛ n
amlwg	a m l ʊ ɡ
amnewid	a n n ɛ u̯ ɪ d
amobr	a m ɔ b r
amod	a m ɔ d
amrant	a m r a n t
amrantiad	a m r a n t j a d
amrwd	a m r ʊ d
amryw	a m r ɪ u̯
amrywedd	a m r ɪ u̯ j ɛ ð
amrywiad	a m r ɪ u̯ j a d
amrywiaeth	a m r ɪ u̯ j a ɨ̯ ð
amrywiaeth	a m r ɪ u̯ j ɛ θ
amrywio	a m r ɪ u̯ j ɔ
amrywiol	a m r ɪ u̯ j ɔ l
amser	a m s a r
amser	a m s ɛ r
amwythig	a m ʊ ɨ̯ θ ɪ ɡ
anabl	a n a b l
anabledd	a n a b l ɛ ð
anableddau	a n a b l ɛ ð a
anableddau	a n a b l ɛ ð a ɨ̯
anableddau	a n a b l ɛ ð ɛ
anadlu	a n a d l ɨ
anafa	a n a v a
anafai	a n a v a i̯
anafais	a n a v ɪ ʃ
anafais	a n a v a i̯ s
anafais	a n a v ɛ s
anaf	a n a v
anafes	a n a v ɛ s
anafu	a n a v ɨ
ân	aː n
aneiriol	a n e i̯ r j ɔ l
anffurfiol	a n f ɨ̞ r v j ɔ l
anfonaf	a n v ɔ n a v
anfon	a n v ɔ n
angel	a ŋ a l
angel	a ŋ ɛ l
angen	a ŋ a n
angen	a ŋ ɛ n
angharad	a ŋ h a r a d
angheuol	a ŋ h e ɨ̯ ɔ l
anghofio	a ŋ h ɔ v j ɔ
anghofrwydd	a ŋ h ɔ v r ʊ ɨ̯ ð
anghofus	a ŋ h ɔ v ɨ̞ s
anghofuster	a ŋ h ɔ v ɨ̞ s d ɛ r
anghydfod	a ŋ h ə d v ɔ d
anghydradd	a ŋ h ə d r a ð
anghydraddoldeb	a ŋ h ə d r a ð ɔ l d ɛ b
anghyfartal	a ŋ h ə v a r t a l
anghyflawn	a ŋ h ə v l a u̯ n
anghyfreithlon	a ŋ h ə v r e i̯ θ l ɔ n
anghymeradwyaeth	a ŋ h ə m ɛ r a d ʊ ɨ̯ a ɨ̯ θ
anghymeradwyaeth	a ŋ h ə m ɛ r a d ʊ ɨ̯ ɛ θ
anghymreig	a ŋ h ə m r e i̯ ɡ
anghymreigio	a ŋ h ə m r e i̯ ɡ j ɔ
anghywir	a ŋ h ə u̯ ɪ r
angladd	a ŋ l a ð
angladdau	a ŋ l a ð a
angladdau	a ŋ l a ð a ɨ̯
angladdau	a ŋ l a ð ɛ
angof	a ŋ ɔ v
angylaidd	a ŋ
angylaidd	a ŋ ə l a i̯ ð
angylaidd	a ŋ ə l ɛ ð
angyles	a ŋ ə l ɛ s
anialwch	a n j a l ʊ χ
anifail	a n ɪ v a i̯ l
anifail	a n ɪ v ɛ l
anner	a n ɛ r
annerbyniol	a n ɛ r b ə n j o l
annerch	a n ɛ r χ
annog	a n ɔ ɡ
annwyd	a n ʊ ɨ̯ d
annwyl	a n ʊ ɨ̯ l
anoddach	a n ɔ ð a χ
anoddaf	a n ɔ ð a
anoddaf	a n ɔ ð a v
anodd	a n ɔ ð
anodded	a n ɔ ð ɛ d
anogaf	a n ɔ ɡ a
anogaf	a n ɔ ɡ a v
anrheg	a n r̥ ɛ ɡ
anrhydeddu	a n r̥ ə d ɛ ð ɨ
ansawdd	a n s a u̯ ð
ansoddair	a n s ɔ ð a i̯ r
ânt	aː n t
antimoni	a n t ɪ m ɔ n i
anweddu	a n w ɛ ð ɨ
ap	a p
apêl	a p eː l
aradr	a r a d
aradr	a r a d r
araf	a r a
araf	a r a v
arall	a r a ɬ
aran	a r a n
ar	a r
arbedaf	a r b ɛ d a
arbedaf	a r b ɛ d a v
arbed	a r b ɛ d
archfarchnad	a r χ v a r χ n a d
ardal	a r d a l
ardaloedd	a r d a l ɔ ɨ̯ ð
arddaf	a r ð a v
arddwrn	a r ð ʊ r n
aredaf	a r ɛ d a
aredaf	a r ɛ d a v
aredig	a r ɛ d ɪ ɡ
aren	a r ɛ n
arestio	a r ɛ s t j ɔ
arfedd	a r v a ð
arfedd	a r v ɛ ð
arfeddog	a r v ɛ ð ɔ ɡ
arfer	a r v a r
arfer	a r v ɛ r
arglwydd	a r ɡ l ʊ ɨ̯ ð
arholiad	a r h ɔ l j a d
arholiadau	a r h ɔ l j a d a
arholiadau	a r h ɔ l j a d a ɨ̯
arholiadau	a r h ɔ l j a d ɛ
arholiadau	a r ɔ l j a d a
arholiadau	a r ɔ l j a d ɛ
arholi	a r h ɔ l ɪ
arhosaf	a r h ɔ s a v
arian	a r j a n
ariannog	a r j a n ɔ ɡ
arllwysaf	a r ɬ ʊ ɨ̯ s a
arllwysaf	a r ɬ ʊ ɨ̯ s a v
arllwys	a r ɬ ʊ ɨ̯ s
arlwy	a r l u ɨ̯
armenia	a r m ɛ n j a
arna	a r n a
arnat	a r n a t
arni	a r n ɪ
aros	a r ɔ s
arosfa	a r ɔ s v a
arthan	a r θ a n
arth	a r θ
arwain	a r w a i̯ n
arwain	a r w ɛ n
arweiniad	a r w e i̯ n j a d
arweinydd	a r w e i̯ n ɨ̞ ð
arweinyddion	a r w e i̯ n ə ð j ɔ n
arwynebedd	a r w ɨ̞ n ɛ b ɛ ð
asen	a s ɛ n
asgwrn	a s ɡ ʊ r n
asid	a s ɪ d
asyn	a s ɨ̞ n
ata	a t a
atal	a t a l
atalnod	a t a l n ɔ d
at	a t
atebaf	a t ɛ b a
atebaf	a t ɛ b a v
ateli	a t ɛ l i
atelid	a t ɛ l ɪ d
athrawes	a θ r a u̯ ɛ s
ati	a t i
ato	a t ɔ
aton	a t ɔ n
aur	a ɨ̯ r
awch	a u̯ χ
awchus	a u̯ χ ɨ̞ s
awd	a u̯ d
awdl	a u̯ d l
awen	a u̯ ɛ n
awgrym	a u̯ ɡ r ɨ̞ m
awgrymiad	a u̯ ɡ r ə m j a d
awgrymog	a u̯ ɡ r ə m ɔ ɡ
awgrymu	a u̯ ɡ r ə m ɨ
awn	a u̯ n
awr	a u̯ r
awst	a u̯ s d
awydd	a u̯ ɨ̞ ð
awyr	a u̯ ɨ̞ r
baban	b a b a n
babi	b a b ɪ
babis	b a b ɪ s
babŵn	b a b uː n
bach	b aː χ
bachgennyn	b a χ ɡ ɛ n i̞ n
bae	b aː ɨ̯
baedd	b aː ɨ̯ ð
baet	b aː ɨ̯ t
baith	b a i̯ θ
banana	b a n a n a
ban	b a n
bangor	b a ŋ ɡ ɔ r
banjo	b a n d͡ʒ ɔ
bara	b a r a
barcud	b a r k ɨ̞ d
bardd	b a r ð
barfog	b a r v ɔ ɡ
barnau	b a r n a
barnau	b a r n a ɨ̯
barnau	b a r n ɛ
barn	b a r n
barnu	b a r n ɨ
barod	b a r ɔ d
barotach	b a r ɔ t a χ
baroted	b a r ɔ t ɛ d
bas	b aː s
basen	b a s a n
basen	b a s ɛ n
basen	b ə s a n
basen	b ə s ɛ n
basen	s a n
basen	s ɛ n
basio	b a ʃ ɔ
baw	b a u̯
bawdd	b a u̯ ð
bawn	b a u̯ n
be'	b eː
be'	b ɛ
bechan	b ɛ χ a n
bedd	b eː ð
bedr	b ɛ d r
bedw	b ɛ d ʊ
bedwen	b ɛ d w a n
bedwen	b ɛ d w ɛ n
beic	b e i̯ k
beichiog	b e i̯ χ j ɔ ɡ
beidr	b e i̯ d r
belffast	b ɛ l f a s d
ben	b ɛ n
bengwin	b ɛ ŋ ɡ w ɪ n
bengwiniaid	b ɛ ŋ ɡ w ɪ n j a i̯ d
bengwiniaid	b ɛ ŋ ɡ w ɪ n j ɛ d
ber	b ɛ r
berf	b ɛ r v
berfenw	b ɛ r v ɛ n u
beth	b eː θ
bigan	b ɪ ɡ a n
big	b iː ɡ
biliwn	b ɪ l j ʊ n
bin	b iː n
bin	b ɪ n
bioleg	b j ɔ l ɛ ɡ
biolegol	b j ɔ l ɛ ɡ ɔ l
biolegydd	b j ɔ l ɛ ɡ ɨ ð
birmingham	b ə r m ɪ ŋ h a m
blaen	b l aː ɨ̯ n
blaidd	b l a i̯ ð
blanced	b l a ŋ k a d
blanced	b l a ŋ k ɛ d
ble	b l eː
bleiddiaid	b l e i̯ ð j a i̯ d
bleiddiaid	b l e i̯ ð j ɛ d
bleiddiau	b l e i̯ ð j a
bleiddiau	b l e i̯ ð j a ɨ̯
bleiddiau	b l e i̯ ð j ɛ
blin	b l iː n
blith	b l iː θ
blodau	b l ɔ d a
blodau	b l ɔ d a ɨ̯
blodau	b l ɔ d ɛ
blodyn	b l ɔ d ɨ̞ n
blorai	b l ɔ r a i̯
blwch	b l uː χ
bobl	b ɔ b l
bobl	b ɔ b ɔ l
bobloedd	b ɔ b l ɔ ɨ̯ ð
boch	b oː χ
bochdew	b ɔ χ d ɛ u̯
bod	b oː d
bodd	b oː ð
boenen	b ɔ ɨ̯ n ɛ n
bol	b ɔ l
bôm	b oː m
bôn	b oː n
bondigrybwyll	b ɔ n d ɪ ɡ r ə b ʊ ɨ̯ ɬ
boptai	b ɔ p t a i̯
bopty	b ɔ p t ɨ
bord	b ɔ r d
bordydd	b ɔ r d ɨ̞ ð
bore	b ɔ r a
bore	b ɔ r ɛ
brad	b r aː d
braenu	b r e i̯ n i
braenu	b r e ɨ̯ n ɨ̞
braf	b r aː v
braich	b r a i̯ χ
brain	b r a i̯ n
brân	b r aː n
braster	b r a s t ɛ r
brasterog	b r a s d ɛ r ɔ ɡ
brathu	b r a θ ɨ̞
brawd	b r a u̯ d
brechdan	b r ɛ χ d a n
brecsit	b r ɛ k s ɪ t
brecwast	b r ɛ k w a s t
brenhines	b r ɛ n h ɪ n a s
brenhines	b r ɛ n h ɪ n ɛ s
brenin	b r ɛ n ɪ n
bresych	b r ɛ s ɨ̞ χ
bresychen	b r ɛ s ə χ a n
bresychen	b r ɛ s ə χ ɛ n
brexit	b r ɛ k s ɪ t
bri	b r iː
brics	b r ɪ k s
bricsen	b r ɪ k s a n
bricsen	b r ɪ k s ɛ n
bricyll	b r ɪ k ɨ̞ ɬ
brif	b r iː v
brig	b r iː ɡ
brith	b r iː θ
briw	b r ɪ u̯
broch	b r oː χ
brochion	b r ɔ χ j ɔ n
brochod	b r ɔ χ ɔ d
broga	b r ɔ ɡ a
bron	b r ɔ n
bronwen	b r ɔ n w ɛ n
brown	b r o u̯ n
brwdfrydedd	b r ʊ d v r ə d a ð
brwdfrydedd	b r ʊ d v r ə d ɛ ð
brwyn	b r uː ɨ̯ n
brwysg	b r uː ɨ̯ s k
bryd	b r ɨː d
bryfed	b r ə v a d
bryfed	b r ə v ɛ d
bryngaer	b r ə ŋ ɡ a ɨ̯ r
bryngaer	b r ɨ̞ ŋ ɡ a ɨ̯ r
brys	b r ɨː s
bryste	b r ɨ̞ s t ɛ
brython	b r ə θ ɔ n
brythoneg	b r ə θ ɔ n ɛ ɡ
bual	b ɨ̞ a l
buan	b ɨ̞ a n
budd	b ɨː ð
buddugoliaeth	b ɨ̞ ð ɨ̞ ɡ ɔ l j a ɨ̯ θ
buddugoliaeth	b ɨ̞ ð ɨ̞ ɡ ɔ l j ɛ θ
bugail	b ɪ ɡ a i̯ l
bugail	b ɪ ɡ ɛ l
bum	b ɨ̞ m
bûm	b ɨː m
bur	b ɨː r
buwch	b ɨ u̯ χ
bwced	b ʊ k a d
bwced	b ʊ k ɛ d
bwch	b uː χ
bwlch	b ʊ l χ
bwrdd	b ʊ r ð
bwrw	b ʊ r u
bwyd	b uː ɨ̯ d
bwyta	b ə t a
bwyta	b ʊ ɨ̯ t a
bwytadwy	b ʊ ɨ̯ t a d ʊ ɨ̯
bychan	b ə χ a n
byd	b ɨː d
bydd	b ɨː ð
byddi	b ə ð ɪ
byddin	b ə ð ɪ n
byddwch	b ə ð ʊ χ
byddwn	b ə ð ʊ n
byr	b ɨ̞ r
byrddydd	b ə r ð ɨ̞ ð
bysell	b ə s ɛ ɬ
bysellfwrdd	b ə s ɛ ɬ v ʊ r ð
byth	b ɨː θ
byw	b ɪ u̯
bywgraffiadur	b ɪ u̯ ɡ r a f j a d ɨ̞ r
bywiog	b ɨ̞ u̯ j ɔ ɡ
bywyd	b ə u̯ ɨ̞ d
cachai	k a χ a i̯
cachai	k a χ ɛ
cachais	k a χ a i̯ s
cachais	k a χ ɛ s
cacha	k a χ a
cachan	k a χ a n
cachen	k a χ ɛ n
caches	k a χ ɛ s
cachet	k a χ ɛ t
cachi	k a χ ɪ
cach	k aː χ
cachlwyth	k a χ l ʊ ɨ̯ θ
cachu	k a χ ɨ̞
cactws	k a k t ʊ s
cacwn	k a k ʊ n
cadach	k a d a χ
cadair	k a d a i̯ r
cadair	k a d a r
cadair	k a d ɛ r
cadd	k aː ð
cadernid	k a d ɛ r n i d
cad	k aː d
cadnawes	k a d n a u̯ ɛ s
cadno	k a d n ɔ
cadwch	k a d ʊ χ
cadw	k a d ʊ
cadwyn	k a d ʊ ɨ̯ n
caeaf	k e ɨ̯ a
caeaf	k e ɨ̯ a v
caed	k aː ɨ̯ d
caeir	k e ɨ̯ ɪ r
cae	k aː ɨ̯
cael	k aː l
cael	k aː ɨ̯ l
caem	k aː ɨ̯ m
caen	k aː ɨ̯ n
caerdydd	k a ɨ̯ r d ɨː ð
caerdydd	k ə r d ɨː ð
caeredin	k a ɨ̯ r ɛ d ɨ̞ n
caerfaddon	k a ɨ̯ r v a ð ɔ n
caergaint	k a ɨ̯ r ɡ a i̯ n t
caergrawnt	k a ɨ̯ r ɡ r a u̯ n t
caerhirfryn	k a ɨ̯ r h ɪ r v r ɨ̞ n
caer	k aː ɨ̯ r
caerliwelydd	k a ɨ̯ r l ɪ u̯ ɛ l ɨ̞ ð
caerloyw	k a ɨ̯ r l ɔ ɨ̯ ʊ
caerlŷr	k a ɨ̯ r l ɨː r
caersallog	k a ɨ̯ r s a ɬ ɔ ɡ
caerwrangon	k a ɨ̯ r w r a ŋ ɔ n
caerwynt	k a ɨ̯ r w ɨ̞ n t
caerwysg	k a ɨ̯ r uː ɨ̯ s ɡ
caerwysg	k a ɨ̯ r w ɨ̯ː s ɡ
cafas	k a v a s
caffai	k a f a i̯
caffed	k a f ɛ d
caffel	k a f ɛ l
caffent	k a f ɛ n t
caffer	k a f ɛ r
caffîn	k a f iː n
cafiar	k a v j a r
cafiâr	k a v j aː r
caf	k aː
caf	k aː v
cafon	k a v ɔ n
caill	k a i̯ ɬ
cain	k a i̯ n
caint	k a i̯ n t
cais	k a i̯ s
cait	k a i̯ t
ca	k aː
cala	k a l a
calan	k a l a n
caled	k a l a d
caled	k a l ɛ d
caledu	k a l ɛ d ɨ
calenigion	k a l ɛ n ɪ ɡ j ɔ n
caleted	k a l ɛ t ɛ d
calon	k a l ɔ n
calsiwm	k a l s j ʊ m
camgymeriad	k a m ɡ ə m ɛ r j a d
camlwrw	k a m l ʊ r ʊ
camu	k a m ɨ
canaf	k a n a v
canai	k a n a i̯
canai	k a n ɛ
canais	k a n ɪ ʃ
canais	k a n a i̯ s
canais	k a n ɛ ʃ
canais	k a n ɛ s
cana	k a n a
canant	k a n a n t
canem	k a n ɛ m
canen	k a n ɛ n
canent	k a n ɛ n t
caner	k a n ɛ r
canes	k a n ɛ s
canet	k a n ɛ t
cangarŵ	k a ŋ ɡ a r uː
canghellor	k a ŋ h ɛ ɬ ɔ r
canhwyllau	k a n h ʊ ɨ̯ ɬ a ɨ̯
canhwyllau	k a n h ʊ i̯ ɬ a
canhwyllau	k a n h ʊ i̯ ɬ ɛ
canhwyllbren	k a n h ʊ ɨ̯ ɬ b r ɛ n
cani	k a n ɪ
canit	k a n ɪ t
cân	k aː n
canlyniad	k a n l ə n j a d
canlyn	k a n l ɨ̞ n
canlynol	k a n l ə n ɔ l
cannwyll	k a n ʊ ɨ̯ ɬ
cano	k a n ɔ
canolaf	k a n ɔ l a v
canolbarth	k a n ɔ l b a r θ
canolig	k a n ɔ l ɪ ɡ
canoli	k a n ɔ l i
canol	k a n ɔ l
canolog	k a n ɔ l ɔ ɡ
canon	k a n ɔ n
cansai	k a n s a i̯
cansai	k a n s ɛ
cansen	k a n s ɛ n
cant	k a n t
canu	k a n ɨ̞
canwr	k a n ʊ r
canwyllbrennau	k a n ʊ ɨ̯ ɬ b r ɛ n a
canwyllbrennau	k a n ʊ ɨ̯ ɬ b r ɛ n a ɨ̯
canwyllbrennau	k a n ʊ ɨ̯ ɬ b r ɛ n ɛ
capel	k a p ɛ l
carai	k a r a i̯
carai	k a r ɛ
carais	k a r ɪ ʃ
carais	k a r a i̯ s
carais	k a r ɛ ʃ
carais	k a r ɛ s
cara	k a r a
caran	k a r a n
carant	k a r a n t
carbon	k a r b ɔ n
cared	k a r ɛ d
carem	k a r ɛ m
caren	k a r ɛ n
carent	k a r ɛ n t
carer	k a r ɛ r
cares	k a r ɛ s
carest	k a r ɛ s d
caret	k a r ɛ t
carfil	k a r v ɪ l
cariad	k a r j a d
cari	k a r ɪ
carit	k a r ɪ t
car	k a r
câr	k aː r
carnedd	k a r n ɛ ð
caro	k a r ɔ
carom	k a r ɔ m
caron	k a r ɔ n
carreg	k a r a ɡ
carreg	k a r ɛ ɡ
carsi	k a r s i
carthen	k a r θ a n
carthen	k a r θ ɛ n
carthennau	k a r θ ɛ n a
carthennau	k a r θ ɛ n a ɨ̯
carthennau	k a r θ ɛ n ɛ
carthenni	k a r θ ɛ n ɪ
cartref	k a r t r a
cartref	k a r t r ɛ
cartref	k a r t r ɛ v
cartre	k a r t r a
cartre	k a r t r ɛ v
caru	k a r ɨ̞
carw	k a r ʊ
carwr	k a r ʊ r
casáu	k a s a ɨ̯
casgen	k a s ɡ ɛ n
casglu	k a s ɡ l ɨ
cas	k aː s
casnewydd	k a s n ɛ u̯ ɨ̞ ð
casnewydd	k aː s n ɛ u̯ ɨ̞ ð
castanwydden	k a s d a n w ɨ̞ ð a n
castanwydden	k a s d a n w ɨ̞ ð ɛ n
castanwydd	k a s d a n w ɨ̞ ð
castell	k a s d a ɬ
castell	k a s d ɛ ɬ
cathbysgod	k a θ b ə s ɡ ɔ d
cath	k aː θ
cato	k a t ɔ
cawl	k a u̯ l
cawn	k a u̯ n
cawr	k a u̯ r
caws	k a u̯ s
cbac	k b a k
cedor	k ɛ d ɔ r
ceffyl	k ɛ f ɨ̞ l
cefnau	k ɛ v n a
cefnau	k ɛ v n a ɨ̯
cefnau	k ɛ v n ɛ
cefnfor	k e v n v ɔ r
cefn	k ɛ v n
cefnog	k ɛ v n ɔ ɡ
cegin	k ɛ ɡ ɪ n
ceg	k eː ɡ
cei	k e i̯
ceiliog	k e i̯ l j ɔ ɡ
ceillgwd	k e i ɬ ɡ ʊ d
ceinach	k e i̯ n a χ
ceiniog	k e i̯ n j ɔ ɡ
ceirios	k e i̯ r j ɔ s
ceir	k e i̯ r
ceisio	k e i̯ ʃ ɔ
celai	k ɛ l a i̯
celen	k ɛ l ɛ n
celet	k ɛ l ɛ t
celli	k ɛ ɬ ɪ
cell	k ɛ ɬ
celyn	k ɛ l ɨ̞ n
celynnen	k ɛ l ə n a n
celynnen	k ɛ l ə n ɛ n
cenedl	k ɛ n ɛ d l
cenhedlu	k ɛ n h ɛ d l ɨ̞
ceni	k ɛ n ɪ
cen	k ɛ n
cerais	k ɛ r a i̯ s
cerdded	k ɛ r ð ɛ d
cerdd	k ɛ r ð
cerddoriaeth	k ɛ r ð ɔ r j a ɨ̯ θ
cerddoriaeth	k ɛ r ð ɔ r j ɛ θ
ceri	k ɛ r ɪ
cerir	k ɛ r ɪ r
cer	k ɛ r
cerpyn	k ɛ r p ɨ̞ n
cerrig	k ɛ r ɪ ɡ
cerwch	k ɛ r ʊ χ
cerwyn	k ɛ r u ɨ̯ n
cesail	k ɛ s a i̯ l
cesail	k ɛ s ɛ l
cesar	k ɛ s a r
cest	k ɛ s d
cestyll	k ɛ s d ɨ̞ ɬ
ceulo	k e ɨ̯ l ɔ
cewri	k ɛ u̯ r i
chacha	χ a χ a
chachi	χ a χ ɪ
chad	χ aː d
chael	χ aː l
chael	χ aː ɨ̯ l
chaen	χ aː ɨ̯ n
chae	χ aː ɨ̯
chafas	χ a v a s
chaffed	χ a f ɛ d
chaffer	χ a f ɛ r
chaint	χ a i̯ n t
chain	χ a i̯ n
chais	χ a i̯ s
chalan	χ a l a n
chaled	χ a l a d
chaled	χ a l ɛ d
chalenigion	χ a l ɛ n ɪ ɡ j ɔ n
chalennig	χ a l ɛ n ɪ ɡ
chaleted	χ a l ɛ t ɛ d
chalon	χ a l ɔ n
chana	χ a n a
chanes	χ a n ɛ s
chani	χ a n ɪ
chansen	χ a n s ɛ n
chant	χ a n t
chanu	χ a n ɨ̞
chân	χ aː n
charai	χ a r a i̯
charai	χ a r ɛ
charan	χ a r a n
chara	χ a r a
chared	χ a r ɛ d
chares	χ a r ɛ s
charet	χ a r ɛ t
chari	χ a r ɪ
charo	χ a r ɔ
char	χ a r
chastell	χ a s d a ɬ
chastell	χ a s d ɛ ɬ
chas	χ aː s
chath	χ aː θ
chato	χ a t ɔ
chaws	χ a u̯ s
chdi	χ d iː
chefnau	χ ɛ v n a
chefnau	χ ɛ v n a ɨ̯
chefnau	χ ɛ v n ɛ
chefn	χ ɛ v n
chei	χ e i̯
chell	χ ɛ ɬ
chelyn	χ ɛ l ɨ̞ n
cherir	χ ɛ r ɪ r
cheri	χ ɛ r ɪ
chestyll	χ ɛ s d ɨ̞ ɬ
chest	χ ɛ s t
ches	χ eː s
chi	χ iː
chloan	χ l ɔ a n
chlwb	χ l ʊ b
chlybiau	χ l ə b j a
chlybiau	χ l ə b j a ɨ̯
chlybiau	χ l ə b j ɛ
chlyw	χ l ɪ u̯
chly	χ l ɨː
chnwd	χ n uː d
choed	χ oː ɨ̯ d
choeg	χ oː ɨ̯ ɡ
chor	χ ɔ r
chosyn	χ ɔ s ɨ̞ n
christ	χ r iː s t
chrwth	χ r uː θ
chul	χ ɨː l
chusanau	χ ɨ̞ s a n a
chusanau	χ ɨ̞ s a n a ɨ̯
chusanau	χ ɨ̞ s a n ɛ
chusanu	χ ɨ̞ s a n ɨ̞
chusan	χ ɨ̞ s a n
chut	χ ɨ̞ t
chu	χ ɨː
chwaer	χ w aː ɨ̯ r
chwalu	χ w a l ɨ̞
chwannog	χ w a n ɔ ɡ
chwarae	χ w a r a
chwarae	χ w a r a ɨ̯
chwarae	χ w a r ɛ
chwarel	χ w a r a l
chwarel	χ w a r ɛ l
chwarren	χ w a r ɛ n
chwech	χ w eː χ
chwedl	χ w ɛ d l
chwefror	χ w ɛ v r ɔ r
chwern	χ w ɛ r n
chwerw	χ w ɛ r ʊ
chwe	χ w eː
chwilio	χ w ɪ l j ɔ
chwisgi	w ɪ s ɡ i
chwisgi	χ w ɪ s ɡ i
chwith	χ w iː θ
chwi	χ w iː
chwrs	χ ʊ r s
chwydd	χ uː ɨ̯ ð
chwydd	χ w ɨː ð
chwyrnaf	χ w ə r n a v
chwyrnu	χ w ə r n ɨ
chwyrn	χ w ɨ̞ r n
chwys	χ w ɨː s
chwythaf	χ w ə θ a
chwythaf	χ w ə θ a v
chwythu	χ w ə θ ɨ̞
chwyth	χ w ɨː θ
chyfiawnder	χ ə v j a u̯ n d ɛ r
chyfreithiwr	χ ə v r e i̯ θ j ʊ r
chymaint	χ ə m a i̯ n t
chymaint	χ ə m ɛ n t
chymorth	χ ə m ɔ r θ
chymru	χ ə m r ɨ̞
chythraul	χ ə θ r a l
chythraul	χ ə θ r a ɨ̯ l
chythraul	χ ə θ r ɛ l
chythreuliaid	χ ə θ r e ɨ̯ l j a i̯ d
chythreuliaid	χ ə θ r e ɨ̯ l j ɛ d
'ch	χ
cigfran	k ɪ ɡ v r a n
cig	k iː ɡ
ci	k iː
cilbost	k ɪ l b ɔ s t
cilbren	k ɪ l b r ɛ n
cilddant	k ɪ l ð a n t
cildroi	k ɪ l d r ɔ i̯
cildwrn	k ɪ l d ʊ r n
ciledrych	k ɪ l ɛ d r ɨ χ
cilfach	k ɪ l v a χ
cilgant	k ɪ l ɡ a n t
cilio	k ɪ l j ɔ
cil	k iː l
cilwen	k ɪ l w ɛ n
cilwg	k ɪ l ʊ ɡ
ciwdod	k ɪ u̯ d ɔ d
claddu	k l a ð ɨ̞
claf	k l aː v
clas	k l aː s
clau	k l a ɨ̯
cledd	k l eː ð
cledr	k l ɛ d r
clefyd	k l ɛ v ɨ̞ d
clirio	k l ɪ r j ɔ
cloan	k l ɔ a n
cloch	k l oː χ
cloddfa	k l ɔ ð v a
cloem	k l oː ɨ̯ m
cloen	k l oː ɨ̯ n
cloent	k l oː ɨ̯ n t
cloi	k l ɔ i̯
clois	k l ɔ i̯ s
cloit	k l ɔ i̯ t
clo	k l oː
closed	k l ɔ s ɛ d
closen	k l ɔ s ɛ n
closet	k l ɔ s ɛ t
clou	k l ɔ ɨ̯
clown	k l ɔ u̯ n
clustdlws	k l ɨ̞ s d l ʊ s
clust	k l ɨː s t
clwb	k l ʊ b
clwt	k l ʊ t
clwyd	k l uː ɨ̯ d
clybiau	k l ə b j a
clybiau	k l ə b j a ɨ̯
clybiau	k l ə b j ɛ
cly	k l ɨː
clymu	k l ə m ɨ̞
clywaf	k l ə w a v
clywed	k l ə u̯ a d
clywed	k l ə u̯ ɛ d
clywedog	k l ə u̯ ɛ d ɔ ɡ
clyw	k l ɪ u̯
cnau	k n a ɨ̯
cnuchio	k n ɨ̞ χ j ɔ
cnwd	k n uː d
cobra	k ɔ b r a
coch	k oː χ
cochyn	k ɔ χ ɨ̞ n
coden	k ɔ d ɛ n
codi	k ɔ d i
coeden	k ɔ ɨ̯ d a n
coeden	k ɔ ɨ̯ d ɛ n
coed	k oː ɨ̯ d
coeg	k oː ɨ̯ ɡ
coegog	k ɔ ɨ̯ ɡ ɔ ɡ
coelcerth	k ɔ ɨ̯ l k ɛ r θ
coelio	k ɔ i̯ l j ɔ
coelio	k ɔ ɨ̯ l j ɔ
coel	k oː ɨ̯ l
coes	k oː ɨ̯ s
coffi	k ɔ f i
cofiai	k ɔ v j a i̯
cofiais	k ɔ v ɪ ʃ
cofiais	k ɔ v j a i̯ s
cofiais	k ɔ v j ɛ ʃ
cofiais	k ɔ v j ɛ s
cofia	k ɔ v j a
cofiem	k ɔ v j ɛ m
cofio	k ɔ v j ɔ
cofiwn	k ɔ v j ʊ n
cof	k oː
cof	k oː v
cofnodi	k ɔ v n ɔ d i
cofnodion	k ɔ v n ɔ d j ɔ n
cofnod	k ɔ v n ɔ d
coginio	k ɔ ɡ ɪ n j ɔ
cog	k oː ɡ
coleg	k ɔ l ɛ ɡ
colfen	k ɔ l v ɛ n
colli	k ɔ ɬ i
collnod	k ɔ ɬ n ɔ d
colomen	k ɔ l ɔ m ɛ n
coma	k ɔ m a
condemni	k ɔ n d ɛ m n ɪ
condemnio	k ɔ n d ɛ m n j ɔ
cont	k ɔ n t
conwy	k ɔ n ʊ ɨ̯
copïo	k ɔ p ɪ ɔ
copog	k ɔ p ɔ ɡ
corff	k ɔ r f
corgi	k ɔ r ɡ i
corgwn	k ɔ r ɡ ʊ n
corhedydd	k ɔ r h ɛ d ɨ̞ ð
cor	k ɔ r
côr	k oː r
corn	k ɔ r n
corwg	k ɔ r ʊ ɡ
cosyn	k ɔ s ɨ̞ n
craf	k r aː v
crair	k r a i̯ r
cramen	k r a m ɛ n
credaf	k r ɛ d a
credaf	k r ɛ d a v
creda	k r ɛ d a
credant	k r ɛ d a n t
credent	k r ɛ d ɛ n t
creder	k r ɛ d ɛ r
credes	k r ɛ d ɛ s
credet	k r ɛ d ɛ t
credi	k r ɛ d ɪ
credit	k r ɛ d ɪ t
cred	k r eː d
credo	k r ɛ d ɔ
credu	k r ɛ d ɨ
cref	k r eː
cref	k r eː v
crempog	k r ɛ m p ɔ ɡ
creto	k r ɛ t ɔ
crëwr	k r ɛ ʊ r
crëyr	k r ɛ ɨ̞ r
crist	k r iː s t
criw	k r ɪ u̯
croeniog	k r ɔ ɨ̯ n j ɔ ɡ
croen	k r oː ɨ̯ n
croesair	k r ɔ ɨ̯ s a i̯ r
croesffordd	k r ɔ ɨ̯ s f ɔ r ð
croesgad	k r ɔ ɨ̯ s ɡ a d
croeshoeliad	k r ɔ ɨ̯ s h ɔ ɨ̯ l j a d
croeshoelio	k r ɔ ɨ̯ s h ɔ ɨ̯ l j ɔ
croesholi	k r ɔ ɨ̯ s h ɔ l ɪ
croesi	k r ɔ ɨ̯ s i
croes	k r oː ɨ̯ s
croestorri	k r ɔ ɨ̯ s d ɔ r ɪ
crog	k r oː ɡ
croglen	k r ɔ ɡ l ɛ n
cromfach	k r ɔ m v a χ
cromlech	k r ɔ m l ɛ χ
cronni	k r ɔ n i
croth	k r oː θ
crwban	k r ʊ b a n
crwn	k r ʊ n
crwth	k r uː θ
crwydr	k r ʊ ɨ̯ d r
crwyn	k r uː ɨ̯ n
crychydd	k r ə χ ɨ̞ ð
cryf	k r ɨː
cryf	k r ɨː v
crymu	k r ə m ɨ
crynhoad	k r ə n h ɔ a d
crynu	k r ə n ɨ̞
crynwr	k r ə n ʊ r
crynwyr	k r ə n w ɨ̞ r
cucumer	k ɨ̞ k ɨ̞ m ɛ r
cuddio	k ɪ ð j o
cudyn	k ɨ̞ d ɨ̞ n
cu	k ɨː
cul	k ɨː l
cusanau	k ɨ̞ s a n a
cusanau	k ɨ̞ s a n a ɨ̯
cusanau	k ɨ̞ s a n ɛ
cusan	k ɨ̞ s a n
cusanu	k ɨ̞ s a n ɨ
cut	k ɨ̞ t
cwar	k w a r
cwb	k ʊ b
cwd	k uː d
cwestiwn	k w ɛ s t j ʊ n
cwis	k w ɪ s
cwlwm	k ʊ l ʊ m
cwm	k ʊ m
cwmpas	k ʊ m p a s
cwmpawd	k ʊ m p a u̯ d
cwmwd	k ʊ m ʊ d
cwmwl	k ʊ m ʊ l
cwningen	k ʊ n ɪ ŋ a n
cwningen	k ʊ n ɪ ŋ ɛ n
cŵn	k uː n
cwpwrdd	k ʊ p ʊ r ð
cwrs	k ʊ r s
cwrw	k ʊ r ʊ
cwsg	k uː s ɡ
cwta	k ʊ t a
cwtiar	k ʊ t j a r
cwymp	k w ɨ̯ m p
cwympo	k w ɨ m p ɔ
cwynion	k ʊ ɨ̯ n j ɔ n
cwyn	k uː ɨ̯ n
cwyno	k ʊ ɨ̯ n ɔ
cwyr	k uː ɨ̯ r
cydbreswylwyr	k ɨː d b r ɛ s ʊ ɨ̯ l w ɨ̞ r
cyd	k ɨː d
cyfarch	k ə v a r χ
cyfarchol	k ə v a r χ ɔ l
cyfaredd	k ə v a r ɛ ð
cyfareddol	k ə v a r ɛ ð ɔ l
cyfarfod	k ə v a r v ɔ d
cyfartaledd	k ə v a r t a l ɛ ð
cyfartal	k ə v a r t a l
cyfartalog	k ə v a r t a l ɔ ɡ
cyfarwyddwr	k ə v a r ʊ ɨ̯ ð ʊ r
cyfarwys	k ə v a r ʊ ɨ̯ s
cyfathrach	k ə v a θ r a χ
cyfddydd	k ə v ð ɨ̞ ð
cyfeillgar	k ə v e i̯ ɬ ɡ a r
cyfeirio	k ə v e i̯ r j ɔ
cyfenw	k ə v ɛ n ʊ
cyfernod	k ə v ɛ r n ɔ d
cyfforddus	k ə f ɔ r ð ɨ̞ s
cyffwrdd	k ə f ʊ r ð
cyffylog	k ə f ə l ɔ ɡ
cyfiawnder	k ə v j a u̯ n d a r
cyfiawnder	k ə v j a u̯ n d ɛ r
cyfieithu	k ə v j e i̯ θ ɨ
cyfieithydd	k ə v j e i̯ θ ɨ̞ ð
cyfle	k ə v l a
cyfle	k ə v l ɛ
cyflwr	k ə v l ʊ r
cyflwyno	k ə v l ʊ ɨ̯ n ɔ
cyfnewid	k ə v n ɛ u̯ ɪ d
cyfnither	k ə v n ɪ θ a r
cyfnither	k ə v n ɪ θ ɛ r
cyfnod	k ə v n ɔ d
cyfnos	k ə v n ɔ s
cyfoethog	k ə v ɔ ɨ̯ θ ɔ ɡ
cyfraith	k ə v r a i̯ θ
cyfraith	k ə v r ɛ θ
cyfrannog	k ə v r a n ɔ ɡ
cyfreithiwr	k ə v r e i̯ θ j ʊ r
cyfrifeg	k ə v r ɪ v ɛ ɡ
cyfrifiad	k ə v r ɪ v j a d
cyfrifiant	k ə v r ɪ v j a n t
