a	aː
harth	h a r θ
hatyr	h a t ɨ̞ r
haul	h a ɨ̯ l
hawdd	h a u̯ ð
hawlfraint	h a u̯ l v r a i̯ n t
hawl	h a u̯ l
hawlio	h a u̯ l j ɔ
heb	h ɛ b
hedd	h eː ð
heddiw	h ɛ ð ɪ u̯
heddlu	h ɛ ð l ɨ
heddluoedd	h ɛ ð l ɨ̞ ɔ ɨ ð
heddwas	h ɛ ð w a s
hedfan	h ɛ d v a n
hedyn	h ɛ d ɨ̞ n
hefin	h ɛ v ɪ n
hefo	h ɛ v ɔ
hefyd	h ɛ v ɨ̞ d
heglwys	h ɛ ɡ l ʊ ɨ̯ s
heirdd	h e i̯ r ð
heisteddfodau	h e i̯ s d ɛ ð v ɔ d a
heisteddfodau	h e i̯ s d ɛ ð v ɔ d a ɨ̯
heisteddfodau	h e i̯ s d ɛ ð v ɔ d ɛ
heisteddfod	h e i̯ s d ɛ ð v ɔ d
helaeth	h ɛ l a ɨ̞ θ
helaeth	h ɛ l ɛ θ
hel	h ɛ l
heliwm	h ɛ l j ʊ m
help	h ɛ l p
helygen	h ɛ l ə ɡ a n
helygen	h ɛ l ə ɡ ɛ n
helyg	h ɛ l ɪ ɡ
helyg	h ɛ l ɨ̞ ɡ
henaint	h ɛ n a i̯ n t
henffordd	h ɛ n f ɔ r ð
henghraifft	h ɛ ŋ̊ r a i̯ f d
henghraifft	h ɛ ŋ̊ r ɛ f d
hen	h eː n
heno	h ɛ n ɔ
henw	h ɛ n u
heog	h ɛ ɔ ɡ
heol	h ɛ ɔ l
heraill	h ɛ r ɪ ɬ
heraill	h ɛ r a i ɬ
her	h ɛ r
heuldro	h e ɨ̯ l d r ɔ
heulsaf	h e ɨ̯ l s a v
hiach	h j aː χ
hiâ	h j aː
hiddewiaeth	h ɪ ð e u̯ j a ɨ θ
hiddewiaeth	h ɪ ð e u̯ j ɛ θ
hifanc	h ɪ v a ŋ k
hi	h iː
hiraeth	h ɪ r a ɨ̯ θ
hiraeth	h ɪ r ɛ θ
hirddydd	h ɪ r ð ɨ̞ ð
hir	h iː r
hoed	h oː ɨ̯ d
hoelio	h ɔ i̯ l j ɔ
hoelio	h ɔ ɨ̯ l j ɔ
hoen	h oː ɨ̯ n
hoffen	h ɔ f ɛ n
hoffest	h ɔ f ɛ s d
hoffet	h ɔ f ɛ t
hoff	h oː f
hoffi	h ɔ f i
hofran	h ɔ v r a n
hofrennydd	h ɔ v r ɛ n ɨ̞ ð
holi	h ɔ l i
holl	h oː ɬ
hon	h ɔ n
honno	h ɔ n ɔ
hoyw	h ɔ ɨ̯ u
huan	h ɨ a n
huddygl	h ɨ̞ ð ɨ̞ ɡ l
hud	h ɨː d
hudo	h ɨ̞ d ɔ
hufen	h ɨ̞ v a n
hufen	h ɨ̞ v ɛ n
hugain	h ɪ ɡ a i̯ n
hugain	h ɪ ɡ j a n
huna	h ɨ̞ n a
hunanladdwr	h i̞ n a n ɬ a ð ʊ r
hun	h ɨː n
hunllef	h ɨ̞ n ɬ a
hunllef	h ɨ̞ n ɬ ɛ
hunllef	h ɨ̞ n ɬ ɛ v
huno	h ɨ̞ n ɔ
hwch	h uː χ
hwn	h ʊ n
hwnna	h ʊ n a
hwnnw	h ʊ n u
hwntw	h ʊ n t u
hwntws	h ʊ n t u s
hwpo	h ʊ p ɔ
hwyaden	h ʊ ɨ̯ a d a n
hwyaden	h ʊ ɨ̯ a d ɛ n
hwyaden	χ w a d a n
hwyad	h ʊ ɨ̯ a d
hwyaid	h ʊ ɨ̯ a i̯ d
hwyaid	h ʊ ɨ̯ ɛ d
hwylbren	h ʊ ɨ̯ l b r ɛ n
hwyl	h uː ɨ̯ l
hwyr	h uː ɨ̯ r
hwythfed	h ʊ ɨ̯ θ v a d
hwythfed	h ʊ ɨ̯ θ v ɛ d
hych	h ɨː χ
hychod	h ə χ ɔ d
hydrefau	h ə d r ɛ v a
hydrefau	h ə d r ɛ v a ɨ̯
hydrefau	h ə d r ɛ v ɛ
hydref	h ə d r a
hydref	h ə d r ɛ
hydref	h ə d r ɛ v
hyfed	h ə v ɛ d
hylif	h ə l ɪ v
hyll	h ɪ ɬ
hyll	h ɨ̞ ɬ
hymasiad	h ə m a ʃ a d
hymenyn	h ə m ɛ n ɨ̞ n
hynafol	h ə n a v ɔ l
hynny	h ə n ɨ
hynod	h ə n ɔ d
hynt	h ɨ̞ n t
hysbys	h ə s b ɨ̞ s
hysgi	h ə s ɡ i
hywel	h ə u̯ ɛ l
iäaidd	j a a i̯ ð
iach	j aː χ
iaith	j a i̯ θ
iâ	j aː
iâr	j aː r
iarll	j a r ɬ
iau	j a ɨ̯
iawn	j a u̯ n
ichwi	ɪ χ w i
iddewiaeth	ɪ ð e u̯ j a ɨ θ
iddewiaeth	ɪ ð e u̯ j ɛ θ
iddi	ɪ ð i
iddo	ɪ ð ɔ
iddyn	ɪ ð ɨ̞ n
iddynt	ɪ ð ɨ̞ n t
iechyd	j ɛ χ ɨ̞ d
ieirll	j e i̯ r ɬ
ieithadur	j e i θ a d ɨ̞ r
ieithoedd	j e i̯ θ ɔ ɨ̯ ð
ieithyddiaeth	j e i̯ θ ə ð j a ɨ̯ θ
ieithyddiaeth	j e i̯ θ ə ð j ɛ θ
iesu	j ɛ s ɨ
iet	j ɛ t
ieuanc	j e ɨ̯ a ŋ k
ieuan	j e ɨ̯ a n
ieuenctid	j e ɨ ɛ ŋ k t ɪ d
ifanc	ɪ v a ŋ k
ifan	ɪ v a n
'i	iː
imi	ɪ m i
im	ɪ m
in	ɪ n
inni	ɪ n i
ioan	j ɔ a n
iogwrt	j ɔ ɡ ʊ r t
ionawr	j ɔ n a u̯ r
iorwg	j ɔ r ʊ ɡ
ir	iː r
iro	ɪ r ɔ
isel	ɨ̞ s a l
isel	ɨ̞ s ɛ l
isod	ɪ s ɔ d
iti	ɪ t i
it	ɪ t
iwan	ɪ u̯ a n
iwch	ɪ u̯ χ
iwerddoneg	ɪ u̯ ɛ r ð ɔ n ɛ ɡ
iwerddon	ɪ u̯ ɛ r ð ɔ n
iwrch	j ʊ r χ
i'w	ɪ u̯
jôc	d͡ʒ oː k
labovaidd	l a b ɔ v a i̯ ð
ladd	l aː ð
ladin	l a d ɪ n
ladron	l a d r ɔ n
laeth	l aː ɨ̯ θ
laith	l a i̯ θ
lanach	l a n a χ
lanaf	l a n a
lanaf	l a n a v
laned	l a n ɛ d
lan	l a n
lân	l aː n
lasach	l a s a χ
lased	l a s ɛ d
lasen	l a s ɛ n
las	l aː s
lawio	l a u̯ j ɔ
lawn	l a u̯ n
ledled	l ɛ d l ɛ d
leicia	l e i̯ k j a
leicia	l ɪ k j a
leician	l e i̯ k j a n
leician	l ɪ k j a n
leicio	l e i̯ k j ɔ
leicio	l ɪ k j ɔ
leidr	l e i̯ d r
leihau	l e i̯ h a ɨ̯
leision	l e i̯ ʃ ɔ n
le	l eː
lemon	l ɛ m ɔ n
lemwn	l ɛ m ʊ n
lerpwl	l ɛ r p ʊ l
lestr	l ɛ s t r
letysen	l ɛ t ə s a n
letysen	l ɛ t ə s ɛ n
letys	l ɛ t ɨ s
leuen	l e ɨ̯ ɛ n
lifft	l ɪ f d
lindys	l ɪ n d ɨ̞ s
lindysyn	l ɪ n d ə s ɨ̞ n
lin	l iː n
lladd	ɬ aː ð
lladin	ɬ a d ɪ n
lladrad	ɬ a d r a d
lladron	ɬ a d r ɔ n
llaeth	ɬ aː ɨ̯ θ
llaid	ɬ a i̯ d
llais	ɬ a i̯ s
llaith	ɬ a i̯ θ
llam	ɬ a m
llan	ɬ a n
llanelli	ɬ a n ɛ ɬ i
llanw	ɬ a n u
llasen	ɬ a s ɛ n
llaswyr	ɬ a s ʊ ɨ̯ r
llau	ɬ a ɨ̯
llawen	ɬ a u̯ a n
llawen	ɬ a u̯ ɛ n
llawer	ɬ a u̯ a r
llawer	ɬ a u̯ ɛ r
llawn	ɬ a u̯ n
llawr	ɬ a u̯ r
llawysgrif	ɬ a u̯ ə s ɡ r ɪ v
llech	ɬ eː χ
llechi	ɬ ɛ χ i
lledieithog	ɬ ɛ d j e i̯ θ ɔ ɡ
lledr	ɬ ɛ d r
lle	ɬ eː
llefarydd	ɬ ɛ v a r ɨ̞ ð
lleidr	ɬ e i̯ d r
lleihau	ɬ e i̯ h a ɨ̯
llen	ɬ ɛ n
llên	ɬ eː n
llenydda	ɬ ɛ n ə ð a
llenyddiaeth	ɬ ɛ n ə ð j a ɨ̯ θ
llenyddiaeth	ɬ ɛ n ə ð j ɛ θ
llenyddol	ɬ ɛ n ə ð ɔ l
lleoli	ɬ ɛ ɔ l i
llestr	ɬ ɛ s t r
lleuad	ɬ e ɨ̯ a d
lleuen	ɬ e ɨ̯ a n
lleuen	ɬ e ɨ̯ ɛ n
llewod	ɬ ɛ u̯ ɔ d
llid	ɬ iː d
llifogydd	ɬ i v ɔ ɡ ɨ̞ ð
llinell	ɬ ɪ n a ɬ
llinell	ɬ ɪ n ɛ ɬ
llinos	ɬ ɪ n ɔ s
llith	ɬ iː θ
llithro	ɬ ɪ θ r ɔ
lliw	ɬ ɪ u̯
lliwyddion	ɬ ɪ u̯ ə ð j ɔ n
lliwydd	ɬ ɪ u̯ ɨ̞ ð
llnau	ɬ n a ɨ̯
lloc	ɬ ɔ k
lloegr	ɬ ɔ ɨ̯ ɡ ə r
lloegr	ɬ ɔ ɨ̯ ɡ r
lloer	ɬ oː ɨ̯ r
llong	ɬ ɔ ŋ
llonydd	ɬ ɔ n ɨ̞ ð
llo	ɬ oː
llosgi	ɬ ɔ s ɡ i
llosg	ɬ ɔ s ɡ
llost	ɬ ɔ s d
llu	ɬ ɨː
lluddias	ɬ ɨ̞ ð j a s
lludw	ɬ ɨ̞ d u
llundain	ɬ ɨ̞ n d a i̯ n
llundain	ɬ ɨ̞ n d a n
llundain	ɬ ɨ̞ n d ɛ n
llun	ɬ ɨː n
llusen	ɬ ɨ̞ s a n
llusen	ɬ ɨ̞ s ɛ n
llus	ɬ ɨː s
llwch	ɬ uː χ
llwchwr	ɬ ʊ χ ʊ r
llwgu	ɬ ʊ ɡ ɨ
llwnc	ɬ ʊ ŋ k
llwybr	ɬ ʊ ɨ̯ b r
llwyddo	ɬ ʊ ɨ̯ ð ɔ
llwydo	ɬ ʊ ɨ̯ d ɔ
llwyd	ɬ uː ɨ̯ d
llychlyn	ɬ ə χ l ɨ̞ n
llychlynnaidd	ɬ ə χ l ə n a i̯ ð
llydan	ɬ ə d a n
llydaw	ɬ ə d a u̯
llyffant	ɬ ə f a n t
llyfrau	ɬ ə v r a
llyfrau	ɬ ə v r a ɨ̯
llyfrau	ɬ ə v r ɛ
llyfrgell	ɬ ə v r ɡ ɛ ɬ
llyfr	ɬ ɨ̞ v r
llyfr	ɬ ɨ̞ v ɨ̞ r
llyfu	ɬ ə v ɨ
llyf	ɬ ɨː v
llygad	ɬ ɨ̞ ɡ a d
llygad	ɬ ə ɡ a d
llygaid	ɬ ɨ̞ ɡ a i̯ d
llygaid	ɬ ə ɡ a i̯ d
llygaid	ɬ ɨ̞ ɡ ɛ d
llygaid	ɬ ə ɡ ɛ d
llygod	ɬ ə ɡ ɔ d
llygru	ɬ ə ɡ r ɨ
llyn	ɬ ɨ̞ n
llysenw	ɬ ɨ̞ s ɛ n u
llysenw	ɬ ɨ̞ː s ɛ n u
llysiau	ɬ ə ʃ a
llysiau	ɬ ə ʃ a ɨ̯
llysiau	ɬ ə ʃ ɛ
llysieuyn	ɬ ə ʃ e ɨ̯ ɨ̞ n
llys	ɬ ɨː s
llythyr	ɬ ə θ ɨ̞ r
llywelyn	ɬ ə u̯ ɛ l ɨ̞ n
llywio	ɬ ɨ u̯ j ɔ
llywodraethu	ɬ ə u̯ ɔ d r e ɨ̯ θ ɨ
llyw	ɬ ɨ̞ u̯
llywy	ɬ ə ʊ̯ ɨ
loc	l ɔ k
loegr	l ɔ ɨ̯ ɡ ə r
loegr	l ɔ ɨ̯ ɡ r
lolfa	l ɔ l v a
lol	l ɔ l
loncian	l ɔ n k j a n
lonciwr	l ɔ n k j ʊ r
long	l ɔ ŋ
lowri	l o u̯ r i
lun	l ɨː n
lydan	l ə d a n
lydaw	l ə d a u̯
lyf	l ɨː v
lyfrau	l ə v r a
lyfrau	l ə v r a ɨ̯
lyfrau	l ə v r ɛ
lyfr	l ɨ̞ v r
lyfr	l ɨ̞ v ɨ̞ r
lygad	l ɨ̞ ɡ a d
lygad	l ə ɡ a d
lygaid	l ɨ̞ ɡ a i̯ d
lygaid	l ə ɡ a i̯ d
lygaid	l ɨ̞ ɡ ɛ d
lygaid	l ə ɡ ɛ d
lyn	l ɨ̞ n
lysenw	l ɨ̞ s ɛ n u
lysenw	l ɨ̞ː s ɛ n u
lys	l ɨː s
mab	m aː b
machgenyn	m a χ ɡ ɛ n i̞ n
mach	m aː χ
madfall	m a d v a ɬ
madfallod	m a d v a ɬ ɔ d
mad	m aː d
mae	m a
mae	m aː ɨ̯
mae	m ə
maen	m a n
maen	m aː ɨ̯ n
maen	m ə n
maent	m a ɨ̯ n t
maes	m aː ɨ̯ s
maestref	m e ɨ s d r ɛ v
mafon	m a v ɔ n
mag	m aː ɡ
mai	m a
mai	m a i̯
main	m a i̯ n
maint	m a i̯ n t
mair	m a i̯ r
malwod	m a l w ɔ d
'ma	m a
mam	m a m
mamoth	m a m ɔ θ
manceinion	m a ŋ k e i̯ n j ɔ n
maneg	m a n a ɡ
maneg	m a n ɛ ɡ
mango	m a ŋ ɡ ɔ
man	m a n
mara	m a r a
march	m a r χ
marchogaeth	m a r χ ɔ ɡ a ɨ̯ θ
marchogaeth	m a r χ ɔ ɡ ɛ θ
marchog	m a r χ ɔ ɡ
marnau	m a r n a
marnau	m a r n a ɨ̯
marnau	m a r n ɛ
marwnad	m a r n a d
marwnad	m a r w n a d
masen	m a s a n
masen	m a s ɛ n
masnachdy	m a s n a χ d ɨ
mathemateg	m a θ ɛ m a t ɛ ɡ
math	m aː θ
mawr	m a u̯ r
mawrth	m a u̯ r θ
meddal	m ɛ ð a l
medd	m eː ð
meddwl	m ɛ ð ʊ l
meddw	m ɛ ð u
medi	m ɛ d i
medra	m ɛ d r a
medran	m ɛ d r a n
medren	m ɛ d r ɛ n
medro	m ɛ d r ɔ
medru	m ɛ d r ɨ
medru	m ɛ d r i
mefusen	m ɛ v ɨ̞ s a n
mefusen	m ɛ v ɨ̞ s ɛ n
mefus	m ɛ v ɨ̞ s
megis	m ɛ ɡ ɪ s
mehefin	m ɛ h ɛ v ɪ n
melen	m ɛ l ɛ n
melin	m ɛ l ɪ n
mêl	m eː l
melon	m ɛ l ɔ n
melyngoch	m ɛ l ə ŋ ɡ ɔ χ
melynion	m ɛ l ə n j ɔ n
melyn	m ɛ l ɨ̞ n
melys	m ɛ l ɨ̞ s
melyster	m ɛ l ə s d ɛ r
menig	m ɛ n ɪ ɡ
menyn	m ɛ n ɨ̞ n
menyw	m ɛ n ɨ̞ u̯
mercher	m ɛ r χ a r
mercher	m ɛ r χ ɛ r
merch	m ɛ r χ
mercwri	m ɛ r k ʊ r i
merfenw	m ɛ r v ɛ n u
mesur	m ɛ s ɨ̞ r
methan	m ɛ θ a n
mether	m ɛ θ ɛ r
methi	m ɛ θ i
metho	m ɛ θ ɔ
methu	m ɛ θ ɨ
mewngofnodi	m ɛ u̯ ŋ ɡ ɔ v n ɔ d i
mewn	m ɛ u̯ n
mewn	m ɨ̞ u̯ n
mewnol	m ɛ u̯ n ɔ l
mewnrwyd	m ɛ u̯ n r ʊ ɨ̯ d
mhaith	m̥ a i̯ θ
mharod	m̥ a r ɔ d
mhengwiniaid	m̥ ɛ ŋ ɡ w ɪ n j a i̯ d
mhengwiniaid	m̥ ɛ ŋ ɡ w ɪ n j ɛ d
mhengwin	m̥ ɛ ŋ ɡ w ɪ n
mhen	m̥ ɛ n
mheth	m̥ eː θ
mhobl	m̥ ɔ b l
mhobl	m̥ ɔ b ɔ l
mhobloedd	m̥ ɔ b l ɔ ɨ̯ ð
mhont	m̥ ɔ n t
mhoptai	m̥ ɔ p t a i̯
mhopty	m̥ ɔ p t ɨ
mhrif	m̥ r iː v
mhryfed	m̥ r ə v a d
mhryfed	m̥ r ə v ɛ d
mhum	m̥ ɨ̞ m
migwrn	m ɪ ɡ ʊ r n
milcant	m i l k a n t
miliwn	m ɪ l j ʊ n
mil	m iː l
milwr	m ɪ l ʊ r
milwyr	m ɪ l w ɨ̞ r
mislif	m ɪ s l ɪ v
mislifol	m ɪ s l ɪ v ɔ l
mis	m iː s
mlaidd	m l a i̯ ð
mleiddiaid	m l e i̯ ð j a i̯ d
mleiddiaid	m l e i̯ ð j ɛ d
mleiddiau	m l e i̯ ð j a
mleiddiau	m l e i̯ ð j a ɨ̯
mleiddiau	m l e i̯ ð j ɛ
mlodau	m l ɔ d a
mlodau	m l ɔ d a ɨ̯
mlodau	m l ɔ d ɛ
mlodyn	m l ɔ d ɨ̞ n
moch	m oː χ
mochyn	m ɔ χ ɨ̞ n
modd	m oː ð
modfedd	m ɔ d v a ð
modfedd	m ɔ d v ɛ ð
mod	m oː d
modrwy	m ɔ d r ʊ ɨ̯
moel	m oː ɨ̯ l
moes	m oː ɨ̯ s
mollt	m oː ɬ d
mol	m ɔ l
môn	m oː n
mordydd	m ɔ r d ɨ̞ ð
more	m ɔ r a
more	m ɔ r ɛ
morfil	m ɔ r v ɪ l
môr	m oː r
morwennol	m oː r w ɛ n ɔ l
morwennol	m ɔ r w ɛ n ɔ l
morwyn	m ɔ r ʊ ɨ̯ n
motél	m ɔ t ɛ l
mrain	m r a i̯ n
mrân	m r aː n
mrecwast	m r ɛ k w a s t
mri	m r iː
mroch	m r oː χ
mron	m r ɔ n
munud	m ɨ̞ n ɨ̞ d
mur	m ɨː r
mwcws	m ʊ k ʊ s
mẁg	m ʊ ɡ
mwg	m uː ɡ
mwll	m ʊ ɬ
mwnci	m ʊ ŋ k i
mwncïod	m ʊ ŋ k ɪ ɔ d
mwng	m ʊ ŋ
mwnt	m ʊ n t
mwyaf	m ʊ ɨ̯ a
mwyaf	m ʊ ɨ̯ a v
mwyafrif	m ʊ ɨ̯ a v r ɪ v
mwyalchen	m u ɨ̯ a l χ a n
mwyalchen	m u ɨ̯ a l χ ɛ n
mwyara	m ʊ ɨ̯ a r a
mwyaren	m ʊ ɨ̯ a r a n
mwyaren	m ʊ ɨ̯ a r ɛ n
mwyar	m ʊ ɨ̯ a r
mwyd	m uː ɨ̯ d
mwyeilch	m u ɨ̯ e i̯ l χ
mwy	m uː ɨ̯
mwynach	m ʊ ɨ̯ n a χ
mwynhau	m ʊ ɨ̯ n h a ɨ̯
myfanwy	m ə v a n ʊ ɨ̯
myfyriwr	m ə v ə r j ʊ r
myfyrwyr	m ə v ə r w ɨ̞ r
mynd	m ɨ̞ n
mynd	m ɨ̞ n d
mynedadwy	m ə n ɛ d a d ʊ ɨ̯
mynediad	m ə n ɛ d j a d
myned	m ə n ɛ d
mynwy	m ə n ʊ ɨ̯
mynychu	m ə n ə χ ɨ
mynyddig	m ə n ə ð ɪ ɡ
mynydd	m ə n ɨ̞ ð
mynyddoedd	m ə n ə ð ɔ ɨ̯ ð
myrddiwn	m ə r ð j ʊ n
myrdd	m ɨ̞ r ð
myr	m ɨ̞ r
mys	m iː s
mys	m ɨː s
nabl	n a b l
nabod	n a b ɔ d
nadolig	d ɔ l ɪ ɡ
nadolig	n a d ɔ l ɪ ɡ
nadredd	n a d r ɛ ð
nadroedd	n a d r ɔ ɨ̯ ð
naet	n aː i̯ t
nage	n a ɡ ɛ
nag	n a ɡ
naid	n a i̯ d
nail	n a i̯ l
nai	n a i̯
'na	n a
na	n a
na	n aː
nant	n a n t
nathlu	n a θ l ɨ
nawfed	n a u̯ v a d
nawfed	n a u̯ v ɛ d
naw	n a u̯
nawn	n a u̯ n
nawr	n a u̯ r
negfed	n ɛ ɡ v a d
negfed	n ɛ ɡ v ɛ d
neidio	n e i̯ d j ɔ
neidit	n e i̯ d ɪ t
neidr	n e i̯ d r
neilen	n e i̯ l a n
neilen	n e i̯ l ɛ n
nei	n e i̯
neithiwr	n e i̯ θ j ʊ r
neithiwyr	n e i̯ θ j ʊ ɨ̯ r
neng	n eː ŋ
nentydd	n ɛ n t ɨ̞ ð
nerf	n ɛ r v
nerfus	n ɛ r v ɨ̞ s
nerth	n ɛ r θ
nerthoedd	n ɛ r θ ɔ ɨ̯ ð
nes	n eː s
nes	n ɛ s
nest	n ɛ s d
neuaddau	n e ɨ̯ a ð a
neuaddau	n e ɨ̯ a ð a ɨ̯
neuaddau	n e ɨ̯ a ð ɛ
neuadd	n e ɨ̯ a ð
neuddegfed	n e ɨ̯ ð ɛ ɡ v a d
neuddegfed	n e ɨ̯ ð ɛ ɡ v ɛ d
neuddeg	n e ɨ̯ ð a ɡ
neuddeg	n e ɨ̯ ð ɛ ɡ
neud	n e ɨ̯ d
neu	n e ɨ̯
newid	n ɛ u̯ ɪ d
newydd	n ɛ u̯ ɨ̞ ð
newyn	n ɛ u̯ ɨ̞ n
ngadael	ŋ a d a l
ngadael	ŋ a d a ɨ̯ l
ngadael	ŋ a d ɛ l
ngair	ŋ a i̯ r
ngâl	ŋ aː l
ngeiriadurwr	ŋ e i̯ r j a d ɨ̞ r ʊ r
ngeiriadurwyr	ŋ e i̯ r j a d ɨ̞ r w ɨ̞ r
ngelli	ŋ ɛ ɬ ɪ
ngelyn	ŋ ɛ l ɨ̞ n
nghad	ŋ̊ aː d
nghael	ŋ̊ aː l
nghael	ŋ̊ aː ɨ̯ l
nghae	ŋ̊ aː ɨ̯
nghain	ŋ̊ a i̯ n
nghaint	ŋ̊ a i̯ n t
nghais	ŋ̊ a i̯ s
nghalan	ŋ̊ a l a n
nghaled	ŋ̊ a l a d
nghaled	ŋ̊ a l ɛ d
nghalenigion	ŋ̊ a l ɛ n ɪ ɡ j ɔ n
nghalennig	ŋ̊ a l ɛ n ɪ ɡ
nghaleted	ŋ̊ a l ɛ t ɛ d
nghalon	ŋ̊ a l ɔ n
nghân	ŋ̊ aː n
nghant	ŋ̊ a n t
nghanu	ŋ̊ a n ɨ̞
nghar	ŋ̊ a r
nghastell	ŋ̊ a s d a ɬ
nghastell	ŋ̊ a s d ɛ ɬ
nghath	ŋ̊ aː θ
nghaws	ŋ̊ a u̯ s
nghefnau	ŋ̊ ɛ v n a
nghefnau	ŋ̊ ɛ v n a ɨ̯
nghefnau	ŋ̊ ɛ v n ɛ
nghefn	ŋ̊ ɛ v n
nghell	ŋ̊ ɛ ɬ
nghelyn	ŋ̊ ɛ l ɨ̞ n
nghestyll	ŋ̊ ɛ s d ɨ̞ ɬ
nghi	ŋ̊ iː
nghlwb	ŋ̊ l ʊ b
nghlybiau	ŋ̊ l ə b j a
nghlybiau	ŋ̊ l ə b j a ɨ̯
nghlybiau	ŋ̊ l ə b j ɛ
nghlyw	ŋ̊ l ɪ u̯
nghnwd	ŋ̊ n uː d
nghoed	ŋ̊ oː ɨ̯ d
nghosyn	ŋ̊ ɔ s ɨ̞ n
nghrist	ŋ̊ r iː s t
nghrwth	ŋ̊ r uː θ
nghusanau	ŋ̊ ɨ̞ s a n a
nghusanau	ŋ̊ ɨ̞ s a n a ɨ̯
nghusanau	ŋ̊ ɨ̞ s a n ɛ
nghusan	ŋ̊ ɨ̞ s a n
nghusanu	ŋ̊ ɨ̞ s a n ɨ̞
nghut	ŋ̊ ɨ̞ t
nghwrs	ŋ̊ ʊ r s
nghydbreswylwyr	ŋ̊ ɨː d b r ɛ s ʊ ɨ̯ l w ɨ̞ r
nghyfiawnder	ŋ̊ ə v j a u̯ n d ɛ r
nghyfreithiwr	ŋ̊ ə v r e i̯ θ j ʊ r
nghymaint	ŋ̊ ə m a i̯ n t
nghymaint	ŋ̊ ə m ɛ n t
nghymorth	ŋ̊ ə m ɔ r θ
nghymru	ŋ̊ ə m r ɨ̞
nghythraul	ŋ̊ ə θ r a l
nghythraul	ŋ̊ ə θ r a ɨ̯ l
nghythraul	ŋ̊ ə θ r ɛ l
nghythreuliaid	ŋ̊ ə θ r e ɨ̯ l j a i̯ d
nghythreuliaid	ŋ̊ ə θ r e ɨ̯ l j ɛ d
nglanach	ŋ l a n a χ
nglanaf	ŋ l a n a
nglanaf	ŋ l a n a v
nglaned	ŋ l a n ɛ d
nglân	ŋ l aː n
nglasach	ŋ l a s a χ
nglased	ŋ l a s ɛ d
nglas	ŋ l aː s
nglawio	ŋ l a u̯ j ɔ
ngleision	ŋ l e i̯ ʃ ɔ n
ngwahanol	ŋ w a h a n ɔ l
ngwain	ŋ w a i̯ n
ngwair	ŋ w a i̯ r
ngwario	ŋ w a r j ɔ
ngwddf	ŋ ʊ ð u
ngwddf	ŋ ʊ ð v
ngwddf	ŋ ʊ ð ʊ v
ngweddi	ŋ w ɛ ð i
ngweddïo	ŋ w ɛ ð ɪ ɔ
ngwella	ŋ w ɛ ɬ a
ngwennol	ŋ w ɛ n ɔ l
ngwenoliaid	ŋ w ɛ n ɔ l j a i̯ d
ngwenoliaid	ŋ w ɛ n ɔ l j ɛ d
ngwin	ŋ w iː n
ngwinoedd	ŋ w ɪ n ɔ ɨ̯ ð
ngwiwer	ŋ w ɪ u̯ a r
ngwiwer	ŋ w ɪ u̯ ɛ r
ngwiwerod	ŋ w ɪ u̯ ɛ r ɔ d
ngwlad	ŋ w l aː d
ngwledydd	ŋ w l ɛ d ɨ̞ ð
ngŵr	ŋ uː r
ngwybodaeth	ŋ w ɨ̞ b ɔ d a ɨ̯ θ
ngwybodaeth	ŋ w ɨ̞ b ɔ d ɛ θ
ngwybodaeth	ŋ w ə b ɔ d a ɨ̯ θ
ngwybodaeth	ŋ w ə b ɔ d ɛ θ
ngwybod	ŋ ʊ b ɔ d
ngwybod	ŋ w ɨ̞ b ɔ d
ngwychach	ŋ w ə χ a χ
ngwyched	ŋ w ə χ ɛ d
ngwych	ŋ w ɨː χ
ngwyddion	ŋ w ə ð j ɔ n
ngŵydd	ŋ uː ɨ̯ ð
ngwŷdd	ŋ w ɨː ð
ngŵyr	ŋ uː ɨ̯ r
ngwys	ŋ w ɨː s
ngwystl	ŋ w ɨ̞ s d l
nhad	n̥ aː d
nhalcen	n̥ a l k a n
nhalcen	n̥ a l k ɛ n
nhaliadau	n̥ a l j a d a
nhaliadau	n̥ a l j a d a ɨ̯
nhaliadau	n̥ a l j a d ɛ
nhâl	n̥ aː l
nhân	n̥ aː n
nharianau	n̥ a r j a n a
nharianau	n̥ a r j a n a ɨ̯
nharianau	n̥ a r j a n ɛ
nharian	n̥ a r j a n
nheigr	n̥ e i̯ ɡ r
nheigrod	n̥ e i̯ ɡ r ɔ d
nhe	n̥ eː
nhewed	n̥ ɛ u̯ ɛ d
nhewi	n̥ ɛ u̯ i
nhew	n̥ eː u̯
nheyrnaddoliant	n̥ e ɨ̯ r n a ð ɔ l j a n t
nhi	n̥ iː
nhraed	n̥ r aː ɨ̯ d
nhrefydd	n̥ r ɛ v ɨ̞ ð
nhre	n̥ r eː
nhroed	n̥ r oː ɨ̯ d
nhro	n̥ r oː
nhrwyddedau	n̥ r ʊ ɨ̯ ð ɛ d a
nhrwyddedau	n̥ r ʊ ɨ̯ ð ɛ d a ɨ̯
nhrwyddedau	n̥ r ʊ ɨ̯ ð ɛ d ɛ
nhrwydded	n̥ r ʊ ɨ̯ ð a d
nhrwydded	n̥ r ʊ ɨ̯ ð ɛ d
nhu	n̥ ɨː
nhŵr	n̥ uː r
nhŷ	n̥ ɨː
nhyrrau	n̥ ə r a
nhyrrau	n̥ ə r a ɨ
nhyrrau	n̥ ə r ɛ
nid	n ɪ d
ni	n iː
nitrogen	n ɪ t r ɔ ɡ ɛ n
niwclear	n ɪ u̯ k l ɛ a r
niweidio	n ɪ u̯ e i̯ d j ɔ
niwlen	n ɪ u̯ l ɛ n
niwliog	n ɪ u̯ l j ɔ ɡ
niwl	n ɪ u̯ l
niwlog	n ɪ u̯ l ɔ ɡ
'n	n
nodi	n ɔ d i
nod	n oː d
nodwydd	n ɔ d w ɨ̞ ð
nofio	n ɔ v j ɔ
nofiwr	n ɔ v j ʊ r
nofwraig	n ɔ v w r a i̯ ɡ
noli	n ɔ l i
nolis	n ɔ l ɪ s
nôl	n oː l
nos	n oː s
nwyf	n uː ɨ̯ v
nwy	n uː ɨ̯
nyddu	n ə ð ɨ
nyddu	n ə ð i
nymff	n ɨ̞ m f
nyrs	n ə r s
nyth	n ɨː θ
nythu	n ə θ ɨ
oce	ɔ k ɛ
ocê	ɔ k eː
ocr	ɔ k r
ocsigenu	ɔ k s ɪ ɡ ɛ n ɨ
oddeutu	ɔ ð e ɨ̯ t ɨ
oddf	ɔ ð v
odl	ɔ d l
oedd	oː ɨ̯ ð
oed	oː ɨ̯ d
oen	oː ɨ̯ n
oer	oː ɨ̯ r
oes	oː ɨ̯ s
oferedd	ɔ v ɛ r ɛ ð
ofergoel	ɔ v ɛ r ɡ ɔ i̯ l
ofergoel	ɔ v ɛ r ɡ ɔ ɨ̯ l
ofer	ɔ v ɛ r
offeren	ɔ f ɛ r ɛ n
offer	ɔ f a r
offer	ɔ f ɛ r
ogwr	ɔ ɡ ʊ r
oherwydd	ɔ h ɛ r w ɨ̞ ð
olddodiad	oː l ð ɔ d j a d
oni	ɔ n i
onnen	ɔ n a n
onnen	ɔ n ɛ n
onn	ɔ n
oren	ɔ r ɛ n
organig	ɔ r ɡ a n ɪ ɡ
oriau	ɔ r j a
oriau	ɔ r j a ɨ̯
oriau	ɔ r j ɛ
os	ɔ s
pabell	p a b a ɬ
pabell	p a b ɛ ɬ
padell	p a d a ɬ
padell	p a d ɛ ɬ
pafin	p a v ɪ n
paham	p a h a m
paith	p a i̯ θ
pajamas	p a d͡ʒ a m a s
palmant	p a l m a n t
palu	p a l ɨ
pam	p a m
pandai	p a n d a i̯
pandy	p a n d ɨ
pan	p a n
pant	p a n t
pa	p aː
papur	p a p ɨ̞ r
paradwys	p a r a d ʊ ɨ̯ s
parc	p a r k
parddu	p a r ð ɨ
parhau	p a r h a ɨ̯
parod	p a r ɔ d
parotach	p a r ɔ t a χ
paroted	p a r ɔ t ɛ d
parot	p a r ɔ t
parth	p a r θ
pasg	p aː s ɡ
pasiaf	p a ʃ a
pasiaf	p a ʃ a v
pasio	p a ʃ ɔ
pau	p a ɨ̯
pawb	p a u̯ b
pawb	p o u̯ b
pechadur	p ɛ χ a d ɨ̞ r
pechod	p ɛ χ ɔ d
pechu	p ɛ χ ɨ
pedair	p ɛ d a i̯ r
pedair	p ɛ d ɛ r
pedrongl	p ɛ d r ɔ ŋ l
pedr	p ɛ d r
pedrsill	p ɛ d r s ɪ ɬ
pedwaredd	p ɛ d w a r a ð
pedwaredd	p ɛ d w a r ɛ ð
pedwar	p ɛ d w a r
pedwerydd	p ɛ d w ɛ r ɪ̞ ð
peidio	p e i d j ɔ
peiriannau	p e i̯ r j a n a
peiriannau	p e i̯ r j a n a ɨ̯
peiriannau	p e i̯ r j a n ɛ
peirianneg	p e i̯ r j a n ɛ ɡ
peiriannol	p e i̯ r j a n ɔ l
peiriannwr	p e i̯ r j a n ʊ r
peiriant	p e i̯ r j a n t
peirianwaith	p e i̯ r j a n w a i̯ θ
peirianwaith	p e i̯ r j a n w ɛ θ
peithiau	p e i̯ θ j a
peithiau	p e i̯ θ j a ɨ̯
peithiau	p e i̯ θ j ɛ
pell	p ɛ ɬ
penddu	p ɛ n ð ɨ
penderfynu	p ɛ n d ɛ r v ə n ɨ
penelin	p ɛ n ɛ l ɪ n
penfelyn	p ɛ n v ɛ l ɨ̞ n
pengwiniaid	p ɛ ŋ ɡ w ɪ n j a i̯ d
pengwiniaid	p ɛ ŋ ɡ w ɪ n j ɛ d
pengwin	p ɛ ŋ ɡ w ɪ n
peniadau	p ɛ n j a d a
peniadau	p ɛ n j a d a ɨ̯
peniadau	p ɛ n j a d ɛ
peniad	p ɛ n j a d
pennau	p ɛ n a
pennau	p ɛ n a ɨ̯
pennau	p ɛ n ɛ
pen	p ɛ n
pentref	p ɛ n t r a
pentref	p ɛ n t r ɛ
pentref	p ɛ n t r ɛ v
pentwr	p ɛ n t ʊ r
pentyrru	p ɛ n t ə r ɨ
peren	p ɛ r a n
peren	p ɛ r ɛ n
perllan	p ɛ r ɬ a n
pêr	p eː r
perseiniol	p ɛ r s e i̯ n j ɔ l
perthi	p ɛ r θ i
perth	p ɛ r θ
pert	p ɛ r t
pesychu	p ɛ s ə χ ɨ
pethau	p ɛ θ a
pethau	p ɛ θ a ɨ̯
pethau	p ɛ θ ɛ
peth	p eː θ
petris	p ɛ t r ɪ s
phaith	f a i̯ θ
pharod	f a r ɔ d
pharotach	f a r ɔ t a χ
pharoted	f a r ɔ t ɛ d
phen	f ɛ n
phengwin	f ɛ ŋ ɡ w ɪ n
phengwiniaid	f ɛ ŋ ɡ w ɪ n j a i̯ d
phengwiniaid	f ɛ ŋ ɡ w ɪ n j ɛ d
pheth	f eː θ
phinc	f ɪ ŋ k
phobl	f ɔ b l
phobl	f ɔ b ɔ l
phobloedd	f ɔ b l ɔ ɨ̯ ð
phont	f ɔ n t
phoptai	f ɔ p t a i̯
phopty	f ɔ p t ɨ
phrif	f r iː v
phryfed	f r ə v a d
phryfed	f r ə v ɛ d
phum	f ɨ̞ m
phur	f ɨː r
pibgorn	p ɪ b ɡ ɔ r n
pibonwyen	p ɪ b ɔ n u ɨ̯ ɛ n
pibonwy	p ɪ b ɔ n u ɨ̯
pib	p iː b
pidyn	p ɪ d ɨ̞ n
pigan	p ɪ ɡ a n
piglas	p ɪ ɡ l a s
pig	p iː ɡ
pigwrn	p ɪ ɡ ʊ r n
pilen	p ɪ l ɛ n
pilipala	p ɪ l ɪ p a l a
pinafal	p iː n a v a l
pinafal	p ɪ n a v a l
pinc	p ɪ ŋ k
pin	p iː n
pîn	p iː n
pin	p ɪ n
pìn	p ɪ n
pioden	p j ɔ d a n
pioden	p j ɔ d ɛ n
pioden	p ɪ ɔ d a n
pioden	p ɪ ɔ d ɛ n
piod	p ɪ ɔ d
pïod	p ɪ ɔ d
piso	p ɪ s ɔ
piws	p ɪ u̯ s
plaid	p l a i̯ d
planhigyn	p l a n h ɪ ɡ ɨ̞ n
plannu	p l a n ɨ
plannu	p l a n i
plant	p l a n t
plastig	p l a s d ɪ ɡ
pleidiol	p l e i̯ d j ɔ l
pleidleisio	p l e i̯ d l e i̯ ʃ ɔ
plentyn	p l ɛ n t ɨ̞ n
pluf	p l ɨː v
plu	p l ɨː
plwm	p l ʊ m
plwyf	p l uː ɨ̯ v
p'nawn	p n a u̯ n
pobloedd	p ɔ b l ɔ ɨ̯ ð
poblog	p ɔ b l ɔ ɡ
pobl	p ɔ b l
pobl	p ɔ b ɔ l
pob	p oː b
poena	p ɔ ɨ̯ n a
poenen	p ɔ ɨ̯ n ɛ n
poeni	p ɔ i̯ n i
poeni	p ɔ ɨ̯ n ɨ
poenit	p ɔ ɨ̯ n ɪ t
poeth	p oː ɨ̯ θ
pont	p ɔ n t
poptai	p ɔ p t a i̯
popty	p ɔ p t ɨ
porchell	p ɔ r χ ɛ ɬ
porffor	p ɔ r f ɔ r
pori	p ɔ r i
post	p oː s d
powys	p o u̯ ɪ s
powys	p o u̯ ɨ̞ s
prawf	p r a u̯ v
pren	p r ɛ n
preswyl	p r ɛ s ʊ ɨ̯ l
pridd	p r iː ð
prifddinas	p r iː v ð ɪ n a s
prifddinas	p r ɪ v ð ɪ n a s
prifiau	p r ɪ v j a
prifiau	p r ɪ v j a ɨ̯
prifiau	p r ɪ v j ɛ
prifion	p r ɪ v j ɔ n
prif	p r iː v
profiad	p r ɔ v j a d
prydael	p r ə d a ɨ̯ l
prydain	p r ə d a i̯ n
prydain	p r ə d ɛ n
pryder	p r ə d a r
pryder	p r ə d ɛ r
pryfed	p r ə v a d
pryfed	p r ə v ɛ d
pryf	p r ɨː v
prys	p r ɨː s
pum	p ɨ̞ m
pump	p ɨ̞ m p
punt	p ɨ̞ n t
pured	p ɨ̞ r ɛ d
pur	p ɨː r
putain	p ɨ̞ t a i̯ n
putain	p ɨ̞ t ɛ n
puteindy	p ɨ̞ t e i̯ n d ɨ
pŵer	p ʊ a r
pŵer	p ʊ ɛ r
pweru	p ʊ ɛ r ɨ
pwll	p ʊ ɬ
pwrpas	p ʊ r p a s
pwyll	p uː ɨ̯ ɬ
pwynt	p uː ɨ̯ n t
pwy	p ʊ
pwy	p uː ɨ̯
pwyso	p ʊ i̯ s ɔ
pwyso	p ʊ ɨ̯ s ɔ
pydredd	p ə d r a ð
pydredd	p ə d r ɛ ð
pydru	p ə d r ɨ
pyglyd	p ə ɡ l ɨ̞ d
pyg	p ɨː ɡ
pyjamas	p ə d͡ʒ a m a s
pymthegfed	p ə m θ ɛ ɡ v a d
pymthegfed	p ə m θ ɛ ɡ v ɛ d
pymthegnos	p ə m θ ɛ ɡ n ɔ s
pymtheg	p ə m θ a ɡ
pymtheg	p ə m θ ɛ ɡ
pysgod	p ə s ɡ ɔ d
pysgodyn	p ə s ɡ ɔ d ɨ̯ n
pys	p ɨː s
pythefnos	p ə θ ɛ v n ɔ s
raff	r a f
raff	r aː f
rai	r a i̯
rech	r eː χ
regen	r ɛ ɡ ɛ n
regi	r ɛ ɡ i
reit	r e i̯ t
rew	r eː u̯
rhacs	r̥ a k s
rhaff	r̥ aː f
rhagddodiad	r̥ a ɡ ð ɔ d j a d
rhagenw	r̥ a ɡ ɛ n u
rhagfyr	r̥ a ɡ v ɨ̞ r
rhaglenni	r̥ a ɡ l ɛ n i
rhaglen	r̥ a ɡ l a n
rhaglen	r̥ a ɡ l ɛ n
rhagor	r̥ a ɡ ɔ r
rhagrith	r̥ a ɡ r ɪ θ
rhai	r̥ a i̯
rhaith	r̥ a i̯ θ
rhannu	r̥ a n ɨ
rhan	r̥ a n
rhaw	r̥ a u̯
rhech	r̥ eː χ
rhedeg	r̥ ɛ d a ɡ
rhedeg	r̥ ɛ d ɛ ɡ
rhegen	r̥ ɛ ɡ ɛ n
rhegi	r̥ ɛ ɡ i
rheg	r̥ eː ɡ
rheidrwydd	r̥ e i̯ d r ʊ ɨ̯ ð
rheidrwydd	r̥ e i̯ d r ʊ i̯ ð
rheoli	r̥ ɛ ɔ l i
rheol	r̥ ɛ ɔ l
rheolwr	r̥ ɛ ɔ l ʊ r
rheolydd	r̥ ɛ ɔ l ɨ̞ ð
rhestr	r̥ ɛ s d r
rhew	r̥ eː u̯
rhian	r̥ i a n
rhiant	r̥ i a n t
rhif	r̥ iː v
rhinart	r̥ ɪ n a r t
rhiniart	r̥ ɪ n j a r t
rhinoseros	r̥ ɪ n ɔ s ɛ r ɔ s
rhin	r̥ iː n
rhi	r̥ iː
rhisgl	r̥ ɪ s ɡ l
rhith	r̥ iː θ
rhithweledigaeth	r̥ ɪ θ w ɛ l ɛ d ɪ ɡ a ɨ̯ θ
rhithweledigaeth	r̥ ɪ θ w ɛ l ɛ d ɪ ɡ ɛ θ
rhiw	r̥ ɪ u̯
rhodia	r̥ ɔ d j a
rhodio	r̥ ɔ d j ɔ
rhodiwch	r̥ ɔ d j ʊ χ
rhodri	r̥ ɔ d r i
rhod	r̥ oː d
rhofio	r̥ ɔ v j ɔ
rhoi	r̥ ɔ i̯
rho	r̥ oː
rhos	r̥ oː s
rhosyn	r̥ ɔ s ɨ̞ n
rhudd	r̥ ɨː ð
rhuddwyn	r̥ ɨ̞ ð w ɨ̞ n
rhufeiniwr	r̥ ɨ̞ v e i̯ n j ʊ r
rhuthraf	r̥ ɨ̞ θ r a
rhuthraf	r̥ ɨ̞ θ r a v
rhuthro	r̥ ɨ̞ θ r ɔ
rhwng	r̥ ʊ ŋ
rhwyd	r̥ uː ɨ̯ d
rhwydwaith	r̥ ʊ ɨ̯ d w a i̯ θ
rhwydwaith	r̥ ʊ ɨ̯ d w ɛ θ
rhwydwaith	r̥ ʊ i̯ d w ɛ θ
rhwyfau	r̥ ʊ ɨ̯ v a
rhwyfau	r̥ ʊ ɨ̯ v a ɨ
rhwyfau	r̥ ʊ ɨ̯ v ɛ
rhwyfo	r̥ ʊ ɨ̯ v ɔ
rhwyf	r̥ uː ɨ̯ v
rhwygo	r̥ ʊ ɨ̯ ɡ ɔ
rhwyg	r̥ uː ɨ̯ ɡ
rhwyll	r̥ uː ɨ̯ ɬ
rhwystro	r̥ ʊ ɨ̯ s d r ɔ
rhyddhaf	r̥ ə ð h aː v
rhyddhau	r̥ ə ð h a ɨ̯
rhyddid	r̥ ə ð ɪ d
rhydd	r̥ ɨː ð
rhydychen	r̥ ɨː d ə χ ɛ n
rhyfedd	r̥ ə v a ð
rhyfedd	r̥ ə v ɛ ð
rhyfeddu	r̥ ə v ɛ ð ɨ
rhyfel	r̥ ə v a l
rhyfel	r̥ ə v ɛ l
rhyfelwr	r̥ ə v ɛ l ʊ r
rhywbeth	r̥ ʊ b a θ
rhywbeth	r̥ ʊ b ɛ θ
rhywbeth	r̥ ɪ u̯ b a θ
rhywbeth	r̥ ɪ u̯ b ɛ θ
rhywiol	r̥ ɪ u̯ j ɔ l
rhywle	r̥ ʊ l a
rhywle	r̥ ʊ l ɛ
rhywle	r̥ ɪ u̯ l a
rhywle	r̥ ɪ u̯ l ɛ
rhyw	r̥ ɪ u̯
rhywsut	r̥ ɪ u̯ s ɨ̞ t
rhywun	r̥ ɪ u̯ ɨ̞ n
rif	r iː v
rod	r oː d
roeddech	r ɔ ɨ̯ ð a χ
roeddech	r ɔ ɨ̯ ð ɛ χ
roedden	r ɔ ɨ̯ ð a n
roedden	r ɔ ɨ̯ ð ɛ n
roeddet	r ɔ ɨ̯ ð a t
roeddet	r ɔ ɨ̯ ð ɛ t
roedd	r oː ɨ̯ ð
roeddwn	r ɔ ɨ̯ ð ʊ n
roi	r ɔ i̯
ro	r oː
'r	r
rw	r ʊ
rwyt	r uː ɨ̯ t
ryddhaf	r ə ð h aː v
ryddhau	r ə ð h a ɨ̯
rydd	r ɨː ð
rydw	r ə d u
rydw	r ə d w
rygbi	r ə ɡ b i
ry	r ɨː
rywbeth	r ʊ b a θ
rywbeth	r ʊ b ɛ θ
rywbeth	r ɪ u̯ b a θ
rywbeth	r ɪ u̯ b ɛ θ
rywle	r ʊ l a
rywle	r ʊ l ɛ
rywle	r ɪ u̯ l a
rywle	r ɪ u̯ l ɛ
rywsut	r ɪ u̯ s ɨ̞ t
rywun	r ɪ u̯ ɨ̞ n
sachell	s a χ ɛ ɬ
sach	s aː χ
sadwrn	s a d ʊ n
sadwrn	s a d ʊ r n
saer	s aː ɨ̯ r
saesneg	s e ɨ̯ s n a ɡ
saesneg	s e ɨ̯ s n ɛ ɡ
saesneg	s ɨ̞ s n a ɡ
saesneg	s ɨ̞ s n ɛ ɡ
saeth	s aː ɨ̯ θ
saethyddiaeth	s e ɨ̯ θ ə ð j a ɨ̯ θ
saethyddiaeth	s e ɨ̯ θ ə ð j ɛ θ
safbwynt	s a v b ʊ ɨ̯ n t
safle	s a v l ɛ
sain	s a i̯ n
saint	s a i̯ n t
saith	s a i̯ θ
salamandr	s a l a m a n d r
sallwyr	s a ɬ ʊ ɨ̯ r
salm	s a l m
saltring	s a l t r ɪ ŋ
santes	s a n t a s
santes	s a n t ɛ s
sant	s a n t
sashimi	s a ʃ ɪ m ɪ
sawdl	s a u̯ d l
sawl	s a u̯ l
sbaeneg	s b e ɨ̯ n ɛ ɡ
sbaen	s b aː ɨ̯ n
sbectol	s b ɛ k t ɔ l
sbwriel	s b ʊ r j a l
sbwriel	s b ʊ r j ɛ l
sebon	s ɛ b ɔ n
sef	s eː v
sefyll	s ɛ v ɨ̞ ɬ
segur	s ɛ ɡ ɨ̞ r
seiclo	s e i̯ k l ɔ
seiclwr	s e i̯ k l ʊ r
selerau	s ɛ l ɛ r a
selerau	s ɛ l ɛ r a ɨ̯
selerau	s ɛ l ɛ r ɛ
seleri	s ɛ l ɛ r i
seler	s ɛ l a r
seler	s ɛ l ɛ r
