a	ʌ
aado	aː d o
aadoodi	aː d oː d i
aakam	aː k ʌ m
aaker	aː k e ɾ
aakir	aː k i ɾ
aako	aː k o
aakooka	aː k oː k ʌ
aakumale	aː k u m ʌ l e
aalam	aː l ʌ m
aalat	aː l ʌ t
aaloota	aː l oː t ʌ
aaman	aː m ʌ n
aamiin	aː m iː n
aana	aː n ʌ
abaaca	ʌ b aː ħ ʌ
abaare	ʌ b aː ɾ e
abaareyna	ʌ b aː ɾ e j n ʌ
abaarik	ʌ b aː ɾ i k
abaaro	ʌ b aː ɾ o
abaaroleela	ʌ b aː ɾ o l eː l ʌ
abaaroli	ʌ b aː ɾ o l i
abace	ʌ b ʌ ħ e
abaci	ʌ b ʌ ħ i
abadan	ʌ b ʌ d ʌ n
abal	ʌ b ʌ l
abale	ʌ b ʌ l e
abalise	ʌ b ʌ l i s e
abalite	ʌ b ʌ l i t e
abalsiise	ʌ b ʌ l s iː s e
abalsiise	ʌ b ʌ l ʃ iː s e
abamabbiime	ʌ b ʌ m ʌ bː iː m e
abamabe	ʌ b ʌ m ʌ b e
abamabsiise	ʌ b ʌ m ʌ b s iː s e
abamabsiise	ʌ b ʌ m ʌ b ʃ iː s e
abba	ʌ b b ʌ
abbaahiye	ʌ bː aː h i j e
abbaasite	ʌ bː aː s i t e
abbaasite	ʌ bː aː ʃ i t e
abbadabqis	ʌ bː ʌ d ʌ b ʕ i s
abbaw	ʌ b b ʌ w
abbiime	ʌ bː iː m e
abbobti	ʌ bː o b t i
abboobi	ʌ bː oː b i
abbowtan	ʌ b b o w t ʌ n
abcitte	ʌ b ħ i t t e
abe	ʌ b e
abeesa	ʌ b eː s ʌ
abeesas	ʌ b eː s ʌ s
abeesos	ʌ b eː s o s
abeyna	ʌ b e j n ʌ
abic	ʌ b i ħ
abice	ʌ b i ħ e
abicle	ʌ b i ħ l e
abicleela	ʌ b i ħ l eː l ʌ
abicli	ʌ b i ħ l i
abiica	ʌ b iː ħ ʌ
abiino	ʌ b iː n o
abina	ʌ b i n ʌ
abite	ʌ b i t e
ablaake	ʌ b l aː k e
abni	ʌ b n i
abooca	ʌ b oː ħ ʌ
abooqa	ʌ b oː ʕ ʌ
abooqi	ʌ b oː ʕ i
aboyya	ʌ b o j j ʌ
aboyyay	ʌ b o j j ʌ j
abqa	ʌ b ʕ ʌ
abraake	ʌ b ɾ aː k e
abre	ʌ b ɾ e
abreera	ʌ b ɾ eː ɾ ʌ
abriika	ʌ b ɾ iː k ʌ
abrik	ʌ b ɾ i k
abrooma	ʌ b ɾ oː m ʌ
absiise	ʌ b s iː s e
absiise	ʌ b ʃ iː s e
absuma	ʌ b s u m ʌ
abu	ʌ b u
abud	ʌ b u d
abur	ʌ b u ɾ
aburwa	ʌ b u ɾ w ʌ
abuudute	ʌ b uː d u t e
abuudutte	ʌ b uː d u t t e
abuuri	ʌ b uː ɾ i
abuurite	ʌ b uː ɾ i t e
abuuritte	ʌ b uː ɾ i t t e
abuuru	ʌ b uː ɾ u
abuuruse	ʌ b uː ɾ u s e
abuusa	ʌ b uː s ʌ
abxa	ʌ b ɖ ʌ
acad	ʌ ħ ʌ d
ada	ʌ d ʌ
adaan	ʌ d aː n
adab	ʌ d ʌ b
adabi	ʌ d ʌ b i
adam	ʌ d ʌ m
adame	ʌ d ʌ m e
adbaanitte	ʌ d b aː n i t t e
adbaanooni	ʌ d b aː n oː n i
adban	ʌ d b ʌ n
adda	ʌ d d ʌ
adday	ʌ dː ʌ j
addaytitte	ʌ dː ʌ j t i t t e
addaytu	ʌ d d ʌ j t u
addo	ʌ d d o
addooda	ʌ dː oː d ʌ
addoy	ʌ dː o j
addunya	ʌ dː u n j ʌ
adlaake	ʌ d l aː k e
ado	ʌ d o
adoyla	ʌ d o j l ʌ
adoylitte	ʌ d o j l i t t e
af	ʌ f
afa	ʌ f ʌ
afaato	ʌ f aː t o
affara	ʌ fː ʌ ɾ ʌ
afitte	ʌ f i t t e
afoofa	ʌ f oː f ʌ
afoofi	ʌ f oː f i
afqaro	ʌ f ʕ ʌ ɾ o
aftiitise	ʌ f t iː t i s e
aftiyta	ʌ f t i j t ʌ
afur	ʌ f u ɾ
agaaba	ʌ ɡ aː b ʌ
agabu	ʌ ɡ ʌ b u
agat	ʌ ɡ ʌ t
agattina	ʌ ɡ ʌ tː i n ʌ
agattinaytu	ʌ ɡ ʌ tː i n ʌ j t u
agattino	ʌ ɡ ʌ tː i n o
agboyta	ʌ ɡ b o j t ʌ
agiira	ʌ ɡ iː ɾ ʌ
agiirannu	ʌ ɡ iː ɾ ʌ nː u
agiru	ʌ ɡ i ɾ u
agle	ʌ ɡ l e
agur	ʌ ɡ u ɾ
ah	ʌ h
ahak	ʌ h ʌ k
ahali	ʌ h ʌ l i
ahli	ʌ h l i
akat	ʌ k ʌ t
akeera	ʌ k eː ɾ ʌ
aki	ʌ k i
akke	ʌ k k e
akkite	ʌ kː i t e
akle	ʌ k l e
ala	ʌ l ʌ
alaysamalayse	ʌ l ʌ j s ʌ m ʌ l ʌ j s e
alaysamalayse	ʌ l ʌ j ʃ ʌ m ʌ l ʌ j ʃ e
alayse	ʌ l ʌ j s e
alayse	ʌ l ʌ j ʃ e
alaysite	ʌ l ʌ j s i t e
alaysite	ʌ l ʌ j ʃ i t e
albo	ʌ l b o
alca	ʌ l ħ ʌ
ale	ʌ l e
aleey	ʌ l eː j
alemu	ʌ l e m u
alfi	ʌ l f i
ali	ʌ l i
alimu	ʌ l i m u
alkume	ʌ l k u m e
alkumeena	ʌ l k u m eː n ʌ
alluwwa	ʌ lː u w w ʌ
almo	ʌ l m o
alo	ʌ l o
alooli	ʌ l oː l i
aloosa	ʌ l oː s ʌ
alsa	ʌ l s ʌ
alsali	ʌ l s ʌ l i
alsitte	ʌ l s i t t e
alsitte	ʌ l ʃ i t t e
alsoosi	ʌ l s oː s i
alsoosi	ʌ l s oː ʃ i
alwa	ʌ l w ʌ
alwaggaso	ʌ l w ʌ ɡː ʌ s o
ama	ʌ m ʌ
amaan	ʌ m aː n
amaate	ʌ m aː t e
amaatite	ʌ m aː t i t e
amah	ʌ m ʌ h
amal	ʌ m ʌ l
ambaaca	ʌ m b aː ħ ʌ
amboyra	ʌ m b o j ɾ ʌ
amcar	ʌ m ħ ʌ ɾ
amcarto	ʌ m ħ ʌ ɾ t o
amcartu	ʌ m ħ ʌ ɾ t u
ammoyra	ʌ m m o j ɾ ʌ
amo	ʌ m o
amooma	ʌ m oː m ʌ
amoyta	ʌ m o j t ʌ
amoytise	ʌ m o j t i s e
amri	ʌ m ɾ i
angu	ʌ n ɡ u
anguuga	ʌ n ɡ uː ɡ ʌ
ankara	ʌ n k ʌ ɾ ʌ
anke	ʌ n k e
anna	ʌ n n ʌ
anni	ʌ n n i
anu	ʌ n u
aqa	ʌ ʕ ʌ
aqakkan	ʌ ʕ ʌ kː ʌ n
aqan	ʌ ʕ ʌ n
aqantibaxa	ʌ ʕ ʌ n t i b ʌ ɖ ʌ
aqantu	ʌ ʕ ʌ n t u
aqta	ʌ ʕ t ʌ
aqto	ʌ ʕ t o
arab	ʌ ɾ ʌ b
arbaq	ʌ ɾ b ʌ ʕ
ardi	ʌ ɾ d i
argiqe	ʌ ɾ ɡ i ʕ e
argiqite	ʌ ɾ ɡ i ʕ i t e
arho	ʌ ɾ h o
arhot	ʌ ɾ h o t
ariyoyta	ʌ ɾ i j o j t ʌ
ariyu	ʌ ɾ i j u
ariyunta	ʌ ɾ i j u n t ʌ
aro	ʌ ɾ o
aroh	ʌ ɾ o h
arooba	ʌ ɾ oː b ʌ
arraaba	ʌ rː aː b ʌ
arraba	ʌ rː ʌ b ʌ
aru	ʌ ɾ u
asaaku	ʌ s aː k u
ase	ʌ s e
asi	ʌ s i
asi	ʌ ʃ i
asise	ʌ s i s e
asise	ʌ ʃ i s e
aslal	ʌ s l ʌ l
assallaama	ʌ sː ʌ lː aː m ʌ
atu	ʌ t u
awka	ʌ w k ʌ
awki	ʌ w k i
awkitte	ʌ w k i t t e
awkoyta	ʌ w k o j t ʌ
awliiya	ʌ w l iː j ʌ
awra	ʌ w ɾ ʌ
axa	ʌ ɖ ʌ
axca	ʌ ɖ ħ ʌ
axkoxxa	ʌ ɖ k o ɖː ʌ
axooca	ʌ ɖ oː ħ ʌ
aynabenta	ʌ j n ʌ b e n t ʌ
ayro	ʌ j ɾ o
ayti	ʌ j t i
ayyaat	ʌ j j aː t
ayyam	ʌ j j ʌ m
baa	b aː
baabur	b aː b u ɾ
baad	b aː d
baahe	b aː h e
baaladi	b aː l ʌ d i
baan	b aː n
baariis	b aː ɾ iː s
baaxo	b aː ɖ o
babba	b ʌ b b ʌ
bacaar	b ʌ ħ aː ɾ
bacaara	b ʌ ħ aː ɾ ʌ
bacad	b ʌ ħ ʌ d
bacra	b ʌ ħ ɾ ʌ
bacta	b ʌ ħ t ʌ
bad	b ʌ d
baddikimbiro	b ʌ dː i k i m b i ɾ o
badiila	b ʌ d iː l ʌ
badooda	b ʌ d oː d ʌ
bafad	b ʌ f ʌ d
bagitte	b ʌ ɡ i t t e
bagu	b ʌ ɡ u
bahriya	b ʌ h ɾ i j ʌ
bahsiise	b ʌ h s iː s e
bahsiise	b ʌ h ʃ iː s e
bakal	b ʌ k ʌ l
bakalo	b ʌ k ʌ l o
bakaltu	b ʌ k ʌ l t u
bakar	b ʌ k ʌ ɾ
bakkeela	b ʌ k k eː l ʌ
bakkelwa	b ʌ kː e l w ʌ
baklo	b ʌ k l o
balha	b ʌ l h ʌ
ballo	b ʌ l l o
ballu	b ʌ lː u
balqinaan	b ʌ l ʕ i n aː n
balsa	b ʌ l s ʌ
baqala	b ʌ ʕ ʌ l ʌ
bar	b ʌ ɾ
bara	b ʌ ɾ ʌ
barise	b ʌ ɾ i s e
barite	b ʌ ɾ i t e
baritte	b ʌ ɾ i t t e
baritteeta	b ʌ ɾ i tː eː t ʌ
baritto	b ʌ ɾ i t t o
barra	b ʌ r r ʌ
barrayto	b ʌ rː ʌ j t o
barraytu	b ʌ r r ʌ j t u
barri	b ʌ rː i
barriino	b ʌ rː iː n o
barriinu	b ʌ r r iː n u
barritte	b ʌ rː i t t e
barseyna	b ʌ ɾ s e j n ʌ
barteyna	b ʌ ɾ t e j n ʌ
barteynitte	b ʌ ɾ t e j n i t t e
barti	b ʌ ɾ t i
bartikimbir	b ʌ ɾ t i k i m b i ɾ
bartikimbiro	b ʌ ɾ t i k i m b i ɾ o
baru	b ʌ ɾ u
barwa	b ʌ ɾ w ʌ
basal	b ʌ s ʌ l
basaltu	b ʌ s ʌ l t u
baskil	b ʌ s k i l
basta	b ʌ s t ʌ
bata	b ʌ t ʌ
bataata	b ʌ t aː t ʌ
baxa	b ʌ ɖ ʌ
baxuwwa	b ʌ ɖ u w w ʌ
baye	b ʌ j e
bee	b eː
beeca	b eː ħ ʌ
beera	b eː ɾ ʌ
beete	b eː t e
bexxa	b e ɖː ʌ
bexxiino	b e ɖː iː n o
bexxiinu	b e ɖ ɖ iː n u
bice	b i ħ e
bilqa	b i l ʕ ʌ
bir	b i ɾ
biritaanya	b i ɾ i t aː n j ʌ
bissoyseena	b i sː o j s eː n ʌ
bissoyseena	b i sː o j ʃ eː n ʌ
bissoyseyna	b i sː o j s e j n ʌ
bissoyseyna	b i sː o j ʃ e j n ʌ
bissoyso	b i sː o j s o
bissoyso	b i sː o j ʃ o
bisu	b i s u
bitamiin	b i t ʌ m iː n
bixaaxe	b i ɖ aː ɖ e
bixaaxime	b i ɖ aː ɖ i m e
biyak	b i j ʌ k
boddina	b o dː i n ʌ
bodo	b o d o
bokol	b o k o l
bokro	b o k ɾ o
bokxo	b o k ɖ o
boliis	b o l iː s
bomodooro	b o m o d oː ɾ o
boodifa	b oː d i f ʌ
booha	b oː h ʌ
bool	b oː l
boolo	b oː l o
booloyta	b oː l o j t ʌ
boor	b oː ɾ
booxa	b oː ɖ ʌ
borojekti	b o ɾ o d͡ʒ e k t i
bosol	b o s o l
bun	b u n
buna	b u n ʌ
burtukan	b u ɾ t u k ʌ n
bus	b u s
bussa	b u s s ʌ
bustaan	b u s t aː n
buta	b u t ʌ
butta	b u t t ʌ
buuba	b uː b ʌ
buun	b uː n
buuti	b uː t i
buuxa	b uː ɖ ʌ
buxa	b u ɖ ʌ
buxal	b u ɖ ʌ l
buyi	b u j i
buyya	b u j j ʌ
buyyaaya	b u jː aː j ʌ
buyyi	b u jː i
bøk	b ɨ k
c	ħ
caac	ħ aː ħ
caacay	ħ aː ħ ʌ j
caafat	ħ aː f ʌ t
caalat	ħ aː l ʌ t
caanowa	ħ aː n o w ʌ
cabe	ħ ʌ b e
cabsa	ħ ʌ b s ʌ
cabsiise	ħ ʌ b s iː s e
cabsiise	ħ ʌ b ʃ iː s e
cabsiisite	ħ ʌ b s iː s i t e
cabsiisite	ħ ʌ b ʃ iː ʃ i t e
cabsiita	ħ ʌ b s iː t ʌ
cabsiita	ħ ʌ b ʃ iː t ʌ
cabti	ħ ʌ b t i
cado	ħ ʌ d o
cadooda	ħ ʌ d oː d ʌ
cadoyta	ħ ʌ d o j t ʌ
cadoytah	ħ ʌ d o j t ʌ h
cagay	ħ ʌ ɡ ʌ j
camad	ħ ʌ m ʌ d
can	ħ ʌ n
canoona	ħ ʌ n oː n ʌ
canoowa	ħ ʌ n oː w ʌ
canti	ħ ʌ n t i
caraa	ħ ʌ ɾ aː
casamcase	ħ ʌ s ʌ m ħ ʌ s e
casamcassiime	ħ ʌ s ʌ m ħ ʌ sː iː m e
case	ħ ʌ s e
cassiime	ħ ʌ sː iː m e
cate	ħ ʌ t e
catew	ħ ʌ t e w
cato	ħ ʌ t o
catuffa	ħ ʌ t u f f ʌ
caxa	ħ ʌ ɖ ʌ
caxak	ħ ʌ ɖ ʌ k
cayso	ħ ʌ j s o
cayso	ħ ʌ j ʃ o
ceele	ħ eː l e
celsiise	ħ e l s iː s e
celsiise	ħ e l ʃ iː s e
ceray	ħ e ɾ ʌ j
ceraymaqad	ħ e ɾ ʌ j m ʌ ʕ ʌ d
ceraytitte	ħ e ɾ ʌ j t i t t e
ceraytu	ħ e ɾ ʌ j t u
cereyya	ħ e ɾ e j j ʌ
cibix	ħ i b i ɖ
cibixxo	ħ i b i ɖ ɖ o
ciin	ħ iː n
ciinwa	ħ iː n w ʌ
cillaale	ħ i lː aː l e
cillaaleena	ħ i lː aː l eː n ʌ
cillaaleyna	ħ i lː aː l e j n ʌ
cinna	ħ i n n ʌ
comor	ħ o m o ɾ
comorto	ħ o m o ɾ t o
coox	ħ oː ɖ
cugbu	ħ u ɡ b u
cusul	ħ u s u l
daaco	d aː ħ o
daacureyta	d aː ħ u ɾ e j t ʌ
daacurre	d aː ħ u r r e
daaha	d aː h ʌ
daahhe	d aː h h e
daaso	d aː s o
daasoyta	d aː s o j t ʌ
dabaaba	d ʌ b aː b ʌ
dabeela	d ʌ b eː l ʌ
dabelwa	d ʌ b e l w ʌ
dabiib	d ʌ b iː b
daboyta	d ʌ b o j t ʌ
dacare	d ʌ ħ ʌ ɾ e
dacoyta	d ʌ ħ o j t ʌ
dacrise	d ʌ ħ ɾ i s e
dactusso	d ʌ ħ t u s s o
dadaq	d ʌ d ʌ ʕ
daftar	d ʌ f t ʌ ɾ
dagal	d ʌ ɡ ʌ l
dagdago	d ʌ ɡ d ʌ ɡ o
daggoowe	d ʌ ɡː oː w e
daggoyise	d ʌ ɡː o j i s e
dago	d ʌ ɡ o
dahab	d ʌ h ʌ b
dakanu	d ʌ k ʌ n u
daktar	d ʌ k t ʌ ɾ
daktara	d ʌ k t ʌ ɾ ʌ
dalaaca	d ʌ l aː ħ ʌ
dalcu	d ʌ l ħ u
dalka	d ʌ l k ʌ
damaaqe	d ʌ m aː ʕ e
damaqta	d ʌ m ʌ ʕ t ʌ
damaqtu	d ʌ m ʌ ʕ t u
danan	d ʌ n ʌ n
dananitte	d ʌ n ʌ n i t t e
dananwa	d ʌ n ʌ n w ʌ
danoona	d ʌ n oː n ʌ
daqar	d ʌ ʕ ʌ ɾ
daqartaba	d ʌ ʕ ʌ ɾ t ʌ b ʌ
darfi	d ʌ ɾ f i
dari	d ʌ ɾ i
daro	d ʌ ɾ o
darot	d ʌ ɾ o t
darre	d ʌ r r e
darreera	d ʌ rː eː ɾ ʌ
darru	d ʌ rː u
data	d ʌ t ʌ
daygir	d ʌ j ɡ i ɾ
dayla	d ʌ j l ʌ
daytuun	d ʌ j t uː n
derre	d e r r e
derrel	d e r r e l
dibro	d i b ɾ o
dibuk	d i b u k
diggah	d i ɡ ɡ ʌ h
digib	d i ɡ i b
digire	d i ɡ i ɾ e
diglo	d i ɡ l o
digloyta	d i ɡ l o j t ʌ
diida	d iː d ʌ
diidaale	d iː d aː l e
diidaaleyta	d iː d ʌ l e j t ʌ
diiteli	d iː t e l i
dimmatoyta	d i mː ʌ t o j t ʌ
dimmatto	d i mː ʌ t t o
dina	d i n ʌ
dinnit	d i n n i t
dirab	d i ɾ ʌ b
dirabboowe	d i ɾ ʌ bː oː w e
dirabboyise	d i ɾ ʌ bː o j i s e
diriq	d i ɾ i ʕ
dirri	d i rː i
dodobbaasite	d o d o bː aː s i t e
dodobbaasite	d o d o bː aː ʃ i t e
dodoobe	d o d oː b e
dorro	d o r r o
dul	d u l
duma	d u m ʌ
dummu	d u m m u
dummum	d u mː u m
dummuuta	d u m m uː t ʌ
dummuuta	d u mː uː t ʌ
dummuyta	d u m m u j t ʌ
dummuyta	d u mː u j t ʌ
duude	d uː d e
duulitte	d uː l i t t e
duyye	d u j j e
ecee	e ħ eː
eerre	eː r r e
eexege	eː ɖ e ɡ e
egel	e ɡ e l
egul	e ɡ u l
ekke	e k k e
eleele	e l eː l e
eleelise	e l eː l i s e
elmo	e l m o
emamemeete	e m ʌ m e m eː t e
emeete	e m eː t e
emeexege	e m eː ɖ e ɡ e
emqe	e m ʕ e
en	e n
enbe	e n b e
enek	e n e k
eneki	e n e k i
engerre	e n ɡ e r r e
enkebeebe	e n k e b eː b e
eqeb	e ʕ e b
eqebto	e ʕ e b t o
eramerde	e ɾ ʌ m e ɾ d e
erameyredde	e ɾ ʌ m e j ɾ e d d e
erarto	e ɾ ʌ ɾ t o
erde	e ɾ d e
erga	e ɾ ɡ ʌ
essemeqe	e sː e m e ʕ e
essenebbe	e sː e n e b b e
etteerre	e tː eː r r e
etteexege	e tː eː ɖ e ɡ e
exce	e ɖ ħ e
exxa	e ɖ ɖ ʌ
exxaaxa	e ɖː aː ɖ ʌ
exxeere	e ɖː eː ɾ e
eygerre	e j ɡ e r r e
eykebeebe	e j k e b eː b e
eymeeqe	e j m eː ʕ e
eynebe	e j n e b e
eyredde	e j ɾ e d d e
eyserre	e j s e r r e
eyserre	e j ʃ e r r e
faatuma	f aː t u m ʌ
faatumay	f aː t u m ʌ j
face	f ʌ ħ e
facise	f ʌ ħ i s e
facisite	f ʌ ħ i s i t e
facisite	f ʌ ħ i ʃ i t e
fakamfake	f ʌ k ʌ m f ʌ k e
fakamfaksiise	f ʌ k ʌ m f ʌ k s iː s e
fakamfaksiise	f ʌ k ʌ m f ʌ k ʃ iː s e
fake	f ʌ k e
fakkaasite	f ʌ kː aː s i t e
fakkaasite	f ʌ kː aː ʃ i t e
falum	f ʌ l u m
faranka	f ʌ ɾ ʌ n k ʌ
farankitte	f ʌ ɾ ʌ n k i t t e
faransaawi	f ʌ ɾ ʌ n s aː w i
faransaawiita	f ʌ ɾ ʌ n s aː w iː t ʌ
fardi	f ʌ ɾ d i
fareen	f ʌ ɾ eː n
farey	f ʌ ɾ e j
fareyi	f ʌ ɾ e j i
farooda	f ʌ ɾ oː d ʌ
fatta	f ʌ t t ʌ
faxe	f ʌ ɖ e
faxsiise	f ʌ ɖ s iː s e
faxsiise	f ʌ ɖ ʃ iː s e
faxsiisite	f ʌ ɖ s iː s i t e
faxsiisite	f ʌ ɖ ʃ iː ʃ i t e
ferey	f e ɾ e j
fida	f i d ʌ
figgaan	f i ɡ ɡ aː n
fikhi	f i k h i
fiqinto	f i ʕ i n t o
fiqintu	f i ʕ i n t u
fiqma	f i ʕ m ʌ
fooca	f oː ħ ʌ
foyya	f o j j ʌ
furraynu	f u r r ʌ j n u
furud	f u ɾ u d
furum	f u ɾ u m
furunto	f u ɾ u n t o
gaala	ɡ aː l ʌ
gaalaytu	ɡ aː l ʌ j t u
gaaliyow	ɡ aː l i j o w
gaanta	ɡ aː n t ʌ
gaba	ɡ ʌ b ʌ
gabbi	ɡ ʌ bː i
gabco	ɡ ʌ b ħ o
gaboobi	ɡ ʌ b oː b i
gabuuti	ɡ ʌ b uː t i
gad	ɡ ʌ d
gadalu	ɡ ʌ d ʌ l u
gadcado	ɡ ʌ d ħ ʌ d o
gaddi	ɡ ʌ d d i
gaditte	ɡ ʌ d i t t e
gadma	ɡ ʌ d m ʌ
gadooda	ɡ ʌ d oː d ʌ
gadoowa	ɡ ʌ d oː w ʌ
galbabbaqini	ɡ ʌ l b ʌ bː ʌ ʕ i n i
galbabbaqinnoowe	ɡ ʌ l b ʌ bː ʌ ʕ i nː oː w e
galbo	ɡ ʌ l b o
galto	ɡ ʌ l t o
gamfal	ɡ ʌ m f ʌ l
gamqe	ɡ ʌ m ʕ e
gandaaram	ɡ ʌ n d aː ɾ ʌ m
gannat	ɡ ʌ nː ʌ t
gaqambo	ɡ ʌ ʕ ʌ m b o
garab	ɡ ʌ ɾ ʌ b
garablu	ɡ ʌ ɾ ʌ b l u
garaqe	ɡ ʌ ɾ ʌ ʕ e
garbo	ɡ ʌ ɾ b o
garbol	ɡ ʌ ɾ b o l
garci	ɡ ʌ ɾ ħ i
gari	ɡ ʌ ɾ i
garob	ɡ ʌ ɾ o b
garooba	ɡ ʌ ɾ oː b ʌ
garqa	ɡ ʌ ɾ ʕ ʌ
garuq	ɡ ʌ ɾ u ʕ
gaso	ɡ ʌ s o
gayran	ɡ ʌ j ɾ ʌ n
gayrantu	ɡ ʌ j ɾ ʌ n t u
gayroona	ɡ ʌ j ɾ oː n ʌ
gaysa	ɡ ʌ j s ʌ
gaysa	ɡ ʌ j ʃ ʌ
gaysoosi	ɡ ʌ j s oː s i
gaysoosi	ɡ ʌ j ʃ oː ʃ i
gee	ɡ eː
gelwa	ɡ e l w ʌ
gexamgexe	ɡ e ɖ ʌ m ɡ e ɖ e
gexamgexxa	ɡ e ɖ ʌ m ɡ e ɖ ɖ ʌ
gexe	ɡ e ɖ e
gexele	ɡ e ɖ e l e
gexite	ɡ e ɖ i t e
gexso	ɡ e ɖ s o
geyite	ɡ e j i t e
gib	ɡ i b
giba	ɡ i b ʌ
gile	ɡ i l e
gileyta	ɡ i l e j t ʌ
gili	ɡ i l i
gilwa	ɡ i l w ʌ
gino	ɡ i n o
gira	ɡ i ɾ ʌ
gita	ɡ i t ʌ
gititte	ɡ i t i t t e
gitwa	ɡ i t w ʌ
goray	ɡ o ɾ ʌ j
goroy	ɡ o ɾ o j
goroyya	ɡ o ɾ o j j ʌ
goroyyaayi	ɡ o ɾ o jː aː j i
gubna	ɡ u b n ʌ
gubun	ɡ u b u n
gubuna	ɡ u b u n ʌ
gubunitte	ɡ u b u n i t t e
gulub	ɡ u l u b
gumqat	ɡ u m ʕ ʌ t
gura	ɡ u ɾ ʌ
guruf	ɡ u ɾ u f
gurufta	ɡ u ɾ u f t ʌ
gurufwa	ɡ u ɾ u f w ʌ
guruufa	ɡ u ɾ uː f ʌ
haan	h aː n
haasaw	h aː s ʌ w
haasawe	h aː s ʌ w e
haawa	h aː w ʌ
hagga	h ʌ ɡ ɡ ʌ
hantuuta	h ʌ n t uː t ʌ
hantuutitte	h ʌ n t uː t i t t e
hawa	h ʌ w ʌ
hawwa	h ʌ w w ʌ
haysiise	h ʌ j s iː s e
haysiise	h ʌ j ʃ iː s e
hebelto	h e b e l t o
hee	h eː
heel	h eː l
hida	h i d ʌ
hidhid	h i d h i d
hinna	h i n n ʌ
hitta	h i tː ʌ
hoba	h o b ʌ
hooba	h oː b ʌ
iba	i b ʌ
ibaabu	i b aː b u
ibbixe	i bː i ɖ e
ibitte	i b i t t e
icfide	i ħ f i d e
ida	i d ʌ
idalto	i d ʌ l t o
idaltu	i d ʌ l t u
idoola	i d oː l ʌ
ifdige	i f d i ɡ e
ifiile	i f iː l e
ifoyta	i f o j t ʌ
ifu	i f u
igix	i ɡ i ɖ
igixxa	i ɡ i ɖː ʌ
ikiiqi	i k iː ʕ i
ikke	i k k e
ikqiyo	i k ʕ i j o
illi	i lː i
illitte	i lː i t t e
ilmonta	i l m o n t ʌ
ilmoyta	i l m o j t ʌ
ilmu	i l m u
ilu	i l u
im	i m
immay	i m m ʌ j
ina	i n ʌ
inaani	i n aː n i
inannaba	i n ʌ n n ʌ b ʌ
infiddige	i n f i dː i ɡ e
ingiliis	i n ɡ i l iː s
ingiliisiyta	i n ɡ i l iː s i j t ʌ
ingiliisiyta	i n ɡ i l iː ʃ i j t ʌ
inik	i n i k
iniki	i n i k i
inki	i n k i
inkibarta	i n k i b ʌ ɾ t ʌ
inkile	i n k i l e
inkitti	i n k i t t i
inkitto	i n k i t t o
inkittu	i n k i tː u
innaa	i n n aː
inni	i n n i
inni	i nː i
innikille	i nː i k i l l e
inonti	i n o n t i
inti	i n t i
intibbixe	i n t i bː i ɖ e
irba	i ɾ b ʌ
irga	i ɾ ɡ ʌ
irgiqe	i ɾ ɡ i ʕ e
iro	i ɾ o
is	i s
iscifide	i s ħ i f i d e
isi	i s i
isi	i ʃ i
isillime	i s i lː i m e
isillime	i ʃ i lː i m e
isin	i s i n
isin	i ʃ i n
isinni	i s i n n i
isinni	i s i nː i
isinni	i ʃ i n n i
isinni	i ʃ i nː i
iskool	i s k oː l
islaam	i s l aː m
itlen	i t l e n
itqite	i t ʕ i t e
itta	i t t ʌ
itta	i tː ʌ
ixcixe	i ɖ ħ i ɖ e
ixiggile	i ɖ i ɡː i l e
ixu	i ɖ u
ixxicixxe	i ɖː ħ i ɖ ɖ e
ixxigille	i ɖː i ɡ i l l e
ixxu	i ɖː u
iyfiile	i j f iː l e
iyfiilise	i j f iː l i s e
iysibbixe	i j s i bː i ɖ e
iysibbixe	i j ʃ i bː i ɖ e
iysillime	i j s i lː i m e
iysillime	i j ʃ i lː i m e
iysitiqe	i j s i t i ʕ e
iysitiqe	i j ʃ i t i ʕ e
iyya	i j j ʌ
iyya	i jː ʌ
iyyi	i j j i
iyyin	i j j i n
joografi	d͡ʒ oː ɡ ɾ ʌ f i
ka	k ʌ
kaa	k aː
kaadu	k aː d u
kaamil	k aː m i l
kaamilow	k aː m i l o w
kaaqay	k aː ʕ ʌ j
kaaqaytu	k aː ʕ ʌ j t u
kabad	k ʌ b ʌ d
kabat	k ʌ b ʌ t
kabba	k ʌ b b ʌ
kabel	k ʌ b e l
kabella	k ʌ b e l l ʌ
kabellaali	k ʌ b e lː aː l i
kabir	k ʌ b i ɾ
kabqi	k ʌ b ʕ i
kaca	k ʌ ħ ʌ
kacca	k ʌ ħ ħ ʌ
kacuw	k ʌ ħ u w
kadco	k ʌ d ħ o
kafe	k ʌ f e
kafise	k ʌ f i s e
kafisite	k ʌ f i s i t e
kafisite	k ʌ f i ʃ i t e
kalam	k ʌ l ʌ m
kalda	k ʌ l d ʌ
kalti	k ʌ l t i
kamiis	k ʌ m iː s
kamri	k ʌ m ɾ i
kantar	k ʌ n t ʌ ɾ
karamella	k ʌ ɾ ʌ m e l l ʌ
karma	k ʌ ɾ m ʌ
karruc	k ʌ rː u ħ
karruf	k ʌ rː u f
kas	k ʌ s
kasab	k ʌ s ʌ b
kasal	k ʌ s ʌ l
kasalto	k ʌ s ʌ l t o
kataf	k ʌ t ʌ f
kataysa	k ʌ t ʌ j s ʌ
kataysa	k ʌ t ʌ j ʃ ʌ
kataysiino	k ʌ t ʌ j s iː n o
kataysiino	k ʌ t ʌ j ʃ iː n o
kataysiinu	k ʌ t ʌ j s iː n u
kataysiinu	k ʌ t ʌ j ʃ iː n u
kaxxa	k ʌ ɖ ɖ ʌ
kaxxam	k ʌ ɖ ɖ ʌ m
kay	k ʌ j
kayiimi	k ʌ j iː m i
kayim	k ʌ j i m
kayniiqe	k ʌ j n iː ʕ e
kedo	k e d o
kee	k eː
ken	k e n
keniimi	k e n iː m i
kenim	k e n i m
kido	k i d o
kidoh	k i d o h
kiilo	k iː l o
kiilomitri	k iː l o m i t ɾ i
kiis	k iː s
kimal	k i m ʌ l
kimbir	k i m b i ɾ
kimbiro	k i m b i ɾ o
kimbixxa	k i m b i ɖː ʌ
kino	k i n o
kitab	k i t ʌ b
kixa	k i ɖ ʌ
ko	k o
koleera	k o l eː ɾ ʌ
kondom	k o n d o m
konoy	k o n o j
konoyu	k o n o j u
kontom	k o n t o m
koo	k oː
koofiyat	k oː f i j ʌ t
kooma	k oː m ʌ
koomaytu	k oː m ʌ j t u
koona	k oː n ʌ
koroos	k o ɾ oː s
kos	k o s
ku	k u
kuclini	k u ħ l i n i
kuclinnoowe	k u ħ l i nː oː w e
kuclinnoyise	k u ħ l i nː o j i s e
kucul	k u ħ u l
kudra	k u d ɾ ʌ
kulli	k u l l i
kulli	k u lː i
kullum	k u lː u m
kullunta	k u l l u n t ʌ
kum	k u m
kummuuqo	k u mː uː ʕ o
kunbula	k u n b u l ʌ
kurta	k u ɾ t ʌ
kusra	k u s ɾ ʌ
kusur	k u s u ɾ
kusura	k u s u ɾ ʌ
kuta	k u t ʌ
kuum	k uː m
kuumu	k uː m u
kuuta	k uː t ʌ
kuyna	k u j n ʌ
laa	l aː
laadina	l aː d i n ʌ
laadinitte	l aː d i n i t t e
laahi	l aː h i
laahinti	l aː h i n t i
labaatanna	l ʌ b aː t ʌ nː ʌ
labaatanni	l ʌ b aː t ʌ n n i
labha	l ʌ b h ʌ
labhayto	l ʌ b h ʌ j t o
labhaytu	l ʌ b h ʌ j t u
labhiino	l ʌ b h iː n o
labhiinu	l ʌ b h iː n u
labko	l ʌ b k o
lacey	l ʌ ħ e j
laceyi	l ʌ ħ e j i
lactam	l ʌ ħ t ʌ m
lagaade	l ʌ ɡ aː d e
lagaddo	l ʌ ɡ ʌ d d o
lagaddu	l ʌ ɡ ʌ dː u
lakqo	l ʌ k ʕ o
lammay	l ʌ m m ʌ j
laqan	l ʌ ʕ ʌ n
lecey	l e ħ e j
lee	l eː
lelwa	l e l w ʌ
lica	l i ħ ʌ
lifiq	l i f i ʕ
lih	l i h
litri	l i t ɾ i
loqo	l o ʕ o
loqoyta	l o ʕ o j t ʌ
loyna	l o j n ʌ
loynayto	l o j n ʌ j t o
loynaytu	l o j n ʌ j t u
lubak	l u b ʌ k
lubakwa	l u b ʌ k w ʌ
lubooka	l u b oː k ʌ
luwa	l u w ʌ
ma	m ʌ
maa	m aː
maaca	m aː ħ ʌ
maacitte	m aː ħ i t t e
maaqo	m aː ʕ o
maayta	m aː j t ʌ
mabla	m ʌ b l ʌ
mabra	m ʌ b ɾ ʌ
maca	m ʌ ħ ʌ
macammad	m ʌ ħ ʌ m m ʌ d
madab	m ʌ d ʌ b
madu	m ʌ d u
magaala	m ʌ ɡ aː l ʌ
magan	m ʌ ɡ ʌ n
maggom	m ʌ ɡː o m
magla	m ʌ ɡ l ʌ
makaayin	m ʌ k aː j i n
makiina	m ʌ k iː n ʌ
makki	m ʌ kː i
makkiyow	m ʌ kː i j o w
malab	m ʌ l ʌ b
malciin	m ʌ l ħ iː n
malciini	m ʌ l ħ iː n i
malcina	m ʌ l ħ i n ʌ
male	m ʌ l e
maleey	m ʌ l eː j
malqo	m ʌ l ʕ o
malyuun	m ʌ l j uː n
mamqa	m ʌ m ʕ ʌ
mango	m ʌ n ɡ o
manni	m ʌ n n i
mano	m ʌ n o
manqa	m ʌ n ʕ ʌ
maqagtina	m ʌ ʕ ʌ ɡ t i n ʌ
maqallim	m ʌ ʕ ʌ l l i m
maqallima	m ʌ ʕ ʌ lː i m ʌ
maqanxa	m ʌ ʕ ʌ n ɖ ʌ
maqanxix	m ʌ ʕ ʌ n ɖ i ɖ
maqyooli	m ʌ ʕ j oː l i
mara	m ʌ ɾ ʌ
mare	m ʌ ɾ e
mareekani	m ʌ ɾ eː k ʌ n i
mareyta	m ʌ ɾ e j t ʌ
markab	m ʌ ɾ k ʌ b
maro	m ʌ ɾ o
maruw	m ʌ ɾ u w
marwa	m ʌ ɾ w ʌ
masnaf	m ʌ s n ʌ f
masu	m ʌ s u
mateeba	m ʌ t eː b ʌ
maxco	m ʌ ɖ ħ o
maxo	m ʌ ɖ o
mayram	m ʌ j ɾ ʌ m
mayramey	m ʌ j ɾ ʌ m e j
mekla	m e k l ʌ
meqe	m e ʕ e
midga	m i d ɡ ʌ
migaaqiyoowa	m i ɡ aː ʕ i j oː w ʌ
migaq	m i ɡ ʌ ʕ
migaqwa	m i ɡ ʌ ʕ w ʌ
migda	m i ɡ d ʌ
milyaar	m i l j aː ɾ
miniina	m i n iː n ʌ
minin	m i n i n
miraarib	m i ɾ aː ɾ i b
mitri	m i t ɾ i
mixig	m i ɖ i ɡ
miyya	m i jː ʌ
mocammad	m o ħ ʌ mː ʌ d
molta	m o l t ʌ
moolo	m oː l o
mootar	m oː t ʌ ɾ
morootom	m o ɾ oː t o m
moyya	m o j j ʌ
mudarris	m u d ʌ r r i s
mudarrisa	m u d ʌ rː i s ʌ
muggaaqise	m u ɡː aː ʕ i s e
muggaq	m u ɡ ɡ ʌ ʕ
mukno	m u k n o
mukto	m u k t o
muqallim	m u ʕ ʌ lː i m
muqallima	m u ʕ ʌ lː i m ʌ
musaahara	m u s aː h ʌ ɾ ʌ
naag	n aː ɡ
nabaru	n ʌ b ʌ ɾ u
nagay	n ʌ ɡ ʌ j
nagayna	n ʌ ɡ ʌ j n ʌ
namma	n ʌ m m ʌ
nammay	n ʌ m m ʌ j
nammaya	n ʌ m m ʌ j ʌ
nangalo	n ʌ n ɡ ʌ l o
nangalta	n ʌ n ɡ ʌ l t ʌ
nangalu	n ʌ n ɡ ʌ l u
nanu	n ʌ n u
naqaboyta	n ʌ ʕ ʌ b o j t ʌ
naqabu	n ʌ ʕ ʌ b u
naqaso	n ʌ ʕ ʌ s o
naqasu	n ʌ ʕ ʌ s u
naqoosa	n ʌ ʕ oː s ʌ
naqoosannu	n ʌ ʕ oː s ʌ nː u
naqoosinna	n ʌ ʕ oː s i n n ʌ
naqoosinna	n ʌ ʕ oː ʃ i n n ʌ
naqoosite	n ʌ ʕ oː s i t e
naqoosite	n ʌ ʕ oː ʃ i t e
nargo	n ʌ ɾ ɡ o
narig	n ʌ ɾ i ɡ
narigto	n ʌ ɾ i ɡ t o
narigtu	n ʌ ɾ i ɡ t u
nariiga	n ʌ ɾ iː ɡ ʌ
nariige	n ʌ ɾ iː ɡ e
ne	n e
nee	n eː
ni	n i
niimi	n iː m i
nim	n i m
ninni	n i n n i
ninni	n i nː i
niya	n i j ʌ
nudqi	n u d ʕ i
num	n u m
numih	n u m i h
numoyta	n u m o j t ʌ
nunqi	n u n ʕ i
nussi	n u sː i
nuuh	n uː h
obbeerasiyonu	o bː eː ɾ ʌ s i j o n u
obbeerasiyonu	o bː eː ɾ ʌ ʃ i j o n u
obboode	o bː oː d e
obol	o b o l
offoofe	o fː oː f e
ogamoogore	o ɡ ʌ m oː ɡ o ɾ e
okme	o k m e
olaali	o l aː l i
olmo	o l m o
olo	o l o
oloyta	o l o j t ʌ
olu	o l u
omoogoqe	o m oː ɡ o ʕ e
omooqore	o m oː ʕ o ɾ e
ontobbe	o n t o b b e
ontooqobe	o n t oː ʕ o b e
oobbe	oː b b e
oogoqe	oː ɡ o ʕ e
oogore	oː ɡ o ɾ e
ooqobe	oː ʕ o b e
ooqore	oː ʕ o ɾ e
oqamomooqobe	o ʕ ʌ m o m oː ʕ o b e
oqamooqobe	o ʕ ʌ m oː ʕ o b e
oroomo	o ɾ oː m o
oroomoyta	o ɾ oː m o j t ʌ
orris	o r r i s
ossa	o s s ʌ
otqor	o t ʕ o ɾ
ottoogoqe	o tː oː ɡ o ʕ e
ottooqobe	o tː oː ʕ o b e
oyboode	o j b oː d e
oyfoofe	o j f oː f e
oysobbe	o j s o b b e
oysobbe	o j ʃ o b b e
qaada	ʕ aː d ʌ
qaadoodi	ʕ aː d oː d i
qaafiyat	ʕ aː f i j ʌ t
qaafiyata	ʕ aː f i j ʌ t ʌ
qaag	ʕ aː ɡ
qaahira	ʕ aː h i ɾ ʌ
qaakil	ʕ aː k i l
qaasali	ʕ aː s ʌ l i
qadaala	ʕ ʌ d aː l ʌ
qadaalaytu	ʕ ʌ d aː l ʌ j t u
qaday	ʕ ʌ d ʌ j
qadayto	ʕ ʌ d ʌ j t o
qaddoowe	ʕ ʌ dː oː w e
qaddoyse	ʕ ʌ dː o j s e
qaddoyse	ʕ ʌ dː o j ʃ e
qaddoysite	ʕ ʌ dː o j s i t e
qaddoysite	ʕ ʌ dː o j ʃ i t e
qado	ʕ ʌ d o
qafar	ʕ ʌ f ʌ ɾ
qafarto	ʕ ʌ f ʌ ɾ t o
qafartu	ʕ ʌ f ʌ ɾ t u
qafur	ʕ ʌ f u ɾ
qale	ʕ ʌ l e
qaleela	ʕ ʌ l eː l ʌ
qalek	ʕ ʌ l e k
qalelwa	ʕ ʌ l e l w ʌ
qaleyta	ʕ ʌ l e j t ʌ
qali	ʕ ʌ l i
qaliyow	ʕ ʌ l i j o w
qalwa	ʕ ʌ l w ʌ
qam	ʕ ʌ m
qambilbacar	ʕ ʌ m b i l b ʌ ħ ʌ ɾ
qammi	ʕ ʌ mː i
qammitte	ʕ ʌ mː i t t e
qamur	ʕ ʌ m u ɾ
qanay	ʕ ʌ n ʌ j
qanaytitte	ʕ ʌ n ʌ j t i t t e
qanaytu	ʕ ʌ n ʌ j t u
qarab	ʕ ʌ ɾ ʌ b
qarabi	ʕ ʌ ɾ ʌ b i
qarabtoyta	ʕ ʌ ɾ ʌ b t o j t ʌ
qarabtu	ʕ ʌ ɾ ʌ b t u
qari	ʕ ʌ ɾ i
qaro	ʕ ʌ ɾ o
qarok	ʕ ʌ ɾ o k
qaroora	ʕ ʌ ɾ oː ɾ ʌ
qarot	ʕ ʌ ɾ o t
qaroyta	ʕ ʌ ɾ o j t ʌ
qarwa	ʕ ʌ ɾ w ʌ
qasa	ʕ ʌ s ʌ
qasadirri	ʕ ʌ s ʌ d i rː i
qasamqasa	ʕ ʌ s ʌ m ʕ ʌ s ʌ
qasamqassoowe	ʕ ʌ s ʌ m ʕ ʌ sː oː w e
qasbo	ʕ ʌ s b o
qasir	ʕ ʌ s i ɾ
qasir	ʕ ʌ ʃ i ɾ
qasso	ʕ ʌ sː o
qassoowe	ʕ ʌ sː oː w e
qatar	ʕ ʌ t ʌ ɾ
qatri	ʕ ʌ t ɾ i
qawi	ʕ ʌ w i
qawiiwa	ʕ ʌ w iː w ʌ
qawiyta	ʕ ʌ w i j t ʌ
qaxa	ʕ ʌ ɖ ʌ
qayso	ʕ ʌ j s o
qayso	ʕ ʌ j ʃ o
qaysoyta	ʕ ʌ j s o j t ʌ
qaysoyta	ʕ ʌ j ʃ o j t ʌ
qayto	ʕ ʌ j t o
qayxi	ʕ ʌ j ɖ i
qayxiixa	ʕ ʌ j ɖ iː ɖ ʌ
qayxixxo	ʕ ʌ j ɖ i ɖ ɖ o
qayxixxu	ʕ ʌ j ɖ i ɖː u
qeebi	ʕ eː b i
qeebitte	ʕ eː b i t t e
qeela	ʕ eː l ʌ
qeeli	ʕ eː l i
qeelitte	ʕ eː l i t t e
qeeni	ʕ eː n i
qeglili	ʕ e ɡ l i l i
qelwa	ʕ e l w ʌ
qeskaalu	ʕ e s k aː l u
qeskaltu	ʕ e s k ʌ l t u
qibin	ʕ i b i n
qibina	ʕ i b i n ʌ
qibna	ʕ i b n ʌ
qibnayto	ʕ i b n ʌ j t o
qibnaytu	ʕ i b n ʌ j t u
qidi	ʕ i d i
qokka	ʕ o k k ʌ
qolla	ʕ o l l ʌ
qollaaba	ʕ o lː aː b ʌ
qoobaari	ʕ oː b aː ɾ i
qoobaariyta	ʕ oː b aː ɾ i j t ʌ
qunga	ʕ u n ɡ ʌ
qungayto	ʕ u n ɡ ʌ j t o
qunxa	ʕ u n ɖ ʌ
qusba	ʕ u s b ʌ
qutur	ʕ u t u ɾ
raare	ɾ aː ɾ e
raba	ɾ ʌ b ʌ
rabbi	ɾ ʌ bː i
rabbow	ɾ ʌ b b o w
rabko	ɾ ʌ b k o
raddi	ɾ ʌ dː i
radditte	ɾ ʌ dː i t t e
rade	ɾ ʌ d e
rakub	ɾ ʌ k u b
rala	ɾ ʌ l ʌ
ramad	ɾ ʌ m ʌ d
ramid	ɾ ʌ m i d
rara	ɾ ʌ ɾ ʌ
rasu	ɾ ʌ s u
reyta	ɾ e j t ʌ
ribaarib	ɾ i b aː ɾ i b
rob	ɾ o b
rooci	ɾ oː ħ i
rubqi	ɾ u b ʕ i
ruddi	ɾ u dː i
ruga	ɾ u ɡ ʌ
rugaagi	ɾ u ɡ aː ɡ i
rugaagiyow	ɾ u ɡ aː ɡ i j o w
rugaytu	ɾ u ɡ ʌ j t u
saahi	s aː h i
saakih	s aː k i h
saakitte	s aː k i t t e
saaku	s aː k u
saami	s aː m i
saamiyay	s aː m i j ʌ j
saax	s aː ɖ
sabti	s ʌ b t i
saga	s ʌ ɡ ʌ
sagaal	s ʌ ɡ aː l
sagaala	s ʌ ɡ aː l ʌ
sagaytu	s ʌ ɡ ʌ j t u
sagla	s ʌ ɡ l ʌ
saksako	s ʌ k s ʌ k o
salat	s ʌ l ʌ t
salfa	s ʌ l f ʌ
samaf	s ʌ m ʌ f
