a	ʌ
samah	s ʌ m ʌ h
san	s ʌ n
sanat	s ʌ n ʌ t
sanot	s ʌ n o t
santa	s ʌ n t ʌ
sara	s ʌ ɾ ʌ
saro	s ʌ ɾ o
sarra	s ʌ r r ʌ
sarra	s ʌ rː ʌ
sasam	s ʌ s ʌ m
sasan	s ʌ s ʌ n
satqa	s ʌ t ʕ ʌ
satta	s ʌ t t ʌ
seece	s eː ħ e
seecime	s eː ħ i m e
segerre	s e ɡ e r r e
sesahtu	s e s ʌ h t u
sharti	ʃ ʌ ɾ t i
sidiica	s i d iː ħ ʌ
sidiica	ʃ i d iː ħ ʌ
sidoc	s i d o ħ
sidoc	ʃ i d o ħ
sidocoy	s i d o ħ o j
sidocoy	ʃ i d o ħ o j
sidocu	s i d o ħ u
sidocu	ʃ i d o ħ u
sigaara	s i ɡ aː ɾ ʌ
sigaara	ʃ i ɡ aː ɾ ʌ
sigaaroori	s i ɡ aː ɾ oː ɾ i
sigaaroori	ʃ i ɡ aː ɾ oː ɾ i
siino	s iː n o
siino	ʃ iː n o
silac	s i l ʌ ħ
silac	ʃ i l ʌ ħ
simbiliq	s i m b i l i ʕ
simbiliq	ʃ i m b i l i ʕ
simbilqa	s i m b i l ʕ ʌ
simbilqa	ʃ i m b i l ʕ ʌ
sin	s i n
sin	ʃ i n
sinam	s i n ʌ m
sinam	ʃ i n ʌ m
siniimi	s i n iː m i
siniimi	ʃ i n iː m i
sinim	s i n i m
sinim	ʃ i n i m
sinni	s i n n i
sinni	s i nː i
sinni	ʃ i n n i
sinni	ʃ i nː i
siqriya	s i ʕ ɾ i j ʌ
siqriya	ʃ i ʕ ɾ i j ʌ
sirwaal	s i ɾ w aː l
sirwaal	ʃ i ɾ w aː l
sirwaaltu	s i ɾ w aː l t u
sirwaaltu	ʃ i ɾ w aː l t u
sitta	s i tː ʌ
sitta	ʃ i tː ʌ
soddom	s o d d o m
sokkar	s o k k ʌ ɾ
sola	s o l ʌ
soole	s oː l e
soom	s oː m
soomaali	s oː m aː l i
soomaaliita	s oː m aː l iː t ʌ
subci	s u b ħ i
sucul	s u ħ u l
suge	s u ɡ e
sultaan	s u l t aː n
sute	s u t e
ta	t ʌ
taagat	t aː ɡ ʌ t
taagatwa	t aː ɡ ʌ t w ʌ
taagoota	t aː ɡ oː t ʌ
taahir	t aː h i ɾ
taama	t aː m ʌ
taamit	t aː m i t
taamite	t aː m i t e
taban	t ʌ b ʌ n
tabana	t ʌ b ʌ n ʌ
tabna	t ʌ b n ʌ
tabu	t ʌ b u
tagorri	t ʌ ɡ o rː i
tah	t ʌ h
takke	t ʌ kː e
talaata	t ʌ l aː t ʌ
talafoon	t ʌ l ʌ f oː n
tama	t ʌ m ʌ
tamah	t ʌ m ʌ h
tamu	t ʌ m u
tawaaga	t ʌ w aː ɡ ʌ
tayfoofi	t ʌ j f oː f i
tayyaara	t ʌ jː aː ɾ ʌ
telfoon	t e l f oː n
tet	t e t
tetiimi	t e t iː m i
tetim	t e t i m
tifiile	t i f iː l e
tigre	t i ɡ ɾ e
tigreyta	t i ɡ ɾ e j t ʌ
titta	t i tː ʌ
tiya	t i j ʌ
toh	t o h
tokke	t o kː e
too	t oː
toobokiino	t oː b o k iː n o
toobokiinu	t oː b o k iː n u
tooboko	t oː b o k o
toobokoyta	t oː b o k o j t ʌ
toobokoytitte	t oː b o k o j t i t t e
tu	t u
tuffaac	t u f f aː ħ
tuffac	t u f f ʌ ħ
tufo	t u f o
tukkurru	t u kː u r r u
tumme	t u m m e
turru	t u r r u
turub	t u ɾ u b
tuuristi	t uː ɾ i s t i
tuut	t uː t
ubamuble	u b ʌ m u b l e
ubamumbulle	u b ʌ m u m b u l l e
ubamuybulle	u b ʌ m u j b u l l e
ubka	u b k ʌ
uble	u b l e
ubqure	u b ʕ u ɾ e
udulume	u d u l u m e
uduure	u d uː ɾ e
uftuce	u f t u ħ e
ufuy	u f u j
ugdube	u ɡ d u b e
uguc	u ɡ u ħ
ugucta	u ɡ u ħ t ʌ
ugute	u ɡ u t e
ukkuqe	u kː u ʕ e
ukubbi	u k u b b i
ukwa	u k w ʌ
ukya	u k j ʌ
uli	u l i
ulla	u l l ʌ
ullaali	u lː aː l i
ullaalo	u lː aː l o
ullalwa	u lː ʌ l w ʌ
ullat	u l l ʌ t
ulmo	u l m o
ulqi	u l ʕ i
uma	u m ʌ
umaane	u m aː n e
umel	u m e l
ummaan	u m m aː n
umman	u mː ʌ n
umubqure	u m u b ʕ u ɾ e
umukkuqe	u m u kː u ʕ e
unbuude	u n b uː d e
undullume	u n d u lː u m e
unfuttuce	u n f u tː u ħ e
unkaq	u n k ʌ ʕ
untulluke	u n t u lː u k e
uqdure	u ʕ d u ɾ e
urri	u r r i
urriina	u rː iː n ʌ
urrimalaawa	u rː i m ʌ l aː w ʌ
urritte	u rː i t t e
urru	u rː u
urruuga	u rː uː ɡ ʌ
urruuteeta	u rː uː t eː t ʌ
uruffe	u ɾ u f f e
usgudube	u s ɡ u d u b e
usguude	u s ɡ uː d e
uskute	u s k u t e
ussuguude	u sː u ɡ uː d e
ussukute	u sː u k u t e
usuk	u s u k
usun	u s u n
usuule	u s uː l e
utkaaliyta	u t k aː l i j t ʌ
uttuduure	u tː u d uː ɾ e
utuluke	u t u l u k e
uxum	u ɖ u m
uxxi	u ɖ ɖ i
uxxuxe	u ɖː u ɖ e
uybulle	u j b u l l e
uybulluse	u j b u lː u s e
uybuude	u j b uː d e
uyduure	u j d uː ɾ e
uyduuruse	u j d uː ɾ u s e
viktooriya	v i k t oː ɾ i j ʌ
waado	w aː d o
waadoyso	w aː d o j s o
waadoyso	w aː d o j ʃ o
waame	w aː m e
waamu	w aː m u
waane	w aː n e
waar	w aː ɾ
wacar	w ʌ ħ ʌ ɾ
wacaro	w ʌ ħ ʌ ɾ o
wacro	w ʌ ħ ɾ o
wadaariyoowa	w ʌ d aː ɾ i j oː w ʌ
wadar	w ʌ d ʌ ɾ
wadarih	w ʌ d ʌ ɾ i h
wadir	w ʌ d i ɾ
wagaq	w ʌ ɡ ʌ ʕ
wagar	w ʌ ɡ ʌ ɾ
wagarto	w ʌ ɡ ʌ ɾ t o
wagartoota	w ʌ ɡ ʌ ɾ t oː t ʌ
wak	w ʌ k
wakak	w ʌ k ʌ k
wakri	w ʌ k ɾ i
wale	w ʌ l e
wana	w ʌ n ʌ
wanna	w ʌ n n ʌ
wanxef	w ʌ n ɖ e f
wanxefta	w ʌ n ɖ e f t ʌ
wanxeftitte	w ʌ n ɖ e f t i t t e
waqdi	w ʌ ʕ d i
waqla	w ʌ ʕ l ʌ
waqlat	w ʌ ʕ l ʌ t
waraakit	w ʌ ɾ aː k i t
wardiya	w ʌ ɾ d i j ʌ
warkat	w ʌ ɾ k ʌ t
warru	w ʌ rː u
way	w ʌ j
waynabo	w ʌ j n ʌ b o
waysu	w ʌ j s u
waysu	w ʌ j ʃ u
wayxaxe	w ʌ j ɖ ʌ ɖ e
wayxex	w ʌ j ɖ e ɖ
wayxexxo	w ʌ j ɖ e ɖ ɖ o
wayxexxu	w ʌ j ɖ e ɖː u
wee	w eː
weelisenta	w eː l i s e n t ʌ
weelo	w eː l o
weelol	w eː l o l
weeqa	w eː ʕ ʌ
weeqaytu	w eː ʕ ʌ j t u
weyite	w e j i t e
widir	w i d i ɾ
wili	w i l i
wixih	w i ɖ i h
woh	w o h
woo	w oː
wotti	w o tː i
wottih	w o tː i h
xaa	ɖ aː
xaafitte	ɖ aː f i t t e
xaafu	ɖ aː f u
xaagitte	ɖ aː ɡ i t t e
xaagu	ɖ aː ɡ u
xaahi	ɖ aː h i
xaaxe	ɖ aː ɖ e
xabcini	ɖ ʌ b ħ i n i
xabcinnoowe	ɖ ʌ b ħ i nː oː w e
xago	ɖ ʌ ɡ o
xagor	ɖ ʌ ɡ o ɾ
xagorta	ɖ ʌ ɡ o ɾ t ʌ
xagxago	ɖ ʌ ɡ ɖ ʌ ɡ o
xaleyna	ɖ ʌ l e j n ʌ
xalu	ɖ ʌ l u
xamu	ɖ ʌ m u
xayi	ɖ ʌ j i
xayih	ɖ ʌ j i h
xaylo	ɖ ʌ j l o
xeeri	ɖ eː ɾ i
xeeru	ɖ eː ɾ u
xeeruk	ɖ eː ɾ u k
xeet	ɖ eː t
xeflih	ɖ e f l i h
xiba	ɖ i b ʌ
xiiba	ɖ iː b ʌ
ximmo	ɖ i m m o
ximo	ɖ i m o
ximoli	ɖ i m o l i
xin	ɖ i n
xinse	ɖ i n s e
yaa	j aː
yaabe	j aː b e
yaabise	j aː b i s e
yaagut	j aː ɡ u t
yaarri	j aː r r i
yab	j ʌ b
yabamyaabe	j ʌ b ʌ m j aː b e
yabamyabsiise	j ʌ b ʌ m j ʌ b s iː s e
yabamyabsiise	j ʌ b ʌ m j ʌ b ʃ iː s e
yabbaasite	j ʌ bː aː s i t e
yabbaasite	j ʌ bː aː ʃ i t e
yabsiise	j ʌ b s iː s e
yabsiise	j ʌ b ʃ iː s e
yabsiisite	j ʌ b s iː s i t e
yabsiisite	j ʌ b ʃ iː ʃ i t e
yahuud	j ʌ h uː d
yahuudiyta	j ʌ h uː d i j t ʌ
yalla	j ʌ lː ʌ
yallaw	j ʌ l l ʌ w
yalli	j ʌ l l i
yangula	j ʌ n ɡ u l ʌ
yangulitte	j ʌ n ɡ u l i t t e
yangulta	j ʌ n ɡ u l t ʌ
yangulwa	j ʌ n ɡ u l w ʌ
yayfoofi	j ʌ j f oː f i
yayya	j ʌ j j ʌ
yeey	j eː j
yengeleeni	j e n ɡ e l eː n i
yerde	j e ɾ d e
yi	j i
yibuuti	j i b uː t i
yifiile	j i f iː l e
yiimi	j iː m i
yim	j i m
yo	j o
yoo	j oː
zimbaabuwe	z i m b aː b u w e
