hinigugma	h ɪ n̪ ɪ ɡ ʊ ɡ m a ʔ
hinog	h ɪ n̪ o ɡ
hinudas	h ɪ n̪ u d̪ ʌ s̪
hinumdom	h ɪ n̪ u m d̪ ɔ m
hinungdan	h ɪ n̪ ʊ ŋ d̪ a n̪
hipon	h i p ɔ n̪
hipos	h i p ɔ s̪
hisoler	h ɪ s̪ ɔ l̪ i ɾ̪
hita	h i t̪ ʌ ʔ
hito	h i t̪ ɔ ʔ
hitsura	h ɪ t͡s u ɾ̪ ʌ
honda	h o n̪ d̪ ʌ
hopia	h o p j ʌ ʔ
hopya	h o p j ʌ ʔ
hubad	h ʊ b a d̪
hubag	h ʊ b a ɡ
hubak	h u b ʌ k
hubakon	h ʊ b a k ɔ n̪
hubas	h ʊ b a s̪
hubo	h ʊ b o ʔ
hubog	h ʊ b o ɡ
hubon	h ʊ b o n̪
hudas	h u d̪ ʌ s̪
hudyo	h ʊ d̪ j o
hugas	h u ɡ ʌ s̪
hugaw	h u ɡ a ʊ̯
hukom	h ʊ k o m
hula	h u l̪ ʌ
hulagway	h ʊ l̪ ʌ ɡ w a ɪ̯
hulat	h ʊ a t̪
hulat	h ʊ l̪ a t̪
hulay	h u l̪ a ɪ̯
hulbot	h ʊ ɡ k o t̪
hulga	h o l ɡ ɐ ʔ
hulhol	h ʊ l̪ h o l̪
hulog	h u l̪ ɔ ɡ
hulyo	h u l̪ j ɔ
humok	h u m ɔ k
humot	h ʌ m o t̪
hunas	h ʊ n̪ a s̪
hungit	h u ŋ ɪ t̪
hunyo	h u n̪ j ɔ
huot	h u ʔ ɔ t̪
huramentado	h ʊ ɾ̪ ʌ m ɪ n̪ t̪ a d̪ ɔ
hurisdiksiyon	h ʊ ɾ̪ ɪ s̪ d̪ ɪ k s̪ j o n̪
husay	h u s̪ a ɪ̯
husgado	h ʊ s̪ ɡ a d̪ ɔ
huwad	h ʊ a d̪
huwat	h ʊ a t̪
huwebes	h ʊ w i b ɪ s̪
huyang	h u j ʌ ŋ
huybes	h u ɪ b ɪ s̪
huyop	h ʊ j o p
huyuhoy	h ʊ j u h o ɪ̯
ibabaw	ʔ ɪ b a b a ʊ̯
ibarra	ʔ ɪ b a ɾ̪ ʌ
ibañez	ʔ ɪ b a ɲ ɪ s̪
ideyolohiya	ʔ ɪ d̪ ɪ j ɔ l̪ ɔ h i ʌ
ido	ʔ i d̪ ɔ ʔ
igbaw	ʔ ɪ ɡ b a ʊ̯
ignorante	ʔ ɪ ɡ n̪ ɔ ɾ̪ a n̪ t̪ ɪ
igot	ʔ i ɡ ɔ t̪
igso	ʔ ɪ ɡ s̪ o ʔ
ihag	ʔ i h ʌ ɡ
ihalas	ʔ ɪ h ʌ l̪ a s̪
ihas	ʔ ɪ h a s̪
ihi	ʔ i h ɪ ʔ
ikaw	ʔ ɪ k a ʊ̯
ikog	ʔ i k ɔ ɡ
ila	ʔ i l̪ ʌ
ilad	ʔ ɪ l̪ a d̪
ilaga	ʔ ɪ l̪ ʌ ɡ a ʔ
iling	ʔ ɪ l̪ i ŋ
ilo	ʔ i l̪ ɔ
iloilo	ʔ ɪ l̪ o j l̪ ɔ
ilok	ʔ i l̪ ɔ k
ilusyon	ʔ ɪ l̪ ʊ s̪ j o n̪
imahe	ʔ ɪ m a h ɪ
imbes	ʔ ɪ m b i s̪
imbestigar	ʔ ɪ m b ɪ s̪ t̪ i ɡ ʌ ɾ̪
imbestigasyon	ʔ ɪ m b ɪ s̪ t̪ ɪ ɡ ʌ s̪ j o n̪
imbitar	ʔ ɪ m b ɪ t̪ a ɾ̪
imburnal	ʔ ɪ m b ʊ ɾ̪ n̪ a l̪
imo	ʔ i m ɔ
impakto	ʔ ɪ m p a k t̪ ɔ
impeksyon	ʔ ɪ m p ɪ k s̪ j o n̪
implementar	ʔ ɪ m p l̪ ɪ m ɪ n̪ t̪ a ɾ̪
implikar	ʔ ɪ m p l̪ ɪ k a ɾ̪
implikasyon	ʔ ɪ m p l̪ ɪ k ʌ s̪ j o n̪
importansiya	ʔ ɪ m p ɔ ɾ̪ t̪ a n̪ s̪ j a
ina	ʔ ɪ n̪ a
inabanga	ʔ ɪ n̪ ʌ b a ŋ ɡ ʌ
inadlawan	ʔ i n̪ a d̪ l̪ ʌ w ʌ n̪
inadlawan	ʔ ɪ n̪ ʌ d̪ l̪ a w ʌ n̪
inahan	ʔ ɪ n̪ a h ʌ n̪
inaon	ʔ ɪ n̪ ʌ ʔ o n̪
inday	ʔ ɪ n̪ d̪ a ɪ̯
indibidwal	ʔ ɪ n̪ d̪ ɪ b ɪ d̪ w a l̪
indulhensiya	ʔ ɪ n̪ d̪ ʊ l̪ h i n̪ s̪ j ʌ
inga	ɪ ŋ ʌ ʔ
ingrato	ʔ ɪ ŋ ɡ ɾ̪ a t̪ ɔ
inilokano	ʔ ɪ n̪ ɪ l̪ ɔ k a n̪ ɔ
iningles	ʔ ɪ n̪ ɪ ŋ ɡ l̪ i s̪
ininsik	ʔ ɪ n̪ ɪ n̪ s̪ i k
init	ʔ i n̪ ɪ t̪
inkulkasyon	ʔ ɪ ŋ k ʊ l̪ k ʌ s̪ j o n̪
inom	ʔ ɪ n̪ o m
inosente	ʔ ɪ n̪ ɔ s̪ i n̪ t̪ ɪ
insenso	ʔ ɪ n̪ s̪ i n̪ s̪ ɔ
instruksyon	ʔ ɪ n̪ s̪ t̪ ɾ̪ ʊ k s̪ j o n̪
insulto	ʔ ɪ n̪ s̪ u l̪ t̪ ɔ
insumniyalak	ʔ ɪ n̪ s̪ u m n̪ j a l̪ ʌ k
internasyonal	ʔ ɪ n̪ t̪ ɪ ɾ̪ n̪ ʌ s̪ j ɔ n̪ a l̪
inunlan	ʔ ɪ n̪ ʊ n̪ l̪ a n̪
inyo	ʔ i n̪ j ɔ
ipil	ʔ i p ɪ l̪
ipos	ʔ i p ɔ s̪
irigasyon	ʔ ɪ ɾ̪ ɪ ɡ ʌ s̪ j o n̪
iring	ʔ ɪ ɾ̪ i ŋ
iro	ʔ i ɾ̪ ɔ ʔ
isda	ʔ ɪ s̪ d̪ a ʔ
isi	ʔ i s̪ ɪ
isigkatawo	ʔ ɪ s̪ ɪ ɡ k ʌ ʔ i ŋ ɔ n̪
isip	ʔ i s̪ ɪ p
isko	ʔ ɪ s̪ k o ʔ
isla	ʔ i s̪ l̪ ʌ
isog	ʔ i s̪ ɔ ɡ
itlog	ʔ ɪ t̪ l̪ o ɡ
ito	ʔ i t̪ ɔ ʔ
itsura	ʔ ɪ t͡s u ɾ̪ ʌ
iya	ʔ ɪ a
iya	ʔ ɪ d͡ʒ a
iyot	ʔ i j ɔ t̪
jagna	h a ɡ n̪ ʌ
jakol	d͡ʒ ʌ k o l̪
jimenez	h ɪ m i n̪ ɪ s̪
jose	h ɔ s̪ i
jud	d͡ʒ ʊ d̪
jumawan	h ʊ m a w ʌ n̪
kaajo	k ʌ ʔ a d͡ʒ ɔ
kaanyag	k ʌ ʔ ʌ n̪ j a ɡ
kaaway	k ʌ ʔ a w a ɪ̯
kaayo	k ʌ ʔ a j ɔ
kabanga	k ʌ b ʌ ŋ a
kabankalan	k ʌ b ʌ ŋ k ʌ l̪ a n̪
kabata	k ʌ b a t̪ ʌ ʔ
kabaw	k a b a ʊ̯
kabayo	k ʌ b a j ɔ
kabit	k ʌ b i t̪
kabkab	k a b k a b
kabo	k a b ɔ
kabo	k a b ɔ ʔ
kabog	k ʌ b o ɡ
kabuang	k ʌ b u ʔ ʌ ŋ
kadagatan	k ʌ d̪ ʌ ɡ a t̪ ʌ n̪
kadagkoan	k ʌ d̪ ʌ ɡ k ɔ ʔ a n̪
kadiyot	k ʌ d̪ j o t̪
kadto	k a d̪ t̪ ɔ
kadugo	k a d̪ ʊ ɡ o ʔ
kadula	k ʌ d̪ u l̪ ʌ ʔ
kaeskuyla	k ʌ ʔ ɪ s̪ k u ɪ l̪ ʌ
kagabhion	k ʌ ɡ ʌ b h i ʔ ɔ n̪
kagabii	k ʌ ɡ ʌ b ɪ ʔ i
kagahapon	k ʌ ɡ ʌ h a p ɔ n̪
kagaw	k a ɡ a ʊ̯
kagawasan	k ʌ ɡ ʌ w a s̪ ʌ n̪
kagibuhi	k ʌ ɡ ɪ b u h ɪ ʔ
kagwapa	k ʌ ɡ w a p ʌ
kagwapo	k ʌ ɡ w a p ɔ
kahibalo	k ʌ h ɪ b ʌ l̪ o
kahoy	k a h o ɪ̯
kahoyan	k ʌ h ɔ j a n̪
kahubog	k ʌ h ʊ b o ɡ
kahusayan	k ʌ h ʊ s̪ a j ʌ n̪
kaisog	k ʌ ʔ i s̪ ɔ ɡ
kakahoyan	k ʌ k ʌ h o j ʌ n̪
kakaw	k ʌ k a ʊ̯
kalabasa	k ʌ l̪ ʌ b a s̪ ʌ
kalabera	k ʌ l̪ ʌ b i ɾ̪ ʌ
kalag	k a ɡ
kalag	k ʌ l̪ a ɡ
kalainan	k ʌ l̪ ʌ ʔ i n̪ ʌ n̪
kalamansi	k ʌ l̪ ʌ m ʌ n̪ s̪ i ʔ
kalamboan	k ʌ l̪ ʌ m b ɔ ʔ a n̪
kalambre	k ʌ l̪ a m b ɾ̪ ɪ
kalangitan	k ʌ l̪ ʌ ŋ i t̪ ʌ n̪
kalasag	k a s̪ ʌ ɡ
kalasag	k ʌ l̪ a s̪ ʌ ɡ
kalaskas	k ʌ l̪ ʌ s̪ k a s̪
kalayo	k a j ɔ
kalayo	k ʌ j a j ɔ
kalayo	k ʌ l̪ a d͡ʒ ɔ
kalayo	k ʌ l̪ a j ɔ
kalayo	k ʌ l̪ ʌ d͡ʒ o
kalayo	k ʌ l̪ ʌ j o
kaldero	k ʌ l̪ d̪ i ɾ̪ ɔ
kalentura	k ʌ l̪ ɪ n̪ t̪ u ɾ̪ ʌ
kalibotan	k ʌ l̪ ɪ b o t̪ ʌ n̪
kalinaw	k ʌ l̪ i n̪ a ʊ̯
kalipay	k ʌ l̪ i p a ɪ̯
kalis	k a l̪ ɪ s̪
kaliwatan	k ʌ l̪ ɪ w a t̪ ʌ n̪
kalo	k a l̪ ɔ ʔ
kalos	k a l̪ ɔ s̪
kalos	k a w s̪
kalsada	k ʌ l̪ s̪ a d̪ ʌ
kaluha	k ʌ l̪ ʊ h a
kaluhaan	k a ʊ̯ h a ʔ ʌ n̪
kaluhaan	k ʌ l̪ ʊ h a ʔ ʌ n̪
kaluhaan	k ʌ w h a ʔ ʌ n̪
kalundan	k ʌ l̪ ʊ n̪ d̪ a n̪
kaluoy	k ʌ l̪ u ʔ o ɪ̯
kamagong	k ʌ m ʌ ɡ o ŋ
kamalig	k ʌ m a l̪ ɪ ɡ
kamantigi	k ʌ m ʌ n̪ t̪ ɪ ɡ i
kamao	k ʌ m a ʔ ɔ
kamatayon	k ʌ m ʌ t̪ a d͡ʒ ɔ n̪
kamatayon	k ʌ m ʌ t̪ a j ɔ n̪
kamatis	k ʌ m a t̪ ɪ s̪
kamatuoran	k ʌ m ʌ t̪ ʊ ʔ o ɾ̪ ʌ n̪
kamatyonon	k ʌ m ʌ t̪ j o n̪ ɔ n̪
kambras	k a m b ɾ̪ ʌ s̪
kami	k ʌ m i
kamkam	k ʌ m k a m
kamlas	k a m l̪ ʌ s̪
kamo	k ʌ m o
kamot	k ʌ m o t̪
kamote	k ʌ m o t̪ ɪ
kampana	k ʌ m p a n̪ ʌ ʔ
kampanaryo	k ʌ m p ʌ n̪ a ɾ̪ j ɔ
kampanilya	k ʌ m p ʌ n̪ i l̪ j ʌ
kamras	k ʌ m ɾ̪ a s̪
kamunggay	k ʌ m ʊ ŋ ɡ a ɪ̯
kamuning	k ʌ m ʊ n̪ i ŋ
kandila	k ʌ n̪ d̪ i l̪ ʌ
kanding	k ʌ n̪ d̪ i ŋ
kang	k a ŋ
kanibalismo	k ʌ n̪ ɪ b ʌ l̪ i s̪ m ɔ
kansiyon	k ʌ n̪ s̪ j o n̪
kanta	k ʌ n̪ t̪ a
kanto	k a n̪ t̪ ɔ
kanunay	k ʌ n̪ u n̪ a ɪ̯
kanyon	k ʌ n̪ j o n̪
kaon	k a ʔ ɔ n̪
kapait	k ʌ p ʌ i t̪
kapalaran	k ʌ p ʌ l̪ a ɾ̪ ʌ n̪
kapay	k ʌ p a ɪ̯
kapayas	k ʌ p a j ʌ s̪
kapinyahan	k ʌ p ɪ n̪ j a h ʌ n̪
kapitalismo	k ʌ p ɪ t̪ ʌ l̪ i s̪ m ɔ
kapitalista	k ʌ p ɪ t̪ ʌ l̪ i s̪ t̪ ʌ
kapitolyo	k ʌ p ɪ t̪ o l̪ j ɔ
kapoy	k ʌ p o j
kapuloan	k ʌ p ʊ l̪ ɔ ʔ a n̪
kapunawan	k ʌ p ʊ n̪ a w ʌ n̪
karaan	k ʌ ɾ̪ a ʌ n̪
karaho	k ʌ ɾ̪ a h ɔ
kargaburo	k ʌ ɾ̪ ɡ ʌ b u ɾ̪ ɔ
kargador	k ʌ ɾ̪ ɡ ʌ d̪ o ɾ̪
karinyo	k ʌ ɾ̪ i n̪ j ɔ
karnabal	k ʌ ɾ̪ n̪ ʌ b a l̪
karnero	k ʌ ɾ̪ n̪ i ɾ̪ ɔ
karon	k ʌ ɾ̪ o n̪
karpet	k a ɾ̪ p ɪ t̪
karsada	k ʌ ɾ̪ s̪ a d̪ ʌ
karwahe	k ʌ r w a h ɪ
kasadpan	k ʌ s̪ a d̪ p ʌ n̪
kasag	k ʌ s̪ a ɡ
kasambagan	k ʌ s̪ ʌ m b ʌ ɡ a n̪
kasili	k ʌ s̪ i l̪ ɪ
kasilyas	k ʌ s̪ i l̪ j ʌ s̪
kasingkasing	k ʌ s̪ ɪ ŋ k a s̪ ɪ ŋ
kasitas	k ʌ s̪ i t̪ ʌ s̪
kaskas	k ʌ s̪ k a s̪
kaso	k a s̪ ɔ
kaspa	k a s̪ p ʌ
kastigo	k ʌ s̪ t̪ i ɡ ɔ
kasulya	k ʌ s̪ u l̪ j ʌ
kasundalohan	k ʌ s̪ ʊ n̪ d̪ ʌ l̪ o h ʌ n̪
katabang	k ʌ t̪ a b ʌ ŋ
katahap	k ʌ t̪ a h ʌ p
katahom	k ʌ t̪ ʌ h o m
katarata	k ʌ t̪ ʌ ɾ̪ a t̪ ʌ
katawa	k ʌ t̪ ʌ w a
kategoriya	k ʌ t̪ ɪ ɡ ɔ ɾ̪ i ʌ
katig	k a t̪ ɪ ɡ
katigayonan	k ʌ t̪ ɪ ɡ ʌ j o n̪ ʌ n̪
katkat	k a t̪ k ʌ t̪
katmon	k ʌ t̪ m o n̪
kato	k a t̪ ɔ
katol	k ʌ t̪ o l̪
katre	k a t̪ ɾ̪ ɪ
katsila	k ʌ t͡s i l̪ ʌ ʔ
katulog	k ʌ t̪ u l̪ ɔ ɡ
katunggan	k ʌ t̪ ʊ ŋ ɡ a n̪
katunhayan	k ʌ t̪ ʊ ŋ h ʌ j a n̪
katuod	k ʌ t̪ ʊ ʔ o d̪
katupad	k ʌ t̪ u p ʌ d̪
kaugalingnan	k ʌ ʔ ʊ ɡ ʌ l̪ ɪ ŋ n̪ a n̪
kaugalingon	k ʌ ʔ ʊ ɡ ʌ l̪ i ŋ ɔ n̪
kaugmaon	k ʌ ʔ ʊ ɡ m a ʔ ɔ n̪
kaulaw	k ʌ ʔ u a ʊ̯
kaulaw	k ʌ ʔ u l̪ a ʊ̯
kaunom	k ʌ ʔ u n̪ ɔ m
kauswagan	k ʌ ʔ ʊ s̪ w ʌ ɡ a n̪
kawanangan	k ʌ w ʌ n̪ a ŋ ʌ n̪
kawat	k a w ʌ t̪
kawatan	k ʌ w ʌ t̪ a n̪
kawayan	k ʌ w a j ʌ n̪
kawayanan	k ʌ w ʌ j ʌ n̪ a n̪
kawit	k a w ɪ t̪
kawras	k a ʊ̯ ɾ̪ ʌ s̪
kayas	k a j ʌ s̪
kayat	k a d͡ʒ ʌ t̪
kayat	k a j ʌ t̪
kaymito	k a ɪ̯ m i t̪ ɔ
kayo	k a j ɔ
keso	k i s̪ ɔ
kevin	k i b ɪ n̪
kidya	k ɪ d̪ j a
kikik	k ɪ k i k
kilat	k i l̪ ʌ t̪
kilay	k i l̪ a ɪ̯
kilomkilom	k ɪ l̪ ɔ m k i l̪ ɔ m
kilumkilom	k ɪ l̪ ʊ m k i l̪ ɔ m
kinabuhi	k ɪ n̪ ʌ b u h ɪ
kinamaguwangan	k ɪ n̪ ʌ m ʌ ɡ w a ŋ ʌ n̪
kinasingkasing	k ɪ n̪ ʌ s̪ ɪ ŋ k a s̪ ɪ ŋ
kinatsila	k ɪ n̪ ʌ t͡s i l̪ ʌ ʔ
kintanar	k ɪ n̪ t̪ ʌ n̪ a ɾ̪
kisame	k i s̪ ʌ m ɪ
kisami	k i s̪ ʌ m ɪ
kita	k i t̪ ʌ
kita	k ɪ t̪ a
kitiw	k i t̪ i ʊ̯
kitiw	k ɪ t̪ i ʊ̯
klaro	k l̪ a ɾ̪ ɔ
kliyente	k l̪ j i n̪ t̪ ɪ
kobra	k o b ɾ̪ ʌ
kobra	k ɔ b ɾ̪ a
kobrador	k ɔ b ɾ̪ ʌ d̪ o ɾ̪
kokak	k o k ʌ k
kolehiyo	k ɔ l̪ ɪ h i j ɔ
kolera	k o l̪ ɪ ɾ̪ ʌ
kombensyon	k ɔ m b ɪ n̪ s̪ j o n̪
kombento	k ɔ m b i n̪ t̪ ɔ
kombida	k ɔ m b ɪ d̪ a
komedyana	k ɔ m ɪ d̪ j a n̪ ʌ
komedyano	k ɔ m ɪ d̪ j a n̪ ɔ
komedyante	k ɔ m ɪ d̪ j a n̪ t̪ ɪ
komemorasyon	k ɔ m ɪ m ɔ ɾ̪ ʌ s̪ j o n̪
komentarista	k ɔ m ɪ n̪ t̪ ʌ ɾ̪ i s̪ t̪ ʌ
komentaryo	k ɔ m ɪ n̪ t̪ a ɾ̪ j ɔ
komite	k ɔ m ɪ t̪ i
komo	k o m ɔ
kompetisyon	k ɔ m p ɪ t̪ ɪ s̪ j o n̪
kompleto	k ɔ m p l̪ i t̪ ɔ
komposisyon	k ɔ m p ɔ s̪ ɪ s̪ j o n̪
komun	k ɔ m u n̪
komunista	k ɔ m ʊ n̪ i s̪ t̪ ʌ
kondensada	k ɔ n̪ d̪ ɪ n̪ s̪ a d̪ ʌ
koneho	k ɔ n̪ i h ɔ
kongkreto	k ɔ ŋ k ɾ̪ i t̪ ɔ
kongresista	k ɔ ŋ ɡ ɾ̪ ɪ s̪ i s̪ t̪ ʌ
kongreso	k ɔ ŋ ɡ ɾ̪ i s̪ ɔ
konkreto	k ɔ ŋ k ɾ̪ i t̪ ɔ
konsagrasyon	k ɔ n̪ s̪ ʌ ɡ ɾ̪ ʌ s̪ j o n̪
konsensiya	k ɔ n̪ s̪ i n̪ s̪ j a
konsensya	k ɔ n̪ s̪ i n̪ s̪ j ʌ
konsorte	k ɔ n̪ s̪ o ɾ̪ t̪ ɪ
konsumidor	k ɔ n̪ s̪ ʊ m ɪ d̪ o ɾ̪
kontador	k ɔ n̪ t̪ ʌ d̪ o ɾ̪
kontento	k ɔ n̪ t̪ i n̪ t̪ ɔ
kontrabando	k ɔ n̪ t̪ ɾ̪ ʌ b a n̪ d̪ ɔ
kooperasyon	k ɔ ɔ p ɪ ɾ̪ ʌ s̪ j o n̪
kordero	k ɔ ɾ̪ d̪ i ɾ̪ ɔ
kosina	k ɔ s̪ i n̪ ʌ
kosinera	k ɔ s̪ ɪ n̪ i ɾ̪ ʌ
kosinero	k ɔ s̪ ɪ n̪ i ɾ̪ ɔ
kotse	k o t͡s ɪ
krayola	k ɾ̪ ʌ j o l̪ ʌ
kristo	k ɾ̪ i s̪ t̪ ɔ
kubalan	k ʊ b ʌ l̪ a n̪
kubalon	k ʊ b a l̪ ɔ n̪
kubkob	k ʊ b k o b
kubot	k u b ɔ t̪
kubot	k ʊ b o t̪
kubtanan	k ʊ b t̪ a n̪ ʌ n̪
kudeta	k u d̪ ɪ t̪ ʌ
kudkoran	k ʊ d̪ k ɔ ɾ̪ a n̪
kughal	k ʊ ɡ h a l̪
kugita	k ʊ ɡ i t̪ ʌ
kugmo	k u ɡ m ɔ
kugmohon	k ʊ ɡ m o h ɔ n̪
kugos	k u ɡ ɔ s̪
kugtong	k ʊ ɡ t̪ o ŋ
kuha	k u h ʌ ʔ
kuhit	k u h ɪ t̪
kujaji	k ʊ d͡ʒ a d͡ʒ ɪ
kuko	k ʊ k o
kukok	k u k ɔ k
kulago	k ʊ l̪ a ɡ ɔ ʔ
kulangot	k ʊ l̪ a ŋ ɔ t̪
kulas	k ʊ l̪ a s̪
kuli	k u l̪ ɪ ʔ
kuli	k ʊ l̪ i ʔ
kulianon	k ʊ l̪ ɪ ʔ a n̪ ɔ n̪
kulkol	k u l̪ k ɔ l̪
kulob	k ʊ l̪ o b
kumagat	k ʊ m a ɡ ʌ t̪
kumagko	k ʊ m a ɡ k ɔ ʔ
kumalagko	k ʊ m a ɡ k ɔ ʔ
kumalagko	k ʊ m ʌ l̪ a ɡ k ɔ ʔ
kumusta	k ʊ m ʊ s̪ t̪ a
kupo	k ʊ p o ʔ
kupos	k u p ɔ s̪
kupot	k ʊ p o t̪
kuratsa	k ʊ ɾ̪ a t͡s ʌ
kurba	k ʊ ɾ̪ b a
kurus	k ʊ ɾ̪ u s̪
kuryente	k ʊ ɾ̪ j i n̪ t̪ ɪ
kusgan	k ʊ s̪ ɡ a n̪
kusina	k ʊ s̪ i n̪ ʌ
kusisang	k ʊ s̪ i s̪ ʌ ŋ
kusog	k ʊ s̪ o ɡ
kutana	k ʊ t̪ a n̪ ʌ
kuting	k ʊ t̪ i ŋ
kutis	k u t̪ ɪ s̪
kutkot	k u t̪ k ɔ t̪
kuto	k u t̪ ɔ
kutsara	k ʊ t͡s a ɾ̪ ʌ
kutsaron	k ʊ t͡s ʌ ɾ̪ o n̪
kutsilyo	k ʊ t͡s i l̪ j ɔ
kuwadrilyon	k w ʌ d̪ ɾ̪ ɪ l̪ j o n̪
kuwang	k u ʌ ŋ
kuwarta	k w a ɾ̪ t̪ ʌ
kuwartahan	k w ʌ ɾ̪ t̪ a h ʌ n̪
kuweba	k w i b ʌ
kuwintilyon	k w ɪ n̪ t̪ ɪ l̪ j o n̪
kuwitis	k w i t̪ ɪ s̪
kuyap	k ʊ j a p
kuyba	k u ɪ b ʌ
kwarta	k w ʌ ɾ̪ t̪ ʌ
kwelyo	k w ɪ l̪ j ɔ
kwestyonable	k w ɪ s̪ t̪ j ɔ n̪ a b l̪ ɪ
laag	l̪ a ʔ ʌ ɡ
laagan	l̪ ʌ ʔ ʌ ɡ a n̪
laba	l̪ ʌ b a
labaha	l̪ ʌ b a h ʌ
labandera	l̪ ʌ b ʌ n̪ d̪ i ɾ̪ ʌ
labandero	l̪ ʌ b ʌ n̪ d̪ i ɾ̪ ɔ
labastida	l̪ ʌ b ʌ s̪ t̪ i d̪ ʌ
labaw	l̪ a b a ʊ̯
labay	l̪ ʌ b a ɪ̯
labender	l̪ ʌ b i n̪ d̪ ɪ ɾ̪
labhan	l̪ ʌ b h a n̪
labong	l̪ a b ɔ ŋ
laga	l̪ a ʔ ɡ ʌ ʔ
lagaw	l̪ ʌ ɡ a ʊ̯
lagay	j ʌ ɡ a ɪ̯
lagay	l̪ ʌ ɡ a ɪ̯
lagingling	l̪ ʌ ɡ ɪ ŋ l̪ i ŋ
lagos	l̪ ʌ ɡ o s̪
lahar	l̪ ʌ h a ɾ̪
lain	l̪ a ʔ ɪ n̪
lakang	l̪ a k ʌ ŋ
lakat	l̪ ʌ k a t̪
lakaw	l̪ ʌ k a ʊ̯
laki	l̪ a k ɪ
laksa	l̪ ʌ k s̪ a ʔ
laksot	l̪ ʌ k s̪ o t̪
lalag	l̪ a l̪ ʌ ɡ
lalaki	l̪ ʌ l̪ a k ɪ
lalawigan	l̪ ʌ l̪ ʌ w i ɡ ʌ n̪
lalom	l̪ a l̪ ɔ m
lamdaman	l̪ ʌ m d̪ a m ʌ n̪
lamok	l̪ ʌ m o k
lamparilya	l̪ ʌ m p ʌ ɾ̪ i l̪ j ʌ
lampin	l̪ ʌ m p i n̪
lana	l̪ a n̪ ʌ
langaw	l̪ a ŋ a ʊ̯
langgam	l̪ ʌ ŋ ɡ a m
langit	l̪ a ŋ ɪ t̪
langob	l̪ ʌ ŋ o b
langoy	l̪ ʌ ŋ o j
lansa	l̪ ʌ n̪ s̪ a
lansang	l̪ ʌ n̪ s̪ a ŋ
lansaro	l̪ ʌ n̪ s̪ ʌ ɾ̪ o
lansarohon	l̪ ʌ n̪ s̪ ʌ ɾ̪ ɔ h o n̪
lansones	l̪ ʌ n̪ s̪ o n̪ ɪ s̪
lansyaw	l̪ a n̪ s̪ j a ʊ̯
laog	l̪ a ʔ ɔ ɡ
laom	l̪ a ʔ ɔ m
lapad	l̪ ʌ p a d̪
lapas	l̪ ʌ p a s̪
lapida	l̪ a p ɪ d̪ ʌ
lapis	l̪ a p ɪ s̪
lapok	l̪ ʌ p o k
largabista	l̪ ʌ ɾ̪ ɡ ʌ b i s̪ t̪ ʌ
lasang	l̪ a s̪ ʌ ŋ
lasaw	l̪ a s̪ a ʊ̯
laslas	l̪ ʌ s̪ l̪ a s̪
lastiko	l̪ a s̪ t̪ ɪ k ɔ
laurel	l̪ a ʊ̯ ɾ̪ i l̪
lauron	l̪ a ʊ̯ ɾ̪ o n̪
lawas	l̪ a w ʌ s̪
laway	l̪ a w a ɪ̯
lawayan	l̪ ʌ w ʌ j a n̪
lawgaw	l̪ a ʊ̯ ɡ a ʊ̯
lawig	l̪ ʌ w i ɡ
lawin	l̪ a w ɪ n̪
lawis	l̪ a w ɪ s̪
lawod	l̪ ʌ w o d̪
laya	l̪ a j ʌ ʔ
layag	l̪ a j ʌ ɡ
layas	l̪ a j ʌ s̪
layas	l̪ ʌ j a s̪
layo	j ʌ j o ʔ
layo	l̪ ʌ d͡ʒ o ʔ
layo	l̪ ʌ j o ʔ
ledesma	l̪ ɪ d̪ i s̪ m ʌ
legalisasyon	l̪ ɪ ɡ ʌ l̪ ɪ s̪ ʌ s̪ j o n̪
lehislasyon	l̪ ɪ h ɪ s̪ l̪ ʌ s̪ j o n̪
lehislatura	l̪ ɪ h ɪ s̪ l̪ ʌ t̪ u ɾ̪ ʌ
letse	l̪ i t͡s ɪ
leytehanon	l̪ i t̪ ɪ h a n̪ ɔ n̪
libak	l̪ ɪ b a k
libjo	l̪ ɪ b h o ʔ
libod	l̪ i b ɔ d̪
libog	l̪ i b ɔ ɡ
libot	l̪ i b ɔ t̪
libradilla	l̪ ɪ b ɾ̪ ʌ d̪ i l̪ j ʌ
libre	l̪ i b ɾ̪ ɪ
libro	l̪ ɪ b ɾ̪ o
lider	l̪ i d̪ ɪ ɾ̪
ligid	l̪ i ɡ ɪ d̪
lihay	l̪ ɪ h a ɪ̯
likay	l̪ i k a ɪ̯
liko	l̪ ɪ k o ʔ
likod	l̪ ɪ k o d̪
lima	l̪ ɪ m a
limbaga	l̪ ɪ m b a ɡ ʌ
limbong	l̪ ɪ m b o ŋ
limonsito	l̪ ɪ m ɔ n̪ s̪ i t̪ ɔ
limpiyado	l̪ ɪ m p j a d̪ ɔ
limpyado	l̪ ɪ m p j a d̪ ɔ
limpyo	l̪ i m p j ɔ
limugmog	l̪ ɪ m u ɡ m ɔ ɡ
linaw	l̪ i n̪ a ʊ̯
lingaw	l̪ ɪ ŋ a ʊ̯
lingkod	l̪ i ŋ k ɔ d̪
linog	l̪ i n̪ ɔ ɡ
linti	l̪ i n̪ t̪ ɪ ʔ
linuto	l̪ ɪ n̪ u t̪ ɔ ʔ
lipay	l̪ i p a ɪ̯
lisensiya	l̪ ɪ s̪ i n̪ s̪ j ʌ
lisensiyado	l̪ ɪ s̪ ɪ n̪ s̪ j a d̪ ɔ
lisensya	l̪ ɪ s̪ i n̪ s̪ j ʌ
lisensyado	l̪ ɪ s̪ ɪ n̪ s̪ j a d̪ ɔ
lisod	l̪ i s̪ ɔ d̪
lisod	l̪ ɪ s̪ o d̪
lisondra	l̪ ɪ s̪ o n̪ d̪ ɾ̪ ʌ
lista	l̪ i s̪ t̪ ʌ
listahan	l̪ ɪ s̪ t̪ a h ʌ n̪
litaniya	l̪ ɪ t̪ ʌ n̪ i ʌ
litrato	l̪ ɪ t̪ ɾ̪ a t̪ ɔ
liwat	l̪ ɪ w a t̪
llanera	l̪ j ʌ n̪ i ɾ̪ ʌ
lomo	l̪ o m ɔ
longganisa	l̪ ɔ ŋ ɡ ʌ n̪ i s̪ ʌ
lopez	l̪ o p ɪ s̪
loreto	l̪ ɔ ɾ̪ i t̪ ɔ
luag	l̪ ʊ ʔ a ɡ
lubnganan	l̪ ʊ b ŋ a n̪ ʌ n̪
lubong	l̪ ʊ b o ŋ
lubot	l̪ ʊ b o t̪
luchavez	l̪ ʊ t͡s a b ɪ s̪
lugaw	l̪ u ɡ a ʊ̯
lugaynan	l̪ ʊ ɡ a ɪ̯ n̪ a n̪
lugi	l̪ u ɡ ɪ ʔ
lugos	l̪ u ɡ ɔ s̪
luha	l̪ u h ʌ ʔ
luhod	l̪ ʊ h o d̪
lukdo	l̪ ʊ k d̪ o
lukso	l̪ ʊ k s̪ o
lukton	l̪ ʊ k t̪ o n̪
lumos	l̪ ʊ m o s̪
lumponid	l̪ ʊ m p o n̪ ɪ d̪
lundag	l̪ ʊ n̪ d̪ a ɡ
lunes	l̪ u n̪ ɪ s̪
lungay	l̪ ʊ ŋ a ɪ̯
lungayngay	l̪ ʊ ŋ a ɪ̯ ŋ a ɪ̯
lungib	l̪ ʊ ŋ i b
lungon	l̪ ʊ ŋ o n̪
lungsod	l̪ ʊ ŋ s̪ o d̪
lunhaw	l̪ ʊ ŋ h a ʊ̯
lunod	l̪ u n̪ ɔ d̪
lunsod	l̪ ʊ n̪ s̪ o d̪
luom	l̪ u ʔ ɔ m
lupad	l̪ ʊ p a d̪
lupog	l̪ u p ɔ ɡ
lusay	l u s ɐ j
lusay	l ɔ s ɐ j
lusot	l̪ ʊ s̪ o t̪
luta	l̪ u t̪ ʌ
luta	l̪ ʊ t̪ a ʔ
lutahan	l̪ ʊ t̪ a h ʌ n̪
luto	l̪ u t̪ ɔ ʔ
luto	l̪ ʊ t̪ o
luwa	l̪ w a ʔ
luwaan	l̪ w ʌ ʔ a n̪
luwag	l̪ w a ɡ
luwas	l̪ w a s̪
maayo	m ʌ ʔ a j ɔ
mabalod	m ʌ b ʌ l̪ o d̪
mabangis	m ʌ b ʌ ŋ i s̪
mabdos	m ʌ b d̪ o s̪
mabolo	m ʌ b o l̪ ɔ
mactan	m ʌ k t̪ a n̪
madangit	m ʌ d̪ a ŋ ɪ t̪
madanguit	m ʌ d̪ ʌ ŋ ɡ i t̪
madre	m a d̪ ɾ̪ ɪ
madyong	m ʌ d̪ j o ŋ
maestra	m ʌ i s̪ t̪ ɾ̪ ʌ
maestro	m ʌ i s̪ t̪ ɾ̪ ɔ
mafalda	m ʌ p a l̪ d̪ ʌ
magdudula	m ʌ ɡ d̪ ʊ d̪ u l̪ ʌ ʔ
magduduwa	m ʌ ɡ d̪ ʊ d̪ u ʌ ʔ
magkabayo	m ʌ ɡ k ʌ b a j ɔ
maglala	m ʌ ɡ l̪ a l̪ ʌ
magpailad	m ʌ ɡ p ʌ ʔ i l̪ ʌ d̪
magulang	m ʌ ɡ u l̪ ʌ ŋ
mahal	m ʌ h a l̪
mahatagon	m ʌ h ʌ t̪ a ɡ ɔ n̪
mahuyang	m ʌ h u j ʌ ŋ
mainom	m ʌ ʔ ɪ n̪ o m
makahilo	m ʌ k ʌ h ɪ l̪ o
makaon	m ʌ k a ʔ ɔ n̪
makatubol	m ʌ k ʌ t̪ ʊ b o l̪
makatunok	m ʌ k a t̪ ʊ n̪ o k
makina	m a k ɪ n̪ ʌ
makopa	m ʌ k o p ʌ
mal	m a l̪
maldito	m ʌ l̪ d̪ i t̪ ɔ
malinaw	m ʌ l̪ i n̪ a ʊ̯
malinawon	m ʌ l̪ ɪ n̪ a w n̪
malipayon	m ʌ l̪ ɪ p a j ɔ n̪
malisyoso	m ʌ l̪ ɪ s̪ j o s̪ ɔ
mall	m o l̪
maluya	m ʌ l̪ u j ʌ
mamaligyaay	m ʌ m ʌ l̪ ɪ ɡ j ʌ ʔ a ɪ̯
mamatayan	m ʌ m ʌ t̪ a j ʌ n̪
mamati	m ʌ m a t̪ ɪ ʔ
mamumuno	m ʌ m ʊ m u n̪ ɔ ʔ
man	m a n̪
manambalay	m ʌ n̪ ʌ m b ʌ l̪ a ɪ̯
manananggot	m ʌ n̪ ʌ n̪ ʌ ŋ ɡ o t̪
mananap	m ʌ n̪ ʌ n̪ a p
mananquil	m ʌ n̪ ʌ ŋ k i l̪
mandauehanon	m ʌ n̪ d̪ ʌ w ɪ h a n̪ ɔ n̪
mando	m a n̪ d̪ ɔ
maneho	m ʌ n̪ i h ɔ
mangahoy	m ʌ ŋ a h o ɪ̯
mangayam	m ʌ ŋ a j ʌ m
mangga	m a ŋ ɡ ʌ
manghod	m ʌ ŋ h o d̪
mangtas	m ʌ ŋ t̪ a s̪
mangubat	m ʌ ŋ u b ʌ t̪
mani	m ʌ n̪ i
manigarilyo	m ʌ n̪ ɪ ɡ ʌ ɾ̪ i l̪ j ɔ
manila	m ʌ n̪ i l̪ ʌ
manila	m ʌ n̪ i l̪ ʌ ʔ
maniobra	m ʌ n̪ j o b ɾ̪ ʌ
manok	m ʌ n̪ o k
manokmanok	m ʌ n̪ ɔ k m a n̪ ɔ k
mansa	m ʌ n̪ s̪ a
mansanas	m ʌ n̪ s̪ a n̪ ʌ s̪
mansanitas	m ʌ n̪ s̪ ʌ n̪ i t̪ ʌ s̪
mantala	m ʌ n̪ t̪ a l̪ ʌ
manunubos	m ʌ n̪ ʊ n̪ u b ɔ s̪
manzano	m ʌ n̪ s̪ a n̪ ɔ
maong	m ʌ ʔ o ŋ
mapa	m a p ʌ
mapahiyomon	m ʌ p ʌ h ɪ j o m ɔ n̪
mapintas	m ʌ p i n̪ t̪ ʌ s̪
maribel	m ʌ ɾ̪ i b ɪ l̪
marigondon	m ʌ ɾ̪ ɪ ɡ ɔ n̪ d̪ o n̪
marinero	m ʌ ɾ̪ ɪ n̪ i ɾ̪ ɔ
marpil	m ʌ ɾ̪ p i l̪
marso	m a ɾ̪ s̪ ɔ
martes	m a ɾ̪ t̪ ɪ s̪
martinez	m ʌ ɾ̪ t̪ i n̪ ɪ s̪
martsa	m a ɾ̪ t̪ s̪ ʌ
masahe	m ʌ s̪ a h ɪ
masahista	m ʌ s̪ ʌ h i s̪ t̪ ʌ
masanagon	m ʌ s̪ ʌ n̪ a ɡ ɔ n̪
masbate	m ʌ s̪ b a t̪ ɪ
maskara	m a s̪ k ʌ ɾ̪ ʌ
masol	m a s̪ ɔ l̪
masuso	m ʌ s̪ u s̪ ɔ
masyador	m ʌ s̪ j a d̪ ɔ ɾ̪
mata	m ʌ t̪ a
matahapon	m ʌ t̪ ʌ h a p ɔ n̪
matapobre	m ʌ t̪ ʌ p o b ɾ̪ ɪ
matay	m ʌ t̪ a ɪ̯
mate	m a t̪ ɪ
matinumanon	m ʌ t̪ ɪ n̪ ʊ m a n̪ ɔ n̪
matso	m a t͡s ɔ
matugas	m ʌ t̪ u ɡ ʌ s̪
matulogtulog	m ʌ t̪ ʊ l̪ ɔ ɡ t̪ u l̪ ɔ ɡ
matunok	m ʌ t̪ ʊ n̪ o k
mauswagon	m ʌ ʔ ʊ s̪ w a ɡ ɔ n̪
mayo	m a j ɔ
mayor	m i ɪ j ɔ ɾ̪
medina	m ɪ d̪ i n̪ ʌ
melgar	m ɪ l̪ ɡ a ɾ̪
mendoza	m ɪ n̪ d̪ o s̪ ʌ
mensahe	m ɪ n̪ s̪ a h ɪ
mercader	m ɪ ɾ̪ k ʌ d̪ i ɾ̪
merida	m i ɾ̪ ɪ d̪ ʌ
merkado	m ɪ ɾ̪ k a d̪ ɔ
mika	m ɪ k a ʔ
mikropono	m ɪ k ɾ̪ o p ɔ n̪ ɔ
militarista	m ɪ l̪ ɪ t̪ ʌ ɾ̪ i s̪ t̪ ʌ
minaisan	m ɪ n̪ ʌ ʔ ɪ s̪ a n̪
minero	m ɪ n̪ i ɾ̪ ɔ
mingming	m ɪ ŋ m i ŋ
mintinar	m ɪ n̪ t̪ ɪ n̪ a ɾ̪
misis	m i s̪ ɪ s̪
miyembro	m j i m b ɾ̪ ɔ
miyentras	m j i n̪ t̪ ɾ̪ ʌ s̪
miyerkoles	m j i ɾ̪ k ɔ l̪ i s̪
mongha	m o ŋ h ʌ
montebon	m ɔ n̪ t̪ ɪ b o n̪
montellano	m ɔ n̪ t̪ ɪ l̪ j a n̪ ɔ
montesino	m ɔ n̪ t̪ ɪ s̪ i n̪ ɔ
montillano	m ɔ n̪ t̪ ɪ l̪ j a n̪ ɔ
monyeka	m ɔ n̪ j i k ʌ
moreno	m ɔ ɾ̪ i n̪ ɔ
morpema	m ɔ ɾ̪ p i m ʌ
moskitero	m ɔ s̪ k ɪ t̪ i ɾ̪ ɔ
motor	m ɔ t̪ o ɾ̪
mulmol	m u l̪ m ɔ l̪
mulong	m ʊ l̪ o ŋ
multa	m ʊ l̪ t̪ a
mumho	m u m h ɔ
munisipyo	m ʊ n̪ ɪ s̪ i p j ɔ
muro	m ʊ ɾ̪ o
mutya	m u t̪ j ʌ ʔ
naga	n̪ a ɡ ʌ
namok	n̪ ʌ m o k
nana	n̪ a n̪ ʌ ʔ
nancy	n̪ a n̪ s̪ ɪ
nangka	n̪ a ŋ k ʌ ʔ
naog	n̪ a ʔ ɔ ɡ
napo	n̪ a p ɔ ʔ
napulo	n̪ ʌ p o ʔ
napulo	n̪ ʌ p u l̪ ɔ ʔ
napulo	n̪ ʌ p u w ʔ
nara	n̪ a ɾ̪ ʌ
nasod	n̪ a s̪ ɔ d̪
nasyon	n̪ ʌ s̪ j o n̪
nawong	n̪ a w o ŋ
negra	n̪ i ɡ ɾ̪ ʌ
negro	n̪ i ɡ ɾ̪ ɔ
negros	n̪ i ɡ ɾ̪ ɔ s̪
nepotismo	n̪ ɪ p ɔ t̪ i s̪ m ɔ
ngabil	ŋ a b ɪ l̪
ngalan	ŋ a l̪ ʌ n̪
ngano	ŋ a n̪ ɔ
ngipon	ŋ i p ɔ n̪
ngisi	ŋ i s̪ ɪ
ngislit	ŋ i s̪ l̪ ɪ t̪
ngislo	ŋ ɪ s̪ l̪ o ʔ
nguho	ŋ u h ɔ ʔ
ngulngol	ŋ u l̪ ŋ ɔ l̪
ngutngot	ŋ u t̪ ŋ ɔ t̪
nigo	n̪ i ɡ ɔ
nila	n̪ ɪ l̪ a
ningtiil	n̪ ɪ ŋ t̪ i ʔ ɪ l̪
ninjo	n̪ ɪ n̪ d͡ʒ o
ninyo	n̪ ɪ n̪ d͡ʒ o
ninyo	n̪ ɪ n̪ j o
nipis	n̪ ɪ p i s̪
niya	n̪ j a
niya	n̪ ɪ d͡ʒ a
nobenta	n̪ ɔ b i n̪ t̪ ʌ
nobiyembre	n̪ ɔ b j i m b ɾ̪ ɪ
nobyembre	n̪ ɔ b j i m b ɾ̪ ɪ
nuñez	n̪ u ɲ ɪ s̪
obserbasyon	ʔ ɔ b s̪ ɪ ɾ̪ b ʌ s̪ j o n̪
ocampo	ʔ ɔ k a m p ɔ
ocaña	ʔ ɔ k a ɲ ʌ
oktubre	ʔ ɔ k t̪ u b ɾ̪ ɪ
okupado	ʔ ɔ k ʊ p a d̪ ɔ
okupar	ʔ ɔ k u p ʌ ɾ̪
olaivar	ʔ ɔ l̪ a ɪ̯ b ʌ ɾ̪
olayvar	ʔ ɔ l̪ a ɪ̯ b ʌ ɾ̪
oliveros	ʔ ɔ l̪ ɪ b i ɾ̪ ɔ s̪
ompad	ʔ o m p ʌ d̪
ordinaryo	ʔ ɔ ɾ̪ d̪ ɪ n̪ a ɾ̪ j ɔ
ormocanon	ʔ ɔ ɾ̪ m ɔ k a n̪ ɔ n̪
ortega	ʔ ɔ ɾ̪ t̪ i ɡ ʌ
osmeña	ʔ ɔ s̪ m i ɲ ʌ
ospital	ʔ ɔ s̪ p ɪ t̪ a l̪
otap	ʔ o t̪ ʌ p
otsenta	ʔ ɔ t͡s i n̪ t̪ ʌ
paa	p a ʔ ʌ
paagi	p ʌ ʔ a ɡ ɪ
pabor	p ʌ b o ɾ̪
padayhag	p ʌ d̪ ʌ j a ɡ
pagadian	p ʌ ɡ ʌ d̪ i ʔ ʌ n̪
pagbisita	p ʌ ɡ b ɪ s̪ i t̪ ʌ
pagburos	p ʌ ɡ b ʊ ɾ̪ o s̪
pagdugang	p ʌ ɡ d̪ u ɡ ʌ ŋ
pagi	p a ɡ ɪ
pagkalalaki	p ʌ ɡ k a l̪ ʌ l̪ a k ɪ
pagkaon	p ʌ ɡ k a ʔ ɔ n̪
paglaom	p ʌ ɡ l̪ a ʔ ɔ m
pagmabdos	p ʌ ɡ m ʌ b d̪ o s̪
pagpamolitika	p ʌ ɡ p ʌ m ɔ l̪ i t̪ ɪ k ʌ
pagpanagop	p a ɡ p ʌ n̪ ʌ ɡ o p
pagpanigarilyo	p ʌ ɡ p ʌ n̪ ɪ ɡ ʌ ɾ̪ i l̪ j ɔ
pagtuo	p ʌ ɡ t̪ u ʔ ɔ
pagtupad	p ʌ ɡ t̪ ʊ p a d̪
pahayahay	p ʌ h ʌ j a h a ɪ̯
pahiyom	p ʌ h i j ɔ m
pahiyom	p ʌ h ɪ j o m
pahulay	p ʌ h u l̪ a ɪ̯
pahumot	p ʌ h ʊ m o t̪
pahutan	p ʌ h u t̪ ʌ n̪
painit	p ʌ ʔ i n̪ ɪ t̪
paisano	p a ɪ̯ s̪ a n̪ ɔ
pait	p ʌ ʔ i t̪
pakal	p ʌ k a l̪
pakol	p a k ɔ l̪
pakpak	p a k p ʌ k
pakwan	p ʌ k w a n̪
palad	p a l̪ ʌ d̪
palad	p ʌ l̪ a d̪
palahubog	p ʌ l̪ ʌ h u b ɔ ɡ
palainom	p ʌ l̪ ʌ ʔ i n̪ ɔ m
palaman	p ʌ l̪ ʌ m a n̪
palangga	p ʌ l̪ ʌ ŋ ɡ a ʔ
palanggana	p ʌ l̪ ʌ ŋ ɡ a n̪ ʌ
palaran	p ʌ l̪ a ɾ̪ ʌ n̪
palibot	p ʌ l̪ i b ɔ t̪
palihog	p ʌ l̪ i h ɔ ɡ
palihug	p ʌ l̪ i h ʊ ɡ
palit	p ʌ l̪ i t̪
pamahaw	p ʌ m a h a ʊ̯
pamati	p ʌ m a t̪ ɪ
pambata	p ʌ m b a t̪ ʌ
pamilyado	p ʌ m ɪ l̪ j a d̪ ɔ
pamilyar	p ʌ m ɪ l̪ j a ɾ̪
pampam	p a m p ʌ m
pampanga	p ʌ m p a ŋ ɡ ʌ
pamuhi	p ʌ m u h ɪ ʔ
pan	p a n̪
panagang	p ʌ n̪ ʌ ɡ a ŋ
panahon	p ʌ n̪ ʌ h o n̪
panaw	p a n̪ a ʊ̯
pandak	p ʌ n̪ d̪ a k
panday	p ʌ n̪ d̪ a ɪ̯
pandesal	p ʌ n̪ d̪ ɪ s̪ a l̪
pandong	p ʌ n̪ d̪ o ŋ
pangadye	p ʌ ŋ ʌ d̪ j i ʔ
pangadyi	p ʌ ŋ ʌ d̪ j i ʔ
pangalan	p ʌ ŋ a l̪ ʌ n̪
panganod	p ʌ ŋ ʌ n̪ o d̪
panganoron	p ʌ ŋ ʌ n̪ o ɾ̪ ɔ n̪
pangguon	p ʌ ŋ ɡ u ʔ ɔ n̪
panglawas	p ʌ ŋ l̪ a w ʌ s̪
panigarilyo	p ʌ n̪ ɪ ɡ ʌ ɾ̪ i l̪ j ɔ
paniudto	p ʌ n̪ ɪ ʔ ʊ d̪ t̪ o
pansat	p ʌ n̪ s̪ a t̪
pantalan	p ʌ n̪ t̪ ʌ l̪ a n̪
pantalon	p a n̪ t̪ ʌ l̪ o n̪
pantasma	p ʌ n̪ t̪ a s̪ m ʌ
pantat	p ʌ n̪ t̪ a t̪
pantihan	p ʌ n̪ t̪ i h ʌ n̪
pantog	p ʌ n̪ t̪ o ɡ
panultihon	p ʌ n̪ ʊ l̪ t̪ i h ɔ n̪
panyaspanyas	p a n̪ j ʌ s̪ p a n̪ j ʌ s̪
panyawan	p ʌ n̪ j a w ʌ n̪
papel	p ʌ p i l̪
paragrap	p a ɾ̪ ʌ ɡ ɾ̪ ʌ p
paraiso	p ʌ ɾ̪ a ɪ̯ s̪ ɔ
parapente	p ʌ ɾ̪ ʌ p i n̪ t̪ ɪ
parapo	p a ɾ̪ ʌ p ɔ
paras	p ʌ ɾ̪ a s̪
parat	p ʌ ɾ̪ a t̪
pareho	p ʌ ɾ̪ i h ɔ
pareja	p ʌ ɾ̪ i h ʌ
pari	p a ɾ̪ ɪ ʔ
paril	p ʌ ɾ̪ i l̪
partisipasyon	p ʌ ɾ̪ t̪ ɪ s̪ ɪ p ʌ s̪ j o n̪
paryente	p ʌ ɾ̪ j i n̪ t̪ ɪ
pasaw	p a s̪ a ʊ̯
pasayan	p ʌ s̪ a j ʌ n̪
pasaylo	p ʌ s̪ a ɪ̯ l̪ ɔ
pasi	p a s̪ ɪ ʔ
pasikat	p ʌ s̪ i k ʌ t̪
pasilidad	p ʌ s̪ ɪ l̪ ɪ d̪ a d̪
pasipiko	p ʌ s̪ i p ɪ k o
pasipismo	p ʌ s̪ ɪ p i s̪ m ɔ
pasipista	p ʌ s̪ ɪ p i s̪ t̪ ʌ
paso	p a s̪ ɔ
paso	p a s̪ ɔ ʔ
paspas	p a s̪ p ʌ s̪
pastor	p ʌ s̪ t̪ o ɾ̪
pasyente	p ʌ s̪ j i n̪ t̪ ɪ
patalinghug	p ʌ t̪ ʌ l̪ ɪ ŋ h u ɡ
patay	p ʌ t̪ a ɪ̯
patilya	p ʌ t̪ i l̪ j ʌ
pating	p a t̪ ɪ ŋ
pato	p a t̪ ɔ
patong	p a t̪ ɔ ŋ
pautang	p ʌ ʔ u t̪ ʌ ŋ
pawikan	p ʌ w i k ʌ n̪
payod	p a j ɔ d̪
payong	p a j ɔ ŋ
paypay	p a ɪ̯ p a ɪ̯
pebrero	p ɪ b ɾ̪ i ɾ̪ ɔ
pederasyon	p ɪ d̪ ɪ ɾ̪ ʌ s̪ j o n̪
pedro	p i d̪ ɾ̪ ɔ
pelikula	p ɪ l̪ i k ʊ l̪ ʌ
pepino	p ɪ p i n̪ ɔ
peralta	p ɪ ɾ̪ a l̪ t̪ ʌ
perez	p i ɾ̪ ɪ s̪
perhuwisyo	p ɪ ɾ̪ h ʊ i s̪ j ɔ
periko	p ɪ ɾ̪ i k ɔ
perla	p i ɾ̪ l̪ ʌ
personal	p ɪ ɾ̪ s̪ o n̪ ʌ l̪
perya	p i ɾ̪ j ʌ
petrolyo	p ɪ t̪ ɾ̪ o l̪ j ɔ
petsa	p i t͡s ʌ
piguratibo	p ɪ ɡ ʊ ɾ̪ ʌ t̪ i b ɔ
pigurin	p ɪ ɡ ʊ ɾ̪ i n̪
pikit	p ɪ k i t̪
pikoy	p ɪ k o j
pila	p i l̪ ʌ
