abaga	ʔ ʌ b a ɡ ʌ
abaka	ʔ a b ʌ k ʌ
abakadhan	ʔ ʌ b ʌ k ʌ d̪ h a n̪
abaniko	ʔ ʌ b ʌ n̪ i k ɔ
abapo	ʔ ʌ b a p ɔ
abayon	ʔ ʌ b a j ɔ n̪
abello	ʔ ʌ b i l̪ j ɔ
aber	ʔ ʌ b i ɾ̪
aberiya	ʔ ʌ b ɪ ɾ̪ j a
abesamis	ʔ ʌ b ɪ s̪ a m ɪ s̪
abilidad	ʔ ʌ b ɪ l̪ ɪ d̪ a d̪
abiso	ʔ ʌ b i s̪ ɔ
abito	ʔ a b ɪ t̪ o
abli	ʔ ʌ b l̪ i
abo	ʔ ʌ b o
abogado	ʔ ʌ b ɔ ɡ a d̪ ɔ
abogasiya	ʔ ʌ b ɔ ɡ ʌ s̪ i ʌ
abohon	ʔ ʌ b o h ɔ n̪
abokado	ʔ ʌ b ɔ k a d̪ ɔ
abono	ʔ ʌ b o n̪ ɔ
abrebisyon	ʔ ʌ b ɾ̪ ɪ b i s̪ j ɔ n̪
abri	ʔ ʌ b ɾ̪ i
abrigo	ʔ ʌ b ɾ̪ i ɡ ɔ
abril	ʔ ʌ b ɾ̪ i l̪
absolusyon	ʔ ʌ b s̪ ɔ l̪ ʊ s̪ j o n̪
absuwelto	ʔ ʌ b s̪ w i l̪ t̪ ɔ
aburido	ʔ ʌ b ʊ ɾ̪ i d̪ ɔ
abutra	ʔ ʌ b u t̪ ɾ̪ ʌ
abyan	ʔ a b j ʌ n̪
abyerto	ʔ ʌ b j i ɾ̪ t̪ ɔ
abyogan	ʔ ʌ b j o ɡ ʌ n̪
abyon	ʔ ʌ b j o n̪
acebedo	ʔ ʌ s̪ ɪ b i d̪ ɔ
adbentista	ʔ ʌ d̪ b ɪ n̪ t̪ i s̪ t̪ ʌ
adbiyento	ʔ ʌ d̪ b j i n̪ t̪ ɔ
adelantado	ʔ ʌ d̪ ɪ l̪ ʌ n̪ t̪ a d̪ ɔ
adelpa	ʔ ʌ d̪ i l̪ p ʌ
adlaw	ʔ a d̪ l̪ a ʊ̯
administrador	ʔ ʌ d̪ m ɪ n̪ ɪ s̪ t̪ ɾ̪ ʌ d̪ o ɾ̪
administrasiyon	ʔ ʌ d̪ m ɪ n̪ ɪ s̪ t̪ ɾ̪ ʌ s̪ j o n̪
administratibo	ʔ ʌ d̪ m ɪ n̪ ɪ s̪ t̪ ɾ̪ ʌ t̪ i b ɔ
adres	ʔ a d̪ ɾ̪ ɪ s̪
adto	ʔ ʌ d̪ t̪ o
aduna	ʔ ʌ d̪ u n̪ ʌ
adunahan	ʔ ʌ d̪ ʊ n̪ a h ʌ n̪
adunay	ʔ ʌ d̪ u n̪ a ɪ̯
aghop	ʔ ʌ ɡ h o p
agigising	ʔ ʌ ɡ ɪ ɡ i s̪ ɪ ŋ
agila	ʔ a ɡ ɪ l̪ ʌ
agosto	ʔ ʌ ɡ o s̪ t̪ ɔ
agridulse	ʔ ʌ ɡ ɾ̪ ɪ d̪ u l̪ s̪ ɪ
aguho	ʔ ʌ ɡ u h ɔ ʔ
aguilar	ʔ ʌ ɡ ɪ l̪ a ɾ̪
ahedres	ʔ ʌ h ɪ d̪ ɾ̪ i s̪
ahensiya	ʔ ʌ h i n̪ s̪ j a
ahente	ʔ ʌ h i n̪ t̪ ɪ
aho	ʔ ʌ h o
ahos	ʔ a h ɔ s̪
ajaw	ʔ a d͡ʒ a ʊ̯
akademiya	ʔ ʌ k ʌ d̪ i m j ʌ
aklas	ʔ ʌ k l̪ a s̪
ako	ʔ ʌ h o
ako	ʔ ʌ k o
aksidente	ʔ ʌ k s̪ ɪ d̪ i n̪ t̪ ɪ
aksiyon	ʔ ʌ k s̪ j o n̪
aksyon	ʔ ʌ k s̪ j o n̪
aktibidades	ʔ ʌ k t̪ ɪ b ɪ d̪ a d̪ ɪ s̪
akurdiyon	ʔ ʌ k ʊ ɾ̪ d̪ j o n̪
akusar	ʔ ʌ k ʊ s̪ a ɾ̪
akusasyon	ʔ ʌ k ʊ s̪ ʌ s̪ j o n̪
alagad	ʔ ʌ l̪ a ɡ ʌ d̪
alagad	ʔ ʌ l̪ ʌ ɡ a d̪
alahas	ʔ ʌ l̪ a h ʌ s̪
alahero	ʔ ʌ l̪ ʌ h i ɾ̪ ɔ
alak	ʔ a l̪ ʌ k
alakaak	ʔ ʌ l̪ ʌ k a ʔ ʌ k
alamag	ʔ ʌ l̪ a m ʌ ɡ
alambre	ʔ ʌ l̪ a m b ɾ̪ ɪ
alang	ʔ a l̪ ʌ ŋ
alangilan	ʔ ʌ l̪ ʌ ŋ i l̪ ʌ n̪
alarma	ʔ ʌ l̪ a ɾ̪ m ʌ
alat	ʔ a l̪ ʌ t̪
alat	ʔ ʌ l̪ a t̪
albay	ʔ ʌ l̪ b a ɪ̯
alcoy	ʔ ʌ l̪ k o j
alegasyon	ʔ ʌ l̪ ɪ ɡ ʌ s̪ j o n̪
alegoriya	ʔ ʌ l̪ ɪ ɡ ɔ ɾ̪ i ʌ
alegre	ʔ ʌ l̪ i ɡ ɾ̪ ɪ
aleluya	ʔ ʌ l̪ ɪ l̪ u j ʌ
alfonso	ʔ ʌ l̪ p o n̪ s̪ ɔ
alibangbang	ʔ ʌ l̪ ɪ b ʌ ŋ b a ŋ
alibyo	ʔ ʌ l̪ i b j ɔ
aligi	ʔ ʌ l̪ i ɡ ɪ
alikate	ʔ ʌ l̪ ɪ k a t̪ ɪ
alimango	ʔ ʌ l̪ ɪ m a ŋ ɔ
alimasag	ʔ ʌ l̪ ɪ m a s̪ ʌ ɡ
alimpatakan	ʔ ʌ l̪ ɪ m p ʌ t̪ a k ʌ n̪
alimpulos	ʔ ʌ j ɪ m p u j ɔ s̪
alimpulos	ʔ ʌ l̪ ɪ m p o s̪
alimpulos	ʔ ʌ l̪ ɪ m p u d͡ʒ ɔ s̪
alimpulos	ʔ ʌ l̪ ɪ m p u l̪ ɔ s̪
alindahaw	ʔ ʌ l̪ ɪ n̪ d̪ a h a ʊ̯
alindanaw	ʔ ʌ l̪ ɪ n̪ d̪ a n̪ a ʊ̯
alingagngag	ɐ l ɪ ŋ ʌ ɡ ŋ ʌ ɡ
alkalde	ʔ ʌ l̪ k a l̪ d̪ ɪ
almirol	ʔ ʌ l̪ m ɪ ɾ̪ o l̪
almoranas	ʔ ʌ l̪ m ɔ ɾ̪ a n̪ ʌ s̪
alpa	ʔ a l̪ p ʌ
alpabeto	ʔ ʌ l̪ p ʌ b i t̪ ɔ
alpombra	ʔ ʌ l̪ p o m b ɾ̪ ʌ
alsa	ʔ ʌ l̪ s̪ a
alvarado	ʔ ʌ l̪ b ʌ ɾ̪ a d̪ ɔ
amag	ʔ a m ʌ ɡ
amahan	ʔ ʌ m ʌ h a n̪
amaon	ʔ ʌ m ʌ ʔ o n̪
amarilyo	ʔ ʌ m ʌ ɾ̪ i l̪ j ɔ
ambulansiya	ʔ ʌ m b ʊ l̪ a n̪ s̪ j ʌ
amendar	ʔ ʌ m ɪ n̪ d̪ a ɾ̪
amerikano	ʔ ʌ m ɪ ɾ̪ ɪ k a n̪ ɔ
amigo	ʔ ʌ m i ɡ ɔ
amihan	ʔ ʌ m i h ʌ n̪
amihanan	ʔ ʌ m ɪ h a n̪ ʌ n̪
amnestiya	ʔ ʌ m n̪ ɪ s̪ t̪ i ʌ
amplipikasyon	ʔ ʌ m p l̪ ɪ p ɪ k ʌ s̪ j o n̪
anahaw	ʔ ʌ n̪ a h a ʊ̯
anak	ʔ ʌ n̪ a k
anas	ʔ a n̪ ʌ s̪
anay	ʔ a n̪ a ɪ̯
anay	ʔ ʌ n̪ a ɪ̯
andam	ʔ ʌ n̪ d̪ a m
anemya	ʔ ʌ n̪ i m j ʌ
anga	ʔ a ŋ ʌ
angga	ʔ a ŋ ɡ ʌ ʔ
anghel	ʔ ʌ ŋ h i l̪
anghit	ʔ ʌ ŋ h i t̪
angkla	ʔ a ŋ k l̪ ʌ
angso	ʔ ʌ ŋ s̪ o
angtod	ʔ ʌ ŋ t̪ o d̪
anhing	ʔ a ŋ h ɪ ŋ
anilaw	ʔ ʌ n̪ ɪ l̪ a ʊ̯
animal	ʔ ʌ n̪ ɪ m a l̪
aninipot	ʔ ʌ n̪ ɪ n̪ i p ɔ t̪
anino	ʔ ʌ n̪ i n̪ ɔ
anod	ʔ a n̪ ɔ d̪
anso	ʔ ʌ n̪ s̪ o
antepara	ʔ ʌ n̪ t̪ ɪ p a ɾ̪ ʌ
antigo	ʔ a n̪ t̪ ɪ ɡ ɔ
antisipasyon	ʔ ʌ n̪ t̪ ɪ s̪ ɪ p ʌ s̪ j o n̪
antod	ʔ ʌ n̪ t̪ o d̪
anyag	ʔ ʌ n̪ j a ɡ
apatot	ʔ ʌ p a t̪ ɔ t̪
apdo	ʔ ʌ p d̪ o
apektado	ʔ ʌ p ɪ k t̪ a d̪ ɔ
apelyido	ʔ ʌ p ɪ l̪ j i d̪ ɔ
aping	ʔ a p ɪ ŋ
apo	ʔ ʌ p o
aprobado	ʔ ʌ p ɾ̪ ɔ b a d̪ ɔ
apura	ʔ ʌ p ʊ ɾ̪ a
apurado	ʔ ʌ p ʊ ɾ̪ a d̪ ɔ
aragon	ʔ ʌ ɾ̪ ʌ ɡ o n̪
arak	ʔ a ɾ̪ ʌ k
arcaya	ʔ ʌ ɾ̪ k a j ʌ
arcenal	ʔ ʌ ɾ̪ s̪ ɪ n̪ a l̪
arellano	ʔ ʌ ɾ̪ ɪ l̪ j a n̪ ɔ
ari	ʔ a ɾ̪ ɪ
arisgado	ʔ ʌ ɾ̪ ɪ s̪ ɡ a d̪ ɔ
arisgar	ʔ ʌ ɾ̪ i s̪ ɡ ʌ ɾ̪
ariyos	ʔ ʌ ɾ̪ i j ɔ s̪
arkipelago	ʔ ʌ ɾ̪ k ɪ p i l̪ ʌ ɡ ɔ
arkitekto	ʔ ʌ ɾ̪ k ɪ t̪ i k t̪ ɔ
arnaiz	ʔ ʌ ɾ̪ n̪ a ʔ ɪ s̪
arriesgado	ʔ ʌ ɾ̪ j ɪ s̪ ɡ a d̪ ɔ
arsobispado	ʔ ʌ ɾ̪ s̪ ɔ b ɪ s̪ p a d̪ ɔ
arsobispo	ʔ ʌ ɾ̪ s̪ ɔ b i s̪ p ɔ
asa	ʔ a s̪ ʌ
asawa	ʔ ʌ s̪ a w ʌ
aseras	ʔ ʌ s̪ i ɾ̪ ʌ s̪
asin	ʔ ʌ s̪ i n̪
aso	ʔ ʌ s̪ o
asosasyon	ʔ ʌ s̪ ɔ s̪ ʌ s̪ j o n̪
aspalto	ʔ ʌ s̪ p a l̪ t̪ ɔ
asukar	ʔ ʌ s̪ u k ʌ ɾ̪
asul	ʔ ʌ s̪ u l̪
asupre	ʔ ʌ s̪ u p ɾ̪ ɪ
aswang	ʔ ʌ s̪ w a ŋ
asya	ʔ a s̪ j ʌ
ata	ʔ a t̪ ʌ ʔ
atab	ʔ a t̪ ʌ b
atabay	ʔ ʌ t̪ a b a ɪ̯
atake	ʔ ʌ t̪ a k ɪ
atay	ʔ ʌ t̪ a ɪ̯
atis	ʔ a t̪ ɪ s̪
ato	ʔ a t̪ ɔ
atol	ʔ ʌ t̪ o l̪
aton	ʔ a t̪ ɔ n̪
atop	ʔ ʌ t̪ o p
atsay	ʔ ʌ t͡s a ɪ̯
atsoy	ʔ ʌ t͡s o j
avendaño	ʔ ʌ b ɪ n̪ d̪ a ɲ ɔ
away	ʔ a w a ɪ̯
awto	ʔ a ʊ̯ t̪ ɔ
awtorisar	ʔ a ʊ̯ t̪ ɔ ɾ̪ ɪ s̪ a ɾ̪
ayaay	ʔ ʌ j a ʔ a ɪ̯
ayam	ʔ a j ʌ m
ayaw	ʔ ʌ d͡ʒ a ʊ̯
ayaw	ʔ ʌ j a ʊ̯
ayroplano	ʔ a ɪ̯ ɾ̪ ɔ p l̪ a n̪ ɔ
aznar	ʔ ʌ s̪ n̪ a ɾ̪
baang	b a ʔ ʌ ŋ
baba	b a ʔ b ʌ ʔ
baba	b ʌ b a
babaw	b a b a ʊ̯
babay	b a b a ɪ̯
babay	b ʌ b a ɪ̯
babaye	b ʌ b a j ɪ
babaylan	b ʌ b a ɪ̯ l̪ a n̪
baboy	b a b o ɪ̯
baclayon	b ʌ k l̪ a j ɔ n̪
bacus	b a k ʊ s̪
badlis	b ʌ d̪ l̪ i s̪
badlit	b ʌ d̪ l̪ i t̪
badyet	b a d̪ j ɪ t̪
baga	b a ɡ ʌ
baga	b a ɡ ʌ ʔ
baga	b ʌ ɡ a ʔ
bagakay	b ʌ ɡ a k a ɪ̯
bagani	b ʌ ɡ a n̪ ɪ ʔ
bagaso	b ʌ ɡ a s̪ ɔ
bagat	b a ɡ ʌ t̪
bago	b a ɡ ɔ
bago	b ʌ ɡ o ʔ
bagol	b ʌ ɡ o l̪
bagon	b a ɡ ɔ n̪
bagon	b ʌ ɡ o n̪
bagongon	b ʌ ɡ o ŋ ɔ n̪
bagos	b a ɡ ɔ s̪
bagsak	b ʌ ɡ s̪ a k
bagtas	b ʌ ɡ t̪ a s̪
baguio	b a ɡ j ɔ
bagyo	b ʌ ɡ j o
bahada	b ʌ h a d̪ ʌ
bahag	b ʌ h a ɡ
bahandi	b ʌ h a n̪ d̪ ɪ
bahandianon	b ʌ h ʌ n̪ d̪ ɪ ʔ a n̪ ɔ n̪
bahaw	b a h a ʊ̯
baho	b a h ɔ
baho	b a h ɔ ʔ
baho	b ʌ h o ʔ
bahon	b ʌ h o n̪
baka	b a k ʌ
bakak	b ʌ k a k
bakal	b ʌ k a l̪
bakilid	b ʌ k ɪ l̪ i d̪
baklad	b ʌ k l̪ a d̪
baklay	b ʌ k l̪ a ɪ̯
bakos	b ʌ k o s̪
baktas	b ʌ k t̪ a s̪
bakukang	b ʌ k u k ʌ ŋ
bakuna	b ʌ k u n̪ ʌ
bakunawa	b ʌ k ʊ n̪ a w ʌ
balai	b ʌ l̪ a ʔ ɪ
balalatok	b ʌ l̪ ʌ l̪ a t̪ ɔ k
balanak	b ʌ l̪ a n̪ ʌ k
balanghoy	b ʌ l̪ ʌ ŋ h o j
balanse	b ʌ l̪ a n̪ s̪ ɪ
balaod	b ʌ l̪ a ʔ ɔ d̪
balaodnon	b ʌ l̪ ʌ ʔ ɔ d̪ n̪ o n̪
balaoron	b ʌ l̪ ʌ ʔ o ɾ̪ ɔ n̪
balaoron	b ʌ l̪ ʌ ʔ ɔ ɾ̪ o n̪
balas	b ʌ l̪ a s̪
balasahon	b ʌ l̪ ʌ s̪ ʌ h o n̪
balat	b ʌ l̪ a t̪
balatian	b ʌ l̪ ʌ t̪ i ʔ ʌ n̪
balatik	b ʌ l̪ a t̪ ɪ k
balatok	b ʌ l̪ a t̪ ɔ k
balatong	b ʌ l̪ a t̪ ɔ ŋ
balaw	b ʌ l̪ a ʊ̯
balay	b a ɪ̯
balay	b ʌ j a ɪ̯
balay	b ʌ l̪ a ɪ̯
balbal	b ʌ l̪ b a l̪
balbuena	b ʌ l̪ b w i n̪ ʌ
balda	b a l̪ d̪ ʌ
balda	b ʌ l̪ d̪ a
balde	b a l̪ d̪ ɪ
balete	b ʌ l̪ i t̪ ɪ
balhibo	b ʌ l̪ h i b ɔ
balhiboon	b ʌ l̪ h ɪ b o ʔ ɔ n̪
balibago	b ʌ l̪ ɪ b a ɡ ɔ
balik	b ʌ l̪ i k
balinsasayaw	b ʌ l̪ i n̪ s̪ ʌ s̪ ʌ j a ʊ̯
balintong	b ʌ l̪ ɪ n̪ t̪ o ŋ
balion	b ʌ l̪ i ʔ ɔ n̪
balite	b ʌ l̪ i t̪ ɪ
balod	b ʌ l̪ o d̪
balon	b ʌ j o n̪
balon	b ʌ l̪ o n̪
balon	b ʌ o n̪
balos	b ʌ l̪ o s̪
baltazar	b ʌ l̪ t̪ ʌ s̪ a ɾ̪
balukag	b ʌ l̪ u k ʌ ɡ
balyena	b ʌ l̪ j i n̪ ʌ
banalo	b ʌ n̪ a l̪ ɔ
bandido	b ʌ n̪ d̪ i d̪ ɔ
banga	b ʌ ŋ a
banga	b ʌ ŋ a ʔ
bangag	b ʌ ŋ a ɡ
bangaw	b a ŋ a ʊ̯
bangga	b ʌ ŋ ɡ a ʔ
bangkarota	b ʌ ŋ k ʌ ɾ̪ o t̪ ʌ
bangkarote	b ʌ ŋ k ʌ ɾ̪ o t̪ ɪ
bangko	b a ŋ k ɔ
bangko	b ʌ ŋ k o ʔ
bangon	b a ŋ ɔ n̪
banig	b ʌ n̪ i ɡ
banigan	b ʌ n̪ ɪ ɡ a n̪
banika	b ʌ n̪ ɪ k a
banikanhon	b ʌ n̪ ɪ k a ŋ h ɔ n̪
banilad	b ʌ n̪ i l̪ ʌ d̪
banog	b a n̪ ɔ ɡ
banog	b ʌ n̪ o ɡ
banogon	b ʌ n̪ ɔ ɡ o n̪
bantay	b ʌ n̪ t̪ a ɪ̯
bantog	b ʌ n̪ t̪ o ɡ
bantogan	b ʌ n̪ t̪ o ɡ ʌ n̪
bantugan	b ʌ n̪ t̪ u ɡ ʌ n̪
banwa	b ʌ n̪ w a
banwaanon	b ʌ n̪ w ʌ ʔ a n̪ ɔ n̪
banyaga	b ʌ n̪ j a ɡ ʌ ʔ
banyera	b ʌ n̪ j i ɾ̪ ʌ
banyo	b a n̪ j ɔ
baog	b a ʔ ɔ ɡ
baog	b ʌ ʔ o ɡ
baos	b ʌ o s̪
barag	b ʌ ɾ̪ a ɡ
barang	b a ɾ̪ ʌ ŋ
barangay	b ʌ ɾ̪ ʌ ŋ ɡ a ɪ̯
barato	b ʌ ɾ̪ a t̪ ɔ
barcenas	b a ɾ̪ s̪ ɪ n̪ ʌ s̪
barkada	b ʌ ɾ̪ k a d̪ ʌ
barrientos	b ʌ ɾ̪ j i n̪ t̪ ɔ s̪
bartender	b a ɾ̪ t̪ ɪ n̪ d̪ i ɾ̪
bartolina	b ʌ ɾ̪ t̪ ɔ l̪ i n̪ ʌ
baruto	b ʌ ɾ̪ u t̪ ɔ
baryable	b ʌ ɾ̪ j a b l̪ ɪ
baryo	b a r j ɔ
baryohanon	b ʌ r j ɔ h a n̪ ɔ n̪
basa	b a s̪ ʌ
basa	b ʌ s̪ a ʔ
basahon	b ʌ s̪ ʌ h o n̪
basco	b a s̪ k ɔ
basi	b a s̪ ɪ
basin	b a s̪ ɪ n̪
basiyo	b ʌ s̪ i j ɔ
basket	b a s̪ k ɪ t̪
basketan	b ʌ s̪ k i t̪ ʌ n̪
basketbol	b ʌ s̪ k i t̪ b ɔ l̪
baskog	b ʌ s̪ k o ɡ
basol	b a s̪ ɔ l̪
basura	b ʌ s̪ u ɾ̪ ʌ
basurahan	b ʌ s̪ ʊ ɾ̪ ʌ h a n̪
basurero	b ʌ s̪ ʊ ɾ̪ i ɾ̪ ɔ
bat	b a t̪
bata	b a t̪ ʌ
bata	b a t̪ ʌ ʔ
batad	b ʌ t̪ a d̪
batadbatad	b ʌ t̪ ʌ d̪ b a t̪ ʌ d̪
batak	b a t̪ ʌ k
batakan	b ʌ t̪ a k ʌ n̪
batal	b ʌ t̪ a l̪
batalan	b ʌ t̪ ʌ l̪ a n̪
batalyon	b ʌ t̪ ʌ l̪ j o n̪
batang	b a t̪ ʌ ŋ
batang	b ʌ t̪ a ŋ
bataon	b ʌ t̪ ʌ ʔ o n̪
batasan	b ʌ t̪ a s̪ ʌ n̪
batayan	b ʌ t̪ a j ʌ n̪
batbat	b a t̪ b ʌ t̪
bateriya	b ʌ t̪ ɪ ɾ̪ i ʌ
bathala	b ʌ t̪ h a l̪ ʌ ʔ
bathay	b a t̪ h a ɪ̯
bati	b a t̪ ɪ
batid	b ʌ t̪ i d̪
batiis	b ʌ t̪ ɪ ʔ i s̪
batikan	b ʌ t̪ ɪ k a n̪
batikano	b ʌ t̪ ɪ k a n̪ ɔ
batil	b ʌ t̪ i l̪
batin	b a t̪ ɪ n̪
batiya	b ʌ t̪ i ʌ ʔ
bato	b a t̪ ɔ
bato	b ʌ t̪ o
batok	b a t̪ ɔ k
baton	b ʌ t̪ o n̪
batong	b a t̪ ɔ ŋ
batsi	b a t͡s ɪ
batsilyer	b ʌ t͡s ɪ l̪ j i ɾ̪
batuta	b ʌ t̪ u t̪ ʌ ʔ
batya	b a t̪ j ʌ
batyag	b ʌ t̪ j a ɡ
bautista	b a ʊ̯ t̪ i s̪ t̪ ʌ
bawang	b a w ʌ ŋ
bawi	b a w ɪ ʔ
bawod	b ʌ w o d̪
bawon	b a ʊ̯ n̪
bay	b a ɪ̯
bayad	b a j ʌ d̪
bayaw	b ʌ j a ʊ̯
baybay	b a ɪ̯ b a ɪ̯
bayi	b ɐ j ɪ
bayle	b a ɪ̯ l̪ ɪ
baylosis	b a ɪ̯ l̪ o s̪ ɪ s̪
baynte	b a ɪ̯ n̪ t̪ ɪ
bayong	b a j ɔ ŋ
bayot	b a j ɔ t̪
belen	b ɪ l̪ i n̪
belib	b ɪ l̪ i b
bentilador	b ɪ n̪ t̪ ɪ l̪ ʌ d̪ o ɾ̪
berde	b i ɾ̪ d̪ ɪ
bernes	b i ɾ̪ n̪ ɪ s̪
bersikulo	b ɪ ɾ̪ s̪ i k ʊ l̪ ɔ
berso	b i ɾ̪ s̪ ɔ
beterana	b ɪ t̪ ɪ ɾ̪ a n̪ ʌ
beterano	b ɪ t̪ ɪ ɾ̪ a n̪ ɔ
bibi	b i b ɪ
bibingka	b ɪ b i ŋ k ʌ
bibliya	b i b l̪ j a
bihag	b i h ʌ ɡ
bihon	b i h ɔ n̪
bika	b ɪ k a
bikangkang	b ɪ k ʌ ŋ k a ŋ
biko	b i k ɔ
bilang	b i l̪ ʌ ŋ
bilanggo	b ɪ l̪ ʌ ŋ ɡ o ʔ
bilanggoan	b ɪ l̪ ʌ ŋ ɡ o ʔ ʌ n̪
bilar	b ɪ l̪ a ɾ̪
bilas	b ɪ l̪ a s̪
bildo	b i l̪ d̪ ɔ
bilyar	b ɪ l̪ j a ɾ̪
binati	b ɪ n̪ a t̪ ɪ ʔ
binatonan	b ɪ n̪ ʌ t̪ o n̪ ʌ n̪
bingkong	b ɪ ŋ k o ŋ
binilanggo	b ɪ n̪ ɪ l̪ ʌ ŋ ɡ o ʔ
binisaya	b ɪ n̪ ɪ s̪ a j ʌ ʔ
bintana	b ɪ n̪ t̪ a n̪ ʌ ʔ
bira	b ɪ ɾ̪ a
birada	b ɪ ɾ̪ a d̪ ʌ
birtud	b ɪ ɾ̪ t̪ u d̪
bisaya	b ɪ s̪ a j ʌ ʔ
bisdak	b ɪ s̪ d̪ a k
bisdak	b ɪ z d̪ a k
bisikleta	b ɪ s̪ ɪ k l̪ i t̪ ʌ
bisita	b ɪ s̪ i t̪ ʌ
biskuwit	b ɪ s̪ k w i t̪
biskwit	b ɪ s̪ k w ɪ t̪
bisperas	b i s̪ p ɪ ɾ̪ ʌ s̪
bitad	b i t̪ ʌ d̪
bitay	b i t̪ a ɪ̯
bitbit	b i t̪ b ɪ t̪
bitoon	b ɪ t̪ o ʔ ɔ n̪
bituon	b ɪ t̪ u ʔ ɔ n̪
biyernes	b j i ɾ̪ n̪ ɪ s̪
biyernes	b ɪ ɾ n ɪ s
blanco	b l̪ a ŋ k ɔ
bloke	b l̪ o k ɪ
blotter	b l̪ a t̪ ɪ ɾ̪
boda	b o d̪ ʌ
bodega	b ɔ d̪ i ɡ ʌ
bodka	b o d̪ k ʌ
bogohanon	b ɔ ɡ ɔ h a n̪ ɔ n̪
bohol	b ɔ h o l̪
bokabularyo	b ɔ k ʌ b ʊ l̪ a ɾ̪ j ɔ
bokasyon	b ɔ k ʌ s̪ j o n̪
bolakaw	b ɔ l̪ a k a ʊ̯
bolinaw	b ɔ l̪ ɪ n̪ a ʊ̯
bolpen	b o l̪ p ɪ n̪
boltahe	b ɔ l̪ t̪ a h ɪ
bombero	b ɔ m b i ɾ̪ ɔ
bondying	b o n̪ d̪ j ɪ ŋ
bonghanoy	b ɔ ŋ h a n̪ o ɪ̯
bonilla	b ɔ n̪ i l̪ j ʌ
borbon	b ɔ ɾ̪ b o n̪
borja	b o ɾ̪ h ʌ
borongan	b ɔ ɾ̪ o ŋ ɡ ʌ n̪
bosina	b ɔ s̪ i n̪ ʌ
boso	b o s̪ ɔ
bosyo	b o s̪ j ɔ
botar	b ɔ t̪ a ɾ̪
botas	b o t̪ ʌ s̪
bote	b o t̪ ɪ
botelya	b ɔ t̪ i l̪ j ʌ
botik	b ɔ t̪ i k
botika	b ɔ t̪ i k ʌ
boto	b o t̪ ɔ
boykot	b o j k ɔ t̪
braso	b ɾ̪ a s̪ ɔ
brigoli	b ɾ̪ ɪ ɡ o l̪ ɪ
bringhinas	b ɾ̪ ɪ ŋ h i n̪ ʌ s̪
brip	b ɾ̪ i p
buak	b ʊ ʔ a k
buang	b u ʔ ʌ ŋ
buaya	b ʊ ʔ a j ʌ
bubo	b u b ɔ
bubo	b u b ɔ ʔ
budaya	b ʊ d̪ a j ʌ
budhi	b ʊ d̪ h i ʔ
budong	b ʊ d̪ o ŋ
bugang	b ʊ ɡ a ŋ
bugas	b ʊ ɡ a s̪
bugaw	b u ɡ a ʊ̯
bugdo	b ʊ ɡ d̪ o
bughaw	b ʊ ɡ h a ʊ̯
bugnaw	b ʊ ɡ n̪ a ʊ̯
bugnay	b ʊ ɡ n̪ a ɪ̯
bugtong	b ʊ ɡ t̪ o ŋ
buhat	b u h ʌ t̪
buhi	b u h ɪ ʔ
buhis	b ʊ h i s̪
buhok	b ʊ h o k
bukag	b ʊ k a ɡ
bukid	b u k ɪ d̪
bukidnon	b ʊ k ɪ d̪ n̪ o n̪
buklad	b ʊ k l̪ a d̪
bukol	b u k ɔ l̪
bukton	b ʊ k t̪ o n̪
buktot	b ʊ k t̪ o t̪
bukya	b ʊ k j a
bulacan	b ʊ l̪ ʌ k a n̪
bulad	b ʊ l̪ a d̪
bulak	b u l̪ ʌ k
bulakbol	b ʊ l̪ ʌ k b o l̪
bulalakaw	b ʊ l̪ ʌ l̪ a k a ʊ̯
bulan	b u l̪ ʌ n̪
bulan	b u ʌ n̪
bulang	b u l̪ ʌ ŋ
bulang	b u ʌ ŋ
bulangan	b ʊ l̪ ʌ ŋ a n̪
bulaw	b ʊ l̪ a ʊ̯
bulawan	b w a w ʌ n̪
bulawan	b ʊ l̪ a w ʌ n̪
bulbol	b ʊ l̪ b o l̪
buldog	b u l̪ d̪ ɔ ɡ
bulhog	b ʊ l̪ h o ɡ
buli	b ʊ l̪ i
buli	b ʊ l̪ i ʔ
bulig	b u l̪ ɪ ɡ
bulinaw	b ʊ l̪ i n̪ a ʊ̯
bulkan	b ʊ l̪ k a n̪
bulod	b u d̪
bulod	b u j ɔ d̪
bulod	b u l̪ ɔ d̪
bulog	b ʊ l̪ o ɡ
bumbilya	b ʊ m b i l̪ j ʌ
bunal	b u n̪ ʌ l̪
bungahoy	b ʊ ŋ a h o ɪ̯
bungaw	b ʊ ŋ a ʊ̯
bunggo	b ʊ ŋ ɡ o ʔ
bungi	b ʊ ŋ i ʔ
bungsod	b ʊ ŋ s̪ o d̪
bungtod	b ʊ ŋ t̪ o d̪
buno	b ʊ n̪ o ʔ
bunog	b u n̪ ɔ ɡ
bunot	b u n̪ ɔ t̪
bunot	b ʊ n̪ o t̪
bunsod	b ʊ n̪ s̪ o d̪
buntag	b u n̪ t̪ ʌ ɡ
buntag	b ʊ n̪ t̪ a ɡ
buntod	b ʊ n̪ t̪ o d̪
bunyag	b u n̪ j ʌ ɡ
buol	b ʊ ʔ o l̪
buot	b ʊ ʔ o t̪
buraw	b ʊ ɾ̪ a ʊ̯
burgos	b u ɾ̪ ɡ ɔ s̪
buros	b ʊ ɾ̪ o s̪
burot	b u ɾ̪ ɔ t̪
busay	b ʊ s̪ a ɪ̯
buskay	b ʊ s̪ k a ɪ̯
busog	b u s̪ ɔ ɡ
busog	b ʊ s̪ o ɡ
butakal	b ʊ t̪ ʌ k a l̪
butakaw	b ʊ t̪ ʌ k a ʊ̯
butanding	b ʊ t̪ ʌ n̪ d̪ i ŋ
butang	b ʊ t̪ a ŋ
butkon	b ʊ t̪ k o n̪
buto	b u t̪ ɔ ʔ
butod	b ʊ t̪ o d̪
butong	b ʊ t̪ o ŋ
buwad	b w a d̪
buwakaw	b w a k a ʊ̯
buwang	b u ʌ ŋ
buwisit	b w i s̪ ɪ t̪
buyon	b u j ɔ n̪
buyong	b ʊ j o ŋ
byuti	b j u t̪ ɪ
cabahug	k ʌ b a h ʊ ɡ
caballero	k ʌ b ʌ l̪ j i ɾ̪ ɔ
cabanlit	k ʌ b ʌ n̪ l̪ i t̪
cabatuan	k ʌ b ʌ t̪ u ʔ ʌ n̪
cabello	k ʌ b i l̪ j ɔ
cabrera	k ʌ b ɾ̪ i ɾ̪ ʌ
cadeliña	k ʌ d̪ ɪ l̪ i ɲ ʌ
cagas	k a ɡ ʌ s̪
cahoy	k a h o ɪ̯
calamba	k ʌ l̪ a m b ʌ
calamba	k ʌ l̪ ʌ m b a ʔ
calumpang	k ʌ l̪ ʊ m p a ŋ
camalig	k ʌ m a l̪ ɪ ɡ
caminero	k ʌ m ɪ n̪ i ɾ̪ ɔ
candijay	k ʌ n̪ d̪ i h a ɪ̯
capalaran	k ʌ p ʌ l̪ a ɾ̪ ʌ n̪
capistrano	k a p ɪ s̪ t̪ ɾ̪ a n̪ ɔ
capiz	k a p ɪ s̪
capuyan	k ʌ p u j ʌ n̪
carcar	k ʌ ɾ̪ k a ɾ̪
carreon	k ʌ ɾ̪ j o n̪
castañeda	k ʌ s̪ t̪ ʌ ɲ ɪ d̪ ʌ
castaños	k ʌ s̪ t̪ a ɲ ɔ s̪
castillo	k ʌ s̪ t̪ i l̪ j ɔ
castillon	k ʌ s̪ t̪ ɪ l̪ j o n̪
catadman	k ʌ t̪ ʌ d̪ m a n̪
catarina	k ʌ t̪ ʌ ɾ̪ i n̪ ʌ
catipay	k ʌ t̪ i p a ɪ̯
catmon	k ʌ t̪ m o n̪
cayanong	k ʌ j a n̪ ɔ ŋ
cañete	k ʌ ɲ ɪ t̪ ɪ
chiongbian	t̪ s̪ o m b j ʌ n̪
cimafranca	s̪ ɪ m ʌ p ɾ̪ a ŋ k ʌ
comendador	k ɔ m ɪ n̪ d̪ ʌ d̪ o ɾ̪
cometa	k ɔ m i t̪ ʌ
contreras	k ɔ n̪ t̪ ɾ̪ i ɾ̪ ʌ s̪
cordova	k o ɾ̪ d̪ ɔ b ʌ
cortes	k ɔ ɾ̪ t̪ i s̪
cotabato	k ɔ t̪ ʌ b a t̪ ɔ
cruz	k ɾ̪ u s̪
cuevas	k w i b ʌ s̪
cutamora	k ʊ t̪ ʌ m o ɾ̪ ʌ
cuyugan	k ʊ j u ɡ ʌ n̪
cyril	s̪ i ɾ̪ ɪ l̪
cyrus	s̪ a ɪ̯ ɾ̪ ʊ s̪
daan	d̪ a ʔ ʌ n̪
daanglungsod	d̪ ʌ ʌ ŋ l̪ ʊ ŋ s̪ o d̪
daanlungsod	d̪ ʌ ʌ n̪ l̪ ʊ ŋ s̪ o d̪
dacumos	d̪ ʌ k u m ɔ s̪
dagami	d̪ ʌ ɡ a m ɪ
dagan	d̪ a ɡ ʌ n̪
dagat	d̪ a ɡ ʌ t̪
daghan	d̪ ʌ ɡ h a n̪
dagit	d̪ a ɡ ɪ t̪
dagohoy	d̪ ʌ ɡ o h o ɪ̯
dagom	d̪ a ɡ ɔ m
daguldol	d̪ ʌ ɡ u l̪ d̪ ɔ l̪
dagway	d̪ ʌ ɡ w a ɪ̯
dahil	d̪ ʌ h i l̪
dahom	d̪ ʌ h o m
dahon	d̪ a h ɔ n̪
daing	d̪ a ʔ ɪ ŋ
dakbalay	d̪ ʌ k b ʌ l̪ a ɪ̯
dakbayan	d̪ ʌ k b ʌ j a n̪
dako	d̪ ʌ k o ʔ
dalag	d̪ a ɡ
dalag	d̪ ʌ j a ɡ
dalag	d̪ ʌ l̪ a ɡ
dalaga	d̪ ʌ l̪ a ɡ ʌ
dalaginding	d̪ ʌ l̪ ʌ ɡ ɪ n̪ d̪ i ŋ
dalagita	d̪ ʌ l̪ ʌ ɡ i t̪ ʌ
dalan	d̪ a l̪ ʌ n̪
dali	d̪ ʌ l̪ i ʔ
dalo	d̪ ʌ l̪ o ʔ
dalugdog	d̪ ʌ l̪ ʊ ɡ d̪ o ɡ
dalunggan	d̪ ʊ ŋ ɡ a n̪
dalunggan	d̪ ʌ l̪ ʊ ŋ ɡ a n̪
dalunggan	d̪ ʌ w ŋ ɡ a n̪
damay	d̪ a m a ɪ̯
damgo	d̪ a m ɡ ɔ
dampog	d̪ ʌ m p o ɡ
danaw	d̪ a n̪ a ʊ̯
dangaw	d̪ a ŋ a ʊ̯
danggit	d̪ ʌ ŋ ɡ i t̪
daog	d̪ ʌ ʔ o ɡ
daot	d̪ a ʔ ɔ t̪
daot	d̪ ʌ ʔ o t̪
daotan	d̪ ʌ ʔ o t̪ ʌ n̪
daro	d̪ a ɾ̪ ɔ
daster	d̪ a s̪ t̪ ɪ ɾ̪
dato	d̪ a t̪ ɔ ʔ
dawa	d̪ a w ʌ
dawende	d̪ ʌ w i n̪ d̪ ɪ
dayap	d̪ a j ʌ p
dayeg	d̪ a j ɪ ɡ
dayo	d̪ a j ɔ
deboto	d̪ ɪ b o t̪ ɔ
dedbol	d̪ i d̪ b ɔ l̪
dekada	d̪ ɪ k a d̪ ʌ
dekorar	d̪ ɪ k ɔ ɾ̪ a ɾ̪
dekorasyon	d̪ ɪ k ɔ ɾ̪ ʌ s̪ j o n̪
delikado	d̪ ɪ l̪ ɪ k a d̪ ɔ
deliryo	d̪ ɪ l̪ i ɾ̪ j ɔ
denotasyon	d̪ ɪ n̪ ɔ t̪ ʌ s̪ j o n̪
desisyon	d̪ ɪ s̪ ɪ s̪ j o n̪
desperado	d̪ ɪ s̪ p ɪ ɾ̪ a d̪ ɔ
detalye	d̪ ɪ t̪ a l̪ j ɪ
determinasyon	d̪ ɪ t̪ ɪ ɾ̪ m ɪ n̪ ʌ s̪ j o n̪
dewende	d̪ ɪ w i n̪ d̪ ɪ
diaz	d̪ i ʌ s̪
diin	d̪ i ʔ ɪ n̪
diksyonaryo	d̪ ɪ k s̪ j ɔ n̪ a ɾ̪ j ɔ
dila	d̪ i l̪ ʌ ʔ
dili	d̪ ɪ l̪ i
dinhi	d̪ ɪ ŋ h i
diriyot	d̪ ɪ ɾ̪ j o t̪
disenteriya	d̪ ɪ s̪ ɪ n̪ t̪ ɪ ɾ̪ i ʌ
diskuwento	d̪ ɪ s̪ k w i n̪ t̪ ɔ
disposisyon	d̪ ɪ s̪ p ɔ s̪ ɪ s̪ j o n̪
disyembre	d̪ ɪ s̪ j i m b ɾ̪ ɪ
dita	d̪ ɪ t̪ a ʔ
divinagracia	d̪ ɪ b ɪ n̪ ʌ ɡ ɾ̪ a s̪ j ʌ
diwa	d̪ i w ʌ ʔ
diyakono	d̪ j a k ɔ n̪ o
diyos	d̪ j o s̪
diyot	d̪ j o t̪
diyotay	d̪ ɪ j ɔ t̪ a ɪ̯
dodong	d̪ o d̪ ɔ ŋ
dolongan	d̪ ɔ l̪ o ŋ ʌ n̪
dominggo	d̪ ɔ m i ŋ ɡ ɔ
dribol	d̪ ɾ̪ i b ɔ l̪
dugay	d̪ u ɡ a ɪ̯
dugdog	d̪ ʊ ɡ d̪ o ɡ
dughan	d̪ ʊ ɡ h a n̪
dughit	d̪ u ɡ h ɪ t̪
dugo	d̪ ʊ ɡ o ʔ
dugos	d̪ u ɡ ɔ s̪
dugta	d̪ u ɡ t̪ ʌ ʔ
duha	d̪ ʊ h a
duhaylungsod	d̪ ʊ h a ɪ̯ l̪ ʊ ŋ s̪ o d̪
dukesa	d̪ ʊ k i s̪ ʌ
duko	d̪ ʊ k o ʔ
dukot	d̪ ʊ k o t̪
dula	d̪ u l̪ ʌ ʔ
dula	d̪ u ʌ ʔ
dulaan	d̪ w a ʔ ʌ n̪
dulaan	d̪ ʊ l̪ a ʔ ʌ n̪
dulok	d̪ u l̪ ɔ k
dulom	d̪ ʊ l̪ o m
dulon	d̪ u j ɔ n̪
dulon	d̪ u l̪ ɔ n̪
dulon	d̪ u n̪
dulondulon	d̪ ʊ l̪ ɔ n̪ d̪ u l̪ ɔ n̪
dulot	d̪ u l̪ ɔ t̪
dulot	d̪ ʊ l̪ o t̪
dumala	d̪ ʊ m a l̪ ʌ
dumog	d̪ u m ɔ ɡ
dunggab	d̪ u ŋ ɡ ʌ b
dunggan	d̪ u ŋ ɡ ʌ n̪
dunggo	d̪ ʊ ŋ ɡ o ʔ
dunggoan	d̪ ʊ ŋ ɡ o ʔ ʌ n̪
dunggoanan	d̪ ʊ ŋ ɡ ɔ ʔ a n̪ ʌ n̪
dungog	d̪ u ŋ ɔ ɡ
duot	d̪ ʊ ʔ o t̪
duran	d̪ ʊ ɾ̪ a n̪
dusmo	d̪ ʊ s̪ m o ʔ
dusmog	d̪ ʊ s̪ m o ɡ
duso	d̪ ʊ s̪ o ʔ
duterte	d̪ ʊ t̪ i ɾ̪ t̪ ɪ
duwa	d̪ u ʌ ʔ
dyanitor	d̪ j a n̪ ɪ t̪ o ɾ̪
dyip	d̪ j i p
edukado	ʔ ɪ d̪ ʊ k a d̪ ɔ
edukasyon	ʔ ɪ d̪ ʊ k ʌ s̪ j o n̪
eguia	ʔ ɪ ɡ i ʌ
ekek	ʔ i k ɪ k
ekipahe	ʔ ɪ k ɪ p a h ɪ
eklipse	ʔ ɪ k l̪ i p s̪ ɪ
eksakto	ʔ ɪ k s̪ a k t̪ ɔ
eksorsismo	ʔ i k s̪ ɔ ɾ̪ s̪ i s̪ m ɔ
eksplikar	ʔ ɪ k s̪ p l̪ ɪ k a ɾ̪
ektarya	ʔ ɪ k t̪ a ɾ̪ j ʌ
elegante	ʔ ɪ l̪ ɪ ɡ a n̪ t̪ ɪ
eleksyon	ʔ ɪ l̪ ɪ k s̪ j o n̪
elektrisyan	ʔ ɪ l̪ ɪ k t̪ ɾ̪ i s̪ j ʌ n̪
elementarya	ʔ ɪ l̪ ɪ m ɪ n̪ t̪ a ɾ̪ j ʌ
elepante	ʔ ɪ l̪ ɪ p a n̪ t̪ ɪ
eliminasyon	ʔ ɪ l̪ ɪ m ɪ n̪ ʌ s̪ j o n̪
elpidio	ʔ ɪ l̪ p i d̪ j ɔ
empleyada	ʔ ɪ m p l̪ j a d̪ ʌ
empleyado	ʔ ɪ m p l̪ j a d̪ ɔ
enero	ʔ ɪ n̪ i ɾ̪ ɔ
engkanto	ʔ ɪ ŋ k a n̪ t̪ ɔ
engrande	ʔ ɪ ŋ ɡ ɾ̪ a n̪ d̪ ɪ
entablado	ʔ ɪ n̪ t̪ ʌ b l̪ a d̪ ɔ
ermat	ʔ i ɾ̪ m ʌ t̪
eroplano	ʔ ɪ ɾ̪ ɔ p l̪ a n̪ ɔ
erpat	ʔ i ɾ̪ p ʌ t̪
escaño	ʔ ɪ s̪ k a ɲ ɔ
eskedyul	ʔ ɪ s̪ k i d̪ j ʊ l̪
eskina	ʔ ɪ s̪ k i n̪ ʌ
eskobilyo	ʔ ɪ s̪ k ɔ b i l̪ j ɔ
eskultor	ʔ ɪ s̪ k ʊ l̪ t̪ o ɾ̪
eskuwela	ʔ ɪ s̪ k w i l̪ ʌ
eskuwelahan	ʔ ɪ s̪ k w ɪ l̪ ʌ h a n̪
esmagol	ʔ ɪ s̪ m a ɡ ɔ l̪
espanyol	ʔ ɪ s̪ p ʌ n̪ j o l̪
espeho	ʔ ɪ s̪ p i h ɔ
espirito	ʔ ɪ s̪ p i ɾ̪ ɪ t̪ ɔ
espiritohanon	ʔ ɪ s̪ p ɪ ɾ̪ ɪ t̪ ɔ h a n̪ ɔ n̪
espiritu	ʔ ɪ s̪ p i ɾ̪ ɪ t̪ ʊ
espirituhanon	ʔ ɪ s̪ p ɪ ɾ̪ ɪ t̪ ʊ h a n̪ ɔ n̪
espiya	ʔ ɪ s̪ p i ʌ
espongha	ʔ ɪ s̪ p o ŋ h ʌ
estatuwa	ʔ ɪ s̪ t̪ a t̪ w a
estillore	ʔ ɪ s̪ t̪ ɪ l̪ j o ɾ̪ ɪ
estorya	ʔ ɪ s̪ t̪ o ɾ̪ j ʌ
estrella	ʔ ɪ s̪ t̪ ɾ̪ i l̪ j ʌ
estudyante	ʔ ɪ s̪ t̪ ʊ d̪ j a n̪ t̪ ɪ
estupido	ʔ ɪ s̪ t̪ ʊ p i d̪ ɔ
eulogia	ʔ i ʊ̯ l̪ o h ɪ ʌ
fabillar	p ʌ b ɪ l̪ j a ɾ̪
fernando	p ɪ ɾ̪ n̪ a n̪ d̪ ɔ
flores	p l̪ o ɾ̪ ɪ s̪
formentera	p ɔ ɾ̪ m ɪ n̪ t̪ i ɾ̪ ʌ
francisco	p ɾ̪ ʌ n̪ s̪ i s̪ k ɔ
fuentes	p w i n̪ t̪ ɪ s̪
gaak	ɡ ʌ ʔ a k
gaan	ɡ ʌ ʔ a n̪
gaba	ɡ a b ʌ
gabi	ɡ a b ɪ
gabii	ɡ ʌ b ɪ ʔ i
gading	ɡ a d̪ ɪ ŋ
gadya	ɡ ʌ d̪ j a ʔ
gahi	ɡ a h ɪ ʔ
gahom	ɡ a h ɔ m
gajod	ɡ ʌ d͡ʒ o d̪
gallardo	ɡ ʌ l̪ j a ɾ̪ d̪ ɔ
galon	ɡ ʌ l̪ o n̪
gamot	ɡ ʌ m o t̪
gamotpulong	ɡ ʌ m o t̪ p ʊ l̪ o ŋ
gana	ɡ a n̪ ʌ
ganahan	ɡ ʌ n̪ a h ʌ n̪
ganansiya	ɡ ʌ n̪ a n̪ s̪ j a
gang	ɡ a ŋ
ganggang	ɡ a ŋ ɡ ʌ ŋ
ganggang	ɡ ʌ ŋ ɡ a ŋ
gango	ɡ a ŋ ɔ
gapas	ɡ a p ʌ s̪
garahe	ɡ ʌ ɾ̪ a h ɪ
garcia	ɡ ʌ ɾ̪ s̪ i ʌ
garing	ɡ ʌ ɾ̪ i ŋ
garo	ɡ ʌ ɾ̪ o ʔ
gasolina	ɡ ʌ s̪ ɔ l̪ i n̪ ʌ
gasolinahan	ɡ ʌ s̪ ɔ l̪ ɪ n̪ ʌ h a n̪
gatas	ɡ a t̪ ʌ s̪
gatos	ɡ ʌ t̪ o s̪
gawas	ɡ ʌ w a s̪
gayod	d͡ʒ ʊ d̪
gayod	ɡ j ʊ d̪
gayod	ɡ ʌ d͡ʒ o d̪
gayod	ɡ ʌ j o d̪
genaro	h ɪ n̪ a ɾ̪ ɔ
getafe	h ɪ t̪ a p ɪ
gigikanan	ɡ ɪ ɡ ɪ k a n̪ ʌ n̪
gikalag	ɡ ɪ k a ɡ
gikalag	ɡ ɪ k ʌ j a ɡ
gikalag	ɡ ɪ k ʌ l̪ a ɡ
gikan	ɡ i k ʌ n̪
gilayon	ɡ ɪ l̪ ʌ j o n̪
gingharian	ɡ ɪ ŋ h ʌ ɾ̪ i ʔ ʌ n̪
ginhawa	ɡ ɪ ŋ h a w ʌ
ginikanan	ɡ ɪ n̪ ɪ k a n̪ ʌ n̪
ginisal	ɡ ɪ n̪ ɪ s̪ a l̪
ginunting	ɡ ɪ n̪ ʊ n̪ t̪ i ŋ
ginuntingan	ɡ ɪ n̪ ʊ n̪ t̪ i ŋ ʌ n̪
gira	ɡ i ɾ̪ ʌ
gisa	ɡ i s̪ ʌ ʔ
gisa	ɡ ɪ s̪ a
gisado	ɡ ɪ s̪ a d̪ ɔ
gisal	ɡ ɪ s̪ a l̪
gisi	ɡ i s̪ ɪ ʔ
gitara	ɡ ɪ t̪ a ɾ̪ ʌ
giti	ɡ i t̪ ɪ ʔ
glorya	ɡ l̪ o ɾ̪ j ʌ
golosino	ɡ ɔ l̪ ɔ s̪ i n̪ ɔ
gomez	ɡ o m ɪ s̪
gonzaga	ɡ ɔ n̪ s̪ a ɡ ʌ
gorgonio	ɡ ɔ ɾ̪ ɡ o n̪ j ɔ
goryo	ɡ o ɾ̪ j ɔ
graba	ɡ ɾ̪ a b ʌ
guba	ɡ ʊ b a ʔ
gubat	ɡ u b ʌ t̪
gubot	ɡ ʊ b o t̪
guindulman	ɡ ɪ n̪ d̪ ʊ l̪ m a n̪
guiuan	ɡ i w ʌ n̪
gulaman	ɡ ʊ l̪ a m ʌ n̪
gumamela	ɡ ʊ m ʌ m i l̪ ʌ
guna	ɡ u n̪ ʌ
gunting	ɡ ʊ n̪ t̪ i ŋ
guot	ɡ u ʔ ɔ t̪
gusok	ɡ ʊ s̪ o k
gutang	ɡ ʊ t̪ a ŋ
gutom	ɡ u t̪ ɔ m
gutom	ɡ ʊ t̪ o m
guwapa	ɡ w a p ʌ
guwapo	ɡ w a p ɔ
guyabano	ɡ ʊ j ʌ b a n̪ ɔ
guyod	ɡ u j ɔ d̪
guzman	ɡ ʊ s̪ m a n̪
gwapa	ɡ w ʌ p ʌ
gwapo	ɡ w ʌ p ɔ
gyud	ɡ j ʊ d̪
habagat	h ʌ b a ɡ ʌ t̪
habagatan	h ʌ b ʌ ɡ a t̪ ʌ n̪
habal	h a b ʌ l̪
habol	h ʌ b o l̪
hagdan	h ʌ ɡ d̪ a n̪
hagdanan	h ʌ ɡ d̪ a n̪ ʌ n̪
hagnaya	h ʌ ɡ n̪ a j ʌ
hagok	h a ɡ ɔ k
hagtok	h a ɡ t̪ ɔ k
hakog	h ʌ k o ɡ
halas	h a l̪ ʌ s̪
halimaw	h ʌ l̪ i m a ʊ̯
halok	h ʌ l̪ o k
halwa	h a l̪ w ʌ
hambog	h ʌ m b o ɡ
hambogera	h ʌ m b ɔ ɡ i ɾ̪ ʌ
hambogero	h ʌ m b ɔ ɡ i ɾ̪ ɔ
hampang	h a m p ʌ ŋ
hanas	h ʌ n̪ a s̪
hangga	h a ŋ ɡ ʌ ʔ
hangin	h a ŋ ɪ n̪
hangol	h ʌ ŋ o l̪
hantak	h a n̪ t̪ ʌ k
hanting	h a n̪ t̪ ɪ ŋ
hardin	h ʌ ɾ̪ d̪ i n̪
hari	h a ɾ̪ ɪ ʔ
harianon	h ʌ ɾ̪ ɪ ʔ a n̪ ɔ n̪
hasler	h a s̪ l̪ ɪ ɾ̪
hatag	h a t̪ ʌ ɡ
hatdog	h a t̪ d̪ ɔ ɡ
hatod	h ʌ t̪ o d̪
hawak	h a w ʌ k
hawok	h ʌ w o k
hayahay	h ʌ j a h a ɪ̯
hayop	h a j ɔ p
helikopter	h ɪ l̪ ɪ k o p t̪ ɪ ɾ̪
hepa	h i p ʌ
hepe	h i p ɪ
heringgilya	h ɪ ɾ̪ ɪ ŋ ɡ i l̪ j ʌ
hibalo	h ɪ b ʌ l̪ o
hibi	h i b ɪ
higala	h ɪ ɡ a l̪ ʌ
higante	h ɪ ɡ a n̪ t̪ ɪ
higot	h ɪ ɡ o t̪
hikog	h i k ɔ ɡ
hikot	h i k ɔ t̪
hilanat	h ɪ l̪ ʌ n̪ a t̪
hilaw	h ɪ l̪ a ʊ̯
hilawas	h ɪ l̪ a w ʌ s̪
hilig	h i l̪ ɪ ɡ
hilo	h i l̪ ɔ
hilo	h ɪ l̪ o
hilom	h i l̪ ɔ m
hilot	h i l̪ ɔ t̪
himalad	h ɪ m a l̪ ʌ d̪
himantayon	h ɪ m ʌ n̪ t̪ a j ɔ n̪
himasa	h ɪ m a s̪ ʌ
himasa	h ɪ m ʌ s̪ a ʔ
hinabang	h ɪ n̪ a b ʌ ŋ
hinay	h i n̪ a ɪ̯
hingatulog	h ɪ ŋ ʌ t̪ u l̪ ɔ ɡ
hinginom	h ɪ ŋ ʔ ɪ n̪ o m
hingugmo	h ɪ ŋ ʊ ɡ m o
hinguha	h ɪ ŋ u h ʌ ʔ
hinguko	h ɪ ŋ u k ɔ
hinguto	h ɪ ŋ u t̪ ɔ
