pila	p ɪ l̪ a
pilak	p i l̪ ʌ k
pilapil	p ɪ l̪ a p ɪ l̪
pili	p i l̪ ɪ ʔ
pilipog	p ɪ l̪ i p ɔ ɡ
pilit	p ɪ l̪ i t̪
pilok	p ɪ l̪ o k
pinadayag	p ɪ n̪ ʌ d̪ ʌ j a ɡ
pinansyal	p ɪ n̪ a n̪ s̪ j ʌ l̪
pinggan	p ɪ ŋ ɡ a n̪
pinulongan	p ɪ n̪ ʊ l̪ o ŋ ʌ n̪
pinya	p i n̪ j ʌ
pirot	p ɪ ɾ̪ o t̪
pisikal	p ɪ s̪ ɪ k a l̪
piskal	p ɪ s̪ k a l̪
piso	p i s̪ ɔ
pisot	p ɪ s̪ o t̪
pispis	p ɪ s̪ p i s̪
pistola	p ɪ s̪ t̪ o l̪ ʌ
pitlaw	p i t̪ l̪ a ʊ̯
pito	p i t̪ ɔ
pito	p ɪ t̪ o
pitogo	p ɪ t̪ o ɡ ɔ
piyansa	p j a n̪ s̪ ʌ
piyer	p j i ɾ̪
piyesta	p j i s̪ t̪ ʌ
piyong	p i j ɔ ŋ
piñero	p ɪ ɲ ɪ ɾ̪ ɔ
planta	p l̪ a n̪ t̪ ʌ
plaridel	p l̪ a ɾ̪ ɪ d̪ i l̪
plaslayt	p l̪ a s̪ l̪ a ɪ̯ t̪
plema	p l̪ i m ʌ
plete	p l̪ i t̪ ɪ
polbos	p o l̪ b ɔ s̪
politika	p ɔ l̪ i t̪ ɪ k ʌ
politikanhon	p ɔ l̪ ɪ t̪ ɪ k ʌ ŋ h o n̪
ponsing	p o n̪ s̪ ɪ ŋ
porsento	p ɔ ɾ̪ s̪ i n̪ t̪ ɔ
porsiyento	p ɔ ɾ̪ s̪ j i n̪ t̪ ɔ
poste	p o s̪ t̪ ɪ
praktis	p ɾ̪ a k t̪ ɪ s̪
prebensiyon	p ɾ̪ ɪ b ɪ n̪ s̪ j o n̪
prediksyon	p ɾ̪ ɪ d̪ ɪ k s̪ j o n̪
preparado	p ɾ̪ ɪ p ʌ ɾ̪ a d̪ ɔ
preparar	p ɾ̪ ɪ p a ɾ̪ ʌ ɾ̪
presensya	p ɾ̪ ɪ s̪ i n̪ s̪ j ʌ
presidente	p ɾ̪ ɪ s̪ ɪ d̪ i n̪ t̪ ɪ
presko	p ɾ̪ i s̪ k ɔ
presyo	p ɾ̪ i s̪ j ɔ
pribado	p ɾ̪ ɪ b a d̪ ɔ
pribilehiyo	p ɾ̪ ɪ b ɪ l̪ ɪ h i j ɔ
prince	p ɾ̪ i n̪ s̪
priso	p ɾ̪ i s̪ ɔ
prisohan	p ɾ̪ ɪ s̪ ɔ h a n̪
probinsiya	p ɾ̪ ɔ b i n̪ s̪ j ʌ
prutas	p ɾ̪ u t̪ ʌ s̪
puasa	p ʊ ʔ a s̪ ʌ
publikasyon	p ʊ b l̪ ɪ k ʌ s̪ j o n̪
pudlos	p ʊ d̪ l̪ o s̪
pudno	p u d̪ n̪ ɔ
pugad	p u ɡ ʌ d̪
pughak	p ʊ ɡ h a k
pugot	p u ɡ ɔ t̪
pugot	p ʊ ɡ o t̪
puhunan	p ʊ h u n̪ ʌ n̪
pukaw	p u k a ʊ̯
puklo	p o k l o ʔ
pukot	p u k ɔ t̪
pukpok	p u k p ɔ k
pula	p w a
pula	p ʊ l̪ a
pulas	p u l̪ ʌ s̪
pulbora	p u l̪ b ɔ ɾ̪ ʌ
pulgas	p ʊ l̪ ɡ a s̪
puling	p u l̪ ɪ ŋ
pulo	p u l̪ ɔ ʔ
pulo	p ʊ l̪ o ʔ
pulta	p u l̪ t̪ ʌ
punaw	p ʊ n̪ a ʊ̯
pundasiyon	p ʊ n̪ d̪ ʌ s̪ j o n̪
pundir	p ʊ n̪ d̪ i ɾ̪
pundo	p u n̪ d̪ ɔ
punerarya	p ʊ n̪ ɪ ɾ̪ a ɾ̪ j ʌ
pungkay	p ʊ ŋ k a ɪ̯
pungko	p ʊ ŋ k o ʔ
pungkopungko	p ʊ ŋ k o p ʊ ŋ k o ʔ
pungkoy	p ʊ ŋ k o j
puno	p u n̪ ɔ ʔ
puno	p ʊ n̪ o ʔ
punyal	p ʊ n̪ j a l̪
punyeta	p ʊ n̪ j i t̪ ʌ
punyete	p ʊ n̪ j i t̪ ɪ
puot	p ʊ ʔ o t̪
pusgay	p ʊ s̪ ɡ a ɪ̯
pusil	p ʊ s̪ i l̪
pusit	p ʊ s̪ i t̪
puso	p u s̪ ɔ
puso	p u s̪ ɔ ʔ
pusod	p u s̪ ɔ d̪
puspos	p u s̪ p ɔ s̪
pusta	p ʊ s̪ t̪ a
puti	p ʊ t̪ i ʔ
putli	p ʊ t̪ l̪ i ʔ
puto	p u t̪ ɔ
putos	p ʊ t̪ o s̪
putot	p u t̪ ɔ t̪
putyokan	p ʊ t̪ j o k ʌ n̪
puwa	p w a
puwede	p w i d̪ ɪ
pwerta	p w ɪ ɾ̪ t̪ ʌ
quirino	k ɪ ɾ̪ i n̪ ɔ
quiñones	k ɪ ɲ ɔ n̪ ɪ s̪
rabago	ɾ̪ a b ʌ ɡ ɔ
radyo	ɾ̪ a d̪ j ɔ
rambol	ɾ̪ a m b ɔ l̪
rambutan	ɾ̪ ʌ m b u t̪ ʌ n̪
ramirez	ɾ̪ ʌ m i ɾ̪ ɪ s̪
ransiyo	ɾ̪ ʌ n̪ s̪ j o
rason	ɾ̪ ʌ s̪ o n̪
rayban	ɾ̪ i ɪ b ʌ n̪
rayna	ɾ̪ a ɪ̯ n̪ ʌ
razonable	ɾ̪ ʌ s̪ ɔ n̪ a b l̪ ɪ
reaksiyon	ɾ̪ ɪ ʔ ʌ k s̪ j o n̪
reaksyon	ɾ̪ j ʌ k s̪ j o n̪
rebaha	ɾ̪ ɪ b a h ʌ
rebelde	ɾ̪ ɪ b i l̪ d̪ ɪ
regalo	ɾ̪ ɪ ɡ a l̪ ɔ
rekomendar	ɾ̪ ɪ k ɔ m i n̪ d̪ ʌ ɾ̪
relasyon	ɾ̪ ɪ l̪ ʌ s̪ j o n̪
relo	ɾ̪ ɪ l̪ o
relokasyon	ɾ̪ ɪ l̪ ɔ k ʌ s̪ j o n̪
reorganisar	ɾ̪ ɪ ʔ ɔ ɾ̪ ɡ ʌ n̪ ɪ s̪ a ɾ̪
reporma	ɾ̪ ɪ p o ɾ̪ m ʌ
resibo	ɾ̪ ɪ s̪ i b ɔ
resolbar	ɾ̪ ɪ s̪ ɔ l̪ b a ɾ̪
reyalista	ɾ̪ j ʌ l̪ i s̪ t̪ ʌ
risgo	ɾ̪ i s̪ ɡ ɔ
rodriguez	ɾ̪ ɔ d̪ ɾ̪ i ɡ ɪ s̪
rojas	ɾ̪ o h ʌ s̪
rolyo	ɾ̪ o l̪ j ɔ
romero	ɾ̪ ɔ m i ɾ̪ ɔ
rosario	ɾ̪ ɔ s̪ a ɾ̪ j ɔ
rosaryo	ɾ̪ ɔ s̪ a ɾ̪ j ɔ
rubi	ɾ̪ ʊ b i
ruedas	ɾ̪ w i d̪ ʌ s̪
rufino	ɾ̪ ʊ p i n̪ ɔ
ruler	ɾ̪ u l̪ ɪ ɾ̪
ruperto	ɾ̪ ʊ p i ɾ̪ t̪ ɔ
saad	s̪ a ʔ ʌ d̪
sabado	s̪ a b ʌ d̪ o
sabak	s̪ a b ʌ k
sabak	s̪ ʌ b a k
sabat	s̪ ʌ b a t̪
sabaw	s̪ ʌ b a ʊ̯
sabellano	s̪ ʌ b ɪ l̪ j a n̪ ɔ
sablay	s̪ ʌ b l̪ a ɪ̯
sabon	s̪ ʌ b o n̪
sabong	s̪ a b ɔ ŋ
sabot	s̪ ʌ b o t̪
sabsab	s̪ ʌ b s̪ a b
sabwag	s̪ ʌ b w a ɡ
sagang	s̪ ʌ ɡ a ŋ
sagay	s̪ a ɡ a ɪ̯
sagbot	s̪ a ɡ b ɔ t̪
saging	s̪ a ɡ ɪ ŋ
sagop	s̪ ʌ ɡ o p
sain	s̪ a ʔ ɪ n̪
saka	s̪ ʌ k a
sakate	s̪ ʌ k a t̪ ɪ
sakay	s̪ ʌ k a ɪ̯
sakayan	s̪ ʌ k a j ʌ n̪
sako	s̪ a k ɔ
saksak	s̪ a k s̪ ʌ k
saksi	s̪ ʌ k s̪ i
sakto	s̪ a k t̪ ɔ
salabay	s̪ ʌ l̪ a b a ɪ̯
salabotan	s̪ ʌ l̪ ʌ b o t̪ ʌ n̪
salag	s̪ a l̪ ʌ ɡ
salampati	s̪ ʌ l̪ ʌ m p a t̪ ɪ
salan	s̪ ʌ l̪ a n̪
salapi	s̪ ʌ l̪ ʌ p i ʔ
salazar	s̪ ʌ l̪ ʌ s̪ a ɾ̪
salcedo	s̪ ʌ l̪ s̪ i d̪ ɔ
salida	s̪ ʌ l̪ i d̪ ʌ
salikwaot	s̪ ʌ l̪ ɪ k w ʌ ʔ o t̪
salimbagat	s̪ ʌ l̪ ɪ m b a ɡ ʌ t̪
salinas	s̪ ʌ l̪ i n̪ ʌ s̪
salir	s̪ ʌ l̪ i ɾ̪
salog	s̪ a l̪ ɔ ɡ
salog	s̪ ʌ l̪ o ɡ
salom	s̪ a l̪ ɔ m
saluwal	s̪ ʌ l̪ u ʌ l̪
salvador	s̪ ʌ l̪ b ʌ d̪ o ɾ̪
samad	s̪ a m ʌ d̪
samar	s̪ a m ʌ ɾ̪
samarnon	s̪ ʌ m ʌ ɾ̪ n̪ o n̪
sambag	s̪ ʌ m b a ɡ
samin	s̪ ʌ m i n̪
sampay	s̪ ʌ m p a ɪ̯
sampot	s̪ ʌ m p o t̪
sampurado	s̪ ʌ m p ʊ ɾ̪ a d̪ ɔ
samsam	s̪ ʌ m s̪ a m
samsuy	s̪ a m s̪ ʊ ɪ
sanag	s̪ ʌ n̪ a ɡ
sanchez	s̪ a n̪ t̪ s̪ ɪ s̪
sandayong	s̪ ʌ n̪ d̪ ʌ j o ŋ
sandiya	s̪ ʌ n̪ d̪ i ʌ
sanga	s̪ a ŋ ʌ
sanga	s̪ ʌ ŋ a
sangay	s̪ a ŋ a ɪ̯
sanggot	s̪ ʌ ŋ ɡ o t̪
sanggumay	s̪ ʌ ŋ ɡ u m a ɪ̯
sano	s̪ a n̪ ɔ
santiago	s̪ ʌ n̪ t̪ j a ɡ ɔ
santillan	s̪ ʌ n̪ t̪ ɪ l̪ j a n̪
santilmo	s̪ ʌ n̪ t̪ i l̪ m ɔ
santol	s̪ ʌ n̪ t̪ o l̪
saong	s̪ a ʔ ɔ ŋ
sapa	s̪ a p ʌ ʔ
sapal	s̪ a p ʌ l̪
sapatos	s̪ ʌ p a t̪ ɔ s̪
satumbaga	s̪ ʌ t̪ ʊ m b a ɡ ʌ
sawa	s̪ ʌ w a
sawsaw	s̪ a ʊ̯ s̪ a ʊ̯
saya	s̪ a j ʌ
saya	s̪ ʌ j a
sayal	s̪ ʌ j a l̪
sayaw	s̪ ʌ j a ʊ̯
saybit	s̪ a ɪ̯ b i t̪
saydwok	s̪ a ɪ̯ d̪ w k
saylo	s̪ a ɪ̯ l̪ ɔ
saysay	s̪ a ɪ̯ s̪ a ɪ̯
sedula	s̪ i d̪ ʊ l̪ ʌ
segurado	s̪ ɪ ɡ ʊ ɾ̪ a d̪ ɔ
seguro	s̪ ɪ ɡ u ɾ̪ ɔ
sekondarya	s̪ ɪ k ɔ n̪ d̪ a ɾ̪ j ʌ
seksyon	s̪ ɪ k s̪ j o n̪
sekundarya	s̪ ɪ k ʊ n̪ d̪ a ɾ̪ j ʌ
selpon	s̪ i l̪ p ɔ n̪
semana	s̪ ɪ m a n̪ ʌ
sementeryo	s̪ ɪ m ɪ n̪ t̪ i ɾ̪ j ɔ
semento	s̪ ɪ m i n̪ t̪ ɔ
semester	s̪ ɪ m i s̪ t̪ ɪ ɾ̪
semilya	s̪ ɪ m i l̪ j ʌ
seno	s̪ i n̪ ɔ
sensilyo	s̪ ɪ n̪ s̪ i l̪ j ɔ
sensiyo	s̪ ɪ n̪ s̪ i j ɔ
sentido	s̪ ɪ n̪ t̪ i d̪ ɔ
septiyembre	s̪ ɪ p t̪ i m b ɾ̪ ɪ
septiyembre	s̪ ɪ p t̪ j i m b ɾ̪ ɪ
sepulturero	s̪ ɪ p ʊ l̪ t̪ ʊ ɾ̪ i ɾ̪ ɔ
serado	s̪ ɪ ɾ̪ a d̪ ɔ
serbesa	s̪ ɪ ɾ̪ b i s̪ ʌ
seremonyas	s̪ ɪ ɾ̪ ɪ m o n̪ j ʌ s̪
serye	s̪ i ɾ̪ j ɪ
setenta	s̪ ɪ t̪ i n̪ t̪ ʌ
sevilla	s̪ ɪ b i l̪ j ʌ
siaton	s̪ j a t̪ ɔ n̪
sibat	s̪ ɪ b a t̪
sibuyas	s̪ ɪ b u d͡ʒ ʌ s̪
sibuyas	s̪ ɪ b u j ʌ s̪
sibya	s̪ ɪ b j a
sidlakan	s̪ ɪ d̪ l̪ ʌ k a n̪
sigarilyo	s̪ ɪ ɡ ʌ ɾ̪ i l̪ j ɔ
sige	s̪ i ɡ ɪ
sijam	s̪ ɪ d͡ʒ a m
sikat	s̪ ɪ k a t̪
sikil	s̪ ɪ k i l̪
sikmol	s̪ ɪ k m o l̪
siko	s̪ i k ɔ
sili	s̪ i l̪ ɪ
simba	s̪ ɪ m b a
simbahan	s̪ ɪ m b a h ʌ n̪
simbajon	s̪ ɪ m b a h ɔ n̪
simbako	s̪ ɪ m b a k ɔ
simbasimba	s̪ ɪ m b a s̪ ɪ m b a
sinangote	s̪ ɪ n̪ ʌ ŋ ɡ o t̪ ɪ
sinehan	s̪ ɪ n̪ ɪ h a n̪
singin	s̪ i ŋ ɪ n̪
singking	s̪ i ŋ k ɪ ŋ
singkohan	s̪ ɪ ŋ k o h ʌ n̪
singot	s̪ ɪ ŋ o t̪
sino	s̪ i n̪ ɔ
sinumbagay	s̪ ɪ n̪ ʊ m b ʌ ɡ a ɪ̯
siomai	s̪ j o m a ɪ̯
sirado	s̪ ɪ ɾ̪ a d̪ ɔ
sirkulasyon	s̪ ɪ ɾ̪ k ʊ l̪ ʌ s̪ j o n̪
siya	s̪ i ʌ
siya	s̪ j a
siyagit	s̪ j a ɡ ɪ t̪
siyam	s̪ j a m
siyam	s̪ ɪ d͡ʒ a m
siyento	s̪ j i n̪ t̪ ɔ
siyudad	s̪ j ʊ d̪ a d̪
slogan	s̪ l̪ o ɡ ʌ n̪
solusyon	s̪ ɔ l̪ ʊ s̪ j o n̪
sosyalismo	s̪ ɔ s̪ j ʌ l̪ i s̪ m ɔ
sotto	s̪ o t̪ ɔ
suarez	s̪ w ʌ ɾ̪ ɪ s̪
suba	s̪ ʊ b a ʔ
subang	s̪ u b ʌ ŋ
subangan	s̪ ʊ b a ŋ ʌ n̪
subida	s̪ ʊ b i d̪ ʌ
suborno	s̪ ʊ b o ɾ̪ n̪ ɔ
sudlay	s̪ u d̪ l̪ a ɪ̯
sugal	s̪ ʊ ɡ a l̪
sugalan	s̪ ʊ ɡ a l̪ ʌ n̪
sugarol	s̪ ʊ ɡ ʌ ɾ̪ o l̪
sugi	s̪ u ɡ ɪ
sugibuhi	s̪ ʊ ɡ ɪ b u h ɪ ʔ
sugilagming	s̪ ʊ ɡ ɪ l̪ ʌ ɡ m i ŋ
sugilambong	s̪ ʊ ɡ ɪ l̪ ʌ m b o ŋ
sugilandong	s̪ ʊ ɡ ɪ l̪ ʌ n̪ d̪ o ŋ
sugilanon	s̪ ʊ ɡ ɪ l̪ a n̪ ɔ n̪
sugod	s̪ u ɡ ɔ d̪
suhestyon	s̪ ʊ h ɪ s̪ t̪ j o n̪
suhol	s̪ u h ɔ l̪
suholan	s̪ ʊ h o l̪ ʌ n̪
suka	s̪ u k ʌ
suka	s̪ u k ʌ ʔ
sukli	s̪ ʊ k l̪ i ʔ
suko	s̪ u k ɔ
sula	s̪ u l̪ ʌ
sulay	s̪ ʊ l̪ a ɪ̯
sulo	s̪ ʊ l̪ o ʔ
sulod	s̪ u d̪
sulod	s̪ u l̪ ɔ d̪
sulod	s̪ ʊ j o d̪
sulod	s̪ ʊ l̪ o d̪
sulog	s̪ ʊ l̪ o ɡ
sulsol	s̪ ʊ l̪ s̪ o l̪
sultaob	s̪ ʊ l̪ t̪ a ʔ ɔ b
sulu	s̪ ʊ l̪ u
sumalpong	s̪ ʊ m ʌ l̪ p o ŋ
sumbag	s̪ ʊ m b a ɡ
sundalo	s̪ ʊ n̪ d̪ a l̪ ɔ
sundalo	s̪ ʊ n̪ d̪ a w
sundang	s̪ ʊ n̪ d̪ a ŋ
sundawo	s̪ ʊ n̪ d̪ a w
sungay	s̪ u ŋ a ɪ̯
suntok	s̪ ʊ n̪ t̪ o k
suntokay	s̪ ʊ n̪ t̪ ɔ k a ɪ̯
supsop	s̪ u p s̪ ɔ p
sura	s̪ u ɾ̪ ʌ
suroy	s̪ u ɾ̪ o ɪ̯
susi	s̪ u s̪ ɪ
suspek	s̪ u s̪ p ɪ k
sutil	s̪ ʊ t̪ i l̪
sutukil	s̪ ʊ t̪ ʊ k i l̪
suway	s̪ w a ɪ̯
suweldo	s̪ w i l̪ d̪ ɔ
suwerte	s̪ w i ɾ̪ t̪ ɪ
suya	s̪ u j ʌ ʔ
suyak	s̪ u j ʌ k
suyakan	s̪ ʊ j a k ʌ n̪
swapang	s̪ w ʌ p ʌ ŋ
ta	t̪ a
taas	t̪ a ʔ ʌ s̪
taas	t̪ ʌ ʔ a s̪
tabako	t̪ ʌ b a k ɔ ʔ
tabako	t̪ ʌ b ʌ k o ʔ
tabang	t̪ a b ʌ ŋ
tabay	t̪ a b a ɪ̯
tabilawan	t̪ ʌ b ɪ l̪ a w ʌ n̪
tabili	t̪ ʌ b ɪ l̪ i
tabilikod	t̪ ʌ b ɪ l̪ ɪ k o d̪
tabliya	t̪ ʌ b l̪ i ʌ
tabunok	t̪ ʌ b u n̪ ɔ k
tadtad	t̪ a d̪ t̪ ʌ d̪
taga	t̪ a ɡ ʌ
taga	t̪ ʌ ɡ a
taga	t̪ ʌ ɡ a ʔ
tagabukid	t̪ ʌ ɡ ʌ b u k ɪ d̪
tagad	t̪ ʌ ɡ a d̪
tagaw	t̪ ʌ ɡ a ʊ̯
tagay	t̪ a ɡ a ɪ̯
tagbo	t̪ ʌ ɡ b o ʔ
taghoy	t̪ ʌ ɡ h o j
tagna	t̪ a ɡ n̪ ʌ ʔ
tagohipos	t̪ ʌ ɡ ɔ h i p ɔ s̪
tagok	t̪ ʌ ɡ o k
tahap	t̪ a h ʌ p
tahi	t̪ ʌ h i ʔ
taho	t̪ ʌ h o ʔ
tahom	t̪ ʌ h o m
tahop	t̪ a h ɔ p
tai	t̪ a ʔ ɪ
takdol	t̪ a k d̪ ɔ l̪
takig	t̪ a k ɪ ɡ
takilya	t̪ ʌ k i l̪ j ʌ
taklob	t̪ ʌ k l̪ o b
tako	t̪ a k ɔ ʔ
takob	t̪ ʌ ŋ k o b
takwal	t̪ ʌ k w a l̪
talaba	t̪ ʌ l̪ ʌ b a
talamban	t̪ ʌ l̪ ʌ m b a n̪
talaw	t̪ a l̪ a ʊ̯
talawan	t̪ ʌ l̪ a w ʌ n̪
talay	t̪ ʌ l̪ a ɪ̯
tali	t̪ a l̪ ɪ
tali	t̪ a l̪ ɪ ʔ
talibong	t̪ ʌ l̪ ɪ b o ŋ
talong	t̪ ʌ l̪ o ŋ
talong	t̪ ʌ w o ŋ
taludtod	t̪ ʌ l̪ u d̪ t̪ ɔ d̪
talya	t̪ a l̪ j ʌ
talyo	t̪ a l̪ j ɔ
tambaloslos	t̪ ʌ m b ʌ l̪ o s̪ l̪ ɔ s̪
tambis	t̪ a m b ɪ s̪
taming	t ɐ m i ŋ
tampohay	t̪ ʌ m p o h a ɪ̯
tampos	t̪ ʌ m p o s̪
tampus	t̪ ʌ m p u s̪
tamsi	t̪ ʌ m s̪ i
tanan	t̪ ʌ n̪ a n̪
taneo	t̪ ʌ n̪ i ɔ
tangad	t̪ ʌ ŋ a d̪
tanggal	t̪ ʌ ŋ ɡ a l̪
tanggo	t̪ a ŋ ɡ ɔ
tangis	t̪ a ŋ ɪ s̪
tangke	t̪ ʌ ŋ k i
tangkil	t̪ ʌ ŋ k i l̪
tangkilepono	t̪ ʌ ŋ k ɪ l̪ i p ɔ n̪ ɔ
tangkop	t̪ ʌ ŋ k o p
tangkugo	t̪ ʌ ŋ k u ɡ ɔ ʔ
tanglad	t̪ ʌ ŋ l̪ a d̪
tanlag	t̪ ʌ n̪ l̪ a ɡ
tanod	t̪ a n̪ ɔ d̪
tanom	t̪ ʌ n̪ o m
tanos	t̪ a n̪ ɔ s̪
tansan	t̪ a n̪ s̪ ʌ n̪
taob	t̪ ʌ ʔ o b
taop	t̪ a ɔ p
tapay	t̪ a p a ɪ̯
tapayan	t̪ ʌ p a j ʌ n̪
tapol	t̪ ʌ p o l̪
tapolan	t̪ ʌ p ɔ l̪ a n̪
tapos	t̪ a p ɔ s̪
target	t̪ a ɾ̪ ɡ ɪ t̪
tariktik	t̪ ʌ ɾ̪ i k t̪ ɪ k
tasa	t̪ a s̪ ʌ
tata	t̪ a t̪ ʌ
tata	t̪ a t̪ ʌ ʔ
tata	t̪ ʌ t̪ a
taudtaod	t̪ ʌ ʔ u d̪ t̪ ʌ ʔ o d̪
tawa	t̪ ʌ w a
tawag	t̪ a w ʌ ɡ
tawas	t̪ a w ʌ s̪
tawo	t̪ a w
tawong	t̪ ʌ w o ŋ
taya	t̪ ʌ j a ʔ
taytay	t̪ a ɪ̯ t̪ a ɪ̯
telepono	t̪ ɪ l̪ i p ɔ n̪ ɔ
teleponokabildo	t̪ ɪ l̪ i p ɔ n̪ ɔ k ʌ b i l̪ d̪ ɔ
templado	t̪ ɪ m p l̪ a d̪ ɔ
tenyente	t̪ ɪ n̪ j i n̪ t̪ ɪ
termino	t̪ i ɾ̪ m ɪ n̪ o
tesawro	t̪ ɪ s̪ a ʊ̯ ɾ̪ ɔ
tetanos	t̪ i t̪ ʌ n̪ o s̪
tigbak	t̪ ɪ ɡ b a k
tigdumala	t̪ ɪ ɡ d̪ ʊ m a l̪ ʌ
tigidig	t̪ ɪ ɡ ɪ d̪ i ɡ
tikangkang	t̪ ɪ k ʌ ŋ k a ŋ
tiket	t̪ i k ɪ t̪
tiklo	t̪ ɪ k l̪ o ʔ
tikoy	t̪ i k o ɪ̯
tilaok	t̪ ɪ l̪ a ʔ ɔ k
tilapya	t̪ ɪ l̪ a p j ʌ
tilok	t̪ i l̪ ɔ k
timbang	t̪ i m b ʌ ŋ
timbangan	t̪ ɪ m b a ŋ ʌ n̪
timonel	t̪ ɪ m ɔ n̪ i l̪
timonero	t̪ ɪ m ɔ n̪ i ɾ̪ ɔ
timoteo	t̪ i m ɔ t̪ i ɔ
tinagalog	t̪ ɪ n̪ ʌ ɡ a l̪ ɔ ɡ
tinagdan	t̪ ɪ n̪ ʌ ɡ d̪ a n̪
tinapay	t̪ ɪ n̪ a p a ɪ̯
tinda	t̪ i n̪ d̪ ʌ
tindak	t̪ i n̪ d̪ ʌ k
tindera	t̪ ɪ n̪ d̪ i ɾ̪ ʌ
tindero	t̪ ɪ n̪ d̪ i ɾ̪ ɔ
tindog	t̪ ɪ n̪ d̪ o ɡ
tinemplahan	t̪ ɪ n̪ ɪ m p l̪ ʌ h a n̪
tingali	t̪ ɪ ŋ a l̪ ɪ
tingkagol	t̪ ɪ ŋ k a ɡ ɔ l̪
tingkoy	t̪ ɪ ŋ k o j
tinuhoan	t̪ ɪ n̪ ʊ h o ʔ ʌ n̪
tipasi	t̪ ɪ p a s̪ ɪ ʔ
tipoy	t̪ ɪ p o j
tirada	t̪ ɪ ɾ̪ a d̪ ʌ
tirador	t̪ ɪ ɾ̪ ʌ d̪ o ɾ̪
tisoy	t̪ ɪ s̪ o j
titser	t̪ i t͡s ɪ ɾ̪
titulo	t̪ i t̪ ʊ l̪ o
tiya	t̪ i ʌ
tiyan	t̪ j a n̪
tiyo	t̪ i j ɔ
tokaya	t̪ ɔ k a j ʌ
tokayo	t̪ ɔ k a j ɔ
tokhang	t̪ ɔ k h a ŋ
toledo	t̪ ɔ l̪ i d̪ ɔ
toledohanon	t̪ ɔ l̪ ɪ d̪ ɔ h a n̪ ɔ n̪
toma	t̪ o m ʌ ʔ
tomas	t̪ ɔ m a s̪
tomboy	t̪ o m b o ɪ̯
tono	t̪ o n̪ ɔ
torero	t̪ ɔ ɾ̪ i ɾ̪ ɔ
torres	t̪ o ɾ̪ ɪ s̪
trabaho	t̪ ɾ̪ ʌ b a h ɔ
trangka	t̪ ɾ̪ a ŋ k ʌ
trangkaso	t̪ ɾ̪ ʌ ŋ k a s̪ ɔ
trapik	t̪ ɾ̪ a p ɪ k
trapiko	t̪ ɾ̪ a p ɪ k o
trato	t̪ ɾ̪ a t̪ ɔ
trayanggulo	t̪ ɾ̪ ʌ j a ŋ ɡ ʊ l̪ ɔ
traynta	t̪ ɾ̪ a ɪ̯ n̪ t̪ ʌ
trisikad	t̪ ɾ̪ ɪ s̪ i k ʌ d̪
trono	t̪ ɾ̪ o n̪ ɔ
troso	t̪ ɾ̪ o s̪ ɔ
tsampurado	t̪ s̪ ʌ m p ʊ ɾ̪ a d̪ ɔ
tsinelas	t̪ s̪ ɪ n̪ i l̪ ʌ s̪
tsismis	t̪ s̪ i s̪ m ɪ s̪
tsismosa	t̪ s̪ ɪ s̪ m o s̪ ʌ
tsismoso	t̪ s̪ ɪ s̪ m o s̪ ɔ
tsunami	t̪ s̪ ʊ n̪ a m ɪ
tuberkulosis	t̪ ʊ b ɪ ɾ̪ k ʊ l̪ o s̪ ɪ s̪
tubig	t̪ u b ɪ ɡ
tubo	t̪ u b ɔ
tubo	t̪ u b ɔ ʔ
tubo	t̪ ʊ b o
tubol	t̪ ʊ b o l̪
tudtod	t̪ u d̪ t̪ ɔ d̪
tugas	t̪ ʊ ɡ a s̪
tugon	t̪ ʊ ɡ o n̪
tugot	t̪ u ɡ ɔ t̪
tugpahanan	t̪ ʊ ɡ p ʌ h a n̪ ʌ n̪
tuhod	t̪ u h ɔ d̪
tuig	t̪ u ʔ ɪ ɡ
tuka	t̪ ʊ k a ʔ
tukaw	t̪ ʊ k a ʊ̯
tuko	t̪ ʊ k o ʔ
tukoy	t̪ u k o ɪ̯
tuktok	t̪ u k t̪ ɔ k
tuktugaok	t̪ ʊ k t̪ ʊ ɡ a ʔ ɔ k
tulay	t̪ ʊ l̪ a ɪ̯
tuli	t̪ u l̪ ɪ ʔ
tulis	t̪ u l̪ ɪ s̪
tulisan	t̪ ʊ l̪ ɪ s̪ a n̪
tulo	t̪ u l̪ ɔ ʔ
tulo	t̪ ʊ l̪ o
tulo	t̪ ʊ l̪ o ʔ
tulod	t̪ ʊ l̪ o d̪
tulog	t̪ u l̪ ɔ ɡ
tulong	t̪ u l̪ ɔ ŋ
tuman	t̪ u m ʌ n̪
tumpag	t̪ ʊ m p a ɡ
tumulak	t̪ ʊ m u l̪ ʌ k
tunaw	t̪ u n̪ a ʊ̯
tunay	t̪ u n̪ a ɪ̯
tunga	t̪ ʊ ŋ a ʔ
tungod	t̪ u ŋ ɔ d̪
tunok	t̪ ʊ n̪ o k
tunsoy	t̪ ʊ n̪ s̪ o j
tuo	t̪ u ʔ ɔ
tuo	t̪ ʊ ʔ o
tuod	t̪ u ʔ ɔ d̪
tuohon	t̪ ʊ ʔ o h ɔ n̪
tuok	t̪ ʊ ʔ o k
tuon	t̪ ʊ ʔ o n̪
tupad	t̪ ʊ p a d̪
turismo	t̪ ʊ ɾ̪ i s̪ m ɔ
turutot	t̪ ʊ ɾ̪ u t̪ ɔ t̪
tusok	t̪ u s̪ ɔ k
tutoy	t̪ u t̪ o ɪ̯
tuwerka	t̪ w i ɾ̪ k ʌ
tuyo	t̪ u j ɔ
tuñacao	t̪ ʊ ɲ ʌ k a ʊ̯
twerka	t̪ w ɪ ɾ̪ k ʌ
ubalde	ʔ ʊ b a l̪ d̪ ɪ
ubi	ʔ u b ɪ
ubo	ʔ ʊ b o
udong	ʔ u d̪ ɔ ŋ
udto	ʔ ʊ d̪ t̪ o
ugaling	ʔ ʊ ɡ a l̪ ɪ ŋ
ugat	ʔ ʊ ɡ a t̪
ugay	ʔ u ɡ a ɪ̯
ugdo	ʔ ʊ ɡ d̪ o
ugis	ʔ u ɡ ɪ s̪
ugma	ʔ ʊ ɡ m a ʔ
uhong	ʔ u h ɔ ŋ
ulan	ʔ ʊ a n̪
ulan	ʔ ʊ l̪ a n̪
ulang	ʔ ʊ l̪ a ŋ
ulaw	ʔ u a ʊ̯
ulaw	ʔ u d͡ʒ a ʊ̯
ulaw	ʔ u j a ʊ̯
ulaw	ʔ u l̪ a ʊ̯
ulayan	ʔ ʊ l̪ a j ʌ n̪
uli	ʔ u l̪ ɪ ʔ
uling	ʔ u l̪ ɪ ŋ
ulipon	ʔ ʊ l̪ i p ɔ n̪
ulo	ʔ u l̪ ɔ
ulod	ʔ u l̪ ɔ d̪
ulok	ʔ ʊ l̪ o k
ulon	ʔ ʊ l̪ o n̪
ulonan	ʔ ʊ l̪ o n̪ ʌ n̪
umagad	ʔ ʊ m a ɡ ʌ d̪
umang	ʔ ʊ m a ŋ
umog	ʔ ʊ m o ɡ
umpad	ʔ u m p ʌ d̪
unabia	ʔ ʊ n̪ a b j ʌ
unano	ʔ ʊ n̪ a n̪ ɔ ʔ
ungo	ʔ u ŋ ɔ ʔ
ungol	ʔ u ŋ ɔ l̪
ungol	ʔ ʊ ŋ o l̪
unibersidad	ʔ ʊ n̪ ɪ b ɪ ɾ̪ s̪ ɪ d̪ a d̪
unlan	ʔ ʊ n̪ l̪ a n̪
unom	ʔ ʊ n̪ o m
unsa	ʔ ʊ n̪ s̪ a
unya	ʔ ʊ n̪ j a ʔ
unyon	ʔ ʊ n̪ j o n̪
upas	ʔ u p ʌ s̪
upas	ʔ ʊ p a s̪
upat	ʔ ʊ p a t̪
upaw	ʔ u p a ʊ̯
upo	ʔ u p ɔ
usa	ʔ ʊ s̪ a
usap	ʔ u s̪ ʌ p
uswag	ʔ u s̪ w ʌ ɡ
uswag	ʔ ʊ s̪ w a ɡ
utan	ʔ u t̪ ʌ n̪
utang	ʔ u t̪ ʌ ŋ
utangan	ʔ ʊ t̪ ʌ ŋ a n̪
utanon	ʔ ʊ t̪ ʌ n̪ o n̪
utin	ʔ u t̪ ɪ n̪
utog	ʔ ʊ t̪ o ɡ
utok	ʔ u t̪ ɔ k
utong	ʔ ʊ t̪ o ŋ
utot	ʔ ʊ t̪ o t̪
uwak	ʔ ʊ a k
uwang	ʔ ʊ a ŋ
uyab	ʔ u j ʌ b
uyab	ʔ ʊ j a b
uyon	ʔ u j ɔ n̪
vasquez	b a s̪ k ɪ s̪
velasquez	b ɪ l̪ a s̪ k ɪ s̪
villafuerte	b i l̪ j ʌ p w i ɾ̪ t̪ ɪ
villanueva	b ɪ l̪ j ʌ n̪ w i b ʌ
wagas	w ʌ ɡ a s̪
wala	w ʌ l̪ a
wala	w ʌ l̪ a ʔ
walay	w a ɪ̯
walay	w ʌ l̪ a ɪ̯
walo	w ʌ l̪ o
walo	w ʌ w o
walog	w a l̪ ɔ ɡ
wangwang	w a ŋ w ʌ ŋ
wawog	w a w ɡ
way	w a ɪ̯
yamis	j a m ɪ s̪
yapyap	j a p j a p
yarda	j a ɾ̪ d̪ ʌ
yate	j a t̪ ɪ
yawa	d͡ʒ a w ʌ ʔ
yawa	j a w ʌ ʔ
yaya	j a j ʌ
yaya	j a ʔ j ʌ ʔ
yayong	j a j ɔ ŋ
yañez	j a ɲ ɪ s̪
ybañez	ʔ ɪ b a ɲ ɪ s̪
ylaya	ʔ ɪ l̪ a j ʌ ʔ
yoyoy	j o j o ɪ̯
zamora	s̪ ʌ m o ɾ̪ ʌ
