šmꜥ	ʃ ɛ m ɑː
šmꜥw	ʃ ɛ m ɑː uː
šmꜥyt	ʃ ɛ m ɑː iː t
šn	ʃ eː n
šn	ʃ uː n V j
šn	ʃ uː n ə
šn	ʃ ɛ n
šnbt	ʃ ɛ n b ɛ t
šnft	j
šnft	n
šnft	ʃ e n f a
šnft	ʃ e n f ə
šnft	ʃ i n f V t
šnft	ʃ i n f V ʔ
šnft	ʃ ɛ n f ɛ t
šnj	ʃ iː n a
šnj	ʃ iː n i t
šnj	ʃ iː n i ʔ
šnj	ʃ iː n ə
šnj	ʃ ɛ n i
šns	ʃ ɛ n ɛ s
šntt	ʃ ɛ n t ɛ t
šnw	ʃ V n u w
šnw	ʃ ə n u ʔ
šnw	ʃ ə n ø ʔ
šnw	ʃ ɛ n uː
šnwt	ʃ ɛ n uː t
šnḏwt	ʃ ɛ n d͡ʒ uː t
šnṯ	ʃ ɛ n ɛ t͡ʃ
šnꜥ	ʃ ɛ n ɑː
šnꜥtj	ʃ ɛ n ɑː t i
šnꜥw	ʃ ɛ n ɑː uː
šps	ʃ ɛ p ɛ s
špsj	ʃ e p s a
špsj	ʃ e p s ə
špsj	ʃ i p s i t
špsj	ʃ i p s i ʔ
špsj	ʃ ɛ p ɛ s i
špss	ʃ ɛ p s ɛ s
špssw	ʃ ɛ p s ɛ s uː
špst	ʃ e p s a
špst	ʃ e p s ə
špst	ʃ i p s a t
špst	ʃ i p s a ʔ
špst	ʃ ɛ p s ɛ t
špꜣ	ʃ ɛ p ɑ
šr	ʃ eː ɾ ə
šr	ʃ uː ɾ i j
šr	ʃ uː ɾ ə
šr	ʃ ɛ r
šrr	ʃ a ɾ a ɾ
šrr	ʃ a ɾ a ʔ
šrr	ʃ ə ɾ a ʔ
šrr	ʃ ɛ r ɛ r
šrt	ʃ ɛ r ɛ t
šs	ʃ ɛ s
šsm	ʃ ɛ s ɛ m
šsp	ʃ ɛ s ɛ p
šsr	ʃ ɛ s ɛ r
šsꜣ	ʃ ɛ s ɑ
šsꜣw	ʃ ɛ s ɑ uː
št	ʃ e ʔ
št	ʃ i t
št	ʃ i ʔ
št	ʃ ɛ t
štj	ʃ ɛ t i
štjw	ʃ ɛ t i uː
štw	ʃ ɛ t uː
štꜣ	ʃ ɛ t ɑ
štꜣw	ʃ ɛ t ɑ uː
šw	ʃ uː
šwj	ʃ uː i
šwt	ʃ uː t
šww	ʃ uː ʔ uː
šwꜣw	ʃ uː ɑ uː
šzp	ʃ aː p
šzp	ʃ aː z a p
šzp	ʃ oː p
šzp	ʃ ɛ z ɛ p
šzpt	ʃ ɛ z p ɛ t
šzpw	ʃ ɛ z p uː
ššy	ʃ ɛ ʃ iː
šꜣ	ʃ ɑ
šꜣbw	ʃ ɑ b uː
šꜣbꜣkꜣ	ʃ ɑ b ɑ k ɑ
šꜣbꜣtꜣkꜣ	ʃ ɑ b ɑ t ɑ k ɑ
šꜣd	ʃ ɑ d
šꜣq	ʃ ɑ k
šꜣqb	ʃ ɑ k ɛ b
šꜣqw	ʃ ɑ k uː
šꜣrm	ʃ ɑ r ɛ m
šꜣrḥꜣnꜣ	ʃ ɑ r h ɑ n ɑ
šꜣs	ʃ ɑ s
šꜣsw	ʃ ɑ s uː
šꜣt	ʃ ɑ t
šꜣwꜣbtj	ʃ ɑ uː ɑ b t i
šꜣšꜣnq	ʃ ɑ ʃ ɑ n ɛ k
šꜣꜥ	ʃ a ʀ a ʕ
šꜣꜥ	ʃ a ʕ
šꜣꜥ	ʃ ɑ ʔ ɑː
šꜣꜥ	ʃ ə a ʕ
šꜥ	ʃ ɑː
šꜥd	ʃ ɑː d
šꜥt	ʃ eː ʕ a
šꜥt	ʃ eː ʕ ə
šꜥt	ʃ iː ʕ V t
šꜥt	ʃ iː ʕ V ʔ
šꜥt	ʃ ɑː t
šꜥwt	ʃ ɑː uː t
šꜥy	ʃ aː ʕ V j
šꜥy	ʃ aː ʕ ə
šꜥy	ʃ oː ʕ
šꜥy	ʃ ɑː iː
ḏbt	cʼ aː b V t
ḏbt	d͡ʒ ɛ b ɛ t
ḏbt	tʼ aː b V ʔ
ḏbt	tʼ aː b a
ḏbt	tʼ oː β ə
ḏbꜣ	cʼ aː b a ʀ
ḏbꜣ	d͡ʒ ɛ b ɑ
ḏbꜣ	tʼ aː b a ʀ
ḏbꜣ	tʼ aː b ə ʕ
ḏbꜣ	tʼ oː β ə ʕ
ḏbꜣ	ʕ
ḏbꜣt	d͡ʒ ɛ b ɑ t
ḏbꜣw	d͡ʒ ɛ b ɑ uː
ḏbꜥ	cʼ a b a ʕ
ḏbꜥ	cʼ aː b a ʕ
ḏbꜥ	cʼ uː b a ʕ
ḏbꜥ	d͡ʒ ɛ b ɑː
ḏbꜥ	tʼ a b a ʕ
ḏbꜥ	tʼ aː b a ʕ
ḏbꜥ	tʼ aː b ə ʕ
ḏbꜥ	tʼ eː β ə ʕ
ḏbꜥ	tʼ oː β ə ʕ
ḏbꜥ	tʼ uː b a ʕ
ḏbꜥ	tʼ uː b ə ʕ
ḏbꜥ	tʼ ə b a ʕ
ḏbꜥ	tʼ ə β a ʕ
ḏbꜥw	d͡ʒ ɛ b ɑː uː
ḏbꜥwt	d͡ʒ ɛ b ɑː uː t
ḏd	cʼ aː tʼ
ḏd	cʼ i tʼ n u
ḏd	d͡ʒ ɛ d
ḏd	t
ḏd	tʼ
ḏd	t͡ʃʼ aː ʔ
ḏd	t͡ʃʼ oː ʔ
ḏd	ʔ
ḏdb	d͡ʒ ɛ d ɛ b
ḏdft	d͡ʒ ɛ d f ɛ t
ḏdj	d͡ʒ ɛ d i
ḏdw	d͡ʒ ɛ d uː
ḏdꜣ	d͡ʒ ɛ d ɑ
ḏfd	d͡ʒ ɛ f ɛ d
ḏfḏ	d͡ʒ ɛ f ɛ d͡ʒ
ḏfꜣ	d͡ʒ ɛ f ɑ
ḏmꜥ	cʼ aː m i ʕ
ḏmꜥ	d͡ʒ ɛ m ɑː
ḏmꜥ	t͡ʃʼ aː m i ʕ
ḏmꜥ	t͡ʃʼ aː m ə ʕ
ḏmꜥ	t͡ʃʼ oː m ə ʕ
ḏnb	d͡ʒ ɛ n ɛ b
ḏnd	d͡ʒ ɛ n ɛ d
ḏnjt	d͡ʒ ɛ n i t
ḏnnt	d͡ʒ ɛ n ɛ n ɛ t
ḏnḥ	cʼ uː n V ħ
ḏnḥ	d͡ʒ ɛ n ɛ h
ḏnḥ	tʼ eː n ə ħ
ḏnḥ	tʼ uː n V ħ
ḏnḥ	tʼ uː n ə ħ
ḏr	d͡ʒ ɛ r
ḏrj	d͡ʒ ɛ r i
ḏrt	cʼ aː ɾ a t
ḏrt	d͡ʒ ɛ r ɛ t
ḏrt	tʼ aː ɾ a
ḏrt	tʼ aː ɾ a ʔ
ḏrt	tʼ oː ɾ ə
ḏrtj	d͡ʒ ɛ r t i
ḏrtjw	d͡ʒ ɛ r t i uː
ḏrw	d͡ʒ ɛ r uː
ḏryt	d͡ʒ ɛ r iː t
ḏrḏr	d͡ʒ ɛ r d͡ʒ ɛ r
ḏs	d͡ʒ ɛ s
ḏsr	d͡ʒ ɛ s ɛ r
ḏsrt	d͡ʒ ɛ s r ɛ t
ḏt	d͡ʒ ɛ t
ḏt	t͡ʃʼ a j t
ḏw	cʼ a w
ḏw	d͡ʒ uː
ḏw	tʼ a w
ḏwj	d͡ʒ uː i
ḏwjw	d͡ʒ uː i uː
ḏws	d͡ʒ uː s
ḏwt	d͡ʒ uː t
ḏḥwtj	cʼ V ħ a w t i j
ḏḥwtj	d͡ʒ ɛ h uː t i
ḏḥwtj	tʼ V ħ a w t i j
ḏḥwtj	tʼ ə ħ a w t
ḏḥwtj	tʼ ə ħ a w t ə
ḏḥwtt	cʼ V ħ a w t a t
ḏḥwtt	d͡ʒ ɛ h uː t ɛ t
ḏḥwtt	tʼ V ħ a w t a ʔ
ḏḥwtt	tʼ ə ħ a w t a
ḏḥwtt	tʼ ə ħ a w t ə
ḏḥꜥ	d͡ʒ ɛ h ɑː
ḏꜣ	d͡ʒ ɑ
ḏꜣdw	d͡ʒ ɑ d uː
ḏꜣf	cʼ aː ʀ a f
ḏꜣf	d͡ʒ ɑ f
ḏꜣf	t͡ʃʼ aː ʀ a f
ḏꜣf	t͡ʃʼ aː ʔ ə f
ḏꜣf	t͡ʃʼ oː ʔ ə f
ḏꜣhꜣ	d͡ʒ ɑ h ɑ
ḏꜣj	d͡ʒ ɑ i
ḏꜣjs	d͡ʒ ɑ i s
ḏꜣm	d͡ʒ ɑ m
ḏꜣr	d͡ʒ ɑ r
ḏꜣt	d͡ʒ ɑ t
ḏꜣtt	d͡ʒ ɑ t ɛ t
ḏꜣyt	d͡ʒ ɑ iː t
ḏꜣyw	d͡ʒ ɑ iː uː
ḏꜣḏꜣ	cʼ a ʀ cʼ a ʀ
ḏꜣḏꜣ	d͡ʒ ɑ d͡ʒ ɑ
ḏꜣḏꜣ	t͡ʃʼ a ʀ t͡ʃʼ a ʀ
ḏꜣḏꜣ	t͡ʃʼ aː t͡ʃʼ ə
ḏꜣḏꜣ	t͡ʃʼ oː t͡ʃʼ
ḏꜣḏꜣt	d͡ʒ ɑ d͡ʒ ɑ t
ḏꜣḏꜣw	d͡ʒ ɑ d͡ʒ ɑ uː
ḏꜥ	d͡ʒ ɑː
ḏꜥm	d͡ʒ ɑː m
ḏꜥnt	cʼ u ʕ n a t
ḏꜥnt	d͡ʒ ɑː n ɛ t
ḏꜥnt	t͡ʃʼ u ʕ n a
ḏꜥnt	t͡ʃʼ u ʕ n a ʔ
ḏꜥnt	t͡ʃʼ ø ʕ n ə
ḏꜥr	d͡ʒ ɑː r
ḥbbt	h ɛ b ɛ b ɛ t
ḥbnnwt	h ɛ b n ɛ n uː t
ḥbs	h ɛ b ɛ s
ḥbs	ħ a b a s
ḥbs	ħ aː b a s
ḥbs	ħ aː b ə s
ḥbs	ħ oː β ə s
ḥbs	ħ ə b a s
ḥbs	ħ ə β a s
ḥbsw	h ɛ b ɛ s uː
ḥbswt	h ɛ b s uː t
ḥbsyt	h ɛ b s iː t
ḥbw	h ɛ b uː
ḥbꜣbꜣ	h ɛ b ɑ b ɑ
ḥdb	h ɛ d ɛ b
ḥfn	h ɛ f ɛ n
ḥfꜣt	h ɛ f ɑ t
ḥfꜣt	ħ a f aː ʀ a t
ḥfꜣt	ħ a f aː ʀ a ʔ
ḥfꜣt	ħ ə f aː ʔ ə
ḥfꜣt	ħ ə f oː ʔ
ḥfꜣw	h ɛ f ɑ uː
ḥfꜣw	ħ a f
ḥfꜣw	ħ a f ə
ḥfꜣw	ħ a f ʀ a w
ḥfꜣw	ħ a f ʀ aː w a w
ḥfꜣw	ħ ə f aː j ə
ḥfꜣw	ħ ə f oː j
ḥjp	h i p
ḥjpt	h i p ɛ t
ḥkn	h ɛ k ɛ n
ḥknw	h ɛ k ɛ n uː
ḥkꜣ	h ɛ k ɑ
ḥm	h ɛ m
ḥmj	h ɛ m i
ḥmsj	h ɛ m ɛ s i
ḥmsj	ħ e m s a
ḥmsj	ħ e m s ə
ḥmsj	ħ i m s i t
ḥmsj	ħ i m s i ʔ
ḥmt	h ɛ m ɛ t
ḥmt	ħ i j a m w a t
ḥmt	ħ i j a m w a ʔ
ḥmt	ħ iː m a
ḥmt	ħ iː m a t
ḥmt	ħ iː m a ʔ
ḥmt	ħ iː m ə
ḥmt	ħ ə j a m w a
ḥmt	ħ ə j a m w ə
ḥmw	h ɛ m uː
ḥmw	ħ V m u w
ḥmw	ħ ə m u ʔ
ḥmw	ħ ə m ø ʔ
ḥmwt	h ɛ m uː t
ḥmww	h ɛ m uː ʔ uː
ḥmy	h ɛ m iː
ḥmꜣt	h ɛ m ɑ t
ḥn	h ɛ n
ḥnj	h ɛ n i
ḥnk	h ɛ n ɛ k
ḥnk	ħ aː n a k
ḥnk	ħ aː n ə k
ḥnk	ħ oː n ə k
ḥnkt	h ɛ n k ɛ t
ḥnkyt	h ɛ n k iː t
ḥnmmt	h ɛ n m ɛ m ɛ t
ḥnmnm	h ɛ n ɛ m n ɛ m
ḥnn	h ɛ n ɛ n
ḥnqt	h ɛ n k ɛ t
ḥns	h ɛ n ɛ s
ḥnt	h ɛ n ɛ t
ḥntj	h ɛ n t i
ḥntꜣsw	h ɛ n t ɑ s uː
ḥntꜣsw	ħ V n t a ʀ s V w
ḥntꜣsw	ħ ə n t aː s ə
ḥntꜣsw	ħ ə n t oː s
ḥnw	h ɛ n uː
ḥnw	ħ ə n e w
ḥnwt	h ɛ n uː t
ḥnzk	h ɛ n z ɛ k
ḥnzkt	h ɛ n z ɛ k ɛ t
ḥnꜥ	h ɛ n ɑː
ḥnꜥj	h ɛ n ɑː i
ḥnꜥw	h ɛ n ɑː uː
ḥp	h ɛ p
ḥp	ħ u j p V w
ḥp	ħ u ʔ p ə
ḥp	ħ ø ʔ p
ḥpt	h ɛ p ɛ t
ḥpy	h ɛ p iː
ḥqr	h ɛ k ɛ r
ḥqr	ħ a qʼ a ɾ
ḥqr	ħ a qʼ a ʔ
ḥqr	ħ ə qʼ a ʔ
ḥqt	h ɛ k ɛ t
ḥqꜣ	h ɛ k ɑ
ḥqꜣt	h ɛ k ɑ t
ḥr	h ɛ r
ḥr	ħ a ɾ
ḥr	ħ a ʔ
ḥr	ħ aː ɾ u w
ḥr	ħ aː ɾ ə
ḥr	ħ oː ɾ
ḥrj	h ɛ r i
ḥrj	ħ a ɾ i j
ḥrj	ħ ə ɾ e j
ḥrrt	h ɛ r ɛ r ɛ t
ḥrrt	ħ V ɾ uː ɾ a t
ḥrrt	ħ V ɾ uː ɾ a ʔ
ḥrrt	ħ ə ɾ eː ɾ ə
ḥrrt	ħ ə ɾ uː ɾ a
ḥrt	h ɛ r ɛ t
ḥrtj	h ɛ r t i
ḥs	h ɛ s
ḥsb	h ɛ s ɛ b
ḥsbwt	h ɛ s b uː t
ḥsj	h ɛ s i
ḥsq	h ɛ s ɛ k
ḥtj	h ɛ t i
ḥtm	h ɛ t ɛ m
ḥtp	h o t ɛ p
ḥtp	h ɛ t ɛ p
ḥtp	ħ aː t i p
ḥtp	ħ aː t ə p
ḥtp	ħ oː t ə p
ḥtpt	h ɛ t ɛ p ɛ t
ḥtpw	h ɛ t ɛ p uː
ḥtpw	ħ a t p a w
ḥtpw	ħ a ʔ p
ḥtpw	ħ a ʔ p a w
ḥtpw	ħ a ʔ p ə
ḥtpwt	h ɛ t ɛ p uː t
ḥtrj	h ɛ t r i
ḥtrw	h ɛ t ɛ r uː
ḥts	h ɛ t ɛ s
ḥtt	h ɛ t ɛ t
ḥtyt	h ɛ t iː t
ḥw	h uː
ḥwj	h uː i
ḥwn	h uː n
ḥwnj	h uː n i
ḥwnt	h uː n ɛ t
ḥwrw	h uː r uː
ḥwt	h uː t
ḥwt	ħ aː j i ʔ
ḥwt	ħ aː w i t
ḥwt	ħ aː ʔ ə
ḥwt	ħ oː ʔ
ḥww	h uː ʔ uː
ḥwḏꜣr	h uː d͡ʒ ɑ r
ḥwꜣ	h uː ɑ
ḥwꜣ	ħ aː w a ʀ
ḥwꜣ	ħ aː w ə
ḥwꜣ	ħ oː w
ḥwꜣꜣt	h uː ɑ ʔ ɑ t
ḥwꜥ	h uː ɑː
ḥzj	h ɛ z i
ḥzmn	h ɛ z m ɛ n
ḥzp	h ɛ z ɛ p
ḥzt	h ɛ z ɛ t
ḥzy	h ɛ z iː
ḥzꜣ	h ɛ z ɑ
ḥzꜣt	h ɛ z ɑ t
ḥḏ	h ɛ d͡ʒ
ḥḏ	ħ aː cʼ
ḥḏ	ħ aː tʼ
ḥḏ	ħ e tʼ
ḥḏ	ħ eː tʼ
ḥḏ	ħ i cʼ
ḥḏ	ħ i tʼ
ḥḏ	ħ oː tʼ
ḥḏ	ħ uː cʼ a w
ḥḏ	ħ uː tʼ a w
ḥḏ	ħ uː tʼ ə
ḥḏj	h ɛ d͡ʒ i
ḥḏt	h ɛ d͡ʒ ɛ t
ḥḏt	ħ u cʼ j a t
ḥḏt	ħ u tʼ j a
ḥḏt	ħ u tʼ j a ʔ
ḥḏt	ħ ø tʼ j ə
ḥḏw	h ɛ d͡ʒ uː
ḥḥ	h ɛ h
ḥḥ	ħ a ħ
ḥḥj	h ɛ h i
ḥḥw	h ɛ h uː
ḥṯṯt	h ɛ t͡ʃ ɛ t͡ʃ ɛ t
ḥṯṯt	ħ a c c a t
ḥṯṯt	ħ a ʔ t͡ʃ a ʔ
ḥṯṯt	ħ ə ʔ t͡ʃ a ʔ
ḥꜣ	h ɑ
ḥꜣb	h ɑ b
ḥꜣb	ħ a ʀ a b
ḥꜣb	ħ ə a b
ḥꜣb	ħ ə a p
ḥꜣbj	h ɑ b i
ḥꜣbj	ħ i ʀ b i t
ḥꜣbj	ħ i ʀ b i ʔ
ḥꜣbj	ħ iː b a
ḥꜣbj	ħ iː β ə
ḥꜣj	h ɑ i
ḥꜣm	h ɑ m
ḥꜣp	h ɑ p
ḥꜣp	ħ aː ʀ a p
ḥꜣp	ħ aː ʔ ə p
ḥꜣp	ħ oː ʔ ə p
ḥꜣq	h ɑ k
ḥꜣt	h ɑ t
ḥꜣt	ħ eː ʔ
ḥꜣt	ħ uː ʀ i t
ḥꜣt	ħ uː ʀ i ʔ
ḥꜣt	ħ uː ʔ ə
ḥꜣtj	h ɑ t i
ḥꜣtj	u
ḥꜣtj	ħ eː t
ḥꜣtj	ħ u j iː
ḥꜣtj	ħ u ʀ iː
ḥꜣtj	ħ u ʀ iː t i j
ḥꜣtj	ħ u ʀ t V j
ḥꜣtj	ħ uː t ə
ḥꜣtj	ħ w iː
ḥꜣtj	ħ w iː t
ḥꜣtj	ħ w iː t ə
ḥꜣtt	h ɑ t ɛ t
ḥꜣw	h ɑ uː
ḥꜣyt	h ɑ iː t
ḥꜣḥꜣ	h ɑ h ɑ
ḥꜥb	h ɑː b
ḥꜥj	h ɑː i
ḥꜥpj	h ɑː p i
ḥꜥpj	ħ V j p i j
ḥꜥpj	ħ V ʕ p i j
ḥꜥpj	ħ ə p e j
ḥꜥt	h ɑː t
ḥꜥw	h ɑː uː
ḥꜥḏꜣ	h ɑː d͡ʒ ɑ
ḥꜥꜥwt	h ɑː ʔ ɑː uː t
ḫ	x ɛ
ḫbj	x ɛ b i
ḫbs	x ɛ b ɛ s
ḫbzt	x ɛ b z ɛ t
ḫbzwt	x ɛ b z uː t
ḫbꜣ	x ɛ b ɑ
ḫbꜣ	χ aː b a ʀ
ḫbꜣ	χ aː b ə
ḫbꜣ	χ oː β
ḫdj	x ɛ d i
ḫdj	χ e ʔ tʼ a
ḫdj	χ e ʔ tʼ ə
ḫdj	χ i tʼ j i t
ḫdj	χ i tʼ j i ʔ
ḫft	x ɛ f ɛ t
ḫftj	x ɛ f t i
ḫftt	x ɛ f ɛ t ɛ t
ḫftw	x ɛ f ɛ t uː
ḫfꜣ	x ɛ f ɑ
ḫfꜣj	x ɛ f ɑ i
ḫfꜣt	x ɛ f ɑ t
ḫfꜣꜣt	x ɛ f ɑ ʔ ɑ t
ḫfꜥ	x ɛ f ɑː
ḫm	x ɛ m
ḫm	χ aː m
ḫm	χ oː m
ḫmnjw	x ɛ m n i uː
ḫmnjw	χ a m n i j j a w
ḫmnnw	x ɛ m ɛ n n uː
ḫmnw	x ɛ m ɛ n uː
ḫmnw	χ a m aː n a w
ḫmnw	χ ə m aː n ə
ḫmnw	χ ə m oː n
ḫmnyw	x ɛ m ɛ n iː uː
ḫmt	x ɛ m ɛ t
ḫmtnw	x ɛ m ɛ t n uː
ḫmtw	x ɛ m ɛ t uː
ḫmtw	χ a m t
ḫmtw	χ a m t a w
ḫmtw	χ a m t ə
ḫmw	x ɛ m uː
ḫmꜥt	x ɛ m ɑː t
ḫn	x ɛ n
ḫnd	x ɛ n ɛ d
ḫndw	x ɛ n d uː
ḫnfw	x ɛ n ɛ f uː
ḫnj	x ɛ n i
ḫnm	x ɛ n ɛ m
ḫnms	x ɛ n m ɛ s
ḫnmt	x ɛ n m ɛ t
ḫnmw	x ɛ n ɛ m uː
ḫnp	x ɛ n ɛ p
ḫnr	x ɛ n ɛ r
ḫnrt	x ɛ n r ɛ t
ḫnrtt	x ɛ n r ɛ t ɛ t
ḫnsw	x ɛ n s uː
ḫnsw	χ a n s
ḫnsw	χ a n s V w
ḫnsw	χ a n s ə
ḫnt	x ɛ n ɛ t
ḫntj	x ɛ n t i
ḫntj	x ɛ n ɛ t i
ḫntj	χ e n t a
ḫntj	χ e n t ə
ḫntj	χ i n t i t
ḫntj	χ i n t i ʔ
ḫntw	x ɛ n ɛ t uː
ḫntyt	x ɛ n t iː t
ḫntš	x ɛ n t ɛ ʃ
ḫnws	x ɛ n uː s
ḫnz	x ɛ n ɛ z
ḫpd	x ɛ p ɛ d
ḫpdwj	x ɛ p d uː i
ḫpj	x ɛ p i
ḫpp	x ɛ p ɛ p
ḫpr	x ɛ p ɛ r
ḫpr	χ aː p a
ḫpr	χ aː p a ɾ
ḫpr	χ aː p a ʔ
ḫpr	χ oː p ə
ḫprj	x ɛ p r i
ḫprr	x ɛ p r ɛ r
ḫprw	x ɛ p ɛ r uː
ḫprw	χ u p i ɾ w a w
ḫprw	χ u p ɾ a w
ḫprw	χ u p ɾ ə
ḫprw	χ ø p ɾ
ḫprw	χ ə p e ʔ ɾ
ḫprw	χ ə p e ʔ ɾ ə
ḫprš	x ɛ p r ɛ ʃ
ḫpš	x o p ɛ ʃ
ḫpš	x ɛ p ɛ ʃ
ḫpš	χ aː p V ʃ
ḫpš	χ aː p ə ʃ
ḫpš	χ oː p ə ʃ
ḫr	x ɛ r
ḫr	χ u ɾ
ḫr	χ u ʔ
ḫr	χ ø ʔ
ḫrj	x ɛ r i
ḫrp	x ɛ r ɛ p
ḫrp	χ aː ɾ a p
ḫrp	χ aː ɾ ə p
ḫrp	χ oː ɾ ə p
ḫrpw	x ɛ r p uː
ḫrs	x ɛ r ɛ s
ḫrt	x ɛ r ɛ t
ḫrw	x ɛ r uː
ḫrw	χ a ɾ a w
ḫrw	χ ə ɾ a w
ḫrwy	x ɛ r uː iː
ḫrwyw	x ɛ r uː iː uː
ḫryt	x ɛ r iː t
ḫsbd	x ɛ s b ɛ d
ḫsbḏ	x ɛ s b ɛ d͡ʒ
ḫsf	x ɛ s ɛ f
ḫsf	χ aː s a f
ḫsf	χ aː s ə f
ḫsf	χ oː s ə f
ḫsfj	x ɛ s f i
ḫsr	x ɛ s ɛ r
ḫt	x ɛ t
ḫt	χ e ʔ
ḫt	χ i t
ḫt	χ i ʔ
ḫtj	x ɛ t i
ḫtm	x ɛ t ɛ m
ḫtḫt	x ɛ t x ɛ t
ḫtꜣ	x ɛ t ɑ
ḫw	x uː
ḫwd	x uː d
ḫwj	x uː i
ḫww	x uː ʔ uː
ḫwzj	x uː z i
ḫwzj	χ i w z i t
ḫšꜣyꜣrwšꜣ	x ɛ ʃ ɑ iː ɑ r uː ʃ ɑ
ḫḫ	x ɛ x
ḫḫ	χ e χ
ḫḫ	χ i χ
ḫꜣ	x ɑ
ḫꜣ	χ a ʀ
ḫꜣ	χ a ʔ
ḫꜣb	x ɑ b
ḫꜣbꜣbꜣšꜣ	x ɑ b ɑ b ɑ ʃ ɑ
ḫꜣj	x ɑ i
ḫꜣjw	x ɑ i uː
ḫꜣm	x ɑ m
ḫꜣrw	x ɑ r uː
ḫꜣrw	χ u ɾ ɾ a w
ḫꜣrw	χ u ɾ ɾ ə
ḫꜣrw	χ ø ɾ ɾ
ḫꜣst	x ɑ s ɛ t
ḫꜣstjw	x ɑ s t i uː
ḫꜣt	x ɑ t
ḫꜣtb	x ɑ t ɛ b
ḫꜣwj	x ɑ uː i
ḫꜣwt	x ɑ uː t
ḫꜣy	x ɑ iː
ḫꜣyt	x ɑ iː t
ḫꜣz	x ɑ z
ḫꜣḫ	x ɑ x
ḫꜣḫꜣ	x ɑ x ɑ
ḫꜣꜥ	x ɑ ʔ ɑː
ḫꜣꜥ	χ aː ʀ a ʕ
ḫꜣꜥ	χ aː ʔ ə ʕ
ḫꜣꜥ	χ oː ʔ ə ʕ
ḫꜥj	x ɑː i
ḫꜥj	χ a ʕ j a
ḫꜥj	χ e ʕ j a
ḫꜥj	χ e ʕ j ə
ḫꜥj	χ i ʕ j i t
ḫꜥj	χ i ʕ j i ʔ
ḫꜥw	x ɑː uː
ṯb	t͡ʃ ɛ b
ṯbwt	t͡ʃ ɛ b uː t
ṯm	t͡ʃ ɛ m
ṯms	t͡ʃ ɛ m ɛ s
ṯmt	t͡ʃ ɛ m ɛ t
ṯmḥ	t͡ʃ ɛ m ɛ h
ṯmꜣ	t͡ʃ ɛ m ɑ
ṯn	t͡ʃ ɛ n
ṯnj	c aː n a j
ṯnj	t aː n a j
ṯnj	t aː n ə
ṯnj	t oː n
ṯnj	t͡ʃ ɛ n i
ṯnm	t͡ʃ ɛ n ɛ m
ṯnw	t͡ʃ ɛ n uː
ṯnwt	t͡ʃ ɛ n uː t
ṯnḥr	t͡ʃ ɛ n h ɛ r
ṯnṯꜣt	t͡ʃ ɛ n t͡ʃ ɑ t
ṯpḥt	t͡ʃ ɛ p h ɛ t
ṯrm	c aː ɾ a m
ṯrm	t͡ʃ aː ɾ a m
ṯrm	t͡ʃ aː ɾ ə m
ṯrm	t͡ʃ oː ɾ ə m
ṯrm	t͡ʃ ɛ r ɛ m
ṯrp	t͡ʃ ɛ r ɛ p
ṯrt	c aː ɾ a t
ṯrt	t aː ɾ a
ṯrt	t aː ɾ a ʔ
ṯrt	t oː ɾ ə
ṯrt	t͡ʃ ɛ r ɛ t
ṯw	t͡ʃ uː
ṯwfj	t͡ʃ a w f
ṯwfj	t͡ʃ uː f i
ṯwn	t͡ʃ uː n
ṯwpꜣjr	c uː p a ɾ
ṯwpꜣjr	t͡ʃ uː p ɑ i r
ṯwt	t͡ʃ uː t
ṯz	t͡ʃ ɛ z
ṯzj	c iː z i t
ṯzj	t͡ʃ iː s a
ṯzj	t͡ʃ iː s i ʔ
ṯzj	t͡ʃ iː s ə
ṯzj	t͡ʃ ɛ z i
ṯzm	t͡ʃ ɛ z ɛ m
ṯzt	t͡ʃ ɛ z ɛ t
ṯztj	t͡ʃ ɛ z t i
ṯš	t͡ʃ ɛ ʃ
ṯḥn	t͡ʃ ɛ h ɛ n
ṯḥnt	t͡ʃ ɛ h n ɛ t
ṯḥnw	t͡ʃ ɛ h ɛ n uː
ṯḥw	t͡ʃ ɛ h uː
ṯꜣ	t͡ʃ ɑ
ṯꜣj	c i ʀ j i t
ṯꜣj	t͡ʃ i ʀ j i ʔ
ṯꜣj	t͡ʃ iː ʔ
ṯꜣj	t͡ʃ iː ʔ ə
ṯꜣj	t͡ʃ ɑ i
ṯꜣm	t͡ʃ ɑ m
ṯꜣr	t͡ʃ ɑ r
ṯꜣtj	t͡ʃ ɑ t i
ṯꜣtt	t͡ʃ ɑ t ɛ t
ṯꜣw	c i ʀ w i t
ṯꜣw	c u ʀ w u w
ṯꜣw	t eː w
ṯꜣw	t u ʀ w u w
ṯꜣw	t uː w ə
ṯꜣw	t͡ʃ i ʀ w i ʔ
ṯꜣw	t͡ʃ iː w a
ṯꜣw	t͡ʃ iː w ə
ṯꜣw	t͡ʃ ɑ uː
ṯꜣy	t͡ʃ ɑ iː
ẖdb	ç aː tʼ a b
ẖdb	ç aː tʼ ə b
ẖdb	ç oː tʼ ə β
ẖdb	ç ɛ d ɛ b
ẖkr	ç ɛ k ɛ r
ẖkrw	ç ɛ k ɛ r uː
ẖn	ç ɛ n
ẖnj	ç ɛ n i
ẖnm	ç ɛ n ɛ m
ẖnmt	ç a n m V ʔ
ẖnmt	ç a n m a
ẖnmt	ç a n m ə
ẖnmt	ç ɛ n m ɛ t
ẖnmw	ç V n aː m V w
ẖnmw	ç ə n aː m ə
ẖnmw	ç ə n oː m
ẖnmw	ç ɛ n m uː
ẖnn	ç ɛ n ɛ n
ẖnnw	ç ɛ n ɛ n uː
ẖntj	ç ɛ n t i
ẖnw	ç aː n a w
ẖnw	ç aː n ə
ẖnw	ç oː n
ẖnw	ç ɛ n uː
ẖnyt	ç ɛ n iː t
ẖpꜣ	ç u p l V w
ẖpꜣ	ç u p l ə
ẖpꜣ	ç ø p l ə
ẖpꜣ	ç ɛ p ɑ
ẖpꜣw	ç ɛ p ɑ uː
ẖr	ç u ɾ
ẖr	ç u ʔ
ẖr	ç ø ʔ
ẖr	ç ɛ r
ẖrd	ç a ɾ a tʼ
ẖrd	ç ə ɾ a tʼ
ẖrd	ç ɛ r ɛ d
ẖrdw	ç ɛ r ɛ d uː
ẖrj	ç u ɾ i j
ẖrj	ç ə ɾ e j
ẖrj	ç ɛ r i
ẖrt	ç u ɾ i t
ẖrt	ç u ɾ i ʔ
ẖrt	ç ə ɾ e ʔ
ẖrt	ç ɛ r ɛ t
ẖrw	ç ɛ r uː
ẖrwj	ç ɛ r uː i
ẖt	ç eː j ə
ẖt	ç uː j a
ẖt	ç uː j a ʔ
ẖt	ç uː w a t
ẖt	ç ɛ t
ẖz	ç ɛ z
ẖzj	ç iː s a
ẖzj	ç iː s i ʔ
ẖzj	ç iː s ə
ẖzj	ç iː z i t
ẖzj	ç ɛ z i
ẖꜣk	ç ɑ k
ẖꜣr	ç ɑ r
ẖꜣrt	ç ɑ r ɛ t
ẖꜣt	ç ɑ t
ẖꜣyt	ç ɑ iː t
ẖꜥm	ç ɑː m
ẖꜥq	ç ɑː k
ꜣ	ɑ
ꜣb	ɑ b
ꜣbb	ɑ b ɛ b
ꜣbb	ʔ ə β a p
ꜣbd	ɑ b ɛ d
ꜣbd	ʀ a b a tʼ
ꜣbd	ʀ a b u tʼ w
ꜣbd	ʀ a b uː tʼ a w
ꜣbd	ʔ a b a tʼ
ꜣbd	ʔ a b u tʼ w
ꜣbd	ʔ a β a tʼ
ꜣbd	ʔ a β eː tʼ
ꜣbd	ʔ a β eː tʼ ə
ꜣbd	ʔ a β ø tʼ ə
ꜣbj	ɑ b i
ꜣbnjnj	ɑ b n i n i
ꜣbnn	ɑ b n ɛ n
ꜣbt	ɑ b ɛ t
ꜣbw	j eː β
ꜣbw	j uː b ə
ꜣbw	ɑ b uː
ꜣbw	ʀ aː b a w
ꜣbw	ʀ uː b a w
ꜣbw	ʔ aː b ə
ꜣbw	ʔ oː β
ꜣbwt	ɑ b uː t
ꜣby	ɑ b iː
ꜣbyt	ɑ b iː t
ꜣbḏw	ɑ b ɛ d͡ʒ uː
ꜣbḏw	ʀ V b aː cʼ V w
ꜣbḏw	ʀ V b aː tʼ V w
ꜣbḏw	ʔ ə b aː tʼ ə
ꜣbḏw	ʔ ə β oː tʼ
ꜣbḫ	ɑ b ɛ x
ꜣbḫ	ʀ aː b a χ
ꜣbḫ	ʔ aː b ə χ
ꜣbḫ	ʔ oː β ə χ
ꜣbḫt	ɑ b x ɛ t
ꜣbꜣb	ɑ b ɑ b
ꜣd	ɑ d
ꜣdt	ɑ d ɛ t
ꜣdw	ɑ d uː
ꜣdw	ʀ aː tʼ a w
ꜣdw	ʔ aː tʼ ə
ꜣdw	ʔ oː tʼ
ꜣf	ɑ f
ꜣfj	ɑ f i
ꜣfjw	ɑ f i uː
ꜣfr	ɑ f ɛ r
ꜣfꜣf	ɑ f ɑ f
ꜣfꜥ	ɑ f ɑː
ꜣgbj	ɑ ɡ b i
ꜣhd	ɑ h ɛ d
ꜣhmt	ɑ h m ɛ t
ꜣhw	ɑ h uː
ꜣj	ɑ i
ꜣjs	ɑ i s
ꜣjwj	ɑ i uː i
ꜣk	ɑ k
ꜣkr	ɑ k ɛ r
ꜣkwt	ɑ k uː t
ꜣm	ɑ m
ꜣmj	ɑ m i
ꜣmm	ɑ m ɛ m
ꜣmm	ʀ a m a m
ꜣmm	ʔ ə m a m
ꜣmmt	ɑ m ɛ m ɛ t
ꜣmmw	ɑ m ɛ m uː
ꜣms	ɑ m ɛ s
ꜣmw	ɑ m uː
ꜣmwt	ɑ m uː t
ꜣmꜥ	ɑ m ɑː
ꜣmꜥt	ɑ m ɑː t
ꜣpd	ɑ p ɛ d
ꜣpd	ʀ aː p V tʼ
ꜣpd	ʔ aː p ə tʼ
ꜣpd	ʔ oː p ə tʼ
ꜣpdwt	ɑ p d uː t
ꜣpḥ	ɑ p ɛ h
ꜣpꜣrwywsꜣ	ɑ p ɑ r uː iː uː s ɑ
ꜣq	ɑ k
ꜣqw	ɑ k uː
ꜣqyt	ɑ k iː t
ꜣqyt	ʀ a q ’ aː j V ʔ
ꜣqyt	ʀ a q ’ aː w V t
ꜣqyt	ʔ a q ’ aː ʔ ə
ꜣqyt	ʔ a q ’ oː ʔ
ꜣqḥw	ɑ k ɛ h uː
ꜣr	ɑ r
ꜣrr	ɑ r ɛ r
ꜣrwksjndrs	ɑ r uː k s i n ɛ d r ɛ s
ꜣrwkt	ɑ r uː k ɛ t
ꜣrwtꜣḫšꜣšꜣs	ɑ r uː t ɑ x ʃ ɑ ʃ ɑ s
ꜣryt	ɑ r iː t
ꜣs	ɑ s
ꜣsbyw	ɑ s b iː uː
ꜣst	ɑ s ɛ t
ꜣst	ʀ uː s a t
ꜣst	ʀ uː s a ʔ
ꜣst	ʔ eː s ə
ꜣst	ʔ uː s a
ꜣsḫ	ɑ s ɛ x
ꜣt	ɑ t
ꜣtf	ɑ t ɛ f
ꜣtjwt	ɑ t i uː t
ꜣtp	ɑ t ɛ p
ꜣtpwt	ɑ t p uː t
ꜣtyt	ɑ t iː t
ꜣw	ɑ uː
ꜣw	ʀ a w
ꜣw	ʔ a w
ꜣwj	ɑ uː i
ꜣwj	ʀ aː w a j
ꜣwj	ʔ aː w ə
ꜣwj	ʔ oː w
ꜣwr	ɑ uː r
ꜣwsw	ɑ uː s uː
ꜣwt	ɑ uː t
ꜣwtqrtr	ɑ uː t ɛ k r ɛ t ɛ r
ꜣwšꜣ	ɑ uː ʃ ɑ
ꜣwšꜣmm	ɑ uː ʃ ɑ m ɛ m
ꜣwšꜣmm	ʔ u ʀ u ʃ a l i m u m
ꜣwḥ	ɑ uː h
ꜣwḫ	ɑ uː x
ꜣyt	ɑ iː t
ꜣz	ɑ z
ꜣzb	ɑ z ɛ b
ꜣzḫ	ɑ z ɛ x
ꜣzḫ	ʀ aː s a χ
ꜣzḫ	ʀ aː z a χ
ꜣzḫ	ʔ aː s ə χ
ꜣzḫ	ʔ oː s ə χ
ꜣš	ɑ ʃ
ꜣšr	ɑ ʃ ɛ r
ꜣšrt	ɑ ʃ r ɛ t
ꜣḥ	ɑ h
ꜣḥt	j aː ħ a
ꜣḥt	j oː ħ ə
ꜣḥt	ɑ h ɛ t
ꜣḥt	ʀ aː ħ a t
ꜣḥt	ʀ aː ħ a ʔ
ꜣḫ	ɑ x
ꜣḫ	ʀ aː χ
ꜣḫ	ʀ iː χ u w
ꜣḫ	ʔ aː χ
ꜣḫ	ʔ iː χ
ꜣḫ	ʔ iː χ ə
ꜣḫ	ʔ oː χ
ꜣḫf	ɑ x ɛ f
ꜣḫfḫf	ɑ x ɛ f x ɛ f
ꜣḫt	ɑ x ɛ t
ꜣḫtj	ɑ x t i
ꜣḫw	ɑ x uː
ꜣḫw	ʀ aː χ a w
ꜣḫw	ʔ aː χ ə
ꜣḫw	ʔ oː χ
ꜣḫyt	ɑ x iː t
ꜣḫꜣḫ	ɑ x ɑ x
ꜣṯj	ɑ t͡ʃ i
ꜣṯp	ɑ t͡ʃ ɛ p
ꜣṯp	ʀ aː c a p
ꜣṯp	ʀ aː t a p
ꜣṯp	ʔ aː t ə p
ꜣṯp	ʔ oː t ə p
ꜣṯpw	ɑ t͡ʃ ɛ p uː
ꜣṯt	ɑ t͡ʃ ɛ t
ꜣṯwt	ɑ t͡ʃ uː t
ꜣṯyt	ɑ t͡ʃ iː t
ꜣẖꜥ	ɑ ç ɑː
ꜣẖꜥt	ɑ ç ɑː t
ꜣꜣ	ɑ ʔ ɑ
ꜣꜣt	ɑ ʔ ɑ t
ꜣꜣtꜣ	ɑ ʔ ɑ t ɑ
ꜣꜥ	ɑ ʔ ɑː
ꜣꜥbt	ɑ ʔ ɑː b ɛ t
ꜣꜥfj	ɑ ʔ ɑː f i
ꜣꜥw	ɑ ʔ ɑː uː
ꜣꜥz	ɑ ʔ ɑː z
ꜣꜥꜥ	ɑ ʔ ɑː ʔ ɑː
ꜣꜥꜥbw	ɑ ʔ ɑː ɑː b uː
ꜣꜥꜥnj	ɑ ʔ ɑː ɑː n i
ꜣꜥꜥt	ɑ ʔ ɑː ɑː t
ꜣꜥꜥw	ɑ ʔ ɑː ɑː uː
ꜣꜥꜥwj	ɑ ʔ ɑː ɑː uː i
ꜥ	d uː j
ꜥ	ɑː
ꜥ	ʕ eː j
ꜥ	ʕ uː j
ꜥb	ɑː b
ꜥbj	ɑː b i
ꜥbnḫ	ɑː b n ɛ x
ꜥbw	ɑː b uː
ꜥbw	ʕ aː b V w
ꜥbw	ʕ aː b ə
ꜥbw	ʕ oː β
ꜥbḫn	ɑː b x ɛ n
ꜥbꜣ	ɑː b ɑ
ꜥbꜥb	ɑː b ɑː b
ꜥf	ɑː f
ꜥff	ɑː f ɛ f
ꜥff	ʕ u f f V j
ꜥff	ʕ u f f ə
ꜥff	ʕ ø f f
ꜥftj	ɑː f t i
ꜥfḏt	ɑː f d͡ʒ ɛ t
ꜥfꜣy	ɑː f ɑ iː
ꜥgt	ɑː ɡ ɛ t
ꜥkꜣ	ɑː k ɑ
ꜥm	ɑː m
ꜥmm	ɑː m ɛ m
ꜥmr	ɑː m ɛ r
ꜥmr	ʕ V m r i j
ꜥmr	ʕ a m r e ʔ
ꜥmḏ	ɑː m ɛ d͡ʒ
ꜥmḏ	ʕ aː m ə t͡ʃʼ
ꜥmḏ	ʕ oː m ə t͡ʃʼ
ꜥmꜥm	ɑː m ɑː m
ꜥmꜥt	ɑː m ɑː t
ꜥmꜥt	ʕ a m ʕ a
ꜥmꜥt	ʕ a m ʕ a t
ꜥmꜥt	ʕ a m ʕ a ʔ
ꜥmꜥt	ʕ a m ʕ ə
ꜥmꜥꜣ	ɑː m ɑː ʔ ɑ
ꜥmꜥꜣt	ɑː m ɑː ʔ ɑ ɛ t
ꜥn	ɑː n
ꜥnb	ɑː n ɛ b
ꜥnb	ʕ V n aː b V w
ꜥnb	ʕ a n aː b ə
ꜥnb	ʕ a n oː β ə
ꜥnj	ɑː n i
ꜥnn	ɑː n ɛ n
ꜥnn	ʕ a n a n
ꜥnq	ɑː n ɛ k
ꜥnqt	ɑː n k ɛ t
ꜥnt	ɑː n ɛ t
ꜥnt	ʕ iː n V t
ꜥnt	ʕ iː n V ʔ
ꜥnt	ʕ iː n a
ꜥnt	ʕ iː n ə
ꜥntj	ɑː n t i
ꜥntjt	ɑː n t i t
ꜥntjw	ɑː n t i uː
ꜥnḏ	ɑː n ɛ d͡ʒ
ꜥnḏw	ɑː n d͡ʒ uː
ꜥnḏw	ʕ V n cʼ a w w u w
ꜥnḏw	ʕ V n tʼ a w w u w
ꜥnḏw	ʕ a n tʼ a w w ə
ꜥnḫ	ɑː n x
ꜥnḫ	ʕ a n a χ
ꜥnḫ	ʕ aː n a χ
ꜥnḫ	ʕ aː n ə χ
ꜥnḫ	ʕ oː n ə χ
ꜥnḫwj	ɑː n x uː i
ꜥnꜥn	ɑː n ɑː n
ꜥpj	ɑː p i
ꜥpr	ɑː p ɛ r
ꜥpšꜣy	ɑː p ʃ ɑ iː
ꜥq	ɑː k
ꜥq	ʕ aː qʼ
ꜥq	ʕ oː qʼ
ꜥqw	ɑː k uː
ꜥqw	ʕ a j qʼ
ꜥqw	ʕ a j qʼ ə
ꜥqw	ʕ a qʼ j u w
ꜥqw	ʕ a qʼ w u w
ꜥqy	ɑː k iː
ꜥqy	ʕ e j q ’
ꜥqy	ʕ e j q ’ ə
ꜥqy	ʕ i q ’ j a w
ꜥqyt	ɑː k iː t
ꜥqꜣ	ɑː k ɑ
ꜥr	ɑː r
ꜥr	ʕ e l
ꜥr	ʕ i l
ꜥrf	ɑː r ɛ f
ꜥrq	ɑː r ɛ k
ꜥrq	ʕ a l a qʼ
ꜥrq	ʕ a l aː qʼ a w
ꜥrq	ʕ a l aː qʼ ə
ꜥrq	ʕ a l oː qʼ
ꜥrq	ʕ aː l a qʼ
ꜥrq	ʕ aː l ə qʼ
ꜥrq	ʕ oː l ə qʼ
ꜥrqy	ɑː r k iː
ꜥrqy	ʕ V l q ’ i j
ꜥrqy	ʕ V l q ’ i w
ꜥrqy	ʕ a l q ’ e ʔ
ꜥrrwt	ɑː r ɛ r uː t
ꜥrt	ɑː r ɛ t
ꜥrꜥr	ɑː r ɑː r
ꜥsṯjrṯt	ɑː s t͡ʃ i r t͡ʃ ɛ t
ꜥsṯrdt	ɑː s t͡ʃ ɛ r d ɛ t
ꜥsṯrt	ɑː s t͡ʃ ɛ r ɛ t
ꜥsṯt	ɑː s t͡ʃ ɛ t
ꜥt	ɑː t
ꜥtḫ	ɑː t ɛ x
ꜥwt	ɑː uː t
ꜥwꜣ	ɑː uː ɑ
ꜥwꜣj	ɑː uː ɑ i
ꜥwꜣy	ɑː uː ɑ iː
ꜥš	ɑː ʃ
ꜥš	ʕ aː ʃ
ꜥš	ʕ oː ʃ
ꜥšj	ɑː ʃ i
ꜥšm	ɑː ʃ ɛ m
ꜥšꜣ	ɑː ʃ ɑ
ꜥšꜣ	ʕ a ʃ e j
ꜥšꜣ	ʕ i ʃ i ʀ
ꜥšꜣt	ɑː ʃ ɑ t
ꜥḏ	ɑː d͡ʒ
ꜥḏt	ɑː d͡ʒ ɛ t
ꜥḥ	ɑː h
ꜥḥꜣ	ɑː h ɑ
ꜥḥꜣw	ɑː h ɑ uː
ꜥḥꜣwtj	ɑː h ɑ uː t i
ꜥḥꜣwtj	ʕ V ħ ʀ a w t i j
ꜥḥꜣwtj	ʕ a ħ a w t
ꜥḥꜣwtj	ʕ a ħ a w t ə
ꜥḥꜥ	ɑː h ɑː
ꜥḥꜥ	ʕ aː ħ a ʕ
ꜥḥꜥ	ʕ aː ħ ə ʕ
ꜥḥꜥ	ʕ oː ħ ə ʕ
ꜥḥꜥw	j a ħ j a w
ꜥḥꜥw	ɑː h ɑː uː
ꜥḥꜥw	ʔ a ħ i
ꜥḥꜥw	ʔ a ħ j ə
ꜥḥꜥw	ʕ a ħ ʕ a w
ꜥḫj	ɑː x i
ꜥḫm	ɑː x ɛ m
ꜥḫm	ʕ aː χ a m
ꜥḫm	ʕ aː χ ə m
ꜥḫm	ʕ oː χ ə m
ꜥḫḫw	ɑː x ɛ x uː
ꜥẖj	ɑː ç i
ꜥẖm	ɑː ç ɛ m
ꜥẖm	ʕ a ç aː m a w
ꜥẖm	ʕ a ç aː m ə
ꜥẖm	ʕ a ç oː m
ꜥꜣ	j aː ʕ a ʀ
ꜥꜣ	j aː ʕ ə
ꜥꜣ	j oː ʕ
ꜥꜣ	ɑː ʔ ɑ
ꜥꜣ	ʕ a ʀ
ꜥꜣ	ʕ a ʔ
ꜥꜣ	ʕ o ʔ
ꜥꜣb	ɑː ʔ ɑ b
ꜥꜣbt	ɑː ʔ ɑ b ɛ t
ꜥꜣdt	ɑː ʔ ɑ d ɛ t
ꜥꜣg	ɑː ʔ ɑ ɡ
ꜥꜣj	ɑː ʔ ɑ i
ꜥꜣj	ʕ a j e j
ꜥꜣj	ʕ i ʀ i j
ꜥꜣm	ɑː ʔ ɑ m
ꜥꜣmt	ɑː ʔ ɑ m ɛ t
ꜥꜣnbpꜣjr	ɑː ʔ ɑ n ɛ b p ɑ i r
ꜥꜣp	ɑː ʔ ɑ p
ꜥꜣpp	ɑː ʔ ɑ p ɛ p
ꜥꜣpp	ʕ V ʀ p aː p V w
ꜥꜣpp	ʕ a p aː p ə
ꜥꜣpp	ʕ a p oː p
ꜥꜣsjty	ɑː ʔ ɑ s i t iː
ꜥꜣstjr	ɑː ʔ ɑ s t i r
ꜥꜣt	ɑː ʔ ɑ t
ꜥꜣw	ɑː ʔ ɑ uː
ꜥꜣꜥ	ɑː ʔ ɑ ʔ ɑː
ꜥꜣꜥy	ɑː ʔ ɑ ɑː iː
ꜥꜥ	ɑː ʔ ɑː
ꜥꜥb	ɑː ʔ ɑː b
ꜥꜥfs	ɑː ʔ ɑː f ɛ s
ꜥꜥft	ɑː ʔ ɑː f ɛ t
ꜥꜥj	ɑː ʔ ɑː i
ꜥꜥjw	ɑː ʔ ɑː i uː
ꜥꜥt	ɑː ʔ ɑː t
ꜥꜥw	ɑː ʔ ɑː uː
ꜥꜥꜣm	ɑː ʔ ɑː ɑ m
