'cher	t͡ʃ ə ˦
disavowal	d ɪ s ə v a ʊ ə ɫ
disbursal	d ɪ s b ɜː s ə ɫ
disburse	d ɪ s p ɝ s
discalceate	d ɪ s k æ ɫ s ɪ e ɪ t
discalceate	d ɪ s k æ ɫ s ɪ ə t
disculpate	d ɪ s k ʊ ɫ p e ɪ t
disculpate	d ɪ s k ʌ ɫ p e ɪ t
disembowel	d ɪ s ɪ m b a ʊ ə ɫ
disentangle	d ɪ s ɪ n t æ ŋ ɡ ə ɫ
disentitle	d ɪ s ɪ n t a ɪ t ə ɫ
disfavourable	d ɪ s f e ɪ v ɹ ə b ə ɫ
disgraceful	d ɪ s ɡ ɹ e ɪ s f ə ɫ
disgraceful	d ɪ z ɡ ɹ e ɪ s f ə ɫ
disintegration	d ɪ s ɪ n ə ɡ ɹ e ɪ ʃ ə n
disloyal	d ɪ s l ɔ ɪ j ə ɫ
dismantle	d ɪ s m æ n tʰ ə ɫ
dismantle	d ɪ s m æ n ʔ ə ɫ
dismantle	d ɪ s m æ̃ n ɫ̩
dismantle	d ɪ s m æ̃ n ɾ ɫ̩
dismissal	d ɪ s m ɪ s ə ɫ
dismissal	d ɪ z m ɪ s ə ɫ
dispel	d ɪ s p ɛ ɫ
dispellable	d ɪ s p ɛ l ə b ə ɫ
dispensable	d ɪ s pʰ ɛ n s ə b ɫ̩
disposal	d ɪ s p ə ʊ z ə ɫ
disproportional	d ɪ s p ɹ ə p ɔː ʃ ə n ə ɫ
disrespectful	d ɪ s ɹ ɪ s p ɛ k t f ə ɫ
dissemble	d ɪ s ɛ m b ə ɫ
dittander	d ɪ t æ n d ə
ditto	d ɪ ɾ o ʊ
divinyl	d a ɪ v a ɪ n ɪ ɫ
divisible	d ɪ v ɪ z ɪ b ə ɫ
dockize	d ɒ k ɑ ɪ̯ z
dojo	d o ʊ̯ d͡ʒ o ʊ̯
dojo	d ə ʊ̯ d͡ʒ ə ʊ̯
dole	d o ʊ̯ ɫ
dolphin	d ɑ l̥ f ɪ n
dolphin	d ɒ l̥ f ɪ n
don't	d o ʊ̯ n
don't	d õ ʊ̯̃ ʔ t̚
don't	d õ ʔ
don't	d ə ʊ̯ n t̚
dope	d o ʊ p
dope	d ə ʊ p
double	d ʌ b ɫ
dower	d a ʊ ə ɹ
dower	d a ʊ ɚ
drag	d͡ɹ̝ ˗ʷ æˑ ɡ
dragging	d͡ʒ ɹ æ ɡ ɪ ŋ
drain	d͡ʒ ɹ e ɪ n
draw	d͡ʒ ɹ ɔ ɹ
dream	d̠͡ɹ̠ ˔ʷ ɪ i̯ m
dream	d͡ʒ ɹ iː m
dreamer	d͡ʒ ɹ i m ɚ
dreaming	d͡ʒ ɹ iː m ɪ ŋ
dreams	d͡ʒ ɹ iː m z
dreich	d ɹ iː x
dried	d͡ʒ ɹ a ɪ d
drier	d͡ʒ ɹ a ɪ ɚ
drill	d ɹ ɪ ɫ
drink	d̠ ɹ̠ ˔ʷ ɪ ŋ k
drive	d ʒ ɹ a ɪ v
drive	d̠ ɹ̠ ̝ʷ a ɪ v
drop	d͡ʒ ɹ ɑ p
dropped	d͡ʒ ɹ ɑ p t
drops	d͡ʒ ɹ ɑ p s
drought	d ɹ ʌ ʊ t
droughty	d ɹ ʌ ʊ ɾ i
drown	d̠͡ɹ̠ ˔ʷ a ʊ n
drug	d̠͡ɹ̠ ˔ʷ ʌ ɡ
drugs	d ɹ ʌ ɡ z
drugs	d͡ʒ ɹ ʌ ɡ z
drumlin	d ɹ ʌ m l ɪ n
dry	d̠͡ɹ̠ ˔ a ɪ̯
dry	d̠͡ɹ̠ ˔ʷ a ɪ̯
dry	d͡ʒ ɹ a ɪ̯
dryer	d͡ʒ ɹ a ɪ ɚ
drying	d͡ʒ ɹ a ɪ ɪ ŋ
dually	d ʒ uː ə l i
dump	d ɐ m̥ p
dunn	d ɐ n
dyadic	d a ɪ æ ɾ ɪ k
ear	iː ə̯
ear	ɪ ə̯ ~ e ə̯
ear	ɪ ə̯ ~ ɪ ɐ̯
ear	ɪː
eaten	i ʔ n̩
eaten	iː t n̩
eating	i ɾ ɪ ŋ
eccentricity	ɛ k s ə n t ɹ ɪ s ə ɾ i
edible	ɛ d ə b ɫ̩
edible	ɛ d ɪ b ɫ̩
edit	ɛ ɾ ɪ ʔ t̚
edition	ɪ d ɪ ʃ n̩
eejit	iː d͡ʒ ɪ θ͇
eem	ĩː
eh	ɛː
eighty	ʔ e ɪ̯ ɾ i
el	ɛ ɫ
elbow	ɛ ɫ b o ʊ
eleven	ɪ l ɛ b m̩
embattle	ə m b æ ɾ ə l
emphasis	e ɱ f ə s ə s
emphasis	e ɱ f ə s ɪ s
emphasis	ɛ ɱ f ə s ə s
emphasis	ɛ ɱ f ə s ɪ s
emphasize	ɛ ɱ f ə s a ɪ z
en	õ
en	ɑ̃
enabled	ɛ n e ɪ b ə ɫ d
enabled	ɪ n e ɪ b ə ɫ d
encephalic	ɛ n s ə f æ l ɪ k̚
encephalic	ɛ n s ə f æ ɫ ɪ k̚
encephalic	ɪ n s ɛ f ə ɫ ɪ k̚
encephalon	ɛ n s ɛ f ə l n̩
encephalon	ɛ n s ɛ f ə l ɔ n
encephalon	ɪ n s ɛ f ə ɫ n̩
encephalon	ɪ n s ɛ f ə ɫ ɑ n
encouragement	ɪ n k ʌ ɹ ɪ d͡ʒ m ə n t
enscripturating	ɪ n s k ɹ ɪ p t͡ʃ ə ɹ e ɪ ɾ ɪ ŋ
ensnarl	ɛ n s n ɑ ɚ̯ ɫ
ensnarl	ɛ n s n ɑː ɫ
entangle	ɛ n t a ŋ ɡ l̩
enter	ɛ ɾ̃ ɚ
enter	ɪ ɾ̃ ɚ
entertain	ɛ ɾ̃ ɚ tʰ e ɪ n
epigraphy	ʔ ɨ pʰ ɪː ɡ ɹ ə f iː
epimutation	ɛ p ɪ m j u t e ɪ ʃ ə n
epitomic	e p iː t ɔ m ɪ k
epitomic	ɛ p ɪ t ɑ m ɪ k
epitomic	ɛ p ɪ t ɒ m ɪ k
equality	ɪ k w ɑ l ɪ ɾ i
era	ɪ ə̯ ɹ ə
ersatz	ɛ ə ɹ s ɑː t s
essential	ə s ɛ n t ʃ ə l
estimator	e s t ɪ m æ ɪ ɾ ə
estimator	ɛ s t ə m e ɪ ɾ ɚ
eugh	ə x
eugh	ɜː
eugh	ʌ x
evidence	ɛ v ə ɾ ə n s
evidence	ɛ v ɪ ɾ ə n s
ew	ɪ̃ː ʉ̃͡u
ew	ɯ᷈ː
ew	ʏ ʊ̯ː
exam	ɪ ɡ z æ m
example	ɘ ɡ z ɐː m p ɯ
example	ɪ ɡ z ɛ ə m p ə ɫ
exchange	ɛ k s t͡ʃ e ɪ n d͡ʒ
exchange	ɛ k s t͡ʃʰ e ɪ n d͡ʒ
exigency	ɛ ɡ z ɨ d ʒ ə n s i
exosome	ɛ k s o ʊ̯ s o ʊ̯ m
exosome	ɛ k s ə ʊ̯ s ə ʊ̯ m
false	f ɒ ʊ s
false	f ɔ ɫ s
falsity	f ɑ l s ɪ ɾ i
falsity	f ɒ ʊ s ɪ ɾ i
falsity	f ɔ ɫ s ɪ ɾ i
fan	f e ə n
fan	f ɛ ə n
fan	f ɛː n
fanaticism	f ə n æ ɾ ɪ s ɪ z m̩
farrand	f æ ɹ ə n d
farrand	f æ ɹ ə n t
fatal	f e ɪ ɾ ɫ̩
fatality	f e ɪ̯ tʰ æ l ɪ ɾ i
fatally	f e ɪ̯ ɾ l̩ i
fated	f e ɪ̯ ɾ ɨ d
fatten	f æ ʔ n̩
fattening	f æˀ ə n ɪ ŋ
fatuity	f ə t uː ɨ ɾ i
fauxtograph	f oː t ə ɡ ɹ ɑː f
fauxtography	f oː t ɑ ɡ ɹ ə f i
fauxtography	f oː t ɒ ɡ ɹ ə f i
federale	f ɛ d ə ɹ ɑː l i
feel	f iː ɫ
fence	f ɛ n s
fence	f ɛ n t s
fencer	f ɛ n s ɚ
fern	f ɜː n
fettuccini	f ɛ ɾ ə t͡ʃʰ i n i
feudal	f j u ɾ ɫ̩
feudal	f j uː d ɫ̩
feudalism	f j u d ə l ɪ z m̩
few	f j ʉː
few	f j ʉ͡u
fiddle	f ɪ ɾ l̩
fiddy	f ɪ ɾ i
fight	f ʌ ɪ t
fighter	f a ɪ̯ ɾ ɚ
fighty	f ʌ ɪ ɾ i
file	f a ɪ̯ ə ɫ
fill	f ɪ ɫ
filling	f ɪ ɫ ɪ ŋ
film	f ɪ l m̩
film	f ɪ l ə m
film	f ɪ ɫ m
fire	f a ə
fire	f a ɪ̯ ə
fire	f a ɪ̯ ɚ
fire	f aː
fire	f äː ɚ
fire	f ɑ e̯ ə
fire	f ɑ ə
fire	f ɑ əː
fire	f ʌ ɪ̯ ɚ
firewood	f a ɪ ɚ w ʊ d
firewood	f äː ɚ w ʊ d
firm	f ɝ m
firman	f ɝ m ə n
firstborn	f ɜː s t b ɔː n
firstborn	f ɝ s t b ɔ ɚ̯ n
fitra	f ɪ t ɾ a
fitra	f ɪ tˤ ɾ a
fitter	f ɪ ɾ ɚ
fitty	f ɪ ɾ i
fitty	f ɪ ʔ i
fitz	f ɪ t s
flaithiúlach	f l æ h uː l ə x
flatter	f l æ ɾ ɚ
flizz	f l ɪ z
floor	f l o̞ ɹ
flouted	f l a ʊ̯ ɾ ɨ d
flouting	f l a ʊ̯ ɾ ɪ ŋ
foal	f o ɫ
foal	f ɔ ʊ ɫ
fold	f ɒ ʊ ɫ d
fold	f ɔ ʊ ɫ d
fondling	f ɒ n d ɫ̩ ɪ ŋ
foot	f ɤ t
foot	f ɵ ʔ t
foot	f ʉ̞ ʔ t
foot	f ʊ t
foot	f ʊ tʰ
foot	f ʊ t̚
foot	fʷ ʊ t̚
football	f ʊ ʔ b ɔː l
football	f ʊ ʔ t b ɔ ɫ
football	f ʊ ʔ tʰ b ɔː l
football	f ʊ ʔ t̚ b ɔ ɫ
football	f ʊ ʔ t̚ b ɔː l
football	fʷ ʊ ʔ t̚ b ɑ ɫ
forage	f o̞ ɹ ɪ d͡ʒ
forager	f o̞ ɹ ɪ d͡ʒ ɚ
forages	f o̞ ɹ ɪ d͡ʒ ɪ z
force	f o̞ ɹ s
foregaze	f ɔ ɹ ɡ e ɪ z
foregaze	f ɔː ɡ ɛ ɪ z
forest	f ɔ ɹ ɛ̈ s tʰ
foretell	f oː t e ɫ
foretell	f ɔ ɹ t ɛ ɫ
foretell	f ɔː t ɛ ɫ
foretellable	f oː t ɛ ɫ ə b l̩
forever	f ɔ ɹ ɛ v ɚ
forever	f ə ɹ ɛ v ɚ
forever	f ɚ ɛ v ɚ
fork	f o̞ ɹ k
form	f o̞ ɹ m
fortnite	f ɔ ə ʔ n ɐ j ʔ
forty	f ɑ ɹ ɾ i j
forty	f ɔ ɹ ɾ i
fought	f oː t
foundation	f a ʊ̯ n d e ɪ̯ ʃ n̩
fountain	f a ʊ n ʔ n̩
frass	f r a s t
frass	f r æ s t
free	f ɹ ɪ i̯
french	f ɹ̠ ɛ n̠ t͡ʃ
friend	f ɹ̥ e n d̥
frighten	f ɹ̥ a ɪ t n̩
frighten	f ɹ̥ a ɪ ʔ n̩
fritter	f ɹ ɪ ɾ ɚ
fro	f ɹ ə ʊ
frustrating	f ɹ ʌ s t ɹ e ɪ̯ ɾ ɪ ŋ
frustrating	f ɹ ʌ ʃ t͡ʃ ɹ e ɪ̯ ɾ ɪ ŋ
fsck	f͡s̪ k
fsck	ɸ͡s k
fsck	ɸ͡s̪ k
fuck	f ʌ kʰ
fuckability	f ʌ k ə b ɪ l ɪ̈ ɾ i
fuckability	f ʌ k ɪ̈ b ɪ l ɪ̈ ɾ i
fuel	f j u w ə ɫ
fuhgeddaboudit	f ɵ ɡ ɛ ɾ ə b æ ʊ ɾ ɨ ʔ
full	f ʊ ɫ
function	f ʌ ŋ k ʃ n̩
function	f ʌ ŋ k ʃ ɪ̈ n
funds	f ə n d z
furcal	f ɜː k ə ɫ
furcal	f ɝ k ə ɫ
furrier	f ɝ i ɚ
furrier	f ɝˑ i ɚ
fursona	f ɵː s ɐ ʉ n ɜ
furtive	f ɜː ɾ ɪ v
futtock	f ə ɾ ə k
fye	f aː ə
fye	f äː ə
gaeltacht	ɡ e ɪ l t ə x t
gahmen	ɡ ɑː ˧ m ə n ˦
gangtok	ɡ æ ŋ t ɒ k
gasoline	ɡ æ s ɵ l i n
gaumy	ɡ ɔː m i
geaux	ɡ o ʊ
gel	d͡ʒ ɛ ɫ
genetic	d͡ʒ ə n ɛ t ɪ k
genetic	d͡ʒ ɪ n ɛ t ɪ k
genkan	ɡ ɛ ŋ k ɑ n
gentle	d͡ʒ ɛ̃ ɾ̃ l̩
gentleman	d͡ʒ ɛ ɾ̃ ɫ̩ m ə n
gewürztraminer	ɡ ə v ɝ t s t ɹ ə m iː n ɚ
ghee	ɡʱ iː
ghetto	ɡ ɛ ɾ o ʊ̯
ghettoize	ɡ ɛ ɾ o ʊ̯ a ɪ̯ z
gilt	ɡ ɪ ɫ t
girl	ɡ ʏ w
glass	ɡ l a s
glass	ɡ l e ə s
glass	ɡ l äː s
glass	ɡ l æ s
glass	ɡ l ɐː s
glass	ɡ l ɑː s
glass	ɡ l ɛ ə s
glitter	ɡ l ɪ ɾ ɚ
glizzy	ɡ l ɪ z i
glockenspiel	ɡ l ɔ k ŋ̍ ʃ p iː l
glory	ɡ l o ɹ i
glottal	ɡ l ɑ ɾ l̩
glottal	ɡ l ɔ ɾ l̩
gmail	d͡ʒ iː m e ɪ l
go	ɡ o ʊ
go	ɡ u
go	ɡ ɐ ʉ
go	ɡ ə ʉ
go	ɡ ə ʊ
goal	ɡ o ɫ
goal	ɡ ɒ ʊ ɫ
goat	ɡ o ʊ ʔ t̚
goathouse	ɡ o ʊ ʔ t̚ h a ʊ s
goebbels	ɡ o ʊ b l̩ z
goebbels	ɡ ɚ b l̩ z
gold	ɡ ɒ ʊ ɫ d
gold	ɡ ɔ ʊ ɫ d
golden	ɡ ɒ ʊ̯ ɫ d n̩
golden	ɡ ə ɫ d n̩
gone	ɡ ɑ n
gonna	ɡ o ʊ ɪ n ə
gonna	ɡ o ʊ ɪ ŋ t ə
good	ɡ ɪ̈ d
good	ɡ ʊ̈ d
gotta	ɡ ɑ ɾ ə
gotta	ɡ ɒ ʔ ə
gotten	ɡ ɑ t̚ n̩
gotten	ɡ ɑ ʔ n̩
gout	ɡ ʌ u t
gowk	ɡ æ ʊ̯ˀ k
graffito	ɡ ɹ ə f i ɾ o ʊ̯
grandfather	ɡ ɹ̠ʷ ẽˑ ə̯̃ n d f ɑˑ ð ɚ
grass	ɡ ɹ̠ a s
grass	ɡ ɹ̠ e ə s
grass	ɡ ɹ̠ äː s
grass	ɡ ɹ̠ æ s
grass	ɡ ɹ̠ ɐː s
grass	ɡ ɹ̠ ɑː s
grass	ɡ ɹ̠ ɛ ə s
grated	ɡ ɹ e ɪ̯ ɾ ɪ d
gratified	ɡ ɹ æː ɾ ɨ f a ɪː d̚
grating	ɡ ɹ e ɪ̯ ɾ ɪ ŋ
grivna	ɡ ɹ ɪ v n ɑ
grow	ɡ̊ ɹʷ ə ʊ̯
grow	ɡ̊ ɻʷ o ʊ̯
grows	ɡ ɹ o ʊ̯ z
grows	ɡ ɹ ə ʊ̯ z
grr	ɡ ɚːː
guesstimate	ɡ ɛ s t ɪ̈ m e ɪ̯ ʔ t̚
guesstimate	ɡ ɛ s t ɪ̈ m ɪ̈ ʔ t̚
guileless	ɡ a ɪ ɫ l ə s
guttural	ɡ ʌ ɾ ɚ ɫ̩
gyatt	ɟ j æ ʔ
gyatt	ɡ j æ t
gyatt	ɡ j æ ʔ
gyros	d͡ʒ a ɪ ɹ o ʊ z
h	h eː t͡ʃ
h	h æ ɪ t͡ʃ
h	æ ɪ t͡ʃ
ha	h aː
habitat	h æ b ɪ t æ ʔ
hadith	h a d iː θ
hah	h aː
hail	h e ɪ̯ ɫ
hair	h i ə
hair	h ɛ ɚ
halse	h aː s
halse	h oː s
halse	h oː z
hand	h e ə n d
hand	h ɛ ə n d
hand	h ɛː n d
hang	h e ɪ ŋ
hanger	h e ɪ ŋ ɚ
hangnail	h e ɪ ŋ n e ɪ̯ ɫ
hapa	h a p ɐ
hapa	h a p ə
happening	h æ p n ɪ n
harvard	h aː v ə d
harvard	h aː v ɪ d
harvard	h äː v ə d
hat	h a t
hat	h ɛ t
hawaii	h ʊ̈ w a ɪ̯ j i
hawaii	h ʊ̈ w ɑ j i
hawaii	h ʊ̈ w ɔ j i
he	h i
he	ç i
health	h ɛ l̪ θ
heartbeat	h ɑ ɹ ʔ b i ʔ
heat	ç i t
heighten	h a ɪ̯ t n̩
heighten	h a ɪ̯ ʔ n̩
herepath	h ɛ ɹ ə pʰ ɑː θ
hero	h ɪ ə ɹ ə ʊ ~ ç ɪ ə ɹ ə ʊ
hexadecile	h ɛ k s ə d iː s a ɪ ɫ
hibernation	h a ɪ b əː n e ɪ ʃ n̩
hibernation	h a ɪ b ɚ n e ɪ ʃ n̩
high	h a ɪ̯
hill	h ɪ ɫ
hiller	h ɪ l ə ɹ
hiller	h ɪ ɫ l ɚ
him	ɪ̈ m
hinoki	h i n o k i
hinter	h ɪ ɾ̃ ɚ
hitherto	h ɪ ð ə tʰ uː
hitherto	h ɪ ð ɚ tʰ u
hitter	h ɪ ɾ ɚ
hmm	m̥ m̩ ˦˨
hmmm	m̥ m̩ː ˦˨
hold	h o ə ɫ d
hold	h ə ʊ ɫ d
holding	h o ʊ ɫ d ɪ ŋ
holding	h ə ʉ ɫ d ɪ ŋ
holding	h ə ʊ ɫ d ɪ ŋ
hole	h o ɫ
hole	h ɔ ʊ ɫ
hole	h ɞ ʉ ɫ
holey	h ɒ ʊ l i
holey	h ɒ ʊ ɫ l i
holier	h ɒ ʊ l i ə
holier	h ɒ ʊ ɫ l i ə
holiest	h ɒ ʊ l i ɪ s t
holiest	h ɒ ʊ ɫ l i ɪ s t
hollywood	h ɑ ɫ i w ʊ d
hollywood	h ɒ ɫ i w ʊ d
homophobe	h ɒ m ə f ə ʊ b
homophobe	h ə ʊ m ə f ə ʊ b
hon	m̥ ɑ n
honyock	h ɑ n j ɑ k
hood	h ɪ̈ d
hood	h ʊ̈ d
hoot	h ï ɯ t
hooter	h u ɾ ɚ
hordesman	h ɔː d z m n̩
horse	h o̝ː s
horse	h o̞ ɹ s
horus	h ɔː ɹ ə s
hottie	h ɑ ɾ i
housemother	h a ʊ s m ɐ ð ə ɹ
houston	h j̊ uː s t ɨ n
houston	j̊ uː s t ɨ n
hubris	ç j u̟ː b ɹ̠ʷ ɪ s
hue	ç u
hue	ç u̟ː
hue	ç ʉː
huge	h ʊ u d ʒ
huge	ç u̟ː d͡ʒ
huguenot	ɕ u ɡ ə n ɒ t
huh	h ə̃
huh	h ʌ̃
hui	h ʉ w iː
human	ç j u̟ m n̩
human	ç j u̟ m ə n
human	ç j u̟ː m n̩
human	ç j u̟ː m ə n
humanist	h ç uː m ə n ɪ s t
humanist	ç uː m ə n ɪ s t
humanity	h j u m æ n ɪ ɾ i
humongous	ç u̟ː m ɐ ŋ ɡ ə s
humongous	ç u̟ː m ʊ ŋ ɡ ə s
hump	h ɐ m̥ p
humph	h ə ɱ f
humph	h ɱ̩ f
humph	ɱ̊ ɱ̩ f
humvee	h ʌ m β iː
humvee	h ʌ ɱ v iː
hunter	h ʌ ɾ̃ ɚ
hydra	h a ɪ̯ d ɹ ə
hydra	h a ɪ̯ d͡ʒ ɹ ə
hydrogen	h a ɪ d͡ʒ ɹ ə d͡ʒ ə n
hydropsy	h a ɪ̯ d ɹ ɑ p s i
hyperhidrosis	h a ɪ p ə ɹ h a ɪ d ɹ o ʊ s ɪ s
hypnotic	h ɪ p̚ n ɑ ɾ ɪ k̚
hypotenuse	h a ɪ p ɑ ʔ ə n uː s
hypotenuse	h a ɪ p ɒ ʔ n̩ j uː z
háček	h a t͡ʃ ɛ k
háček	h aː t͡ʃ e k
háček	h aː t͡ʃ ɛ k
háček	h æ t͡ʃ ɛ k
háček	h ɐː t͡ʃ e k
háček	h ɑ t͡ʃ ɛ k
háček	h ɑ ə t͡ʃ ɛ k
háček	h ɑː t͡ʃ ɛ k
háček	ɦ ɑː t͡ʃ ɛ k
i	a ɪ̯
i	aː
i	ɑ e̯
ice	ʌ ɪ s
iced	a ɪ̯ s t
identity	a ɪ d ɛ n ə ɾ i
identity	a ɪ d ɛ n ɪ ɾ i
illegal	ɪ ɫ l i ɡ ə ɫ
illegitimate	ɪ l ɨ d͡ʒ ɪ ɾ ə m e ɪ t
illegitimate	ɪ l ɨ d͡ʒ ɪ ɾ ə m ɨ t
illusion	ɪ l uː ʒ ə n
imma	aː m ə
important	ɪ m pʰ ɔ ɹ ʔ n̩ t
important	ɪ m pʰ ɔː t ə n t̚
important	ɪ m pʰ ɔː ʔ n̩ ʔ
inamorata	ɪ n æ m ɒ ɹ ɑː t ə
inamorata	ɪ n æ m ə ɹ ɑː ɾ ə
incalculable	ɪ n kʰ æ ɫ k j ə l ə b l̩
incidental	ɪ n s ɪ d ɛ n tʰ ə l
incidental	ɪ n s ɪ d ɛ ɾ̃ ə l
incommunicado	ɪ n k ə m j u n ɨ k ɑː d o ʊ
incredible	ɪ̈ ŋ k ɹ̥ʷ ɛ ɾ ə b ə ɫ
incredible	ɪ̈ ŋ k ɹ̥ʷ ɛ ɾ ə b ɫ̩
incubator	ɪ n k j uː b e ɪ ɾ ə ɹ
incubator	ɪ n k j uː b e ɪ ɾ ɚ
indefatigable	ɪ n d ə f æ ɾ ɪ ɡ ə b ə l
indical	ɪ n d ɪ k l̩
inequality	ɪ n ɪ k w ɑ l ɪ ɾ i
inexorably	ɪ n ɛ ɡ z ə ɹ ə b l i
inference	ɪ ɱ f ə ɹ ə n s
inference	ɪ ɱ f ɚ ə n s
inference	ɪ ɱ f ɹ ə n s
inferrible	ɪ n f ə ɹ ɪ b l̩
inhalation	ɪ n ɦ ə l e ɪ ʃ n̩
input	ɪ m p ʊ t
input	ɪ n p ʊ t
inscripturating	ɪ n s k ɹ ɪ p t͡ʃ ə ɹ e ɪ ɾ ɪ ŋ
insensible	ɪ n s ɛ n̥ s ɪ b l̩
insolvency	ɪ n s ɒ l v n̩ s i
installation	ɪ n s t ə l e ɪ ʃ ə n
intangible	ɪ n t æ n d͡ʒ ɪ b l̩
intelligibility	ɪ n t ɛ l ə d͡ʒ ə b ɪ l ə ɾ i
intelligibility	ɪ n t ɛ l ə d͡ʒ ə b ɪ l ɪ ɾ i
intentional	ɪ n tʰ ɛ n ʃ n̩ ɫ̩
interchangeable	ɪ ɾ̃ ɚ t͡ʃ e ɪ n d͡ʒ ə b l̩
interconnect	ɪ n ɾ ɚ k ə n ɛ k t
interconnect	ɪ ɾ̃ ɚ k ə n ɛ k t
international	ɪ n t ə n æ ʃ ə n ə ɫ
international	ɪ n t ɚ n æ ʃ ə n ə ɫ
international	ɪ ɾ̃ ɚ n æ ʃ ə n ə ɫ
internet	ɪ ɾ̃ ɚ n ɛ t
internet	ɪ ɾ̃ ɚ n ɛ t̚
interstate	ɪ ɾ̃ ɚ s t e ɪ̯ t
investigate	ɪ n v ɛ s t ɪ ɡ e ɪ̯ t
invincibility	ɪ n v ɪ n s ə b ɪ l ə ɾ i
ipa	a ɪ pʰ iː e ɪ
ireland	a ɪ ɚ l ə n d
ireland	ä ɪ ɚ ɫ ɪ̈ n d
ireland	ɑ ɚ l ə n d
ireland	ɑ ɪ ə l ə n d
ireland	ɑ ɪ ɚ l ə n d
ireland	ə ɪ ɚ l ə n d
ireland	ʌ ɪ ɚ l ə n d
it	ɪ t
it	ɪ̈ t
it'll	ɪ t̬ l̩
item	a ɪ̯ ɾ m̩
item	a ɪ̯ ɾ ə m
ith	a ɪ̯ θ
jabberwocky	d͡ʒ æ b ɚ w ɑ k i
jar	d͡ʒ aː ɹ
jar	d͡ʒ ɐː ɹ
jar	d͡ʒ ɑ ɹ
jarring	d͡ʒ aː r ɪ ŋ
jarring	d͡ʒ ɑː r ɪ ŋ
jialat	t͡ɕ j ɑː ˨ l ɐ t̚ ˦
jitter	d͡ʒ ɪ ɾ ɚ
joged	d͡ʒ o ɡ ə d
joget	d͡ʒ o ɡ ɛ t
jukskei	j ɵ k s k ɛ ɪ
jump	d͡ʒ ɐ m̥ p
juniper	d͡ʒ u n ɪ̈ p ɚ
jupiter	d͡ʒ u p ɪ ɾ ɚ
jury	d͡ʒ ʊ ə ɹ̠ i
kamp	kʰ e ə m p
kamp	kʰ ɛ ə m p
kana	kʰ ɑː n ə
kapok	k ɑː p ə ʊ ʔ
kardashian	kʰ ɑ ɹ d æ ʃ i ə n
karma	k ɑ ɹ m ə
karma	k ɑː m ə
karma	k ə ɾ m ə
kash	k a ʃ
katana	k ɪ̈ tʰ ɑ n ə
katy	kʰ e ɪ̯ ɾ i
kaypoh	k eˑ ˨ p oː ˨˦
kebnekaise	k ɛ b n ə k a i s ə
keep	kʰ i p̚
keloid	k iː l ɔ ɪ d
kelvin	kʰ ɛ ɫ v ɨ n
kena	k ə ˧ n ä ˦
kenya	k ɛ ɲ a
kept	kʰ ɛ p t̚
kettle	kʰ ɛ tᵊ ɫ̩
kettle	kʰ ɛ ɾ ɫ̩
khalass	k a l a s
khalass	k æ l æ s
khalass	k ə l a s
khalass	k ə l æ s
khalassed	k a l a s t
khalassed	k æ l æ s t
khalassed	k ə l a s t
khalassed	k ə l æ s t
khmer	kʰ ə m ɛ ɹ
kiasi	k j ã ˨ s iː ˦˨
kiasu	k j ã ˨ s u
kick	kʰ ɪ k
kiddie	kʰ ɘ ɾ iː
kiddie	kʰ ɪ ɾ i
kiddy	kʰ ɘ ɾ iː
kiddy	kʰ ɪ ɾ i
killer	kʰ ɪ l ə ɹ
killer	kʰ ɪ ɫ l ɚ
kimono	k ɪ̈ m o ʊ̯ n o ʊ̯
kimono	k ɪ̈ m o ʊ̯ n ə
kimonoed	k ɪ̈ m o ʊ̯ n o ʊ̯ d
kimonoed	k ɪ̈ m o ʊ̯ n ɪ̈ d
kindergarten	kʰ ɪ n d ə ɹ ɡ ɑː ɹ t̬ ə n
kindergarten	kʰ ɪ ɾ̃ ə ɹ ɡ ɑː ɹ ʔ n̩
kirton	k ɝ ʔ n̩
kiss	kʰ ɪ s
kitty	kʰ ɘ ɾ iː
kitty	kʰ ɪ ɾ i
knar	n ɑ ɹ
knar	n ɑ ˞
knout	n ʌ ʊ t
koizumi	kʰ ɔ i̯ z u m i
kopitiam	k o ˧ p i ˧ t j a m ˦
kopitiam	k o ˨ p i ˨ t j a m ˩
korea	kʰ ɵ ɹ i ə
korea	kʰ ɵ ɹ iː ə
kratom	k ɹ e ɪ̯ t ə m
kumara	kʰ ʉː m ɐ ɾ ɐ
kumara	kʰ ʉː m ə ɹʷ ɐ
kweng	k w ɛ ŋ
l	l
l	w
l	ɫ
la	ɛ ɫ l e j
ladder	l æ ɾ ɚ
lamb	l ɛ ə m
lambrusco	l æ m b ɹ ʊ s k o ʊ
lambrusco	l æ m b ɹ ʊ s k ə ʊ
lamina	l ɛ ə m ɪ n ə
lamp	l e ə m p
lamp	l ɛ ə m p
lamp	l ɛː m p
land	ɫ e ə̯ n d
lander	l æ n d ə
lander	l æ n d ɚ
language	l e ɪ ŋ ɡ w ɪ d͡ʒ
languages	l e ɪ ŋ ɡ w ɪ d͡ʒ ɪ z
lar	l ɑ ɹ
lar	l ɑ ˞
lastborn	l æ s t b ɔ ɚ̯ n
lastborn	l ɑː s t b ɔː n
later	l e ɪ̯ ɾ ɚ
latin	l æ ʔ n̩
latter	l æ ɾ ɚ
learner	l ɝ n ɚ
leaven	l ɛ v n̩
leeway	l iː w e ɪ
lepak	l eː p ɑ k̚
leung	l œ ŋ
li'l	l ɪ ɫ
li'l	l ɪ ɫ̩
liable	l a ɪ̯ ə b ə ɫ
liable	l a ɪ̯ ə b ɫ̩
liao	l j a ʊ ˨˩
liberty	l ɪ b ɚ ɾ i
liberty	l ɪ b ɪ ɾ i
libre	l i b ʁ
licensed	l a ɪ s n̩ s t
light	ɫ ɐ ɪ̯ ʔ
lighten	l a ɪ t n̩
lighten	l a ɪ ʔ n̩
lighter	l a ɪ ɾ ɚ
lightning	l ɐ ɪ̯ ʔ n ɪ ŋ
lightning	l ʌ ɪ̯ ʔ n ɪ ŋ
limpeh	l ɪ m ˨˦ p eː ˨
lincolnshire	l i ŋ kʰ ə̆ n ʃ ɚ
line	l ɑ e̯ n
listen	l ɪ s n̩
liter	l i ɾ ɚ
literary	ɫ ɪ ɾ ə ɹ ɛ ə ɹ i
litre	l i ɾ ɚ
litter	l ɪ ɾ ɚ
little	l ɪ tʰ ɫ̩
little	l ɪ ɾ ɫ̩
little	ɫ ɪ ɾ ɫ̩
littlest	l ɪ ɾ l̩ ə s t̚
llandeilo	ɬ a n d ə ɪ l oː
llanrumney	ɬ a n r ɜ m n i
llanrwst	ɬ a n r u s t
lobang	l o ˧ b ä ŋ ˦
loiter	l ɔ ɪ ɾ ɚ
longer	l ɑ ŋ ə ɾ
loofball	l ʊ ʔ f̚ b ɔː l
love	l ɘ v
love	l ɘ ʋ
love	l ʌ v
love	ɫ ä v ~ ɫ ɐ v
love	ɫ ʌ v
luck	l ɐ k
luddite	l ʌ ɾ ʌ i t
lulls	l ɐ ɫ z
lulls	ɫ ʌ ɫ z
lunch	l ʌ̃ n t͡ʃ
lycra	l a ɪ k ɹ ə
m'kay	ŋ k e ɪ
ma'am	m e ə m
ma'am	m ɛ ə m
madder	m a d ə ɹ
madder	m æ ɾ ɚ
madhhab	m æ ð h æ b
mailed	m e ɪ ɫ d
maintenance	m ẽ ɪ̃ n ʔ ə n ə n s
makati	m ə k ɑ d ɪ
make	m e ɪ kʲ
mald	m oː ɫ d
mald	m ɒ ʊ ɫ d
malinois	m æ l ɪ n w ɑː
malleable	m a ɫ i ə b ə ɫ
malleable	m æ ɫ i ə b ɫ̩
malleable	m ɛ ɫ i ə b ɫ̩
mamaliga	m ə m ə l i ɡ ə
man	m e ə n
man	m ɑ n
man	m ɛ n
man	m ɛ ə n
man	m ẽ ə̃ n
manager	m e ə n ə d͡ʒ ɚ
mango	m ɛ ə ŋ ɡ o ʊ
manhattan	m n̩ h æ t n̩
manicotti	m e ə n ə kʰ ɑ ɾ i
manicotti	m æ n ə k ɑ t̚
manipulative	m ə n ɪ p j ə l e ɪ ɾ ɪ v
maori	m ɑː ɔ ɾ i
mar	m ɑ ɹ
mar	m ɑ ˞
marga	m ɑː ɡ ɐ
marten	m ɑ ɹ ʔ n̩
martyr	m ɐː t ə ɹ
martyr	m ɐː ɾ ə ɹ
martyr	m ɑ ɹ ɾ ɚ
mash	m a ʃ
mash	m æ ʃ
mat	m æ ʔ t̚
mawky	m ɔː k i
maybe	m e ɪ̯ b i
meadow	m ɛ ɾ o ʊ
meal	m iː ʟ̩
mechanism	m ɛ k ə n ɪ z m̩
medal	m e ɾ ɫ̩
medal	m ɛ d ɫ̩
medal	m ɛ ɾ ɫ̩
meddle	m ɛ ɾ ə ɫ
mediocrity	m i d ɪ ɑ k ɹ ɪ ɾ i
medulla	m ə d ɐ l ə
medulla	m ə d ʉ ɫ ə
medulla	m ɛ d ɐ l ə
meehan	m i ɪ n
meehan	m iː h æ̝ː n
meeting	m i ɾ ɪ ŋ
megameter	m ɛ ɡ ɐ m ɪ ɾ ɚ
melodic	m ə l ɑ ɾ ɪ k
mensuration	m ɛ n ʃ ə ɹ e ɪ ʃ n̩
mental	m ɛ n ɘ l
mental	m ɛ ɾ̃ ɘ l
mersh	m ɝ ʃ
merveilleuse	m ɛ ʁ v ɛ j ø z
merveilleux	m ɛ ʁ v ɛ j ø
meta	m iː ɾ ə
meta	m ɛ ɾ ə
metabolism	m ə t æ b ə l ɪ z m̩
metabolism	m ɪ t a b ə l ɪ z m̩
metabolism	m ɪ t æ b ə l ɪ z m̩
metadata	m e t ə d æ ɪ ɾ ə
metadata	m ɛ ɾ ə d e ɪ ɾ ə
metairie	m ɛ ɾ ə ɹ i
metathesis	m ə tʰ æ θ ə s ə s
metathesis	m ɛ tʰ æ θ ə s ɪ s
metaverse	m ɛ ɾ ə v ɝ s
meteor	m iː ɾ i ɚ
meter	m i ɾ ɚ
methoxphenidine	m ɛː θ ɑ k s f ɛː n ɨ ɾ ĩː n
metic	m ɛ ɾ ə k
metre	m iː ɾ ɚ
mhm	m̩ m̥ m̩ ˥
michael	m ɐ ɪ k ɫ̩
michigander	m ɪ ʃ ə ɡ æ n d ɚ
micrometer	m a ɪ k ɹ o ʊ m iː ɾ ɚ
micrometer	m a ɪ k ɹ ɑ m ɪ ɾ ɚ
middle	m ə d ɯ ɫ
middle	m ɪ d ə ɫ
middle	m ɪ d ʊ
middle	m ɪ ɾ ɫ̩
middle	m ɪ̝ d ə ɫ
middle	m ɪ̝ d ʊ
middleman	m ɪ d ɫ̩ m æ n
midst	m ɪ d s t
midst	m ɪ t s t
mightn't	m a ɪ ʔ n̩ ʔ
mighty	m ʌ ɪ ɾ i
mike	m ɐ ɪ ʔ k̚
mikey	m ɐ ɪ kʰ iː
mile	m a ɪ̯ ɫ
milk	m ɛ l k
milkshake	m ɪ ɫ k ʃ e ɪ k
mill	m ɪ ɫ
million	m ɪ ʎ ə n
mindful	m a ɪ n d f l̩
mindful	m ɑ ɪ n d f l̩
mindful	m ʌ ɪ n d f l̩
minecraft	m a ɪ̯ ŋ k ɹ æ f t
minnesota	m ɪ n ɪ s o ʊ ɾ ə
minnesotan	m ɪ n ə s o ʊ ʔ n̩
minter	m ɪ ɾ̃ ɚ
mirth	m ɝ θ
mister	m ɪ s t ə ɹ
mister	m ɪ s t ɚ
mmm	m̩ː
model	m ɑ ɾ ɫ
molasses	m ə l æ s ɪ z
molasses	m ɵ l æ s ɪ z
mole	m ɔ ʊ ɫ
moms	m ɑ m z
moncion	m o ʊː s i õː n
money	m ɐ n i
moneyball	m ɐ n i b ɔː l
montagnard	m ɑ n t ə n j ɑ ɹ d
montagnard	m ɑ̃ⁿ t ə n j ɑ ˞ d
montagnard	m ɒ n t ə n j ɑː d
montagnard	m ɒ̃ⁿ t ə n j ɑː d
month	m ɐ n̪ θ
month	m ʌ n̪ θ
moor	m öː ə̯ ~ m ʊ̈ː ə̯
morgue	m o̞ ɹ ɡ
morkin	m o̞ ɹ k ɪ n
morn	m o̞ ɹ n
morne	m o̞ ɹ n
morning	m oː n ɪ ŋ
morning	m o̞ ɹ n ɪ̃ ŋ
morné	m o̞ ɹ n e ɪ
moron	m o̞ ɹ ɑ n
mosquitoey	m ə s k i ɾ o ʊ i
mother	m ɐ ð ə ɹ
motlopi	m o ʊ ʔ l o ʊ p i
motlopi	m ə ʊ t̚ l ə ʊ p i
motor	m o ʊ ɾ ɚ
motorcycle	m o ʊ ɾ ɚ s a ɪ k l̩
mount	m a ʊ n t
mount	m a ʊ n ʔ
mount	m ã ʊ̃ n ʔ
mountain	m a ʊ n t n̩
mountain	m ã ʊ̯̃ n ʔ n̩
mountain	m æ̃ ʊ̯̃ n ʔ n̩
mountaineer	m ã ʊ̯̃ n ʔ n̩ i ə ɹ
mountaineer	m æ̃ ʊ̯̃ n ʔ n̩ i ə ɹ
mountainous	m æ ʊ n t n̩ ə s
mourne	m o̞ ɹ n
mugwump	m ə ɡ w ə m p
mugwumps	m ə ɡ w ə m p s
mulga	m ɔ ʊ l ɡ ɐ
multiplayer	m ɐ ɫ t i p l̥ e ɪ̯ ə
multiplayer	m ʌ ɫ t i p l̥ e ɪ̯ ɚ
multiplier	m ʌ ɫ t ɪ p l a ɪ ə ɹ
multiplier	m ʌ ɫ t ɪ p l a ɪ ɚ
munter	m ʊ n t ə r
murr	m ɜː ɹ
murr	m ɝ
museum	m j u z ɛ ə m
mustang	m ʌ s t æ ŋ
mustard	m a s t ə d
mustard	m ɐ s t ə d
mustard	m ʊ s t ə d
mustard	m ʌ s t ɚ d
mutability	m j u ɾ ə b ɪ l ə ɾ i
mutable	m j uː t ə b l̩
mutton	m ʌ ʔ n̩
mykad	m a ɪ kʰ ɑː d
myrrh	m ɜː ɹ
myrrh	m ɝ
myrtle	m ɝ t ɫ̩
myrtle	m ɝ ɾ ɫ̩
nah	n æː
nah	n ɑː
nah	n ẽː
nail	n e ɪ̯ ɫ
nares	n e ɹ iː z
nares	n æ ɹ iː z
nares	n ɛ ə ɹ i z
narration	n æ ɹ e ɪ ʃ n̩
narration	n ə ɹ e ɪ ʃ n̩
narration	n ɛ ɚ ɹ e ɪ ʃ n̩
nature	n æ e t ʃ ə
nature	n ɐ e t ʃ ə
nauruan	n ɑː uː ɹ uː n̩
nautical	n ɑ ɾ ɪ k l̩
nautical	n ɔ ɾ ɪ k l̩
near	n ɪː
neato	n i ɾ o ʊ̯
need	n ɪ i̯ d
neutral	n uː t͡ʃ ɹ ə l
nevada	n ə v æ ɾ ə
nevada	n ə v ɑ ɾ ə
newcastle	n j u kʰ æ s ɫ̩
newcastle	n j ʉ kʰ a s ɫ̩
newcastle	n j ʉ kʰ ɑː s ɫ̩
newcomer	n j u kʰ ʌ m ɚ
nextborn	n ɛ k s t b ɔ ɚ̯ n
nextborn	n ɛ k s t b ɔː n
ng	m̩
ng	ŋ̍
nigcel	n ɪ ɡ s ɛ ɫ
niggard	n ɪ ɡ ə d
niggard	n ɪ ɡ ɚ d
niggered	n ɪ ɡ ə d
niggered	n ɪ ɡ ɚ d
nightmare	n ʌ ɪ ʔ m ɛ ə ɹ
nighttime	n a ɪ ʔ t a ɪ m
nilotic	n a ɪ l ɑ ɾ ɪ k
nine	n a ɪ̯ n
nippon	n ɪ p ɒ n
nippon	n ɪ pʰ ɑ n
nitrate	n a ɪ̯ tʰ ɹ e ɪ̯ t
nitrogen	n ɐ ɪ tʰ ɹ ə d͡ʒ ə n
nizz	n ɪ z
nominal	n ɑ m ɪ n l̩
nominal	n ɒ m ɪ n l̩
nonalphanumeric	n ɑ n æ l f ə n u m ɛ ɚ̯ ɪ k
nonalphanumeric	n ɒ n æ l f ə n j uː m ɛ ɹ ɪ k
nonna	n o ʊ̯ n ɐ
nonna	n ɔ nː ɐ
nonna	n ɔ nː ə
nope	n o ʊ p̚
normality	n ɔ ɹ m æ l ɪ t̬ i
norse	n o̞ ɹ s
north	n o̞ ɹ θ
norville	n ɔː ɹ̩ v ə ɫ
not	n ɑ ʔ t
not	n ɒ t
not	n ɒ ʔ t
not	n ɞ ʔ t
noted	n o ʊ ɾ ɪ d
noted	n ə ʉ ɾ ɪ d
nothing	n ʌ ʔ n̩
notice	n o ʊ ɾ ɪ s
novel	n ɒ v l̩
nowt	n a ʊ ʔ
nowt	n ə ʊ ʔ
numeration	n j uː m ə ɹ e ɪ ʃ ə n
numeration	n u m ɚ e ɪ ʃ ə n
nut	n ɐ t
nymphid	n ɪ m f ɪ d
o'malley	o ʊ̯ m æ l i
o'malley	ɵ m æ l i
o'th'	ə ʔ
o'th'	əˑ
obnubilation	ɒ b n j uː b ɪ l e ɪ ʃ n̩
octagram	ɑ k t ə ɡ ɹ æ m
octagram	ɒ k t ə ɡ ɹ æ m
october	ɑ k tʰ o ʊ b ɚ
odder	ʔ ɑ ɾ ɚ
oftentime	ɒ f n̩ t a ɪ m
oftentime	ɒ f t n̩ t a ɪ m
oil	ɔ ɪ ə ɫ
ointment	ɔ̃ ɪ̃ n ʔ m ɪ̃ n ʔ
old	ɒ ʊ ɫ d
old	ɔ ʊ ɫ d
omphalocele	ɑ m p ɸ ə l ə s i l
omphalocele	ɑ m ɸ æ l ə s i l
omphalocele	ɑ ɱ f æ l ə s i l
omphalocele	ɑ ɱ p̪ f ə l ə s i l
one	w ä n
oni	o ʊ n iː
oop	ɤ p
ope	o ʊ p̚
opinionated	ə p ɪ n j ə n e ɪ ɾ ɪ d
oplan	ɒ pʰ l̥ æ n
oppose	ʔ ə pʰ o ʊː z̥
order	ɔ ɹ ɾ ɚ
orh	ɔ ˧˨
orh	ɔ ˨
origami	ɔ ɹ ɪ̈ ɡ ɑ m i
otaku	o̞ ʊ̯ tʰ ɑ kʰ u
otaku	ə ʊ̯ tʰ ɑː kʰ uː
other	ä ð ə
other	ɐ ð ə
ottawa	ɑ ɾ ə w ə
otter	ʔ ɑ ɾ ɚ
our	ɑ ɹ
our	ɑ ˞
outer	a ʊ ɾ ɚ
outta	a ʊ t ə
outta	a ʊ ɾ ə
outta	a ʊ ʔ ə
outta	aː ɾ ə
outta	æː ɾ ə
outta	ʌ ʊ ɾ ə
ovated	o ʊ̯ v e ɪ̯ ɾ ɪ d
ovated	ə ʉ v æ ɪ̯ ɾ ɪ d
ovated	ə ʊ̯ v e ɪ̯ t ɪ d
ovation	o ʊ v e ɪ ʃ n̩
ovation	ə ʊ v e ɪ ʃ n̩
pack	pʰ æ k
package	pʰ a k ɛ d͡ʒ
paddle	pʰ æ ɾ ɫ̩
paddy	pʰ æ ɾ i
pah	pʼ a
pah	pʼ aʰ
pail	pʰ e ə ɫ
pail	pʰ e ɪ̯ ɫ
paiseh	pʰ a ɪ ˨˦ s e ˨˩
paktor	pʰ ɑ ʔ tʰ ɔː
pal	pʰ æ l
pale	pʰ e ə ɫ
pale	pʰ e ɪ̯ ɫ
pamper	p ɛ ə m p ɚ
pandemia	p æ n d iː m ɪ ə
pansentience	p æ n s ɛ n t ʃ i ə n s
pantry	p a n tʰ ɹ̥ i
pantry	p e ə n tʰ ɹ̥ i
pantry	p æ n tʰ ɹ̥ i
paper	p e ɪ p ə r
paper	p eː p ə r
paper	pʰ e ɪ p ɚ
par	pʰ ɑ ɹ
par	pʰ ɑ ˞
parameter	p ə ɹ æ m ə ɾ ɚ
parcel	pʰ aː s ə ɫ
parcel	pʰ ɑ ɹ s ə ɫ
parcel	pʰ ɑː s ə ɫ
pardon	pʰ äː ɾ ɘ n
pardon	pʰ ɑ ˞ d n̩
park	p ɑ ɹ k
park	pʰ aː k
park	pʰ äː k
park	pʰ ɐː k
park	pʰ ɑ ɹ k
park	pʰ ɑː k
park	pʰ ɒ ə k
paroch	pʰ ä ɾ ə t ʃ
parole	pʰ ə ɹ ə ʊ ɫ
parole	pʰ ə ɹʷ o ʊ ɫ
parole	pʰ ɹ̩ o ʊ ɫ
parse	pʰ ɑː z
partay	pʰ ɑ ɹ tʰ e ɪ̯
partner	p ɑ ɹ ʔ n ɚ
party	pʰ ɑ ɹ ɾ i
party	pʰ ɑː ɾ i
pascal	pʰ æ s k æ ɫ
pascal	pʰ æ s kʰ æ ɫ
pass	pʰ a s
pass	pʰ aː s
pass	pʰ e ə s
pass	pʰ e ə̯ s
pass	pʰ ä s
pass	pʰ äː s
pass	pʰ æ s
pass	pʰ ɐː s
pass	pʰ ɑː s
pass	pʰ ɛ ə s
passion	pʰ æ ʃ ə n
pat	pʰ æ t
pat	pʰ æ t̚
pat	pʰ æˀ t̚
patent	pʰ æ̝ ʔ n̩ t̚
path	pʰ a θ
path	pʰ e ə θ
path	pʰ äː θ
path	pʰ æ θ
path	pʰ ɐː θ
path	pʰ ɑː θ
path	pʰ ɛ ə θ
patrick	pʰ æ t̠ ɹ̠̊ ˔ʷ ɪ k̚
patting	pʰ æ ɾ ɪ ŋ
pattings	pʰ æ ɾ ɪ ŋ z
pay	pʰ e ɪ
pear	pʰ e ə
pearl	pʰ əː ɫ
pearl	pʰ ɚ ɫ
pearls	pʰ əː ɫ z
pearls	pʰ ɝ ɫ z
peculiar	pʰ ə kʰ j u l j ɚ
peculiar	pʰ ə kʰ j u l j ʊ ɹ̠
