'dine	d iː n
lighten	l a ɪ ʔ n̩
listen	l ɪ s n̩
little	l ɪ tʰ ɫ̩
loofball	l ʊ ʔ f̚ b ɔː l
luck	l ɐ k
lulls	l ɐ ɫ z
lulls	ɫ ʌ ɫ z
lunch	l ʌ̃ n t͡ʃ
lymph	l ɪ m p f
madder	m a d ə ɹ
madhhab	m æ ð h æ b
madow	m a d o w
madow	m æ d o w
madow	m ə d o w
mailed	m e ɪ ɫ d
maintenance	m ẽ ɪ̃ n ʔ ə n ə n s
make	m e ɪ kʲ
mald	m ɒ ʊ ɫ d
mald	m ɔː ɫ d
malleable	m a ɫ i ə b ə ɫ
malleable	m æ ɫ i ə b ɫ̩
malleable	m ɛ ɫ i ə b ɫ̩
mamaliga	m ə m ə l i ɡ ə
man	m e ə n
man	m ɛ ə n
man	m ẽ ə̃ n
mawky	m ɔː k i
maybe	m e ɪ̯ b i
meaningful	m iː n ɪ ŋ f l̩
mechanism	m ɛ k ə n ɪ z m̩
medal	m e ɾ ɫ̩
medal	m ɛ d ɫ̩
medal	m ɛ ɾ ɫ̩
meddle	m ɛ ɾ ə ɫ
medulla	m ə d ɐ l ə
medulla	m ɛ d ɐ l ə
mensuration	m ɛ n ʃ ə ɹ e ɪ ʃ n̩
mental	m ɛ n ɘ l
mental	m ɛ ɾ̃ ɘ l
metabolism	m ɪ t a b ə l ɪ z m̩
methoxphenidine	m ɛː θ ɑ k s f ɛː n ɨ ɾ ĩː n
mhm	m̩ m̥ m̩ ˥
middle	m ɪ d ə ɫ
middle	m ɪ d ʊ
middleman	m ɪ d ɫ̩ m æ n
midst	m ɪ d s t
midst	m ɪ t s t
mightn't	m a ɪ ʔ n̩ ʔ
mile	m a ɪ̯ ɫ
milkshake	m ɪ ɫ k ʃ e ɪ k
mill	m ɪ o̯
mill	m ɪ ɫ
mill	m ɪ ʊ̯
million	m ɪ ʎ ə n
misperception	m ɪ s p ə s ɛ p ʃ n̩
mister	m ɪ s t ə ɹ
mmm	m̩ː
molasses	m ə l æ s ɪ z
money	m ɐ n i
morning	m oː n ɪ ŋ
motlopi	m ə ʊ t̚ l ə ʊ p i
mount	m a ʊ n t
mount	m a ʊ n ʔ
mount	m ã ʊ̃ n ʔ
multiplayer	m ɐ ɫ t i p l̥ e ɪ̯ ə
multiplayer	m ʌ ɫ t i p l̥ e ɪ̯ ɚ
multiplier	m ʌ ɫ t ɪ p l a ɪ ə ɹ
multiplier	m ʌ ɫ t ɪ p l a ɪ ɚ
murr	m ɜː ɹ
murr	m ɝ
mustard	m a s t ə d
mustard	m ɐ s t ə d
mustard	m ʊ s t ə d
mustard	m ʌ s t ɚ d
mutable	m j uː t ə b l̩
mwah	ʘ
myrrh	m ɜː ɹ
myrrh	m ɝ
nah	n æː
nah	n ɑː
nah	n ẽː
nail	n e ɪ̯ ɫ
nares	n ɛ ə ɹ i z
narration	n ə ɹ e ɪ ʃ n̩
nature	n a e̯ t ʃ ɐ
nature	n æ e̯ t ʃ ɐ
nautical	n ɔː t ɪ k l̩
need	n ɪ i̯ d
nextborn	n ɛ k s t b ɔ ɚ̯ n
nextborn	n ɛ k s t b ɔː n
niggard	n ɪ ɡ ə d
niggered	n ɪ ɡ ə d
nighttime	n a ɪ ʔ t a ɪ m
nine	n a ɪ̯ n
nitrogen	n ɐ ɪ tʰ ɹ ə d͡ʒ ə n
nizz	n ɪ z
nominal	n ɒ m ɪ n l̩
nonalphanumeric	n ɑ n æ l f ə n u m ɛ ɚ̯ ɪ k
nonalphanumeric	n ɒ n æ l f ə n j uː m ɛ ɹ ɪ k
noodle	n uː d l̩
nope	n o ʊ p̚
normalization	n ɔː m ə l a ɪ z e ɪ ʃ n̩
normalization	n ɔː m ə l ə z e ɪ ʃ n̩
nose	n ə ʊ̯ z
not	n ɑ̈ ʔ t̚
not	n ɒ t
not	n ɒ ʔ t
not	n ɔ t
not	n ɞ ʔ t
nothing	n ʌ ʔ n̩
novel	n ɒ v l̩
numeration	n j uː m ə ɹ e ɪ ʃ ə n
numeration	n u m ɚ e ɪ ʃ ə n
numerical	n j u m ɛ ɹ ɪ k l̩
nut	n ɐ t
nuttin	n ʌ ʕ ɪ̃ n
nymphid	n ɪ m f ɪ d
obnubilation	ɒ b n j uː b ɪ l e ɪ ʃ n̩
observable	ə b z ɜː v ə b ɫ̩
octagram	ɑ k t ə ɡ ɹ æ m
octagram	ɒ k t ə ɡ ɹ æ m
oftentime	ɒ f n̩ t a ɪ m
oftentime	ɒ f t n̩ t a ɪ m
oil	ɔ ɪ ə ɫ
ointment	ɔ̃ ɪ̃ n ʔ m ɪ̃ n ʔ
old	ɒ ʊ ɫ d
old	ɔ ʊ ɫ d
omnipresent	ɒ m n ɪ p ɹ ɛ z n̩ t
oni	o ʊ n iː
oop	ɤ p
ope	o ʊ p̚
oplan	ɒ pʰ l̥ æ n
orange	ɒ ɹ ɪ n d͡ʒ
otaku	ə ʊ̯ tʰ ɑː kʰ uː
our	ɑ ɹ
our	ɑ ˞
outta	a ʊ t ə
outta	a ʊ ɾ ə
outta	a ʊ ʔ ə
outta	aː ɾ ə
outta	æː ɾ ə
outta	ʌ ʊ ɾ ə
ovated	ə ʊ̯ v e ɪ̯ t ɪ d
ovation	ə ʊ v e ɪ ʃ n̩
oversea	ə ʊ̯ v ə s iː
oversee	ə ʊ̯ v ə s iː
pack	pʰ æ k
package	pʰ a k ɛ d͡ʒ
paddle	pʰ æ ɾ ɫ̩
pail	pʰ e ə ɫ
pail	pʰ e ɪ̯ ɫ
pandemia	p æ n d iː m ɪ ə
pantry	p a n tʰ ɹ̥ i
parametric	p æ ɹ ə m ɛ t͡ʃ ɹ ɪ k
parcel	pʰ aː s ə ɫ
parcel	pʰ ɑ ɹ s ə ɫ
parcel	pʰ ɑː s ə ɫ
park	p ɑ ɹ k
park	pʰ äː k
park	pʰ ɑ ɹ k
park	pʰ ɑː k
park	pʰ ɒ ə k
parole	pʰ ə ɹ ə ʊ ɫ
parole	pʰ ə ɹʷ o ʊ ɫ
parole	pʰ ɹ̩ o ʊ ɫ
parse	pʰ ɑː z
pass	pʰ aː s
pass	pʰ e ə s
pass	pʰ äː s
pass	pʰ æ s
pass	pʰ ɐː s
pass	pʰ ɑː s
pass	pʰ ɛ ə s
pat	pʰ æ t
pat	pʰ æ t̚
pat	pʰ æˀ t̚
path	pʰ a θ
path	pʰ e ə θ
path	pʰ äː θ
path	pʰ æ θ
path	pʰ ɐː θ
path	pʰ ɑː θ
path	pʰ ɛ ə θ
patting	pʰ æ ɾ ɪ ŋ
pattings	pʰ æ ɾ ɪ ŋ z
pay	pʰ e ɪ
pear	pʰ e ə
pearl	pʰ əː ɫ
pearls	pʰ əː ɫ z
peel	pʰ i ə ɫ
peel	pʰ iː ɫ
peg	pʰ ɛ ɡ
penchant	p ɑ̃ ʃ ɑ̃
penes	pʰ iː n iː z
penis	pʰ iː n ɪ s
percuss	p ə kʰ ʌ s
perform	pʰ ə f ɔː m
performance	p ə f ɔː m ə n s
performance	p ɚ f ɔ ɹ m ə n s
permutation	p ɜː m j ʊ t e ɪ ʃ n̩
person	pʰ ɜː s n̩
pet	pʰ ɛ t
pet	pʰ ɛ ʔ
pet	pʰ ɛ ʔ t
petting	pʰ ɛ ɾ ɪ ŋ
pff	p͡ɸː
pff	ʙ̥͡ɸː
pfft	p͡ɸː t
phew	ɸ j̊ u̥ ˥˩
phlebolith	f l ɛ b ə l ɪ θ
photo	f ə ʊ tʰ ə ʊ
photograph	f ə ʊ̯ tʰ ə̥ ɡ ɹ̠ ɑː f
photosynthesis	f ə ʊ tʰ ə ʊ s ɪ n̪ θ ə s ɪ s
pick	pʰ ɪ k
pigpen	pʰ ɪ ɡ pʰ ɛ n
piling	pʰ a ɪ̯ ɫ l ɪ ŋ
pill	pʰ ɪ ɫ
pin	pʰ ɪ n
pit	pʰ ɪ ʔ t
pitcher	p ɪ ʔ t͡ʃ ə
pittance	pʰ ɪ ʔ n̩ s
pizza	pʰ i t s ə
pizzadilla	pʰ i t s ə d i j ə
pizzadilla	pʰ i t s ə d iː l j ə
pizzarito	pʰ i t s ə r iː t ə ʊ
pizzarito	pʰ i t s ə ɹ iː t ə ʊ
place	p l̥ e ɪ s
plack	pʰ l̥ a k
plack	pʰ l̥ æ k
plague	pʰ l̥ e ɪ ɡ
plain	p l̥ e ɪ n
plant	pʰ l̥ ɑː n t
plastic	pʰ l a s t ɪ k
plate	pʰ l̥ e ɪ t
play	pʰ l̥ e ɪ̯
poem	pʰ ə ʊ̯ ɪ m
poetry	p ə ʊʷ ə t ɹ ɪ
poignant	p ɔ ɪ ɲ ə n t
polar	pʰ ə ʊ̯ l ə ɹ
pole	pʰ ɒ ʊ ɫ
police	pʰ ə̆ l iˑ s
polo	p ɒ ʊ ɫ ə ʊ
polo	p ə ʊ l ə ʊ
polyamory	p ɒ l ɪ æ m ə ɹ i
poof	p uː ɸ
poomplex	p ʊ m p l ɛ k͡s
possessor	pʰ ə z ɛ s ə ɹ
postal	p ə ʊ s t l̩
potato	p ə̥ tʰ e ɪ tʰ ə ʊ
pow	p ə ʉ
power	pʰ a ə
power	pʰ aː
power	pʰ ɑː
precision	p ɹ ɪ s ɪ ʒ n̩
pree	p ɹ iː
pressure	p ɹ ɛ ʃ ə ɹ
pressure	p ɹ ɛ ʃ ɚ
pretzel	pʰ ɹ ɛ ʔ t͡s ɫ̩
prick	pʰ ɹ̠̊ ɪ k
pride	p ɹ̥ʷ a ɪ d
priest	p ɹ̥ iː s t
prim	pʰ ɹ̠̊ ɪ m
principles	p ɹ ɪ n s ə p l̩ z
principles	p ɹ ɪ n s ɪ p l̩ z
prism	pʰ ɹ̠̊ ɪ z m̩
prison	pʰ ɹ̠̊ ɪ z n̩
processors	p ɹ ə ʊ s ɛ s ə z
pronto	pʰ ɹ ɒ n tʰ ə ʊ̯
pronunciation	pʰ ɹ ə n ʌ n s i e ɪ ʃ ə n
propaganda	p ɹ ɑ p ə ɡ ɛ ə̯ n d ə
propaganda	p ɹ ɒ p ə ɡ æ n d ə
propaganda	p ɹ ɔ p ə ɡ a n d ə
prudential	p ɹ uː d ɛ n ʃ l̩
ptui	p͡tʼʰ
ptui	p͡tʼʰ ə̥
pulchritude	pʰ ʌ ɫ k ɹ ə t j uː d
puppy	pʰ ɐ p i
purl	pʰ əː ɫ
purls	pʰ əː ɫ z
purportion	p ə p ɔː ʃ ə n
push	pʷ ʊ ʃ
pussyo	p ʏ s̪ ɪ j o w
put	pʰ ʊ ʔ t
putt	pʰ ɐ t
putting	pʰ ʊ t ɪ ŋ
putting	pʰ ʊ ɾ ɪ ŋ
putting	pʰ ʌ t ɪ ŋ
quaint	kʰ w e ɪ̯ n t
queen	kʰ w̥ iː n
quesadilla	kʰ e ɪ̯ s ə d iː l j ə
quesarito	kʰ e ɪ̯ s ə r iː t ə ʊ
quesarito	kʰ e ɪ̯ s ə ɹ iː t ə ʊ
quick	kʰ w̥ ɪ k
quid	kʰ w̥ ɪ d̥
quiescent	k w a ɪ̯ ɛ s n̩ t
quiescent	k w i ɛ s n̩ t
quiff	kʰ w̥ ɪ f
quill	kʰ w̥ ɪ l
quilt	kʰ w̥ ɪ l t
quin	kʰ w̥ ɪ n
quint	kʰ w̥ ɪ n t
quip	kʰ w̥ ɪ p
quit	kʰ w̥ ɪ t
quiz	kʰ w̥ ɪ z
rail	ɹ e ɪ ɫ
railgun	ɹ e ɪ j ə ɫ ɡ ʌ n
railgun	ɹ e ɪ ɫ ɡ ʌ n
rajgira	ɾ ɑː d͡ʒ ɡ i r ɑː
rambo	ɹ æ m b ə ʊ
rambutan	ɹ a m b j ʉː t ə n
rattle	ɹ æ t ɫ̩
readable	ɹ iː d ə b l̩
reading	ɹ i ɾ i ŋ
reading	ɹ iː ɾ ɪ ŋ
really	ɹʷ ɪ ə̯ l ɪ
reasoned	ɹ iː z n̩ d
reconnoiter	ɹʷ ɛ k ə n ɔ ɪ̯ tʰ ə
reconnoitre	ɹʷ ɛ k ə n ɔ ɪ̯ tʰ ə
red	ɻʷ ɛˑ d̥
refill	ɹʷ ɪ i̯ f ɪ ɫ
region	ɹ iː d͡ʒ n̩
rehabilitation	ɹ iː ə b ɪ l ɪ t e ɪ ʃ n̩
rehearse	ɹ ɪ h ɜː s
relatable	ɹ ɪ l e ɪ t ə b l̩
relationship	ɹ ɪ l e ɪ ʃ n̩ ʃ ɪ p
relative	ɹ ɛ l ə tʰ ɪ v
relative	ɹ ɛ l ə ɾ ɪ v
relatively	ɹ ɛ l ə tʰ ɪ v l i
relatively	ɹ ɛ l ə ɾ ɪ v l i
remote	ɹ iː m ə ʊ t
remote	ɹ ə m ə ʊ t
remote	ɹ ɪ m ə ʊ t
repetition	ɹ ɛ p ə t ɪ ʃ n̩
responsible	ɹ ɪ s p ɒ n s ə b l̩
revelry	ɹ ɛ v ə ɫ ɹ i
revision	ɹ ɪ v ɪ ʒ n̩
reëvoke	ɹ iː ʔ i v ə ʊ k
rhotic	ɹ ə ʊ̯ tʰ ɪ k
rhythm	ɹ ɪ ð m̩
rider	ɹ̠ a ɪ d ə
right	ɹ a ɪ t
rocks	ɹʷ ɑ k s
rocks	ɹʷ ɒ k s
rocky	ɹʷ ɒ k i
role	ɹʷ ɒ ʊ ɫ
roll	ɹ̠ʷ ɒ ʊ ɫ
rose	ɹ̠ʷ ə ʊ z̥
rubbed	ɹ ʌˑ b̚ d̥
rubbers	ɹ ɐ b ə z
ruin	ɹ u w ɪ n
ruler	ɹ ʉ w l ə
ruler	ɹ ʊ w ɫ ə
s'pose	s p ə ʊ̯ z
sail	s e ɪ̯ ɫ
saint	s n̩ t
saint	s ɨ n t
salami	s ə l ɑː m ɪ
salience	s e ɪ̯ l i ə n s
sandwich	s æ m w ɪ d͡ʒ
sandwich	s æ̃ w ɪ d͡ʒ
sang	s a ŋ
sang	s e ɪ ŋ
sang	s æ ŋ
sang	s ɛ ŋ
scalable	s k e ɪ̯ ɫ ə b l̩
scale	s k e ɪ̯ ə ɫ
scallion	s k æ l j n̩
scallion	s k æ l ɪ ə n
schemes	s k iː m z̥
scold	s k ɒ ʊ ɫ d
screech	s k ɹ i t͡ʃ
screech	s k ɹ iː t͡ʃ
screen	s k ɹ̥ʷ ɪ i̯ n
scuttle	s k ʌ t ə ɫ
scuttle	s k ʌ t ɫ̩
selfish	s ɛ ɫ̥ f ɪ ʃ
senpai	s ɛ m p a ɪ̯
senpai	s ɛ n p a ɪ̯
sensible	s ɛ n̥ s ɪ b l̩
sentence	s ɛ n t n̩ t s
sentence	s ɛ n ʔ n̩ t s
shawty	ʃ ɔː ɾ i
shellfish	ʃ ɛ ɫˑ f ɪ ʃ
shoddy	ʃ ɔ ɾ i
shouldn't	ʃ ʊ n ʔ
shuyookh	ʃ u j uː x
shuyookh	ʃ ʊ j uː x
sibyl	s ɪ b ɫ̩
sigmatism	s ɪ ɡ m ʌ t ɪ z m
simple	s ɪ m p l̩
sixth	s ɪ k s t̪
sixth	s ɪ k θ
skeletal	s k ə l iː t l̩
skeletal	s k ɛ l ɪ t l̩
sket	s k ɛ t
sket	s k ɛ ʔ
sketty	s k ɛ t i
sketty	s k ɛ ʔ i
skill	s k ɪ o̯
skill	s k ɪ ɫ
skill	s k ɪ ʊ̯
skillful	s k ɪ ɫ f ə ɫ
skweee	s k w iː
slang	s l e ɪ ŋ
slaten	s l e ɪ t n̩
sliotar	ʃ l ɪ t ɚ
small	s m oː ɫ
snail	s n̥ e ɪ̯ ɫ
snares	s n ɛː z
snash	s n a ʃ
snow	s n ə ʊ̯
societal	s ə s a ɪ ɪ t ɫ̩
soil	s ɔ ɪ̯ ɫ̩
sold	s ɒ ʊ ɫ d
sole	s ɒ ʊ ɫ
solvent	s ɒ l v ə n t
some	s ɐ m
something	s ɐ m̥ p θ ɪ ŋ
something	s ʌ m ʔ m̩
something	s ʌ m̥ p θ ɪ ŋ
something	s ʌ n̪̥ θ ɪ ŋ
something	s ʌ ɾ̃ ɪ ŋ
something	s ʌˑ ɪ ŋ
something	s ʌ̃ː
somnambulist	s ɒ m n æ m b j ʊ l ɪ s t
somnambulistic	s ɒ m n æ m b j ʊ l ɪ s t ɪ k
sorta	s ɔː t ə
sotto	s o tː o
soul	s ɒ ʊ ɫ
spill	s p ɪ o̯
spill	s p ɪ ɫ
spill	s p ɪ ʊ̯
spose	s p ə ʊ̯ z
squamation	s k w e ɪ m e ɪ ʃ n̩
squander	s k w ɒ n d ə
squee	s k w iː
stability	s t ə b ɪ l ɪ ɾ i
staff	s t a f
staff	s t e ə f
staff	s t ä f
staff	s t äː f
staff	s t æ f
staff	s t ɐː f
staff	s t ɑː f
staff	s t ɛ ə f
standardise	s t æ n d ə ɹ d a ɪ z
statistical	s t ə t ɪ s t ɪ k l̩
statistically	s t ə t ɪ s t ɪ k l̩ i
steel	s t iː ɫ
steven	s t e ɪ̯ v n̩
steven	s t iː v n̩
steven	s t ɛ v n̩
still	s t ɪ o̯
still	s t ɪ ɫ
still	s t ɪ ʊ̯
stope	s t o ʊ p
streets	ʃ t͡ʃ ɹ i t͡s
strident	s t ɹ a ɪ dˀ n t
stripboard	s t ɹ ɪʰ b ɔ ə d
stripboard	s t ɹ ɪʰ b ɔː d
strong	s t̠͡ɹ̠ ɒ ŋ
strong	ʃ t̠͡ɹ̠ ɒ ŋ
structure	s t ɹ ɐ k t ʃ ə ɹ
struggle	s t ɹ ʌ ɡ l̩
strut	s t ɹ ɐ t
strut	s t ɹ ʊ̈ t
styll	s t ɪ ɫ
subhuman	s ʌ b h j uː m ə n
subliminal	s ə b l ɪ m ɪ n l̩
subliminal	s ʌ b l ɪ m ɪ n l̩
substituent	s ʌ b s t ɪ t ʃ u ə n t
subtle	s ʌ ɾ ɫ̩
subway	s ʌ b w e ɪ̯
sudden	s ʌ d n̩
suggestion	s ə d͡ʒ ɛ ʃ t ʃ ə n
superplural	s j u p ə p l ɔː ɹ ə l
superplural	s j u p ə p l ʊ ə ɹ ə l
support	s ə pʰ ɔː t
suppose	s p ə ʊ z
suppose	s ə pʰ ə ʊ z
sweeten	s w iː t n̩
sweeten	s w iː ʔ n̩
sword	s ɔː d
syllable	s ɪ l ə b ɫ̩
symbology	s ɪ m b ɒ l ə d͡ʒ i
symphony	s ɪ ɱ f ə n i
syndical	s ɪ n d ɪ k l̩
syntagms	s ɪ n t æ m z
systematic	s ɪ s t ə m æ ɾ ɪ k
t'	t̚
t'	ʔ
t'	ː
ta	tʰ ɑː
tab	tʰ æ b̥
tackle	tʰ æ k ɫ̩
take	tʰ e ɪ̯ k
talked	tʰ ɔː k t
tall	tʰ oː ɫ
tampon	tʰ æ m p ɒ n
tank	tʰ e ɪ ŋ k
tap	tʰ æ p
tape	tʰ e ɪ̯ p
tattoo	tʰ a tʰ uː
tattoo	tʰ æ tʰ uː
tattoo	tʰ æ ɾ uː
tea	tʰ iː
teal	t iː ɫ
teared	t i ɚ̯ d
teared	t ɛ ɚ̯ d
teared	t ɛː d
teared	t ɪː d
tech	tʰ ɛ k
technical	t ɛ k n ɪ k l̩
technological	t ɛ k n ə l ɒ d͡ʒ ɪ k l̩
tej	t ɛ d͡ʒ
tell	tʰ ɛ l
tell	tʰ ɛ ɫ
ten	tʰ ɛ n
tenable	t ɛ n ə b l̩
tenth	tʰ ɛ n̪ θ
terabyte	tʰ ɛ ɹ ə b a ɪ̯ t
test	tʰ ɛ s t
testable	tʰ ɛ s t ə b l̩
tests	tʰ ɛ s t̚ s
theoretical	θ ɪ ə̯ ɹ ɛ t ɪ k l̩
theosophy	θ ɪ ɒ s ə f ɪ
thickalicious	θ ɪ k ə l ɪ ʃ ə s
thickie	θ ɪ k i
think	f ɪ ŋ k
think	θ æ ŋ k
think	θ ɪ ŋ k
thread	θ ɾ̪̊ ɛ d
three	θ ɹ̥ ɪ i
three	θ ɾ̪̊ iː
three	θ ɾ̪̊ ɪ i
threshold	θ ɹ ɛ ʃ h ɒ ʊ ɫ d
thrice	θ ɾ̪̊ ä ɪ s
thrice	θ ɾ̪̊ ɑ ɪ s
thrill	t̪ ɾ̪̊ ɪ l
thrill	θ ɹ̥ ɪ ɫ
thrill	θ ɾ̪̊ ɪ l
thrill	θ ɾ̪̊ ɪ ɫ
throne	θ ɹ ə ʊ n
throw	θ ɾ̪̊ ə ʊ
tidbit	tʰ ɪ d̚ b ɪ t̚
tighten	tʰ a ɪ̯ t n̩
tighten	tʰ a ɪ̯ ʔ n̩
timber	t ɪˑ m b əː
time	tʰ a ɪ̯ m
tin	tʰ ɪ n
tiptoe	tʰ ɪ p tʰ ə ʊ̯
tired	t a ɪ̯ ə d
titty	tʰ ɪ ɾ i
to	tʰ u̟ː
told	tʰ ɒ ʊ ɫ d
told	tʰ ɔ ʊ ɫ d
toll	tʰ ɔ w ɫ
tomato	tʰ ə̥ m ɐː tʰ ɐ ʉ̯
tomato	tʰ ə̥ m ɑː tʰ ə ʉ̯
too	tʰ u̟ː
top	tʰ ɒˀ p
towards	tʰ ə̥ w ɔː d z
town	tʰ a ʊ̯ n
trace	t ʃ ɹ e ɪ s
tracer	t ʃ ɹ e ɪ s ə ɹ
traditionally	t ɹ ə d ɪ ʃ n̩ l i
traditionally	t ɹ ɪ d ɪ ʃ n̩ l i
train	t̠ ɹ̠̊ ˔ e̞ ɪ n
train	t͡ʃ ɹ e ɪ n
trainee	t ʃ ɹ e ɪ n i
trainees	t ʃ ɹ e ɪ n i z
transcript	t ʃ ɹʷ a n s k ɹʷ ɪ p̚ t
transcript	t ʃ ɹʷ æ n s k ɹʷ ɪ p̚ t
trap	t̠ ɹ̠̊ ˔ a p
trap	t̠ ɹ̠̊ ˔ ä p
trap	t̠ ɹ̠̊ ˔ æ p
trap	t̠ ɹ̠̊ ˔ ɛ p
traumata	t ɹ ɔ m æ ɾ ə
traumata	t ɹ ɔ m ɑ ɾ ə
traumata	t ɹ ɔ m ə ɾ ə
treat	t ɹ iː t
treat	t͡ʃ ɹ iː t
tree	t ɹ iː
tree	t̠͡ɹ̠̊ ˔ʷ ɪ i̯
tree	t͡ʃ ɹ iː
trial	t ɹ a ɪ ə l
trick	t ʃ ɹ̠̊ ɪ k
trick	t̠ʰ ɹ̠̊ ɪ k
trig	t̠ʰ ɹ̠̊ ɪ ɡ
trill	t̠ʰ ɹ̠̊ ɪ l
trim	t̠ʰ ɹ̠̊ ɪ m
trinal	t ɹ ʌ ɪ n̩ l
trip	tʰ ɹ ɪ p
trivial	t͡ʃ ɹ ɪ v i ə l
trope	t ɹ̥ ə ʊ p
true	t̠ ɹ̠̊ ˔ʷ u̠ː
trust	t ɹ ɐ s t
trust	t ɹ ʌ s t
truthfully	t ɹ uː θ f ɫ̩ i
try	t ɹ̝̊ a ɪ̯
try	t̠͡ɹ̠̊ ˔ a ɪ̯
try	t̠͡ɹ̠̊ ˔ʷ a ɪ̯
try	t͡ʃ ɹ a ɪ̯
tss	t͡sːː
tucker	tʰ ʌ k ə
tut	ǀ
twain	tʰ w̥ e ɪ n
twat	tʰ w̥ æ t
twelfth	tʰ w̥ ɛ ɤ θ
twelfth	tʰ w̥ ɛ ɫ f θ
twelfth	tʰ w̥ ɛ ɫʷ f
twelve	t w̥ ɛ ɫ v
twentieth	t w̥ ɛ̃ n t i ə θ
twenty	t w̥ ɛ̃ n t i
twerk	t w̥ ɜː k
twerking	t w̥ ɜː k ɪ ŋ
twice	t w̥ a ɪ s
twill	t w ɪ ɫ
twin	t w̥ ɪ n
twink	tʰ w̥ ɪ ŋ k
twist	t w̥ ɪ s t
twit	tʰ w̥ ɪ t
twitch	tʰ w̥ ɪ t͡ʃ
two	tʰ u̟ː
twos	tʰ u̟ː z
typewriter	t a ɪ p ɹ a ɪ t ə ɹ
ugh	ə
ugh	ə x
ugh	ə ɣ
ugh	ə χ
ugh	ɜ̰ʰ
ugh	ɯ x
ugh	ɯ ɣ
ugh	ɯ ʀ̊
ugh	ɯ χ
ugh	ʊ
ugh	ʊ k
ugh	ʊ x
ugh	ʊ ɡʱ
ugh	ʊ ʀ̊
ugh	ʊ χ
ugh	ʌ k
ugh	ʌ x
ugh	ʌ ɡ
ugh	ʌ ʀ̊
ugh	ʌ χ
ugh	ʌ᷈
ugh	χ
unacceptable	ɐ n æ k s ɛ p t ə b ɫ̩
unacceptable	ɐ n ə k s ɛ p t ə b ɫ̩
under	ɐ n d ə ɹ
underutilize	ɐ n d ə j uː t ɪ l a ɪ z
unfair	ɐ n f ɛ ə ɹ
unfair	ɐ n f ɛː ɹ
unfeasible	ʌ n f iː z ə b ɫ̩
ungoogleable	ʌ n ɡ uː ɡ ɫ̩ ə b ɫ̩
unilateral	j ʉː n ə ɫ æ ɾ ɚ ɻ ɫ̩
unilateral	j ʉː n ɪ l æ t ə ɹ ɫ̩
unilateral	j ʉː n ɪ l æ t͡ʃ ɹ ɫ̩
unintentional	ʌ n ɪ n tʰ ɛ n ʃ n̩ ɫ̩
unlicensed	ʌ n l a ɪ s n̩ s t
unnerstand	ɜ ɽ̃ ɻ s t æ n d̚
unremarkable	ʌ n ɹ ɪ m ɑː k ə b l̩
up	ɐ ʔ p
useful	j uː s f l̩
usher	ʌ ʃ ə ɹ
utter	ɐ t ə
uwu	ʉː w̟ ʉ w
vajazzle	v ə d͡ʒ æ z l̩
vale	v e ɪ ɫ
vegetable	v ɛ d͡ʒ t ə b l̩
vegetables	v ɛ d͡ʒ t ə b l̩ z
verbal	v ɜː b ɫ̩
versatile	v ɜː s ə t a ɪ ɫ
vessel	v ɛ s ɫ̩
vicissity	v a ɪ s ɪ s ɨ t i
vicissity	v ɪ s ɪ s ɨ t i
victual	v ɪ t ɫ̩
victuals	v ɪ t ɫ̩ z
vindical	v ɪ n d ɪ k l̩
vinyl	v a ɪ n l̩
virtually	v ɝ t͡ʃ u ə ɫ i
vision	v ɪ ʒ n̩
vocab	v ə ʊ k a b
volitional	v ɒ l ɪ ʃ n̩ l
volitional	v ɒ l ɪ ʃ n̩ l̩
waffle	w ɒ f ɫ̩
wah	w aːː
wah	w äːː ˦˨
wah	w æːː
wah	w æ̃̂ːː
wail	w e ɪ ɫ
wain	w eː n
waistband	w e ɪ s t b æ n d
waiting	w e ɪ̯ ɾ ɪ ŋ
wale	w e ɪ ɫ
walkable	w ɔː k ə b ɫ̩
wasn't	w ɒ n ʔ
wasn't	w ɒ z n̩ ʔ
wealth	w ɛ l̪ θ
wean	w eː n
welp	w ɛ l p̚
westside	w ɛ s s a ɪ d
westside	w ɛ s t s a ɪ d
whataboutism	w ə ɾ ə b a ʊ ɾ ɪ z m̩
whet	w ɛ ʔ t̚
whet	ʍ ɛ ʔ t̚
wheugh	ɸ ɪ̥ u̯ h
whew	ɸ ĭ̥ ŭ̥
whew	ʍ ĭ̥ ŭ̥
whine	ʍ äː n
whine	ʍ ɑ e̯ n
whine	ʍ ʌ ɪ̯ n
whiten	h w a ɪ̯ t n̩
whiten	h w a ɪ̯ ʔ n̩
whole	h ɒ ʊ ɫ
whole	h ə ʊ ɫ
wholemeal	h ɔ ʊ ɫ m i ə ɫ
wholest	h o ʊ̯ ɫ ɛ s t
wholly	h ɒ ʊ ɫ l ɪ
wholly	h ə ʊ l ɪ
width	w ɪ d̪ θ
wieldy	w ɪ ə l d ɪ
wild	w a ɪ̯ ɫ d
wild	w a ɪ̯ ɫ̩ d
will	w ɪ o̯
will	w ɪ ɫ
will	w ɪ ʊ̯
work	w œː k
work	w ɔː k
work	w ɚ k
work	w ɛː k
work	w ɜː k
work	w ʊː ɹ k
worra	w ɒ ɾ ə
wouldn't	w ʊ dⁿ n̩ t
wouldn't	w ʊ n ʔ
wouldn't	w ʊ ɾ ə n t
wouldn't	w ʊ ʔ n̩ t
wow	w a ʊ̯
wrake	ɹ e ɪ̯ kʰ
writer	ɹ̠ a ɪ t ə
yatt	j a t
yatt	j æ t
ye	j iː
ye	j ɐ
ye	j ɪ
ye	j ɪ i
yeh	j ɛ
yeh	j ɛ ə
yeh	j ɛː
yep	j ɛ p̚
yep	j ɛ ʔ
yive	j ɪ v
yup	j ʌ p̚
zayum	z e ə j ə m
zayum	z æ̙ j ə m
ziti	z i ɾ i
zooplasty	z ə ʊ ə p l æ s t i
zun	z ʌ n
