'cher	t͡ʃ ə ˦
peculiar	pʰ ə kʰ j uː l j ʊ ə
peekhole	pʰ i k h o ʊ ɫ
peel	pʰ i ə ɫ
peel	pʰ iː ɫ
peep	pʰ i p
peephole	pʰ i p h o ʊ ɫ
peg	pʰ ɛ ɡ
peleg	pʰ ɛ l ɛ ɡ
penchant	p ɑ̃ ʃ ɑ̃
pencil	p ɛ n s ə l
pencil	p ɛ n̥ s ə l
penes	pʰ i n i z
penes	pʰ iː n iː z
peng	p e ŋ ˦
penis	pʰ i n ɪ s
penis	pʰ iː n ɪ s
people	pʰ i p ɫ̩
percuss	p ə kʰ ʌ s
percuss	p ɚ kʰ ʌ s
perform	pʰ ə f ɔː m
performance	p ə f ɔː m ə n s
performance	p ɚ f ɔ ɹ m ə n s
perineum	p ə ɹ ɪ n iː ə m
permutation	p ɜː m j ʉ t æ ɪ ʃ n̩
permutation	p ɜː m j ʊ t e ɪ ʃ n̩
permutation	p ɝ m j ʊ t e ɪ ʃ n̩
person	pʰ ɜː s n̩
person	pʰ ɝ s n̩
personality	p ɝ s ə n æ l ɪ ɾ i
peso	p ɛ s o
pester	pʰ ɛ s t ɚ
pet	pʰ ɛ t
pet	pʰ ɛ ʔ t
peter	pʰ i t ɚ
peter	pʰ i ɾ ɚ
petting	pʰ ɛ ɾ ɪ ŋ
petty	p ɛ ɾ i
petty	pʰ ɛ ɾ i
pewter	p j u ɾ ɚ
pff	p͡ɸː
pff	ʙ̥͡ɸː
pfft	p͡ɸː t
phew	ɸ j̊ u̥ ˥˩
philadelphia	f ɪ ɫ ə d ɜ ɫ f i ə
phlebolith	f l ɛ b ə l ɪ θ
phonetic	f ə n ɛ ɾ ɪ k
photo	f ŏ ʊ ɾ o ʊ
photo	f ə ʊ tʰ ə ʊ
photograph	f ŏ ʊ ɾ ə ɡ ɹ̠ æ f
photograph	f ə ʊ tʰ ə̥ ɡ ɹ̠ ɑː f
photographic	f o ʊ ɾ ə ɡ ɹ æ f ɪ k
photosynthesis	f ŏ ʊ ɾ o ʊ s ɪ n̪ θ ə s ɪ s
photosynthesis	f ə ʊ tʰ ə ʊ s ɪ n̪ θ ə s ɪ s
phrenitis	f ɹ ə n a ɪ ɾ ə s
pick	pʰ ɪ k
pierre	pʰ i ə ɹ
pigpen	pʰ ɪ ɡ pʰ ɛ n
piling	pʰ a ɪ̯ ɫ l ɪ ŋ
pill	pʰ ɪ ɫ
pin	pʰ ɪ n
pink	pʰ ɪ ŋ k
pit	pʰ ɪ ʔ t
pittance	pʰ ɪ ʔ n̩ s
pizza	pʰ i t s ə
place	p l̥ e ɪ s
plack	pʰ l̥ a k
plack	pʰ l̥ æ k
plague	pʰ l̥ e ɪ ɡ
plague	pʰ ɫ̥ ɛː ɡ
plain	p l̥ e ɪ n
plan	p l ɛ ə n
plan	pʰ l̥ æ n
plant	pʰ l̥ e ə n t
plant	pʰ l̥ æ n t
plant	pʰ l̥ ɑː n t
plantain	p l aː n ʔ n̩
plantigrade	p l e ə̯ ɾ̃ ə ɡ ɹ e ɪ̯ d
plaque	pʰ l̥ æ k
plastic	pʰ l æ s t ɪ k
plasticity	p l æ s t ɪ s ɪ ɾ i
plasticity	pʰ l æ s t ɪ s ɪ t i
plasticity	pʰ l æ s t ɪ s ɪ ɾ i
plate	pʰ l̥ e ɪ t
play	p l̥ e ɪ
plenty	p l ɛ n i
plenty	p l ɛ ɾ̃ i
plenty	p l ɪ n i
plenty	p l ɪ ɾ̃ i
pluto	p l u ɾ o ʊ
poem	p o ʊ̯ ɪ m
poem	pʰ o ʊ̯ m
poem	pʰ o ʊ̯ m̩
poem	pʰ o ʊ̯ ə m
poem	pʰ ə ʊ̯ ɪ m
poet	pʰ o ʊ̯ ɪ̈ ʔ t̚
poetry	p ə ʊʷ ə t ɹ ɪ
poetry	pʰ o ʊ̯ ə t ɹ i
poignant	p ɔ ɪ ɲ ə n t
polar	pʰ o ʊ̯ l ɚ
polar	pʰ ə ʊ̯ l ə ɹ
pole	pʰ o ə ɫ
pole	pʰ o ʊ ɫ
pole	pʰ ɒ ʊ ɫ
police	pʰ ə̆ l iˑ s
polo	p ɒ ʊ ɫ ə ʊ
polo	p ə ʊ l ə ʊ
pontypridd	p ɔ n t ə p r iː ð
poof	p uː ɸ
pool	pʰ u ə ɫ
pool	pʰ u ɫ
poomplex	p ʊ m p l ɛ k͡s
popcorn	p ʌ p k ɒː n
popcorn	p ʌ p k ɔ ɹ n
popping	pʰ ɑ p ɪ̈ ŋ
portable	pʰ ɔ ɹ ɾ ɪ̈ b l̩
portal	pʰ ɔː ɹ ɾ ɫ̩
positivity	p ɑ z ɪ t ɪ v ɪ ɾ i
positivity	p ɔ z ɪ t ɪ v ɪ ɾ i
possessor	pʰ ə z ɛ s ə ɹ
postal	p o ʊ s t l̩
postal	p ə ʊ s t l̩
potato	p ə̥ tʰ e ɪ tʰ ə ʊ
potato	p ə̥ tʰ e ɪ ɾ o ʊ
potato	p ə̥ tʰ e ɪ ɾ ə
potent	pʰ o ʊ̯ ʔ n̩ t
poutine	p ʉ u t ɪ i n
pow	p ə ʉ
powderful	p a ʊ ˧ d ə f u ˦
power	pʰ a ʊ̯ ɚ
power	pʰ a ʊ̯ ɹ
prairie	p ɹ ɛ ɹ i
precaution	p ɹ iː k ɑ ʃ n̩
precaution	p ɹ ɪ k ɑ ʃ n̩
precision	p ɹ ɪ s ɪ ʒ n̩
pree	p ɹ iː
pressure	p ɹ ɛ ʃ ə ɹ
pressure	p ɹ ɛ ʃ ɚ
pretzel	pʰ ɹ ɛ ʔ t͡s ɫ̩
prick	pʰ ɹ̠̊ ɪ k
pride	p ɹ̥ʷ a ɪ d
priest	p ɹ̥ iː s t
prim	pʰ ɹ̠̊ ɪ m
principles	p ɹ ɪ n s ə p l̩ z
principles	p ɹ ɪ n s ɪ p l̩ z
printer	pʰ ɹ ɪ ɾ̃ ɚ
prism	pʰ ɹ̠̊ ɪ z m̩
prison	pʰ ɹ̠̊ ɪ z n̩
probability	p ɹ ɑ b ə b ɪ l ə ɾ i
probability	p ɹ ɑ b ə b ɪ l ɪ ɾ i
processors	p ɹ ɑ s ɛ s ɚ z
processors	p ɹ ə ʉ s e s ə z
processors	p ɹ ə ʊ s ɛ s ə z
proclitic	p ɹ o ʊ k l ɪ ɾ ɪ k
proclitic	p ɹ ə ʉ k l ɪ ɾ ɪ k
prodigal	pʰ ɹ ɑ ɾ ɪ ɡ ɫ̩
produceorial	p ɹ ɑ d ə s o ʊ ɹ i ə l
pronto	pʰ ɹ ɑ n o ʊ̯
pronto	pʰ ɹ ɑ n tʰ o ʊ̯
pronunciation	pʰ ɹ ə n ʌ n s i e ɪ ʃ ə n
propaganda	p ɹ ɑ p ə ɡ æ n d ə
propaganda	p ɹ ɒ p ə ɡ æ n d ə
property	p ɹ ɑ p ɚ ɾ i
psittacosis	s i ɾ ə k o ʊ s ɪ s
ptui	p͡tʼʰ
ptui	p͡tʼʰ ə̥
pulchritude	pʰ ʌ ɫ k ɹ ə t j uː d
pulchritude	pʰ ʌ ɫ k ɹ ə t uː d
pulliam	pʰ ʊ ɫ i m̩
pulliam	pʰ ʊ ɫ j ə̃ m
pulse	p ə l s
punching	p ə n t ʃ ɪ ŋ
punctuate	p ʌ ŋ k ʃ uː e ɪ t
punter	pʰ ʌ̃ː ɾ̃ ɚ
puppy	pʰ ɐ p i
purl	pʰ əː ɫ
purl	pʰ ɝ ɫ
purlin	p ɜː ɹ l ɪ n
purls	pʰ əː ɫ z
purls	pʰ ɝ ɫ z
purportion	p ə p ɔː ʃ ə n
push	p u ʃ
push	pʷ ʊ ʃ
put	pʰ ʊ ʔ t
putler	p u t l ɚ
putler	p uː t l ə
putt	pʰ a t
putt	pʰ ɐ t
putt	pʰ ʊ t
putt	pʰ ʌ t
putting	pʰ ʊ t ɪ ŋ
putting	pʰ ʊ ɾ ɪ ŋ
putting	pʰ ʌ t ɪ ŋ
pyrrha	pʰ ɪ ɹ̠ ə
quaint	kʰ w e ɪ̯ n t
quality	kʰ w ɑ ɫ ə ɾ i
quantity	kʰ w ɑ n tʰ ɨ tʰ i
quantity	kʰ w ɑ n ɾ ɨ ɾ i
quantum	k w ɑ ɾ̃ ə m
quantum	kʰ w ɑ n tʰ ə m
queen	kʷ w̥ iː n
quesadilla	kʰ e ɪ̯ s ə d i j ə
quesadilla	kʰ e ɪ̯ s ə d iː l j ə
quesalupa	kʰ e ɪ̯ s ə l uː p ə
quesarito	kʰ e ɪ̯ s ə r iː t ə ʊ
quesarito	kʰ e ɪ̯ s ə ɹ i t o ʊ
quesarito	kʰ e ɪ̯ s ə ɹ iː t ə ʊ
quick	kʰ w̥ ɪ k
quickwitted	k w ɪ k w ɪ ɾ ɪ d
quid	kʰ w̥ ɪ d
quiff	kʰ w̥ ɪ f
quill	kʰ w̥ ɪ l
quilt	kʰ w̥ ɪ l t
quin	kʰ w̥ ɪ n
quinn	kʰ w̥ ɪ n
quint	kʰ w̥ ɪ n t
quip	kʰ w̥ ɪ p
quit	kʰ w̥ ɪ t
quittor	k w ɪ ɾ ɚ
quiz	kʰ w̥ ɪ z
rabak	ɹ ä ˧ b ä ʔ ˦
radar	ɹ e ɪ ɾ ɑ ɹ
rail	ɹ e ɪ ɫ
rajgira	ɾ ɑː d͡ʒ ɡ i r ɑː
rambo	ɹ æ m b ə ʊ
rambutan	ɹ a m b j ʉː t ə n
rambutan	ɹ æ m b uː t ə n
rare	ɹ ɜ ɹ
rating	ɹ e ɪ ɾ ɪ ŋ
rattle	ɹ æ t ɫ̩
readable	ɹ iː d ə b l̩
reading	ɹ i ɾ i ŋ
reading	ɹ iː ɾ ɪ ŋ
really	ɹʷ e ə̯ ɫ iː
really	ɹʷ ɪ ə̯ l ɪ
realtor	ɹ i l ə t ɚ
reanalyze	ɹ i ɛ ə n ə l a ɪ z
reanalyze	ɹ i ɛː n ə l a ɪ z
reasonable	ɹ ɪ i z n ə b ə l
reasonableness	ɹ ɪ i z n ə b ə l n ə s
reasoned	ɹ iː z n̩ d
rebutter	ɹ ɪ̈ b ʌ ɾ ɚ
recall	ɹ i kʰ ɑ ɫ
recall	ɹ ɪ kʰ ɑ ɫ
recension	ɹ̠ʷ ɪ̈ s ɛ̃ n t̚ ʃ ə̃ n
reconnoiter	ɹʷ ɛ k ə n ɔ ɪ̯ tʰ ə
reconnoiter	ɹˠ ɛ k ə n ɔ ɪ̯ ɾ ɚ
reconnoitre	ɹʷ ɛ k ə n ɔ ɪ̯ tʰ ə
reconnoitre	ɹˠ ɛ k ə n ɔ ɪ̯ ɾ ɚ
red	ɻʷ ɛˑ d̥
regular	ɹ ɛ ɡ j ɪ̈ l ɚ
regular	ɹ ɛ ɡ l̩ ɚ
rehabilitation	ɹ iː ə b ɪ l ɪ t e ɪ ʃ n̩
rehearse	ɹ ɪ h ɜː s
relationship	ɹ ɪ l e ɪ ʃ n̩ ʃ ɪ p
relative	ɹ ɛ l ə tʰ ɪ v
relative	ɹ ɛ l ə ɾ ɪ v
relatively	ɹ ɛ l ə tʰ ɪ v l i
relatively	ɹ ɛ l ə ɾ ɪ v l i
remote	ɹ iː m ə ʊ t
remote	ɹ ə m ə ʊ t
remote	ɹ ɪ m o ʊ t
remote	ɹ ɪ m ə ʊ t
repetition	ɹ ɛ p ə t ɪ ʃ n̩
respectable	ɹ ɪ s p ɛ k t ə b l̩
responsibility	ɹ ɪ s p ɑ n s ə b ɪ l ə ɾ i
retail	ɹ̠ʷ i tʰ e ɪ̯ ɫ
revelry	ɹ ɛ v ə ɫ ɹ i
reëvoke	ɹ iː ʔ i v ə ʊ k
rhotic	ɹ o ʊ̯ ɾ ɪ k
rhotic	ɹ ə ʊ̯ tʰ ɪ k
rhythm	ɹ ɪ ð m̩
rider	ɹ̠ a ɪ d ə
rider	ɹ̠ a ɪ ɾ ɚ
rider	ɹ̠ ä ɪ ɾ ɚ
rider	ɹ̠ʷ ɑ e̯ d ə
right	ɹ a ɪ t
right	ɹ äː tʰ
right	ɹ ɑ e̯ t
right	ɹ ɒ ɪ ʔ
riverbed	ɹ ɪ v ɚ b eː
robotic	ɹ o ʊ b ɑ ɾ ɪ k
robotics	ɹ o ʊ b ɑ ɾ ɪ k s
rocks	ɹʷ ɑ k s
rocks	ɹʷ ɒ k s
rocks	ɹʷ ɔ k s
rocky	ɹʷ ɑ k i
rocky	ɹʷ ɒ k i
rocky	ɹʷ ɔ k i
role	ɹʷ o ʊ ɫ
role	ɹʷ ɒ ʊ ɫ
roll	ɹ̠ʷ o ɫ
roll	ɹ̠ʷ ɒ ʊ ɫ
romantic	ɹ o ʊ m æ n t ɪ k
rose	ɹ̠ʷ ə ʊ z̥
rose	ɻʷ ö̞ ʊ z̥
roti	ɹ ɔ ʊ ɾ ɪ i̯
rotten	ɹ ɑ ʔ n̩
rout	ɹ ʌ ʊ t
routes	ɹ ʌ ʊ t s
routs	ɹ ʌ ʊ t s
rub	ɹ ɐ b
rubbed	ɹ ʌˑ b̚ d̥
rubber	ɹ ɐ b ə ɹ
rubbers	ɹ ɐ b ə z
rule	ɹ̠ʷ uː ɫ
sail	s e ɪ̯ ɫ
salami	s ə l ɑː m ɪ
salience	s e ɪ̯ l i ə n s
salience	s æ ɪ̯ l i ə n s
salt	s ɑ ɫ t
salt	s ɑ ɫ ʔ
salt	s ɔ ɯ̯ t
samantha	s ə m ɛ ə n θ ə
sample	s äː m p ɯ
sample	s ɛ ə m p ə ɫ
sandwich	s æ m w ɪ d͡ʒ
sandwich	s æ m w ɪ t͡ʃ
sandwich	s æ m ɪ t͡ʃ
sandwich	s æ̃ w ɪ d͡ʒ
sandwich	s æ̃ w ɪ t͡ʃ
sang	s a ŋ
sang	s e ɪ ŋ
sang	s æ ŋ
sang	s ɛ ŋ
sat	s æ ʔ t̚
sat	ɛ s e ɪ̯ tʰ i
satan	s e ɪ ʔ n̩
saturday	s æ ɾ ɚ d e ɪ̯
saturday	s æ ɾ ɚ d i
saw	s ɔ ɹ
scalable	s k e ɪ̯ ɫ ə b l̩
scale	s k e ɪ̯ ə ɫ
scale	s k æ ɪ̯ ə ɫ
scallion	s k æ l j n̩
scallion	s k æ l ɪ ə n
scared	s k ɛ ɚ d
schemes	s k iː m z̥
schismatic	s k ɪ z m æ ɾ ɪ k
schismatic	s ɪ z m æ ɾ ɪ k
schismatic	ʃ ɪ z m æ ɾ ɪ k
scold	s k ɒ ʊ ɫ d
scottish	s k ɔ ɾ ɪ ʃ
scout	s k ʌ ʊ t
screech	s k ɹ i t͡ʃ
screech	s k ɹ iː t͡ʃ
screen	s k ɹ̥ʷ ɪ i̯ n
scrunkly	s k ɹ ʌ ŋ k l ɨ
scuttle	s k ʌ t ə ɫ
scuttle	s k ʌ t ɫ̩
scuttle	s k ʌ ɾ ə ɫ
scuttle	s k ʌ ɾ ɫ̩
secretary	s ɛ k ɹ ə tʰ ɛ ɹ i
security	s ə k j ɔ ɹ ɪ ɾ i
security	s ə k j ʊ ɹ ɪ ɾ i
seizure	s ɪ i ʒ ə ɹ
selfish	s ɛ ɫ̥ f ɪ ʃ
semanticity	s ɪ m æ n tʰ ɪ s ɪ̈ t i
semitic	s ə m ɪ ɾ ɪ k
senpai	s ɛ m p a ɪ̯
senpai	s ɛ n p a ɪ̯
sensible	s ɛ n̥ s ə b ɫ̩
sensible	s ɛ n̥ s ɪ b l̩
sentence	s ɛ n t n̩ t s
sentence	s ɛ n ʔ n̩ t s
servant	s ɝ v n̩ ʔ
seven	s ɛ b m̩
sevendy	s ɛ v n̩ i
sevendy	s ɛ v n̩ ɾ̃ i
shawty	ʃ ɔː ɾ i
shellfish	ʃ ɛ ɫ f ɪ ʃ
shemitic	ʃ ə m ɪ ɾ ɪ k
shiok	ɕ j o̞ k̚
shitter	ʃ ɪ ɾ ɚ
shitty	ʃ ɪ ɾ i
short	ʃ ɑ ɹ t
shortcoming	ʃ ɑ ɹ t k ʌ m ɪ ŋ
shouldn't	ʃ ʊ n ʔ
shudder	ʃ ʌ ɾ ɚ
shuyookh	ʃ u j uː x
shuyookh	ʃ ʊ j uː x
sial	s i a ɫ
sibeh	s iː ˨˦ p eː ˨
siberia	s a ɪ b ɪ ə ɹ ɪ ə
siberia	s a ɪ b ɪ ɹ i ə
siberian	s a ɪ b ɪ ə ɹ ɪ ə n
siberian	s a ɪ b ɪ ɹ i ə n
sibyl	s ɪ b ɫ̩
sigmatism	s ɪ ɡ m ʌ t ɪ z m
simi	s i ˦ m i ˦˨
similarity	s ɪ m ə l æ ɹ ə ɾ i
singapore	s ɪ ŋ ˧ ʌ p ɔ ˦
sitter	s ɪ ɾ ɚ
sixth	s ɪ k s t̪
sixth	s ɪ k s θ
sket	s k ɛ t
sket	s k ɛ ʔ
sketty	s k ɛ t i
sketty	s k ɛ ʔ i
skidder	s k ɪ ɾ ɚ
skillful	s k ɪ ɫ f ə ɫ
skitter	s k ɪ ɾ ɚ
skittish	s k ɪ ɾ ɪ ʃ
skweee	s k w iː
slaten	s l e ɪ t n̩
slight	s l̥ ɐ ɪ ʔ
sliotar	ʃ l ɪ t ɚ
slovak	s l ɑ v ə k
small	s m oː ɫ
smatter	s m æ ɾ ɚ
snail	s n̥ e ɪ̯ ɫ
snares	s n ɛː z
snash	s n a ʃ
snippet	s n ɪ p ɪ̈ ʔ t̚
snow	s n o ʊ̯
snow	s n ə ʊ̯
societal	s ə s a ɪ ə t l̩
societal	s ə s a ɪ ə t̬ l̩
soil	s ɔ ɪ̯ ɫ̩
sold	s ɒ ʊ ɫ d
sole	s ɒ ʊ ɫ
solecism	s o ʊ l ɨ s ɪ z ə m
soluble	s ɔ ɫ j ʊ b ə ɫ
solvent	s ɒ l v ə n t
some	s ä m
some	s ɐ m
somemore	s ɐ ˧ m ɔː ˦
something	s ɐ m̥ p θ ɪ ŋ
something	s ʌ m ʔ m̩
something	s ʌ m̥ p θ ɪ ŋ
something	s ʌ n̪̥ θ ɪ ŋ
something	s ʌ ɾ̃ ɪ ŋ
something	s ʌˑ ɪ ŋ
something	s ʌ̃ː
somnambulist	s ɒ m n æ m b j ʊ l ɪ s t
somnambulistic	s ɒ m n æ m b j ʊ l ɪ s t ɪ k
sorta	s ɔ ɹ ɾ ə
sorta	s ɔː t ə
sotto	s o tː o
soul	s ɒ ʊ ɫ
spam	s p e ə m
spar	s p ɑ ɹ
spar	s p ɑ ˞
spider	s p ʌ ɪ̯ ɾ ə ɹ
splinter	s p l ɪ ɾ̃ ɚ
splitter	s p l ɪ ɾ ɚ
spotted	s p ɑ ɾ ɪ̈ d
spruiker	s p ɹ ʉː k ə
squamation	s k w e ɪ m e ɪ ʃ n̩
squander	s k w ɒ n d ə
squander	s kʷ ɑ n d ɚ
squee	s k w iː
squitten	s k w ɪ ʔ n̩
stability	s t ə b ɪ l ɪ ɾ i
staff	s t a f
staff	s t e ə f
staff	s t äː f
staff	s t æ f
staff	s t ɐː f
staff	s t ɑː f
staff	s t ɛ ə f
stand	s t e ə n d
standard	s t e ə n d ɚ d
standardise	s t æ n d ə ɹ d a ɪ z
standoff	s t e ə n d ɑ f
started	s t ɑ ɹ ɾ ɪ d
starter	s t ɑ ɹ ɾ ɚ
starting	s t ɑ ɹ t ɪ ŋ
starting	s t ɑ ɹ ɾ ɪ ŋ
startup	s t ɑ ɹ ɾ ʌ p
statistically	s t ə t ɪ s t ɪ k l̩ i
status	s t æ ɾ ə s
steel	s t iː ɫ
steven	s t e ɪ̯ v n̩
steven	s t iː v n̩
steven	s t ɛ v n̩
stiletto	s t ɪ l ɛ ɾ o ʊ
still	s t ɪ ɫ
stockholder	s t ɑ k h o ʊ ɫ d ɚ
stope	s t o ʊ p
strand	s t ɹ ɛ ə n d
street	s k ɹ i tˤ
street	ʃ k ɹ i tˤ
street	ʃ t ɹ̠̊ i ʔ
street	ʃ t͡ʃ ɹ i tˤ
streets	ʃ t͡ʃ ɹ i t͡s
strength	s t̠͡ɹ̠ e ɪ ŋ k θ
strength	s t̠͡ɹ̠ ɛ n̪ θ
strength	s t̠͡ɹ̠ ɛ ŋ k θ
strength	s t̠͡ɹ̠ ɛ ɪ ŋ k θ
strength	s t̠͡ɹ̠ ɪ ŋ k θ
strident	s t ɹ a ɪ dˀ n t
stripboard	s t ɹ ɪʰ b ɔ ə d
stripboard	s t ɹ ɪʰ b ɔː d
strong	s t̠͡ɹ̠ ɑ ŋ
strong	s t̠͡ɹ̠ ɒ ŋ
strong	s t̠͡ɹ̠ ɔ ŋ
strong	ʃ t̠͡ɹ̠ ɑ ŋ
strong	ʃ t̠͡ɹ̠ ɒ ŋ
strong	ʃ t̠͡ɹ̠ ɔ ŋ
strong	ʃ t͡ʃ ɹ ɔ ŋ
structure	s t ɹ ɐ k t ʃ ə ɹ
structure	s t ʃ ɹ ɐ k t ʃ ə
struggle	s t ɹ ʌ ɡ l̩
strut	s t ɹ ɐ t
strut	s t ɹ ʊ̈ t
strut	s t ɹ ʌ t
styll	s t ɪ ɫ
subhuman	s ʌ b h j uː m ə n
subliminal	s a b l ɪ m ɪ n l̩
subliminal	s ə b l ɪ m ɪ n l̩
subliminal	s ʌ b l ɪ m ɪ n l̩
subpar	s ə b pʰ ɑ ɹ
subpar	s ə b pʰ ɑ ˞
substance	s ʌ b s t ə n t s
substituent	s ʌ b s t ɪ t ʃ u ə n t
subtle	s ʌ ɾ ɫ̩
subversive	s ə b β ɝ s ɪ v
subversive	s ə b̪ v ɝ s ɪ v
subway	s ʌ b w e ɪ̯
sudden	s ʌ d n̩
suggestion	s ə d͡ʒ ɛ ʃ t ʃ ə n
sui	s u̯ e ɪ̯
supercombinator	s uː p ɚ k ɑ m b ɪ n e ɪ ɾ ɚ
superplural	s j u p ə p l ɔː ɹ ə l
superplural	s j u p ə p l ʊ ə ɹ ə l
superplural	s j y p ɐ p l ʊ̘ˑ ɹ ə l
support	s ə pʰ o ɹ t
support	s ə pʰ ɔ ɹ t
support	s ə pʰ ɔː t
suppose	s p o ʊ z
suppose	s p ə ʊ z
suppose	s ə pʰ o ʊ z
suppose	s ə pʰ ə ʊ z
suzuki	s y z yː k i
swallow	s w ɑ w ɜ ʊ̯
swallow	s w ɑ ɫ o ʊ̯
sweaty	s w ɛ ɾ i
sweeten	s w iː t n̩
sweeten	s w iː ʔ n̩
sweetheart	s w i ɾʱ ɑ ɹ t̠̚
syllable	s ɪ l ə b ɫ̩
symbology	s ɪ m b ɑ l ə d͡ʒ i
symbology	s ɪ m b ɒ l ə d͡ʒ i
symphony	s ɪ ɱ f ə n i
syncline	s ɪ ŋ k l a ɪ n
syndical	s ɪ n d ɪ k l̩
syntagms	s ɪ n t æ m z
t'	t̚
t'	ʔ
t'	ː
ta	tʰ ɑː
tab	tʰ æ b̥
tackle	tʰ æ k ɫ̩
taco	tʰ e ɪ k o ʊ
taco	tʰ ɑ k o ʊ
tagore	tʰ ə ɡ ɔː
tahan	t ä ˧ h ä n ˦˧
take	tʰ e ɪ̯ k
talib	tʰ æ l ɪ b
taliesin	t a l j ɛ s ɪ n
talk	t a k
talk	t ä k
talk	t ɑ k
talked	tʰ ɔː k t
tampines	t ɛ m ˧ p ə ˧ n i s ˦
tampon	tʰ æ m p ɑ n
tampon	tʰ æ m p ɒ n
tandem	t ɛ ə n d ə m
tank	t ɛ ə ŋ k
tap	tʰ æ p
tapao	t ɑː ˧ p a ʊ
tape	tʰ e ɪ̯ p
tar	tʰ ɑ ɹ
tar	tʰ ɑ ɻ
target	tʰ ɑ ɹ ɡ ɪ t̚
tarn	t ɝ n
tatsoi	tʰ ɑ ʔ t s ɔ ɪ
tatterara	t æ t̪ ə ɹ ɑː ɹ ɑː
tea	tʰ i
tea	tʰ iː
teal	t iː ɫ
teared	t i ɚ̯ d
teared	t ɛ ɚ̯ d
teared	t ɛː d
teared	t ɪː d
tech	tʰ ɛ k
technological	t ɛ k n ə l ɑ d͡ʒ ɪ k l̩
technological	t ɛ k n ə l ɒ d͡ʒ ɪ k l̩
techwear	tʰ ɛ k w ɛ ɚ
techwear	tʰ ɛ k w ɛ ɹ
teeter	tʰ i ɾ ɚ
tej	t ɛ d͡ʒ
telangana	t̪ ɛ l ə ŋ ɡ ɑː n ə
tell	tʰ ɛ l
tell	tʰ ɛ ɫ
tellurian	tʰ ə l ɝː iː ɨ̃ n
temerity	t ə m ɛ ɹ ə t̬ i
temperature	tʰ ɛ m pʰ ə ɹ t͡ʃ ɚ
temperature	tʰ ɛ m pʰ ɹ ə t͡ʃ ɚ
ten	tʰ ɛ n
tenth	tʰ ɛ n̪ θ
teotwawki	t i ɑ t w ɑ k i
test	tʰ e s t
test	tʰ ɛ s t
testable	tʰ e s t ə b l̩
testable	tʰ ɛ s t ə b l̩
thank	t̪ e ɪ̯ ŋ k
thank	ð e ɪ̯ ŋ k
thank	ð æ ŋ k
thank	θ a ŋ k
thank	θ e ɪ̯ ŋ k
thank	θ æ ŋ k
theater	θ i ə̯ t ɜ
theater	θ i ə̯ ɾ ɜ
them	d̪ ɛ m
them	d̪ ʌ m
theosophy	θ i ɑ s ə f i
theosophy	θ ɪ ɒ s ə f ɪ
theta	f e i̯ ˥ tʰ aː ˩
thickie	θ ɪ k i
think	θ æ ŋ k
thirty	θ ɝ ɾ i
thorn	θ o̞ ɹ n
thousand	θ a ʊ̯ z n̩ d
thread	θ ɾ̪̊ ɛ d
three	t̪ ɾ̪̊ iː
three	θ ɹ i
three	θ ɹ̥ i
three	θ ɹ̥ ɪ i
three	θ ɾ̪̊ i
three	θ ɾ̪̊ iː
three	θ ɾ̪̊ ɪ i
thrice	θ ɾ̪̊ ä ɪ s
thrice	θ ɾ̪̊ ɑ ɪ s
thrill	t̪ ɾ̪̊ ɪ l
thrill	θ ɹ̥ ɪ ɫ
thrill	θ ɾ̪̊ ɪ l
thrill	θ ɾ̪̊ ɪ ɫ
throne	t ɹ o ʊ n
throne	θ ɹ o ʊ n
throne	θ ɹ ə ʊ n
through	θ ɾ̪̊ ɵ ʉ
through	θ ɾ̪̊ ʊ u
throw	θ ɾ̪̊ o ʊ
throw	θ ɾ̪̊ ə ʊ
throwends	θ ɹʷ ə ʊ̯ ə n d z
tidbit	tʰ ɪ d̚ b ɪ t̚
tide	tʰ aː d
tide	tʰ ɑ e̯ d
tied	tʰ aː d
tied	tʰ ɑ e̯ d
tighten	tʰ a ɪ̯ t n̩
tighten	tʰ a ɪ̯ ʔ n̩
time	tʰ a ɪ̯ m
time	tʰ ɑ e̯ m
tin	tʰ ɪ n
tingkat	t ɪ ŋ ˧ k ä t ˦
tiptoe	tʰ ɪ p tʰ o ʊ̯
tiptoe	tʰ ɪ p tʰ ə ʊ̯
tire	tʰ a ɪ̯ ɚ
titter	t ɪ ɾ ɚ
titty	tʰ ɪ ɾ i
to	tʰ u̟
to	tʰ u̟ː
to	tʰ ʉː
to	ɾ ə
to	ɾ ʊ
today	tʰ ə d e ɪ
today	tʰ ʉ ɾ e ɪː
today	tʰ ʊ d e ɪ
told	tʰ ɒ ʊ ɫ d
told	tʰ ɔ ʊ ɫ d
tomato	tʰ ə̥ m e ɪ ɾ o ʊ
tomato	tʰ ə̥ m ɐː tʰ ɐ ʉ̯
tomato	tʰ ə̥ m ɑː tʰ ə ʉ̯
tomfoolery	t ɔ m ɸ u l ɚ i
tomfoolery	t ɔ ɱ f u l ɚ i
tompang	t ɔ m p ä ŋ
too	tʰ u̟
too	tʰ u̟ː
toon	t uː n
toots	tʰ u t s
toots	tʰ ʊ t s
top	tʰ ɑˀ p
top	tʰ ɒˀ p
toronto	tʰ ə ɹ ɒ n tʰ o ʊ
toronto	tʰ ə ɹ ɒ ɾ̃ o ʊ
toronto	tʰ ə ɹ ɒ ɾ̃ ə
toronto	tʰ ɹ ɒ ɾ̃ ə
toronto	t͡ʃ ə ɹ ɒ n o ʊ
toronto	t͡ʃ ə ɹ ɒ n ə
toronto	t͡ʃ ɹ ɒ n o ʊ
toronto	t͡ʃ ɹ ɒ n ə
tortilla	t ɔ ɹ tʰ i j ə
total	tʰ o ʊ̯ ɾ ɫ
total	tʰ ɔ ɾ ɫ
towards	tʰ w̥ oː d z
towards	tʰ w̥ ɔ ɹ̠ d̠ z
towards	tʰ ɘ̥ w oː d z
towards	tʰ ə̥ w ɔ ɹ̠ d̠ z
towards	tʰ ə̥ w ɔː d z
towel	tʰ æ ɒ̯ ɬ
towel	tʰ æ ɬ
towel	tʰ ɛ j ɔ̯ ɬ
town	tʰ a ʊ̯ n
toyota	t a ɪ̯ o ʊ̯ ɾ ə
toyota	t ɔ ɪ̯ o ʊ̯ ɾ ə
trace	t ʃ ɹ e ɪ s
tracer	t ʃ ɹ e ɪ s ə ɹ
tracer	t ʃ ɹ e ɪ s ɚ
traditionally	t ɹ ə d ɪ ʃ n̩ l i
traditionally	t ɹ ɪ d ɪ ʃ n̩ l i
train	t̠ ɹ̠̊ ˔ e̞ ɪ n
trainee	t ʃ ɹ e ɪ n i
trainees	t ʃ ɹ e ɪ n i z
traitor	tʰ ɹ e ɪ ɾ ɚ
tram	t ɹ e ə m
tram	t ɹ ɛ ə m
tram	t ɹ ɛː m
transcaucasia	t ɹ æ n s k ɔː k e ɪ z j ə
transcaucasia	t ɹ æ n s k ɔː k e ɪ ʒ ə
transcript	t ʃ ɹʷ a n s k ɹʷ ɪ p̚ t
transcript	t ʃ ɹʷ æ n s k ɹʷ ɪ p̚ t
translate	t ʃ ɹʷ ɛ̃ n z ɫ æ e̯ ʔ t
translator	tʰ ɹ æ n z l e ɪ tʰ ɚ
translator	tʰ ɹ æ n z l e ɪ ɾ ɚ
trap	t̠ ɹ̠̊ ˔ ä p
trap	t̠ ɹ̠̊ ˔ æ p
trap	t̠ ɹ̠̊ ˔ ɛ p
traumata	t ɹ ɑ m æ ɾ ə
traumata	t ɹ ɑ m ɑ ɾ ə
traumata	t ɹ ɑ m ə ɾ ə
traumata	t ɹ ɔ m æ ɾ ə
traumata	t ɹ ɔ m ɑ ɾ ə
traumata	t ɹ ɔ m ə ɾ ə
trick	t ʃ ɹ̠̊ ɪ k
trick	t̠ʰ ɹ̠̊ ɪ k
trig	t̠ʰ ɹ̠̊ ɪ ɡ
trill	t̠ʰ ɹ̠̊ ɪ l
trim	t̠ʰ ɹ̠̊ ɪ m
trinal	t ɹ ʌ ɪ n̩ l
trip	t̠ʰ ɹ̠̊ ɪ p
tritone	t̠ ɹ̠̊ ˔ʷ a ɪ tʰ o ʊ̯ n
tritone	t̠͡ʃ ɹ̠̊ ˔ʷ ä ɪ tʰ o ʊ̯ n
trope	t ɹ̥ ə ʊ p
true	t̠ ɹ̠̊ ˔ʷ u̠ː
trump	t͡ʃ ɹ ʌ m p
trunk	t ɹ ʌ ŋ k
trunk	t͡ʃ ɹ ʌ ŋ k
trust	t ɹ ɐ s t
trust	t ɹ ʌ s t
truthfully	t ɹ uː θ f ɫ̩ i
try	t ɹ̝̊ a ɪ̯
try	t̠͡ɹ̠̊ ˔ a ɪ̯
try	t̠͡ɹ̠̊ ˔ʷ a ɪ̯
try	t͡ʃ ɹ a ɪ̯
tucker	tʰ ʌ k ə
tucker	tʰ ʌ k ɚ
tumult	t ʌ m ʌ l t̰̚
turkish	t ɐ ˞ k ɪ ʃ
turkish	t ɚ k ɪ ʃ
turtle	tʰ ɝ ɾ ɫ̩
tut	ǀ
twain	tʰ w̥ e ɪ n
twat	tʰ w̥ æ t
twat	tʰ w̥ ɑ t
twat	tʰ w̥ ɔ t
twelfth	tʰ w̥ ə l f θ
twelfth	tʰ w̥ ə lʷ f
twelfth	tʰ w̥ ə l̪ θ
twelfth	tʰ w̥ ɛ l f θ
twelfth	tʰ w̥ ɛ lʷ f
twelfth	tʰ w̥ ɛ l̪ θ
twelve	t w̥ e ɫ v
twelve	t w̥ ə ɫ v
twelve	t w̥ ɛ v
twelve	t w̥ ɛ ɫ v
twenny	t w ɛ n i
twenny	t w ɛ ɾ̃ i
twenny	t w ʌ n i
twenny	t w ʌ ɾ̃ i
twenty	t w̥ ɛ ɾ̃ i
twenty	t w̥ ɛ̃ n t i
twenty	t w̥ ɛ̃ ɾ̃ i
twerk	t w̥ ɜː k
twerk	tʰ w̥ ɝ k
twice	t w̥ a ɪ s
twig	tʰ w̥ ɪ ɡ
twill	t w ɪ ɫ
twin	t w̥ ɪ n
twink	tʰ w̥ ɪ ŋ k
twist	t w̥ ɪ s t
twit	tʰ w̥ ɪ t
twitch	tʰ w̥ ɪ t͡ʃ
twitter	tʰ w ɪ ɾ ɚ
twitter	tʰ w̥ ɪ ɾ ɚ
two	tʰ u̟
two	tʰ u̟ː
twos	tʰ u̟ z
twos	tʰ u̟ː z
tyneside	t a i n s a i d
tyneside	t ɛ i n s ɛ i d
typewriter	t a ɪ p ɹ a ɪ t ə ɹ
ugh	ə
ugh	ə x
ugh	ə ɣ
ugh	ə χ
ugh	ɜ̰ʰ
ugh	ɯ x
ugh	ɯ ɣ
ugh	ɯ ʀ̊
ugh	ɯ χ
ugh	ʊ
ugh	ʊ k
ugh	ʊ x
ugh	ʊ ɡʱ
ugh	ʊ ʀ̊
ugh	ʊ χ
ugh	ʌ k
ugh	ʌ x
ugh	ʌ ɡ
ugh	ʌ ʀ̊
ugh	ʌ χ
ugh	ʌ᷈
ugh	χ
ukraine	j u k ɹ e ɪ̯ n
ukraine	j u̟ k ɹ e ɪ̯ n
ultimately	ʌ l t ɪ m ɪ ɾ l i
unacceptable	ɐ n æ k s ɛ p tʰ ə b ɫ̩
unacceptable	ɐ n ə k s ɛ p tʰ ə b ɫ̩
unacceptable	ɐ n ɪ̞ k s ɛ p tʰ ə b ɫ̩
under	ɐ n d ə ɹ
under	ʌ n ɾ ɚ
under	ʌ ɾ̃ ɚ
understand	ʌ ɾ̃ ɚ s t e ə̯ n d
understand	ʌ ɾ̃ ɚ s t æ̃ n d
underutilize	ɐ n d ə j uː t ɪ l a ɪ z
underutilize	ʌ n ɾ ɚ j uː t ɪ l a ɪ z
underutilize	ʌ ɾ̃ ɚ j uː t ɪ l a ɪ z
undivided	ʌ ɾ̃ ɪ̈ v a ɪ̯ ɾ ɪ̈ d
unfair	ɐ n f ɛ ə ɹ
unfair	ɐ n f ɛː ɹ
unfetter	ʌ n f ɛ ɾ ɚ
unilateral	j ʉː n ə ɫ æ ɾ ɚ ɻ ɫ̩
unilateral	j ʉː n ɪ l æ t ə ɹ ɫ̩
unilateral	j ʉː n ɪ l æ t͡ʃ ɹ ɫ̩
unintentional	ʌ n ɪ n tʰ ɛ n ʃ n̩ ɫ̩
unite	j u̟ n a ɪ̯ ʔ
unite	j u̟ n a ɪ̯ ʔ t̚
unite	j ə n a ɪ̯ ʔ
unite	j ə n a ɪ̯ ʔ t̚
unite	j ʊ n a ɪ̯ ʔ
unite	j ʊ n a ɪ̯ ʔ t̚
united	j u n a ɪ̯ ɾ ɪ̈ d
united	j u̟ n a ɪ̯ ɾ ɪ̈ d
united	j ə n a ɪ̯ ɾ ɪ̈ d
united	j ʊ n a ɪ̯ ɾ ɪ̈ d
unlicensed	ʌ n l a ɪ s n̩ s t
unnerstand	ɜ ɽ̃ ɻ s t æ n d̚
unremarkable	ʌ n ɹ ɪ m ɑ ɹ k ə b l̩
unremarkable	ʌ n ɹ ɪ m ɑː k ə b l̩
untac	j u ɛ n t ɪ ɛ j s iː
untaet	j u ɛ n t i ɛ j ɪ t iː
unutterable	ʌ n ʌ ɾ ɚ ɪ̈ b l̩
up	ä p
up	ɐ ʔ p
up	ʌ p̚
upmost	ʌ ʔ m o ʊ s t
upvote	ʌ p β o ʊ t
upvote	ʌ p̪ v o ʊ t
usher	a ʃ ə ɹ
usher	ʌ ʃ ə ɹ
usher	ʌ ʃ ɚ
utility	j u t ɪ l ə ɾ i
utter	ɐ t ə
utter	ʌ ɾ ɚ
vajazzle	v ə d͡ʒ æ z l̩
vale	v e ɪ ɫ
vendetta	v ə n d ɛ ɾ ə
vendetta	v ɛ n d ɛ ɾ ə
venus	v i n ɪ̈ s
verbal	v ɜ ˞ b ɫ̩
verbal	v ɜː b ɫ̩
vermont	v ɚ m ɑ n ʔ t̚
vermont	v ɚ m ɑ̃ ʔ
versatile	v ɜː s ə t a ɪ ɫ
veteran	v ɛ t̬ ə ɹ ə n
veteran	v ɛ ɾ ə ɹ ə n
veto	v iː tʰ o ʊ
veto	v iː ɾ o ʊ
vibrator	v a ɪ̯ b ɹ e ɪ̯ ɾ ɚ
vicissitude	v a ɪ s ɪ s ɨ t j uː d
vicissitude	v ɨ s ɪ s ɨ t j uː d
vicissity	v a ɪ s ɪ s ɨ t i
vicissity	v ɪ s ɪ s ɨ t i
vindical	v ɪ n d ɪ k l̩
violin	v a ɪ̯ ɪ̈ l ɪ n
virtual	v ɵː t͡ʃ ɯ l
virtually	v ɝ t͡ʃ u ə ɫ i
vision	v ɪ ʒ n̩
vitamin	v ʌ ɪ ɾ ə m ɪ n
vlach	v l æ k
vlach	v l ɑː k
vocab	v o ʊ k æ b
vocab	v ə ʉ k æ b
vocab	v ə ʊ k a b
volatile	v ɑ l ə ɾ ɫ̩
vouchsafe	v ʌ ʊ t ʃ s e ɪ f
waddle	w ɑ ɾ ɫ̩
wah	w aːː
wah	w æːː
wail	w e ɪ ɫ
wain	w eː n
waistband	w e ɪ s t b æ n d
wait	w e ɪ̯ ʔ t
waiting	w e ɪ̯ ɾ ɪ ŋ
wale	w e ɪ ɫ
wales	w e ɪ ɫ z
wass	w a s
wass	w æ s
wassed	w a s t
wassed	w æ s t
water	w a t ə
water	w a ɾ ɚ
water	w aː ʈ ə r ɯ
water	w o ʊ ʔ ə
water	w oː t ə
water	w oː ɾ ə
water	w oː ʔ ɐ
water	w oː ʔ ə
water	w ɑ ɾ ɚ
water	w ɒː θ̠ ɚ
water	w ɔ o ɾ ɐ
water	w ɔ t ə r
water	w ɔ ə ɾ ə
water	w ɔ ɹ ɾ ɚ
water	w ɔ ɾ ɚ
water	w ɔ ʈ ə r
water	w ʊ ɾ ɚ
water	ʋ aː ʈ ə r ɯ
water	ʋ ɔ ʈ ə r
wattle	w ɑ ɾ l̩
wealth	w ɛ l̪ θ
wean	w eː n
wear	w ɛ ɚ
wear	w ɛ ɹ
weeaboos	w iː a b yː z
wellington	w ɛ l ɪ ŋ t ə n
welp	w ɛ l p̚
went	w ɛ n ʔ t̚
weren't	w ɝ n
weren't	w ɝ̃ ʔ
weren't	w ɝ̃ ʔ t̚
westside	w ɛ s s a ɪ d
westside	w ɛ s s aː d
westside	w ɛ s t s a ɪ d
wetting	w ɛ ɾ ɪ ŋ
whakapapa	f a k a p a p a
what're	w ʌ ɾ ɚ
whataboutism	w ə ɾ ə b a ʊ ɾ ɪ z m̩
whatev	w ʌ ɾ ɛ v
whet	w ɛ ʔ t̚
whet	ʍ ɛ ʔ t̚
whetstone	w ɛ ʔ s t o ʊ n
whetstone	ʍ ɛ ʔ s t o ʊ n
whetter	w ɛ ɾ ɚ
whetter	ʍ ɛ ɾ ɚ
wheugh	ɸ ɪ̥ u̯ h
whew	ɸ ĭ̥ ŭ̥
whew	ʍ ĭ̥ ŭ̥
whine	ʍ a ɪ̯ n
whine	ʍ äː n
whine	ʍ ɑ e̯ n
whine	ʍ ʌ ɪ̯ n
whiten	h w a ɪ̯ t n̩
whiten	h w a ɪ̯ ʔ n̩
who're	h uː ɹ
who're	h ʊ ɚ
whole	h o ʊ ɫ
whole	h ɒ ʊ ɫ
whole	h ə ʊ ɫ
wholemeal	h ɔ ʊ ɫ m i ə ɫ
wholest	h o ʊ̯ ɫ ɛ s t
wholly	h o ʊ l i
wholly	h o ʊ ɫ l i
wholly	h ɒ ʊ ɫ l ɪ
wholly	h ə ʊ l ɪ
whomperjawed	w ɑ̃ m p ɚ d͡ʒ ɑ ɒ̯ d
whuddup	w ʌ ɾ ʌ p
width	w ɪ d̪ θ
wieldy	w ɪ ə l d ɪ
wiktionary	w i k ʃ n ə ɾ i
wild	w a ɪ̯ ɫ d
wild	w a ɪ̯ ɫ̩ d
wildcat	w a ɪ ə l ʔ k æ t
wilde	w a ɪ ə̯ ɫ d
will	w ɪ ɫ
window	w ɪ ɾ̃ o ʊ
winter	w ɪ n tʰ ɚ
winter	w ɪ n ɚ
winter	w ɪ ɾ̃ ɚ
winters	w ɪ ɾ̃ ɚ z
wintertide	w ɪ ɾ̃ ɚ t a ɪ d
wintry	w ɪ ɾ̃ ə ɹ i
wisconsin	w ə s k ɑ n s n̩
wisconsin	w ə s kʰ ɑ n s n̩
without	w ɪ ð ɐ ʊ t
without	w ɪ θ ɐ ʊ t
witter	w ɪ ɾ ɚ
witty	w ɪ ɾ i
wolf	w ɫ̩ f
wolf	w ʊ w f
wolf	w ʊ̠ ɫ f
woman	w o m ɪ n
won't	w õ tˀ
won't	w õ ʔ
woodlands	w u d ˧ l ə n z ˦
wool	w ə l
wool	w ɫ̩
wool	w ʊ̠ ɫ
work	w œː k
work	w ɔː k
work	w ɚ k
work	w ɛː k
work	w ɜː k
work	w ʊː ɹ k
workforce	w ɚ k f o̞ ɹ s
world	w ɵː ɯ̯ d̥
worra	w ɒ ɾ ə
worrisome	w ɜː ə s ə m
worse	w ə ɪ s
wouldn't	w ʊ dⁿ n̩ t
wouldn't	w ʊ n ʔ
wouldn't	w ʊ ɾ ə n t
wouldn't	w ʊ ʔ n̩ t
wrake	ɹ e ɪ̯ kʰ
wrightwood	ɹ a i̯ t̚ w ʊ d̚
wristlet	ɹ ɪ s l ɨ ʔ̚
writer	ɹ̠ a ɪ t ə
writer	ɹ̠ ă ɪ ɾ ɚ
writer	ɹ̠ ʌ ɪ ɾ ɚ
wuddup	w ʌ ɾ ʌ p
y'all's	j ɔ l z
yatt	j a t
yatt	j æ t
ye	j iː
ye	j ɪ i
yech	j ɛ x
yech	j ɛ χ
yeh	j ɛ
yeh	j ɛ ə
yeh	j ɛː
yep	j ɛ p̚
yep	j ɛ ʔ
yeppity	j ɛ p ɨ ɾ i
yeti	j ɛ ɾ i
yeung	j œ ŋ
yive	j ɪ v
yprois	i p ʁ w aː
yprois	i p ʁ w aː z
yup	j ʌ p̚
yuppity	j ʌ p ɨ ɾ i
zarina	z ʌ ɹʲ i n ə
zemfira	z ɛ ɱ f i ɹ ə
zemfira	z ɪ ɱ f i ɹ ə
zhng	t͡s ŋ̍ ˦
ziti	z i ɾ i
zooplasty	z o ʊ ə p l æ s t i
zooplasty	z ə ʊ ə p l æ s t i
zun	z ʌ n
