'dine	d iː n
'dine	d ĩː n
'em	m̩
'em	ə m
'em	ɛ m
'em	ɪ m
'll	l̩
'll	ə l
'll	ɫ̩
'll	ɯ
'll	ʊ
'n	n̩
'n'	n̩
'n'	ə n
'rales	ɹ ɑː l i z
Adam	æ ɾ m̩
Adam	æ ɾ ə m
Alder	ɔː l d ə
Andrew	eᵊ n d̠ ɹ̠ ˔ʷ ʊ̈ u
Andrew	æ n d̠ ɹ̠ʷ ˔ ʊ̈ u
Aristotle	æ ɹ ɪ s t ɒ tᵊ ɫ̩
Arlon	ɑ ɹ ɫ ɔː n
Arlon	ɑː ɫ ɔː n
Atlanta	æ t l æ n ə
Atlanta	æ t l æ ɾ̃ ə
Augustan	ɔː ɡ ʌ s t n̩
Baedeker	b e ɪ d ɪ k ə
Bashkortostan	b a ʃ k o̞ː ɹ t ə ʉ̯ s t æ n
Bastille	b æ s t ɪ ə ɫ
Beatle	b iː t ə ɫ
Bill	b ɪ ɫ
Breault	b ɹ o ʊ̯
Brighton	b ɹ a ɪ̯ ʔ ə n
Britain	b ɹ ɪ t n̩
CALAX	k ɐ l a k s
CAVITEX	k ɐ v iː t ɛ k s
Cain	kʰ e ɪ n
Cambodia	k æ m b o ʊ d i ə
Chance	t͡ʃʰ æ n s ~ t͡ʃʰ a n s
Chance	t͡ʃʰ ɐː n s
Chance	t͡ʃʰ ɑː n s
Chance	t͡ʃʰ ɛ ə n s ~ t͡ʃʰ e ə n s
Chechnya	t͡ʃ ɛ t ʃ ɲ i ə
China	t͡ʃʰ a ɪ̯ n ə
Clinton	k l ɪ n ʔ n̩
Coventry	kʰ ɒ v ə n t ʃ ɹ i
Cuba	k j uː b ə
Cuban	k j u b ə n
Cuban	k j uː b ə n
Cuban	k j ʉː b ə n
Daniel	d a n j ə l
Dardanelles	d ɑ ɹ d ə n ɛ ɫ z
Dardanelles	d ɑː d ə n ɛ ɫ z
Delphi	d ɛ ɫ f i
Delphine	d ɛ ɫ f iː n
Denton	d ɪ n ʔ n̩
Diggle	d ɪ ɡ ə ɫ
Diggles	d ɪ ɡ ə ɫ z
Disibodenberg	d ɪ z ɪ b ə ʊ d n̩ b ɛ ɚ k
Dunn	d ɐ n
EDSA	ʔ ɛː d s ɐ
Edinburgh	ɛ d n̩ b ə ɹ ə
El	ɛ ɫ
Fitz	f ɪ t s
FrankenSAM	f ɹ a ŋ k n̩ s a m
Gaeltacht	ɡ e ɪ l t ə x t
Gangtok	ɡ æ ŋ t ɒ k
Gmail	d͡ʒ iː m e ɪ l
Gorrie	ɡ ɒ ɹ̠ w iː
Hollywood	h ɑ ɫ i w ʊ d
Hollywood	h ɒ ɫ i w ʊ d
Humvee	h ʌ m β iː
Humvee	h ʌ ɱ v iː
Hydra	h a ɪ̯ d ɹ ə
Hydra	h a ɪ̯ d͡ʒ ɹ ə
I	ɑ j
IPA	a ɪ pʰ iː e ɪ
Ireland	a ɪ ɚ l ə n d
Ireland	ä ɪ ɚ ɫ ɪ̈ n d
Ireland	ɑ ɚ l ə n d
Ireland	ɑ ɪ ə l ə n d
Ireland	ɑ ɪ ɚ l ə n d
Ireland	ə ɪ ɚ l ə n d
Ireland	ʌ ɪ ɚ l ə n d
Italy	i t ɐ l i
Italy	ɪ t ə l i
Italy	ɪ ɾ ə l i
Jacobinism	d͡ʒ æ k ə b ɪ n ɪ z m̩
Jungian	j ʊ ŋ i j ə n
Jungian	j ʊ ŋ ɡ i j ə n
Kare	k aː ɾ e
Kastner	kʰ æ s t̚ n ə ɹ
Katy	kʰ e ɪ̯ ɾ i
Kebnekaise	k ɛ b n ə k a i s ə
Khalkha	kʰ ɑː ɫ kʰ ə
Koizumi	kʰ ɔ i̯ z u m i
Korea	kʰ ɵ ɹ iː ə
Lambrusco	l æ m b ɹ ʊ s k ə ʊ
Langevin	l ɛ ə ŋ ə v ɪ n
Lycra	l a ɪ k ɹ ə
MASH	m a ʃ
Malinois	m æ l ɪ n w ɑː
Mandelson	m a n d l̩ s n̩
Mandelson	m a n d l̩ s ə n
Maximilian	m æ k s ɪ m ɪ l j ə n
Mendelson	m ɛ n d l̩ s n̩
Mendelson	m ɛ n d l̩ s ə n
Menderson	m ɛ n d ɚ s n̩
Metairie	m ɛ ɾ ə ɹ i
Michael	m ɐ ɪ k ɫ̩
Michigander	m ɪ ʃ ə ɡ æ n d ɚ
Mikey	m ɐ ɪ kʰ iː
Mister	m ɪ s t ə ɹ
Moneyball	m ɐ n i b ɔː l
Montagnard	m ɒ n t ə n j ɑː d
Montagnard	m ɒ̃ⁿ t ə n j ɑː d
MyKad	m a ɪ kʰ ɑː d
NAIAX	n ɐ ʔ iː ɐ k s
NAIAX	n ɐ ʔ ɪ aː ʔ ɛ k s
NLEX	ʔ ɛː n l ɛ k s
Nabil	n a b ɪ ɫ
Nabil	n ə b ɪ ɫ
Nancy	n ɛ ə n s i
Nauruan	n ɑː uː ɹ uː n̩
Newcastle	n j ʉ kʰ a s ɫ̩
Newcastle	n j ʉ kʰ ɑː s ɫ̩
Ng	ŋ̍
Nippon	n ɪ p ɒ n
PAL	pʰ æ l
Paddy	pʰ æ ɾ i
Park	pʰ ɑː k
Patrick	pʰ æ t̠ ɹ̠̊ ˔ʷ ɪ k̚
Philadelphia	f ɪ ɫ ə d ɜ ɫ f i ə
Pulliam	pʰ ʊ ɫ i m̩
Pulliam	pʰ ʊ ɫ j ə̃ m
Putler	p uː t l ə
Pyrrha	pʰ ɪ ɹ̠ ə
Quart	k a ʁ
Quart	k w a ɾ t
Quinn	kʰ w̥ ɪ n
Rhene	ɹ̥ iː n iː
Samantha	s ə m ɛ ə n θ ə
Shalë	ʃ aː l
Siberia	s a ɪ b ɪ ə ɹ ɪ ə
Siberian	s a ɪ b ɪ ə ɹ ɪ ə n
Subaru	s u̟ w b ə ɹ u̟ w
Subaru	s ʉ w b ə ɹ ʉ w
TESDA	t ɛː s d ɐ
Tagore	tʰ ə ɡ ɔː
Talib	tʰ æ l ɪ b
Telangana	t̪ ɛ l ə ŋ ɡ ɑː n ə
Throwends	θ ɹʷ ə ʊ̯ ə n d z
Transcaucasia	t ɹ æ n s k ɔː k e ɪ z j ə
Transcaucasia	t ɹ æ n s k ɔː k e ɪ ʒ ə
Turkiye	t uː ɹ k i j ə
Türkiye	t uː ɹ k i j ə
Ukrainophile	j u k r e ɪ n ə f a ɪ l
Union	u n i̯ oː n
Utter	ɐ t ə
Venedotian	v ɛ n ɪ d ə ʊ ʃ n̩
Vlach	v l æ k
Vlach	v l ɑː k
WWW	d ʌ ɥ ʊ̆ d ʌ ɥ ʊ̆ d ʌ bˡ j u
Wales	w e ɪ ɫ z
Wilde	w a ɪ ə̯ ɫ d
Wisconsin	w ə s k ɑ n s n̩
Wisconsin	w ə s kʰ ɑ n s n̩
Zemfira	z ɛ ɱ f i ɹ ə
Zemfira	z ɪ ɱ f i ɹ ə
aa	ɑː ʔ ɑː
abear	ə b ɛː
able	e ɪ̯ b ɫ̩
abrogation	æ b ɹ ə ɡ e ɪ ʃ n̩
abysmal	ə b ɪ z m l̩
accommodate	ə kʰ ɒ m ə d e ɪ t
accommodator	ə k ɒ m ə d e ɪ t ə
accreditation	ə k ɹ ɛ d ɪ t e ɪ ʃ ə n
acknowledge	ə k n ɒ l ɨ̞ d͡ʒ
acknowledge	ə ɡ n ɒ l ɨ̞ d͡ʒ
acrally	æ k r ə l ɪ
added	a d ə d
added	a d ɪ d
added	æ ɾ ə d
added	æ ɾ ɪ d
addition	ə d ɪ ʃ n̩
administrative	ə d m ɪ n ɪ s t̠ ɹ̠̊ ˔ʷ ə tʰ ɪ v
aeroplane	ɛ ə̯ ɹ ə p l e ɪ̯ n
aerose	i ɹ ə ʊ z
agglutinin	ə ɡ l uː ʔ n̩ ɪ n
agh	æː x
aight	a ɪ̯ ʔ
aight	ə ɪ̯ ʔ
alban	a l b n̩
albicant	a l b ɪ k n̩ t
album	a ɫ b̚ m̩
alders	ɔː l d ə z
algorithm	æ ɫ ɡ ə ɹ ɪ ð m̩
alienation	e ɪ l i ə n e ɪ ʃ ə n
all	oː ɫ
allergies	æ l ə d͡ʒ i z
allergies	æ l ɚ d͡ʒ i z
allergy	æ l ə d ʒ i
allergy	æ l ɚ d͡ʒ i
almanac	ɔː l m ə n æ k
alpha	æ ɫ f ə
alternately	ɔː l t ɜ ɹ n ə t l ɪ
am	a m
am	æ m
amatory	æ m ə t ɔ ɹ i
amatory	ɑː m ə t ə ɹ ɪ
amazing	ə m e ɪ̯ z ɪ ŋ
amphibious	æ m f ɪ b i ə s
an	ɛ ə n
an'	n̩
analects	æ n ə l ɛ k t s
analytical	æ n ə l ɪ t ɪ k ɫ̩
angsts	e ɪ ŋ k s t s
aphorism	æ f ə ɹ ɪ z m̩
apple	æ p ɫ̩
appled	æ p ɫ̩ d
approachable	ə p ɹ ə ʊ t͡ʃ ə b l̩
approximation	ə p ɹ ɒ k s ɪ m e ɪ ʃ n̩
arbitration	ɑː b ə t̠͡ɹ̠ e ɪ ʃ n̩
argh	ɑ ɣː
argh	ɑ ɹ ɣ
article	ɑː tʰ ɪ kʰ ə ɫ
artificial	ɑː r t ɪ f ɪ ʃ l
asked	ɑː s k̚ t
atom	æ ɾ m̩
atom	æ ɾ ə m
attend	ə tʰ ɛ n d
attestable	ə t ɛ s t ə b ɫ̩
attic	æ ɾ ɪ k
attraction	ə t ɹ æ k ʃ ɪ̈ n
attraction	ə t͡ʃ ɹ æ k ʃ ɪ̈ n
aunt	a n t
aunt	aː n t
aunt	e ə n t
aunt	ä n t
aunt	äː n t
aunt	æ n t
aunt	ɐː n t
aunt	ɑː n t
aunt	ɒː n t
aunt	ɛ ə n t
availability	ə v e ɪ l ə b ɪ l ɪ t ɪ
awara	æ w ɑː ɹ ʌ
awara	ɒ w ʌ ɹ ʌ
aye	æ e̯
ayuh	ˀe ɪ ʌˀ
b'y	b ɤ i̯
b'y	b ʌ i̯
baa	b æ̰ˀ æ̰ˀ æ̰ˀ æ̰ˀ
baa	b æ̰ː
baa	b ɑː
babbler	b æ b ə l ə ɹ
back	b a k
back	b æ k
backspin	b æ k s p ɪ n
bacterial	b æ k t ɪ ə ɹ i ə ɫ
bagel	b e ɪ ɡ ɫ̩
bagful	b æ ɡ f ʊ ɫ
bald	b ɒ ʊ l d
bald	b ɔː ɫ d
baldric	b ɔː ɫ d ɹ ɪ k
bale	b e ə̯ ɫ
bale	b e ɪ̯ ə ɫ
bank	b e ɪ ŋ k
baptize	b a p t a j z
baptize	b æ p t a j z
barn	b ɑː n
barrel	b æ ɹ ə ɫ
basal	b e ɪ s ə ɫ
bashful	b æ ʃ f ə ɫ
bashful	b æ ʃ f ʊ ɫ
bastille	b æ s t ɪ ə ɫ
bath	b a θ ~ b ä θ
bath	b æ θ ~ b ɛ ə θ ~ b e ə θ
bath	b ɑː t̪
bath	b ɑː t̪ʰ
bath	b ɑː θ
battle	b a tʰ ɫ̩
battlebus	b æ t ə ɫ b ʌ s
battlement	b æ t ə ɫ m ə n t
bauble	b ɔː b ə ɫ
bawl	b ɔː ɫ
beadle	b iː d ə ɫ
beagle	b̥ iː ɡ ə ɫ
beared	b ɛ ɚ̯ d
beared	b ɛː d
beaten	b iː t n̩
beaten	b iː ʔ n̩
beazle	b iː z ə ɫ
becquerel	b ɛ k ə ɹ ɛ ɫ
bedevil	b ɪ d ɛ v ə ɫ
bedight	b ɪ d ʌ ɪ t
beetle	b i ɾ ə ɫ
befang	b ə f æ ŋ
better	b e ʔ ə
better	b ɛ tʰ ə
betther	b ɛ t̪ ɚ
betting	b ɛ ɾ ɪ ŋ
bill	b ɪ o̯
bill	b ɪ ɫ
bill	b ɪ ʊ̯
bitey	b a ɪ̯ ɾ i
bitter	b ɪ tʰ ə
bitter	b ɪ ʔ ə
bitty	b ɪ ɾ i
blam	b l a m
blam	b l æ m
bleach	b l i t͡ʃ
bleach	b l iː t͡ʃ
blem	b l ɛ m
blicky	b l ɪ k i
blurple	b l əː p l̩
bockety	b ɑ k ə t iː
bold	b ɒ ʊ ɫ d
boldly	b ɒ ʊ l d l i
bolster	b ɒ ʊ l s t ə
bolt	b ɔ ʊ ɫ t
bookcase	b ʊ ʔ k̚ k e ɪ s
boot	b uː t
botanist	b ɒ t n̩ ɪ s t
both	b o ʊ θ
both	b ɐ ʉ θ
both	b ə ʊ θ
both	b ɜ ʊ̯ θ
bottle	b ɒ ʔ ɫʷ
bottle	ə b ɔ t ɫ̩
bountiful	b a ʊ̯ n ɾ ə f ə ɫ
boutye	b ɐ ʏ t͡ʃ ə
bowl	b ɒ ʊ ɫ
bowling	b ɒ ʊ ɫ ɪ ŋ
brakeforce	b ɹ e ɪ k f ɔː ɹ s
bramble	b ɹ ɛ ə m b l̩
bramble	b ɹ ɛ ə m b ə l
break	b ɹʷ e ɪ̯ k
brew	b ɹ ʉ w
buccopalatal	b ʌ kʰ o ʊː pʰ æː l ə ɾ ɫ̩
buffer	b ɐ f ə ɹ
bumboclaat	b ʌ m b ə k l ɑ t
bump	b ɐ m̥ p
but	b ɐ t
butted	b ʌ ɾ ɨ d
butter	b ɐ tʰ ə
butterfly	b ʌ t ə f l a ɪ
butterfly	b ʌ ɾ ɚ f l a ɪ
butting	b ʌ ɾ ɪ ŋ
buttings	b ʌ ɾ ɪ ŋ z
buttock	b ɐ t ə k
button	b ʌ ʔ t ə n
button	b ʌ ʔ tⁿ n̩
béchamel	b ɛ ʃ ə m ɛ ɫ
cacao	k ə kʰ e ɪ̯ ə ʊ̯
cacao	k ə kʰ ɑː ə ʊ̯
cacoepy	k ə k ə ʊ ɪ p ɪ
cake	k̟ʰ e ɪ̯ k̚
calculable	kʰ æ ɫ k j ə l ə b l̩
call	kʰ o ɫ
called	kʰ o ɫ d
calling	kʰ o l ɪ ŋ
cam	k æ m
came	kʰ e ɪ̯ m
camp	kʰ e ə m p
camp	kʰ ɛ ə m p
can	kʰ a n
can	kʰ n̩
can	kʰ æ n
can	kʰ ə n
can't	k aː n t
can't	k aː ɳ ʈ
can't	k äː n t
can't	k æ n t ~ k ɛ ə n t ~ k e ə n t
can't	k ɐː n t
can't	k ɑ n t
can't	k ɑː n t
can't	kʰ ẽ ɪ̃ n t
can't	kʰ ẽ ɪ̃ n ʔ
canonical	k ə n ɒ n ɪ k l̩
cap	kʰ æ p
capital	kʰ æ p ɪ ɾ ɫ̩
caramba	k a ɹ a m b a
card	kʰ ɑː d
carload	kʰ ɑː l ə ʊ d
carnival	k ɑː n ɪ v l̩
cat	kʰ æ t
cat	kʰ æ t̚
cathedra	k ə θ iː d ɹ ə
cattle	kʰ æ t ə ɫ
caught	kʰ o ə̯ t
caught	kʰ ɑ t
caught	kʰ ɒ t
caught	kʰ ɔ t
caught	kʰ ɔ ə̯ t
caught	kʰ ʊ ə̯ t
caught	k̠ʰ oː t
causal	kʰ oː z̥ ə l
causality	kʰ oː z̥ æ l ɪ t ɪ
causation	kʰ oː z̥ e ɪ ʃ ə n
cause	kʰ oː z̥
caused	kʰ oː z̥ d
ceili	k e ɪ l i
ceramah	t͡ʃ ə r a m ʌ
chai	χ a i̯
chalcanthite	k æ w k æ n θ ɒ͡ɪ ʔ
chalcanthite	kʰ æ ɫ l kʰ æ n θ ʌ ɪ t̚
chalcanthite	~ θ ɒ͡ɪ t̚
chance	t͡ʃ ɑː n s
chance	t͡ʃʰ a n s
chance	t͡ʃʰ e ə n s
chance	t͡ʃʰ äː n s
chance	t͡ʃʰ æ n s
chance	t͡ʃʰ æː n s
chance	t͡ʃʰ ɐː n s
chance	t͡ʃʰ ɑː n s
chance	t͡ʃʰ ɛ ə n s
chance	t͡ʃʰ ɛː n s
chapel	t͡ʃ æ p ə ɫ
chapel	t͡ʃ æ p ɫ̩
char	t͡ʃ aː
charging	t͡ʃ aː d͡ʒ ɪ ŋ
charnel	t ʃ ɑː n ə l
chatted	t͡ʃ æ ɾ ɨ d
cheated	t͡ʃ i ɾ ɨ d
check	t͡ʃ ɛ k̚
child	t͡ʃ a ɪ̯ ɫ d
child	t͡ʃ a ɪ̯ ɫ̩ d
children	t ʃ ɪ l ɹ ə n
choo	t ʃ uː
chorea	kʰ ɵ ɹ iː ə
cicada	s ɪ kʰ e ɪ̯ d ə
cicada	s ɪ kʰ ɑː d ə
circle	s ɜː k ə ɫ
circle	s ɝ k ə ɫ
cital	s a ɪ t l̩
cital	s ʌ ɪ t l̩
city	s ɪ tʰ iː
city	s ɪ ɾ i
clamming	k l a m ɘ n
clay	k l̥ e ɪ
clean	kʰ l̥ iː n
cleanup	kʰ l iː n ʌ p
click	kʰ l̥ ɪ k
clientele	k l a ɪ n̩ t ɛ l
clientelism	k l a ɪ n̩ t ɛ l ɪ z m̩
clientelism	k l iː ɒ n t ɛ l ɪ z m̩
clientelist	k l a ɪ n̩ t ɛ l ɪ s t
clientèle	k l a ɪ n̩ t ɛ l
cliff	k l̥ʰ ɪ f
clip	k l̥ʰ ɪ p
clit	kʰ l̥ ɪ t
coach	kʰ ə ʊ̯ t ʃ
coal	kʰ ɒ ʊ ɫ
coccus	kʰ ɑ k ə s
coconut	kʰ ə ʊ̯ k ə n ɐ t
coconut	kʰ ə ʊ̯ k ə n ʌ t
coefficient	k ə ʊ i f ɪ ʃ n̩ t
coefficient	k ə ʊ ɪ f ɪ ʃ n̩ t
cold	kʰ ɒ ʊ ɫ d
cold	kʰ ɔ ʊ ɫ d
collaboration	kʰ ə l æ b ə ɹ e ɪ̯ ʃ ə n
colonelcy	kʰ əː n l̩ s i
colt	k ɔ ʊ l t
come	kʰ ɐ m
comfortable	kʰ ɐ ɱ f t ɘ b ɫ̩
comfy	kʰ ʌ m p f i
comfy	kʰ ʌ ɱ f i
comment	kʰ ɒ m ɛ n t
committee	k ɒ m ɪ t iː
committee	k ə m ɪ t i
communism	k ɒ m j u n ɪ z m̩
compare	k ə m p e ə
compare	k ə m p ɛ ə
compare	k ə m p ɛː
compatible	k m̩ p æ t ə b l̩
comptroller	k ə m p t ɹ o ʊ l ə ɹ
comptroller	k ə m t ɹ o ʊ l ə ɹ
concede	k ə n s ɪ i d
concoct	kʰ ə ŋ kʰ ɒ k t
confident	kʰ ɔ ɱ f ɪ d ə n t
confirmation	kʰ ɒ ɱ f ə m e ɪ ʃ n̩
conservancy	k ə n s ɜː v ə n s ɪ
constellation	k ɒ n s t ə l e ɪ ʃ n̩
contestant	k ə n tʰ ɛ s t ə n t
contestation	k ɒ n t ɛ s t e ɪ ʃ n̩
conversation	kʰ ɒ ɱ v ə s e ɪ ʃ n̩
convert	kʰ ɒ ɱ v ə t
convert	kʰ ə̥ ɱ v ɜː t
coolly	k uʷ ɫ l i
coolly	k ʉː l i
cougar	kʰ uː ɡ ə
coulda	kʰ ʊ d ə
couldn't	k ʊ n ʔ
countable	kʰ ã ʊ̯̃ n ɾ ə b ɫ̩
country	kʰ ʌ n t̠ ɹ̠̊ ˔ʷ i
craytur	k ɹ eː t̪ ə ɹ
creation	k ɹ iʲ e ɪ ʃ ɘ n
creep	kʰ ɹ iː p
crew	k ɹ u ʊ̯
crisscross	k ɹ ɪ s k ɹ ɒ s
crisscross	k ɹ ɪ s k ɹ ɔ s
cryptography	k ɹ̥ ɪ p tʰ ɒ ɡ ɹ ə f iː
cult	kʰ ʌ l t
curl	kʰ əː ɫ
cursor	kʰ ɜː s ə
curve	kʰ ɜː v
cycle	s a ɪ k l̩
cymbal	s ɪ m b ɫ̩
dabble	d æ b l̩
dance	d a n s
dance	d e ə n t s
dance	d ä n s
dance	d äː n s
dance	d æ n s
dance	d æː n s
dance	d ɐː n s
dance	d ɑː n s
dance	d ɛ ə n t s
dance	ɖ ɑː n s
dandle	d æ n d ə ɫ
dangleberry	d æ ŋ ɡ ə ɫ b ɛ ɹ i
dapple	d æ p ə ɫ
dappled	d æ p ə ɫ d
daredevil	d ɛ ə d ɛ v ə ɫ
data	d æ ɾ ə
daydream	d e ɪ d͡ʒ ɹ iː m
dayouth	d a jː uː θ
dayouth	d æ jː uː θ
dayum	d e ə j ə m
dayum	d æ̙ j ə m
deacetyltransferase	d iː ə s iː t a ɪ ɫ t ɹ ɑː n s f ə ɹ e ɪ z
dealkylate	d iː æ ɫ k ɪ l e ɪ t
dealkylated	d iː æ ɫ k ɪ l e ɪ t ə d
dealkylating	d iː æ ɫ k ɪ l e ɪ t ɪ ŋ ɡ
dealkylation	d iː æ ɫ k ɪ l e ɪ ʃ ə n
dealkylative	d iː æ ɫ k ɪ l ə t ɪ v
dean	d iː n
dean	d ĩː n
debatable	d ɪ b e ɪ t ə b ə ɫ
debateful	d ɪ b e ɪ t f ə ɫ
debuggable	d iː b ʊ ɡ ə b ə ɫ
debuggable	d iː b ʌ ɡ ə b ə ɫ
debulk	d iː b ʊ ɫ k
debulk	d iː b ʌ ɫ k
debunkable	d iː b ʊ ŋ k ə b ə ɫ
debunkable	d iː b ʌ ŋ k ə b ə ɫ
decadal	d ɪ k e ɪ d ə ɫ
decagonal	d ɪ k æ ɡ ə n ə ɫ
decahedral	d ɛ k ə h iː d ɹ ə ɫ
decalcification	d iː k æ ɫ s ɪ f ɪ k e ɪ ʃ ə n
decalcifier	d iː k æ ɫ s ɪ f a ɪ ə ɹ
decalcify	d iː k æ ɫ s ɪ f a ɪ
decalcifying	d iː k æ l s ɪ f a ɪ ɪ ŋ ɡ
decalcomania	d iː k æ ɫ k ə m e ɪ n ɪ ə
decanormal	d ɛ k ə n ɔː m ə ɫ
decaprenyl	d ɛ k ə p ɹ iː n a ɪ ɫ
decasulfide	d ɛ k ə s ʊ ɫ f a ɪ d
decasulfide	d ɛ k ə s ʌ ɫ f a ɪ d
decasyllable	d ɛ k ə s ɪ l ə b ə ɫ
decidable	d ɪ s a ɪ d ə b ə ɫ
decidual	d ɪ s ɪ d͡ʒ ʊ ə ɫ
decile	d iː s a ɪ ɫ
decile	d ɛ s a ɪ ɫ
decimole	d ɛ s ɪ m ə ʊ ɫ
decinormal	d ɛ s ɪ n ɔː m ə ɫ
decipherable	d ɪ s a ɪ f ə ɹ ə b ə ɫ
decision	d ɪ s ɪ ʒ n̩
decisional	d ɪ s ɪ ʒ ə n ə ɫ
decisions	d ɪ s ɪ ʒ n̩ z
declarable	d ɪ k l æ ɹ ə b ə ɫ
decodable	d ɪ k ə ʊ d ə b ə ɫ
decomposable	d iː k ə m p ə ʊ z ə b ə ɫ
decompositional	d iː k ɒ m p ə z ɪ ʃ ə n ə ɫ
deconstructable	d iː k ə n s t ɹ ʊ k t ə b ə ɫ
deconstructable	d iː k ə n s t ɹ ʌ k t ə b ə ɫ
deconstructional	d iː k ə n s t ɹ ʊ k ʃ ə n ə ɫ
deconstructional	d iː k ə n s t ɹ ʌ k ʃ ə n ə ɫ
decouplable	d iː k ʊ p l ə b ə ɫ
decouplable	d iː k ʊ p ə l ə b ə ɫ
decouplable	d iː k ʌ p l ə b ə ɫ
decouplable	d iː k ʌ p ə l ə b ə ɫ
decouplable	d ɪ k ʊ p ə l ə b ə ɫ
decouplable	d ɪ k ʌ p ə l ə b ə ɫ
decouple	d iː k ʊ p ə ɫ
decouple	d iː k ʌ p ə ɫ
decoupler	d iː k ʊ p ə l ə
decoupler	d iː k ʌ p ə l ə ɹ
decoupling	d iː k ʊ p ə l ɪ ŋ ɡ
decoupling	d iː k ʌ p ə l ɪ ŋ
decremental	d ɛ k ɹ ə m ə n t ə ɫ
decryptable	d ɪ k ɹ ɪ p t ə b ə ɫ
deducible	d ɪ d j uː s ɪ b ə ɫ
deductable	d ɪ d ʊ k t ə b ə ɫ
deductable	d ɪ d ʌ k t ə b ə ɫ
deductible	d ɪ d ʊ k t ə b ə ɫ
deductible	d ɪ d ʌ k t ə b ə ɫ
defalcate	d ɛ f ə ɫ k e ɪ t
defalcation	d ɛ f ə ɫ k e ɪ ʃ ə n
defalcator	d ɛ f ə ɫ k e ɪ t ə ɹ
defatigable	d ɪ f æ t ɪ ɡ ə b ə ɫ
defaultable	d ɪ f ɔː ɫ t ə b ə ɫ
defaulter	d ɪ f ɔː ɫ t ə ɹ
defeasible	d ɪ f iː z ɪ b ə ɫ
defeatable	d ɪ f iː t ə b ə ɫ
defendable	d ɪ f ɛ n d ə b ə ɫ
defensible	d ɪ f ɛ n s ɪ b ɫ
deferential	d ɛ f ə ɹ ɛ n ʃ ə ɫ
deferrable	d ɪ f ɜː ɹ ə b ə ɫ
deferral	d ɪ f ɜː ɹ ə ɫ
defiable	d ɪ f a ɪ j ə b ə ɫ
defiled	d ɪ f a ɪ j ə ɫ d
definable	d ɪ f a ɪ n ə b ə ɫ
definition	d ɛ f ɪ n ɪ ʃ n̩
definitional	d ɛ f ɪ n ɪ ʃ ə n ə ɫ
deflectable	d ɪ f l ɛ k t ə b ə ɫ
deformable	d ɪ f ɔː m ə b ə ɫ
defoul	d ɪ f a ʊ ɫ
deglucosyl	d iː ɡ l uː k ə s ɪ ɫ
degradable	d ɪ ɡ ɹ e ɪ d ə b ə ɫ
dehydrocholesterol	d iː h a ɪ d ɹ ə k ə l ɛ s t ə ɹ ɒ ɫ
dehydroretinol	d iː h a ɪ d ɹ ə ɹ ɛ t ɪ n ɒ ɫ
deicidal	d e ɪ j ɪ s a ɪ d ə ɫ
delectable	d ɪ l ɛ k t ə b ə ɫ
delft	d ɛ ɫ f t
delphine	d ɛ ɫ f iː n
delphinium	d ɛ ɫ f ɪ n ɪ ə m
delta	d ɛ ɫ t ə
demicircle	d ɛ m ɪ s ɜː k ə ɫ
demographical	d ɛ m ə ɡ ɹ æ f ɪ k ə ɫ
demolition	d ɛ m ə l ɪ ʃ n̩
dendrological	d ɛ n d ɹ ə l ɒ d͡ʒ ɪ k ə ɫ
dendrophile	d ɛ n d ɹ ə f a ɪ ɫ
dependable	d ɪ p ɛ n d ə b ə ɫ
derivable	d ɪ ɹ a ɪ v ə b ə ɫ
derival	d ɪ ɹ a ɪ v ə ɫ
dermal	d ɜː m ə ɫ
dermatological	d ɜː m ə t ə l ɒ d͡ʒ ɪ k ə ɫ
dermoneural	d ɜː m ə n j ʊ ə ɹ ə ɫ
desirable	d ɪ z a ɪ j ə ɹ ə b ə ɫ
desktop	d ɛ s k t ɒ p
desktops	d ɛ s k t ɒ p s
despeckle	d iː s p ɛ k ə ɫ
diabolical	d a ɪ ə b ɒ l ɪ k ə ɫ
dial	d a ɪ ə ɫ
diasporan	d a ɪ æ s p ə ɹ n̩
diasporan	d ʌ ɪ a s p ə ɹ n̩
dibutyl	d a ɪ b j uː t a ɪ ɫ
dictatorial	d ɪ k t ə t ɔː ɹ ɪ ə ɫ
diddle	d ɪ d ɫ̩
didn't	d ɪ n ʔ
differential	d ɪ f ə ɹ ə n ʃ ə ɫ
diggety	d ɪ ɡ ə ɾ i
diisopropyl	d a ɪ a ɪ s ə ʊ p ɹ ə ʊ p a ɪ ɫ
dildo	d ɪ ɫ d ə ʊ
dimethylbenzene	d a ɪ m iː θ a ɪ ɫ b ɛ n z iː n
dingaling	d ɪ ŋ ə l ɪ ŋ
diphenol	d a ɪ f iː n ɒ ɫ
diphenyl	d a ɪ f iː n a ɪ ɫ
dirgeful	d ɜː d͡ʒ f ə ɫ
dirndl	d ɪ ə n d ə ɫ
disabled	d ɪ s e ɪ b ə ɫ d
disagreeable	d ɪ s ə ɡ ɹ i ə b ə ɫ
disapproval	d ɪ s ə p ɹ uː v ə ɫ
disavail	d ɪ s ə v e ɪ ɫ
disavowal	d ɪ s ə v a ʊ ə ɫ
disbursal	d ɪ s b ɜː s ə ɫ
disculpate	d ɪ s k ʊ ɫ p e ɪ t
disculpate	d ɪ s k ʌ ɫ p e ɪ t
disembowel	d ɪ s ɪ m b a ʊ ə ɫ
disentangle	d ɪ s ɪ n t æ ŋ ɡ ə ɫ
disentitle	d ɪ s ɪ n t a ɪ t ə ɫ
disfavourable	d ɪ s f e ɪ v ɹ ə b ə ɫ
disgraceful	d ɪ s ɡ ɹ e ɪ s f ə ɫ
disgraceful	d ɪ z ɡ ɹ e ɪ s f ə ɫ
disloyal	d ɪ s l ɔ ɪ j ə ɫ
dismantle	d ɪ s m æ n tʰ ə ɫ
dismissal	d ɪ s m ɪ s ə ɫ
dismissal	d ɪ z m ɪ s ə ɫ
dispel	d ɪ s p ɛ ɫ
dispellable	d ɪ s p ɛ l ə b ə ɫ
dispensable	d ɪ s pʰ ɛ n s ə b ɫ̩
disposal	d ɪ s p ə ʊ z ə ɫ
disproportional	d ɪ s p ɹ ə p ɔː ʃ ə n ə ɫ
disrespectful	d ɪ s ɹ ɪ s p ɛ k t f ə ɫ
dissemble	d ɪ s ɛ m b ɫ̩
dittander	d ɪ t æ n d ə
divinyl	d a ɪ v a ɪ n ɪ ɫ
divisible	d ɪ v ɪ z ɪ b ə ɫ
doesn't	d ʌ z n̩ t
dojo	d ə ʊ̯ d͡ʒ ə ʊ̯
dolphin	d ɒ l̥ f ɪ n
don't	d ə ʊ̯ n t̚
done	d ɐ n
done	d ʊ n
dope	d ə ʊ p
dower	d a ʊ ə ɹ
drag	d͡ɹ̝ ˗ʷ æˑ ɡ
dragging	d͡ʒ ɹ æ ɡ ɪ ŋ
drain	d ɹ e̞ ɪ̯ n
drain	d̥ ɹ ẽː n
dream	d̠͡ɹ̠ ˔ʷ ɪ i̯ m
dream	d͡ʒ ɹ iː m
dreaming	d͡ʒ ɹ iː m ɪ ŋ
dreams	d͡ʒ ɹ iː m z
dried	d͡ʒ ɹ a ɪ d
drill	d ɹ ɪ ɫ
drink	d̠ ɹ̠ ˔ʷ ɪ ŋ k
drive	d͡ʒ ɹ a ɪ v
drown	d̠͡ɹ̠ ˔ʷ a ʊ n
drug	d̠͡ɹ̠ ˔ʷ ʌ ɡ
drugs	d ɹ ʌ ɡ z
drugs	d͡ʒ ɹ ʌ ɡ z
dry	d̠͡ɹ̠ ˔ a ɪ̯
dry	d̠͡ɹ̠ ˔ʷ a ɪ̯
dry	d͡ʒ ɹ a ɪ̯
drying	d͡ʒ ɹ a ɪ ɪ ŋ
dually	d ʒ uː ə l i
dump	d ɐ m̥ p
eaten	iː t n̩
eaten	iː ʔ n̩
edible	ɛ d ɪ b ɫ̩
edition	ɪ d ɪ ʃ n̩
eh	ɛː
el	ɛ ɫ
embattle	ə m b æ ɾ ə l
emphasis	e ɱ f ə s ə s
emphasis	e ɱ f ə s ɪ s
emphasis	ɛ ɱ f ə s ə s
emphasis	ɛ ɱ f ə s ɪ s
emphasize	ɛ ɱ f ə s a ɪ z
enabled	ɛ n e ɪ b ə ɫ d
encephalic	ɛ n s ə f æ l ɪ k̚
encouragement	ɪ n k ʌ ɹ ɪ d͡ʒ m ə n t
enrichment	ɪ n ɹ ɪ t͡ʃ m n̩ t
ensign	ɛ n s n̩
ensnarl	ɛ n s n ɑ ɚ̯ ɫ
ensnarl	ɛ n s n ɑː ɫ
entangle	ɛ n t a ŋ ɡ l̩
epigraphy	ʔ ɨ pʰ ɪː ɡ ɹ ə f iː
epimutation	ɛ p ɪ m j u t e ɪ ʃ ə n
epitomic	e p iː t ɔ m ɪ k
epitomic	ɛ p ɪ t ɑ m ɪ k
epitomic	ɛ p ɪ t ɒ m ɪ k
era	ɪ ə̯ ɹ ə
errable	ɛ r ə b ɫ̩
essential	ə s ɛ n t ʃ ə l
eugh	ə x
eugh	ɜː
eugh	ʌ x
exam	ɪ ɡ z æ m
exchange	ɛ k s t͡ʃ e ɪ n d͡ʒ
exosome	ɛ k s o ʊ̯ s o ʊ̯ m
exosome	ɛ k s ə ʊ̯ s ə ʊ̯ m
fanaticism	f ə n æ ɾ ɪ s ɪ z m̩
farrand	f æ ɹ ə n d
farrand	f æ ɹ ə n t
fatal	f e ɪ ɾ ɫ̩
fatally	f e ɪ̯ ɾ l̩ i
fated	f e ɪ̯ ɾ ɨ d
fatten	f æ ʔ n̩
fauxtograph	f oː t ə ɡ ɹ ɑː f
fauxtography	f oː t ɒ ɡ ɹ ə f i
feasible	f iː z ə b ɫ̩
federale	f ɛ d ə ɹ ɑː l i
feel	f iː ɫ
fence	f ɛ n s
fence	f ɛ n t s
fencer	f ɛ n s ɚ
fentanyl	f ɛ ʔ n̩ n ɪ ɫ
feudal	f j uː d ɫ̩
feudalism	f j u d ə l ɪ z m̩
few	f j ʉː
few	f j ʉ͡u
fiddy	f ɪ ɾ i
file	f a ɪ̯ ə ɫ
fill	f ɪ ɫ
filling	f ɪ ɫ ɪ ŋ
film	f ɪ ɫ m
fire	f a ə
fire	f a ɪ̯ ə
fire	f aː
fire	f ɑ ə
fire	f ɑ əː
firstborn	f ɜː s t b ɔː n
firstborn	f ɝ s t b ɔ ɚ̯ n
fitra	f ɪ t ɾ a
fitra	f ɪ tˤ ɾ a
flag	f ɫ æ ɡ
flaithiúlach	f l æ h uː l ə x
flizz	f l ɪ z
flouted	f l a ʊ̯ ɾ ɨ d
flouting	f l a ʊ̯ ɾ ɪ ŋ
foal	f ɔ ʊ ɫ
fold	f ɒ ʊ ɫ d
fold	f ɔ ʊ ɫ d
fondling	f ɒ n d ɫ̩ ɪ ŋ
foot	f ɤ t
foot	f ɤ̈ t̚
foot	f ɯ̽ t̚
foot	f ɵ ʔ t
foot	f ʉ t
foot	f ʉ̞ ʔ t
foot	f ʊ t
foot	f ʊ tʰ
foot	f ʊ t̚
foot	fʷ ʊ t̚
football	f ʊ ʔ b ɔː l
football	f ʊ ʔ tʰ b ɔː l
football	f ʊ ʔ t̚ b ɔː l
foregaze	f ɔː ɡ ɛ ɪ z
foretell	f oː t e ɫ
foretell	f ɔ ɹ t ɛ ɫ
foretell	f ɔː t ɛ ɫ
foretellable	f oː t ɛ ɫ ə b l̩
forsythia	f ɔː s a j θ i j ə
foundation	f a ʊ̯ n d e ɪ̯ ʃ n̩
free	f ɹ ɪ i̯
french	f ɹ̠ ɛ n̠ t͡ʃ
friend	f ɹ̥ ɛ n d̥
frighten	f ɹ̥ a ɪ t n̩
frighten	f ɹ̥ a ɪ ʔ n̩
fro	f ɹ ə ʊ
fsck	f͡s̪ k
fsck	ɸ͡s k
fsck	ɸ͡s̪ k
fuck	f ʌ kʰ
fuel	f j u w ə ɫ
full	f ʊ ɫ
furcal	f ɜː k ə ɫ
furcal	f ɝ k ə ɫ
gasoline	ɡ æ s ɵ l i n
gaumy	ɡ ɔː m i
gel	d͡ʒ ɛ ɫ
genkan	ɡ ɛ ŋ k ɑ n
gilt	ɡ ɪ ɫ t
glass	ɡ l e ə s
glass	ɡ l æ s
glass	ɡ l ɑː s
glass	ɡ l ɛ ə s
glizzy	ɡ l ɪ z i
go	ɡ u
go	ɡ ɐ ʉ
go	ɡ ə ʉ
go	ɡ ə ʊ
goal	ɡ ɒ ʊ ɫ
gold	ɡ ɒ ʊ ɫ d
gold	ɡ ɔ ʊ ɫ d
golden	ɡ ɒ ʊ̯ ɫ d n̩
gonna	ɡ o ʊ ɪ n ə
gotta	ɡ ɒ ʔ ə
gowk	ɡ æ ʊ̯ˀ k
gramophone	ɡ ɹ æ m ə f ə ʊ n
grass	ɡ ɹ̠ a s
grass	ɡ ɹ̠ e ə s
grass	ɡ ɹ̠ ä s
grass	ɡ ɹ̠ äː s
grass	ɡ ɹ̠ æ s
grass	ɡ ɹ̠ ɐː s
grass	ɡ ɹ̠ ɑː s
grass	ɡ ɹ̠ ɛ ə s
grated	ɡ ɹ e ɪ̯ ɾ ɪ d
gratified	ɡ ɹ æː ɾ ɨ f a ɪː d̚
grating	ɡ ɹ e ɪ̯ ɾ ɪ ŋ
grivna	ɡ ɹ ɪ v n ɑ
grow	ɡ̊ ɹʷ ə ʊ̯
grows	ɡ ɹ ə ʊ̯ z
grr	ɡ ɚːː
guileless	ɡ a ɪ ɫ l ə s
guttural	ɡ ʌ ɾ ɚ ɫ̩
gyros	d͡ʒ a ɪ ɹ o ʊ z
h	æ ɪ t͡ʃ
ha	h aː
hadith	h ə d iː θ
hah	h aː
hail	h e ɪ̯ ɫ
hang	h e ɪ ŋ
hangnail	h e ɪ ŋ n e ɪ̯ ɫ
happening	h æ p n ɪ n
hat	h a t
health	h ɛ l̪ θ
heighten	h a ɪ̯ t n̩
heighten	h a ɪ̯ ʔ n̩
hero	h ɪ ə ɹ ə ʊ ~ ç ɪ ə ɹ ə ʊ
hexadecile	h ɛ k s ə d iː s a ɪ ɫ
hi	h a ɪ̯
hibernate	h ɑ ɪ b ə n ɛ ɪ t
hibernation	h a ɪ b əː n e ɪ ʃ n̩
high	h a ɪ̯
hill	h ɪ o̯
hill	h ɪ ɫ
hill	h ɪ ʊ̯
hiller	h ɪ l ə ɹ
him	ɪ̈ m
hitherto	h ɪ ð ə tʰ uː
hmm	m̥ m̩ ˦˨
hmmm	m̥ m̩ː ˦˨
hold	h ə ʊ ɫ d
holding	h o ʊ ɫ d ɪ ŋ
holding	h ə ʉ ɫ d ɪ ŋ
holding	h ə ʊ ɫ d ɪ ŋ
hole	h ɔ ʊ ɫ
holey	h ɒ ʊ l i
holey	h ɒ ʊ ɫ l i
holier	h ɒ ʊ l i ə
holier	h ɒ ʊ ɫ l i ə
holiest	h ɒ ʊ l i ɪ s t
holiest	h ɒ ʊ ɫ l i ɪ s t
homophobe	h ɒ m ə f ə ʊ b
homophobe	h ə ʊ m ə f ə ʊ b
hood	h ɪ̈ d
hood	h ʊ̈ d
hordesman	h ɔː d z m n̩
housemother	h a ʊ s m ɐ ð ə ɹ
hubris	ç j u̟ː b ɹ̠ʷ ɪ s
hue	ç j u̟ː
huge	ç u̟ː d͡ʒ
hugeness	ç u̟ː d͡ʒ n ɨ s
huh	h ʌ̃
human	ç j u̟ m n̩
human	ç j u̟ m ə n
humanist	h ç uː m ə n ɪ s t
humanist	ç uː m ə n ɪ s t
humongous	ç u̟ː m ɐ ŋ ɡ ə s
humongous	ç u̟ː m ʊ ŋ ɡ ə s
hump	h ɐ m̥ p
humph	h ə ɱ f
humph	h ɱ̩ f
humph	ɱ̊ ɱ̩ f
hyperhidrosis	h a ɪ p ə ɹ h a ɪ d ɹ o ʊ s ɪ s
hypotenuse	h a ɪ p ɒ ʔ n̩ j uː z
háček	h a t͡ʃ ɛ k
háček	h aː t͡ʃ e k
háček	h aː t͡ʃ ɛ k
háček	h æ t͡ʃ ɛ k
háček	h ɐː t͡ʃ e k
háček	h ɑ t͡ʃ ɛ k
háček	h ɑ ə t͡ʃ ɛ k
háček	h ɑː t͡ʃ ɛ k
háček	ɦ ɑː t͡ʃ ɛ k
iced	a ɪ̯ s t
idol	a ɪ d l̩
imba	ɪ m b ɐ
imperialism	ɪ m p ɪ ə ɹ i ə l ɪ z m̩
important	ɪ m pʰ ɔː t ə n t̚
important	ɪ m pʰ ɔː ʔ n̩ ʔ
importantly	ɪ m pʰ ɔː t ə n t̚ l i
importantly	ɪ m pʰ ɔː ʔ n̩ ʔ l i
inamorata	ɪ n æ m ɒ ɹ ɑː t ə
incalculable	ɪ n kʰ æ ɫ k j ə l ə b l̩
incidental	ɪ n s ɪ d ɛ n tʰ ə l
incidental	ɪ n s ɪ d ɛ ɾ̃ ə l
indical	ɪ n d ɪ k l̩
inexorably	ɪ n ɛ ɡ z ə ɹ ə b l i
inference	ɪ ɱ f ə ɹ ə n s
inference	ɪ ɱ f ɹ ə n s
inferrible	ɪ n f ə ɹ ɪ b l̩
inhalation	ɪ n ɦ ə l e ɪ ʃ n̩
input	ɪ m p ʊ t
input	ɪ n p ʊ t
insensible	ɪ n s ɛ n̥ s ɪ b l̩
insolvency	ɪ n s ɒ l v n̩ s i
installation	ɪ n s t ə l e ɪ ʃ ə n
intangible	ɪ n t æ n d͡ʒ ɪ b l̩
intentional	ɪ n tʰ ɛ n ʃ n̩ ɫ̩
international	ɪ n t ə n æ ʃ ə n ə ɫ
interpretable	ɪ n t ɜː p ɹ ɪ t ə b l̩
investigate	ɪ n v ɛ s t ɪ ɡ e ɪ̯ t
isn't	ɪ z n̩ t
it	ɪ t
it	ɪ̈ t
iteration	ɪ t ə ɹ e ɪ ʃ n̩
ith	a ɪ̯ θ
jar	d͡ʒ ɑː ɹ
jarring	d͡ʒ aː r ɪ ŋ
jarring	d͡ʒ ɑː r ɪ ŋ
joged	d͡ʒ o ɡ ə d
joget	d͡ʒ o ɡ ɛ t
jokingly	d ʒ ə ʊ k ɪ ŋ l ɪ
judgemental	d͡ʒ ʌ d͡ʒ m ɛ n t l̩
jump	d͡ʒ ɐ m̥ p
kamp	kʰ e ə m p
kamp	kʰ ɛ ə m p
kana	kʰ ɑː n ə
karma	k ɑː m ə
keep	kʰ i p̚
keloid	k iː l ɔ ɪ d
kept	kʰ ɛ p t̚
kettle	kʰ ɛ tᵊ ɫ̩
kiasu	k j ã ˨ s u
kick	kʰ ɪ k
kiddie	kʰ ɘ ɾ iː
kiddie	kʰ ɪ ɾ i
kill	kʰ ɪ o̯
kill	kʰ ɪ ɫ
kill	kʰ ɪ ʊ̯
killer	kʰ ɪ l ə ɹ
kiss	kʰ ɪ s
kissper	kʰ ɪ s p ə
kitty	kʰ ɘ ɾ iː
kitty	kʰ ɪ ɾ i
kratom	k ɹ e ɪ̯ t ə m
kumara	kʰ ʉː m ɐ ɾ ɐ
kumara	kʰ ʉː m ə ɹʷ ɐ
l	l
l	w
l	ɫ
lady	l e ɪ ɾ i
lah	l ä ˨
lamb	l e ə m
lander	l æ n d ə
language	l e ɪ ŋ ɡ w ɪ d͡ʒ
languages	l e ɪ ŋ ɡ w ɪ d͡ʒ ɪ z
lastborn	l æ s t b ɔ ɚ̯ n
lastborn	l ɑː s t b ɔː n
learner	l ɝ n ɚ
leaven	l ɛ v n̩
leeway	l iː w e ɪ
lesson	l ɛ s n̩
li'l	l ɪ ɫ
li'l	l ɪ ɫ̩
liable	l a ɪ̯ ə b ə ɫ
liable	l a ɪ̯ ə b ɫ̩
liably	l a ɪ̯ ə b l i
libre	l i b ʁ
licensed	l a ɪ s n̩ s t
lighten	l a ɪ t n̩
