'll	l̩
strength	s t̠͡ɹ̠ ɪ ŋ k θ
strident	s t ɹ a ɪ dˀ n t
stripboard	s t ɹ ɪʰ b ɔ ə d
stripboard	s t ɹ ɪʰ b ɔː d
strong	s t̠͡ɹ̠ ɒ ŋ
strong	ʃ t̠͡ɹ̠ ɒ ŋ
structure	s t ɹ ɐ k t ʃ ə ɹ
struggle	s t ɹ ʌ ɡ l̩
strut	s t ɹ ɐ t
subhuman	s ʌ b h j uː m ə n
substituent	s ʌ b s t ɪ t ʃ u ə n t
subtle	s ʌ ɾ ɫ̩
subway	s ʌ b w e ɪ̯
sudden	s ʌ d n̩
suggestion	s ə d͡ʒ ɛ ʃ t ʃ ə n
support	s ə pʰ ɔː t
suppose	s p ə ʊ z
suppose	s ə pʰ ə ʊ z
syllable	s ɪ l ə b ɫ
symbology	s ɪ m b ɒ l ə d ʒ i
symphony	s ɪ m p f ə n i
symphony	s ɪ ɱ f ə n i
syndical	s ɪ n d ɪ k l̩
syntagms	s ɪ n t æ m z
t'	t̚
t'	ʔ
t'	ː
tab	tʰ æ b̥
tackle	tʰ æ k ɫ̩
take	tʰ e ɪ̯ k
talib	tʰ æ l ɪ b
talked	tʰ ɔː k t
tallit	tʰ ä l i t
tallit	tʰ ɑ ɫ ɪ s
tampon	tʰ æ m p ɒ n
tap	tʰ æ p
tape	tʰ e ɪ̯ p
tapestry	t æ p ə s t͡ʃ ɹ i
taring	t ɛ ə ɹ ɪ ŋ
tarter	t ɑ ɹ ɾ ɚ
tarter	t ɑː t ə ɹ
tattoo	tʰ æ tʰ u̟ː
tea	tʰ iː
teal	t iː ɫ
teared	t i ɚ̯ d
teared	t ɛ ɚ̯ d
teared	t ɛː d
teared	t ɪː d
tearing	t ɛ ə ɹ ɪ ŋ
tearing	t ɪ ə ɹ ɪ ŋ
tech	tʰ ɛ k
tej	t ɛ d͡ʒ
telangana	t̪ ɛ l ə ŋ ɡ ɑː n ə
ten	tʰ ɛ n
tenth	tʰ ɛ n̪ θ
thagomizer	θ æ ɡ ə m a ɪ z ə
thank	θ a ŋ k
theosophy	θ ɪ ɒ s ə f ɪ
theriac	θ ɛ ɹ i ɑ k
theriac	θ ɛ ɹ i ə k
thickie	θ ɪ k i
thousand	θ a ʊ z n̩ d
thread	θ ɾ̪̊ ɛ d
three	θ ɾ̪̊ iː
three	θ ɾ̪̊ ɪ i
thrice	θ ɾ̪̊ ä ɪ s
thrice	θ ɾ̪̊ ɑ ɪ s
thrill	t̪ ɾ̪̊ ɪ l
thrill	θ ɾ̪̊ ɪ l
thrill	θ ɾ̪̊ ɪ ɫ
throne	θ ɹ ə ʊ n
through	θ ɾ̪̊ ɵ ʉ
throughout	θ ɹ uːʷ a ʊ t
throw	θ ɾ̪̊ ə ʊ
timber	t ɪˑ m b əː
time	tʰ a ɪ m
tin	tʰ ɪ n
tiptoe	tʰ ɪ p tʰ ə ʊ̯
titty	tʰ ɪ ɾ i
to	tʰ u̟ː
tomato	tʰ ə̥ m e ɪ ɾ o ʊ
tomato	tʰ ə̥ m e ɪ ɾ ə
tomato	tʰ ə̥ m ɐː tʰ ɐ ʉ
tomato	tʰ ə̥ m ɑ ɾ o ʊ
tomato	tʰ ə̥ m ɑː tʰ ə ʊ
too	tʰ u̟ː
top	tʰ ɒˀ p
toronto	tʰ ə ɹ ɒ n tʰ o ʊ
toronto	tʰ ə ɹ ɒ ɾ̃ o ʊ
toronto	tʰ ə ɹ ɒ ɾ̃ ə
towards	tʰ ə̥ w ɔː d z
town	tʰ a ʊ̯ n
trace	t ʃ ɹ e ɪ s
tracer	t ʃ ɹ e ɪ s ə ɹ
traditionally	t ɹ ə d ɪ ʃ n̩ l i
traditionally	t ɹ ɪ d ɪ ʃ n̩ l i
train	t ɹ e ɪ n
train	t̠ ɹ̠ ̝ʷ e ɪ n
trainee	t ʃ ɹ e ɪ n i
trainees	t ʃ ɹ e ɪ n i z
transcaucasia	t ɹ æ n s k ɔː k e ɪ z j ə
transcaucasia	t ɹ æ n s k ɔː k e ɪ ʒ ə
trap	t ɹ̥ æ p
trap	t ʃ ɹ̥ æ p
trap	t̠ ɹ̝̊ ä p
tree	t̠ ɹ̠̊ ˔ʷ ɪ i̯
trick	t̠ʰ ɹ̠̊ ɪ k
trig	t̠ʰ ɹ̠̊ ɪ ɡ
trill	t̠ʰ ɹ̠̊ ɪ l
trim	t̠ʰ ɹ̠̊ ɪ m
trinal	t ɹ ʌ ɪ n̩ l
trip	t̠ʰ ɹ̠̊ ɪ p
trope	t ɹ̥ ə ʊ p
trust	t ɹ ɐ s t
trust	t ɹ ʌ s t
tsk	ǀ
tucker	tʰ ʌ k ə
turning	t ɜː n ɪ ŋ
turning	t ɝ n ɪ ŋ
tut	ǀ
twain	tʰ w̥ e ɪ n
twat	tʰ w̥ æ t
twelfth	tʰ w̥ ɛ l f θ
twelfth	tʰ w̥ ɛ lʷ f
twelfth	tʰ w̥ ɛ l̪ θ
twelve	t w̥ ɛ ɫ v
twentieth	t w̥ ɛ ɾ̃ i ə θ
twenty	t w̥ ɛ̃ n t i
twerk	t w̥ ɜː k
twice	t w̥ a ɪ s
twin	t w̥ ɪ n
twink	tʰ w̥ ɪ ŋ k
twist	t w̥ ɪ s t
twit	tʰ w̥ ɪ t
twitch	tʰ w̥ ɪ t͡ʃ
two	tʰ u̟ː
twos	tʰ u̟ː z
typewriter	t a ɪ p ɹ a ɪ t ə ɹ
ugh	ɯ x
ugh	ɯ χ
ugh	ʊ
ugh	ʊ k
ugh	ʊ x
ugh	ʊ χ
ugh	ʌ k
ugh	ʌ x
ugh	ʌ ɡ
ugh	ʌ χ
ugh	ʌ᷈
unacceptable	ɐ n æ k s ɛ p tʰ ə b ɫ̩
unacceptable	ɐ n ə k s ɛ p tʰ ə b ɫ̩
uncle	ɐ ŋ k ə ɫ
uncle	ɐ ŋ k ɫ̩
under	ɐ n d ə ɹ
unfair	ɐ n f ɛ ə ɹ
unfair	ɐ n f ɛː ɹ
unilateral	j ʉː n ə ɫ æ ɾ ɚ ɻ ɫ̩
unilateral	j ʉː n ɪ l æ t ə ɹ ɫ̩
unilateral	j ʉː n ɪ l æ t͡ʃ ɹ ɫ̩
unisex	j uː n ɪ s ɛ k s
unnerstand	ɜ ɽ̃ ɻ s t æ n d̚
untac	j u ɛ n t ɪ ɛ j s iː
untaet	j u ɛ n t i ɛ j ɪ t iː
up	ɐ ʔ p
usher	ʌ ʃ ə ɹ
utter	ɐ t ə
vajazzle	v ə d ʒ æ z l̩
vale	v e ɪ ɫ
verbal	v ɜː b ɫ̩
versatile	v ɜː s ə t a ɪ ɫ
veteran	v ɛ t̬ ə ɹ ə n
veteran	v ɛ ɾ ə ɹ ə n
veto	v iː tʰ o ʊ
veto	v iː ɾ o ʊ
vicissitude	v a ɪ s ɪ s ɨ t j uː d
vicissitude	v ɨ s ɪ s ɨ t j uː d
vicissity	v a ɪ s ɪ s ɨ t i
vicissity	v ɪ s ɪ s ɨ t i
vindical	v ɪ n d ɪ k l̩
virtually	v ɝ t͡ʃ u ə ɫ i
vlach	v l æ k
vlach	v l ɑː k
vocab	v o ʊ k æ b
vocab	v ə ʉ k æ b
vocab	v ə ʊ k æ b
wail	w e ɪ ɫ
waistband	w e ɪ s t b æ n d
waiting	w e ɪ̯ ɾ ɪ ŋ
wale	w e ɪ ɫ
wales	w e ɪ ɫ z
wanted	w ɒ n tʰ ɪ d
wasn't	w ɒ n ʔ
wasn't	w ɒ z n̩ ʔ
wealth	w ɛ l̪ θ
wean	w eː n
weeaboos	w iː a b yː z
welp	w ɛ l p̚
westside	w ɛ s s a ɪ d
westside	w ɛ s t s a ɪ d
whew	ɸ ĭ̥ ŭ̥
whew	ʍ ĭ̥ ŭ̥
whole	h ɒ ʊ ɫ
whole	h ə ʊ ɫ
wholemeal	h ɔ ʊ ɫ m i ə ɫ
wholly	h ɒ ʊ̯ ɫ l ɪ
wholly	h ə ʊ l ɪ
width	w ɪ d̪ θ
wieldy	w ɪ ə l d ɪ
wilde	w a ɪ ə̯ ɫ d
will	w ɪ ɫ
winter	w ɪ n tʰ ɚ
winter	w ɪ ɾ̃ ɚ
wisconsin	w ə s k ɑ n s n̩
wisconsin	w ə s kʰ ɑ n s n̩
wouldn't	w ʊ dⁿ n̩ t
wouldn't	w ʊ n ʔ
wouldn't	w ʊ ɾ ə n t
wrake	ɹ e ɪ̯ kʰ
writer	ɹ̠ a ɪ tʰ ə
www	d ʌ ɥ ʊ̆ d ʌ ɥ ʊ̆ d ʌ bˡ j u
xxx	ʔ ɛ k s ʔ ɛ k s ʔ ɛ k s
yatt	j a t
yatt	j æ t
yep	j ɛ p̚
yive	j ɪ v
yolngu	j oː l ŋ ʊ
yum	j ʌ m
zarina	z ʌ ɹʲ i n ə
zemfira	z ɛ ɱ f i ɹ ə
zemfira	z ɪ ɱ f i ɹ ə
ziti	z i ɾ i
zooplasty	z ə ʊ ə p l æ s t i
zun	z ʌ n
übermensch	ʔ yː b ɐ m ɛ n ʃ
