'ad	ɑ t̪ˠ
paráiste	pˠ ə ɾˠ ɑː ʃ tʲ ə
paráiste	pˠ ʊ ɾˠ ɑː ʃ tʲ ə
paráiste	pˠ ɾˠ ɑː ʃ tʲ ə
paráistí	pˠ ə ɾˠ ɑː ʃ tʲ iː
paráistí	pˠ ʊ ɾˠ ɑː ʃ tʲ iː
paráistí	pˠ ɾˠ ɑː ʃ tʲ iː
páras	pˠ ɑː ɾˠ ə sˠ
páras	pˠ æː ɾˠ ə sˠ
pardún	pˠ ɑː ɾˠ d̪ˠ uː n̪ˠ
pardún	pˠ ɑː ɾˠ d̪ˠ uː nˠ
pardún	pˠ aː ɾˠ d̪ˠ u nˠ
pártaí	pˠ ɑː ɾˠ t̪ˠ iː
parthalán	pˠ ɑ ɾˠ h ə l̪ˠ ɑː n̪ˠ
parthalán	pˠ ɑ ɾˠ h ə lˠ ɑː nˠ
parthalán	pˠ aː ɾˠ h lˠ a nˠ
parthas	pˠ aː r h u s
pasam	pˠ a sˠ ə mˠ
pasfhocal	pˠ a sˠ ɔ k ə lˠ
pasta	pˠ a sˠ t̪ˠ ə
pastae	pˠ a sˠ t̪ˠ eː
patrún	pˠ ɑ t̪ˠ ɾˠ uː nˠ
pé	pʲ eː
peaca	pʲ a k ə
peaca	pʲ a k u
peacadh	pʲ a k u
peacaí	pʲ a k iː
peacaí	pʲ a k iː
peacaí	pʲ a k i
péacóg	pʲ eː k oː ɡ
péacógach	pʲ eː k oː ɡ ə x
péacógach	pʲ eː k oː ɡ ə x
péacógach	pʲ eː k ɔ ɡ a x
peadar	pʲ a d̪ˠ ə ɾˠ
peall	pʲ a u l̪ˠ
peall	pʲ ɑː l̪ˠ
peall	pʲ a l̪ˠ
peann	pʲ a u n̪ˠ
peann	pʲ ɑː n̪ˠ
peann	pʲ a n̪ˠ
peanna	pʲ aː n̪ˠ ə
pearsa	pʲ a ɾˠ sˠ ə
pearsana	pʲ a ɾˠ sˠ ə nˠ ə
péas	pʲ eː sˠ
peata	pʲ a t̪ˠ ə
peata	pʲ æː t̪ˠ ə
péatar	pʲ eː t̪ˠ ə ɾˠ
peil	pʲ ɛ lʲ
peile	pʲ ɛ lʲ ə
peileadóir	pʲ ɛ lʲ ə d̪ˠ oː ɾʲ
peileadóir	pʲ ɛ lʲ ə d̪ˠ oː ɾʲ
peileadóir	pʲ ɛ lʲ ə d̪ˠ ɔ ɾʲ
péin	pʲ eː nʲ
péine	pʲ eː nʲ ə
péinis	pʲ eː nʲ ə ʃ
péint	pʲ eː nʲ tʲ
péinteáil	pʲ eː nʲ tʲ aː lʲ
péinteáil	pʲ eː n̠ʲ tʲ ɑː lʲ
péinteáil	pʲ eː n̠ʲ tʲ æ lʲ
péinteáilte	pʲ eː nʲ tʲ ɑː l̠ʲ tʲ ə
péire	pʲ eː ɾʲ ə
peirs	pʲ ɛ ɾʲ ʃ
peirsil	pʲ ɛ ɾʲ ʃ ə lʲ
peirsis	pʲ ɛ ɾʲ ʃ ɪ ʃ
peitreal	pʲ ɛ tʲ ɾʲ ə lˠ
péitseog	pʲ eː tʲ ʃ oː ɡ
péitseog	pʲ eː tʲ ʃ oː ɡ
péitseog	pʲ eː tʲ ʃ a ɡ
phá	fˠ ɑː
phá	fˠ æː
pháirc	fˠ aː ɾʲ c
pháirt	fˠ ɑː ɾˠ tʲ
phálás	fˠ ɑː l̪ˠ ɑː sˠ
phálás	fˠ ɑː lˠ ɑː sˠ
phálás	fˠ æ lˠ æ sˠ
pháras	fˠ ɑː ɾˠ ə sˠ
pháras	fˠ æː ɾˠ ə sˠ
phasta	fˠ a sˠ t̪ˠ ə
pheacaí	fʲ a k iː
pheacaí	fʲ a k iː
pheacaí	fʲ a k i
pheadair	fʲ a d̪ˠ ə ɾʲ
pheadar	fʲ a d̪ˠ ə ɾˠ
pheann	fʲ a u n̪ˠ
pheann	fʲ ɑː n̪ˠ
pheann	fʲ a n̪ˠ
phearsa	fʲ a ɾˠ sˠ ə
phearsana	fʲ a ɾˠ sˠ ə nˠ ə
phian	fʲ i ə nˠ
phianadh	fʲ i ə nˠ ə
phianadh	fʲ i ə nˠ uː
phianadh	fʲ i ə nˠ u
phianadh	fʲ i ə nˠ ə x
phianadh	fʲ i ə nˠ ə tʲ
phianadh	fʲ i ə nˠ ə x
phianadh	fʲ i ə nˠ ə tʲ
phianadh	fʲ i ə nˠ uː
phianadh	fʲ i ə nˠ ə tʲ
phianadh	fʲ i ə nˠ u
phianfadh	fʲ i ə nˠ h ə x
phianfadh	fʲ i ə nˠ h ə tʲ
phianfadh	fʲ i ə nˠ h ə x
phianfadh	fʲ i ə nˠ h ə tʲ
phianfadh	fʲ i ə nˠ h uː
phianfadh	fʲ i ə nˠ h ə tʲ
phianfadh	fʲ i ə nˠ h u
philéir	fʲ ə lʲ eː ɾʲ
philéir	fʲ lʲ eː ɾʲ
philéir	fʲ ɪ lʲ eː ɾʲ
philéir	fʲ ɪ lʲ e ɾʲ
phinc	fʲ ɪ ɲ c
phioc	fʲ ʊ k
phiocadh	fʲ ʊ k ə
phiocadh	fʲ ʊ k uː
phiocadh	fʲ ɪ k u
phiocadh	fʲ ʊ k ə x
phiocadh	fʲ ʊ k ə tʲ
phiocadh	fʲ ʊ k ə x
phiocadh	fʲ ʊ k ə tʲ
phiocadh	fʲ ʊ k uː
phiocadh	fʲ ɪ k ə tʲ
phiocadh	fʲ ɪ k u
phis	fʲ ɪ ʃ
phlainc	fˠ lˠ a ɲ c
phléisiúr	fʲ lʲ eː ʃ uː ɾˠ
phléisiúr	fʲ lʲ eː ʃ uː ɾˠ
phléisiúr	fʲ lʲ eː ʃ u ɾˠ
phlúr	fˠ lˠ uː ɾˠ
phóca	pˠ oː k ə
phóca	pˠ ɔː k ə
pholainn	fˠ ɔ l̪ˠ ɪ ɲ
pholainn	fˠ ɔ lˠ ə n̠ʲ
pholainn	fˠ ʌ lˠ ə n̠ʲ
pholl	fˠ ə u l̪ˠ
phonc	fˠ ʊ ŋ k
phósadh	fˠ oː sˠ ə
phósadh	fˠ oː sˠ uː
phósadh	fˠ ɔː sˠ u
phósadh	fˠ oː sˠ ə x
phósadh	fˠ oː sˠ ə tʲ
phósadh	fˠ oː sˠ ə x
phósadh	fˠ oː sˠ ə tʲ
phósadh	fˠ oː sˠ uː
phósadh	fˠ ɔː sˠ ə tʲ
phósadh	fˠ ɔː sˠ u
phósfadh	fˠ oː sˠ ə x
phósfadh	fˠ oː sˠ ə tʲ
phósfadh	fˠ oː sˠ ə x
phósfadh	fˠ oː sˠ ə tʲ
phósfadh	fˠ oː sˠ uː
phósfadh	fˠ ɔː sˠ ə tʲ
phósfadh	fˠ ɔː sˠ u
phota	fˠ ɔ t̪ˠ ə
phrioc	fʲ ɾʲ ʊ k
phuca	fˠ ʊ k ə
pian	pʲ i ə nˠ
piana	pʲ i ə nˠ ə
pianadh	pʲ i ə nˠ ə
pianadh	pʲ i ə nˠ uː
pianadh	pʲ i ə nˠ u
pianadh	pʲ i ə nˠ ə ɡ
pianadh	pʲ i ə nˠ ə vˠ
pianadh	pʲ i ə nˠ uː
pianadh	pʲ i ə nˠ u
pianadh	pʲ i ə nˠ ə x
pianadh	pʲ i ə nˠ ə tʲ
pianadh	pʲ i ə nˠ ə x
pianadh	pʲ i ə nˠ ə tʲ
pianadh	pʲ i ə nˠ uː
pianadh	pʲ i ə nˠ ə tʲ
pianadh	pʲ i ə nˠ u
pianann	pʲ i ə nˠ ə n̪ˠ
pianfaidh	pʲ i ə n h ə
pianfaidh	pʲ i ə n h ɪ ɟ
pianfaidh	pʲ i ə n h ə
pianfaidh	pʲ i ə n h iː
pianfaidh	pʲ i ə n h i
pianó	pʲ i a nˠ oː
píb	pʲ iː bʲ
píbe	pʲ iː bʲ ə
pice	pʲ ɪ c ɪ
píce	pʲ iː c ɪ
pící	pʲ iː c iː
pící	pʲ iː c iː
pící	pʲ iː c i
pictiúr	pʲ ɪ c tʲ uː ɾˠ
pictiúr	pʲ ɪ c tʲ uː ɾˠ
pictiúr	pʲ ɪ c tʲ u ɾˠ
piléar	pʲ ə lʲ eː ɾˠ
piléar	pʲ lʲ eː ɾˠ
piléar	pʲ ɪ lʲ eː ɾˠ
piléar	pʲ ɪ lʲ a ɾˠ
piléir	pʲ ə lʲ eː ɾʲ
piléir	pʲ lʲ eː ɾʲ
piléir	pʲ ɪ lʲ eː ɾʲ
piléir	pʲ ɪ lʲ e ɾʲ
piliúr	pʲ ɛ lʲ uː ɾˠ
pinc	pʲ ɪ ɲ c
pince	pʲ ɪ ɲ c ɪ
pingin	pʲ ɪ ɲ ə nʲ
pingin	pʲ ɪ ɲ ə nʲ
pingin	pʲ ɪ ɲ ɟ ə nʲ
pingin	pʲ iː n̠ʲ
pingine	pʲ ɪ ɲ ə nʲ ə
pingine	pʲ ɪ ɲ ə nʲ ə
pingine	pʲ ɪ ɲ ɟ ə nʲ ə
pingine	pʲ iː n̠ʲ ə
pingineacha	pʲ iː n̠ʲ ə x iː
pinginí	pʲ ɪ ɲ ə nʲ iː
pinginí	pʲ ɪ ɲ ə nʲ iː
pinginí	pʲ ɪ ɲ ɟ ə nʲ iː
pinginí	pʲ iː n̠ʲ iː
pinn	pʲ ə i ɲ
pinn	pʲ ə i nʲ
pinn	pʲ iː n̠ʲ
pinn	pʲ ɪ n̠ʲ
pínn	pʲ iː n̠ʲ
píob	pʲ iː bˠ
píoba	pʲ iː bˠ ə
píobaire	pʲ iː bˠ ə ɾʲ ə
pioc	pʲ ʊ k
piocadh	pʲ ʊ k ə
piocadh	pʲ ʊ k uː
piocadh	pʲ ɪ k u
piocadh	pʲ ʊ k ə ɡ
piocadh	pʲ ʊ k ə vˠ
piocadh	pʲ ʊ k uː
piocadh	pʲ ɪ k u
piocadh	pʲ ʊ k ə x
piocadh	pʲ ʊ k ə tʲ
piocadh	pʲ ʊ k ə x
piocadh	pʲ ʊ k ə tʲ
piocadh	pʲ ʊ k uː
piocadh	pʲ ɪ k ə tʲ
piocadh	pʲ ɪ k u
pionós	pʲ ɨ̞ n u s
pionta	pʲ ɪ n̪ˠ t̪ˠ ə
píopa	pʲ iː pˠ ə
píosa	pʲ iː sˠ ə
píotsa	pʲ iː t̪ˠ sˠ ə
pis	pʲ ɪ ʃ
pite	pʲ ɪ tʲ ə
plaic	pˠ lˠ a c
plaice	pˠ lˠ a c ɪ
plainc	pˠ lˠ a ɲ c
pláinéad	pˠ l̪ˠ ɑː nʲ eː d̪ˠ
pláinéad	pˠ l̪ˠ ɑː nʲ eː d̪ˠ
pláinéad	pˠ l̪ˠ æː nʲ e d̪ˠ
plaisteach	pˠ lˠ a ʃ tʲ ə x
plána	pˠ l̪ˠ ɑː n̪ˠ ə
plána	pˠ lˠ ɑː nˠ ə
plána	pˠ lˠ æː nˠ ə
plás	pˠ lˠ ɑː sˠ
plás	pˠ lˠ æː sˠ
pláta	pˠ lˠ ɑː t̪ˠ ə
pláta	pˠ lˠ æː t̪ˠ ə
plé	pʲ lʲ eː
plean	pʲ lʲ a nˠ
pléigh	pʲ lʲ eː ɟ
pléigh	pʲ lʲ eː
pléisiúr	pʲ lʲ eː ʃ uː ɾˠ
pléisiúr	pʲ lʲ eː ʃ uː ɾˠ
pléisiúr	pʲ lʲ eː ʃ u ɾˠ
plimp	pʲ lʲ ɪ mʲ pʲ
plódaithe	pˠ lˠ oː d̪ˠ ɪ h ə
plódaithe	pˠ lˠ oː d̪ˠ iː
plódaithe	pˠ lˠ ɔː d̪ˠ ɪ h ə
plúch	pˠ lˠ uː x
pluid	pˠ lˠ ɪ dʲ
plúir	pˠ lˠ uː ɾʲ
pluma	pˠ lˠ ʊ mˠ ə
plump	pˠ l̪ˠ ʊ mˠ pˠ
plúr	pˠ lˠ uː ɾˠ
plúra'	pˠ lˠ uː ɾˠ ə
pobail	pˠ ɔ bˠ ə lʲ
pobail	pˠ ʌ bˠ ə lʲ
pobal	pˠ ɔ bˠ ə lˠ
pobal	pˠ ʌ bˠ ə lˠ
pobalscoil	pˠ ɔ bˠ ə lˠ sˠ k ɛ lʲ
póca	pˠ oː k ə
póca	pˠ ɔː k ə
póg	pˠ oː ɡ
póg	pˠ ɔː ɡ
pógadh	pˠ oː ɡ ə
pógadh	pˠ oː ɡ uː
pógadh	pˠ ɔː ɡ u
pógadh	pˠ oː ɡ ə ɡ
pógadh	pˠ oː ɡ ə vˠ
pógadh	pˠ oː ɡ uː
pógadh	pˠ ɔː ɡ u
pógadh	pˠ oː ɡ ə x
pógadh	pˠ oː ɡ ə tʲ
pógadh	pˠ oː ɡ ə x
pógadh	pˠ oː ɡ ə tʲ
pógadh	pˠ oː ɡ uː
pógadh	pˠ ɔː ɡ ə tʲ
pógadh	pˠ ɔː ɡ u
pógtha	pˠ oː k ə
pógtha	pˠ ɔː k ə
poiblí	pˠ ɔ bˠ l̪ˠ iː
poiblí	pˠ ə i bʲ lʲ iː
poiblí	pˠ ə i bʲ lʲ iː
poiblí	pˠ ʌ bʲ lʲ i
poill	pˠ ə i l̠ʲ
pointe	pˠ iː n̠ʲ tʲ ə
pointe	pˠ ɪ n̠ʲ tʲ ə
pointeáilte	pˠ iː n̠ʲ tʲ ɑː l̠ʲ tʲ ə
póirse	pˠ oː ɾˠ ʃ ə
póirse	pˠ ɔː ɾˠ ʃ ə
pól	pˠ oː lˠ
pól	pˠ ɔː lˠ
polainn	pˠ ɔ l̪ˠ ɪ ɲ
polainn	pˠ ɔ lˠ ə n̠ʲ
polainn	pˠ ʌ lˠ ə n̠ʲ
polainnis	pˠ ɔ l̪ˠ ə n̠ʲ ɪ ʃ
polaitíocht	pˠ ɔ lˠ ə tʲ i ə x t̪ˠ
poll	pˠ ə u l̪ˠ
poll	pˠ ʌ l̪ˠ
polláire	pˠ ɔː lˠ ɑː ɾʲ ə
ponc	pˠ ʊ ŋ k
poncán	pˠ ə ŋ k ɑː n̪ˠ
poncán	pˠ ɔ ŋ k ɑː nˠ
poncán	pˠ ʊ ŋ k ɑː nˠ
poncán	pˠ ʌ ŋ k æ nˠ
pór	pˠ oː ɾˠ
pór	pˠ ɔː ɾˠ
portach	pˠ ə ɾˠ t̪ˠ a x
portach	pˠ ɔ ɾˠ t̪ˠ ə x
portach	pˠ ʌ ɾˠ t̪ˠ a x
pós	pˠ oː sˠ
pós	pˠ ɔː sˠ
pósad	pˠ oː sˠ ə d̪ˠ
pósadh	pˠ oː sˠ ə
pósadh	pˠ oː sˠ uː
pósadh	pˠ ɔː sˠ u
pósadh	pˠ oː sˠ ə ɡ
pósadh	pˠ oː sˠ ə vˠ
pósadh	pˠ oː sˠ uː
pósadh	pˠ ɔː sˠ u
pósadh	pˠ oː sˠ ə x
pósadh	pˠ oː sˠ ə tʲ
pósadh	pˠ oː sˠ ə x
pósadh	pˠ oː sˠ ə tʲ
pósadh	pˠ oː sˠ uː
pósadh	pˠ ɔː sˠ ə tʲ
pósadh	pˠ ɔː sˠ u
pósaid	pˠ oː sˠ ə dʲ
pósfad	pˠ oː sˠ ə d̪ˠ
pósfadsa	pˠ oː sˠ ə d̪ˠ sˠ
pota	pˠ ɔ t̪ˠ ə
potaisiam	pˠ ɔ t̪ˠ a ʃ i ə mˠ
prácás	pˠ ɾˠ ɑː k ə sˠ
prácás	pˠ ɾˠ ɑː k ɑː sˠ
prácás	pˠ ɾˠ æː k a sˠ
praghas	p ɾˠ ə i sˠ
praiseach	pˠ ɾˠ ə ʃ a x
praiseach	pˠ ɾˠ a ʃ ə x
praiseach	pˠ ɾˠ a ʃ a h
práta	pˠ ɾˠ ɑː t̪ˠ ə
práta	pˠ ɾˠ aː t̪ˠ ə
pratastúnach	pˠ ɾˠ aː t̪ˠ ə sˠ t̪ˠ uː n̪ˠ ə x
preab	pʲ ɾʲ a bˠ
preas	pʲ ɾʲ a sˠ
príobháideacht	pʲ ɾʲ iː vˠ ɑː dʲ ə x t̪ˠ
príobháideacht	pʲ ɾʲ iː w ɑː dʲ ə x t̪ˠ
príobháideacht	pʲ ɾʲ iː w a d͡ʒ a x t̪ˠ
prioc	pʲ ɾʲ ʊ k
príomhchathair	pˠ ɾˠ iː vˠ x a h ɪ ɾʲ
príomhchathair	pˠ ɾˠ iː vˠ x aː ɾʲ
príomhchathair	pˠ ɾˠ iː w x a h ɪ ɾʲ
prios	p ɾʲ ɪ sˠ
príosún	pʲ ɾʲ iː sˠ uː n̪ˠ
próifíl	pˠ ɾˠ oː fʲ iː lʲ
próifíl	pˠ ɾˠ oː fʲ iː lʲ
próifíl	pˠ ɾˠ ɔː fʲ i lʲ
proinn	pˠ ɾˠ iː ŋʲ
próis	pˠ ɾˠ oː ʃ
protastúnach	pˠ ɾˠ ɔ t̪ˠ ə sˠ t̪ˠ uː n̪ˠ ə x
protastúnach	pˠ ɾˠ ɔ t̪ˠ ə sˠ t̪ˠ uː n̪ˠ ə x
protastúnach	pˠ ɾˠ ʌ t̪ˠ ə sˠ t̪ˠ u n̪ˠ a h
puball	pˠ ʊ bˠ ə l̪ˠ
puca	pˠ ʊ k ə
púca	pˠ uː k ə
púdar	pˠ uː d̪ˠ ə ɾˠ
puis	pˠ ɪ ʃ
puisín	pˠ ɪ ʃ iː nʲ
puisín	pˠ ɪ ʃ iː nʲ
puisín	pˠ ɪ ʃ i nʲ
púma	pˠ uː mˠ ə
punt	pˠ uː n̪ˠ t̪ˠ
punt	pˠ ʊ n̪ˠ t̪ˠ
punt	pˠ ʌ n̪ˠ t̪ˠ
punt	pˠ ʊ nˠ t̪ˠ
punta	pˠ ʊ n̪ˠ t̪ˠ ə
pupall	p u b a l͈
pus	pˠ ʊ sˠ
pus	pˠ ʌ sˠ
pusa	pˠ ʊ sˠ ə
rá	ɾˠ ɑː
rabhadh	ɾˠ o u
rabhadh	ɾˠ oː w ə
rabhadh	ɾˠ oː u
rabharta	ɾˠ ə u ɾˠ t̪ˠ ə
rabharta	ɾˠ oː ɾˠ t̪ˠ ə
raibh	ɾˠ ɛ vʲ
raibh	ɾˠ o
raidió	ɾˠ a dʲ iː oː
raidió	ɾˠ a dʲ iː oː
raidió	ɾˠ a dʲ i ɔ
raiméis	ɾˠ ɑː mʲ eː ʃ
raiméis	ɾˠ ɑː mʲ eː ʃ
raiméis	ɾˠ æː mʲ e ʃ
raiméis	ɾˠ aː mˠ a sˠ
ráinig	ɾˠ ɑː nʲ ɪ ɟ
ráinig	ɾˠ ɑː nʲ ɪ c
ráinig	ɾˠ æː nʲ ɪ c
rainnt	ɾˠ ə i nʲ tʲ
ráite	ɾˠ ɑː tʲ ə
ramhar	ɾˠ ə ʊ ɾˠ
rang	ɾˠ ɑ ŋ ɡ
rang	ɾˠ aː ŋ ɡ
rang	ɾˠ a ŋ
rann	ɾˠ a nˠ
raon	ɾˠ eː n̪ˠ
raon	ɾˠ iː nˠ
raplachán	ɾˠ a pˠ lˠ a x æ nˠ
rása	ɾˠ ɑː sˠ ə
rása	ɾˠ æː sˠ ə
rástaí	ɾˠ ɑː sˠ t̪ˠ iː
rásúirí	ɾˠ ɑː sˠ uː ɾʲ iː
rásúr	ɾˠ ɑː sˠ uː ɾˠ
rásúr	ɾˠ ɑː sˠ uː ɾˠ
rásúr	ɾˠ æː sˠ u ɾˠ
rath	ɾˠ ɑ h
rath	ɾˠ a
rath	ɾˠ a h
ráth	ɾˠ ɑː
ráth	ɾˠ aː x
ráthanna	ɾˠ aː x ə n̪ˠ i
ré	rˠ eː
reachtach	ɾˠ a x t̪ˠ ə x
reachtach	ɾˠ a x t̪ˠ a x
réad	ɾˠ eː d̪ˠ
réal	ɾˠ eː lˠ
réalta	ɾˠ eː l̪ˠ t̪ˠ ə
réaltra	ɾˠ eː l̪ˠ t̪ˠ ɾˠ ə
réam	ɾˠ eː mˠ
réama	ɾˠ eː mˠ ə
réasúnta	ɾˠ eː sˠ uː n̪ˠ t̪ˠ ə
réasúnta	ɾˠ eː sˠ uː n̪ˠ t̪ˠ ə
réasúnta	ɾˠ eː sˠ u n̪ˠ t̪ˠ ə
reic	ɾˠ ɛ c
reicteam	ɾˠ ɛ c tʲ ə mˠ
réidh	ɾˠ eː ɟ
réidh	ɾˠ eː
reilig	ɾˠ ɛ lʲ ɪ ɟ
reilig	ɾˠ ɛ lʲ ɪ c
reilig	ɾˠ ə l iː c
reilig	ɾˠ ɪ lʲ ɪ ɟ
reiligiún	ɾˠ ɛ lʲ ɪ ɟ uː nˠ
reiligiún	ɾˠ ɛ lʲ ɪ ɟ uː nˠ
reiligiún	ɾˠ ɛ lʲ ɪ ɟ u nˠ
réim	ɾˠ eː mʲ
réimeanna	ɾˠ eː mʲ ə n̪ˠ ə
réir	ɾˠ eː ɾʲ
réiteach	ɾˠ eː tʲ ə x
réiteach	ɾˠ eː tʲ a h
réiteoir	ɾˠ eː tʲ oː ɾʲ
réiteoir	ɾˠ eː tʲ oː ɾʲ
réiteoir	ɾˠ eː tʲ ɔ ɾʲ
réitigh	ɾˠ eː tʲ ɪ ɟ
réitigh	ɾˠ eː tʲ ə
réitigh	ɾˠ eː tʲ iː
réitigh	ɾˠ eː tʲ i
reitric	ɾˠ ɛ tʲ ɾʲ ɪ c
reo	ɾˠ oː
reo	ɾˠ ɔː
reoiteog	ɾˠ oː tʲ oː ɡ
reoiteog	ɾˠ oː tʲ oː ɡ
reoiteog	ɾˠ ɔː tʲ a ɡ
rí	ɾˠ iː
rialta	ɾˠ i ə l̪ˠ t̪ˠ ə
rialtais	ɾˠ i ə l̪ˠ t̪ˠ ə ʃ
rialtas	ɾˠ i ə l̪ˠ t̪ˠ ə sˠ
rián	rˠ i ɑː nˠ
riarann	ɾˠ i ə ɾˠ ə n̪ˠ
ribe	ɾˠ ɪ bʲ ə
righ	ɾˠ ɪ ɟ
righ	ɾˠ ɪ j
righin	ɾˠ iː nʲ
righin	ɾˠ ə i nʲ
rinc	ɾˠ ɪ ɲ c
rinn	ɾˠ a i ɲ
rinn	ɾˠ iː nʲ
rinn	ɾˠ iː n̠ʲ
rinn	ɾˠ ɪ n̠ʲ
rinne	ɾˠ ɪ n̠ʲ ə
rinne	ɾˠ ɪ n̠ʲ ə
rinneadar	ɾˠ ɪ n̠ʲ ə d̪ˠ ə ɾˠ
rinneadh	ɾˠ ɪ nʲ ə vˠ
rinneadh	ɾˠ ɪ nʲ uː
rinneadh	ɾˠ ɪ nʲ u
rinneamar	ɾˠ ɪ n̠ʲ ə mˠ ə ɾˠ
rinneas	ɾˠ ɪ n̠ʲ ə sˠ
riocht	ɾˠ ʊ x t̪ˠ
ríogach	ɾˠ iː ɡ ə x
ríogach	ɾˠ iː ɡ a x
ríomh	ɾˠ iː vˠ
ríomh	ɾˠ iː w
ríomhaire	ɾˠ iː vˠ ə ɾʲ ə
ríomhchláraitheoir	ɾˠ iː vˠ x lˠ aː ɾˠ ə h oː ɾʲ
ríomhleabhar	ɾʲ iː vˠ lʲ ə u ɾˠ
ríomhleabhar	ɾʲ iː w lʲ ə u ɾˠ
ríomhleabhar	ɾʲ iː w lʲ oː ɾˠ
ríon	ɾˠ iː nˠ
rís	ɾʲ iː ʃ
ríse	ɾˠ iː ʃ ə
rísín	ɾˠ iː ʃ iː nʲ
rísín	ɾˠ iː ʃ iː nʲ
rísín	ɾˠ iː ʃ i nʲ
risteard	ɾˠ ɪ ʃ tʲ ɑː ɾˠ d̪ˠ
rite	ɾˠ ɪ tʲ ə
rith	ɾˠ ɪ h
rith	ɾˠ ʊ
rith	ɾˠ i h
rith	ɾˠ ɯ h
riug	ɾʲ ʊ ɡ
ró	ɾˠ oː
ró	ɾˠ ɔː
robé	r o bʲ eː
robh	ɾˠ o
roc	ɾˠ ɔ k
rochtain	ɾˠ ɔ x t̪ˠ ə nʲ
rochtain	ɾˠ ʌ x t̪ˠ ə nʲ
ród	ɾˠ oː d̪ˠ
ród	ɾˠ ɔː d̪ˠ
rógaire	ɾˠ oː ɡ ə ɾʲ ə
rógaire	ɾˠ ɔː ɡ ə ɾʲ ə
rógánta	ɾˠ oː ɡ ɑː n̪ˠ t̪ˠ ə
rógánta	ɾˠ oː ɡ ɑː n̪ˠ t̪ˠ ə
rógánta	ɾˠ ɔː ɡ ə n̪ˠ t̪ˠ ə
rogha	ɾˠ o u
roghanna	ɾˠ o u n̪ˠ ə
róghoilliúnach	r oː ɣ ɔ lʲ uː nˠ ə x
róghoilliúnach	r oː ɣ ɔ l̠ʲ uː nˠ ə x
róghoilliúnach	r oː ɣ i l̠ʲ u nˠ a h
roibeárd	ɾˠ ɛ bʲ ɑː ɾˠ d̪ˠ
róid	ɾˠ oː dʲ
róid	ɾˠ ɔː dʲ
roimh	ɾˠ ɪ vʲ
roimhe	ɾˠ ɪ vʲ ə
roimis	ɾˠ ɪ mʲ ə ʃ
roinn	ɾˠ a i ɲ
roinn	ɾˠ iː ɲ
roinn	ɾˠ iː n̠ʲ
roinn	ɾˠ ɪ n̠ʲ
roinnt	ɾˠ ə ɪ n̠ʲ tʲ
roinnt	ɾˠ iː n̠ʲ tʲ
roinnt	ɾˠ ɪ n̠ʲ tʲ
rois	ɾˠ ɔ ʃ
róis	ɾˠ oː ʃ
róisín	rˠ oː ʃ iː nʲ
róisín	rˠ oː ʃ iː nʲ
ról	ɾˠ oː lˠ
romhaibh	ɾˠ õː vʲ
romhainn	ɾˠ õː n̠ʲ
romham	ɾˠ õː mˠ
romhat	ɾˠ uː t̪ˠ
romhat	ɾˠ õː d̪ˠ
romhatsa	ɾˠ uː t̪ˠ sˠ ə
rón	ɾˠ oː n̪ˠ
rón	ɾˠ uː nˠ
rón	ɾˠ õː nˠ
rópa	ɾˠ oː pˠ ə
rópa	ɾˠ ɔː pˠ ə
ros	ɾˠ ɔ sˠ
rós	ɾˠ oː sˠ
rós	ɾˠ ɔː sˠ
rosa	ɾˠ ɔ sˠ ə
rosa	ɾˠ ʌ sˠ ə
roth	ɾˠ ɔ h
rotha	ɾˠ ɔ h ə
rua	ɾˠ u ə
ruacan	ɾˠ u ə k ə nˠ
ruadhán	ɾˠ uː ɑː n̪ˠ
ruadhán	ɾˠ uː ɑː nˠ
ruadhán	ɾˠ uː a nˠ
ruainne	ɾˠ u ə n̠ʲ ə
ruainne	ɾˠ uː n̠ʲ ə
rúbal	ɾˠ uː bˠ ə lˠ
rud	ɾˠ ʊ d̪ˠ
rud	ɾˠ ʌ d̪ˠ
ruda	ɾˠ ʊ d̪ˠ ə
rúibín	ɾˠ uː bʲ iː nʲ
rúibín	ɾˠ uː bʲ iː nʲ
rúibín	ɾˠ uː bʲ i nʲ
rúin	ɾˠ uː nʲ
rúis	ɾˠ uː ʃ
rúisis	ɾˠ uː ʃ ə ʃ
rún	ɾˠ uː nˠ
rúnaí	ɾˠ uː n̪ˠ iː
rúnaí	ɾˠ uː nˠ iː
rúnaí	ɾˠ uː nˠ i
rúnda	ɾˠ uː n̪ˠ d̪ˠ ə
ruóg	ɾˠ uː oː ɡ
ruóg	r uː ɔ ɡ
rúsc	ɾˠ uː sˠ k
sa	sˠ ə
sábh	sˠ ɑː w
sábháil	sˠ ɑː vˠ ɑː lʲ
sábháil	sˠ ɑː w ɑː lʲ
sábháil	sˠ æː w æ lʲ
sabóid	sˠ ə bˠ oː dʲ
sabóid	sˠ a bˠ oː dʲ
sabóid	sˠ a bˠ ɔ dʲ
sách	sˠ ɑː x
sách	sˠ æː x
sadhbh	sˠ ə i̯ vˠ
sagairt	sˠ ɑ ɡ ə ɾˠ tʲ
sagairt	sˠ æ ɡ ə ɾˠ tʲ
sagairt	sˠ a ɡ ə ɾˠ tʲ
sagart	sˠ ɑ ɡ ə ɾˠ t̪ˠ
sagart	sˠ æ ɡ ə ɾˠ t̪ˠ
sagart	sˠ a ɡ ə ɾˠ t̪ˠ
saghas	sˠ ə i sˠ
saibhir	sˠ ɛ vʲ ə ɾʲ
saibhreas	sˠ ɛ vʲ ə ɾʲ ə sˠ
saibhris	sˠ ɛ vʲ ə ɾʲ ə ʃ
sáigh	sˠ ɑː ɟ
sáigh	sˠ ɑː
sáigh	sˠ ɑː j
sáigh	sˠ æː j
saighdiúir	sˠ a i dʲ uː ɾʲ
sail	s a lʲ
sáil	sˠ ɑː lʲ
sáil	sˠ æː lʲ
saile	s a lʲ ə
sáile	sˠ ɑː lʲ ə
saill	sˠ a i l̠ʲ
saill	sˠ æ l̠ʲ
sáinn	sˠ ɑː n̠ʲ
sáinn	sˠ æː n̠ʲ
sál	sˠ ɑː lˠ
sál	sˠ æː lˠ
salach	sˠ ə l̪ˠ a x
salach	sˠ a lˠ ə x
salach	sˠ a lˠ a x
salach	sˠ a lˠ a h
salachar	sˠ a lˠ ə x ə ɾˠ
salaigh	sˠ ɑ l̪ˠ ɪ ɟ
salaigh	sˠ a lˠ ə
salaigh	sˠ a lˠ iː
salaigh	sˠ a lˠ i
salainn	s a lˠ ə n̠ʲ
salann	sˠ a lˠ ə n̪ˠ
salann	sˠ ɔ lˠ ə n̪ˠ
sall	sˠ ə u l̪ˠ
sall	sˠ ɑː l̪ˠ
salm	sˠ ɑ l̪ˠ ə mˠ
salm	sˠ a l̪ˠ ə mˠ
salú	sˠ ə l̪ˠ uː
salú	sˠ a l̪ˠ uː
salú	sˠ a l̪ˠ u
sámh	sˠ ɑː vˠ
sámh	sˠ ɑː w
sámh	sˠ aː w
samhain	sˠ a u nʲ
samhain	sˠ o u nʲ
samhain	sˠ ə u nʲ
samhain	sˠ ɑ vˠ ə n
samhain	sˠ a u w ə nʲ
samhlaigh	sˠ ə u l̪ˠ ə
samhlú	sˠ ə u l̪ˠ uː
samhradh	sˠ ə u ɾˠ ə
samhradh	sˠ ə u ɾˠ uː
samhradh	sˠ ə u ɾˠ u
samhraíocha	sˠ ə u ɾˠ iː x iː
san	sˠ ə nˠ
san	sˠ ə nʲ
sanasán	sˠ ɑ n̪ˠ ə sˠ ɑː n̪ˠ
sanasán	sˠ a nˠ ə sˠ ɑː nˠ
sanasán	sˠ a nˠ ə sˠ a nˠ
saoi	sˠ iː
saoil	sˠ iː lʲ
saoil	sˠ eː lʲ
saoil	sˠ iː lʲ
saoile	sˠ iː lʲ ə
saoileann	sˠ iː lʲ ə n̪ˠ
saoir	sˠ iː ɾʲ
saoire	sˠ iː ɾʲ ə
saoirse	sˠ iː ɾˠ ʃ ə
saoirse	sˠ iː ɾʲ ʃ ə
saolta	sˠ eː l̪ˠ t̪ˠ ə
saolta	sˠ iː l̪ˠ t̪ˠ ə
saonta	sˠ eː n̪ˠ t̪ˠ ə
saonta	sˠ iː n̪ˠ t̪ˠ ə
saor	sˠ eː ɾˠ
saor	sˠ iː ɾˠ
saor	sˠ iː ɾˠ
saor	sˠ ɯː ɾˠ
saora	sˠ eː ɾˠ ə
saora	sˠ iː ɾˠ ə
saoradh	sˠ eː ɾˠ ə
saoradh	sˠ iː ɾˠ ə
saoradh	sˠ iː ɾˠ uː
saoradh	sˠ iː ɾˠ u
saoradh	sˠ eː ɾˠ ə ɡ
saoradh	sˠ iː ɾˠ ə vˠ
saoradh	sˠ iː ɾˠ uː
saoradh	sˠ iː ɾˠ u
saoradh	sˠ eː ɾˠ ə x
saoradh	sˠ iː ɾˠ ə tʲ
saoradh	sˠ iː ɾˠ ə x
saoradh	sˠ iː ɾˠ ə tʲ
saoradh	sˠ iː ɾˠ uː
saoradh	sˠ iː ɾˠ ə tʲ
saoradh	sˠ iː ɾˠ u
saorann	sˠ eː ɾˠ ə n̪ˠ
saorann	sˠ iː ɾˠ ə n̪ˠ
saothar	sˠ eː h ə ɾˠ
saothar	sˠ iː h ə ɾˠ
saothar	sˠ iː ɾˠ
saothar	sˠ iː ɾˠ
saothar	sˠ i h ə ɾˠ
saothar	sˠ ɯ h ə ɾˠ
saothraigh	sˠ iː ɾˠ ə
saothrú	sˠ iː ɾˠ uː
sár	sˠ ɑː ɾˠ
sár	sˠ æː ɾˠ
sara	sˠ a ɾˠ ə
sáraíocht	sˠ ɑː ɾˠ i ə x t̪ˠ
saraiste	sˠ a ɾˠ ə ʃ tʲ ə
sás	sˠ ɑː sˠ
sás	sˠ æː sˠ
sásair	sˠ ɑː sˠ ə ɾʲ
sásair	sˠ æː sˠ ə ɾʲ
sasana	sˠ a sˠ ə nˠ ə
sasanach	sˠ a sˠ ə nˠ ə x
sásta	sˠ ɑː sˠ t̪ˠ ə
sásta	sˠ æː sˠ t̪ˠ ə
scadán	sˠ k ə d̪ˠ ɑː n̪ˠ
scadán	sˠ k a d̪ˠ ɑː nˠ
scadán	sˠ k a d̪ˠ a nˠ
scáileán	sˠ k ɑː lʲ ɑː nˠ
scairt	sˠ k a ɾˠ tʲ
scairteadh	sˠ k a ɾˠ tʲ ə
scairteadh	sˠ k a ɾˠ tʲ uː
scairteadh	sˠ k a ɾˠ tʲ u
scairteadh	sˠ k a ɾˠ tʲ ə ɡ
scairteadh	sˠ k a ɾˠ tʲ ə vˠ
scairteadh	sˠ k a ɾˠ tʲ uː
scairteadh	sˠ k a ɾˠ tʲ u
scairteadh	sˠ k a ɾˠ tʲ ə x
scairteadh	sˠ k a ɾˠ tʲ ə tʲ
scairteadh	sˠ k a ɾˠ tʲ ə x
scairteadh	sˠ k a ɾˠ tʲ ə tʲ
scairteadh	sˠ k a ɾˠ tʲ uː
scairteadh	sˠ k a ɾˠ tʲ ə tʲ
scairteadh	sˠ k a ɾˠ tʲ u
scaitheamh	sˠ k a
scaití	sˠ k a tʲ iː
scamall	sˠ k a mˠ ə l̪ˠ
scannán	sˠ k ə n̪ˠ aː n̪ˠ
scanraigh	sˠ k a u n̪ˠ ɾˠ ɪ ɟ
scanraigh	sˠ k ɑː n̪ˠ ɾˠ ə
scanraigh	sˠ k aː nˠ ɾˠ i
scanraithe	sˠ k aː nˠ ɾˠ i
scanrú	sˠ k a u n̪ˠ ɾˠ uː
scanrú	sˠ k ɑː n̪ˠ ɾˠ uː
scanrú	sˠ k æː n̪ˠ ɾˠ u
scaoilte	sˠ k iː lʲ tʲ ə
scar	s k a ɾˠ
scar	s k a r
scara	sˠ k a ɾˠ ə
scaradh	sˠ k ɑ ɾˠ ə
scaradh	sˠ k a ɾˠ ə
scaradh	sˠ k a ɾˠ uː
scaradh	sˠ k a ɾˠ u
scaradh	sˠ k ɑ ɾˠ ə ɡ
scaradh	sˠ k a ɾˠ ə vˠ
scaradh	sˠ k a ɾˠ uː
scaradh	sˠ k a ɾˠ u
scaradh	sˠ k ɑ ɾˠ ə x
scaradh	sˠ k a ɾˠ ə tʲ
scaradh	sˠ k a ɾˠ ə x
scaradh	sˠ k a ɾˠ ə tʲ
scaradh	sˠ k a ɾˠ uː
scaradh	sˠ k a ɾˠ ə tʲ
scaradh	sˠ k a ɾˠ u
scaraid	sˠ k a ɾˠ ə dʲ
scarúint	sˠ k ɑ ɾˠ uː nʲ tʲ
scata	sˠ k ɑ t̪ˠ ə
scata	sˠ k a t̪ˠ ə
scáth	sˠ k ɑː
scáth	sˠ k æː
scátháin	sˠ k ɑː h ɑː nʲ
scátháin	sˠ k ɑː h ɑː nʲ
scátháin	sˠ k ɑː nʲ
scátháin	sˠ k æ h æ nʲ
scáthán	sˠ k ɑː h ɑː n̪ˠ
scáthán	sˠ k ɑː h ɑː nˠ
scáthán	sˠ k ɑː n̪ˠ
scáthán	sˠ k a h a nˠ
sceacha	ʃ c a x ə
scéal	ʃ c i a lˠ
scéal	ʃ c eː lˠ
scéala	ʃ c eː lˠ ə
scéalaí	ʃ c eː lˠ iː
scéalaí	ʃ c eː lˠ iː
scéalaí	ʃ c eː lˠ i
scealp	ʃ c a lˠ pˠ
sceideal	ʃ c ɛ dʲ ə lˠ
sceith	ʃ c ɛ h
sceitimíní	sˠ c ɛ tʲ ə mʲ iː nʲ iː
sceitimíní	ʃ c ɛ tʲ ə mʲ iː nʲ iː
sceitimíní	ʃ c ɛ tʲ ə mʲ i nʲ i
scian	ʃ c i ə nˠ
scian	ʃ c iː n̪ˠ
sciath	ʃ c i ə
scil	ʃ c ɪ lʲ
scilling	ʃ c ɪ lʲ ɪ ɲ
scilling	ʃ c i lʲ ə nʲ
scilling	ʃ c i l̠ʲ ə n̠ʲ
scioból	ʃ c ɪ bˠ oː l̪ˠ
scioból	ʃ c ɪ bˠ oː l̪ˠ
scioból	ʃ c ɨ̞ bˠ ɔ l̪ˠ
scioból	ʃ c ɨ̞ bˠ a l̪ˠ
sciobtha	ʃ c ʊ pˠ iː
scíth	ʃ c iː
scóig	sˠ k oː ɟ
scóig	sˠ k ɔː ɟ
scoil	sˠ k ɔ lʲ
scoileanna	sˠ k ɛ lʲ ə n̪ˠ ə
scoileanna	sˠ k ɛ lʲ ə n̪ˠ iː
scóip	sˠ k oː pʲ
scóip	sˠ k ɔː pʲ
scóir	sˠ k oː ɾʲ
scoitheadh	s k a h u
scoláire	sˠ kˠ oː lˠ ɑː ɾʲ ə
scoláireacht	sˠ k ə lˠ ɑː ɾʲ ə x t̪ˠ
scoláireacht	sˠ k ɔ lˠ ɑː ɾʲ ə x t̪ˠ
scoláireacht	sˠ k ʌ lˠ æ ɾʲ a h t̪ˠ
scóp	sˠ k oː pˠ
scóp	sˠ k ɔː pˠ
scór	sˠ k oː ɾˠ
scóráil	sˠ k oː ɾˠ ɑː lʲ
scóráil	sˠ k oː ɾˠ ɑː lʲ
scóráil	sˠ k ɔː ɾˠ a lʲ
scornach	sˠ k ɔː ɾˠ n̪ˠ a x
scórtha	sˠ k oː ɾˠ h ə
scórtha	sˠ k oː ɾˠ ə
scórtha	sˠ k ɔː ɾˠ h ə
scoth	s k ɔ h
scragall	sˠ k ɾˠ a ɡ ə l̪ˠ
scréach	ʃ c ɾʲ eː x
scríbend	sʲ kʲ rʲ iː vʲ e n͈ d
scríobh	ʃ c ɾʲ iː vˠ
scríobh	ʃ c ɾʲ i w
scríobhaim	s c ɾʲ iː mʲ
scríofa	ʃ c ɾʲ iː fˠ ə
scriú	sˠ k ɾˠ uː
scriúta	ʃ c ɾʲ uː t̪ˠ ə
scrúdaigh	sˠ k ɾˠ uː d̪ˠ ɪ ɟ
scrúdaigh	sˠ k ɾˠ uː d̪ˠ ə
scrúdaigh	sˠ k ɾˠ uː d̪ˠ iː
scrúdaigh	sˠ k ɾˠ uː d̪ˠ i
scuab	sˠ k u ə bˠ
scuabadh	sˠ k u ə bˠ ə
scuabadh	sˠ k u ə bˠ uː
scuabadh	sˠ k u ə bˠ u
scuabadh	sˠ k u ə bˠ ə ɡ
scuabadh	sˠ k u ə bˠ ə vˠ
scuabadh	sˠ k u ə bˠ uː
scuabadh	sˠ k u ə bˠ u
scuabadh	sˠ k u ə bˠ ə x
scuabadh	sˠ k u ə bˠ ə tʲ
scuabadh	sˠ k u ə bˠ ə x
scuabadh	sˠ k u ə bˠ ə tʲ
scuabadh	sˠ k u ə bˠ uː
scuabadh	sˠ k u ə bˠ ə tʲ
scuabadh	sˠ k u ə bˠ u
scuabtha	sˠ k u ə pˠ ə
sé	ʃ eː
sé	ʃ ɛ
sé	ʃ ə
sé	ʃ eː
sea	ʃ a
seabhac	ʃ ə u k
seabhac	ʃ oː k
séabra	ʃ eː bˠ ɾˠ ə
séabraí	ʃ eː bˠ ɾˠ iː
seach	ʃ a x
seachain	ʃ a x ə nʲ
seachain	ʃ æ x ə nʲ
seachas	ʃ a x ə sˠ
seachas	ʃ ɔ x ə sˠ
seachas	ʃ æ x ə sˠ
seacht	ʃ a x t̪ˠ
seacht	ʃ æ x t̪ˠ
seachtain	ʃ a x t̪ˠ ə nʲ
seachtar	ʃ a x t̪ˠ ə ɾˠ
seachtar	ʃ æː x t̪ˠ ə ɾˠ
seachtó	ʃ a x t̪ˠ oː
seacláid	ʃ æ k lˠ ɑː dʲ
sead	ʃ a d̪ˠ
seada	ʃ a d̪ˠ ə
seadadh	ʃ a d̪ˠ ə
seadadh	ʃ a d̪ˠ uː
seadadh	ʃ a d̪ˠ u
seadadh	ʃ a d̪ˠ ə ɡ
seadadh	ʃ a d̪ˠ ə vˠ
seadadh	ʃ a d̪ˠ uː
seadadh	ʃ a d̪ˠ u
seadadh	ʃ a d̪ˠ ə x
seadadh	ʃ a d̪ˠ ə tʲ
seadadh	ʃ a d̪ˠ ə x
seadadh	ʃ a d̪ˠ ə tʲ
seadadh	ʃ a d̪ˠ uː
seadadh	ʃ a d̪ˠ ə tʲ
seadadh	ʃ a d̪ˠ u
seafóid	ʃ æ fˠ oː dʲ
seagal	ʃ a ɡ ə lˠ
seaicéad	ʃ a c eː d̪ˠ
seaicéad	ʃ a c eː d̪ˠ
seaicéad	ʃ æː c eː d̪ˠ
seaicéad	ʃ a c æ d̪ˠ
seáin	ʃ ɑː nʲ
seáin	ʃ æː nʲ
seal	ʃ a lˠ
sealadach	ʃ a lˠ ə d̪ˠ ə x
sealg	ʃ a lˠ ə ɡ
seám	ʃ aː mˠ
seamhan	ʃ ə u nˠ
seamróg	ʃ a mˠ ə ɾˠ oː ɡ
seamróg	ʃ a mˠ ɾˠ oː ɡ
seamróg	ʃ a mˠ ɾˠ a ɡ
seamróga	ʃ a mˠ ə ɾˠ oː ɡ ə
seamróga	ʃ a mˠ ɾˠ oː ɡ ə
seamróga	ʃ a mˠ ɾˠ a ɡ ə
sean	ʃ a nˠ
sean	ʃ æː nˠ
seán	ʃ ɑː n̪ˠ
seán	ʃ æː n̪ˠ
séan	ʃ eː nˠ
seanathair	ʃ a nˠ a h ə ɾʲ
seanbhan	ʃ a nˠ w a nˠ
seanbhean	ʃ a n vʲ a n
seanchas	ʃ a n ə x ə sˠ
seanchas	ʃ a n ə x ə sˠ k
seanduine	ʃ a n̪ˠ d̪ˠ ɪ nʲ ə
seanduine	ʃ æ n̪ˠ ɪ nʲ ə
seanfhear	ʃ a nˠ a ɾˠ
seanfhocal	ʃ a nˠ ɔ k ə lˠ
seanmóir	ʃ a n̪ˠ ə m oː ɾʲ
seanmóir	ʃ a nˠ ə m oː ɾʲ
seanmóir	ʃ a nˠ ə m ɔ ɾʲ
seanmóirí	ʃ a n̪ˠ ə m oː ɾʲ iː
seanmóirí	ʃ a nˠ ə m oː ɾʲ iː
seanmóirí	ʃ a nˠ ə m ɔ ɾʲ iː
seanmóntaidhe	ʃ a nˠ ə mˠ a n̪ˠ t̪ˠ i
seánra	ʃ ɑː n̪ˠ ɾˠ ə
seánra	ʃ æː n̪ˠ ɾˠ ə
seans	ʃ a n̪ˠ sˠ
seanscéal	ʃ a n̪ˠ ʃ c i a l̪ˠ
seanscéal	ʃ a nˠ ʃ c eː lˠ
seanscéal	ʃ a nˠ ʃ c e lˠ
searbh	ʃ a ɾˠ ə vˠ
searbh	ʃ a rˠ uː
searbh	ʃ a rˠ u
seas	ʃ a sˠ
seas	ʃ æ sˠ
seasamh	ʃ a sˠ ə vˠ
seasamh	ʃ a sˠ ə vˠ
seasamh	ʃ a sˠ ə
seasamh	ʃ a sˠ uː
seasamh	ʃ æ sˠ ə
seasamh	ʃ a sˠ u
seasca	ʃ a sˠ k ə
séasúr	sˠ eː sˠ uː ɾˠ
séasúr	ʃ eː sˠ uː ɾˠ
séasúr	ʃ eː sˠ u ɾˠ
seic	ʃ ɛ c
séid	ʃ eː dʲ
séide	ʃ eː dʲ ə
seift	ʃ ɛ fʲ tʲ
seilbh	ʃ ɛ lʲ ə vʲ
seile	ʃ ɛ lʲ ə
seilg	ʃ ɛ lʲ ɪ ɟ
seilide	ʃ ɛ lʲ ə dʲ ə
séipéal	ʃ eː pʲ eː l̪ˠ
séipéal	ʃ eː pʲ a l̪ˠ
séis	ʃ eː ʃ
seise	ʃ ɛ ʃ ə
seisean	ʃ ɛ ʃ ə nˠ
seisear	ʃ ɛ ʃ ə ɾˠ
seisiún	ʃ ɛ ʃ uː n̪ˠ
seisiún	ʃ ɛ ʃ uː nˠ
seisiún	ʃ ɛ ʃ u nˠ
seo	ʃ ɔ
seó	ʃ oː
seoid	ʃ oː dʲ
seoid	ʃ ɔː dʲ
seoirse	ʃ oː ɾˠ ʃ ə
seol	ʃ oː l̪ˠ
seol	ʃ oː l
seol	ʃ ɔː lˠ
seomra	ʃ oː mˠ ɾˠ ə
