'ad	a d̪ˠ
crochadh	k ɾˠ ɔ x uː
crochadh	k ɾˠ ɔ x ə
crochadh	k ɾˠ ɔ x ə tʲ
crochadh	k ɾˠ ɔ x ə vˠ
crochadh	k ɾˠ ɔ x ə x
crochadh	k ɾˠ ɔ x ə ɡ
crochadh	k ɾˠ ʌ x u
crochadh	k ɾˠ ʌ x ə tʲ
crochta	k ɾˠ ɔ x t̪ˠ ə
crochta	k ɾˠ ʌ x t̪ˠ ə
croith	k ɾˠ ɔ h
crom	k ɾˠ a u mˠ
crom	k ɾˠ uː mˠ
crom	k ɾˠ ʊ mˠ
crom	k ɾˠ ʌ mˠ
croí	k ɾˠ iː
croíúil	k ɾˠ iː u lʲ
croíúil	k ɾˠ iː uː lʲ
crua	k ɾˠ u ə
crua	k ɾˠ u ə j
cruach	k ɾˠ u ə x
cruacha	k ɾˠ u ə x ə
cruan	k ɾˠ u ə nˠ
cruinn	k ɾˠ iː nʲ
cruinn	k ɾˠ iː n̠ʲ
cruinn	k ɾˠ ɪ n̠ʲ
cruinne	k ɾˠ ɪ n̠ʲ ə
cruinne	k ɾˠ ɪ ɲ ə
cruinneál	k ɾˠ ɪ n̠ʲ ɑː l̪ˠ
cruinnigh	k ɾˠ ɪ nʲ ɪ ɟ
cruinnigh	k ɾˠ ɪ n̠ʲ i
cruinnigh	k ɾˠ ɪ n̠ʲ iː
cruinnigh	k ɾˠ ɪ n̠ʲ ə
cruinnigh	k ɾˠ ɪ ɲ ɪ ɟ
cruinniú	k ɾˠ ɪ n̠ʲ uː
cruinníocha	k ɾˠ ɪ n̠ʲ i ə x iː
cruit	k ɾˠ ɪ tʲ
cruithneacht	k ɾˠ ɪ nʲ ə x t̪ˠ
cruitireacht	k ɾˠ ɪ tʲ ə ɾʲ a h t̪ˠ
cruitireacht	k ɾˠ ɪ tʲ ə ɾʲ ə x t̪ˠ
cruth	k ɾˠ ʊ h
cráite	k ɾˠ æː tʲ ə
cráite	k ɾˠ ɑː tʲ ə
cré	c ɾʲ eː
créacht	c ɾʲ eː x t̪ˠ
créatúr	c ɾʲ eː t̪ˠ u ɾˠ
créatúr	c ɾʲ eː t̪ˠ uː ɾˠ
crích	c ɾʲ iː
crích	c ɾʲ iː ç
crín	c ɾʲ iː nʲ
críoch	c ɾʲ i ə x
críoch	c ɾʲ iː x
críochnaigh	c ɾʲ i ə x n̪ˠ iː
críochnaigh	c ɾʲ i ə x n̪ˠ ə
críochnaigh	c ɾʲ iː x n̪ˠ i
críochnaigh	c ɾʲ iː x n̪ˠ ɪ ɟ
críochnaithe	c ɾʲ iː x n̪ˠ ɪ h ɪ
críon	c ɾʲ iː nˠ
cróga	k ɾˠ oː ɡ ə
cróga	k ɾˠ ɔː ɡ ə
crúb	k ɾˠ uː bˠ
crúca	k ɾˠ uː k ə
crúigh	k ɾˠ uː
crúigh	k ɾˠ uː j
crúigh	k ɾˠ uː ɟ
cuach	k u ə x
cuaird	k u ə ɾˠ dʲ
cuairt	k u ə ɾˠ tʲ
cuan	k u ə nˠ
cuarc	k u ə ɾˠ k
cuardaigh	k u ə ɾˠ d̪ˠ i
cuardaigh	k u ə ɾˠ d̪ˠ iː
cuardaigh	k u ə ɾˠ d̪ˠ ə
cuardaigh	k u ə ɾˠ d̪ˠ ɪ ɟ
cucól	k ʊ k oː l̪ˠ
cuibhreann	k ɪ vʲ ɾʲ ə n̪ˠ
cuibhrigh	k ɪ vʲ ɾʲ i
cuibhrigh	k ɪ vʲ ɾʲ iː
cuibhrigh	k ɪ vʲ ɾʲ ə
cuibhrigh	k ɪ vʲ ɾʲ ɪ ɟ
cuibhrinn	k ɪ vʲ ɾʲ ə n̠ʲ
cuid	k ɪ dʲ
cuidhil	k i ə lʲ
cuidhil	k iː lʲ
cuil	k ɪ lʲ
cuimhne	k iː mʲ ɾʲ ə
cuimhne	k iː nʲ ə
cuimhne	k iː vʲ ɾʲ ə
cuimhne	k ɪ mʲ n ə
cuimhne	k ɪ mʲ nʲ ə
cuimhne	k ɪ vʲ n ə
cuimhne	k ɪ̃ vʲ nʲ ə
cuimhnigh	k iː mʲ ɾʲ ə
cuimhnigh	k iː nʲ ɪ ɟ
cuimhnigh	k iː vʲ ɾʲ ə
cuimhnigh	k ɪ vʲ nʲ i
cuimhnigh	k ɪ vʲ nʲ iː
cuimhniú	k iː mʲ ɾʲ uː
cuimhniú	k iː vʲ ɾʲ uː
cuir	k ɪ ɾʲ
cuire	k ɪ ɾʲ ə
cuireadh	k ɪ ɾʲ u
cuireadh	k ɪ ɾʲ uː
cuireadh	k ɪ ɾʲ ə tʲ
cuireadh	k ɪ ɾʲ ə vˠ
cuireadh	k ɪ ɾʲ ə x
cuireadh	k ɪ ɾʲ ə ɡ
cuireann	k ɪ ɾʲ ə n̪ˠ
cuisle	k ɪ ʃ l̠ʲ ə
cuisliméara	k ɪ ʃ lʲ ə mʲ eː ɾˠ ə
cuisneoir	k ə ʃ nʲ oː ɾʲ
cuisneoir	k ɪ ʃ nʲ oː ɾʲ
cuisneoir	k ɪ ʃ nʲ ɔ ɾʲ
culaith	k l̪ˠ ɞ h
culaith	k l̪ˠ ɪ h
culaith	k ɔ l̪ˠ ə
culaith	k ʌ lˠ i
cultúr	k ʊ l̪ˠ t̪ˠ u ɾˠ
cultúr	k ʊ l̪ˠ t̪ˠ uː ɾˠ
cum	k uː mˠ
cum	k ʊ mˠ
cuma	k ʊ mˠ ə
cumann	k ʊ mˠ ə n̪ˠ
cumha	k u ə
cumha	k uː
cumhrán	k uː ɾˠ ɑː nˠ
cuntais	k uː n̪ˠ t̪ˠ ə ʃ
cuntais	k ɤ n̪ˠ t̪ˠ ə ʃ
cuntais	k ʊ n̪ˠ t̪ˠ ə ʃ
cuntar	k uː n̪ˠ t̪ˠ ə ɾˠ
cuntar	k ʊ n̪ˠ t̪ˠ ə ɾˠ
cuntas	k uː n̪ˠ t̪ˠ ə sˠ
cuntas	k ɤ n̪ˠ t̪ˠ ə sˠ
cuntas	k ʊ n̪ˠ t̪ˠ ə sˠ
cupán	k ɔ pˠ æ nˠ
cupán	k ʊ pˠ ɑː nˠ
curach	k ɔ ɾˠ ə x
curach	k ə ɾˠ a x
curach	k ɤ ɾˠ a
curach	k ɤ ɾˠ a h
curach	k ɤ ɾˠ a x
curach	k ʊ ɾˠ ə x
curacha	k ɔ ɾˠ ə x ə
curacha	k ə ɾˠ a x ə
curacha	k ɤ ɾˠ a h ə
curacha	k ɤ ɾˠ a x ə
curacha	k ʊ ɾˠ ə x ə
curaigh	k ɔ ɾˠ ə
curaigh	k ʊ ɾˠ i
curaigh	k ʊ ɾˠ iː
curaigh	k ʊ ɾˠ ə
curaigh	k ʊ ɾˠ ɪ ɟ
curaí	k ɔ ɾˠ iː
curaí	k ə ɾˠ iː
curaí	k ɤ ɾˠ i
curaí	k ʊ ɾˠ iː
curaí	k ʌ ɾˠ iː
cuán	k uː æ nˠ
cuán	k uː ɑː nˠ
cuán	k uː ɑː n̪ˠ
cáibín	k aː bʲ i nʲ
cáibín	k aː bʲ iː nʲ
cáil	k æː lʲ
cáil	k ɑː lʲ
cáiliúil	k æː lʲ u lʲ
cáiliúil	k ɑː lʲ uː lʲ
cáin	k æː nʲ
cáin	k ɑː nʲ
cáinte	k æː n̠ʲ tʲ ə
cáinte	k ɑː n̠ʲ tʲ ə
cáis	k æː ʃ
cáis	k ɑː ʃ
cáisc	k æː ʃ c
cáisc	k ɑː ʃ c
cáit	k æː tʲ
cáit	k ɑː tʲ
cál	k æː lˠ
cál	k ɑː lˠ
cána	k æː nˠ ə
cána	k ɑː nˠ ə
cána	k ɑː n̪ˠ ə
cánach	k æː nˠ a h
cánach	k ɑː nˠ ə x
cánach	k ɑː n̪ˠ ə x
cánacha	k æː nˠ a h ə
cánacha	k ɑː nˠ ə x ə
cánacha	k ɑː n̪ˠ ə x ə
cár	k aː ɾˠ
cárb	k aː ɾˠ bˠ
cárbh	k aː ɾˠ vˠ
cárta	k æː ɾˠ t̪ˠ ə
cárta	k ɑː ɾˠ t̪ˠ ə
cás	k æː sˠ
cás	k ɑː sˠ
cé	c eː
céachta	c eː x t̪ˠ ə
céad	c eː d̪ˠ
céadaoin	c eː d̪ˠ iː nʲ
céadta	c eː t̪ˠ ə
céanna	c eː n̪ˠ ə
céard	c eː ɾˠ d̪ˠ
céibh	c eː vʲ
céibhe	c eː vʲ ə
céibheanna	c eː vʲ ə n̪ˠ iː
céid	c eː dʲ
céide	c eː dʲ ə
céile	c eː lʲ ə
céille	c eː l̠ʲ ə
céilí	c eː lʲ iː
céilíoch	c eː lʲ iː ə x
céim	c eː mʲ
céir	c eː ɾʲ
cér	c eː ɾˠ
cérb	c eː ɾˠ bˠ
cérbh	c eː ɾˠ vˠ
cím	c iː mʲ
cíoch	c iː x
cíocrach	c iː k ɾˠ a h
cíocrach	c iː k ɾˠ ə x
cíocras	c iː k ɾˠ ə sˠ
cíor	c iː ɾˠ
cíora	c iː ɾˠ ə
cíos	c iː sˠ
círe	c iː ɾʲ ə
císte	c iː ʃ tʲ ə
cócaráil	k oː k ə ɾˠ aː lʲ
cófra	k oː fˠ ɾˠ ə
cófra	k ɔː fˠ ɾˠ ə
cóir	k oː ɾʲ
cóir	k ɔː ɾʲ
cóirigh	k oː ɾʲ iː
cóirigh	k oː ɾʲ ə
cóirigh	k oː ɾʲ ɪ ɟ
cóirigh	k ɔː ɾʲ i
cóiriú	k oː ɾʲ u
cóiriú	k oː ɾʲ uː
cóisir	k oː ʃ ə ɾʲ
cóisir	k ɔː ʃ ə ɾʲ
cóiste	k oː ʃ tʲ ə
cóiste	k ɔː ʃ tʲ ə
cónaigh	k oː nˠ iː
cónaigh	k oː nˠ ə
cónaigh	k oː n̪ˠ ɪ ɟ
cónaigh	k ɔː nˠ i
cónaithe	k uː n̪ˠ iː
cónaí	k oː n̪ˠ iː
cónaí	k uː nˠ iː
cónaí	k ɔː nˠ i
cóngar	k uː ŋ ɡ ə ɾˠ
cónra	k oː ɾˠ ə
cónra	k uː ɾˠ h ə
cónra	k õː n ə ɾʲ
cór	k oː ɾˠ
córam	k oː ɾˠ ə mˠ
córas	k oː ɾˠ ə sˠ
córas	k ɔː ɾˠ ə sˠ
cósta	k oː sˠ t̪ˠ ə
cósta	k ɔː sˠ t̪ˠ ə
cóstaí	k oː sˠ t̪ˠ iː
cóstaí	k ɔː sˠ t̪ˠ i
cóta	k oː t̪ˠ ə
cóta	k ɔː t̪ˠ ə
cótaí	k oː t̪ˠ iː
cótaí	k ɔː t̪ˠ i
cú	k uː
cúig	k uː ɟ
cúige	k uː ɟ ɪ
cúigear	k uː ɟ ə ɾˠ
cúigiú	k uː ɟ u
cúigiú	k uː ɟ uː
cúinge	k uː ɲ ɪ
cúinne	k uː n̠ʲ ə
cúinne	k uː ɲ ɪ
cúirt	k uː ɾˠ tʲ
cúis	k uː ʃ
cúl	k uː lˠ
cúnamh	k oː nˠ ə
cúnamh	k uː nˠ u
cúnamh	k uː nˠ uː
cúnamh	k uː nˠ ə
cúnamh	k uː n̪ˠ ə vˠ
cúng	k uː ŋ
cúntóir	k uː nˠ t̪ˠ oː ɾʲ
cúr	k uː ɾˠ
cúraim	k uː ɾˠ ə mʲ
cúram	k uː ɾˠ ə mˠ
cúramach	k uː ɾˠ ə mˠ a h
cúramach	k uː ɾˠ ə mˠ ə x
cúrsa	k uː ɾˠ sˠ ə
cúthail	k uː h ə lʲ
cúthail	k uː lʲ
d'ainneoin	d̪ˠ a nʲ oː nʲ
d'ainneoin	d̪ˠ a n̠ʲ oː nʲ
d'ainneoin	d̪ˠ a n̠ʲ ɔ nʲ
d'aithin	d̪ˠ a h ə nʲ
d'aithin	d̪ˠ eː h ə n
d'aithin	d̪ˠ æ n
d'aithin	d̪ˠ æ nʲ
d'aithneodh	d̪ˠ æ nʲ ə tʲ
d'aithneodh	d̪ˠ æ nʲ ə x
d'aithníodh	dˠ a h nʲ iː fˠ
d'aithníodh	dˠ a h nʲ iː tʲ
d'aithníodh	dˠ a h nʲ iː w
d'aithníodh	dˠ a h nʲ iː x
d'aithníodh	dˠ æ nʲ iː tʲ
d'aithníodh	dˠ æ nʲ iː x
d'altadh	d̪ˠ a l̪ˠ t̪ˠ u
d'altadh	d̪ˠ a l̪ˠ t̪ˠ uː
d'altadh	d̪ˠ a l̪ˠ t̪ˠ ə tʲ
d'altadh	d̪ˠ a l̪ˠ t̪ˠ ə x
d'altfadh	d̪ˠ a l̪ˠ t̪ˠ u
d'altfadh	d̪ˠ a l̪ˠ t̪ˠ uː
d'altfadh	d̪ˠ a l̪ˠ t̪ˠ ə tʲ
d'altfadh	d̪ˠ a l̪ˠ t̪ˠ ə x
d'fheiceadh	dʲ ɛ c u
d'fheiceadh	dʲ ɛ c uː
d'fheiceadh	dʲ ɛ c ə tʲ
d'fheiceadh	dʲ ɛ c ə x
d'fheicfeadh	dʲ ɛ c u
d'fheicfeadh	dʲ ɛ c uː
d'fheicfeadh	dʲ ɛ c ə tʲ
d'fheicfeadh	dʲ ɛ c ə x
d'fhiafraigh	dʲ i ə ɾˠ ə
d'fhill	dʲ iː lʲ
d'fhill	dʲ iː l̠ʲ
d'fhill	dʲ ɪ l̠ʲ
d'fhonn	d̪ˠ uː n̪ˠ
d'fhonn	d̪ˠ ə u n̪ˠ
d'fhonn	d̪ˠ ʌ n̪ˠ
d'fhreastail	dʲ ɾʲ a sˠ t̪ˠ ə lʲ
d'fhreastalaíodh	dʲ ɾʲ a sˠ t̪ˠ ə lˠ iː tʲ
d'fhreastalaíodh	dʲ ɾʲ a sˠ t̪ˠ ə lˠ iː x
d'fhreastalódh	dʲ ɾʲ a sˠ t̪ˠ ə lˠ oː tʲ
d'fhreastalódh	dʲ ɾʲ a sˠ t̪ˠ ə lˠ oː x
d'fhágadar	d̪ˠ æː ɡ ə d̪ˠ ə ɾˠ
d'fhágadar	d̪ˠ ɑː ɡ ə d̪ˠ ə ɾˠ
d'fhágadar	d̪ˠ ə ɣ ɑː ɡ ə d̪ˠ ə ɾˠ
d'fhágadh	d̪ˠ æː ɡ u
d'fhágadh	d̪ˠ æː ɡ ə tʲ
d'fhágadh	d̪ˠ ɑː ɡ uː
d'fhágadh	d̪ˠ ɑː ɡ ə tʲ
d'fhágadh	d̪ˠ ɑː ɡ ə x
d'fhágfadh	d̪ˠ æː k u
d'fhágfadh	d̪ˠ æː k ə tʲ
d'fhágfadh	d̪ˠ ɑː k uː
d'fhágfadh	d̪ˠ ɑː k ə tʲ
d'fhágfadh	d̪ˠ ɑː k ə x
d'fháisc	d̪ˠ ɑː ʃ c
d'fhás	dˠ æː sˠ
d'fhás	dˠ ɑː sˠ
d'iarr	dʲ i ə ɾˠ
d'imigh	dʲ ɪ mʲ ɪ ɟ
d'inseodh	dʲ iː nʲ ʃ oː tʲ
d'inseodh	dʲ iː nʲ ʃ oː x
d'ith	dʲ iː
d'ith	dʲ ɪ
d'ith	dʲ ɪ h
d'oil	d̪ˠ ɛ lʲ
d'oil	d̪ˠ ɪ lʲ
d'oileadh	d̪ˠ ɛ lʲ u
d'oileadh	d̪ˠ ɛ lʲ uː
d'oileadh	d̪ˠ ɛ lʲ ə tʲ
d'oileadh	d̪ˠ ɛ lʲ ə x
d'oileadh	d̪ˠ ɪ lʲ u
d'oileadh	d̪ˠ ɪ lʲ uː
d'oileadh	d̪ˠ ɪ lʲ ə tʲ
d'oileadh	d̪ˠ ɪ lʲ ə x
d'oilfeadh	d̪ˠ ɛ lʲ h u
d'oilfeadh	d̪ˠ ɛ lʲ h uː
d'oilfeadh	d̪ˠ ɛ lʲ h ə tʲ
d'oilfeadh	d̪ˠ ɛ lʲ h ə x
d'oilfeadh	d̪ˠ ɪ lʲ h u
d'oilfeadh	d̪ˠ ɪ lʲ h uː
d'oilfeadh	d̪ˠ ɪ lʲ h ə tʲ
d'oilfeadh	d̪ˠ ɪ lʲ h ə x
d'ullmhaigh	d̪ˠ ʊ l̪ˠ w iː
d'ullmhaigh	d̪ˠ ʊ l̪ˠ w ə
d'ullmhaigh	d̪ˠ ʊ l̪ˠ ə vˠ ɪ ɟ
d'ullmhaigh	d̪ˠ ʌ l̪ˠ w i
d'éalaigh	dʲ eː lˠ i
d'éalaigh	dʲ eː lˠ iː
d'éalaigh	dʲ eː lˠ ə
d'éalaigh	dʲ i a l̪ˠ ɪ ɟ
d'éirigh	dʲ iː ɾʲ i
d'éirigh	dʲ ə i ɾʲ iː
d'éirigh	dʲ ə i ɾʲ ə
d'éirigh	dʲ ə i ɾʲ ɪ ɟ
d'íosfadh	dʲ iː s ə tʲ
d'íosfadh	dʲ iː s ə x
dabhach	d̪ˠ ə u w i
dabhach	d̪ˠ ə u ə x
dabhaigh	d̪ˠ ə u w i
dada	d̪ˠ a d̪ˠ ə
daichead	d̪ˠ a h ə d̪ˠ
daichead	d̪ˠ a ç ə d̪ˠ
daid	d̪ˠ a dʲ
daidí	d̪ˠ a dʲ iː
dainséar	d̪ˠ a i nʲ ʃ eː ɾˠ
dainséar	d̪ˠ a n̠ʲ ʃ a ɾˠ
dainséar	d̪ˠ a n̠ʲ ʃ eː ɾˠ
dair	d̪ˠ a ɾʲ
dall	d̪ˠ a u l̪ˠ
dall	d̪ˠ ɑ l̪ˠ
dall	d̪ˠ ɑː l̪ˠ
dalta	d̪ˠ a lˠ t̪ˠ ə
daltach	d̪ˠ a l̪ˠ t̪ˠ a h
daltach	d̪ˠ a l̪ˠ t̪ˠ ə x
damh	d̪ˠ a w
damhsa	d̪ˠ ə u sˠ ə
damhsa	d̪ˠ ə̃ ũ sˠ ə
damhsaigh	d̪ˠ a u sˠ ə
damáiste	d̪ˠ a mˠ æ ʃ tʲ ə
damáiste	d̪ˠ a mˠ ɑː ʃ tʲ ə
damáiste	d̪ˠ ə mˠ ɑː ʃ tʲ ə
danmhairgis	d̪ˠ a nˠ w a ɾʲ ɪ ɟ ɪ ʃ
daoi	d̪ˠ iː
daoibh	dʲ iː bʲ
daoibh	d̪ˠ iː bʲ
daoibh	d̪ˠ iː vʲ
daoine	d̪ˠ iː nʲ ə
daoirse	d̪ˠ iː ɾˠ ʃ ə
daonchairdiúil	d̪ eː n̪ x ɑː ɾˠ dʲ uː lʲ
daonchairdiúil	d̪ iː n̪ x æː ɾˠ dʲ u lʲ
daonchairdiúil	d̪ iː n̪ x ɑː ɾˠ dʲ uː lʲ
daonra	dˠ eː n̪ˠ ɾˠ ə
daonra	dˠ iː n̪ˠ ɾˠ ə
dara	d̪ˠ a ɾˠ ə
dara	d̪ˠ ɑ ɾˠ ə
dath	d̪ˠ a h
dathúil	d̪ˠ a h uː lʲ
dathúil	d̪ˠ a uː lʲ
dathúil	d̪ˠ ə u lʲ
de	dʲ ə
de	dʲ ɛ
de	ɡ ə
deacair	dʲ a k ə ɾʲ
deacair	dʲ æ k ə ɾʲ
deachaigh	dʲ a x i
deachaigh	dʲ a x iː
deachaigh	dʲ a x ə
deachaigh	dʲ a x ə ɟ
dealbh	dʲ a lˠ ə vˠ
deannach	dʲ a nˠ ə x
deara	dʲ a ɾˠ ə
dearbh	dʲ a ɾˠ ə vˠ
dearcadh	dʲ a ɾˠ k u
dearcadh	dʲ a ɾˠ k uː
dearcadh	dʲ a ɾˠ k ə
dearcadh	dʲ a ɾˠ k ə tʲ
dearcadh	dʲ a ɾˠ k ə vˠ
dearcadh	dʲ a ɾˠ k ə x
dearcadh	dʲ a ɾˠ k ə ɡ
dearg	dʲ a ɾˠ ə ɡ
dearg	dʲ æ ɾˠ ə ɡ
deargadh	dʲ a ɾˠ ə ɡ u
deargadh	dʲ a ɾˠ ə ɡ uː
deargadh	dʲ a ɾˠ ə ɡ ə
deargadh	dʲ a ɾˠ ə ɡ ə tʲ
deargadh	dʲ a ɾˠ ə ɡ ə vˠ
deargadh	dʲ a ɾˠ ə ɡ ə x
deargadh	dʲ a ɾˠ ə ɡ ə ɡ
dearmad	dʲ a ɾˠ ə mˠ ə d̪ˠ
dearmad	dʲ æ ɾˠ ə mˠ ə d̪ˠ
dearna	dʲ ɑː ɾˠ n̪ˠ ə
deartháir	dʲ a ɾˠ h a ɾʲ
deartháir	dʲ æː ɾˠ h a ɾʲ
deartháir	dʲ æː ɾˠ h ə ɾʲ
deartháir	dʲ ɾʲ i ç aː ɾʲ
deartháir	dʲ ɾʲ ɑː h ə rʲ
deartháir	dʲ ɾʲ ɑː ɾʲ
deartháir	dʲ ɾʲ ə h aː ɾʲ
deartháireacha	dʲ a ɾˠ h a ɾʲ ə x ə
deartháireacha	dʲ æː ɾˠ h a ɾʲ a x ə
deartháireacha	dʲ æː ɾˠ h ə ɾʲ a x ə
deartháireacha	dʲ ɾʲ i ç aː ɾʲ ə x ə
deartháireacha	dʲ ɾʲ ɑː h ə rʲ ə x ə
deartháireacha	dʲ ɾʲ ə h aː ɾʲ ə x ə
dearthár	dʲ a ɾˠ h a ɾˠ
dearthár	dʲ æː ɾˠ h a ɾˠ
dearthár	dʲ æː ɾˠ h ə ɾˠ
dearthár	dʲ ɾʲ i ç aː ɾˠ
dearthár	dʲ ɾʲ ɑː h ə rˠ
dearthár	dʲ ɾʲ ɑː ɾˠ
dearthár	dʲ ɾʲ ə h aː ɾˠ
deartháracha	dʲ ɾʲ ɑː ɾˠ ə x iː
deas	dʲ a sˠ
deas	dʲ æ sˠ
deasa	dʲ a sˠ ə
ded	dʲ ɛ d̪ˠ
deice	dʲ ɛ c ɪ
deich	dʲ ɛ
deich	dʲ ɛ h
deich	dʲ ɛ ç
deichniúr	dʲ ɪ n̠ʲ uː ɾˠ
deifir	dʲ ɛ fʲ ə ɾʲ
deil	dʲ ɛ lʲ
deilbh	dʲ ɛ lʲ ə vʲ
deileanna	dʲ ɛ lʲ ə n̪ˠ ə
deimhin	dʲ ə ɪ nʲ
deimhin	dʲ ɪ vʲ ə nʲ
deinim	dʲ ɛ nʲ ɪ mʲ
deinim	dʲ ɪ nʲ ɪ mʲ
deir	dʲ ɛ ɾʲ
deire	dʲ ɛ ɾʲ ə
deireadh	dʲ ɛ ɾʲ u
deireadh	dʲ ɛ ɾʲ uː
deireadh	dʲ ɛ ɾʲ ə
deireadh	dʲ ɛ ɾʲ ə tʲ
deireadh	dʲ ɛ ɾʲ ə x
deireanach	dʲ ɛ ɾʲ ə nˠ a h
deireanach	dʲ ɛ ɾʲ ə nˠ ə x
deirfiúr	dʲ ɛ ɾʲ ə fʲ a ɾˠ
deirfiúr	dʲ ɛ ɾʲ ə fʲ ə ɾˠ
deirfiúr	dʲ ɛ ɾʲ ə fˠ uː ɾˠ
deirfiúr	dʲ ɛ ɾʲ ə h uː ɾˠ
deirfiúr	dʲ ɾʲ a u h ə ɾˠ
deirfiúr	dʲ ɾʲ a u ɾˠ
deirfiúr	dʲ ɾʲ ə fʲ uː ɾˠ
deirfiúr	dʲ ɾʲ ə fˠ uː ɾˠ
deirfiúr	dʲ ɾʲ ɛ h uː ɾˠ
deirfiúracha	dʲ e ɾʲ ə fʲ a ɾˠ a x ə
deirfiúracha	dʲ e ɾʲ ə fʲ ə ɾˠ a x ə
deirfiúracha	dʲ e ɾʲ ə fʲ ə ɾˠ ə x ə
deirfiúracha	dʲ ɾʲ a u h ə ɾˠ ə x ə
deirfiúracha	dʲ ɾʲ a u ɾˠ ə x iː
deirfiúracha	dʲ ɾʲ e h uː ɾˠ ə x ə
deirfiúracha	dʲ ɾʲ ə fˠ uː ɾˠ ə x ə
deis	dʲ ɛ ʃ
deisceabal	dʲ ɛ ʃ c ə bˠ ə lˠ
deisceart	dʲ ɛ ʃ c ə ɾˠ t̪ˠ
deise	dʲ ɛ ʃ ə
deiseal	dʲ ɛ ʃ ə lˠ
deiseanna	dʲ ɛ ʃ ə n̪ˠ ə
dem	dʲ ɛ mˠ
den	dʲ ə nˠ
den	dʲ ɛ nˠ
den	ɡ ə nˠ
deoch	dʲ ɔ x
deoir	dʲ oː ɾʲ
deoir	dʲ ɔː ɾʲ
deor	dʲ oː ɾˠ
deor	dʲ ɔː ɾˠ
desean	dʲ ɛ ʃ ə nˠ
desna	dʲ ɛ sˠ n̪ˠ ə
det	dʲ ɛ t̪ˠ
dh'	ɣ
dhaingníodar	ɣ a ɲ ɟ ə nʲ iː d̪ˠ ə ɾˠ
dhaoibh	iː bʲ
dhaoibh	j iː bʲ
dhaoibh	ɣ iː bʲ
dhaoibh	ɣ iː vʲ
dhaoibhse	j iː pʲ ʃ ə
dhaoine	ɣ iː nʲ ə
dhe	j ɛ
dheacair	j a k ə ɾʲ
dheacair	j æ k ə ɾʲ
dhearna	j ɑː ɾˠ n̪ˠ ə
dheireadh	j ɛ ɾʲ u
dheireadh	j ɛ ɾʲ uː
dheireadh	j ɛ ɾʲ ə
dhesean	j ɛ ʃ ə nˠ
dhi	iː
dhi	j iː
dhi	j ɪ
dhi	ɣ iː
dhiaidh	j i ə
dhise	j ɪ ʃ ə
dhiúil	j uː lʲ
dhom	mˠ
dhom	ə mˠ
dhom	ɣ ɔ mˠ
dhom	ɣ ə mˠ
dhom	ɣ ʊ mˠ
dhom	ʊ mˠ
dhomsa	ɣ ɔ mˠ sˠ ə
dhubh	ɣ ʊ vˠ
dhubh	ɣ ʊ w
dhuine	ɣ ɪ nʲ ə
dhuit	ɣ ɪ tʲ
dhuitse	ɣ ɪ tʲ ʃ ə
dhul	ɣ ʊ lˠ
dhá	ɑː
dhá	ɣ æː
dhá	ɣ ɑː
dháiríre	ɣ æ ɾʲ iː ɾʲ ə
dháiríre	ɣ ɑː ɾʲ iː ɾʲ ə
dháréag	ɣ ɑː ɾˠ eː ɡ
dhéag	j eː ɡ
dhéanfadh	j iː n ə tʲ
dhéanfadh	j iː n ə x
dhíbh	iː bʲ
dhíbh	j iː bʲ
dhíbh	j iː vʲ
dhíbh	ɣ iː bʲ
dhíbhse	j iː vʲ ʃ ə
dhícheall	j iː h ə l̪ˠ
dhícheall	j iː ç ə l̪ˠ
dhínn	iː n̠ʲ
dhínn	j iː n̠ʲ
dhínn	ɣ iː n̠ʲ
dhínn	ɣ ɪ n̠ʲ
dhínne	j iː n̠ʲ ə
dhíobh	iː bˠ
dhíobh	j iː bˠ
dhíobh	ɣ iː bˠ
dhíobhsan	j iː pˠ sˠ ə n
dhíolann	j iː lˠ ə n̪ˠ
dhíom	iː mˠ
dhíom	j iː mˠ
dhíom	ɣ iː mˠ
dhíomsa	j iː mˠ sˠ ə
dhíot	iː t̪ˠ
dhíot	j iː t̪ˠ
dhíot	ɣ iː t̪ˠ
dhíotsa	j iː t̪ˠ sˠ ə
dhó	ɣ oː
dhó	ɣ ɔː
dhóibh	oː bʲ
dhóibh	oː bˠ
dhóibh	ɣ oː bʲ
dhóibh	ɣ oː bˠ
dhóibh	ɣ oː vʲ
dhóibhsean	ɣ oː pˠ sˠ ə n
dhóigh	ɣ oː
dhóigh	ɣ oː ɟ
dhósan	ɣ oː sˠ ə nˠ
dhóthain	ɣ oː h ə nʲ
dhóthain	ɣ oː nʲ
dhóthain	ɣ ɔ h ə nʲ
dhúil	ɣ uː lʲ
dhúinn	uː n̠ʲ
dhúinn	ɣ uː n̠ʲ
dhúinn	ɣ ɪ n̠ʲ
dhúinn	ɪ n̠ʲ
dhúinne	ɣ uː n̠ʲ ə
dhún	ɣ uː nˠ
di	dʲ iː
di	dʲ ɪ
di	d̪ˠ iː
dia	dʲ i ə
diabhal	dʲ i ə l̪ˠ
diabhal	dʲ ə u l̪ˠ
diaidh	dʲ i ə
diamant	dʲ iˑ ə mˠ ə n̪ˠ t̪ˠ
dian	dʲ i ə nˠ
diana	dʲ i ə nˠ ə
dianghlasáil	dʲ i ə nˠ ɣ lˠ a sˠ ɑː lʲ
diarmaid	dʲ i ə ɾˠ mˠ ə dʲ
difríocht	dʲ ɪ fʲ ɾʲ i ə x t̪ˠ
ding	dʲ ɪ ɲ
ding	dʲ ɪ ɲ ɟ
dinnéar	dʲ ɪ nʲ e ɾˠ
dinnéar	dʲ ɪ nʲ eː ɾˠ
dise	dʲ ɪ ʃ ə
diúc	dʲ uː k
diúil	dʲ uː lʲ
diúl	dʲ uː lˠ
dlaoi	d̪ˠ lˠ iː
dligh	dʲ lʲ iː
dligh	dʲ lʲ ɪ ɟ
dlí	dʲ lʲ iː
dlúth	d̪ˠ lˠ uː
do	d̪ˠ ɔ
do	d̪ˠ ə
do	ɡ ə
dochar	d̪ˠ ɔ x ə ɾˠ
dochar	d̪ˠ ʌ x ə ɾˠ
dochreidte	d̪ˠ ɔ ç ɾʲ ɛ tʲ ə
dochtúir	d̪ˠ ɔ x t̪ˠ uː ɾʲ
dochtúir	d̪ˠ ʌ x t̪ˠ u ɾʲ
dochtúr	d̪ˠ ɔ x t̪ˠ uː ɾˠ
dod	d̪ˠ ɔ d̪ˠ
dod	d̪ˠ ʌ d̪ˠ
doiciméad	d̪ˠ ɔ c ɪ mʲ e d̪ˠ
doiciméad	d̪ˠ ɔ c ɪ mʲ eː d̪ˠ
doiciméad	d̪ˠ ɪ c ɪ mʲ eː d̪ˠ
doire	d̪ˠ ɛ ɾʲ ə
doirse	d̪ˠ ɔ ɾˠ ʃ ə
doirse	d̪ˠ ʌ ɾˠ ʃ ə
dol	d̪ˠ ɔ lˠ
dol	d̪ˠ ʌ lˠ
dola	d̪ˠ ɔ lˠ ə
dola	d̪ˠ ʌ lˠ ə
dom	d̪ˠ ɔ mˠ
dom	d̪ˠ ə mˠ
dom	d̪ˠ ʊ mˠ
domhain	d̪ˠ ə u nʲ
domhan	d̪ˠ a ʊ n̪ˠ
domhan	d̪ˠ a ʊ ə n̪ˠ
domhan	d̪ˠ oː ə n̪ˠ
domhnall	d̪ˠ oː nˠ ə l̪ˠ
domhnall	d̪ˠ uː nˠ ə l̪ˠ
domsa	d̪ˠ ɔ mˠ sˠ ə
don	d̪ˠ ɔ nˠ
don	d̪ˠ ə nˠ
don	d̪ˠ ʌ nˠ
don	ɡ ə nˠ
dona	d̪ˠ ɔ nˠ ə
dona	d̪ˠ ʊ nˠ ə
donas	d̪ˠ ɔ nˠ ə sˠ
donas	d̪ˠ ʌ nˠ ə sˠ
donasach	d̪ˠ ɔ nˠ ə sˠ ə x
donasach	d̪ˠ ʌ nˠ ə sˠ a h
donn	d̪ˠ uː n̪ˠ
donn	d̪ˠ ɔ n̪ˠ
donn	d̪ˠ ə u n̪ˠ
donna	d̪ˠ ɔ n̪ˠ ə
donna	d̪ˠ ʊ n̪ˠ ə
donncha	d̪ˠ ɔ n̪ˠ ə x ə
donncha	d̪ˠ ʊ n̪ˠ ə x ə
donncha	d̪ˠ ʌ n̪ˠ a x ə
dorais	d̪ˠ ɔ ɾˠ ə ʃ
doras	d̪ˠ ɔ ɾˠ ə sˠ
doras	d̪ˠ ʌ ɾˠ ə sˠ
dorcha	d̪ˠ ɔ ɾˠ ə x ə
dorcha	d̪ˠ ʌ ɾˠ ə x ə
dorchacht	d̪ˠ ɔ ɾˠ ə x ə x t̪ˠ
dorchacht	d̪ˠ ʌ ɾˠ ə x a h t̪ˠ
dorn	d̪ˠ oː ɾˠ n̪ˠ
dos	d̪ˠ ɔ sˠ
dos	d̪ˠ ʌ sˠ
dosna	d̪ˠ ɔ sˠ n̪ˠ ə
dot	d̪ˠ ɔ t̪ˠ
dragan	d̪ˠ ɾˠ a ɡ ə nˠ
drama	d̪ˠ ɾˠ a mˠ ə
dramanna	d̪ˠ ɾˠ a mˠ ə n̪ˠ iː
dreach	dʲ ɾʲ a x
dream	dʲ ɾʲ a mˠ
dream	dʲ ɾʲ ɑː mˠ
dream	dˠ ɾˠ a u mˠ
dream	dˠ ɾˠ o u mˠ
dreancaid	dʲ ɾʲ a ŋ k ə dʲ
dreo	dʲ ɾʲ oː
dreo	dʲ ɾʲ ɔː
dreoigh	dʲ ɾʲ oː
dreoigh	dʲ ɾʲ oː j
dreoigh	dʲ ɾʲ oː ɟ
dreoigh	dʲ ɾʲ ɔː j
dreoite	dʲ ɾʲ oː tʲ ə
dreoite	dʲ ɾʲ ɔː tʲ ə
dris	dʲ ɾʲ ɪ ʃ
droichead	d̪ˠ ɾˠ eː d̪ˠ
droichead	d̪ˠ ɾˠ ə i d̪ˠ
droichead	d̪ˠ ɾˠ ɛ h ə d̪ˠ
droichead	d̪ˠ ɾˠ ɛ ç ə d̪ˠ
droichid	d̪ˠ ɾˠ eː dʲ
droim	d̪ˠ ɾˠ iː mʲ
droim	d̪ˠ ɾˠ ɪ mʲ
drom	d̪ˠ ɾˠ o u mˠ
droma	d̪ˠ ɾˠ ɔ mˠ ə
druid	d̪ˠ ɾˠ ɪ dʲ
druncaera	d̪ˠ ɾˠ ʊ ŋ k eː ɾˠ ə
dráma	d̪ˠ ɾˠ æː mˠ ə
dráma	d̪ˠ ɾˠ ɑː mˠ ə
dréimire	dʲ ɾʲ eː mʲ ə ɾʲ ə
dtaisce	d̪ˠ a ʃ c ɪ
dtalamh	d̪ˠ a lˠ u
dtalamh	d̪ˠ a lˠ uː
dtalamh	d̪ˠ a lˠ ə
dtalamh	d̪ˠ ɑ lˠ ə vˠ
dtarbh	d̪ˠ a ɾˠ u
dtarbh	d̪ˠ a ɾˠ uː
dte	dʲ ɛ
dteach	dʲ a x
dteach	dʲ æː x
dtiarna	dʲ i ə ɾˠ n̪ˠ ə
dtigh	dʲ iː
dtigh	dʲ ɪ ɟ
dtiocfad	dʲ ʊ k ə d̪ˠ
dtiocfad	d̪ˠ ʊ k ə d̪ˠ
dtiocfainn	dʲ ʊ k ə n̠ʲ
dtiocfá	dʲ ʊ k fˠ ɑː
dtiocfá	d̪ˠ ʊ k fˠ ɑː
dtorann	d̪ˠ ɔ ɾˠ ə n̪ˠ
dtorann	d̪ˠ ʌ ɾˠ ə n̪ˠ
dtosach	d̪ˠ ɔ sˠ ə x
dtosach	d̪ˠ ə sˠ ɑ x
dtosach	d̪ˠ ʌ sˠ a h
dtrátha	d̪ˠ ɾˠ a h ə
dtrátha	d̪ˠ ɾˠ ɑː h ə
dtrí	dʲ ɾʲ iː
dtuigeann	d̪ˠ ɪ ɟ ə n̪ˠ
dté	dʲ eː
dtír	dʲ iː ɾʲ
dtóir	d̪ˠ oː ɾʲ
dtóir	d̪ˠ ɔː ɾʲ
dtóireacha	d̪ˠ oː ɾʲ ə x ə
dtóireacha	d̪ˠ ɔː ɾʲ a h ə
dua	d̪ˠ u ə
duaidh	d̪ˠ u ə ɟ
duais	d̪ˠ u ə ʃ
dual	d̪ˠ u ə lˠ
duas	d̪ˠ u ə sˠ
dubh	d̪ˠ ʊ fˠ
dubh	d̪ˠ ʊ vˠ
dubh	d̪ˠ ʊ w
dubhghall	d̪ˠ ʊ w ə l
ducht	d̪ˠ ʊ x t̪ˠ
dugaire	d̪ˠ ɤ ɡ ə ɾʲ ə
dugaire	d̪ˠ ʊ ɡ ə ɾʲ ə
duibheagán	d̪ˠ ɪ vʲ ə ɡ aː n̪ˠ
duid	d̪ˠ ɪ dʲ
duille	d̪ˠ ɪ lʲ ə
duilleach	d̪ˠ ɪ l̠ʲ a x
duilleach	d̪ˠ ɪ l̠ʲ ə x
duilleog	dʲ ɪ l oː ɡ
duine	d̪ˠ ɪ nʲ ə
duit	d̪ˠ ɪ tʲ
duitse	d̪ˠ ɪ tʲ ʃ ə
dul	d̪ˠ ʊ lˠ
dusta	d̪ˠ ɪ sˠ t̪ˠ ə
dusta	d̪ˠ ʊ sˠ t̪ˠ ə
dáir	d̪ˠ æː ɾʲ
dáir	d̪ˠ ɑː ɾʲ
dáiríre	d̪ˠ æ ɾʲ iː ɾʲ ə
dáiríre	d̪ˠ ɑː ɾʲ iː ɾʲ ə
dála	d̪ˠ æː lˠ ə
dála	d̪ˠ ɑː lˠ ə
dán	d̪ˠ æː nˠ
dán	d̪ˠ ɑː nˠ
dán	d̪ˠ ɑː n̪ˠ
dár	d̪ˠ ɑː ɾˠ
dáréag	d̪ˠ ɑː ɾˠ eː ɡ
dáta	d̪ˠ æː t̪ˠ ə
dáta	d̪ˠ ɑː t̪ˠ ə
dé	dʲ eː
déad	dʲ eː d̪ˠ
déag	dʲ eː ɡ
déan	dʲ eː nˠ
déan	dʲ iː n
déan	dʲ ɪ n
déanamh	dʲ a nˠ u
déanamh	dʲ eː nˠ u
déanamh	dʲ eː nˠ uː
déanamh	dʲ i a n̪ˠ ə
déanamh	dʲ i a n̪ˠ ə v
déanamh	dʲ iː n̪ˠ ə
déanamh	dʲ ɪ n̪ˠ ə
déanaí	dʲ eː n̪ˠ i
déanaí	dʲ eː n̪ˠ iː
déanaí	dʲ i a n̪ˠ iː
déanta	dʲ eː n̪ˠ t̪ˠ ə
déanta	dʲ iː n̪ˠ t̪ˠ ə
déantar	dʲ eː n̪ˠ t̪ˠ ə ɾˠ
déantar	dʲ iː n̪ˠ t̪ˠ ə ɾˠ
déantar	dʲ ɪ n̪ˠ t̪ˠ ə ɾˠ
déantóir	dʲ eː n̪ˠ t̪ˠ oː ɾʲ
déantóir	dʲ i a n̪ˠ t̪ˠ oː ɾʲ
déantóir	dʲ æː n̪ˠ t̪ˠ ɔ ɾʲ
déardaoin	dʲ eː ɾˠ d̪ˠ iː nʲ
déarfadh	dʲ eː ɾˠ h u
déarfadh	dʲ eː ɾˠ h uː
déarfadh	dʲ eː ɾˠ h ə tʲ
déarfadh	dʲ eː ɾˠ h ə x
déin	dʲ eː nʲ
déistin	dʲ eː ʃ tʲ ə nʲ
díbh	dʲ iː bʲ
díbh	dʲ iː vʲ
díbh	d̪ˠ iː bʲ
díbhse	dʲ iː vʲ ʃ ə
díbir	dʲ iː bʲ ə ɾʲ
díbríodh	dʲ iː bʲ ɾʲ i tʲ
díbríodh	dʲ iː bʲ ɾʲ i w
díbríodh	dʲ iː bʲ ɾʲ iː tʲ
díbríodh	dʲ iː bʲ ɾʲ iː vˠ
díbríodh	dʲ iː bʲ ɾʲ iː w
díbríodh	dʲ iː bʲ ɾʲ iː x
díbríodh	dʲ iː bʲ ɾʲ iː ɡ
dícheall	dʲ iː h ə l̪ˠ
dícheall	dʲ iː ç ə l̪ˠ
díleas	dʲ iː lʲ ə sˠ
dílis	dʲ iː lʲ ə ʃ
dílse	dʲ iː l̠ʲ ʃ ə
dínn	dʲ iː n̠ʲ
dínn	d̪ˠ iː n̠ʲ
dínne	dʲ iː n̠ʲ ə
dínnéar	dʲ iː n̠ʲ eː ɾˠ
díobh	dʲ iː bˠ
díobh	d̪ˠ iː bˠ
díobhsan	dʲ iː pˠ sˠ ə n
díograis	dʲ iː ɡ ɾˠ ə ʃ
díograiseach	dʲ iː ɡ ɾˠ ə ʃ ə x
díol	dʲ i ə l̪ˠ
díol	dʲ iː lˠ
díolann	dʲ iː lˠ ə n̪ˠ
díom	dʲ iː mˠ
díom	d̪ˠ iː mˠ
díomsa	dʲ iː mˠ sˠ ə
díomá	dʲ iː mˠ vˠ ɑː
díomá	dʲ iː mˠ æ
díomá	dʲ iː mˠ ɑː
díon	dʲ iː nˠ
díot	dʲ iː t̪ˠ
díot	d̪ˠ iː t̪ˠ
díotsa	dʲ iː t̪ˠ sˠ ə
díreach	dʲ iː ɾʲ a h
díreach	dʲ iː ɾʲ ə x
díreacha	dʲ iː ɾʲ a h ə
díreacha	dʲ iː ɾʲ a x ə
díreacha	dʲ iː ɾʲ ə x ə
dís	dʲ iː ʃ
dó	d̪ˠ oː
dó	d̪ˠ ɔː
dóbair	d̪ˠ oː bˠ ə ɾʲ
dócha	d̪ˠ oː x ə
dócha	d̪ˠ ɔː x ə
dóchas	d̪ˠ oː x ə sˠ
dóchas	d̪ˠ ɔː x ə sˠ
dóibh	d̪ˠ oː bʲ
dóibh	d̪ˠ oː bˠ
dóibh	d̪ˠ oː vʲ
dóibhsean	d̪ˠ oː pˠ sˠ ə n
dóid	d̪ˠ oː dʲ
dóid	d̪ˠ ɔː dʲ
dóigh	d̪ˠ oː
dóigh	d̪ˠ oː ɟ
dólámhach	d̪ˠ oː l̪ˠ ɑː vˠ ə x
dólámhach	d̪ˠ oː l̪ˠ ɑː w ə x
dólámhach	d̪ˠ ɔː l̪ˠ æː w a h
dónall	d̪ˠ oː nˠ ə l̪ˠ
dónall	d̪ˠ uː nˠ ə l̪ˠ
dósan	d̪ˠ oː sˠ ə nˠ
dóthain	d̪ˠ oː h ə nʲ
dóthain	d̪ˠ oː nʲ
dóthain	d̪ˠ ɔ h ə nʲ
dúcha	d̪ˠ uː x ə
dúchas	d̪ˠ uː x ə sˠ
dúid	d̪ˠ uː dʲ
dúide	d̪ˠ uː dʲ ə
dúideanna	d̪ˠ uː dʲ ə n̪ˠ ə
dúigh	d̪ˠ uː j
dúigh	d̪ˠ uː ɟ
dúil	d̪ˠ uː lʲ
dúin	d̪ˠ uː nʲ
dúinn	d̪ˠ uː n̠ʲ
dúinn	d̪ˠ ɪ n̠ʲ
dúinne	d̪ˠ uː n̠ʲ ə
dúirt	d̪ˠ uː ɾʲ tʲ
dúiseacht	d̪ˠ uː ʃ a h t̪ˠ
dúiseacht	d̪ˠ uː ʃ ə x t̪ˠ
dúisigh	d̪ˠ uː ʃ i
dúisigh	d̪ˠ uː ʃ iː
dúisigh	d̪ˠ uː ʃ ə
dúisigh	d̪ˠ uː ʃ ɪ ɟ
dúlamán	d̪ˠ uː lˠ ə mˠ æ nˠ
dúlamán	d̪ˠ uː lˠ ə mˠ ɑː nˠ
dúlamán	d̪ˠ uː l̪ˠ ə mˠ ɑː n̪ˠ
dúlra	d̪ˠ uː lˠ ɾˠ ə
dún	d̪ˠ uː nˠ
dúnfad	d̪ˠ uː nˠ h ə d̪ˠ
dúnmharú	d̪ˠ uː n̪ˠ vˠ a ɾˠ uː
dúntar	d̪ˠ uː n̪ˠ t̪ˠ ə ɾˠ
dúr	d̪ˠ uː ɾˠ
ea	a
eabar	a bˠ ə ɾˠ
each	a x
eachmairt	a x m ə ɾʲ tʲ
eachra	a x ɾˠ ə
eachtra	a x t̪ˠ ɾˠ ə
eadhon	aː n
eadhon	aː ə n
eadraibh	a t̪ˠ ɾˠ iː
eadraibhse	aː t̪ˠ ɾˠ iː ʃ ə
eadrainn	a d̪ˠ ɾˠ ə n̠ʲ
eadrainn	a t̪ˠ ɾˠ ə n̠ʲ
eadrainne	aː t̪ˠ ɾˠ ə n̠ʲ ə
eadáine	a d̪ˠ ɑː n̠ʲ ə
eadáineach	a d̪ˠ oː n ə x
eagar	a ɡ ə ɾˠ
eagla	a ɡ lˠ ə
eagla	a ɡ ə lˠ ə
eagla	aː ɡ l ə
eaglais	a ɡ lˠ ə ʃ
eaglais	a ɡ ə l̪ˠ ə ʃ
eaglais	aː ɡ lˠ ə ʃ
eaglais	ɑː ɡ lˠ ə ʃ
eala	a lˠ ə
ealaín	a lˠ iː nʲ
ealaín	æ l iː n
ealaín	ɑ lˠ ɨ nʲ
eallach	a l̪ˠ ə x
eang	a ŋ
eangach	a ŋ a x
eangach	a ŋ ɡ ə x
earra	a ɾˠ ə
earrach	a ɾˠ a h
earrach	a ɾˠ ə x
earrach	æ ɾˠ ə x
earrach	æː ɾˠ ə x
earrach	ə ɾˠ a x
eascaine	a sˠ k ə nʲ ə
eascann	a sˠ k ə n̪ˠ
eascann	æ sˠ k ə n
easna	ɑ sˠ n̪ˠ ə
easpa	æ s p ə
easpag	æ sˠ pˠ oː ɡ
easpag	æ sˠ pˠ ə ɡ
easpag	ɑ sˠ pˠ ə k
easpaig	a sˠ pˠ ɪ ɟ
eastóinis	a sˠ tˠ oː nʲ ɪ ʃ
easóg	æ sˠ oː ɡ
easóg	ɑ sˠ ɑ ɡ
easóg	ɑ sˠ ɔ ɡ
eatarthu	a t̪ˠ ɾˠ ə bˠ
eatarthu	ɑ t̪ˠ ɾˠ ə pˠ
eatarthusan	aː t̪ˠ ɾˠ ə bˠ sˠ ə nˠ
eich	ɛ ç
eicínt	ə c iː n̠ʲ tʲ
eidheann	eː n̪ˠ
eile	ɛ lʲ ə
eireaball	ɾˠ ɨ bˠ ə l̪ˠ
eisceacht	ə ʃ c a x t̪ˠ
eisceacht	ɛ ʃ c a h t̪ˠ
eisceacht	ɛ ʃ c ə x t̪ˠ
eiscir	ɛ ʃ c ə ɾʲ
eisean	ɛ ʃ ə nˠ
eite	ɛ tʲ ə
eiteog	ɛ tʲ a ɡ
eiteog	ɛ tʲ oː ɡ
eithne	ɛ h nʲ ə
eithne	ɛ nʲ ə
eitil	ɛ tʲ ɪ lʲ
eitleáin	ɛ tʲ ə lʲ æ nʲ
eitleáin	ɛ tʲ ə lʲ ɑː nʲ
eitleán	ɛ tʲ ə lʲ æ nˠ
eitleán	ɛ tʲ ə lʲ ɑː nˠ
eitleán	ɛ tʲ ə lʲ ɑː n̪ˠ
eo	oː
eo	ɔː
eochair	ɔ x ə ɾʲ
eoin	o ɪ n̺
eol	oː lˠ
eol	ɔː lˠ
eolais	oː lˠ ə ʃ
eolais	ɔː lˠ ə ʃ
