'ad	a d̪ˠ
'ad	ɑ t̪ˠ
'ad	ɑː t̪ˠ
'adsa	ɑ t̪ˠ sˠ ə
'am	a mˠ
'am	ɑ mˠ
'am	ɑː mˠ
'chuile	x ɪ lʲ ə
'spáin	s pˠ ɑː nʲ
'sé	ʃ eː
'un	ə nˠ
'ur	uː ɾˠ
'ur	ə
a	ə
a'	ə
ab	a bˠ
ab	ə bˠ
abair	a bˠ ə ɾʲ
abairt	a bˠ ə ɾˠ tʲ
abar	a bˠ ə ɾˠ
abartha	a bˠ ə ɾˠ ə
abarthach	a bˠ ə ɾˠ ə x
abcáisis	a bˠ k aː ʃ ɪ ʃ
abhac	a u k
abhac	ɑ u w ə k
abhaill	ə u w ə l̠ʲ
abhainn	oː n̠ʲ
abhainn	ə u nʲ
abhainn	ə u n̠ʲ
abhann	oː n̪ˠ
abhann	ə u n̪ˠ
abhann	ə u ə n̪ˠ
abhras	ə u ɾˠ ə sˠ
abhus	ə vˠ ʊ sˠ
abhus	ə w ʊ sˠ
abraid	a bˠ ɾˠ ə dʲ
abrán	ɑ bˠ ə ɾˠ ɑː n̪ˠ
abú	ə bˠ uː
acadamh	a k ə d̪ˠ u
acadamh	a k ə d̪ˠ uː
acadamh	a k ə d̪ˠ ə vˠ
acais	æ k ə ʃ
acaiseach	æ k ə ʃ ə x
ach	a x
ach	ɑ x
achadh	a x u
achadh	a x uː
achadh	a x ə
achar	a x ə ɾˠ
acht	a x
acht	a x t̪ˠ
acht	ɑ x
acht	ɑ x t̪ˠ
acra	a k ɾˠ ə
acra	ɑ k ɾˠ ə
acu	a k u
acu	a k ə
acu	a k ə bˠ
acu	a pˠ ə k
acu	ɑ k ə bˠ
acu	ə k u
acusan	a k u sˠ ə nˠ
acusan	a k ə pˠ sˠ ə nˠ
acusan	a k ə sˠ ə nˠ
acusan	ɑ k ə pˠ sˠ ə nˠ
acusan	ə k u sˠ ə nˠ
ad	ə d̪ˠ
adhairce	ə i ə ɾʲ c ɪ
adhairce	ə i ɾʲ c ɪ
adhall	ə i ə l̪ˠ
adharc	ə i ə ɾˠ k
adharc	ə i ɾˠ k
adharca	ə i ə ɾˠ k ə
adhlaic	ɑː l̪ˠ ə c
adhlaic	ə i l̪ˠ ə c
adhmad	æː mˠ ə d̪ˠ
adhmad	ɑː mˠ ə d̪ˠ
adhmad	ə i mˠ ə d̪ˠ
adhnaic	ə i n̪ˠ ə c
ae	eː
aeir	eː ɾʲ
aer	eː ɾˠ
aerach	eː ɾˠ a x
aerach	eː ɾˠ ə x
aerfort	eː ɾˠ f ɔ ɾˠ t̪ˠ
aerga	eː ɾˠ ɡ ə
aeráid	eː ɾˠ æ dʲ
aeráid	eː ɾˠ ɑː dʲ
aeróstach	eː ɾˠ oː sˠ t̪ˠ ə x
aeróstach	eː ɾˠ ɔː sˠ t̪ˠ a x
ag	ə
ag	ə ɟ
ag	ə ɡ
ag	ɛ ɟ
ag	ɪ ɟ
ag	ɪ ɟ ə
aga	a ɡ ə
agad	a ɡ ə d̪ˠ
agaibh	a ɡ iː
agaibh	a ɡ ə vʲ
agaibh	ɑ ɡ iː
agaibh	ə ɡ ɪ vʲ
agaibh	ə ɣ ɪ vʲ
agaibhse	a ɡ iː ʃ ə
agaibhse	a ɡ ə vʲ ʃ ə
agaibhse	ɑ ɡ iː ʃ ə
againn	a ɡ ə n̠ʲ
againn	æː n̠ʲ
againn	ə ɡ ɪ nʲ
againn	ə ɣ ɪ nʲ
againne	a ɡ ə n̠ʲ ə
againne	æ n̠ʲ ə
agair	a ɡ ə ɾʲ
agam	a ɡ ə mˠ
agam	ɑ ɡ ə mˠ
agam	ə ɡ ɑ mˠ
agam	ə ɣ ɑ mˠ
agamsa	a mˠ sˠ ə
agamsa	a ɡ ə mˠ sˠ ə
agamsa	ɑ mˠ sˠ ə
agamsa	ɑ ɡ ə mˠ sˠ ə
agamsa	ə ɡ ɑ m s ə
agat	a ɡ ə t̪ˠ
agat	ɑː ɡ ə t̪ˠ
agat	ə ɡ ɑ t̪ˠ
agat	ə ɣ ɑ t̪ˠ
agatsa	ɑ ɡ ə t̪ˠ sˠ ə
agatsa	ə ɡ ɑ t̪ˠ sˠ ə
age	ɛ ɡ ə
aghaidh	ə i
aghaidh	ə i ə
aghaidh	ə i ɟ
agus	a ɡ ə sˠ
agus	ɑ ɡ ə sˠ
agus	ɡ ə sˠ
aibhne	u ə v n̠ʲ ə
aibhne	ə i vʲ n ə
aibhne	ə i vʲ n̠ʲ ə
aibhneacha	a vʲ nʲ ə x ə
aibhneacha	u ə v n̠ʲ ə x ə
aibhneacha	ə i vʲ n ə x ə
aibhneacha	ə i vʲ n̠ʲ ə x iː
aibhneacha	ə i vʲ n̠ʲ ə x ə
aibreán	a bʲ ə ɾʲ ɑː n̪ˠ
aibreán	ɑ bˠ ə ɾˠ ɑː n̪ˠ
aibreán	ə i bʲ ɾʲ ɑː n
aibí	a bʲ ɪ ɟ
aibí	a pˠ i
aibíd	æ bʲ iː dʲ
aice	a c ɪ
aice	ɛ c ɪ
aiceann	a c ə n̪ˠ
aichear	a ç ə ɾˠ
aici	ɛ c iː
aici	ɛ c ɪ
aici	ɪ c ɪ
aicise	ɛ c ɪ ʃ ə
aicme	a c mʲ ə
aidiacht	a dʲ a h t̪ˠ
aidiacht	a dʲ i ə x t̪ˠ
aidmheáil	a dʲ vʲ æ lʲ
aifreann	a fʲ ɾʲ ə n̪ˠ
aifreann	æ fʲ ɾʲ ə n̪ˠ
aifreann	ɪ fʲ ɾʲ ə n̪ˠ
aifreannacha	a fʲ ɾʲ ə n̪ˠ ə x iː
aiféala	a fʲ eː lˠ
aiféala	a fʲ eː lˠ ə
aiféala	a fʲ eː ɾˠ
aiféalach	a fʲ eː l ə x
aige	ɛ ɟ
aige	ɛ ɟ ə
aige	ɪ ɟ ɛ
aiges	ɛ ɟ ɪ sˠ
aigesan	ɛ ɟ ə sˠ ə n
aigesean	ɛ ɟ ə sˠ ə n
aigéan	a ɟ eː nˠ
ail	a lʲ
aill	ɑ i lʲ
aill	ɑː l̠ʲ
aill	ɑː l̪ˠ
aimhleas	a v l a s
aimhleas	a v l̠ʲ a s
aimhleas	ɑ v l a s
aimhleas	ɑ v l̠ʲ a s
aimsir	a mʲ ʃ ə ɾʲ
aimsir	æ mʲ ʃ ə ɾʲ
aimsir	æː mʲ ʃ ə ɾʲ
aimsire	a mʲ ʃ ə ɾʲ ə
aimsire	æ mʲ ʃ ə ɾʲ ə
aimsire	æː mʲ ʃ ə ɾʲ ə
ainbhios	a n vʲ ə sˠ
ainbhios	æ n ə ʃ
ainbhios	æ n ɪ ʃ
ainbhios	ɛ nʲ ə vʲ ɪ sˠ
aindriú	a nʲ ɾʲ uː
aineolaí	a nʲ oː l iː
aineolaí	a nʲ ɔ l i
aingeal	æ ɲ ɟ ə l
ainm	a nʲ ə mʲ
ainm	æ n ə mʲ
ainm	æ nʲ ə mʲ
ainmhí	a nʲ ə vʲ i
ainmhí	a nʲ ə vʲ iː
ainmneacha	a nʲ ə mʲ nʲ a x ə
ainmneacha	a nʲ ə mʲ nʲ ə x iː
ainmneacha	a nʲ ə mʲ nʲ ə x ə
ainnear	æ n̠ʲ ə ɾˠ
ainneoin	a nʲ oː nʲ
ainneoin	a n̠ʲ oː nʲ
ainneoin	a n̠ʲ ɔ nʲ
ainnir	æ n̠ʲ ə ɾˠ
ainseabhaí	a nʲ ʃ ə w iː
air	a ɾʲ
air	ə ɾʲ
air	ɛ ɾʲ
airc	a ɾʲ c
aird	æː ɾˠ dʲ
aird	ɑː ɾˠ dʲ
airde	a i ɾʲ dʲ ə
airde	iː ɾˠ dʲ ə
airde	æː ɾˠ dʲ ə
airde	ɑː ɾˠ dʲ ə
airde	ʌ ɾˠ dʲ ə
aire	a ɾʲ ə
aire	æ ɾʲ ə
aire	ɑː ɾʲ ə
aireach	æ ɾʲ ə x
aireachtáil	a ɾʲ a x t̪ˠ æ lʲ
aireachtáil	a ɾʲ ə x t̪ˠ ɑː lʲ
aireachtáil	æː ɾʲ ə x t̪ˠ ɑː lʲ
airg	a ɾʲ ɪ ɟ
airgead	a ɾʲ ɪ ɟ ə d̪ˠ
airgead	æ ɾʲ ɪ ɟ ə d̪ˠ
airgid	a ɾʲ ə ɟ ə dʲ
airgid	æ ɾʲ ə ɟ ə dʲ
airgid	æː ɾʲ ə ɟ ə dʲ
airigh	a ɾʲ i
airigh	a ɾʲ iː
airigh	a ɾʲ ə
airigh	a ɾʲ ɪ ɟ
airigh	æ ɾʲ ə
airigh	æː ɾʲ ə
airleacan	ɑː ɾˠ l̠ʲ ə k ə nˠ
airméanach	a ɾʲ ə mʲ eː nˠ ə x
airméin	a ɾʲ ə mʲ eː nʲ
airméinis	a ɾʲ ə mʲ eː nʲ ə ʃ
airne	æː ɾˠ n̠ʲ ə
airne	ɑː ɾˠ n̠ʲ ə
airsean	ɛ ɾʲ s ə n
airsean	ɛ ɾʲ ʃ ə nˠ
airím	a ɾʲ i mˠ
airím	a ɾʲ iː mʲ
airím	æ ɾʲ iː mʲ
airím	æː ɾʲ iː mʲ
aisce	a ʃ c ɪ
aischuir	a ʃ x ɪ rʲ
aiseag	a ʃ ə k
aiseag	a ʃ ə ɡ
aisfhreagar	a sˠ ɾˠ ɪ ɡ ə ɾˠ
aisig	a ʃ ɪ c
aisig	a ʃ ɪ ɟ
aisling	a ʃ lʲ ə nʲ
aisling	a ʃ lʲ ɪ ɲ
aisling	a ʃ l̠ʲ ə n̠ʲ
aiste	a ʃ tʲ ə
aisteach	a ʃ tʲ ə x
aisteach	æ ʃ tʲ ə x
aistear	æ ʃ tʲ ə ɾʲ
aisteoir	a ʃ tʲ oː ɾʲ
aisteoir	a ʃ tʲ ɔ ɾʲ
aisteoir	ə ʃ tʲ oː ɾʲ
aisti	a ʃ tʲ ə
aisti	a ʃ tʲ ɪ
aistise	æ ʃ tʲ ə ʃ ə
aistritheoir	a ʃ tʲ ɾʲ ə h oː ɾʲ
aiséirí	æ ʃ ə i ɾʲ ə
ait	a tʲ
aiteach	a tʲ a x
aiteach	a tʲ ə x
aiteann	æ tʲ ə n̪ˠ
aitheanta	a h ə n̪ˠ t̪ˠ ə
aitheantas	a h ə n̪ˠ t̪ˠ ə sˠ
aithin	a h ə nʲ
aithin	eː h ə n
aithin	æ n
aithin	æ nʲ
aithinne	æ h n̠ʲ ə
aithinne	æ h ə n̠ʲ ə
aithint	a n̠ʲ tʲ
aithis	æ h ə ʃ
aithiseach	æ h ə ʃ ə x
aithne	e h nʲ ə
aithne	æ n ə
aithne	æ n̠ʲ ə
aithne	æː nʲ ə
aithneachtáil	æ nʲ ə x t̪ˠ ɑː lʲ
aithneodh	æ nʲ oː tʲ
aithneodh	æ nʲ oː x
aithnigh	æ nʲ ə
aithním	æ n iː mʲ
aithním	æ nʲ iː mʲ
aithním	æ n̠ʲ iː mʲ
aithníodh	a h nʲ iː fˠ
aithníodh	a h nʲ iː tʲ
aithníodh	a h nʲ iː w
aithníodh	a h nʲ iː x
aithníodh	a h nʲ iː ɡ
aithníodh	æ nʲ iː tʲ
aithníodh	æ nʲ iː vˠ
aithníodh	æ nʲ iː x
aithníonn	a h nʲ iː n̪ˠ
aithníonn	æ nʲ iː n̪ˠ
aithreacha	a h ɾʲ ə x ə
aithreacha	æ h ɾʲ ə x ə
aithreacha	æː ɾʲ ə x iː
aithreachas	a h ə ɾʲ ə x ə sˠ
aithrí	a ɾʲ h iː
aithrí	æ ɾʲ iː
ala	a lˠ ə
alastar	a l̪ˠ ə sˠ t̪ˠ ə ɾˠ
alba	a lˠ ə bˠ ə
albain	a l ə bˠ ə n
albain	a l ə bˠ ə nʲ
alban	a l ə bˠ ə nˠ
alban	n ə h a l ə bˠ ə nˠ
albanach	a lˠ ə bˠ ə n ə x
alga	a lˠ ə ɡ ə
alla	a l̪ˠ ə
allas	a l̪ˠ ə sˠ
alltracha	ɑ l̪ˠ t̪ˠ ɾˠ ə x ə
alltracha	ɑː l̪ˠ t̪ˠ ɾˠ ə x iː
alt	a l̪ˠ t̪ˠ
alta	a l̪ˠ t̪ˠ ə
altadh	a l̪ˠ t̪ˠ u
altadh	a l̪ˠ t̪ˠ uː
altadh	a l̪ˠ t̪ˠ ə
altadh	a l̪ˠ t̪ˠ ə tʲ
altadh	a l̪ˠ t̪ˠ ə vˠ
altadh	a l̪ˠ t̪ˠ ə x
altadh	a l̪ˠ t̪ˠ ə ɡ
altann	a l̪ˠ t̪ˠ ə n̪ˠ
altfadh	a l̪ˠ t̪ˠ u
altfadh	a l̪ˠ t̪ˠ uː
altfadh	a l̪ˠ t̪ˠ ə tʲ
altfadh	a l̪ˠ t̪ˠ ə x
altfaidh	a l̪ˠ t̪ˠ i
altfaidh	a l̪ˠ t̪ˠ iː
altfaidh	a l̪ˠ t̪ˠ ə
altfaidh	a l̪ˠ t̪ˠ ə ɟ
am	a mˠ
am	a u mˠ
am	ɑː mˠ
am	ə mˠ
amach	ə mˠ a x
amadán	a mˠ ə d̪ˠ a nˠ
amadán	a mˠ ə d̪ˠ ɑː nˠ
amadán	ɑ mˠ ə d̪ˠ ɑː nˠ
amaid	a mˠ ə dʲ
amaideach	ɑ mˠ ə dʲ ə x
amaideacha	ɑ m ə dʲ ə x ə
amanna	a mˠ ə n̪ˠ iː
amanna	a mˠ ə n̪ˠ ə
amh	a vˠ
amh	a w
amha	a w ə
amharc	a fˠ ə ɾˠ k
amharc	aː fˠ ɾˠ ə k
amharc	ə u ə ɾˠ k
amharclann	ə u ɾˠ k lˠ ə n̪ˠ
amhlaidh	ɑ v l̪ˠ ə
amhlaidh	ɑ w l̪ˠ ə
amhras	a nˠ vˠ ɾˠ ə sˠ
amhras	a vˠ ɾˠ ə sˠ
amhras	ã vˠ ɾˠ ə sˠ
amhras	ə u ɾˠ ə sˠ
amhras	ə̃ ũ ɾˠ ə sˠ
amhrasach	ɑ n v ɾˠ ə sˠ ə x
amhrasach	ɑ v ɾˠ ə sˠ ə x
amhrasach	ɑ̃ v ɾˠ ə sˠ ə x
amhráin	oː ɾˠ æ nʲ
amhráin	oː ɾˠ ɑː nʲ
amhráin	ə u ɾˠ ɑː nʲ
amhrán	oː ɾˠ a nˠ
amhrán	oː ɾˠ ɑː nˠ
amhrán	ɑː ɾˠ ɑː nˠ
amhrán	ə u ɾˠ ɑː n̪ˠ
amháin	ə vˠ ɑː nʲ
amháin	ə w æː nʲ
amháin	ə w ɑː nʲ
amuigh	ə mˠ ɪ j
amuigh	ə mˠ ɪ ɟ
amuigh	ə mˠ ʊ
amáireach	ə mˠ æː ɾʲ a h
amáireach	ə mˠ ɑː ɾʲ ə x
amú	ə mˠ uː
an	ə
an	ə nˠ
anagheairid	ɑ n ɑ j a ɾʲ ə dʲ
anall	ə n̪ˠ ɑː l̪ˠ
anam	a nˠ ə mˠ
anam	ɑ n ə mˠ
anam	ɑ n̪ˠ ə mˠ
anamacha	a nˠ ə mˠ ə x ə
anamacha	a n̪ˠ ə mˠ ə x iː
anamhaith	ɑ n̪ˠ ə vˠ ɑ h
anamhór	ɑ n̪ˠ ə vˠ u ə ɾˠ
anamnacha	a n̪ˠ ə mˠ n̪ˠ ə x iː
anamnacha	ɑ n ə mˠ n ɑ x ə
anart	ɑ n ə ɾˠ t̪ˠ
ancaire	a ŋ k ə ɾʲ ə
ancaire	ɑ ŋ k ə ɾʲ ə
anchroí	ɑ n x ɾˠ ə
anduine	ɑ n̪ˠ ɪ n ə
aneas	ə n̠ʲ a sˠ
aneas	ə n̠ʲ æ sˠ
anfa	a nˠ ə fˠ ə
anglais	a ŋ ɡ l ə ʃ
anglaise	a ŋ ɡ l ə ʃ ə
aniar	ə n̠ʲ i ə ɾˠ
anmain	a nˠ ə mˠ ə nʲ
ann	a n̪ˠ
ann	a u n̪ˠ
ann	ɑː n̪ˠ
annamh	a n ə vˠ
annamh	a n̪ˠ u
annamh	a n̪ˠ uː
annamh	a n̪ˠ ə
annamh	ɑ n̪ˠ ə
anocht	ə n̪ˠ ɔ x t̪ˠ
anoir	ə n̪ˠ ɛ ɾʲ
anois	ə nʲ ɪ ʃ
anois	ə n̪ˠ ɪ ʃ
anonn	ə n̪ˠ uː n̪ˠ
anraith	a n̪ˠ ɾˠ ə h
anseo	i n̠ʲ ʃ ɔ
anseo	ə nʲ ʃ ɔ
anseo	ə n̪ˠ ʃ ɔ
ansin	ə nʲ ʃ ɪ nʲ
ansin	ə n̪ˠ ʃ ɪ nʲ
anuas	ə n̪ˠ u ə sˠ
anuraidh	ə n̪ˠ ɔ ɾˠ ə
anáil	ə n ɑː l
aníos	ə n̠ʲ iː sˠ
aodh	eː
aodh	iː
aoi	iː
aoibheallach	iː vʲ ə l̪ˠ a h
aoibheallach	iː vʲ ə l̪ˠ ə x
aoibhinn	iː vʲ ə nʲ
aoibhinn	iː vʲ ə n̠ʲ
aoibhinn	iː vʲ ɪ ɲ
aoibhneas	iː vʲ nʲ ə sˠ
aoife	iː fʲ ə
aoine	iː nʲ ə
aoinne	eː nʲ ə
aoire	eː ɾʲ ɪ
aoire	iː ɾʲ ə
aois	iː ʃ
aon	eː nˠ
aon	iː nˠ
aonghas	eː ŋ ɣ ə sˠ
aonghas	æ ŋ ɡ ə sˠ
aonghuthach	eː n̪ˠ ɣ ʊ h a h
aonghuthach	eː n̪ˠ ɣ ʊ h ə x
aonraic	eː n̪ˠ ɾˠ ɪ c
aontaigh	eː n̪ˠ t̪ˠ ɪ ɟ
aontaigh	iː n̪ˠ t̪ˠ i
aontaigh	iː n̪ˠ t̪ˠ iː
aontaigh	iː n̪ˠ t̪ˠ ə
aontaím	eː n̪ˠ t̪ˠ iː mʲ
aontaím	iː n̪ˠ t̪ˠ i mˠ
aontaím	iː n̪ˠ t̪ˠ iː mʲ
aontú	iː n̪ˠ t̪ˠ uː
aosta	eː sˠ t̪ˠ ə
aosta	iː sˠ t̪ˠ ə
apaidh	a pˠ i
ar	ɛ ɾʲ
arabach	a ɾˠ ə bˠ ə x
araon	ə ɾˠ eː nˠ
arbhar	a ɾˠ uː ɾˠ
arbhar	a ɾˠ ə w ə ɾˠ
arbhar	ɑ ɾˠ uː ɾˠ
arc	a ɾˠ k
arcán	a ɾˠ k a nˠ
arcán	a ɾˠ k ɑː nˠ
ard	æː ɾˠ d̪ˠ
ard	ɑː ɾˠ d̪ˠ
arda	ɑː ɾˠ d̪ˠ ə
ardaingeal	ɑː ɾˠ dˠ æ ɲ ɟ ə l
ardchlár	æː ɾˠ d̪ˠ x lˠ æː ɾˠ
ardchlár	ɑː ɾˠ d̪ˠ x lˠ ɑː ɾˠ
ardchlár	ɑː ɾˠ d̪ˠ x l̪ˠ ɑː ɾˠ
ardeaspag	ɑː ɾʲ dʲ æ sˠ pˠ ə ɡ
ardeaspag	ɑː ɾˠ d̪ˠ æ sˠ pˠ ə ɡ
ardghlórach	ɑː ɾˠ d̪ˠ ɣ lˠ oː ɾˠ ə x
ardghlórach	ɑː ɾˠ d̪ˠ ɣ lˠ ɔː ɾˠ a h
ardghlórach	ɑː ɾˠ d̪ˠ ɣ l̪ˠ oː ɾˠ ə x
ardintinneach	ɑː ɾˠ d̪ˠ iː n tʲ ə n̠ʲ ə x
ardrí	ɑː ɾˠ d̪ˠ ɾˠ iː
ardscoil	ɑː ɾˠ d̪ˠ sˠ k ʌ l
argóint	ɑ ɾˠ ɡ oː nʲ tʲ
argóint	ɑ ɾˠ ɡ ɔ nʲ tʲ
arm	a ɾˠ ə mˠ
arm	ɑ ɾˠ ə mˠ
arsa	a ɾˠ sˠ ə
artaire	a ɾˠ t̪ˠ ə ɾʲ ə
arán	a ɾˠ a nˠ
arán	ə ɾˠ ɑː n
arán	ə ɾˠ ɑː n̪ˠ
arán	ɾˠ ɑː n
arán	ɾˠ ɑː nˠ
aréir	ə ɾʲ eː ɾʲ
aríst	ə ɾʲ iː ʃ tʲ
arú	a ɾˠ u
arú	a ɾˠ uː
arú	ə ɾˠ uː
as	a sˠ
as	æ sˠ
as	ɑ sˠ
asaibh	a sˠ i
asaibh	a sˠ iː
asaibh	a sˠ t̪ˠ iː
asaibh	ɑ sˠ iː
asaibh	ɑ sˠ ə vʲ
asaibhse	a sˠ i ʃ ə
asaibhse	a sˠ iː ʃ ə
asaibhse	a sˠ t̪ˠ iː ʃ ə
asaibhse	a sˠ ə vʲ ʃ ə
asaibhse	ɑ sˠ iː ʃ ə
asainn	a sˠ t̪ˠ ə n̠ʲ
asainn	a sˠ ə n̠ʲ
asainn	ɑ sˠ ə nʲ
asainn	ɑ sˠ ə n̠ʲ
asainne	a sˠ ə n̠ʲ ə
asainne	aː sˠ t̪ˠ ə n̠ʲ ə
asainne	aː sˠ ə n̠ʲ ə
asainne	ɑ sˠ ə n̠ʲ ə
asal	a sˠ ə lˠ
asam	a sˠ ə mˠ
asam	ɑ sˠ ə mˠ
asamsa	a sˠ ə mˠ sˠ ə
asamsa	ɑ sˠ ə mˠ sˠ ə
asat	a sˠ t̪ˠ ə d̪ˠ
asat	a sˠ ə d̪ˠ
asat	a sˠ ə t̪ˠ
asat	ɑ sˠ ə t̪ˠ
asatsa	ɑ sˠ ə t̪ˠ sˠ ə
ascaill	a sˠ k ə l̠ʲ
ascaill	a sˠ k ə l̪ˠ
aspal	a sˠ pˠ ə lˠ
aspal	ɑ pˠ sˠ tˠ ə l
astu	a sˠ t̪ˠ ə bˠ
astu	a sˠ t̪ˠ ʊ
astu	ɑ s t ə
astu	ɑ sˠ t̪ˠ ə bˠ
astusan	ɑ sˠ t̪ˠ ə pˠ sˠ ə n
at	a t̪ˠ
at	ɑ t̪ˠ
ata	a t̪ˠ ə
athair	a h ə ɾʲ
athair	æ h ə ɾʲ
athair	æː ɾʲ
athar	a h ə ɾˠ
athar	æ h ə ɾˠ
athar	æ ɾˠ
athfhás	a h ɑː sˠ
athléim	a l eː mʲ
athléim	ɑ l eː mʲ
athraigh	a ɾˠ ə
athraigh	aː ɾˠ ə
athraigh	æ ɾˠ ə
athraigh	ɑ ɾˠ ə
athraithe	a h ɾˠ ɪ h ə
athraithe	a ɾˠ iː
athraím	a ɾˠ iː mʲ
athraím	æ ɾˠ iː mʲ
athraím	ɑ ɾˠ iː mʲ
athróidh	ɑ ɾˠ oː
athrú	a h ɾˠ uː
athrú	aː ɾˠ uː
athrú	ɑ ɾˠ uː
atuirseach	a t̪ˠ ʊ ɾˠ ʃ a h
atuirseach	a t̪ˠ ʊ ɾˠ ʃ ə x
atá	a t̪ˠ æ
atá	a t̪ˠ ɑː
atá	ə t̪ˠ æː
atá	ə t̪ˠ ɑː
aíocht	i ə x t̪ˠ
b'	bʲ
b'	bˠ
b'fhearr	bʲ ɑː ɾˠ
b'fhéidir	bʲ eː dʲ ə ɾʲ
b'éigean	bʲ eː ɟ ə nˠ
b'éigint	bʲ eː ɟ ɪ n̠ʲ tʲ
ba	bˠ a
ba	bˠ ɑ h
ba	bˠ ə
bablóinia	bˠ a bˠ lˠ oː nʲ i ə
bac	bˠ a k
bac	bˠ ɑ k
bacach	bˠ a k a h
bacach	bˠ a k ə x
bacach	bˠ ə k ɑ x
bacacha	bˠ a k a h ə
bacacha	bˠ a k ə x ə
bacacha	bˠ ə k ɑ x ə
bacadh	bˠ a k u
bacadh	bˠ a k uː
bacadh	bˠ a k ə
bacadh	bˠ a k ə tʲ
bacadh	bˠ a k ə vˠ
bacadh	bˠ a k ə x
bacadh	bˠ a k ə ɡ
bacaigh	bˠ a k i
bacaigh	bˠ a k iː
bacaigh	bˠ a k ə
bacaigh	bˠ ɑ k ɪ ɟ
bacaí	bˠ a k i
bacaí	bˠ a k iː
bacaí	bˠ ə k iː
bachlach	bˠ ɑ h ə l̪ˠ ə x
badhb	bˠ ə i bˠ
badhbh	bˠ ə i vˠ
bagún	bˠ a ɡ u nˠ
bagún	bˠ a ɡ uː nˠ
bagún	bˠ ə ɡ uː n̪ˠ
bail	bˠ a lʲ
baile	bˠ a lʲ ə
bailte	bˠ a l̠ʲ tʲ ə
bailteacha	bˠ a l̠ʲ tʲ ə x iː
bain	bˠ a nʲ
bain	bˠ ɪ nʲ
baineann	bˠ ɪ ɾʲ ə n̪ˠ
baineannach	bˠ a nʲ ə nˠ ə x
bainis	b a nʲ ə ʃ
bainne	bˠ a n̠ʲ ə
bainne	bˠ ɑ nʲ ə
bainne	bˠ ɑ ɲ ə
baintreach	bˠ a nʲ tʲ ɾʲ ə x
baisc	bˠ a ʃ c
baist	bˠ a ʃ tʲ
baiste	bˠ a ʃ tʲ ə
baisteadh	bˠ a ʃ tʲ u
baisteadh	bˠ a ʃ tʲ uː
baisteadh	bˠ a ʃ tʲ ə
baisteadh	bˠ a ʃ tʲ ə tʲ
baisteadh	bˠ a ʃ tʲ ə vˠ
baisteadh	bˠ a ʃ tʲ ə x
baisteadh	bˠ a ʃ tʲ ə ɡ
baladh	bˠ a l̪ˠ ə
balbh	bˠ a lˠ ə vˠ
ball	bˠ a l̪ˠ
ball	bˠ ɑː l̪ˠ
ball	bˠ ə u l̪ˠ
balla	bˠ a l̪ˠ ə
balsamach	bˠ a lˠ sˠ ə mˠ a h
balsamach	bˠ a lˠ sˠ ə mˠ ə x
banana	bˠ ə n̪ˠ a n̪ˠ ə
banc	bˠ a ŋ k
banda	bˠ a n̪ˠ d̪ˠ ə
bandach	bˠ a n̪ˠ d̪ˠ a h
bandach	bˠ a n̪ˠ d̪ˠ ə x
bandach	bˠ ɑ n̪ˠ d̪ˠ ə x
banna	bˠ a nˠ ə
banríon	bˠ a nˠ ɾˠ iː nˠ
baois	bˠ iː ʃ
baol	bˠ eː l̪ˠ
baol	bˠ iː lˠ
baoth	bˠ eː
baoth	bˠ iː
bara	bˠ a ɾˠ ə
bard	bˠ æː ɾˠ d̪ˠ
bard	bˠ ɑː ɾˠ d̪ˠ
barda	bˠ æː ɾˠ dˠ ə
barda	bˠ ɑː ɾˠ dˠ ə
bardasach	bˠ æː ɾˠ d̪ˠ ə sˠ a h
bardasach	bˠ ɑː ɾˠ d̪ˠ ə sˠ ə x
barr	bˠ æː ɾˠ
barr	bˠ ɑː ɾˠ
barúlach	bˠ a ɾˠ u lˠ a h
barúlach	bˠ a ɾˠ uː lˠ ə x
barúlach	bˠ a ɾˠ uː l̪ˠ ə x
bas	bˠ a sˠ
bascais	bˠ a sˠ k ə ʃ
bata	bˠ a t̪ˠ ə
beach	bʲ a x
beacha	bʲ a x ə
beachaire	bʲ a x ə ɾʲ ə
beachlann	bʲ a x l ə n̪ˠ
beacht	bʲ a x t̪ˠ
beadh	bʲ ɛ fˠ
beadh	bʲ ɛ tʲ
beadh	bʲ ɛ w
beadh	bʲ ɛ x
beag	bʲ ɔ ɡ
beag	bʲ ɛ ɡ
beag	bʲ ɞ ɡ
beaga	bʲ ɞ ɡ ə
beagán	bʲ ɞ ɡ ɑː nˠ
bealach	bʲ a lˠ a h
bealach	bʲ a lˠ ə x
bealach	bʲ ə l̪ˠ ɑ x
bealtaine	bʲ a l̪ˠ t̪ˠ ə nʲ ə
bealtaine	bʲ ɑː l̪ˠ t̪ˠ ə nʲ ə
bean	bʲ a nˠ
bean	bʲ æː nˠ
beanna	bʲ a n̪ˠ ə
beannacht	bʲ a n̪ˠ a h t̪ˠ
beannacht	bʲ a n̪ˠ ə x t̪ˠ
beannacht	bʲ ə n̪ˠ a x t̪ˠ
bearach	bʲ a ɾˠ a x
bearach	bʲ a ɾˠ ə x
bearna	bʲ ɑː ɾˠ n̪ˠ ə
bearr	bʲ ɑː ɾˠ
bearradh	bʲ a ɾˠ u
bearradh	bʲ a ɾˠ uː
bearradh	bʲ a ɾˠ ə
bearradh	bʲ a ɾˠ ə tʲ
bearradh	bʲ a ɾˠ ə vˠ
bearradh	bʲ a ɾˠ ə x
bearradh	bʲ a ɾˠ ə ɡ
bearradh	bʲ ɑː ɾˠ ə
bearradh	bʲ ɑː ɾˠ ə tʲ
bearradh	bʲ ɑː ɾˠ ə vˠ
bearradh	bʲ ɑː ɾˠ ə x
beart	bʲ a ɾˠ t̪ˠ
beas	bʲ ɛ sˠ
beas	bʲ ɛ ɪ sˠ
beatha	bʲ a h ə
beich	bʲ ɛ ç
beiche	bʲ ɛ ç ɪ
beid	bʲ ɛ dʲ
beidh	bʲ ɛ j
beidh	bʲ ɛ ɟ
beimid	bʲ ɛ mʲ ə dʲ
beir	bʲ ɛ ɾʲ
beireann	bʲ ɛ ɾʲ ə n̪ˠ
beirid	bʲ ɛ ɾʲ ə dʲ
beiridh	bʲ ɛ ɾʲ iː ɟ
beiridh	bʲ ɛ ɾʲ ɪ ɟ
beirt	bʲ ɛ ɾˠ tʲ
beirtear	bʲ ɛ ɾʲ t ə ɾʲ
beithíoch	bʲ ɛ h i ə h
beithíoch	bʲ ɛ h i ə x
beithíoch	bʲ ɛ i x
beo	bʲ oː
beo	bʲ ɔː
beocha	bʲ oː x ə
beoir	bʲ oː ɾʲ
beorach	bʲ oː ɾˠ ə x
beoracha	bʲ oː ɾˠ ə x ə
beár	bʲ aː ɾˠ
bhain	w a nʲ
bhain	w ɪ nʲ
bharr	bˠ æː ɾˠ
bharr	vˠ ɑː ɾˠ
bharr	wˠ ɑː ɾˠ
bharúil	vˠ ɑ ɾˠ uː lʲ
bharúil	w a ɾˠ u lʲ
bharúil	w a ɾˠ uː lʲ
bheadh	vʲ ɛ fˠ
bheadh	vʲ ɛ tʲ
bheadh	vʲ ɛ w
bheadh	vʲ ɛ x
bheag	vʲ ɔ ɡ
bheag	vʲ ɛ ɡ
bheag	vʲ ɞ ɡ
bhealach	vʲ a lˠ a h
bhealach	vʲ a lˠ ə x
bhealach	vʲ ə l̪ˠ ɑ x
bhean	vʲ æː nˠ
bheas	vʲ ɛ sˠ
bheas	vʲ ɛ ɪ sˠ
bheidh	vʲ ɛ j
bheidh	vʲ ɛ ɟ
bheidís	vʲ ɛ dʲ iː ʃ
bheifeá	vʲ ɛ h ɑː
bheifeá	vʲ ɛ ɑː
bheimid	vʲ ɛ mʲ ə dʲ
bheinn	vʲ ɛ n̠ʲ
bheith	vʲ ɛ
bheo	vʲ oː
bheo	vʲ ɔː
bhfadhb	vˠ ə i bˠ
bhfadhb	w ə i bˠ
bhfaide	w a dʲ ə
bhfaigheann	w æː n̪ˠ
bhfaightear	w a h a ɾˠ
bhfeaca	vʲ a k ə
bhfeadh	vʲ a
bhfeadh	vʲ a w
bhfeadh	vʲ a ɡ
bhfeadh	vʲ æː
bhfear	vʲ a ɾˠ
bhfear	vʲ æ ɾˠ
bhfeiceanna	vʲ ɛ c ə n̪ˠ ə
bhfeirm	vʲ ɛ ɾʲ ə mʲ
bhfeis	vʲ ɛ ʃ
bhfiaradh	vʲ i ə ɾˠ u
bhfiaradh	vʲ i ə ɾˠ uː
bhfiaradh	vʲ i ə ɾˠ ə
bhfiaradh	vʲ i ə ɾˠ ə tʲ
bhfiaradh	vʲ i ə ɾˠ ə vˠ
bhfiaradh	vʲ i ə ɾˠ ə x
bhfiaradh	vʲ i ə ɾˠ ə ɡ
bhfillfeadh	vʲ iː lʲ h ə x
bhfillfir	vʲ iː lʲ h ə rʲ
bhfir	vʲ ɪ ɾʲ
bhfreastalaí	fʲ ɾʲ a sˠ t̪ˠ ə lˠ iː
bhfreastalaíodh	vʲ ɾʲ a sˠ t̪ˠ ə lˠ iː tʲ
bhfreastalaíodh	vʲ ɾʲ a sˠ t̪ˠ ə lˠ iː x
bhfreastalódh	vʲ ɾʲ a sˠ t̪ˠ ə lˠ oː tʲ
bhfreastalódh	vʲ ɾʲ a sˠ t̪ˠ ə lˠ oː x
bhfuair	vˠ u ə ɾʲ
bhfuair	w iː ɾʲ
bhfuair	w u ə ɾʲ
bhfuil	vˠ ɪ lʲ
bhfuil	w ɪ lʲ
bhisigh	vʲ ɪ ʃ i
bhisigh	vʲ ɪ ʃ iː
bhisigh	vʲ ɪ ʃ ə
bhisigh	vʲ ɪ ʃ ɪ ɟ
bhlais	vˠ lˠ a ʃ
bhláthanna	vˠ l̪ˠ ɑː h ə n̪ˠ ə
bhláthanna	w l̪ˠ æ h ə n̪ˠ ə
bhláthanna	w l̪ˠ ɑː h ə n̪ˠ ə
bhláthanna	w l̪ˠ ɑː n̪ˠ iː
bhrasaíl	vˠ ɾˠ a sˠ iː lʲ
bhreab	vʲ ɾʲ a bˠ
bhreoiteacht	vʲ ɾʲ oː tʲ ə x t̪ˠ
bhreoiteacht	vʲ ɾʲ ɔː tʲ a h t̪ˠ
bhris	vʲ ɾʲ ɪ ʃ
bhriseadh	vʲ ɾʲ ɪ ʃ u
bhriseadh	vʲ ɾʲ ɪ ʃ uː
bhriseadh	vʲ ɾʲ ɪ ʃ ə
bhriseadh	vʲ ɾʲ ɪ ʃ ə tʲ
bhriseadh	vʲ ɾʲ ɪ ʃ ə x
bhrisfeadh	vʲ ɾʲ ɪ ʃ u
bhrisfeadh	vʲ ɾʲ ɪ ʃ uː
bhrisfeadh	vʲ ɾʲ ɪ ʃ ə tʲ
bhrisfeadh	vʲ ɾʲ ɪ ʃ ə x
bhrí	vʲ ɾʲ iː
bhríd	vʲ ɾʲ iː dʲ
bhuail	vˠ u ə lʲ
bhuail	w u ə lʲ
bhun	vˠ ʊ nˠ
bhun	w ʊ nˠ
bhun	w ʌ nˠ
bhuntáiste	vˠ ə n̪ˠ t̪ˠ ɑː ʃ tʲ ə
bhuntáiste	wˠ ʊ n̪ˠ t̪ˠ æ ʃ tʲ ə
bhuntáiste	wˠ ʊ n̪ˠ t̪ˠ ɑː ʃ tʲ ə
bhur	mˠ ə ɾˠ
bhur	uː ɾˠ
bhur	ə
bhuí	vˠ iː
bhuí	w iː
bhád	vˠ ɑː d̪ˠ
bhád	w æː d̪ˠ
bhád	w ɑː d̪ˠ
bháis	vˠ ɑː ʃ
bháis	w æː ʃ
bháis	w ɑː ʃ
bhán	vˠ ɑː n̪ˠ
bhán	w æː nˠ
bhán	w ɑː nˠ
bhéarfadh	vʲ eː ɾˠ ə tʲ
bhéarfadh	vʲ eː ɾˠ ə x
bhí	vʲ iː
bhíobhair	vʲ iː w ə ɾʲ
bhíodh	vʲ iː tʲ
bhíodh	vʲ iː w
bhíodh	vʲ iː x
bhíonns	vʲ iː n̪ˠ sˠ
bhíos	vʲ iː sˠ
bhíothadh	vʲ iː uː
bhíothas	vʲ iː h ə sˠ
bhó	vˠ oː
bhó	w oː
bhó	w ɔː
bia	bʲ i ə
biachlár	bʲ i ə x lˠ ɑː ɾˠ
bialann	bʲ iˑ ə l̪ˠ ə n̪ˠ
big	bʲ ɪ ɟ
bile	bʲ ɪ lʲ ə
bileogach	bʲ ə lʲ oː ɡ ə x
bileogach	bʲ ɪ lʲ a ɡ a h
bileogach	bʲ ɪ lʲ oː ɡ ə x
bille	bʲ ɪ lʲ ə
billiún	bʲ i l̠ʲ uː nˠ
billí	bʲ ɪ lʲ iː
binn	bʲ iː nʲ
binn	bʲ ɪ nʲ
binne	bʲ ɪ nʲ ə
binne	bʲ ɪ n̠ʲ ə
binne	bʲ ɪ ɲ ɪ
binse	bʲ iː nʲ ʃ ə
bior	bʲ ɪ ɾ
biorach	bʲ ɪ ɾˠ ɑ x
biorán	b ɾʲ ɑː n̪ˠ
biorán	bʲ ɪ ɾˠ ɑː n̪ˠ
biseach	bʲ ɪ ʃ a h
biseach	bʲ ɪ ʃ a x
biseach	bʲ ɪ ʃ ə x
bisigh	bʲ ɪ ʃ i
bisigh	bʲ ɪ ʃ iː
bisigh	bʲ ɪ ʃ ə
bisigh	bʲ ɪ ʃ ɪ ɟ
bith	bʲ ɪ
bith	bʲ ɪ h
blagaid	bˠ lˠ a ɡ ə dʲ
blais	bˠ lˠ a ʃ
blaosc	bˠ lˠ eː sˠ k
blaosc	bˠ lˠ iː sˠ k
blarna	bˠ lˠ æː ɾˠ n̪ˠ ə
blarna	bˠ lˠ ɑː ɾˠ n̪ˠ ə
blarnan	bˠ lˠ æː ɾˠ n̪ˠ ə nˠ
blarnan	bˠ lˠ ɑː ɾˠ n̪ˠ ə nˠ
blasta	bˠ lˠ a sˠ t̪ˠ ə
bleacht	bʲ lʲ a x t̪ˠ
bliain	bʲ lʲ i ə nʲ
blianta	bʲ lʲ i ə n̪ˠ t̪ˠ ə
bliosán	bʲ lʲ ə sˠ ɑː n̪ˠ
bliosán	bʲ lʲ ɪ sˠ æ nˠ
bliosán	bʲ lʲ ɪ sˠ ɑː nˠ
bláfar	bˠ lˠ æː fˠ ə ɾˠ
bláfar	bˠ lˠ ɑː fˠ ə ɾˠ
bláithche	bˠ lˠ aː i ç ə
blás	b l aː s
blás	b l ɔː s
bláth	bˠ l̪ˠ æː
bláth	bˠ l̪ˠ ɑː
bláthach	bˠ lˠ ɑː x
bláthach	bˠ l̪ˠ ɑː h ə x
bláthanna	bˠ l̪ˠ æ h ə n̪ˠ ə
bláthanna	bˠ l̪ˠ ɑː h ə n̪ˠ ə
bláthanna	bˠ l̪ˠ ɑː n̪ˠ iː
bláthaí	bˠ l ɑ h iː
bláthaí	bˠ l̪ˠ ɑː h iː
bláthmhar	bˠ lˠ æː fˠ ə ɾˠ
bláthmhar	bˠ lˠ ɑː fˠ ə ɾˠ
bocht	bˠ ɔ x t̪ˠ
bocht	bˠ ʌ x t̪ˠ
bod	bˠ ɔ d̪ˠ
bod	bˠ ʌ d̪ˠ
bodach	bˠ ɔ d̪ˠ ə x
bodach	bˠ ʌ d̪ˠ a h
bodhar	bˠ ə u ɾˠ
bodhrán	bˠ oː ɾˠ æ n̪ˠ
bodhrán	bˠ ə u ɾˠ ɑː n̪ˠ
bog	bˠ ɔ ɡ
bog	bˠ ʌ ɡ
boga	bˠ ɔ ɡ ə
bogach	bˠ ɔ ɡ ə x
bogach	bˠ ə ɡ ɑ x
bogach	bˠ ʌ ɡ a h
bogadh	bˠ ɔ ɡ uː
bogadh	bˠ ɔ ɡ ə
bogadh	bˠ ɔ ɡ ə tʲ
bogadh	bˠ ɔ ɡ ə vˠ
bogadh	bˠ ɔ ɡ ə x
bogadh	bˠ ɔ ɡ ə ɡ
bogadh	bˠ ʌ ɡ u
bogadh	bˠ ʌ ɡ ə tʲ
bogearraí	bˠ o ɟ ə ɾˠ iː
bogha	bˠ a u
bogha	bˠ o u
bogha	bˠ oː
boid	bˠ ɪ dʲ
boig	bˠ ɪ ɟ
boireannach	bˠ ɛ ɾʲ ə n̪ˠ a h
boireannach	bˠ ɛ ɾʲ ə n̪ˠ ə x
bolcáin	b ɔ lˠ k æ nʲ
bolcáin	b ɔ lˠ k ɑː nʲ
bolcáin	b ə l̪ˠ k ɑː nʲ
bolcán	b ɔ lˠ k æ nˠ
bolcán	b ɔ lˠ k ɑː nˠ
bolcán	b ə l̪ˠ k ɑː n̪ˠ
bolg	bˠ ɔ l ə k
bolg	bˠ ɔ lˠ ə ɡ
bomaite	bˠ ʌ mˠ ə tʲ ə
bonnán	bˠ u n̪ˠ ɑː n̪ˠ
borb	bˠ a ɾˠ ə bˠ
borb	bˠ ɔ ɾˠ ə bˠ
bord	bˠ oː ɾˠ d̪ˠ
bord	bˠ ə u ɾˠ d̪ˠ
both	bˠ ɔ
both	bˠ ɔ h
bpianadh	bʲ i ə nˠ u
bpianadh	bʲ i ə nˠ uː
bpianadh	bʲ i ə nˠ ə
bpianadh	bʲ i ə nˠ ə tʲ
bpianadh	bʲ i ə nˠ ə vˠ
bpianadh	bʲ i ə nˠ ə x
bpianadh	bʲ i ə nˠ ə ɡ
bpáipéar	bˠ aː pʲ eː ɾˠ
bpáipéar	bˠ æː pʲ e ɾˠ
bpáipéar	bˠ ɑː pʲ eː ɾˠ
bpáistí	bˠ æː ʃ tʲ i
bpáistí	bˠ ɑː ʃ tʲ iː
bpéin	bʲ eː nʲ
bpósfadh	bˠ oː sˠ uː
bpósfadh	bˠ oː sˠ ə tʲ
bpósfadh	bˠ oː sˠ ə x
bpósfadh	bˠ ɔː sˠ u
bpósfadh	bˠ ɔː sˠ ə tʲ
brachán	bˠ ɾˠ a h a nˠ
brachán	bˠ ɾˠ a x ɑː nˠ
brachán	bˠ ɾˠ ə x ɑː nˠ
brad	bˠ ɾˠ a d̪ˠ
bradach	bˠ ɾˠ a d̪ˠ a h
bradach	bˠ ɾˠ a d̪ˠ ə x
bradach	bˠ ɾˠ ɑ d̪ˠ ə x
bradán	bˠ ɾˠ a d̪ˠ aː nˠ
bradán	bˠ ɾˠ ɑ d̪ˠ ɑ nˠ
bradán	bˠ ɾˠ ə d̪ˠ aː n̪ˠ
braillín	bˠ ɑ ɾʲ lʲ iː nʲ
braillín	bˠ ɾˠ ɑː l̠ʲ iː nʲ
braith	bˠ ɾˠ a
braon	bˠ ɾˠ eː n̪ˠ
braon	bˠ ɾˠ iː nˠ
brasaíl	bˠ ɾˠ a sˠ iː lʲ
brata	bˠ ɾˠ a t̪ˠ ə
bratach	bˠ ɾˠ a t̪ˠ a h
bratach	bˠ ɾˠ a t̪ˠ ə x
brath	bˠ ɾˠ a
breab	bʲ ɾʲ a bˠ
breabadh	bʲ ɾʲ a bˠ u
breabadh	bʲ ɾʲ a bˠ uː
breabadh	bʲ ɾʲ a bˠ ə
breabadh	bʲ ɾʲ a bˠ ə tʲ
breabadh	bʲ ɾʲ a bˠ ə vˠ
breabadh	bʲ ɾʲ a bˠ ə x
breabadh	bʲ ɾʲ a bˠ ə ɡ
breac	bʲ ɾʲ a k
breaca	bʲ ɾʲ a k ə
breathnaigh	bˠ ɾˠ æː n̪ˠ ə
breathnú	bˠ ɾˠ æː n̪ˠ uː
breatnach	bʲ ɾʲ a n̪ˠ a h
breatnach	bʲ ɾʲ a n̪ˠ ə x
breatnach	bʲ ɾʲ ə n̪ˠ a x
breis	bʲ ɾʲ ɛ ʃ
breith	bʲ ɾʲ ɛ
breithiúnais	bʲ ɾʲ ə h uː n̪ˠ ə ʃ
breithiúnais	bʲ ɾʲ ɛ h u nˠ ə ʃ
breithiúnais	bʲ ɾʲ ɛ h uː nˠ ə ʃ
breithiúnas	bʲ ɾʲ ə h uː n̪ˠ ə sˠ
breithiúnas	bʲ ɾʲ ɛ h u nˠ ə sˠ
breithiúnas	bʲ ɾʲ ɛ h uː nˠ ə sˠ
breo	bʲ ɾʲ oː
breo	bʲ ɾʲ ɔː
breoite	bʲ ɾʲ oː tʲ ə
breoite	bʲ ɾʲ ɔː tʲ ə
breoiteacht	bʲ ɾʲ oː tʲ ə x t̪ˠ
breoiteacht	bʲ ɾʲ ɔː tʲ a h t̪ˠ
breá	bʲ ɾʲ aː
breá	bʲ ɾʲ æː
breá	bʲ ɾʲ ɑː
breácha	bʲ ɾʲ ɑː x ə
briathar	bʲ ɾʲ i ə h ə ɾˠ
brice	bʲ ɾʲ ɪ c ɪ
bricfásta	bʲ ɾʲ ɪ c fˠ ɑː sˠ t̪ˠ ə
brionglóid	bʲ ɾʲ ɪ ŋ l̪ˠ oː dʲ
briosca	bʲ ɾʲ ɪ sˠ k ə
bris	bʲ ɾʲ ɪ ʃ
brise	bʲ ɾʲ ɪ ʃ ə
briseadh	bʲ ɾʲ ɪ ʃ u
briseadh	bʲ ɾʲ ɪ ʃ uː
briseadh	bʲ ɾʲ ɪ ʃ ə
briseadh	bʲ ɾʲ ɪ ʃ ə tʲ
briseadh	bʲ ɾʲ ɪ ʃ ə vˠ
briseadh	bʲ ɾʲ ɪ ʃ ə x
briseadh	bʲ ɾʲ ɪ ʃ ə ɡ
briseann	bʲ ɾʲ ɪ ʃ ə n̪ˠ
brisid	bʲ ɾʲ ɪ ʃ ɪ dʲ
briste	bʲ ɾʲ ɪ ʃ tʲ ə
brobh	bˠ ɾˠ o w
brobh	bˠ ɾˠ ɔ vˠ
brobh	bˠ ɾˠ ɔ w
broc	bˠ ɾˠ ɔ k
broc	bˠ ɾˠ ʌ k
brocach	bˠ ɾˠ ɔ k ə x
brocach	bˠ ɾˠ ʌ k a h
broim	bˠ ɾˠ a i mʲ
broim	bˠ ɾˠ iː mʲ
broim	bˠ ɾˠ ɪ mʲ
broinn	bˠ ɾˠ iː n̠ʲ
brollach	bˠ ɾˠ a l̪ˠ a x
brollach	bˠ ɾˠ ɔ l̪ˠ ə x
bromach	bˠ ɾˠ ɔ mˠ ə x
bromach	bˠ ɾˠ ə mˠ ɑ x
bromach	bˠ ɾˠ ɤ mˠ a h
bromach	bˠ ɾˠ ɤ mˠ a x
bromach	bˠ ɾˠ ʊ mˠ ə x
bronn	bˠ ɾˠ ʌ n̪ˠ
bruach	bˠ ɾˠ u ə x
bruith	bˠ ɾˠ ʊ
bruscar	bˠ ɾˠ ʊ sˠ k ə ɾˠ
bruth	bˠ ɾˠ ʊ h
bruíon	bˠ ɾˠ iː nˠ
brá	bˠ ɾˠ æː
