'ad	ɑ t̪ˠ
'ad	ɑː t̪ˠ
'ad	a d̪ˠ
'adsa	ɑ t̪ˠ sˠ ə
'am	ɑː mˠ
'am	ɑ mˠ
'am	a mˠ
'chuile	x ɪ lʲ ə
'sé	ʃ eː
'spáin	s pˠ ɑː nʲ
'un	ə nˠ
'ur	uː ɾˠ
'ur	ə
á	ɑː
a'	ə
ab	a bˠ
ab	ə bˠ
abair	a bˠ ə ɾʲ
abairt	a bˠ ə ɾˠ tʲ
ábalta	ɑː bˠ ə l̪ˠ t̪ˠ ə
ábalta	æː bˠ ə l̪ˠ t̪ˠ ə
ábaltacht	ɑː bˠ ə l̪ˠ t̪ˠ ə x t̪ˠ
ábaltacht	æː bˠ ə l̪ˠ t̪ˠ a x t̪ˠ
abar	a bˠ ə ɾˠ
abartha	a bˠ ə ɾˠ ə
abarthach	a bˠ ə ɾˠ ə x
abcáisis	a bˠ k aː ʃ ɪ ʃ
abcáisis	a bˠ k aː ʃ ɪ ʃ
abhac	a u k
abhac	ɑ u w ə k
abhaill	ə u w ə l̠ʲ
abhainn	ə u nʲ
abhainn	ə u n̠ʲ
abhainn	oː n̠ʲ
abhann	ə u n̪ˠ
abhann	ə u n̪ˠ
abhann	ə u ə n̪ˠ
abhann	oː n̪ˠ
ábhar	a u ɾˠ
ábhar	ɑː vˠ ə ɾˠ
ábhar	ɑː w ə ɾˠ
ábhar	æː w ə ɾˠ
abhlóir	a u lˠ ɔ ɾʲ
abhras	ə u ɾˠ ə sˠ
abhus	ə vˠ ʊ sˠ
abhus	ə w ʊ sˠ
abraid	a bˠ ɾˠ ə dʲ
abrán	ɑ bˠ ə ɾˠ ɑː n̪ˠ
abú	ə bˠ uː
acadamh	a k ə d̪ˠ ə vˠ
acadamh	a k ə d̪ˠ uː
acadamh	a k ə d̪ˠ u
acais	æ k ə ʃ
acaiseach	æ k ə ʃ ə x
ach	ɑ x
ach	a x
achadh	a x ə
achadh	a x uː
achadh	a x u
achar	a x ə ɾˠ
acht	ɑ x t̪ˠ
acht	a x t̪ˠ
acht	ɑ x
acht	a x
acht	ɑ x t̪ˠ
acht	a x t̪ˠ
acmhainn	a x vˠ ə n̠ʲ
acmhainn	a k uː n̠ʲ
acmhainn	a k u n̠ʲ
acmhainn	a x w ə n̠ʲ
acra	ɑ k ɾˠ ə
acra	a k ɾˠ ə
acsón	a k sˠ oː n̪ˠ
acsón	a k sˠ oː nˠ
acsón	a k sˠ uː nˠ
acsón	a k sˠ ɔː nˠ
acu	a k ə
acu	a k u
acu	ə k u
acu	ɑ k ə bˠ
acu	a k ə bˠ
acu	a pˠ ə k
acusan	a k ə sˠ ə nˠ
acusan	a k u sˠ ə nˠ
acusan	ə k u sˠ ə nˠ
acusan	ɑ k ə pˠ sˠ ə nˠ
acusan	a k ə pˠ sˠ ə nˠ
ad	ə d̪ˠ
adaí	a d̪ˠ i
adaí	ɔ d̪ˠ i
adamh	ɑ d̪ˠ ə vˠ
adamh	æ d̪ˠ ʊ
ádh	ɑː
ádh	æː
adhairce	ə i ɾʲ c ɪ
adhairce	ə i ə ɾʲ c ɪ
adhall	ə i ə l̪ˠ
ádhamh	ɑː vˠ
ádhamh	ɑː w
ádhamh	aː w
adharc	ə i ɾˠ k
adharc	ə i ə ɾˠ k
adharca	ə i ə ɾˠ k ə
adhlaic	ə i l̪ˠ ə c
adhlaic	ɑː l̪ˠ ə c
adhmad	ə i mˠ ə d̪ˠ
adhmad	ɑː mˠ ə d̪ˠ
adhmad	aː mˠ ə d̪ˠ
adhnaic	ə i n̪ˠ ə c
ádhúil	ɑː w ʊ l
ádhúil	ɑː w ə l
ae	eː
aeir	eː ɾʲ
aer	eː ɾˠ
aerach	eː ɾˠ ə x
aerach	eː ɾˠ a x
aeráid	eː ɾˠ ɑː dʲ
aeráid	eː ɾˠ ɑː dʲ
aeráid	eː ɾˠ æ dʲ
aerfort	eː ɾˠ f ɔ ɾˠ t̪ˠ
aerga	eː ɾˠ ɡ ə
aeróstach	eː ɾˠ oː sˠ t̪ˠ ə x
aeróstach	eː ɾˠ oː sˠ t̪ˠ ə x
aeróstach	eː ɾˠ ɔː sˠ t̪ˠ a x
ag	ə
ag	ə ɡ
ag	ə ɟ
ag	ɛ ɟ
ag	ɪ ɟ
ag	ɪ ɟ ə
ag	ɛ ɟ
aga	a ɡ ə
agad	a ɡ ə d̪ˠ
agaibh	a ɡ ə vʲ
agaibh	ə ɡ ɪ vʲ
agaibh	ə ɣ ɪ vʲ
agaibh	ɑ ɡ iː
agaibh	a ɡ iː
agaibhse	a ɡ ə vʲ ʃ ə
agaibhse	ɑ ɡ iː ʃ ə
agaibhse	a ɡ iː ʃ ə
againn	a ɡ ə n̠ʲ
againn	ə ɡ ɪ nʲ
againn	ə ɣ ɪ nʲ
againn	a ɡ ə n̠ʲ
againn	æː n̠ʲ
againne	a ɡ ə n̠ʲ ə
againne	æ n̠ʲ ə
agair	a ɡ ə ɾʲ
agam	a ɡ ə mˠ
agam	ə ɡ ɑ mˠ
agam	ə ɣ ɑ mˠ
agam	ɑ ɡ ə mˠ
agam	a ɡ ə mˠ
agamsa	a ɡ ə mˠ sˠ ə
agamsa	ə ɡ ɑ m s ə
agamsa	ɑ ɡ ə mˠ sˠ ə
agamsa	ɑ mˠ sˠ ə
agamsa	a mˠ sˠ ə
agat	a ɡ ə t̪ˠ
agat	ə ɡ ɑ t̪ˠ
agat	ə ɣ ɑ t̪ˠ
agat	ɑː ɡ ə t̪ˠ
agatsa	ə ɡ ɑ t̪ˠ sˠ ə
agatsa	ɑ ɡ ə t̪ˠ sˠ ə
age	ɛ ɡ ə
aghaidh	ə i ɟ
aghaidh	ə i
aghaidh	a i ə
aghaidh	a i
agus	ɑ ɡ ə sˠ
agus	ɡ ə sˠ
agus	a ɡ ə sˠ
agus	ɡ ə sˠ
aibhne	ə i vʲ n̠ʲ ə
aibhne	ə i vʲ n ə
aibhne	u ə v n̠ʲ ə
aibhneacha	a vʲ nʲ ə x ə
aibhneacha	ə i vʲ n̠ʲ ə x ə
aibhneacha	ə i vʲ n ə x ə
aibhneacha	u ə v n̠ʲ ə x ə
aibhneacha	ə i vʲ n̠ʲ ə x iː
aibí	a bʲ ɪ ɟ
aibí	a pˠ i
aibíd	æ bʲ iː dʲ
aibreán	a bʲ ə ɾʲ ɑː n̪ˠ
aibreán	ɑ bˠ ə ɾˠ ɑː n̪ˠ
aibreán	ə i bʲ ɾʲ ɑː n
aice	a c ɪ
aice	ɛ c ɪ
aiceann	a c ə n̪ˠ
aichear	a ç ə ɾˠ
aici	ɛ c ɪ
aici	ɪ c ɪ
aici	ɛ c ɪ
aici	ɛ c iː
aicise	ɛ c ɪ ʃ ə
aicme	a c mʲ ə
aidhm	ə i mʲ
aidiacht	a dʲ i ə x t̪ˠ
aidiacht	a dʲ i ə x t̪ˠ
aidiacht	a dʲ a h t̪ˠ
aidmheáil	a dʲ vʲ æ lʲ
aiféala	a fʲ eː lˠ ə
aiféala	a fʲ eː ɾˠ
aiféala	a fʲ eː lˠ
aiféalach	a fʲ eː l ə x
aifreann	a fʲ ɾʲ ə n̪ˠ
aifreann	a fʲ ɾʲ ə n̪ˠ
aifreann	ɪ fʲ ɾʲ ə n̪ˠ
aifreann	æ fʲ ɾʲ ə n̪ˠ
aifreannacha	a fʲ ɾʲ ə n̪ˠ ə x iː
aige	ɛ ɟ ə
aige	ɪ ɟ ɛ
aige	ɛ ɟ ə
aige	ɛ ɟ
aigéad	a ɟ eː d̪ˠ
aigéad	a ɟ eː d̪ˠ
aigéad	a ɟ æ d̪ˠ
aigéan	a ɟ eː nˠ
aiges	ɛ ɟ ɪ sˠ
aigesan	ɛ ɟ ə sˠ ə n
aigesean	ɛ ɟ ə sˠ ə n
ail	a lʲ
áil	ɑː lʲ
áil	æː lʲ
aill	ɑ i lʲ
aill	ɑː l̪ˠ
aill	ɑː l̠ʲ
áille	ɑː l̠ʲ ə
áille	æː l̠ʲ ə
ailm	a lʲ ə mʲ
aimhleas	ɑ v l̠ʲ a s
aimhleas	ɑ v l a s
aimhleas	a v l̠ʲ a s
aimhleas	a v l a s
aimsir	a mʲ ʃ ə ɾʲ
aimsir	æ mʲ ʃ ə ɾʲ
aimsir	æː mʲ ʃ ə ɾʲ
aimsire	a mʲ ʃ ə ɾʲ ə
aimsire	æ mʲ ʃ ə ɾʲ ə
aimsire	æː mʲ ʃ ə ɾʲ ə
ainbhios	æ n ə ʃ
ainbhios	æ n ɪ ʃ
ainbhios	a n vʲ ə sˠ
ainbhios	ɛ nʲ ə vʲ ɪ sˠ
aindriú	a nʲ ɾʲ uː
aineolaí	a nʲ oː l iː
aineolaí	a nʲ oː l iː
aineolaí	a nʲ ɔ l i
aingeal	a ɲ ə l
aingeal	a ɲ ɟ ə l
aingeal	æ ɲ ɟ ə l
aingeal	æ ɲ ə l
ainm	a nʲ ə mʲ
ainm	æ n ə mʲ
ainm	æ nʲ ə mʲ
ainmhí	a nʲ ə vʲ iː
ainmhí	a nʲ ə vʲ iː
ainmhí	a nʲ ə vʲ i
ainmneacha	a nʲ ə mʲ nʲ ə x ə
ainmneacha	a nʲ ə mʲ nʲ ə x iː
ainmneacha	a nʲ ə mʲ nʲ a x ə
ainnear	æ n̠ʲ ə ɾˠ
ainneoin	a nʲ oː nʲ
ainneoin	a n̠ʲ oː nʲ
ainneoin	a n̠ʲ ɔ nʲ
ainnir	æ n̠ʲ ə ɾˠ
ainseabhaí	a nʲ ʃ ə w iː
áinsí	aː nʲ ʃ iː
áinsí	aː n̠ʲ ʃ iː
áinsí	æː n̠ʲ ʃ i
áinsíoch	aː nʲ ʃ i ə x
áinsíoch	aː n̠ʲ ʃ i ə x
áinsíoch	æː n̠ʲ ʃ i a x
aíocht	i ə x t̪ˠ
air	a ɾʲ
air	ɛ ɾʲ
air	ə ɾʲ
airc	a ɾʲ c
aird	ɑː ɾˠ dʲ
aird	æː ɾˠ dʲ
airde	ɑː ɾˠ dʲ ə
airde	iː ɾˠ dʲ ə
airde	ɑː ɾˠ dʲ ə
airde	a i ɾʲ dʲ ə
airde	æː ɾˠ dʲ ə
airde	ʌ ɾˠ dʲ ə
aire	a ɾʲ ə
aire	æ ɾʲ ə
aire	a ɾʲ ə
aire	ɑː ɾʲ ə
aireach	æ ɾʲ ə x
aireachtáil	a ɾʲ ə x t̪ˠ ɑː lʲ
aireachtáil	æː ɾʲ ə x t̪ˠ ɑː lʲ
aireachtáil	a ɾʲ ə x t̪ˠ ɑː lʲ
aireachtáil	a ɾʲ a x t̪ˠ æ lʲ
áireamh	ɑː ɾʲ ə vˠ
áireamh	ɑː ɾʲ uː
áireamh	ɑː ɾʲ u
airg	a ɾʲ ɪ ɟ
airgead	a ɾʲ ɪ ɟ ə d̪ˠ
airgead	æ ɾʲ ɪ ɟ ə d̪ˠ
airgeadúla	a ɾʲ ɪ ɟ ə d̪ˠ uː lˠ ə
airgeadúla	a ɾʲ ɪ ɟ ə d̪ˠ uː lˠ ə
airgeadúla	æ ɾʲ ɪ ɟ ə d̪ˠ uː lˠ ə
airgeadúla	æ ɾʲ ɪ ɟ ə d̪ˠ uː lˠ ə
airgeadúla	a ɾʲ ɪ ɟ ə d̪ˠ u lˠ ə
airgid	a ɾʲ ə ɟ ə dʲ
airgid	æ ɾʲ ə ɟ ə dʲ
airgid	æː ɾʲ ə ɟ ə dʲ
áirid	ɑː ɾʲ ə dʲ
áirid	ɡ ə h ɑː ɾʲ ə dʲ
airigh	a ɾʲ ɪ ɟ
airigh	a ɾʲ ə
airigh	æ ɾʲ ə
airigh	æː ɾʲ ə
airigh	a ɾʲ iː
airigh	a ɾʲ i
airím	a ɾʲ iː mʲ
airím	a ɾʲ iː mʲ
airím	æ ɾʲ iː mʲ
airím	a ɾʲ iː mʲ
airím	æː ɾʲ iː mʲ
airím	a ɾʲ i mˠ
áirithe	ɑː ɾʲ ə h ə
áirithe	ɑː ɾʲ iː
áirithe	æː ɾʲ ə h ə
airleacan	ɑː ɾˠ l̠ʲ ə k ə nˠ
airméanach	a ɾʲ ə mʲ eː nˠ ə x
airméin	a ɾʲ ə mʲ eː nʲ
airméinis	a ɾʲ ə mʲ eː nʲ ə ʃ
airne	ɑː ɾˠ n̠ʲ ə
airne	æː ɾˠ n̠ʲ ə
airsean	ɛ ɾʲ ʃ ə nˠ
airsean	ɛ ɾʲ s ə n
aisce	a ʃ c ɪ
aischuir	a ʃ x ɪ rʲ
aiseag	a ʃ ə ɡ
aiseag	a ʃ ə k
aiséirí	æ ʃ ə i ɾʲ ə
aisfhreagar	a sˠ ɾˠ ɪ ɡ ə ɾˠ
aisig	a ʃ ɪ ɟ
aisig	a ʃ ɪ c
áisiúil	aː ʃ uː lʲ
aisling	a ʃ lʲ ɪ ɲ
aisling	a ʃ lʲ ə nʲ
aisling	a ʃ l̠ʲ ə n̠ʲ
aiste	a ʃ tʲ ə
aisteach	æ ʃ tʲ ə x
aisteach	a ʃ tʲ ə x
aistear	æ ʃ tʲ ə ɾʲ
aisteoir	ə ʃ tʲ oː ɾʲ
aisteoir	a ʃ tʲ oː ɾʲ
aisteoir	a ʃ tʲ ɔ ɾʲ
aisti	a ʃ tʲ ɪ
aisti	a ʃ tʲ ə
aisti	a ʃ tʲ ə
aistise	æ ʃ tʲ ə ʃ ə
aistritheoir	a ʃ tʲ ɾʲ ə h oː ɾʲ
ait	a tʲ
áit	ɑː tʲ
áit	æː tʲ
aiteach	a tʲ ə x
aiteach	a tʲ a x
áiteacha	ɑː tʲ ə x iː
aiteann	æ tʲ ə n̪ˠ
áith	ɑː
áith	æː
aitheanta	a h ə n̪ˠ t̪ˠ ə
aitheantas	a h ə n̪ˠ t̪ˠ ə sˠ
aithin	a h ə nʲ
aithin	æ n
aithin	eː h ə n
aithin	æ nʲ
aithinne	æ h ə n̠ʲ ə
aithinne	æ h n̠ʲ ə
aithint	a n̠ʲ tʲ
aithint	a h ə nʲ tʲ
aithis	æ h ə ʃ
aithiseach	æ h ə ʃ ə x
aithne	æ n̠ʲ ə
aithne	æ n ə
aithne	æː nʲ ə
aithne	e h nʲ ə
aithneachtáil	æ nʲ ə x t̪ˠ ɑː lʲ
aithneodh	æ nʲ oː tʲ
aithneodh	æ nʲ oː x
aithnigh	æ nʲ ə
aithním	æ n̠ʲ iː mʲ
aithním	æ n iː mʲ
aithním	æ nʲ iː mʲ
aithníodh	a h nʲ iː ɡ
aithníodh	æ nʲ iː vˠ
aithníodh	a h nʲ iː fˠ
aithníodh	a h nʲ iː w
aithníodh	a h nʲ iː x
aithníodh	æ nʲ iː tʲ
aithníodh	æ nʲ iː x
aithníodh	a h nʲ iː tʲ
aithníodh	a h nʲ iː fˠ
aithníodh	a h nʲ iː tʲ
aithníodh	a h nʲ iː w
aithníonn	a h nʲ iː n̪ˠ
aithníonn	æ nʲ iː n̪ˠ
aithreacha	a h ɾʲ ə x ə
aithreacha	æ h ɾʲ ə x ə
aithreacha	æː ɾʲ ə x iː
aithreachas	a h ə ɾʲ ə x ə sˠ
aithrí	æ ɾʲ iː
aithrí	a ɾʲ h iː
ál	ɑː l̪ˠ
ál	ɑː lˠ
ál	æː lˠ
ala	a lˠ ə
álainn	ɑː l̪ˠ ɪ ɲ
álainn	ɑː l̪ˠ ə nʲ
álainn	ɑː l iː n̠ʲ
álainn	ɑː lˠ ə n̠ʲ
álainn	æː lˠ ə n̠ʲ
alastar	a l̪ˠ ə sˠ t̪ˠ ə ɾˠ
alba	a lˠ ə bˠ ə
albain	a l ə bˠ ə nʲ
albain	a l ə bˠ ə n
alban	a l ə bˠ ə nˠ
albanach	a lˠ ə bˠ ə n ə x
alga	a lˠ ə ɡ ə
alla	a l̪ˠ ə
allas	a l̪ˠ ə sˠ
alltracha	ɑ l̪ˠ t̪ˠ ɾˠ ə x ə
alltracha	ɑː l̪ˠ t̪ˠ ɾˠ ə x iː
alt	a l̪ˠ t̪ˠ
ált	aː l̪ˠ t̪ˠ
alta	a l̪ˠ t̪ˠ ə
altadh	a l̪ˠ t̪ˠ ə
altadh	a l̪ˠ t̪ˠ uː
altadh	a l̪ˠ t̪ˠ u
altadh	a l̪ˠ t̪ˠ ə ɡ
altadh	a l̪ˠ t̪ˠ ə vˠ
altadh	a l̪ˠ t̪ˠ uː
altadh	a l̪ˠ t̪ˠ u
altadh	a l̪ˠ t̪ˠ ə x
altadh	a l̪ˠ t̪ˠ ə tʲ
altadh	a l̪ˠ t̪ˠ ə x
altadh	a l̪ˠ t̪ˠ ə tʲ
altadh	a l̪ˠ t̪ˠ uː
altadh	a l̪ˠ t̪ˠ ə tʲ
altadh	a l̪ˠ t̪ˠ u
altann	a l̪ˠ t̪ˠ ə n̪ˠ
altfadh	a l̪ˠ t̪ˠ ə x
altfadh	a l̪ˠ t̪ˠ ə tʲ
altfadh	a l̪ˠ t̪ˠ ə x
altfadh	a l̪ˠ t̪ˠ ə tʲ
altfadh	a l̪ˠ t̪ˠ uː
altfadh	a l̪ˠ t̪ˠ ə tʲ
altfadh	a l̪ˠ t̪ˠ u
altfaidh	a l̪ˠ t̪ˠ ə
altfaidh	a l̪ˠ t̪ˠ ə ɟ
altfaidh	a l̪ˠ t̪ˠ ə
altfaidh	a l̪ˠ t̪ˠ iː
altfaidh	a l̪ˠ t̪ˠ i
am	a u mˠ
am	ɑː mˠ
am	a mˠ
am	a mˠ
am	ə mˠ
am	ə mˠ
amach	ə mˠ a x
amadán	ɑ mˠ ə d̪ˠ ɑː nˠ
amadán	a mˠ ə d̪ˠ ɑː nˠ
amadán	a mˠ ə d̪ˠ a nˠ
amaid	a mˠ ə dʲ
amaideach	ɑ mˠ ə dʲ ə x
amaideacha	ɑ m ə dʲ ə x ə
amáireach	ə mˠ ɑː ɾʲ ə x
amáireach	ə mˠ æː ɾʲ a h
amanna	a mˠ ə n̪ˠ ə
amanna	a mˠ ə n̪ˠ iː
amárach	ə mˠ ɑː ɾˠ ə x
amárach	ə mˠ aː ɾ a x
amh	a vˠ
amh	a w
amh	a f
amha	a w ə
amháin	ə vˠ ɑː nʲ
amháin	ə w ɑː nʲ
amháin	ə w æː nʲ
amharc	ə u ə ɾˠ k
amharc	a fˠ ə ɾˠ k
amharc	aː fˠ ɾˠ ə k
amharc	ã u w ə ɾˠ k
amharclann	ə u ɾˠ k lˠ ə n̪ˠ
amhlaidh	ɑ v l̪ˠ ə
amhlaidh	ɑ w l̪ˠ ə
amhlánta	a u lˠ a n̪ˠ t̪ˠ ə
amhráin	ə u ɾˠ ɑː nʲ
amhráin	oː ɾˠ ɑː nʲ
amhráin	oː ɾˠ æ nʲ
amhrán	ə u ɾˠ ɑː n̪ˠ
amhrán	oː ɾˠ ɑː nˠ
amhrán	ɑː ɾˠ ɑː nˠ
amhrán	oː ɾˠ ɑː nˠ
amhrán	ɔː ɾˠ a nˠ
amhras	ə u ɾˠ ə sˠ
amhras	ə̃ ũ ɾˠ ə sˠ
amhras	a vˠ ɾˠ ə sˠ
amhras	ã vˠ ɾˠ ə sˠ
amhras	a nˠ vˠ ɾˠ ə sˠ
amhras	ə̃ ũ ɾˠ ə sˠ
amhrasach	ɑ v ɾˠ ə sˠ ə x
amhrasach	ɑ̃ v ɾˠ ə sˠ ə x
amhrasach	ɑ n v ɾˠ ə sˠ ə x
amhscarthanach	a u sˠ k ə ɾˠ n̪ˠ ə x
amparán	a u m pˠ ə ɾˠ ɑː n̪ˠ
amú	ə mˠ uː
amuigh	ə mˠ ɪ ɟ
amuigh	ə mˠ ɪ j
amuigh	ə mˠ ʊ
an	ə nˠ
an	ə
an	ə
an	ə nˠ
án	ɑː n̪ˠ
án	ɑː nˠ
án	æː nˠ
án	eː nˠ
anagheairid	ɑ n ɑ j a ɾʲ ə dʲ
anáil	ə n ɑː l
anall	ə n̪ˠ ɑː l̪ˠ
anall	ə n̪ˠ a l̪ˠ
anall	ə n̪ˠ ɔ l̪ˠ
anam	ɑ n̪ˠ ə mˠ
anam	ɑ n ə mˠ
anam	a nˠ ə mˠ
anamacha	a nˠ ə mˠ ə x ə
anamacha	a n̪ˠ ə mˠ ə x iː
anamhaith	ɑ n̪ˠ ə vˠ ɑ h
anamhór	ɑ n̪ˠ ə vˠ u ə ɾˠ
anamnacha	ɑ n ə mˠ n ɑ x ə
anamnacha	a n̪ˠ ə mˠ n̪ˠ ə x iː
anart	ɑ n ə ɾˠ t̪ˠ
anas	a nˠ ə sˠ
anbhann	a nˠ u n̪ˠ
ancaire	ɑ ŋ k ə ɾʲ ə
ancaire	a ŋ k ə ɾʲ ə
anchroí	ɑ n x ɾˠ ə
anchúinse	a n̪ˠ ə x uː n̠ʲ ʃ ə
anchúinse	a nˠ x uː n̠ʲ ʃ ə
anchúinse	a nˠ x u n̠ʲ ʃ ə
anduine	ɑ n̪ˠ ɪ n ə
aneas	ə n̠ʲ a sˠ
aneas	ə n̠ʲ æ sˠ
anfa	a nˠ ə fˠ ə
anglais	a ŋ ɡ l ə ʃ
anglaise	a ŋ ɡ l ə ʃ ə
aniar	ə n̠ʲ i ə ɾˠ
aníos	ə n̠ʲ iː sˠ
anmain	a nˠ ə mˠ ə nʲ
ann	a u n̪ˠ
ann	ɑː n̪ˠ
ann	a n̪ˠ
annamh	a n ə vˠ
annamh	ɑ n̪ˠ ə
annamh	a n̪ˠ ə
annamh	a n̪ˠ uː
annamh	a n̪ˠ u
anocht	ə n̪ˠ ɔ x t̪ˠ
anoir	ə n̪ˠ ɛ ɾʲ
anóirthear	ə n̪ˠ ɔː ɾˠ i ɾʲ
anois	ə n̪ˠ ɪ ʃ
anois	ə nʲ ɪ ʃ
anonn	ə n̪ˠ uː n̪ˠ
anraith	a n̪ˠ ɾˠ ə h
anraith	aː nˠ ɾˠ ɪ
anró	aː nˠ ɾˠ ɔː
anseo	ə nʲ ʃ ɔ
anseo	ə n̪ˠ ʃ ɔ
anseo	i n̠ʲ ʃ ɔ
ansin	ə nʲ ʃ ɪ nʲ
ansin	ə n̪ˠ ʃ ɪ nʲ
anuas	ə n̪ˠ u ə sˠ
anuraidh	ə n̪ˠ ɔ ɾˠ ə
anuraidh	ə n̪ˠ ɨ̞ ɾˠ i
aodh	eː
aodh	iː
aoi	iː
aoibheallach	iː vʲ ə l̪ˠ ə x
aoibheallach	iː vʲ ə l̪ˠ a h
aoibhinn	iː vʲ ɪ ɲ
aoibhinn	iː vʲ ə nʲ
aoibhinn	iː vʲ ə n̠ʲ
aoibhneas	iː vʲ nʲ ə sˠ
aoife	iː fʲ ə
aoine	iː nʲ ə
aoine	iː nʲ ə
aoinne	eː nʲ ə
aoire	eː ɾʲ ɪ
aoire	iː ɾʲ ə
aois	iː ʃ
aon	iː nˠ
aon	eː nˠ
aon	eː nˠ
aonad	eː nˠ ə d̪ˠ
aonaid	eː nˠ ə dʲ
aonbheannach	eː nˠ vʲ a nˠ ə x
aonbheannach	eː nˠ vʲ ə nˠ a x
aonbheannach	iː nˠ vʲ a nˠ a h
aonghas	eː ŋ ɣ ə sˠ
aonghas	æ ŋ ɡ ə sˠ
aonghuthach	eː n̪ˠ ɣ ʊ h ə x
aonghuthach	eː n̪ˠ ɣ ʊ h a h
aonraic	eː n̪ˠ ɾˠ ɪ c
aontaigh	eː n̪ˠ t̪ˠ ɪ ɟ
aontaigh	iː n̪ˠ t̪ˠ ə
aontaigh	iː n̪ˠ t̪ˠ iː
aontaigh	iː n̪ˠ t̪ˠ i
aontaigh	ɯː n̪ˠ t̪ˠ i
aontaím	eː n̪ˠ t̪ˠ iː mʲ
aontaím	iː n̪ˠ t̪ˠ iː mʲ
aontaím	iː n̪ˠ t̪ˠ i mˠ
aontú	iː n̪ˠ t̪ˠ uː
aosta	eː sˠ t̪ˠ ə
aosta	iː sˠ t̪ˠ ə
apaidh	a pˠ i
ar	ɛ ɾʲ
ár	ɑː ɾˠ
ár	ə ɾˠ
ár	ə
ár	ɑː ɾˠ
ár	æː ɾˠ
ár	ɑː ɾˠ
ár	æː ɾˠ
ára	ɑː ɾˠ ə
arabach	a ɾˠ ə bˠ ə x
árainn	ɑː ɾˠ ə n̠ʲ
arán	ə ɾˠ ɑː n̪ˠ
arán	ə ɾˠ ɑː n
arán	ɾˠ ɑː n
arán	ɾˠ ɑː nˠ
arán	a ɾˠ a nˠ
árannach	ɑː ɾˠ ə n̪ˠ ə x
araon	ə ɾˠ eː nˠ
árasáin	ɑː ɾˠ ə sˠ ɑː nʲ
árasáin	ɑː ɾˠ ə sˠ ɑː nʲ
árasáin	æː ɾˠ ə sˠ æ nʲ
árasán	ɑː ɾˠ ə sˠ ɑː n̪ˠ
árasán	ɑː ɾˠ ə sˠ ɑː nˠ
árasán	æː ɾˠ ə sˠ a nˠ
arbhar	a ɾˠ uː ɾˠ
arbhar	ɑ ɾˠ uː ɾˠ
arbhar	a ɾˠ ə w ə ɾˠ
arc	a ɾˠ k
arcán	a ɾˠ k ɑː nˠ
arcán	a ɾˠ k ɑː nˠ
arcán	a ɾˠ k a nˠ
ard	ɑː ɾˠ d̪ˠ
ard	æː ɾˠ d̪ˠ
arda	ɑː ɾˠ d̪ˠ ə
ardaingeal	ɑː ɾˠ dˠ æ ɲ ɟ ə l
ardchlár	ɑː ɾˠ d̪ˠ x l̪ˠ ɑː ɾˠ
ardchlár	ɑː ɾˠ d̪ˠ x lˠ ɑː ɾˠ
ardchlár	æː ɾˠ d̪ˠ x lˠ æː ɾˠ
ardeaspag	ɑː ɾˠ d̪ˠ æ sˠ pˠ ə ɡ
ardeaspag	ɑː ɾʲ dʲ æ sˠ pˠ ə ɡ
ardghlórach	ɑː ɾˠ d̪ˠ ɣ l̪ˠ oː ɾˠ ə x
ardghlórach	ɑː ɾˠ d̪ˠ ɣ lˠ oː ɾˠ ə x
ardghlórach	ɑː ɾˠ d̪ˠ ɣ lˠ ɔː ɾˠ a h
ardintinneach	ɑː ɾˠ d̪ˠ iː n tʲ ə n̠ʲ ə x
ardrí	ɑː ɾˠ d̪ˠ ɾˠ iː
ardscoil	ɑː ɾˠ d̪ˠ sˠ k ʌ l
ardú	ɑː ɾˠ d̪ˠ uː
ardú	ɑː ɾˠ d̪ˠ uː
ardú	aː ɾˠ d̪ˠ u
aréir	ə ɾʲ eː ɾʲ
argóint	ɑ ɾˠ ɡ oː nʲ tʲ
argóint	ɑ ɾˠ ɡ oː nʲ tʲ
argóint	ɑ ɾˠ ɡ ɔ nʲ tʲ
aríst	ə ɾʲ iː ʃ tʲ
arm	ɑ ɾˠ ə mˠ
arm	a ɾˠ ə mˠ
arsa	a ɾˠ sˠ ə
artaire	a ɾˠ t̪ˠ ə ɾʲ ə
árthach	ɑː ɾˠ h ə x
árthach	ɑː ɾˠ ə x
arú	ə ɾˠ uː
arú	a ɾˠ uː
arú	a ɾˠ u
as	a sˠ
as	ɑ sˠ
as	æ sˠ
as	a sˠ
as	ɑ sˠ
as	æ sˠ
asaibh	ɑ sˠ ə vʲ
asaibh	ɑ sˠ iː
asaibh	a sˠ iː
asaibh	a sˠ t̪ˠ iː
asaibh	a sˠ i
asaibhse	a sˠ ə vʲ ʃ ə
asaibhse	ɑ sˠ iː ʃ ə
asaibhse	a sˠ iː ʃ ə
asaibhse	a sˠ t̪ˠ iː ʃ ə
asaibhse	a sˠ iː ʃ ə
asaibhse	a sˠ i ʃ ə
asainn	a sˠ ə n̠ʲ
asainn	ɑ sˠ ə nʲ
asainn	ɑ sˠ ə n̠ʲ
asainn	a sˠ ə n̠ʲ
asainn	a sˠ t̪ˠ ə n̠ʲ
asainne	a sˠ ə n̠ʲ ə
asainne	ɑ sˠ ə n̠ʲ ə
asainne	aː sˠ ə n̠ʲ ə
asainne	aː sˠ t̪ˠ ə n̠ʲ ə
asal	a sˠ ə lˠ
asam	ɑ sˠ ə mˠ
asam	a sˠ ə mˠ
asamsa	a sˠ ə mˠ sˠ ə
asamsa	ɑ sˠ ə mˠ sˠ ə
asat	a sˠ ə t̪ˠ
asat	ɑ sˠ ə t̪ˠ
asat	a sˠ ə d̪ˠ
asat	a sˠ t̪ˠ ə d̪ˠ
asatsa	ɑ sˠ ə t̪ˠ sˠ ə
ásc	ɑː sˠ k
ásc	æː sˠ k
ascaill	a sˠ k ə l̠ʲ
ascaill	a sˠ k ə l̪ˠ
aspal	a sˠ pˠ ə lˠ
aspal	ɑ pˠ sˠ tˠ ə l
astu	a sˠ t̪ˠ ʊ
astu	ɑ s t ə
astu	ɑ sˠ t̪ˠ ə bˠ
astu	a sˠ t̪ˠ ə bˠ
astusan	ɑ sˠ t̪ˠ ə pˠ sˠ ə n
at	ɑ t̪ˠ
at	a t̪ˠ
ata	a t̪ˠ ə
atá	ə t̪ˠ ɑː
atá	ə t̪ˠ æː
atá	ə t̪ˠ ɑː
atá	a t̪ˠ ɑː
atá	a t̪ˠ æ
áth	ɑː
áth	æː
athair	a h ə ɾʲ
athair	æ h ə ɾʲ
athair	æː ɾʲ
athar	a h ə ɾˠ
athar	æ h ə ɾˠ
athar	æ ɾˠ
áthas	ɑː h ə sˠ
áthas	ɑː sˠ
áthas	æ h ə sˠ
athfhás	a h ɑː sˠ
athléim	a l eː mʲ
athléim	ɑ l eː mʲ
athmhachnamh	a vˠ ɑ x n̪ˠ ə vˠ
athmhachnamh	a wˠ a x n̪ ə
athmhachnamh	a wˠ a x n̪ uː
athmhachnamh	a wˠ a x n̪ u
athraigh	ɑ ɾˠ ə
athraigh	a ɾˠ ə
athraigh	æ ɾˠ ə
athraigh	aː ɾˠ ə
athraím	ɑ ɾˠ iː mʲ
athraím	a ɾˠ iː mʲ
athraím	æ ɾˠ iː mʲ
athraithe	a h ɾˠ ɪ h ə
athraithe	a ɾˠ iː
athróidh	ɑ ɾˠ oː
athrú	a h ɾˠ uː
athrú	ɑ ɾˠ uː
athrú	aː ɾˠ uː
athrú	aː h ɾˠ u
atuirseach	a t̪ˠ ʊ ɾˠ ʃ ə x
atuirseach	a t̪ˠ ʊ ɾˠ ʃ a h
b'	bˠ
b'	bʲ
b'éigean	bʲ eː ɟ ə nˠ
b'éigint	bʲ eː ɟ ɪ n̠ʲ tʲ
b'fhearr	bʲ ɑː ɾˠ
b'fhéidir	bʲ eː dʲ ə ɾʲ
ba	bˠ a
ba	bˠ ɑ h
ba	bˠ ə
bablóinia	bˠ a bˠ lˠ oː nʲ i ə
bac	bˠ ɑ k
bac	bˠ a k
bacach	bˠ ə k ɑ x
bacach	bˠ a k ə x
bacach	bˠ a k a h
bacacha	bˠ ə k ɑ x ə
bacacha	bˠ a k ə x ə
bacacha	bˠ a k a h ə
bacadh	bˠ a k ə
bacadh	bˠ a k uː
bacadh	bˠ a k u
bacadh	bˠ a k ə ɡ
bacadh	bˠ a k ə vˠ
bacadh	bˠ a k uː
bacadh	bˠ a k u
bacadh	bˠ a k ə x
bacadh	bˠ a k ə tʲ
bacadh	bˠ a k ə x
bacadh	bˠ a k ə tʲ
bacadh	bˠ a k uː
bacadh	bˠ a k ə tʲ
bacadh	bˠ a k u
bacaí	bˠ ə k iː
bacaí	bˠ a k iː
bacaí	bˠ a k i
bacaigh	bˠ ɑ k ɪ ɟ
bacaigh	bˠ a k ə
bacaigh	bˠ a k iː
bacaigh	bˠ a k i
bachlach	bˠ ɑ h ə l̪ˠ ə x
bád	bˠ ɑː d̪ˠ
bád	bˠ æː d̪ˠ
badhb	bˠ ə i bˠ
badhbh	bˠ ə i vˠ
bagún	bˠ ə ɡ uː n̪ˠ
bagún	bˠ a ɡ uː nˠ
bagún	bˠ a ɡ u nˠ
bail	bˠ a lʲ
baile	bˠ a lʲ ə
bailigh	bˠ a lʲ ɪ ɟ
bailigh	bˠ a lʲ ə
bailigh	bˠ a lʲ iː
bailigh	bˠ a lʲ i
bailiúchán	bˠ a lʲ uː x ɑː n̪ˠ
bailiúchán	bˠ a lʲ uː x ɑː nˠ
bailiúchán	bˠ a lʲ u x a nˠ
báille	bˠ ɑː l̠ʲ ə
báille	bˠ æː l̠ʲ iː
bailte	bˠ a l̠ʲ tʲ ə
bailteacha	bˠ a l̠ʲ tʲ ə x iː
bain	bˠ a nʲ
bain	bˠ ɪ nʲ
báine	bˠ ɑː nʲ ə
báine	bˠ æː nʲ ə
baineann	bˠ ɪ ɾʲ ə n̪ˠ
baineannach	bˠ a nʲ ə nˠ ə x
báinín	bˠ ɑː nʲ iː nʲ
báinín	bˠ ɑː nʲ iː nʲ
báinín	bˠ æː nʲ i nʲ
bainis	b a nʲ ə ʃ
bainne	bˠ ɑ ɲ ə
bainne	bˠ ɑ nʲ ə
bainne	bˠ a n̠ʲ ə
baintreach	bˠ a nʲ tʲ ɾʲ ə x
báire	bˠ ɑː ɾʲ ə
báire	bˠ æː ɾʲ ə
bairéad	bˠ a ɾʲ eː d̪ˠ
bairéad	bˠ a ɾʲ eː d̪ˠ
bairéad	bʲ a ɾˠ a d̪ˠ
báis	bˠ ɑː ʃ
báis	bˠ æː ʃ
baisc	bˠ a ʃ c
báisín	bˠ ɑː ʃ iː nʲ
báisín	bˠ ɑː ʃ iː nʲ
báisín	bˠ æː ʃ i nʲ
baist	bˠ a ʃ tʲ
baiste	bˠ a ʃ tʲ ə
báisteach	bˠ ɑː ʃ tʲ ə x
báisteach	bˠ æː ʃ tʲ a h
baisteadh	bˠ a ʃ tʲ ə
baisteadh	bˠ a ʃ tʲ uː
baisteadh	bˠ a ʃ tʲ u
baisteadh	bˠ a ʃ tʲ ə ɡ
baisteadh	bˠ a ʃ tʲ ə vˠ
baisteadh	bˠ a ʃ tʲ uː
baisteadh	bˠ a ʃ tʲ u
baisteadh	bˠ a ʃ tʲ ə x
baisteadh	bˠ a ʃ tʲ ə tʲ
baisteadh	bˠ a ʃ tʲ ə x
baisteadh	bˠ a ʃ tʲ ə tʲ
baisteadh	bˠ a ʃ tʲ uː
baisteadh	bˠ a ʃ tʲ ə tʲ
baisteadh	bˠ a ʃ tʲ u
báite	bˠ ɑː tʲ ə
báite	bˠ æː tʲ ə
bál	bˠ ɑː lˠ
bál	bˠ æː lˠ
baladh	bˠ a l̪ˠ ə
balbh	bˠ a lˠ ə vˠ
balbh	bˠ ɔ lˠ u
balc	bˠ a lˠ k
balc	bˠ ɔ lˠ k
ball	bˠ ə u l̪ˠ
ball	bˠ ɑː l̪ˠ
ball	bˠ a l̪ˠ
ball	bˠ a l̪ˠ
balla	bˠ a l̪ˠ ə
balsamach	bˠ a lˠ sˠ ə mˠ ə x
balsamach	bˠ a lˠ sˠ ə mˠ a h
banana	bˠ ə n̪ˠ a n̪ˠ ə
banbh	bˠ a nˠ ə vˠ
banc	bˠ a ŋ k
banda	bˠ a n̪ˠ d̪ˠ ə
bandach	bˠ ɑ n̪ˠ d̪ˠ ə x
bandach	bˠ a n̪ˠ d̪ˠ ə x
bandach	bˠ a n̪ˠ d̪ˠ a h
bándearg	bˠ ɑː nˠ dʲ a ɾˠ ə ɡ
banna	bˠ a nˠ ə
banríon	bˠ a nˠ ɾˠ iː nˠ
banríon	bˠ aː nˠ ɾˠ iː nˠ
baois	bˠ iː ʃ
baol	bˠ eː l̪ˠ
baol	bˠ iː lˠ
baol	bˠ iː lˠ
baol	bˠ ɯː lˠ
baoth	bˠ eː
baoth	bˠ iː
baoth	bˠ iː
baoth	bˠ ɯː
bara	bˠ a ɾˠ ə
bard	bˠ ɑː ɾˠ d̪ˠ
bard	bˠ æː ɾˠ d̪ˠ
barda	bˠ ɑː ɾˠ dˠ ə
barda	bˠ æː ɾˠ dˠ ə
bardasach	bˠ ɑː ɾˠ d̪ˠ ə sˠ ə x
bardasach	bˠ æː ɾˠ d̪ˠ ə sˠ a h
barr	bˠ ɑː ɾˠ
barr	bˠ aː ɾˠ
barraíocht	bˠ ɔ ɾˠ i a x t̪ˠ
barrchith	bˠ ɑː ɾˠ ç ɪ h
barrchith	bˠ ɑː ɾˠ ç ɪ
barrchith	bˠ aː ɾˠ ç ɪ ç
barrchith	bˠ a ɾˠ ç ɪ ç
barriall	bˠ ɑː ɾˠ i ə l̪ˠ
barriall	bˠ ɑː ɾˠ i ə l̪ˠ
barriall	bˠ aː ɾˠ i ə l̪ˠ
barúlach	bˠ a ɾˠ uː l̪ˠ ə x
barúlach	bˠ a ɾˠ uː lˠ ə x
barúlach	bˠ a ɾˠ u lˠ a h
bas	bˠ a sˠ
bás	bˠ ɑː sˠ
bás	bˠ aː sˠ
bascais	bˠ a sˠ k ə ʃ
bata	bˠ a t̪ˠ ə
báthair	b ɑː h ə ɾʲ
bé	bʲ eː
bé	bʲ eː
beacán	bˠ ɔ k a nˠ
beach	bʲ a x
beacha	bʲ a x ə
beachaire	bʲ a x ə ɾʲ ə
beachlann	bʲ a x l ə n̪ˠ
beachóg	bʲ a x a ɡ
beachóg	bʲ a x ɔ ɡ
beachóige	bʲ a x æ ɟ ɪ
beachóige	bʲ a x ɔ ɟ ɪ
beacht	bʲ a x t̪ˠ
beadh	bʲ ɛ x
beadh	bʲ ɛ tʲ
beadh	bʲ ɛ x
beadh	bʲ ɛ tʲ
beadh	bʲ ɛ fˠ
beadh	bʲ ɛ tʲ
beadh	bʲ ɛ w
beag	bʲ ɔ ɡ
beag	bʲ ɞ ɡ
beag	bʲ ɛ ɡ
beaga	bʲ ɞ ɡ ə
beagán	bʲ ɞ ɡ ɑː nˠ
béal	bʲ i a̯ l̪ˠ
béal	bʲ eː lˠ
béal	bʲ eː l
bealach	bʲ ə l̪ˠ ɑ x
bealach	bʲ a lˠ ə x
bealach	bʲ a lˠ a h
bealtaine	bʲ a l̪ˠ t̪ˠ ə nʲ ə
bealtaine	bʲ ɑː l̪ˠ t̪ˠ ə nʲ ə
beáltaine	bʲ aː l̪ˠ t̪ˠ ə nʲ ə
bean	bʲ a nˠ
bean	bʲ æː nˠ
beanna	bʲ a n̪ˠ ə
beannacht	bʲ ə n̪ˠ a x t̪ˠ
beannacht	bʲ a n̪ˠ ə x t̪ˠ
beannacht	bʲ a n̪ˠ a h t̪ˠ
beannú	bʲ a n̪ˠ uː
beannú	bʲ a n̪ˠ uː
beannú	bʲ a n̪ˠ u
beár	bʲ aː ɾˠ
bearach	bʲ a ɾˠ ə x
bearach	bʲ a ɾˠ a x
béarla	bʲ eː ɾˠ l̪ˠ ə
béarla	bʲ eː ɾˠ l̪ˠ ə
béarlach	bʲ eː ɾˠ l̪ˠ ə x
béarlach	bʲ eː ɾˠ l̪ˠ a x
béarlóireacht	bʲ eː ɾˠ l̪ˠ oː ɾʲ ə x t̪ˠ
béarlóireacht	bʲ eː ɾˠ l̪ˠ oː ɾʲ ə x t̪ˠ
béarlóireacht	bʲ eː ɾˠ l̪ˠ ɔ ɾʲ a h t̪ˠ
bearn	bʲ aː ɾˠ n̪ˠ
bearna	bʲ ɑː ɾˠ n̪ˠ ə
bearr	bʲ ɑː ɾˠ
bearr	bʲ aː ɾˠ
bearradh	bʲ a ɾˠ ə
bearradh	bʲ a ɾˠ ə
bearradh	bʲ ɑː ɾˠ ə
bearradh	bʲ a ɾˠ uː
bearradh	bʲ a ɾˠ u
bearradh	bʲ a ɾˠ ə ɡ
bearradh	bʲ a ɾˠ ə vˠ
bearradh	bʲ ɑː ɾˠ ə vˠ
bearradh	bʲ a ɾˠ uː
bearradh	bʲ a ɾˠ u
bearradh	bʲ a ɾˠ ə x
bearradh	bʲ a ɾˠ ə tʲ
bearradh	bʲ ɑː ɾˠ ə tʲ
bearradh	bʲ a ɾˠ ə x
bearradh	bʲ ɑː ɾˠ ə x
bearradh	bʲ a ɾˠ ə tʲ
bearradh	bʲ a ɾˠ uː
bearradh	bʲ a ɾˠ ə tʲ
bearradh	bʲ a ɾˠ u
bearrtha	bʲ ɑː ɾˠ h ə
bearrtha	bʲ aː ɾˠ h ə
beart	bʲ a ɾˠ t̪ˠ
beas	bʲ ɛ ɪ sˠ
beas	bʲ ɛ sˠ
béas	bʲ eː sˠ
beatha	bʲ a h ə
beathach	bʲ aː x
beathaigh	bʲ a h i
beathaisnéisí	bʲ a h ɑ ʃ nʲ eː ʃ iː
beathaisnéisí	bʲ æ h ɑ ʃ nʲ eː ʃ iː
beathaisnéisí	bʲ æ h ɑ ʃ nʲ eː ʃ iː
béic	bʲ eː c
beich	bʲ ɛ ç
beiche	bʲ ɛ ç ɪ
beid	bʲ ɛ dʲ
beidh	bʲ ɛ ɟ
beidh	bʲ ɛ j
beidh	bʲ ə i
beidh	bʲ ɛ j
béile	bʲ eː lʲ ə
béim	bʲ eː mʲ
beimid	bʲ ɛ mʲ ə dʲ
beir	bʲ ɛ ɾʲ
beireann	bʲ ɛ ɾʲ ə n̪ˠ
beirid	bʲ ɛ ɾʲ ə dʲ
beiridh	bʲ ɛ ɾʲ ɪ ɟ
beiridh	bʲ ɛ ɾʲ iː ɟ
beirt	bʲ ɛ ɾˠ tʲ
beirtear	bʲ ɛ ɾʲ t ə ɾʲ
beithígh	bʲ ɛ h iː ɟ
beithígh	bʲ ɛ h iː
beithígh	bʲ ɛ i
beithígh	bʲ a h i
beithíoch	bʲ ɛ h i ə x
beithíoch	bʲ ɛ h i ə x
beithíoch	bʲ ɛ i x
beithíoch	bʲ aː x
beo	bʲ oː
beo	bʲ ɔː
beocha	bʲ oː x ə
beoir	bʲ oː ɾʲ
beola	bʲ oː l̪ˠ ə
beola	bʲ oː lˠ ə
beola	bʲ ɔː lˠ ə
beorach	bʲ oː ɾˠ ə x
beoracha	bʲ oː ɾˠ ə x ə
bhád	vˠ ɑː d̪ˠ
bhád	w ɑː d̪ˠ
bhád	w æː d̪ˠ
bhain	w a nʲ
bhain	w ɪ nʲ
bháis	vˠ ɑː ʃ
bháis	w ɑː ʃ
bháis	w æː ʃ
bhán	vˠ ɑː n̪ˠ
bhán	w ɑː nˠ
bhán	w æː nˠ
bharr	vˠ ɑː ɾˠ
bharr	wˠ ɑː ɾˠ
bharr	bˠ æː ɾˠ
bharúil	vˠ ɑ ɾˠ uː lʲ
bharúil	w a ɾˠ uː lʲ
bharúil	w a ɾˠ u lʲ
bheadh	vʲ ɛ x
bheadh	vʲ ɛ tʲ
bheadh	vʲ ɛ x
bheadh	vʲ ɛ tʲ
bheadh	vʲ ɛ fˠ
bheadh	vʲ ɛ tʲ
bheadh	vʲ ɛ w
bheag	vʲ ɔ ɡ
bheag	vʲ ɞ ɡ
bheag	vʲ ɛ ɡ
bhealach	vʲ ə l̪ˠ ɑ x
bhealach	vʲ a lˠ ə x
bhealach	vʲ a lˠ a h
bhean	vʲ æː nˠ
bhéarfadh	vʲ eː ɾˠ ə tʲ
bhéarfadh	vʲ eː ɾˠ ə x
bhearr	vʲ ɑː ɾˠ
bhearr	vʲ aː ɾˠ
bheas	vʲ ɛ ɪ sˠ
bheas	vʲ ɛ sˠ
bheatha	vʲ a h ə
bheidh	vʲ ɛ ɟ
bheidh	vʲ ɛ j
bheidís	vʲ ɛ dʲ iː ʃ
bheifeá	vʲ ɛ h ɑː
bheifeá	vʲ ɛ ɑː
bheimid	vʲ ɛ mʲ ə dʲ
bheinn	vʲ ɛ n̠ʲ
bheith	vʲ ɛ
bheo	vʲ oː
bheo	vʲ ɔː
bhfaca	vˠ ɑ k ə
bhfaca	w ɑ k ə
bhfaca	w a k ə
bhfaca	w a k ə
bhfaca	w ɔ k ə
bhfadhb	vˠ ə i bˠ
bhfadhb	w ə i bˠ
bhfaide	w a dʲ ə
bhfaigheann	w æː n̪ˠ
bhfaightear	w a h a ɾˠ
bhfeaca	vʲ a k ə
bhfeadh	vʲ a ɡ
bhfeadh	vʲ a
bhfeadh	vʲ æː
bhfeadh	vʲ a w
bhfear	vʲ a ɾˠ
bhfear	vʲ æ ɾˠ
bhfeice	vʲ ɛ c ɪ
bhfeiceanna	vʲ ɛ c ə n̪ˠ ə
bhfeirm	vʲ ɛ ɾʲ ə mʲ
bhfeis	vʲ ɛ ʃ
bhfiaradh	vʲ i ə ɾˠ ə
