'ad	ɑ t̪ˠ
eachtra	a x t̪ˠ ɾˠ ə
éad	eː d̪ˠ
éadach	i a̯ d̪ˠ ə x
éadach	eː d̪ˠ ə x
éadach	eː d̪ˠ a h
eadáine	a d̪ˠ ɑː n̠ʲ ə
eadáineach	a d̪ˠ oː n ə x
éadálach	i a̯ d̪ˠ ɑː l̪ˠ ə x
éadálach	eː d̪ˠ ɑː lˠ ə x
éadálach	eː d̪ˠ aː lˠ a x
éadan	eː d̪ˠ ə nˠ
eadhon	aː n
eadhon	aː ə n
éadmhar	ɛ ə d̪ˠ u ɾˠ
éadóchas	i ə d̪ˠ oː x ə s
éadóchas	eː d̪ˠ oː xː ə s
éadóchas	eː d̪ˠ oː h ə s
eadraibh	a t̪ˠ ɾˠ iː
eadraibhse	aː t̪ˠ ɾˠ iː ʃ ə
eadrainn	a d̪ˠ ɾˠ ə n̠ʲ
eadrainn	a t̪ˠ ɾˠ ə n̠ʲ
eadrainne	aː t̪ˠ ɾˠ ə n̠ʲ ə
éadrom	eː d̪ˠ ɾˠ ə mˠ
eagar	a ɡ ə ɾˠ
eagla	a ɡ lˠ ə
eagla	a ɡ ə lˠ ə
eagla	aː ɡ l ə
eaglais	a ɡ ə l̪ˠ ə ʃ
eaglais	aː ɡ lˠ ə ʃ
eaglais	ɑː ɡ lˠ ə ʃ
eaglais	a ɡ lˠ ə ʃ
eala	a lˠ ə
éalaigh	i a l̪ˠ ɪ ɟ
éalaigh	eː lˠ ə
éalaigh	eː lˠ iː
éalaigh	eː lˠ i
ealaín	a lˠ iː nʲ
ealaín	a lˠ iː nʲ
ealaín	æ l iː n
ealaín	ɑ lˠ ɨ nʲ
eallach	a l̪ˠ ə x
eallach	a l̪ˠ a x
éaló	eː l̪ˠ oː
éaló	eː lˠ oː
éaló	ɛ ə lˠ ɔ
éan	eː nˠ
éanacha	eː n̪ˠ ə x iː
eang	a ŋ
eangach	a ŋ ɡ ə x
eangach	a ŋ a x
earra	a ɾˠ ə
earrach	ə ɾˠ a x
earrach	æ ɾˠ ə x
earrach	æː ɾˠ ə x
earrach	a ɾˠ ə x
earrach	a ɾˠ a h
éasca	eː sˠ k ə
eascaine	a sˠ k ə nʲ ə
eascann	a sˠ k ə n̪ˠ
eascann	æ sˠ k ə n
easna	ɑ sˠ n̪ˠ ə
easóg	æ sˠ oː ɡ
easóg	ɑ sˠ ɔ ɡ
easóg	ɑ sˠ ɑ ɡ
easpa	æ s p ə
easpach	a sˠ pˠ ə x
easpach	a sˠ pˠ a x
easpag	æ sˠ pˠ ə ɡ
easpag	æ sˠ pˠ oː ɡ
easpag	ɑ sˠ pˠ ə k
easpaig	a sˠ pˠ ɪ ɟ
eastóinis	a sˠ tˠ oː nʲ ɪ ʃ
eastóinis	a sˠ tˠ oː nʲ ɪ ʃ
éastras	eː sˠ t̪ˠ ɾˠ ə sˠ
eatarthu	ɑ t̪ˠ ɾˠ ə pˠ
eatarthu	a t̪ˠ ɾˠ ə bˠ
eatarthu	a t̪ˠ ə ɾˠ u
eatarthu	ɔ t̪ˠ ə ɾˠ u
eatarthusan	aː t̪ˠ ɾˠ ə bˠ sˠ ə nˠ
eich	ɛ ç
eicínt	ə c iː n̠ʲ tʲ
éide	eː dʲ ə
eidheann	eː n̪ˠ
éidí	eː dʲ iː
éidí	eː dʲ iː
éidí	eː dʲ i
éigean	eː ɟ ə nˠ
éigéille	eː ɟ eː l̠ʲ ə
éigiall	eː ɟ i ə l̪ˠ
éigin	eː ɟ ɪ nʲ
éigint	eː ɟ ɪ n̠ʲ tʲ
eile	ɛ lʲ ə
éinne	a i ɲ ə
éinne	eː nʲ ə
einsímeach	ɛ nʲ ʃ iː mʲ ə x
einsímeach	ɛ n̠ʲ ʃ iː mʲ ə x
einsímeach	ɛ n̠ʲ ʃ iː mʲ a x
éire	eː ɾʲ ə
eireaball	ɾˠ ɨ bˠ ə l̪ˠ
eireaball	ɾˠ ʌ bˠ ə l̪ˠ
éireannach	eː ɾʲ ə n̪ˠ ə x
éireannach	eː ɾʲ ə n̪ˠ a h
éireoidh	ə i ɾʲ oː
éirí	ə i ɾʲ iː
éirí	ə i ɾʲ ə
éirigh	ə i ɾʲ ɪ ɟ
éirigh	ə i ɾʲ iː
éirigh	ə i ɾʲ ə
éirigh	iː ɾʲ i
éirigh	iː ɾʲ iː
éirím	ə i ɾʲ iː mʲ
éirím	ə i ɾʲ iː mʲ
éirím	iː ɾʲ i mˠ
éirinn	eː ɾʲ ə n̠ʲ
éirinn	eː ɾʲ ɪ ɲ
éiríonn	ə i ɾʲ iː n̪ˠ
éiríonn	ə i ɾʲ iː n̪ˠ
éiríonn	iː ɾʲ i n̪ˠ
éis	eː ʃ
eisceacht	ə ʃ c a x t̪ˠ
eisceacht	ɛ ʃ c ə x t̪ˠ
eisceacht	ɛ ʃ c a h t̪ˠ
eiscir	ɛ ʃ c ə ɾʲ
eisean	ɛ ʃ ə nˠ
eisigh	ɛ ʃ ɪ ɟ
eisigh	ɛ ʃ ə
eisigh	ɛ ʃ iː
eisigh	ɛ ʃ i
éist	eː ʃ tʲ
éisteacht	eː ʃ tʲ ə x t̪ˠ
éisteacht	eː ʃ tʲ a h t̪ˠ
eite	ɛ tʲ ə
eiteog	ɛ tʲ oː ɡ
eiteog	ɛ tʲ oː ɡ
eiteog	ɛ tʲ a ɡ
eithne	ɛ nʲ ə
eithne	ɛ h nʲ ə
eitil	ɛ tʲ ɪ lʲ
eitleáin	ɛ tʲ ə lʲ ɑː nʲ
eitleáin	ɛ tʲ ə lʲ ɑː nʲ
eitleáin	ɛ tʲ ə lʲ æ nʲ
eitleán	ɛ tʲ ə lʲ ɑː n̪ˠ
eitleán	ɛ tʲ ə lʲ ɑː nˠ
eitleán	ɛ tʲ ə l̪ˠ ɑː n̪ˠ
eitleán	ɛ tʲ ə l̪ˠ ɑː n̪ˠ
eitleán	ɛ tʲ ə lʲ æ nˠ
eitpheil	ɛ tʲ fʲ ɛ lʲ
eo	oː
eo	ɔː
eochaidh	ɔ x ɪ ɟ
eochaidh	ɔ x iː
eochaidh	ɔ x i
eochair	ɔ x ə ɾʲ
eoghan	oː n̪ˠ
eoghan	oː nˠ
eoghan	ɔː nˠ
eoin	o ɪ n̺
eol	oː lˠ
eol	ɔː lˠ
eolach	oː l̪ˠ ə x
eolach	oː lˠ ə x
eolach	ɔː lˠ a x
eolaíocht	oː lˠ i ə x t̪ˠ
eolais	oː lˠ ə ʃ
eolais	ɔː lˠ ə ʃ
eolas	oː lˠ ə sˠ
eolas	ɔː lˠ ə sˠ
eoraip	oː ɾ ə pʲ
eorna	oː ɾˠ n̪ˠ ə
eorna	ɔː ɾˠ n̪ˠ ə
éscae	eː s k e
fá	fˠ aː
fá	fˠ a
fabht	fˠ ə u t̪ˠ
faca	fˠ a k ə
fachta	fˠ ɑ x t̪ˠ ə
facs	fˠ a k sˠ
fad	fˠ ɑ d̪ˠ
fad	fˠ a d̪ˠ
fada	fˠ ɑ d̪ˠ ə
fada	fˠ a d̪ˠ ə
fadálach	fˠ ə d̪ˠ ɑː l̪ˠ ə x
fadálach	fˠ a d̪ˠ ɑː lˠ ə x
fadálach	fˠ a d̪ˠ a lˠ a x
fadhb	fˠ ə i bˠ
fadhbanna	fˠ ə i bˠ ə n̪ˠ ə
fadó	fˠ a d̪ˠ oː
fadó	fˠ a d̪ˠ ɔː
fadó	fˠ ə d̪ˠ oː
fadó	fˠ a d̪ˠ oː
fadó	fˠ a d̪ˠ ɔ
fág	fˠ ɑː ɡ
fág	fˠ æː ɡ
fága	fˠ ɑː ɡ ə
fága	fˠ æː ɡ ə
fágadh	fˠ ɑː ɡ ə ɡ
fágadh	fˠ ɑː ɡ ə vˠ
fágadh	fˠ ɑː ɡ uː
fágadh	fˠ æː ɡ u
fágadh	fˠ ɑː ɡ ə x
fágadh	fˠ ɑː ɡ ə tʲ
fágadh	fˠ ɑː ɡ ə x
fágadh	fˠ ɑː ɡ ə tʲ
fágadh	fˠ ɑː ɡ uː
fágadh	fˠ æː ɡ ə tʲ
fágadh	fˠ æː ɡ u
fágáil	fˠ ɑː ɡ ɑː lʲ
fágáil	fˠ ɑː ɡ ɑː lʲ
fágáil	fˠ aː ɡ æ lʲ
fágaint	fˠ ɑː ɡ ə nʲ tʲ
fágann	fˠ ɑː ɡ ə n̪ˠ
fágfaidh	fˠ ɑː k ə
fágfaidh	fˠ æː k ə
fágfaidh	fˠ ɑː k ɪ ɟ
fágfaidh	fˠ ɑː k ə
fágfaidh	fˠ ɑː k iː
fágfaidh	fˠ æː k i
fagháilt	fˠ ɑː lʲ tʲ
faghta	fˠ ɑ x t̪ˠ ə
faide	fˠ a dʲ ə
faigh	fˠ ə i
faigh	fˠ a ɟ
faigh	fˠ ɑː
faigh	fˠ æː j
faigheann	fˠ aː n̪ˠ
faightear	fˠ a h a ɾˠ
fail	fˠ a lʲ
fáil	fˠ ɑː lʲ
fáil	fˠ ɑː lʲ
fáil	fˠ æː lʲ
faill	fˠ ɑ i lʲ
fáilt	fˠ ɑː lʲ tʲ
fáilte	fˠ ɑː lʲ tʲ ə
fáilte	fˠ æː lʲ tʲ ə
fáinne	fˠ ɑː ɲ ə
fáinne	fˠ ɑː n̠ʲ ə
fáinne	fˠ æː n̠ʲ ə
faire	fˠ a ɾʲ ə
fairsing	fˠ ɑ ɾˠ ʃ ɪ ɲ
fairsing	fˠ ɑ ɾˠ ʃ ə nʲ
fairsing	fˠ a ɾˠ ʃ ə n̠ʲ
fáisc	fˠ ɑː ʃ c
faisean	fˠ a ʃ ə nˠ
faitíos	fˠ a tʲ i ə sˠ
faitíos	fˠ a tʲ ç iː sˠ
faitíos	fˠ a tʲ ç ə sˠ
faitíos	fˠ aː tʲ i ə sˠ
faitíos	fˠ a tʲ i sˠ
fál	fˠ ɑː lˠ
fál	fˠ ɑː l̪ˠ
falamh	fˠ a l̪ˠ ə
falla	fˠ ɑ l̪ˠ ə
falsa	fˠ a l̪ˠ sˠ ə
fan	fˠ a nˠ
fán	fˠ ɑː n̪ˠ
fán	fˠ æː n̪ˠ
fána	fˠ æː nˠ ə
fánach	fˠ ɑː nˠ ə x
fánach	fˠ æː nˠ a h
fanacht	fˠ ɑ nˠ ə x t̪ˠ
fanacht	fˠ a nˠ ə x t̪ˠ
fanacht	fˠ a nˠ a x t̪ˠ
faobhrach	fˠ eː vˠ ɾˠ ə x
faobhrach	fˠ iː w ɾˠ ə x
faobhrach	fˠ iː w ɾˠ a x
faocha	fˠ eː x ə
faocha	fˠ iː x ə
faoi	fˠ iː
faoileog	fˠ iː lʲ a ɡ
faoin	fˠ iː nʲ
faoina	fˠ iː nˠ ə
faoinar	fˠ iː nˠ ə ɾˠ
faoinár	fˠ iː nˠ ɑː ɾˠ
faoinarb	fˠ iː nˠ ə ɾˠ bˠ
faoinarbh	fˠ iː nˠ ə ɾˠ vˠ
faoiseamh	fˠ iː ʃ ə vˠ
faoiseamh	fˠ iː ʃ uː
faoiseamh	fˠ iː ʃ u
faoisean	fˠ iː ʃ ə nˠ
faoisean	fˠ ɯː sˠ ə n
faoistin	fˠ iː sʲ tʲ i nʲ
faol	fˠ eː lˠ
faol	fˠ iː lˠ
fara	fˠ a ɾˠ ə
farc	fˠ a ɾˠ k
farraige	fˠ a ɾˠ ɪ ɟ ɪ
fás	fˠ ɑː sˠ
fás	fˠ aː sˠ
fásach	fˠ ɑː sˠ ə x
fásach	fˠ æː sˠ a x
fásta	fˠ ɑː sˠ t̪ˠ ə
fáth	fˠ ɑː
fáth	fˠ æː
fathach	fˠ a h ə x
fathach	fˠ a h a h
fé	fʲ eː
feá	fʲ aː
feabhas	fʲ ə u sˠ
feabhas	fʲ oː sˠ
feabhra	fʲ a u ɾˠ ə
feac	fʲ ɛ c ɪ
feaca	fʲ a k ə
féach	fʲ eː x
féach	fʲ i a x
feachtas	fʲ a x t̪ˠ ə sˠ
fead	fʲ a d̪ˠ
féad	fʲ eː d̪ˠ
féadachtáil	fʲ eː d̪ˠ ə x t̪ˠ ɑː lʲ
feadálach	fʲ a d̪ˠ a l a x
feadh	fʲ a ɡ
feadh	fʲ a
feadh	fʲ æː
feadh	fʲ a w
feadha	fʲ ɑː
feadha	fʲ aː
feadóg	fʲ a d̪ˠ oː ɡ
feag	fʲ a ɡ
feall	fʲ ɑː l̪ˠ
fealsamh	fʲ a l̪ˠ sˠ ə vˠ
fealsamh	fʲ a l̪ˠ sˠ uː
fealsamh	fʲ a l̪ˠ sˠ u
fealsúnacht	fʲ a l̪ˠ sˠ uː n̪ˠ ə x t̪ˠ
fealsúnacht	fʲ a l̪ˠ sˠ uː nˠ ə x t̪ˠ
fealsúnacht	fʲ a l̪ˠ sˠ u nˠ a x t̪ˠ
feamainn	fʲ a mˠ ə n̠ʲ
feamainn	fʲ a mˠ ɪ ɲ
féan	fʲ eː nˠ
fear	fʲ a ɾˠ
fear	fʲ æ ɾˠ
féar	fʲ eː ɾˠ
féarach	fʲ i a r ə x
féarach	fʲ eː r ə x
féarach	fʲ eː r a x
fearg	fʲ a ɾˠ ə ɡ
fearg	fʲ æː ɾˠ ə ɡ
fearr	fʲ aː ɾˠ
fearr	fʲ ɑː ɾˠ
fearr	fʲ aː ɾˠ
fearthainn	fʲ a ɾˠ h ə ɲ
fearthainn	fʲ a ɾˠ h ə n̠ʲ
fearthainn	fʲ a ɾˠ h ə n̠ʲ
féasóg	fʲ i a̯ sˠ oː ɡ
féasóg	fʲ eː sˠ oː ɟ
féasóg	fʲ eː sˠ a ɡ
feic	fʲ ɛ c
feice	fʲ ɛ c ɪ
feiceadh	fʲ ɛ c ə x
feiceadh	fʲ ɛ c ə tʲ
feiceadh	fʲ ɛ c ə x
feiceadh	fʲ ɛ c ə tʲ
feiceadh	fʲ ɛ c uː
feiceadh	fʲ ɛ c ə tʲ
feiceadh	fʲ ɛ c u
feiceáil	fʲ ɛ c ɑː lʲ
feiceáil	fʲ ɛ c æ lʲ
feiceálach	fʲ ɛ c a lˠ a x
feiceann	fʲ ɛ c ə n̪ˠ
feiceanna	fʲ ɛ c ə n̪ˠ ə
féich	fʲ eː ç
féicheamh	fʲ eː h ə vˠ
féicheamh	fʲ eː ç ə vˠ
féicheamh	fʲ eː ç uː
féicheamh	fʲ eː ç u
feide	fʲ ɛ dʲ ə
féidearthacht	fʲ eː dʲ ə ɾˠ h ə x t̪ˠ
féidearthacht	fʲ eː dʲ ə ɾˠ h a x t̪ˠ
feidhm	fʲ ə i mʲ
feidhmeannach	fʲ ə i mʲ ə n̪ˠ ə x
féidir	fʲ eː dʲ ə ɾʲ
feighil	fʲ ə i lʲ
féil	fʲ eː lʲ
féile	fʲ eː lʲ ə
féilire	fʲ eː lʲ ə ɾʲ ə
feiliúint	fʲ ɪ lʲ uː nʲ tʲ
feiliúnach	fʲ ɪ lʲ uː n̪ˠ ə x
feiliúnach	fʲ ɛ lʲ uː nˠ ə x
féin	h eː nʲ
féin	fʲ eː nʲ
féinchúis	fʲ eː nʲ x uː ʃ
féinfhostaithe	fʲ eː nʲ o sˠ t̪ˠ ə h ə
féinín	fʲ eː nʲ iː nʲ
féinín	fʲ eː nʲ iː nʲ
féinín	fʲ eː nʲ i nʲ
féinphic	fʲ eː nʲ fʲ ɪ c
féinspéis	fʲ eː nʲ sˠ pʲ eː ʃ
feirg	fʲ ɛ ɾʲ ɪ ɟ
feirge	fʲ ɛ ɾʲ ɪ ɟ ɪ
feirm	fʲ ɛ ɾʲ ə mʲ
feis	fʲ ɛ ʃ
feisigh	fʲ ɛ ʃ iː
feistigh	fʲ ɛ ʃ tʲ ɪ ɟ
feistigh	fʲ ɛ ʃ tʲ ə
feistigh	fʲ ɛ ʃ tʲ iː
feistigh	fʲ ɛ ʃ tʲ i
feitheamh	fʲ ɪ h ə v
fén	fʲ eː n̪ˠ
feoigh	fʲ ɔː j
feoil	fʲ oː lʲ
feoil	fʲ ɔː lʲ
feoilséantóir	fʲ oː lʲ ʃ i a̯ n̪ˠ t̪ˠ oː rʲ
feoilséantóir	fʲ oː lʲ ʃ eː n̪ˠ t̪ˠ oː rʲ
feoilséantóir	fʲ ɔː lʲ ʃ eː n̪ˠ t̪ˠ ɔ rʲ
feola	fʲ oː l̪ˠ ə
feola	fʲ oː lˠ ə
feola	fʲ ɔː lˠ ə
fhada	ɑ d̪ˠ ə
fhada	a d̪ˠ ə
fhágadar	ɑː ɡ ə d̪ˠ ə ɾˠ
fhágadar	æː ɡ ə d̪ˠ ə ɾˠ
fhágadh	ɑː ɡ ə x
fhágadh	ɑː ɡ ə tʲ
fhágadh	ɑː ɡ ə x
fhágadh	ɑː ɡ ə tʲ
fhágadh	ɑː ɡ uː
fhágadh	æː ɡ ə tʲ
fhágadh	æː ɡ u
fhágaint	ɑː ɡ ə nʲ tʲ
fhágfadh	ɑː k ə x
fhágfadh	ɑː k ə tʲ
fhágfadh	ɑː k ə x
fhágfadh	ɑː k ə tʲ
fhágfadh	ɑː k uː
fhágfadh	æː k ə tʲ
fhágfadh	æː k u
fhagháilt	ɑː lʲ tʲ
fhaide	a dʲ ə
fhaigheann	aː n̪ˠ
fhaightear	a h a ɾˠ
fhaill	ɑ i lʲ
fharraige	a ɾˠ ə ɟ ɪ
fheadh	a ɡ
fheadh	a
fheadh	æː
fheadh	a w
fheadha	ɑː
fheadha	æː
fhear	a ɾˠ
fhéar	eː ɾˠ
fheiceadh	ɛ c ə x
fheiceadh	ɛ c ə tʲ
fheiceadh	ɛ c ə x
fheiceadh	ɛ c ə tʲ
fheiceadh	ɛ c uː
fheiceadh	ɛ c ə tʲ
fheiceadh	ɛ c u
fheiceanna	ɛ c ə n̪ˠ ə
fheicfeadh	ɛ c ə x
fheicfeadh	ɛ c ə tʲ
fheicfeadh	ɛ c ə x
fheicfeadh	ɛ c ə tʲ
fheicfeadh	ɛ c uː
fheicfeadh	ɛ c ə tʲ
fheicfeadh	ɛ c u
fheictear	ɛ c tʲ ə ɾˠ
fhéidir	eː dʲ ə ɾʲ
fhéin	h eː nʲ
fhéir	eː ɾʲ
fheis	ɛ ʃ
fhiacha	i ə x ə
fhiaradh	i ə ɾˠ ə
fhiaradh	i ə ɾˠ uː
fhiaradh	i ə ɾˠ u
fhiaradh	i ə ɾˠ ə x
fhiaradh	i ə ɾˠ ə tʲ
fhiaradh	i ə ɾˠ ə x
fhiaradh	i ə ɾˠ ə tʲ
fhiaradh	i ə ɾˠ uː
fhiaradh	i ə ɾˠ ə tʲ
fhiaradh	i ə ɾˠ u
fhir	ɪ ɾʲ
fhírinne	iː ɾʲ ɪ ɲ ɪ
fhírinne	iː ɾʲ ə nʲ ə
fhírinne	iː ɾʲ ə n̠ʲ ə
fhocal	ɔ k ə lˠ
fhocal	ʌ k ə lˠ
fhómhair	oː ɾʲ
fhómhair	õː ɾʲ
fhómhair	oː vˠ ə ɾʲ
fhómhair	uː w ə ɾʲ
fhómhair	ɔː w ə ɾʲ
fhómhar	oː ɾˠ
fhómhar	õː ɾˠ
fhómhar	oː vˠ ə ɾˠ
fhómhar	uː w ə ɾˠ
fhómhar	ɔː w ə ɾˠ
fhonn	ə u n̪ˠ
fhonn	uː n̪ˠ
fhonn	ʌ n̪ˠ
fhreastail	ɾʲ a sˠ t̪ˠ ə lʲ
fhreastalaíodh	ɾʲ a sˠ t̪ˠ ə lˠ iː x
fhreastalaíodh	ɾʲ a sˠ t̪ˠ ə lˠ iː tʲ
fhreastalódh	ɾʲ a sˠ t̪ˠ ə lˠ oː x
fhreastalódh	ɾʲ a sˠ t̪ˠ ə lˠ oː tʲ
fhuinneoig	ə ɲ oː ɟ
fhuinneoig	ə n̠ʲ oː ɟ
fhuinneoig	ɪ n̠ʲ oː ɟ
fhuinneoig	ɪ n̠ʲ ɔ ɟ
fhuinneoig	ɪ n̠ʲ æ ɟ
fhuiriste	ɾʲ ɪ ʃ tʲ ə
fí	fʲ iː
fiabhras	fʲ i ə vˠ ɾˠ ə sˠ
fiabhras	fʲ ɪ w ɾˠ ə sˠ
fiabhras	fʲ i ə w ɾˠ ə sˠ
fiach	fʲ i ə x
fiach	fʲ i a̯ x
fiacha	fʲ i ə x ə
fiacha	fʲ i a̯ x ə
fiacháil	fʲ i a̯ x æ lʲ
fiaclóir	fʲ i ə k l̪ˠ oː ɾʲ
fiaclóir	fʲ i ə k lˠ oː ɾʲ
fiaclóir	fʲ i ə k lˠ ɔ ɾʲ
fiafraí	fʲ i ə ɾˠ iː
fiafraigh	fʲ i ə ɾˠ ə
fiáin	fʲ i ə nʲ
fiáin	fʲ iː ɑː nʲ
fiáin	fʲ iː a nʲ
fial	fʲ i ə lˠ
fiánta	fʲ i ə n̪ˠ t̪ˠ ə
fiánta	fʲ iː ɑː n̪ˠ t̪ˠ ə
fiánta	fʲ iː a n̪ˠ t̪ˠ ə
fiar	fʲ i ə ɾˠ
fiaradh	fʲ i ə ɾˠ ə
fiaradh	fʲ i ə ɾˠ uː
fiaradh	fʲ i ə ɾˠ u
fiaradh	fʲ i ə ɾˠ ə ɡ
fiaradh	fʲ i ə ɾˠ ə vˠ
fiaradh	fʲ i ə ɾˠ uː
fiaradh	fʲ i ə ɾˠ u
fiaradh	fʲ i ə ɾˠ ə x
fiaradh	fʲ i ə ɾˠ ə tʲ
fiaradh	fʲ i ə ɾˠ ə x
fiaradh	fʲ i ə ɾˠ ə tʲ
fiaradh	fʲ i ə ɾˠ uː
fiaradh	fʲ i ə ɾˠ ə tʲ
fiaradh	fʲ i ə ɾˠ u
fiartha	fʲ i ə ɾˠ h ə
fiche	fʲ ɪ h ə
fiche	fʲ ɪ ç ə
fiche	fʲ iː
fichid	fʲ ɪ h ə dʲ
fichid	fʲ ɪ ç ə dʲ
fichid	fʲ iː dʲ
fill	fʲ iː lʲ
fill	fʲ iː l̠ʲ
fill	fʲ ɪ l̠ʲ
fillfir	fʲ iː lʲ h ə rʲ
fine	fʲ ɪ nʲ ə
fíniúin	fʲ iː nʲ uː nʲ
fíniúin	fʲ iː nʲ uː nʲ
fíniúin	fʲ iː nʲ u nʲ
fíniúnach	fʲ iː nʲ uː n̪ˠ ə x
fíniúnach	fʲ iː nʲ uː nˠ ə x
fíniúnach	fʲ iː nʲ u nˠ a h
finn	fʲ iː ɲ
finn	fʲ iː n̠ʲ
finn	fʲ ɪ n̠ʲ
finne	fʲ ɪ n̠ʲ ə
fiodh	fʲ ɪ
fíodóir	fʲ iː d̪ˠ oː ɾʲ
fíodóir	fʲ iː d̪ˠ oː ɾʲ
fíodóir	fʲ iː d̪ˠ ɔ ɾʲ
fíon	fʲ iː nˠ
fíonghort	fʲ iː nˠ ɣ ɔ ɾˠ tˠ
fionnghall	fʲ uː n ɣ a l
fionnghuala	fʲ ɪ n̪ˠ uː ə lˠ ə
fionnuar	fʲ ɪ nˠ u ə ɾˠ
fíor	fʲ iː ɾˠ
fíor	fʲ i ə ɾˠ
fios	fʲ ɪ sˠ
fir	fʲ ɪ ɾʲ
firéad	fʲ ə rʲ eː d̪ˠ
firéad	fʲ ɪ rʲ eː d̪ˠ
firéad	fʲ ɪ rʲ a d̪ˠ
fireann	fʲ ɪ ɾˠ ə n̪ˠ
fírinne	fʲ iː ɾʲ ɪ ɲ ɪ
fírinne	fʲ iː ɾʲ ə nʲ ə
fírinne	fʲ iː ɾʲ ə n̠ʲ ə
fírinneach	fʲ iː ɾʲ ɪ ɲ ə x
fírinneach	fʲ iː ɾʲ ə nʲ ə x
fírinneach	fʲ iː ɾʲ ə n̠ʲ ə x
fírinneach	fʲ iː ɾʲ ə n̠ʲ a h
fisic	fʲ ɪ ʃ ɪ c
fiú	fʲ uː
flaith	fˠ lˠ a h
flaith	fˠ lˠ a
fleá	fʲ lʲ aː
fleá	fʲ lʲ ɑː
fleá	fʲ lʲ æː
fliuch	fʲ lʲ ʊ x
fliuch	fʲ lʲ ɔ x
fliuch	fʲ lʲ ɨ̞ x
fliuch	fʲ lʲ ʌ x
fliuch	fʲ lʲ ʊ x
fliuch	fʲ lʲ ɔ x
fliuchadh	fʲ lʲ ʊ x ə
fliuchadh	fʲ lʲ ʊ x ə
fliuchadh	fʲ lʲ ɔ x ə
fliuchadh	fʲ lʲ ʊ x uː
fliuchadh	fʲ lʲ ʊ x u
fliuchadh	fʲ lʲ ʊ x ə ɡ
fliuchadh	fʲ lʲ ʊ x ə vˠ
fliuchadh	fʲ lʲ ɔ x ə vˠ
fliuchadh	fʲ lʲ ʊ x uː
fliuchadh	fʲ lʲ ʊ x u
fliuchadh	fʲ lʲ ʊ x ə x
fliuchadh	fʲ lʲ ʊ x ə tʲ
fliuchadh	fʲ lʲ ɔ x ə tʲ
fliuchadh	fʲ lʲ ʊ x ə x
fliuchadh	fʲ lʲ ɔ x ə ə x
fliuchadh	fʲ lʲ ʊ x ə tʲ
fliuchadh	fʲ lʲ ʊ x uː
fliuchadh	fʲ lʲ ʊ x ə tʲ
fliuchadh	fʲ lʲ ʊ x u
fliúit	fʲ lʲ uː tʲ
focail	fˠ ɔ k ə lʲ
focail	fˠ ʌ k ə lʲ
focal	fˠ ɔ k ə lˠ
focal	fˠ ʌ k ə lˠ
focla	fˠ ɔ k l̪ ə
foclóirí	fˠ ə k l̪ˠ oː ɾʲ iː
foclóirí	fˠ ɔ k lˠ oː ɾʲ iː
foclóirí	fˠ ʌ k l̪ˠ ɔ ɾʲ i
fód	fˠ oː d̪ˠ
fód	fˠ ɔː d̪ˠ
fógair	fˠ oː ɡ ə ɾʲ
fógair	fˠ ɔː ɡ ə ɾʲ
foghar	fˠ a u ɾˠ
foghar	fˠ oː ɾˠ
foghar	fˠ eː ɾˠ
foghlaim	fˠ oː l̪ˠ ɪ mʲ
foghlaim	fʲ ɔː lʲ ə mʲ
fógra	fˠ oː ɡ ɾˠ ə
fógra	fˠ ɔː ɡ ɾˠ ə
foide	fˠ ɛ dʲ ə
foighid	fˠ ə i dʲ
foighne	fˠ ə i nʲ ə
fóill	fˠ oː l̠ʲ
fóill	fˠ ɔː l̠ʲ
foireann	fˠ ɪ ɾʲ ə n̪ˠ
foirfe	fˠ ɪ ɾʲ ə fʲ ə
foirfe	fˠ ɛ ɾʲ ə fʲ ə
foirgneamh	fˠ ɔ ɾʲ ɪ ɟ ə nʲ ə vˠ
foirgneamh	fˠ ɔ ɾʲ ɪ ɟ nʲ ə vˠ
foirgneamh	fˠ ɔ ɾʲ ɪ ɟ nʲ uː
foirgneamh	fˠ ʌ ɾʲ ɪ ɟ nʲ u
foirmle	fˠ ɛ ɾʲ ə mʲ lʲ ə
fola	fˠ ɔ lˠ ə
folach	fˠ ə l̪ˠ a x
folach	fˠ ɔ lˠ ə x
folach	fˠ a lˠ ə x
folach	fˠ ɔ lˠ a x
folach	fˠ a lˠ a x
folaigh	fˠ ɔ l̪ˠ ɪ ɟ
folaigh	fˠ ɔ lˠ ə
folaigh	fˠ ɔ lˠ iː
folaigh	fˠ ɔ lˠ i
folaigh	fˠ a lˠ i
folaím	fˠ ɔ lˠ i mˠ
foláir	fʲ lʲ ɑː ɾˠ
folamh	fˠ ɔ l̪ˠ ə vˠ
folamh	fˠ aː l̪ˠ ə
folamh	fˠ ɔ lˠ uː
folamh	fˠ ɔ lˠ u
folláin	fˠ ə l̪ˠ ɑː nʲ
folláin	fˠ ɔ l̪ˠ ɑː nʲ
folláin	fˠ a l̪ˠ æː nʲ
fómhar	fˠ oː ɾˠ
fómhar	fˠ õː ɾˠ
fómhar	fˠ oː vˠ ə ɾˠ
fómhar	fˠ uː w ə ɾˠ
fómhar	fˠ õː w ə ɾˠ
fomhuireán	f ɔ vˠ ə rʲ ɑː n̪ˠ
fomhuireán	f ɔ w ə rʲ ɑː nˠ
fomhuireán	f ɔː w ə rʲ æ nˠ
fón	fˠ oː nˠ
fonn	fˠ ə u n̪ˠ
fonn	fˠ uː n̪ˠ
fonn	fˠ ʌ n̪ˠ
fonn	fˠ ə u n̪ˠ
foradh	fˠ ɔ ɾˠ ə
foradh	fˠ ɔ ɾˠ uː
foradh	fˠ a ɾˠ u
foraois	f ə ɾˠ iː ʃ
foraois	f ɔ ɾˠ iː ʃ
foraois	f ʌ ɾˠ i ʃ
forc	fˠ o ɾˠ k
foréigean	fˠ ɔ ɾˠ eː ɟ ɪ nˠ
formad	fˠ ɔ ɾˠ ə mˠ ə d̪ˠ
fortacht	fˠ ɔ ɾˠ t̪ ə x t̪ˠ
fortacht	fˠ ɔ ɾˠ t̪ a x t̪ˠ
fos	fˠ ɔ sˠ
fos	fˠ ʌ sˠ
fós	fˠ oː sˠ
fós	fˠ ɔː sˠ
foscadh	fˠ a sˠ k ə
foscadh	fˠ a sˠ k u
foscail	fˠ ɔ sˠ k ə lʲ
foscail	fˠ a sˠ k ə lʲ
fosclóchaidh	fˠ ɔ sˠ k lˠ a x i
fosclóchaidh	fˠ a sˠ k lˠ a x i
foshruth	fˠ ɔ h rˠ ʊ h
fosta	fˠ ɔ sˠ t̪ˠ ə
frainc	f ɾˠ a ɲ c
frainc	f ɾˠ a i ɲ c
frainc	f ɾˠ æ ɲ c
fraincis	fˠ ɾˠ a ɲ c ɪ ʃ
fraincis	fˠ ɾˠ æ ɲ c ɪ ʃ
franc	fˠ ɾˠ a ŋ k
francach	fˠ ɾˠ ɑ ŋ k ə x
francach	fˠ ɾˠ a u ŋ k ə x
francach	fˠ ɾˠ aː ŋ k ə x
francach	fˠ ɾˠ a ŋ k ə x
francach	fˠ ɾˠ a ŋ k a h
francach	fˠ ɾˠ ɑ ŋ k ə x
francach	fˠ ɾˠ a u ŋ k ə x
francach	fˠ ɾˠ aː ŋ k ə x
francach	fˠ ɾˠ a ŋ k ə x
francach	fˠ ɾˠ a ŋ k a h
fraoch	fˠ ɾˠ eː x
fraoch	fˠ ɾˠ iː x
fraoch	fˠ ɾˠ iː x
fraoch	fˠ ɾˠ ɯː x
frása	fˠ ɾˠ ɑː sˠ ə
frása	fˠ ɾˠ æː sˠ ə
frat	fˠ ɾˠ a t̪ˠ
fré	fˠ ɾˠ eː
freagair	fʲ ɾʲ a ɡ ə ɾʲ
freagairt	fʲ rʲ a ɡ ə ɾˠ tʲ
freagra	fʲ ɾʲ a ɡ ə ɾˠ ə
freagra	fʲ ɾʲ a ɡ ɾˠ ə
fréamh	fʲ ɾʲ eː vˠ
fréamhacha	fʲ ɾʲ eː w ə x ə
fréamhacha	fʲ ɾʲ eː w ə x iː
fréamhacha	fʲ ɾʲ eː vˠ a x ə
fréamhacha	fʲ ɾʲ eː vˠ a h ə
freastail	fʲ ɾʲ a sˠ t̪ˠ ə lʲ
freastal	fʲ ɾʲ a sˠ t̪ˠ ə lˠ
freastalaí	fʲ ɾʲ a sˠ t̪ˠ ə l̪ˠ iː
freastalaí	fʲ ɾʲ a sˠ t̪ˠ ə lˠ iː
freastalaí	fʲ ɾʲ a sˠ t̪ˠ ə lˠ i
freastalaím	fʲ ɾʲ a sˠ t̪ˠ ə lˠ iː mʲ
freastalaíodh	fʲ ɾʲ a sˠ t̪ˠ ə lˠ iː ɡ
freastalaíodh	fʲ ɾʲ a sˠ t̪ˠ ə lˠ iː vˠ
freastalaíodh	fʲ ɾʲ a sˠ t̪ˠ ə lˠ iː w
freastalaíodh	fʲ ɾʲ a sˠ t̪ˠ ə lˠ i w
freastalaíodh	fʲ ɾʲ a sˠ t̪ˠ ə lˠ iː x
freastalaíodh	fʲ ɾʲ a sˠ t̪ˠ ə lˠ iː tʲ
freastalaíodh	fʲ ɾʲ a sˠ t̪ˠ ə lˠ iː x
freastalaíodh	fʲ ɾʲ a sˠ t̪ˠ ə lˠ iː tʲ
freastalaíodh	fʲ ɾʲ a sˠ t̪ˠ ə lˠ iː w
freastalaíodh	fʲ ɾʲ a sˠ t̪ˠ ə lˠ i tʲ
freastalaíodh	fʲ ɾʲ a sˠ t̪ˠ ə lˠ i w
freastalaíonn	fʲ ɾʲ a sˠ t̪ˠ ə lˠ iː n̪ˠ
freastalóidh	fʲ ɾʲ a sˠ t̪ˠ ə lˠ oː j
freastalta	fʲ ɾʲ a sˠ t̪ˠ ə l̪ˠ t̪ ə
freis	fˠ ɾˠ ɛ ʃ
freisin	fʲ ɾʲ ɛ ʃ ə nʲ
freisin	fˠ ɾˠ ɔ ʃ ə nʲ
freo	fˠ ɾˠ oː bˠ
fria	fˠ ɾˠ eː
fríd	fʲ ɾʲ iː dʲ
fuacht	fˠ u ə x t̪ˠ
fuadar	fˠ u ə d̪ˠ ə ɾˠ
fuadh	fˠ u ə ɡ
fuadh	fˠ u ə vˠ
fuadh	fˠ u ə w
fuadh	fˠ u ə w
fuadh	fˠ u ə x
fuadh	fˠ u ə tʲ
fuadh	fˠ u ə x
fuadh	fˠ u ə tʲ
fuadh	fˠ u ə w
fuadh	fˠ u ə tʲ
fuadh	fˠ u ə w
fuaim	fˠ u ə mʲ
fuair	fˠ u ə ɾʲ
fuair	fˠ iː ɾʲ
fuair	fˠ u ə ɾʲ
fuair	fˠ u ə ɾʲ
fual	fˠ u ə lˠ
fuar	fˠ u ə ɾˠ
fuath	fˠ u ə
fúibh	fˠ uː bʲ
fúibhse	fˠ uː pʲ ʃ ə
fuil	fˠ ɪ lʲ
fuil	fˠ ɨ̞ lʲ
fúinn	fˠ uː n̠ʲ
fúinne	fˠ uː n̠ʲ ə
fuinneamh	fˠ ɪ ɲ ə vˠ
fuinneamh	fˠ ɪ n̠ʲ ə vˠ
fuinneamh	fˠ ɪ n̠ʲ ə
fuinneamh	fˠ ɪ n̠ʲ uː
fuinneamh	fˠ ɪ n̠ʲ u
fuinneog	fʲ ɪ ɲ uː ɡ
fuinneog	fˠ ə ɲ oː ɡ
fuinneog	fˠ ə n̠ʲ oː ɡ
fuinneog	fˠ ɪ n̠ʲ oː ɡ
fuinneog	fˠ ɪ n̠ʲ ɔ ɡ
fuinneog	fˠ ɪ n̠ʲ a ɡ
fuinneoga	fˠ ɪ ɲ oː ɡ ə
fuinneoga	fʲ ɪ ŋʲ oː ɡ ə
fuinneoga	fˠ ɪ n̠ʲ oː ɡ ə
fuinneoga	fˠ ɪ n̠ʲ oː ɡ ə
fuinneoga	fˠ ɪ n̠ʲ oː ɡ iː
fuinneoga	fˠ ɪ n̠ʲ ɔ ɡ ə
fuinneoig	fˠ ə ɲ oː ɟ
fuinneoig	fˠ ə n̠ʲ oː ɟ
fuinneoig	fˠ ɪ n̠ʲ oː ɟ
fuinneoig	fˠ ɪ n̠ʲ ɔ ɟ
fuinneoig	fˠ ɪ n̠ʲ æ ɟ
fuiriste	fʲ ɾʲ ɪ ʃ tʲ ə
fuisce	fˠ ɪ ʃ c ɪ
fuiseog	fˠ ə ʃ oː ɡ
fuiseog	fˠ ɪ ʃ oː ɡ
fuiseog	fˠ ɪ ʃ a ɡ
fúithi	fˠ ʊ h ə
fúithi	fˠ uː
fúithise	fˠ uː ʃ ə
fulaing	fˠ ʊ lˠ ə n̠ʲ
fúm	fˠ uː mˠ
fúmsa	fˠ uː mˠ sˠ ə
fungasach	fˠ ʊ ŋ ɡ ə sˠ ə x
fungasach	fˠ ʊ ŋ ɡ ə sˠ a x
furasta	fˠ ʊ ɾ̪ˠ ə s t̪ˠ ə
furasta	fˠ ɾ̪ˠ ʊ s t̪ˠ ə
fusa	fˠ ʊ sˠ ə
fút	fˠ uː t̪ˠ
fúthu	fˠ uː bˠ
fúthusan	fˠ uː pˠ sˠ ə n
fútsa	fˠ uː t̪ˠ sˠ ə
ga	ɡ a
ga	ɡ a h
gá	ɡ ɑː
gá	ɡ æː
gabh	ɡ a w
gabh	ɡ oː
gabh	ɡ a vʲ
gabh	ɡ o
gabha	ɡ ə u ə
gabha	ɡ ə u
gabha	ɡ oː
gabháil	ɡ ə vˠ ɑː lʲ
gabháil	ɡ a w ɑː lʲ
gabháil	ɡ ɔː lʲ
gabháil	ɡ ɔ lʲ
gabháil	ɡ ɔ lˠ
gabháilt	ɡ vˠ ɑː lʲ tʲ
gabhaim	ɡ ə i mʲ
gabhaim	ɡ oː mˠ
gabhal	ɡ ɑ u l̪ˠ
gabhal	ɡ ə u lˠ
gabhal	ɡ oː lˠ
gabhála	ɡ ə vˠ ɑː l̪ˠ ə
gabhála	ɡ a w ɑː lˠ ə
gabhála	ɡ ɔː lˠ ə
gabhar	ɡ ə u ɾˠ
gabhar	ɡ oː ɾˠ
gach	ɡ a x
gada	ɡ a d̪ˠ ə
gadaí	ɡ ə d̪ˠ iː
gadaí	ɡ a d̪ˠ iː
gadaí	ɡ a d̪ˠ i
gadhar	ɡ ə i ɾˠ
gae	ɡ eː
gaedhilge	ɡ eː lʲ ɟ ə
gaedhlaing	ɡ eː l ɪ ɲ
gaeilge	ɡ eː lʲ ɟ ɪ
gael	ɡ eː lˠ
gafa	ɡ a fˠ ə
gaibh	ɡ a vʲ
gaibhte	ɡ ʊ tʲ ə
gaillimh	ɡ a l̠ʲ ɪ vʲ
gaineamh	ɡ a nʲ ə vˠ
gaineamh	ɡ a nʲ ə vʲ
gaineamh	ɡ a nʲ ə
gaineamh	ɡ a nʲ uː
gaineamh	ɡ a nʲ u
gair	ɡ a ɾʲ
gáir	ɡ ɑː ɾʲ
gáir	ɡ æː ɾʲ
gairdín	ɡ ɑː ɾˠ dʲ iː nʲ
gairdín	ɡ ɑː ɾˠ dʲ iː nʲ
gairdín	ɡ æː ɾˠ dʲ i nʲ
gaire	ɡ a ɾʲ ə
gáirí	ɡ ɑː ɾʲ iː
gáirí	ɡ ɑː ɾʲ iː
gáirí	ɡ æː ɾʲ i
gairid	ɡ a ɾʲ ə dʲ
gairleog	ɡ ɑː ɾˠ lʲ oː ɡ
gairleog	ɡ ɑː ɾˠ lʲ oː ɡ
gairleog	ɡ ɑː ɾˠ lʲ a ɡ
gairm	ɡ a ɾʲ ə mʲ
gairme	ɡ a ɾʲ ə mʲ ə
gais	ɡ a ʃ
gaisce	ɡ a ʃ c ɪ
gal	ɡ ɑ l̪ˠ
gal	ɡ a l̪ˠ
galach	ɡ ə l̪ˠ ɑ x
galach	ɡ a lˠ ə x
galach	ɡ a lˠ a h
galar	ɡ a lˠ ə ɾˠ
galar	ɡ ɔ lˠ ə ɾˠ
gall	ɡ ɑː l̪ˠ
gall	ɡ ɑː l̪ˠ
gallta	ɡ aː l̪ˠ t̪ˠ ə
gallúnach	ɡ a lˠ uː nˠ ə x
galúin	ɡ ə lˠ uː nʲ
galúin	ɡ a lˠ uː nʲ
galúin	ɡ a lˠ u nʲ
galún	ɡ ə lˠ uː nˠ
galún	ɡ a lˠ uː nˠ
galún	ɡ a lˠ u nˠ
gan	ɡ ə n̪ˠ
gan	ɡ ɑ n̪ˠ
gan	ɡ a n̪ˠ
gaol	ɡ eː l̪ˠ
gaol	ɡ iː lˠ
gaol	ɡ iː lˠ
gaol	ɡ ɯː lˠ
gaolainn	ɡ ɘː l̪ˠ ɪ ɲ
gaolmhar	ɡ iː lˠ u ɾˠ
gaolmhar	ɡ ɯː lˠ u ɾˠ
gaoth	ɡ eː
gaoth	ɡ iː
gaoth	ɡ iː
gaoth	ɡ ɯː
gaothrán	ɡ iː ɾ̥ˠ ɑː n̪ˠ
garbh	ɡ ɑ ɾˠ ə vˠ
garbh	ɡ a ɾˠ ə vˠ
garbh	ɡ a ɾˠ uː
garbh	ɡ a ɾˠ u
garda	ɡ ɑː ɾˠ d̪ˠ ə
garda	ɡ æː ɾˠ d̪ˠ ə
garda	ɡ ɑː ɾˠ d̪ˠ ə
garda	ɡ æː ɾˠ d̪ˠ ə
garraí	ɡ ɑ ɾˠ iː
garraí	ɡ a ɾˠ iː
garraí	ɡ a ɾˠ i
garsún	ɡ ɑ ɾˠ sˠ uː n̪ˠ
garsún	ɡ a ɾˠ sˠ uː nˠ
garsún	ɡ a ɾˠ sˠ u nˠ
gasóg	ɡ ə sˠ oː ɡ
gasóg	ɡ a sˠ oː ɡ
gasóg	ɡ a sˠ ɔ ɡ
gasóg	ɡ a sˠ a ɡ
gasúir	ɡ ɑ sˠ uː ɾʲ
gasúir	ɡ a sˠ uː ɾʲ
gasúir	ɡ a sˠ u ɾʲ
gasúr	ɡ ɑ sˠ uː ɾˠ
gasúr	ɡ a sˠ uː ɾˠ
gasúr	ɡ a sˠ u ɾˠ
gcairde	ɡ ɑː ɾˠ dʲ ə
gcaoi	ɡ iː
gcaoirigh	ɡ iː ɾʲ ɪ ɟ
gcaoirigh	ɡ iː ɾʲ ə
gcaoirigh	ɡ iː ɾʲ iː
gcaoirigh	ɡ iː ɾʲ i
gcapall	ɡ a pˠ ə l̪ˠ
gcaptaen	ɡ ɑ pˠ t̪ˠ eː n̪ˠ
gcara	ɡ a ɾˠ ə
gcaraid	ɡ a ɾˠ ə dʲ
gcás	ɡ ɑː sˠ
gcás	ɡ æː sˠ
gcasadh	ɡ ɑ sˠ ə
gcasadh	ɡ a sˠ ə
gcasadh	ɡ a sˠ uː
gcasadh	ɡ a sˠ u
gcasadh	ɡ ɑ sˠ ə x
gcasadh	ɡ a sˠ ə tʲ
gcasadh	ɡ a sˠ ə x
gcasadh	ɡ a sˠ ə tʲ
gcasadh	ɡ a sˠ uː
gcasadh	ɡ a sˠ ə tʲ
gcasadh	ɡ a sˠ u
gcathaoir	ɡ ɑ h iː rʲ
gcead	ɟ a d̪ˠ
gcead	ɟ æː d̪ˠ
gcéad	ɟ eː d̪ˠ
gcéadta	ɟ eː t̪ˠ ə
gceanada	ɟ a nˠ ə d̪ˠ ə
gceann	ɟ a u n̪ˠ
gceann	ɟ ɑː n̪ˠ
gceann	ɟ a n̪ˠ
gcearnóg	ɟ aː ɾˠ n̪ˠ oː ɡ
gcearnóg	ɟ ɑː ɾˠ n̪ˠ oː ɡ
gcearnóg	ɟ æː ɾˠ n̪ˠ ɔ ɡ
gcéibh	ɟ eː vʲ
gcéibheanna	ɟ eː vʲ ə n̪ˠ iː
gceist	ɟ ɛ ʃ tʲ
gcífinn	ɟ iː h ə nʲ
gciliméadar	ɟ ɪ lʲ ə mʲ eː d̪ˠ ə ɾˠ
gciliméadar	ɟ ɪ lʲ ə mʲ eː d̪ˠ ə ɾˠ
gciliméadar	ɟ ɪ lʲ ə mʲ e d̪ˠ ə ɾˠ
gcnoic	ɡ n̪ˠ ɪ c
gcnoic	ɡ nˠ ɪ c
gcnoic	ɡ ɾˠ ɪ c
gcnuic	ɡ n̪ˠ ɪ c
gcnuic	ɡ nˠ ɪ c
gcnuic	ɡ ɾˠ ɪ c
gcodladh	ɡ ɔ l̪ˠ ə
gcodladh	ɡ ɔ l̪ˠ uː
gcodladh	ɡ ʌ l̪ˠ u
gcoill	ɡ iː lʲ
gcoill	ɡ ə i l̠ʲ
gcoill	ɡ ɞ l̠ʲ
gcoill	ɡ ʌ l̠ʲ
gcomhluadar	ɡ oː lˠ u ə d̪ˠ ə ɾˠ
gcomhluadar	ɡ ɔː lˠ u ə d̪ˠ ə ɾˠ
gcóngar	ɡ uː ŋ ɡ ə ɾˠ
gcósta	ɡ oː sˠ t̪ˠ ə
gcósta	ɡ ɔː sˠ t̪ˠ ə
gcóstaí	ɡ oː sˠ t̪ˠ iː
gcóstaí	ɡ oː sˠ t̪ˠ iː
gcóstaí	ɡ ɔː sˠ t̪ˠ i
gcrainn	ɡ ɾˠ a i ɲ
gcrainn	ɡ ɾˠ iː nʲ
gcrainn	ɡ ɾˠ iː n̠ʲ
gcrainn	ɡ ɾˠ ɪ n̠ʲ
gcroí	ɡ ɾˠ iː
gcuairt	ɡ u ə ɾˠ tʲ
gcuairteanna	ɡ u ə ɾˠ tʲ ə n̪ˠ ə
gcuan	ɡ u ə nˠ
gcuireadh	ɡ ɪ ɾʲ ə x
gcuireadh	ɡ ɪ ɾʲ ə tʲ
gcuireadh	ɡ ɪ ɾʲ ə x
gcuireadh	ɡ ɪ ɾʲ ə tʲ
gcuireadh	ɡ ɪ ɾʲ uː
gcuireadh	ɡ ɪ ɾʲ ə tʲ
gcuireadh	ɡ ɪ ɾʲ u
gcuireann	ɡ ɪ ɾʲ ə n̪ˠ
gcurach	ɡ ə ɾˠ a x
gcurach	ɡ ʊ ɾˠ ə x
gcurach	ɡ ɔ ɾˠ ə x
gcurach	ɡ ɤ ɾˠ a x
gcurach	ɡ ɤ ɾˠ a h
gcurach	ɡ ɤ ɾˠ a
gcuraigh	ɡ ʊ ɾˠ ɪ ɟ
gcuraigh	ɡ ʊ ɾˠ ə
gcuraigh	ɡ ɔ ɾˠ ə
gcuraigh	ɡ ʊ ɾˠ iː
gcuraigh	ɡ ʊ ɾˠ i
gé	ɟ eː
geac	ɟ a k
géag	ɟ eː ɡ
géagach	ɟ eː ɡ ə x
géagach	ɟ eː ɡ a h
geal	ɟ a l̪ˠ
geal	ɟ a lˠ
geala	ɟ a lˠ ə
gealach	ɟ ə l̪ˠ ɑ x
gealach	ɟ a lˠ ə x
gealach	ɟ æ l̪ˠ ə x
