અં	ə̃ː
અંક	ə ŋ k ə
અંકગણિત	ə ŋ k ə ɡ ɳ ɪ t̪
અંકુર	ə ŋ k u ɾ
અંગારકામ્લ	ə ŋ ɡ ɑ ɾ k ɑ m l ə
અંગૂઠો	ə ŋ ɡ u ʈʰ ɔ
અંગૂર	ə ŋ ɡ u ɾ
અંગ્રેજ	ə ŋ ɡ ɾ eː d͡ʒ
અંધારું	ə n d̪ʱ ɑ ɾ ũ
અંબર	ə m b ə ɾ
અઃ	ə ɨ
અક્ષર	ə k ʃ ə ɾ
અગનગોળો	ə ɡ ə n ɡ o ɭ o
અગરબત્તી	ə ɡ ə ɾ b ə t̪ t̪ i
અગિયાર	ə ɡ i j ɑ ɾ
અગિયારી	ə ɡ ɪ j ɑ ɾ i
અગ્રમસ્તિષ્ક	ə ɡ ɾ ə m ə s t̪ ɪ ʃ k
અછબડા	ə t͡ʃʰ ə b ɖ ɑ
અજવાળું	ə d͡ʒ ə ʋ ɑ ɭ ũ
અઝાન	ə d͡ʒʱ ɑ n
અઢળક	ə ɖʱ ə ɭ k ə
અઢાર	ə ɖʱ ɑ ɾ
અણગમતું	ə ɳ ə ɡ ə m t̪ ũ
અણસણ	ə ɳ ə s ə ɳ
અતંત્રતા	ə t̪ ə n t̪ ɾ ə t̪ ɑ
અતિથિ	ə t̪ ɪ t̪ʰ ɪ
અતિશય	ə t̪ ɪ ʃ ə j
અત્યંત	ə t̪ j ə n t̪
અધમૂઉં	ə d̪ʱ ə m u ũ
અધિકાર	ə d̪ʱ ɪ k ɑ ɾ
અધુના	ə d̪ʱ u n ɑ
અનાજ	ə n ɑ d͡ʒ
અનારકળી	ə n ɑ ɾ k ə ɭ i
અનિદ્રા	ə n ɪ d̪ ɾ ɑ
અનુભવ	ə n u bʱ ə ʋ
અનુમધ્યમસ્તિષ્ક	ə n u m ə d̪ʱ j ə m ə s t̪ ɪ ʃ k
અન્ય	ə n j ə
અપભ્રંશ	ə p ə bʱ ɾ ã ʃ
અફગાનિસ્તાન	ə pʰ ə ɡ ɑ n ɪ s t̪ ɑ n
અફસાના	ə pʰ ə s ɑ n ɑ
અબલખ	ə b ə l ə kʰ
અભિનેતા	ə bʱ ɪ n eː t̪ ɑ
અભિમાન	ə bʱ ɪ m ɑ n
અમદાવાદ	ə m ə d̪ ɑ ʋ ɑ d̪
અમી	ə m i
અમૂર્ત	ə m u ɾ t̪
અમૃતા	ə m r̩ t̪ ɑ
અરજદાર	ə ɾ ə d͡ʒ d̪ ɑ ɾ
અરડૂસી	ə ɾ ə ɖ u s i
અરબસ્તાન	ə ɾ ə b ə s t̪ ɑ n
અરિ	ə ɾ ɪ
અર્થ	ə ɾ t̪ʰ
અર્ધવર્તુળાકાર	ə ɾ d̪ʱ ə ʋ ə ɾ t̪ u ɭ ɑ k ɑ ɾ
અલખ	ə l ə kʰ
અલ્પાકા	ə l p ɑ k ɑ
અલ્બેનિયા	ə l b eː n ɪ j ɑ
અલ્લાહ	ə l l ɑʱ
અવધ	ə ʋ ə d̪ʱ
અવયવીકરણ	ə ʋ ə j ə ʋ i k ɾ ə ɳ
અવાક	ə ʋ ɑ k
અવાજ	ə ʋ ɑ d͡ʒ
અવાજ	ə ʋ ɑ z
અવિદ્યા	ə ʋ ɪ d̪ j ɑ
અશોક	ə ʃ o k
અષાઢ	ə ʃ ɑ ɖʱ
અસર	ə s ə ɾ
અસ્પૃશ્યતાનિવારણ	ə s p r̩ ʃ j ə t̪ ɑ n ɪ ʋ ɑ ɾ ə ɳ
અહીં	ə ɦ ĩ
અહીંતહીં	ə ɦ ĩ t̪ ə ɦ ĩ
આ	ɑ̈
આંતરરાષ્ટ્રીય	ɑ n t̪ ə ɾ ɾ ɑ ʂ ʈ ɾ i j ə
આંબો	ɑ̃ b o
આંસ	ɑ̃ s
આગગાડી	ɑ ɡ ə ɡ ɑ ɖ i
આગાર	ɑ ɡ ɑ ɾ
આચરણ	ɑ t͡ʃ ə ɾ ə ɳ
આઝાદ	ɑ d͡ʒʱ ɑ d̪
આઠ	ɑ ʈʰ ə
આતશ	ɑ t̪ ə ʃ
આત્મા	ɑ t̪ m ɑ
આદમ	ɑ d̪ ə m
આફતાબ	ɑ pʰ ə t̪ ɑ b
આબ	ɑ b
આભ	ɑ bʱ ə
આભાર	ɑ bʱ ɑ ɾ
આમળાં	ɑ m ə ɭ ɑ̃
આયખું	ɑ j ə kʰ ũ
આયુષ	ɑ j u ʂ
આલમારી	ɑ l ə m ɑ ɾ i
આલીશાન	ɑ l i ʃ ɑ n
આશીર્વાદ	ɑ ʃ i ɾ ʋ ɑ d̪
આસમાન	ɑ s ə m ɑ n
આસમાની	ɑ s ə m ɑ n i
આસામ	ɑ s ɑ m
ઇ	ɪ
ઇઝરાયલ	ɪ d͡ʒʱ ə ɾ ɑ j ə l
ઇટાલી	ɪ ʈ ɑ l i
ઇન્શાઅલ્લાહ	ɪ n ʃ ɑ ə l l ɑʱ
ઇબાદત	ɪ b ɑ d̪ ə t̪
ઇમારત	ɪ m ɑ ɾ ə t̪
ઇમ્ફાલ	ɪ m pʰ ɑ l
ઇસ્ત્રી	ɪ s t̪ ɾ i
ઇસ્પિતાલ	ɪ s p ɪ t̪ ɑ l
ઇસ્લામ	ɪ s l ɑ m
ઈ	iː
ઈદ	i d̪
ઈરાન	i ɾ ɑ n
ઉ	u
ઉચ્ચાર	u t͡ʃ t͡ʃ ɑ ɾ
ઉઝબેકિસ્તાન	u d͡ʒʱ b eː k ɪ s t̪ ɑ n
ઉદાસ	u d̪ ɑ s
ઉદ્યાન	u d̪ j ɑ n
ઉનાળો	u n ɑ ɭ o
ઉપઉષ્ણકટિબંધીય	u p ə u ʃ ɳ ə k ʈ ɪ b ə n d̪ʱ i j ə
ઉપનયન	u p ə n j ə n
ઉપનામ	u p ə n ɑ m
ઉપવાસ	u p ə ʋ ɑ s
ઉમંગ	u m ə ŋ ɡ
ઉમર	u m ə ɾ
ઉર્દૂ	u ɾ d̪ u
ઉર્સ	u ɾ s
ઉષા	u ʃ ɑ
ઉષ્ણકટિબંધીય	u ʃ ɳ ə k ʈ ɪ b ə n d̪ʱ i j ə
ઊ	uː
ઊકળવું	u k ə ɭ ʋ ũ
ઊધઈ	u d̪ʱ ə i
ઊન	u n ə
ઊલિયું	u l ɪ j ũ
ઊષર	u ʃ ə ɾ
ઋ	ɾ u
ઋતુ	ɾ u t̪ u
ઋષિ	ɾ u ʃ ɪ
એ	e
એક	e k ə
એકલડું	eː k ə l ɖ ũ
એકલું	eː k ə l ũ
એકવીસ	eː k ə ʋ i s
એન્જીનિયર	eː n d͡ʒ i n ɪ j ə ɾ
એપ્રિલ	eː p ɾ ɪ l
એહસાન	eː ɦ ə s ɑ n
ઐ	ə j
ઐતિહાસિક	ə ɪ t̪ ɪ ɦ ɑ s ɪ k
ઑક્ટોબર	ɔ k ʈ o b ə ɾ
ઑફિસ	ɔ pʰ ɪ s
ઑફિસર	ɔ pʰ ɪ s ə ɾ
ઓ	o
ઓગણીસ	o ɡ ə ɳ i s
ઓઠ	o ʈʰ
ઓણ	o ɳ ə
ઓળગ	o ɭ ɡ ə
ઔ	ə ʋ
ક	k ə
કડવું	k ə ɖ ʋ ũ
કપોત	k ə p o t̪
કબર	k ə b ə ɾ
કમલ	k ə m ə l
કમળ	k ə m ə ɭ
કરચોરી	k ə ɾ t͡ʃ o ɾ i
કરેણ	k ə ɾ eː ɳ
કરોડ	k ə ɾ o ɖ
કર્મ	k ə ɾ m ə
કલમ	k ə l ə m
કવિ	k ə ʋ ɪ
કવ્વાલી	k ə ʋ ʋ ɑ l i
કહેવું	k ə ɦ eː ʋ ũ
કાંઠો	k ɑ̃ ʈʰ o
કાકણક	k ɑ k ɳ ə k
કાગડો	k ɑ ɡ ɖ o
કાગળકામ	k ɑ ɡ ə ɭ k ɑ m
કાજુ	k ɑ d͡ʒ u
કાઠિયાવાડ	k ɑ ʈʰ ɪ j ɑ ʋ ɑ ɖ
કાતર	k ɑ t̪ ə ɾ
કાપવું	k ɑ p ʋ ũ
કાબા	k ɑ b ɑ
કાબુલ	k ɑ b u l
કામ	k ɑ m
કાયર	k ɑ j ə ɾ
કારખાનું	k ɑ ɾ kʰ ɑ n ũ
કાશ્મીર	k ɑ ʃ m i ɾ
કિશોરી	k ɪ ʃ o ɾ i
કીટલી	k i ʈ l i
કીડો	k i ɖ o
કુંડળ	k u ɳ ɖ ə ɭ
કુંભકાર	k u m bʱ k ɑ ɾ
કુંભાર	k u m bʱ ɑ ɾ
કુટુંબ	k u ʈ u m b
કુદરત	k u d̪ ɾ ə t̪
કુમારી	k u m ɑ ɾ i
કુમુદિની	k u m u d̪ ɪ n i
કુરાન	k u ɾ ɑ n
કૂકડો	k u k ɖ o
કૃષ્ણ	k r̩ ʃ ɳ
કેરી	k eː ɾ i
કોઈ	k o i
કોટ	k o ʈ
કોન્ટ્રાક્ટર	k o n ʈ ɾ ɑ k ʈ ə ɾ
કોન્લી	k o n l i
કોયલો	k o j ə l o
કોશિશ	k o ʃ ɪ ʃ
ક્યાં	k j ɑ̃
ક્યારે	k j ɑ ɾ eː
ક્રિયાવિશેષણઅવ્યય	k ɾ ɪ j ɑ ʋ ɪ ʃ eː ʃ ɳ ə ə ʋ j ə j ə
ક્રિશ્ચિયન	k ɾ ɪ ʃ t͡ʃ ɪ j ə n
ક્રીડા	k ɾ i ɖ ɑ
ક્ષ	k ʃ ə
ખ	kʰ ə
ખચ્ચર	kʰ ə t͡ʃ t͡ʃ ə ɾ
ખજૂર	kʰ ə d͡ʒ u ɾ
ખમીસ	kʰ ə m i s
ખરજવું	kʰ ə ɾ ə d͡ʒ ʋ ũ
ખરું	kʰ ə ɾ ũ
ખાખરા	kʰ ɑ kʰ ɾ ɑ
ખાનું	kʰ ɑ n ũ
ખાલા	kʰ ɑ l ɑ
ખાલિક	kʰ ɑ l ɪ k
ખાલિસ્તાન	kʰ ɑ l ɪ s t̪ ɑ n
ખાવસા	kʰ ɑ ʋ s ɑ
ખિસકોલી	kʰ ɪ s k o l i
ખીમો	kʰ i m o
ખુદા	kʰ u d̪ ɑ
ખૂન	kʰ u n
ખેંચવું	kʰ eː ɲ t͡ʃ ʋ ũ
ગ	ɡ ə
ગંગા	ɡ ə ŋ ɡ ɑ
ગજ	ɡ ə d͡ʒ
ગણપતિ	ɡ ə ɳ ə p t̪ ɪ
ગણવું	ɡ ə ɳ ʋ ũ
ગયંદ	ɡ ə j ə n d̪
ગરબા	ɡ ə ɾ b ɑ
ગરમ	ɡ ə ɾ ə m
ગરીબ	ɡ ə ɾ i b
ગાંધીનગર	ɡ ɑ̃ d̪ʱ i n ə ɡ ə ɾ
ગાજર	ɡ ɑ d͡ʒ ə ɾ
ગાડી	ɡ ɑ ɖ i
ગાલ	ɡ ɑ l
ગાવું	ɡ ɑ ʋ ũ
ગિરજા	ɡ ɪ ɾ d͡ʒ ɑ
ગુજરાત	ɡ u d͡ʒ ɾ ɑ t̪
ગુજરાતી	ɡ u d ʒ ə ɾ ɑː t̪ i
ગુરુ	ɡ u ɾ u
ગુલ	ɡ u l
ગુલશન	ɡ u l ʃ ə n
ગુલાબ	ɡ u l ɑ b
ગુલાબી	ɡ u l ɑ b i
ગુસલ	ɡ u s ə l
ગોતું	ɡ o t̪ ũ
ગોપી	ɡ o p i
ગોસાંઈ	ɡ o s ɑ̃ i
ગ્રંથ	ɡ ɾ ə n t̪ʰ
ગ્રીષ્મ	ɡ ɾ i ʃ m ə
ગ્રીસ	ɡ ɾ i s
ઘ	ɡʱ ə
ઘટવું	ɡʱ ə ʈ ʋ ũ
ઘર	ɡʱ ə ɾ
ઘરો	ɡʱ ə ɾ o
ઘાસ	ɡʱ ɑ s
ઘુવડ	ɡʱ u ʋ ə ɖ
ઘોડું	ɡʱ o ɖ ũ
ઘોડો	ɡʱ o ɽ o
ઙ	ŋ ə
ચ	t͡ʃ ə
ચંદ્ર	t͡ʃ ə n d̪ ɾ ə
ચંદ્રબિંદુ	t͡ʃ ə n d̪ ɾ ə b ɪ n d̪ u
ચક્ર	t͡ʃ ə k ɾ ə
ચરો	t͡ʃ ə ɾ o
ચર્મ	t͡ʃ ə ɾ m ə
ચશ્માં	t͡ʃ ə ʃ m ɑ̃
ચા	t͡ʃ ɑ
ચાંચિયો	t͡ʃ ɑ̃ t͡ʃ ɪ j o
ચાંદ	t͡ʃ ɑ̃ d̪
ચાંદની	t͡ʃ ɑ̃ d̪ n i
ચાકુ	t͡ʃ ɑ k u
ચાખવું	t͡ʃ ɑ kʰ ʋ ũ
ચાર	t͡ʃ ə ɾ
ચિત્તો	t͡ʃ ɪ t̪ t̪ o
ચીકણું	t͡ʃ i k ɳ ũ
ચીકુ	t͡ʃ i k u
ચીન	t͡ʃ i n
ચીની	t͡ʃ i n i
ચેરી	t͡ʃ eː ɾ i
ચૈત્ર	t͡ʃ ə ɪ t̪ ɾ ə
ચોપડી	t͡ʃ o p ɖ i
ચોપડો	t͡ʃ o p ɖ o
ચૌદ	t͡ʃ ə ʋ d
છ	t ʃʰ ə
છત્તીસગઢ	t͡ʃʰ ə t̪ t̪ i s ɡ ə ɖʱ
છત્રી	t͡ʃʰ ə t̪ ɾ i
છરી	t͡ʃʰ ə ɾ i
છાંયડી	t͡ʃʰ ɑ̃ j ə ɖ i
છોકરમત	t ʃʰ o k ə r m ə t
છોકરી	t ʃʰ o k r i
છોકરું	t ʃʰ o k r ũ
છોકરો	t ʃʰ o k r o
જ	d͡ʒ ə
જકાત	d͡ʒ ə k ɑ t̪
જગ્યા	d͡ʒ ə ɡ j ɑ
જડ	d͡ʒ ə ɖ
જન્નત	d͡ʒ ə n n ə t̪
જબાન	d͡ʒ ə b ɑ n
જમવું	d͡ʒ ə m ʋ ũ
જમીન	d͡ʒ ə m i n
જર્મની	d͡ʒ ə ɾ m ə n i
જળ	d͡ʒ ə ɭ
જવાબ	d͡ʒ ə ʋ ɑ b
જહન્નમ	d͡ʒ ə ɦ ə n n ə m
જાકીટ	d͡ʒ ɑ k i ʈ
જાત	d͡ʒ ɑ t̪
જી	d͡ʒ i
જુલાઈ	d͡ʒ u l ɑ i
જુવાની	d͡ʒ u ʋ ɑ n i
જૂન	d͡ʒ u n
જેઠ	d͡ʒ eː ʈʰ
જોકે	d͡ʒ o k eː
જોશી	d͡ʒ o ʃ i
જ્ઞ	ɡ n ə
જ્ઞાન	ɡ j ɑ n
જ્યાં	d͡ʒ j ɑ̃
ઝ	d͡ʒʱ ə
ઝરૂખો	d͡ʒʱ ə ɾ u kʰ o
ઝીણા	d͡ʒʱ i ɳ ɑ
ઝેર	d͡ʒʱ eː ɾ
ઞ	ɲ ə
ટ	ʈ ə
ટમલર	ʈ ə m l ə ɾ
ટિકિટ	ʈ ɪ k ɪ ʈ
ટ્રેન	ʈ ɾ eː n
ઠ	ʈʰ ə
ઠાણ	ʈʰ ɑ ɳ
ઠોકર	ʈʰ o k ə ɾ
ડ	ɖ ə
ડરવું	ɖ ə ɾ ʋ ũ
ડિસેમ્બર	ɖ ɪ s eː m b ə ɾ
ડૉક્ટર	ɖ ɔ k ʈ ə ɾ
ડોકું	ɖ o k ũ
ઢ	ɖʱ ə
ઢીંગલી	ɖʱ ĩ ɡ l i
ઢેપું	ɖʱ eː p ũ
ઢેલ	ɖʱ eː l
ઢોર	ɖʱ o ɾ
ણ	ɳ ə
ત	t ə
તડકો	t̪ ə ɖ k o
તરબૂચ	t̪ ə ɾ b u t͡ʃ
તળવું	t̪ ə ɭ ʋ ũ
તહેવાર	t̪ ə ɦ eː ʋ ɑ ɾ
તાપ	t̪ ɑ p
તારીખિયું	t̪ ɑ ɾ i kʰ ɪ j ũ
તિબેટ	t̪ ɪ b eː ʈ
તીખું	t̪ i kʰ ũ
તુલા	t̪ u l ɑ
તેર	t e ɾ
તેલ	t̪ eː l
તેલુગુ	t̪ eː l u ɡ u
તોરત	t̪ o ɾ ə t̪
ત્રણ	t̪ ɾ ɔ ɳ
ત્વરિત	t̪ ʋ ə ɾ ɪ t̪
થ	tʰ ə
થળ	t̪ʰ ə ɭ
થી	t̪ʰ i
થેલી	t̪ʰ eː l i
દ	d ə
દયા	d̪ ə j ɑ
દરગાહ	d̪ ə ɾ ɡ ɑʱ
દરવાજો	d̪ ə ɾ ʋ ɑ d͡ʒ o
દવે	d̪ ə ʋ eː
દશ	d ə ʃ
દસ	d ə s
દહીં	d̪ ə ɦ ĩ
દાડમ	d̪ ɑ ɖ ə m
દાઢી	d̪ ɑ ɖʱ i
દાળ	d̪ ɑ ɭ
દિયર	d̪ ɪ j ə ɾ
દિલ્હી	d̪ ɪ l ɦ i
દિવસ	d̪ ɪ ʋ ə s
દિવાળી	d̪ ɪ ʋ ɑ ɭ i
દીદી	d̪ i d̪ i
દીવાનું	d̪ i ʋ ɑ n ũ
દુઃસ્વપ્ન	d̪ uʰ s ʋ ə p n ə
દુઆ	d̪ u ɑ
દૂધ	d̪ u d̪ʱ
દૂરદર્શન	d̪ u ɾ d̪ ə ɾ ʃ ə n
દેરું	d̪ eː ɾ ũ
દેવ	d̪ eː ʋ
ધ	dʱ ə
ધણીધણિયાણી	d̪ʱ ə ɳ i d̪ʱ ɳ ɪ j ɑ ɳ i
ધન્યવાદ	d̪ʱ ə n j ə ʋ ɑ d̪
ધૂમ્રપાન	d̪ʱ u m ɾ ə p ɑ n
ધૂળ	d̪ʱ u ɭ
ધોરીમાર્ગ	d̪ʱ o ɾ i m ɑ ɾ ɡ
ધ્વનિ	d̪ʱ ʋ ə n ɪ
ન	n ə
નંબર	n ə m b ə ɾ
નથ	n ə t̪ʰ
નપુંસકલિંગ	n ə p ũ s ə k l ɪ ŋ ɡ
નમસ્તે	n ə m ə s t̪ eː
નમાજ	n ə m ɑ d͡ʒ
નમાજ	n ə m ɑ z
નળ	n ə ɭ
નવ	n ə ʋ
નવરોજ	n ə ʋ ɾ o d͡ʒ
નવાપુર	n ə ʋ ɑ p u ɾ
નવાબ	n ə ʋ ɑ b
નવેમ્બર	n ə ʋ eː m b ə ɾ
નસીબ	n ə s i b
નસ્તાલીક	n ə s t̪ ɑ l i k
નાખવું	n ɑ kʰ ʋ ũ
નાચવું	n ɑ t͡ʃ ʋ ũ
નાટક	n ɑ ʈ ə k
નાતાલ	n ɑ t̪ ɑ l
નાથ	n ɑ t̪ʰ
નાન્યતર	n ɑ n j ə t̪ ə ɾ
નાર	n ɑ ɾ
નારી	n ɑ ɾ i
નિકાસ	n ɪ k ɑ s
નિબંધ	n ɪ b ə n d̪ʱ
નિર્ણય	n ɪ ɾ ɳ ə j ə
નિશાળ	n ɪ ʃ ɑ ɭ
નૃત્ય	n r̩ t̪ j ə
ને	n eː
પ	p ə
પંખો	p ə ŋ kʰ o
પંજાબ	p ə ɲ d͡ʒ ɑ b
પંદર	p ə n d ə ɾ
પક્ષી	p ə k ʃ i
પખવાડિયું	p ə kʰ ʋ ɑ ɖ ɪ j ũ
પગલૂછણિયું	p ə ɡ l u t͡ʃʰ ɳ ɪ j ũ
પટેલ	p ə ʈ eː l
પઠાણ	p ə ʈʰ ɑ ɳ
પણ	p ə ɳ
પતંગ	p ə t̪ ə ŋ ɡ
પત્ની	p ə t̪ n i
પદ્મ	p ə d̪ m ə
પપૈયું	p ə p ə ɪ j ũ
પરદેશ	p ə ɾ d̪ eː ʃ
પરમેશ્વર	p ə ɾ m eː ʃ ʋ ə ɾ
પરાઠા	p ə ɾ ɑ ʈʰ ɑ
પરિવાર	p ə ɾ ɪ ʋ ɑ ɾ
પરિસ્થિતિ	p ə ɾ ɪ s t̪ʰ ɪ t̪ ɪ
પરીખ	p ə ɾ i kʰ
પર્વત	p ə ɾ ʋ ə t̪
પળ	p ə ɭ
પવન	p ə ʋ ə n
પહાડ	p ə ɦ ɑ ɖ
પાંચ	p ɑ̃ː t͡ʃ
પાંસળી	p ɑ̃ s ə ɭ i
પાણી	p ɑ ɳ i
પાણીપુરી	p ɑ ɳ i p u ɾ i
પાદરી	p ɑ d̪ ɾ i
પાનખર	p ɑ n kʰ ə ɾ
પાનું	p ɑ n ũ
પારકું	p ɑ ɾ k ũ
પારેખ	p ɑ ɾ eː kʰ
પિતા	p ɪ t̪ ɑ
પિત્તળ	p ɪ t̪ t̪ ə ɭ
પિસ્તોલ	p ɪ s t̪ o l
પીંછું	p ĩ t͡ʃʰ ũ
પીછું	p i t͡ʃʰ ũ
પીઠ	p i ʈʰ
પીઠી	p i ʈʰ i
પીઠું	p i ʈʰ ũ
પુંલિંગ	p ũ l ɪ ŋ ɡ
પુત્રી	p u t̪ ɾ i
પુર	p u ɾ
પુરી	p u ɾ i
પુસ્તક	p u s t̪ ə k
પુસ્તકાલય	p u s t̪ ə k ɑ l j ə
પૂંજી	p ũ d͡ʒ i
પૂજા	p u d͡ʒ ɑ
પૃથ્વી	p r̩ t̪ʰ ʋ i
પેન	p eː n
પેશવા	p eː ʃ ʋ ɑ
પોપૈયું	p o p ə ɪ j ũ
પોર્ટુગલ	p o ɾ ʈ u ɡ ə l
પ્રકાર	p ɾ ə k ɑ ɾ
પ્રકાશ	p ɾ ə k ɑ ʃ
પ્રકાશિત	p ɾ ə k ɑ ʃ ɪ t̪
પ્રગટવું	p ɾ ə ɡ ə ʈ ʋ ũ
પ્રણામ	p ɾ ə ɳ ɑ m
પ્રશ્ન	p ɾ ə ʃ n ə
પ્રાકૃત	p ɾ ɑ k r̩ t̪
પ્રાચી	p ɾ ɑ t͡ʃ i
પ્રાચીન	p ɾ ɑ t͡ʃ i n
પ્રાણ	p ɾ ɑ ɳ
પ્રેમિકા	p ɾ eː m ɪ k ɑ
ફ	f
ફ	pʰ ə
ફ	ɸ
ફજર	pʰ ə d͡ʒ ə ɾ
ફળ	pʰ ə ɭ
ફાનસ	pʰ ɑ n ə s
ફેબ્રુઆરી	pʰ eː b ɾ u ɑ ɾ i
ફ્રાંસ	pʰ ɾ ɑ̃ s
ફ્રાંસીસી	pʰ ɾ ɑ̃ː s i s i
બ	b ə
બંબો	b ə m b o
બદામ	b ə d̪ ɑ m
બરાક	b ə ɾ ɑ k
બળવાન	b ə ɭ ʋ ɑ n
બસ	b ə s
બહુ	b ə ɦ u
બહેરામ	b ə ɦ eː ɾ ɑ m
બાંગ	b ɑ̃ ɡ
બાંધવું	b ɑ̃ d̪ʱ ʋ ũ
બાઇબલ	b ɑ ɪ b ə l
બાઈડી	b ɑ i ɖ i
બાગ	b ɑ ɡ
બાટલી	b ɑ ʈ l i
બાદશાહ	b ɑ d̪ ʃ ɑʱ
બાફવું	b ɑ pʰ ʋ ũ
બાબો	b ɑ b o
બાર	b ɑ ɾ
બાલદી	b ɑ l d̪ i
બાળપણ	b ɑ ɭ p ə ɳ
બિંદુ	b ɪ n d̪ u
બિરયાની	b ɪ ɾ j ɑ n i
બિસ્કિટ	b ɪ s k ɪ ʈ
બિસ્મિલ્લા	b ɪ s m ɪ l l ɑ
બિહાર	b ɪ ɦ ɑ ɾ
બીજ	b i d͡ʒ
બુત	b u t̪
બુતાન	b u t̪ ɑ n
બુધ	b u d̪ʱ
બૂચ	b u t͡ʃ
બૂડવું	b u ɖ ʋ ũ
બે	b e
બેવકૂફ	b eː ʋ ə k u pʰ
બેસવું	b eː s ʋ ũ
બ્રહ્મદેશ	b ɾ əʱ m ə d̪ eː ʃ
બ્રિંજલ	b ɾ ɪ ɲ d͡ʒ ə l
બ્રિટન	b ɾ ɪ ʈ ə n
ભ	bʱ ə
ભગવાન	bʱ ə ɡ ʋ ɑ n
ભજન	bʱ ə d͡ʒ ə n
ભણવું	bʱ ə ɳ ʋ ũ
ભરવું	bʱ ə ɾ ʋ ũ
ભવાઇ	bʱ ə ʋ ɑ ɪ
ભાઈ	bʱ ɑ i
ભાભી	bʱ ɑ bʱ i
ભારત	bʱ ɑ ɾ ə t̪
ભાર્યા	bʱ ɑ ɾ j ɑ
ભાષણ	bʱ ɑ ʃ ə ɳ
ભિસ્તી	bʱ ɪ s t̪ i
ભીખ	bʱ i kʰ
ભીલ	bʱ i l
ભૂખહડતાળ	bʱ u kʰ ɦ ə ɖ t̪ ɑ ɭ
ભોં	bʱ õ
મ	m ə
મંગળ	m ə ŋ ɡ ə ɭ
મંગળવાર	m ə ŋ ɡ ə ɭ ʋ ɑ ɾ
મંદિર	m ə n d̪ ɪ ɾ
મકબરો	m ə k b ə ɾ o
મકાન	m ə k ɑ n
મગ	m ə ɡ
મગજ	m ə ɡ ə d͡ʒ
મગર	m ə ɡ ə ɾ
મગરિબ	m ə ɡ ɾ ɪ b
મધમાખી	m ə d̪ʱ m ɑ kʰ i
મધુ	m ə d̪ʱ u
મન	m ə n
મફત	m ə pʰ ə t̪
મર્ચન્ટ	m ə ɾ t͡ʃ ə n ʈ
મસીદ	m ə s i d̪
મસ્જિદ	m ə s d͡ʒ ɪ d̪
મસ્તિષ્ક	m ə s t̪ ɪ ʃ k
મહત્ત્વ	m ə ɦ ə t̪ t̪ ʋ ə
મહારાણી	m ə ɦ ɑ ɾ ɑ ɳ i
મહિલા	m ə ɦ ɪ l ɑ
માંડો	m ɑ̃ ɖ o
માખણ	m ɑ kʰ ə ɳ
માગ	m ɑ ɡ
માટે	m ɑ ʈ e
માતા	m ɑ t̪ ɑ
મારવાડ	m ɑ ɾ ʋ ɑ ɖ
મારા	m ɑ ɾ ɑ
મારી	m ɑ ɾ i
માર્ગ	m ɑ ɾ ɡ
માર્ચ	m ɑ ɾ t͡ʃ
માવડી	m ɑ ʋ ɖ i
માશાલ્લાહ	m ɑ ʃ ɑ l l ɑʱ
મિસર	m ɪ s ə ɾ
મુઘલ	m u ɡʱ ə l
મુસલ્લો	m u s ə l l o
મુહર્રમ	m u ɦ ə ɾ ɾ ə m
મુહલ્લા	m u ɦ ə l l ɑ
મૂડીવાદ	m u ɖ i ʋ ɑ d̪
મે	m eː
મેંદી	m eː n d̪ i
મેકવાન	m eː k ʋ ɑ n
મેઘ	m eː ɡʱ
મેઘધનુષ	m eː ɡʱ ə d̪ʱ ə n u ʂ
મેહ	m eːʱ
મોટરસાયકલ	m o ʈ ə ɾ s ɑ j ə k ə l
મોસંબી	m o s ə m b i
મોહબત	m oʱ b ə t̪
મોહમ્મદ	m o ɦ ə m m ə d̪
ય	j ə
યાર	j ɑ ɾ
ર	ɾ ə
રંગવું	ɾ ə ŋ ɡ ʋ ũ
રક્ત	ɾ ə k t̪
રક્ષા	ɾ ə k ʃ ɑ
રણવાસ	ɾ ə ɳ ʋ ɑ s
રથ	ɾ ə t̪ʰ
રમઝાન	ɾ ə m d͡ʒʱ ɑ n
રમઝાન	ɾ ə m z ɑ n
રમત	ɾ ə m ə t̪
રવિ	ɾ ə ʋ ɪ
રશિયા	ɾ ə ʃ ɪ j ɑ
રસૂલ	ɾ ə s u l
રસોડું	ɾ ə s o ɖ ũ
રહેમાન	ɾ ə ɦ eː m ɑ n
રાંધવું	ɾ ɑ̃ d̪ʱ ʋ ũ
રાઈતું	ɾ ɑ i t̪ ũ
રાખસ	ɾ ɑ kʰ ə s
રાજપૂત	ɾ ɑ d͡ʒ p u t̪
રાજમાર્ગ	ɾ ɑ d͡ʒ m ɑ ɾ ɡ
રાજા	ɾ ɑ d͡ʒ ɑ
રાજીવ	ɾ ɑ d͡ʒ i ʋ
રામાયણ	ɾ ɑ m ɑ j ə ɳ
રાય	ɾ ɑ j ə
રિક્ષા	ɾ ɪ k ʃ ɑ
રિચાર્ડ	ɾ ɪ t͡ʃ ɑ ɾ ɖ
રૂસ	ɾ u s
રોજો	ɾ o d͡ʒ o
લ	l ə
લંકા	l ə ŋ k ɑ
લગ્ન	l ə ɡ n ə
લઘુતાદર્શક	l ə ɡʱ u t̪ ɑ d̪ ə ɾ ʃ ə k
લતા	l ə t̪ ɑ
લપસણી	l ə p ə s ɳ i
લહર	l ə ɦ ə ɾ
લાકડું	l ɑ k ɖ ũ
લિંગ	l ɪ ŋ ɡ
લિલામ	l ɪ l ɑ m
લીખ	l i kʰ
લુપ્ત	l u p t̪
લેખક	l eː kʰ ə k
લોપ	l o p
ળ	ɭ ə
વ	v ə
વચલું	ʋ ə t͡ʃ l ũ
વડ	ʋ ə ɖ
વડોદરા	ʋ ə ɖ o d̪ ɾ ɑ
વતન	ʋ ə t̪ ə n
વધારે	ʋ ə d̪ʱ ɑ ɾ e
વય	ʋ ə j ə
વર	ʋ ə ɾ
વર્ણમાળા	ʋ ə ɾ ɳ ə m ɑ ɭ ɑ
વર્ષા	ʋ ə ɾ ʃ ɑ
વલંદો	ʋ ə l ə n d̪ o
વસંત	ʋ ə s ə n t̪
વસ્તુ	ʋ ə s t̪ u
વાંસળી	ʋ ɑ̃ s ə ɭ i
વાક	ʋ ɑ k
વાઘણ	ʋ ɑ ɡʱ ə ɳ
વાપરવું	ʋ ɑ p ə ɾ ʋ ũ
વાયુ	ʋ ɑ j u
વાળ	ʋ ɑ ɭ
વાસણ	ʋ ɑ s ə ɳ
વિક્ષનરી	ʋ i k ʃ ə n ə ɾ i
વિચાર	ʋ ɪ t͡ʃ ɑ ɾ
વિજ્ઞાન	ʋ ɪ ɡ n ɑ n
વિલિયમ	ʋ ɪ l ɪ j ə m
વિહોણું	ʋ ɪ ɦ o ɳ ũ
વીણા	ʋ i ɳ ɑ
વીર	ʋ i ɾ
વીસ	ʋ iː s
વુજૂ	ʋ u d͡ʒ u
વુજૂ	ʋ u z u
વૃષ્ટિ	ʋ r̩ ʂ ʈ ɪ
વેલ્સ	ʋ eː l s
વૈશાખ	ʋ ə ɪ ʃ ɑ kʰ
વૈષ્ણવ	ʋ ə ɪ ʃ ɳ ə ʋ
વ્યાકરણ	ʋ j ɑ k ɾ ə ɳ
શ	ʃ ə
શંખ	ʃ ə ŋ kʰ
શક્તિ	ʃ ə k t̪ ɪ
શનિ	ʃ ə n ɪ
શરદ	ʃ ə ɾ ə d̪
શાક્યમુનિ	ʃ ɑ k j ə m u n ɪ
શાને	ʃ ɑ n eː
શામ	ʃ ɑ m
શિશિર	ʃ ɪ ʃ ɪ ɾ
શીતલ	ʃ i t̪ ə l
શુક્ર	ʃ u k ɾ ə
શૂન્ય	ʃ u n j ə
શેકવું	ʃ eː k ʋ ũ
શૈવ	ʃ ə ɪ ʋ
શ્યામ	ʃ j ɑ m
શ્રી	ʃ ɾ iː
શ્રીલંકા	ʃ ɾ i l ə ŋ k ɑ
શ્વાસ	ʃ ʋ ɑ s
ષ	ʂ ə
સ	s ə
સંતરું	s ə n t̪ ɾ ũ
સંસ્મરણ	s ã s m ə ɾ ə ɳ
સડક	s ə ɖ ə k
સત્તર	s ə t t ə r
સપ્ટેમ્બર	s ə p ʈ eː m b ə ɾ
સમુદ્ર	s ə m u d̪ ɾ ə
સરકાર	s ə ɾ k ɑ ɾ
સરસ્વતી	s ə ɾ ə s ʋ ə t̪ i
સરસ્વતીચંદ્ર	s ə ɾ ə s ʋ ə t̪ i t͡ʃ ə n d̪ ɾ ə
સરિતા	s ə ɾ ɪ t̪ ɑ
સલાત	s ə l ɑ t̪
સલામ	s ə l ɑ m
સલાહ	s ə l ɑʱ
સલાહકાર	s ə l ɑʱ k ɑ ɾ
સહિયર	s ə ɦ ɪ j ə ɾ
સહી	s ə ɦ i
સાંજ	s ɑ̃ d͡ʒ
સાગર	s ɑ ɡ ə ɾ
સાત	s ɑ t
સાપ	s ɑ p
સાબુ	s ɑ b u
સામાન	s ɑ m ɑ n
સામેલ	s ɑ m eː l
સારું	s ɑ ɾ ũ
સાવધાન	s ɑ ʋ d̪ʱ ɑ n
સાહ	s ɑʱ
સિંદૂર	s ɪ n d̪ u ɾ
સિંધ	s ɪ n d̪ʱ
સિંધુ	s ɪ n d̪ʱ u
સિંધુદેશ	s ɪ n d̪ʱ u d̪ eː ʃ
સિંહ	s ĩ ɦ
સિંહ	ʃ ĩ ɦ
સિગારેટ	s ɪ ɡ ɑ ɾ eː ʈ
સિજદો	s ɪ d͡ʒ d̪ o
સુંદરતા	s u n d̪ ə ɾ t̪ ɑ
સુરીલું	s u ɾ i l ũ
સૂફી	s u pʰ i
સૂરજમુખી	s u ɾ ə d͡ʒ m u kʰ i
સેબ	s eː b
સૈનિક	s ə ɪ n ɪ k
સોનું	s o n ũ
સોપારી	s o p ɑ ɾ i
સોમ	s o m
સોળ	s ɔ ɭ
સ્ત્રી	s t̪ ɾ i
સ્ત્રીલિંગ	s t̪ ɾ i l ɪ ŋ ɡ
સ્વપ્ન	s ʋ ə p n ə
સ્વર્ગ	s ʋ ə ɾ ɡ
સ્વાગત	s ʋ ɑ ɡ ə t̪
સ્વામી	s ʋ ɑ m i
સ્વેટર	s ʋ eː ʈ ə ɾ
હ	ɦ ə
હંમેશાં	ɦ ə m m eː ʃ ɑ̃
હંસ	ɦ ã s
હજ	ɦ ə d͡ʒ
હબશી	ɦ ə b ʃ i
હરિકેન	ɦ ə ɾ ɪ k eː n
હલાલ	ɦ ə l ɑ l
હળ	ɦ ə ɭ
હવા	ɦ ə ʋ ɑ
હસવું	ɦ ə s ʋ ũ
હાંડવો	ɦ ɑ̃ ɖ ʋ o
હાથી	ɦ ɑ t̪ʰ i
હુકમ	ɦ u k ə m
હેમંત	ɦ eː m ə n t̪
હેલો	ɦ eː l o
હૈયું	ɦ ə ɪ j ũ
હોટેલ	ɦ o ʈ eː l
હોવું	ɦ o ʋ ũ
હોસ્પિટલ	ɦ o s p ɪ ʈ ə l
