नाज़ीवाद	n̪ äː d͡ʒ iː ʋ äː d̪
नाज़ीवाद	n̪ äː z iː ʋ äː d̪
नाज़ुक	n̪ äː d͡ʒ ʊ k
नाज़ुक	n̪ äː z ʊ k
नाज़ुकी	n̪ äː d͡ʒ ʊ k iː
नाज़ुकी	n̪ äː z ʊ k iː
नाजायज़	n̪ äː d͡ʒ äː j ə d͡ʒ
नाजायज़	n̪ äː d͡ʒ äː j ə z
नाटक	n̪ äː ʈ ə k
नाटककार	n̪ äː ʈ ə k̚ k äː ɾ
नाटा	n̪ äː ʈ äː
नाड़ी	n̪ äː ɽ iː
नाडु	n̪ äː ɖ uː
नाता	n̪ äː t̪ äː
नातिन	n̪ äː t̪ ɪ̃ n̪
नाती	n̪ aː t̪ iː
नाथ	n̪ äː t̪ʰ
नादान	n̪ äː d̪ ä̃ː n̪
नादानी	n̪ äː d̪ äː n̪ iː
नादिरशाही	n̪ äː d̪ ɪ ɾ ʃ äː ɦ iː
नादिरी	n̪ äː d̪ ɪ ɾ iː
नान	n̪ ä̃ː n̪
नानबाई	n̪ ä̃ː n̪ b äː iː
नानस	n̪ äː n̪ ə s̪
नानसरा	n̪ äː n̪ ə s̪ ɾ äː
नाना	n̪ äː n̪ äː
नानाओ	n̪ äː n̪ äː oː
नानाओं	n̪ äː n̪ äː õː
नानियाँ	n̪ äː n̪ i j ä̃ː
नानियो	n̪ äː n̪ i j oː
नानियों	n̪ äː n̪ i j õː
नानी	n̪ äː n̪ iː
नानू	n̪ äː n̪ uː
नाप	n̪ äː p
नापना	n̪ äː p n̪ äː
नापसंद	n̪ äː p ə s̪ ə̃ n̪ d̪
नाफ़	n̪ äː f
नाफ़	n̪ äː pʰ
नाफ़रमान	n̪ äː f ə ɾ m ä̃ː n̪
नाफ़रमान	n̪ äː pʰ ə ɾ m ä̃ː n̪
नाबालिग़	n̪ äː b äː l̪ ɪ ɡ
नाबालिग़	n̪ äː b äː l̪ ɪ ɣ
नाभि	n̪ äː bʱ iː
नाभिक	n̪ äː bʱ ɪ k
नाभिकीय	n̪ äː bʱ ɪ k iː jᵊ
नाम	n̪ ä̃ː m
नामंज़ूर	n̪ äː m ə̃ d͡ʒ uː ɾ
नामंज़ूर	n̪ äː m ə̃ z uː ɾ
नामक	n̪ äː m ə k
नामकरण	n̪ ä̃ː m k ə ɾ ə̃ ɳ
नामनिर्देशिती	n̪ ä̃ː m n̪ ɪ ɾ d̪ eː ʃ ɪ t̪ iː
नामवर	n̪ ä̃ː m w ə ɾ
नामा	n̪ äː m äː
नामांकन	n̪ äː m ä̃ː ŋ k ə̃ n̪
नामीबिया	n̪ äː m iː b i j äː
नामो	n̪ äː m oː
नामों	n̪ äː m õː
नामोत्पत्ति	n̪ äː m oː t̪ p ə t̪̚ t̪ iː
नायक	n̪ äː j ə k
नायब	n̪ äː j ə b
नायाब	n̪ äː j äː b
नायिका	n̪ äː j ɪ k äː
नार	n̪ äː ɾ
नारंगी	n̪ äː ɾ ə̃ ŋ ɡ iː
नारा	n̪ äː ɾ äː
नाराज़	n̪ äː ɾ äː d͡ʒ
नाराज़	n̪ äː ɾ äː z
नारायण	n̪ äː ɾ äː j ə̃ ɳ
नारियल	n̪ äː ɾ i j ə l̪
नारियाँ	n̪ äː ɾ i j ä̃ː
नारियो	n̪ äː ɾ i j oː
नारियों	n̪ äː ɾ i j õː
नारी	n̪ äː ɾ iː
नारीत्व	n̪ äː ɾ iː t̪ wᵊ
नारीवाद	n̪ äː ɾ iː ʋ äː d̪
नाल	n̪ äː l̪
नाला	n̪ äː l̪ äː
नालायक	n̪ äː l̪ äː j ə k
नालायक	n̪ äː l̪ äː j ə q
नाव	n̪ äː ʋ
नाविक	n̪ äː ʋ ɪ k
नाशपाती	n aː ʃ p aː t̪ iː
नाश्ता	n̪ äː ʃ t̪ äː
नासमझ	n̪ äː s̪ ə m ə d͡ʒʱ
नासरत	n̪ äː s̪ ə ɾ ə t̪
नासिक	n̪ äː s̪ ɪ k
नास्तिक	n̪ äː s̪ t̪ ɪ k
नास्तिकता	n̪ äː s̪ t̪ ɪ k t̪ äː
नाहर	n̪ äː ɦ ə ɾ
निंदा	n̪ ɪ̃ n̪ d̪ äː
निंदासा	n̪ ɪ̃ n̪ d̪ äː s̪ äː
निःशब्द	n̪ ɪ ɦ ʃ ə b d̪
निःशुल्क	n̪ ɪ ɦ ʃ ʊ l̪ k
निकट	n̪ ɪ k ə ʈ
निकम्मा	n̪ ɪ k ə̃ m m äː
निकम्मापन	n̪ ɪ k ə̃ m m äː p ə̃ n̪
निकर	n̪ ɪ k ə ɾ
निकलता	n̪ ɪ k ə l̪ t̪ äː
निकलती	n̪ ɪ k ə l̪ t̪ iː
निकलतीं	n̪ ɪ k ə l̪ t̪ ĩː
निकलते	n̪ ɪ k ə l̪ t̪ eː
निकलना	n̪ ɪ k ə l̪ n̪ äː
निकलने	n̪ ɪ k ə l̪ n̪ eː
निकलनेवाला	n̪ ɪ k ə l̪ n̪ eː ʋ äː l̪ äː
निकलनेवालीं	n̪ ɪ k ə l̪ n̪ eː ʋ äː l̪ ĩː
निकलनेवाले	n̪ ɪ k ə l̪ n̪ eː ʋ äː l̪ eː
निकलवा	n̪ ɪ k ə l̪ ʋ äː
निकलवाइये	n̪ ɪ k ə l̪ ʋ äː i j eː
निकलवाइयेगा	n̪ ɪ k ə l̪ ʋ äː i j eː ɡ äː
निकलवाइयो	n̪ ɪ k ə l̪ ʋ äː i j oː
निकलवाऊँ	n̪ ɪ k ə l̪ ʋ äː ũː
निकलवाऊँगा	n̪ ɪ k ə l̪ ʋ äː ũː ŋ ɡ äː
निकलवाऊँगी	n̪ ɪ k ə l̪ ʋ äː ũː ŋ ɡ iː
निकलवाओ	n̪ ɪ k ə l̪ ʋ äː oː
निकलवाओगी	n̪ ɪ k ə l̪ ʋ äː oː ɡ iː
निकलवाओगे	n̪ ɪ k ə l̪ ʋ äː oː ɡ eː
निकलवाकर	n̪ ɪ k ə l̪ ʋ äː k ə ɾ
निकलवाके	n̪ ɪ k ə l̪ ʋ äː k eː
निकलवाता	n̪ ɪ k ə l̪ ʋ äː t̪ äː
निकलवाती	n̪ ɪ k ə l̪ ʋ äː t̪ iː
निकलवातीं	n̪ ɪ k ə l̪ ʋ äː t̪ ĩː
निकलवाते	n̪ ɪ k ə l̪ ʋ äː t̪ eː
निकलवाना	n̪ ɪ k ə l̪ ʋ äː n̪ äː
निकलवानी	n̪ ɪ k ə l̪ ʋ äː n̪ iː
निकलवानीं	n̪ ɪ k ə l̪ ʋ äː n̪ ĩː
निकलवाने	n̪ ɪ k ə l̪ ʋ äː n̪ eː
निकलवानेवाला	n̪ ɪ k ə l̪ ʋ äː n̪ eː ʋ äː l̪ äː
निकलवानेवाली	n̪ ɪ k ə l̪ ʋ äː n̪ eː ʋ äː l̪ iː
निकलवानेवालीं	n̪ ɪ k ə l̪ ʋ äː n̪ eː ʋ äː l̪ ĩː
निकलवानेवाले	n̪ ɪ k ə l̪ ʋ äː n̪ eː ʋ äː l̪ eː
निकलवाया	n̪ ɪ k ə l̪ ʋ äː j äː
निकलवायी	n̪ ɪ k ə l̪ ʋ äː j iː
निकलवायीं	n̪ ɪ k ə l̪ ʋ äː j ĩː
निकलवाये	n̪ ɪ k ə l̪ ʋ äː j eː
निकलवायें	n̪ ɪ k ə l̪ ʋ äː j ẽː
निकलवायेंगी	n̪ ɪ k ə l̪ ʋ äː j ẽː ŋ ɡ iː
निकलवायेंगे	n̪ ɪ k ə l̪ ʋ äː j ẽː ŋ ɡ eː
निकलवायेगा	n̪ ɪ k ə l̪ ʋ äː j eː ɡ äː
निकलवायेगी	n̪ ɪ k ə l̪ ʋ äː j eː ɡ iː
निकला	n̪ ɪ k l̪ äː
निकलिये	n̪ ɪ k l̪ i j eː
निकलियेगा	n̪ ɪ k l̪ i j eː ɡ äː
निकली	n̪ ɪ k l̪ iː
निकलीं	n̪ ɪ k l̪ ĩː
निकलूँ	n̪ ɪ k l̪ ũː
निकलूँगा	n̪ ɪ k l̪ ũː ŋ ɡ äː
निकलूँगी	n̪ ɪ k l̪ ũː ŋ ɡ iː
निकले	n̪ ɪ k l̪ eː
निकलें	n̪ ɪ k l̪ ẽː
निकलेंगी	n̪ ɪ k l̪ ẽː ŋ ɡ iː
निकलेंगे	n̪ ɪ k l̪ ẽː ŋ ɡ eː
निकलेगा	n̪ ɪ k l̪ eː ɡ äː
निकलेगी	n̪ ɪ k l̪ eː ɡ iː
निकलो	n̪ ɪ k l̪ oː
निकलोगी	n̪ ɪ k l̪ oː ɡ iː
निकलोगे	n̪ ɪ k l̪ oː ɡ eː
निक़ाब	n̪ ɪ k äː b
निक़ाब	n̪ ɪ q äː b
निकारागुआ	n̪ ɪ k äː ɾ äː ɡ ʊ äː
निकाल	n̪ ɪ k äː l̪
निकालकर	n̪ ɪ k äː l̪ k ə ɾ
निकालके	n̪ ɪ k äː l̪ k eː
निकालता	n̪ ɪ k äː l̪ t̪ äː
निकालती	n̪ ɪ k äː l̪ t̪ iː
निकालतीं	n̪ ɪ k äː l̪ t̪ ĩː
निकालते	n̪ ɪ k äː l̪ t̪ eː
निकालना	n̪ ɪ k äː l̪ n̪ äː
निकालनी	n̪ ɪ k äː l̪ n̪ iː
निकालनीं	n̪ ɪ k äː l̪ n̪ ĩː
निकालने	n̪ ɪ k äː l̪ n̪ eː
निकालनेवाला	n̪ ɪ k äː l̪ n̪ eː ʋ äː l̪ äː
निकालनेवाली	n̪ ɪ k äː l̪ n̪ eː ʋ äː l̪ iː
निकालनेवालीं	n̪ ɪ k äː l̪ n̪ eː ʋ äː l̪ ĩː
निकालनेवाले	n̪ ɪ k äː l̪ n̪ eː ʋ äː l̪ eː
निकाला	n̪ ɪ k äː l̪ äː
निकालिये	n̪ ɪ k äː l̪ i j eː
निकालियेगा	n̪ ɪ k äː l̪ i j eː ɡ äː
निकालियो	n̪ ɪ k äː l̪ i j oː
निकाली	n̪ ɪ k äː l̪ iː
निकालीं	n̪ ɪ k äː l̪ ĩː
निकालूँ	n̪ ɪ k äː l̪ ũː
निकालूँगा	n̪ ɪ k äː l̪ ũː ŋ ɡ äː
निकालूँगी	n̪ ɪ k äː l̪ ũː ŋ ɡ iː
निकाले	n̪ ɪ k äː l̪ eː
निकालें	n̪ ɪ k äː l̪ ẽː
निकालेंगी	n̪ ɪ k äː l̪ ẽː ŋ ɡ iː
निकालेंगे	n̪ ɪ k äː l̪ ẽː ŋ ɡ eː
निकालेगा	n̪ ɪ k äː l̪ eː ɡ äː
निकालेगी	n̪ ɪ k äː l̪ eː ɡ iː
निकालो	n̪ ɪ k äː l̪ oː
निकालोगी	n̪ ɪ k äː l̪ oː ɡ iː
निकालोगे	n̪ ɪ k äː l̪ oː ɡ eː
निकास	n̪ ɪ k äː s̪
निकाह	n̪ ɪ k äː ɦ
निकाहनामा	n̪ ɪ k äː ɦ n̪ äː m äː
निकोबार	n̪ ɪ k oː b äː ɾ
निखट्टू	n̪ ɪ kʰ ə ʈ̚ ʈ uː
निखरना	n̪ ɪ kʰ ə ɾ n̪ äː
निखारना	n̪ ɪ kʰ äː ɾ n̪ äː
निगम	n̪ ɪ ɡ ə̃ m
निगमन	n̪ ɪ ɡ ə m ə̃ n̪
निगरानी	n̪ ɪ ɡ ɾ äː n̪ iː
निगलना	n̪ ɪ ɡ ə l̪ n̪ äː
निगाह	n̪ ɪ ɡ äː ɦ
निचला	n̪ ɪ t͡ʃ l̪ äː
निचोड़	n̪ ɪ t͡ʃ oː ɽ
निचोड़ना	n̪ ɪ t͡ʃ oː ɽ n̪ äː
निज	n̪ ɪ d͡ʒ
निज़ाम	n̪ ɪ d͡ʒ ä̃ː m
निज़ाम	n̪ ɪ z ä̃ː m
निज़ामाबाद	n̪ ɪ d͡ʒ äː m äː b äː d̪
निज़ामाबाद	n̪ ɪ z äː m äː b äː d̪
निजात	n̪ ɪ d͡ʒ äː t̪
निजी	n̪ ɪ d͡ʒ iː
निजीकरण	n̪ ɪ d͡ʒ iː k ə ɾ ə̃ ɳ
नितंब	n̪ ɪ t̪ ə̃ m b
नित्य	n̪ ɪ t̪ jᵊ
नित्यप्रति	n̪ ɪ t̪ j ə p ɾ ə t̪ iː
निथरना	n̪ ɪ t̪ʰ ə ɾ n̪ äː
निदेशक	n̪ ɪ d̪ eː ʃ ə k
निद्र	n̪ ɪ d̪ ɾᵊ
निनानवे	n̪ ɪ n̪ ä̃ː n̪ w eː
निन्दित	n̪ ɪ̃ n̪ d̪ ɪ t̪
निन्यानवे	n̪ ɪ̃ n̪ j ä̃ː n̪ w eː
निपुण	n̪ ɪ p ʊ̃ ɳ
निपूता	n̪ ɪ p uː t̪ äː
निबंध	n̪ ɪ b ə̃ n̪ d̪ʱ
निबंधन	n̪ ɪ b ə̃ n̪ d̪ʱ ə̃ n̪
निबाह	n̪ ɪ b äː ɦ
निबाहना	n̪ ɪ b äː ɦ n̪ äː
निभाना	n̪ ɪ bʱ äː n̪ äː
निमंत्रण	n̪ ɪ m ə̃ n̪ t̪ ɾ ə̃ ɳ
निमय	n̪ ɪ m ə j
निम्न	n̪ ɪ̃ m n̪ᵊ
निम्नलिखित	n̪ ɪ̃ m n̪ ə l̪ ɪ kʰ ɪ t̪
नियंत्रित	n̪ i j ə̃ n̪ t̪ ɾ ɪ t̪
नियत	n̪ i j ə t̪
नियतत्ववाद	n̪ ɪ j t̪ ə t̪ w ə ʋ äː d̪
नियति	n̪ i j ə t̪ iː
नियम	n̪ i j ə̃ m
नियमावलियाँ	n̪ i j ə m äː ʋ ə l̪ i j ä̃ː
नियमावलियो	n̪ i j ə m äː ʋ ə l̪ i j oː
नियमावलियों	n̪ i j ə m äː ʋ ə l̪ i j õː
नियमावली	n̪ i j ə m äː ʋ ə l̪ iː
नियमित	n̪ i j ə m ɪ t̪
नियमो	n̪ i j ə m oː
नियमों	n̪ i j ə m õː
नियाज़	n̪ i j äː d͡ʒ
नियाज़	n̪ i j äː z
नियामक	n̪ i j äː m ə k
नियुक्त	n̪ i j ʊ k t̪
नियुक्ति	n̪ i j ʊ k t̪ iː
नियुक्तियाँ	n̪ i j ʊ k t̪ i j ä̃ː
नियुक्तियो	n̪ i j ʊ k t̪ i j oː
नियुक्तियों	n̪ i j ʊ k t̪ i j õː
निरंकुश	n̪ ɪ ɾ ə̃ ŋ k ʊ ʃ
निरंकुशवाद	n̪ ɪ ɾ ə̃ ŋ k ʊ ʃ ʋ äː d̪
निरंतर	n̪ ɪ ɾ ə̃ n̪ t̪ ə ɾ
निरपेक्ष	n̪ ɪ ɾ p eː k ʃ
निरभिमान	n̪ ɪ ɾ ə bʱ ɪ m ä̃ː n̪
निरस्त	n̪ ɪ ɾ ə s̪ t̪
निरस्त्रीकरण	n̪ ɪ ɾ ə s̪ t̪ ɾ iː k ə ɾ ə̃ ɳ
निराकार	n̪ ɪ ɾ äː k äː ɾ
निराला	n̪ ɪ ɾ äː l̪ äː
निरावेशित	n̪ ɪ ɾ äː ʋ eː ʃ ɪ t̪
निराश	n̪ ɪ ɾ äː ʃ
निराशा	n̪ ɪ ɾ äː ʃ äː
निराशावाद	n̪ ɪ ɾ äː ʃ äː ʋ äː d̪
निराहार	n̪ ɪ ɾ äː ɦ äː ɾ
निरीक्षक	n̪ ɪ ɾ iː k ʃ ə k
निरीक्षण	n̪ ɪ ɾ iː k ʃ ə̃ ɳ
निरूपण	n̪ ɪ ɾ uː p ə̃ ɳ
निरोग	n̪ ɪ ɾ oː ɡ
निरोध	n̪ ɪ ɾ oː d̪ʱ
निर्घोष	n̪ ɪ ɾ ɡʱ oː ʃ
निर्जन	n̪ ɪ ɾ d͡ʒ ə̃ n̪
निर्जलित	n̪ ɪ ɾ d͡ʒ ə l̪ ɪ t̪
निर्जीव	n̪ ɪ ɾ d͡ʒ iː ʋ
निर्णय	n̪ ɪ ɾ ɳ ə j
निर्णायक	n̪ ɪ ɾ ɳ äː j ə k
निर्दिष्ट	n̪ ɪ ɾ d̪ ɪ ʂ ʈ
निर्देश	n̪ ɪ ɾ d̪ eː ʃ
निर्देशक	n̪ ɪ ɾ d̪ eː ʃ ə k
निर्देशन	n̪ ɪ ɾ d̪ eː ʃ ə̃ n̪
निर्देशांक	n̪ ɪ ɾ d̪ eː ʃ ä̃ː ŋ k
निर्दोष	n̪ ɪ ɾ d̪ oː ʃ
निर्धन	n̪ ɪ ɾ d̪ʱ ə̃ n̪
निर्धनता	n̪ ɪ ɾ d̪ʱ ə̃ n̪ t̪ äː
निर्धारण	n̪ ɪ ɾ d̪ʱ äː ɾ ə̃ ɳ
निर्धारिती	n̪ ɪ ɾ d̪ʱ äː ɾ ɪ t̪ iː
निर्नैतिकतावाद	n̪ ɪ ɾ n̪ ɛː t̪ ɪ k t̪ äː ʋ äː d̪
निर्बल	n̪ ɪ ɾ b ə l̪
निर्भय	n̪ ɪ ɾ bʱ ə j
निर्भर	n̪ ɪ ɾ bʱ ə ɾ
निर्भरता	n̪ ɪ ɾ bʱ ə ɾ t̪ äː
निर्भरताएँ	n̪ ɪ ɾ bʱ ə ɾ t̪ äː ẽː
निर्भरताओं	n̪ ɪ ɾ bʱ ə ɾ t̪ äː õː
निर्मल	n̪ ɪ ɾ m ə l̪
निर्माण	n̪ ɪ ɾ m ä̃ː ɳ
निर्माता	n̪ ɪ ɾ m äː t̪ äː
निर्माताओ	n̪ ɪ ɾ m äː t̪ äː oː
निर्माताओं	n̪ ɪ ɾ m äː t̪ äː õː
निर्मित	n̪ ɪ ɾ m ɪ t̪
निर्मेघ	n̪ ɪ ɾ m eː ɡʱ
निर्यात	n̪ ɪ ɾ j äː t̪
निर्वाचन	n̪ ɪ ɾ ʋ äː t͡ʃ ə̃ n̪
निर्वाचित	n̪ ɪ ɾ ʋ äː t͡ʃ ɪ t̪
निर्वाह	n̪ ɪ ɾ ʋ äː ɦ
निलंबित	n̪ ɪ l̪ ə̃ m b ɪ t̪
निवाला	n̪ ɪ ʋ äː l̪ äː
निवास	n̪ ɪ ʋ äː s̪
निवासी	n̪ ɪ ʋ äː s̪ iː
निवासो	n̪ ɪ ʋ äː s̪ oː
निवासों	n̪ ɪ ʋ äː s̪ õː
निवृत्त	n̪ ɪ ʋ ɾ ɪ t̪ t̪
निवेदन	n̪ ɪ ʋ eː d̪ ə̃ n̪
निवेश	n̪ ɪ ʋ eː ʃ
निशान	n̪ ɪ ʃ ä̃ː n̪
निशाने	n̪ ɪ ʃ äː n̪ eː
निशानेबाज़ी	n̪ ɪ ʃ äː n̪ eː b äː d͡ʒ iː
निशानेबाज़ी	n̪ ɪ ʃ äː n̪ eː b äː z iː
निशानो	n̪ ɪ ʃ äː n̪ oː
निशानों	n̪ ɪ ʃ äː n̪ õː
निश्चय	n̪ ɪ ʃ t͡ʃ ə j
निश्चल	n̪ ɪ ʃ t͡ʃ ə l̪
निश्चित	n̪ ɪ ʃ t͡ʃ ɪ t̪
निषेचन	n̪ ɪ ʃ eː t͡ʃ ə̃ n̪
निषेधन	n̪ ɪ ʃ eː d̪ʱ ə̃ n̪
निषेधात्मक	n̪ ɪ ʃ eː d̪ʱ äː t̪ m ə k
निष्कर्ष	n̪ ɪ ʃ k ə ɾ ʃ
निष्कासन	n̪ ɪ ʃ k äː s̪ ə̃ n̪
निष्कासित	n̪ ɪ ʃ k äː s̪ ɪ t̪
निष्क्रिय	n̪ ɪ ʃ k ɾ ɪ j
निष्क्रियता	n̪ ɪ ʃ k ɾ ɪ j t̪ äː
निष्ठा	n̪ ɪ ʃ ʈʰ äː
निष्ठुर	n̪ ɪ ʃ ʈʰ ʊ ɾ
निष्णात	n̪ ɪ ʃ ɳ äː t̪
निष्पक्ष	n̪ ɪ ʃ p ə k ʃ
निष्फल	n̪ ɪ ʃ pʰ ə l̪
निसार	n̪ ɪ s̪ äː ɾ
निस्पृह	n̪ ɪ s̪ p ɾ ɪ ɦ
निस्संदेह	n̪ ɪ s̪ s̪ ə̃ n̪ d̪ eː ɦ
निस्सार	n̪ ɪ s̪ s̪ äː ɾ
निहत्था	n̪ ɪ ɦ ə t̪̚ t̪ʰ äː
निहाई	n̪ ɪ ɦ äː iː
निहायत	n̪ ɪ ɦ äː j ə t̪
निहार	n̪ ɪ ɦ äː ɾ
निहारकर	n̪ ɪ ɦ äː ɾ k ə ɾ
निहारके	n̪ ɪ ɦ äː ɾ k eː
निहारता	n̪ ɪ ɦ äː ɾ t̪ äː
निहारती	n̪ ɪ ɦ äː ɾ t̪ iː
निहारतीं	n̪ ɪ ɦ äː ɾ t̪ ĩː
निहारते	n̪ ɪ ɦ äː ɾ t̪ eː
निहारना	n̪ ɪ ɦ äː ɾ n̪ äː
निहारने	n̪ ɪ ɦ äː ɾ n̪ eː
निहारनेवाला	n̪ ɪ ɦ äː ɾ n̪ eː ʋ äː l̪ äː
निहारनेवाली	n̪ ɪ ɦ äː ɾ n̪ eː ʋ äː l̪ iː
निहारनेवालीं	n̪ ɪ ɦ äː ɾ n̪ eː ʋ äː l̪ ĩː
निहारनेवाले	n̪ ɪ ɦ äː ɾ n̪ eː ʋ äː l̪ eː
निहारा	n̪ ɪ ɦ äː ɾ äː
निहारिका	n̪ ɪ ɦ äː ɾ ɪ k äː
निहारिये	n̪ ɪ ɦ äː ɾ i j eː
निहारियेगा	n̪ ɪ ɦ äː ɾ i j eː ɡ äː
निहारियो	n̪ ɪ ɦ äː ɾ i j oː
निहारी	n̪ ɪ ɦ äː ɾ iː
निहारीं	n̪ ɪ ɦ äː ɾ ĩː
निहारूँ	n̪ ɪ ɦ äː ɾ ũː
निहारूँगा	n̪ ɪ ɦ äː ɾ ũː ŋ ɡ äː
निहारूँगी	n̪ ɪ ɦ äː ɾ ũː ŋ ɡ iː
निहारे	n̪ ɪ ɦ äː ɾ eː
निहारें	n̪ ɪ ɦ äː ɾ ẽː
निहारेंगी	n̪ ɪ ɦ äː ɾ ẽː ŋ ɡ iː
निहारेंगे	n̪ ɪ ɦ äː ɾ ẽː ŋ ɡ eː
निहारेगा	n̪ ɪ ɦ äː ɾ eː ɡ äː
निहारेगी	n̪ ɪ ɦ äː ɾ eː ɡ iː
निहारो	n̪ ɪ ɦ äː ɾ oː
निहारोगी	n̪ ɪ ɦ äː ɾ oː ɡ iː
निहारोगे	n̪ ɪ ɦ äː ɾ oː ɡ eː
निहित	n̪ ɪ ɦ ɪ t̪
निहुरना	n̪ ɪ ɦ ʊ ɾ n̪ äː
नी	n̪ iː
नींबू	n̪ ĩː m b uː
नींव	n̪ ĩː ʋ
नीच	n̪ iː t͡ʃ
नीचा	n̪ iː t͡ʃ äː
नीड़ज	n̪ iː ɽ ə d͡ʒ
नीत	n̪ iː t̪
नीति	n̪ iː t̪ iː
नीतिगत	n̪ iː t̪ ɪ ɡ ə t̪
नीदरलैंड	n̪ iː d̪ ə ɾ l̪ ɛ̃ː ɳ ɖ
नीदरलैण्ड	n̪ iː d̪ ə ɾ l̪ ɛ̃ː ɳ ɖ
नीबू	n̪ iː b uː
नीयत	n̪ iː j ə t̪
नीर	n̪ iː ɾ
नील	n̪ iː l̪
नीलगाय	n̪ iː l̪ ɡ äː j
नीलम	n̪ iː l̪ ə̃ m
नीललोहित	n̪ iː l̪ l̪ oː ɦ ɪ t̪
नीला	n̪ iː l̪ äː
नीलाम	n̪ iː l̪ ä̃ː m
नीवि	n̪ iː ʋ iː
नीहारिका	n̪ iː ɦ äː ɾ ɪ k äː
नुकसान	n̪ ʊ k s̪ ä̃ː n̪
नुकसान	n̪ ʊ q s̪ ä̃ː n̪
नुक़्ता	n̪ ʊ k t̪ äː
नुक़्ता	n̪ ʊ q t̪ äː
नुमाइंदगी	n̪ ʊ m äː ɪ̃ d̪ ə ɡ iː
नुमाइंदा	n̪ ʊ m äː ɪ̃ n̪ d̪ äː
नुमाइश	n̪ ʊ m äː ɪ ʃ
नुशूर	n̪ ʊ ʃ uː ɾ
नुसख़ा	n̪ ʊ s̪ kʰ äː
नुसख़ा	n̪ ʊ s̪ x äː
नुस्ख़ा	n̪ ʊ s̪ kʰ äː
नुस्ख़ा	n̪ ʊ s̪ x äː
नुस्खा	n̪ ʊ s̪ kʰ äː
नुस्खा	n̪ ʊ s̪ x äː
नूनी	n̪ uː n̪ iː
नूर	n̪ uː ɾ
नूह	n̪ uː ɦ
नृत्त	n̪ ɾ ɪ t̪ t̪
नृत्य	n̪ ɾ ɪ t̪ j ə
ने	n̪ eː
नेक	n̪ eː k
नेकटाई	n̪ eː k ʈ äː iː
नेकदिल	n̪ eː k d̪ ɪ l̪
नेकी	n̪ eː k iː
नेटवर्क	n̪ eː ʈ w ə ɾ k
नेतन्याहू	n̪ eː t̪ ə̃ n̪ j äː ɦ uː
नेतली	n̪ eː t̪ l̪ iː
नेता	n̪ eː t̪ äː
नेताओ	n̪ eː t̪ äː oː
नेताओं	n̪ eː t̪ äː õː
नेतृत्व	n̪ eː t̪ ɾ ɪ t̪ wᵊ
नेत्र	n̪ eː t̪ ɾ
नेत्रच्छद	n̪ eː t̪ ɾ ə t̚ t͡ʃʰ ə d̪
नेत्रदान	n̪ eː t̪ ɾ ə d̪ ä̃ː n̪
नेत्रिका	n̪ eː t̪ ɾ ɪ k äː
नेत्री	n̪ eː t̪ ɾ iː
नेत्रोपम	n̪ eː t̪ ɾ oː p ə̃ m
नेपथ्य	n̪ eː p ə t̪ʰ jᵊ
नेपाल	n̪ eː p äː l̪
नेपालगंज	n̪ eː p äː l̪ ɡ ə̃ n̪ d͡ʒ
नेपाली	n̪ eː p äː l̪ iː
नेम	n̪ ẽː m
नेल्लोर	n̪ eː l̪ l̪ oː ɾ
नेवला	n̪ eː ʋ l̪ äː
नेस्तनाबूद	n̪ eː s̪ t̪ ə n̪ äː b uː d̪
नैचा	n̪ ɛː t͡ʃ äː
नैचाबंद	n̪ ɛː t͡ʃ äː b ə̃ n̪ d̪
नैचाबंदी	n̪ ɛː t͡ʃ äː b ə̃ n̪ d̪ iː
नैन	n̪ ɛ̃ː n̪
नैना	n̪ ɛː n̪ äː
नैया	n̪ ə̯ i j äː
नैहर	n̪ ɛː ɦ ə ɾ
नॉर्वे	n̪ ɔ ɾ ʋ eː
नोएडा	n̪ oː eː ɖ äː
नोचना	n̪ oː t͡ʃ n̪ äː
नोट	n̪ oː ʈ
नोटबंदी	n̪ oː ʈ b ə̃ n̪ d̪ iː
नोटबुक	n̪ oː ʈ b ʊ k
नोटिस	n̪ oː ʈ ɪ s̪
नोनी	n̪ oː n̪ iː
नौ	n̪ ɔː
नौकर	n̪ ɔː k ə ɾ
नौकरशाही	n̪ ɔː k ə ɾ ʃ äː ɦ iː
नौकरानियाँ	n̪ ɔː k ɾ äː n̪ i j ä̃ː
नौकरानियो	n̪ ɔː k ɾ äː n̪ i j oː
नौकरानियों	n̪ ɔː k ɾ äː n̪ i j õː
नौकरानी	n̪ ɔː k ɾ äː n̪ iː
नौकरियाँ	n̪ ɔː k ɾ i j ä̃ː
नौकरियो	n̪ ɔː k ɾ i j oː
नौकरियों	n̪ ɔː k ɾ i j õː
नौकरी	n̪ ɔː k ɾ iː
नौकरो	n̪ ɔː k ɾ oː
नौकरों	n̪ ɔː k ɾ õː
नौका	n̪ ɔː k äː
नौजवान	n̪ ɔː d͡ʒ ə ʋ ä̃ː n̪
नौजवानो	n̪ ɔː d͡ʒ ə ʋ äː n̪ oː
नौजवानों	n̪ ɔː d͡ʒ ə ʋ äː n̪ õː
नौटंकी	n̪ ɔː ʈ ə̃ ŋ k iː
नौबत	n̪ ɔː b ə t̪
नौवाँ	n̪ ə̯ u ʋ ä̃ː
नौसिखिया	n̪ ɔː s̪ ɪ kʰ i j äː
नौसेना	n̪ ɔː s̪ eː n̪ äː
न्याय	n̪ j äː j
न्यायपालिका	n̪ j äː j p äː l̪ ɪ k äː
न्यायशास्त्र	n̪ j äː j ʃ äː s̪ t̪ ɾᵊ
न्यायाधीश	n̪ j äː j äː d̪ʱ iː ʃ
न्यायालयो	n̪ j äː j äː l̪ ə j oː
न्यायालयों	n̪ j äː j äː l̪ ə j õː
न्यायिक	n̪ j äː j ɪ k
न्यायोचित	n̪ j äː j oː t͡ʃ ɪ t̪
न्यारा	n̪ j äː ɾ äː
न्यास	n̪ j äː s̪
न्यूज़	n̪ j uː d͡ʒ
न्यूज़	n̪ j uː z
न्यूज़ीलैंड	n̪ j uː d͡ʒ iː l̪ ɛ̃ː ɳ ɖ
न्यूज़ीलैंड	n̪ j uː z iː l̪ ɛ̃ː ɳ ɖ
न्यूज़ीलैण्ड	n̪ j uː d͡ʒ iː l̪ ɛ̃ː ɳ ɖ
न्यूज़ीलैण्ड	n̪ j uː z iː l̪ ɛ̃ː ɳ ɖ
न्यून	n̪ j ũː n̪
न्यूनतम	n̪ j ũː n̪ t̪ ə̃ m
न्यूयॉर्क	n̪ j uː j ɔ ɾ k
न्योता	n̪ j oː t̪ äː
पंक्ति	p ə̃ ŋ k t̪ iː
पंख	p ə̃ ŋ kʰ
पंखा	p ə̃ ŋ kʰ äː
पंखावाला	p ə̃ ŋ kʰ äː ʋ äː l̪ äː
पंखुड़ी	p ə̃ ŋ kʰ ɽ iː
पंखुड़ी	p ə̃ ŋ kʰ ʊ ɽ iː
पंखो	p ə̃ ŋ kʰ oː
पंगु	p ə̃ ŋ ɡ uː
पंचशील	p ə̃ n̪ t͡ʃ ʃ iː l̪
पंचायत	p ə̃ n̪ t͡ʃ äː j ə t̪
पंचायती	p ə̃ n̪ t͡ʃ äː j ə t̪ iː
पंछियो	p ə̃ n̪ t͡ʃʰ i j oː
पंछियों	p ə̃ n̪ t͡ʃʰ i j õː
पंछी	p ə̃ n̪ t͡ʃʰ iː
पंजा	p ə̃ n̪ d͡ʒ äː
पंजाब	p ə̃ n̪ d͡ʒ äː b
पंजाबी	p ə̃ n̪ d͡ʒ äː b iː
पंजीकरण	p ə̃ n̪ d͡ʒ iː k ə ɾ ə̃ ɳ
पंजीकृत	p ə̃ n̪ d͡ʒ iː k ɾ ɪ t̪
पंजे	p ə̃ n̪ d͡ʒ eː
पंजो	p ə̃ n̪ d͡ʒ oː
पंजों	p ə̃ n̪ d͡ʒ õː
पंडाल	p ə̃ ɳ ɖ äː l̪
पंडिताई	p ə̃ ɳ ɖ ɪ t̪ äː iː
पंडुक	p ə̃ ɳ ɖ ʊ k
पंद्रह	p ə̃ n̪ d̪ ɾ ə ɦ
पंसारी	p ə̃ n̪ s̪ äː ɾ iː
पकड़ता	p ə k ə ɽ t̪ äː
पकड़ना	p ə k ə ɽ n̪ äː
पकड़नी	p ə k ə ɽ n̪ iː
पकड़नीं	p ə k ə ɽ n̪ ĩː
पकड़ने	p ə k ə ɽ n̪ eː
पकड़नेवाला	p ə k ə ɽ n̪ eː ʋ äː l̪ äː
पकड़नेवाली	p ə k ə ɽ n̪ eː ʋ äː l̪ iː
पकड़नेवालीं	p ə k ə ɽ n̪ eː ʋ äː l̪ ĩː
पकड़नेवाले	p ə k ə ɽ n̪ eː ʋ äː l̪ eː
पकड़वा	p ə k ə ɽ ʋ äː
पकड़वाइये	p ə k ə ɽ ʋ äː i j eː
पकड़वाइयेगा	p ə k ə ɽ ʋ äː i j eː ɡ äː
पकड़वाइयो	p ə k ə ɽ ʋ äː i j oː
पकड़वाऊँ	p ə k ə ɽ ʋ äː ũː
पकड़वाऊँगा	p ə k ə ɽ ʋ äː ũː ŋ ɡ äː
पकड़वाऊँगी	p ə k ə ɽ ʋ äː ũː ŋ ɡ iː
पकड़वाओ	p ə k ə ɽ ʋ äː oː
पकड़वाओगी	p ə k ə ɽ ʋ äː oː ɡ iː
पकड़वाओगे	p ə k ə ɽ ʋ äː oː ɡ eː
पकड़वाकर	p ə k ə ɽ ʋ äː k ə ɾ
पकड़वाके	p ə k ə ɽ ʋ äː k eː
पकड़वाता	p ə k ə ɽ ʋ äː t̪ äː
पकड़वाती	p ə k ə ɽ ʋ äː t̪ iː
पकड़वातीं	p ə k ə ɽ ʋ äː t̪ ĩː
पकड़वाते	p ə k ə ɽ ʋ äː t̪ eː
