मरायेंगे	m ə ɾ äː j ẽː ŋ ɡ eː
मरायेगा	m ə ɾ äː j eː ɡ äː
मरायेगी	m ə ɾ äː j eː ɡ iː
मरियम	m ə ɾ i j ə̃ m
मरियल	m ə ɾ i j ə l̪
मरिये	m ə ɾ i j eː
मरियेगा	m ə ɾ i j eː ɡ äː
मरियो	m ə ɾ i j oː
मरुस्थल	m ə ɾ ʊ s̪ t̪ʰ ə l̪
मरूँगा	m ə ɾ ũː ŋ ɡ äː
मरूँगी	m ə ɾ ũː ŋ ɡ iː
मरेंगी	m ə ɾ ẽː ŋ ɡ iː
मरेंगे	m ə ɾ ẽː ŋ ɡ eː
मरेगा	m ə ɾ eː ɡ äː
मर्जियाँ	m ə ɾ d͡ʒ i j ä̃ː
मर्जियाँ	m ə ɾ z i j ä̃ː
मर्जियो	m ə ɾ d͡ʒ i j oː
मर्जियो	m ə ɾ z i j oː
मर्जियों	m ə ɾ d͡ʒ i j õː
मर्जियों	m ə ɾ z i j õː
मर्तबा	m ə ɾ t̪ ə b äː
मर्तबान	m ə ɾ t̪ ə b ä̃ː n̪
मर्दन	m ə ɾ d̪ ə̃ n̪
मर्दानगी	m ə ɾ d̪ ä̃ː n̪ ɡ iː
मर्दाना	m ə ɾ d̪ äː n̪ äː
मर्दुम	m ə ɾ d̪ ʊ̃ m
मर्दुमशुमारी	m ə ɾ d̪ ʊ̃ m ʃ ʊ m äː ɾ iː
मर्मघातक	m ə ɾ m ə ɡʱ äː t̪ ə k
मर्यादा	m ə ɾ j äː d̪ äː
मल	m ə l̪
मलना	m ə l̪ n̪ äː
मलबा	m ə l̪ b äː
मलयालम	m ə l̪ ə j äː l̪ ə̃ m
मलयाली	m ə l̪ j äː l̪ iː
मलहम	m ə l̪ ɦ ə̃ m
मलाई	m ə l̪ äː iː
मलाल	m ə l̪ äː l̪
मलिका	m ə l̪ ɪ k äː
मलिन	m ə l̪ ɪ̃ n̪
मलिनता	m ə l̪ ɪ̃ n̪ t̪ äː
मलेशिया	m ə l̪ eː ʃ i j äː
मल्लयुद्ध	m ə l̪ l̪ ə j ʊ d̪ d̪ʱ
मल्लाह	m ə l̪ l̪ äː ɦ
मल्होत्रा	m ə l̪ ɦ oː t̪ ɾ äː
मशक़्क़त	m ə ʃ ə k̚ k ə t̪
मशग़ूल	m ə ʃ ɡ uː l̪
मशग़ूल	m ə ʃ ɣ uː l̪
मशरूम	m ə ʃ ɾ ũː m
मशाल	m ə ʃ äː l̪
मशीन	m ə ʃ ĩː n̪
मशीनरी	m ə ʃ ĩː n̪ ɾ iː
मशीनी	m ə ʃ iː n̪ iː
मशीनीकरण	m ə ʃ iː n̪ iː k ə ɾ ə̃ ɳ
मस	m ə s̪
मसका	m ə s̪ k äː
मसख़रा	m ə s̪ ə kʰ ɾ äː
मसख़रा	m ə s̪ ə x ɾ äː
मसख़री	m ə s̪ kʰ ə ɾ iː
मसख़री	m ə s̪ x ə ɾ iː
मसजिद	m ə s̪ d͡ʒ ɪ d̪
मसनद	m ə s̪ n̪ ə d̪
मसनवी	m ə s̪ n̪ ə ʋ iː
मसरूफ़	m ə s̪ ɾ uː f
मसरूफ़	m ə s̪ ɾ uː pʰ
मसल	m ə s̪ ə l̪
मसलकर	m ə s̪ ə l̪ k ə ɾ
मसलके	m ə s̪ ə l̪ k eː
मसलन	m ə s̪ l̪ ə̃ n̪
मसलना	m ə s̪ ə l̪ n̪ äː
मसलने	m ə s̪ ə l̪ n̪ eː
मसलनेवाला	m ə s̪ ə l̪ n̪ eː ʋ äː l̪ äː
मसलनेवाली	m ə s̪ ə l̪ n̪ eː ʋ äː l̪ iː
मसलनेवालीं	m ə s̪ ə l̪ n̪ eː ʋ äː l̪ ĩː
मसलनेवाले	m ə s̪ ə l̪ n̪ eː ʋ äː l̪ eː
मसलहत	m ə s̪ l̪ eː ɦ ə t̪
मसलहत	m ə s̪ l̪ ɛ ɦ ɛ t̪
मसला	m ə s̪ l̪ äː
मसलिये	m ə s̪ l̪ i j eː
मसलियेगा	m ə s̪ l̪ i j eː ɡ äː
मसलूँ	m ə s̪ l̪ ũː
मसलूँगा	m ə s̪ l̪ ũː ŋ ɡ äː
मसलूँगी	m ə s̪ l̪ ũː ŋ ɡ iː
मसलें	m ə s̪ l̪ ẽː
मसलेंगी	m ə s̪ l̪ ẽː ŋ ɡ iː
मसलेंगे	m ə s̪ l̪ ẽː ŋ ɡ eː
मसलो	m ə s̪ l̪ oː
मसान	m ə s̪ ä̃ː n̪
मसाला	m ə s̪ äː l̪ äː
मसि	m ə s̪ iː
मसिपात्र	m ə s̪ ɪ p äː t̪ ɾᵊ
मसीह	m ə s̪ iː ɦ
मसीहा	m ə s̪ iː ɦ äː
मसीही	m ə s iː ɦ iː
मसूड़ा	m ə s̪ uː ɽ äː
मसूर	m ə s̪ uː ɾ
मस्जिद	m ə s̪ d͡ʒ ɪ d̪
मस्त	m ə s̪ t̪
मस्तक	m ə s̪ t̪ ə k
मस्ताना	m ə s̪ t̪ äː n̪ äː
मस्तानी	m ə s̪ t̪ äː n̪ iː
मस्तियाँ	m ə s̪ t̪ i j ä̃ː
मस्तियो	m ə s̪ t̪ i j oː
मस्तियों	m ə s̪ t̪ i j õː
मस्तिष्क	m ə s̪ t̪ ɪ ʃ k
मस्तिष्कस्तंभ	m ə s̪ t̪ ɪ ʃ k s̪ t̪ ə̃ m bʱ
मस्तिष्कस्तम्भ	m ə s̪ t̪ ɪ ʃ k s̪ t̪ ə̃ m bʱ
मस्ती	m ə s̪ t̪ iː
मस्तूल	m ə s̪ t̪ uː l̪
मस्सा	m ə s̪ s̪ äː
महँगाई	m ɛ ɦ ɛ̃ ŋ ɡ äː iː
महंगा	m ɛ ɦ ɛ̃ ŋ ɡ äː
महक	m ɛ ɦ ɛ k
महकना	m ɛ ɦ ɛ k n̪ äː
महकमा	m ɛ ɦ k ə m äː
महकें	m ɛ ɦ ɛ k ẽː
महको	m ɛ ɦ ɛ k oː
महकों	m ɛ ɦ ɛ k õː
महजबीं	m ɛ ɦ ɛ d͡ʒ b ĩː
महज़	m ɛ ɦ ɛ d͡ʒ
महज़	m ɛ ɦ ɛ z
महताब	m ɛ ɦ t̪ äː b
महत्त्व	m ɛ ɦ ɛ t̪̚ t̪ wᵊ
महत्त्वपूर्ण	m ɛ ɦ ɛ t̪̚ t̪ w ə p uː ɾ ɳ
महत्व	m ɛ ɦ ɛ t̪ wᵊ
महत्वपूर्ण	m ɛ ɦ ɛ t̪ w ə p uː ɾ ɳ
महत्वाकांक्षा	m ɛ ɦ ɛ t̪ w äː k ä̃ː ŋ k ʃ äː
महफ़िल	m ɛ ɦ f ɪ l̪
महफ़िल	m ɛ ɦ pʰ ɪ l̪
महफ़ूज़	m ɛ ɦ f uː z
महफ़ूज़	m ɛ ɦ pʰ uː d͡ʒ
महफिल	m ɛ ɦ f ɪ l̪
महफिल	m ɛ ɦ pʰ ɪ l̪
महबूब	m ɛ ɦ b uː b
महबूबा	m ɛ ɦ b uː b äː
महमूद	m ɛ ɦ m uː d̪
महरूम	m ɛ ɦ ɾ ũː m
महल	m ɛ ɦ ɛ l̪
महसूस	m ɛ ɦ s̪ uː s̪
महा	m ə ɦ äː
महागठबंधन	m ə ɦ äː ɡ ə ʈʰ b ə̃ n̪ d̪ʱ ə̃ n̪
महागुरु	m ə ɦ äː ɡ ʊ ɾ uː
महात्मा	m ə ɦ äː t̪ m äː
महादेव	m ə ɦ äː d̪ eː ʋ
महाद्वीप	m ə ɦ äː d̪ w iː p
महाधिवक्ता	m ə ɦ äː d̪ʱ ɪ ʋ ə k t̪ äː
महान	m ə ɦ ä̃ː n̪
महानगर	m ə ɦ äː n̪ ə ɡ ə ɾ
महापंडित	m ə ɦ äː p ə̃ ɳ ɖ ɪ t̪
महापण्डित	m ə ɦ äː p ə̃ ɳ ɖ ɪ t̪
महापौर	m ə ɦ äː p ɔː ɾ
महाप्रभु	m ə ɦ äː p ɾ ə bʱ uː
महाभियोग	m ə ɦ äː bʱ i j oː ɡ
महामारियाँ	m ə ɦ äː m äː ɾ i j ä̃ː
महामारियो	m ə ɦ äː m äː ɾ i j oː
महामारियों	m ə ɦ äː m äː ɾ i j õː
महामारी	m ə ɦ äː m äː ɾ iː
महायान	m ə ɦ äː j ä̃ː n̪
महायुद्ध	m ə ɦ äː j ʊ d̪ d̪ʱ
महारत	m ə ɦ äː ɾ ə t̪
महाराज	m ə ɦ äː ɾ äː d͡ʒ
महाराजा	m ə ɦ äː ɾ äː d͡ʒ äː
महाराष्ट्र	m ə ɦ äː ɾ äː ʃ ʈ ɾᵊ
महार्णव	m ə ɦ äː ɾ ɳ ə ʋ
महावत	m ə ɦ äː ʋ ə t̪
महाविद्यालय	m ə ɦ äː ʋ ɪ d̪ j äː l̪ ə j
महावीर	m ə ɦ äː ʋ iː ɾ
महाशक्ति	m ə ɦ äː ʃ ə k t̪ iː
महाशय	m ə ɦ äː ʃ ə j
महासचिव	m ə ɦ äː s̪ ə t͡ʃ ɪ ʋ
महासागर	m ə ɦ äː s̪ äː ɡ ə ɾ
महिमा	m ə ɦ ɪ m äː
महिला	m ə ɦ ɪ l̪ äː
महिलाएँ	m ə ɦ ɪ l̪ äː ẽː
महिलाओ	m ə ɦ ɪ l̪ äː oː
महिलाओं	m ə ɦ ɪ l̪ äː õː
महीन	m ə ɦ ĩː n̪
महीने	m ə ɦ iː n̪ eː
महीनो	m ə ɦ iː n̪ oː
महीनों	m ə ɦ iː n̪ õː
महेंद्र	m ə ɦ ẽː n̪ d̪ ɾᵊ
महोदया	m ə ɦ oː d̪ ə j äː
मह्ल	m ɛ ɦ l̪ᵊ
माँ	m ä̃ː
माँग	m ä̃ː ŋ ɡ
माँगकर	m ä̃ː ŋ ɡ k ə ɾ
माँगके	m ä̃ː ŋ ɡ k eː
माँगता	m ä̃ː ŋ ɡ t̪ äː
माँगती	m ä̃ː ŋ ɡ t̪ iː
माँगतीं	m ä̃ː ŋ ɡ t̪ ĩː
माँगते	m ä̃ː ŋ ɡ t̪ eː
माँगना	m ä̃ː ŋ ɡ n̪ äː
माँगनी	m ä̃ː ŋ ɡ n̪ iː
माँगनीं	m ä̃ː ŋ ɡ n̪ ĩː
माँगने	m ä̃ː ŋ ɡ n̪ eː
माँगनेवाला	m ä̃ː ŋ ɡ n̪ eː ʋ äː l̪ äː
माँगनेवाली	m ä̃ː ŋ ɡ n̪ eː ʋ äː l̪ iː
माँगनेवालीं	m ä̃ː ŋ ɡ n̪ eː ʋ äː l̪ ĩː
माँगनेवाले	m ä̃ː ŋ ɡ n̪ eː ʋ äː l̪ eː
माँगा	m ä̃ː ŋ ɡ äː
माँगिये	m ä̃ː ŋ ɡ i j eː
माँगियेगा	m ä̃ː ŋ ɡ i j eː ɡ äː
माँगियो	m ä̃ː ŋ ɡ i j oː
माँगी	m ä̃ː ŋ ɡ iː
माँगीं	m ä̃ː ŋ ɡ ĩː
माँगूँ	m ä̃ː ŋ ɡ ũː
माँगूँगा	m ä̃ː ŋ ɡ ũː ŋ ɡ äː
माँगूँगी	m ä̃ː ŋ ɡ ũː ŋ ɡ iː
माँगे	m ä̃ː ŋ ɡ eː
माँगें	m ä̃ː ŋ ɡ ẽː
माँगेंगी	m ä̃ː ŋ ɡ ẽː ŋ ɡ iː
माँगेंगे	m ä̃ː ŋ ɡ ẽː ŋ ɡ eː
माँगेगा	m ä̃ː ŋ ɡ eː ɡ äː
माँगेगी	m ä̃ː ŋ ɡ eː ɡ iː
माँगो	m ä̃ː ŋ ɡ oː
माँगोगी	m ä̃ː ŋ ɡ oː ɡ iː
माँगोगे	m ä̃ː ŋ ɡ oː ɡ eː
माँजना	m ä̃ː n̪ d͡ʒ n̪ äː
माँजा	m ä̃ː n̪ d͡ʒ äː
माँझी	m ä̃ː n̪ d͡ʒʱ iː
माँड़ना	m ä̃ː ɽ n̪ äː
माँत	m ä̃ː t̪
माँदा	m ä̃ː d̪ äː
माँस	m ä̃ː s̪
माँसाहारी	m ä̃ː s̪ äː ɦ äː ɾ iː
मां	m ä̃ː
मांग	m ä̃ː ŋ ɡ
मांगना	m ä̃ː ŋ ɡ n̪ äː
मांगलिक	m ä̃ː ŋ ɡ ə l̪ ɪ k
मांजा	m ä̃ː n̪ d͡ʒ äː
मांड	m ä̃ː ɳ ɖ
मांडलिक	m ä̃ː ɳ ɖ ə l̪ ɪ k
मांड़ी	m ä̃ː n̪ d͡ʒ iː
मांड़ी	m ä̃ː n̪ z iː
मांडा	m ä̃ː ɳ ɖ äː
मांस	m ä̃ː n̪ s̪
मांसपेशी	m ä̃ː n̪ s̪ p eː ʃ iː
मांसल	m ä̃ː n̪ s̪ ə l̪
मांसाहार	m ä̃ː n̪ s̪ äː ɦ äː ɾ
मांसाहारी	m ä̃ː n̪ s̪ äː ɦ äː ɾ iː
माइक	m äː ɪ k
माइक्रोप्रोसेसर	m äː ɪ k ɾ oː p ɾ oː s̪ eː s̪ ə ɾ
माइनक्राफ़्ट	m äː ɪ̃ n̪ k ɾ äː f ʈ
माइनक्राफ़्ट	m äː ɪ̃ n̪ k ɾ äː pʰ ʈ
माओवाद	m äː oː ʋ äː d̪
माओवादियों	m äː oː ʋ äː d̪ i j õː
माओवादी	m äː oː ʋ äː d̪ iː
माखन	m äː kʰ ə̃ n̪
माघ	m äː ɡʱ
माचिस	m äː t͡ʃ ɪ s̪
माजरा	m äː d͡ʒ ɾ äː
माज़ी	m äː d͡ʒ iː
माज़ी	m äː z iː
माजूफल	m äː d͡ʒ uː pʰ ə l̪
माटी	m äː ʈ iː
माण्डलिक	m ä̃ː ɳ ɖ ə l̪ ɪ k
मातम	m äː t̪ ə̃ m
माता	m äː t̪ äː
माताएँ	m äː t̪ äː ẽː
माताओ	m äː t̪ äː oː
माताओं	m äː t̪ äː õː
मातृ	m äː t̪ ɾ
मातृभाषा	m äː t̪ ɾ ɪ bʱ äː ʃ äː
मातृसत्ता	m äː t̪ ɾ ɪ s̪ ə t̪̚ t̪ äː
मात्रक	m äː t̪ ɾ ə k
मात्रा	m äː t̪ ɾ äː
मात्राएँ	m äː t̪ ɾ äː ẽː
मात्राओ	m äː t̪ ɾ äː oː
मात्राओं	m äː t̪ ɾ äː õː
माथा	m äː t̪ʰ äː
मादर	m äː d̪ ə ɾ
मादरचोद	m äː d̪ ə ɾ t͡ʃ oː d̪
मादा	m äː d̪ äː
माधव	m äː d̪ʱ ə ʋ
मान	m ä̃ː n̪
मानक	m äː n̪ ə k
मानकर	m ä̃ː n̪ k ə ɾ
मानके	m ä̃ː n̪ k eː
मानचित्र	m ä̃ː n̪ t͡ʃ ɪ t̪ ɾᵊ
मानता	m ä̃ː n̪ t̪ äː
मानती	m ä̃ː n̪ t̪ iː
मानतीं	m ä̃ː n̪ t̪ ĩː
मानते	m ä̃ː n̪ t̪ eː
मानदेय	m ä̃ː n̪ d̪ eː j
मानना	m ä̃ː n̪ n̪ äː
माननी	m ä̃ː n̪ n̪ iː
माननीं	m ä̃ː n̪ n̪ ĩː
माननीय	m ä̃ː n̪ n̪ iː jᵊ
मानने	m ä̃ː n̪ n̪ eː
माननेवाला	m ä̃ː n̪ n̪ eː ʋ äː l̪ äː
माननेवाली	m ä̃ː n̪ n̪ eː ʋ äː l̪ iː
माननेवालीं	m ä̃ː n̪ n̪ eː ʋ äː l̪ ĩː
माननेवाले	m ä̃ː n̪ n̪ eː ʋ äː l̪ eː
मानव	m äː n̪ ə ʋ
मानवता	m äː n̪ ə ʋ t̪ äː
मानववाद	m äː n̪ ə ʋ ʋ äː d̪
मानवविज्ञान	m äː n̪ ə ʋ ʋ ɪ ɡ j ä̃ː n̪
मानवशास्त्र	m äː n̪ ə ʋ ʃ äː s̪ t̪ ɾᵊ
मानवाधिकार	m äː n̪ ə ʋ äː d̪ʱ ɪ k äː ɾ
मानविकी	m ä̃ː n̪ w ɪ k iː
मानवीय	m äː n̪ ə ʋ iː jᵊ
मानवो	m äː n̪ ə ʋ oː
मानवों	m äː n̪ ə ʋ õː
मानस	m äː n̪ ə s̪
मानसिक	m ä̃ː n̪ s̪ ɪ k
मानसिकता	m ä̃ː n̪ s̪ ɪ k t̪ äː
मानसून	m ä̃ː n̪ s̪ ũː n̪
मानसूनी	m ä̃ː n̪ s̪ uː n̪ iː
मानिये	m äː n̪ i j eː
मानियेगा	m äː n̪ i j eː ɡ äː
मानियो	m äː n̪ i j oː
मानी	m äː n̪ iː
मानीं	m äː n̪ ĩː
मानुस	m äː n̪ ʊ s̪
मानूँ	m äː n̪ ũː
मानूँगा	m äː n̪ ũː ŋ ɡ äː
मानूँगी	m äː n̪ ũː ŋ ɡ iː
माने	m äː n̪ eː
मानें	m äː n̪ ẽː
मानेंगी	m äː n̪ ẽː ŋ ɡ iː
मानेंगे	m äː n̪ ẽː ŋ ɡ eː
मानेगा	m äː n̪ eː ɡ äː
मानेगी	m äː n̪ eː ɡ iː
मानो	m äː n̪ oː
मानोगी	m äː n̪ oː ɡ iː
मानोगे	m äː n̪ oː ɡ eː
मान्यता	m ä̃ː n̪ j ə t̪ äː
मान्यताप्राप्त	m ä̃ː n̪ j ə t̪ äː p ɾ äː p t̪
माप	m äː p
मापना	m äː p n̪ äː
माफ़	m äː f
माफ़	m äː pʰ
माफ़िया	m äː f i j äː
माफ़िया	m äː pʰ i j äː
माफ़ी	m äː f iː
माफ़ी	m äː pʰ iː
मामला	m ä̃ː m l̪ äː
मामले	m ä̃ː m l̪ eː
मामलो	m ä̃ː m l̪ oː
मामलों	m ä̃ː m l̪ õː
मामा	m äː m äː
मामाओ	m äː m äː oː
मामाओं	m äː m äː õː
मामियाँ	m äː m i j ä̃ː
मामियो	m äː m i j oː
मामियों	m äː m i j õː
मामी	m äː m iː
मामू	m äː m uː
मामूली	m äː m uː l̪ iː
मायका	m äː j k äː
मायने	m äː j n̪ eː
माया	m äː j äː
मायावी	m äː j äː ʋ iː
मायूस	m äː j uː s̪
मायूसी	m äː j uː s̪ iː
मारकर	m äː ɾ k ə ɾ
मारके	m äː ɾ k eː
मारख़ोर	m äː ɾ kʰ oː ɾ
मारख़ोर	m äː ɾ x oː ɾ
मारता	m äː ɾ t̪ äː
मारती	m äː ɾ t̪ iː
मारतीं	m äː ɾ t̪ ĩː
मारते	m äː ɾ t̪ eː
मारतौल	m äː ɾ t̪ ɔː l̪
मारना	m äː ɾ n̪ äː
मारनी	m äː ɾ n̪ iː
मारनीं	m äː ɾ n̪ ĩː
मारने	m äː ɾ n̪ eː
मारनेवाला	m äː ɾ n̪ eː ʋ äː l̪ äː
मारनेवाली	m äː ɾ n̪ eː ʋ äː l̪ iː
मारनेवालीं	m äː ɾ n̪ eː ʋ äː l̪ ĩː
मारनेवाले	m äː ɾ n̪ eː ʋ äː l̪ eː
मारपीट	m äː ɾ p iː ʈ
मारवाड़	m äː ɾ ʋ äː ɽ
मारवाड़ी	m äː ɾ ʋ äː ɽ iː
मारा	m äː ɾ äː
मारिये	m äː ɾ i j eː
मारियेगा	m äː ɾ i j eː ɡ äː
मारियो	m äː ɾ i j oː
मारी	m äː ɾ iː
मारीं	m äː ɾ ĩː
मारूँ	m äː ɾ ũː
मारूँगा	m äː ɾ ũː ŋ ɡ äː
मारूँगी	m äː ɾ ũː ŋ ɡ iː
मारे	m äː ɾ eː
मारें	m äː ɾ ẽː
मारेंगी	m äː ɾ ẽː ŋ ɡ iː
मारेंगे	m äː ɾ ẽː ŋ ɡ eː
मारेगा	m äː ɾ eː ɡ äː
मारेगी	m äː ɾ eː ɡ iː
मारो	m äː ɾ oː
मारोगी	m äː ɾ oː ɡ iː
मारोगे	m äː ɾ oː ɡ eː
मार्केट	m äː ɾ k eː ʈ
मार्क्सवाद	m äː ɾ k s̪ ʋ äː d̪
मार्ग	m äː ɾ ɡ
मार्गदर्शन	m äː ɾ ɡ d̪ ə ɾ ʃ ə̃ n̪
मार्गशीर्ष	m äː ɾ ɡ ʃ iː ɾ ʃ
मार्गाभिगमन	m äː ɾ ɡ äː bʱ ɪ ɡ ə m ə̃ n̪
मार्च	m äː ɾ t͡ʃ
मार्फ़िया	m äː ɾ f i j äː
मार्फ़िया	m äː ɾ pʰ i j äː
माल	m äː l̪
मालगुज़ारी	m äː l̪ ɡ ʊ d͡ʒ äː ɾ iː
मालगुज़ारी	m äː l̪ ɡ ʊ z äː ɾ iː
मालदार	m äː l̪ d̪ äː ɾ
मालदीव	m äː l̪ d̪ iː ʋ
माला	m äː l̪ äː
मालागासी	m äː l̪ äː ɡ äː s̪ iː
मालिक	m äː l̪ ɪ k
मालिकाना	m äː l̪ ɪ k äː n̪ äː
मालिको	m äː l̪ ɪ k oː
मालिकों	m äː l̪ ɪ k õː
मालिन	m äː l̪ ɪ̃ n̪
मालियो	m äː l̪ i j oː
मालियों	m äː l̪ i j õː
मालिश	m äː l̪ ɪ ʃ
माली	m äː l̪ iː
मालीद	m äː l̪ iː d̪
मालूम	m äː l̪ ũː m
माले	m äː l̪ eː
माल्टा	m äː l̪ ʈ äː
मावा	m äː ʋ äː
माशा	m äː ʃ äː
माशाल्लाह	m äː ʃ äː l̪ l̪ äː ɦ
माशूक़	m äː ʃ uː k
माशूक़	m äː ʃ uː q
मास	m äː s̪
मासिक	m äː s̪ ɪ k
मासूम	m äː s̪ ũː m
मास्क	m äː s̪ k
मास्को	m äː s̪ k oː
माह	m äː ɦ
माहिर	m äː ɦ ɪ ɾ
माहीगीर	m äː ɦ iː ɡ iː ɾ
माहौल	m äː ɦ ɔː l̪
मिक्सर	m ɪ k s̪ ə ɾ
मिज़ाज	m ɪ d͡ʒ äː d͡ʒ
मिज़ाज	m ɪ z äː d͡ʒ
मिज़ोरम	m ɪ d͡ʒ oː ɾ ə̃ m
मिज़ोरम	m ɪ z oː ɾ ə̃ m
मिटना	m ɪ ʈ n̪ äː
मिट्टी	m ɪ ʈ̚ ʈ iː
मिठाइयाँ	m ɪ ʈʰ äː i j ä̃ː
मिठाई	m ɪ ʈʰ äː iː
मिठास	m ɪ ʈʰ äː s̪
मितुल	m ɪ t̪ ʊ l̪
मित्राई	m ɪ t̪ ɾ äː iː
मिथ्या	m ɪ t̪ʰ j äː
मिनट	m ɪ n̪ ə ʈ
मिन्नत	m ɪ̃ n̪ n̪ ə t̪
मिमियाना	m ɪ m i j äː n̪ äː
मियाँ	m i j ä̃ː
मिल	m ɪ l̪
मिलकर	m ɪ l̪ k ə ɾ
मिलके	m ɪ l̪ k eː
मिलता	m ɪ l̪ t̪ äː
मिलती	m ɪ l̪ t̪ iː
मिलतीं	m ɪ l̪ t̪ ĩː
मिलते	m ɪ l̪ t̪ eː
मिलन	m ɪ l̪ ə̃ n̪
मिलनसार	m ɪ l̪ ə̃ n̪ s̪ äː ɾ
मिलनी	m ɪ l̪ n̪ iː
मिलनीं	m ɪ l̪ n̪ ĩː
मिलने	m ɪ l̪ n̪ eː
मिलनेवाला	m ɪ l̪ n̪ eː ʋ äː l̪ äː
मिलनेवाली	m ɪ l̪ n̪ eː ʋ äː l̪ iː
मिलनेवालीं	m ɪ l̪ n̪ eː ʋ äː l̪ ĩː
मिलनेवाले	m ɪ l̪ n̪ eː ʋ äː l̪ eː
मिला	m ɪ l̪ äː
मिलाइये	m ɪ l̪ äː i j eː
मिलाइयेगा	m ɪ l̪ äː i j eː ɡ äː
मिलाइयो	m ɪ l̪ äː i j oː
मिलाऊँ	m ɪ l̪ äː ũː
मिलाऊँगा	m ɪ l̪ äː ũː ŋ ɡ äː
मिलाऊँगी	m ɪ l̪ äː ũː ŋ ɡ iː
मिलाओ	m ɪ l̪ äː oː
मिलाओगी	m ɪ l̪ äː oː ɡ iː
मिलाओगे	m ɪ l̪ äː oː ɡ eː
मिलाकर	m ɪ l̪ äː k ə ɾ
मिलाके	m ɪ l̪ äː k eː
मिलाता	m ɪ l̪ äː t̪ äː
मिलाती	m ɪ l̪ äː t̪ iː
मिलातीं	m ɪ l̪ äː t̪ ĩː
मिलाते	m ɪ l̪ äː t̪ eː
मिलानी	m ɪ l̪ äː n̪ iː
मिलानीं	m ɪ l̪ äː n̪ ĩː
मिलाने	m ɪ l̪ äː n̪ eː
मिलानेवाला	m ɪ l̪ äː n̪ eː ʋ äː l̪ äː
मिलानेवाली	m ɪ l̪ äː n̪ eː ʋ äː l̪ iː
मिलानेवालीं	m ɪ l̪ äː n̪ eː ʋ äː l̪ ĩː
मिलानेवाले	m ɪ l̪ äː n̪ eː ʋ äː l̪ eː
मिलाप	m ɪ l̪ äː p
मिलाया	m ɪ l̪ äː j äː
मिलायी	m ɪ l̪ äː j iː
मिलायीं	m ɪ l̪ äː j ĩː
मिलाये	m ɪ l̪ äː j eː
मिलायें	m ɪ l̪ äː j ẽː
मिलायेंगी	m ɪ l̪ äː j ẽː ŋ ɡ iː
मिलायेंगे	m ɪ l̪ äː j ẽː ŋ ɡ eː
मिलायेगा	m ɪ l̪ äː j eː ɡ äː
मिलायेगी	m ɪ l̪ äː j eː ɡ iː
मिलिये	m ɪ l̪ i j eː
मिलियेगा	m ɪ l̪ i j eː ɡ äː
मिलियो	m ɪ l̪ i j oː
मिली	m ɪ l̪ iː
मिलीं	m ɪ l̪ ĩː
मिलीभगत	m ɪ l̪ iː bʱ ə ɡ ə t̪
मिलूँ	m ɪ l̪ ũː
मिलूँगा	m ɪ l̪ ũː ŋ ɡ äː
मिलूँगी	m ɪ l̪ ũː ŋ ɡ iː
मिले	m ɪ l̪ eː
मिलें	m ɪ l̪ ẽː
मिलेंगी	m ɪ l̪ ẽː ŋ ɡ iː
मिलेंगे	m ɪ l̪ ẽː ŋ ɡ eː
मिलेगा	m ɪ l̪ eː ɡ äː
मिलेगी	m ɪ l̪ eː ɡ iː
मिलो	m ɪ l̪ oː
मिलोगी	m ɪ l̪ oː ɡ iː
मिलोगे	m ɪ l̪ oː ɡ eː
मिल्कियत	m ɪ l̪ k i j ə t̪
मिश्रण	m ɪ ʃ ɾ ə̃ ɳ
मिश्रधातु	m ɪ ʃ ɾ ə d̪ʱ äː t̪ uː
मिस	m ɪ s̪
मिसरी	m ɪ s̪ ɾ iː
मिसाइल	m ɪ s̪ äː ɪ l̪
मिसाल	m ɪ s̪ äː l̪
मिसालें	m ɪ s̪ äː l̪ ẽː
मिसालो	m ɪ s̪ äː l̪ oː
मिसालों	m ɪ s̪ äː l̪ õː
मिसिसॉगा	m ɪ s̪ ɪ s̪ ɔ ɡ äː
मिसेज़	m ɪ s̪ eː d͡ʒ
मिसेज़	m ɪ s̪ eː z
मिसो	m ɪ s̪ oː
मिस्टर	m ɪ s̪ ʈ ə ɾ
मिस्तरी	m ɪ s̪ t̪ ɾ iː
मिस्त्री	m ɪ s̪ t̪ ɾ iː
मिस्र	m ɪ s̪ ɾ
मीचना	m iː t͡ʃ n̪ äː
मीज़ान	m iː d͡ʒ ä̃ː n̪
मीज़ान	m iː z ä̃ː n̪
मीठा	m iː ʈʰ äː
मीडिया	m iː ɖ i j äː
मीन	m ĩː n̪
मीना	m iː n̪ äː
मीम	m ĩː m
मीरा	m iː ɾ äː
मील	m iː l̪
मु'अय्यन	m ʊ ə j j ə̃ n̪
मु'अय्यन	m ʊ ʔ ə j j ə̃ n̪
मुँहमाँगा	m ʊ̃ ɦ m ä̃ː ŋ ɡ äː
मुँहासा	m ʊ̃ ɦ äː s̪ äː
मुंड	m ʊ̃ ɳ ɖ
मुंडन	m ʊ̃ ɳ ɖ ə̃ n̪
मुंडा	m ʊ̃ ɳ ɖ äː
मुंडे	m ʊ̃ ɳ ɖ eː
मुंतज़िम	m ʊ̃ n̪ t̪ ə d͡ʒ ɪ̃ m
मुंतज़िम	m ʊ̃ n̪ t̪ ə z ɪ̃ m
मुंतज़िर	m ʊ̃ n̪ t̪ ə d͡ʒ ɪ ɾ
मुंतज़िर	m ʊ̃ n̪ t̪ ə z ɪ ɾ
मुंबई	m ʊ̃ m b ə iː
मुंशी	m ʊ̃ n̪ ʃ iː
मुंसिफ़ाना	m ʊ̃ n̪ s̪ ɪ f äː n̪ äː
मुंसिफ़ाना	m ʊ̃ n̪ s̪ ɪ pʰ äː n̪ äː
मुअज़्ज़िन	m ʊ ə d̚ d͡ʒ ɪ̃ n̪
मुअज़्ज़िन	m ʊ ə z z ɪ̃ n̪
मुअल्लम	m ʊ ə l̪ l̪ ə̃ m
मुअल्लिम	m ʊ ə l̪ l̪ ɪ̃ m
मुआ	m ʊ äː
मुआयना	m ʊ äː j n̪ äː
मुआवज़ा	m ʊ äː ʋ d͡ʒ äː
मुआवज़ा	m ʊ äː ʋ z äː
मुआहिदा	m ʊ äː ɦ ɪ d̪ äː
मुकम्मल	m ʊ k ə̃ m m ə l̪
मुकरना	m ʊ k ə ɾ n̪ äː
मुक़दमा	m ʊ k ə d̪ m äː
मुक़दमा	m ʊ q ə d̪ m äː
मुक़द्दर	m ʊ k ə d̪̚ d̪ ə ɾ
मुक़द्दर	m ʊ q ə d̪̚ d̪ ə ɾ
मुक़द्दस	m ʊ k ə d̪̚ d̪ ə s̪
मुक़द्दस	m ʊ q ə d̪̚ d̪ ə s̪
मुक़ाबला	m ʊ k äː b l̪ äː
मुक़ाबला	m ʊ q äː b l̪ äː
मुक़ाबले	m ʊ k äː b l̪ eː
मुक़ाबले	m ʊ q äː b l̪ eː
मुक़ाबलों	m ʊ k äː b l̪ õː
मुक़ाबलों	m ʊ q äː b l̪ õː
मुक़ाम	m ʊ k ä̃ː m
मुक़ाम	m ʊ q ä̃ː m
मुकुट	m ʊ k ʊ ʈ
मुक्का	m ʊ k̚ k äː
मुक्के	m ʊ k̚ k eː
मुक्केबाज़	m ʊ k̚ k eː b äː d͡ʒ
मुक्केबाज़	m ʊ k̚ k eː b äː z
मुक्केबाज़ो	m ʊ k̚ k eː b äː d͡ʒ oː
मुक्केबाज़ो	m ʊ k̚ k eː b äː z oː
मुक्केबाज़ों	m ʊ k̚ k eː b äː d͡ʒ õː
मुक्केबाज़ों	m ʊ k̚ k eː b äː z õː
मुक्को	m ʊ k̚ k oː
मुक्कों	m ʊ k̚ k õː
मुक्तिधन	m ʊ k t̪ ɪ d̪ʱ ə̃ n̪
मुक्तिवादी	m ʊ k t̪ ɪ ʋ äː d̪ iː
मुखड़ा	m ʊ kʰ ɽ äː
मुखमैथुन	m ʊ kʰ m ɛː t̪ʰ ʊ̃ n̪
मुख़ालिफ़त	m ʊ kʰ äː l̪ ɪ pʰ ə t̪
मुख़ालिफ़त	m ʊ x äː l̪ ɪ f ə t̪
मुख़्तसर	m ʊ kʰ t̪ ə s̪ ə ɾ
मुख़्तसर	m ʊ x t̪ ə s̪ ə ɾ
मुखाभिगम	m ʊ kʰ äː bʱ ɪ ɡ ə̃ m
मुखिया	m ʊ kʰ i j äː
मुखौटा	m ʊ kʰ ɔː ʈ äː
