गुलूबंद	ɡ ʊ l̪ uː b ə̃ n̪ d̪
गुलेल	ɡ ʊ l̪ eː l̪
गुल्फ	ɡ ʊ l̪ pʰ
गुल्लक	ɡ ʊ l̪ l̪ ə k
गुवाहाटी	ɡ ʊ ʋ äː ɦ äː ʈ iː
गुस्ताख़	ɡ ʊ s̪ t̪ äː kʰ
गुस्ताख़	ɡ ʊ s̪ t̪ äː x
गुस्ताख़ी	ɡ ʊ s̪ t̪ äː kʰ iː
गुस्ताख़ी	ɡ ʊ s̪ t̪ äː x iː
गुस्सा	ɡ ʊ s̪ s̪ äː
गुस्सा	ɣ ʊ s̪ s̪ äː
गुहर	ɡ ɔ ɦ ɔ ɾ
गुहा	ɡ ʊ ɦ äː
गुहार	ɡ ʊ ɦ äː ɾ
गूंगा	ɡ ũː ŋ ɡ äː
गूंज	ɡ ũː n̪ d͡ʒ
गूंजना	ɡ ũː n̪ d͡ʒ n̪ äː
गूंजने	ɡ ũː n̪ d͡ʒ n̪ eː
गूंजे	ɡ ũː n̪ d͡ʒ eː
गूंजेगा	ɡ ũː n̪ d͡ʒ eː ɡ äː
गूंजेगी	ɡ ũː n̪ d͡ʒ eː ɡ iː
गूगल	ɡ uː ɡ ə l̪
गृहमंत्री	ɡ ɾ ɪ ɦ m ə̃ n̪ t̪ ɾ iː
गृहस्थ	ɡ ɾ ɪ ɦ ə s̪ t̪ʰ
गेंडा	ɡ ẽː ɳ ɖ äː
गेरुआ	ɡ eː ɾ ʊ äː
गेसू	ɡ eː s̪ uː
गेहुँअन	ɡ eː ɦ ʊ̃ ə̃ n̪
गैंडा	ɡ ɛ̃ː ɳ ɖ äː
गैलन	ɡ ɛː l̪ ə̃ n̪
गैस	ɡ æ s̪
गैस	ɡ ɛː s̪
गॉर्डन	ɡ ɔ ɾ ɖ ə̃ n̪
गोंद	ɡ õː n̪ d̪
गोगोला	ɡ oː ɡ oː l̪ äː
गोड़ना	ɡ oː ɽ n̪ äː
गोधूम	ɡ oː d̪ʱ ũː m
गोपन	ɡ oː p ə̃ n̪
गोपनीय	ɡ oː p n̪ iː jᵊ
गोपनीयता	ɡ oː p n̪ iː j t̪ äː
गोपनीयताएँ	ɡ oː p n̪ iː j t̪ äː ẽː
गोपनीयताओ	ɡ oː p n̪ iː j t̪ äː oː
गोपनीयताओं	ɡ oː p n̪ iː j t̪ äː õː
गोपाल	ɡ oː p äː l̪
गोबरैला	ɡ oː b ɾ ɛː l̪ äː
गोरक्षा	ɡ oː ɾ ə k ʃ äː
गोरखा	ɡ oː ɾ kʰ äː
गोरा	ɡ oː ɾ äː
गोरियाँ	ɡ oː ɾ i j ä̃ː
गोरियो	ɡ oː ɾ i j oː
गोरियों	ɡ oː ɾ i j õː
गोरिल्ला	ɡ oː ɾ ɪ l̪ äː
गोल	ɡ oː l̪
गोलंदाज़	ɡ oː l̪ ə̃ n̪ d̪ äː d͡ʒ
गोलंदाज़	ɡ oː l̪ ə̃ n̪ d̪ äː z
गोलगप्पा	ɡ oː l̪ ɡ ə p̚ p äː
गोलबंदी	ɡ oː l̪ b ə̃ n̪ d̪ iː
गोलमाल	ɡ oː l̪ m äː l̪
गोला	ɡ oː l̪ äː
गोली	ɡ oː l̪ iː
गोलीबारी	ɡ oː l̪ iː b äː ɾ iː
गोवा	ɡ oː ʋ äː
गोष्ठी	ɡ oː ʃ ʈʰ iː
गोसाईं	ɡ oː s̪ äː ĩː
गौरवशाली	ɡ ɔː ɾ ə ʋ ʃ äː l̪ iː
गौरवान्वित	ɡ ɔː ɾ ə ʋ ä̃ː n̪ w ɪ t̪
गौरैया	ɡ ɔː ɾ ə̯ i j äː
गौशाला	ɡ ɔː ʃ äː l̪ äː
ग्यारह	ɡ j äː ɾ äː
ग्यारह	ɡ j äː ɾ ə ɦ
ग्यारह	ɡ j äː ɾ ɛː
ग्रंथकार	ɡ ɾ ə̃ n̪ t̪ʰ k äː ɾ
ग्रंथालय	ɡ ɾ ə̃ n̪ t̪ʰ äː l̪ ɛː
ग्रंथो	ɡ ɾ ə̃ n̪ t̪ʰ oː
ग्रंथों	ɡ ɾ ə̃ n̪ t̪ʰ õː
ग्रथन	ɡ ɾ ə t̪ʰ ə̃ n̪
ग्रन्थो	ɡ ɾ ə̃ n̪ t̪ʰ oː
ग्रन्थों	ɡ ɾ ə̃ n̪ t̪ʰ õː
ग्राम	ɡ ɾ ä̃ː m
ग्रामचर्या	ɡ ɾ ä̃ː m t͡ʃ ə ɾ j äː
ग्रामीण	ɡ ɾ äː m ĩː ɳ
ग्राहक	ɡ ɾ äː ɦ ə k
ग्रीष्म	ɡ ɾ iː ʃ mᵊ
ग्रीस	ɡ ɾ iː s̪
ग्लानि	ɡ l̪ äː n̪ iː
ग्लासगो	ɡ l̪ äː s̪ ɡ oː
ग्वाटेमाला	ɡ ʋ äː ʈ eː m äː l̪ äː
ग्वार	ɡ ʋ äː ɾ
ग्वारपाठा	ɡ ʋ äː ɾ p äː ʈʰ äː
ग्वाला	ɡ ʋ äː l̪ äː
ग्वालियर	ɡ ʋ äː l̪ i j ə ɾ
घंटा	ɡʱ ə̃ ɳ ʈ äː
घटता	ɡʱ ə ʈ t̪ äː
घटना	ɡʱ ə ʈ n̪ äː
घटनाएँ	ɡʱ ə ʈ n̪ äː ẽː
घटनाओ	ɡʱ ə ʈ n̪ äː oː
घटनाओं	ɡʱ ə ʈ n̪ äː õː
घटनास्थल	ɡʱ ə ʈ n̪ äː s̪ t̪ʰ ə l̪
घटनी	ɡʱ ə ʈ n̪ iː
घटनीं	ɡʱ ə ʈ n̪ ĩː
घटने	ɡʱ ə ʈ n̪ eː
घटा	ɡʱ ə ʈ äː
घटाइये	ɡʱ ə ʈ äː i j eː
घटाइयेगा	ɡʱ ə ʈ äː i j eː ɡ äː
घटाइयो	ɡʱ ə ʈ äː i j oː
घटाऊँ	ɡʱ ə ʈ äː ũː
घटाऊँगा	ɡʱ ə ʈ äː ũː ŋ ɡ äː
घटाऊँगी	ɡʱ ə ʈ äː ũː ŋ ɡ iː
घटाएँ	ɡʱ ə ʈ äː ẽː
घटाओ	ɡʱ ə ʈ äː oː
घटाओं	ɡʱ ə ʈ äː õː
घटाओगी	ɡʱ ə ʈ äː oː ɡ iː
घटाओगे	ɡʱ ə ʈ äː oː ɡ eː
घटाकर	ɡʱ ə ʈ äː k ə ɾ
घटाके	ɡʱ ə ʈ äː k eː
घटाता	ɡʱ ə ʈ äː t̪ äː
घटाती	ɡʱ ə ʈ äː t̪ iː
घटातीं	ɡʱ ə ʈ äː t̪ ĩː
घटाते	ɡʱ ə ʈ äː t̪ eː
घटाना	ɡʱ ə ʈ äː n̪ äː
घटानी	ɡʱ ə ʈ äː n̪ iː
घटानीं	ɡʱ ə ʈ äː n̪ ĩː
घटाने	ɡʱ ə ʈ äː n̪ eː
घटानेवाला	ɡʱ ə ʈ äː n̪ eː ʋ äː l̪ äː
घटानेवाली	ɡʱ ə ʈ äː n̪ eː ʋ äː l̪ iː
घटानेवालीं	ɡʱ ə ʈ äː n̪ eː ʋ äː l̪ ĩː
घटानेवाले	ɡʱ ə ʈ äː n̪ eː ʋ äː l̪ eː
घटाया	ɡʱ ə ʈ äː j äː
घटायी	ɡʱ ə ʈ äː j iː
घटायीं	ɡʱ ə ʈ äː j ĩː
घटाये	ɡʱ ə ʈ äː j eː
घटायें	ɡʱ ə ʈ äː j ẽː
घटायेंगी	ɡʱ ə ʈ äː j ẽː ŋ ɡ iː
घटायेंगे	ɡʱ ə ʈ äː j ẽː ŋ ɡ eː
घटायेगा	ɡʱ ə ʈ äː j eː ɡ äː
घटायेगी	ɡʱ ə ʈ äː j eː ɡ iː
घटिया	ɡʱ ə ʈ i j äː
घटेंगी	ɡʱ ə ʈ ẽː ŋ ɡ iː
घटेंगे	ɡʱ ə ʈ ẽː ŋ ɡ eː
घटेगा	ɡʱ ə ʈ eː ɡ äː
घड़ियाल	ɡʱ ə ɽ i j äː l̪
घड़ियालो	ɡʱ ə ɽ i j äː l̪ oː
घड़ियालों	ɡʱ ə ɽ i j äː l̪ õː
घन	ɡʱ ə̃ n̪
घनचक्कर	ɡʱ ə̃ n̪ t͡ʃ ə k̚ k ə ɾ
घनत्व	ɡʱ ə n̪ ə t̪ wᵊ
घना	ɡʱ ə n̪ äː
घनीय	ɡʱ ə n̪ iː jᵊ
घबरा	ɡʱ ə b ɾ äː
घबराइये	ɡʱ ə b ɾ äː i j eː
घबराइयेगा	ɡʱ ə b ɾ äː i j eː ɡ äː
घबराऊँ	ɡʱ ə b ɾ äː ũː
घबराऊँगा	ɡʱ ə b ɾ äː ũː ŋ ɡ äː
घबराऊँगी	ɡʱ ə b ɾ äː ũː ŋ ɡ iː
घबराओ	ɡʱ ə b ɾ äː oː
घबराओगी	ɡʱ ə b ɾ äː oː ɡ iː
घबराओगे	ɡʱ ə b ɾ äː oː ɡ eː
घबराकर	ɡʱ ə b ɾ äː k ə ɾ
घबराके	ɡʱ ə b ɾ äː k eː
घबराता	ɡʱ ə b ɾ äː t̪ äː
घबराती	ɡʱ ə b ɾ äː t̪ iː
घबरातीं	ɡʱ ə b ɾ äː t̪ ĩː
घबराते	ɡʱ ə b ɾ äː t̪ eː
घबराना	ɡʱ ə b ɾ äː n̪ äː
घबराने	ɡʱ ə b ɾ äː n̪ eː
घबराया	ɡʱ ə b ɾ äː j äː
घबरायी	ɡʱ ə b ɾ äː j iː
घबरायीं	ɡʱ ə b ɾ äː j ĩː
घबराये	ɡʱ ə b ɾ äː j eː
घबरायें	ɡʱ ə b ɾ äː j ẽː
घबरायेंगी	ɡʱ ə b ɾ äː j ẽː ŋ ɡ iː
घबरायेंगे	ɡʱ ə b ɾ äː j ẽː ŋ ɡ eː
घबरायेगा	ɡʱ ə b ɾ äː j eː ɡ äː
घबरायेगी	ɡʱ ə b ɾ äː j eː ɡ iː
घबराहट	ɡʱ ə b ɾ äː ɦ ə ʈ
घमंड	ɡʱ ə m ə̃ ɳ ɖ
घमंडी	ɡʱ ə m ə̃ ɳ ɖ iː
घमासान	ɡʱ ə m äː s̪ ä̃ː n̪
घरवाला	ɡʱ ə ɾ ʋ äː l̪ äː
घराना	ɡʱ ə ɾ äː n̪ äː
घरेलू	ɡʱ ə ɾ eː l̪ uː
घर्षण	ɡʱ ə ɾ ʃ ə̃ ɳ
घलुआ	ɡʱ ə l̪ ʊ äː
घसियारा	ɡʱ ə s̪ i j äː ɾ äː
घसीटना	ɡʱ ə s̪ iː ʈ n̪ äː
घाट	ɡʱ äː ʈ
घाटा	ɡʱ äː ʈ äː
घाटी	ɡʱ äː ʈ iː
घाटो	ɡʱ äː ʈ oː
घाटों	ɡʱ äː ʈ õː
घात	ɡʱ äː t̪
घातीय	ɡʱ äː t̪ iː jᵊ
घाना	ɡʱ äː n̪ äː
घायल	ɡʱ äː j ə l̪
घालना	ɡʱ äː l̪ n̪ äː
घाव	ɡʱ äː ʋ
घास	ɡʱ äː s̪
घासलेट	ɡʱ äː s̪ l̪ eː ʈ
घिनाना	ɡʱ ɪ n̪ äː n̪ äː
घिनौना	ɡʱ ɪ n̪ ɔː n̪ äː
घिनौनापन	ɡʱ ɪ n̪ ɔː n̪ äː p ə̃ n̪
घिरना	ɡʱ ɪ ɾ n̪ äː
घिसना	ɡʱ ɪ s̪ n̪ äː
घीया	ɡʱ iː j äː
घुँघरू	ɡʱ ʊ̃ ŋ ɡʱ ɾ uː
घुंघरू	ɡʱ ʊ̃ ŋ ɡʱ ɾ uː
घुंडी	ɡʱ ʊ̃ ɳ ɖ iː
घुटना	ɡʱ ʊ ʈ n̪ äː
घुटने	ɡʱ ʊ ʈ n̪ eː
घुटनो	ɡʱ ʊ ʈ n̪ oː
घुटनों	ɡʱ ʊ ʈ n̪ õː
घुटा	ɡʱ ʊ ʈ äː
घुटेगा	ɡʱ ʊ ʈ eː ɡ äː
घुड़कना	ɡʱ ʊ ɽ ə k n̪ äː
घुड़सवार	ɡʱ ʊ ɽ s̪ ə ʋ äː ɾ
घुड़सवारी	ɡʱ ʊ ɽ ə s̪ ʋ äː ɾ iː
घुमा	ɡʱ ʊ m äː
घुमाइये	ɡʱ ʊ m äː i j eː
घुमाइयेगा	ɡʱ ʊ m äː i j eː ɡ äː
घुमाइयो	ɡʱ ʊ m äː i j oː
घुमाऊँ	ɡʱ ʊ m äː ũː
घुमाऊँगा	ɡʱ ʊ m äː ũː ŋ ɡ äː
घुमाऊँगी	ɡʱ ʊ m äː ũː ŋ ɡ iː
घुमाओ	ɡʱ ʊ m äː oː
घुमाओगी	ɡʱ ʊ m äː oː ɡ iː
घुमाओगे	ɡʱ ʊ m äː oː ɡ eː
घुमाकर	ɡʱ ʊ m äː k ə ɾ
घुमाके	ɡʱ ʊ m äː k eː
घुमाता	ɡʱ ʊ m äː t̪ äː
घुमाती	ɡʱ ʊ m äː t̪ iː
घुमातीं	ɡʱ ʊ m äː t̪ ĩː
घुमाते	ɡʱ ʊ m äː t̪ eː
घुमाना	ɡʱ ʊ m äː n̪ äː
घुमानी	ɡʱ ʊ m äː n̪ iː
घुमानीं	ɡʱ ʊ m äː n̪ ĩː
घुमाने	ɡʱ ʊ m äː n̪ eː
घुमानेवाला	ɡʱ ʊ m äː n̪ eː ʋ äː l̪ äː
घुमानेवाली	ɡʱ ʊ m äː n̪ eː ʋ äː l̪ iː
घुमानेवालीं	ɡʱ ʊ m äː n̪ eː ʋ äː l̪ ĩː
घुमानेवाले	ɡʱ ʊ m äː n̪ eː ʋ äː l̪ eː
घुमाया	ɡʱ ʊ m äː j äː
घुमायी	ɡʱ ʊ m äː j iː
घुमायीं	ɡʱ ʊ m äː j ĩː
घुमाये	ɡʱ ʊ m äː j eː
घुमायें	ɡʱ ʊ m äː j ẽː
घुमायेंगी	ɡʱ ʊ m äː j ẽː ŋ ɡ iː
घुमायेंगे	ɡʱ ʊ m äː j ẽː ŋ ɡ eː
घुमायेगा	ɡʱ ʊ m äː j eː ɡ äː
घुमायेगी	ɡʱ ʊ m äː j eː ɡ iː
घुलनशील	ɡʱ ʊ l̪ ə̃ n̪ ʃ iː l̪
घुलनशीलता	ɡʱ ʊ l̪ ə̃ n̪ ʃ iː l̪ t̪ äː
घुस	ɡʱ ʊ s̪
घुसड़ना	ɡʱ ʊ s̪ ə ɽ n̪ äː
घुसना	ɡʱ ʊ s̪ n̪ äː
घुसपैठ	ɡʱ ʊ s̪ p ɛː ʈʰ
घुसपैठिया	ɡʱ ʊ s̪ p ɛː ʈʰ i j äː
घूँघट	ɡʱ ũː ŋ ɡʱ ə ʈ
घूँसा	ɡʱ ũː s̪ äː
घूम	ɡʱ ũː m
घूमकर	ɡʱ ũː m k ə ɾ
घूमके	ɡʱ ũː m k eː
घूमता	ɡʱ ũː m t̪ äː
घूमती	ɡʱ ũː m t̪ iː
घूमतीं	ɡʱ ũː m t̪ ĩː
घूमते	ɡʱ ũː m t̪ eː
घूमनी	ɡʱ ũː m n̪ iː
घूमनीं	ɡʱ ũː m n̪ ĩː
घूमने	ɡʱ ũː m n̪ eː
घूमनेवाला	ɡʱ ũː m n̪ eː ʋ äː l̪ äː
घूमनेवाली	ɡʱ ũː m n̪ eː ʋ äː l̪ iː
घूमनेवालीं	ɡʱ ũː m n̪ eː ʋ äː l̪ ĩː
घूमनेवाले	ɡʱ ũː m n̪ eː ʋ äː l̪ eː
घूमा	ɡʱ uː m äː
घूमिये	ɡʱ uː m i j eː
घूमियेगा	ɡʱ uː m i j eː ɡ äː
घूमियो	ɡʱ uː m i j oː
घूमूँगा	ɡʱ uː m ũː ŋ ɡ äː
घूमूँगी	ɡʱ uː m ũː ŋ ɡ iː
घूमेंगी	ɡʱ uː m ẽː ŋ ɡ iː
घूमेंगे	ɡʱ uː m ẽː ŋ ɡ eː
घूमेगा	ɡʱ uː m eː ɡ äː
घूरना	ɡʱ uː ɾ n̪ äː
घूर्णन	ɡʱ uː ɾ ɳ ə̃ n̪
घूर्णवायु	ɡʱ uː ɾ ɳ ə ʋ äː j uː
घूस	ɡʱ uː s̪
घूसख़ोर	ɡʱ uː s̪ kʰ oː ɾ
घूसख़ोर	ɡʱ uː s̪ x oː ɾ
घूसख़ोरी	ɡʱ uː s̪ kʰ oː ɾ iː
घूसख़ोरी	ɡʱ uː s̪ x oː ɾ iː
घृणा	ɡʱ ɾ ɪ ɳ äː
घृणास्पद	ɡʱ ɾ ɪ ɳ äː s̪ p ə d̪
घेंटा	ɡʱ ẽː ɳ ʈ äː
घेरता	ɡʱ eː ɾ t̪ äː
घेरना	ɡʱ eː ɾ n̪ äː
घेरने	ɡʱ eː ɾ n̪ eː
घेरा	ɡʱ eː ɾ äː
घेराव	ɡʱ eː ɾ äː ʋ
घेरूँगा	ɡʱ eː ɾ ũː ŋ ɡ äː
घेरूँगी	ɡʱ eː ɾ ũː ŋ ɡ iː
घेरेंगी	ɡʱ eː ɾ ẽː ŋ ɡ iː
घेरेंगे	ɡʱ eː ɾ ẽː ŋ ɡ eː
घोंगा	ɡʱ õː ŋ ɡ äː
घोंघा	ɡʱ õː ŋ ɡʱ äː
घोंपना	ɡʱ õː m p n̪ äː
घोंसला	ɡʱ õː n̪ s̪ l̪ äː
घोटाला	ɡʱ oː ʈ äː l̪ äː
घोटाले	ɡʱ oː ʈ äː l̪ eː
घोटालो	ɡʱ oː ʈ äː l̪ oː
घोटालों	ɡʱ oː ʈ äː l̪ õː
घोड़ा	ɡʱ oː ɽ äː
घोराही	ɡʱ oː ɾ äː ɦ iː
घोल	ɡʱ oː l̪
घोलना	ɡʱ oː l̪ n̪ äː
घोष	ɡʱ oː ʃ
घोषक	ɡʱ oː ʃ ə k
घोषणा	ɡʱ oː ʃ ɳ äː
घोषणाएँ	ɡʱ oː ʃ ɳ äː ẽː
घोषणाओ	ɡʱ oː ʃ ɳ äː oː
घोषणाओं	ɡʱ oː ʃ ɳ äː õː
घोषित	ɡʱ oː ʃ ɪ t̪
चंकट	t͡ʃ ə̃ ŋ k ə ʈ
चंगाल	t͡ʃ ə̃ ŋ ɡ äː l̪
चंडीगढ़	t͡ʃ ə̃ ɳ ɖ iː ɡ ə ɽʱ
चंडु	t͡ʃ ə̃ ɳ ɖ uː
चंडू	t͡ʃ ə̃ ɳ ɖ uː
चंडूख़ाना	t͡ʃ ə̃ ɳ ɖ uː kʰ äː n̪ äː
चंडूख़ाना	t͡ʃ ə̃ ɳ ɖ uː x äː n̪ äː
चंडूबाज़	t͡ʃ ə̃ ɳ ɖ uː b äː d͡ʒ
चंडूबाज़	t͡ʃ ə̃ ɳ ɖ uː b äː z
चंद	t͡ʃ ə̃ n̪ d̪
चंदा	t͡ʃ ə̃ n̪ d̪ äː
चंद्र	t͡ʃ ə̃ n̪ d̪ ɾᵊ
चंद्रकांति	t͡ʃ ə̃ n̪ d̪ ɾ ə k ä̃ː n̪ t̪ iː
चंद्रकान्ति	t͡ʃ ə̃ n̪ d̪ ɾ ə k ä̃ː n̪ t̪ iː
चंद्रगुप्त	t͡ʃ ə̃ n̪ d̪ ɾ ə ɡ ʊ p t̪
चंद्रग्रहण	t͡ʃ ə̃ n̪ d̪ ɾ ə ɡ ɾ ɛ ɦ ɛ̃ ɳ
चंद्रबिंदु	t͡ʃ ə̃ n̪ d̪ ɾ ə b ɪ̃ n̪ d̪ uː
चंद्रमा	t͡ʃ ə̃ n̪ d̪ ɾ ə m äː
चंद्रवार	t͡ʃ ə̃ n̪ d̪ ɾ ə ʋ äː ɾ
चंद्रशेखर	t͡ʃ ə̃ n̪ d̪ ɾ ə ʃ eː kʰ ə ɾ
चंद्रिका	t͡ʃ ə̃ n̪ d̪ ɾ ɪ k äː
चंद्रिणी	t͡ʃ ə̃ n̪ d̪ ɾ ɪ ɳ iː
चंपा	t͡ʃ ə̃ m p äː
चकमा	t͡ʃ ə k m äː
चकाचौंध	t͡ʃ ə k äː t͡ʃ ɔ̃ː n̪ d̪ʱ
चकोतरा	t͡ʃ ə k oː t̪ ɾ äː
चक्कर	t͡ʃ ə k̚ k ə ɾ
चक्का	t͡ʃ ə k̚ k äː
चक्रवृद्धि	t͡ʃ ə k ɾ ə ʋ ɾ ɪ d̪̚ d̪ʱ iː
चक्षु	t͡ʃ ə k ʃ uː
चक्षुदान	t͡ʃ ə k ʃ ʊ d̪ ä̃ː n̪
चखना	t͡ʃ ə kʰ n̪ äː
चटकना	t͡ʃ ə ʈ ə k n̪ äː
चटकारा	t͡ʃ ə ʈ k äː ɾ äː
चटगांव	t͡ʃ ə ʈ ɡ ä̃ː oː
चटनी	t͡ʃ ə ʈ n̪ iː
चटपटा	t͡ʃ ə ʈ ə p ʈ äː
चटाई	t͡ʃ ə ʈ äː iː
चट्टान	t͡ʃ ə ʈ̚ ʈ ä̃ː n̪
चड्डियाँ	t͡ʃ ə ɖ̚ ɖ i j ä̃ː
चड्डियो	t͡ʃ ə ɖ̚ ɖ i j oː
चड्डियों	t͡ʃ ə ɖ̚ ɖ i j õː
चड्डी	t͡ʃ ə ɖ̚ ɖ iː
चढ़ता	t͡ʃ ə ɽʱ t̪ äː
चढ़ना	t͡ʃ ə ɽʱ n̪ äː
चढ़नी	t͡ʃ ə ɽʱ n̪ iː
चढ़नीं	t͡ʃ ə ɽʱ n̪ ĩː
चढ़ने	t͡ʃ ə ɽʱ n̪ eː
चढ़नेवाला	t͡ʃ ə ɽʱ n̪ eː ʋ äː l̪ äː
चढ़नेवाली	t͡ʃ ə ɽʱ n̪ eː ʋ äː l̪ iː
चढ़नेवालीं	t͡ʃ ə ɽʱ n̪ eː ʋ äː l̪ ĩː
चढ़नेवाले	t͡ʃ ə ɽʱ n̪ eː ʋ äː l̪ eː
चढ़ा	t͡ʃ ə ɽʱ äː
चढ़ाइये	t͡ʃ ə ɽʱ äː i j eː
चढ़ाइयेगा	t͡ʃ ə ɽʱ äː i j eː ɡ äː
चढ़ाइयो	t͡ʃ ə ɽʱ äː i j oː
चढ़ाई	t͡ʃ ə ɽʱ äː iː
चढ़ाऊँ	t͡ʃ ə ɽʱ äː ũː
चढ़ाऊँगा	t͡ʃ ə ɽʱ äː ũː ŋ ɡ äː
चढ़ाऊँगी	t͡ʃ ə ɽʱ äː ũː ŋ ɡ iː
चढ़ाए	t͡ʃ ə ɽʱ äː eː
चढ़ाओ	t͡ʃ ə ɽʱ äː oː
चढ़ाओगी	t͡ʃ ə ɽʱ äː oː ɡ iː
चढ़ाओगे	t͡ʃ ə ɽʱ äː oː ɡ eː
चढ़ाकर	t͡ʃ ə ɽʱ äː k ə ɾ
चढ़ाके	t͡ʃ ə ɽʱ äː k eː
चढ़ाता	t͡ʃ ə ɽʱ äː t̪ äː
चढ़ाती	t͡ʃ ə ɽʱ äː t̪ iː
चढ़ातीं	t͡ʃ ə ɽʱ äː t̪ ĩː
चढ़ाते	t͡ʃ ə ɽʱ äː t̪ eː
चढ़ाना	t͡ʃ ə ɽʱ äː n̪ äː
चढ़ानी	t͡ʃ ə ɽʱ äː n̪ iː
चढ़ानीं	t͡ʃ ə ɽʱ äː n̪ ĩː
चढ़ाने	t͡ʃ ə ɽʱ äː n̪ eː
चढ़ानेवाला	t͡ʃ ə ɽʱ äː n̪ eː ʋ äː l̪ äː
चढ़ानेवाली	t͡ʃ ə ɽʱ äː n̪ eː ʋ äː l̪ iː
चढ़ानेवालीं	t͡ʃ ə ɽʱ äː n̪ eː ʋ äː l̪ ĩː
चढ़ानेवाले	t͡ʃ ə ɽʱ äː n̪ eː ʋ äː l̪ eː
चढ़ाया	t͡ʃ ə ɽʱ äː j äː
चढ़ायी	t͡ʃ ə ɽʱ äː j iː
चढ़ायीं	t͡ʃ ə ɽʱ äː j ĩː
चढ़ाये	t͡ʃ ə ɽʱ äː j eː
चढ़ायें	t͡ʃ ə ɽʱ äː j ẽː
चढ़ायेंगी	t͡ʃ ə ɽʱ äː j ẽː ŋ ɡ iː
चढ़ायेंगे	t͡ʃ ə ɽʱ äː j ẽː ŋ ɡ eː
चढ़ायेगा	t͡ʃ ə ɽʱ äː j eː ɡ äː
चढ़ायेगी	t͡ʃ ə ɽʱ äː j eː ɡ iː
चढ़िये	t͡ʃ ə ɽʱ i j eː
चढ़ियेगा	t͡ʃ ə ɽʱ i j eː ɡ äː
चढ़ियो	t͡ʃ ə ɽʱ i j oː
चढ़ूँगा	t͡ʃ ə ɽʱ ũː ŋ ɡ äː
चढ़ूँगी	t͡ʃ ə ɽʱ ũː ŋ ɡ iː
चढ़ेंगी	t͡ʃ ə ɽʱ ẽː ŋ ɡ iː
चढ़ेंगे	t͡ʃ ə ɽʱ ẽː ŋ ɡ eː
चढ़ेगा	t͡ʃ ə ɽʱ eː ɡ äː
चतुराइयाँ	t͡ʃ ə t̪ ʊ ɾ äː i j ä̃ː
चतुराइयो	t͡ʃ ə t̪ ʊ ɾ äː i j oː
चतुराइयों	t͡ʃ ə t̪ ʊ ɾ äː i j õː
चतुराई	t͡ʃ ə t̪ ʊ ɾ äː iː
चना	t͡ʃ ə n̪ äː
चनाब	t͡ʃ ə n̪ äː b
चन्द	t͡ʃ ə̃ n̪ d̪
चन्द्र	t͡ʃ ə̃ n̪ d̪ ɾᵊ
चन्द्रकांति	t͡ʃ ə̃ n̪ d̪ ɾ ə k ä̃ː n̪ t̪ iː
चन्द्रकान्ति	t͡ʃ ə̃ n̪ d̪ ɾ ə k ä̃ː n̪ t̪ iː
चन्द्रमा	t͡ʃ ə̃ n̪ d̪ ɾ ə m äː
चन्द्रवार	t͡ʃ ə̃ n̪ d̪ ɾ ə ʋ äː ɾ
चन्द्रहास	t͡ʃ ə̃ n̪ d̪ ɾ ə ɦ äː s̪
चन्द्रिका	t͡ʃ ə̃ n̪ d̪ ɾ ɪ k äː
चन्द्रिणी	t͡ʃ ə̃ n̪ d̪ ɾ ɪ ɳ iː
चपरासी	t͡ʃ ə p ɾ äː s̪ iː
चपाती	t͡ʃ ə p äː t̪ iː
चप्पल	t͡ʃ ə p̚ p ə l̪
चबा	t͡ʃ ə b äː
चबाइये	t͡ʃ ə b äː i j eː
चबाइयेगा	t͡ʃ ə b äː i j eː ɡ äː
चबाइयो	t͡ʃ ə b äː i j oː
चबाऊँ	t͡ʃ ə b äː ũː
चबाऊँगा	t͡ʃ ə b äː ũː ŋ ɡ äː
चबाऊँगी	t͡ʃ ə b äː ũː ŋ ɡ iː
चबाओ	t͡ʃ ə b äː oː
चबाओगी	t͡ʃ ə b äː oː ɡ iː
चबाओगे	t͡ʃ ə b äː oː ɡ eː
चबाकर	t͡ʃ ə b äː k ə ɾ
चबाके	t͡ʃ ə b äː k eː
चबाता	t͡ʃ ə b äː t̪ äː
चबाती	t͡ʃ ə b äː t̪ iː
चबातीं	t͡ʃ ə b äː t̪ ĩː
चबाते	t͡ʃ ə b äː t̪ eː
चबाना	t͡ʃ ə b äː n̪ äː
चबानी	t͡ʃ ə b äː n̪ iː
चबानीं	t͡ʃ ə b äː n̪ ĩː
चबाने	t͡ʃ ə b äː n̪ eː
चबानेवाला	t͡ʃ ə b äː n̪ eː ʋ äː l̪ äː
चबानेवाली	t͡ʃ ə b äː n̪ eː ʋ äː l̪ iː
चबानेवालीं	t͡ʃ ə b äː n̪ eː ʋ äː l̪ ĩː
चबानेवाले	t͡ʃ ə b äː n̪ eː ʋ äː l̪ eː
चबाया	t͡ʃ ə b äː j äː
चबायी	t͡ʃ ə b äː j iː
चबायीं	t͡ʃ ə b äː j ĩː
चबाये	t͡ʃ ə b äː j eː
चबायें	t͡ʃ ə b äː j ẽː
चबायेंगी	t͡ʃ ə b äː j ẽː ŋ ɡ iː
चबायेंगे	t͡ʃ ə b äː j ẽː ŋ ɡ eː
चबायेगा	t͡ʃ ə b äː j eː ɡ äː
चबायेगी	t͡ʃ ə b äː j eː ɡ iː
चमककर	t͡ʃ ə m ə k̚ k ə ɾ
चमकके	t͡ʃ ə m ə k̚ k eː
चमकता	t͡ʃ ə m ə k t̪ äː
चमकदार	t͡ʃ ə m ə k d̪ äː ɾ
चमकना	t͡ʃ ə m ə k n̪ äː
चमकनी	t͡ʃ ə m ə k n̪ iː
चमकनीं	t͡ʃ ə m ə k n̪ ĩː
चमकने	t͡ʃ ə m ə k n̪ eː
चमकनेवाला	t͡ʃ ə m ə k n̪ eː ʋ äː l̪ äː
चमकनेवाली	t͡ʃ ə m ə k n̪ eː ʋ äː l̪ iː
चमकनेवालीं	t͡ʃ ə m ə k n̪ eː ʋ äː l̪ ĩː
चमकनेवाले	t͡ʃ ə m ə k n̪ eː ʋ äː l̪ eː
चमका	t͡ʃ ə̃ m k äː
चमकिये	t͡ʃ ə̃ m k i j eː
चमकियेगा	t͡ʃ ə̃ m k i j eː ɡ äː
चमकी	t͡ʃ ə̃ m k iː
चमकीं	t͡ʃ ə̃ m k ĩː
चमकीली	t͡ʃ ə̃ m k iː l̪ iː
चमकीले	t͡ʃ ə̃ m k iː l̪ eː
चमकूँ	t͡ʃ ə̃ m k ũː
चमकूँगा	t͡ʃ ə̃ m k ũː ŋ ɡ äː
चमकूँगी	t͡ʃ ə̃ m k ũː ŋ ɡ iː
चमके	t͡ʃ ə̃ m k eː
चमकें	t͡ʃ ə̃ m k ẽː
चमकेंगी	t͡ʃ ə̃ m k ẽː ŋ ɡ iː
चमकेंगे	t͡ʃ ə̃ m k ẽː ŋ ɡ eː
चमकेगा	t͡ʃ ə̃ m k eː ɡ äː
चमकेगी	t͡ʃ ə̃ m k eː ɡ iː
चमको	t͡ʃ ə̃ m k oː
चमकोगी	t͡ʃ ə̃ m k oː ɡ iː
चमकोगे	t͡ʃ ə̃ m k oː ɡ eː
चमगादड़	t͡ʃ ə̃ m ɡ äː d̪ ə ɽ
चमच	t͡ʃ ə m ə t͡ʃ
चमचमाना	t͡ʃ ə̃ m t͡ʃ ə m äː n̪ äː
चमचा	t͡ʃ ə̃ m t͡ʃ äː
चमची	t͡ʃ ə̃ m t͡ʃ iː
चमड़ा	t͡ʃ ə̃ m ɽ äː
चमड़ी	t͡ʃ ə̃ m ɽ iː
चमत्कार	t͡ʃ ə m ə t̪ k äː ɾ
चमत्कारी	t͡ʃ ə m ə t̪ k äː ɾ iː
चमत्कारो	t͡ʃ ə m ə t̪ k äː ɾ oː
चमत्कारों	t͡ʃ ə m ə t̪ k äː ɾ õː
चमन	t͡ʃ ə m ə̃ n̪
चमस	t͡ʃ ə m ə s̪
चमारो	t͡ʃ ə m äː ɾ oː
चमारों	t͡ʃ ə m äː ɾ õː
चमेलियाँ	t͡ʃ ə m eː l̪ i j ä̃ː
चमेलियो	t͡ʃ ə m eː l̪ i j oː
चमेलियों	t͡ʃ ə m eː l̪ i j õː
चम्मचो	t͡ʃ ə̃ m m ə t͡ʃ oː
चम्मचों	t͡ʃ ə̃ m m ə t͡ʃ õː
चयन	t͡ʃ ə j ə̃ n̪
चरख़ा	t͡ʃ ə ɾ kʰ äː
चरख़ा	t͡ʃ ə ɾ x äː
चरखा	t͡ʃ ə ɾ kʰ äː
चरखा	t͡ʃ ə ɾ x äː
चरण	t͡ʃ ə ɾ ə̃ ɳ
चरना	t͡ʃ ə ɾ n̪ äː
चरपरा	t͡ʃ ə ɾ p ə ɾ äː
चरमपंथी	t͡ʃ ə ɾ ə̃ m p ə̃ n̪ t̪ʰ iː
चरमराना	t͡ʃ ə ɾ ə̃ m ɾ äː n̪ äː
चरवाहा	t͡ʃ ə ɾ ʋ äː ɦ äː
चरागाह	t͡ʃ ə ɾ äː ɡ äː ɦ
चर्चा	t͡ʃ ə ɾ t͡ʃ äː
चल	t͡ʃ ə l̪
चलकर	t͡ʃ ə l̪ k ə ɾ
चलके	t͡ʃ ə l̪ k eː
चलचित्र	t͡ʃ ə l̪ t͡ʃ ɪ t̪ ɾᵊ
चलचित्रण	t͡ʃ ə l̪ t͡ʃ ɪ t̪ ɾ ə̃ ɳ
चलता	t͡ʃ ə l̪ t̪ äː
चलती	t͡ʃ ə l̪ t̪ iː
चलतीं	t͡ʃ ə l̪ t̪ ĩː
चलते	t͡ʃ ə l̪ t̪ eː
चलन	t͡ʃ ə l̪ ə̃ n̪
चलना	t͡ʃ ə l̪ n̪ äː
चलनी	t͡ʃ ə l̪ n̪ iː
चलनीं	t͡ʃ ə l̪ n̪ ĩː
चलने	t͡ʃ ə l̪ n̪ eː
चलनेवाला	t͡ʃ ə l̪ n̪ eː ʋ äː l̪ äː
चलनेवाली	t͡ʃ ə l̪ n̪ eː ʋ äː l̪ iː
चलनेवालीं	t͡ʃ ə l̪ n̪ eː ʋ äː l̪ ĩː
चलनेवाले	t͡ʃ ə l̪ n̪ eː ʋ äː l̪ eː
चलवा	t͡ʃ ə l̪ ʋ äː
चलवाइये	t͡ʃ ə l̪ ʋ äː i j eː
चलवाइयेगा	t͡ʃ ə l̪ ʋ äː i j eː ɡ äː
चलवाऊँ	t͡ʃ ə l̪ ʋ äː ũː
चलवाऊँगा	t͡ʃ ə l̪ ʋ äː ũː ŋ ɡ äː
चलवाऊँगी	t͡ʃ ə l̪ ʋ äː ũː ŋ ɡ iː
चलवाकर	t͡ʃ ə l̪ ʋ äː k ə ɾ
चलवाके	t͡ʃ ə l̪ ʋ äː k eː
चलवाता	t͡ʃ ə l̪ ʋ äː t̪ äː
चलवाना	t͡ʃ ə l̪ ʋ äː n̪ äː
चलवाने	t͡ʃ ə l̪ ʋ äː n̪ eː
चलवाया	t͡ʃ ə l̪ ʋ äː j äː
चला	t͡ʃ ə l̪ äː
चलाइये	t͡ʃ ə l̪ äː i j eː
चलाइयेगा	t͡ʃ ə l̪ äː i j eː ɡ äː
चलाइयो	t͡ʃ ə l̪ äː i j oː
चलाऊँ	t͡ʃ ə l̪ äː ũː
चलाऊँगा	t͡ʃ ə l̪ äː ũː ŋ ɡ äː
चलाऊँगी	t͡ʃ ə l̪ äː ũː ŋ ɡ iː
चलाओ	t͡ʃ ə l̪ äː oː
चलाओगी	t͡ʃ ə l̪ äː oː ɡ iː
चलाओगे	t͡ʃ ə l̪ äː oː ɡ eː
चलाकर	t͡ʃ ə l̪ äː k ə ɾ
