Ada	aː t a
knattspyrnukona	kʰ n a h t s p ɪ r t n ʏ kʰ ɔː n a
knattspyrnumaður	kʰ n a h t s p ɪ r t n ʏ m aː ð ʏ r
knattspyrnuþjálfari	kʰ n a h t s p ɪ r t n ʏ θ j a u l v a r ɪ
knega	kʰ n e iː ɣ a
knipla	kʰ n ɪ h p l a
knippi	kʰ n ɪ h p ɪ
knár	kʰ n a uː r
knæpa	kʰ n a iː p a
kné	kʰ n j ɛː
knéfiðla	kʰ n j ɛː f ɪ ð l a
knörr	kʰ n œ rː
knöttur	kʰ n œ h t ʏ r
knús	kʰ n uː s
knýja	kʰ n iː j a
koddaver	kʰ ɔ tː a v ɛː r
koddi	kʰ ɔ tː ɪ
kofa	kʰ ɔː v a
kofaþorp	kʰ ɔː v a θ ɔ r̥ p
koffort	kʰ ɔ fː ɔ r̥ t
koffín	kʰ ɔ fː iː n
kok	kʰ ɔː k
kokhlust	kʰ ɔː k l̥ ʏ s t
kokka	kʰ ɔ h k a
kokkteill	kʰ ɔ h k tʰ e i t l
kokkur	kʰ ɔ h k ʏ r
koks	kʰ ɔ x s
kokteill	kʰ ɔ x t e i t l̥
kol	kʰ ɔː l
kolanáma	kʰ ɔː l a n a uː m a
kolefni	kʰ ɔː l ɛ p n ɪ
koli	kʰ ɔː l ɪ
kolkrabbi	kʰ ɔ l kʰ r a pː ɪ
kolla	kʰ ɔ t l a
kollekta	kʰ ɔ lː ɛ x t a
kollhnís	kʰ ɔ t l n̥ iː s
kollur	kʰ ɔ t l ʏ r
kolsýra	kʰ ɔ l s iː r a
kolvetni	kʰ ɔ l v ɛ h t n ɪ
koma	kʰ ɔː m a
komma	kʰ ɔ mː a
kommi	kʰ ɔ mː ɪ
kommúna	kʰ ɔ mː uː n a
kommúnismi	kʰ ɔ mː uː n ɪ s m ɪ
kommúnisti	kʰ ɔ mː uː n ɪ s t ɪ
kompa	kʰ ɔ m̥ p a
komutími	kʰ ɔː m ʏ tʰ iː m ɪ
kona	kʰ ɔ n a
konar	kʰ ɔː n a r
konsúll	kʰ ɔ n s u t l
kontrabassi	kʰ ɔ n̥ t r a p a sː ɪ
kontrafagott	kʰ ɔ n̥ t r a f aː k ɔ h t
kontrapunktur	kʰ ɔ n̥ t r a pʰ ʏ n̥ k t ʏ r
konum	kʰ ɔː n ʏ m
konunglegur	kʰ ɔː n u ŋ k l ɛː ɣ ʏ r
konungshöll	kʰ ɔː n u ŋ k s h œ t l
konungsríki	kʰ ɔː n u ŋ k s r iː c ɪ
konungsveldi	kʰ ɔː n u ŋ k s v ɛ l t ɪ
konur	kʰ ɔː n ʏ r
kopar	kʰ ɔː p a r
korkur	kʰ ɔ r̥ k ʏ r
korn	kʰ ɔ r t n
kornblóm	kʰ ɔ r t n p l o uː m
kornbreskur	kʰ ɔ r t n p r ɛ s k ʏ r
kornhæna	kʰ ɔ r t n h a iː n a
kornsúra	kʰ ɔ r t n s uː r a
korpa	kʰ ɔ r̥ p a
korpönd	kʰ ɔ r̥ p œ n t
korr	kʰ ɔ rː
korra	kʰ ɔ rː a
kort	kʰ ɔ r̥ t
kortér	kʰ ɔ r̥ t j ɛ r
kosning	kʰ ɔ s t n i ŋ k
kosningarréttur	kʰ ɔ s t n i ŋ k a r r j ɛ h t ʏ r
koss	kʰ ɔ sː
kossa	kʰ ɔ sː a
kosta	kʰ ɔ s t a
kotra	kʰ ɔː t r a
krabbamein	kʰ r a pː a m e iː n
krafa	kʰ r aː v a
kraftaverk	kʰ r a f t a v ɛ r̥ k
kraftur	kʰ r a f t ʏ r
kragi	kʰ r a iː j ɪ
kragi	kʰ r aː j ɪ
krakk	kʰ r a h k
krakkaskömm	kʰ r a h k a s k œ mː
krakki	kʰ r a h c ɪ
krampi	kʰ r a m̥ p ɪ
krani	kʰ r aː n ɪ
krap	kʰ r aː p
krappur	kʰ r a h p ʏ r
kreditkort	kʰ r ɛː t ɪ t kʰ ɔ r̥ t
krefja	kʰ r ɛ v j a
krefjast	kʰ r ɛ v j a s t
kreista	kʰ r e i s t a
krem	kʰ r ɛː m
kremja	kʰ r ɛ m j a
krepja	kʰ r ɛː p j a
kreppa	kʰ r ɛ h p a
krikket	kʰ r ɪ h c ɛ t
krimmi	kʰ r ɪ mː ɪ
kringja	kʰ r i ɲ c a
kringla	kʰ r i ŋ l a
kringlóttur	kʰ r i ŋ l o u h t ʏ r
kringumstæður	kʰ r i ŋ k ʏ m s t a iː ð ʏ r
krisma	kʰ r ɪ s m a
kristindómur	kʰ r ɪ s t ɪ n t o uː m ʏ r
kristni	kʰ r ɪ s t n ɪ
kristþyrnir	kʰ r ɪ s t θ ɪ r t n ɪ r
krjúpa	kʰ r j uː p a
krol	kʰ r ɔː l
kroppa	kʰ r ɔ h p a
kroppur	kʰ r ɔ h p ʏ r
kross	kʰ r ɔ sː
krossfari	kʰ r ɔ sː f aː r ɪ
krossfeldi	kʰ r ɔ sː f ɛ l t ɪ
krossferð	kʰ r ɔ sː f ɛ r ð
krossfesting	kʰ r ɔ sː f ɛ s t i ŋ k
krossfiskur	kʰ r ɔ sː f ɪ s k ʏ r
krossfífill	kʰ r ɔ sː f iː v ɪ t l
krossför	kʰ r ɔ sː f œː r
krossgáta	kʰ r ɔ sː k a uː t a
krosskónguló	kʰ r ɔ sː k o u ŋ k ʏ l o uː
krossmaðra	kʰ r ɔ sː m a ð r a
krukka	kʰ r ʏ h k a
krumla	kʰ r ʏ m l a
krummi	k r̥ ʏ mː ɪ
krybba	k r i pː a
krydd	kʰ r ɪ tː
krydda	kʰ r ɪ tː a
kryfja	kʰ r ɪ v j a
kryppa	kʰ r ɪ h p a
krá	kʰ r a uː
kráka	kʰ r a uː k a
krækill	kʰ r a iː c ɪ t l
krækja	kʰ r a iː c a
krækla	kʰ r a i h k l a
kræklingur	kʰ r a i h k l i ŋ k ʏ r
kræklóttur	kʰ r a i h k l o u h t ʏ r
kræla	kʰ r a iː l a
kría	kʰ r iː j a
kríli	kʰ r iː l ɪ
krít	kʰ r iː t
kró	kʰ r o uː
krókur	kʰ r o uː k ʏ r
krókus	kʰ r o uː k ʏ s
krókódíll	kʰ r o uː k o u t i t l
krókódílstár	kʰ r o uː k o u t i l s tʰ a uː r
króm	kʰ r o uː m
króna	kʰ r o u n a
krónprins	kʰ r o u n pʰ r ɪ n s
krónprinsessa	kʰ r o u n p r ɪ n s ɛ sː a
kröfuganga	kʰ r œː v ʏ k a u ŋ k a
kröggur	kʰ r œ kː ʏ r
krúna	kʰ r u n a
krýna	kʰ r iː n a
krýning	kʰ r iː n i ŋ k
kubbur	kʰ ʏ pː ʏ r
kufl	kʰ ʏ p l
kukl	kʰ ʏ h k l
kuldalegur	kʰ ʏ l t a l ɛː ɣ ʏ r
kuldi	kʰ ʏ l t ɪ
kundur	kʰ ʏ n t ʏ r
kunna	kʰ ʏ nː a
kunnur	kʰ ʏ nː ʏ r
kunnátta	kʰ ʏ nː a u h t a
kunta	kʰ ʏ n̥ t a
kurr	kʰ ʏ rː
kurt	kʰ ʏ r̥ t
kurteisi	kʰ ʏ r̥ t e iː s ɪ
kusa	kʰ ʏː s a
kussari	kʰ ʏ sː a r ɪ
kuti	kʰ ʏː t ɪ
kuðungur	kʰ ʏː ð u ŋ k ʏ r
kvabb	kʰ v a pː
kvabba	kʰ v a pː a
kvak	kʰ v aː k
kvaka	kʰ v aː k a
kvap	kʰ v aː p
kvarki	kʰ v a r̥ c ɪ
kvars	kʰ v a r̥ s
kvarta	kʰ v a r̥ t a
kvartil	kʰ v a r̥ t ɪ l
kvað	kʰ v aː ð
kvaðratrót	kʰ v a ð r aː t r o uː t
kvef	kʰ v ɛː v
kveif	kʰ v e iː v
kveikja	kʰ v e iː c a
kveikjari	kʰ v e iː c a r ɪ
kveikur	kʰ v e iː k ʏ r
kvein	kʰ v e iː n
kveina	kʰ v e iː n a
kveisa	kʰ v e iː s a
kvelja	kʰ v ɛ l j a
kvendýr	kʰ v ɛ n t iː r
kvenhatur	kʰ v ɛ n h aː t ʏ r
kvenhylli	kʰ v ɛ n h ɪ t l ɪ
kvenkyn	kʰ v ɛ n cʰ ɪː n
kvenmaður	kʰ v ɛ n m aː ð ʏ r
kvennabósi	kʰ v ɛ nː a p o uː s ɪ
kvennabúr	kʰ v ɛ nː a p uː r
kverk	kʰ v ɛ r̥ k
kverkar	kʰ v ɛ r̥ k a r
kveða	kʰ v ɛː ð a
kveðja	kʰ v ɛ ð j a
kveðskapur	kʰ v ɛ ð s k aː p ʏ r
kvika	kʰ v ɪː k a
kvikasilfur	kʰ v ɪː k a s ɪ l v ʏ r
kvikmynd	kʰ v ɪː k m ɪ n t
kvikmyndahús	kʰ v ɪː k m ɪ n t a h uː s
kvikmyndaver	kʰ v ɪː k m ɪ n t a v ɛː r
kvikna	kʰ v ɪ h k n a
kvikur	kʰ v ɪː k ʏ r
kvilli	kʰ v ɪ t l ɪ
kvis	kʰ v ɪː s
kvistur	kʰ v ɪ s t ʏ r
kvittun	kʰ v ɪ h t ʏ n
kvittur	kʰ v ɪ h t ʏ r
kviða	kʰ v ɪː ð a
kviðslit	kʰ v ɪ ð s t l ɪː t
kviður	kʰ v ɪː ð ʏ r
kvos	kʰ v ɔː s
kvoða	kʰ v ɔː ð a
kvæna	kʰ v a iː n a
kvæði	kʰ v a iː ð ɪ
kví	kʰ v iː
kvíga	kʰ v iː ɣ a
kvísl	kʰ v i s t l
kvíða	kʰ v iː ð a
kvíði	kʰ v iː ð ɪ
kvöl	kʰ v œː l
kvöld	kʰ v œ l t
kvöldmatur	kʰ v œ l t m aː t ʏ r
kvöldverður	kʰ v œ l t v ɛ r ð ʏ r
kvörn	kʰ v œ r t n
kvörtun	kʰ v œ r̥ t ʏ n
kvöð	kʰ v œː ð
kylfa	cʰ ɪ l v a
kyn	cʰ ɪː n
kynblendingur	cʰ ɪ n p l ɛ n t i ŋ k ʏ r
kynbundinn	cʰ ɪ n p ʏ n t ɪ nː
kynda	cʰ ɪ n t a
kyndill	cʰ ɪ n t ɪ t l
kyndugur	cʰ ɪ n t ʏː ɣ ʏ r
kynfruma	c ɪ n f r ʏː m a
kynfæri	cʰ ɪ n f a iː r ɪ
kyngja	cʰ i ɲ c a
kynhneigð	cʰ ɪ n n̥ e i ɣ ð
kynhvöt	cʰ ɪː n kʰ v œː t
kynhvöt	cʰ ɪː n xʷ œː t
kynkirtill	cʰ ɪː n cʰ ɪ r̥ t ɪ t l
kynkvísl	cʰ ɪː n kʰ v i s t l
kynlaus	cʰ ɪ n l ø yː s
kynleysi	cʰ ɪ n l e iː s ɪ
kynna	cʰ ɪ nː a
kynngi	cʰ i ɲ c ɪ
kynni	cʰ ɪ nː ɪ
kynning	cʰ ɪ nː i ŋ k
kynnir	cʰ ɪ nː ɪ r
kynsjúkdómur	cʰ ɪ n s j uː k t o uː m ʏ r
kynskiptingur	cʰ ɪː n s c ɪ f t i ŋ k ʏ r
kynslóð	cʰ ɪ n s t l o uː ð
kynstur	cʰ ɪ n s t ʏ r
kynþáttur	c ɪ n θ a u h t ʏ r
kyrja	cʰ ɪ r j a
kyrking	cʰ ɪ r̥ c i ŋ k
kyrkingur	cʰ ɪ r̥ c i ŋ k ʏ r
kyrkislanga	c ɪ r̥ c ɪ s t l a u ŋ k a
kyrkja	cʰ ɪ r̥ c a
kyrr	cʰ ɪ rː
kyrr	cʰ ɪː r
kyrr	cʰ ʏː r
kyrravika	cʰ ɪ rː a v ɪː k a
kyrrlæti	cʰ ɪ r l a iː t ɪ
kyrrseta	cʰ ɪ r s ɛː t a
kyrrsetning	cʰ ɪ r s ɛ h t n i ŋ k
kyrrð	cʰ ɪ r ð
kyrrþeyr	cʰ ɪ r θ e iː r
kyrtill	cʰ ɪ r̥ t ɪ t l
kyssa	cʰ ɪ sː a
kyssilegur	cʰ ɪ sː ɪ l ɛː ɣ ʏ r
kytra	cʰ ɪː t r a
ká	kʰ a uː
káeta	kʰ a uː ɛː t a
káfa	kʰ a uː v a
káka	kʰ a uː k a
kál	kʰ a uː l
kála	kʰ a uː l a
kálfi	kʰ a u l v ɪ
kálfur	kʰ a u l v ʏ r
kápa	kʰ a uː p a
kássa	kʰ a u sː a
kátur	kʰ a uː t ʏ r
kæfa	cʰ a iː v a
kækur	cʰ a iː k ʏ r
kæla	cʰ a iː l a
kæliskápur	cʰ a iː l ɪ s k a uː p ʏ r
kæna	cʰ a iː n a
kænn	cʰ a i t n
kænska	cʰ a i n s k a
kæpa	cʰ a iː p a
kær	cʰ a iː r
kæra	cʰ a iː r a
kærasta	cʰ a iː r a s t a
kærasti	cʰ a iː r a s t ɪ
kærulaus	cʰ a iː r ʏ l ø yː s
kæruleysi	cʰ a iː r ʏ l e iː s ɪ
kæsa	cʰ a iː s a
kæta	cʰ a iː t a
kæti	cʰ a iː t ɪ
kíf	cʰ iː v
kífa	cʰ iː v a
kíghósti	kʰ iː ɣ h o u s t ɪ
kíkir	cʰ iː c ɪ r
kíll	cʰ i t l
kíló	cʰ iː l o uː
kím	cʰ iː m
kímblað	cʰ i m p l aː ð
kínakál	cʰ iː n a kʰ a uː l
kínasi	cʰ iː n aː s ɪ
kínaskák	cʰ iː n a s k a uː k
kínverska	cʰ i n v ɛ r̥ s k a
kínín	cʰ iː n iː n
kísill	cʰ iː s ɪ t l
kítti	cʰ i h t ɪ
kíví	kʰ iː v i
kóf	kʰ o uː v
kók	kʰ o uː k
kókoshneta	k o uː k ɔ s n̥ ɛː t a
kólfur	kʰ o u l v ʏ r
kólibrífugl	kʰ o uː l ɪ p r iː f ʏ k l
kólna	kʰ o u l n a
kóngsbiskup	kʰ o u ŋ k s p ɪ s k ʏ p
kóngshrókur	k o u ŋ k s r̥ o uː k ʏ r
kóngsriddari	k o u ŋ k s r ɪ tː a r ɪ
kónguló	kʰ o u ŋ k ʏ l o uː
kóngur	kʰ o u ŋ k ʏ r
kópur	kʰ o uː p ʏ r
kór	kʰ o uː r
kórall	kʰ o uː r a t l
kóraltoppur	kʰ o uː r a l tʰ ɔ h p ʏ r
kóreska	kʰ o uː r ɛ s k a
kóríander	kʰ o uː r iː j a n t ɛː r
kóróna	kʰ o uː r o uː n a
kósínus	kʰ o uː s iː n ʏ s
kóða	kʰ o uː ð a
köfnun	kʰ œ p n ʏ n
köfnunarefni	kʰ œ p n ʏ n a r ɛ p n ɪ
köggull	kʰ œ kː ʏ t l
kögur	kʰ œː ɣ ʏ r
kökkur	kʰ œ h k ʏ r
kökuhnífur	kʰ œː k ʏ n̥ iː v ʏ r
kökukefli	kʰ œː k ʏ cʰ ɛ p l ɪ
köldugras	kʰ œ l t ʏ k r aː s
kölkun	kʰ œ l̥ k ʏ n
köllun	kʰ œ t l ʏ n
köngull	kʰ ø y ŋ k ʏ t l
könguló	kʰ ø y ŋ k ʏ l o uː
kör	kʰ œː r
körfuboltaþjálfari	kʰ œ r v ʏ p ɔ l̥ t a θ j a u l v a r ɪ
körfubolti	kʰ œ r v ʏ p ɔ l̥ t ɪ
körfuknattleiksþjálfari	kʰ œ r v ʏ kʰ n a h t l e i k s θ j a u l v a r ɪ
körfuknattleikur	kʰ œ r v ʏ kʰ n a h t l e iː k ʏ r
körfuvíðir	kʰ œ r v ʏ v iː ð ɪ r
kös	kʰ œː s
kössóttur	kʰ œ sː o u h t ʏ r
köttur	kʰ œ h t ʏ r
kú	kʰ uː
kúbein	kʰ uː p e iː n
kúfa	kʰ uː v a
kúfur	kʰ uː v ʏ r
kúga	k uː a
kúka	kʰ uː k a
kúkur	kʰ uː k ʏ r
kúl	kʰ uː l
kúla	kʰ uː l a
kúlulega	kʰ uː l ʏ l ɛː ɣ a
kúlupenni	kʰ uː l ʏ pʰ ɛ nː ɪ
kúluvarp	kʰ uː l ʏ v a r̥ p
kúmen	kʰ uː m ɛː n
kúnni	kʰ u nː ɪ
kúpa	kʰ uː p a
kúptur	kʰ u f t ʏ r
kúpull	kʰ uː p ʏ t l
kúrbítur	kʰ u r p iː t ʏ r
kúrdíska	kʰ u r t i s k a
kúrín	kʰ uː r iː n
kústur	kʰ u s t ʏ r
kútur	kʰ uː t ʏ r
kýli	cʰ iː l ɪ
kýr	cʰ iː r
kýrauga	cʰ iː r ø yː ɣ a
kýta	cʰ iː t a
labb	l a pː
labba	l a pː a
labbakútur	l a pː a kʰ uː t ʏ r
laf	l aː v
lafa	l aː v a
lafði	l a v ð ɪ
lag	l aː ɣ
laga	l aː ɣ a
lager	l aː ɣ ɛ r
lagga	l a kː a
laggóður	l a ɣ k o uː ð ʏ r
laginn	l a iː j ɪ nː
laglína	l a ɣ l iː n a
lagni	l a k n ɪ
lagður	l a ɣ ð ʏ r
lak	l aː k
lakk	l a h k
lakka	l a h k a
lakkrís	l a h k r iː s
laktasi	l a x t aː s ɪ
lama	l aː m a
lamb	l a m p
lambagras	l a m p a k r aː s
lambakjöt	l a m p a cʰ œː t
lambaklukka	l a m p a kʰ l ʏ h k a
lampi	l a m̥ p ɪ
land	l a n t
landafræði	l a n t a f r a iː ð ɪ
landakort	l a n t a kʰ ɔ r̥ t
landamæri	l a n t a m a iː r ɪ
landbúnaður	l a n t p uː n aː ð ʏ r
landfræði	l a n t f r a iː ð ɪ
landi	l a n t ɪ
landnemi	l a n t n ɛː m ɪ
landráð	l a n t r a uː ð
landslag	l a n s l aː ɣ
landsvala	l a n t s v aː l a
landsvæði	l a n t s v a iː ð ɪ
langa	l a u ŋ k a
langafi	l a u ŋ k aː v ɪ
langamma	l a u ŋ k a mː a
langatöng	l a u ŋ k a tʰ ø y ŋ k
langhlið	l a u ŋ k l̥ ɪː ð
langkrækill	l a u ŋ k kʰ r a iː c ɪ t l
langnykra	l a u ŋ k n ɪː k r a
langreyður	l a u ŋ k r e iː ð ʏ r
langur	l a u ŋ k ʏ r
langur	l a ŋ k ʏ r
lappi	l a h p ɪ
larfur	l a r v ʏ r
lasanja	l a s a n j a
lasinn	l aː s ɪ nː
laska	l a s k a
laski	l a s c ɪ
laslegur	l aː s l ɛː ɣ ʏ r
lasna	l a s t n a
last	l a s t
latur	l aː t ʏ r
latína	l aː tʰ iː n a
latínuskóli	l aː tʰ iː n ʏ s k o uː l ɪ
lauf	l ø yː v
laufblað	l ø y v p l aː ð
lauftré	l ø y v t r j ɛː
laug	l ø yː ɣ
lauga	l ø yː ɣ a
laugamaðra	l ø yː ɣ a m a ð r a
laugardagur	l ø yː ɣ a r t aː ɣ ʏ r
laugasef	l ø yː ɣ a s ɛː v
laukur	l ø yː k ʏ r
lauma	l ø yː m a
laun	l ø yː n
launahækkun	l ø yː n a h a i h k ʏ n
laus	l ø yː s
lauslátur	l ø yː s l a uː t ʏ r
lauslæti	l ø yː s l a iː t ɪ
lausn	l œ i s t n
lausnarhraði	l ø y s t n a r r̥ aː ð ɪ
lausung	l ø yː s u ŋ k
laut	l ø yː t
lautinant	l ø yː tʰ ɪ n a n̥ t
laxerolía	l a x s ɛ r ɔː l i j a
laða	l aː ð a
lefsa	l ɛ f s a
leg	l ɛː ɣ
lega	l ɛː ɣ a
legbólga	l ɛ ɣ p o u l k a
legging	l ɛ cː i ŋ k
leggja	l ɛ cː a
leggur	l ɛ kː ʏ r
leggöng	l ɛ ɣ k ø y ŋ k
legill	l e iː j ɪ t l
legkaka	l ɛ ɣ kʰ aː k a
legnám	l ɛ ɣ n a uː m
legunautur	l ɛː ɣ ʏ n ø yː t ʏ r
legvatn	l ɛ ɣ v a h t n
leif	l e iː v
leifa	l e iː v a
leifar	l e iː v a r
leiftur	l e i f t ʏ r
leifturstríð	l e i f t ʏ r s t r iː ð
leiga	l e iː ɣ a
leigja	l e iː j a
leigubíll	l e iː ɣ ʏ p i t l
leika	l e iː k a
leikari	l e iː k aː r ɪ
leikbrúða	l e iː k p r uː ð a
leikfang	l e iː k f a u ŋ k
leikfélag	l e iː k f j ɛː l aː ɣ
leikhús	l e iː k h uː s
leikkona	l e iː k kʰ ɔː n a
leikmaður	l e iː k m aː ð ʏ r
leikmynd	l e iː k m ɪ n t
leikrit	l e iː k r ɪː t
leikritaskáld	l e iː k r ɪː t a s k a u l t
leikskóli	l e i k s k o uː l ɪ
leikur	l e iː k ʏ r
leikvangur	l e iː k v a u ŋ k ʏ r
leikvöllur	l e iː k v œ t l ʏ r
leir	l e iː r
leirburður	l e i r p ʏ r ð ʏ r
leit	l e iː t
leið	l e iː ð
leiða	l e iː ð a
leiðangur	l e iː ð a u ŋ k ʏ r
leiðari	l e iː ð aː r ɪ
leiðarstef	l e iː ð a r s t ɛː v
leiðbeining	l e i ð p e iː n i ŋ k
leiði	l e iː ð ɪ
leiðindi	l e iː ð ɪ n t ɪ
leiðni	l e i ð n ɪ
leiðrétting	l e i ð r j ɛ h t i ŋ k
leiðsla	l e i ð s t l a
leiðsögn	l e i ð s œ k n
leiðsögumaður	l e i ð s œː ɣ ʏ m aː ð ʏ r
leiðtogi	l e i ð tʰ ɔː j ɪ
leiður	l e iː ð ʏ r
leka	l ɛː k a
leki	l ɛː c ɪ
lekur	l ɛː k ʏ r
lemja	l ɛ m j a
lemmun	l ɛ mː ʏ n
lemúr	l ɛː m uː r
lenda	l ɛ n t a
lending	l ɛ n t i ŋ k
lengd	l e i ŋ k t
lengja	l e i ɲ c a
lengjast	l e i ɲ c a s t
lengur	l e i ŋ k ʏ r
lensa	l ɛ n s a
lensutungljurt	l ɛ n s ʏ tʰ u ŋ l j ʏ r̥ t
lepja	l ɛː p j a
leppur	l ɛ h p ʏ r
lerki	l ɛ r̥ c ɪ
les	l ɛː s
lesa	l ɛː s a
lesandabréf	l ɛː s a n t a p r j ɛː v
lesandi	l ɛː s a n t ɪ
lesblinda	l ɛː s p l ɪ n t a
lesblindur	l ɛː s p l ɪ n t ʏ r
lesbía	l ɛ s p iː j a
lesminni	l ɛː s m ɪ nː ɪ
lessa	l ɛ sː a
lest	l ɛ s t
lesta	l ɛ s t a
lestarstjóri	l ɛ s t a r s t j o uː r ɪ
lestrarbók	l ɛ s t r a r p o uː k
lestun	l ɛ s t ʏ n
lettneska	l ɛ h t n ɛ s k a
lettneskur	l ɛ h t n ɛ s k ʏ r
letur	l ɛː t ʏ r
leturborð	l ɛː t ʏ r p ɔ r ð
lexía	l ɛ k s iː j a
lexía	l ɛ x s iː j a
leyfa	l e iː v a
leyfi	l e iː v ɪ
leyna	l e iː n a
leynd	l e i n t
leyndarmál	l e i n t a r m a uː l
leyndó	l e i n t o uː
leyni	l e iː n ɪ
leyniskytta	l e iː n ɪ s c ɪ h t a
leysa	l e iː s a
leysibóla	l e iː s ɪ p o uː l a
leysigeisli	l e iː s ɪ c e i s t l ɪ
leysingi	l e iː s i ɲ c ɪ
leysir	l e iː s ɪ r
leðja	l ɛ ð j a
leður	l ɛː ð ʏ r
leðurblaka	l ɛː ð ʏ r p l aː k a
lifa	l ɪː v a
lifandi	l ɪː v a n t ɪ
lifur	l ɪː v ʏ r
liggja	l ɪ cː a
lilja	l ɪ l j a
limgerði	l ɪ m c ɛ r ð ɪ
lind	l ɪ n t
lindasef	l ɪ n t a s ɛː v
lindi	l ɪ n t ɪ
lindifura	l ɪ n t ɪ f ʏː r a
linditré	l ɪ n t ɪ tʰ r j ɛː
linka	l i ŋ̊ k a
linna	l ɪ nː a
linnur	l ɪ nː ʏ r
linsa	l ɪ n s a
linur	l ɪː n ʏ r
lipur	l ɪː p ʏ r
lipurð	l ɪː p ʏ r ð
lirfa	l ɪ r v a
list	l ɪ s t
listasafn	l ɪ s t a s a p n
listasaga	l ɪ s t a s aː ɣ a
listaskóli	l ɪ s t a s k o uː l ɪ
listmálari	l ɪ s t m a uː l a r ɪ
listsýning	l ɪ s t s iː n i ŋ k
lita	l ɪː t a
litarefni	l ɪː t a r ɛ p n ɪ
litaröð	l ɪː t a r œː ð
litháíska	l ɪː t h a uː i s k a
litningsendi	l ɪ h t n i ŋ k s ɛ n t ɪ
litningur	l ɪ h t n i ŋ k ʏ r
litunarjafni	l ɪː t ʏ n a r j a p n ɪ
litín	l ɪː tʰ iː n
litúrgískur	l ɪː tʰ u r c i s k ʏ r
lið	l ɪː ð
liðamót	l ɪː ð a m o uː t
liðfætla	l ɪ ð f a i h t l a
liðhlaupi	l ɪ ð l̥ ø yː p ɪ
liðsforingi	l ɪ ð s f ɔː r i ɲ c ɪ
liðugur	l ɪː ð ʏː ɣ ʏ r
liður	l ɪː ð ʏ r
liðveisla	l ɪ ð v e i s t l a
liðþjálfi	l ɪ θ θ j a u l v ɪ
liþín	l ɪː θ iː n
ljá	l j a uː
ljár	l j a uː r
ljómi	l j o uː m ɪ
ljón	l j o uː n
ljónslappi	l j o u n s t l a h p ɪ
ljós	l j o uː s
ljósabekkur	l j o uː s a p ɛ h k ʏ r
ljósakróna	l j o uː s a kʰ r o uː n a
ljósapera	l j o uː s a pʰ ɛː r a
ljósastör	l j o uː s a s t œː r
ljósberi	l j o uː s p ɛː r ɪ
ljósbjalla	l j o uː s p j a t l a
ljóseind	l j o uː s e i n t
ljósfræði	l j o uː s f r a iː ð ɪ
ljóska	l j o u s k a
ljósmynd	l j o uː s m ɪ n t
ljósmyndavél	l j o uː s m ɪ n t a v j ɛː l
ljósmóðir	l j o uː s m o uː ð ɪ r
ljósta	l j o u s t a
ljóstillífun	l j o uː s t ɪ l l iː v ʏ n
ljóstýra	l j o uː s tʰ iː r a
ljósvaki	l j o uː s v aː c ɪ
ljótur	l j o uː t ʏ r
ljóð	l j o uː ð
ljóðlist	l j o u ð l ɪ s t
ljóðskáld	l j o u ð s k a u l t
ljóður	l j o uː ð ʏ r
ljúfra	l j u v r a
ljúga	l j uː a
ljúka	l j uː k a
lofa	l ɔː v a
loforð	l ɔː v ɔ r ð
loft	l ɔ f t
loftpúði	l ɔ f t pʰ uː ð ɪ
loftslag	l ɔ f t s l aː ɣ
lofttæmi	l ɔ f t tʰ a iː m ɪ
loftárás	l ɔ f t a uː r a uː s
loftþrýstingur	l ɔ f t θ r i s t i ŋ k ʏ r
lofðungur	l ɔ v ð u ŋ k ʏ r
loga	l ɔː ɣ a
logi	l ɔ iː j ɪ
logn	l ɔ k n
logri	l ɔ ɣ r ɪ
lok	l ɔː k
loka	l ɔː k a
lokkur	l ɔ h k ʏ r
lopapeysa	l ɔː p a pʰ e iː s a
loppa	l ɔ h p a
lortur	l ɔ r̥ t ʏ r
losun	l ɔː s ʏ n
lotning	l ɔ h t n i ŋ k
lotsveifgras	l ɔː t s v e i v k r aː s
lottó	l ɔ h t o uː
lotugræðgi	l ɔː t ʏ k r a i ð c ɪ
lotukerfi	l ɔː t ʏ cʰ ɛ r v ɪ
loða	l ɔː ð a
loðfíll	l ɔ ð f i t l
loðinn	l ɔː ð ɪ nː
loðna	l ɔ ð n a
loðvíðir	l ɔ ð v iː ð ɪ r
lufsa	l ʏ f s a
lugt	l ʏ x t
lukka	l ʏ h k a
lukt	l ʏ x t
luma	l ʏː m a
lumma	l ʏ mː a
lumpa	l ʏ m̥ p a
lund	l ʏ n t
lunderni	l ʏ n t ɛ r t n ɪ
lundi	l ʏ n t ɪ
lundir	l ʏ n t ɪ r
lundur	l ʏ n t ʏ r
lunga	l u ŋ k a
lungnaberklar	l u ŋ k n a p ɛ r̥ k l a r
lungnabláæð	l u ŋ k n a p l a uː a iː ð
lungnakrabbamein	l u ŋ k n a kʰ r a pː a m e iː n
lungnaslagæð	l u ŋ k n a s t l aː ɣ a iː ð
lunti	l ʏ n̥ t ɪ
luralegur	l ʏː r a l ɛː ɣ ʏ r
luri	l ʏː r ɪ
lyf	l ɪː v
lyfjabúð	l ɪ v j a p uː ð
lyfjagras	l ɪ v j a k r aː s
lyfta	l ɪ f t a
lyftutónlist	l ɪ f t ʏ tʰ o u n l ɪ s t
lygari	l ɪː ɣ aː r ɪ
lygi	l ɪ iː j ɪ
lygn	l ɪ k n
lygna	l ɪ k n a
lykill	l ɪː c ɪ t l
lykja	l ɪː c a
lykkja	l ɪ h c a
lyklabarn	l ɪ h k l a p a r t n
lyklaborð	l ɪ h k l a p ɔ r ð
lykt	l ɪ x t
lykta	l ɪ x t a
lyndi	l ɪ n t ɪ
lyng	l i ŋ k
lyngjafni	l i ŋ k j a p n ɪ
lyst	l ɪ s t
lystarstol	l ɪ s t a r s t ɔː l
lystauki	l ɪ s t ø yː c ɪ
lá	l a uː
ládauður	l a uː t ø yː ð ʏ r
lágarfi	l a uː ɣ a r v ɪ
láglendi	l a u ɣ l ɛ n t ɪ
lágmark	l a u ɣ m a r̥ k
lágmynd	l a u ɣ m ɪ n t
lágnætti	l a uː ɣ n a i h t ɪ
lágur	l a uː r̥
lágur	l a uː ɣ ʏ r̥
lágþrýstingur	l a u ɣ θ r i s t i ŋ k ʏ r
lán	l a uː n
lána	l a uː n a
lánsþýðing	l a u n s θ iː ð i ŋ k
lás	l a uː s
lásbogi	l a uː s p ɔː j ɪ
lát	l a uː t
láta	l a uː t a
látbragð	l a uː t p r a ɣ ð
látbragðsleikur	l a uː t p r a ɣ ð s l e iː k ʏ r
látæði	l a uː t a iː ð ɪ
látún	l a uː t uː n
lávarður	l a uː v a r ð ʏ r
láð	l a uː ð
lægja	l a iː j a
lægð	l a i ɣ ð
lækjafræhyrna	l a iː c a f r a iː h ɪ r t n a
lækjagrýta	l a iː c a k r iː t a
lækjasef	l a iː c a s ɛː v
lækjasóley	l a iː c a s o uː l e iː
læknir	l a i h k n ɪ r
læknisfræði	l a i h k n ɪ s f r a iː ð ɪ
læknisfræðilegur	l a i h k n ɪ s f r a iː ð ɪ l ɛː ɣ ʏ r
læknisskoðun	l a i h k n ɪ s s k ɔː ð ʏ n
lækur	l a iː k ʏ r
læmingi	l a iː m i ɲ c ɪ
læra	l a iː r a
lærdómur	l a i r t o uː m ʏ r
læri	l a iː r ɪ
lærisveinn	l a iː r ɪ s v e i t n
lærleggur	l a i r l ɛ kː ʏ r
læti	l a iː t ɪ
lævís	l a iː v iː s
læða	l a iː ð a
lélegur	l j ɛː l ɛː ɣ ʏ r
lén	l j ɛː n
léreft	l j ɛː r ɛ f t
létta	l j ɛ h t a
léttir	l j ɛ h t ɪ r
léttmjólk	l j ɛ h t m j o u l̥ k
léttur	l j ɛ h t ʏ r
léttvatn	l j ɛ h t v a h t n
léttúð	l j ɛ h t uː ð
léttúðugur	l j ɛ h t uː ð ʏː ɣ ʏ r
líf	l iː v
lífdagar	l i v t aː ɣ a r
lífefnafræði	l iː v ɛ p n a f r a iː ð ɪ
lífeðlisfræði	l iː v ɛ ð l ɪ s f r a iː ð ɪ
líffræði	l i f f r a iː ð ɪ
líffræðilegur	l i f f r a iː ð ɪ l ɛː ɣ ʏ r
líffræðingur	l i f f r a iː ð i ŋ k ʏ r
líffæri	l i f f a iː r ɪ
lífga	l i v k a
lífhimna	l i v h ɪ m n a
lífljómun	l i v l j o uː m ʏ n
lífrænn	l i v r a i t n
lífsandi	l i f s a n t ɪ
lífsgleði	l i f s k l ɛː ð ɪ
lífsmark	l i f s m a r̥ k
lífsspursmál	l i f s s p ʏ r̥ s m a uː l
lífstykki	l i f s t ɪ h c ɪ
lífsþróttur	l i f s θ r o u h t ʏ r
líftími	l iː v tʰ iː m ɪ
lífvera	l i v v ɛː r a
lífvörður	l i v v œ r ð ʏ r
lík	l iː k
líka	l iː k a
líkami	l iː kʰ aː m ɪ
líkamlegur	l iː kʰ a m l ɛː ɣ ʏ r
líkamsrækt	l iː kʰ a m s r a i x t
líkamur	l iː kʰ aː m ʏ r
líkindi	l iː c ɪ n t ɪ
líking	l iː c i ŋ k
líkkista	l iː k cʰ ɪ s t a
líkn	l i h k n
líkna	l i h k n a
líkskurður	l iː k s k ʏ r ð ʏ r
líkur	l iː k ʏ r
lím	l iː m
líma	l iː m a
límband	l iː m p a n t
límóna	l iː m o uː n a
lín	l iː n
línarfi	l iː n a r v ɪ
língresi	l i n k r ɛː s ɪ
línulega	l iː n ʏ l ɛː ɣ a
línuleiki	l iː n ʏ l e iː c ɪ
línuskauti	l iː n ʏ s k ø yː t ɪ
líra	l iː r a
líta	l iː t a
lítill	l iː t ɪ t l
lítri	l iː t r ɪ
lítt	l i h t
líða	l iː ð a
ló	l o uː
lóa	l o uː a
lófatölva	l o uː v a tʰ œ l v a
lófi	l o uː v ɪ
lófi	l o uː ɪ
lóga	l o uː a
lógresi	l o uː k r ɛː s ɪ
lómur	l o uː m ʏ r
lón	l o uː n
lónasóley	l o uː n a s o uː l e iː
lóð	l o uː ð
lóða	l o uː ð a
lóðleit	l o u ð l e iː t
lög	l œː ɣ
lögbrot	l œː ɣ p r ɔː t
lögfræði	l œ ɣ f r a iː ð ɪ
lögfræðingur	l œ ɣ f r a iː ð i ŋ k ʏ r
lögg	l œ kː
lögga	l œ kː a
löggjafarvald	l œ ɣ c aː v a r v a l t
löggjafarþing	l œ ɣ c aː v a r θ i ŋ k
löggjöf	l œ ɣ c œː v
lögmaður	l œ ɣ m aː ð ʏ r
lögregla	l œ ɣ r ɛ k l a
lögreglukona	l œ ɣ r ɛ k l ʏ k ɔː n a
lögreglumaður	l œ ɣ r ɛ k l ʏ m aː ð ʏ r
lögreglustjóri	l œ ɣ r ɛ k l ʏ s t j o uː r ɪ
lögreglustöð	l œ ɣ r ɛ k l ʏ s t œː ð
lögregluþjónn	l œ ɣ r ɛ k l ʏ θ j o u t n
lögur	l œː ɣ ʏ r
löm	l œː m
lömun	l œː m ʏ n
löng	l ø y ŋ k
löng	l œ ŋ k
löngun	l ø y ŋ k ʏ n
löpp	l œ h p
löskur	l œ s k ʏ r
löstur	l œ s t ʏ r
lötra	l œː t r a
lúga	l uː a
lúi	l uː ɪ
lúka	l uː k a
lúkk	l u h k
lús	l uː s
lúta	l uː t a
lúterskur	l uː tʰ ɛ r̥ s k ʏ r
lútur	l uː t ʏ r
lúxus	l u k s ʏ s
lúxus	l u x s ʏ s
lúða	l uː ð a
lúðalegur	l uː ð a l ɛː ɣ ʏ r
lúði	l uː ð ɪ
lúður	l uː ð ʏ r
lýja	l iː j a
lýra	l iː r a
lýsa	l iː s a
lýsi	l iː s ɪ
lýsing	l iː s i ŋ k
lýsingarháttur	l iː s i ŋ k a r h a u h t ʏ r
lýsingarorð	l iː s i ŋ k aː r ɔ r ð
lýðnet	l i ð n ɛː t
lýðræði	l i ð r a iː ð ɪ
lýðræðisríki	l i ð r a iː ð ɪ s r iː c ɪ
lýður	l iː ð ʏ r
lýðveldi	l i ð v ɛ l t ɪ
m	ɛ mː
magapína	m aː ɣ a pʰ iː n a
magi	m a i j ɪ
magn	m a k n
magur	m aː ɣ ʏ r
majór	m a j o uː r
maki	m aː c ɪ
makki	m a h c ɪ
mala	m aː l a
malajíska	m aː l a iː j i s k a
malbik	m a l p ɪː k
malli	m a lː ɪ
maltur	m a l̥ t ʏ r
malurt	m aː l ʏ r̥ t
mamma	m a mː a
man	m a n
mana	m aː n a
mandla	m a n t l a
manna	m a nː a
mannasiður	m a nː a s ɪː ð ʏ r
manneskja	m a n ɛ s c a
mannfræði	m a nː f r a iː ð ɪ
manngera	m a nː c ɛː r a
manni	m a nː ɪ
mannkyn	m a nː cʰ ɪː n
mannlegur	m a nː l ɛː ɣ ʏ r
mannorð	m a nː ɔ r ð
mannréttindi	m a nː r j ɛ h t ɪ n t ɪ
manntal	m a nː tʰ aː l
mannvirki	m a nː v ɪ r̥ c ɪ
mannvirðing	m a nː v ɪ r ð i ŋ k
mannvit	m a nː v ɪː t
mannvitsbrekka	m a nː v ɪ t s p r ɛ h k a
mappa	m a h p a
mar	m aː r
marbendill	m a r p ɛ n t ɪ t l
margfaldur	m a r k f a l t ʏ r
margföldun	m a r k f œ l t ʏ n
marglytta	m a r k l ɪ h t a
margur	m a r k ʏ r
margæs	m a r c a iː s
margþættur	m a r k θ a i h t ʏ r
mark	m a r̥ k
marka	m a r̥ k a
markalína	m a r̥ k a l iː n a
markaskrá	m a r̥ k a s k r a uː
markaður	m a r̥ k a ð ʏ r
markgreifi	m a r̥ k k r e iː v ɪ
markmaður	m a r̥ k m aː ð ʏ r
markorð	m a r̥ k ɔ r ð
markslá	m a r̥ k s t l a uː
markspyrna	m a r̥ k s p ɪ r t n a
markstöng	m a r̥ k s t ø y ŋ k
marksúla	m a r̥ k s uː l a
markteigur	m a r̥ k tʰ e iː ɣ ʏ r
markvörður	m a r̥ k v œ r ð ʏ r
marmennill	m a r m ɛ nː ɪ t l
marr	m a rː
marra	m a rː a
mars	m a r̥ s
marsbúi	m a r̥ s p uː ɪ
marsera	m a r̥ s ɛː r a
marsering	m a r̥ s ɛː r i ŋ k
marsmánuður	m a r̥ s m a uː n ʏː ð ʏ r
martröð	m a r̥ tʰ r œː ð
