Ada	aː t a
Afganistan	a v k aː n ɪ s t aː n
Afríka	aː f r iː k a
Aggi	a cː ɪ
Alaska	aː l a s k a
Albanía	a l p aː n iː j a
Alda	a l t a
Aldinborg	a l t ɪ n p ɔ r k
Aldís	a l t iː s
Alexander	aː l ɛ k s a n t ɛː r
Alli	a t l ɪ
Alþingi	a l θ i ŋ c ɪ
Ameríka	aː m ɛ r iː k a
Andersen	a n t ɛ r s ɛ nː
Andri	a n t r ɪ
Andrés	a n t r j ɛː s
Andrésína	a n t r j ɛː s iː n a
Angóla	a ŋ k o uː l a
Anna	a t n̥ a
Anúbis	aː n uː p ɪ s
Ara	aː r a
Arabía	aː r a p iː j a
Argentína	a r k ɛ n tʰ iː n a
Ari	aː r ɪ
Aristóteles	aː r ɪ s t o uː tʰ ɛː l ɛː s
Arnar	a r t n aː r
Arndís	a r t n t iː s
Arnfríður	a r t n f r iː ð ʏ r
Arngunnur	a r t n k ʏ nː ʏ r
Arnheiður	a r t n h e iː ð ʏ r
Arnmundur	a r t n m ʏ n t ʏ r
Arnór	a r t n o uː r
Arnþrúður	a r t n θ r uː ð ʏ r
Aron	aː r ɔː n
Asía	aː s iː j a
Austurey	ø y s t ʏ r e iː
Austurland	ø y s t ʏ r l a n t
Austurríki	ø y s t ʏ r r iː c ɪ
Austurríkismaður	ø y s t ʏ r r iː c ɪ s m aː ð ʏ r
Auðmundur	ø y ð m ʏ n t ʏ r
Auður	ø yː ð ʏ r
Aðalheiður	aː ð a l h e iː ð ʏ r
Aðalmundur	aː ð a l m ʏ n t ʏ r
Aþena	aː θ ɛː n a
Aþeningur	aː θ ɛː n i ŋ k ʏ r
Bakkus	p a h k ʏ s
Baldur	p a l t ʏ r
Bandaríkin	p a n t a r iː c ɪ n
Barein	p aː r e iː n
Belgi	p ɛ l c ɪ
Belgía	p ɛ l c i j a
Bender	p ɛ n d ɛː r
Benedikt	p ɛː n ɛː t ɪ x t
Benediktína	p ɛː n ɛː t ɪ x t iː n a
Benjamín	p ɛ n j a m iː n
Benín	p ɛː n iː n
Bera	p ɛː r a
Bergdís	p ɛ r k t iː s
Bergmann	p ɛ r k m a nː
Bergmundur	p ɛ r k m ʏ n t ʏ r
Bergþrúður	p ɛ r k θ r uː ð ʏ r
Berlín	p ɛ r l iː n
Bernharður	p ɛ r n h a r ð ʏ r
Bernharðína	p ɛ r n h a r ð iː n a
Bernhöft	p ɛ r n h œ f t
Biggi	p ɪ cː ɪ
Birgir	p ɪ r c ɪ r
Birna	p ɪ r t n a
Bjargmundur	p j a r k m ʏ n t ʏ r
Bjarki	p j a r̥ c ɪ
Bjarndís	p j a r t n t iː s
Bjarnharður	p j a r t n h a r ð ʏ r
Bjarnheiður	p j a r t n h e iː ð ʏ r
Bjartur	p j a r̥ t ʏ r
Bjólan	p j o u̯ː l a n
Bjöggi	p j œ cː ɪ
Björg	p j œ r k
Björgmundur	p j œ r k m ʏ n t ʏ r
Björgvin	p j œ r k v ɪ n
Björk	p j œ r̥ k
Björt	p j œ r̥ t
Blöndal	p l œ n t aː l
Bogga	p ɔ kː a
Bogi	p ɔ iː j ɪ
Borgundarhólmur	p ɔ r k ʏ n t a r h o u l m ʏ r
Bosnía	p ɔ s t n iː j a
Brasilía	p r aː s ɪ l iː j a
Breki	p r ɛː c ɪ
Breti	p r ɛː t ɪ
Bretland	p r ɛː t l a n t
Briem	p r iː m
Brjánn	p r j a u t n
Brussel	p r ʏ sː ɛ l
Brynja	p r ɪ n j a
Brynjólfur	p r ɪ n j o u l v ʏ r
Brynjólfína	p r ɪ n j o u l v iː n a
Brynjúlfur	p r ɪ n j u l v ʏ r
Bylgja	p ɪ l c a
Bára	p a uː r a
Bárður	p a u r ð ʏ r
Bólivía	p o uː l ɪ v iː j a
Búi	p uː ɪ
Búlgaría	p u l k a r iː j a
Búrma	p u r m a
Claessen	kʰ l a sː ɛ n
Clausen	kʰ l a uː s ɛː nː
Dabbi	t a pː ɪ
Daldís	t a l t iː s
Dalla	t a t l a
Dalmatía	t a l m a tʰ iː j a
Damjan	t a m j a n
Danalög	t aː n a l œː ɣ
Dani	t aː n ɪ
Danmörk	t a n m œ r̥ k
Daníel	t aː n i j ɛː l
Davíð	t aː v iː ð
Diljá	t ɪ l j a uː
Droplaug	t r ɔː p l ø yː ɣ
Dugfús	t ʏ x f uː s
Duus	d uː s
Dyflinn	t ɪ p l ɪ nː
Dynja	t ɪ n j a
Dína	t iː n a
Dísa	t iː s a
Dóná	t o uː n a uː
Dóri	t o uː r ɪ
Dýri	t iː r ɪ
Dýrmundur	t i r m ʏ n t ʏ r
Edinborg	ɛː t ɪ n p ɔ r k
Eggertína	ɛ cː ɛ r̥ t iː n a
Egyptaland	ɛː c ɪ f t a l a n t
Einar	e iː n a r
Einarína	e iː n aː r iː n a
Einbjörg	e i n p j œ r k
Einir	e iː n ɪ r
Eisti	e i s t ɪ
Eistland	e i s t l a n t
Eldjárn	ɛ l t j a u r t n
Elli	ɛ lː ɪ
Elli	ɛ t l ɛ ~ ɪ n t ʏ r
Elli	ɛ t l ɪ
Ellingsen	ɛ lː i ŋ k s ɛ n
Elí	ɛː l iː
Elía	ɛː l iː j a
Elías	ɛː l iː j a s
Elíasína	ɛː l i j aː s iː n a
England	e i ŋ l a n t
Erla	ɛ r t l a
Erlendur	ɛ r l ɛ n t ʏ r
Erlendur	ɛ t l ɛ n t ʏ r
Erlendur	ɛ t l ɪ n t ʏ r
Erlendína	ɛ r l ɛ n t iː n a
Ernir	ɛ r t n ɪ r
Erítrea	ɛː r iː tʰ r ɛː a
Esóp	ɛː s o uː p
Eva	ɛː v a
Evklíð	ɛ v kʰ l iː ð
Evrópa	ɛ v r o uː p a
Eydís	e iː t iː s
Eyjafjallajökull	e iː j a f j a t l a j œː k ʏ t l
Eyjaálfa	e iː j a a u l v a
Eyjólfína	e iː j o u l v iː n a
Eyland	e iː l a n t
Eymundur	e iː m ʏ n t ʏ r
Eyrún	e iː r u n
Eyvindína	e iː v ɪ n t iː n a
Eþíópía	ɛː θ j o uː pʰ iː j a
Falstur	f a l s t ʏ r
Falur	f aː l ʏ r
Felix	f ɛː l ɪ k s
Felix	f ɛː l ɪ x s
Finnbogi	f ɪ n p ɔ j ɪ
Finni	f ɪ nː ɪ
Finnland	f ɪ nː l a n t
Finnur	f ɪ nː ʏ r
Finsen	f ɪ n s ɛː nː
Fjóla	f j o uː l a
Fjólmundur	f j o u l m ʏ n t ʏ r
Fjón	f j o uː n
Flensborg	f l ɛ n s p ɔ r k
Flórens	f l o uː r ɛ n s
Flórída	f l o uː r i t a
Frakkar	f r a h k aː r
Frakki	f r a h c ɪ
Frakkland	f r a h k l a n t
Frank	f r a ŋ̊ k
Frelsisstyttan	f r ɛ l s ɪ s s t ɪ h t a n
Freydís	f r e iː t iː s
Freygerður	f r e iː c ɛ r ð ʏ r
Freyja	f r e iː j a
Friðmundur	f r ɪ ð m ʏ n t ʏ r
Frímannía	f r iː m a nː iː j a
Fríða	f r iː ð a
Frón	f r o uː n
Fróðný	f r o u ð n iː
Fésbók	f j ɛː s p o uː k
Fíladelfía	f iː l a t ɛ l f iː j a
Fönikía	f œː n ɪ cʰ iː j a
Galílea	k aː l iː l ɛː a
Gana	k aː n a
Ganamaður	k aː n a m aː ð ʏ r
Garðar	k a r ð a r
Gaukur	k ø yː k ʏ r
Gautaborg	k ø yː t a p ɔ r k
Gautelfur	k ø yː t ɛ l v ʏ r
Gauti	k ø yː t ɪ
Geir	k e iː r
Geirdís	c e i r t iː s
Geirfríður	c e i r̥ f r iː ð ʏ r
Geirharður	c e iː r h a r ð ʏ r
Geirmundur	c e i r m ʏ n t ʏ r
Geirþrúður	c e i r̥ θ r uː ð ʏ r
Genf	c ɛ n f
Genf	k ɛ n f
Georgía	c ɛː ɔ r c iː j a
Georgína	c ɛː ɔ r c iː n a
Gerður	c ɛ r ð ʏ r
Gestína	c ɛ s t iː n a
Gilitrutt	c ɪː l ɪ tʰ r ʏ h t
Gissunn	c ɪ sː ʏ nː
Gissurína	c ɪ sː ʏ r iː n a
Gloría	k l ɔː r i a
Glódís	k l o uː t iː s
Glúmur	k l uː m ʏ r
Gnarr	k n a rː
Goggi	k ɔ cː ɪ
Gormur	k ɔ r m ʏ r
Goti	k ɔː t ɪ
Gotland	k ɔː t l a n t
Grikki	k r ɪ h c ɪ
Grikkland	k r ɪ h k l a n t
Grjóni	k r j o uː n ɪ
Grænhöfðaeyjar	k r a iː n h œ v ð a e i j a r
Grænland	k r a i n l a n t
Gríma	k r iː m a
Grímkell	k r i m cʰ ɛ t l
Grímur	k r iː m ʏ r
Grýla	k r iː l a
Gunnarína	k ʏ nː aː r iː n a
Gunndís	k ʏ nː t iː s
Gunnlaug	k ʏ nː l ø yː ɣ
Gunnlaugur	k ʏ nː l ø yː ɣ ʏ r
Gunnur	k ʏ nː ʏ r
Gunnólfur	k ʏ nː o u l v ʏ r
Gunnþórunn	k ʏ n θ o uː r ʏ nː
Guðbjörg	k v ʏ ð p j œ r k
Guðbrandína	k v ʏ ð p r a n t iː n a
Guðdís	k v ʏ ð t iː s
Guðjohnsen	k v ʏ ð j o u n s ɛː nː
Guðjónína	k v ʏ ð j o uː n iː n a
Guðlaug	k v ʏ ð l ø yː ɣ
Guðlaugur	k v ʏ ð l ø yː ɣ ʏ r
Guðmunda	k v ʏ ð m ʏ n t a
Guðmundur	k v ʏ ð m ʏ n t ʏ r
Guðmundína	k v ʏ ð m ʏ n t iː n a
Guðríður	k v ʏ ð r iː ð ʏ r
Guðrún	k v ʏ ð r uː n
Guðvaldína	k v ʏ ð v a l t iː n a
Gvatemala	k v aː tʰ ɛː m aː l a
Gyrðir	c ɪ r ð ɪ r
Gyða	c ɪː ð a
Gíbraltar	c iː p r a l̥ t aː r
Gíslína	c i s t l iː n a
Haarde	h ɔ r t ɛː
Hadda	h a tː a
Hafdís	h a v t iː s
Hafliðína	h a v l ɪː ð iː n a
Halla	h a t l a
Halldís	h a l t iː s
Halldór	h a l t o uː r
Halldórsdóttir	h a l t o u r̥ s t o u h t ɪ r
Hallgerður	h a t l c ɛ r ð ʏ r
Hallgrímína	h a t l k r iː m iː n a
Halli	h a t l ɪ
Hallmundur	h a t l m ʏ n t ʏ r
Hallur	h a t l ʏ r
Hamborg	h a m p ɔ r k
Hanna	h a nː a
Hannesína	h a nː ɛː s iː n a
Hansen	h a n s ɛ nː
Hansi	h a n s ɪ
Hansína	h a n s iː n a
Haraldur	h aː r a l t ʏ r
Haraldína	h aː r a l t iː n a
Haukur	h ø yː k ʏ r
Havaí	h aː v a iː
Hedda	h ɛ tː a
Heiðdís	h e i ð t iː s
Heiður	h e iː ð ʏ r
Hekla	h ɛ h k l a
Helgi	h ɛ l c ɪ
Helsingjaborg	h ɛ l s i ɲ c a p ɔ r k
Helsingjaeyri	h ɛ l s ɪ ɲ c a e iː r ɪ
Hera	h ɛː r a
Herdís	h ɛ r t iː s
Herkúles	h ɛ r̥ k uː l ɛː s
Hermundur	h ɛ r m ʏ n t ʏ r
Hersegóvína	h ɛ r̥ s ɛː k o uː v iː n a
Hervör	h ɛ r v œː r
Hildigunnur	h ɪ l t ɪ k ʏ nː ʏ r
Hildimundur	h ɪ l t ɪ m ʏ n t ʏ r
Hilmir	h ɪ l m ɪ r
Hjaltalín	ç a l̥ t a l iː n
Hjaltested	ç a l̥ t ɛː s t ɛː ð
Hjalti	ç a l̥ t ɪ
Hjaltlandseyjar	ç a l̥ t l a n t s e iː j a r
Hjaltína	ç a l̥ t iː n a
Hjálmar	ç a u l m a r
Hjálmtýr	ç a u l m tʰ iː r
Hjördís	ç œ r t iː s
Hjörtur	ç œ r̥ t ʏ r
Hjörtína	ç œ r̥ t iː n a
Hlér	l̥ j ɛː r
Hlésey	l̥ j ɛː s e iː
Holland	h ɔ l l a n t
Holtsetaland	h ɔ l̥ t s ɛː t a l a n t
Hrafn	r̥ a p n
Hrafndís	r̥ a p n t iː s
Hrafnhildur	r̥ a p n̥ h ɪ l t ʏ r
Hrafnkell	r̥ a p n cʰ ɛ t l
Hreindís	r̥ e i n t iː s
Hreinn	r̥ e i t n
Hróarskelda	r̥ o uː a r̥ s cʰ ɛ l t a
Hrólfur	r̥ o u l v ʏ r
Hróný	r̥ o uː n iː
Hróðný	r̥ o u ð n iː
Hulda	h ʏ l t a
Hveðn	kʰ v ɛ ð n
Hveðn	xʷ ɛ ð n
Hvítá	kʰ v iː t a uː
Hvítá	xʷ iː t a uː
Hámundur	h a uː m ʏ n t ʏ r
Hávarðína	h a uː v a r ð iː n a
Héðinn	ç ɛː ð ɪ nː
Hólmfríður	h o u l m f r iː ð ʏ r
Hórus	h o uː r ʏ s
Höfuðborgarsvæðið	h œː v ʏ θ p ɔ r k a r s v a iː ð ɪ ð
Höfðaborg	h œ v ð a p ɔ r k
Hörn	h œ r t n
Hörðaland	h œ r ð a l a n t
Hörður	h œ r ð ʏ r
Ilmur	ɪ l m ʏ r
Indland	ɪ n t l a n t
Indriðason	ɪ n t r ɪː ð a s ɔː n
Indriði	ɪ n t r ɪː ð ɪ
Indriðína	ɪ n t r ɪː ð iː n a
Indverji	ɪ n t v ɛ r j ɪ
Indónesía	ɪ n t o uː n ɛː s iː j a
Ingi	i ɲ c ɪ
Ingibjörg	i ɲ c ɪ p j œ r k
Ingimundur	i ɲ c ɪ m ʏ n t ʏ r
Ingimundína	i ŋ c ɪ m ʏ n t iː n a
Ingunn	i ŋ k ʏ nː
Ingvarsson	i ŋ k v a r̥ s s ɔː n
Ingólfur	i ŋ k o u l v ʏ r
Ingólfína	i ŋ k o u l v iː n a
Internet	ɪ n̥ t ɛ r n ɛː t
Iða	ɪː ð a
Iðunn	ɪː ð ʏ nː
Jakob	j aː kʰ ɔː p
Jakobína	j aː kʰ ɔː p iː n a
Jana	j aː n a
Japan	j aː pʰ a n
Japani	j aː pʰ aː n ɪ
Jarþrúður	j a r̥ θ r uː ð ʏ r
Jaðar	j aː ð a r
Jensen	j ɛ n s ɛ nː
Jensína	j ɛ n s iː n a
Jerúsalem	j ɛː r uː s aː l ɛː m
Jesús	j ɛː s uː s
Johnsen	j o u n s ɛː nː
Játvarður	j a uː t v a r ð ʏ r
Jóakim	j o uː a cʰ ɪ m
Jódís	j o uː t iː s
Jóhann	j o uː h a nː
Jóhanna	j o uː h a nː a
Jóhannes	j o uː h a nː ɛː s
Jóhannesína	j o uː h a nː ɛː s iː n a
Jólaeyja	j o uː l a e iː j a
Jón	j o uː n
Jónas	j o uː n aː s
Jónasína	j o uː n aː s iː n a
Jónatan	j o u̯ː n a tʰ aː n
Jóndís	j o u n t iː s
Jónheiður	j o uː n h e iː ð ʏ r
Jónmundur	j o u n m ʏ n t ʏ r
Jónína	j o uː n iː n a
Jóný	j o uː n iː
Jórdan	j o u r t aː n
Jórdanía	j o u r t aː n iː j a
Jórunn	j o uː r ʏ nː
Jósebína	j o uː s ɛː p iː n a
Jósefína	j o uː s ɛː f iː n a
Jótland	j o uː t l a n t
Jörgensen	j œ r k ɛ n s ɛː nː
Jörundína	j œː r ʏ n t iː n a
Júdea	j uː t ɛː a
Júdit	j uː t ɪː t
Júkki	j u h c ɪ
Júlíus	j uː l iː j ʏ s
Júpíter	j uː p iː tʰ ɛː r
Kaaber	kʰ ɔː p ɛ r
Kalifornía	kʰ aː l ɪ f ɔ r n i j a
Kanada	kʰ aː n aː t a
Kantaraborg	kʰ a n̥ t a r a p ɔ r k
Kara	kʰ aː r a
Karen	kʰ aː r ɛː n
Karþagó	kʰ a r̥ θ a k o uː
Katrín	kʰ aː t r iː n
Kaðlín	kʰ a ð l iː n
Ketill	cʰ ɛː t ɪ t l
Kiljan	cʰ ɪ l j a n
Kirjálaland	cʰ ɪ r j a uː l a l a n t
Kirkjubær	cʰ ɪ r̥ c ʏ p a iː r
Kjartan	cʰ a r̥ t a n
Kjartanía	cʰ a r̥ t a n iː j a
Klara	kʰ l aː r a
Klemens	kʰ l ɛː m ɛ n s
Klængur	kʰ l a i ŋ k ʏ r
Knútur	kʰ n uː t ʏ r
Konráð	kʰ ɔ n r a uː ð
Konráðína	kʰ ɔ n r a uː ð iː n a
Kornbretaland	kʰ ɔ r t n p r ɛː t a l a n t
Korsíka	kʰ ɔ r̥ s iː k a
Kragh	kʰ r aː ɣ
Kraká	kʰ r aː k a uː
Krissa	kʰ r ɪ sː a
Krista	kʰ r ɪ s t a
Kristinn	kʰ r ɪ s t ɪ nː
Kristjana	k r ɪ s t j aː n a
Kristján	kʰ r ɪ s t j a uː n
Kristjánssandur	kʰ r ɪ s t j a u n s s a n t ʏ r
Kristur	kʰ r ɪ s t ʏ r
Kristí	kʰ r ɪ s t iː
Kristín	kʰ r ɪ s t iː n
Króati	kʰ r o uː aː t ɪ
Kumbaraland	kʰ ʏ m p aː r a l a n t
Kvaran	kʰ v aː r a n
Kára	kʰ a uː r a
Kári	kʰ a uː r ɪ
Kína	cʰ iː n a
Kórea	kʰ o uː r ɛː a
Kúld	kʰ u l t
Kýpur	cʰ iː p ʏ r
Langbarðaland	l a u ŋ k p a r ð a l a n t
Lappland	l a h p l a n t
Lara	l aː r a
Laugaskarð	l ø yː ɣ a s k a r ð
Lea	l ɛː a
Leira	l e iː r a
Leppalúði	l ɛ h p a l uː ð ɪ
Lettland	l ɛ h t l a n t
Leví	l ɛː v iː
Limafjörður	l ɪː m a f j œ r ð ʏ r
Litháen	l ɪː t h a uː ɛː n
Ljótunn	l j o uː t ʏ nː
Logi	l ɔ iː j ɪ
Loki	l ɔː c ɪ
Long	l ɔ ŋː
Lundúnir	l ʏ n t uː n ɪ r
Lyngvi	l i ŋ k v ɪ
Láfi	l a uː v ɪ
Láki	l a uː c ɪ
Láland	l a uː l a n t
Lára	l a uː r a
Lárus	l a uː r ʏ s
Lénharður	l j ɛː n h a r ð ʏ r
Lísa	l iː s a
Lói	l o uː ɪ
Lúxemborg	l u x s ɛ m p ɔ r ɣ
Maggi	m a cː ɪ
Magndís	m a k n t iː s
Magnea	m a k n ɛː a
Magnús	m a k n uː s
Magnúsína	m a k n uː s iː n a
Makedónía	m aː kʰ ɛː t o uː n iː j a
Malasía	m aː l a s iː j a
Malmquist	m a l m kʰ v ɪ s t
Malí	m aː l iː
Mardís	m a r t iː s
Mari	m aː r ɪ
Markúsartorg	m a r̥ k uː s a r tʰ ɔ r k
Mars	m a r̥ s
Marta	m a r̥ t a
Marteinn	m a r̥ t e i t n
María	m aː r iː j a
Maídís	m a iː t iː s
Meddi	m ɛ tː ɪ
Medína	m ɛː t iː n a
Mekka	m ɛ h k a
Melaskóli	m ɛː l a s k o uː l ɪ
Melkorka	m ɛ l kʰ ɔ r̥ k a
Merkúr	m ɛː r̥ kʰ uː r
Mesópótamía	m ɛː s o uː pʰ o uː t a m iː j a
Mexíkó	m ɛ k s iː kʰ o uː
Michelsen	m ɪ h k ɛ l s ɛ nː
Mikael	m ɪː kʰ aː ɛː l
Mikki	m ɪ h c ɪ
Miðjarðarhaf	m ɪ ð j a r ð a r h aː v
Mjallhvít	m j a h t l k v i t
Mjölnir	m j œ l n ɪ r
Moldavía	m ɔ l t a v iː j a
Mongóli	m o u ŋ k o u l ɪ
Mongólía	m ɔ ŋ k o uː l iː j a
Morthens	m ɔ r̥ t ɛ n s
Málmey	m a u l m e iː
Mári	m a uː r ɪ
Mæri	m a iː r ɪ
Mía	m iː j a
Móeiður	m o uː e iː ð ʏ r
Móheiður	m o uː h e iː ð ʏ r
Möller	m œ lː ɛ r
Mön	m œː n
Mörður	m œ r ð ʏ r
Múhameð	m uː h a m ɛː ð
Mýrdalur	m i r t aː l ʏ r
Mýrdalína	m i r t aː l iː n a
Mývatn	m iː v aʰ t n
Namibía	n aː m ɪ p iː j a
Narfi	n a r v ɪ
Nenna	n ɛ nː a
Nenni	n ɛ nː ɪ
Nepal	n ɛː pʰ aː l
Neptúnus	n ɛ f tʰ uː n ʏ s
Neptúnus	n ɛ p tʰ uː n ʏ s
Nevada	n ɛː v a t a
Nielsen	n i l s ɛ nː
Nikulás	n ɪː k ʏ l a uː s
Ninja	n ɪ n j a
Njáll	n j a u t l
Noregur	n ɔː r ɛː ɣ ʏ r
Norðdahl	n ɔ r ð t aː l
Norðmaður	n ɔ r ð m aː ð ʏ r
Norðurland	n ɔ r ð ʏ r l a n t
Norðymbraland	n ɔ r ð ɪ m p r a l a n t
Nárú	n a uː r uː
Níelsína	n iː j ɛ l s iː n a
Nígería	n iː k ɛː r iː j a
Níl	n iː l
Nína	n iː n a
Nói	n o uː ɪ
Nökkvi	n œ h k v ɪ
Oddur	ɔ tː ʏ r
Olga	ɔ l k a
Olgeirína	ɔ l c e iː r iː n a
Olsen	o u l s ɛ nː
Orkneyjar	ɔ r̥ k n e iː j a r
Ormur	ɔ r m ʏ r
Osló	ɔ s t l o uː
Palestína	pʰ aː l ɛ s t iː n a
París	pʰ aː r iː s
Perla	pʰ ɛ r t l a
Persía	pʰ ɛ r̥ s iː j a
Perú	pʰ ɛː r uː
Petersen	pʰ ɛː t ɛ r̥ s ɛ nː
Petrína	p ɛː t r iː n a
Portúgali	pʰ ɔ r̥ t u k aː l ɪ
Prag	pʰ r aː ɣ
Prússland	pʰ r u s t l a n t
Páldís	p a u l t iː s
Páll	pʰ a u t l
Pálmar	pʰ a u l m a r
Pálína	pʰ a uː l iː n a
Pétti	pʰ j ɛ h t ɪ
Pétur	p j ɛː t ʏ r
Pétursborg	pʰ j ɛː t ʏ r̥ s p ɔ r k
Pólland	p o u l l a n t
Pýþagóras	pʰ iː θ a k o uː r aː s
Ragnar	r a k n aː r
Ragnheiður	r a k n h e iː ð ʏ r
Reynir	r e iː n ɪ r
Riis	r iː s
Rogaland	r ɔː ɣ a l a n t
Runólfína	r ʏː n o u l v iː n a
Rustikus	r ʏ s t ɪ kʰ ʏ s
Ríkharður	r iː k h a r ð ʏ r
Rín	r iː n
Ríta	r iː t a
Róm	r o uː m
Rómaborg	r o uː m a p ɔ r k
Rögnvaldína	r œ k n v a l t iː n a
Rökkvi	r œ h k v ɪ
Röskva	r œ s k v a
Rúmenía	r uː m ɛː n iː j a
Rúnar	r uː n aː r
Rúrik	r uː r ɪ k
Rúðuborg	r uː ð ʏ p ɔ r k
Safír	s aː f iː r
Saga	s aː ɣ a
Sagreb	s aː k r ɛː p
Salka	s a l̥ k a
Salvadori	s a l v a t ɔː r ɪ
Samúel	s aː m uː ɛː l
Samúelína	s aː m uː ɛː l iː n a
Sara	s aː r a
Sardinía	s a r t ɪ n iː j a
Saxland	s a x s l a n t
Scheving	s c ɛː v i ŋ
Schiöth	s c œ h t
Schram	s k r aː m
Seifur	s e iː v ʏ r
Selma	s ɛ l m a
Serbi	s ɛ r p ɪ
Sif	s ɪː v
Sigdís	s ɪ ɣ t iː s
Sigfús	s ɪ x f uː s
Sigfúsína	s ɪ x f uː s iː n a
Siggi	s ɪ cː ɪ
Sigmar	s ɪ ɣ m aː r
Sigmundur	s ɪ ɣ m ʏ n t ʏ r
Sigmundína	s ɪ ɣ m ʏ n t iː n a
Signa	s ɪ k n a
Sigríður	s ɪ ɣ r iː ð ʏ r
Sigurdís	s ɪː ɣ ʏ r t iː s
Sigurðsson	s ɪː ɣ ʏ r ð s s ɔː n
Sigurður	s ɪː ɣ ʏ r ð ʏ r
Sigurðína	s ɪː ɣ ʏ r ð iː n a
Sigþrúður	s ɪ x θ r uː ð ʏ r
Sikiley	s ɪː c ɪ l e iː
Silja	s ɪ l j a
Sjáland	s j a uː l a n t
Sjöfn	s j œ p n
Skoti	s k ɔː t ɪ
Skotland	s k ɔː t l a n t
Skánn	s k a u t n
Skírisskógur	s c iː r ɪ s s k o uː ʏ r
Skíði	s c iː ð ɪ
Skúli	s k uː l ɪ
Skúlína	s k uː l iː n a
Slésvík	s t l j ɛː s v iː k
Slóvakía	s t l o uː v a cʰ iː j a
Slóvenía	s t l o uː v ɛː n iː j a
Smári	s m a uː r ɪ
Snæfríður	s t n a iː f r iː ð ʏ r
Snæland	s t n a iː l a n t
Soffía	s ɔ fː iː j a
Solla	s ɔː l a
Spanjóli	s p a n j o uː l ɪ
Sparta	s p a r̥ t a
Spánn	s p a u t n
Spánverji	s p a u n v ɛ r j ɪ
Stefanía	s t ɛː f aː n iː j a
Stein	s t e iː n
Steindór	s t e i n t o uː r
Steinn	s t e i t n
Steinunn	s t e iː n ʏ nː
Steinþór	s t e i n θ o uː r
Stella	s t ɛ lː a
Stephensen	s t ɛː f ɛ n s ɛ n
Stokkhólmur	s t ɔ h k h o u l m ʏ r
Sturla	s t ʏ r t l a
Sturlína	s t ʏ r t l iː n a
Styrmir	s t ɪ r m ɪ r
Stína	s t iː n a
Stórólfur	s t o uː r o u l v ʏ r
Stóðgarður	s t o u ð k a r ð ʏ r
Sundhnúkagígaröðin	s ʏ n t h n u k a j i ɣ a r œ ð ɪ n
Suðurland	s ʏ ð ʏ r l a n t
Svandís	s v a n t iː s
Sveindís	s v e i n t iː s
Sveinn	s v e i t n
Sverrir	s v ɛ rː ɪ r
Sverrína	s v ɛ rː iː n a
Sviss	s v ɪ sː
Svíi	s v iː ɪ
Sámsey	s a u m s e iː
Sæmundur	s a iː m ʏ n t ʏ r
Sæmundína	s a iː m ʏ n t iː n a
Sæunn	s a iː j ʏ nː
Síbería	s iː p ɛ r iː j a
Símon	s iː m ɔː n
Símonía	s iː m ɔː n iː j a
Sófókles	s o uː f o uː kʰ l ɛː s
Sóldís	s o u l t iː s
Sólon	s o uː l ɔ n
Sólveig	s o u l v e iː ɣ
Sómalía	s o uː m a l iː j a
Sölvi	s œ l v ɪ
Sýrland	s i r l a n t
Tala	tʰ aː l a
Tara	tʰ aː r a
Taíland	tʰ a iː l a n t
Telma	tʰ ɛ l m a
Thorarensen	tʰ o uː r aː r ɛ n s ɛ nː
Thorlacius	tʰ ɔ r l a s iː j ʏ s
Thoroddsen	tʰ o uː r ɔ tː s ɛ nː
Tjalli	tʰ j a lː ɪ
Torfi	tʰ ɔ r v ɪ
Tristan	tʰ r ɪ s t a n
Tryggvi	tʰ r ɪ k v ɪ
Tryggvína	tʰ r ɪ k v iː n a
Tumi	tʰ ʏː m ɪ
Tyrkland	t ɪ r̥ k l a n t
Tékki	tʰ j ɛ h c ɪ
Tékkland	t j ɛ h k l a n t
Téténía	tʰ j ɛ tʰ j ɛː n iː j a
Túvalú	tʰ uː v a l uː
Ugla	ʏ k l a
Unnar	ʏ nː aː r
Unndís	ʏ nː t iː s
Unndór	ʏ n t o uː r
Unnur	ʏ nː ʏ r
Uppsalir	ʏ h p s aː l ɪ r
Valdimaría	v a l t ɪ m aː r iː j a
Valdína	v a l t iː n a
Valdís	v a l t iː s
Valhöll	v aː l h œ t l̥
Valtýr	v a l tʰ iː r
Venus	v ɛː n ʏ s
Vesturland	v ɛ s t ʏ r l a n t
Veturliði	v ɛː t ʏ r l ɪː ð ɪ
Vigdís	v ɪ ɣ t iː s
Vigfús	v ɪ x f uː s
Vigfúsína	v ɪ x f uː s iː n a
Vignir	v ɪ k n ɪ r
Vildís	v ɪ l t iː s
Vilhjálmur	v ɪ l ç a u l m ʏ r
Vilhjálmía	v ɪ l ç a u l m iː j a
Vilhjálmína	v ɪ l ç a u l m iː n a
Vilma	v ɪ l m a
Vilmundur	v ɪ l m ʏ n t ʏ r
Virginía	v ɪ r c ɪ n iː j a
Viðar	v ɪː ð aː r
Volga	v ɔ l k a
Vordís	v ɔ r t iː s
Vænir	v a iː n ɪ r
Védís	v j ɛː t iː s
Vídalín	v iː t a l iː n
Vík	v iː k
Vín	v iː n
Vínarborg	v iː n a r p ɔ r k
Víðir	v iː ð ɪ r
Vörður	v œ r ð ʏ r
Waage	v ɔː ɣ ɛː
Wathne	v a h t n ɛː
Wiium	v iː j ʏ m
Zoëga	s o uː ɛː k aː
Zóphonías	s o uː f ɔː n iː j a s
a	aː
abbadís	a pː a t iː s
abbast	a pː a s t
adamsepli	aː d a m s ɛ h p l ɪ
adda	a tː a
af	aː v
afar	aː v a r
afbaka	a v p aː k a
afbrigði	a v p r ɪ ɣ ð ɪ
afbrigðilegur	a v p r ɪ ɣ ð ɪ l ɛː ɣ ʏ r
afbrot	aː v p r ɔː t
afbrýði	a v p r iː ð ɪ
afburður	a v p ʏ r ð ʏ r
afbökun	a v p œː k ʏ n
afdrep	a v t r ɛː p
afgangur	a v k a u ŋ k ʏ r
afgreiða	a v k r e iː ð a
afgreiðsla	a v k r e i ð s t l a
afhenda	a f h ɛ n t a
afhending	a f h ɛ n t i ŋ k
afi	aː v ɪ
afklæða	a v kʰ l a iː ð a
afkomandi	a v kʰ ɔː m a n t ɪ
afkvæmi	a v kʰ v a iː m ɪ
afkáralegur	a v kʰ a uː r a l ɛː ɣ ʏ r
afl	a p l
afla	a p l a
afleiðing	a v l e iː ð i ŋ k
afli	a p l ɪ
afmæli	a m m a iː l ɪ
afmæli	a v m a iː l ɪ
afmælisdagur	a mː a iː l ɪ s t aː ɣ ʏ r
afmælisdagur	a v m a iː l ɪ s t aː ɣ ʏ r
afmælisgjöf	a v m a iː l ɪ s c œː v
afrit	a v r ɪː t
afráða	a v r a uː ð a
afríkanska	aː f r iː kʰ a n s k a
afríkanskur	aː f r iː kʰ a n s k ʏ r
afríkufíll	aː f r iː k ʏ f i t l
afrískur	aː f r i s k ʏ r
afsaka	a f s aː k a
afskrá	a f s k r a uː
afskráning	a f s k r a uː n i ŋ k
afsláttur	a f s t l a u h t ʏ r
afstæði	a f s t a iː ð ɪ
afsökun	a f s œː k ʏ n
aftaka	a v tʰ aː k a
aftur	a f t ʏ r
aftur	a h t ʏ r
afturbatapíka	a f t ʏ r p aː t a pʰ iː k a
afturbati	a f t ʏ r p aː t ɪ
afturbeyging	a f t ʏ r p e iː j i ŋ k
afturbeygður	a f t ʏ r p e i ɣ ð ʏ r
afturelding	a f t ʏ r ɛ l t i ŋ k
afturfótur	a f t ʏ r f o uː t ʏ r
afturhald	a f t ʏ r h a l t
afturhaldsstefna	a f t ʏ r h a l t s s t ɛ p n a
afturkræfur	a f t ʏ r kʰ r a iː v ʏ r
aftursæti	a f t ʏ r s a iː t ɪ
afvopna	a v v ɔ h p n a
afæta	aː v a iː t a
aga	aː ɣ a
agalega	aː ɣ a l ɛː ɣ a
agalegur	aː ɣ a l ɛ ɣ ʏ r
agi	aː j ɪ
agn	a k n
agða	a ɣ ð a
agúrka	aː k u r̥ k a
aka	aː k a
akarn	aː kʰ a r t n
akbraut	aː k p r ø yː t
akkeri	a h k ɛː r ɪ
akkur	a h k ʏ r
akrein	aː k r e iː n
akri	aː k r ɪ
akrinum	aː k r ɪ n ʏ m
akur	aː kʰ ʏ r
akurarfi	aː k ʏ r a r v ɪ
akurinn	aː kʰ ʏ r ɪ n
akurstjarna	aː k ʏ r s t j a r t n a
ala	aː l a
alaskavíðir	aː l a s k a v iː ð ɪ r
alaskaösp	aː l a s k a œ s p
alba	a l p a
albanska	a l p a n s k a
albanskur	a l p a n s k ʏ r
albínói	a l p iː n o uː ɪ
alda	a l t a
aldeilis	a l t e iː l ɪ s
aldin	a l t ɪ n
aldinbori	a l t ɪ n p ɔː r ɪ
aldingarður	a l t ɪ n k a r ð ʏ r
aldrei	a l t r e iː
aldur	a l t ʏ r
aldursmunur	a l t ʏ r s m ʏː n ʏ r
algerlega	a l c ɛ r l ɛː ɣ a
algjörlega	a l c œ r l ɛː ɣ a
algyðistrú	a l c ɪ ð ɪ s tʰ r u
alheimur	aː l h e iː m ʏ r
alin	aː l ɪ n
alklæddur	aː l kʰ l a i tː ʏ r
alkul	a l kʰ ʏː l
alls	a l s
allsber	a l s p ɛː r
allsgáður	a l s k a uː ð ʏ r
allt	a l̥ t
alltaf	a t l̥ tʰ aː v
allteins	a l̥ t e i n s
allur	a t l ʏ r
almannatengsl	a l m a n n a tʰ e i ŋ k s t l
almennilegur	a l m ɛ nː ɪ l ɛː ɣ ʏ r
almennur	a l m ɛ nː ʏ r
almætti	a l m a i h t ɪ
alnet	a l n ɛː t
alpahúfa	a l̥ p a h uː v a
alræði	a l r a iː ð ɪ
altari	a l̥ t a r ɪ
altaristafla	a l̥ t aː r ɪ s tʰ a p l a
alur	aː l ʏ r
alvara	a l v aː r a
alvarlega	a l v a r l ɛː ɣ a
alvarlegur	a l v a r l ɛː ɣ ʏ r
alvitur	a l v ɪː t ʏ r
alvörulaus	a l v œː r ʏ l ø yː s
alvöruleysi	a l v œː r ʏ l e iː s ɪ
alúðlega	aː l u ð l ɛː ɣ a
alúðlegur	aː l u ð l ɛː ɣ ʏ r
alþjóðlegur	a l θ j o u ð l ɛː ɣ ʏ r
alþýðlegur	a l θ i ð l ɛː ɣ ʏ r
amaba	aː m aː p a
amba	a m p a
ambaga	a m p aː ɣ a
amerískur	aː m ɛ r i s k ʏ r
amharíska	aː m h a r i s k a
amma	a mː a
amper	a m̥ p ɛː r
amöba	aː m œː p a
ananas	aː n aː n a s
anda	a n t a
andaglas	a n t a k l aː s
andardráttur	a n t a r t r a u h t ʏ r
andarnefja	a n t a r n ɛ v j a
andarungi	a n t a r u ɲ c ɪ
anddyri	a n t t ɪː r ɪ
andefni	a n t ɛ p n ɪ
andeind	a n t e i n t
andfélagslega	a n t f j ɛː l a x s l ɛː ɣ a
andfélagslegur	a n t f j ɛː l a x s l ɛː ɣ ʏ r
andheiti	a n t h e iː t ɪ
andi	a n t ɪ
andlag	a n t l aː ɣ
andlagsfall	a n t l a x s f a t l
andlangur	a n t l a u ŋ k ʏ r
andlit	a n t l ɪː t
andlát	a n t l a uː t
andri	a n t r ɪ
andstyggilega	a n t s t ɪ cː ɪ l ɛː ɣ a
andstæðingur	a n t s t a iː ð i ŋ k ʏ r
andstæður	a n t s t a i ð ʏ r
andvaka	a n t v aː k a
andvari	a n t v aː r ɪ
andvarp	a n t v a r̥ p
andvirði	a n t v ɪ r ð ɪ
andúð	a n t uː ð
anemóna	aː n ɛ m o uː n a
anga	a u ŋ k a
angan	a u ŋ k a n
angi	a u ɲ c ɪ
anna	a nː a
annar	a nː a r
annars	a nː a r̥ s
annríki	a nː r iː c ɪ
annáll	a nː a u t l
ansa	a n s a
ansi	a n s ɪ
apa	aː p a
apalhraun	aː p a l r̥ ø yː n
apamaður	aː p a m aː ð ʏ r
api	aː p ɪ
app	a h p
appelsína	a h p ɛ l s iː n a
appelsínugulur	a h p ɛ l s iː n ʏ k ʏː l ʏ r
appelsínusafi	a h p ɛ l s iː n ʏ s aː v ɪ
apótek	aː p o uː tʰ ɛː k
apótekari	aː p o uː tʰ ɛː k aː r ɪ
arabíska	aː r a p i s k a
arabískur	aː r a p i s k ʏ r
aragrúi	aː r a k r uː ɪ
arameíska	aː r a m ɛː i s k a
arfi	a r v ɪ
argur	a r k ʏ r
ari	aː r ɪ
arinn	aː r ɪ nː
ark	a r̥ k
arkitekt	a r̥ c ɪ tʰ ɛ x t
armband	a r m p a n t
armbandsúr	a r m p a n t s uː r
armenska	a r m ɛ n s k a
armur	a r m ʏ r
aronsvöndur	aː r ɔ n s v œ n t ʏ r
arsen	a r̥ s ɛ n
art	a r t
aría	aː r iː j a
arða	a r ð a
arður	a r ð ʏ r
as	aː s
asetón	aː s ɛː tʰ o uː n
asi	aː s ɪ
aska	a s k a
askur	a s k ʏ r
asna	a s t n a
asni	a s t n ɪ
aspas	a s p a s
astat	a s t aː t
at	aː t
ata	aː t a
atarna	a tʰ a r t n a
atburður	aː t p ʏ r ð ʏ r
atferli	aː t f ɛ r t l ɪ
atgeir	aː t k e iː r
atgervi	aː t c ɛ r v ɪ
athuga	aː t h ʏː ɣ a
athugasemd	aː t h ʏː ɣ a s ɛ m t
athygli	aː t h ɪ k l ɪ
athæfi	aː t h a iː v ɪ
athöfn	aː t h œ p n
atkvæði	aː t kʰ v a iː ð ɪ
atlot	aː t l ɔː t
