Ⴁ	b
პენისი	pʼ ɛ n i s i
პენიცილინი	pʼ ɛ n i t͡s i l i n i
პენსი	pʼ ɛ n s i
პენსიონერი	pʼ ɛ n s i ɔ n ɛ r i
პენსნე	pʼ ɛ n s n ɛ
პერი	pʼ ɛ r i
პერიმეტრი	pʼ ɛ r i m ɛ tʼ r i
პერიოდი	pʼ ɛ r i ɔ d i
პერიოდით	pʼ ɛ r i ɔ d i tʰ
პერიოდის	pʼ ɛ r i ɔ d i s
პერიოდს	pʼ ɛ r i ɔ d s
პერიოდული	pʼ ɛ r i ɔ d u l i
პერისკოპი	pʼ ɛ r i s kʼ ɔ pʼ i
პერიტონიტი	pʼ ɛ r i tʼ ɔ n i tʼ i
პერიფერიული	pʼ ɛ r i pʰ ɛ r i u l i
პერუ	pʼ ɛ r u
პერუჯი	pʼ ɛ r u d͡ʒ i
პესიმიზმი	pʼ ɛ s i m i z m i
პესიმისტური	pʼ ɛ s i m i s tʼ u r i
პესო	pʼ ɛ s ɔ
პესტიციდი	pʼ ɛ s tʼ i t͡s i d i
პეტერბურგი	pʼ ɛ tʼ ɛ r b u r ɡ i
პეტრე	pʼ ɛ tʼ r ɛ
პექტინი	pʼ ɛ kʰ tʼ i n i
პეწი	pʼ ɛ t͡sʼ i
პიგმეი	pʼ i ɡ m ɛ i
პიგმენტი	pʼ i ɡ m ɛ n tʼ i
პიერო	pʼ i ɛ r ɔ
პითონი	pʼ i tʰ ɔ n i
პიკეტი	pʼ i kʼ ɛ tʼ i
პიკი	pʼ i kʼ i
პიკნიკი	pʼ i kʼ n i kʼ i
პიკოლო	pʼ i kʼ ɔ l ɔ
პილიგრიმი	pʼ i l i ɡ r i m i
პილონი	pʼ i l ɔ n i
პილოტი	pʼ i l ɔ tʼ i
პილოტური	pʼ i l ɔ tʼ u r i
პილპილი	pʼ i l pʼ i l i
პინგვინი	pʼ i n ɡ v i n i
პიონერი	pʼ i ɔ n ɛ r i
პიპეტი	pʼ i pʼ ɛ tʼ i
პიჟონი	pʼ i ʒ ɔ n i
პირველი	pʼ i r v ɛ l i
პირველყოფილი	pʼ i r v ɛ l qʼ ɔ pʰ i l i
პირველშობილი	pʼ i r v ɛ l ʃ ɔ b i l i
პირი	pʼ i r i
პირით	pʼ i r i tʰ
პირის	pʼ i r i s
პირისპირ	pʼ i r i s pʼ i r
პირიტი	pʼ i r i tʼ i
პირიქით	pʼ i r i kʰ i tʰ
პირმოთნე	pʼ i r m ɔ tʰ n ɛ
პირმოთნედ	pʼ i r m ɔ tʰ n ɛ d
პირმშო	pʼ i r m ʃ ɔ
პირმშოები	pʼ i r m ʃ ɔ ɛ b i
პირობითი	pʼ i r ɔ b i tʰ i
პიროვნებით	pʼ i r ɔ v n ɛ b i tʰ
პიროვნების	pʼ i r ɔ v n ɛ b i s
პიროქსილინი	pʼ i r ɔ kʰ s i l i n i
პირს	pʼ i r s
პირუეტი	pʼ i r u ɛ tʼ i
პირუთვნელი	pʼ i r u tʰ v n ɛ l i
პირუკუ	pʼ i r u kʼ u
პირუტყვი	pʼ i r u tʼ qʼ v i
პირუტყვული	pʼ i r u tʼ qʼ v u l i
პირფერი	pʼ i r pʰ ɛ r i
პირქუში	pʼ i r kʰ u ʃ i
პისტოლეტი	pʼ i s tʼ ɔ l ɛ tʼ i
პიტერი	pʼ i tʼ ɛ r i
პიტი	pʼ i tʼ i
პიურე	pʼ i u r ɛ
პლებეი	pʼ l ɛ b ɛ i
პლებეური	pʼ l ɛ b ɛ u r i
პლებისციტი	pʼ l ɛ b i s t͡s i tʼ i
პლედი	pʼ l ɛ d i
პლევრიტი	pʼ l ɛ v r i tʼ i
პლინთუსი	pʼ l i n tʰ u s i
პლომბი	pʼ l ɔ m b i
პლუსი	pʼ l u s i
პლუტონი	pʼ l u tʼ ɔ n i
პლუტონიუმი	pʼ l u tʼ ɔ n i u m i
პლუში	pʼ l u ʃ i
პოდიუმი	pʼ ɔ d i u m i
პოეტი	pʼ ɔ ɛ tʼ i
პოეტური	pʼ ɔ ɛ tʼ u r i
პოზიორი	pʼ ɔ z i ɔ r i
პოზიტივი	pʼ ɔ z i tʼ i v i
პოზიტივიზმი	pʼ ɔ z i tʼ i v i z m i
პოზიტივისტი	pʼ ɔ z i tʼ i v i s tʼ i
პოზიტიური	pʼ ɔ z i tʼ i u r i
პოინტერი	pʼ ɔ i n tʼ ɛ r i
პოკერი	pʼ ɔ kʼ ɛ r i
პოლ	pʼ ɔ l
პოლემიკური	pʼ ɔ l ɛ m i kʼ u r i
პოლემისტი	pʼ ɔ l ɛ m i s tʼ i
პოლიგლოტი	pʼ ɔ l i ɡ l ɔ tʼ i
პოლიგონი	pʼ ɔ l i ɡ ɔ n i
პოლითეიზმი	pʼ ɔ l i tʰ ɛ i z m i
პოლითეისტური	pʼ ɔ l i tʰ ɛ i s tʼ u r i
პოლიმორფული	pʼ ɔ l i m ɔ r pʰ u l i
პოლიპი	pʼ ɔ l i pʼ i
პოლიტიკოსი	pʼ ɔ l i tʼ i kʼ ɔ s i
პოლიტიკური	pʼ ɔ l i tʼ i kʼ u r i
პოლიფონიური	pʼ ɔ l i pʰ ɔ n i u r i
პოლიციელი	pʼ ɔ l i t͡s i ɛ l i
პოლკოვნიკი	pʼ ɔ l kʼ ɔ v n i kʼ i
პოლო	pʼ ɔ l ɔ
პოლონეზი	pʼ ɔ l ɔ n ɛ z i
პოლონეთი	pʼ ɔ l ɔ n ɛ tʰ i
პოლონიუმი	pʼ ɔ l ɔ n i u m i
პოლონური	pʼ ɔ l ɔ n u r i
პოლუსი	pʼ ɔ l u s i
პომიდორი	pʼ ɔ m i d ɔ r i
პომპეზური	pʼ ɔ m pʼ ɛ z u r i
პომპონი	pʼ ɔ m pʼ ɔ n i
პონი	pʼ ɔ n i
პონტი	pʼ ɔ n tʼ i
პონტონი	pʼ ɔ n tʼ ɔ n i
პონჩო	pʼ ɔ n t͡ʃ ɔ
პოპულისტი	pʼ ɔ pʼ u l i s tʼ i
პოპური	pʼ ɔ pʼ u r i
პორტერი	pʼ ɔ r tʼ ɛ r i
პორტი	pʼ ɔ r tʼ i
პორტიერი	pʼ ɔ r tʼ i ɛ r i
პორტპლედი	pʼ ɔ r tʼ pʼ l ɛ d i
პორტრეტი	pʼ ɔ r tʼ r ɛ tʼ i
პორტრეტისტი	pʼ ɔ r tʼ r ɛ tʼ i s tʼ i
პორტფელი	pʼ ɔ r tʼ pʰ ɛ l i
პორფირი	pʼ ɔ r pʰ i r i
პოსტი	pʼ ɔ s tʼ i
პოტენციური	pʼ ɔ tʼ ɛ n t͡s i u r i
პრეზიდენტი	pʼ r ɛ z i d ɛ n tʼ i
პრეზიდიუმი	pʼ r ɛ z i d i u m i
პრეისტორიული	pʼ r ɛ i s tʼ ɔ r i u l i
პრესვიტერი	pʼ r ɛ s v i tʼ ɛ r i
პრესტიჟი	pʼ r ɛ s tʼ i ʒ i
პრესტიჟული	pʼ r ɛ s tʼ i ʒ u l i
პრეტენდენტი	pʼ r ɛ tʼ ɛ n d ɛ n tʼ i
პრეტენზიული	pʼ r ɛ tʼ ɛ n z i u l i
პრეტორი	pʼ r ɛ tʼ ɔ r i
პრეფექტი	pʼ r ɛ pʰ ɛ kʰ tʼ i
პრიზი	pʼ r i z i
პრიზმული	pʼ r i z m u l i
პრიმიტივისტი	pʼ r i m i tʼ i v i s tʼ i
პრიმიტიული	pʼ r i m i tʼ i u l i
პრიმუსი	pʼ r i m u s i
პრინტერი	pʼ r i n tʼ ɛ r i
პრინციპი	pʼ r i n t͡s i pʼ i
პრინციპული	pʼ r i n t͡s i pʼ u l i
პრიორიტეტი	pʼ r i ɔ r i tʼ ɛ tʼ i
პროგნოზი	pʼ r ɔ ɡ n ɔ z i
პროგრესი	pʼ r ɔ ɡ r ɛ s i
პროგრესული	pʼ r ɔ ɡ r ɛ s u l i
პროდიუსერი	pʼ r ɔ d i u s ɛ r i
პროდუქტი	pʼ r ɔ d u kʰ tʼ i
პროდუქტიული	pʼ r ɔ d u kʰ tʼ i u l i
პროექტი	pʼ r ɔ ɛ kʰ tʼ i
პროვინცი	pʼ r ɔ v i n t͡s i
პროვინციით	pʼ r ɔ v i n t͡s i i tʰ
პროვინციის	pʼ r ɔ v i n t͡s i i s
პროვინციული	pʼ r ɔ v i n t͡s i u l i
პროზელიტი	pʼ r ɔ z ɛ l i tʼ i
პროზექტორი	pʼ r ɔ z ɛ kʰ tʼ ɔ r i
პროკონსული	pʼ r ɔ kʼ ɔ n s u l i
პროკურორი	pʼ r ɔ kʼ u r ɔ r i
პროლოგი	pʼ r ɔ l ɔ ɡ i
პრომეთიუმი	pʼ r ɔ m ɛ tʰ i u m i
პროპორციული	pʼ r ɔ pʼ ɔ r t͡s i u l i
პროჟექტორი	pʼ r ɔ ʒ ɛ kʰ tʼ ɔ r i
პროსპექტი	pʼ r ɔ s pʼ ɛ kʰ tʼ i
პროტეინი	pʼ r ɔ tʼ ɛ i n i
პროტეჟე	pʼ r ɔ tʼ ɛ ʒ ɛ
პროტესტი	pʼ r ɔ tʼ ɛ s tʼ i
პროტექტორი	pʼ r ɔ tʼ ɛ kʰ tʼ ɔ r i
პროტოკოლი	pʼ r ɔ tʼ ɔ kʼ ɔ l i
პროტონი	pʼ r ɔ tʼ ɔ n i
პროტოტიპი	pʼ r ɔ tʼ ɔ tʼ i pʼ i
პროფესიული	pʼ r ɔ pʰ ɛ s i u l i
პროფესორი	pʼ r ɔ pʰ ɛ s ɔ r i
პროფილი	pʼ r ɔ pʰ i l i
პროცედურული	pʼ r ɔ t͡s ɛ d u r u l i
პროცენტი	pʼ r ɔ t͡s ɛ n tʼ i
პროცესი	pʼ r ɔ t͡s ɛ s i
პროცესორი	pʼ r ɔ t͡s ɛ s ɔ r i
პროჭი	pʼ r ɔ t͡ʃʼ i
პრუსიული	pʼ r u s i u l i
პუბლიცისტი	pʼ u b l i t͡s i s tʼ i
პუდელი	pʼ u d ɛ l i
პუდინგი	pʼ u d i n ɡ i
პულიმიოტი	pʼ u l i m i ɔ tʼ i
პულოვერი	pʼ u l ɔ v ɛ r i
პულსი	pʼ u l s i
პუნქტი	pʼ u n kʰ tʼ i
პუნში	pʼ u n ʃ i
პური	pʼ u r i
პუტჩი	pʼ u tʼ t͡ʃ i
ჟელე	ʒ ɛ l ɛ
ჟესტი	ʒ ɛ s tʼ i
ჟილეტი	ʒ i l ɛ tʼ i
ჟინი	ʒ i n i
ჟინჟღლი	ʒ i n ʒ ɣ l i
ჟოკეი	ʒ ɔ kʼ ɛ i
ჟოლო	ʒ ɔ l ɔ
ჟოლოსფერი	ʒ ɔ l ɔ s pʰ ɛ r i
ჟონგლიორი	ʒ ɔ n ɡ l i ɔ r i
ჟუნჟრუკი	ʒ u n ʒ r u kʼ i
ჟღვლემ	ʒ ɣ v l ɛ m
ჟღვლემს	ʒ ɣ v l ɛ m s
ჟღმურტლი	ʒ ɣ m u r tʼ l i
რბილი	r b i l i
რგოლი	r ɡ ɔ l i
რგოლისებრი	r ɡ ɔ l i s ɛ b r i
რე	r ɛ
რებუსი	r ɛ b u s i
რეგენტი	r ɛ ɡ ɛ n tʼ i
რეგიონი	r ɛ ɡ i ɔ n i
რეგიონით	r ɛ ɡ i ɔ n i tʰ
რეგიონის	r ɛ ɡ i ɔ n i s
რეგიონს	r ɛ ɡ i ɔ n s
რეგრესი	r ɛ ɡ r ɛ s i
რეგრესიული	r ɛ ɡ r ɛ s i u l i
რეესტრი	r ɛ ɛ s tʼ r i
რევიზიონიზმი	r ɛ v i z i ɔ n i z m i
რევიზიონისტი	r ɛ v i z i ɔ n i s tʼ i
რევიზორი	r ɛ v i z ɔ r i
რევოლვერი	r ɛ v ɔ l v ɛ r i
რევოლუციური	r ɛ v ɔ l u t͡s i u r i
რეზერვი	r ɛ z ɛ r v i
რეზერვისტი	r ɛ z ɛ r v i s tʼ i
რეზიკო	r ɛ z i kʼ ɔ
რეზიუმე	r ɛ z i u m ɛ
რეზო	r ɛ z ɔ
რეზუსი	r ɛ z u s i
რეიდი	r ɛ i d i
რეისი	r ɛ i s i
რეიტინგი	r ɛ i tʼ i n ɡ i
რეკორდული	r ɛ kʼ ɔ r d u l i
რელიგიური	r ɛ l i ɡ i u r i
რემონტი	r ɛ m ɔ n tʼ i
რენიუმი	r ɛ n i u m i
რენკლოდი	r ɛ n kʼ l ɔ d i
რენტგენი	r ɛ n tʼ ɡ ɛ n i
რეპეტიტორი	r ɛ pʼ ɛ tʼ i tʼ ɔ r i
რეპი	r ɛ pʼ i
რეპორტიორი	r ɛ pʼ ɔ r tʼ i ɔ r i
რეპრესიული	r ɛ pʼ r ɛ s i u l i
რეპროდუქტორი	r ɛ pʼ r ɔ d u kʰ tʼ ɔ r i
რეჟიმი	r ɛ ʒ i m i
რეჟისორი	r ɛ ʒ i s ɔ r i
რესკრიპტი	r ɛ s kʼ r i pʼ tʼ i
რესპონდენტი	r ɛ s pʼ ɔ n d ɛ n tʼ i
რესპუბლიკური	r ɛ s pʼ u b l i kʼ u r i
რესურსი	r ɛ s u r s i
რეფერენდუმი	r ɛ pʰ ɛ r ɛ n d u m i
რეფლექსი	r ɛ pʰ l ɛ kʰ s i
რეფლექტორი	r ɛ pʰ l ɛ kʰ tʼ ɔ r i
რეფრენი	r ɛ pʰ r ɛ n i
რექტორი	r ɛ kʰ tʼ ɔ r i
რეცეპტი	r ɛ t͡s ɛ pʼ tʼ i
რეციდივი	r ɛ t͡s i d i v i
რეციდივიზმი	r ɛ t͡s i d i v i z m i
რეციდივისტი	r ɛ t͡s i d i v i s tʼ i
რვეული	r v ɛ u l i
რთველი	r tʰ v ɛ l i
რთული	r tʰ u l i
რიგი	r i ɡ i
რიგობითი	r i ɡ ɔ b i tʰ i
რიგრიგობით	r i ɡ r i ɡ ɔ b i tʰ
რით	r i tʰ
რიკი	r i kʼ i
რიკოშეტი	r i kʼ ɔ ʃ ɛ tʼ i
რიკული	r i kʼ u l i
რინგი	r i n ɡ i
რიონი	r i ɔ n i
რის	r i s
რისთვის	r i s tʰ v i s
რისკი	r i s kʼ i
რიტმი	r i tʼ m i
რიტმული	r i tʼ m u l i
რიტორები	r i tʼ ɔ r ɛ b i
რიტორი	r i tʼ ɔ r i
რიტორიკული	r i tʼ ɔ r i kʼ u l i
რიფი	r i pʰ i
რიჩმონდი	r i t͡ʃ m ɔ n d i
რიცხვი	r i t͡s x v i
რიცხობრივი	r i t͡s x ɔ b r i v i
რიხი	r i x i
რკო	r kʼ ɔ
რო	r ɔ
რობერტ	r ɔ b ɛ r tʼ
რობერტი	r ɔ b ɛ r tʼ i
რობოტი	r ɔ b ɔ tʼ i
როგორ	r ɔ ɡ ɔ r
როგორი	r ɔ ɡ ɔ r i
როგორმე	r ɔ ɡ ɔ r m ɛ
როდესმე	r ɔ d ɛ s m ɛ
როდის	r ɔ d i s
როდიუმი	r ɔ d i u m i
როზგი	r ɔ z ɡ i
როზეტი	r ɔ z ɛ tʼ i
როკენროლი	r ɔ kʼ ɛ n r ɔ l i
როკერი	r ɔ kʼ ɛ r i
როკი	r ɔ kʼ i
როკნროლი	r ɔ kʼ n r ɔ l i
როკფორი	r ɔ kʼ pʰ ɔ r i
როლი	r ɔ l i
რომ	r ɔ m
რომბი	r ɔ m b i
რომბოიდი	r ɔ m b ɔ i d i
რომელი	r ɔ m ɛ l i
რომელიც	r ɔ m ɛ l i t͡s
რომელს	r ɔ m ɛ l s
რომი	r ɔ m i
რომით	r ɔ m i tʰ
რომის	r ɔ m i s
რომს	r ɔ m s
რომც	r ɔ m t͡s
რონდო	r ɔ n d ɔ
როტორი	r ɔ tʼ ɔ r i
როუმინგი	r ɔ u m i n ɡ i
როფი	r ɔ pʰ i
როქი	r ɔ kʰ i
როჯერი	r ɔ d͡ʒ ɛ r i
რუ	r u
რუბიდიუმი	r u b i d i u m i
რუბიკონი	r u b i kʼ ɔ n i
რუბლი	r u b l i
რუდ	r u d
რუდიმენტი	r u d i m ɛ n tʼ i
რუდოლფი	r u d ɔ l pʰ i
რუდუნებს	r u d u n ɛ b s
რუთენიუმი	r u tʰ ɛ n i u m i
რუთი	r u tʰ i
რულეტი	r u l ɛ tʼ i
რული	r u l i
რუმ	r u m
რუმინეთი	r u m i n ɛ tʰ i
რუმინული	r u m i n u l i
რუპორი	r u pʼ ɔ r i
რუს	r u s
რუსეთი	r u s ɛ tʰ i
რუსეთით	r u s ɛ tʰ i tʰ
რუსეთის	r u s ɛ tʰ i s
რუსეთს	r u s ɛ tʰ s
რუსი	r u s i
რუსიშვილი	r u s i ʃ v i l i
რუსული	r u s u l i
რუტინული	r u tʼ i n u l i
რუქი	r u kʰ i
რჩეული	r t͡ʃ ɛ u l i
რძე	r d͡z ɛ
რწმუნებულები	r t͡sʼ m u n ɛ b u l ɛ b i
რწმუნებული	r t͡sʼ m u n ɛ b u l i
რწყილი	r t͡sʼ qʼ i l i
რხევით	r x ɛ v i tʰ
სგ	s ɡ
სეგმენტი	s ɛ ɡ m ɛ n tʼ i
სეზონი	s ɛ z ɔ n i
სეზონური	s ɛ z ɔ n u r i
სეირი	s ɛ i r i
სეირნობს	s ɛ i r n ɔ b s
სეისმოლოგი	s ɛ i s m ɔ l ɔ ɡ i
სეისმური	s ɛ i s m u r i
სეიფი	s ɛ i pʰ i
სეკვესტრი	s ɛ kʼ v ɛ s tʼ r i
სეკრეტერი	s ɛ kʼ r ɛ tʼ ɛ r i
სელენი	s ɛ l ɛ n i
სელენიუმი	s ɛ l ɛ n i u m i
სელექტორი	s ɛ l ɛ kʰ tʼ ɔ r i
სელი	s ɛ l i
სემესტრი	s ɛ m ɛ s tʼ r i
სემიტი	s ɛ m i tʼ i
სემიტური	s ɛ m i tʼ u r i
სენდვიჩი	s ɛ n d v i t͡ʃ i
სენიორი	s ɛ n i ɔ r i
სენსორული	s ɛ n s ɔ r u l i
სერბეთი	s ɛ r b ɛ tʰ i
სერგი	s ɛ r ɡ i
სერგო	s ɛ r ɡ ɔ
სერვერი	s ɛ r v ɛ r i
სერვისი	s ɛ r v i s i
სერთუკი	s ɛ r tʰ u kʼ i
სერი	s ɛ r i
სერიოზული	s ɛ r i ɔ z u l i
სერიული	s ɛ r i u l i
სეროზული	s ɛ r ɔ z u l i
სერფინგი	s ɛ r pʰ i n ɡ i
სესილი	s ɛ s i l i
სესხი	s ɛ s x i
სეტერი	s ɛ tʼ ɛ r i
სეფსისი	s ɛ pʰ s i s i
სექტემბერი	s ɛ kʰ tʼ ɛ m b ɛ r i
სექტემბერს	s ɛ kʰ tʼ ɛ m b ɛ r s
სექტორი	s ɛ kʰ tʼ ɔ r i
სექციებით	s ɛ kʰ t͡s i ɛ b i tʰ
სექციების	s ɛ kʰ t͡s i ɛ b i s
სექციებს	s ɛ kʰ t͡s i ɛ b s
სექციით	s ɛ kʰ t͡s i i tʰ
სექციის	s ɛ kʰ t͡s i i s
სექციური	s ɛ kʰ t͡s i u r i
სველი	s v ɛ l i
სვეტი	s v ɛ tʼ i
სვეტიცხოველი	s v ɛ tʼ i t͡s x ɔ v ɛ l i
სვირინგი	s v i r i n ɡ i
სვიტერი	s v i tʼ ɛ r i
სთხოვს	s tʰ x ɔ v s
სი	s i
სიბერე	s i b ɛ r ɛ
სიბეჯითე	s i b ɛ d͡ʒ i tʰ ɛ
სიბინძურე	s i b i n d͡z u r ɛ
სიბნელე	s i b n ɛ l ɛ
სიბოროტე	s i b ɔ r ɔ tʼ ɛ
სიბრტყე	s i b r tʼ qʼ ɛ
სიბრძნე	s i b r d͡z n ɛ
სიგიჟე	s i ɡ i ʒ ɛ
სიგრილე	s i ɡ r i l ɛ
სიგრძე	s i ɡ r d͡z ɛ
სიდედრი	s i d ɛ d r i
სიდიდე	s i d i d ɛ
სიდინჯე	s i d i n d͡ʒ ɛ
სიდრი	s i d r i
სივიწროვე	s i v i t͡sʼ r ɔ v ɛ
სივრცე	s i v r t͡s ɛ
სივრცელე	s i v r t͡s ɛ l ɛ
სივრცული	s i v r t͡s u l i
სიზუსტე	s i z u s tʼ ɛ
სითბო	s i tʰ b ɔ
სითბური	s i tʰ b u r i
სითეთრე	s i tʰ ɛ tʰ r ɛ
სითხე	s i tʰ x ɛ
სიკეთე	s i kʼ ɛ tʰ ɛ
სიკვდილი	s i kʼ v d i l i
სიკვდილით	s i kʼ v d i l i tʰ
სიკვდილის	s i kʼ v d i l i s
სიკვდილს	s i kʼ v d i l s
სიკომორო	s i kʼ ɔ m ɔ r ɔ
სიკოჭლე	s i kʼ ɔ t͡ʃʼ l ɛ
სილიციუმი	s i l i t͡s i u m i
სიმბიოზი	s i m b i ɔ z i
სიმბოლიზმი	s i m b ɔ l i z m i
სიმბოლო	s i m b ɔ l ɔ
სიმბოლური	s i m b ɔ l u r i
სიმდიდრე	s i m d i d r ɛ
სიმეტრიული	s i m ɛ tʼ r i u l i
სიმი	s i m i
სიმინდი	s i m i n d i
სიმკვეთრე	s i m kʼ v ɛ tʰ r ɛ
სიმკვირცხლე	s i m kʼ v i r t͡s x l ɛ
სიმოკლე	s i m ɔ kʼ l ɛ
სიმპოზიუმი	s i m pʼ ɔ z i u m i
სიმპტომი	s i m pʼ tʼ ɔ m i
სიმრუდე	s i m r u d ɛ
სიმსივნე	s i m s i v n ɛ
სიმსუბუქე	s i m s u b u kʰ ɛ
სიმსუქნე	s i m s u kʰ n ɛ
სიმტკიცე	s i m tʼ kʼ i t͡s ɛ
სიმუნჯე	s i m u n d͡ʒ ɛ
სიმფონიური	s i m pʰ ɔ n i u r i
სიმღერით	s i m ɣ ɛ r i tʰ
სიმღერის	s i m ɣ ɛ r i s
სიმყიფე	s i m qʼ i pʰ ɛ
სიმშვენიერე	s i m ʃ v ɛ n i ɛ r ɛ
სიმშვიდე	s i m ʃ v i d ɛ
სიმცირე	s i m t͡s i r ɛ
სიმძიმე	s i m d͡z i m ɛ
სიმწირე	s i m t͡sʼ i r ɛ
სიმწიფე	s i m t͡sʼ i pʰ ɛ
სიმჭიდროვე	s i m t͡ʃʼ i d r ɔ v ɛ
სიმხნე	s i m x n ɛ
სინდისი	s i n d i s i
სინდისიერი	s i n d i s i ɛ r i
სინდიყი	s i n d i qʼ i
სინდრომი	s i n d r ɔ m i
სინელე	s i n ɛ l ɛ
სინთეზი	s i n tʰ ɛ z i
სინიორი	s i n i ɔ r i
სინოდი	s i n ɔ d i
სინონიმი	s i n ɔ n i m i
სინონიმური	s i n ɔ n i m u r i
სინოპტიკური	s i n ɔ pʼ tʼ i kʼ u r i
სინორი	s i n ɔ r i
სინუსი	s i n u s i
სინქრონული	s i n kʰ r ɔ n u l i
სინჯი	s i n d͡ʒ i
სიო	s i ɔ
სიონიზმი	s i ɔ n i z m i
სიონისტი	s i ɔ n i s tʼ i
სირბილე	s i r b i l ɛ
სირბილი	s i r b i l i
სირთულე	s i r tʰ u l ɛ
სირი	s i r i
სირიული	s i r i u l i
სიროფი	s i r ɔ pʰ i
სირსველი	s i r s v ɛ l i
სირცხვილი	s i r t͡s x v i l i
სისირი	s i s i r i
სისრულე	s i s r u l ɛ
სისტემით	s i s tʼ ɛ m i tʰ
სისტემის	s i s tʼ ɛ m i s
სისულელე	s i s u l ɛ l ɛ
სისუსტე	s i s u s tʼ ɛ
სისქე	s i s kʰ ɛ
სისწორე	s i s t͡sʼ ɔ r ɛ
სისხლი	s i s x l i
სიტკბო	s i tʼ kʼ b ɔ
სიტყვიერი	s i tʼ qʼ v i ɛ r i
სიუზერენი	s i u z ɛ r ɛ n i
სიუჟეტი	s i u ʒ ɛ tʼ i
სიუცხოვე	s i u t͡s x ɔ v ɛ
სიუხეშე	s i u x ɛ ʃ ɛ
სიუხვე	s i u x v ɛ
სიფილისი	s i pʰ i l i s i
სიფიცხე	s i pʰ i t͡s x ɛ
სიფრთხილე	s i pʰ r tʰ x i l ɛ
სიფხვიერე	s i pʰ x v i ɛ r ɛ
სიფხიზლე	s i pʰ x i z l ɛ
სიქვრივე	s i kʰ v r i v ɛ
სიქიზმი	s i kʰ i z m i
სიღრმე	s i ɣ r m ɛ
სიყვითლე	s i qʼ v i tʰ l ɛ
სიყრმე	s i qʼ r m ɛ
სიყრუე	s i qʼ r u ɛ
სიშიშვლე	s i ʃ i ʃ v l ɛ
სიშორე	s i ʃ ɔ r ɛ
სიჩლუნგე	s i t͡ʃ l u n ɡ ɛ
სიჩუმე	s i t͡ʃ u m ɛ
სიცელქე	s i t͡s ɛ l kʰ ɛ
სიცივე	s i t͡s i v ɛ
სიცილი	s i t͡s i l i
სიცილით	s i t͡s i l i tʰ
სიცოცხლე	s i t͡s ɔ t͡s x l ɛ
სიცრუე	s i t͡s r u ɛ
სიცხე	s i t͡s x ɛ
სიცხოველე	s i t͡s x ɔ v ɛ l ɛ
სიძე	s i d͡z ɛ
სიძლიერე	s i d͡z l i ɛ r ɛ
სიძნელე	s i d͡z n ɛ l ɛ
სიძულვილი	s i d͡z u l v i l i
სიძუნწე	s i d͡z u n t͡sʼ ɛ
სიწვრილე	s i t͡sʼ v r i l ɛ
სიწითლე	s i t͡sʼ i tʰ l ɛ
სიწმინდე	s i t͡sʼ m i n d ɛ
სიწრფელე	s i t͡sʼ r pʰ ɛ l ɛ
სიხისტე	s i x i s tʼ ɛ
სიხშირე	s i x ʃ i r ɛ
სიჯიუტე	s i d͡ʒ i u tʼ ɛ
სკეპტიკოსი	s kʼ ɛ pʼ tʼ i kʼ ɔ s i
სკეპტიკური	s kʼ ɛ pʼ tʼ i kʼ u r i
სკეპტიციზმი	s kʼ ɛ pʼ tʼ i t͡s i z m i
სკერცო	s kʼ ɛ r t͡s ɔ
სკვერი	s kʼ v ɛ r i
სკივრი	s kʼ i v r i
სკლეროზი	s kʼ l ɛ r ɔ z i
სკოლით	s kʼ ɔ l i tʰ
სკოლის	s kʼ ɔ l i s
სკორე	s kʼ ɔ r ɛ
სკულპტურული	s kʼ u l pʼ tʼ u r u l i
სლენგი	s l ɛ n ɡ i
სლოვენი	s l ɔ v ɛ n i
სლოკინი	s l ɔ kʼ i n i
სმ	s m
სმოკინგი	s m ɔ kʼ i n ɡ i
სმური	s m u r i
სნეული	s n ɛ u l i
სნობი	s n ɔ b i
სნობიზმი	s n ɔ b i z m i
სოვერენი	s ɔ v ɛ r ɛ n i
სოიო	s ɔ i ɔ
სოკო	s ɔ kʼ ɔ
სოლი	s ɔ l i
სოლიდური	s ɔ l i d u r i
სოლისტი	s ɔ l i s tʼ i
სოლიტერი	s ɔ l i tʼ ɛ r i
სომბრერო	s ɔ m b r ɛ r ɔ
სომეხი	s ɔ m ɛ x i
სომხეთი	s ɔ m x ɛ tʰ i
სომხეთით	s ɔ m x ɛ tʰ i tʰ
სომხეთის	s ɔ m x ɛ tʰ i s
სომხეთს	s ɔ m x ɛ tʰ s
სომხური	s ɔ m x u r i
სონეტი	s ɔ n ɛ tʼ i
სორგო	s ɔ r ɡ ɔ
სოსისი	s ɔ s i s i
სოუსი	s ɔ u s i
სოფელი	s ɔ pʰ ɛ l i
სოფელს	s ɔ pʰ ɛ l s
სოფიზმი	s ɔ pʰ i z m i
სოფისტი	s ɔ pʰ i s tʼ i
სოფლები	s ɔ pʰ l ɛ b i
სოფლელი	s ɔ pʰ l ɛ l i
სოფლით	s ɔ pʰ l i tʰ
სოფლის	s ɔ pʰ l i s
სოფლური	s ɔ pʰ l u r i
სოციოლოგი	s ɔ t͡s i ɔ l ɔ ɡ i
სოციოლოგიური	s ɔ t͡s i ɔ l ɔ ɡ i u r i
სოჭი	s ɔ t͡ʃʼ i
სოხვი	s ɔ x v i
სოხუმი	s ɔ x u m i
სპექტრი	s pʼ ɛ kʰ tʼ r i
სპეციფიკური	s pʼ ɛ t͡s i pʰ i kʼ u r i
სპიდომეტრი	s pʼ i d ɔ m ɛ tʼ r i
სპიკერი	s pʼ i kʼ ɛ r i
სპილენძი	s pʼ i l ɛ n d͡z i
სპილო	s pʼ i l ɔ
სპირიტისტი	s pʼ i r i tʼ i s tʼ i
სპირტი	s pʼ i r tʼ i
სპონსორი	s pʼ ɔ n s ɔ r i
სპორტი	s pʼ ɔ r tʼ i
სპორტსმენი	s pʼ ɔ r tʼ s m ɛ n i
სპორტული	s pʼ ɔ r tʼ u l i
სპრინტერი	s pʼ r i n tʼ ɛ r i
სრული	s r u l i
სრულყოფილი	s r u l qʼ ɔ pʰ i l i
სრუტე	s r u tʼ ɛ
სსრ	s s r
სსრკ	s s r kʼ
სტენლი	s tʼ ɛ n l i
სტეპი	s tʼ ɛ pʼ i
სტერეოსკოპი	s tʼ ɛ r ɛ ɔ s kʼ ɔ pʼ i
სტერეოტიპი	s tʼ ɛ r ɛ ɔ tʼ i pʼ i
სტერილური	s tʼ ɛ r i l u r i
სტერლინგი	s tʼ ɛ r l i n ɡ i
სტვენით	s tʼ v ɛ n i tʰ
სტვირი	s tʼ v i r i
სტიბიუმი	s tʼ i b i u m i
სტივენი	s tʼ i v ɛ n i
