qonax	q oː n ɑː x
qorzî	q oː ɾ z iː
qozeqer	q oː z ɛ q ɛ ɾ
qulaç	q ʊ l ɑː t͡ʃ
qumrî	q ʊ m ɾ iː
qurm	q ʊ ɾ m
qutabxane	q ʊ t ɑː b x ɑː n ɛ
quz	q ʊ z
qêmîş	q eː m iː ʃ
qîr	q iː ɾ
qîz	q iː z
qîzik	q iː z ɪ k
qûn	q uː n
qût	q uː t
rabûn	r ɑː b uː n
rahênan	r ɑː h eː n ɑː n
rahêner	r ɑː h eː n ɛ ɾ
raketin	r ɑː k ɛ t ɪ n
ramîn	r ɑː m iː n
rastî	r ɑː s t iː
rawestîn	r ɑː w ɛ s t iː n
ray	r ɑː j
reaktor	r ɛ ɑː k t oː ɾ
realîzm	r ɛ ɑː l iː z m
reftar	r ɛ f t ɑː ɾ
reh	r ɛ h
rekeh	r ɛ k ɛ h
rengdêr	r ɛ ŋ ɡ d eː ɾ
rengîn	r ɛ n ɡ iː n
reqabet	r ɛ q ɑː b ɛ t
reqem	r ɛ q ɛ m
resûl	r ɛ s uː l
retronîm	r ɛ t ɾ oː n iː m
rev	r ɛ v
revandin	r ɛ v ɑː n d ɪ n
revîn	r ɛ v iː n
rewşenbîr	r ɛ w ʃ ɛ n b iː ɾ
rexne	r ɛ x n ɛ
reyîn	r ɛ j iː n
rez	r ɛ z
riba	r ɪ b ɑː
riberiz	r ɪ b ɛ ɾ ɪ z
rih	r ɪ h
rind	r ɪ n d
risq	r ɪ s q
riwekxwer	r ɪ w ɛ k x w ɛ ɾ
roj	r oː ʒ
rojane	r oː ʒ ɑː n ɛ
rojhilat	r oː ʒ h ɪ l ɑː t
rojname	r oː ʒ n ɑː m ɛ
rojnamevan	r oː ʒ n ɑː m ɛ v ɑː n
rojî	r oː ʒ iː
ronakbîr	r oː n ɑː k b iː ɾ
rovî	r oː v iː
rê	r eː
rêber	r eː b ɛ ɾ
rêgeh	r eː ɡ ɛ h
rêveber	r eː v ɛ b ɛ ɾ
rêwî	ɾ eː w iː
rêxistin	r eː x ɪ s t ɪ n
rêz	r eː z
rêziman	r eː z ɪ m ɑː n
rî	r iː
rîtin	r iː t ɪ n
rîx	r iː x
rîş	r iː ʃ
rû	r uː
rûmet	r uː m ɛ t
rûnas	r uː n ɑː s
rûniştin	r uː n ɪ ʃ t ɪ n
rûniştvan	r uː n ɪ ʃ t v ɑː n
rûpel	r uː p ɛ l
rûreş	r uː ɾ ɛ ʃ
saet	s ɑː ʕ a t
sal	s ɑː l
salname	s ɑː l n ɑː m ɛ
saqî	s ɑː q iː
savar	s ɑː v ɑː ɾ
sedem	s ɛ d ɛ m
sedsal	s ɛ d s ɑː l
seet	s ɛ ɛ t
sefaret	s ɛ f ɑː ɾ ɛ t
sefer	s ɛ f ɛ ɾ
sefîne	s ɛ f iː n ɛ
sefîr	s ɛ f iː ɾ
sekinandibî	s ɛ k ɪ n ɑː n d ɪ b iː
sekinîn	s ɛ k ɪ n iː n
sempatî	s ɛ m p ɑː t iː
serbajar	s ɛ ɾ b ɑː ʒ ɑː ɾ
serberjêr	s ɛ ɾ b ɛ ɾ ʒ eː ɾ
serbixwe	s ɛ ɾ b ɪ x w ɛ
serbixwetî	s ɛ ɾ b ɪ x w ɛ t iː
serdozger	s ɛ ɾ d oː z ɡ ɛ ɾ
serenav	s ɛ ɾ ɛ n ɑː v
serhildan	s ɛ ɾ h ɪ l d ɑː n
serhildêr	s ɛ ɾ h ɪ l d eː ɾ
serokdewlet	s ɛ ɾ oː k d ɛ w l ɛ t
serokkomar	s ɛ ɾ oː k k oː m ɑː ɾ
serokwezîr	s ɛ ɾ oː k w ɛ z iː ɾ
sewax	s ɛ w ɑː x
sewî	s ɛ w iː
sexbêr	s ɛ x b eː ɾ
seyda	s ɛ j d ɑː
seyîs	s ɛ j iː s
sifir	sˤ ɪ f ɪ ɾ
sike	s ɪ k ɛ
simbêl	s ɪ m b eː l
sinîtî	s ɪ n iː t iː
sirişt	s ɪ ɾ ɪ ʃ t
sist	s ɪ s t
sivore	s ɪ v oː ɾ ɛ
sixêf	s ɪ x eː f
siyaset	s ɪ j ɑː s ɛ t
siyasetnasî	s ɪ j ɑː s ɛ t n ɑː s iː
siyasî	s ɪ j ɑː s iː
slavî	s l ɑː v iː
sond	s oː n d
sondname	s oː n d n ɑː m ɛ
sondxwer	s oː n d xʷ ɛ ɾ
soranî	s oː ɾ ɑː n iː
sosyalîst	s oː s j ɑː l iː s t
sosyolojî	s oː s j oː l oː ʒ iː
spanî	s p ɑː n iː
spî	s p iː
spîk	s p iː k
stranbêj	s t ɾ ɑː n b eː ʒ
stêrnasî	s t eː ɾ n ɑː s iː
suhbet	s ʊ h b ɛ t
sêv	s eː v
sêwî	s eː w iː
sêwîtî	s eː w iː t iː
sêwîxane	s eː w iː x ɑː n ɛ
sêşem	s eː ʃ ɛ m
sî	s iː
sîbaq	s iː b ɑː q
sîleh	s iː l ɛ h
sîng	s iː ŋ ɡ
sînor	s iː n oː ɾ
sîqilandin	s iː q ɪ l ɑː n d ɪ n
sîr	s iː ɾ
sîtil	s iː t ɪ l
sîwan	s iː w ɑː n
sîx	s iː x
sîxur	s iː x ʊ ɾ
sûl	s uː l
tabûr	t ɑː b uː ɾ
talankirin	t ɑː l ɑː n k ɪ ɾ ɪ n
tarîgan	t ɑː ɾ iː ɡ ɑː n
tarîkirin	t ɑː ɾ iː k ɪ ɾ ɪ n
tat	t ɑː t
tav	t ɑː v
tawankar	t ɑː w ɑː n k ɑː ɾ
tawannasî	t ɑː w ɑː n n ɑː s iː
tax	t ɑː x
taybet	t ɑː j b ɛ t
taybetî	t ɑː j b ɛ t iː
tayîn	t ɑː j iː n
tazî	t ɑː z iː
tazîtî	t ɑː z iː t iː
taşandin	t ɑː ʃ ɑː n d ɪ n
tebax	t ɛ b ɑː x
tebeq	t ɛ b ɛ q
tebîet	t ɛ b iː ɛ t
tefandin	t ɛ f ɑː n d ɪ n
teknîkî	t ɛ k n iː k iː
temînat	t ɛ m iː n ɑː t
tendirûst	t ɛ n d ɪ ɾ uː s t
tendirûstî	t ɛ n d ɪ ɾ uː s t iː
tendûrustî	t ɛ n d uː ɾ ʊ s t iː
tenzîlat	t ɛ n z iː l ɑː t
tenûr	t ɛ n uː ɾ
teqawid	t ɛ q ɑː w ɪ d
teqîn	t ɛ q iː n
terazî	t ɛ ɾ ɑː z iː
terazû	t ɛ ɾ ɑː z uː
tercime	t ɛ ɾ d͡ʒ ɪ m ɛ
terewîl	t ɛ ɾ ɛ w iː l
terş	t ɛ ɾ ʃ
teyr	t ɛ j ɾ
tijî	t ɪ ʒ iː
tilyak	t ɪ l j ɑː k
tilûr	t ɪ l uː ɾ
tirk	t ɪ ɾ k
tirkî	t ɪ ɾ k iː
tirsandin	t ɪ ɾ s ɑː n d ɪ n
tirsîn	t ɪ ɾ s iː n
tirî	t ɪ ɾ iː
tirş	t ɪ ɾ ʃ
tiwalet	t ɪ w ɑː l ɛ t
tixûb	t ɪ x uː b
tizbî	t ɪ z b iː
tişt	t ɪ ʃ t
tiştanok	t ɪ ʃ t ɑː n oː k
toksîn	t oː k s iː n
tomarkirin	t oː m ɑː ɾ k ɪ ɾ ɪ n
torin	t oː ɾ ɪ n
tov	t oː v
trîptofan	t ɾ iː p t oː f ɑː n
têkilî	t eː k ɪ l iː
tîprêz	t iː p ɾ eː z
tîprêzî	t iː p ɾ eː z iː
tîr	t iː ɾ
tîrbûn	t iː ɾ b uː n
tîrmeh	t iː ɾ m ɛ h
tîrosîn	t iː ɾ oː s iː n
tîvil	t iː v ɪ l
tîş	t iː ʃ
tû	t uː
umêd	ɪ m eː d
umêd	ʊ m eː d
umêd	ʊ m iː d
umêdewar	ʊ m eː d ɛ w ɑː ɾ
umêdewartir	ʊ m eː d ɛ w ɑː ɾ t ɪ ɾ
umêdewartirîn	ʊ m eː d ɛ w ɑː ɾ t ɪ ɾ iː n
vagon	v ɑː ɡ oː n
valageh	v ɑː l ɑː ɡ ɛ h
valîn	v ɑː l iː n
vazo	v ɑː z oː
veavakirin	v ɛ ɑː v ɑː k ɪ ɾ ɪ n
vegotin	v ɛ ɡ oː t ɪ n
vekirin	v ɛ k ɪ ɾ ɪ n
vexwarin	v ɛ x w ɑː ɾ ɪ n
vexwendin	v ɛ x w ɛ n d ɪ n
vexwendname	v ɛ x w ɛ n d n ɑː m ɛ
viyolîn	v ɪ j oː l iː n
vokatîv	v oː k ɑː t iː v
volkan	v oː l k ɑː n
vîkîng	v iː k iː ŋ ɡ
watenasî	w ɑː t ɛ n ɑː s iː
wekhevî	w ɛ k h ɛ v iː
welat	w ɛ l ɑː t
welatparêz	w ɛ l ɑː t p ɑː ɾ eː z
welatparêzî	w ɛ l ɑː t p ɑː ɾ eː z iː
werar	w ɛ ɾ ɑː ɾ
werger	w ɛ ɾ ɡ ɛ ɾ
wergerandin	w ɛ ɾ ɡ ɛ ɾ ɑː n d ɪ n
wergêr	w ɛ ɾ ɡ eː ɾ
werz	w ɛ ɾ z
westandin	w ɛ s t ɑː n d ɪ n
wext	w ɛ x t
wezîr	w ɛ z iː ɾ
wêje	w eː ʒ ɛ
wêne	w eː n ɛ
wêranker	w eː ɾ ɑː n k ɛ ɾ
wîkî	w iː k iː
wîlayet	w iː l ɑː j ɛ t
xal	x ɑː l
xalxalok	x ɑː l x ɑː l oː k
xanî	x ɑː n iː
xapîner	x ɑː p iː n ɛ ɾ
xar	x ɑː ɾ
xaç	x ɑː t͡ʃ
xebatkar	x ɛ b ɑː t k ɑː ɾ
xefnêr	x ɛ f n eː ɾ
xela	x ɛ l ɑː
xelatgir	x ɛ l ɑː t ɡ ɪ ɾ
xelq	x ɛ l q
xem	x ɛ m
xemgîn	x ɛ m ɡ iː n
xemgînî	x ɛ m ɡ iː n iː
xemilandin	x ɛ m ɪ l ɑː n d ɪ n
xemsarî	x ɛ m s ɑː ɾ iː
xeniqîn	x ɛ n ɪ q iː n
xerman	x ɛ ɾ m ɑː n
xerîb	x ɛ ɾ iː b
xerûze	x ɛ ɾ uː z ɛ
xew	x ɛ w
xewn	x ɛ w n
xewxane	x ɛ w x ɑː n ɛ
xezeb	x ɛ z ɛ b
xilmaş	x ɪ l m ɑː ʃ
xilwet	x ɪ l w ɛ t
xiyar	x ɪ j ɑː ɾ
xizêm	x ɪ z eː m
xopanker	x oː p ɑː n k ɛ ɾ
xort	x oː ɾ t
xox	x oː x
xuda	x ʊ d ɑː
xuhermend	x ʊ h ɛ ɾ m ɛ n d
xwarin	xʷ ɑː ɾ ɪ n
xwaringeh	xʷ ɑː ɾ ɪ n ɡ ɛ h
xwedî	xʷ ɛ d iː
xwedîmaf	xʷ ɛ d iː m ɑː f
xwelî	xʷ ɛ l iː
xwelîdank	xʷ ɛ l iː d ɑː ŋ k
xwen	xʷ ɛ n
xwenda	xʷ ɛ n d ɑː
xwendekar	xʷ ɛ n d ɛ k ɑː ɾ
xwendevan	xʷ ɛ n d ɛ v ɑː n
xwendingeh	xʷ ɛ n d ɪ n ɡ ɛ h
xwerist	xʷ ɛ ɾ ɪ s t
xweserî	xʷ ɛ s ɛ ɾ iː
xwestin	xʷ ɛ s t ɪ n
xwestok	xʷ ɛ s t oː k
xweza	xʷ ɛ z ɑː
xwezanas	xʷ ɛ z ɑː n ɑː s
xweşbextane	xʷ ɛ ʃ b ɛ x t ɑː n ɛ
xweşkirin	xʷ ɛ ʃ k ɪ ɾ ɪ n
xweşî	xʷ ɛ ʃ iː
xwê	xʷ eː
xwêdan	xʷ eː d ɑː n
xwêdank	xʷ eː d ɑː ŋ k
xwîn	xʷ iː n
xwîndarî	xʷ iː n d ɑː ɾ iː
xêvet	x eː v ɛ t
xîç	x iː t͡ʃ
yahodî	j ɑː h oː d iː
yane	j ɑː n ɛ
yarî	j ɑː ɾ iː
yek	j ɛ k
yekîtî	j ɛ k iː t iː
zagon	z ɑː ɡ oː n
zagonîtî	z ɑː ɡ oː n iː t iː
zanist	z ɑː n ɪ s t
zanistvan	z ɑː n ɪ s t v ɑː n
zanko	z ɑː n k oː
zanîn	z ɑː n iː n
zanîngeh	z ɑː n iː n ɡ ɛ h
zarok	z ɑː r oː k
zava	z ɑː v ɑː
zayend	z ɑː j ɛ n d
zazakî	z ɑː z ɑː k iː
zelam	z ɛ l ɑː m
zemawend	z ɛ m ɑː w ɛ n d
zengînî	z ɛ n ɡ iː n iː
zer	z ɛ ɾ
zerd	z ɛ ɾ d
zerdelî	z ɛ ɾ d ɛ l iː
zerik	z ɛ ɾ ɪ k
zevî	z ɛ v iː
zewicîn	z ɛ w ɪ d͡ʒ iː n
zeytûn	z ɛ j t uː n
zik	z ɪ k
zikak	z ɪ k ɑː k
ziman	z ɪ m ɑː n
zimankuj	z ɪ m ɑː n k ʊ ʒ
zimankujî	z ɪ m ɑː n k ʊ ʒ iː
zimanmalbat	z ɪ m ɑː n m ɑː l b ɑː t
zimannas	z ɪ m ɑː n n ɑː s
zimannasî	z ɪ m ɑː n n ɑː s iː
zina	z ɪ n ɑː
zincîr	z ɪ n d͡ʒ iː ɾ
zindanker	z ɪ n d ɑː n k ɛ ɾ
zindankirin	z ɪ n d ɑː n k ɪ ɾ ɪ n
zirav	z ɪ ɾ ɑː v
zirto	z ɪ ɾ t oː
zivirandin	z ɪ v ɪ ɾ ɑː n d ɪ n
zivistan	z ɪ v ɪ s t ɑː n
zivêrkirin	z ɪ v eː ɾ k ɪ ɾ ɪ n
zordarkuj	z oː ɾ d ɑː ɾ k ʊ ʒ
zordarkujî	z oː ɾ d ɑː ɾ k ʊ ʒ iː
zêf	z eː f
zêr	z eː ɾ
zêw	z eː w
zîha	z iː h ɑː
zîv	z iː v
Çem	t͡ʃ ɛ m
Êzidi	eː z ɪ d ɪ
çakar	t͡ʃ ɑː k ɑː ɾ
çand	t͡ʃ ɑː n d
çande	t͡ʃ ɑː n d ɛ
çandinî	t͡ʃ ɑː n d ɪ n iː
çapemenî	t͡ʃ ɑː p ɛ m ɛ n iː
çare	t͡ʃ ɑː ɾ ɛ
çarşem	t͡ʃ ɑː ɾ ʃ ɛ m
çarşev	t͡ʃ ɑː ɾ ʃ ɛ v
çav	t͡ʃˤ ɑː v
çavrî	t͡ʃ ɑː v ɾ iː
çay	t͡ʃ ɑː j
çayxane	t͡ʃ ɑː j x ɑː n ɛ
çek	t͡ʃ ɛ k
çekdanîn	t͡ʃ ɛ k d ɑː n iː n
çekhilanîn	t͡ʃ ɛ k h ɪ l ɑː n iː n
çekûç	t͡ʃ ɛ k uː t͡ʃ
çem	t͡ʃ ɛ m
çeper	t͡ʃ ɛ p ɛ ɾ
çerm	t͡ʃ ɛ ɾ m
çewder	t͡ʃ ɛ w d ɛ ɾ
çewtî	t͡ʃ ɛ w t iː
çexdar	t͡ʃ ɛ x d ɑː ɾ
çilm	t͡ʃ ɪ l m
çimkî	t͡ʃ ɪ m k iː
çip	t͡ʃ ɪ p
çipik	t͡ʃ ɪ p ɪ k
çiq	t͡ʃ ɪ q
çiqil	t͡ʃ ɪ q ɪ l
çivîk	t͡ʃ ɪ v iː k
çiya	t͡ʃ ɪ j ɑː
çiyayî	t͡ʃ ɪ j ɑː j iː
çol	t͡ʃ oː l
çêlek	t͡ʃ eː l ɛ k
çêlekew	t͡ʃ eː l ɛ k ɛ w
çêr	t͡ʃ eː r
çêregeh	t͡ʃ eː ɾ ɛ ɡ ɛ h
çîmen	t͡ʃ iː m ɛ n
çîn	t͡ʃ iː n
çîrok	t͡ʃ iː ɾ oː k
çîrokbêj	t͡ʃ iː ɾ oː k b eː ʒ
çît	t͡ʃ iː t
çîtik	t͡ʃ iː t ɪ k
çîyayî	t͡ʃ iː j ɑː j iː
çûk	t͡ʃˤ uː kˤ
çûn	t͡ʃ uː n
çûçik	t͡ʃ uː t͡ʃ ɪ k
êrîş	eː ɾ iː ʃ
êvar	eː v ɑː ɾ
êzing	eː z ɪ ŋ ɡ
êş	eː ʃ
îlac	iː l ɑː d͡ʒ
împerator	iː m p ɛ ɾ ɑː t oː ɾ
împeratorî	iː m p ɛ ɾ ɑː t oː ɾ iː
înan	iː n ɑː n
îqame	iː q ɑː m ɛ
îsot	iː s oː t
îtalî	iː t ɑː l iː
îzotop	iː z oː t oː p
îşaret	iː ʃ ɑː ɾ ɛ t
û	uː
ûr	uː ɾ
Şivan	ʃ ɪ v ɑː n
şahî	ʃ ɑː h iː
şalyar	ʃ ɑː l j ɑː ɾ
şampo	ʃ ɑː m p oː
şan	ʃ ɑː n
şandin	ʃ ɑː n d ɪ n
şano	ʃ ɑː n oː
şar	ʃ ɑː ɾ
şargeh	ʃ ɑː ɾ ɡ ɛ h
şaxmat	ʃ ɑː x m ɑː t
şayîr	ʃ ɑː j iː ɾ
şebeq	ʃ ɛ b ɛ q
şeftalî	ʃ ɛ f t ɑː l iː
şeher	ʃ ɛ h ɛ ɾ
şekir	ʃ ɛ k ɪ ɾ
şemî	ʃ ɛ m iː
şer	ʃ ɛ ɾ
şeref	ʃ ɛ ɾ ɛ f
şev	ʃ ɛ v
şewitîn	ʃ ɛ w ɪ t iː n
şik	ʃ ɪ k
şikar	ʃ ɪ k ɑː ɾ
şikayet	ʃ ɪ k ɑː j ɛ t
şikeft	ʃ ɪ k ɛ f t
şilêl	ʃ ɪ l eː l
şimşûr	ʃ ɪ m ʃ uː ɾ
şip	ʃ ɪ p
şirket	ʃ ɪ ɾ k ɛ t
şivan	ʃ ɪ v ɑː n
şivdar	ʃ ɪ v d ɑː ɾ
şiverê	ʃ ɪ v ɛ ɾ eː
şiwît	ʃ ɪ w iː t
şofar	ʃ oː f ɑː ɾ
şofêr	ʃ oː f eː ɾ
şor	ʃ oː ɾ
şorbe	ʃ oː ɾ b ɛ
şwîştin	ʃ w iː ʃ t ɪ n
şêlim	ʃ eː l ɪ m
şêr	ʃ eː ɾ
şîlav	ʃ iː l ɑː v
şîn	ʃ iː n
şîpane	ʃ iː p ɑː n ɛ
şîr	ʃ iː ɾ
şîranî	ʃ iː ɾ ɑː n iː
şîv	ʃ iː v
şûr	ʃ uː ɾ
şûrik	ʃ uː ɾ ɪ k
şûşe	ʃ uː ʃ ɛ
şûştin	ʃ uː ʃ t ɪ n
