a	e
a	ä
a	ɐ
a	ə
ab	e b i
abab	a b a b
abad	a b a t
abadiah	a b a d i j a h
abadiat	a b a d i j a t
abadikan	a b a d i k a n
abahkan	a b a h k a n
abaka	a b a k a
abaka	a b a k ə
abalon	a b a l o n
abalone	a b a l o n e
abangan	a b a ŋ a n
abdikasi	a b d i k a s i
abnormal	a b n o r m a l
abses	a b s e s
absurdisme	a b s u r d i s m ə
ada	a d ə
adenium	a d e n i j u m
adenovirus	a d e n o r u s
adiwira	a d i w i r a
aek	aʲ ɛ ʔ
aerodinamik	e r o d a i̯ n a m i ʔ
agenda	a ɡ e n d a
agenda	ä d͡ʒ e n d ä
agik	a ɡ i ʔ
agitasi	a ɡ i t a s i
agogo	a ɡ o ɡ o
akhbar	ä k̚ b äː
akhdar	a x d a r
aktinium	a k t i n i o m
aktinium	a k t i n i ə m
aktinium	ɛ k t i n i ə m
alamak	ʔ ä l ä m ä ʔ
allah	a ɫ ɫ a h
allah	ɔ ɫ ɫ ɔ h
amerisium	a m ɛ r i s i o m
amerisium	a m ɛ r i s i ə m
amerisium	ə m ɛ r i s i ə m
anggur	a ŋ ɡ o
angkatan	a ŋ k a t a n
anjing	a ɲ d͡ʒ e ŋ
antartika	a n t̪ a r t̪ i k a
antimoni	a n t i m o n i
antimoni	ɛ n t i m o n i
antologi	a n t o l o ɡ i
antologi	ɛ n t ɔ l ə d͡ʒ i
antu	a n t u
antuk	a n t o ʔ
anut	ä n o t̚
anut	ä n ʊ t̚
api	a p i
april	a p r e l
ara	ä r ə
argentum	a r d͡ʒ ɛ n t ə m
argentum	a r ɡ ɛ n t o m
argentum	a r ɡ ɛ n t ə m
arked	a r k e t̪
arsenik	a r s ə n e k
artikel	a r t i k ə l
asrama	a s r a m a
asrama	a s r a m ə
astatin	a s t a t e n
astatin	ɛ s t e t e n
asu	a s u
aswad	a s u a t
aswad	a s w a t
atas	a t a h
auditorium	a u̯ d i t̪ o r j o m
auditorium	a u̯ d i t̪ o r j u m
aurum	a u r o m
aurum	a u r u m
aurum	a u r ə m
aurum	ɔ r u m
autopsi	a u̯ t ɔ p s i
autopsi	o t ɔ p s i
awek	a w e ʔ
ayah	a j a h
ayam	a j ɛ̃ː
b	b
b	b i
b	p̚
badminton	b a d m i n t o n
badminton	b ɛ t̚ m i n t ə n
baldu	b ä l d u
balik	b ä l ɪ ʔ ~ l e̞ ʔ
baling	b a l e ŋ
balut	b a l ʊ t̪
banar	b a n a r
banci	b ä ɲ t͡ʃ i
bandung	b a n d o ŋ
bandung	b a n d u ŋ
bangkai	b ä ŋ k ä i̯
banjar	b ä ɲ d͡ʒ äː
bank	b e ŋ
banyak	b a n j a k
banyak	b a ɲ a ʔ
barat	b a ɣ a ʔ
barat	b a ʀ a t
barat	b a ʁ a t
barium	b a r i o m
barium	b a r i ə m
barium	b ɛ r i ə m
barua	b a r u w a
basahan	b a s a h a n
batas	b a t a s
bateri	b e t ə r i
batok	b a t ɔ k̚
batuk	b a t ʊ k̚
bawang	b a w a ŋ
bayar	b ä j ä r
bayar	b ä j äː
beku	b ə k u
belanak	b ə l ä n ä ʔ
belanga	b ə l a ŋ a
belatuk	b ə l a t̪ u ʔ
belau	b ə l a u̯
bemban	b ə m b ä n
benci	b ə n t͡ʃ i
bengkok	b e̞ ŋ k o̞ ʔ
bengkuang	b ə ŋ k w a ŋ
benturung	b ə n t u r o ŋ
berak	b e r ä ʔ
berbau	b ə b a u
berdasarkan	b ə r d a s a r k a n
berdikari	b ə d i k a r i
berek	b e r e ʔ
berkas	b ə r k ä s
berkedut	b ə k ə d o t
berkedut	b ə r k ə d o t
berkelium	b ɛ r k e l i o m
berkelium	b ɛ r k e l i ə m
berlau	b ə r l a u̯
bermanifesto	b ə r m a n i f e s t o
berpoligami	b ə p o l i ɡ a m i
bertambun	b ə r t a m b o n
bertambun	b ə t a m b o n
bertas	b ə r t ä s ~ b ə ɾ t ä s
bertempat	b ə t ə m p a t
beruk	b ə r u ʔ
berunai	b ə r u n a i̯
besi	b ə s i
betlehem	b e t̪ l e h e m
bias	b i a s
bila	b i l ə
binatang	b i n a t a ŋ
biru	b i r u
bismut	b i s m o t
bismut	b i s m ə t
bius	b i ʊ s
bocah	b o t͡ʃ a h
bolong	b o l o ŋ
boneka	b o n e k a
boneka	b o n e k ə
brakilogi	b r a k i l o ɡ i
bromin	b r o m a e n
bromin	b r o m e n
buaya	b u a j ə
bubuh	b u b o h
bubuh	b u b o̞ h
bubuh	b u b ʊ h
bubuk	b u b u ʔ
budak	b u d ä ʔ
budu	b u d u
bulan	b u l a n
buni	b u n i
bunuh	b u n o h
bunuh	b u n ʊ h
bura	b u r ä
bura	b u r ə
bustan	b u s t a n
busuk	b u s o ʔ
busur	b u s o
butun	b u t̪ u n
c	s i
c	t͡ʃ
cacar	t͡ʃ a t͡ʃ a r
cakap	t͡ʃ ä k ä p̚
calon	t͡ʃ a l o n
cam	t͡ʃ a m
campak	t͡ʃ a m p a ʔ
cantik	t͡ʃ a n t e ʔ
cap	t͡ʃ a p
caya	t͡ʃ a j ə
cekik	t͡ʃ ə k ɪ ʔ
ceramah	t͡ʃ ə r a m a h
cermin	t͡ʃ ə r m ɪ n
cerpen	t͡ʃ ə p e n
chukai	t͡ʃ u k a i̯
cikgu	t͡ʃ e ʔ ɡ u
cikgu	t͡ʃ ɪ ʔ ɡ u
citah	t͡ʃ i t a h
cuka	t͡ʃ u k ə
culik	t͡ʃ u l ɪ ʔ ~ l e̞ ʔ
d	d
d	d i
d	t̚
dadih	d a d i h
daftar	d a f t a r
daing	d a e ŋ
daing	d a ɪ ŋ
dalam	d a l ẽ
dalang	d a l a ŋ
daratan	d a r a t̪ a n
darmstadtium	d a r m s t a t t i o m
darmstadtium	d a r m s t a t t i ə m
dasun	d ä s o n
dasun	d ä s o̞ n
dasun	d ä s ʊ n
datang	d a t̪ a ŋ
datuk	d a t o ʔ
daya	d ä j ə
dedap	d ə d ä p
dehidrasi	d e h i t̪ r a s i
dengan	d ə ŋ ä n
depoh	d e p o h
derhaka	d ə r h ä k ä
derhaka	d ə r h ä k ə
detik	d ə t e ʔ
deuterium	d e u t ə r i o m
deuterium	d e u t ə r i ə m
deuterium	d i u t ə r i ə m
di	d i
dia	d i ə
dia	dʲ ə
dian	d̪ i a n
dikedutkan	d i k ə d o t k a n
dikit	d i k e t
dinamik	d i n a m i ʔ
dingo	d i ŋ o
dingo	d i ŋ ɡ o
dioksidakan	d i o k s i d a k a n
dipeningkan	d i p ə n e ŋ k a n
disember	d i s ɛ m b ə r
disember	d i z ɛ m b ə r
disprosium	d i s p r o s i o m
disprosium	d i s p r o s i ə m
doktor	d ɔ k̚ t o̟ r
domba	d ɔ m b a
dominika	d o m i n i k a
dua	d u w ə
dua	d u ə
duri	d u r i
e	e
e	i
e	ə
e	ɛ
egosentrik	e ɡ o s e n t r i k
egosentrisme	e ɡ o s e n t r i s m ə
egotisme	e ɡ o t i s m ə
einsteinium	a i n s t a e n i ə m
einsteinium	e i n s t e i n i o m
einsteinium	e i n s t e i n i ə m
eja	e d͡ʒ ä
eja	e d͡ʒ ə
ejek	e d͡ʒ e ʔ
elak	e̞ l ä ʔ
elektrik	e l e ʔ t̪ r i ʔ
empat	ə m p a t̪
erbium	ə r b i o m
erbium	ə r b i ə m
esa	e s ə
esa	ə s ə
europium	e u r o p i o m
europium	e u r o p i ə m
europium	j u r o p i ə m
f	f
f	ɛ f
falak	f a l a ʔ
fantasi	f a n t a s i
fasal	p a s a j
februari	f ɛ b r u a r i
fermium	f ə r m i o m
fermium	f ə r m i ə m
ferum	f ɛ r o m
ferum	f ɛ r ə m
fidah	f i d a h
fisiologi	f i s i o l o d͡ʒ i
fransium	f r a n s i o m
fransium	f r a n s i ə m
g	d͡ʒ i
g	k̚
g	ɡ
gadai	ɡ a d a i̯
gading	ɡ a d e ŋ
gadolinium	ɡ a d o l i n i o m
gadolinium	ɡ a d o l i n i ə m
gadolinium	ɡ ɛ d o l i n i ə m
gaji	ɡ a d͡ʒ i
gak	ɡ a ʔ
galium	ɡ a l i o m
galium	ɡ a l i ə m
galium	ɡ ɛ l i ə m
galon	ɡ a l ɔ n
gangga	ɡ a ŋ ɡ a
gangga	ɡ a ŋ ɡ ə
ganggu	ɡ ä ŋ ɡ u
ganja	ɡ a n d͡ʒ a
gantang	ɡ ä n t̪ ä ŋ
garaj	ɡ a r a d͡ʒ
garang	ɡ ä r ä ŋ
gayung	ɡ ä j o ŋ
gayung	ɡ ä j ʊ ŋ
geisya	ɡ e ʔ i ʃ ɐ
gejala	ɡ ə d͡ʒ a l a
gelang	ɡ ə l ä ŋ
gelanggang	ɡ ə l a ŋ ɡ a ŋ
gelar	ɡ ə l ä r
gelisah	ɡ ə l i s a h
gembira	ɡ ə m b i r ə
gerabak	ɡ ə r a b a ʔ
geran	ɡ ə r a n
gerek	ɡ e ɾ e ʔ̚
gergasi	ɡ ə r ɡ a s i
germanium	d͡ʒ ə r m a n i ə m
germanium	ɡ ə r m a n i o m
germanium	ɡ ə r m a n i ə m
gigil	ɡ i ɡ e l
gigil	ɡ i ɡ e̞ l
gigil	ɡ i ɡ ɪ l
gila	ɡ i l ə
globalisasi	ɡ l o b a l i s a s i
gosok	ɡ o s o ʔ
graviti	ɡ r a v i t i
guam	ɡ u ä m
gudang	ɡ u d a ŋ
guna	ɡ u n ə
gunung	ɡ u n o ŋ
gunung	ɡ u n u ŋ
h	e t͡ʃ
h	h
h	h e t͡ʃ
habsyah	h a b ʃ a h
hafnium	h a f n i o m
hafnium	h a f n i ə m
haiwan	h a i̯ w a n
haiwan	h e w a n
hak	h a ʔ
halwa	h ä l w ə
hamba	a m b ɑː
hamba	h a m b ə
hang	h ä ŋ
hari	h a r i
hartal	h a r t a l
hassium	h a s i o m
hassium	h a s i ə m
hassium	h ɛ s i ə m
hawa	h ä w ə
hentak	h ə n t ä ʔ
hentam	h ə n t ä m
hiburan	h i b u r a n
hidraulik	h i t̪ r a u l i ʔ
hidrologi	h a i̯ d r o l o d͡ʒ i
hijau	h i d͡ʒ a u̯
himar	h i m a r
himpun	h i m p o n
himpun	h i m p u n
hinggap	h i ŋ ɡ ä p̚
hipokondria	h i p o k o n d r i j a
hirup	h i ɣ ɔ ʔ
hitam	h i t a m
holmium	h ɔ l m i o m
holmium	h ɔ l m i ə m
hospital	h o s p i t̪ a l
hubub	h u b o p̚
hubub	h u b o̞ p̚
hubub	h u b ʊ p̚
hungary	h u ŋ ɡ ə r i
hutang	h u t̪ ä ŋ ~ u t̪ ä ŋ
i	a i̯
i	e
i	i
ia	i ə
ia	iʲ ə
iau	iʲ ä u̯
ibus	i b o s
ibus	i b o̞ s
ibus	i b ʊ s
ikhtiar	i x t̪ j a r
iklan	i k l ä n
iklan	i ʔ l a n
imigresen	i m i ɡ r e s e n
imigresyen	i m i ɡ r ə ʃ ə n
indium	i n d i o m
indium	i n d i ə m
inersia	i n ə s i a
inisiatif	i n i s j a t̪ i f
inkuilin	i n k u w i l i n
inovatif	i n o v a t i f
inovator	i n o v a t o r
insinyur	ɪ n s i ɲ ʊ r
internet	i n t ə n ɛ t̚
invaginasi	i n v a ɡ i n a s i
iodin	a j o d e n
iodin	i o d e n
iridium	i r i d i o m
iridium	i r i d i ə m
istana	ɪ s t a n a
itam	i t a m
iterbium	i t ə r b i o m
iterbium	i t ə r b i ə m
itrium	i t r i o m
itrium	i t r i ə m
izin	i z ɪ n
j	d͡ʒ
j	d͡ʒ e
j	t͡ʃ
jakal	d͡ʒ a k a l
jakim	d͡ʒ a k i m
jala	d͡ʒ ä l ə
jam	d͡ʒ a m
jambu	d͡ʒ a m b u
januari	d͡ʒ a n w a r i
jari	d ʒ ä ɾ i
jawab	d͡ʒ ä w ä p̚
jb	d͡ʒ e i̯ b i
je	d͡ʒ e
jelak	d͡ʒ ə l a ʔ
jelata	d͡ʒ ə l a t ə
jelatang	d͡ʒ ə l ä t ä ŋ
jenama	d͡ʒ ə n a m a
jenama	d͡ʒ ə n a m ə
jengkal	d ʒ ə ŋ k ä l
jenuh	d͡ʒ ə n o h
jenuh	d͡ʒ ə n ʊ h
jerang	d͡ʒ ə r ä ŋ
jeti	d͡ʒ e t̪ i
jika	d͡ʒ i k ə
jkr	d͡ʒ e i̯ k e i̯ ʔ a r
joget	d ʒ o ɡ ɛ t
juara	d͡ʒ u w a r ə ~ d͡ʒ w a r ə
juga	d͡ʒ u ɡ ə
jugak	d͡ʒ u ɡ a ʔ
julai	d͡ʒ u l a i̯
jun	d͡ʒ o n
jurutera	d͡ʒ u r u t ə r a
k	k
k	k e
k	k̚
k	ʔ
kabut	k a b o t
kabut	k a b o̞ t
kabut	k a b ʊ t
kacu	k ä t͡ʃ u
kadmium	k a t m i o m
kadmium	k a t m i ə m
kadmium	k ɛ t m i ə m
kajang	k a d͡ʒ a ŋ
kalifornium	k a l i f ɔ r n i o m
kalifornium	k a l i f ɔ r n i ə m
kalifornium	k ɛ l i f ɔ r n i ə m
kalium	k a l i o m
kalium	k a l i ə m
kalium	k e l i ə m
kalkulator	k a l k u l a t̪ o r
kalsium	k a l s i o m
kalsium	k a l s i ə m
kalsium	k ɛ l s i ə m
kanada	k a n a d a
kancing	k ä n t͡ʃ e ŋ
kancing	k ä n t͡ʃ ɪ ŋ
kanyon	k a ɲ o n
kapitalisme	k a p i t̪ a l i s m ə
kapur	k a p o
kardiologi	k a r d j o l o d͡ʒ i
kariah	k a r j a h
kasut	k a s u t̪
katil	k a t e
katil	k a t e l
katir	k ä t eː
katir	k ä t e̞ː
katir	k ä t ɪː
kawah	k a w a h
kawan	k a w a n
kayangan	k a j a ŋ a n
kayau	k a j a u̯
kebabal	k ə b a b a l
keban	k ə b ä n
kebasi	k ə b ä s i
kedelai	k ə d ə l a i̯
kedua	k ə d w a
kedut	k ə d o t
kedutkan	k ə d o t k a n
kejap	k ə d ʒ ä p̚
keju	k ɛ d͡ʒ u
kejuruteraan	k ə d͡ʒ u r u t̪ ə r a a n
kek	k e ʔ
kelabu	k ə l a b u
kelalang	k ə l ä l ä ŋ
kelambir	k ə l a m b i r
kelayang	k ə l a j a ŋ
keledut	k ə l ə d o t
kelima	k ə l i m ä
kelima	k ə l i m ə
keluarga	k ə lʷ ä r ɡ ə
kem	k e m
kemalangan	k ə m a l a ŋ a n
kemalasan	k ə m ä l ä s ä n
kemih	k ə m e h
kemih	k ə m e̞ h
kemih	k ə m ɪ h
kemiri	k ə m i r i
kempen	k e m p e n
kemudahan	k ə m u d a h a n
kemudi	k ə m u d i
kena	k ə n ə
kenapa	k ə n ä p ə
kencana	k ə n t͡ʃ a n ə
kencing	k ə n t͡ʃ e ŋ
kencing	k ə n t͡ʃ ɪ ŋ
kendatipun	k ə n d ä t i p ʊ n
kendi	k ə n d i
kenyataan	k ə ɲ a t a ʔ a n
kera	k ə r a
kerah	k ə r a h
kerajaan	k ə r a d͡ʒ a ʔ a n
kerakyatan	k ə r a ʔ j a t a n
kerana	k ə r a n ə
kerana	k ə r n a
kerani	k ə r a n i
kerdut	k ə r ə d o t
keropok	k ə r o p o k̚
ketat	k ə t̪ a t̪
kewarganegaraan	k ə w a r ɡ a n ə ɡ a r a ʔ a n
kewarganegaraan	k ə w a ɡ ə n ə ɡ a r a ʔ a n
kima	k i m ä
kima	k i m ə
kimpal	k i m p a l
kirai	k i r a i̯
kirik	k i r e ʔ
kita	k i t ə
kitak	k i t a ʔ
kk	k e i̯ k e i̯
kl	k e i̯ ʔ e l
klorin	k l ɔ r ɪ n
kobalt	k o b a l t
komisen	k o m i s e n
kompleks	k o m p l e k s
kopernisium	k ɔ p ə r n i s i o m
kopernisium	k ɔ p ə r n i s i ə m
korah	k o r a h
koran	k o r a n
kordit	k o r d i t
kordofon	k o r d o f o n
kornea	k o r n e j a
korona	k o r o n a
koruna	k o r u n a
kos	k o s
koyote	k a j o t i
koyote	k o j o t e
kpm	k e i̯ p i ʔ e m
kripton	k r i p t o n
kripton	k r i p t ə n
kromium	k r o m i o m
kromium	k r o m i ə m
kuang	k u w a ŋ
kubu	k u b u
kugar	k u ɡ a r
kugar	k u ɡ ɐ r
kulon	k u l o n
kuman	k u m a n
kumur	k u m o
kunci	k u ɲ t͡ʃ i
kunyit	k u ɲ ɪ t̚
kuprum	k u p r o m
kuprum	k u p r ə m
kurap	k u r ä p
kurium	k u r i o m
kurium	k u r i ə m
kurma	k ʊ r m a
kurun	k u r o n
kutub	k u t̪ o p̚
kutub	k u t̪ o̞ p̚
kutub	k u t̪ ʊ p̚
kutubkhanah	k u t̪ u p x a n a h
kuyuk	k u j o ʔ
l	l
l	ɛ l
laga	l a ɡ a
lahar	l ä h äː
lai	l a i̯
lampu	l a m p u
langgar	l a ŋ ɡ a r
langit	l a ŋ e t
langking	l a ŋ k e ŋ
lantanum	l a n t a n o m
lantanum	l a n t a n ə m
lantanum	l ɛ n t ə n ə m
lapah	l ä p ä h
lapar	l a p a
lapuk	l a p u ʔ
latin	l a t e n
lawak	l a w a ʔ
lawan	l ä w ä n
lawrensium	l ɔ r ɛ n s i o m
lawrensium	l ɔ r ɛ n s i ə m
layar	l ä j äː
lebai	l ə b a i̯
leftenan	l e f t̪ ə n a n
legundi	l ə ɡ u n d i
leher	l e ʔ e r
lemak	l ə m ä ʔ
lembah	l ə m b ä h
lempung	l ə m p o ŋ
lempung	l ə m p ʊ ŋ
lengkung	l ə ŋ k u ŋ
lepas	l ə p ä s
lerai	l ə r a i̯
lima	l i m ə
limas	l i m a s
lipas	l i p ä s
lipat	l i p ä t
lorat	l o r ä t
lori	l o r i
lotong	l o t o ŋ
lukut	l u k u t̪
lumba	l u m b ä
lumba	l u m b ə
luntang	l u n t̪ ä ŋ
lutetium	l u t e t i o m
lutetium	l u t e t i ə m
lutetium	l u t i ʃ ə m
m	m
m	ɛ m
mabuk	m a b o ʔ
mac	m a t͡ʃ
macam	m a t͡ʃ a m
madagaskar	m a d a ɡ a s k a r
maghrib	m a ɡ ə r e p
maghrib	m a ɣ ə r e p
maghribi	m a ɡ r i b i
mahal	m a h a
mai	m a i̯
majlis	m a d͡ʒ l i s
makalah	m a k a l a h
maklum	m ä ʔ l o m
maklum	m ä ʔ l ʊ m
maklumat	m ä ʔ l u m ä t̚
maktab	m a ʔ k t a p
malas	m ä l ä s
malayalam	m a l a j a l a m
maldives	m a l d i v
malu	m ä l u
mamah	m ä m ä h
mandi	m ä n d i
mangan	m a ŋ ɡ a n
mangan	m a ŋ ɡ ə n
mangan	m ɛ ŋ ɡ ə n
mangkat	m ä ŋ k ä t
mangkubumi	m a ŋ k u b u m i
maniak	m a n i j a k
manipulatif	m a n i p u l a t i f
mara	m a r a
marah	m a ʁ a h
marhaen	m a r h ã e̯ n
marhaen	m a r h ã i̯ n
mas	m a s
masak	m ä s ä ʔ
masokisme	m a s o k i s m ə
mayones	m a j o n e s
mayonis	m a j o n i s
mei	m e i̯
meitnerium	m a i t n i r i ə m
meitnerium	m e i t n e r i o m
meitnerium	m e i t n e r i ə m
mel	m e l
melukut	m ə l u k o t̚
melukut	m ə l u k ʊ t̚
melur	m ə l o r
memberang	m ə m b ə r a ŋ
membesar	m ə m b ə s a
membusuk	m ə m b u s o ʔ
memeningkan	m ə m ə n e ŋ k a n
memerang	m ə m ə r a ŋ
menawarkan	m ə n a w a r k a n
mendelevium	m ɛ n d ə l ɛ v i o m
mendelevium	m ɛ n d ə l ɛ v i ə m
meneroka	m ə n ə r o k ə
mengedut	m ə ŋ ə d o t
mengedutkan	m ə ŋ ə d o t k a n
mengkuang	m ə ŋ k w a ŋ
mengoksida	m ə ŋ o k s i d a
mengoksidakan	m ə ŋ o k s i d a k a n
menular	m ə n u l a
menyatakan	m ə ɲ a t ə k a n
merak	m ə r a ʔ
merdeka	m ə r d e k ə
merkuri	m ə r k u r i
merunggai	m ə r u ŋ ɡ a i̯
mesej	m e s e d͡ʒ
mesej	m ɛ s ɪ d͡ʒ
mesin	m e s e n
mesin	m e s ɪ n
mesir	m ə s e r
mesir	m ə s i r
mesir	m ə s ə r
mesti	m e s t i
mesti	m ə s t i
mikroskop	m i k r o s k o p
minggu	m i ŋ ɡ u
minit	m i n e t
misa	m i s a
molibdenum	m o l i p d e n o m
molibdenum	m o l i p d e n ə m
monorel	m o n o r e l
muflis	m u f l e s
mutu	m u t u
muzium	m j u z i o m
muzium	m j u z i u m
n	n
n	ɛ n
nak	n ä ʔ̚
nasi	n a s i
nasi	n a s i ʔ
nek	n e̞ ʔ
nenek	n e n e ʔ
neodimium	n e o d i m i o m
neodimium	n e o d i m i ə m
neodimium	n i o d i m i ə m
neptunium	n ɛ p t u n i o m
neptunium	n ɛ p t u n i ə m
ngarai	ŋ a r a i̯
nikel	n i k ə l
nila	n i l ə
nilakandi	n i l ə k a n d i
nilau	n i l ä u̯
niobium	n i o b i o m
niobium	n i o b i ə m
nipis	n i p e s
nobelium	n o b ɛ l i o m
nobelium	n o b ɛ l i ə m
nona	n o n a
november	n o v e m b ə r
nyalaan	ɲ a l ə ʔ a n
nyata	ɲ a t ə
nyiur	ɲ j u r
o	o
o	ɔ
obituari	o b i t u w a r i
obor	o b o r
oftalmologi	o f t̪ a l m o l o d͡ʒ i
ogos	ɔ ɡ o s
oksihidrogen	ɔ k s i h a i̯ d r o d͡ʒ ə n
oksihidrogen	ɔ k s i h i d r o ɡ ə n
oktober	ɔ k t o b ə r
ombak	o̞ m b ä ʔ
osmium	ɔ s m i o m
osmium	ɔ s m i ə m
overtur	o v ə r t u r
ovum	o v o m
p	p
p	p i
p	p̚
pabila	p ə b i l ə
pada	p a d ə
pagar	p ä ɡ äː
pagi	p ä ɡ i
paha	p ə h ə
pakar	p ä k ä r
paksa	p ä k̚ s ə
pakwe	p a ʔ w ə
paladium	p a l a d i o m
paladium	p a l a d i ə m
paladium	p ə l e d i ə m
pancung	p a n t͡ʃ o ŋ
panda	p a n d ə
pantai	p a n t̪ a i̯
papan	p a p a n
para	p a r ə
pasak	p ä s ä ʔ
pasal	p a s a j
patut	p ä t̪ o t̚
patut	p ä t̪ ʊ t̚
paul	p a o l
pawaka	p a w a k ə
pbb	p i b i b i
pdrm	p i d i ʔ a r ʔ e m
pecut	p ə t͡ʃ o t
peduli	p ə d u l i
pelatuk	p ə l a t o ʔ
pelawak	p ə l a w a ʔ
peluit	p ə l u w e t
pemalas	p ə m ä l ä s
pemanipulasi	p ə m a n i p u l a s i
pempengaruh	p ə m p ə ŋ a r o h
penara	p ə n a r ə
pengaruh	p ə ŋ a r o h
pengeja	p ə ŋ e d͡ʒ a
pengetua	p ə ŋ ə t u ə
penggemar	p ə ŋ ɡ ə m a
pengovuman	p ə ŋ o v o m a n
pening	p ə n e ŋ
pening	p ə n i n
peningkan	p ə n e ŋ k a n
penuh	p ə n o h
penunu	p ə n u n u
penyapu	p ə ɲ ä p u
perahu	p ə r a h u
perak	p e r a ʔ
perancis	p ə r a n t͡ʃ e s
perancis	p ə r a n t͡ʃ ɪ s
perau	p ə r a u̯
percaya	p ə t͡ʃ a j ə
perhentian	p ə r h ə n t̪ j a n
periksa	p ə r i ʔ s a
pernyataan	p ə r ɲ a t a ʔ a n
pernyataan	p ə ɲ a t a ʔ a n
persen	p ə r s e n
pertama	p ə r t a m ə
peta	p ə t ə
peti	p ə t̪ i
petir	p ə t e
petir	p ə t e r
pihak	p i h a ʔ
pijak	p i d͡ʒ ä ʔ
pilih	p i l e h
pingat	p i ŋ ä t
pirau	p i r a u̯
pks	p i k e i̯ e s
platinum	p l a t i n o m
platinum	p l a t i n ə m
platinum	p l ɛ t i n ə m
plumbum	p l a m b ə m
plumbum	p l u m b o m
plumbum	p l u m b ə m
plutonium	p l u t o n i o m
plutonium	p l u t o n i ə m
polonium	p o l o n i o m
polonium	p o l o n i ə m
polonium	p ə l o n i ə m
pongsu	p ɔ ŋ s u
popia	p o p j ã
popia	p ɔ p j ã
pos	p o s
praseodimium	p r a s e o d i m i o m
praseodimium	p r a s e o d i m i ə m
praseodimium	p r e s i ə d i m i ə m
presiden	p r e s i d e n
presiden	p r e s i d ə n
produktif	p r o d u ʔ t̪ i f
projek	p r o d͡ʒ e ʔ
prometium	p r o m e t i o m
prometium	p r o m e t i ə m
prometium	p r o m i t i ə m
protaktinium	p r o t a k t i n i o m
protaktinium	p r o t a k t i n i ə m
protaktinium	p r o t ɛ k t i n i ə m
psikologi	s a i̯ k o l o d͡ʒ i
puan	p u w a n
puchong	p u t͡ʃ o ŋ
pucung	p u t͡ʃ o ŋ
pukat	p u k a t̪
pulun	p u l o n
puma	p u m ɐ
puma	p u m ə
pupuk	p u p o ʔ
purata	p u r a t ə
pusaka	p u s a k a
pusaka	p u s a k ə
pusing	p u s ɪ ŋ
putat	p u t ä t
putih	p u t ɪ h
q	k
q	k i u
q	k j u
q	k̚
q	q
r	a r
r	r
radium	r a d i o m
radium	r a d i ə m
radium	r e d i ə m
radon	r a d ɔ n
radon	r e d ɔ n
raksa	r a k s ə
rakyat	r a k j a t
rakyat	r a ʔ j a t
ramas	r ä m ä s
rambutan	r ä m b o t ä n
rambutan	r ä m b u t ä n
rami	r ä m i
rapat	r a p a t̪
rapuh	r a p u h
ras	ɾ ä s
rasa	r a s ə
rasisme	r a s i s m ə
rawak	ɾ ä w ä ʔ
raya	ɣ ä j ə
reda	r ə d ə
redaksi	r e d̪ a k s i
reformasi	r e f o m a s i
rejimen	r e d͡ʒ i m e n
reka	r ɛ k a
rela	r e l ə
relevan	r e l ə v ə n
relevan	ɾ ɛ l ə v ə n
rempah	r ə m p ä h ~ ɾ ə m p ä h
rendang	r ə n d a ŋ
rendang	r ɛ n d a ŋ
renium	r ɛ n i o m
renium	r ɛ n i ə m
resam	r ə s ä m
resolusi	r e s o l u s i
restorasi	r ɛ s t o r a s i
ria	r i ə
ria	rʲ ə
rodium	r o d i o m
rodium	r o d i ə m
roentgenium	r ɛ n t ə ɡ ɛ n i o m
roentgenium	r ɛ n t ə ɡ ɛ n i ə m
rotan	r o t̪ a n
rtm	a r t̪ i ʔ e m
ruang	ɾ uʷ ä ŋ
rubidium	r u b i d i o m
rubidium	r u b i d i ə m
rumawi	r u m a w i
rutenium	r u t ə n i o m
rutenium	r u t ə n i ə m
ruterfordium	r u t ə r f ɔ r d i o m
ruterfordium	r u t ə r f ɔ r d i ə m
s	s
s	ɛ s
saat	s a ʔ a t
sadisme	s a d i s m ə
sahaya	s a h a j ə
salin	s a l e n
sama	s a m ə
samarium	s a m a r i o m
samarium	s a m a r i ə m
samarium	s ə m ɛ r i ə m
sambut	s a m b u t̪
sami	s a m i
sasar	s a s a
satah	s a t̪ a h
sato	s a t o
satwa	s a t u ə
satwa	s a t w ə
saya	s ä j ə
sebab	s ə b a ʔ
secantik	s ə t͡ʃ a n t i ʔ
segala	s a ɡ a l a
segala	s ə ɡ a l ə
segar	s ə ɡ äː
sekolah	s ə k o l a
sekolah	s ə k o l a h
sekretaris	s ɛ k r ə t a r ɪ s
selenium	s e l ɛ n i o m
sengkar	s ə ŋ k a r
sengkek	s ə ŋ k ə ʔ
sengkuang	s ə ŋ k w a ŋ
seni	s ə n i
senjata	s ə ɲ d͡ʒ a t̪ a
senjata	s ə ɲ d͡ʒ a t̪ ə
sepak	s e̞ p ä ʔ
sepak	s ə p ä ʔ
september	s ɛ p t ɛ m b ə r
seragam	s ə r a ɡ a m
seram	s ə r ä m
serampang	s ə r a m p a ŋ
seri	s ə r i
serigala	s ə r i ɡ a l ə
serium	s e r i o m
serium	s e r i ə m
serium	s i r i ə m
sesiapa	s ə sʲ ä p ə
sesium	s e s i o m
sesium	s e s i ə m
sesium	s i s i ə m
setengah	s ə t ə ŋ ä h
setuju	s t u d͡ʒ u
sial	s i a l
siamang	s i a m a ŋ
siapa	sʲ ä p ə
siasat	s j a s a t̪
siber	s a i̯ b ə
siber	s i b ə
sida	s i d a ʔ
sil	s e l
sil	s ɪ l
simpan	s i m p ä n
simpang	s i m p ãᵑ
simptom	s i m p t̪ o m
singa	s i ŋ ə
singgah	s i ŋ ɡ ä h
singkek	s i ŋ k ə ʔ
siniar	s i n i a r
sjk	e s d͡ʒ e k e
sk	e s k e
skandium	s k a n d i o m
skandium	s k a n d i ə m
skandium	s k ɛ n d i ə m
spad	s p a t̪
spm	e s p i e m
sprm	e s p i a r ʔ e m
staf	s t̪ a f
statik	s t̪ a t̪ i ʔ
strategi	s t̪ r a t̪ e d͡ʒ i
strontium	s t r ɔ n t i o m
strontium	s t r ɔ n t i ə m
strontium	s t r ɔ n ʃ ə m
suami	s w a m i
subang	s u b a ŋ
suda	s u d a
suhakam	s u h a k a m
sukat	s u k ä t
suruh	s u ɾ o h
suruh	s u ɾ ʊ h
suruhanjaya	s u r u h a ɲ d͡ʒ a j a
suruhanjaya	s u r u h a ɲ d͡ʒ a j ə
syabas	ʃ a b a s
syok	ʃ o ʔ
t	t
t	t i
t	t̚
tadah	t ä d ä h
tahan	t̪ ä h ä n
tahun	t a h o n
takde	t ä ʔ d ə
takkan	t a ʔ k a n
taksi	t̪ a ʔ s i
taksir	t ä k̚ s e r
taksir	t ä k̚ s ɪ r
talas	t̪ ä l ä s
talium	t a l i o m
talium	t a l i ə m
talium	t ɛ l i ə m
tamban	t ä m b ä n
tambun	t a m b o n
tampuk	t̪ a m p u ʔ
tanak	t ä n ä ʔ
tanggung	t̪ ä ŋ ɡ o ŋ
tanggung	t̪ ä ŋ ɡ ʊ ŋ
tantalum	t a n t a l o m
tantalum	t a n t a l ə m
tantalum	t ɛ n t ə l ə m
tanya	t ä ɲ ə
tarik	t a r e ʔ
tarum	t̪ ä r o m
tarum	t̪ ä r ʊ m
taukua	t ɔ k u ɔ̃
taukua	t ɔ̃ k u ɔ̃
tawar	t ä w äː
teater	t̪ j ə t̪ ə r
teknetium	t ɛ k n e t i o m
teknetium	t ɛ k n e t i ə m
teknologi	t̪ e ʔ n o l o d͡ʒ i
teko	t e k o
teksi	t̪ e ʔ s i
televisi	t̪ e l e v i s i
televisyen	t̪ e l e v i ʃ ə n
telur	t̪ ə l o r
telurium	t ɛ l u r i o m
telurium	t ɛ l u r i ə m
telurium	t ɛ l ə r i ə m
tembaga	t ə m b a ɡ ə
tembuni	t̪ ə m b u n i
tempat	t ə p a ʔ
tempeleng	t̪ ə m p ə l ɛ ŋ
tenggara	t ə ŋ ɡ ä ɣ ə
tenggiri	t ə ŋ ɡ i r i
tentera	t̪ ə n t̪ ə r a
tentera	t̪ ə n t̪ ə r ə
tenturun	t ə n t u r o n
tenung	t̪ ə n o ŋ
tenung	t̪ ə n o̞ ŋ
tenung	t̪ ə n ʊ ŋ
tera	t e̞ ɣ ə
tera	t ə ɣ ə
terajang	t ə r ä d͡ʒ ä ŋ
terbium	t ə r b i o m
terbium	t ə r b i ə m
terburuk	t ə r b u r u ʔ
tercantik	t ə r t͡ʃ a n t i ʔ
terhad	t̪ ə r h a t̪
terjun	t̪ ə r d͡ʒ o n
terjun	t̪ ə r d͡ʒ ʊ n
terkam	t̪ ə r k ä m
ternyata	t ə ɲ a t ə
teroka	t ə r o k ə
terokai	t ə r o k a ʔ i
tertentu	t ə t ə n t u
teta	t e t ä
tiba	t i b a
tidak	t i d a ʔ
tiga	t i ɡ ə
tikar	t i k a
tikus	t i k o s
timah	t i m a h
timba	t̪ i m b a
timba	t̪ i m b ə
timbau	t̪ i m b ä u̯
tiram	t̪ i r a m
tiris	t̪ i r i s
titah	t̪ i t̪ ä h
titanium	t a i̯ t e n i ə m
titanium	t i t a n i o m
titanium	t i t a n i ə m
tldm	t̪ i e l d i e m
tnb	t̪ i e m b i
tolak	t o̞ l ä ʔ
torium	t ɔ r i o m
torium	t ɔ r i ə m
trak	t̪ r a ʔ
tua	t u ə
tua	tʷ ə
tuan	t u w a n
tuba	t u b a
tuba	t u b ə
tudm	t̪ i j u d i e m
tuil	t u e l
tuil	t u ɪ l
tujuh	t̪ u d͡ʒ o h
tujuh	t̪ u d͡ʒ u h
tukil	t̪ u k e l
tukil	t̪ u k ɪ l
tular	t u l a
tulium	t u l i o m
tulium	t u l i ə m
tumbuk	t̪ u m b o ʔ
tumbuk	t̪ u m b ʊ ʔ
tungsten	t u ŋ s t ə n
tunu	t̪ u n u
turut	t̪ u r o t̚
turut	t̪ u r ʊ t̚
u	j u
u	o
u	u
ubin	u b i n
ujian	u d͡ʒʲ ä n
ujrah	u d͡ʒ ə r a h
ujrat	u d͡ʒ ə r a t
ukm	j u k e i̯ ʔ e m
ulun	u l u n
umbut	u m b o t̚
umbut	u m b o̞ t̚
umbut	u m b ʊ t̚
ungka	u ŋ k a
universitas	u n i v ə r s i t̪ a s
universiti	j u n i v ə r s i t̪ i
upacara	u p ə t͡ʃ ä ɾ ə
uranium	j u r e n i ə m
uranium	u r a n i o m
uranium	u r a n i ə m
urdu	u r d u
urut	u r u t̪
usah	u s ä h
v	f
v	v
v	v i
vanadium	v a n a d i o m
vanadium	v a n a d i ə m
vanadium	v ə n e d i ə m
voltan	v o l t̪ a n
w	d a b l i u
w	d a b l j u
w	d a b ə l i u
w	d a b ə l j u
w	w
warganegara	w ä ɾ ɡ ə n ə ɡ ä ɾ ə
wolfram	w ɔ l f r a m
wolfram	w ɔ l f r ɛ m
x	k̚ s
x	z
x	ɛ k̚ s
xenofobia	x e n o f o b j a
xenon	z e n ɔ n
xenon	z i n ɔ n
y	j
y	w a i̯
ya	j ä
ya	j ə
yaum	j a o m
yunani	j u n a n i
z	s
z	z
z	z i
z	z ɛ k̚
z	z ɛ t̚
zamrud	z a m ɾ u d̚
zib	z e p
zigot	z i ɡ ɔ t
zink	z e ŋ k ə
zirkonium	z i r k o n i o m
zirkonium	z i r k o n i ə m
zon	z o n
ă	ə
ĕ	ə
