Афетъ	a fʲ ɛ t ʊ
Афетъ	a fʲ ɛː t
Афетъ	ɑ f ɛ t ʊ
Ватрь	ʋ a t rʲ
Ватрь	ʋ a t rʲ ɪ
Ватрь	ʋ ɑ t r ɪ
Велесъ	ʋ ɛ l ɛ s ʊ
Велесъ	ʋʲ ɛ lʲ ɛ s ʊ
Велесъ	ʋʲ ɛ lʲ ɛː s
Володимѣръ	ʋ ɔ l ɔ d i m eː r ʊ
Володимѣръ	ʋ ɔ l ɔ dʲ i mʲ eː r
Володимѣръ	ʋ ɔ l ɔ dʲ i mʲ eː r ʊ
Володимѣръ	ʋ ɔ l ɔ dʲ i mʲ ɛː r
Галичь	ɡ a lʲ i t͡ɕ
Галичь	ɡ a lʲ i t͡ɕ ɪ
Галичь	ɡ ɑ l i t͡ɕ ɪ
Игорь	j i ɡ ɔ r ɪ
Игорь	j i ɡ ɔ rʲ ɪ
Игорь	j i ɡ ɔː rʲ
Львовъ	l ɪ ʋ ɔ ʋ ʊ
Львовъ	lʲ ɪ ʋ ɔ ʋ ʊ
Львовъ	lʲ ʋ ɔː ʋ
Персида	p ɛ r s i d ɑ
Персида	pʲ ɛ r sʲ i d a
Припѧть	p r i p ɛ̃ t ɪ
Припѧть	p rʲ i pʲ a tʲ
Припѧть	p rʲ i pʲ a tʲ ɪ
Римъ	r i m ʊ
Римъ	rʲ i m
Римъ	rʲ i m ʊ
Русь	r u s ɪ
Русь	r u sʲ
Русь	r u sʲ ɪ
Симарьглъ	s i m ɑ r ɪ ɡ l ʊ
Симарьглъ	sʲ i m a rʲ ɛ ɡ l
Симарьглъ	sʲ i m a rʲ ɪ ɡ l ʊ
Симовъ	s i m ɔ ʋ ʊ
Симовъ	sʲ i m ɔ ʋ ʊ
Симовъ	sʲ i m ɔː ʋ
Симъ	s i m ʊ
Симъ	sʲ i m
Симъ	sʲ i m ʊ
Стрибогъ	s t r i b ɔ ɡ ʊ
Стрибогъ	s t rʲ i b ɔ ɡ ʊ
Стрибогъ	s t rʲ i b ɔː ɡ
Хамъ	x a m
Хамъ	x a m ʊ
Хамъ	x ɑ m ʊ
Хърсъ	x ɔ r s
Хърсъ	x ʊ r s ʊ
а	a
а	ɑ
агода	a ɡ ɔ d a
агода	ɑ ɡ ɔ d ɑ
багръ	b a ɡ r
багръ	b a ɡ r ʊ
багръ	b ɑ ɡ r ʊ
багъръ	b a ɡ ɔ r
багъръ	b a ɡ ʊ r ʊ
багъръ	b ɑ ɡ ʊ r ʊ
баранъ	b a r a n
баранъ	b a r a n ʊ
баранъ	b ɑ r ɑ n ʊ
батѧ	b a tʲ a
батѧ	b ɑ t ɛ̃
берегъ	b ɛ r ɛ ɡ ʊ
берегъ	bʲ ɛ rʲ ɛ ɡ ʊ
берегъ	bʲ ɛ rʲ ɛː ɡ
береза	b ɛ r ɛ z ɑ
береза	bʲ ɛ rʲ ɛ z a
бити	b i t i
бити	bʲ i tʲ i
блаженъ	b l a ʑ ɛ n ʊ
блаженъ	b l a ʑ ɛː n
блаженъ	b l ɑ ʑ ɛ n ʊ
бо	b ɔ
бобръ	b ɔ b r ʊ
бобръ	b ɔː b r
богъ	b ɔ ɡ ʊ
богъ	b ɔː ɡ
божьница	b ɔ ʑ ɪ n i t͡sʲ ɑ
божьница	b ɔ ʑ ɪ nʲ i t͡sʲ a
божьница	b ɔː ʑ nʲ i t͡sʲ a
бозьница	b ɔ z ɪ n i t͡sʲ ɑ
бозьница	b ɔ zʲ ɪ nʲ i t͡sʲ a
бозьница	b ɔː zʲ nʲ i t͡sʲ a
болого	b oː l ɔ ɡ ɔ
борода	b ɔ r ɔ d a
борода	b ɔ r ɔ d ɑ
бородатъ	b ɔ r ɔ d a t
бородатъ	b ɔ r ɔ d a t ʊ
бородатъ	b ɔ r ɔ d ɑ t ʊ
борьць	b ɔ r ɪ t͡sʲ ɪ
борьць	b ɔ rʲ ɛ t͡sʲ
борьць	b ɔ rʲ ɪ t͡sʲ ɪ
брада	b r a d a
брада	b r ɑ d ɑ
брадатъ	b r a d a t
брадатъ	b r a d a t ʊ
брадатъ	b r ɑ d ɑ t ʊ
братиꙗ	b r a tʲ i j a
братиꙗ	b r a tʲ j a
братиꙗ	b r a tʲ ɪ j a
братиꙗ	b r ɑ t i j ɑ
братиꙗ	b r ɑ t ɪ j ɑ
братъ	b r a t
братъ	b r a t ʊ
братъ	b r ɑ t ʊ
бързо	b ɔ r z ɔ
бързо	b ʊ r z ɔ
бързъ	b ɔ r z
бързъ	b ʊ r z ʊ
бѣгати	b eː ɡ ɑ t i
бѣгати	bʲ eː ɡ a tʲ i
бѣлъ	b eː l ʊ
бѣлъ	bʲ eː l
бѣлъ	bʲ eː l ʊ
бѣлъ	bʲ ɛː l
бѣль	b eː l ɪ
бѣль	bʲ eː lʲ
бѣль	bʲ eː lʲ ɪ
бѣль	bʲ ɛː lʲ
бѣсъ	b eː s ʊ
бѣсъ	bʲ eː s
бѣсъ	bʲ eː s ʊ
бѣсъ	bʲ ɛː s
бꙑкъ	b ɯ k
бꙑкъ	b ɯ k ʊ
бꙑти	b ɯ t i
бꙑти	b ɯ tʲ i
варѧгъ	ʋ a rʲ a ɡ
варѧгъ	ʋ a rʲ a ɡ ʊ
варѧгъ	ʋ ɑ r ɛ̃ ɡ ʊ
везти	ʋ ɛ z t i
везти	ʋʲ ɛ z tʲ i
величьѥ	ʋ ɛ l i t͡ɕ ɪ j ɛ
величьѥ	ʋʲ ɛ lʲ i t͡ɕ j ɛ
величьѥ	ʋʲ ɛ lʲ i t͡ɕ ɪ j ɛ
вельблѫдъ	ʋ ɛ l ɪ b l õ d ʊ
вельблѫдъ	ʋʲ ɛ lʲ ɪ b l u d ʊ
вельблѫдъ	ʋʲ ɛː lʲ b l u d
вельможа	ʋ ɛ l ɪ m ɔ ʑ ɑ
вельможа	ʋʲ ɛ lʲ ɪ m ɔ ʑ a
вельможа	ʋʲ ɛː lʲ m ɔ ʑ a
вепрь	ʋ ɛ p r ɪ
вепрь	ʋʲ ɛ p rʲ ɪ
вепрь	ʋʲ ɛː p rʲ
вести	ʋ ɛ s t i
вести	ʋʲ ɛ s tʲ i
вода	ʋ ɔ d a
вода	ʋ ɔ d ɑ
волосъ	ʋ ɔ l ɔ s ʊ
волосъ	ʋ ɔ l ɔː s
ворогъ	ʋ ɔ r ɔ ɡ ʊ
ворогъ	ʋ ɔ r ɔː ɡ
ворожьда	ʋ ɔ r ɔ ʑ ɪ d a
ворожьда	ʋ ɔ r ɔ ʑ ɪ d ɑ
ворожьда	ʋ ɔ r ɔː ʑ d a
врагъ	ʋ r a ɡ
врагъ	ʋ r a ɡ ʊ
врагъ	ʋ r ɑ ɡ ʊ
врѣменьнъ	ʋ r eː m ɛ n ɪ n ʊ
врѣменьнъ	ʋ rʲ eː mʲ ɛ nʲ ɛ n
врѣменьнъ	ʋ rʲ eː mʲ ɛ nʲ ɪ n ʊ
въ	ʋ
въ	ʋ ʊ
вълкъ	ʋ ɔ l k
вълкъ	ʋ ʊ l k ʊ
вълхвъ	ʋ ɔ l x ʋ
вълхвъ	ʋ ʊ l x ʋ ʊ
въстокъ	ʋ s t ɔː k
въстокъ	ʋ ʊ s t ɔ k ʊ
вьсꙗкъ	ʋ ɪ sʲ ɑ k ʊ
вьсꙗкъ	ʋʲ sʲ a k
вьсꙗкъ	ʋʲ ɪ sʲ a k ʊ
вѣра	ʋ eː r ɑ
вѣра	ʋʲ eː r a
гвоздь	ɡ ʋ ɔ z d ɪ
гвоздь	ɡ ʋ ɔ z dʲ ɪ
гвоздь	ɡ ʋ ɔː z dʲ
глава	ɡ l a ʋ a
глава	ɡ l ɑ ʋ ɑ
главизна	ɡ l a ʋʲ i z n a
главизна	ɡ l ɑ ʋ i z n ɑ
глаголати	ɡ l a ɡ ɔ l a tʲ i
глаголати	ɡ l ɑ ɡ ɔ l ɑ t i
годьнъ	ɡ ɔ d ɪ n ʊ
годьнъ	ɡ ɔ dʲ ɛ n
годьнъ	ɡ ɔ dʲ ɪ n ʊ
голосъ	ɡ ɔ l ɔ s ʊ
голосъ	ɡ ɔ l ɔː s
голѫбъ	ɡ ɔ l u b
голѫбъ	ɡ ɔ l u b ʊ
голѫбъ	ɡ ɔ l õ b ʊ
голѫбꙑи	ɡ ɔ l u b ɔ j
голѫбꙑи	ɡ ɔ l u b ɯ j
голѫбꙑи	ɡ ɔ l u b ɯ j ɪ
голѫбꙑи	ɡ ɔ l u b ʊ j ɪ
голѫбꙑи	ɡ ɔ l õ b ɯ j ɪ
голѫбꙑи	ɡ ɔ l õ b ʊ j ɪ
гора	ɡ ɔ r a
гора	ɡ ɔ r ɑ
горохъ	ɡ ɔ r oː x
горохъ	ɡ ɔ r oː x ʊ
горохъ	ɡ ɔ r ɔː x
гость	ɡ ɔ s t ɪ
гость	ɡ ɔ s tʲ ɪ
гость	ɡ ɔː s tʲ
грудьнъ	ɡ r u d ɪ n ʊ
грудьнъ	ɡ r u dʲ ɛ n
грудьнъ	ɡ r u dʲ ɪ n ʊ
гълчаниѥ	ɡ l t͡ɕ a nʲ i j ɛ
гълчаниѥ	ɡ ʊ l t͡ɕ a nʲ i j ɛ
гълчаниѥ	ɡ ʊ l t͡ɕ ɑ n i j ɛ
гълчати	ɡ l t͡ɕ a tʲ i
гълчати	ɡ ʊ l t͡ɕ a tʲ i
гълчати	ɡ ʊ l t͡ɕ ɑ t i
гълькъ	ɡ lʲ ɛ k
гълькъ	ɡ ɔ lʲ ɛ k
гълькъ	ɡ ʊ l ɪ k ʊ
гълькъ	ɡ ʊ lʲ ɪ k ʊ
гъльць	ɡ ɔ lʲ ɛ t͡sʲ
гъльць	ɡ ʊ l ɪ t͡sʲ ɪ
гъльць	ɡ ʊ lʲ ɪ t͡sʲ ɪ
двигнѫти	d ʋ i ɡ n õ t i
двигнѫти	d ʋʲ i ɡ n u tʲ i
дворъ	d ʋ oː r
дворъ	d ʋ oː r ʊ
дворъ	d ʋ ɔː r
двьрь	d ʋ ɪ r ɪ
двьрь	d ʋʲ ɛ rʲ
двьрь	d ʋʲ ɪ rʲ ɪ
дерево	d ɛ r ɛ ʋ ɔ
дерево	dʲ ɛ rʲ ɛ ʋ ɔ
до	d ɔ
добролѣпнꙑи	d ɔ b r ɔ l eː p n ɯ j i
добролѣпнꙑи	d ɔ b r ɔ lʲ eː p n ɯ j i
доброта	d ɔ b r ɔ t a
доброта	d ɔ b r ɔ t ɑ
добръ	d oː b r
добръ	d oː b r ʊ
добръ	d ɔː b r
докалѧнъ	d ɔ k a lʲ a n
докалѧнъ	d ɔ k a lʲ a n ʊ
докалѧнъ	d ɔ k ɑ l ɛ̃ n ʊ
домъ	d ɔ m ʊ
домъ	d ɔː m
достоимъ	d ɔ s t ɔ j i m
достоимъ	d ɔ s t ɔ j i m ʊ
достоинъ	d ɔ s t ɔ j i n
достоинъ	d ɔ s t ɔ j ɪ n ʊ
достоиньство	d ɔ s t ɔ j i nʲ s t ʋ ɔ
достоиньство	d ɔ s t ɔ j ɪ n ɪ s t ʋ ɔ
достоиньство	d ɔ s t ɔ j ɪ nʲ ɪ s t ʋ ɔ
достоинꙑи	d ɔ s t ɔ j i n ɯ j
достоинꙑи	d ɔ s t ɔ j ɪ n ɯ j ɪ
достоити	d ɔ s t ɔ j i t i
достоити	d ɔ s t ɔ j i tʲ i
достоканъ	d ɔ s t ɔ k a n
достоканъ	d ɔ s t ɔ k a n ʊ
достоканъ	d ɔ s t ɔ k ɑ n ʊ
другъ	d r u ɡ
другъ	d r u ɡ ʊ
дъчи	d ɔ t͡ɕ i
дъчи	d ʊ t͡ɕ i
дьнь	d ɪ n ɪ
дьнь	dʲ ɛ nʲ
дьнь	dʲ ɪ nʲ ɪ
дѣва	d eː ʋ ɑ
дѣва	dʲ eː ʋ a
дѣвица	d eː ʋ i t͡sʲ ɑ
дѣвица	dʲ eː ʋʲ i t͡sʲ a
дѣвка	d eː ʋ k ɑ
дѣвка	dʲ eː ʋ k a
дѣтѧ	d eː t ɛ̃
дѣтѧ	dʲ eː tʲ a
дꙋга	d u ɡ a
дꙋга	d u ɡ ɑ
егда	j ɛ ɡ d a
егда	j ɛ ɡ d ɑ
единъ	j ɛ d i n ʊ
единъ	j ɛ dʲ i n
единъ	j ɛ dʲ i n ʊ
жегъзулꙗ	ʑ ɛ ɡ ɔ z u lʲ a
жегъзулꙗ	ʑ ɛ ɡ ʊ z u l ɑ
жегъзулꙗ	ʑ ɛ ɡ ʊ z u lʲ a
жегъзулꙗ	ʑ ɛː ɡ z u lʲ a
желѣзо	ʑ ɛ l eː z ɔ
желѣзо	ʑ ɛ lʲ eː z ɔ
жена	ʑ ɛ n a
жена	ʑ ɛ n ɑ
женъка	ʑ ɛ n ʊ k a
женъка	ʑ ɛ n ʊ k ɑ
женъка	ʑ ɛː n k a
животъ	ʑ i ʋ oː t
животъ	ʑ i ʋ oː t ʊ
животъ	ʑ i ʋ ɔː t
жонка	ʑ ɔ n k a
жонка	ʑ ɔ n k ɑ
жьньць	ʑ nʲ ɛ t͡sʲ
жьньць	ʑ ɪ n ɪ t͡sʲ ɪ
жьньць	ʑ ɪ nʲ ɪ t͡sʲ ɪ
жьньчюгъ	ʑ ɛ n t͡ɕ u ɡ
жьньчюгъ	ʑ ɛ nʲ t͡ɕ u ɡ
жьньчюгъ	ʑ ɪ n t͡ɕ u ɡ ʊ
жьньчюгъ	ʑ ɪ n ɪ t͡ɕ u ɡ ʊ
жьньчюгъ	ʑ ɪ nʲ ɪ t͡ɕ u ɡ ʊ
звѣзда	z ʋ eː z d ɑ
звѣзда	z ʋʲ eː z d a
звѣрь	z ʋ eː r ɪ
звѣрь	z ʋʲ eː rʲ
звѣрь	z ʋʲ eː rʲ ɪ
звѣрь	z ʋʲ ɛː rʲ
землꙗ	z ɛ m lʲ ɑ
землꙗ	zʲ ɛ m lʲ a
земꙗ	z ɛ m j ɑ
земꙗ	zʲ ɛ m j a
зима	z i m ɑ
зима	zʲ i m a
змии	z m i j ɪ
змии	z m ɪ j ɪ
змии	z mʲ i j
змии	z mʲ i j ɪ
змии	z mʲ ɛ j
змии	z mʲ ɪ j ɪ
знати	z n a tʲ i
знати	z n ɑ t i
зѣница	z eː n i t͡sʲ ɑ
зѣница	zʲ eː nʲ i t͡sʲ a
и	j i
и	j ɛ
и	j ɪ
иже	j ɛ ʑ ɛ
иже	j ɪ ʑ ɛ
извлѣщи	j i z ʋ l eː ɕ t͡ɕ i
извлѣщи	j i z ʋ lʲ eː ɕ t͡ɕ i
изглаголати	j z ɡ l a ɡ ɔ l a tʲ i
изглаголати	j ɪ z ɡ l a ɡ ɔ l a tʲ i
изглаголати	j ɪ z ɡ l ɑ ɡ ɔ l ɑ t i
измѣна	j z mʲ eː n a
измѣна	j ɪ z m eː n ɑ
измѣна	j ɪ z mʲ eː n a
израда	j z r a d a
израда	j ɪ z r a d a
израда	j ɪ z r ɑ d ɑ
имѧ	j i m ɛ̃
имѧ	j i mʲ a
искони	j s k ɔ nʲ i
искони	j ɪ s k ɔ n i
искони	j ɪ s k ɔ nʲ i
истиньнъ	j ɛ s tʲ i nʲ ɛ n
истиньнъ	j ɪ s t i n ɪ n ʊ
истиньнъ	j ɪ s tʲ i nʲ ɪ n ʊ
ити	j tʲ i
ити	j ɪ t i
ити	j ɪ tʲ i
калугеръ	k a l u ɡ ɛ r ʊ
калугеръ	k a l u ɡ ɛː r
калугеръ	k ɑ l u ɡ ɛ r ʊ
камень	k a mʲ ɛ nʲ ɪ
камень	k a mʲ ɛː nʲ
камень	k ɑ m ɛ n ɪ
камꙑ	k a m ɯ
камꙑ	k ɑ m ɯ
книга	k nʲ i ɡ a
книга	k nʲ i ɡ ɑ
книжьнъ	k nʲ i ʑ ɛ n
книжьнъ	k nʲ i ʑ ɪ n ʊ
козакъ	k ɔ z a k
козакъ	k ɔ z a k ʊ
козакъ	k ɔ z ɑ k ʊ
комонь	k ɔ m ɔ nʲ ɪ
комонь	k ɔ m ɔː nʲ
конотопъ	k ɔ n ɔ t ɔ p ʊ
конотопъ	k ɔ n ɔ t ɔː p
конь	k oː nʲ
конь	k oː nʲ ɪ
конь	k ɔː nʲ
коса	k ɔ s a
коса	k ɔ s ɑ
кость	k ɔ s t ɪ
кость	k ɔ s tʲ ɪ
кость	k ɔː s tʲ
краина	k r a j i n a
краина	k r ɑ j i n ɑ
красити	k r a sʲ i tʲ i
красити	k r ɑ s i t i
крꙑ	k r ɯ
кудесникъ	k u d ɛ s n i k ʊ
кудесникъ	k u dʲ ɛ s nʲ i k
кудесникъ	k u dʲ ɛ s nʲ i k ʊ
кънига	k nʲ i ɡ a
кънига	k ʊ nʲ i ɡ a
кънига	k ʊ nʲ i ɡ ɑ
кънижьнъ	k nʲ i ʑ ɛ n
кънижьнъ	k ʊ nʲ i ʑ ɪ n ʊ
къто	k t ɔ
къто	k ʊ t ɔ
кѫду	k u d u
кѫду	k õ d u
кѫпала	k u p a l a
кѫпала	k õ p ɑ l ɑ
кѫпалиꙗ	k u p a lʲ i j a
кѫпалиꙗ	k u p a lʲ j a
кѫпалиꙗ	k u p a lʲ ɪ j a
кѫпалиꙗ	k õ p ɑ l i j ɑ
кѫпалиꙗ	k õ p ɑ l ɪ j ɑ
кѫпало	k u p a l ɔ
кѫпало	k õ p ɑ l ɔ
ледъ	l ɛ d ʊ
ледъ	lʲ ɛ d ʊ
ледъ	lʲ ɛː d
лисъ	l i s ʊ
лисъ	lʲ i s
лисъ	lʲ i s ʊ
лоша	l ɔ ɕ a
лоша	l ɔ ɕ ɑ
луна	l u n a
луна	l u n ɑ
лъжька	l ɔ ʑ k a
лъжька	l ʊ ʑ ɪ k a
лъжька	l ʊ ʑ ɪ k ɑ
любꙑ	lʲ u b ɯ
лѣсъ	l eː s ʊ
лѣсъ	lʲ eː s
лѣсъ	lʲ eː s ʊ
лѣсъ	lʲ ɛː s
лѣто	l eː t ɔ
лѣто	lʲ eː t ɔ
лѧхъ	l ɛ̃ x ʊ
лѧхъ	lʲ a x
лѧхъ	lʲ a x ʊ
мати	m a tʲ i
мати	m ɑ t i
медвѣдь	m ɛ d ʋ eː d ɪ
медвѣдь	mʲ ɛ d ʋʲ eː dʲ
медвѣдь	mʲ ɛ d ʋʲ eː dʲ ɪ
медвѣдь	mʲ ɛ d ʋʲ ɛː dʲ
медъ	m ɛ d ʊ
медъ	mʲ ɛ d ʊ
медъ	mʲ ɛː d
миръ	m i r ʊ
миръ	mʲ i r
миръ	mʲ i r ʊ
море	m ɔ rʲ ɛ
мьгла	m ɪ ɡ l ɑ
мьгла	mʲ ɡ l a
мьгла	mʲ ɪ ɡ l a
мѣсѧць	m eː s ɛ̃ t͡sʲ ɪ
мѣсѧць	mʲ eː sʲ a t͡sʲ
мѣсѧць	mʲ eː sʲ a t͡sʲ ɪ
мѫжь	m u ʑ
мѫжь	m u ʑ ɪ
мѫжь	m õ ʑ ɪ
мꙑшь	m ɯ ɕ
мꙑшь	m ɯ ɕ ɪ
не	n ɛ
не	nʲ ɛ
небо	n ɛ b ɔ
небо	nʲ ɛ b ɔ
нести	n ɛ s t i
нести	nʲ ɛ s tʲ i
нить	n i t ɪ
нить	nʲ i tʲ
нить	nʲ i tʲ ɪ
ноздророгъ	n ɔ z d r ɔ r ɔ ɡ ʊ
ноздророгъ	n ɔ z d r ɔ r ɔː ɡ
ноздрь	n o z d rʲ
ноздрь	n o z d rʲ ɪ
ноздрь	n ɔ z d r ɪ
ноздрь	n ɔ z d rʲ
ноздрь	n ɔ z d rʲ ɪ
ноздрꙗ	n ɔ z d rʲ a
ноздрꙗ	n ɔ z d rʲ ɑ
ночь	n oː t͡ɕ
ночь	n oː t͡ɕ ɪ
ночь	n ɔː t͡ɕ
нъ	n ɔ
нъ	n ʊ
нѣкꙑи	n eː k ɯ j ɪ
нѣкꙑи	nʲ eː k ɯ j
нѣкꙑи	nʲ eː k ɯ j ɪ
о	ɔ
обращати	ɔ b r a ɕ t͡ɕ a tʲ i
обращати	ɔ b r ɑ ɕ t͡ɕ ɑ t i
объ	ɔ b ʊ
объ	ɔː b
огнь	oː ɡ nʲ
огнь	oː ɡ nʲ ɪ
огнь	ɔː ɡ nʲ
озеро	ɔ z ɛ r ɔ
озеро	ɔ zʲ ɛ r ɔ
олъ	ɔ l ʊ
олъ	ɔː l
орудиѥ	ɔ r u d i j ɛ
орудиѥ	ɔ r u dʲ i j ɛ
оружиѥ	ɔ r u ʑ i j ɛ
осень	ɔ s ɛ n ɪ
осень	ɔ sʲ ɛ nʲ ɪ
осень	ɔ sʲ ɛː nʲ
островъ	ɔ s t r ɔ ʋ ʊ
островъ	ɔ s t r ɔː ʋ
отъ	ɔ t ʊ
отъ	ɔː t
отъкѫду	ɔ t ʊ k u d u
отъкѫду	ɔ t ʊ k õ d u
отъкѫду	ɔː t k u d u
отьць	ɔ t ɪ t͡sʲ ɪ
отьць	ɔ tʲ ɛ t͡sʲ
отьць	ɔ tʲ ɪ t͡sʲ ɪ
печь	p ɛ t͡ɕ ɪ
печь	pʲ ɛ t͡ɕ ɪ
печь	pʲ ɛː t͡ɕ
пизда	p i z d ɑ
пизда	pʲ i z d a
повѣсть	p ɔ ʋ eː s t ɪ
повѣсть	p ɔ ʋʲ eː s tʲ
повѣсть	p ɔ ʋʲ eː s tʲ ɪ
повѣсть	p ɔ ʋʲ ɛː s tʲ
погостъ	p ɔ ɡ ɔ s t ʊ
погостъ	p ɔ ɡ ɔː s t
поле	p ɔ lʲ ɛ
поразумѣвати	p ɔ r a z u mʲ eː ʋ a tʲ i
поразумѣвати	p ɔ r ɑ z u m eː ʋ ɑ t i
поразумѣти	p ɔ r a z u mʲ eː tʲ i
поразумѣти	p ɔ r ɑ z u m eː t i
потопъ	p ɔ t ɔ p ʊ
потопъ	p ɔ t ɔː p
почитание	p ɔ t͡ɕ i t a nʲ i j ɛ
почитание	p ɔ t͡ɕ i t a nʲ j ɛ
почитание	p ɔ t͡ɕ i t a nʲ ɪ j ɛ
почитание	p ɔ t͡ɕ i t ɑ n i j ɛ
почитание	p ɔ t͡ɕ i t ɑ n ɪ j ɛ
пътица	p tʲ i t͡sʲ a
пътица	p ʊ t i t͡sʲ ɑ
пътица	p ʊ tʲ i t͡sʲ a
пькълъ	p ɪ k ʊ l ʊ
пькълъ	pʲ k ɔ l
пькълъ	pʲ ɪ k ʊ l ʊ
пьрть	p ɪ r t ɪ
пьрть	pʲ ɛ r tʲ
пьрть	pʲ ɪ r tʲ ɪ
пѧть	p ɛ̃ t ɪ
пѧть	pʲ a tʲ
пѧть	pʲ a tʲ ɪ
разумъ	r a z u m
разумъ	r a z u m ʊ
разумъ	r ɑ z u m ʊ
разумѣвати	r a z u mʲ eː ʋ a tʲ i
разумѣвати	r ɑ z u m eː ʋ ɑ t i
разумѣти	r a z u mʲ eː tʲ i
разумѣти	r ɑ z u m eː t i
речи	r ɛ t͡ɕ i
речи	rʲ ɛ t͡ɕ i
рить	r i t ɪ
рить	rʲ i tʲ
рить	rʲ i tʲ ɪ
робѧ	r ɔ b ɛ̃
робѧ	r ɔ bʲ a
ръжь	r ɔ ʑ
ръжь	r ʊ ʑ ɪ
рѧдъ	r ɛ̃ d ʊ
рѧдъ	rʲ a d
рѧдъ	rʲ a d ʊ
рꙑба	r ɯ b a
рꙑба	r ɯ b ɑ
свекрꙑ	s ʋ ɛ k r ɯ
свекрꙑ	s ʋʲ ɛ k r ɯ
свѣтъ	s ʋ eː t ʊ
свѣтъ	s ʋʲ eː t
свѣтъ	s ʋʲ eː t ʊ
свѣтъ	s ʋʲ ɛː t
село	s ɛ l oː
село	sʲ ɛ l oː
серьга	s ɛ r ɪ ɡ ɑ
серьга	sʲ ɛ rʲ ɪ ɡ a
серьга	sʲ ɛː rʲ ɡ a
сестра	s ɛ s t r ɑ
сестра	sʲ ɛ s t r a
слава	s l a ʋ a
слава	s l ɑ ʋ ɑ
слово	s l ɔ ʋ ɔ
сльза	s l ɪ z ɑ
сльза	s lʲ z a
сльза	s lʲ ɪ z a
собака	s ɔ b a k a
собака	s ɔ b ɑ k ɑ
стогъ	s t ɔ ɡ ʊ
стогъ	s t ɔː ɡ
столъ	s t oː l
столъ	s t oː l ʊ
столъ	s t ɔː l
страна	s t r a n a
страна	s t r ɑ n ɑ
съвѣдѣтель	s ʊ ʋ eː d eː t ɛ l ɪ
съвѣдѣтель	s ʊ ʋʲ eː dʲ eː tʲ ɛ lʲ ɪ
съвѣдѣтель	s ʋʲ eː dʲ eː tʲ ɛː lʲ
съгрѣшити	s ɡ rʲ eː ɕ i tʲ i
съгрѣшити	s ʊ ɡ r eː ɕ i t i
съгрѣшити	s ʊ ɡ rʲ eː ɕ i tʲ i
съкрꙑти	s k r ɯ tʲ i
съкрꙑти	s ʊ k r ɯ t i
съкрꙑти	s ʊ k r ɯ tʲ i
сълньце	s ɔ l nʲ t͡sʲ ɛ
сълньце	s ɔ nʲ t͡sʲ ɛ
сълньце	s ʊ l n ɪ t͡sʲ ɛ
сълньце	s ʊ l nʲ ɪ t͡sʲ ɛ
съмьрть	s mʲ ɛ r tʲ
съмьрть	s ʊ m ɪ r t ɪ
съмьрть	s ʊ mʲ ɪ r tʲ ɪ
сь	s ɪ
сь	sʲ ɛ
сь	sʲ ɪ
сьрдьце	s ɪ r d ɪ t͡sʲ ɛ
сьрдьце	sʲ ɛ r dʲ t͡sʲ ɛ
сьрдьце	sʲ ɪ r dʲ ɪ t͡sʲ ɛ
сѫдъ	s u d
сѫдъ	s u d ʊ
сѫдъ	s õ d ʊ
сꙑновьство	s ɯ n ɔ ʋ ɪ s t ʋ ɔ
сꙑновьство	s ɯ n ɔ ʋʲ ɪ s t ʋ ɔ
сꙑновьство	s ɯ n ɔː ʋʲ s t ʋ ɔ
сꙑнъ	s ɯ n
сꙑнъ	s ɯ n ʊ
та	t a
та	t ɑ
телѧ	t ɛ l ɛ̃
телѧ	tʲ ɛ lʲ a
тришьдꙑ	t r i ɕ ɪ d ɯ
тришьдꙑ	t rʲ i ɕ d ɯ
тришьдꙑ	t rʲ i ɕ ɪ d ɯ
трудъ	t r u d
трудъ	t r u d ʊ
туръ	t u r
туръ	t u r ʊ
туча	t u t͡ɕ a
туча	t u t͡ɕ ɑ
търгъ	t ɔ r ɡ
търгъ	t ʊ r ɡ ʊ
тьма	t ɪ m ɑ
тьма	tʲ m a
тьма	tʲ ɪ m a
тѣло	t eː l ɔ
тѣло	tʲ eː l ɔ
тꙑкꙑ	t ɯ k ɯ
у	u
украина	u k r a j i n a
украина	u k r ɑ j i n ɑ
уста	u s t a
уста	u s t ɑ
хлѣбъ	x l eː b ʊ
хлѣбъ	x lʲ eː b
хлѣбъ	x lʲ eː b ʊ
хлѣбъ	x lʲ ɛː b
хотѣти	x ɔ t eː t i
хотѣти	x ɔ tʲ eː tʲ i
хрьстиꙗнъ	x r ɪ s t i j ɑ n ʊ
хрьстиꙗнъ	x r ɪ s t ɪ j ɑ n ʊ
хрьстиꙗнъ	x rʲ s tʲ i j a n
хрьстиꙗнъ	x rʲ ɛ s tʲ j a n
хрьстиꙗнъ	x rʲ ɪ s tʲ i j a n ʊ
хрьстиꙗнъ	x rʲ ɪ s tʲ ɪ j a n ʊ
худъ	x u d
худъ	x u d ʊ
хуи	x u j
хуи	x u j ɪ
цьркꙑ	t͡sʲ ɛ r k ɯ
цьркꙑ	t͡sʲ ɪ r k ɯ
человѣкъ	t͡ɕ ɛ l ɔ ʋ eː k ʊ
человѣкъ	t͡ɕ ɛ l ɔ ʋʲ eː k
человѣкъ	t͡ɕ ɛ l ɔ ʋʲ eː k ʊ
человѣкъ	t͡ɕ ɛ l ɔ ʋʲ ɛː k
чловѣкъ	t͡ɕ l ɔ ʋ eː k ʊ
чловѣкъ	t͡ɕ l ɔ ʋʲ eː k
чловѣкъ	t͡ɕ l ɔ ʋʲ eː k ʊ
чловѣкъ	t͡ɕ l ɔ ʋʲ ɛː k
чьрнъ	t͡ɕ ɛ r n
чьрнъ	t͡ɕ ɪ r n ʊ
чьрнь	t͡ɕ ɛ r nʲ
чьрнь	t͡ɕ ɪ r n ɪ
чьрнь	t͡ɕ ɪ r nʲ ɪ
чьсти	t͡ɕ ɛ s tʲ i
чьсти	t͡ɕ ɪ s t i
чьсти	t͡ɕ ɪ s tʲ i
чьто	t͡ɕ t ɔ
чьто	t͡ɕ ɪ t ɔ
чѧсть	t͡ɕ a s tʲ
чѧсть	t͡ɕ a s tʲ ɪ
чѧсть	t͡ɕ ɛ̃ s t ɪ
щенѧ	ɕ t͡ɕ ɛ n ɛ̃
щенѧ	ɕ t͡ɕ ɛ nʲ a
ѥжь	j ɛ ʑ ɪ
ѥжь	j ɛː ʑ
ѥти	j ɛ t i
ѥти	j ɛ tʲ i
ѩзꙑкъ	j a z ɯ k
ѩзꙑкъ	j a z ɯ k ʊ
ѩзꙑкъ	j ɛ̃ z ɯ k ʊ
ѫжь	u ʑ
ѫжь	u ʑ ɪ
ѫжь	õ ʑ ɪ
ꙗгода	j a ɡ ɔ d a
ꙗгода	j ɑ ɡ ɔ d ɑ
ꙗзъ	j a z
ꙗзъ	j a z ʊ
ꙗзъ	j ɑ z ʊ
ꙗтисѧ	j a tʲ i sʲ a
ꙗтисѧ	j ɑ t i s ɛ̃
