'day	d a ɪ̯
labong	l ɐ b o ŋ
laboratoryo	l ɐ b o ɾ ɐ t o ɾ j o
laboy	l a b o ɪ̯
labso	l ɐ b s o ʔ
labtik	l ɐ b t i k
labuyo	l ɐ b u j o ʔ
lacambra	l ɐ x a m b ɾ ɐ
lacap	l a x ɐ p
ladlad	l ɐ d l a d
ladrilyo	l ɐ d ɾ i l j o
ladya	l a d͡ʒ ɐ
ladya	l ɐ d͡ʒ a ʔ
laga	l a ɰ ɐ ʔ
lagabag	l ɐ ɰ ɐ b a ɡ
lagablab	l ɐ ɰ ɐ b l a b
lagabog	l ɐ ɰ ɐ b o ɡ
lagak	l ɐ ɰ a k
lagaklak	l ɐ ɰ ɐ k l a k
lagalag	l ɐ ɰ a l ɐ ɡ
lagalag	l ɐ ɰ ɐ l a ɡ
laganap	l ɐ ɰ a n ɐ p
laganas	l ɐ ɰ ɐ n a s
lagap	l ɐ ɰ a p
lagapak	l ɐ ɰ ɐ p a k
lagari	l ɐ ɰ a ɾ ɪ ʔ
lagari	l ɐ ɰ ɐ ɾ i ʔ
lagas	l a ɰ ɐ s
lagas	l ɐ ɰ a s
lagasaw	l ɐ ɰ ɐ s a ʊ̯
lagaslas	l ɐ ɰ ɐ s l a s
lagay	l ɐ ɰ a ɪ̯
lagayan	l a ɰ a j ɐ n
lagayan	l ɐ ɰ ɐ j a n
lagaylay	l ɐ ɰ a ɪ̯ l a ɪ̯
lagda	l ɐ ɡ d a ʔ
lagdameo	l ɐ ɡ d a m e o
lagi	l a ɰ ɪ
lagi	l a ɰ ɪ ʔ
lagibas	l ɐ ɰ ɪ b a s
lagikway	l ɐ ɰ ɪ k w a ɪ̯
lagim	l ɐ ɰ i m
laginit	l ɐ ɰ ɪ n i t
lagis	l ɐ ɰ i s
lagislis	l ɐ ɰ ɪ s l i s
lagitik	l ɐ ɰ ɪ t i k
lagitlit	l ɐ ɰ ɪ t l i t
lagkit	l ɐ ɡ k i t
laglag	l ɐ ɡ l a ɡ
lagmak	l ɐ ɡ m a k
lagmay	l a ɡ m a ɪ̯
lagnat	l ɐ ɡ n a t
lagnatin	l a ɡ n a t ɪ n
lagnatin	l ɐ ɡ n ɐ t i n
lago	l a ɰ o
lago	l ɐ ɰ o ʔ
lagod	l a ɰ o d
lagod	l ɐ ɰ o d
lagok	l ɐ ɰ o k
lagom	l a ɰ o m
lagong	l a ɰ o ŋ
lagos	l ɐ ɰ o s
lagot	l ɐ ɰ o t
lagpak	l ɐ ɡ p a k
lagpas	l ɐ ɡ p a s
lagsang	l ɐ ɡ s a ŋ
lagumba	l ɐ ɰ u m b a
lagumlalangin	l ɐ ɰ ʊ m l a l a ŋ ɪ n
lagumlalangin	l ɐ ɰ ʊ m l ɐ l ɐ ŋ i n
laguna	l ɐ ɰ u n ɐ
lagundi	l ɐ ɰ ʊ n d i ʔ
lagusan	l a ɰ u s ɐ n
lagusan	l ɐ ɰ ʊ s a n
laguslos	l ɐ ɰ ʊ s l o s
lagutok	l ɐ ɰ ʊ t o k
laguyo	l ɐ ɰ u j o ʔ
lagwat	l ɐ ɡ w a t
lagwerta	l ɐ ɡ w e ɾ t ɐ
lagyo	l ɐ ɡ j o ʔ
lahad	l a h ɐ d
lahad	l ɐ h a d
lahat	l ɐ h a t
lahi	l a h ɪ ʔ
lahid	l a h ɪ d
lahok	l ɐ h o k
lahoy	l a h o ɪ̯
lain	l a ɪ̯ n
laing	l a ʔ ɪ ŋ
laing	l ɐ ʔ i ŋ
lait	l a ʔ ɪ t
laitin	l ɐ ʔ i t ɪ n
lakad	l a x ɐ d
lakad	l ɐ x a d
lakambini	l ɐ x ɐ m b i n ɪ
lakan	l a x ɐ n
lakan	l ɐ x a n
lakandiwa	l ɐ x ɐ n d i w ɐ ʔ
lakansugo	l ɐ x ɐ n s u ɰ o ʔ
lakas	l ɐ x a s
lakatan	l ɐ x ɐ t a n
lakbay	l ɐ k b a ɪ̯
lakdang	l ɐ k d a ŋ
lakdaw	l ɐ k d a ʊ̯
lakdawkaphay	l ɐ k d a ʊ̯ x ɐ p h a ɪ̯
lakdawyugto	l ɐ k d a ʊ̯ j ʊ ɡ t o ʔ
lakhan	l ɐ k h a n
laki	l ɐ x i
lakihan	l ɐ x ɪ h a n
lakip	l a x ɪ p
lakip	l ɐ x i p
lakit	l a x ɪ t
laklak	l ɐ k l a k
lako	l a x o ʔ
lako	l ɐ x o
laksa	l ɐ k s a
laksa	l ɐ k s a ʔ
laksante	l ɐ k s a n t e
laksatiba	l ɐ k s ɐ t i b ɐ
laktaw	l ɐ k t a ʊ̯
laktosa	l ɐ k t o s ɐ
lakwatsa	l ɐ k w a t͡ʃ ɐ
lakwatsera	l ɐ k w ɐ t͡ʃ e ɾ ɐ
lakwatsero	l ɐ k w ɐ t͡ʃ e ɾ o
lala	l a l ɐ
lala	l a l ɐ ʔ
lala	l ɐ l a
lala	l ɐ l a ʔ
lalab	l a l ɐ b
lalaban	l ɐ l a b ɐ n
lalad	l ɐ l a d
lalagukan	l ɐ l ɐ ɰ u x ɐ n
lalagukan	l ɐ l ɐ ɰ ʊ x a n
lalagyan	l a l ɐ ɡ j a n
lalagyan	l ɐ l ɐ ɡ j a n
lalaki	l ɐ l a x ɪ
lalaki	l ɐ l ɐ x i
lalamunan	l ɐ l ɐ m u n ɐ n
lalan	l ɐ l a n
lalang	l ɐ l a ŋ
lalanghutan	l ɐ l ɐ ŋ h u t ɐ n
lalanghutan	l ɐ l ɐ ŋ h ʊ t a n
lalawigan	l ɐ l ɐ w i ɰ ɐ n
lalay	l ɐ l a ɪ̯
lali	l a l ɪ
lalik	l a l ɪ k
lalim	l a l ɪ m
lalin	l a l ɪ n
lam	l ɐ m
lamad	l a m ɐ d
laman	l ɐ m a n
lamang	l a m ɐ ŋ
lamang	l ɐ m a ŋ
lamas	l a m ɐ s
lamas	l ɐ m a s
lamasin	l ɐ m a s ɪ n
lamat	l a m ɐ t
lamay	l a m a ɪ̯
lamba	l ɐ m b a
lamba	l ɐ m b a ʔ
lambak	l ɐ m b a k
lambal	l ɐ m b a l
lambang	l ɐ m b a ŋ
lambanog	l ɐ m b a n o ɡ
lambanog	l ɐ m b ɐ n o ɡ
lambat	l ɐ m b a t
lambayog	l ɐ m b a j o ɡ
lambi	l ɐ m b i ʔ
lambing	l ɐ m b i ŋ
lambitin	l ɐ m b i t ɪ n
lambo	l ɐ m b o
lambo	l ɐ m b o ʔ
lambot	l ɐ m b o t
lamesa	l ɐ m e s ɐ
lamesita	l ɐ m e s i t ɐ
lamig	l ɐ m i ɡ
lamira	l ɐ m i ɾ ɐ ʔ
lamira	l ɐ m ɪ ɾ a ʔ
lamog	l ɐ m o ɡ
lamok	l ɐ m o k
lampa	l ɐ m p a
lampara	l a m p ɐ ɾ a
lampas	l ɐ m p a s
lampaso	l ɐ m p a s o
lampik	l ɐ m p i k
lampin	l ɐ m p i n
lamuga	l ɐ m u ɰ ɐ ʔ
lamukos	l ɐ m u x o s
lamukos	l ɐ m ʊ x o s
lamuymoy	l ɐ m ʊ ɪ m o ɪ̯
lamyerda	l ɐ m j e ɾ d ɐ
lana	l a n ɐ
lanab	l a n ɐ b
lanao	l a n a ʊ̯
lanap	l a n ɐ p
lanap	l ɐ n a p
lanaw	l a n a ʊ̯
lanaw	l ɐ n a ʊ̯
lanay	l a n a ɪ̯
lanay	l ɐ n a ɪ̯
landa	l ɐ n d a
landas	l a n d ɐ s
landas	l ɐ n d a s
landi	l ɐ n d i ʔ
landit	l ɐ n d i t
landrito	l ɐ n d ɾ i t o
lang	l ɐ ŋ
langal	l ɐ ŋ a l
langaray	l ɐ ŋ a ɾ a ɪ̯
langasngas	l ɐ ŋ ɐ s ŋ a s
langaw	l a ŋ a ʊ̯
langayak	l ɐ ŋ ɐ j a k
langgam	l ɐ ŋ ɡ a m
langgas	l ɐ ŋ ɡ a s
langgotse	l ɐ ŋ ɡ o t͡ʃ e
langhap	l ɐ ŋ h a p
langhapan	l ɐ ŋ h a p ɐ n
langib	l ɐ ŋ i b
langil	l a ŋ ɪ l
langis	l ɐ ŋ i s
langit	l a ŋ ɪ t
langitngit	l ɐ ŋ ɪ t ŋ i t
langka	l ɐ ŋ k a ʔ
langkaan	l ɐ ŋ k a ʔ ɐ n
langkal	l ɐ ŋ k a l
langkap	l ɐ ŋ k a p
langkas	l ɐ ŋ k a s
langkaw	l ɐ ŋ k a ʊ̯
langkay	l ɐ ŋ k a ɪ̯
langkayan	l ɐ ŋ k a j ɐ n
langlang	l ɐ ŋ l a ŋ
lango	l ɐ ŋ o
langoy	l ɐ ŋ o ɪ̯
langyot	l ɐ ŋ j o t
lanip	l a n ɪ p
lanlan	l ɐ n l a n
lansa	l a n s ɐ
lansa	l ɐ n s a
lansang	l ɐ n s a ŋ
lansangan	l ɐ n s a ŋ ɐ n
lansina	l ɐ n s i n ɐ ʔ
lansones	l ɐ n s o n e s
lanta	l ɐ n t a
lantad	l ɐ n t a d
lantak	l ɐ n t a k
lantaka	l ɐ n t a x ɐ ʔ
lantana	l ɐ n t a n ɐ ʔ
lantay	l ɐ n t a ɪ̯
lanting	l a n t ɪ ŋ
lanting	l ɐ n t i ŋ
lantod	l ɐ n t o d
lantong	l ɐ n t o ŋ
lantot	l ɐ m b i ŋ
lantsa	l a n t͡ʃ ɐ
lantutay	l ɐ n t u t a ɪ̯
lanubo	l ɐ n u b o ʔ
lanunab	l ɐ n u n ɐ b
lanuza	l ɐ n u s ɐ
lao	l a ʊ̯
laoag	l ɐ w a ɡ
laog	l ɐ ʔ o ɡ
laon	l ɐ ʔ o n
laos	l ɐ ʔ o s
lapad	l a p ɐ d
lapad	l ɐ p a d
lapag	l ɐ p a ɡ
lapas	l ɐ p a s
lapastangan	l ɐ p ɐ s t a ŋ ɐ n
lapat	l a p ɐ t
lapat	l ɐ p a t
lapay	l a p a ɪ̯
lapay	l ɐ p a ɪ̯
lapi	l a p ɪ ʔ
lapida	l a p ɪ d a
lapig	l a p ɪ ɡ
laping	l ɐ p i ŋ
lapirot	l ɐ p i ɾ o t
lapirot	l ɐ p ɪ ɾ o t
lapis	l a p ɪ s
lapisa	l ɐ p ɪ s a ʔ
lapit	l a p ɪ t
lapit	l ɐ p i t
laplap	l ɐ p l a p
lapnis	l ɐ p n i s
lapnit	l ɐ p n i t
lapnos	l ɐ p n o s
lapok	l ɐ p o k
lapulapu	l a p ʊ l a p ʊ
lapurit	l ɐ p u ɾ ɪ t
lapurit	l ɐ p ʊ ɾ i t
lapuz	l a p ʊ s
lapya	l ɐ p j a ʔ
lapyad	l ɐ p j a d
laquindanum	l ɐ x ɪ n d a n ʊ m
larang	l a ɾ ɐ ŋ
larangan	l ɐ ɾ a ŋ ɐ n
larawan	l ɐ ɾ a w ɐ n
laray	l a ɾ a ɪ̯
larga	l a ɾ ɡ ɐ
larga	l ɐ ɾ ɡ a
laris	l ɐ ɾ i s
laro	l ɐ ɾ o
laro	l ɐ ɾ o ʔ
larot	l ɐ ɾ o t
laroy	l a ɾ o ɪ̯
laroy	l ɐ ɾ o ɪ̯
laruan	l a ɾ ʊ ʔ a n
laruan	l ɐ ɾ ʊ ʔ a n
laryo	l ɐ ɾ j o
lasa	l a s ɐ
lasa	l a s ɐ ʔ
lasa	l ɐ s a ʔ
lasak	l a s ɐ k
lasak	l ɐ s a k
lasap	l ɐ s a p
lasaw	l a s a ʊ̯
lasaw	l ɐ s a ʊ̯
lascano	l ɐ s k a n o
lasenggera	l ɐ s e ŋ ɡ e ɾ ɐ
lasenggero	l ɐ s e ŋ ɡ e ɾ o
lasenggo	l ɐ s e ŋ ɡ o
lasgas	l ɐ s ɡ a s
lasing	l ɐ s i ŋ
lasinggera	l ɐ s ɪ ŋ ɡ e ɾ ɐ
lasinggero	l ɐ s ɪ ŋ ɡ e ɾ o
laskuta	l ɐ s k u t ɐ ʔ
laslas	l ɐ s l a s
laso	l ɐ s o ʔ
lasog	l ɐ s o ɡ
laspag	l ɐ s p a ɡ
lastag	l ɐ s t a ɡ
lastay	l ɐ s t a ɪ̯
lastiko	l a s t ɪ x o
lasuna	l ɐ s ʊ n a ʔ
lasunin	l ɐ s u n ɪ n
laswa	l ɐ s w a ʔ
lata	l a t ɐ
lata	l ɐ t a ʔ
latag	l a t ɐ ɡ
latag	l ɐ t a ɡ
latak	l a t ɐ k
latak	l ɐ t a k
latay	l a t a ɪ̯
latayan	l ɐ t a j ɐ n
lathala	l ɐ t h a l ɐ ʔ
lathala	l ɐ t h ɐ l a ʔ
lati	l a t ɪ ʔ
latigo	l a t ɪ ɰ o
latik	l ɐ t i k
latin	l ɐ t i n
latitud	l ɐ t ɪ t u d
latok	l ɐ t o k
latundan	l ɐ t ʊ n d a n
lauriat	l o ɾ j ɐ t
lawa	l a w ɐ ʔ
lawaan	l ɐ w a ʔ ɐ n
lawaan	l ɐ w ɐ ʔ a n
lawak	l a w ɐ k
laway	l a w a ɪ̯
laway	l ɐ w a ɪ̯
lawi	l ɐ w i
lawig	l a w ɪ ɡ
lawig	l ɐ w i ɡ
lawin	l a w ɪ n
lawing	l ɐ w i ŋ
lawit	l a w ɪ t
lawit	l ɐ w i t
lawlaw	l a ʊ̯ l a ʊ̯
laxamana	l ɐ k s ɐ m a n ɐ
laya	l a j ɐ
laya	l a j ɐ ʔ
laya	l ɐ j a ʔ
layag	l a j ɐ ɡ
layag	l ɐ j a ɡ
layak	l ɐ j a k
layas	l a j ɐ s
layas	l ɐ j a s
layaw	l a j a ʊ̯
layaw	l ɐ j a ʊ̯
laygo	l a ɪ̯ ɰ o
laylay	l a ɪ̯ l a ɪ̯
laylayan	l a ɪ̯ l a j ɐ n
laylo	l a ɪ̯ l o
layno	l a ɪ̯ n o
layo	l ɐ j o ʔ
layon	l ɐ j o n
layter	l a ɪ̯ t e ɾ
lazarte	l ɐ s a ɾ t e
lazatin	l ɐ s a t ɪ n
lebadura	l e b ɐ d u ɾ ɐ
lechias	l e t͡ʃ i ɐ s
lee	l ɪ
legal	l e ɰ a l
legalidad	l e ɰ ɐ l ɪ d a d
legazpi	l e ɰ a s p ɪ
legwas	l e ɡ w ɐ s
lehislasyon	l e h ɪ s l ɐ ʃ o n
lehislatura	l e h ɪ s l ɐ t u ɾ ɐ
lehitimo	l e h i t ɪ m o
lehiya	l e h i ɐ
lehiya	l e h ɪ a
leksikograpiko	l e k s ɪ x o ɡ ɾ a p ɪ x o
leksikograpiya	l e k s ɪ x o ɡ ɾ ɐ p i ɐ
leksikograpo	l e k s ɪ x o ɡ ɾ ɐ p o
leksiyon	l e k ʃ o n
leksiyon	l ɪ k ʃ o n
lelang	l e l ɐ ŋ
lemur	l e m ʊ ɾ
lengguwahe	l e ŋ ɡ w ɐ h e
lentehas	l e n t e h ɐ s
lesbiyana	l e s b j ɐ n ɐ
lesbyana	l e s b j ɐ n ɐ
lespu	l e s p ʊ
letmaku	l e t m ɐ x u
letra	l e t ɾ ɐ
letsugas	l e t͡ʃ u ɰ ɐ s
leung	l j ʊ ŋ
leynes	l e ɪ̯ n e s
leyte	l e ɪ̯ t e
li	l ɪ
libag	l ɪ b a ɡ
libak	l ɪ b a k
liban	l i b ɐ n
liban	l ɪ b a n
libang	l ɪ b a ŋ
libano	l i b ɐ n o
libay	l ɪ b a ɪ̯
liberal	l ɪ b e ɾ a l
liberalisasyon	l ɪ b e ɾ ɐ l ɪ s ɐ ʃ o n
liberasyon	l ɪ b e ɾ ɐ ʃ o n
libid	l i b ɪ d
libid	l ɪ b i d
libing	l ɪ b i ŋ
libingan	l i b i ŋ ɐ n
libingan	l ɪ b ɪ ŋ a n
libis	l ɪ b i s
liblib	l ɪ b l i b
libot	l ɪ b o t
libra	l i b ɾ ɐ
libradilla	l ɪ b ɾ ɐ d i l l ɐ
libre	l ɪ b ɾ e
libro	l ɪ b ɾ o
libtos	l ɪ b t o s
libumbon	l ɪ b u m b o n
libuntaon	l i b ʊ n t ɐ ʔ o n
libya	l i b j ɐ
lichauco	l ɪ t͡ʃ a ʊ̯ x o
licup	l i x ʊ p
liderato	l ɪ d e ɾ a t o
liga	l i ɰ ɐ
ligalig	l ɪ ɰ a l ɪ ɡ
ligalig	l ɪ ɰ ɐ l i ɡ
ligamento	l ɪ ɰ ɐ m e n t o
ligamgam	l ɪ ɰ ɐ m ɡ a m
ligao	l ɪ ɰ a ʊ̯
ligat	l i ɰ ɐ t
ligata	l ɪ ɰ a t ɐ ʔ
ligaw	l i ɰ a ʊ̯
ligaw	l ɪ ɰ a ʊ̯
ligawgaw	l ɪ ɰ a ʊ̯ ɰ a ʊ̯
ligaya	l ɪ ɰ a j ɐ
ligid	l i ɰ ɪ d
ligid	l ɪ ɰ i d
ligis	l ɪ ɰ i s
ligo	l i ɰ o ʔ
ligo	l ɪ ɰ o
ligo	l ɪ ɰ o ʔ
ligoy	l i ɰ o ɪ̯
ligpit	l ɪ ɡ p i t
ligpitin	l ɪ ɡ p ɪ t i n
ligta	l ɪ ɡ t a ʔ
ligtas	l ɪ ɡ t a s
ligwak	l ɪ ɡ w a k
ligwan	l ɪ ɡ w a n
liha	l i h ɐ
liha	l i h ɐ ʔ
liha	l ɪ h a
liham	l i h ɐ m
lihi	l ɪ h i
lihi	l ɪ h i ʔ
lihim	l i h ɪ m
lihim	l ɪ h i m
lihis	l ɪ h i s
lihiya	l ɪ h i ɐ
lihiya	l ɪ h ɪ a
lihukan	l i h u x ɐ n
liig	l ɪ ʔ i ɡ
liing	l ɪ ʔ i ŋ
liit	l ɪ ʔ i t
likas	l i x ɐ s
likas	l ɪ x a s
likat	l ɪ x a t
likaw	l i x a ʊ̯
likaw	l ɪ x a ʊ̯
likha	l ɪ k h a
likha	l ɪ k h a ʔ
likido	l i x ɪ d o
liknayan	l ɪ k n a j ɐ n
liko	l ɪ x o ʔ
likod	l ɪ x o d
likom	l i x o m
likom	l ɪ x o m
likop	l i x o p
likop	l ɪ x o p
likot	l ɪ x o t
liksi	l ɪ k s i ʔ
likuran	l ɪ x ʊ ɾ a n
lila	l i l ɐ
lila	l i l ɐ ʔ
lilik	l i l ɪ k
lilim	l i l ɪ m
liling	l i l ɪ ŋ
lilip	l i l ɪ p
lilip	l ɪ l i p
lilok	l ɪ l o k
lima	l ɪ m a
limahi	l ɪ m a h ɪ ʔ
limahi	l ɪ m ɐ h i ʔ
limahid	l ɪ m a h ɪ d
limahid	l ɪ m ɐ h i d
limampu	l ɪ m ɐ m p u ʔ
limandaan	l ɪ m ɐ n d ɐ ʔ a n
limanlaksa	l ɪ m ɐ n l ɐ k s a ʔ
limas	l ɪ m a s
limatik	l ɪ m a t ɪ k
limatik	l ɪ m ɐ t i k
limay	l i m a ɪ̯
limay	l ɪ m a ɪ̯
limbag	l ɪ m b a ɡ
limbaga	l ɪ m b a ɰ ɐ
limbay	l ɪ m b a ɪ̯
limi	l i m ɪ
limi	l i m ɪ ʔ
limi	l ɪ m i ʔ
limit	l i m ɪ t
limita	l ɪ m ɪ t a
limitado	l ɪ m ɪ t a d o
limitasyon	l ɪ m ɪ t ɐ ʃ o n
limjoco	l ɪ m d͡ʒ o x o
limlim	l ɪ m l i m
limon	l ɪ m o n
limonada	l ɪ m o n a d ɐ
limonsito	l ɪ m o n s i t o
limos	l ɪ m o s
limot	l ɪ m o t
limpa	l ɪ m p a ʔ
limpak	l ɪ m p a k
limpal	l ɪ m p a l
limpik	l ɪ m p i k
limsiha	l ɪ m s i h ɐ ʔ
limusina	l ɪ m ʊ s i n ɐ
linab	l ɪ n a b
linang	l ɪ n a ŋ
linatoc	l ɪ n a t o k
linatsay	l ɪ n ɐ t͡ʃ a ɪ̯
linaw	l i n a ʊ̯
linay	l i n a ɪ̯
linay	l ɪ n a ɪ̯
lindayag	l ɪ n d a j ɐ ɡ
lindol	l ɪ n d o l
lindulin	l ɪ n d ʊ l i n
linga	l i ŋ ɐ ʔ
linga	l ɪ ŋ a
linga	l ɪ ŋ a ʔ
lingad	l i ŋ ɐ d
lingaw	l i ŋ a ʊ̯
lingaw	l ɪ ŋ a ʊ̯
lingawngaw	l ɪ ŋ a ʊ̯ ŋ a ʊ̯
linggal	l ɪ ŋ ɡ a l
linggatong	l ɪ ŋ ɡ a t o ŋ
linggaw	l ɪ ŋ ɡ a ʊ̯
linggi	l ɪ ŋ ɡ i ʔ
linggit	l ɪ ŋ ɡ i t
linggo	l ɪ ŋ ɡ o
lingguwista	l ɪ ŋ ɡ w ɪ s t ɐ
lingguwistika	l ɪ ŋ ɡ w i s t ɪ x a
lingid	l ɪ ŋ i d
lingil	l i ŋ ɪ l
lingil	l ɪ ŋ i l
lingindayat	l ɪ ŋ i n d ɐ j a t
lingindayat	l ɪ ŋ ɪ n d a j ɐ t
lingkaw	l ɪ ŋ k a ʊ̯
lingkod	l ɪ ŋ k o d
lingming	l ɪ ŋ m i ŋ
lingo	l ɪ ŋ o
lingon	l ɪ ŋ o n
linib	l ɪ n i b
linis	l i n ɪ s
linis	l ɪ n i s
linisan	l ɪ n i s ɐ n
linisan	l ɪ n ɪ s a n
linisin	l ɪ n i s ɪ n
linisin	l ɪ n ɪ s i n
linlang	l ɪ n l a ŋ
linsil	l ɪ n s i l
linta	l ɪ n t a ʔ
lintik	l ɪ n t i k
lintos	l ɪ n t o s
linuknok	l ɪ n ʊ k n o k
linya	l i ɲ ɐ
lipa	l i p ɐ ʔ
lipa	l ɪ p a
lipad	l ɪ p a d
lipak	l ɪ p a k
lipana	l ɪ p a n ɐ ʔ
lipas	l i p ɐ s
lipas	l ɪ p a s
lipat	l i p ɐ t
lipi	l i p ɪ ʔ
lipit	l i p ɪ t
lipol	l ɪ p o l
lipot	l ɪ p o t
lipstik	l i p s t ɪ k
lipumpon	l ɪ p u m p o n
lipunan	l i p u n ɐ n
lipunan	l ɪ p ʊ n a n
lipya	l ɪ p j a ʔ
liquigan	l ɪ x i ɰ ɐ n
lira	l i ɾ ɐ
lira	l i ɾ ɐ ʔ
lirot	l ɪ ɾ o t
lisa	l ɪ s a ʔ
lisan	l i s ɐ n
lisensiya	l ɪ s e n ʃ a
lisensiyado	l ɪ s e n ʃ ɐ d o
lising	l i s ɪ ŋ
lislis	l ɪ s l i s
liso	l ɪ s o
liso	l ɪ s o ʔ
lisok	l ɪ s o k
lista	l i s t ɐ
lista	l ɪ s t a
listahan	l ɪ s t a h ɐ n
listahan	l ɪ s t ɐ h a n
listo	l ɪ s t o
litak	l ɪ t a k
litang	l ɪ t a ŋ
litas	l i t ɐ s
litaw	l ɪ t a ʊ̯
literal	l ɪ t e ɾ a l
literasiya	l ɪ t e ɾ ɐ s i ɐ
literasya	l ɪ t e ɾ a ʃ ɐ
literatura	l ɪ t e ɾ ɐ t u ɾ ɐ
litid	l i t ɪ d
litigante	l ɪ t ɪ ɰ a n t e
litigasyon	l ɪ t ɪ ɰ ɐ ʃ o n
litik	l i t ɪ k
litis	l i t ɪ s
litograpiya	l ɪ t o ɡ ɾ ɐ p i ɐ
litratista	l ɪ t ɾ ɐ t i s t ɐ
litrato	l ɪ t ɾ a t o
litsiyas	l ɪ t͡ʃ i ɐ s
litson	l ɪ t͡ʃ o n
liturhiya	l ɪ t u ɾ h ɪ a
litwanya	l ɪ t w a ɲ ɐ
lityo	l i t͡ʃ o
liwag	l i w ɐ ɡ
liwaliw	l ɪ w ɐ l i ʊ̯
liwanag	l ɪ w a n ɐ ɡ
liwas	l i w ɐ s
liwas	l ɪ w a s
liwat	l i w ɐ t
liway	l ɪ w a ɪ̯
liwayway	l ɪ w a ɪ̯ w a ɪ̯
liya	l i ɐ ʔ
liya	l j a ʔ
liyab	l j a b
liyama	l j ɐ m ɐ
liyamado	l ɪ ɐ m a d o
liyempo	l j e m p o
lizada	l ɪ s a d ɐ
llanera	l l ɐ n e ɾ ɐ
loa	l o ʔ ɐ
lodi	l o d ɪ
logarta	l o ɰ a ɾ t ɐ
logo	l o ɰ o
lohika	l o h ɪ x a
lohikal	l o h ɪ x a l
lohiko	l o h ɪ x o
lohuwa	l o h ʊ a
loka	l o x ɐ
lokal	l o x a l
lokalidad	l o x ɐ l ɪ d a d
loko	l o x o
lola	l o l ɐ
lolipap	l o l ɪ p a p
lomi	l o m ɪ
lomibao	l o m i b a ʊ̯
lona	l o n ɐ
longganisa	l o ŋ ɡ ɐ n i s ɐ
longhitud	l o ŋ h ɪ t u d
lonta	l o n t ɐ
loo	l ʊ
loobkaphay	l o ʔ o b k ɐ p h a ɪ̯
lorenzana	l o ɾ e n s a n ɐ
loryat	l o ɾ j ɐ t
losyon	l o ʃ o n
loteriya	l o t e ɾ i ɐ
loterya	l o t e ɾ j ɐ
lowat	l o w ɐ t
lozada	l o s a d ɐ
lu	l ʊ
luad	l ʊ ʔ a d
lubak	l u b ɐ k
lubak	l ʊ b a k
lubang	l u b ɐ ŋ
lubay	l ʊ b a ɪ̯
lubha	l ʊ b h a ʔ
lubiano	l ʊ b j a n o
lubid	l u b ɪ d
lubid	l ʊ b i d
lubig	l ʊ b i ɡ
lubigan	l ʊ b i ɰ ɐ n
lubigan	l ʊ b ɪ ɰ a n
lublob	l ʊ b l o b
lubo	l ʊ b o
lubo	l ʊ b o ʔ
lubog	l ʊ b o ɡ
lubos	l ʊ b o s
lubot	l ʊ b o t
lubyak	l ʊ b j a k
lucena	l ʊ s e n ɐ
lucy	l ʊ s ɪ
luga	l u ɰ ɐ ʔ
lugami	l ʊ ɰ a m ɪ ʔ
lugami	l ʊ ɰ ɐ m i ʔ
luganggang	l ʊ ŋ ɡ ɐ ɰ a ŋ
lugar	l ʊ ɰ a ɾ
lugas	l ʊ ɰ a s
lugaw	l u ɰ a ʊ̯
lugaw	l ʊ ɰ a ʊ̯
lugay	l u ɰ a ɪ̯
lugay	l ʊ ɰ a ɪ̯
lugi	l u ɰ ɪ
lugi	l u ɰ ɪ ʔ
lugit	l u ɰ ɪ t
luglog	l ʊ ɡ l o ɡ
lugmok	l ʊ ɡ m o k
lugnas	l ʊ ɡ n a s
lugo	l ʊ ɰ o
lugod	l ʊ ɰ o d
lugot	l u ɰ o t
lugot	l ʊ ɰ o t
lugpo	l ʊ ɡ p o ʔ
lugso	l ʊ ɡ s o ʔ
luha	l u h ɐ ʔ
luhod	l ʊ h o d
luhuran	l u h u ɾ ɐ n
luhuran	l ʊ h ʊ ɾ a n
lukba	l ʊ k b a ʔ
lukban	l u k b ɐ n
lukban	l ʊ k b a n
lukbot	l ʊ k b o t
lukemya	l ʊ x e m j ɐ
luklok	l ʊ k l o k
luklukan	l ʊ k l u x ɐ n
luklukan	l ʊ k l ʊ x a n
luko	l u x o
luko	l ʊ x o ʔ
lukob	l u x o b
lukob	l ʊ x o b
lukong	l ʊ x o ŋ
lukot	l u x o t
lukot	l ʊ x o t
luksa	l ʊ k s a ʔ
luksemburgo	l ʊ k s e m b u ɾ ɡ o
lukso	l ʊ k s o
lukto	l ʊ k t o ʔ
lukton	l ʊ k t o n
lukulok	l ʊ x ʊ l o k
lukutan	l ʊ x u t ɐ n
lula	l u l ɐ ʔ
lula	l ʊ l a ʔ
lulan	l u l ɐ n
lulay	l u l a ɪ̯
lulod	l ʊ l o d
lulon	l ʊ l o n
lulong	l ʊ l o ŋ
lulot	l ʊ l o t
luma	l u m ɐ ʔ
luma	l ʊ m a
lumabag	l ʊ m ɐ b a ɡ
lumaban	l ʊ m a b ɐ n
lumabas	l ʊ m ɐ b a s
lumabo	l ʊ m a b o ʔ
lumabo	l ʊ m ɐ b o
lumad	l u m ɐ d
lumagui	l ʊ m a ɰ ɪ
lumakad	l ʊ m a x ɐ d
lumakas	l ʊ m ɐ x a s
lumakdang	l ʊ m ɐ k d a ŋ
lumaki	l ʊ m ɐ x i
lumalaban	l ʊ m ɐ l a b ɐ n
lumambitin	l ʊ m ɐ m b i t ɪ n
lumamig	l ʊ m ɐ m i ɡ
lumanay	l ʊ m a n a ɪ̯
lumanglas	l ʊ m a ŋ l ɐ s
lumangoy	l ʊ m ɐ ŋ o ɪ̯
lumapastangan	l ʊ m ɐ p ɐ s t a ŋ ɐ n
lumapirot	l ʊ m ɐ p ɪ ɾ o t
lumapit	l ʊ m a p ɪ t
lumay	l u m a ɪ̯
lumay	l ʊ m a ɪ̯
lumaya	l ʊ m a j ɐ ʔ
lumayas	l ʊ m a j ɐ s
lumayo	l ʊ m a j o ʔ
lumayo	l ʊ m ɐ j o ʔ
lumbang	l u m b ɐ ŋ
lumbao	l u m b a ʊ̯
lumbay	l u m b a ɪ̯
lumboy	l u m b o ɪ̯
lumi	l u m ɪ ʔ
lumi	l ʊ m i ʔ
lumibao	l ʊ m i b a ʊ̯
lumigwak	l ʊ m ɪ ɡ w a k
lumihis	l ʊ m ɪ h i s
lumiit	l ʊ m ɪ ʔ i t
lumikha	l ʊ m ɪ k h a ʔ
luminaw	l ʊ m i n a ʊ̯
lumindol	l ʊ m ɪ n d o l
luminis	l ʊ m i n ɪ s
lumipad	l ʊ m ɪ p a d
lumipol	l ʊ m i p o l
lumiwanag	l ʊ m ɪ w a n ɐ ɡ
lumo	l ʊ m o
lumon	l ʊ m o n
lumpia	l u m p j a ʔ
lumpiya	l u m p j a ʔ
lumuklok	l ʊ m ʊ k l o k
lumundag	l ʊ m ʊ n d a ɡ
lumutang	l ʊ m u t ɐ ŋ
lumuwag	l ʊ m w a ɡ
lunak	l ʊ n a k
lunas	l u n ɐ s
lunas	l ʊ n a s
lunaw	l u n a ʊ̯
lunaw	l ʊ n a ʊ̯
lundag	l ʊ n d a ɡ
lunday	l ʊ n d a ɪ̯
lundo	l ʊ n d o ʔ
lungad	l u ŋ ɐ d
lungad	l ʊ ŋ a d
lungas	l ʊ ŋ a s
lungaw	l ʊ ŋ a ʊ̯
lungga	l ʊ ŋ ɡ a ʔ
lunggati	l ʊ ŋ ɡ ɐ t i ʔ
lungib	l ʊ ŋ i b
lungkag	l ʊ ŋ k a ɡ
lungkot	l ʊ ŋ k o t
lungsod	l ʊ ŋ s o d
luningning	l ʊ n ɪ ŋ n i ŋ
lunod	l ʊ n o d
lunok	l ʊ n o k
lunot	l ʊ n o t
lunsad	l ʊ n s a d
lunsod	l ʊ n s o d
lunti	l ʊ n t i ʔ
luntian	l ʊ n t i ʔ ɐ n
luntian	l ʊ n t ɪ ʔ a n
luntidinsol	l ʊ n t ɪ d ɪ n s o l
lunukin	l ʊ n ʊ x i n
luoy	l ʊ ʔ o ɪ̯
lupa	l u p ɐ ʔ
lupagi	l ʊ p a ɰ ɪ ʔ
lupagi	l ʊ p ɐ ɰ i ʔ
lupain	l ʊ p ɐ ʔ i n
lupalop	l ʊ p a l o p
lupasay	l ʊ p a s a ɪ̯
lupasay	l ʊ p ɐ s a ɪ̯
lupi	l ʊ p i ʔ
lupig	l u p ɪ ɡ
lupig	l ʊ p i ɡ
luping	l u p ɪ ŋ
luping	l ʊ p i ŋ
lupit	l ʊ p i t
lupog	l ʊ p o ɡ
lura	l ʊ ɾ a ʔ
lusaw	l u s a ʊ̯
lusaw	l ʊ s a ʊ̯
lusay	l u s a ɪ̯
lusay	l ʊ s a ɪ̯
luslos	l ʊ s l o s
lusok	l ʊ s o k
lusong	l ʊ s o ŋ
lusot	l ʊ s o t
lutad	l ʊ t a d
lutang	l u t ɐ ŋ
lutang	l ʊ t a ŋ
lutas	l u t ɐ s
lutas	l ʊ t a s
lutay	l u t a ɪ̯
lutay	l ʊ t a ɪ̯
luto	l ʊ t o
luto	l ʊ t o ʔ
lutong	l ʊ t o ŋ
luwa	l u ɐ
luwa	l w a ʔ
luwad	l w a d
luwag	l w a ɡ
luwal	l w a l
luwalhati	l ʊ ɐ l h a t ɪ ʔ
luwan	l w a n
luwang	l w a ŋ
luwas	l w a s
luwat	l w a t
luway	l w a ɪ̯
luy	l ʊ ɪ
luya	l u j ɐ
luyok	l ʊ j o k
luzano	l ʊ s a n o
luzon	l ʊ s o n
luzuriaga	l ʊ s ʊ ɾ j a ɰ ɐ
maabilidad	m ɐ ʔ ɐ b ɪ l ɪ d a d
maabo	m ɐ ʔ ɐ b o
maagap	m ɐ ʔ a ɰ ɐ p
maagrabyado	m ɐ ʔ ɐ ʔ ɡ ɾ ɐ b j a d o
maako	m ɐ ʔ ɐ x o
maalamat	m ɐ ɐ l ɐ m a t
maalat	m ɐ ʔ a l ɐ t
maalintana	m ɐ ʔ ɐ l ɪ n t a n ɐ
maalon	m a ɐ l o n
maamag	m ɐ ʔ a m ɐ ɡ
maangas	m ɐ ʔ a ŋ ɐ s
maangas	m ɐ ʔ ɐ ŋ a s
maanghang	m ɐ ɐ ŋ h a ŋ
maapoy	m ɐ ɐ p o ɪ̯
maarte	m ɐ ʔ a ɾ t e
maasim	m ɐ ʔ a s ɪ m
maasin	m ɐ ʔ ɐ s i n
maatik	m ɐ ʔ ɐ t i k
mababa	m ɐ b a b ɐ ʔ
mababaw	m ɐ b a b a ʊ̯
mabagal	m ɐ b a ɰ ɐ l
mabagsik	m ɐ b ɐ ɡ s i k
mabagyo	m ɐ b ɐ ɡ j o
mabait	m ɐ b ɐ ʔ i t
mabalacat	m ɐ b ɐ l a x ɐ t
mabalahibo	m ɐ b ɐ l ɐ h i b o
mabali	m ɐ b a l ɪ ʔ
mabalot	m ɐ b a l o t
mabanas	m ɐ b ɐ n a s
mabangis	m ɐ b ɐ ŋ i s
mabasa	m a b a s ɐ
mabasa	m a b ɐ s a ʔ
mabasa	m ɐ b a s ɐ
mabasa	m ɐ b ɐ s a
mabasa	m ɐ b ɐ s a ʔ
mabasag	m ɐ b a s ɐ ɡ
mabato	m a b ɐ t o
mabato	m ɐ b ɐ t o
mabayaran	m ɐ b ɐ j a ɾ ɐ n
mabigat	m ɐ b ɪ ɰ a t
mabilis	m ɐ b ɪ l i s
mabini	m ɐ b i n ɪ
mabini	m ɐ b i n ɪ ʔ
mabitamina	m ɐ b ɪ t ɐ m i n ɐ
mabolo	m ɐ b o l o
mabuhok	m ɐ b ʊ h o k
mabuhol	m ɐ b ʊ h o l
mabula	m ɐ b ʊ l a ʔ
mabulaklak	m ɐ b ʊ l ɐ k l a k
mabulo	m ɐ b u l o
maburyong	m ɐ b ʊ ɾ j o ŋ
mabuti	m ɐ b u t ɪ
mabutig	m ɐ b ʊ t i ɡ
mabuwisit	m ɐ b w i s ɪ t
macababbad	m ɐ x ɐ b a b b ɐ d
macadangdang	m ɐ x ɐ d a ŋ d ɐ ŋ
macalalad	m ɐ x ɐ l a l ɐ d
macalindong	m ɐ x ɐ l i n d o ŋ
macapagal	m ɐ x ɐ p ɐ ɰ a l
macapinlac	m ɐ x ɐ p i n l ɐ k
macapugay	m ɐ x ɐ p u ɰ a ɪ̯
macaranas	m ɐ x ɐ ɾ a n ɐ s
macasaet	m ɐ x a s ɐ e t
macasieb	m ɐ x a s ɪ e b
macaspac	m ɐ x a s p ɐ k
macatulad	m ɐ x ɐ t u l ɐ d
maceda	m ɐ s e d ɐ
macuha	m ɐ x u h ɐ
madaga	m ɐ d ɐ ɰ a ʔ
madalas	m ɐ d ɐ l a s
madaldal	m ɐ d ɐ l d a l
madamay	m ɐ d a m a ɪ̯
madamot	m ɐ d a m o t
madlangbayan	m ɐ d l ɐ ŋ b a j ɐ n
madriaga	m ɐ d ɾ i ɐ ɰ ɐ
madulas	m a d ʊ l a s
madulas	m ɐ d ʊ l a s
madyong	m ɐ d͡ʒ o ŋ
magabok	m ɐ ɰ ɐ b o k
magaling	m ɐ ɰ a l ɪ ŋ
magallanes	m ɐ ɰ ɐ l j a n e s
magalona	m ɐ ɰ ɐ l o n ɐ
maganap	m ɐ ɰ ɐ n a p
magandahan	m ɐ ɰ ɐ n d ɐ h a n
magarbo	m ɐ ɰ a ɾ b o
magaso	m ɐ ɰ ɐ s o
magatas	m ɐ ɰ a t ɐ s
magbababoy	m ɐ ɡ b ɐ b ɐ b o ɪ̯
magbabakal	m ɐ ɡ b ɐ b a x ɐ l
magbabakal	m ɐ ɡ b ɐ b ɐ x a l
magbabalot	m ɐ ɡ b ɐ b ɐ l o t
magbabaon	n ɐ ɡ b a ʔ o n
magbabaon	n ɐ ɡ b ɐ ʔ o n
magbabasa	m ɐ ɡ b ɐ b ɐ s a
magbabasa	m ɐ ɡ b ɐ b ɐ s a ʔ
magbakal	m ɐ ɡ b a x ɐ l
magbakal	m ɐ ɡ b ɐ x a l
magbakasakali	m ɐ ɡ b ɐ x ɐ s ɐ x a l ɪ ʔ
magbalatkayo	m ɐ ɡ b ɐ l ɐ t k ɐ j o ʔ
magbanda	m ɐ ɡ b a n d ɐ
magbanua	m ɐ ɡ b a n ʊ ɐ
magbaon	m ɐ ɡ b a ʔ o n
magbaon	m ɐ ɡ b ɐ ʔ o n
magbarena	m ɐ ɡ b ɐ ɾ e n ɐ
magbasa	m ɐ ɡ b ɐ s a
magbasa	m ɐ ɡ b ɐ s a ʔ
magbati	m ɐ ɡ b ɐ t i
magbati	m ɐ ɡ b ɐ t i ʔ
magbayad	m ɐ ɡ b a j ɐ d
magbenta	m ɐ ɡ b e n t ɐ
magbentilador	m ɐ ɡ b e n t ɪ l ɐ d o ɾ
magbibigas	m ɐ ɡ b ɪ b i ɰ ɐ s
magbibigas	m ɐ ɡ b ɪ b ɪ ɰ a s
magbigay	m ɐ ɡ b ɪ ɰ a ɪ̯
magbihis	m ɐ ɡ b i h ɪ s
magbilad	m ɐ ɡ b ɪ l a d
magbinata	m ɐ ɡ b ɪ n ɐ t a ʔ
magbiro	m ɐ ɡ b ɪ ɾ o ʔ
magbisikleta	m ɐ ɡ b ɪ s ɪ k l e t ɐ
magbobote	m ɐ ɡ b o b o t e
magboo	m ɐ ɡ b o o
magbrotsa	m ɐ ɡ b ɾ o t͡ʃ ɐ
magbubukid	m ɐ ɡ b ʊ b u x ɪ d
magbubukid	m ɐ ɡ b ʊ b ʊ x i d
magbuhat	m ɐ ɡ b u h ɐ t
magbukid	m ɐ ɡ b u x ɪ d
magbulakbol	m ɐ ɡ b ʊ l ɐ k b o l
magdalaga	m ɐ ɡ d ɐ l ɐ ɰ a
magdamag	m ɐ ɡ d ɐ m a ɡ
magdaspan	m ɐ ɡ d a s p ɐ n
magdayao	m ɐ ɡ d a j a ʊ̯
magdede	m ɐ ɡ d e d e
magdede	m ɐ ɡ d e d e ʔ
magdeliryo	m ɐ ɡ d e l i ɾ j o
magdemanda	m ɐ ɡ d e m a n d ɐ
maggatong	m ɐ ɡ ɡ a t o ŋ
maghabilin	m ɐ ɡ h ɐ b i l ɪ n
maghabla	m ɐ ɡ h ɐ b l a
maghalili	m ɐ ɡ h ɐ l i l ɪ
maghalili	m ɐ ɡ h ɐ l ɪ l i
maghanapbuhay	m ɐ ɡ h ɐ n ɐ p b u h a ɪ̯
maghanda	m ɐ ɡ h ɐ n d a ʔ
maghangad	m ɐ ɡ h ɐ ŋ a d
maghapon	m ɐ ɡ h a p o n
maghari	m ɐ ɡ h a ɾ ɪ ʔ
maghasik	m ɐ ɡ h ɐ s i k
maghati	m ɐ ɡ h a t ɪ ʔ
maghawak	m ɐ ɡ h a w ɐ k
maghiganti	m ɐ ɡ h ɪ ɰ ɐ n t i
maghikab	m ɐ ɡ h ɪ x a b
maghikaw	m ɐ ɡ h i x a ʊ̯
maghilik	m ɐ ɡ h ɪ l i k
maghimagsik	m ɐ ɡ h ɪ m ɐ ɡ s i k
maghimutok	m ɐ ɡ h ɪ m ʊ t o k
maghinala	m ɐ ɡ h ɪ n a l ɐ ʔ
maghingalo	m ɐ ɡ h ɪ ŋ ɐ l o
maghinto	m ɐ ɡ h ɪ n t o ʔ
maghinuha	m ɐ ɡ h ɪ n u h ɐ ʔ
maghirang	m ɐ ɡ h i ɾ ɐ ŋ
maghirap	m ɐ ɡ h i ɾ ɐ p
maghitso	m ɐ ɡ h ɪ t͡ʃ o
maghiyas	m ɐ ɡ h ɪ a s
maghugas	m ɐ ɡ h u ɰ ɐ s
maghumpay	m ɐ ɡ h u m p a ɪ̯
magkaaway	m ɐ ɡ k ɐ ʔ a w a ɪ̯
magkakarne	m ɐ ɡ k ɐ x ɐ ɾ n e
magkanlong	m ɐ ɡ k ɐ n l o ŋ
magkataon	m ɐ ɡ k ɐ t ɐ ʔ o n
magkeyk	m ɐ ɡ k e ɪ̯ k
maglabas	m ɐ ɡ l ɐ b a s
maglalako	m ɐ ɡ l ɐ l a x o ʔ
maglalako	m ɐ ɡ l ɐ l ɐ x o ʔ
maglalang	m ɐ ɡ l a l ɐ ŋ
maglandi	m ɐ ɡ l ɐ n d i ʔ
maglanggas	m ɐ ɡ l ɐ ŋ ɡ a s
maglangib	m ɐ ɡ l ɐ ŋ i b
maglango	m ɐ ɡ l ɐ ŋ o
maglantod	m ɐ ɡ l ɐ n t o d
maglapa	m ɐ ɡ l a p ɐ ʔ
maglapastangan	m ɐ ɡ l ɐ p ɐ s t a ŋ ɐ n
maglarawan	m ɐ ɡ l ɐ ɾ a w ɐ n
maglaro	m ɐ ɡ l ɐ ɾ o ʔ
maglaso	m ɐ ɡ l a s o
maglaway	m ɐ ɡ l ɐ w a ɪ̯
maglingid	m ɐ ɡ l ɪ ŋ i d
maglingkod	m ɐ ɡ l ɪ ŋ k o d
maglola	m ɐ ɡ l o l ɐ
maglolo	m ɐ ɡ l o l o
magluwat	m ɐ ɡ l w a t
magma	m a ɡ m ɐ
magmaliw	m ɐ ɡ m a l ɪ ʊ̯
magmaneho	m ɐ ɡ m ɐ n e h o
magmaniobra	m ɐ ɡ m ɐ n i o b ɾ ɐ
magmartsa	m ɐ ɡ m a ɾ t͡ʃ ɐ
magnakaw	m ɐ ɡ n a x a ʊ̯
magnanakaw	m ɐ ɡ n ɐ n ɐ x a ʊ̯
magnanay	m ɐ ɡ n a n a ɪ̯
magnesyo	m ɐ ɡ n e ʃ o
magnetiko	m ɐ ɡ n e t ɪ x o
magnipayer	m ɐ ɡ n ɪ p a j e ɾ
magnipikador	m ɐ ɡ n ɪ p ɪ x ɐ d o ɾ
magpalaganap	m ɐ ɡ p ɐ l ɐ ɰ a n ɐ p
magpanatili	m ɐ ɡ p ɐ n ɐ t i l ɪ
magparaya	m ɐ ɡ p ɐ ɾ a j ɐ ʔ
magpasubasta	m ɐ ɡ p ɐ s ʊ b a s t ɐ
magpaubaya	m ɐ ɡ p a ʊ̯ b a j ɐ ʔ
magpaubaya	m ɐ ɡ p ɐ ʔ ʊ b a j ɐ ʔ
magpawis	m ɐ ɡ p ɐ w i s
magpraktis	m ɐ ɡ p ɾ a k t ɪ s
magrasa	m ɐ ɡ ɾ a s ɐ
magrenta	m ɐ ɡ ɾ e n t ɐ
magsalang	m ɐ ɡ s a l ɐ ŋ
magsaliksik	m ɐ ɡ s ɐ l ɪ k s i k
magsapatos	m ɐ ɡ s ɐ p a t o s
magsimba	m ɐ ɡ s ɪ m b a
