'day	d a ɪ̯
burloloy	b ʊ ɾ l o l o ɪ̯
burma	b u ɾ m ɐ
burol	b ʊ ɾ o l
burukinto	b ʊ ɾ ʊ x ɪ n t o
burundi	b ʊ ɾ u n d ɪ
buryong	b ʊ ɾ j o ŋ
bus	b ɐ s
bus	b ʊ s
busabos	b ʊ s a b o s
busal	b u s ɐ l
busal	b ʊ s a l
busangot	b ʊ s a ŋ o t
busangot	b ʊ s ɐ ŋ o t
busay	b ʊ s a ɪ̯
busbos	b ʊ s b o s
busilak	b ʊ s i l ɐ k
busina	b ʊ s i n ɐ
busisi	b ʊ s i s ɪ ʔ
busisi	b ʊ s ɪ s i ʔ
buslo	b ʊ s l o ʔ
buslot	b ʊ s l o t
busog	b ʊ s o ɡ
busol	b ʊ s o l
buson	b ʊ s o n
buswang	b ʊ s w a ŋ
butac	b u t ɐ k
butaka	b ʊ t a x ɐ
butaka	b ʊ t a x ɐ ʔ
butal	b ʊ t a l
butanding	b ʊ t ɐ n d i ŋ
butang	b ʊ t a ŋ
butangero	b ʊ t ɐ ŋ e ɾ o
butas	b u t ɐ s
butas	b ʊ t a s
butaw	b u t a ʊ̯
butaw	b ʊ t a ʊ̯
butete	b ʊ t e t e
butete	b ʊ t e t e ʔ
buti	b u t ɪ
butig	b ʊ t i ɡ
butigan	b ʊ t ɪ ɰ a n
butiki	b ʊ t ɪ x i ʔ
butil	b u t ɪ l
butlig	b ʊ t l i ɡ
buto	b ʊ t o
butod	b ʊ t o d
butse	b ʊ t͡ʃ e
butse	b ʊ t͡ʃ i
butsi	b ʊ t͡ʃ i
butudkaphay	b ʊ t u d k ɐ p h a ɪ̯
butudkilos	b ʊ t u d k i l o s
buturan	b u t ʊ ɾ a n
buuin	b ʊ ʔ ʊ ʔ i n
buumbilang	b ʊ ʔ u m b i l ɐ ŋ
buurin	b ʊ ʔ ʊ ɾ i n
buwa	b u ɐ ʔ
buwa	b w a ʔ
buwag	b w a ɡ
buwagin	b ʊ ɐ ɰ i n
buwakaw	b w ɐ x a ʊ̯
buwal	b w a l
buwan	b w a n
buwanan	b w a n ɐ n
buwang	b w a ŋ
buwaya	b w ɐ j ɐ
buwelo	b w e l o
buwelta	b w e l t ɐ
buweltahan	b w e l t ɐ h a n
buwenamano	b ʊ e n ɐ m a n o
buwik	b w i k
buwis	b w i s
buwisan	b w i s ɐ n
buwisan	b ʊ ɪ s a n
buwisit	b w ɪ s ɪ t
buwitre	b w ɪ t ɾ e
buya	b u j ɐ ʔ
buyaya	b ʊ j a j ɐ ʔ
buyaya	b ʊ j ɐ j a ʔ
buyo	b ʊ j o
buyon	b ʊ j o n
buyunin	b u j u n ɪ n
buyunin	b ʊ j ʊ n i n
bwisit	b w i s ɪ t
c	s ɪ
cabahug	k x ɐ b a h ʊ ɡ
caballero	k x ɐ b ɐ l j e ɾ o
cabanatuan	k x ɐ b ɐ n ɐ t u ʔ ɐ n
cabanayan	k x ɐ b ɐ n a j ɐ n
cabanlit	k x ɐ b a n l ɪ t
cabasag	k x ɐ b a s ɐ ɡ
cabiling	k x ɐ b i l ɪ ŋ
cabral	k x a b ɾ ɐ l
cabrera	k x ɐ b ɾ e ɾ ɐ
cabuhat	k x ɐ b u h ɐ t
cabungcal	k x ɐ b u ŋ k ɐ l
cabuti	k x ɐ b ʊ t i
cacdac	k x a k d ɐ k
cadano	k x ɐ d a n o
cadapan	k x ɐ d a p ɐ n
cadayona	k x ɐ d ɐ j o n ɐ
cagalingan	k x ɐ ɰ ɐ l i ŋ ɐ n
cagao	k x a ɰ a ʊ̯
cagayan	k x ɐ ɰ ɐ j a n
caguiat	k x a ɡ j ɐ t
caguioa	k x ɐ ɰ i w ɐ
cahinaan	k x ɐ h ɪ n a ʔ ɐ n
cainta	k x ɐ ʔ ɪ n t a ʔ
calalo	k x ɐ l a l o
calamba	k x ɐ l ɐ m b a
calamba	k x ɐ l ɐ m b a ʔ
calan	k x ɐ l a n
calauang	k x ɐ l a w ɐ ŋ
calaunan	k x ɐ l ɐ ʔ u n ɐ n
calayan	k x ɐ l a j ɐ n
calaycay	k x ɐ l a ɪ̯ x a ɪ̯
calinawan	k x ɐ l ɪ n a w ɐ n
calingasan	k x ɐ l ɪ ŋ a s ɐ n
calinisan	k x ɐ l ɪ n i s ɐ n
calis	k x a l ɪ s
calixto	k x ɐ l i k s t o
callao	k a ʎ a ʊ
calma	k x a l m ɐ
calumpang	k x ɐ l u m p ɐ ŋ
caluya	k x ɐ l u j ɐ
camacho	k x ɐ m a t͡ʃ o
camarines	k x ɐ m ɐ ɾ i n e s
camiguin	k x ɐ m ɪ ɰ i n
campo	k x a m p o
cancio	k x a n s ɪ o
candila	k x ɐ n d i l ɐ
canicosa	k x ɐ n ɪ x o s ɐ
canilao	k x ɐ n i l a ʊ̯
canina	k x ɐ n i n ɐ
cantiveros	k x ɐ n t ɪ b e ɾ o s
cantos	k x a n t o s
caparas	k x ɐ p a ɾ ɐ s
capinpin	k x ɐ p i n p ɪ n
capitan	k x ɐ p ɪ t a n
capiz	k x a p ɪ s
cardiño	k x ɐ ɾ d i ɲ o
cariaso	k x ɐ ɾ j a s o
carillo	k x ɐ ɾ i l j o
cariñosa	k x ɐ ɾ ɪ ɲ o s ɐ
carrillo	k x ɐ ɾ ɾ i l l o
casal	k x a s ɐ l
casanova	k x ɐ s ɐ n o b ɐ
casao	k x a s a ʊ̯
caseda	k x ɐ s e d ɐ
castañeda	k x ɐ s t ɐ ɲ e d ɐ
castrence	k x ɐ s t ɾ e n s e
catanduanes	k x ɐ t ɐ n d w ɐ n e s
catapang	k x ɐ t a p ɐ ŋ
catibog	k x ɐ t i b o ɡ
catimbang	k x ɐ t i m b ɐ ŋ
catipon	k x ɐ t i p o n
cato	k x ɐ t o
catral	k x a t ɾ ɐ l
cauilan	k x ɐ w i l ɐ n
cavan	k x ɐ b a n
cavite	k x ɐ b i t e
cayetano	k x ɐ j e t a n o
cañete	k x ɐ ɲ e t e
cenizal	s e n i s ɐ l
chan	t͡ʃ ɐ n
chang	t͡ʃ ɐ ŋ
charot	t͡ʃ ɐ ɾ o t
ching	t͡ʃ ɪ ŋ
chiong	t͡ʃ ɪ o ŋ
chiyoko	t͡ʃ ɪ o x o
choi	t͡ʃ o ɪ̯
cinco	s i ŋ k o
closa	k x l o s ɐ
collado	k x o l j a d o
cometa	k x o m e t ɐ
comia	k x o m ɪ ɐ
condez	k x o n d e s
consolacion	k x o n s o l ɐ ʃ o n
coo	k x ʊ
coquia	k x o x ɪ ɐ
corazon	k x o ɾ ɐ s o n
corcuera	k x o ɾ k w e ɾ ɐ
cornejo	k x o ɾ n e h o
coronel	k x o ɾ o n e l
corpus	k x o ɾ p ʊ s
corrales	k x o ɾ ɾ a l e s
correa	k x o ɾ e ɐ
corro	k x o ɾ ɾ o
cosico	k x o s i x o
cotabato	k x o t ɐ b a t o
coting	k x o t i ŋ
cpp	s ɪ p ɪ p i
crisostomo	k x ɾ ɪ s o s t o m o
cruzat	k x ɾ ʊ s ɐ t
cuasay	k w ɐ s a ɪ̯
cubacub	k x ʊ b a x ʊ b
cuizon	k x u ɪ s o n
custodio	k x ʊ s t o d͡ʒ o
daan	d a ʔ ɐ n
daan	d ɐ ʔ a n
daantaon	d ɐ ʔ a n t ɐ ʔ o n
dabarkads	d a b ɐ ɾ k a d s
dabaw	d a b a ʊ̯
dabdab	d ɐ b d a b
dacanay	d ɐ x a n a ɪ̯
dadaanin	d ɐ d ɐ ʔ a n ɪ n
dadaanin	d ɐ d ɐ ʔ ɐ n i n
daga	d a ɰ ɐ
daga	d ɐ ɰ a ʔ
dagabdab	d ɐ ɰ ɐ b d a b
dagadagaan	d ɐ ɰ ɐ d ɐ ɰ a ʔ ɐ n
dagalwak	d ɐ ɰ ɐ l w a k
dagan	d ɐ ɰ a n
dagas	d ɐ ɰ a s
dagasdas	d ɐ ɰ ɐ s d a s
dagat	d a ɰ ɐ t
dagatan	d ɐ ɰ a t ɐ n
dagdag	d ɐ ɡ d a ɡ
dagibulog	d ɐ ɰ ɪ b ʊ l o ɡ
dagihaynayan	d ɐ ɰ ɪ h a ɪ̯ n a j ɐ n
dagikapnayan	d ɐ ɰ ɪ x ɐ p n a j ɐ n
dagil	d a ɰ ɪ l
dagilusaw	d ɐ ɰ ɪ l ʊ s a ʊ̯
dagim	d ɐ ɰ i m
dagindas	d ɐ ɰ ɪ n d a s
daginding	d ɐ ɰ ɪ n d i ŋ
dagipik	d ɐ ɰ i p ɪ k
dagisdis	d ɐ ɰ ɪ s d i s
dagisik	d ɐ ɰ i s ɪ k
dagisik	d ɐ ɰ ɪ s i k
dagisikan	d a ɰ ɪ s ɪ x a n
dagison	d ɐ ɰ i s o n
dagit	d a ɰ ɪ t
dagitab	d ɐ ɰ i t ɐ b
dagitban	d ɐ ɰ ɪ t b a n
dagitigilan	d ɐ ɰ ɪ t i ɰ ɪ l a n
dagitsigan	d ɐ ɰ ɪ t͡ʃ i ɰ ɐ n
daglat	d ɐ ɡ l a t
dagli	d ɐ ɡ l i ʔ
dagok	d a ɰ o k
dagos	d a ɰ o s
dagsa	d ɐ ɡ s a ʔ
dagsin	d ɐ ɡ s i n
dagta	d ɐ ɡ t a ʔ
dagubang	d ɐ ɰ ʊ b a ŋ
dagubdob	d ɐ ɰ ʊ b d o b
daguldol	d ɐ ɰ ʊ l d o l
dagundong	d ɐ ɰ ʊ n d o ŋ
dagupan	d ɐ ɰ u p ɐ n
dagusdos	d ɐ ɰ ʊ s d o s
dahak	d a h ɐ k
dahan	d a h ɐ n
dahas	d ɐ h a s
dahil	d a h ɪ l
dahilan	d ɐ h ɪ l a n
dahilig	d ɐ h i l ɪ ɡ
dahilig	d ɐ l ɪ h i ɡ
dahop	d ɐ h o p
daig	d a ʔ ɪ ɡ
daig	d ɐ ʔ i ɡ
daigdig	d ɐ ʔ ɪ ɡ d i ɡ
daing	d a ʔ ɪ ŋ
daing	d ɐ ʔ i ŋ
dais	d ɐ ʔ i s
daisuke	d a ɪ̯ s u x e
daka	d a x ɐ
dakdak	d ɐ k d a k
dakila	d ɐ x i l ɐ ʔ
dakip	d ɐ x i p
dakma	d ɐ k m a ʔ
dako	d a x o
dakol	d ɐ x o l
dakot	d ɐ x o t
dakota	d ɐ x o t ɐ
daks	d ɐ k s
daktao	d ɐ k t a ʔ o
daktinig	d ɐ k t i n ɪ ɡ
dakutin	d ɐ x ʊ t i n
dala	d a l ɐ
dala	d ɐ l a
dala	d ɐ l a ʔ
dalag	d ɐ l a ɡ
dalaga	d ɐ l a ɰ ɐ
dalaginday	d ɐ l a ɰ ɪ n d a ɪ̯
dalaginding	d ɐ l a ɰ ɪ n d i ŋ
dalagita	d ɐ l ɐ ɰ i t ɐ
dalahik	d ɐ l a h ɪ k
dalahikan	d ɐ l ɐ h i x ɐ n
dalamhati	d ɐ l ɐ m h a t ɪ ʔ
dalampasigan	d ɐ l ɐ m p ɐ s i ɰ ɐ n
dalandan	d ɐ l ɐ n d a n
dalang	d a l ɐ ŋ
dalangat	d ɐ l a ŋ ɐ t
dalangat	d ɐ l ɐ ŋ a t
dalanghita	d ɐ l ɐ ŋ h i t ɐ
dalangin	d ɐ l a ŋ ɪ n
dalao	d a l a ʊ̯
dalas	d ɐ l a s
dalatan	d ɐ l a t ɐ n
dalaw	d a l a ʊ̯
dalawa	d ɐ l ɐ w a
dalawampu	d ɐ l ɐ w ɐ m p u ʔ
dalawandaan	d ɐ l ɐ w ɐ n d ɐ ʔ a n
dalawin	d ɐ l a w ɪ n
dalawit	d ɐ l a w ɪ t
daldal	d ɐ l d a l
daldalera	d ɐ l d ɐ l e ɾ ɐ
daldalero	d ɐ l d ɐ l e ɾ o
dalhin	d ɐ l h i n
dali	d a l ɪ
dali	d a l ɪ ʔ
dali	d ɐ l i ʔ
dalikdik	d ɐ l i k d ɪ k
daliri	d ɐ l i ɾ ɪ ʔ
dalisay	d ɐ l i s a ɪ̯
dalit	d a l ɪ t
dalit	d ɐ l i t
dalita	d ɐ l ɪ t a ʔ
dalmasya	d ɐ l m a ʃ ɐ
dalmatika	d ɐ l m a t ɪ x a
dalo	d ɐ l o
dalok	d ɐ l o k
daloy	d a l o ɪ̯
dalubbanwa	d ɐ l u b b ɐ n w a
dalubbanwahan	d ɐ l u b b ɐ n w a h ɐ n
dalubguro	d ɐ l u b ɡ u ɾ o ʔ
dalubhalman	d ɐ l u b h ɐ l m a n
dalubhalmanan	d ɐ l u b h ɐ l m a n ɐ n
dalubhasa	d ɐ l ʊ b h a s ɐ ʔ
dalubhasaan	d ɐ l ʊ b h ɐ s a ʔ ɐ n
dalubhayop	d ɐ l u b h a j o p
dalubhayupan	d ɐ l u b h ɐ j u p ɐ n
dalubituinan	d ɐ l u b ɪ t ʊ ʔ ɪ n a n
dalubkabibihan	d ɐ l u b k a b ɪ b ɪ h a n
dalubkatawan	d ɐ l u b k ɐ t ɐ w a n
dalubkulisap	d ɐ l u b k ʊ l i s ɐ p
dalubkulisapan	d ɐ l u b k u l ɪ s a p ɐ n
dalublahi	d ɐ l u b l a h ɪ ʔ
dalublahian	d ɐ l u b l a h ɪ ʔ a n
dalublasunan	d ɐ l u b l a s ʊ n a n
dalublumutan	d ɐ l u b l u m ʊ t a n
dalubsugaan	d ɐ l u b s u ɰ a a n
dalubtala	d ɐ l u b t a l ɐ ʔ
dalubtalaan	d ɐ l u b t a l ɐ ʔ a n
dalubtalain	d ɐ l ʊ b t a l a i n
dalubtao	d ɐ l u b t a ʔ o
dalubtauhan	d ɐ l u b t a ʔ ʊ h a n
dalubwika	d ɐ l u b w i x ɐ ʔ
dalubwikaan	d ɐ l u b w i x ɐ ʔ a n
daluhong	d ɐ l u h o ŋ
dalumat	d ɐ l u m ɐ t
daluro	d ɐ l u ɾ o ʔ
daluro	d ɐ l ʊ ɾ o ʔ
dalurok	d ɐ l u ɾ o k
dalusong	d ɐ l u s o ŋ
daluyong	d ɐ l u j o ŋ
dalwa	d ɐ l w a
dalya	d a l j ɐ
dama	d a m ɐ
dama	d ɐ m a
damag	d a m ɐ ɡ
damag	d ɐ m a ɡ
damahan	d ɐ m a h ɐ n
damahan	d ɐ m ɐ h a n
damak	d ɐ m a k
damay	d a m a ɪ̯
dambana	d ɐ m b a n ɐ ʔ
dambong	d ɐ m b o ŋ
dambuhala	d ɐ m b ʊ h a l ɐ ʔ
damdam	d ɐ m d a m
damdamin	d ɐ m d a m ɪ n
damikay	d ɐ m i x a ɪ̯
damit	d ɐ m i t
damo	d ɐ m o
dampa	d ɐ m p a ʔ
dampalit	d ɐ m p ɐ l i t
dampi	d ɐ m p i ʔ
dampot	d ɐ m p o t
damsiha	d ɐ m s i h ɐ ʔ
damuhan	d ɐ m ʊ h a n
damuho	d ɐ m u h o ʔ
damulag	d ɐ m u l ɐ ɡ
danas	d a n ɐ s
danaw	d a n a ʊ̯
danay	d a n a ɪ̯
danes	d ɐ n e s
danesa	d ɐ n e s ɐ
dangal	d ɐ ŋ a l
danggit	d ɐ ŋ ɡ i t
dangkal	d ɐ ŋ k a l
dani	d ɐ n i ʔ
daniw	d a n ɪ ʊ̯
daniw	d ɐ n i ʊ̯
dansay	d ɐ n s a ɪ̯
dantaon	d ɐ n t ɐ ʔ o n
dantay	d ɐ n t a ɪ̯
danum	d ɐ n u m
danumbiling	d a n u m b ɪ l i ŋ
danumbulog	d a n u m b ʊ l o ɡ
danumhaynayan	d ɐ n ʊ m h a ɪ̯ n a j ɐ n
danumkapnayan	d ɐ n ʊ m k ɐ p n a j ɐ n
danumsigwasan	d ɐ n ʊ m s ɪ ɡ w a s ɐ n
danumtigilan	d ɐ n ʊ m t i ɰ ɪ l a n
danyos	d a ɲ o s
dao	d ɐ ʔ o
daong	d ɐ ʔ o ŋ
dapa	d ɐ p a ʔ
dapal	d a p ɐ l
dapat	d a p ɐ t
dapdap	d ɐ p d a p
dapit	d a p ɪ t
dapitan	d ɐ p i t ɐ n
dapithapon	d ɐ p ɪ t h a p o n
daplis	d ɐ p l i s
dapog	d ɐ p o ɡ
dapulak	d ɐ p u l ɐ k
dara	d ɐ ɾ a
darak	d ɐ ɾ a k
daras	d ɐ ɾ a s
darasigsukat	d ɐ ɾ ɐ s ɪ ɡ s u x ɐ t
dasal	d ɐ s a l
dasmariñas	d ɐ s m ɐ ɾ i ɲ ɐ s
daspan	d a s p ɐ n
daspanin	d a s p ɐ n i n
datal	d ɐ t a l
datapuwa	d ɐ t ɐ p w a ʔ
datapwa	d ɐ t ɐ p w a ʔ
datapwat	d a t ɐ p w a t
dati	d a t ɪ
datiles	d a t ɪ l e s
dating	d ɐ t i ŋ
datinguinoo	d a t ɪ ŋ ɡ ɪ n o ʔ o
datu	d a t ʊ
daulat	d ɐ ʔ ʊ l a t
daungan	d a ʔ u ŋ ɐ n
dausdos	d ɐ ʔ ʊ s d o s
davao	d a b a ʊ̯
daw	d a ʊ̯
dawdaw	d a ʊ̯ d a ʊ̯
dawi	d a w ɪ
dawis	d a w ɪ s
dawit	d a w ɪ t
day	d a ɪ̯
daya	d a j ɐ ʔ
dayag	d a j ɐ ɡ
dayalekto	d ɐ j ɐ l e k t o
dayalogo	d ɐ j a l o ɰ o
dayami	d ɐ j a m ɪ
dayan	d ɐ j a n
dayang	d a j ɐ ŋ
dayang	d ɐ j a ŋ
dayanghirang	d ɐ j ɐ ŋ h i ɾ ɐ ŋ
dayap	d a j ɐ p
dayrit	d a ɪ̯ ɾ ɪ t
dayuhan	d ɐ j u h ɐ n
dayuhan	d ɐ j ʊ h a n
dayukyok	d ɐ j ʊ k d o k
dayungon	d ɐ j u ŋ o n
deang	d͡ʒ ɐ ŋ
debatista	d e b ɐ t i s t ɐ
debosyon	d e b o ʃ o n
decena	d e s e n ɐ
dedikado	d e d ɪ x a d o
dedikasyon	d e d ɪ x ɐ ʃ o n
dedma	d e d m ɐ
dee	d ɪ
dehins	d e h ɪ n s
dehins	d e ɪ̯ n s
dekada	d e x a d ɐ
dekametro	d e x a m e t ɾ o
dekametro	d e x ɐ m e t ɾ o
dekana	d e x a n ɐ
dekano	d e x a n o
deklara	d e k l ɐ ɾ a
deklarasyon	d e k l ɐ ɾ ɐ ʃ o n
dekorasyon	d e x o ɾ ɐ ʃ o n
dekwat	d e k w ɐ t
dekwatin	d e k w ɐ t i n
delata	d e l a t ɐ
delegado	d e l e ɰ a d o
delegasyon	d e l e ɰ ɐ ʃ o n
deliberasyon	d e l ɪ b e ɾ ɐ ʃ o n
delikadesa	d e l ɪ x ɐ d e s ɐ
delikado	d e l ɪ x a d o
demanda	d e m a n d ɐ
demandado	d e m ɐ n d a d o
demokrasya	d e m o k ɾ a ʃ ɐ
demolisyon	d e m o l ɪ ʃ o n
demonio	d e m o ɲ o
demonstrasyon	d e m o n s t ɾ ɐ ʃ o n
demonyo	d e m o ɲ o
demostrasyon	d e m o s t ɾ ɐ ʃ o n
denggoy	d e ŋ ɡ o ɪ̯
dentista	d e n t i s t ɐ
dentisteriya	d e n t ɪ s t e ɾ i ɐ
departamento	d e p ɐ ɾ t ɐ m e n t o
depensa	d e p e n s ɐ
depensahan	d e p e n s ɐ h a n
deportasyon	d e p o ɾ t ɐ ʃ o n
deposito	d e p o s ɪ t o
depresasyon	d e p ɾ e s ɐ ʃ o n
depresyon	d e p ɾ e ʃ o n
deregulasyon	d e ɾ e ɰ ʊ l ɐ ʃ o n
desbentaha	d e s b e n t a h ɐ
desesperada	d e s e s p e ɾ a d ɐ
desesperasyon	d e s e s p e ɾ ɐ ʃ o n
desgrasya	d e s ɡ ɾ a ʃ ɐ
desidido	d e s ɪ d i d o
desilitro	d e s ɪ l i t ɾ o
desimetro	d e s ɪ m e t ɾ o
desimpeksiyon	d e s ɪ m p e k ʃ o n
desisyon	d e s ɪ ʃ o n
deskripsiyon	d e s k ɾ ɪ p ʃ o n
deskubri	d e s k ʊ b ɾ i
deskuwento	d e s k w e n t o
desmaya	d e s m ɐ j a
desmayado	d e s m ɐ j a d o
despedida	d e s p e d i d ɐ
desperada	d e s p e ɾ a d ɐ
desperasyon	d e s p e ɾ ɐ ʃ o n
despertador	d e s p e ɾ t ɐ d o ɾ
destabilisasyon	d e s t ɐ b ɪ l ɪ s ɐ ʃ o n
destinasyon	d e s t ɪ n ɐ ʃ o n
destiyero	d e s t͡ʃ e ɾ o
destruksiyon	d e s t ɾ ʊ k ʃ o n
desyerto	d e ʃ e ɾ t o
detalyado	d e t ɐ l j a d o
determinasyon	d e t e ɾ m ɪ n ɐ ʃ o n
detonasyon	d e t o n ɐ ʃ o n
diamante	d ɪ ɐ m a n t e
dian	d ɪ ʔ a n
diba	d ɪ b a
dibdib	d ɪ b d i b
dibisyon	d ɪ b ɪ ʃ o n
diblinig	d ɪ b l ɪ n i ɡ
diborsiyo	d ɪ b o ɾ ʃ o
dighal	d ɪ ɡ h a l
dighay	d ɪ ɡ h a ɪ̯
diglap	d ɪ ɡ l a p
digma	d ɪ ɡ m a ʔ
digmaan	d ɪ ɡ m a ʔ ɐ n
dignidad	d ɪ ɡ n ɪ d a d
digos	d i ɰ o s
digtalain	d ɪ ɡ t a l ɐ ʔ i n
diigkasin	d ɪ ʔ ɪ ɡ k a s ɪ n
diin	d ɪ i n
diit	d ɪ ʔ i t
diitan	d i ʔ ɪ t ɐ n
diitan	d ɪ ʔ ɪ t a n
dijamco	d ɪ d͡ʒ a m k o
dikdik	d ɪ k d i k
dike	d i x e
dikiam	d ɪ k j a m
dikit	d ɪ x i t
diklap	d ɪ k l a p
diko	d i x o
diksiyonaryo	d ɪ k ʃ o n a ɾ j o
dikta	d ɪ k t a
diktador	d ɪ k t ɐ d o ɾ
diktadora	d ɪ k t ɐ d o ɾ ɐ
diktadura	d ɪ k t ɐ d u ɾ ɐ
diktadurya	d ɪ k t ɐ d u ɾ j ɐ
dikya	d ɪ k j a
dikya	d ɪ k j a ʔ
dikyam	d ɪ k j a m
dila	d i l ɐ ʔ
dilaan	d ɪ l a ʔ ɐ n
dilaan	d ɪ l ɐ ʔ a n
dilag	d ɪ l a ɡ
dilambuwaya	d i l ɐ m b w a j ɐ
dilambuwaya	d ɪ l a m b w a j ɐ
dilat	d i l ɐ t
dilat	d ɪ l a t
dilaw	d ɪ l a ʊ̯
dilawan	d ɪ l a w ɐ n
dilawan	d ɪ l ɐ w a n
dilawdinsol	d ɪ l a ʊ̯ d ɪ n s o l
dili	d i l ɪ
dili	d i l ɪ ʔ
dilig	d ɪ l i ɡ
dilihensiya	d ɪ l ɪ h e n ʃ a
dilikas	d ɪ l ɪ x a s
dilim	d ɪ l i m
dilis	d i l ɪ s
dilis	d ɪ l i s
dilubyo	d ɪ l u b j o
dimaala	d ɪ m a ɐ l ɐ
dimaandal	d ɪ m a ɐ n d ɐ l
dimaapi	d ɪ m a ɐ p ɪ
dimacali	d ɪ m ɐ x a l ɪ
dimagiba	d ɪ m ɐ ɰ i b ɐ
dimailig	d ɪ m a ɪ̯ l ɪ ɡ
dimalaluan	d ɪ m ɐ l a l ʊ ɐ n
dimalanta	d ɪ m ɐ l a n t ɐ
dimapilis	d ɪ m ɐ p i l ɪ s
dimaranan	d ɪ m ɐ ɾ a n ɐ n
dimarim	d ɪ m a ɾ ɪ m
dimatatac	d ɪ m ɐ t a t ɐ k
dimig	d i m ɪ ɡ
dimig	d ɪ m i ɡ
din	d ɪ n
dinagat	d ɪ n a ɰ ɐ t
dinagipik	d ɪ n ɐ ɰ i p ɪ k
dinamarka	d ɪ n ɐ m a ɾ k ɐ
dinamita	d ɪ n ɐ m i t ɐ
dinastiya	d ɪ n ɐ s t i ɐ
dinding	d ɪ n d i ŋ
dingal	d i ŋ ɐ l
dingding	d ɪ ŋ d i ŋ
dinggin	d ɪ ŋ ɡ i n
dingig	d ɪ ŋ i ɡ
dini	d i n ɪ
dinig	d ɪ n i ɡ
dinosawro	d ɪ n o s a ʊ̯ ɾ o
dinsol	d ɪ n s o l
dinsulan	d ɪ n s u l ɐ n
dinuguan	d ɪ n ʊ ɰ ʊ ʔ a n
dipa	d ɪ p a
dipasupil	d ɪ p ɐ s u p ɪ l
dipende	d ɪ p e n d e
diperensiya	d ɪ p e ɾ e n ʃ a
diplomasya	d ɪ p l o m a ʃ ɐ
diplomata	d ɪ p l o m ɐ t a
diplomatiko	d ɪ p l o m ɐ t ɪ x o
dipolog	d ɪ p o l o ɡ
dipterya	d ɪ p t e ɾ j ɐ
direksiyon	d ɪ ɾ e k ʃ o n
direkta	d ɪ ɾ e k t ɐ
direktiba	d ɪ ɾ e k t i b ɐ
direktor	d ɪ ɾ e k t o ɾ
direktora	d ɪ ɾ e k t o ɾ ɐ
direktoryo	d ɪ ɾ e k t o ɾ j o
diretso	d ɪ ɾ e t͡ʃ o
diri	d i ɾ ɪ
dirihible	d ɪ ɾ ɪ h i b l e
diris	d i ɾ ɪ s
disaluyan	d ɪ s ɐ l u j ɐ n
disente	d ɪ s e n t e
disenteriya	d ɪ s e n t e ɾ i ɐ
disenyo	d ɪ s e ɲ o
disgrasya	d ɪ s ɡ ɾ a ʃ ɐ
disinuwebe	d ɪ s ɪ n w e b e
disiotso	d ɪ s ɪ ʔ o t͡ʃ o
disiplina	d ɪ s ɪ p l i n ɐ
disiplinado	d ɪ s ɪ p l ɪ n a d o
disiplinahin	d ɪ s ɪ p l ɪ n a h ɪ n
disipulo	d ɪ s i p ʊ l o
disisais	d ɪ s ɪ s ɐ ʔ i s
disiseis	d ɪ s ɪ s e ʔ i s
disiseis	d ɪ s ɪ s ɐ ʔ i s
disisiyete	d ɪ s ɪ ʃ e t e
diskarte	d ɪ s k a ɾ t e
diskita	d ɪ s k ɪ t a
diskompiyado	d ɪ s k u m p j ɐ d o
diskriminasyon	d ɪ s k ɾ ɪ m ɪ n ɐ ʃ o n
diskumpiyado	d ɪ s k u m p j ɐ d o
diskusyon	d ɪ s k ʊ ʃ o n
diskuwalipika	d ɪ s k ʊ ɐ l ɪ p ɪ x a
diskuwalipikado	d ɪ s k ʊ ɐ l ɪ p ɪ x a d o
diskuwalipikasyon	d ɪ s k ʊ ɐ l ɪ p ɪ x ɐ ʃ o n
dismayado	d ɪ s m ɐ j a d o
diso	d ɪ s o
dispatser	d ɪ s p a t͡ʃ e ɾ
dispensa	d ɪ s p e n s ɐ
distansiya	d ɪ s t a n ɪ ʃ a
distinggido	d ɪ s t ɪ ŋ ɡ i d o
distribusyon	d ɪ s t ɾ ɪ b ʊ ʃ o n
distrito	d ɪ s t ɾ i t o
disyembre	d ɪ ʃ e m b ɾ e
dita	d i t ɐ ʔ
dita	d ɪ t a ʔ
ditdit	d ɪ t d i t
ditse	d ɪ t͡ʃ e
diwa	d i w ɐ
diwa	d i w ɐ ʔ
diwang	d i w ɐ ŋ
diwata	d ɪ w a t ɐ ʔ
diyabetes	d ɪ ɐ b e t e s
diyabetes	d͡ʒ ɐ b e t ɪ s
diyabetiko	d ɪ ɐ b e t ɪ x o
diyablo	d͡ʒ a b l o
diyakono	d͡ʒ a x o n o
diyalekto	d ɪ ɐ l e k t o
diyalogo	d͡ʒ a l o ɰ o
diyamante	d ɪ ɐ m a n t e
diyametro	d ɪ ɐ m e t ɾ o
diyametro	d͡ʒ a m e t ɾ o
diyan	d ɪ ʔ a n
diyan	d͡ʒ a n
diyan	d͡ʒ ɐ ʔ a n
diyaryo	d͡ʒ a ɾ j o
diyes	d͡ʒ e s
diyes	d͡ʒ ɪ s
diyeta	d͡ʒ e t ɐ
diyos	d͡ʒ o s
diyosa	d͡ʒ o s ɐ
diyosesis	d͡ʒ o s e s i s
doktora	d o k t o ɾ ɐ
doktrina	d o k t ɾ i n ɐ
dokumentado	d o x ʊ m e n t a d o
dokumentaryo	d o x ʊ m e n t a ɾ j o
dokumentasyon	d o x ʊ m e n t ɐ ʃ o n
dokumento	d o x ʊ m e n t o
dolar	d o l ɐ ɾ
domantay	d o m a n t a ɪ̯
dominado	d o m ɪ n a d o
dominante	d o m ɪ n a n t e
dominikano	d o m ɪ n ɪ x a n o
domino	d o m ɪ n o
donasyon	d o n ɐ ʃ o n
donat	d o n ɐ t
dormitoryo	d o ɾ m ɪ t o ɾ j o
dosena	d o s e n ɐ
dosis	d o s ɪ s
dosyentos	d o ʃ e n t o s
dragon	d ɾ ɐ ɰ o n
drakula	d ɾ a x ʊ l ɐ
drama	d ɾ a m ɐ
dramatiko	d ɾ ɐ m a t ɪ x o
droga	d ɾ o ɰ ɐ
drowing	d ɾ o w ɪ ŋ
duag	d w a ɡ
dubdob	d ʊ b d o b
duda	d u d ɐ
dueñas	d u e ɲ ɐ s
dugas	d u ɰ ɐ s
dugo	d ʊ ɰ o ʔ
dugong	d u ɰ o ŋ
dugso	d ʊ ɡ s o ʔ
dugtong	d ʊ ɡ t o ŋ
duguan	d ʊ ɰ ʊ ʔ a n
dugyot	d ʊ ɡ j o t
duhagi	d ʊ h a ɰ ɪ
duhagi	d ʊ h ɐ ɰ i
duhakay	d ʊ h a x a ɪ̯
duhambindahon	d ʊ h ɐ m b ɪ n d a h o n
duhandas	d ʊ h ɐ n d a s
duhansipat	d ʊ h ɐ n s i p ɐ t
duhasik	d ʊ h a s ɪ k
duhat	d u h ɐ t
duhol	d ʊ h o l
dukado	d ʊ x a d o
dukal	d ʊ x a l
duke	d u x e
dukesa	d ʊ x e s ɐ
dukha	d ʊ k h a ʔ
dukot	d u x o t
dukwang	d ʊ k w a ŋ
dukwangin	d ʊ k w ɐ ŋ i n
dula	d u l ɐ ʔ
dula	d ʊ l a ʔ
dulaan	d u l a ɐ n
dulang	d u l ɐ ŋ
dulang	d ʊ l a ŋ
dulas	d ʊ l a s
dulay	d u l a ɪ̯
duldol	d ʊ l d o l
duling	d ʊ l i ŋ
dulis	d u l ɪ s
dulit	d u l ɪ t
dulog	d ʊ l o ɡ
dulos	d ʊ l o s
dulugan	d u l u ɰ ɐ n
dulugan	d ʊ l ʊ ɰ a n
duluhan	d ʊ l u h ɐ n
dumaan	d ʊ m ɐ ʔ a n
dumagit	d ʊ m a ɰ ɪ t
dumagsin	d ʊ m ɐ ɡ s i n
dumaguete	d ʊ m ɐ ɰ e t e
dumaguing	d ʊ m a ɰ ɪ ŋ
dumal	d u m ɐ l
dumalaw	d ʊ m a l a ʊ̯
dumali	d ʊ m ɐ l i ʔ
dumapa	d ʊ m ɐ p a ʔ
dumating	d ʊ m ɐ t i ŋ
dumausdos	d ʊ m ɐ ʔ ʊ s d o s
dumi	d ʊ m i
dumighay	d ʊ m ɪ ɡ h a ɪ̯
dumihan	d u m i h ɐ n
dumihan	d ʊ m ɪ h a n
dumilim	d ʊ m ɪ l i m
dumlao	d u m l ɐ o
dumog	d ʊ m o ɡ
dumpit	d u m p ɪ t
dumugo	d ʊ m ʊ ɰ o ʔ
dumukot	d ʊ m u x o t
dumulas	d ʊ m ʊ l a s
dumumi	d ʊ m ʊ m i
dumungaw	d ʊ m u ŋ a ʊ̯
dumura	d ʊ m ʊ ɾ a ʔ
dungaw	d u ŋ a ʊ̯
dunggol	d ʊ ŋ ɡ o l
dunggot	d ʊ ŋ ɡ o t
dungis	d u ŋ ɪ s
dungon	d ʊ ŋ o n
dupa	d ʊ p a ʔ
dupikal	d ʊ p ɪ x a l
dupil	d u p ɪ l
dura	d ʊ ɾ a ʔ
durante	d ʊ ɾ a n t e
durian	d ʊ ɾ j a n
durog	d ʊ ɾ o ɡ
durugista	d ʊ ɾ ʊ ɰ i s t ɐ
durungawan	d u ɾ ʊ ŋ ɐ w a n
duryan	d ʊ ɾ j a n
dusa	d u s ɐ
dusdos	d ʊ s d o s
dusing	d u s ɪ ŋ
dusta	d ʊ s t a ʔ
dutaan	d u t ɐ ʔ ɐ n
dutaliknayan	d ʊ t ɐ l ɪ k n a j ɐ n
dutdot	d ʊ t d o t
dutdutin	d ʊ t d ʊ t i n
duwag	d w a ɡ
duwende	d w e n d e
duyan	d u j ɐ n
dy	d ɪ
dyahe	d͡ʒ a h e
dyaket	d͡ʒ a x e t
dyanitor	d͡ʒ a n ɪ t o ɾ
dyaryo	d͡ʒ a ɾ j o
dyas	d͡ʒ ɐ s
dyip	d͡ʒ ɪ p
dyipni	d͡ʒ i p n ɪ
dyologin	d͡ʒ o l o ɰ ɪ n
dyologs	d͡ʒ o l o ɡ s
dyudo	d͡ʒ u d o
dyumologs	d͡ʒ ʊ m o l o ɡ s
eba	ʔ e b ɐ
ebak	ʔ e b ɐ k
ebakwasyon	ʔ e b ɐ k w ɐ ʃ o n
ebanghelista	ʔ e b ɐ ŋ h e l i s t ɐ
ebanghelyo	ʔ e b ɐ ŋ h e l j o
ebaporada	ʔ e b ɐ p o ɾ a d ɐ
ebidensiya	ʔ e b ɪ d e n ʃ a
ebidensya	ʔ e b ɪ d e n ʃ ɐ
ebolusyon	ʔ e b o l ʊ ʃ o n
echevarria	ʔ e t͡ʃ e b a ɾ j ɐ
edipisyo	ʔ e d ɪ p i ʃ o
edisyon	ʔ e d ɪ ʃ o n
editoryal	ʔ e d ɪ t o ɾ j a l
edukada	ʔ e d ʊ x a d ɐ
edukado	ʔ e d ʊ x a d o
edukasyon	ʔ e d ʊ x ɐ ʃ o n
ehekutibo	ʔ e h e x ʊ t i b o
ehersisyo	ʔ e h e ɾ s i ʃ o
ehersito	ʔ e h e ɾ s ɪ t o
ekipahe	ʔ e x ɪ p a h e
ekis	ʔ e x ɪ s
ekisan	ʔ e x i s ɐ n
ekonomista	ʔ e x o n o m i s t ɐ
ekonomiya	ʔ e x o n o m i ɐ
eksaherado	ʔ e k s ɐ h e ɾ a d o
eksaherasyon	ʔ e k s ɐ h e ɾ ɐ ʃ o n
eksaminador	ʔ e k s ɐ m ɪ n ɐ d o ɾ
eksena	ʔ e k s e n ɐ
eksklusibo	ʔ e k s k l ʊ s i b o
eksklusyon	ʔ e k s k l ʊ ʃ o n
eksperimento	ʔ e k s p e ɾ ɪ m e n t o
eksplanasyon	ʔ e k s p l ɐ n ɐ ʃ o n
ekspresyon	ʔ e k s p ɾ e ʃ o n
ektarya	ʔ e k t a ɾ j ɐ
ekwador	ʔ e k w ɐ d o ɾ
elaborasyon	ʔ e l ɐ b o ɾ ɐ ʃ o n
elamparo	ʔ e l ɐ m p a ɾ o
elastiko	ʔ e l a s t ɪ x o
elegansiya	ʔ e l e ɰ a n ʃ a
elegante	ʔ e l e ɰ a n t e
elehiya	ʔ e l e h i ɐ
eleksiyon	ʔ e l e k ʃ o n
elektrisidad	ʔ e l e k t ɾ ɪ s ɪ d a d
elektrisista	ʔ e l e k t ɾ ɪ s i s t ɐ
eliseo	ʔ e l ɪ s e j o
elizaga	ʔ e l ɪ s a ɰ ɐ
embahada	ʔ e m b ɐ h a d ɐ
embahador	ʔ e m b ɐ h ɐ d o ɾ
embalsama	ʔ e m b ɐ l s ɐ m a
embalsamador	ʔ e m b ɐ l s ɐ m ɐ d o ɾ
emiko	ʔ e m i x o
emosyon	ʔ e m o ʃ o n
emosyonal	ʔ e m o ʃ o n a l
empake	ʔ e m p a x e
emperador	ʔ e m p e ɾ ɐ d o ɾ
emperadora	ʔ e m p e ɾ ɐ d o ɾ ɐ
emperatris	ʔ e m p e ɾ ɐ t ɾ i s
encarnado	ʔ e ŋ k ɐ ɾ n a d o
encinas	ʔ e n s i n ɐ s
endaya	ʔ e n d a j ɐ
enerhiya	ʔ e n e ɾ h i ɐ
engganyo	ʔ e ŋ ɡ a ɲ o
engkuwentro	ʔ e ŋ k w e n t ɾ o
ensaymada	ʔ e n s a ɪ̯ m a d ɐ
ensemada	ʔ e n s e m a d ɐ
ensiklopedya	ʔ e n s ɪ k l o p e d͡ʒ ɐ
entrada	ʔ e n t ɾ a d ɐ
entusyasmo	ʔ e n t ʊ ʃ ɐ s m o
epal	ʔ e p ɐ l
epidemia	ʔ e p ɪ d e m j ɐ
epidemya	ʔ e p ɪ d e m j ɐ
epiko	ʔ e p ɪ x o
epilepsiya	ʔ e p ɪ l e p ʃ a
epistemolohiya	ʔ e p ɪ s t e m o l o h i ɐ
episyente	ʔ e p ɪ ʃ e n t e
eredera	ʔ e ɾ e d e ɾ ɐ
erehiya	ʔ e ɾ e h i ɐ
ermita	ʔ e ɾ m i t ɐ
ermitanyo	ʔ e ɾ m ɪ t a ɲ o
escalona	ʔ e s k ɐ l o n ɐ
esena	ʔ e s e n ɐ
esguerra	ʔ e s ɡ e ɾ ɾ ɐ
eskabetse	ʔ e s k ɐ b e t͡ʃ e
eskalador	ʔ e s k ɐ l ɐ d o ɾ
eskandalo	ʔ e s k a n d ɐ l o
eskandalosa	ʔ e s k ɐ n d ɐ l o s ɐ
eskandaloso	ʔ e s k ɐ n d ɐ l o s o
eskaparate	ʔ e s k ɐ p ɐ ɾ a t e
eskapularyo	ʔ e s k ɐ p ʊ l a ɾ j o
eskina	ʔ e s k i n ɐ
eskinita	ʔ e s k ɪ n i t ɐ
eskoba	ʔ e s k o b ɐ
eskosya	ʔ e s k o ʃ ɐ
eskriba	ʔ e s k ɾ i b ɐ
eskrima	ʔ e s k ɾ i m ɐ
eskultor	ʔ e s k ʊ l t o ɾ
eskultura	ʔ e s k ʊ l t u ɾ ɐ
eskuwela	ʔ e s k w e l ɐ
eskuwelahan	ʔ e s k w e l ɐ h a n
eskwela	ʔ e s k w e l ɐ
eslobakya	ʔ e s l o b a k j ɐ
eslobenya	ʔ e s l o b e ɲ ɐ
esmeralda	ʔ e s m e ɾ a l d ɐ
esmeril	ʔ e s m e ɾ ɪ l
esopago	ʔ e s o p ɐ ɰ o
espada	ʔ e s p a d ɐ
espadahan	ʔ e s p ɐ d ɐ h a n
espantaho	ʔ e s p ɐ n t a h o
espanya	ʔ e s p a ɲ ɐ
espanyol	ʔ e s p ɐ ɲ o l
espanyola	ʔ e s p ɐ ɲ o l ɐ
esparago	ʔ e s p a ɾ ɐ ɰ o
espasol	ʔ e s p ɐ s o l
espasyo	ʔ e s p a ʃ o
españa	ʔ e s p a ɲ ɐ
esperma	ʔ e s p e ɾ m ɐ
espesyal	ʔ e s p e ʃ a l
espesyalista	ʔ e s p e ʃ ɐ l i s t ɐ
espina	ʔ e s p i n ɐ
espinaka	ʔ e s p ɪ n a x ɐ
espinoza	ʔ e s p ɪ n o s ɐ
espiritu	ʔ e s p i ɾ ɪ t u
espiritwalidad	ʔ e s p ɪ ɾ ɪ t w ɐ l ɪ d a d
espiya	ʔ e s p i ɐ
espiya	ʔ e s p j a
espongha	ʔ e s p o ŋ h ɐ
estabillo	ʔ e s t ɐ b i l l o
establisimiyento	ʔ e s t ɐ b l ɪ s ɪ m j e n t o
establisimyento	ʔ e s t ɐ b l ɪ s ɪ m j e n t o
estampa	ʔ e s t a m p ɐ
estampita	ʔ e s t ɐ m p i t ɐ
estapa	ʔ e s t a p ɐ
estapador	ʔ e s t ɐ p ɐ d o ɾ
estasyon	ʔ e s t ɐ ʃ o n
estatwa	ʔ e s t a t w ɐ
estola	ʔ e s t o l ɐ
estonya	ʔ e s t o ɲ ɐ
estrada	ʔ e s t ɾ a d ɐ
estratehiko	ʔ e s t ɾ ɐ t e h ɪ x o
estratehiya	ʔ e s t ɾ ɐ t e h i ɐ
estratehiya	ʔ e s t ɾ ɐ t e h ɪ a
estrella	ʔ e s t ɾ e l l ɐ
estronsiyo	ʔ e s t ɾ o n ʃ o
estruktura	ʔ e s t ɾ ʊ k t u ɾ ɐ
estudyante	ʔ e s t ʊ d͡ʒ a n t e
etika	ʔ e t ɪ x a
etiyopiya	ʔ e t ɪ o p i ɐ
eugenio	j ʊ h e ɲ o
eva	ʔ e b ɐ
ewan	ʔ e w ɐ n
eyre	ʔ e ɪ̯ ɾ e
ezra	ʔ e s ɾ ɐ
fabregas	f a b ɾ e ɰ ɐ s
fajardo	p ɐ h a ɾ d o
faltado	f ɐ l t a d o
felicidad	f e l ɪ s ɪ d a d
ferriols	f e ɾ ɾ ɪ o l s
figueras	p ɪ ɰ e ɾ ɐ s
figueroa	f ɪ ɰ e ɾ o ɐ
filipina	f ɪ l ɪ p i n ɐ
filipinas	f ɪ l ɪ p i n ɐ s
filipino	f ɪ l ɪ p i n o
flora	f l o ɾ ɐ
fojas	p o h ɐ s
fonacier	f o n a s ɪ e ɾ
fontelera	f o n t e l e ɾ ɐ
fontillas	p o n t i l j ɐ s
forteza	f o ɾ t e s ɐ
franco	f ɾ a ŋ k o
frias	f ɾ ɪ ɐ s
fronda	f ɾ o n d ɐ
fuentebella	p ʊ e n t e b e l j ɐ
fulgencio	f ʊ l h e n ʃ o
fung	f ʊ ŋ
furagganan	f ʊ ɾ ɐ ɡ ɡ a n ɐ n
ga	ɡ ɐ
gaan	ɡ ɐ ʔ a n
gaano	ɡ ɐ ʔ a n o
gaano	ɡ ɐ ʔ ɐ n o
gaas	ɡ ɐ ʔ a s
gaban	ɡ ɐ b a n
gabay	ɡ ɐ b a ɪ̯
gabi	ɡ a b ɪ
gabi	ɡ ɐ b i
gabiana	ɡ ɐ b i ɐ n ɐ
gabinete	ɡ ɐ b ɪ n e t e
gabok	ɡ ɐ b o k
gabon	ɡ ɐ b o n
gabriel	ɡ ɐ b ɾ j e l
gabrielle	ɡ ɐ b ɾ i e l l e
gabya	ɡ a b j ɐ
