'day	d a ɪ̯
'y	ɪ
aa	ʔ a ʔ ɐ ʔ
aa	ʔ ɐ ɐ
aa	ʔ ɐ ʔ a ʔ
aaa	ʔ ɐ ʔ ɐ ʔ a ʔ
aaaban	ʔ a ʔ ɐ ʔ ɐ b a n
aab	ʔ ɐ ʔ a b
aaban	ʔ ɐ ʔ ɐ b a n
aabisuhan	ʔ ɐ ɐ b ɪ s u h ɐ n
aak	ʔ ɐ ʔ a k
aakyat	ʔ ɐ ʔ ɐ k j a t
aam	ʔ ɐ ʔ a m
aamendyahan	ʔ ɐ ʔ ɐ m j e n d ɐ h a n
aap	ʔ a ʔ ɐ p
aap	ʔ ɐ ʔ a p
aawat	ʔ ɐ ʔ a w ɐ t
aba	ʔ ɐ b a
aba	ʔ ɐ b a ʔ
abad	ʔ ɐ b a d
abahin	ʔ ɐ b ɐ h i n
abain	ʔ ɐ b ɐ ʔ i n
abaka	ʔ ɐ b ɐ x a
abakada	ʔ ɐ b ɐ x a d ɐ
abako	ʔ ɐ b ɐ x o
abakus	ʔ a b ɐ x u s
abala	ʔ ɐ b a l ɐ
abala	ʔ ɐ b ɐ l a
abalahin	ʔ ɐ b ɐ l a h ɪ n
abaloryo	ʔ ɐ b ɐ l o ɾ j o
abalos	ʔ a b ɐ l o s
abanderado	ʔ ɐ b ɐ n d e ɾ a d o
abandonado	ʔ ɐ b ɐ n d o n a d o
abang	ʔ ɐ b a ŋ
abangan	ʔ a b a ŋ ɐ n
abangan	ʔ ɐ b ɐ ŋ a n
abaniko	ʔ ɐ b ɐ n i x o
abante	ʔ ɐ b a n t e
abat	ʔ ɐ b a t
abatan	ʔ a b a t ɐ n
abatan	ʔ ɐ b ɐ t a n
abay	ʔ a b a ɪ̯
abay	ʔ ɐ b a ɪ̯
abayan	ʔ ɐ b a j ɐ n
abayan	ʔ ɐ b ɐ j a n
abdikasyon	ʔ ɐ b d ɪ x ɐ ʃ o n
abdurahman	ʔ ɐ b d ʊ ɾ a h m ɐ n
abejuela	ʔ ɐ b e h u e l ɐ
abelgas	ʔ ɐ b e l ɡ ɐ s
abella	ʔ ɐ b e l l ɐ
abellera	ʔ ɐ b e l j e ɾ ɐ
abenida	ʔ ɐ b e n i d ɐ
abentura	ʔ ɐ b e n t u ɾ ɐ
abenturero	ʔ ɐ b e n t ʊ ɾ e ɾ o
aber	ʔ ɐ b e ɾ
aberya	ʔ ɐ b e ɾ j a
abestrus	ʔ ɐ b e s t ɾ u s
abilaw	ʔ ɐ b ɪ l a ʊ̯
abilidad	ʔ ɐ b ɪ l ɪ d a d
abilo	ʔ ɐ b i l o
abing	ʔ a b ɪ ŋ
abiso	ʔ ɐ b i s o
abisuhan	ʔ ɐ b ɪ s u h ɐ n
abitsuwela	ʔ ɐ b ɪ t͡ʃ ʊ e l ɐ
abitsuwelas	ʔ ɐ b ɪ t͡ʃ ʊ e l ɐ s
abla	ʔ a b l ɐ
abla	ʔ ɐ b l a
abno	ʔ ɐ b n o ʔ
abnormal	ʔ ɐ b n o ɾ m a l
abnormal	ʔ ɐ b n o ɾ m ɐ l
abnormalidad	ʔ ɐ b n o ɾ m ɐ l ɪ d a d
abnoy	ʔ ɐ b n o ɪ̯
abo	ʔ ɐ b o
abobot	ʔ ɐ b o b o t
abog	ʔ ɐ b o ɡ
abogada	ʔ ɐ b o ɰ a d ɐ
abogado	ʔ ɐ b o ɰ a d o
abogasya	ʔ ɐ b o ɰ ɐ ʃ a
abok	ʔ ɐ b o k
abokado	ʔ ɐ b o x a d o
abolisyon	ʔ ɐ b o l ɪ ʃ o n
abono	ʔ ɐ b o n o
aborsiyon	ʔ ɐ b o ɾ ʃ o n
aborsiyonista	ʔ ɐ b o ɾ s ɪ o n i s t ɐ
aborsyonista	ʔ ɐ b o ɾ ʃ o n i s t ɐ
abot	ʔ ɐ b o t
aboy	ʔ ɐ b o ɪ̯
abra	ʔ a b ɾ ɐ
abrasador	ʔ ɐ b ɾ ɐ s ɐ d o ɾ
abrasete	ʔ ɐ b ɾ ɐ s e t e
abrasyete	ʔ ɐ b ɾ ɐ ʃ e t e
abrazado	ʔ ɐ b ɾ ɐ s a d o
abrelata	ʔ ɐ b ɾ e l a t ɐ
abrenica	ʔ ɐ b ɾ e n i x ɐ
abrigo	ʔ ɐ b ɾ i ɰ o
abril	ʔ ɐ b ɾ i l
absik	ʔ ɐ b s i k
abuab	ʔ ɐ b ʊ ʔ a b
abubot	ʔ ɐ b u b o t
abucay	ʔ ɐ b u x a ɪ̯
abueg	ʔ ɐ b w e ɡ
abuhan	ʔ a b u h ɐ n
abuhan	ʔ ɐ b ʊ h a n
abuhin	ʔ a b ʊ h i n
abuhin	ʔ ɐ b ʊ h i n
abukado	ʔ ɐ b ʊ x a d o
abukanin	ʔ ɐ b ʊ x a n ɪ n
abukay	ʔ ɐ b u x a ɪ̯
abukay	ʔ ɐ b ʊ x a ɪ̯
abulencia	ʔ ɐ b ʊ l e n ʃ ɐ
abuloy	ʔ ɐ b u l o ɪ̯
abuluyan	ʔ a b ʊ l ʊ j a n
abuluyan	ʔ ɐ b ʊ l u j ɐ n
aburido	ʔ ɐ b ʊ ɾ i d o
aburido	ʔ ɐ b ʊ ɾ ɪ d o
abusado	ʔ ɐ b ʊ s a d o
abuso	ʔ ɐ b u s o
abusuhin	ʔ ɐ b ʊ s u h ɪ n
abutab	ʔ ɐ b ʊ t a b
abutan	ʔ a b u t ɐ n
abutan	ʔ ɐ b u t ɐ n
abutan	ʔ ɐ b ʊ t a n
abutin	ʔ ɐ b u t ɪ n
abutin	ʔ ɐ b ʊ t i n
abuwab	ʔ ɐ b w a b
abwab	ʔ ɐ b w a b
abyad	ʔ ɐ b j a d
abyador	ʔ ɐ b j ɐ d o ɾ
abyarin	ʔ ɐ b j ɐ ɾ i n
abyasyon	ʔ ɐ b j ɐ ʃ o n
abyog	ʔ ɐ b j o ɡ
abyugin	ʔ ɐ b j ʊ ɰ i n
acebedo	ʔ ɐ s e b e d o
acierto	ʔ ɐ ʃ e ɾ t o
acorda	ʔ ɐ x o ɾ d ɐ
acosta	ʔ ɐ x o s t ɐ
acuzar	ʔ ɐ x u s ɐ ɾ
acuña	ʔ ɐ x u ɲ ɐ
ada	ʔ a d ɐ
adajar	ʔ ɐ d ɐ h a ɾ
adan	ʔ ɐ d a n
adberbiyo	ʔ ɐ d b e ɾ b ɪ o
adbiyento	ʔ ɐ d b j e n t o
adbokasiya	ʔ ɐ d b o x ɐ s i ɐ
adelanto	ʔ ɐ d e l a n t o
adelpa	ʔ ɐ d e l p ɐ
adhika	ʔ ɐ d h ɪ x a ʔ
adhikain	ʔ ɐ d h ɪ x a ʔ ɪ n
adidas	ʔ ɐ d i d ɐ s
adik	ʔ a d ɪ k
adiksiyon	ʔ ɐ d ɪ k ʃ o n
adiksyon	ʔ ɐ d ɪ k ʃ o n
adikto	ʔ ɐ d i k t o
adisyunal	ʔ ɐ d ɪ ʃ ʊ n a l
adlaw	ʔ ɐ d l a ʊ̯
adlawan	ʔ ɐ d l a w ɐ n
administrador	ʔ ɐ d m ɪ n ɪ s t ɾ ɐ d o ɾ
administrasyon	ʔ ɐ d m ɪ n ɪ s t ɾ ɐ ʃ o n
administratibo	ʔ ɐ d m ɪ n ɪ s t ɾ ɐ t i b o
admiral	ʔ a d m ɪ ɾ a l
adobe	ʔ ɐ d o b e
adobo	ʔ ɐ d o b o
adopsiyon	ʔ ɐ d o p ʃ o n
adopsyon	ʔ ɐ d o p ʃ o n
adorador	ʔ ɐ d o ɾ ɐ d o ɾ
adorno	ʔ ɐ d o ɾ n o
adres	ʔ ɐ d ɾ e s
adrias	ʔ a d ɾ ɪ ɐ s
adulto	ʔ ɐ d u l t o
aduwana	ʔ ɐ d w ɐ n ɐ
adwa	ʔ ɐ d w a ʔ
adwana	ʔ ɐ d w a n ɐ
adya	ʔ ɐ d͡ʒ a
adyenda	ʔ ɐ d͡ʒ e n d ɐ
adyo	ʔ ɐ d͡ʒ o
adyo	ʔ ɐ d͡ʒ o ʔ
aga	ʔ a ɰ ɐ
agaas	ʔ a ɰ ɐ ɐ s
agaas	ʔ ɐ ɰ ɐ ʔ a s
agad	ʔ ɐ ɰ a d
agahan	ʔ ɐ ɰ a h ɐ n
agahas	ʔ ɐ ɰ a h ɐ s
agahas	ʔ ɐ ɰ ɐ h a s
agalya	ʔ ɐ ɰ a l j ɐ
agam	ʔ a ɰ ɐ m
agamahan	ʔ a ɰ ɐ m ɐ h ɐ n
agap	ʔ a ɰ ɐ p
agapay	ʔ ɐ ɰ a p a ɪ̯
agaran	ʔ a ɰ a ɾ ɐ n
agas	ʔ a ɰ ɐ s
agas	ʔ ɐ ɰ a s
agata	ʔ a ɰ ɐ t a
agatat	ʔ ɐ ɰ ɐ t a t
agaw	ʔ a ɰ a ʊ̯
agaw	ʔ ɐ ɰ a ʊ̯
agbarog	ʔ ɐ ɡ b a ɾ o ɡ
agbarugan	ʔ ɐ ɡ b ɐ ɾ u ɰ ɐ n
agham	ʔ ɐ ɡ h a m
aghambuhay	ʔ ɐ ɡ h a m b u h a ɪ̯
aghamwika	ʔ ɐ ɡ h a m w i x ɐ ʔ
aghimo	ʔ ɐ ɡ h i m o ʔ
aghimuan	ʔ ɐ ɡ h i m ʊ ɐ n
aghimuin	ʔ ɐ ɡ h i m ʊ ɪ n
agihap	ʔ ɐ ɰ i h ɐ p
agila	ʔ a ɰ ɪ l a
agimat	ʔ ɐ ɰ i m ɐ t
agimatan	ʔ ɐ ɰ ɪ m a t ɐ n
agingay	ʔ ɐ ɰ i ŋ a ɪ̯
agipo	ʔ ɐ ɰ ɪ p o
agiw	ʔ a ɰ ɪ ʊ̯
aglahi	ʔ ɐ ɡ l a h ɪ ʔ
agnas	ʔ ɐ ɡ n a s
agnos	ʔ ɐ ɡ n o s
agong	ʔ a ɰ o ŋ
agos	ʔ a ɰ o s
agosto	ʔ ɐ ɰ o s t o
agoy	ʔ a ɰ o ɪ̯
agpang	ʔ ɐ ɡ p a ŋ
agrabyado	ʔ ɐ ɡ ɾ ɐ b j a d o
agresibo	ʔ ɐ ɡ ɾ e s i b o
agrikultura	ʔ ɐ ɡ ɾ ɪ x ʊ l t u ɾ ɐ
agrimensor	ʔ ɐ ɡ ɾ ɪ m e n s o ɾ
agsikap	ʔ ɐ ɡ s i x ɐ p
agsikapan	ʔ ɐ ɡ s ɪ x a p ɐ n
agta	ʔ ɐ ɡ t a
aguas	ʔ a ɰ ʊ ɐ s
aguda	ʔ ɐ ɰ u d ɐ
aguha	ʔ ɐ ɰ u h ɐ
aguhilya	ʔ ɐ ɰ ʊ h i l j ɐ
aguho	ʔ ɐ ɰ u h o ʔ
aguho	ʔ ɐ ɰ ʊ h o ʔ
aguhon	ʔ ɐ ɰ ʊ h o n
aguilar	ʔ ɐ ɰ ɪ l a ɾ
aguilera	ʔ ɐ ɰ ɪ l e ɾ ɐ
aguirre	ʔ ɐ ɰ i ɾ e
agulo	ʔ ɐ ɰ u l o
agusan	ʔ ɐ ɰ u s ɐ n
agusil	ʔ ɐ ɰ ʊ s i l
agustin	ʔ ɐ ɰ ʊ s t i n
agustino	ʔ ɐ ɰ ʊ s t i n o
agwa	ʔ a ɡ w ɐ
agwa	ʔ ɐ ɡ w a
agwahe	ʔ ɐ ɡ w a h e
agwamarina	ʔ ɐ ɡ w ɐ m ɐ ɾ i n ɐ
agwaras	ʔ ɐ ɡ w ɐ ɾ a s
agwardiyente	ʔ ɐ ɡ w ɐ ɾ d͡ʒ e n t e
agwardyente	ʔ ɐ ɡ w ɐ ɾ d͡ʒ e n t e
agwas	ʔ a ɡ w ɐ s
agwas	ʔ ɐ ɡ w a s
agwat	ʔ ɐ ɡ w a t
agwela	ʔ ɐ ɡ w e l ɐ
agwelo	ʔ ɐ ɡ w e l o
ahang	ʔ a h ɐ ŋ
ahang	ʔ ɐ h a ŋ
ahas	ʔ a h ɐ s
ahedres	ʔ ɐ h e d ɾ e s
ahensiya	ʔ ɐ h e n ʃ a
ahente	ʔ ɐ h e n t e
ahit	ʔ a h ɪ t
ahit	ʔ ɐ h i t
ahiya	ʔ ɐ h i ɐ
ahunin	ʔ ɐ h u n ɪ n
akademya	ʔ ɐ x ɐ d e m j ɐ
akala	ʔ ɐ x a l ɐ
akala	ʔ ɐ x a l ɐ ʔ
akap	ʔ a x ɐ p
akasya	ʔ ɐ x a ʃ ɐ
akawntant	ʔ ɐ x a ʊ̯ n t ɐ n t
akay	ʔ a x a ɪ̯
akayin	ʔ ɐ x a j ɪ n
akayin	ʔ ɐ x ɐ j i n
akba	ʔ a k b ɐ
akba	ʔ ɐ k b a
akbay	ʔ ɐ k b a ɪ̯
akda	ʔ ɐ k d a ʔ
akibat	ʔ ɐ x i b ɐ t
akiko	ʔ ɐ x i k o
akin	ʔ a x ɪ n
akit	ʔ a x ɪ t
akit	ʔ ɐ x i t
aklan	ʔ ɐ k l a n
aklas	ʔ ɐ k l a s
aklat	ʔ ɐ k l a t
aklatan	ʔ ɐ k l a t ɐ n
akma	ʔ ɐ k m a
akma	ʔ ɐ k m a ʔ
ako	ʔ a x o ʔ
ako	ʔ ɐ x o
akom	ʔ a x o m
akom	ʔ ɐ x o m
akompanya	ʔ ɐ x u m p ɐ ɲ a
akordeon	ʔ ɐ x o ɾ d e o n
akordeon	ʔ ɐ x o ɾ d͡ʒ o n
akreditasyon	ʔ ɐ k ɾ e d ɪ t ɐ ʃ o n
akrostik	ʔ ɐ k ɾ o s t ɪ k
aksaya	ʔ ɐ k s ɐ j a
aksayado	ʔ ɐ k s ɐ j a d o
aksibal	ʔ ɐ k s i b ɐ l
aksidente	ʔ ɐ k s ɪ d e n t e
aksiyon	ʔ ɐ k ʃ o n
aksyon	ʔ ɐ k ʃ o n
aktibidad	ʔ ɐ k t ɪ b ɪ d a d
aktibidades	ʔ ɐ k t ɪ b ɪ d a d e s
aktibismo	ʔ ɐ k t ɪ b i s m o
aktibista	ʔ ɐ k t ɪ b i s t ɐ
aktibo	ʔ ɐ k t i b o
aktor	ʔ ɐ k t o ɾ
aktres	ʔ ɐ k t ɾ e s
aktuwal	ʔ ɐ k t w a l
akuin	ʔ ɐ x u ʔ ɪ n
akumulasyon	ʔ ɐ x ʊ m ʊ l ɐ ʃ o n
akurdiyon	ʔ ɐ x ʊ ɾ d͡ʒ o n
akusa	ʔ ɐ x ʊ s a
akusado	ʔ ɐ x ʊ s a d o
akwarela	ʔ ɐ k w ɐ ɾ e l ɐ
akwaryum	ʔ ɐ k w a ɾ j ʊ m
akyat	ʔ ɐ k j a t
akyatan	ʔ ɐ k j a t ɐ n
akyatan	ʔ ɐ k j ɐ t a n
akyatin	ʔ ɐ k j ɐ t i n
alaala	ʔ ɐ l ɐ ʔ a l ɐ
alaala	ʔ ɐ l ɐ ʔ ɐ l a
alabastro	ʔ ɐ l ɐ b a s t ɾ o
alabok	ʔ ɐ l ɐ b o k
alabwab	ʔ ɐ l ɐ b w a b
alaga	ʔ ɐ l a ɰ ɐ ʔ
alaga	ʔ ɐ l ɐ ɰ a ʔ
alagad	ʔ ɐ l ɐ ɰ a d
alagaw	ʔ ɐ l ɐ ɰ a ʊ̯
alahas	ʔ ɐ l a h ɐ s
alahero	ʔ ɐ l ɐ h e ɾ o
alak	ʔ a l ɐ k
alakdan	ʔ ɐ l ɐ k d a n
alala	ʔ ɐ l a l ɐ
alala	ʔ ɐ l ɐ l a
alalahanin	ʔ a l ɐ l ɐ h ɐ n i n
alalahanin	ʔ ɐ l ɐ l ɐ h a n ɪ n
alalawa	ʔ a l ɐ l ɐ w ɐ ʔ
alalay	ʔ ɐ l a l a ɪ̯
alalay	ʔ ɐ l ɐ l a ɪ̯
alam	ʔ a l ɐ m
alam	ʔ ɐ l a m
alamang	ʔ ɐ l ɐ m a ŋ
alamat	ʔ ɐ l ɐ m a t
alambre	ʔ ɐ l a m b ɾ e
alambrera	ʔ ɐ l ɐ m b ɾ e ɾ ɐ
alamid	ʔ ɐ l ɐ m i d
alamin	ʔ ɐ l ɐ m i n
alampay	ʔ ɐ l ɐ m p a ɪ̯
alangaang	ʔ ɐ l ɐ ŋ a ʔ ɐ ŋ
alangan	ʔ ɐ l ɐ ŋ a n
alanganin	ʔ ɐ l ɐ ŋ a n ɪ n
alangilan	ʔ ɐ l ɐ ŋ i l ɐ n
alapaw	ʔ ɐ l a p a ʊ̯
alarma	ʔ ɐ l a ɾ m ɐ
alas	ʔ ɐ l a s
alaskador	ʔ ɐ l ɐ s k ɐ d o ɾ
alat	ʔ a l ɐ t
alay	ʔ a l a ɪ̯
alba	ʔ a l b ɐ
albahaka	ʔ ɐ l b ɐ h a x ɐ
albakora	ʔ ɐ l b ɐ x o ɾ ɐ
albanya	ʔ ɐ l b a ɲ ɐ
albarikoke	ʔ ɐ l b ɐ ɾ ɪ x o k e
albay	ʔ ɐ l b a ɪ̯
alberto	ʔ ɐ l b e ɾ t o
alboroto	ʔ ɐ l b o ɾ o t o
albularyo	ʔ ɐ l b ʊ l a ɾ j o
alcaide	ʔ ɐ l k a ɪ̯ d e
aldover	ʔ ɐ l d o b e ɾ
alegre	ʔ ɐ l e ɡ ɾ e
aleman	ʔ ɐ l e m a n
alemanya	ʔ ɐ l e m a ɲ ɐ
algodon	ʔ ɐ l ɡ o d o n
alguwasil	ʔ ɐ l ɡ ʊ ɐ s i l
alibadbad	ʔ ɐ l ɪ b ɐ d b a d
alibugha	ʔ ɐ l ɪ b ʊ ɡ h a ʔ
aligaga	ʔ ɐ l ɪ ɰ ɐ ɡ a ʔ
aligi	ʔ ɐ l ɪ ɰ i
alikabok	ʔ ɐ l ɪ x ɐ b o k
alila	ʔ ɐ l i l ɐ ʔ
alilis	ʔ ɐ l i l ɪ s
alilis	ʔ ɐ l ɪ l i s
alilisan	ʔ a l ɪ l ɪ s a n
alimango	ʔ ɐ l ɪ m a ŋ o
alimasag	ʔ ɐ l ɪ m a s ɐ ɡ
alimis	ʔ ɐ l ɪ m i s
alimpayawan	ʔ ɐ l ɪ m p ɐ j a w ɐ n
alimpungat	ʔ ɐ l ɪ m p ʊ ŋ a t
alimpuyo	ʔ ɐ l ɪ m p ʊ j o
alimuom	ʔ ɐ l ɪ m u ʔ o m
alimuom	ʔ ɐ l ɪ m ʊ ʔ o m
alimuran	ʔ ɐ l ɪ m ʊ ɾ a n
alin	ʔ ɐ l i n
alindog	ʔ ɐ l ɪ n d o ɡ
aling	ʔ a l ɪ ŋ
aling	ʔ ɐ l i ŋ
alingasaw	ʔ ɐ l ɪ ŋ a s a ʊ̯
alingasngas	ʔ ɐ l ɪ ŋ ɐ s ŋ a s
alingawngaw	ʔ ɐ l ɪ ŋ a ʊ̯ ŋ a ʊ̯
alinlangan	ʔ ɐ l ɪ n l a ŋ ɐ n
alinman	ʔ ɐ l ɪ m m a n
alinsunod	ʔ ɐ l ɪ n s u n o d
alintana	ʔ ɐ l ɪ n t a n ɐ
alipato	ʔ ɐ l ɪ p a t o
alipin	ʔ ɐ l i p ɪ n
alipunga	ʔ ɐ l ɪ p ʊ ŋ a
alipusta	ʔ ɐ l ɪ p ʊ s t a ʔ
alis	ʔ ɐ l i s
alisagsag	ʔ ɐ l ɪ s ɐ ɡ s a ɡ
alisangsang	ʔ ɐ l ɪ s ɐ ŋ s a ŋ
alisin	ʔ ɐ l ɪ s i n
alisto	ʔ ɐ l i s t o
alit	ʔ a l ɪ t
alitan	ʔ ɐ l i t ɐ n
alitangya	ʔ ɐ l ɪ t ɐ ŋ j a
alitaptap	ʔ ɐ l ɪ t ɐ p t a p
aliw	ʔ a l ɪ ʊ̯
aliw	ʔ ɐ l i ʊ̯
alkabus	ʔ ɐ l k ɐ b u s
alkabusero	ʔ ɐ l k ɐ b ʊ s e ɾ o
alkalde	ʔ ɐ l k a l d e
alkaldesa	ʔ ɐ l k ɐ l d e s ɐ
alkansiya	ʔ ɐ l k ɐ n s i ɐ
alkansiya	ʔ ɐ l k ɐ n ʃ a
alkansya	ʔ ɐ l k a n ʃ ɐ
alkatsopas	ʔ ɐ l k ɐ t͡ʃ o p ɐ s
alkitran	ʔ ɐ l k ɪ t ɾ a n
alkohol	ʔ ɐ l k o h o l
alma	ʔ ɐ l m a
almaden	ʔ ɐ l m ɐ d e n
almarez	ʔ ɐ l m ɐ ɾ e s
almario	ʔ ɐ l m a ɾ ɪ o
almasiga	ʔ ɐ l m a s ɪ ɰ a
almasiga	ʔ ɐ l m ɐ s i ɰ ɐ
almeha	ʔ ɐ l m e h ɐ
almendrala	ʔ ɐ l m e n d ɾ a l ɐ
almirante	ʔ ɐ l m ɪ ɾ a n t e
almirol	ʔ ɐ l m ɪ ɾ o l
almohadilya	ʔ ɐ l m o h ɐ d i l j ɐ
almon	ʔ ɐ l m o n
almoranas	ʔ ɐ l m o ɾ a n ɐ s
almusal	ʔ ɐ l m ʊ s a l
almuwada	ʔ ɐ l m w ɐ d ɐ
alog	ʔ ɐ l o ɡ
alok	ʔ ɐ l o k
alonte	ʔ ɐ l o n t e
alonto	ʔ ɐ l o n t o
aloy	ʔ a l o ɪ̯
alpa	ʔ ɐ l p a
alpabeto	ʔ ɐ l p ɐ b e t o
alpaka	ʔ ɐ l p a x ɐ
alpapa	ʔ ɐ l p a p ɐ
alpay	ʔ a l p a ɪ̯
alpay	ʔ ɐ l p a ɪ̯
alperes	ʔ ɐ l p e ɾ e s
alsa	ʔ ɐ l s a
altapresyon	ʔ ɐ l t ɐ p ɾ e ʃ o n
altar	ʔ ɐ l t a ɾ
alternatibo	ʔ ɐ l t e ɾ n ɐ t i b o
alugin	ʔ ɐ l ʊ ɰ i n
alulod	ʔ ɐ l ʊ l o d
alulong	ʔ ɐ l ʊ l o ŋ
aluminyo	ʔ ɐ l ʊ m i ɲ o
alupag	ʔ ɐ l u p ɐ ɡ
alupag	ʔ ɐ l ʊ p a ɡ
alupihan	ʔ ɐ l ʊ p i h ɐ n
alusema	ʔ ɐ l ʊ s e m ɐ
alusitha	ʔ ɐ l ʊ s ɪ t h a ʔ
alvarez	ʔ a l b ɐ ɾ e s
alviar	ʔ ɐ l b j a ɾ
alwagi	ʔ ɐ l w a ɰ ɪ
alyansa	ʔ ɐ l j a n s ɐ
alyas	ʔ a l j ɐ s
alyas	ʔ ɐ l j a s
am	ʔ ɐ m
ama	ʔ a m ɐ
ama	ʔ ɐ m a
amag	ʔ a m ɐ ɡ
amain	ʔ ɐ m a i n
amak	ʔ a m ɐ k
amak	ʔ ɐ m a k
amam	ʔ a m ɐ m
amama	ʔ ɐ m a m ɐ
amansinaya	ʔ ɐ m ɐ n s ɪ n a j ɐ ʔ
amante	ʔ ɐ m a n t e
amapola	ʔ ɐ m ɐ p o l ɐ
amaranto	ʔ ɐ m ɐ ɾ a n t o
amarilyo	ʔ ɐ m ɐ ɾ i l j o
amas	ʔ ɐ m a s
amatista	ʔ ɐ m ɐ t i s t ɐ
amba	ʔ ɐ m b a ʔ
ambag	ʔ ɐ m b a ɡ
ambi	ʔ ɐ m b i ʔ
ambisyon	ʔ ɐ m b ɪ ʃ o n
ambisyosa	ʔ ɐ m b ɪ ʃ o s ɐ
ambisyoso	ʔ ɐ m b ɪ ʃ o s o
ambon	ʔ ɐ m b o n
ambubuyog	ʔ ɐ m b ʊ b u j o ɡ
ambulansiya	ʔ ɐ m b ʊ l a n ʃ a
ambuwang	ʔ ɐ m b w a ŋ
amen	ʔ ɐ m e n
amerika	ʔ ɐ m e ɾ ɪ x a
amerikana	ʔ ɐ m e ɾ ɪ x a n ɐ
amerikano	ʔ ɐ m e ɾ ɪ x a n o
amihan	ʔ ɐ m i h ɐ n
amil	ʔ a m ɪ l
amil	ʔ ɐ m i l
amilyar	ʔ ɐ m ɪ l j a ɾ
amilyaramyento	ʔ ɐ m ɪ l j ɐ ɾ ɐ m j e n t o
amin	ʔ a m ɪ n
aminado	ʔ ɐ m ɪ n a d o
aminin	ʔ ɐ m i n ɪ n
amis	ʔ a m ɪ s
amis	ʔ ɐ m i s
amnestiya	ʔ ɐ m n e s t i ɐ
amo	ʔ ɐ m o ʔ
amogis	ʔ ɐ m o ɰ ɪ s
amonya	ʔ ɐ m o ɲ ɐ
amoranto	ʔ ɐ m o ɾ a n t o
amoritis	ʔ ɐ m o ɾ i t ɪ s
amorseko	ʔ ɐ m o ɾ s e x o
amorsiko	ʔ ɐ m o ɾ s i x o
amos	ʔ ɐ m o s
amoy	ʔ ɐ m o ɪ̯
ampalaya	ʔ ɐ m p ɐ l ɐ j a
ampang	ʔ ɐ m p a ŋ
ampaw	ʔ a m p a ʊ̯
ampaw	ʔ ɐ m p a ʊ̯
amperyo	ʔ ɐ m p e ɾ j o
ampibyan	ʔ ɐ m p i b j ɐ n
ampiteatro	ʔ ɐ m p ɪ t e ɐ t ɾ o
ampon	ʔ ɐ m p o n
ampunan	ʔ ɐ m p u n ɐ n
ampunan	ʔ ɐ m p ʊ n a n
amugis	ʔ ɐ m u ɰ ɪ s
amurao	ʔ ɐ m ʊ ɾ a ʊ̯
amuyong	ʔ ɐ m u j o ŋ
amyenda	ʔ ɐ m j e n d ɐ
amyendahan	ʔ ɐ m j e n d ɐ h a n
anahaw	ʔ ɐ n a h a ʊ̯
anak	ʔ a n ɐ k
anak	ʔ ɐ n a k
anakroniko	ʔ ɐ n ɐ k ɾ o n ɪ x o
anakronismo	ʔ ɐ n ɐ k ɾ o n i s m o
analisador	ʔ ɐ n ɐ l ɪ s ɐ d o ɾ
analisis	ʔ ɐ n a l ɪ s i s
analitika	ʔ ɐ n ɐ l i t ɪ x a
analitiko	ʔ ɐ n ɐ l i t ɪ x o
analohiya	ʔ ɐ n ɐ l o h i ɐ
anaman	ʔ ɐ n ɐ m a n
ananapla	ʔ ɐ n ɐ n ɐ p l a
anarkiya	ʔ ɐ n ɐ ɾ k i ɐ
anas	ʔ ɐ n a s
anasan	ʔ a n a s ɐ n
anatomista	ʔ ɐ n ɐ t o m i s t ɐ
anatomiya	ʔ ɐ n ɐ t o m i ɐ
anatomiya	ʔ ɐ n ɐ t o m j a
anay	ʔ a n a ɪ̯
anayad	ʔ ɐ n a j ɐ d
anayin	ʔ ɐ n a j ɪ n
anayo	ʔ ɐ n a j o
anayo	ʔ ɐ n a j o ʔ
anda	ʔ a n d ɐ
andaderas	ʔ ɐ n d ɐ d e ɾ ɐ s
andal	ʔ ɐ n d a l
andam	ʔ ɐ n d a m
andap	ʔ ɐ n d a p
andar	ʔ ɐ n d a ɾ
andaya	ʔ ɐ n d a j ɐ
andora	ʔ ɐ n d o ɾ ɐ
anga	ʔ ɐ ŋ a
anga	ʔ ɐ ŋ a ʔ
angal	ʔ a ŋ ɐ l
angal	ʔ ɐ ŋ a l
angas	ʔ a ŋ ɐ s
angas	ʔ ɐ ŋ a s
angat	ʔ ɐ ŋ a t
angaw	ʔ a ŋ a ʊ̯
anggo	ʔ ɐ ŋ ɡ o
anggulo	ʔ a ŋ ɡ ʊ l o
anghang	ʔ ɐ ŋ h a ŋ
anghel	ʔ ɐ ŋ h e l
anghit	ʔ ɐ ŋ h i t
angi	ʔ ɐ ŋ i
angis	ʔ ɐ ŋ i s
angkak	ʔ ɐ ŋ k a k
angkan	ʔ ɐ ŋ k a n
angkas	ʔ ɐ ŋ k a s
angkat	ʔ ɐ ŋ k a t
angkin	ʔ ɐ ŋ k i n
angkla	ʔ a ŋ k l ɐ
angkop	ʔ ɐ ŋ k o p
ango	ʔ ɐ ŋ o
angot	ʔ ɐ ŋ o t
angpao	ʔ a ŋ p a ʊ̯
anhin	ʔ ɐ ŋ h i n
ani	ʔ a n ɪ
ani	ʔ ɐ n i
anib	ʔ a n ɪ b
anibersaryo	ʔ ɐ n ɪ b e ɾ s a ɾ j o
anila	ʔ a n ɪ l a
anila	ʔ ɐ n i l ɐ
anim	ʔ a n ɪ m
animal	ʔ ɐ n ɪ m a l
animnapu	ʔ ɐ n ɪ m n ɐ p u ʔ
animnaraan	ʔ ɐ n ɪ m n ɐ ɾ ɐ ʔ a n
aninag	ʔ ɐ n i n ɐ ɡ
aninaw	ʔ ɐ n i n a ʊ̯
aninaw	ʔ ɐ n ɪ n a ʊ̯
anino	ʔ ɐ n i n o
anis	ʔ ɐ n i s
anislag	ʔ ɐ n i s l ɐ ɡ
anit	ʔ a n ɪ t
anit	ʔ ɐ n i t
anito	ʔ ɐ n i t o
anito	ʔ ɐ n ɪ t o
aniya	ʔ ɐ ɲ a
anlaw	ʔ ɐ n l a ʊ̯
anluwagi	ʔ ɐ n l w ɐ ɰ ɪ
ano	ʔ ɐ n o
anomalya	ʔ ɐ n o m ɐ l j a
anonang	ʔ ɐ n o n ɐ ŋ
anonas	ʔ ɐ n o n ɐ s
anor	ʔ ɐ n o ɾ
anos	ʔ ɐ n o s
anot	ʔ ɐ n o t
anta	ʔ a n t ɐ
anta	ʔ ɐ n t a
antabay	ʔ ɐ n t a b a ɪ̯
antak	ʔ ɐ n t a k
antala	ʔ ɐ n t a l ɐ
antanda	ʔ ɐ n t ɐ n d a ʔ
antas	ʔ ɐ n t a s
antay	ʔ ɐ n t a ɪ̯
antena	ʔ ɐ n t e n ɐ
antibiyotiko	ʔ ɐ n t ɪ b j o t ɪ x o
antig	ʔ ɐ n t i ɡ
antik	ʔ ɐ n t i k
antilope	ʔ ɐ n t i l o p e
antipalo	ʔ ɐ n t ɪ p a l o
antipolo	ʔ ɐ n t ɪ p o l o
antipona	ʔ ɐ n t i p o n a
antique	ʔ ɐ n t i x e
antok	ʔ ɐ n t o k
antot	ʔ ɐ n t o t
antraks	ʔ a n t ɾ ɐ k s
antropolohiya	ʔ ɐ n t ɾ o p o l o h i ɐ
antukin	ʔ ɐ n t u x ɪ n
antukin	ʔ ɐ n t ʊ x i n
anubing	ʔ ɐ n u b ɪ ŋ
anuhin	ʔ ɐ n ʊ h i n
anunsiyo	ʔ ɐ n u n ʃ o
anunsyo	ʔ ɐ n u n ʃ o
anwang	ʔ ɐ n w a ŋ
anyaya	ʔ ɐ ɲ ɐ j ɐ
anyaya	ʔ ɐ ɲ ɐ j ɐ ʔ
anyayahan	ʔ ɐ ɲ ɐ j a h ɐ n
anyo	ʔ a ɲ o
anyo	ʔ ɐ ɲ o ʔ
apa	ʔ a p ɐ
apa	ʔ ɐ p a ʔ
apahap	ʔ ɐ p a h ɐ p
apak	ʔ a p ɐ k
apak	ʔ ɐ p a k
apalit	ʔ ɐ p a l ɪ t
apalya	ʔ ɐ p ɐ l j a
aparador	ʔ ɐ p ɐ ɾ ɐ d o ɾ
aparato	ʔ ɐ p ɐ ɾ a t o
apat	ʔ a p ɐ t
apatnapu	ʔ ɐ p ɐ t n ɐ p u ʔ
apatnaraan	ʔ ɐ p ɐ t n ɐ ɾ ɐ ʔ a n
apaw	ʔ a p a ʊ̯
apaw	ʔ ɐ p a ʊ̯
apaya	ʔ ɐ p a j ɐ
apayao	ʔ ɐ p a j ɐ o
apayao	ʔ ɐ p ɐ j a ʊ̯
apdo	ʔ ɐ p d o
apektado	ʔ ɐ p e k t a d o
apekto	ʔ ɐ p e k t o
apela	ʔ ɐ p e l a
apelyido	ʔ ɐ p e l j i d o
apendisitis	ʔ ɐ p e n d ɪ s i t ɪ s
apganistan	ʔ ɐ p ɡ ɐ n ɪ s t a n
api	ʔ ɐ p i
apid	ʔ ɐ p i d
apihin	ʔ ɐ p ɪ h i n
apila	ʔ ɐ p ɪ l a
apilado	ʔ ɐ p ɪ l a d o
apir	ʔ ɐ p i ɾ
apitong	ʔ ɐ p i t o ŋ
aplaya	ʔ ɐ p l a j ɐ
aplikante	ʔ ɐ p l ɪ x a n t e
aplikasyon	ʔ ɐ p l ɪ x ɐ ʃ o n
apo	ʔ ɐ p o
apokripos	ʔ ɐ p o k ɾ ɪ p o s
apolo	ʔ ɐ p o l o
apolonio	ʔ ɐ p o l o n ɪ o
apostasiya	ʔ ɐ p o s t ɐ s i ɐ
apostata	ʔ ɐ p o s t ɐ t a
apostol	ʔ ɐ p o s t o l
apostolado	ʔ ɐ p o s t o l a d o
apostoliko	ʔ ɐ p o s t o l ɪ x o
apoy	ʔ ɐ p o ɪ̯
apresasyon	ʔ ɐ p ɾ e s ɐ ʃ o n
apresyasyon	ʔ ɐ p ɾ e ʃ ɐ ʃ o n
aprika	ʔ a p ɾ ɪ x ɐ
aprikana	ʔ ɐ p ɾ ɪ x a n ɐ
aprikano	ʔ ɐ p ɾ ɪ x a n o
aprikot	ʔ a p ɾ ɪ x o t
apritada	ʔ ɐ p ɾ ɪ t a d ɐ
aproba	ʔ ɐ p ɾ o b a
aprobado	ʔ ɐ p ɾ o b a d o
apula	ʔ ɐ p u l ɐ ʔ
apula	ʔ ɐ p ʊ l a ʔ
apura	ʔ ɐ p ʊ ɾ a
apurado	ʔ ɐ p ʊ ɾ a d o
apuybilos	ʔ ɐ p ʊ ɪ b i l o s
apyak	ʔ ɐ p j a k
apyan	ʔ ɐ p j a n
aquino	ʔ ɐ x i n o
arabe	ʔ ɐ ɾ ɐ b e
arabo	ʔ ɐ ɾ a b o
arabya	ʔ ɐ ɾ a b j ɐ
aral	ʔ a ɾ ɐ l
aral	ʔ ɐ ɾ a l
aralin	ʔ ɐ ɾ a l ɪ n
aralin	ʔ ɐ ɾ ɐ l i n
aranda	ʔ ɐ ɾ a n d ɐ
arangkada	ʔ ɐ ɾ ɐ ŋ k a d ɐ
aranya	ʔ ɐ ɾ a ɲ ɐ
aranya	ʔ ɐ ɾ ɐ ɲ a
arap	ʔ a ɾ ɐ p
araro	ʔ ɐ ɾ a ɾ o
araru	ʔ ɐ ɾ ɐ ɾ u
aras	ʔ a ɾ ɐ s
aratiles	ʔ ɐ ɾ a t ɪ l e s
aratilis	ʔ ɐ ɾ a t ɪ l i s
araw	ʔ a ɾ a ʊ̯
araw	ʔ ɐ ɾ a ʊ̯
arawan	ʔ ɐ ɾ a w ɐ n
arawan	ʔ ɐ ɾ ɐ w a n
aray	ʔ ɐ ɾ a ɪ̯
arañas	ʔ ɐ ɾ a ɲ ɐ s
arcega	ʔ ɐ ɾ s e ɰ ɐ
arcilla	ʔ ɐ ɾ s i l l ɐ
arcillas	ʔ ɐ ɾ s i l l ɐ s
arcinas	ʔ ɐ ɾ s i n ɐ s
ardilya	ʔ ɐ ɾ d i l j ɐ
are	ʔ ɐ ɾ e
areglo	ʔ ɐ ɾ e ɡ l o
arellano	ʔ ɐ ɾ e l j ɐ n o
arenas	ʔ ɐ ɾ e n ɐ s
arestado	ʔ ɐ ɾ e s t a d o
aresto	ʔ ɐ ɾ e s t o
arevalo	ʔ ɐ ɾ e b ɐ l o
argente	ʔ ɐ ɾ h e n t e
argolya	ʔ ɐ ɾ ɡ o l j ɐ
argumento	ʔ ɐ ɾ ɡ ʊ m e n t o
arhentina	ʔ ɐ ɾ h e n t i n ɐ
ari	ʔ a ɾ ɪ ʔ
ari	ʔ ɐ ɾ e
ari	ʔ ɐ ɾ i
arilyos	ʔ ɐ ɾ i l j o s
arina	ʔ ɐ ɾ i n ɐ
aristoteles	ʔ ɐ ɾ ɪ s t o t e l e s
arkanghel	ʔ ɐ ɾ k a ŋ h e l
arkanghel	ʔ ɐ ɾ k ɐ ŋ h e l
arkeologo	ʔ ɐ ɾ k e o l o ɰ o
arkeolohiya	ʔ ɐ ɾ k e o l o h i ɐ
arkila	ʔ a ɾ k ɪ l a
arkitekto	ʔ ɐ ɾ k ɪ t e k t o
arkitektura	ʔ ɐ ɾ k ɪ t e k t u ɾ ɐ
armadilyo	ʔ ɐ ɾ m ɐ d i l j o
armado	ʔ ɐ ɾ m a d o
armalayt	ʔ a ɾ m ɐ l a ɪ̯ t
armas	ʔ a ɾ m ɐ s
armas	ʔ ɐ ɾ m a s
armenya	ʔ ɐ ɾ m e ɲ ɐ
arminyo	ʔ ɐ ɾ m i ɲ o
armonika	ʔ ɐ ɾ m o n ɪ x a
arnibal	ʔ ɐ ɾ n i b ɐ l
arnis	ʔ ɐ ɾ n i s
arogante	ʔ ɐ ɾ o ɰ a n t e
aroma	ʔ ɐ ɾ o m ɐ
aroskaldo	ʔ ɐ ɾ o s k a l d o
arpiya	ʔ ɐ ɾ p i ɐ
arquiza	ʔ ɐ ɾ k i s ɐ
arriola	ʔ ɐ ɾ i o l ɐ
arrogante	ʔ ɐ ɾ o ɰ a n t e
arroyo	ʔ ɐ ɾ o j o
arseniko	ʔ ɐ ɾ s e n ɪ x o
arsilya	ʔ ɐ ɾ s i l j ɐ
arsobispado	ʔ ɐ ɾ s o b ɪ s p a d o
arsobispo	ʔ ɐ ɾ s o b i s p o
artiaga	ʔ ɐ ɾ ʃ ɐ ɰ ɐ
artikulo	ʔ ɐ ɾ t i x ʊ l o
artipisyal	ʔ ɐ ɾ t ɪ p ɪ ʃ a l
artista	ʔ ɐ ɾ t i s t ɐ
arwa	ʔ ɐ ɾ w a ʔ
arya	ʔ a ɾ j ɐ
arzadon	ʔ ɐ ɾ s a d o n
asa	ʔ a s ɐ
asada	ʔ ɐ s a d ɐ
asahan	ʔ ɐ s a h ɐ n
asal	ʔ a s ɐ l
asam	ʔ ɐ s a m
asamblea	ʔ ɐ s ɐ m b l e j ɐ
asambleista	ʔ ɐ s ɐ m b l e ʔ i s t ɐ
asanorya	ʔ ɐ s ɐ n o ɾ j ɐ
asap	ʔ a s ɐ p
asap	ʔ ɐ s a p
asar	ʔ ɐ s a ɾ
asarol	ʔ ɐ s ɐ ɾ o l
asawa	ʔ ɐ s a w ɐ
asbesto	ʔ ɐ s b e s t o
asbok	ʔ ɐ s b o k
asendero	ʔ ɐ s e n d e ɾ o
asenso	ʔ ɐ s e n s o
aserbayan	ʔ ɐ s e ɾ b ɐ j a n
asido	ʔ a s ɪ d o
asignatura	ʔ ɐ s ɪ ɡ n ɐ t u ɾ ɐ
asikaso	ʔ ɐ s ɪ x a s o
asilo	ʔ ɐ s i l o
asim	ʔ a s ɪ m
asin	ʔ ɐ s i n
asindero	ʔ ɐ s ɪ n d e ɾ o
asinta	ʔ ɐ s ɪ n t a
asiwa	ʔ ɐ s i w ɐ ʔ
asiwa	ʔ ɐ s ɪ w a ʔ
askal	ʔ a s k ɐ l
asngal	ʔ ɐ s ŋ a l
aso	ʔ ɐ s o
asog	ʔ ɐ s o ɡ
asoge	ʔ ɐ s o ɰ e
asosasyon	ʔ ɐ s o s ɐ ʃ o n
aspalto	ʔ ɐ s p a l t o
aspekto	ʔ ɐ s p e k t o
aspeto	ʔ ɐ s p e t o
aspile	ʔ ɐ s p ɪ l e
aspin	ʔ a s p ɪ n
aspirina	ʔ ɐ s p ɪ ɾ i n ɐ
asta	ʔ a s t ɐ
asta	ʔ ɐ s t a ʔ
astaka	ʔ ɐ s t a x ɐ ʔ
astaka	ʔ ɐ s t ɐ x a ʔ
astig	ʔ ɐ s t i ɡ
astinggal	ʔ ɐ s t ɪ ŋ ɡ a l
astrolohiya	ʔ ɐ s t ɾ o l o h i ɐ
astronomiya	ʔ ɐ s t ɾ o n o m i ɐ
astropisika	ʔ ɐ s t ɾ o p i s ɪ x ɐ
asukal	ʔ ɐ s u x ɐ l
asukarera	ʔ ɐ s ʊ x ɐ ɾ e ɾ ɐ
asul	ʔ ɐ s u l
asungot	ʔ ɐ s u ŋ o t
asunto	ʔ ɐ s u n t o
asupre	ʔ ɐ s u p ɾ e
asusena	ʔ ɐ s ʊ s e n ɐ
aswang	ʔ ɐ s w a ŋ
asya	ʔ a ʃ ɐ
asyano	ʔ ɐ ʃ ɐ n o
asyenda	ʔ ɐ ʃ e n d ɐ
at	ʔ ɐ t
ata	ʔ a t ɐ
ata	ʔ a t ɐ ʔ
atake	ʔ ɐ t a x e
atang	ʔ a t ɐ ŋ
atang	ʔ ɐ t a ŋ
atangya	ʔ ɐ t ɐ ŋ j a
atas	ʔ a t ɐ s
atas	ʔ ɐ t a s
atat	ʔ ɐ t a t
ataud	ʔ ɐ t ɐ ʔ u d
ataul	ʔ ɐ t ɐ ʔ u l
atay	ʔ a t a ɪ̯
atay	ʔ ɐ t a ɪ̯
atayin	ʔ ɐ t ɐ j i n
ate	ʔ ɐ t e
ate	ʔ ɐ t e ʔ
atenas	ʔ ɐ t e n ɐ s
atendido	ʔ ɐ t e n d i d o
atensiyon	ʔ ɐ t e n ʃ o n
athanasia	ʔ ɐ t h ɐ n a s ɪ ɐ
atig	ʔ ɐ t i ɡ
atigin	ʔ ɐ t ɪ ɰ i n
atik	ʔ ɐ t i k
atikha	ʔ ɐ t ɪ k h a ʔ
atin	ʔ a t ɪ n
atip	ʔ ɐ t i p
atis	ʔ a t ɪ s
atlantiko	ʔ ɐ t l a n t ɪ x o
atleta	ʔ ɐ t l e t ɐ
atras	ʔ ɐ t ɾ a s
atraso	ʔ ɐ t ɾ a s o
atrebida	ʔ ɐ t ɾ e b i d ɐ
atrebido	ʔ ɐ t ɾ e b i d o
atribida	ʔ ɐ t ɾ ɪ b i d ɐ
atribido	ʔ ɐ t ɾ ɪ b i d o
atribusyon	ʔ ɐ t ɾ ɪ b ʊ ʃ o n
atsara	ʔ ɐ t͡ʃ a ɾ ɐ
atsi	ʔ a t͡ʃ ɪ
atsi	ʔ ɐ t͡ʃ i
atsoy	ʔ ɐ t͡ʃ o ɪ̯
atsuwete	ʔ ɐ t͡ʃ ʊ e t e
atubili	ʔ ɐ t ʊ b i l ɪ ʔ
atubili	ʔ ɐ t ʊ b ɪ l i
atubili	ʔ ɐ t ʊ b ɪ l i ʔ
atungal	ʔ ɐ t u ŋ ɐ l
atupag	ʔ ɐ t u p ɐ ɡ
audrey	ʔ a ʊ̯ d ɾ e ɪ̯
aurora	ʔ a ʊ̯ ɾ o ɾ ɐ
avanceña	ʔ ɐ b ɐ n s e ɲ ɐ
avendaño	ʔ ɐ b e n d a ɲ o
aw	ʔ a ʊ̯
awa	ʔ a w ɐ ʔ
awak	ʔ a w ɐ k
awak	ʔ ɐ w a k
awang	ʔ ɐ w a ŋ
awanggan	ʔ ɐ w ɐ ŋ ɡ a n
awat	ʔ a w ɐ t
awat	ʔ ɐ w a t
away	ʔ a w a ɪ̯
awayan	ʔ ɐ w ɐ j a n
awayin	ʔ ɐ w a j ɪ n
awit	ʔ a w ɪ t
awstralya	ʔ a ʊ̯ s t ɾ ɐ l j ɐ
awstriya	ʔ a ʊ̯ s t ɾ ɪ ɐ
awtismo	ʔ a ʊ̯ t i s m o
awtomatiko	ʔ a ʊ̯ t o m a t ɪ x o
awtonomiya	ʔ a ʊ̯ t o n o m i ɐ
awtopsiya	ʔ a ʊ̯ t o p ʃ a
awtor	ʔ a ʊ̯ t o ɾ
awtoridad	ʔ a ʊ̯ t o ɾ ɪ d a d
awtoridad	ʔ o t o ɾ ɪ d a d
awtorisado	ʔ a ʊ̯ t o ɾ ɪ s a d o
awtorisado	ʔ o t o ɾ ɪ s a d o
awtorisasyon	ʔ a ʊ̯ t o ɾ ɪ s ɐ ʃ o n
awtorisasyon	ʔ o t o ɾ ɪ s ɐ ʃ o n
ay	ʔ a ɪ̯
aya	ʔ a j ɐ
aya	ʔ a j ɐ ʔ
ayako	ʔ ɐ j a x o
ayam	ʔ a j ɐ m
ayan	ʔ ɐ j a n
ayangaw	ʔ ɐ j ɐ ŋ a ʊ̯
ayaw	ʔ a j a ʊ̯
ayaw	ʔ ɐ j a ʊ̯
ayon	ʔ ɐ j o n
ayos	ʔ ɐ j o s
aysing	ʔ a ɪ̯ s ɪ ŋ
ayson	ʔ a ɪ̯ s o n
ayta	ʔ a ɪ̯ t a
ayuda	ʔ ɐ j u d ɐ
ayumi	ʔ ɐ j u m ɪ
ayungin	ʔ ɐ j u ŋ ɪ n
ayuno	ʔ ɐ j u n o
ayusin	ʔ ɐ j u s ɪ n
ayusin	ʔ ɐ j ʊ s i n
ayuyang	ʔ ɐ j ʊ j a ŋ
aywan	ʔ a ɪ̯ w a n
aywan	ʔ e w ɐ n
azaña	ʔ ɐ s a ɲ ɐ
azucena	ʔ ɐ s ʊ s e n ɐ
añonuevo	ʔ ɐ ɲ o n u e b o
ba	b ɐ
ba't	b ɐ t
baang	b a ʔ ɐ ŋ
baang	b ɐ ʔ a ŋ
baat	b ɐ ʔ a t
baba	b a b ɐ ʔ
baba	b ɐ b a
baba	b ɐ b a ʔ
babaan	b a b a ʔ ɐ n
babaan	b a b ɐ ʔ a n
babaan	b ɐ b ɐ ʔ a n
babad	b a b ɐ d
babad	b ɐ b a d
babae	b ɐ b a ʔ e
babaero	b ɐ b ɐ ʔ e ɾ o
babag	b a b ɐ ɡ
babag	b ɐ b a ɡ
babaihin	b ɐ b ɐ ʔ i h ɪ n
babala	b ɐ b ɐ l a ʔ
babao	b a b a ʊ̯
babasa	b ɐ b a s ɐ
babasagin	b ɐ b ɐ s a ɰ ɪ n
babasagin	b ɐ b ɐ s ɐ ɰ i n
babasahin	b ɐ b ɐ s a h ɪ n
babasahin	b ɐ b ɐ s ɐ h i n
babat	b a b ɐ t
babaw	b a b a ʊ̯
babay	b a b a ɪ̯
babayaran	b ɐ b ɐ j a ɾ ɐ n
babayaran	b ɐ b ɐ j ɐ ɾ a n
babaye	b ɐ b a j e
babaylan	b ɐ b a ɪ̯ l a n
babero	b ɐ b e ɾ o
baboy	b a b o ɪ̯
babuyan	b ɐ b u j ɐ n
babuyan	b ɐ b ʊ j a n
babuyin	b ɐ b u j ɪ n
bacani	b ɐ x a n ɪ
bacas	b ɐ x a s
baclad	b ɐ k l a d
baclig	b a k l ɪ ɡ
bacoor	b ɐ x o ʔ o ɾ
bacsa	b a k s ɐ
baculi	b ɐ x u l ɪ
badaho	b ɐ d a h o
badayos	b ɐ d a j o s
bading	b ɐ d i ŋ
badminton	b a d m ɪ n t o n
badminton	b ɐ d m ɪ n t o n
baduy	b ɐ d u ɪ
badya	b ɐ d͡ʒ a
badyet	b a d͡ʒ e t
bag	b ɐ ɡ
baga	b a ɰ ɐ
baga	b a ɰ ɐ ʔ
baga	b ɐ ɰ a
baga	b ɐ ɰ a ʔ
bagabag	b ɐ ɰ a b ɐ ɡ
bagabag	b ɐ ɰ ɐ b a ɡ
bagahe	b ɐ ɰ a h e
bagal	b a ɰ ɐ l
bagalan	b ɐ ɰ a l ɐ n
bagama't	b ɐ ɰ ɐ m a t
bagaman	b ɐ ɰ ɐ m a n
