أحبك	ʔ a ħ ʊ bː a k
أحبك	ʔ a ħ ʊ bː ɪ k
أخطبوط	ʔ a x tˤ a b uː tˤ
أكتوبر	ʔ o̞ k t o̞ː b a r
أكرانيا	ʔ o̞ k r aː n j a
إستونيا	ʔ e̞ s t o̞ː n j a
إستونيا	ʔ ɪ s t o̞ː n j a
إله	ʔ ɪ l aː h
إلين	ʔ e̞ l e̞ː n
إيش	ʔ e̞ː ʃ
إيقاع	ʔ iː q aː ʕ
إيميل	ʔ iː m e̞ː l
اسم	e̞ s e̞ m
اقتصاد	ɪ q t ɪ sˤ aː d
البلقان	a l b a l q aː n
العراق	a l ʕ ɪ r aː ɡ
القدس	a l q ʊ d s
القدس	a l ɡ ʊ d s
انقلاب	ɪ ŋ q ɪ l aː b
بشع	b ɪ ʃ e̞ ʕ
بطريق	b a tˤ r iː q
بقرة	b a ɡ a r a
بقلاوة	b ɪ ɡ l aː w a
بلكونة	b a l a k o̞ː n a
بوسة	b o̞ː s a
بولندا	b o̞ː l a n d a
بيت	b e̞ː t
تعليق	t a ʕ l iː q
تقليد	t a q l iː d
تقنية	t a q n ɪ j a
تقويم	t a q w iː m
تكنلوجيا	t e̞ k n o̞ l o̞ː d͡ʒ j a
توقيع	t a w q iː ʕ
ثقافة	θ a q aː f a
ج	d͡ʒ
ج	ʒ
جسر	d͡ʒ ɪ s e̞ ɾ
جفس	d͡ʒ ɪ f e̞ sˤ
جنب	d͡ʒ a m b
حب	ħ o̞ bː
حب	ħ ʊ bː
حكم	ħ o̞ k ʊ m
حوش	ħ o̞ː ʃ
حوم	ħ o̞ː m
خ	x
خ	χ
خرقة	x e̞ r ɡ a
خرقة	x ɪ r ɡ a
خيمة	x e̞ː m a
دعسوقة	d a ʕ s uː q a
دقة	d ɪ ɡ ɡ a
ر	r
ر	ɾ
روب	r o̞ː b
روما	r o̞ː m a
زحليقة	z o̞ ħ l e̞ː ɡ a
زحليقة	z ʊ ħ l e̞ː ɡ a
ساق	s aː ɡ
سبقتي	s p a ɡ e̞ tː i
سنما	s ɪ n e̞ m a
سنما	s ɪ n ɪ m a
شطرطون	ʃ a tˤ a r tˤ o̞ː n
شكاقو	ʃ ɪ k aː ɡ o̞
شكاقو	ʃ ɪ k aː ɡ u
شكرا	ʃ ʊ k r a n
شوق	ʃ o̞ː ɡ
شوكة	ʃ o̞ː k a
صيف	sˤ e̞ː f
طوكيو	tˤ o̞ː k j o̞
ظفر	dˤ e̞ f e̞ r
عبقري	ʕ a b q a r i
عبقري	ʕ a b ɡ a r i
عطر	ʕ e̞ tˤ e̞ r
عطر	ʕ ɪ tˤ ɪ r
عليق	ʕ ʊ lː e̞ː ɡ
عيش	ʕ e̞ː ʃ
عيلة	ʕ e̞ː l a
غ	ɣ
غ	ʁ
غايب	ɣ aː j ɪ b
غايب	ʁ aː j ɪ b
غناء	ɣ ʊ n a
غوص	ɣ o̞ː sˤ
فايكنق	f aː j k ɪ ŋ ɡ
فايكنق	v aː j k ɪ ŋ ɡ
فقاعة	f ʊ qː aː ʕ a
فقمة	f a q m a
فندق	f ʊ n d ʊ ɡ
فوق	f o̞ː ɡ
ق	q
ق	q aː f
ق	ɡ
قاعة	q aː ʕ a
قاعدة	q aː ʕ ɪ d a
قالب	ɡ aː l a b
قالب	ɡ aː l ɪ b
قبة	q ʊ b b a
قبة	ɡ ʊ b b a
قبض	ɡ a b dˤ
قبض	ɡ a bː a dˤ
قبطان	q u b tˤ aː n
قبطان	ɡ u b tˤ aː n
قبلة	q e̞ b l a
قرش	ɡ e̞ ɾ ʃ
قرش	ɡ ɪ ɾ ʃ
قرن	q a r n
قرنفل	ɡ ʊ r ʊ ɱ f ʊ l
قزاز	ɡ ʊ z aː z
قشرة	ɡ e̞ ʃ r a
قشرة	ɡ ɪ ʃ r a
قشطة	ɡ ɪ ʃ tˤ a
قليل	ɡ a l iː l
قمل	ɡ a m ɪ l , ɡ a m l
قناع	q ɪ n aː ʕ
قناع	ɡ ɪ n aː ʕ
قنبلة	ɡ ʊ m b ʊ l a
قولون	q o̞ː l o̞ː n
كتاب	k ɪ t̪ aː b
كرنب	k o̞ r ʊ m b
كف	k a f
كيف	k e̞ː f
كيكة	k e̞ː k a
لاحق	l aː ħ a ɡ
لبنان	l ɪ b n aː n
لحظة	l a ħ ðˤ a
لفت	l e̞ f t
لهجة	l a h d͡ʒ a
لون	l o̞ː n
ليش	l e̞ː ʃ
مبسوط	m a b sˤ uː tˤ
مترو	m e̞ t r o̞
محقق	m ʊ ħ a qː ɪ q
محقق	m ʊ ħ a ɡː ɪ ɡ
مخمج	m x a mː ɪ d͡ʒ
مسابقة	m ʊ s aː b a ɡ a
مستقبل	m ʊ s t a ɡ b a l
مصر	m a sˤ ʊ r
مظلة	m a ðˤ a lː a
مظلة	m ɪ ðˤ a lː a
معصب	m ʕ a sˤː i b
معليش	m a ʕ l e̞ː ʃ
مقدونيا	m a q d o̞ː n j a
مقعد	m o̞ q ʕ a d
مقعد	m o̞ ɡ ʕ a d
مقعد	m ʊ q ʕ a d
مقعد	m ʊ ɡ ʕ a d
مقلمة	m ɪ ɡ l a m a
مناظرة	m ʊ n aː ðˤ a r a
منقا	m a ŋ ɡ a
منقة	m a ŋ ɡ a
منقل	m ɪ ŋ q a l
موز	m o̞ː z
موية	m o̞ː j a
نوفمبر	n o̞ː v a m b a r
نيجيريا	n iː d͡ʒ iː r j a
هليون	h e̞ l j o̞ː n
هليون	h ɪ l j o̞ː n
و	w aː w
و	w äː w
وزغة	w a zˤ a ɣ a
وسخ	w a sˤ a x
وسخ	w a sˤː a x
وسخ	w ɪ sˤ ɪ x
يرقة	j a r a q a
يوم	j o̞ː m
ڤايكنق	v aː j k ɪ ŋ ɡ
ڤيتنام	v ɪ j e̞ t n aː m
