abo	a b ɔ
absolwent	a p s ɔ l v ɛ n t
absolwentka	a p s ɔ l v ɛ n t k a
aby	a b ɨ
afrika	a f rʲ i k a
ako	a k ɔ
albanarka	a l b a n a r k a
albanaŕ	a l b a n a rʲ
ale	a l ɛ
alojs	a l ɔ j s
awstriska	a w s t rʲ i s k a
awto	a w t ɔ
awtor	a w t ɔ r
azija	a z i j a
baba	b a b a
babce	b a p t͡s ɛ
baby	b a b ɨ
banana	b a n a n a
bananu	b a n a n u
banka	b a n k a
bankach	b a n k a x
bankami	b a n k a mʲ i
banki	b a n kʲ i
banku	b a n k u
barana	b a r a n a
barlinja	b a r lʲ i nʲ a
barliń	b a r lʲ i nʲ
barwa	b a r v a
baz	b a s
baza	b a z a
baze	b a z ɛ
bazowy	b a z ɔ w ɨ
bcha	p x a
beja	b ɛ j a
bejach	b ɛ j a x
bit	bʲ i t
bjachaŕ	bʲ a x a rʲ
bjerjech	bʲ ɛ rʲ ɛ ç
bjerjechmej	bʲ ɛ rʲ ɛ ç m ɛ j
bjerjechmy	bʲ ɛ rʲ ɛ ç m ɨ
bjerjechu	bʲ ɛ rʲ ɛ ç u
bjerjecy	bʲ ɛ rʲ ɛ t͡s ɨ
bjerješo	bʲ ɛ rʲ ɛ ʃ ɔ
bjerještej	bʲ ɛ rʲ ɛ ʃ t ɛ j
bjerješćo	bʲ ɛ rʲ ɛ ɕ t͡ɕ ɔ
bjerjo	bʲ ɛ rʲ ɔ
bjerjom	bʲ ɛ rʲ ɔ m
bjerjomej	bʲ ɛ rʲ ɔ m ɛ j
bjerjomy	bʲ ɛ rʲ ɔ m ɨ
bjerjotej	bʲ ɛ rʲ ɔ t ɛ j
bjerjośo	bʲ ɛ rʲ ɔ ɕ ɔ
bjerjoš	bʲ ɛ rʲ ɔ ʃ
bjeŕ	bʲ ɛ rʲ
bjeŕtej	bʲ ɛ rʲ t ɛ j
bjeŕśo	bʲ ɛ rʲ ɕ ɔ
blida	b l i d a
blido	b l i d ɔ
bliska	b l i s k a
bliski	b l i s kʲ i
bliskich	b l i s kʲ i x
bliskim	b l i s kʲ i m
bliskimi	b l i s kʲ i mʲ i
blisko	b l i s k ɔ
blědy	b l ɪ d ɨ
bob	b ɔ p
bobr	b ɔ b r
boce	b ɔ t͡s ɛ
boga	b ɔ ɡ a
bogaty	b ɔ ɡ a t ɨ
bok	b ɔ k
bom	b ɔ m
boma	b ɔ m a
bramborska	b r a m b ɔ r s k a
brane	b r a n ɛ
bratš	b r a t ʃ
braś	b r a ɕ
bridki	b rʲ i t kʲ i
brjaza	b rʲ a z a
brjaze	b rʲ a z ɛ
brjoze	b rʲ ɔ z ɛ
brjuch	b rʲ u x
brod	b r ɔ t
broda	b r ɔ d a
brodach	b r ɔ d a x
brodami	b r ɔ d a mʲ i
brodom	b r ɔ d ɔ m
brodu	b r ɔ d u
brona	b r ɔ n a
bronach	b r ɔ n a x
bronami	b r ɔ n a mʲ i
brony	b r ɔ n ɨ
broń	b r ɔ nʲ
brošma	b r ɔ ʃ m a
bruk	b r u k
bruse	b r u s ɛ
bubon	b u b ɔ n
buducy	b u d u t͡s ɨ
budyšyn	b u d ɨ ʃ ɨ n
bujny	b u j n ɨ
buk	b u k
butra	b u t r a
buwoł	b u w ɔ w
buź	b u ɕ
buźom	b u ʑ ɔ m
buźtej	b u ɕ t ɛ j
buźćo	b u ɕ t͡ɕ ɔ
bydle	b ɨ d l ɛ
bydlenje	b ɨ d l ɛ nʲ ɛ
bydli	b ɨ d l i
bydlim	b ɨ d l i m
bydlit	b ɨ d l i t
bydlił	b ɨ d l i w
bydliś	b ɨ d l i ɕ
byk	b ɨ k
byli	b ɨ l i
byłej	b ɨ w e j
byśe	b ɨ ɕ ɛ
bój	b ɛ j
bójał	b ɛ j a w
bójaś	b ɛ j a ɕ
bóje	b ɛ j ɛ
bójm	b ɛ j m
ból	b ɛ l
ból	b ɨ l
ból	b ʊ l
bóleł	b ɛ l ɛ w
bóleł	b ɨ l ɛ w
bóleł	b ʊ l ɛ w
bóleś	b ɛ l ɛ ɕ
bóleś	b ɨ l ɛ ɕ
bóleś	b ʊ l ɛ ɕ
bóli	b ɛ l i
bóli	b ɨ l i
bóli	b ʊ l i
bósučki	b ɛ s u t͡ʃ k i
bósučki	b ɨ s u t͡ʃ k i
bósučki	b ʊ s u t͡ʃ k i
bósy	b ɛ s ɨ
bósy	b ɨ s ɨ
bósy	b ʊ s ɨ
bóžy	b ɛ ʒ ɨ
bóžy	b ɨ ʒ ɨ
bóžy	b ʊ ʒ ɨ
běch	bʲ ɪ x
běchmej	bʲ ɪ x m e j
běchmy	bʲ ɪ x m ɨ
běchu	bʲ ɪ x u
běły	bʲ ɪ w ɨ
běšo	bʲ ɪ ʃ ɔ
běštej	bʲ ɪ ʃ t e j
běšćo	bʲ ɪ ɕ t͡ɕ ɔ
běžaś	bʲ ɪ ʒ a ɕ
błogi	b ɔ ɡʲ i
błota	b w ɔ t a
błoto	b w ɔ t ɔ
bźez	b ʑ ɛ s
b́edro	bʲ ɛ d r ɔ
candaŕ	t͡s a n d a rʲ
capla	t͡s a p l a
caple	t͡s a p l ɛ
carne	t͡s a r n ɛ
carnem	t͡s a r n ɛ m
cas	t͡s a s
casa	t͡s a s a
casach	t͡s a s a x
case	t͡s a s ɛ
ceja	t͡s ɛ j a
ceje	t͡s ɛ j ɛ
ceji	t͡s ɛ j i
cele	t͡s ɛ l ɛ
ceptaŕ	t͡s ɛ p t a rʲ
cerw	t͡s ɛ r f
cerwjeny	t͡s ɛ r vʲ ɛ n ɨ
cesa	t͡s ɛ s a
cesta	t͡s ɛ s t a
cesto	t͡s ɛ s t ɔ
cesty	t͡s ɛ s t ɨ
cesć	t͡s ɛ s t͡ɕ
ceło	t͡s ɛ w ɔ
charta	x a r t a
chlěw	x l ɪ w
chrobry	x r ɔ b r ɨ
chroma	x r ɔ m a
chrome	x r ɔ m ɛ
chromy	x r ɔ m ɨ
chrust	x r u s t
chto	x t ɔ
chudy	kʰ u d ɨ
chudy	x u d ɨ
chyliś	x ɨ l i ɕ
chytšy	x ɨ t ʃ ɨ
chójźiś	x ɛ j ʑ i ɕ
chóra	x ɛ r a
chóra	x ɨ r a
chóra	x ʊ r a
chóre	x ɛ r ɛ
chóre	x ɨ r ɛ
chóre	x ʊ r ɛ
chórem	x ɛ r ɛ m
chórem	x ɨ r ɛ m
chórem	x ʊ r ɛ m
chórgoj	x ɛ r ɡ ɔ j
chórgoj	x ɨ r ɡ ɔ j
chórgoj	x ʊ r ɡ ɔ j
chórobny	x ɛ r ɔ b n ɨ
chórobny	x ɨ r ɔ b n ɨ
chórobny	x ʊ r ɔ b n ɨ
chórowni	x ɛ r o w nʲ i
chórowni	x ɨ r o w nʲ i
chórowni	x ʊ r o w nʲ i
chórownja	x ɛ r o w nʲ a
chórownja	x ɨ r o w nʲ a
chórownja	x ʊ r o w nʲ a
chóry	x ɛ r ɨ
chóry	x ɨ r ɨ
chóry	x ʊ r ɨ
chórych	x ɛ r ɨ x
chórych	x ɨ r ɨ x
chórych	x ʊ r ɨ x
chóśebuski	x ɛ ɕ ɛ b u s kʲ i
chóśebuski	x ɨ ɕ ɛ b u s kʲ i
chóśebuski	x ʊ ɕ ɛ b u s kʲ i
chóśebuz	x ɛ ɕ ɛ b u s
chóśebuz	x ɨ ɕ ɛ b u s
chóśebuz	x ʊ ɕ ɛ b u s
chóśebuza	x ɛ ɕ ɛ b u z a
chóśebuza	x ɨ ɕ ɛ b u z a
chóśebuza	x ʊ ɕ ɛ b u z a
chłodno	x ɔ d n ɔ
chłodny	x ɔ d n ɨ
co	t͡s ɔ
cogo	t͡s ɔ ɡ ɔ
cole	t͡s ɔ l ɛ
comu	t͡s ɔ m u
cora	t͡s ɔ r a
coš	t͡s ɔ ʃ
což	t͡s ɔ ʃ
crjej	t͡s rʲ ɛ j
crjop	t͡s rʲ ɔ p
cukor	t͡s u k ɔ r
cut	t͡s u t
cuzy	t͡s u z ɨ
cyni	t͡s ɨ nʲ i
cynim	t͡s ɨ nʲ i m
cynimej	t͡s ɨ nʲ i m e j
cynimy	t͡s ɨ nʲ i m ɨ
cynitej	t͡s ɨ nʲ i t e j
cynił	t͡s ɨ nʲ i w
cyniś	t͡s ɨ nʲ i ɕ
cyniśo	t͡s ɨ nʲ i ɕ ɔ
cyniš	t͡s ɨ nʲ i ʃ
cynje	t͡s ɨ nʲ ɛ
cyste	t͡s ɨ s t ɛ
cysty	t͡s ɨ s t ɨ
cytanje	t͡s ɨ t a nʲ ɛ
cłowjek	t͡s w ɔ j ɛ k
cłowjek	t͡s w ɔ vʲ ɛ k
da	d a
dalej	d a l ɛ j
dali	d a l i
dalina	d a l i n a
daloko	d a l ɔ k ɔ
damast	d a m a s t
dan	d a n
dana	d a n a
dane	d a n ɛ
daneje	d a n ɛ j ɛ
danje	d a nʲ ɛ
dank	d a n k
danki	d a n kʲ i
danku	d a n k u
danu	d a n u
dany	d a n ɨ
dat	d a t
dawno	d a w n ɔ
dawny	d a w n ɨ
dej	d ɛ j
dejanje	d ɛ j a nʲ ɛ
dejał	d ɛ j a w
dejaś	d ɛ j a ɕ
deje	d ɛ j ɛ
deri	d ɛ rʲ i
deriś	d ɛ rʲ i ɕ
dešć	d ɛ ɕ t͡ɕ
dirigent	dʲ i rʲ i ɡʲ ɛ n t
dirigentka	dʲ i rʲ i ɡʲ ɛ n t k a
diskutowaś	dʲ i s k u t ɔ w a ɕ
dla	d l a
do	d ɔ
dobra	d ɔ b r a
dobre	d ɔ b r ɛ
dobrego	d ɔ b r ɛ ɡ ɔ
dobrej	d ɔ b r ɛ j
dobrem	d ɔ b r ɛ m
dobremu	d ɔ b r ɛ m u
dobrota	d ɔ b r ɔ t a
dobru	d ɔ b r u
dobry	d ɔ b r ɨ
dobrych	d ɔ b r ɨ x
dobrym	d ɔ b r ɨ m
dobrymi	d ɔ b r ɨ mʲ i
dole	d ɔ l ɛ
dom	d ɔ m
doma	d ɔ m a
domy	d ɔ m ɨ
dosć	d ɔ s t͡ɕ
doł	d ɔ w
dołojce	d ɔ w ɔ j t͡s ɛ
drap	d r a p
drapaś	d r a p a ɕ
drjewo	d rʲ ɛ w ɔ
drježdźany	d rʲ ɛ ʑ d ʑ a n ɨ
drob	d r ɔ p
droba	d r ɔ b a
drobami	d r ɔ b a mʲ i
droby	d r ɔ b ɨ
droga	d r ɔ w ɡ a
droga	d r ɔ ɡ a
droge	d r ɔ ɡʲ ɛ
drogich	d r ɔ ɡʲ i x
drogowy	d r ɔ w ɡ ɔ w ɨ
droze	d r ɔ w z ɛ
droze	d r ɔ z ɛ
droznje	d r ɔ z nʲ ɛ
droždźeje	d r ɔ ʑ d͡ʑ ɛ j ɛ
drugi	d r u ɡʲ i
drugich	d r u ɡʲ i x
du	d u
dub	d u p
dubach	d u b a x
dubje	d u bʲ ɛ
dut	d u t
dute	d u t ɛ
duś	d u ɕ
dwa	d w a
dwór	d w ɛ r
dwór	d w ɨ r
dwór	d w ʊ r
dwě	d vʲ ɪ
dy	d ɨ
dym	d ɨ m
dyma	d ɨ m a
dług	d w u k
dłujki	d w u j kʲ i
estniska	ɛ s t nʲ i s k a
ezel	ɛ z ɛ l
fabrice	f a b rʲ i t͡s ɛ
fabrika	f a b rʲ i k a
fabriki	f a b rʲ i kʲ i
fagot	f a ɡ ɔ t
familija	f a mʲ i lʲ i j a
fanfara	f a n f a r a
fara	f a r a
faram	f a r a m
faraŕ	f a r a rʲ
faru	f a r u
fary	f a r ɨ
fasada	f a s a d a
ferije	f ɛ rʲ i j ɛ
fidle	fʲ i d l ɛ
formowaś	f ɔ r m ɔ w a ɕ
francojska	f r a n t͡s ɔ j s k a
gaby	ɡ a b ɨ
gad	ɡ a t
gada	ɡ a d a
gadam	ɡ a d a m
galerija	ɡ a l ɛ rʲ i j a
gano	ɡ a n ɔ
garba	ɡ a r b a
gardina	ɡ a r dʲ i n a
garona	ɡ a r ɔ n a
gat	ɡ a t
gdy	d ɨ
gdyby	d ɨ b ɨ
gib	ɡʲ i p
gibanje	ɡʲ i b a nʲ ɛ
gjarb	ɡʲ a r p
gjardy	ɡʲ a r d ɨ
gjardło	ɡʲ a r d w ɔ
gjarsć	ɡʲ a r s t͡ɕ
glej	ɡ l ɛ j
glědaś	ɡ lʲ ɪ d a ɕ
gnida	ɡ nʲ i d a
gnězdo	ɡ nʲ ɪ z d ɔ
gowjedo	ɡ ɔ j ɛ d ɔ
gowjedo	ɡ ɔ vʲ ɛ d ɔ
goły	ɡ ɔ w ɨ
grali	ɡ r a l i
granice	ɡ r a nʲ i t͡s ɛ
grat	ɡ r a t
graśe	ɡ r a ɕ ɛ
grima	ɡ rʲ i m a
grob	ɡ r ɔ p
groba	ɡ r ɔ b a
grobach	ɡ r ɔ b a x
grobami	ɡ r ɔ b a mʲ i
grobje	ɡ r ɔ bʲ ɛ
grobom	ɡ r ɔ b ɔ m
groby	ɡ r ɔ b ɨ
grod	ɡ r ɔ t
grody	ɡ r ɔ d ɨ
gromaźe	ɡ r ɔ m a ʑ ɛ
groni	ɡ r ɔ nʲ i
groza	ɡ r ɔ z a
groze	ɡ r ɔ z ɛ
grozu	ɡ r ɔ z u
guba	ɡ u b a
gus	ɡ u s
gusta	ɡ u s t a
guste	ɡ u s t ɛ
gustem	ɡ u s t ɛ m
gusto	ɡ u s t ɔ
gustu	ɡ u s t u
gusty	ɡ u s t ɨ
gwězda	ɡ vʲ ɪ z d a
gymnazium	ɡ ɨ m n a z i u m
gód	ɡ ɛ t
gód	ɡ ɨ t
gód	ɡ ʊ t
gódy	ɡ ɛ d ɨ
gódy	ɡ ɨ d ɨ
gódy	ɡ ʊ d ɨ
gójś	ɡ ɛ j ɕ
góla	ɡ ɛ l a
góla	ɡ ɨ l a
góla	ɡ ʊ l a
gólc	ɡ ɛ l t͡s
gólc	ɡ ɨ l t͡s
gólc	ɡ ʊ l t͡s
góle	ɡ ɛ l ɛ
góle	ɡ ɨ l ɛ
góle	ɡ ʊ l ɛ
góleśa	ɡ ɛ l ɛ ɕ a
góleśa	ɡ ɨ l ɛ ɕ a
góleśa	ɡ ʊ l ɛ ɕ a
góra	ɡ ɛ r a
góra	ɡ ɨ r a
góra	ɡ ʊ r a
górach	ɡ ɛ r a x
górach	ɡ ɨ r a x
górach	ɡ ʊ r a x
góram	ɡ ɛ r a m
góram	ɡ ɨ r a m
góram	ɡ ʊ r a m
górami	ɡ ɛ r a m ɨ
górami	ɡ ɨ r a m ɨ
górami	ɡ ʊ r a m ɨ
górce	ɡ ɛ r t͡s ɛ
górce	ɡ ɨ r t͡s ɛ
górce	ɡ ʊ r t͡s ɛ
górjejce	ɡ ɛ rʲ ɛ j t͡s ɛ
górjejce	ɡ ɨ rʲ ɛ j t͡s ɛ
górjejce	ɡ ʊ rʲ ɛ j t͡s ɛ
górka	ɡ ɛ r k a
górka	ɡ ɨ r k a
górka	ɡ ʊ r k a
górki	ɡ ɛ r kʲ i
górki	ɡ ɨ r kʲ i
górki	ɡ ʊ r kʲ i
góru	ɡ ɛ r u
góru	ɡ ɨ r u
góru	ɡ ʊ r u
góry	ɡ ɛ r ɨ
góry	ɡ ɨ r ɨ
góry	ɡ ʊ r ɨ
góršy	ɡ ɛ r ʃ ɨ
góršy	ɡ ɨ r ʃ ɨ
góršy	ɡ ʊ r ʃ ɨ
gósć	ɡ ɛ s t͡ɕ
gósć	ɡ ɨ s t͡ɕ
gósć	ɡ ʊ s t͡ɕ
gósća	ɡ ɛ s t͡ɕ a
gósća	ɡ ɨ s t͡ɕ a
gósća	ɡ ʊ s t͡ɕ a
gósćeńc	ɡ ɛ s t͡ɕ ɛ nʲ t͡s
gósćeńc	ɡ ɨ s t͡ɕ ɛ nʲ t͡s
gósćeńc	ɡ ʊ s t͡ɕ ɛ nʲ t͡s
gósći	ɡ ɛ s t͡ɕ i
gósći	ɡ ɨ s t͡ɕ i
gósći	ɡ ʊ s t͡ɕ i
gótowa	ɡ ɛ t ɔ w a
gótowa	ɡ ɨ t ɔ w a
gótowa	ɡ ʊ t ɔ w a
gótowy	ɡ ɛ t ɔ w ɨ
gótowy	ɡ ɨ t ɔ w ɨ
gótowy	ɡ ʊ t ɔ w ɨ
gózdź	ɡ ɛ s t͡ɕ
gózdź	ɡ ɨ s t͡ɕ
gózdź	ɡ ʊ s t͡ɕ
gózdźa	ɡ ɛ z d͡ʑ a
gózdźa	ɡ ɨ z d͡ʑ a
gózdźa	ɡ ʊ z d͡ʑ a
gózdźe	ɡ ɛ z d͡ʑ ɛ
gózdźe	ɡ ɨ z d͡ʑ ɛ
gózdźe	ɡ ʊ z d͡ʑ ɛ
gózdźik	ɡ ɛ z d ʑ i k
gózdźik	ɡ ɨ z d ʑ i k
gózdźik	ɡ ʊ z d ʑ i k
góńtwowaś	ɡ ɛ nʲ t w o w a ɕ
góńtwowaś	ɡ ɨ nʲ t w o w a ɕ
góńtwowaś	ɡ ʊ nʲ t w o w a ɕ
góźina	ɡ ɛ ʑ i n a
góźina	ɡ ɨ ʑ i n a
góźina	ɡ ʊ ʑ i n a
gładkich	ɡ w a t kʲ i x
gładko	ɡ w a t k ɔ
głog	ɡ w ɔ k
głogi	ɡ w ɔ ɡʲ i
głogom	ɡ w ɔ ɡ ɔ m
głogu	ɡ w ɔ ɡ u
głupy	ɡ u p ɨ
hengist	h ɛ ŋʲ ɡʲ i s t
historiske	h i s t ɔ rʲ i s kʲ ɛ
how	ɔ w
hurje	h u rʲ ɛ
huroma	h u r ɔ m a
huru	h u r u
hyś	ɨ ɕ
informacija	i n f ɔ r m a t͡s i j a
inženjer	i n ʒ ɛ nʲ ɛ r
inženjerka	i n ʒ ɛ nʲ ɛ r k a
jacmjeń	j a t͡s mʲ ɛ nʲ
jaden	j a d ɛ n
jagnje	j a ɡ nʲ ɛ
jagnjeśina	j a ɡ nʲ ɛ ɕ i n a
jagoda	j a ɡ ɔ d a
jajach	j a j a x
jajce	j a j t͡s ɛ
jajko	j a j k ɔ
jajo	j a j ɔ
jano	j a n ɔ
jara	j a r a
jare	j a r ɛ
jarem	j a r ɛ m
jary	j a r ɨ
jasne	j a s n ɛ
jasno	j a s n ɔ
jasny	j a s n ɨ
jasnych	j a s n ɨ x
jastśeb	j a s t͡ɕ ɛ p
jastśebik	j a s t͡ɕ ɛ bʲ i k
jastśebja	j a s t͡ɕ ɛ bʲ a
jatšy	j a t͡ʃ ɨ
jazor	j a z ɔ r
jazoro	j a z ɔ r ɔ
jazw	j a s
jašćeŕ	j a ɕ t͡ɕ ɛ rʲ
je	j ɛ
jeb	j ɛ p
jeba	j ɛ b a
jebany	j ɛ b a n ɨ
jebat	j ɛ b a t
jedle	j ɛ d l ɛ
jeglicka	j ɛ ɡ l i t͡s k a
jeje	j ɛ j ɛ
jelenica	j ɛ l ɛ nʲ i t͡s a
jeleń	j ɛ l ɛ nʲ
jerjeł	j ɛ rʲ ɛ w
jerła	j ɛ r w a
jež	j e ʃ
ježe	j ɛ ʒ ɛ
jich	j i x
jima	j i m a
jogo	j ɔ ɡ ɔ
jogurt	j ɔ ɡ u r t
joli	j ɔ l i
južo	j u ʒ ɔ
jědro	j ɪ d r ɔ
jědu	j ɪ d u
jěsć	j ɪ s t͡ɕ
jětša	j ɪ t ʃ a
jěza	j ɪ z a
jězd	j ɪ s t
jězdźiś	j ɪ z d͡ʑ i ɕ
jězyk	j ɪ z ɨ k
jěł	j ɪ w
jěś	j ɪ ɕ
jěźech	j ɪ ʑ ɛ ç
jěźechmej	j ɪ ʑ ɛ ç m ɛ j
jěźechmy	j ɪ ʑ ɛ ç m ɨ
jěźechu	j ɪ ʑ ɛ ç u
jěźecy	j ɪ ʑ ɛ t͡s ɨ
jěźenje	j ɪ ʑ ɛ nʲ ɛ
jěźešo	j ɪ ʑ ɛ ʃ ɔ
jěźeštej	j ɪ ʑ ɛ ʃ t e j
jěźešćo	j ɪ ʑ ɛ ɕ t͡ɕ ɔ
jěźo	j ɪ ʑ ɔ
jěźom	j ɪ ʑ ɔ m
jěźony	j ɪ ʑ ɔ n ɨ
k	k
kacka	k a t͡s k a
kaka	k a k a
kakawa	k a k a w a
kake	k a kʲ ɛ
kale	k a l ɛ
kamel	k a m ɛ l
kamela	k a m ɛ l a
kamele	k a m ɛ l ɛ
kamjenica	k a mʲ ɛ nʲ i t͡s a
kamjeny	k a mʲ ɛ n ɨ
kamjeń	k a mʲ ɛ nʲ
kani	k a nʲ i
kanja	k a nʲ a
kanka	k a n k a
kanki	k a n kʲ i
kanu	k a n u
kanuna	k a n u n a
kapa	k a p a
kapow	k a p ɔ w
kapu	k a p u
kara	k a r a
karnikel	k a r nʲ i kʲ ɛ l
karpa	k a r p a
karu	k a r u
kawce	k a w t͡s ɛ
kawka	k a w k a
kawkach	k a w k a x
kawkami	k a w k a mʲ i
kawki	k a w kʲ i
kawč	k a w t͡ʃ
kał	k a w
kenž	kʲ ɛ n ʃ
ketšup	kʲ ɛ t ʃ u p
kiju	kʲ i j u
kim	kʲ i m
kjarcma	kʲ a r t͡s m a
kjarm	kʲ a r m
kjałbasa	kʲ a w b a s a
klěb	k l ɪ p
klěcaś	k l ɪ t͡s a ɕ
klěkaś	k lʲ ɪ k a ɕ
klěś	k l ɪ ɕ
klěšće	k l ɪ ɕ t͡ɕ ɛ
kmótš	k m ɛ t͡ʃ
kmótš	k m ɨ t͡ʃ
kmótš	k m ʊ t͡ʃ
knigły	k nʲ i ɡ w ɨ
kněni	k nʲ ɪ nʲ i
kněz	k nʲ ɪ s
kněžna	k nʲ ɪ ʒ n a
kobołk	k ɔ b o w k
kobra	k ɔ b r a
kobrami	k ɔ b r a mʲ i
kobru	k ɔ b r u
kobry	k ɔ b r ɨ
kobyła	k ɔ b ɨ w a
kofer	k ɔ f ɛ r
kogo	k ɔ ɡ ɔ
kokot	k ɔ k ɔ t
kokoš	k ɔ k ɔ ʃ
kokoška	k ɔ k ɔ ʃ k a
komar	k ɔ m a r
komora	k ɔ m ɛ r a
komu	k ɔ m u
kopi	k ɔ pʲ i
kopje	k ɔ pʲ ɛ
kopyto	k ɔ p ɨ t ɔ
koło	k o w ɔ
kołp	k ɔ w p
kraba	k r a b a
kralik	k r a l i k
krida	k rʲ i d a
krogul	k r ɔ ɡ u l
krotko	k r ɔ t k ɔ
krowa	k r o w a
krowach	k r o w a x
krowami	k r o w a mʲ i
krowy	k r o w ɨ
ku	k u
kuba	k u b a
kuchnja	k u x nʲ a
kukawa	k u k a w a
kulka	k u l k a
kunu	k u n u
kupnice	k u p nʲ i t͡s ɛ
kura	k u r a
kuram	k u r a m
kurami	k u r a mʲ i
kurce	k u r t͡s ɛ
kurka	k u r k a
kurki	k u r kʲ i
kuru	k u r u
kurwota	k u r w ɔ t a
kusa	k u s a
kusam	k u s a m
kusaś	k u s a ɕ
kuždy	k u ʒ d ɨ
kwět	k vʲ ɪ t
kwětk	k vʲ ɪ t k
kócka	k ɛ t͡s k a
kócka	k ɨ t͡s k a
kócka	k ʊ t͡s k a
kócor	k ɛ t͡s ɔ r
kócor	k ɨ t͡s ɔ r
kócor	k ʊ t͡s ɔ r
kólaso	k ɛ l a s ɔ
kólaso	k ɨ l a s ɔ
kólaso	k ʊ l a s ɔ
kóleno	k ɛ l ɛ n ɔ
kóleno	k ɨ l ɛ n ɔ
kóleno	k ʊ l ɛ n ɔ
kónja	k ɛ nʲ a
kónja	k ɨ nʲ a
kónja	k ʊ nʲ a
kónju	k ɛ nʲ u
kónju	k ɨ nʲ u
kónju	k ʊ nʲ u
kónopje	k ɛ n ɔ pʲ ɛ
kónopje	k ɨ n ɔ pʲ ɛ
kónopje	k ʊ n ɔ pʲ ɛ
kórjeń	k ɛ rʲ ɛ nʲ
kórjeń	k ɨ rʲ ɛ nʲ
kórjeń	k ʊ rʲ ɛ nʲ
kóryto	k ɛ r ɨ t ɔ
kóryto	k ɨ r ɨ t ɔ
kóryto	k ʊ r ɨ t ɔ
kós	k ɛ s
kós	k ɨ s
kós	k ʊ s
kósa	k ɛ s a
kósa	k ɨ s a
kósa	k ʊ s a
kósam	k ɛ s a m
kósam	k ɨ s a m
kósam	k ʊ s a m
kóse	k ɛ s ɛ
kóse	k ɨ s ɛ
kóse	k ʊ s ɛ
kósu	k ɛ s u
kósu	k ɨ s u
kósu	k ʊ s u
kósć	k ɛ s t͡ɕ
kósć	k ɨ s t͡ɕ
kósć	k ʊ s t͡ɕ
kót	k ɛ t
kót	k ɨ t
kót	k ʊ t
kóta	k ɛ t a
kóta	k ɨ t a
kóta	k ʊ t a
kótary	k ɛ t a r ɨ
kótary	k ɨ t a r ɨ
kótary	k ʊ t a r ɨ
kótow	k ɛ t o w
kótow	k ɨ t o w
kótow	k ʊ t o w
kóza	k ɛ z a
kóza	k ɨ z a
kóza	k ʊ z a
kózoł	k ɛ z o w
kózoł	k ɨ z o w
kózoł	k ʊ z o w
kózyrožk	k ɛ z ɨ r o ʃ k
kózyrožk	k ɨ z ɨ r o ʃ k
kózyrožk	k ʊ z ɨ r o ʃ k
kóń	k ɛ nʲ
kóń	k ɨ nʲ
kóń	k ʊ nʲ
kóńc	k ɛ nʲ t͡s
kóńc	k ɨ nʲ t͡s
kóńc	k ʊ nʲ t͡s
kóńck	k ɛ nʲ t s k
kóńck	k ɨ nʲ t s k
kóńck	k ʊ nʲ t s k
kóńcowaś	k ɛ nʲ t s o w a ɕ
kóńcowaś	k ɨ nʲ t s o w a ɕ
kóńcowaś	k ʊ nʲ t s o w a ɕ
kóśeł	k ɛ ɕ ɛ w
kóśeł	k ɨ ɕ ɛ w
kóśeł	k ʊ ɕ ɛ w
kóža	k ɛ ʒ a
kóža	k ɨ ʒ a
kóža	k ʊ ʒ a
kśebjat	k ɕ ɛ bʲ a t
kśebjata	k ɕ ɛ bʲ a t a
kśemjeń	k ɕ ɛ mʲ ɛ nʲ
kśidło	k ɕ i d w ɔ
kśiwy	k ɕ i w ɨ
kśě	k ɕ ɪ
kśěn	k ɕ ɪ n
kśěł	k ɕ ɪ w
kśěś	k ɕ ɪ ɕ
kšej	k ʃ ɛ j
kšupa	k ʃ u p a
kšupy	k ʃ u p ɨ
kšuty	k ʃ u t ɨ
kšuška	k ʃ u ʃ k a
kšyśe	k ʃ ɨ ɕ ɛ
lan	l a n
lanka	l a ŋ k a
law	l a w
lawk	l a w k
lažaś	l a ʒ a ɕ
laže	l a ʒ ɛ
lažčejšy	l a ʃ t͡ʃ ɛ j ʃ ɨ
leśe	l ɛ ɕ ɛ
lic	l i t͡s
lice	l i t͡s ɛ
licho	l i x ɔ
lichy	l i x ɨ
lico	l i t͡s ɔ
licy	l i t͡s ɨ
licyś	l i t͡s ɨ ɕ
lip	l i p
lipa	l i p a
lipat	l i p a t
lipaś	l i p a ɕ
lipoma	l i p ɔ m a
lipsk	l i p s k
list	l i s t
lista	l i s t a
listy	l i s t ɨ
liška	l i ʃ k a
lod	l ɔ t
luba	l u b a
lube	l u b ɛ
lubje	l u bʲ ɛ
lubjej	l u bʲ ɛ j
lubowaś	l u b ɔ w a ɕ
lud	l u t
luta	l u t a
lute	l u t ɛ
lutem	l u t ɛ m
lutu	l u t u
luty	l u t ɨ
luź	l u ɕ
lěkaŕ	l ɪ k a rʲ
lěpšy	l ɪ p ʃ ɨ
lěs	l ɪ s
lěto	l ɪ t ɔ
lěwy	l ɪ w ɨ
lězć	l ɪ s t͡ɕ
lěśe	l ɪ ɕ ɛ
mack	m a t͡s k
macka	m a t͡s k a
mackach	m a t͡s k a x
mackami	m a t͡s k a mʲ i
macki	m a t͡s kʲ i
mackom	m a t͡s k ɔ m
maju	m a j u
mak	m a k
maka	m a k a
makam	m a k a m
maki	m a kʲ i
maku	m a k u
malina	m a l i n a
malinami	m a l i n a mʲ i
mamam	m a m a m
mamu	m a m u
mamy	m a m ɨ
mapa	m a p a
mapje	m a pʲ ɛ
marchwej	m a r x w ɛ j
marchwje	m a r x j ɛ
marchwje	m a r x vʲ ɛ
marjank	m a r j a ŋ k
masle	m a s l ɛ
masło	m a s w ɔ
małe	m a w ɛ
mało	m a w ɔ
maś	m a ɕ
mech	m ɛ x
mecha	m ɛ x a
mej	m ɛ j
mimo	mʲ i m ɔ
miła	mʲ i w a
miłe	mʲ i w ɛ
miłego	mʲ i w ɛ ɡ ɔ
miłej	mʲ i w e j
miłemu	mʲ i w ɛ m u
miły	mʲ i w ɨ
miłych	mʲ i w ɨ χ
miłym	mʲ i w ɨ m
miłymi	mʲ i w ɨ mʲ i
mišnjo	mʲ i ʃ nʲ ɔ
mjac	mʲ a t͡s
mjadwjeź	mʲ a d j e ɕ
mjadwjeź	mʲ a d vʲ e ɕ
mjasec	mʲ a s ɛ t͡s
mjatel	mʲ a t ɛ l
mjazy	mʲ a z ɨ
mjod	mʲ ɔ t
mlaś	m l a ɕ
mloko	m l ɔ k ɔ
moderne	m ɔ d ɛ r n ɛ
mrěś	m rʲ ɪ ɕ
muce	m u t͡s ɛ
mucha	m u x a
mudra	m u d r a
muku	m u k u
mul	m u l
mula	m u l a
mulam	m u l a m
mule	m u l ɛ
muli	m u l i
mulu	m u l u
muše	m u ʃ ɛ
muž	m u ʃ
muže	m u ʒ ɛ
myli	m ɨ l i
mysli	m ɨ s l i
myslit	m ɨ s l i t
mysliś	m ɨ s l i ɕ
myslony	m ɨ s l ɔ n ɨ
myt	m ɨ t
myś	m ɨ ɕ
myśe	m ɨ ɕ ɛ
myš	m ɨ ʃ
móc	m ɛ t͡s
móc	m ɨ t͡s
móc	m ʊ t͡s
móct	m ɛ t͡s t
móct	m ɨ t͡s t
móct	m ʊ t͡s t
módle	m ɛ d l ɛ
módle	m ɨ d l ɛ
módle	m ʊ d l ɛ
módli	m ɛ d l i
módli	m ɨ d l i
módli	m ʊ d l i
módlim	m ɛ d l i m
módlim	m ɨ d l i m
módlim	m ʊ d l i m
módlił	m ɛ d l i w
módlił	m ɨ d l i w
módlił	m ʊ d l i w
módliś	m ɛ d l i ɕ
módliś	m ɨ d l i ɕ
módliś	m ʊ d l i ɕ
módra	m ɛ d r a
módra	m ɨ d r a
módra	m ʊ d r a
módre	m ɛ d r ɛ
módre	m ɨ d r ɛ
módre	m ʊ d r ɛ
módru	m ɛ d r u
módru	m ɨ d r u
módru	m ʊ d r u
módry	m ɛ d r ɨ
módry	m ɨ d r ɨ
módry	m ʊ d r ɨ
mógli	m ɛ ɡ l i
mógli	m ɨ ɡ l i
mógli	m ʊ ɡ l i
mógu	m ɛ ɡ u
mógu	m ɨ ɡ u
mógu	m ʊ ɡ u
mógł	m ɛ k
mógł	m ɨ k
mógł	m ʊ k
mógła	m ɛ ɡ w a
mógła	m ɨ ɡ w a
mógła	m ʊ ɡ w a
mógłej	m ɛ ɡ w ɛ j
mógłej	m ɨ ɡ w ɛ j
mógłej	m ʊ ɡ w ɛ j
mógło	m ɛ ɡ w ɔ
mógło	m ɨ ɡ w ɔ
mógło	m ʊ ɡ w ɔ
mój	m ɛ j
mója	m ɛ j a
móje	m ɛ j ɛ
mójej	m ɛ j ɛ j
mójo	m ɛ j ɔ
mól	m ɛ l
mól	m ɨ l
mól	m ʊ l
móla	m ɛ l a
móla	m ɨ l a
móla	m ʊ l a
mólach	m ɛ l a x
mólach	m ɨ l a x
mólach	m ʊ l a x
mólam	m ɛ l a m
mólam	m ɨ l a m
mólam	m ʊ l a m
móle	m ɛ l ɛ
móle	m ɨ l ɛ
móle	m ʊ l ɛ
móli	m ɛ l i
móli	m ɨ l i
móli	m ʊ l i
mólu	m ɛ l u
mólu	m ɨ l u
mólu	m ʊ l u
móri	m ɛ rʲ i
móri	m ɨ rʲ i
móri	m ʊ rʲ i
mórjo	m ɛ rʲ ɔ
mórjo	m ɨ rʲ ɔ
mórjo	m ʊ rʲ ɔ
mórzgi	m ɛ r z ɡʲ i
mórzgi	m ɨ r z ɡʲ i
mórzgi	m ʊ r z ɡʲ i
móst	m ɛ s t
móst	m ɨ s t
móst	m ʊ s t
móžo	m ɛ ʒ ɔ
móžo	m ɨ ʒ ɔ
móžo	m ʊ ʒ ɔ
móžom	m ɛ ʒ ɔ m
móžom	m ɨ ʒ ɔ m
móžom	m ʊ ʒ ɔ m
móžomej	m ɛ ʒ ɔ m ɛ j
móžomej	m ɨ ʒ ɔ m ɛ j
móžomej	m ʊ ʒ ɔ m ɛ j
móžomy	m ɛ ʒ ɔ m ɨ
móžomy	m ɨ ʒ ɔ m ɨ
móžomy	m ʊ ʒ ɔ m ɨ
móžotej	m ɛ ʒ ɔ t ɛ j
móžotej	m ɨ ʒ ɔ t ɛ j
móžotej	m ʊ ʒ ɔ t ɛ j
móžoš	m ɛ ʒ ɔ ʃ
móžoš	m ɨ ʒ ɔ ʃ
móžoš	m ʊ ʒ ɔ ʃ
mě	mʲ ɪ
měch	mʲ ɪ x
měki	mʲ ɪ kʲ i
měra	mʲ ɪ r a
měri	mʲ ɪ rʲ i
měrim	mʲ ɪ rʲ i m
měrił	mʲ ɪ rʲ i w
měriś	mʲ ɪ rʲ i ɕ
měrje	mʲ ɪ rʲ ɛ
měso	mʲ ɪ s ɔ
města	mʲ ɪ s t a
městno	mʲ ɪ s t n ɔ
město	mʲ ɪ s t ɔ
měsćanaŕ	mʲ ɪ s t͡ɕ a n a rʲ
měsćańske	mʲ ɪ s t͡ɕ a nʲ s kʲ ɛ
měsćański	mʲ ɪ s t͡ɕ a nʲ s kʲ i
měto	mʲ ɪ t ɔ
mězdze	mʲ ɪ z d͡z ɛ
mězga	mʲ ɪ z ɡ a
měŕ	mʲ ɪ rʲ
měś	mʲ ɪ ɕ
měź	mʲ ɪ ɕ
mła	m w a
młode	m w ɔ d ɛ
młoźinske	m ɔ ʑ i n s kʲ ɛ
młoźinski	m ɔ ʑ i n s kʲ i
na	n a
naga	n a ɡ a
nage	n a ɡʲ ɛ
nagi	n a ɡʲ i
nagich	n a ɡʲ i x
nagim	n a ɡʲ i m
nagimi	n a ɡʲ i mʲ i
nagu	n a ɡ u
nakup	n a k u p
nalěwo	n a l ɪ w ɔ
nan	n a n
nana	n a n a
napšawo	n a p ʃ a w ɔ
nas	n a s
nałpa	n a w p a
ned	n ɛ t
nejgóršy	n ɛ j ɡ ɛ r ʃ ɨ
nejgóršy	n ɛ j ɡ ɨ r ʃ ɨ
nejgóršy	n ɛ j ɡ ʊ r ʃ ɨ
nich	nʲ i x
nim	nʲ i m
nima	nʲ i m a
nimcowka	nʲ i m t͡s o w k a
nime	nʲ i m ɛ
nimska	nʲ i m s k a
niska	nʲ i s k a
niskich	nʲ i s kʲ i x
nisko	nʲ i s k ɔ
njasł	nʲ a s
njebjo	nʲ ɛ bʲ ɔ
njejdu	nʲ ɛ j d u
njejo	nʲ ɛ j ɔ
njejsmej	nʲ ɛ j s m ɛ j
njejsmy	nʲ ɛ j s m ɨ
njejsom	nʲ ɛ j s ɔ m
njejstej	nʲ ɛ j s t ɛ j
njejsu	nʲ ɛ j s u
njejsy	nʲ ɛ j s ɨ
njejsćo	nʲ ɛ j s t͡ɕ ɔ
njejźo	nʲ ɛ j ʑ ɔ
njejźom	nʲ ɛ j ʑ ɔ m
njejźomej	nʲ ɛ j ʑ ɔ m ɛ j
njejźoš	nʲ ɛ j ʑ ɔ ʃ
njekśě	nʲ ɛ k ɕ ɪ
njerěšny	nʲ ɛ rʲ ɪ ʃ n ɨ
njetopyŕ	nʲ ɛ t ɔ p ɨ rʲ
njewjedro	nʲ ɛ j ɛ d r ɔ
njewjedro	nʲ ɛ vʲ ɛ d r ɔ
njewjericka	nʲ ɛ j ɛ rʲ i t͡s k a
njewjericka	nʲ ɛ vʲ ɛ rʲ i t͡s k a
njeźela	nʲ ɛ ʑ ɛ l a
noc	n ɔ t͡s
nocach	n ɔ t͡s a x
nocami	n ɔ t͡s a mʲ i
nocka	n ɔ t͡s k a
nocy	n ɔ t͡s ɨ
noga	n ɔ ɡ a
nogi	n ɔ ɡʲ i
nokś	n ɔ k ɕ
nos	n ɔ s
nose	n ɔ s ɛ
nowe	n ɔ w ɛ
nowo	n ɔ w ɔ
nowy	n o w ɨ
noze	n ɔ z ɛ
nož	n ɔ ʃ
nožyce	n ɔ ʒ ɨ t͡s ɛ
numer	n u m ɛ r
nutśi	n u t͡ɕ i
ně	nʲ ɪ
něco	nʲ ɪ t͡s ɔ
někotary	nʲ ɪ k ɔ t a r ɨ
něnt	nʲ ɪ n t
něnto	nʲ ɪ n t ɔ
padali	p a d a l i
paduch	p a d u x
palach	p a l a x
palc	p a l t͡s
palca	p a l t͡s a
palcach	p a l t͡s a x
palcami	p a l t͡s a mʲ i
palce	p a l t͡s ɛ
palcom	p a l t͡s ɔ m
palcu	p a l t͡s u
pale	p a l ɛ
pali	p a l i
palica	p a l i t͡s a
palice	p a l i t͡s ɛ
palim	p a l i m
palimy	p a l i m ɨ
palit	p a l i t
palił	p a l i w
paliła	p a l i w a
paliło	p a l i w ɔ
paliś	p a l i ɕ
paliśo	p a l i ɕ ɔ
pališ	p a l i ʃ
palona	p a l ɔ n a
palone	p a l ɔ n ɛ
palony	p a l ɔ n ɨ
papa	p a p a
papje	p a pʲ ɛ
paprika	p a p rʲ i k a
papriku	p a p r i k u
park	p a r k
parka	p a r k a
pas	p a s
pasam	p a s a m
pase	p a s ɛ
pata	p a t a
patu	p a t u
paw	p a w
pawa	p a w a
pawk	p a w k
paśpula	p a ɕ p u l a
pcha	p x a
pcołka	t͡s ɔ w k a
pile	pʲ i l ɛ
pili	pʲ i l i
pisał	pʲ i s a w
pisaś	pʲ i s a ɕ
pit	pʲ i t
pite	pʲ i t ɛ
pitu	pʲ i t u
pity	pʲ i t ɨ
piwo	pʲ i w ɔ
piła	pʲ i w a
piłam	pʲ i w a m
piło	pʲ i w ɔ
piły	pʲ i w ɨ
piś	pʲ i ɕ
piśe	pʲ i ɕ ɛ
pjac	pʲ a t͡s
pjelch	pʲ ɛ l x
pjelniś	pʲ ɛ l nʲ i ɕ
pjenjeze	pʲ ɛ nʲ ɛ z ɛ
pjerina	pʲ ɛ rʲ i n a
pjero	pʲ ɛ r ɔ
pla	p l a
plasta	p l a s t a
plasć	p l a s t͡ɕ
plěś	p l ɪ ɕ
politika	p ɔ l i tʲ i k a
politiki	p ɔ l i tʲ i kʲ i
pomoc	p ɔ m ɛ t͡s
popjeł	p ɔ pʲ ɛ w
powrjoz	p o w rʲ ɔ s
powědański	p o vʲ ɪ d a nʲ s kʲ i
powědaś	p o vʲ ɪ d a ɕ
powědaś	p ɔ j ɪ d a ɕ
powěźeś	p o vʲ ɪ ʑ e ɕ
powěźeś	p ɔ j ɪ ʑ e ɕ
połny	p o w n ɨ
prama	p r a m a
pramu	p r a m u
pranje	p r a nʲ ɛ
proch	p r ɔ x
proga	p r ɔ ɡ a
progi	p r ɔ ɡʲ i
prose	p r ɔ s ɛ
prozniny	p r ɔ z nʲ i n ɨ
prozny	p r ɔ z n ɨ
prěcny	p rʲ ɪ t͡s n ɨ
prědk	p rʲ ɪ t k
prědny	p rʲ ɪ d n ɨ
prězy	p rʲ ɪ z ɨ
psa	p s a
psy	p s ɨ
ptašk	p t a ʃ k
ptaškowy	p t a ʃ k ɔ w ɨ
pusta	p u s t a
puste	p u s t ɛ
pusty	p u s t ɨ
puta	p u t a
putam	p u t a m
putu	p u t u
pyrje	p ɨ rʲ ɛ
pytali	p ɨ t a l i
pytanje	p ɨ t a nʲ ɛ
pyto	p ɨ t ɔ
pó	p ɛ
pó	p ɨ
pó	p ʊ
pód	p ɛ t
pód	p ɨ t
pód	p ʊ t
pódla	p ɛ d l a
pódla	p ɨ d l a
pódla	p ʊ d l a
pódomk	p ɛ d ɔ m k
pódomk	p ɨ d ɔ m k
pódomk	p ʊ d ɔ m k
póla	p ɛ l a
póla	p ɨ l a
póla	p ʊ l a
pólach	p ɛ l a x
pólach	p ɨ l a x
pólach	p ʊ l a x
pólack	p ɛ l a t͡s k
pólack	p ɨ l a t͡s k
pólack	p ʊ l a t͡s k
pólak	p ɛ l a k
pólak	p ɨ l a k
pólak	p ʊ l a k
póli	p ɛ l i
póli	p ɨ l i
póli	p ʊ l i
pólka	p ɛ l k a
pólka	p ɨ l k a
pólka	p ʊ l k a
pólo	p ɛ l ɔ
pólo	p ɨ l ɔ
pólo	p ʊ l ɔ
pólska	p ɛ l s k a
pólska	p ɨ l s k a
pólska	p ʊ l s k a
pólske	p ɛ l s kʲ ɛ
pólske	p ɨ l s kʲ ɛ
pólske	p ʊ l s kʲ ɛ
pólski	p ɛ l s kʲ i
pólski	p ɨ l s kʲ i
pólski	p ʊ l s kʲ i
pólskich	p ɛ l s kʲ i x
pólskich	p ɨ l s kʲ i x
pólskich	p ʊ l s kʲ i x
pólskim	p ɛ l s kʲ i m
pólskim	p ɨ l s kʲ i m
pólskim	p ʊ l s kʲ i m
pólskimi	p ɛ l s kʲ i mʲ i
pólskimi	p ɨ l s kʲ i mʲ i
pólskimi	p ʊ l s kʲ i mʲ i
pólsku	p ɛ l s k u
pólsku	p ɨ l s k u
pólsku	p ʊ l s k u
pólu	p ɛ l u
pólu	p ɨ l u
pólu	p ʊ l u
pólšćina	p ɛ l ɕ t͡ɕ i n a
pólšćina	p ɨ l ɕ t͡ɕ i n a
pólšćina	p ʊ l ɕ t͡ɕ i n a
pón	p ɛ n
pón	p ɨ n
pón	p ʊ n
pónjeźela	p ɛ nʲ ɛ ʑ ɛ l a
pónjeźela	p ɨ nʲ ɛ ʑ ɛ l a
pónjeźela	p ʊ nʲ ɛ ʑ ɛ l a
pónjeźele	p ɛ nʲ ɛ ʑ ɛ l ɛ
pónjeźele	p ɨ nʲ ɛ ʑ ɛ l ɛ
pónjeźele	p ʊ nʲ ɛ ʑ ɛ l ɛ
póra	p ɛ r a
póra	p ɨ r a
póra	p ʊ r a
póram	p ɛ r a m
póram	p ɨ r a m
póram	p ʊ r a m
pórat	p ɛ r a t
pórat	p ɨ r a t
pórat	p ʊ r a t
póraś	p ɛ r a ɕ
póraś	p ɨ r a ɕ
póraś	p ʊ r a ɕ
pósoł	p ɛ s ɔ w
pósoł	p ɨ s ɔ w
pósoł	p ʊ s ɔ w
pótom	p ɛ t ɔ m
pótom	p ɨ t ɔ m
pótom	p ʊ t ɔ m
pówětš	p ɛ vʲ ɪ t͡ʃ
pówětš	p ɨ vʲ ɪ t͡ʃ
pówětš	p ʊ vʲ ɪ t͡ʃ
pěsk	pʲ ɪ s k
pěsć	pʲ ɪ s t͡ɕ
pěta	pʲ ɪ t a
