ក	k ɑː
សិល្ប	s ə l l ə p a ʔ
សិល្បៈ	s ə l l ə p a ʔ
សិសិរៈ	s e s e r ĕ ə ʔ
សិស្ស	s ə h
សីហា	s ə j h aː
សីហៈ	s ə j h a ʔ
សឹង្ហ	s ə ŋ
សឹម	s ə m
សឺរ៉ាំង	s ə ɨ r a ŋ
សុក	s o k
សុក្រ	s o k
សុខ	s o k
សុដន់	s o ɗ ɑ n
សុទ្ធ	s o t
សុបិន	s o ɓ ə n
សុប្រាត	s o p r aː t
សុភ	s o pʰ ĕ ə ʔ
សុរា	s o r aː
សុរិយ	s o r e j a ʔ
សុវណ្ណ	s o ʋ a n
សុវត្ថិ	s o ʋ a t tʰ e ʔ
សុំ	s o m
សូដ្យូម	s o u t j o u m
សូឌីយ៉ូម	s o u ɗ iː j o u m
សូត្រ	s o u t
សូន្យ	s o u n
សូម	s o u m
សូម៉ាលី	s o u m aː l iː
សូម្បី	s o u m ɓ ə j
សូរ	s o u
សូរីណាម	s o u r iː n aː m
សូវៀត	s o u ʋ i ə t
សូហ្វវែរ	s o u f ʋ a e
សួគ៌	s u ə
សួត	s u ə t
សួន	s u ə n
សួរ	s u ə
សួស្ដី	s u ə s ɗ ə j
សួស្តី	s u ə s ɗ ə j
សើច	s a ə c
សើន	s a ə n
សើម	s a ə m
សៀក	s i ə ʔ
សៀង	s i ə ŋ
សៀម	s i ə m
សៀរ៉ាឡេអូន	s i ə r aː l eː ʔ o u n
សេក	s eː k
សេក្ខ	s eː k
សេចក្ដី	s a c kʰ t ə j
សេចក្តី	s a c kʰ t ə j
សេដ្ឋ	s eː tʰ a ʔ
សេដ្ឋកិច្ច	s eː t tʰ a ʔ k ə c
សេណេហ្គាល់	s eː n eː ɡ aː l
សេព	s eː p
សេមហកលា	s eː m h a ʔ k a ʔ l aː
សេម្ហៈ	s eː m h a ʔ
សេរី	s eː r ə j
សេរីភាព	s eː r ə j pʰ i ə p
សេវកៈ	s eː ʋ a ʔ k a ʔ
សេសែល	s eː s a e l
សេអ៊ូល	s eː ʔ uː l
សេះ	s e h
សែក	s a e k
សែន	s a e n
សៃយ	s a j
សៃហ្គន	s a j ɡ ɑː n
សោ	s a o
សោក	s a o k
សោណ្ឌ	s a o n
សោធន	s a o tʰ ŭ ə n
សោធនី	s a o tʰ ĕ ə ʔ n iː
សោះ	s ɑ h
សៅរ៍	s a w
សំដី	s ɑ m ɗ ə j
សំណ	s ɑ m n ɑː
សំណាក	s ɑ m n aː ʔ
សំណាក់	s ɑ m n a ʔ
សំណាង	s ɑ m n aː ŋ
សំណូម	s ɑ m n o u m
សំណួរ	s ɑ m n u ə
សំណើ	s ɑ m n a ə
សំណើច	s ɑ m n a ə c
សំណើម	s ɑ m n a ə m
សំនួន	s ɑ m n u ə n
សំនួរ	s ɑ m n u ə
សំបក	s ɑ m ɓ ɑː ʔ
សំបុក	s ɑ m ɓ o k
សំបុត្រ	s ɑ m ɓ o t
សំបែង	s ɑ m ɓ a e ŋ
សំពត់	s ɑ m p ŭ ə t
សំពៅ	s ɑ m p ɨ w
សំពះ	s ɑ m p ĕ ə h
សំភោរ	s ɑ m pʰ oː
សំយោគ	s a ŋ j oː k
សំរស់	s ɑ m r ɑ h
សំរាក	s ɑ m r aː ʔ
សំរាម	s ɑ m r aː m
សំរឹទ្ធ	s ɑ m r ə t
សំរេក	s ɑ m r eː k
សំលោហៈ	s ɑ m l oː h a ʔ
សំស្ក្រឹត	s a ŋ s k r ə t
សំឡេង	s ɑ m l eː ŋ
សំអាត	s ɑ m ʔ aː t
ស៊ី	s iː
ស៊ីញេ	s iː ɲ e i
ស៊ីដា	s iː ɗ aː
ស៊ីប	s iː p
ស៊ីបេរី	s iː ɓ eː r iː
ស៊ីមបាវ៉េ	s iː m ɓ aː ʋ eː
ស៊ីម៉ងត៍	s iː m ɑː ŋ
ស៊ីរី	s iː r iː
ស៊ីលី	s iː l iː
ស៊ីហ្គា	s iː ɡ aː
ស៊ីឡាំង	s iː l a ŋ
ស៊ឺបៀ	s ɨː ɓ i ə
ស៊ុកូឡា	s u k o u l aː
ស៊ុត	s u t
ស៊ុប	s u p
ស៊ុយ	s u j
ស៊ុយអែត	s u j ʔ a e t
ស៊ូដង់	s uː ɗ ɑ ŋ
ស៊េប៊ី	s e i ɓ iː
ស័ក	s a ʔ
ស័ក្តិ	s a ʔ
ស័ង្កសី	s a ŋ k a ʔ s ə j
ស័ង្គសី	s a ŋ k a ʔ s ə j
ស័ព្ទ	s a p
ស្ករ	s k ɑː
ស្កួយ	s k u ə j
ស្គរ	s k ɔː
ស្ងាត	s ŋ aː t
ស្ងាប	s ŋ aː p
ស្ងាវ	s ŋ aː w
ស្ងួត	s ŋ u ə t
ស្ងៀម	s ŋ i ə m
ស្ងោ	s ŋ a o
ស្ងោរ	s ŋ a o
ស្ញប់	s ɲ ɑ p
ស្ញែង	s ɲ a e ŋ
ស្ដាប់	s ɗ a p
ស្ដាប់ឮ	s ɗ a p l ɨː
ស្ដាយ	s ɗ aː j
ស្ដាំ	s ɗ a m
ស្ដើង	s ɗ a ə ŋ
ស្ដេច	s ɗ a c
ស្ដោះ	s ɗ ɑ h
ស្ដៅ	s ɗ a w
ស្តង់	s t ɑ ŋ
ស្តង់ដារ	s t ɑ ŋ ɗ aː
ស្តង់ដារទ្វេ	s t ɑ ŋ ɗ aː tʰ ʋ e i
ស្តុតិ	s t o t e ʔ
ស្ត្រប៊េរី	s ɗ ɑː ɓ e i r iː
ស្ត្រី	s t r ə j
ស្ថាន	s tʰ aː n
ស្ថានីយ	s tʰ aː n iː
ស្ថាបត្យកម្ម	s tʰ aː p t a ʔ j a ʔ k a m
ស្ថិតិ	s tʰ e t e ʔ
ស្ទង់	s t ŭ ə ŋ
ស្ទន់	s t ŭ ə n
ស្ទឹង	s t ɨ ŋ
ស្នង	s n ɑː ŋ
ស្នប់	s n ɑ p
ស្នា	s n aː
ស្នាម	s n aː m
ស្នាយុ	s n aː j u ʔ
ស្នូក	s n o u k
ស្នេហា	s n a e h aː
ស្នែង	s n a e ŋ
ស្បូន	s ɓ o u n
ស្បែក	s ɓ a e k
ស្ពាន	s p i ə n
ស្ពាន់	s p ŏ ə n
ស្ពុតនីក	s p u t n iː k
ស្ពៃ	s p ɨ j
ស្មង	s m ɑː ŋ
ស្មា	s m aː
ស្មាន់	s m a n
ស្មើ	s m a ə
ស្មៀន	s m i ə n
ស្មៅ	s m a w
ស្ម័គ្រ	s m a ʔ
ស្យង់	s j ɑ ŋ
ស្យាម	s j aː m
ស្រ	s r ɑː
ស្រកា	s r ɑ k aː
ស្រមោច	s r ɑ m a o c
ស្រមោល	s r ɑ m a o l
ស្រវា	s r ɑ ʋ aː
ស្រស់	s r ɑ h
ស្រឡាញ់	s r ɑ l a ɲ
ស្រា	s r aː
ស្រាល	s r aː l
ស្រី	s r ə j
ស្រីលង្កា	s r ə j l ɔ ŋ k aː
ស្រុក	s r o k
ស្រុត	s r o t
ស្រូវ	s r ə w
ស្រួច	s r u ə c
ស្រួល	s r u ə l
ស្រេក	s r eː k
ស្រែ	s r a e
ស្រែក	s r a e k
ស្រោម	s r a o m
ស្រៈ	s r a ʔ
ស្លា	s l aː
ស្លាក	s l aː ʔ
ស្លាប	s l aː p
ស្លាបព្រា	s l aː p p r i ə
ស្លាប់	s l a p
ស្លឹក	s l ə k
ស្លឹង	s l ə ŋ
ស្លូវេនី	s l o u ʋ e i n iː
ស្លូវ៉ាគី	s l o u ʋ aː k iː
ស្លេស្ម	s l a e h
ស្លែ	s l a e
ស្លោក	s l a o k
ស្វទេស	s ʋ a ʔ t eː h
ស្វរៈ	s ʋ a ʔ r a ʔ
ស្វា	s ʋ aː
ស្វាគមន៍	s ʋ aː k u m
ស្វាយ	s ʋ aː j
ស្វាស៊ីឡង់	s ʋ aː s iː l ɑ ŋ
ស្វីស	s ʋ iː h
ស្វែង	s ʋ a e ŋ
ស្អប់	s ʔ ɑ p
ស្អាត	s ʔ aː t
ស្អិត	s ʔ ə t
ស្អី	s ʔ ə j
ស្អែក	s ʔ a e k
ហ	h ɑː
ហង្ស	h ɑ ŋ
ហត្ថ	h a t
ហនុមាន	h a ʔ n u m aː n
ហហ្មុក	h ɑ m o k
ហាង	h aː ŋ
ហាងបាយ	h aː ŋ ɓ aː j
ហាណូយ	h aː n o u j
ហាត់	h a t
ហាម	h aː m
ហាស	h aː h
ហាំប៊ឺហ្គឺ	h a m ɓ ɨː ɡ ə ɨ
ហិណ្ឌី	h ə n ɗ iː
ហិប	h ə p
ហិបប្រាក់	h ə p p r a ʔ
ហិមៈ	h e m ĕ ə ʔ
ហិរញ្ញ	h e r a ɲ
ហិរញ្ញវត្ថុ	h e r a ɲ ɲ ĕ ə ʔ ʋ ŏ ə t tʰ o ʔ
ហិរិ	h e r i ʔ
ហឹរ	h a ə
ហុងកុង	h o ŋ k o ŋ
ហុងគ្រី	h o ŋ k r iː
ហុងឌូរ៉ាស	h o ŋ ɗ uː r aː h
ហុច	h o c
ហូជីមិញ	h o u c iː m ɨ ɲ
ហូតែល	h o u t a e l
ហូរ	h o u
ហូឡង់	h o u l ɑ ŋ
ហួច	h u ə c
ហើយ	h a ə j
ហើរ	h a ə
ហេតុ	h a e t
ហេមន្ត	h eː m ɑ n t a ʔ
ហែក	h a e k
ហែល	h a e l
ហៃទី	h a j t iː
ហោតិល	h a o t ə l
ហោរា	h a o r aː
ហោរាសាស្ត្រ	h a o r aː s aː h
ហោះ	h ɑ h
ហៅ	h a w
ហ៊ុប	h u p
ហ៊្វីជី	f iː c iː
ហ៊្សកដានី	z ɔː ʔ ɗ aː n iː
ហ័វ	h a w
ហ្គាណា	ɡ aː n aː
ហ្គាបុង	ɡ aː ɓ o ŋ
ហ្គាស	ɡ aː h
ហ្គីណេ	ɡ iː n eː
ហ្គីតា	ɡ iː t aː
ហ្គីយ៉ាន	ɡ iː j aː n
ហ្គំប៊ី	ɡ ɑ m ɓ iː
ហ្នាំង	n a ŋ
ហ្នឹង	n ɨ ŋ
ហ្នុង	n o ŋ
ហ្ន័ង	n a ŋ
ហ្ម	m ɑː
ហ្មដំរី	m ɑː ɗ ɑ m r ə j
ហ្លួង	l u ə ŋ
ហ្វាម៉ាស៊ី	f aː m aː s iː
ហ្វារ	f aː
ហ្វាំងឡង់	f a ŋ l ɑ ŋ
ហ្វីល	f iː l
ហ្វីលីពីន	f iː l iː p iː n
ហ្វីលីព្ពីន	f iː l iː p p iː n
ហ្វឹក	ʋ ɨ k
ហ្វូង	ʋ o u ŋ
ហ្វឿងហ្វា	f ɨ ə ŋ f aː
ហ្វៃហ្វា	ʋ a j ʋ aː
ហ្វ្រង្ក	f r ɑ ŋ
ហ្វ្រូម៉ាហ្ស	f r o u m aː
ហ្វ្រែហ្ស៍	f r ɛː h
ហ្វ្រ័ង	f r a ŋ
ហ្សកហ្ស៊ី	z ɑ ʔ z iː
ហ្សាម៉ាអ៊ីក	z aː m aː ʔ iː k
ហ្សីរ៉ាហ្វ	z ə j r aː
ហ្សេរុយសាឡឹម	z eː r u j s aː l ə m
ហ្សំប៊ី	z ɑ m ɓ iː
ឡ	l ɑː
ឡត	l ɑː t
ឡាតាំង	l aː t a ŋ
ឡាន	l aː n
ឡាប់សង	l a p s ɑː ŋ
ឡាវ	l aː w
ឡុកឡាក់	l o k l a ʔ
ឡុងដ៍	l o ŋ
ឡូរី	l o u r iː
ឡើង	l a ə ŋ
ឡេតូនី	l eː t o u n iː
ឡេវ	l eː w
ឡេសូតូ	l eː s o u t o u
អ	ʔ ɑː
អកម្ម	ʔ a ʔ k a m
អកម្មភាព	ʔ a ʔ k a m m ĕ ə ʔ pʰ i ə p
អក្ខរា	ʔ a ʔ kʰ a ʔ r aː
អក្ខរាវិរុទ្ធ	ʔ a ʔ kʰ a ʔ r aː ʋ i r u t
អក្ខរៈ	ʔ ɑ ʔ kʰ ɑ r a ʔ
អក្សរ	ʔ a k s ɑː
អគ្គ	ʔ a ʔ k ĕ ə ʔ
អគ្គជៈ	ʔ ɑ ʔ k ĕ ə ʔ c ĕ ə ʔ
អគ្គិ	ʔ a ʔ k i ʔ
អគ្គិសនី	ʔ a ʔ k i s a ʔ n iː
អគ្គី	ʔ a ʔ k i ʔ
អគ្យសនី	ʔ a ʔ k i s ɑː n iː
អង់គ្លេស	ʔ ɑ ŋ kʰ l e i h
អង់ដូរ៉ា	ʔ ɑ ŋ ɗ o u r aː
អង់តាទិក	ʔ ɑ ŋ t aː t ɨ k
អង់ហ្គោឡា	ʔ ɑ ŋ ɡ oː l aː
អង្កត់	ʔ ɑ ŋ k ɑ t
អង្ករ	ʔ ɑ ŋ k ɑː
អង្កាម	ʔ ɑ ŋ k aː m
អង្កាល	ʔ ɑ ŋ k aː l
អង្កាល់	ʔ ɑ ŋ k a l
អង្គ	ʔ ɑ ŋ
អង្គរ	ʔ ɑ ŋ k ɔː
អង្គារ	ʔ ɑ ŋ k i ə
អង្គុយ	ʔ ɑ ŋ k u j
អង្គុលី	ʔ ɑ ŋ k u l iː
អង្រន់	ʔ ɑ ŋ r ŭ ə n
អង្រឹង	ʔ ɑ ŋ r ɨ ŋ
អង្រួន	ʔ ɑ ŋ r u ə n
អង្សា	ʔ ɑ ŋ s aː
អញ	ʔ ɑː ɲ
អញ្ជើញ	ʔ ɑ ɲ c əː ɲ
អញ្ជ័ន	ʔ a ɲ c ŏ ə n
អដវី	ʔ a ʔ ɗ a ʔ ʋ iː
អដ្ឋករ	ʔ a t tʰ a ʔ k ɑː
អដ្ឋិ	ʔ ɑ t tʰ e ʔ
អឌ្ឍ	ʔ a t tʰ ĕ ə ʔ
អណូ	ʔ a ʔ n o u
អណ្ដាត	ʔ ɑ n ɗ aː t
អណ្ដូង	ʔ ɑ n ɗ o u ŋ
អណ្ដើក	ʔ ɑ n ɗ a ə k
អណ្ដែត	ʔ ɑ n ɗ a e t
អតិថិ	ʔ a ʔ t e tʰ e ʔ
អតិថី	ʔ a ʔ t e tʰ e ʔ
អតិសុខុម	ʔ a ʔ t e s o kʰ o m
អតីត	ʔ a ʔ t ɨ t
អត់	ʔ ɑ t
អត្តពលិក	ʔ a t t a ʔ p ŏ ə l l ɨ k
អត្ថ	ʔ a t
អត្ថប្រយោជន៍	ʔ a t t a ʔ p r ɑ j a o c
អត្ថិភាព	ʔ a t tʰ e pʰ i ə p
អធិការ	ʔ a ʔ tʰ i k aː
អធិការបតី	ʔ a ʔ tʰ i k aː p a ʔ t ə j
អធិក្រឹតិ	ʔ a ʔ tʰ ɨ k r ə t
អធិបតេយ្យ	ʔ a ʔ tʰ ɨ p p a ʔ t a j
អធិរាជ	ʔ a ʔ tʰ i r i ə c
អនាគត	ʔ a ʔ n aː k ŭ ə t
អនិច្ច	ʔ a ʔ n ɨ c c a ʔ
អនុក្រម	ʔ a ʔ n u k r ɑ m
អនុញ្ញាត	ʔ a ʔ n u ɲ ɲ aː t
អនុស្វារ	ʔ a ʔ n u h s ʋ aː r a ʔ
អនុស្សាវរីយ	ʔ a ʔ n u h s aː ʋ a ʔ r iː
អនុស្សាវរីយ៍	ʔ a ʔ n u h s aː ʋ a ʔ r iː
អន្តរ	ʔ a n ɗ ɑː
អន្តរជាតិ	ʔ ɑ n t a ʔ r a ʔ c i ə t
អន្តរវាសក	ʔ ɑ n t a ʔ r a ʔ ʋ aː s ɑ ʔ
អន្តោ	ʔ ɑ n t a o
អន្តៈ	ʔ ɑ n t a ʔ
អន្ទង់	ʔ ɑ n t ŭ ə ŋ
អន្លើ	ʔ ɑ n l əː
អន្វេស	ʔ a n ʋ eː h
អបនិត	ʔ a ʔ p a ʔ n ɨ t
អបាយមុខ	ʔ a ʔ ɓ aː j ĕ ə ʔ m u k
អប្សរ	ʔ a p pʰ s ɑː
អប្សរា	ʔ a p s a ʔ r aː
អព្យយ	ʔ a p j ĕ ə ʔ j ĕ ə ʔ
អភិ	ʔ a ʔ pʰ i ʔ
អភិបាល	ʔ a ʔ pʰ i ɓ aː l
អភិវឌ្ឍន៍	ʔ a ʔ pʰ i ʋ ŏ ə t
អម្ពិល	ʔ ɑ m p ɨ l
អម្ភ័ស	ʔ ɑ m pʰ ŏ ə h
អម្រស់	ʔ ɑ m r ɑ h
អយ	ʔ a ʔ j a ʔ
អយស្ម័យ	ʔ a ʔ j a ʔ s m a j
អយោ	ʔ a ʔ j oː
អយ្យកា	ʔ a j j ĕ ə ʔ k aː
អយ្យកោ	ʔ a j j ĕ ə ʔ k a o
អយ្យិកា	ʔ a j j i k aː
អរ	ʔ ɑː
អរគុណ	ʔ ɑ k u n
អរិយ	ʔ a ʔ r e j a ʔ
អរុណ	ʔ a ʔ r u n
អវកាស	ʔ a ʔ ʋ ĕ ə ʔ k aː h
អវិរុទ្ធ	ʔ a ʔ ʋ i r u t
អសង្ហារិម	ʔ a ʔ s ɑ ŋ h aː r ɨ m
អសង្ហារិមៈ	ʔ a ʔ s ɑ ŋ h aː r i m ĕ ə ʔ
អសន្យាណូ	ʔ a ʔ s ɑ n j i ə n o u
អសុរ	ʔ a ʔ s o l
អសុរា	ʔ a ʔ s o r aː
អសុរី	ʔ a ʔ s o r ə j
អសំហារិមៈ	ʔ a ʔ s ɑ ŋ h aː r i m ĕ ə ʔ
អស្តា	ʔ a h s t aː
អស្យាណូ	ʔ a ʔ s ɑ n j aː n o u
អស្វិន	ʔ a h s ʋ ɨ n
អស្សុ	ʔ a h s o ʔ
អាកទិក	ʔ aː ʔ t ɨ k
អាករ	ʔ aː k ɑː
អាកាស	ʔ aː k aː h
អាកាសចរ	ʔ aː k aː h c ɑː
អាកាសធាតុ	ʔ aː k aː s a ʔ tʰ i ə t
អាកុល	ʔ aː k o l
អាក្រក់	ʔ aː ʔ r ɑ ʔ
អាគារ	ʔ aː k i ə
អាគ្នេយ៍	ʔ aː kʰ n eː
អាឃាត	ʔ aː kʰ i ə t
អាង	ʔ aː ŋ
អាច	ʔ aː c
អាចម៍	ʔ a c
អាចរិយ	ʔ aː c a ʔ r e j a ʔ
អាចារ្យ	ʔ aː c aː
អាជ្ញា	ʔ aː c ɲ aː
អាណា	ʔ aː n aː
អាណាចក្រ	ʔ aː n aː c a ʔ
អាតូម	ʔ aː t o u m
អាត្លង់ទិក	ʔ aː t l ɑ ŋ t ɨ k
អាថែនស៍	ʔ aː tʰ a e n
អាទិត្យ	ʔ aː t ɨ t
អាន	ʔ aː n
អាប	ʔ aː p
អាពាហ៍ពិពាហ៍	ʔ aː p i ə p i p i ə
អាពុក	ʔ aː p u k
អាមាតិសារ	ʔ aː m aː t e s aː
អាមេនី	ʔ aː m e i n iː
អាមេរិក	ʔ aː m e i r ɨ k
អាយ	ʔ aː j
អាយឡែន	ʔ aː j l a e n
អាយុ	ʔ aː j u ʔ
អាយ័ត	ʔ aː j a t
អារ	ʔ aː
អារក្ខ	ʔ aː r a ʔ
អារក្ស	ʔ aː r a ʔ
អារម្មណ៍	ʔ aː r ɑ m
អារ៉ាប	ʔ aː r aː p
អារ៉ាប់	ʔ aː r a p
អាលុយមីញ៉ូម	ʔ aː l u j m iː ɲ o u m
អាល់បានី	ʔ a l ɓ aː n iː
អាល់ហ្សេរី	ʔ a l z eː r iː
អាល្លឺម៉ង់	ʔ aː l l ə ɨ m ɑ ŋ
អាវ	ʔ aː w
អាវុធ	ʔ aː ʋ u t
អាវេសិក	ʔ aː ʋ eː s ə k
អាវ៉ូកាត៍	ʔ aː ʋ o u k aː
អាសន្ទិ	ʔ aː s ɑ n t i ʔ
អាសយដ្ឋាន	ʔ aː s a ʔ j a t tʰ aː n
អាសេនិក	ʔ aː s eː n ɨ k
អាស៊ី	ʔ aː z iː
អាស៊ីត	ʔ aː s iː t
អាស៊ែបៃហ្សង់	ʔ aː s ɛː ɓ a j z ɑ ŋ
អាស់សង់ស័រ	ʔ a h s ɑ ŋ s ɔ ə
អាស្រូវ	ʔ aː s r ə w
អាហារ	ʔ aː h aː
អាហ្មុក	h ɑ m o k
អាហ្វហ្គានីស្ថាន	ʔ aː f ɡ aː n iː s tʰ aː n
អាហ្វ្រិក	ʔ aː f r ɨ k
អាហ្សង់ទីន	ʔ aː z ɑ ŋ t iː n
អាឡា	ʔ aː l aː
អាឡូ	ʔ aː l o u
អាំង	ʔ a ŋ
អិស្លាម	ʔ i h s l aː m
អី	ʔ ə j
អឺរ៉ាស៊ី	ʔ ə ɨ r aː z iː
អឺរ៉ុប	ʔ ə ɨ r o p
អឺរ៉ូ	ʔ ə ɨ r o u
អុក	ʔ o k
អុរ	ʔ o l
អុស	ʔ o h
អូខី	ʔ o u kʰ ə j
អូដ្ឋ	ʔ o u t
អូតូការ	ʔ o u t o u k aː
អូតូប៊ុស	ʔ o u t o u ɓ u h
អូតូរុត	ʔ o u t o u r u t
អូតែល	ʔ o u t a e l
អូទ្រីស	ʔ o u t r iː h
អូន	ʔ o u n
អូប៉ាល័រ	ʔ o u p aː l ɔ ə
អូប៉េរ៉ា	ʔ o u p eː r aː
អូប័រ	ʔ o u ɓ ŏ ə
អូមែន	ʔ o u m ɛː n
អូរ	ʔ o u
អូលីវ	ʔ o u l iː w
អូស	ʔ o u h
អូសេអានី	ʔ o u s eː ʔ aː n iː
អូស្ត្រាលី	ʔ o u s t r aː l iː
អូស្រ្តាលី	ʔ o u s t r aː l iː
អៀង	ʔ i ə ŋ
អៀន	ʔ i ə n
អៀរឡង់	ʔ i ə l ɑ ŋ
អេកូស	ʔ eː k o u h
អេក្រង់	ʔ eː k r ɑ ŋ
អេក្វាទ័រ	ʔ eː kʰ ʋ aː t ɔ ə
អេដស៍	ʔ eː t
អេត្យូពី	ʔ eː t j uː p iː
អេរីត្រេ	ʔ eː r iː t r eː
អេលីកុបទែរ	ʔ eː l iː k o p t ɛː
អេស្តូនី	ʔ eː s t o u n iː
អេស្ប៉ាញ	ʔ eː s p aː ɲ
អេហ៊្សីប	ʔ eː z iː p
អេះ	ʔ e h
អែលសាល់វ៉ាឌ័រ	ʔ a e l s a l ʋ aː ɗ ɔ ə
អោប	ʔ a o p
អំណាច	ʔ ɑ m n aː c
អំណោយ	ʔ ɑ m n a o j
អំបាត	ʔ ɑ m ɓ aː t
អំបិល	ʔ ɑ m ɓ ə l
អំបោស	ʔ ɑ m ɓ a o h
អំបោះ	ʔ ɑ m ɓ ɑ h
អំប៊ូឡង់ស៍	ʔ ɑ m ɓ uː l ɑ ŋ
អំពល់	ʔ ɑ m p ŭ ə l
អំពិលអំពែក	ʔ a m p ɨ l ʔ ɑ m p ɛː k
អំពៅ	ʔ ɑ m p ɨ w
អ៊ីដ្រូកាបូ	ʔ iː t r o u k aː ɓ o u
អ៊ីតាលី	ʔ iː t aː l iː
អ៊ីនធឺណិត	ʔ iː n tʰ ɨː n ə t
អ៊ីមែល	ʔ iː m ɛː l
អ៊ីរ៉ង់	ʔ iː r ɑ ŋ
អ៊ីរ៉ាក់	ʔ iː r a ʔ
អ៊ីស្រាអែល	ʔ iː s r aː ʔ a e l
អ៊ីស្លង់	ʔ iː s l ɑ ŋ
អ៊ីស្លាម	ʔ i h s l aː m
អ៊ុយក្រែន	ʔ u j k r a e n
អ៊ុយរូហ្គាយ	ʔ u j r uː ɡ aː j
អ៊ូបេគីស្ថាន	ʔ uː ɓ eː k iː s tʰ aː n
អ៊ូលេនបាធរ	ʔ uː l e i n ɓ aː tʰ ɔː
អ៊ូហ្គង់ដា	ʔ uː ɡ ɑ ŋ ɗ aː
អ័ព្ទ	ʔ a p
អ័ព្ភ	ʔ a p
អ័ភ្រ	ʔ a p
អ្នក	n ĕ ə ʔ
អ្នកឧកញ៉ា	n ĕ ə ʔ ʔ o k ɲ aː
អ្វី	ʔ a ʔ ʋ ə j
អ្វីៗ	ʔ a ʔ ʋ ə j ʔ a ʔ ʋ ə j
ឣ	ʔ a ʔ
ឥ	ʔ e ʔ
ឥដ្ឋ	ʔ ə t
ឥណទាន	ʔ ɨ n t i ə n
ឥណ្ឌា	ʔ ə n ɗ i ə
ឥណ្ឌូចិន	ʔ e n ɗ uː c ə n
ឥណ្ឌូនេស៊ី	ʔ ə n ɗ uː n e i s iː
ឥណ្ឌៀ	ʔ ə n ɗ i ə
ឥត	ʔ ə t
ឥទ្ធិ	ʔ ə t tʰ i ʔ
ឥន្ទធនូ	ʔ ə n tʰ ĕ ə ʔ n uː
ឥន្ទ្រិយ	ʔ ə n t r iː
ឥន្ទ្រី	ʔ ə n t r iː
ឥន្ធនៈ	ʔ ə n tʰ ĕ ə ʔ n ĕ ə ʔ
ឥរា	ʔ i r aː
ឥស្លាម	ʔ i h s l aː m
ឦ	ʔ ə j
ឦស	ʔ iː s a ʔ
ឦសាន	ʔ ə j s aː n
ឧ	ʔ o ʔ
ឧកញ៉ា	ʔ o k ɲ aː
ឧក្កាបាត	ʔ u k k aː ɓ aː t
ឧច្ចារ	ʔ u c c aː r a ʔ
ឧដុង្គ	ʔ u ɗ o ŋ
ឧណ្ណា	ʔ u n n aː
ឧណ្ហីស	ʔ u n h ə h
ឧតុ	ʔ u t o ʔ
ឧត្តរ	ʔ u t ɗ ɑː
ឧទានសញ្ញា	ʔ u t i ə n ĕ ə ʔ s a ɲ ɲ aː
ឧទានសព្ទ	ʔ u t i ə n ĕ ə ʔ s a p
ឧទានស័ព្ទ	ʔ u t i ə n ĕ ə ʔ s a p
ឧទាហរណ៍	ʔ u t i ə h ɑː
ឧទ្យាន	ʔ u t tʰ j i ə n
ឧបករណ៍	ʔ u p a ʔ k ɑː
ឧបជ្ឈា	ʔ u p a c cʰ i ə
ឧបជ្ឈាយ៍	ʔ u p a c cʰ i ə
ឧបទ្វីប	ʔ u p a t tʰ ʋ iː p
ឧបយុវរាជ	ʔ u p a ʔ j u ʋ ĕ ə ʔ r i ə c
ឧបរាជ	ʔ u p a ʔ r aː c
ឧប្បាទធម៌	ʔ u p ɓ aː t ĕ ə ʔ tʰ ŏ ə
ឧភយោរាជ	ʔ u pʰ ĕ ə ʔ j oː r i ə c
ឧម្មង្គ	ʔ u m m ɑ ŋ
ឧម្មុង្គ	ʔ u m m o ŋ
ឧរគ	ʔ u r a ʔ k ĕ ə ʔ
ឧរង្គ	ʔ u r ɑ ŋ k ĕ ə ʔ
ឧស	ʔ o h
ឧសភា	ʔ o s a ʔ pʰ i ə
ឧស្ម័ន	ʔ u s m a n
ឧស្សវៈ	ʔ u h s ĕ ə ʔ ʋ ĕ ə ʔ
ឧស្សាហកម្ម	ʔ u s s aː h a ʔ k a m
ឧស្សាហៈ	ʔ u h s aː h a ʔ
ឩដ្ឋ	ʔ o u t
ឪ	ʔ ə w
ឪពុក	ʔ ə w p u k
ឪឡឹក	ʔ ə w l ə k
ឫស	r ɨ h
ឫស្សី	r ɨ h s ə j
ឬ	r ɨː
ឬទេ	r ɨː t e i
ឮ	l ɨː
ឯ	ʔ a e
ឯក	ʔ a e k
ឯករាជ	ʔ a e k a ʔ r i ə c
ឯករាជ្យ	ʔ a e k a ʔ r i ə c
ឯកសារ	ʔ a e k a ʔ s aː
ឯកាធិកម្ម	ʔ a e k aː tʰ i k a m
ឯកាធិភាព	ʔ a e k aː tʰ i pʰ i ə p
ឯង	ʔ a e ŋ
ឯណា	ʔ a e n aː
ឱកាស	ʔ a o k aː h
ឱម៉ាល់	ʔ a o m a l
ឱរ៉ុប	ʔ a o r o u p
ឱរ៉ូប	ʔ a o r o u p
ឱសថ	ʔ a o s ɑ t
ឱសថស្ថាន	ʔ a o s ɑː tʰ ɑː s tʰ aː n
ឱស្ឋ	ʔ a o h
ឱហាត	ʔ a o h aː t
ឲ្យ	ʔ a o j
ឳ	ʔ ə w
ឳពុក	ʔ ə w p u k
