ក	k ɑː
ពន្លាក	p ŭ ə n l i ə ʔ
ពន្លឺ	p ŭ ə n l ɨː
ពពក	p ɔ p ɔː ʔ
ពពុះ	p ɔ p u h
ពពួក	p ɔ p u ə ʔ
ពពែ	p ɔ p ɛː
ពភ្លើ	p o p l əː
ពល	p ŭ ə l
ពលី	p ĕ ə ʔ l iː
ពស់	p ŭ ə h
ពហុ	p ĕ ə ʔ h u ʔ
ពាក់	p ĕ ə ʔ
ពាក្យ	p i ə ʔ
ពាក្យសំដី	p i ə k s ɑ m ɗ ə j
ពាង	p i ə ŋ
ពាណិជ	p i ə n ɨ c
ពាណិជ្ជ	p i ə n ɨ c
ពាន់	p ŏ ə n
ពាម	p i ə m
ពាយុ	p i ə j u ʔ
ពាល	p i ə l
ពាល់	p ŏ ə l
ពាំង	p ĕ ə ŋ
ពិឃាត	p i kʰ i ə t
ពិចារណា	p i c aː r a ʔ n aː
ពិណ	p ɨ n
ពិត	p ɨ t
ពិតាន	p i t aː n
ពិធាន	p i tʰ i ə n
ពិធី	p i tʰ iː
ពិនិត្យ	p i n ɨ t
ពិន័យ	p i n ɨ j
ពិន្ទង	p ɨ n t ɔː ŋ
ពិន្ទុ	p ɨ n t u ʔ
ពិបាក	p i ɓ aː ʔ
ពិពណ៌នា	p i p ɔ ə n i ə
ពិពិធ	p i p ɨ t
ពិភព	p i pʰ u p
ពិរុទ្ឋ	p i r u t
ពិល	p ɨ l
ពិស	p ɨ h
ពិសា	p i s aː
ពិសោធន៍	p i s a o t
ពី	p iː
ពីង	p iː ŋ
ពីងពាង	p iː ŋ p i ə ŋ
ពីជៈ	p iː c ĕ ə ʔ
ពីណា	p iː n aː
ពីរ	p iː
ពីរោះ	p iː r ŭ ə h
ពុក	p u k
ពុង	p u ŋ
ពុទ្ធ	p u t
ពុធ	p u t
ពុំ	p u m
ពុះ	p u h
ពូក	p uː k
ពូជ	p uː c
ពូថៅ	p uː tʰ a w
ពួក	p u ə ʔ
ពួកគេ	p u ə ʔ k eː
ពួកម៉ាក	p u ə ʔ m aː ʔ
ពួរ	p u ə
ពេក	p e i k
ពេជ្ឈឃាដ	p ɨ c cʰ ĕ ə ʔ kʰ i ə t
ពេជ្ឈឃាត	p ɨ c cʰ ĕ ə ʔ kʰ i ə t
ពេញ	p ɨ ɲ
ពេទ្យ	p ɛː t
ពេល	p eː l
ពេស្យា	p eː h s j aː
ពេស្យាស្ថាន	p eː h s j aː s tʰ aː n
ពែង	p ɛː ŋ
ពែរមី	p ɛː m iː
ពែរ្ស	p ɛː s ɑː
ពោត	p oː t
ពោះ	p ŭ ə h
ព័ត៌មាន	p ɔ ə ɗ ɑː m i ə n
ព័រទុយហ្គាល់	p ɔ ə t u j ɡ a l
ព័ស្តុតាង	pʰ ŏ ə h t aː ŋ
ព្យញ្ជន	pʰ j u ə ɲ c ĕ ə ʔ n ĕ ə ʔ
ព្យតិហារ	pʰ j ĕ ə ʔ t e h aː
ព្យាករណ៍	pʰ j i ə k ɑː
ព្យាការី	pʰ j i ə k aː r ə j
ព្យាង្គ	pʰ j i ə ŋ
ព្យាបាល	pʰ j i ə ɓ aː l
ព្យុងយ៉ាង	pʰ j u ŋ j aː ŋ
ព្យុះ	pʰ j u h
ព្រនង់	p r ɔ n ŭ ə ŋ
ព្រម	p r ɔː m
ព្រលឹង	p r ɔ l ɨ ŋ
ព្រលឹត	p r ɔ l ɨ t
ព្រលឹម	p r ɔ l ɨ m
ព្រហក់	p r ɔ h ŭ ə ʔ
ព្រហស្បតិ៍	p r ɔ h ŏ ə h
ព្រហស្បត្ណិ	p r ɔ h ŏ ə h
ព្រហ្មញ្ញ	p r u m m a ɲ
ព្រហ្មណ្យ	p r u m m a n
ព្រាន	p r i ə n
ព្រាប	p r i ə p
ព្រិច	p r ɨ c
ព្រិល	p r ɨ l
ព្រឹក	p r ɨ k
ព្រុយណេ	p r u j n eː
ព្រុស	p r u h
ព្រូន	p r uː n
ព្រួញ	p r u ə ɲ
ព្រួយ	p r u ə j
ព្រេង	p r eː ŋ
ព្រែ	p r ɛː
ព្រៃ	p r ɨ j
ព្រោន	p r oː n
ព្រោះ	p r ŭ ə h
ព្រះ	p r ĕ ə h
ព្រះអង្គ	p r ĕ ə h ʔ ɑ ŋ
ភ	pʰ ɔː
ភក់	pʰ ŭ ə ʔ
ភក្ខ	pʰ ĕ ə ʔ
ភក្តី	pʰ ĕ ə k t ə j
ភក្តីភាព	pʰ ĕ ə ʔ kʰ t ə j pʰ i ə p
ភក្ស	pʰ ĕ ə k s aː
ភក្សា	pʰ ĕ ə k s aː
ភព	pʰ u p
ភរ	pʰ ɔː
ភរិយា	pʰ ĕ ə ʔ r i j i ə
ភស្តុតាង	pʰ ŏ ə h t aː ŋ
ភាគ	pʰ i ə ʔ
ភាគី	pʰ i ə k iː
ភាព	pʰ i ə p
ភាពយន្ត	pʰ i ə p j ŭ ə n
ភារ	pʰ i ə
ភាសា	pʰ i ə s aː
ភីហ្សា	pʰ iː z aː
ភូត	pʰ uː t
ភូមធ្យរេខា	pʰ uː m ĕ ə t j ĕ ə ʔ r e i kʰ aː
ភូមា	pʰ uː m i ə
ភូមិ	pʰ uː m
ភូមិន្ទ	pʰ uː m ɨ n
ភូរាល	pʰ uː r i ə l
ភួង	pʰ u ə ŋ
ភួយ	pʰ u ə j
ភើ	pʰ əː
ភឿន	pʰ ɨ ə n
ភេ	pʰ e i
ភេទ	pʰ eː t
ភេនឃ្វីន	pʰ e i n kʰ ʋ iː n
ភេរវជន	pʰ eː r ĕ ə ʔ ʋ ĕ ə ʔ c ŭ ə n
ភេរវនិយម	pʰ eː r ĕ ə ʔ ʋ ĕ ə ʔ n i j u m
ភេរវារម្មណ៍	pʰ eː r ĕ ə ʔ ʋ i ə r ɑ m
ភេសជ្ជ	pʰ e i s a c
ភេសជ្ជាគារ	pʰ e i s a c c i ə k i ə
ភោ	pʰ oː
ភោជនាគារ	pʰ oː c ĕ ə ʔ n i ə k i ə
ភោជនីយ	pʰ oː c ĕ ə ʔ n iː
ភោជ្ជសាលី	pʰ oː c s aː l ə j
ភ្ជាប់	pʰ c ŏ ə p
ភ្ជុំ	pʰ c u m
ភ្ជួរ	pʰ c u ə
ភ្ញាក់	pʰ ɲ ĕ ə ʔ
ភ្ញៀវ	pʰ ɲ i ə w
ភ្នាក់	pʰ n ĕ ə ʔ
ភ្នាល់	pʰ n ŏ ə l
ភ្នែក	pʰ n ɛː k
ភ្នំ	pʰ n u m
ភ្រូណ	p r uː n
ភ្រូណា	p r uː n aː
ភ្រូន	p r uː n
ភ្លាម	pʰ l i ə m
ភ្លុក	pʰ l u k
ភ្លើង	pʰ l əː ŋ
ភ្លៀង	pʰ l i ə ŋ
ភ្លេង	pʰ l eː ŋ
ភ្លេច	pʰ l ɨ c
ភ្លែត	pʰ l ɛː t
ភ្លោះ	pʰ l ŭ ə h
ភ្លៅ	pʰ l ɨ w
ម	m ɔː
មក	m ɔː ʔ
មករា	m ĕ ə ʔ k a ʔ r aː
មកុដ	m ĕ ə ʔ k o t
មង្គល	m ŭ ə ŋ k ŭ ə l
មង្ឃុត	m ŭ ə ŋ kʰ u t
មច្ចព័ន្ធ	m a c c a ʔ p ŏ ə n
មច្ឆានុ	m a c cʰ aː n u ʔ
មជ្ជ	m ɑ c c ĕ ə ʔ
មជ្ឈដ្ឋាន	m a c cʰ ĕ ə ʔ tʰ aː n
មជ្ឈិម	m a c cʰ ɨ m
មឈូស	m ɔ cʰ uː h
មណី	m ĕ ə ʔ n iː
មណ្ឌល	m ŭ ə n ɗ ŭ ə l
មតិ	m ĕ ə ʔ t e ʔ
មត្ត	m a t t a
មន	m ɔː n
មនសិការ	m ĕ ə ʔ n ĕ ə ʔ s e k aː
មនុស្ស	m ɔ n u h
មន្ត	m ŭ ə n
មន្ត្រ	m ŭ ə n
មន្ត្រី	m ŭ ə n t r ə j
មន្ទីរ	m ŭ ə n t iː
មមាល	m ɔ m i ə l
មមី	m ɔ m iː
មមែ	m ɔ m ɛː
មមោក	m ɔ m oː k
មយូរ	m ĕ ə ʔ j uː
មយូរី	m ĕ ə ʔ j uː r iː
មសូរ	m ĕ ə ʔ s o u
មហទ្ធន	m ĕ ə ʔ h a t tʰ ŭ ə n
មហា	m ĕ ə ʔ h aː
មហាក្សត្រ	m ĕ ə ʔ h aː k s ɑː t
មហារាជ	m ĕ ə ʔ h aː r i ə c
មហាវិទ្យាល័យ	m ĕ ə ʔ h aː ʋ ɨ t tʰ j i ə l a j
មហាសមុទ្រ	m ĕ ə ʔ h aː s a ʔ m o t
មហោរស្រព	m ĕ ə ʔ h a o s r ɑ p
មហោស្រព	m ĕ ə ʔ h a o s r ɑ p
មាត់	m ŏ ə t
មាន	m i ə n
មាន់	m ŏ ə n
មារ	m i ə
មាស	m i ə h
មិច្ឆា	m ɨ c cʰ aː
មិត្ត	m ɨ t
មិត្តប្រុស	m ɨ t p r o h
មិត្តភាព	m ɨ t t a ʔ pʰ i ə p
មិត្តស្រី	m ɨ t s r ə j
មិថុន	m i tʰ o n
មិថុនា	m i tʰ o n aː
មិន	m ɨ n
មី	m iː
មីក្រុប	m iː k r o p
មីក្រូវ៉េវ	m iː k r uː ʋ eː w
មីន	m iː n
មីនា	m iː n aː
មីយ៉ាន់ម៉ា	m iː j a n m aː
មឹក	m ɨ k
មុក្តា	m u k t aː
មុខ	m u k
មុង	m u ŋ
មុត	m u t
មុត្តា	m u t t aː
មុន	m u n
មុម	m u m
មុំ	m u m
មូត្រ	m o u t
មូល	m uː l
មូលតា	m uː l t aː
មូស	m uː h
មូសិកទន្ត	m uː s e k a ʔ t ŏ ə n
មូស្គូ	m uː s k uː
មូស្លីម	m uː s l ə j m
មួក	m u ə ʔ
មួយ	m u ə j
មួល	m u ə l
មើល	m əː l
មឿង	m ɨ ə ŋ
មៀន	m i ə n
មៀម	m i ə m
មេ	m eː
មេឃ	m e i k
មេឃ្មុំ	m eː kʰ m u m
មេដាយ	m eː ɗ aː j
មេថុន	m eː tʰ o n
មេធាវី	m eː tʰ i ə ʋ iː
មេពាក្យ	m eː p i ə ʔ
មេសបាល	m e i s a ʔ ɓ aː l
មេសបាលី	m e i s a ʔ ɓ aː l iː
មេសា	m e i s aː
មេអំបៅ	m e i ʔ ɑ m ɓ a w
មែក	m ɛː k
មែន	m ɛː n
មោរៈ	m oː r ĕ ə ʔ
មំសៈ	m ĕ ə ŋ s a ʔ
ម៉ាកាវ	m aː k aː w
ម៉ាក្ស	m aː k s ɑː
ម៉ាដាហ្គាស្ការ	m aː ɗ aː ɡ aː s k aː
ម៉ាត់	m a t
ម៉ារ៉ុក	m aː r o k
ម៉ាលី	m aː l iː
ម៉ាល់ឌីវ	m a l ɗ iː w
ម៉ាល់តា	m a l t aː
ម៉ាស	m aː h
ម៉ាសក៍	m a h
ម៉ាសេដូនី	m aː s eː ɗ o u n iː
ម៉ាស៊ីន	m aː s ɨ n
ម៉ាស្សា	m aː s s aː
ម៉ាឡាយូ	m aː l aː j uː
ម៉ាឡាវី	m aː l aː ʋ iː
ម៉ាឡេស៊ី	m aː l eː s iː
ម៉ិចស៊ិក	m ə c s ɨ k
ម៉ឺន	m ə ɨ n
ម៉ុងតេនីក្រូ	m o ŋ t eː n iː k r uː
ម៉ុងហ្គោលី	m o ŋ ɡ o u l iː
ម៉ុលដូវ៉ា	m o l ɗ o u ʋ aː
ម៉ូណាកូ	m o u n aː k o u
ម៉ូត	m o u t
ម៉ូតូ	m o u t o u
ម៉ូតែល	m o u t a e l
ម៉ូរីតានី	m o u r iː t aː n iː
ម៉ូរីស	m o u r iː h
ម៉ូលេគុល	m o u l e i k u l
ម៉ូសំប៊ិក	m o u s ɑ m ɓ ɨ k
ម៉េច	m ə c
ម៉េត្រូ	m eː t r o u
ម៉ែ	m a e
ម៉ែត្រ	m a e t
ម៉ោង	m a o ŋ
ម៉ោងជាង	m a o ŋ c i ə ŋ
ម័រហ្វីន	m ɔ ə f ə j n
ម្ចាស់	m c a h
ម្ជុល	m c u l
ម្ឈួស	m ɔ cʰ uː h
ម្ញ៉ិកម្ញ៉ក់	m ɲ ə k m ɲ ɑ ʔ
ម្ដង	m ɗ ɑː ŋ
ម្ដាយ	m ɗ aː j
ម្ដេច	m ɗ ə c
ម្ទេស	m t e i h
ម្នាស់	m n ŏ ə h
ម្ភៃ	m pʰ ɨ j
ម្រាម	m r i ə m
ម្រឹត	m r ɨ t
ម្រេច	m r ɨ c
ម្រះ	m r ĕ ə h
ម្លប់	m l u p
ម្លូ	m l uː
ម្សាញ់	m s a ɲ
ម្សិល	m s ə l
ម្សៅ	m s a w
ម្ហូប	m h o u p
យ	j ɔː
យក	j ɔː ʔ
យក់	j ŭ ə ʔ
យក្ខ	j ĕ ə ʔ
យក្ស	j ĕ ə ʔ
យញ្ញ	j a ɲ
យន្ត	j ŭ ə n
យប់	j u p
យម	j u m
យល់	j ŭ ə l
យស	j u ə h
យាន	j i ə n
យានដ្ឋាន	j i ə n a ʔ tʰ aː n
យាយ	j i ə j
យីហោ	j iː h a o
យឺត	j ɨː t
យុគ	j u k
យុគល	j u k u ə l
យុគលៈ	j u k ĕ ə ʔ l ĕ ə ʔ
យុត្តិ	j u t t e ʔ
យុត្តិធម៌	j u t t e tʰ ŏ ə
យុថ្កា	j u t k aː
យូហ្គា	j uː ɡ aː
យួន	j u ə n
យួរ	j u ə
យើង	j əː ŋ
យេមែន	j e i m ɛː n
យេស៊ូ	j eː s uː
យោគៈ	j oː k ĕ ə ʔ
យោធ	j oː tʰ ĕ ə ʔ
យោធា	j oː tʰ i ə
យោនី	j oː n iː
យោបល់	j oː ɓ ɑ l
យោមរាជ	j oː m ĕ ə ʔ r i ə c
យោល	j oː l
យំ	j u m
យ៉ាក	j aː ʔ
យ៉ាង	j aː ŋ
យ៉ាបា	j aː ɓ aː
យ៉ាប់	j a p
យ័ន្ត	j ŭ ə n
រ	r ɔː
រក	r ɔː ʔ
រកា	r ɔ k aː
រក្សសី	r ĕ ə k s a ʔ s ə j
រក្សសៈ	r ĕ ə k s a ʔ s a ʔ
រខិត	r ɔ kʰ ə t
រងា	r ɔ ŋ i ə
រងើក	r ɔ ŋ əː k
រងៃ	r ɔ ŋ ɨ j
រង្គាជីព	r u ə ŋ k i ə c iː p
រង្វាន់	r ŭ ə ŋ ʋ ŏ ə n
រចនា	r a ʔ c a ʔ n aː
រញ្ជួយ	r ŭ ə ɲ c u ə j
រដូវ	r ɔ ɗ ə w
រដ្ឋ	r ŏ ə t
រដ្ឋធានី	r ŏ ə t tʰ a ʔ tʰ i ə n iː
រដ្ឋាភិបាល	r ŏ ə t tʰ aː pʰ i ɓ aː l
រតិ	r ĕ ə ʔ t e ʔ
រត់	r ŭ ə t
រថ	r ŭ ə t
រថភ្លើង	r ŭ ə t pʰ l əː ŋ
រទច្ឆេទី	r ĕ ə ʔ t ĕ ə ʔ cʰ eː t iː
រទេះ	r ɔ t e h
រន្ទះ	r ŭ ə n t ĕ ə h
រន្ធ	r ŭ ə n
របប	r ɔ ɓ ɑː p
របស់	r ɔ ɓ ɑ h
របស់ខ្ញុំ	r ɔː ɓ ɑ h k ɲ o m
របស់លោក	r ɔː ɓ ɑ h l oː k
របាទ	r ɔ ɓ aː t
របាល	r ɔ ɓ aː l
របាំ	r ɔ ɓ a m
របួស	r ɔ ɓ u ə h
របៀប	r ɔ ɓ i ə p
រពីង	r ɔ p iː ŋ
រមាស	r ɔ m i ə h
រមាំង	r ɔ m ĕ ə ŋ
រមៀត	r ɔ m i ə t
រម្ភា	r u m pʰ i ə
រយ	r ɔː j
រលក	r ɔ l ɔː ʔ
រលុង	r ɔ l u ŋ
រលំ	r ɔ l u m
រវ៉ាន់ដា	r ɔ ʋ a n ɗ aː
រស	r ŭ ə h
រសោះ	r ɔ s ɑ h
រស់	r ŭ ə h
រស្មី	r ĕ ə ʔ s m ə j
រស្ស	r ŏ ə h s a ʔ
រហែ	r ɔ h a e
រអិល	r ɔ ʔ ə l
រឥល	r ɔ ʔ ə l
រា	r i ə
រាក្ស័ស	r i ə kʰ s a h
រាគ	r i ə ʔ
រាជ	r i ə c
រាជធានី	r i ə c tʰ i ə n iː
រាជា	r i ə c i ə
រាជាណាចក្រ	r i ə c i ə n aː c a ʔ
រាជ្យ	r i ə c
រាត្រី	r i ə t r ə j
រាន	r i ə n
រាប	r i ə p
រាប់	r ŏ ə p
រាមញ្ញ	r i ə m ɲ ɲ ɔː
រាយ	r i ə j
រាវ	r i ə w
រាសី	r i ə s ə j
រាសីចក្រ	r i ə s ə j c a ʔ
រាស្ត្រ	r i ə h
រាហុ៍	r i ə h
រាំ	r ŏ ə m
រិល	r ɨ l
រិះគិត	r i h k ɨ t
រឹត	r ɨ t
រឹល	r ɨ l
រុក្ខរស	r u k kʰ a ʔ r ŭ ə h
រុញ	r u ɲ
រុយ	r u j
រុស្សី	r u h s ə j
រុស្ស៊ី	r u s iː
រូង	r uː ŋ
រូប	r uː p
រូបយន្ត	r uː p j ŭ ə n
រូបិយវត្ថុ	r uː p e j ĕ ə ʔ ʋ ŏ ə t tʰ o ʔ
រូម៉ានី	r uː m aː n iː
រូស	r uː h
រួម	r u ə m
រួល	r u ə l
រើស	r əː h
រឿង	r ɨ ə ŋ
រៀន	r i ə n
រៀប	r i ə p
រៀល	r i ə l
រេញ	r ɨ ɲ
រេណបថ	r eː n a ʔ ɓ ɑː t
រេផៈ	r e i pʰ a ʔ
រៃ	r ɨ j
រោគ	r oː k
រោង	r oː ŋ
រោងចក្រ	r oː ŋ c a ʔ
រោទ៍	r oː
រោម	r oː m
រោយ	r oː j
រោរព	r oː r u p
រោល	r oː l
រោហិណី	r oː h e n iː
រំពាត់	r u m p ŏ ə t
រំលូត	r u m l uː t
រំលោភ	r u m l oː p
រំសេវ	r u m s eː w
រំអិល	r u m ʔ ə l
រះ	r ĕ ə h
រ៉ក	r ɑː ʔ
រ៉ង់ហ្គូន	r ɑ ŋ ɡ o u n
រ៉ាឌីយោ	r aː ɗ iː j oː
រ៉ាប់រង	r a p r ɔː ŋ
រ៉ាំងណុក	r a ŋ n o k
រ៉ឺកុម្មងដេ	r ə ɨ k o m m ɑ ŋ ɗ eː
រ៉ុកកែត	r o k k a e t
រ៉ូម	r o u m
រ៉ូម៉ង់	r o u m ɑ ŋ
រ៉ែ	r a e
រ័ក្ស	r ĕ ə ʔ
ល	l ɔː
លក់	l ŭ ə ʔ
លក្ស្មី	l ĕ ə k s m ə j
លង្វែក	l ŭ ə ŋ ʋ ɛː k
លជ្ជាភាព	l a c c i ə pʰ i ə p
លញ្ឆករ	l a ɲ cʰ a ʔ k ɑː
លទ្ធ	l a t tʰ ĕ ə ʔ
លទ្ធិ	l a t tʰ i ʔ
លស់	l ŭ ə h
លា	l i ə
លាក់	l ĕ ə ʔ
លាង	l i ə ŋ
លាឈប់	l i ə cʰ u p
លាន	l i ə n
លាប់	l ŏ ə p
លាមក	l i ə m ŭ ə ʔ
លាយ	l i ə j
លាវ	l i ə w
លាសិនហើយ	l i ə s ə n h a ə j
លាហើយ	l i ə h a ə j
លិខិត	l i kʰ ə t
លិង្គ	l ɨ ŋ
លិច	l ɨ c
លិចតិនស្តាញ	l ɨ c t ə n s t aː ɲ
លិឍ	l ɨ t
លិទ្ធ	l ɨ t
លិនជី	l ɨ n c iː
លី	l iː
លីង	l iː ŋ
លីទុយអានី	l iː t u j ʔ aː n iː
លីបង់	l iː ɓ ɑ ŋ
លីបេរីយ៉ា	l iː ɓ eː r iː j aː
លីប៊ី	l iː ɓ iː
លីវ	l iː w
លីឡ្នា	l iː l h aː
លុក	l u k
លុង	l u ŋ
លុចសំបួ	l u c s ɑ m ɓ u ə
លុត	l u t
លុន	l u n
លុប	l u p
លុម្បក	l u p a ʔ k a ʔ
លុយ	l u j
លូ	l uː
លូត	l uː t
លួច	l u ə c
លួស	l u ə h
លើ	l əː
លើក	l əː k
លឿង	l ɨ ə ŋ
លឿន	l ɨ ə n
លេខ	l eː k
លេខនា	l eː kʰ a ʔ n aː
លេខា	l eː kʰ aː
លេង	l eː ŋ
លេណ	l eː n
លេណក	l eː n ɑ ʔ
លេប	l eː p
លៃ	l ɨ j
លោក	l oː k
លោកិយ	l oː k e j a ʔ
លោត	l oː t
លោម	l oː m
លោហាករ	l oː h aː k ɑː
លោហិត	l oː h ə t
លោហៈ	l oː h a ʔ
លំចង់	l u m c ɑ ŋ
លំដាប់	l u m ɗ a p
លំពោង	l u m p oː ŋ
លំហែ	l u m h a e
លំអ	l u m ʔ ɑː
លំអោត	l u m ʔ a o t
ល័ខ	l ĕ ə ʔ
ល្ខោន	l kʰ a o n
ល្ង	l ŋ ɔː
ល្ងង់	l ŋ ŭ ə ŋ
ល្ងាច	l ŋ i ə c
ល្ងីល្ងើ	l ŋ iː l ŋ əː
ល្បឿន	l ɓ ɨ ə n
ល្បែង	l ɓ a e ŋ
ល្បះ	l ɓ a h
ល្មម	l m ɔː m
ល្មុង	l m u ŋ
ល្មូន	l m uː n
ល្វា	l ʋ i ə
ល្វែង	l ʋ ɛː ŋ
ល្ហ	l h ɑː
ល្ហុង	l h o ŋ
ល្ហែ	l h a e
ល្អ	l ʔ ɑː
ល្អង	l ʔ ɑː ŋ
ល្អិត	l ʔ ə t
ល្អី	l ʔ ə j
វ	ʋ ɔː
វក	ʋ ɔː ʔ
វក្កំ	ʋ ĕ ə ʔ k a ŋ
វគ្គ	ʋ ĕ ə ʔ
វង់	ʋ ŭ ə ŋ
វង្ស	ʋ ŭ ə ŋ
វចន	ʋ a c c a ʔ n a ʔ
វចនតា	ʋ a c c a ʔ n a ʔ t aː
វចនានុក្រម	ʋ ĕ ə ʔ c a ʔ n aː n u k r ɑ m
វចនៈ	ʋ a c c a ʔ n a ʔ
វច្ច	ʋ ɑ c c a ʔ
វឌ្ឍន	ʋ ŏ ə t tʰ ĕ ə ʔ n ĕ ə ʔ
វណវេឋន៍	ʋ ĕ ə ʔ n a ʔ ʋ eː t
វណិជ្ជា	ʋ ĕ ə ʔ n ɨ c c i ə
វណ្ណ	ʋ a n n a ʔ
វត្ត	ʋ ŏ ə t
វត្តមាន	ʋ ŏ ə t t a ʔ m aː n
វត្តមានា	ʋ ŏ ə t t a ʔ m aː n aː
វត្ថុ	ʋ ŏ ə t tʰ o ʔ
វត្ស	ʋ ŏ ə t
វត្សរ៍	ʋ ŏ ə t
វធភូមិ	ʋ ĕ ə ʔ tʰ ĕ ə ʔ pʰ uː m
វន្ទា	ʋ ŏ ə n t i ə
វប្ប	ʋ ŏ ə p p a ʔ
វប្បធម៌	ʋ ŏ ə p p a ʔ tʰ ŏ ə
វរ	ʋ ɔː
វលី	ʋ ĕ ə ʔ l iː
វសនដ្ឋាន	ʋ ĕ ə ʔ s a ʔ n a t tʰ aː n
វា	ʋ i ə
វាក្យ	ʋ i ə ʔ j a ʔ
វាគុរិក	ʋ i ə k u r ɨ k
វាគ្មិន	ʋ i ə ʔ m ɨ n
វាទកៈ	ʋ i ə t ĕ ə ʔ k a ʔ
វាយ	ʋ i ə j
វាយុ	ʋ i ə j u ʔ
វារ	ʋ i ə
វារុណី	ʋ i ə r u n iː
វាល	ʋ i ə l
វាសនដ្ឋាន	ʋ i ə s a ʔ n a t tʰ aː n
វាសនា	ʋ i ə s a ʔ n aː
វាស់	ʋ ŏ ə h
វាំង	ʋ ĕ ə ŋ
វាំងនន	ʋ ĕ ə ŋ n ɔː n
វិកប្ប	ʋ i k a p p a ʔ
វិការ	ʋ i k aː
វិការដ្ឋាន	ʋ i k aː tʰ aː n
វិចារកៈ	ʋ i c aː r a ʔ k a ʔ
វិចិត្រ	ʋ i c ə t
វិច្ឆិកា	ʋ ɨ c cʰ e k aː
វិជ្ជា	ʋ ɨ c c i ə
វិជ្ជុ	ʋ ɨ c c u ʔ
វិញ	ʋ ɨ ɲ
វិញ្ញាណ	ʋ ɨ ɲ ɲ i ə n
វិញ្ញាសា	ʋ ɨ ɲ ɲ i ə s aː
វិថី	ʋ i tʰ ə j
វិទូ	ʋ i t uː
វិទ្យា	ʋ ɨ t j i ə
វិទ្យាសាស្ត្រ	ʋ ɨ t j i ə s aː h
វិទ្យុ	ʋ ɨ t j u ʔ
វិធី	ʋ i tʰ iː
វិនាទី	ʋ i n i ə t iː
វិន័យ	p i n ɨ j
វិបត្តិ	ʋ i p a t t e ʔ
វិបាក	ʋ i ɓ aː ʔ
វិភាគ	ʋ i pʰ i ə ʔ
វិមាន	ʋ i m i ə n
វិម្ហយសញ្ញា	ʋ ɨ m h a ʔ j ĕ ə ʔ s a ɲ ɲ aː
វិរាម	ʋ i r i ə m
វិរុទ្ធ	ʋ i r u t
វិលោកនៈ	ʋ i l oː k a ʔ n a ʔ
វិសេស	ʋ i s e h
វិសេសន	ʋ i s eː s a ʔ n a ʔ
វិស័យ	ʋ i s a j
វិស្វករ	ʋ i h s ʋ a ʔ k ɑː
វិហារ	ʋ i h i ə
វីដេអូ	ʋ iː ɗ eː ʔ o u
វីតាមីន	ʋ iː t aː m iː n
វីថិ	ʋ i tʰ ə j
វីមង្សា	ʋ iː m ĕ ə ŋ s aː
វីយោឡុង	ʋ iː j o u l o ŋ
វីរ	ʋ iː r ĕ ə ʔ
វីរុស	ʋ iː r u h
វីសាណូ	ʋ iː s aː n o u
វីស្គី	ʋ iː s k iː
វូ	ʋ uː
វៀងច័ន្ទន៍	ʋ i ə ŋ c a n
វៀន	ʋ i ə n
វេជ្ជ	ʋ ɨ c c ĕ ə ʔ
វេណេហ្ស៊ុយអេឡា	ʋ e i n eː z u j ʔ eː l aː
វេត្រាណូ	ʋ eː t r aː n o u
វេទ	ʋ eː t
វេន	ʋ e i n
វេយ្យាករណ៍	ʋ e i j j i ə k ɑː
វេលា	ʋ e i l i ə
វែក	ʋ ɛː k
វែង	ʋ ɛː ŋ
វៃយរាពណ៍	ʋ ɨ j j ĕ ə ʔ r i ə p
វៃយាករណ៍	ʋ e i j j i ə k ɑː
វោត	ʋ oː t
វោហារុបជីវី	ʋ oː h aː r u p a ʔ c iː ʋ iː
វ៉ាក់សាំង	ʋ a k s a ŋ
វ៉ាត់	ʋ a t
វ៉ាទីកង់	ʋ aː t iː k ɑ ŋ
វ៉ារស្សាវ៉ា	ʋ aː s s aː ʋ aː
វ៉ាលីស៍	ʋ aː l iː
វ៉ាស៊ីនតោន	ʋ aː s iː n t a o n
វ៉ាហ្គុង	ʋ aː ɡ o ŋ
វ៉ុល	ʋ o l
វ៉ូង	ʋ o u ŋ
វ៉ែនតា	ʋ a e n t aː
ស	s ɑː
សកុណាយន្ត	s a ʔ k o n aː j ŏ ə n
សក់	s ɑ ʔ
សង	s ɑː ŋ
សង់	s ɑ ŋ
សង្ករ	s a ŋ
សង្កាត់	s ɑ ŋ k a t
សង្កេត	s ɑ ŋ k eː t
សង្ខារ	s ɑ ŋ kʰ aː
សង្គតិ	s ɑ ŋ k ĕ ə ʔ t e ʔ
សង្គម	s ɑ ŋ k u m
សង្គមនិយម	s ɑ ŋ k u m n i j u m
សង្គីតនាដន៍	s ɑ ŋ k iː t a ʔ n i ə t
សង្គ្រាម	s ɑ ŋ k r i ə m
សង្គ្រោះ	s ɑ ŋ k r ŭ ə h
សង្ឃ	s ɑ ŋ
សង្ឃរា	s ɑ ŋ kʰ ĕ ə ʔ r i ə
សង្ឃឹម	s ɑ ŋ kʰ ɨ m
សជន	s a ʔ c ŭ ə n
សញ្ជាតិ	s a ɲ c i ə t e ʔ
សញ្ឈា	s ɑ ɲ cʰ i ə
សញ្ញា	s a ɲ ɲ aː
សណ្ដែក	s ɑ n ɗ a e k
សណ្ឋាគារ	s ɑ n tʰ aː k i ə
សណ្ឋាន	s ɑ n tʰ aː n
សតិ	s a ʔ t e ʔ
សត្រូវ	s a t t r ə w
សត្វ	s a t
សត្វល្អិត	s a t l ʔ ə t
សទ្ទ	s a t t ĕ ə ʔ
សទ្ធា	s a t tʰ i ə
សន្តិសុខ	s ɑ n t e s o k
សន្ថាគារ	s ɑ n tʰ aː k i ə
សន្ទនា	s ɑ n t ĕ ə ʔ n i ə
សន្ធិ	s ɑ n tʰ i ʔ
សន្និបាត	s ɑ n n i ɓ aː t
សន្និសីទ	s ɑ n n i s ə t
សន្យា	s ɑ n j aː
សន្លាក់	s ɑ n l a ʔ
សន្លឹក	s ɑ n l ə k
សន្សើម	s ɑ n s a ə m
សប្តាហៈ	s a p pʰ t a ʔ
សប្តិ	s ɑ p
សប្បាយ	s a p ɓ aː j
សព	s ɑ p
សព្ទ	s a p
សព្វ	s ɑ p
សព្វនាម	s ɑ p p ĕ ə ʔ n i ə m
សភា	s a ʔ pʰ i ə
សម	s ɑ m
សម	s ɑː m
សមមិត្ត	s a ʔ m a ʔ m ɨ t
សមាជិក	s a ʔ m aː c ɨ k
សមាន	s a ʔ m aː n
សមាភាគ	s a m m aː pʰ i ə ʔ
សមិការ	s a ʔ m iː k aː
សមិន្ធន៍	s a ʔ m ɨ n
សមុទ្ទ	s a ʔ m o t
សមុទ្រ	s a ʔ m o t
សម័យ	s a ʔ m a j
សម្ងាត់	s ɑ m ŋ a t
សម្ដេច	s ɑ m ɗ a c
សម្បត្តិ	s ɑ m ɓ a t
សម្បុក	s ɑ m ɓ o k
សម្បោរ	s ɑ m ɓ a o
សម្ពាធ	s ɑ m p i ə t
សម្ពាហកម្ម	s a m p i ə h a ʔ k a m
សម្មតិ	s ɑ m m a t
សម្មាភាគ	s a m m aː pʰ i ə ʔ
សម្រស់	s ɑ m r ɑ h
សម្រាក	s ɑ m r aː ʔ
សម្រាជ	s ɑ m r aː c
សម្រាប់	s ɑ m r a p
សម្រាម	s ɑ m r aː m
សម្រេក	s ɑ m r eː k
សម្រេច	s ɑ m r ɨ c
សម្លាក	s ɑ m l aː ʔ
សម្លាប់	s ɑ m l a p
សម្លេង	s ɑ m l e i ŋ
សរ	s ɑː
សរទៈ	s a ʔ r a ʔ t ĕ ə ʔ
សរសេរ	s ɑ s eː
សរីរាង្គ	s a ʔ r ə j r i ə ŋ
សរីរៈ	s a ʔ r ə j r a ʔ
សល់	s ɑ l
សល្យ	s ɑ l j ĕ ə ʔ
សវ	s a ʔ ʋ a ʔ
សសរ	s ɑ s ɑː
សសោះ	s ɑ s ɑ h
សហ	s a ʔ h a ʔ
សហគ្រាស	s a ʔ h a ʔ k r i ə h
សហពន្ធុ	s a ʔ h a ʔ p ŭ ə n tʰ u ʔ
សហព័ន្ធ	s a ʔ h a ʔ p ŭ ə n
សហភាព	s a ʔ h a ʔ pʰ i ə p
សាកល	s aː k ɑ l
សាកលវិទ្យាល័យ	s aː k ɑ l ʋ ɨ t tʰ j i ə l a j
សាកាដូ	s aː k aː ɗ o u
សាក់	s a ʔ
សាខា	s aː kʰ aː
សាគរ	s aː k ɔː
សាច់	s a c
សាតាំង	s aː t a ŋ
សាធក	s aː tʰ ĕ ə ʔ k a ʔ
សាធារណជន	s aː tʰ i ə n a ʔ c ɔː n
សាធារណរដ្ឋ	s aː tʰ i ə r ĕ ə ʔ n a ʔ r ŏ ə t
សាធារណៈ	s aː tʰ i ə r ĕ ə ʔ n a ʔ
សាធារណ៍	s aː tʰ i ə
សានម៉ារីណូ	s aː n m aː r iː n o u
សាប៊ូ	s aː ɓ uː
សាមណេរ	s aː m a ʔ n eː
សាមី	s aː m ə j
សាយណ្ហ	s aː j a n h ɑː
សារ	s aː
សារពត៌មាន	s aː p ɔ ə ɗ ɑː m i ə n
សារមន្ទីរ	s aː m ŭ ə n t iː
សារី	s aː r iː
សាល	s aː l
សាលា	s aː l aː
សាលាដ	s aː l aː t
សាលី	s aː l ə j
សាសន	s aː s a ʔ n a ʔ
សាសនា	s aː s n aː
សាសន៍	s a h
សាស្ត្រ	s aː h
សាស្ត្រាចារ្យ	s aː h s t r aː c aː
សាហារ៉ា	s aː h aː r aː
សាំង	s a ŋ
សាំងកាប៉ូ	s a ŋ k aː p o u
សាំង្កសី	s a ŋ k a ʔ s ə j
សិក្សា	s ə k s aː
សិគាល	s e k i ə l
សិង្ឃានិក	s ə ŋ kʰ i ə n i k ɑː
សិង្ហបុរី	s ə ŋ h a ʔ ɓ o r ə j
សិត	s ə t
សិទ្ធ	s ə t
សិទ្ធិ	s ə t tʰ i ʔ
សិបយន្ត	s ə p j ŭ ə n
សិរិ	s e r e ʔ
សិរិ	s e r ə j
សិលា	s e l aː
