najnaglejši	n á j n àː ɡ l ɛ j ʃ i
najnaravnejši	n á j n a r àː ʋ n ɛ j ʃ i
najnepotrpežljivejši	n á j n ɛ́ p ɔ t ə r p ɛ ʒ l j ìː ʋ ɛ j ʃ i
najneumnejši	n á j n ɛ ùː m n ɛ j ʃ i
najnevarnejši	n á j n ɛ ʋ àː r n ɛ j ʃ i
najobčutljivejši	n á j ɔ p t͡ʃ u t l j ìː ʋ ɛ j ʃ i
najodličnejši	n á j ɔ d l ìː t͡ʃ n ɛ j ʃ i
najokusnejši	n á j ɔ k ùː s n ɛ j ʃ i
najosnovnejši	n á j ɔ s n ɔ́ː ʋ n ɛ j ʃ i
najočitnejši	n á j ɔ t͡ʃ ìː t n ɛ j ʃ i
najožji	n á j óː ʒ j i
najpestrejši	n á j p èː s t r ɛ j ʃ i
najplodnejši	n á j p l òː d n ɛ j ʃ i
najpodlejši	n á j p ɔ̀ː d l ɛ j ʃ i
najpodobnejši	n á j p ɔ d òː b n ɛ j ʃ i
najpodrobnejši	n á j p ɔ d r óː b n ɛ j ʃ i
najpogosteje	n á j p ɔ ɡ óː s t ɛ j ɛ
najpogostejše	n á j p ɔ ɡ óː s t ɛ j ʃ ɛ
najpogumnejši	n á j p ɔ ɡ ùː m n ɛ j ʃ i
najpolnejši	n á j p ɔ̀ː l n ɛ j ʃ i
najpomembnejši	n á j p ɔ m èː m b n ɛ j ʃ i
najpomembnejši	n á j p ɔ m éː m b n ɛ j ʃ i
najpotrebnejši	n á j p ɔ t r èː b n ɛ j ʃ i
najpotrpežljivejši	n á j p ɔ t ə r p ɛ ʒ l j ìː ʋ ɛ j ʃ i
najpočasneje	n á j p ɔ t͡ʃ a s n ɛ́ː j ɛ
najpočasneje	n á j p ɔ t͡ʃ àː s n ɛ j ɛ
najpravilneje	n á j p r a ʋ íː l n ɛ j ɛ
najpravilnejše	n á j p r a ʋ íː l n ɛ j ʃ ɛ
najpridnejši	n á j p r ìː d n ɛ j ʃ i
najprijaznejši	n á j p r i j àː z n ɛ j ʃ i
najpustejši	n á j p u s t ɛ́ː j ʃ i
najpustejši	n á j p ùː s t ɛ j ʃ i
najranejši	n á j r àː n ɛ j ʃ i
najravnejši	n á j r àː ʋ n ɛ j ʃ i
najrazličnejši	n á j r a z l ìː t͡ʃ n ɛ j ʃ i
najredkejši	n á j r èː t k ɛ j ʃ i
najredkejši	n á j r ɛ t k ɛ́ː j ʃ i
najresničnejši	n á j r ɛ s n ìː t͡ʃ n ɛ j ʃ i
najresničnejši	n á j r ɛ s n íː t͡ʃ n ɛ j ʃ i
najrevnejši	n á j r èː ʋ n ɛ j ʃ i
najskrivnejši	n á j s k r íː ʋ n ɛ j ʃ i
najskrivnostnejši	n á j s k r i ʋ n óː s t n ɛ j ʃ i
najskromnejši	n á j s k r ɔ̀ː m n ɛ j ʃ i
najslabše	n á j s l áː p ʃ ɛ
najslabši	n á j s l áː p ʃ i
najsladejši	n á j s l a d ɛ́ː j ʃ i
najslajši	n á j s l áː j ʃ i
najsmelejši	n á j s m èː l ɛ j ʃ i
najsodobnejši	n á j s ɔ d ɔ̀ː b n ɛ j ʃ i
najsončnejši	n á j s óː n t͡ʃ n ɛ j ʃ i
najsplošnejši	n á j s p l ɔ̀ː ʃ n ɛ j ʃ i
najspodobnejši	n á j s p ɔ d òː b n ɛ j ʃ i
najsrečnejše	n á j s r èː t͡ʃ n ɛ j ʃ ɛ
najsrečnejše	n á j s r ɛ t͡ʃ n ɛ́ː j ʃ ɛ
najsrečnejši	n á j s r èː t͡ʃ n ɛ j ʃ i
najsrečnejši	n á j s r ɛ t͡ʃ n ɛ́ː j ʃ i
najstarejši	n á j s t a r ɛ́ː j ʃ i
najstrastnejši	n á j s t r àː s t n ɛ j ʃ i
najsvobodnejši	n á j s ʋ ɔ b ɔ̀ː d n ɛ j ʃ i
najtežji	n á j t éː ʒ j i
najti	n àː j t i
najtrši	n á j t ə́ r ʃ i
najusodnejši	n á j u s òː d n ɛ j ʃ i
najustreznejši	n á j u s t r èː z n ɛ j ʃ i
najvarnejši	n á j ʋ àː r n ɛ j ʃ i
največ	n á j ʋ ɛ t͡ʃ
največ	n á j ʋ ɛ́ t͡ʃ
največji	n á j ʋ éː t͡ʃ j i
najvišji	n á j ʋ íː ʃ j i
najzanimivejši	n á j z a n i m ìː ʋ ɛ j ʃ i
najznačilnejši	n á j z n a t͡ʃ íː l n ɛ j ʃ i
najzrelejši	n á j z r èː l ɛ j ʃ i
najzrelejši	n á j z r ɛ l ɛ́ː j ʃ i
najživahnejši	n á j ʒ i ʋ àː x n ɛ j ʃ i
naključje	n a k l j úː t͡ʃ j ɛ
namenilnik	n a m ɛ n íː l n i k
namera	n a m éː r a
namibija	n a m ìː b i j a
namigovati	n a m i ɡ ɔ ʋ àː t i
nanašati	n a n áː ʃ a t i
nanositi	n a n ɔ s ìː t i
nanositi	n a n ɔ s íː t i
napad	n a p á t
napaka	n a p áː k a
napačen	n a p áː t͡ʃ ə n
napačen	n áː p a t͡ʃ ə n
napisati	n a p i s àː t i
napisati	n a p ìː s a t i
naprava	n a p r áː ʋ a
narava	n a r áː ʋ a
naraven	n a r àː ʋ ə n
naravnejši	n a r àː ʋ n ɛ j ʃ i
naravnost	n a r àː ʋ n ɔ s t
narediti	n a r ɛ d ìː t i
narediti	n a r ɛ d íː t i
narečje	n a r éː t͡ʃ j ɛ
narod	n àː r ɔ t
naslednji	n a s l éː d n j i
nasmeh	n a s m éː x
nasmeh	n a s m ɛ́ x
nasmehniti	n a s m èː x n i t i
nastati	n a s t àː t i
nasvidenje	n a s ʋ íː d ɛ n j ɛ
nataša	n a t áː ʃ a
natrij	n àː t r i j
navada	n a ʋ áː d a
navdih	n a ʋ d íː x
nazaj	n a z àː j
načelo	n a t͡ʃ ɛ̀ː l ɔ
načeti	n a t͡ʃ èː t i
načrt	n a t͡ʃ ə́ r t
naš	n á ʃ
ne	n ɛ
ne	n ɛ́
neapelj	n ɛ àː p ə l
nebesa	n ɛ b èː s a
nebo	n ɛ b óː
nebotičnik	n ɛ b ɔ t íː t͡ʃ n i k
nedelja	n ɛ d èː l j a
nedoločnik	n ɛ́ d ɔ l òː t͡ʃ n i k
nedoločnik	n ɛ́ d ɔ l óː t͡ʃ n i k
nedovršen	n ɛ́ d ɔ ʋ ə́ r ʃ ə n
nehati	n éː x a t i
nehemija	n ɛ x ɛ m íː j a
nekaj	n èː k a j
nekaj	n éː k a j
nekam	n èː k a m
nekdo	n éː ɡ d ɔ
nekdo	n ɛ ɡ d òː
nekdo	n ɛ ɡ d óː
nekje	n ɛ k j èː
nekje	n ɛ k j éː
nekrofilija	n ɛ k r ɔ f i l íː j a
nekropola	n ɛ k r óː p ɔ l a
nem	n éː m
nemec	n èː m ə t͡s
nemka	n èː m k a
nemogoč	n ɛ́ m ɔ ɡ òː t͡ʃ
nemčija	n éː m t͡ʃ i j a
nemški	n èː m ʃ k i
nemško	n èː m ʃ k ɔ
nemščina	n èː m ʃ t͡ʃ i n a
neodim	n ɛ ɔ d íː m
neodvisen	n ɛ́ ɔ d ʋ ìː s ə n
neon	n éː ɔ n
neposreden	n ɛ́ p ɔ s r éː d ə n
neposredno	n ɛ́ p ɔ s r éː d n ɔ
nepotrpežljiv	n ɛ́ p ɔ t ə r p ɛ ʒ l j ìː ʋ
nepotrpežljiv	n ɛ́ p ɔ t ə r p ɛ ʒ l j íː ʋ
nepotrpežljivejši	n ɛ́ p ɔ t ə r p ɛ ʒ l j ìː ʋ ɛ j ʃ i
nepredvidljiv	n ɛ́ p r ɛ d ʋ i d l j ìː ʋ
nepredvidljiv	n ɛ́ p r ɛ d ʋ i d l j íː ʋ
neptun	n ɛ p t úː n
neptunij	n ɛ p t ùː n i j
nesti	n ɛ̀ː s t i
netopir	n ɛ t ɔ p ìː r
netopir	n ɛ t ɔ p íː r
neumen	n ɛ ùː m ə n
neumnejši	n ɛ ùː m n ɛ j ʃ i
nevaren	n ɛ ʋ àː r ə n
nevarnejši	n ɛ ʋ àː r n ɛ j ʃ i
nevihta	n ɛ ʋ íː x t a
nečak	n ɛ t͡ʃ àː k
nečakinja	n ɛ t͡ʃ àː k i n j a
nihče	n i x t͡ʃ ɛ́
nihče	n íː x t͡ʃ ɛ
nikelj	n ìː k ə l
nikolaj	n i k ɔ l áː j
nikoli	n i k óː l i
niobij	n i j òː b i j
nit	n í t
nizek	n ìː z ə k
nizozemec	n i z ɔ z éː m ə t͡s
nizozemka	n i z ɔ z éː m k a
nizozemska	n i z ɔ z éː m s k a
nizozemski	n i z ɔ z éː m s k i
nizozemsko	n i z ɔ z éː m s k ɔ
nizozemščina	n i z ɔ z éː m ʃ t͡ʃ i n a
nič	n í t͡ʃ
niša	n ìː ʃ a
niša	n íː ʃ a
njegov	n j ɛ ɡ ɔ̀ː ʋ
njegov	n j ɛ ɡ ɔ́ ʋ
njen	n j èː n
njihov	n j ìː x ɔ ʋ
njihov	n j íː x ɔ ʋ
njun	n j ùː n
nlp	n ə l ə p ə́
nobelij	n ɔ b èː l i j
nocoj	n ɔ t͡s òː j
noga	n ɔ̀ː ɡ a
nogavica	n ɔ ɡ a ʋ ìː t͡s a
nogomet	n ɔ ɡ ɔ m ɛ́ t
noht	n óː x t
noj	n óː j
noj	n ɔ́ j
nominativ	n óː m i n a t i ʋ
nor	n ɔ́ r
norveška	n ɔ r ʋ éː ʃ k a
norveški	n ɔ r ʋ éː ʃ k i
norveško	n ɔ r ʋ éː ʃ k ɔ
norveščina	n ɔ r ʋ éː ʃ t͡ʃ i n a
norvežan	n ɔ r ʋ ɛ ʒ á n
norvežan	n ɔ r ʋ ɛ ʒ áː n
norvežanka	n ɔ r ʋ ɛ ʒ áː n k a
nos	n óː s
nosilec	n ɔ s íː l ə t͡s
nositi	n ɔ s ìː t i
nositi	n ɔ s íː t i
nosorog	n ɔ s ɔ r óː k
nota	n óː t a
noter	n òː t ɛ r
noter	n óː t ɛ r
notri	n òː t r i
notri	n óː t r i
nov	n ɔ́ ʋ
novak	n ɔ ʋ àː k
november	n ɔ ʋ ɛ̀ː m b ə r
novina	n ɔ ʋ ìː n a
novinec	n ɔ ʋ íː n ə t͡s
noč	n óː t͡ʃ
nož	n ɔ́ ʃ
nuna	n ùː n a
o	ɔ
obed	ɔ b ɛ́ t
obesiti	ɔ b èː s i t i
obiskati	ɔ b i s k àː t i
obiskovati	ɔ b i s k ɔ ʋ àː t i
objaviti	ɔ b j àː ʋ i t i
objem	ɔ b j ɛ́ m
objeti	ɔ b j èː t i
oblak	ɔ b l áː k
oblast	ɔ b l áː s t
obleka	ɔ b l éː k a
oblika	ɔ b l íː k a
oblikosloven	ɔ b l i k ɔ s l ɔ́ː ʋ ə n
oblikoslovje	ɔ b l i k ɔ s l ɔ́ː ʋ j ɛ
obljuba	ɔ b l j úː b a
obljubiti	ɔ b l j u b ìː t i
obljubiti	ɔ b l j u b íː t i
obljubiti	ɔ b l j ùː b i t i
obljubiti	ɔ b l j úː b i t i
obmodek	ɔ b m óː d ə k
oboa	óː b ɔ a
obramba	ɔ b r áː m b a
obraniti	ɔ b r a n ìː t i
obraniti	ɔ b r a n íː t i
obraz	ɔ b r á s
obrazen	ɔ b r áː z ə n
obrazilo	ɔ b r a z ìː l ɔ
obrezovanje	ɔ b r ɛ z ɔ ʋ àː n j ɛ
obrv	ɔ b ə́ r ʋ
obsedenost	ɔ p s éː d ɛ n ɔ s t
obsečnica	ɔ p s éː t͡ʃ n i t͡s a
obuti	ɔ b ùː t i
občinstvo	ɔ p t͡ʃ íː n s t ʋ ɔ
občutljiv	ɔ p t͡ʃ u t l j ìː ʋ
občutljiv	ɔ p t͡ʃ u t l j íː ʋ
občutljivejši	ɔ p t͡ʃ u t l j ìː ʋ ɛ j ʃ i
od	ɔ t
oddajnik	ɔ d d áː j n i k
odeja	ɔ d ɛ́ː j a
oder	òː d ə r
odgovor	ɔ d ɡ ɔ́ː ʋ ɔ r
odgovoriti	ɔ d ɡ ɔ ʋ ɔ r ìː t i
odgovoriti	ɔ d ɡ ɔ ʋ ɔ r íː t i
oditi	ɔ d ìː t i
odjaviti	ɔ d j àː ʋ i t i
odličen	ɔ d l ìː t͡ʃ ə n
odličnejši	ɔ d l ìː t͡ʃ n ɛ j ʃ i
odločba	ɔ d l óː d͡ʒ b a
odnos	ɔ d n ɔ́ s
odpreti	ɔ t p r èː t i
odprt	ɔ t p ə́ r t
odrešenik	ɔ d r ɛ ʃ ɛ n ìː k
odvisen	ɔ d ʋ ìː s ə n
odvreti	ɔ d ʋ r èː t i
ogel	òː ɡ ə ʋ
ogel	óː ɡ ə ʋ
ogenj	ɔ̀ː ɡ ə n
oglas	ɔ ɡ l á s
ogledalo	ɔ ɡ l ɛ d àː l ɔ
ogljik	ɔ ɡ l j íː k
ognjenik	ɔ ɡ n j ɛ n ìː k
ogor	óː ɡ ɔ r
ogor	ɔ ɡ óː r
ograja	ɔ ɡ r àː j a
ograja	ɔ ɡ r áː j a
ogroziti	ɔ ɡ r ɔ z ìː t i
ogroziti	ɔ ɡ r ɔ z íː t i
ogrožati	ɔ ɡ r òː ʒ a t i
ogrska	òː ɡ ə r s k a
ogrska	óː ɡ ə r s k a
oje	ɔ j éː
okarina	ɔ k a r íː n a
oklepaj	ɔ k l ɛ p áː j
okno	ɔ̀ː k n ɔ
oko	ɔ k óː
okopati	ɔ k òː p a t i
okopati	ɔ k ɔ p àː t i
okopavati	ɔ k ɔ p áː ʋ a t i
okostje	ɔ k óː s t j ɛ
okrogel	ɔ k r òː ɡ ə ʋ
oktober	ɔ k t òː b ə r
okus	ɔ k úː s
okusen	ɔ k ùː s ə n
okusen	ɔ k úː s ə n
okusnejši	ɔ k ùː s n ɛ j ʃ i
ol	óː l
ol	óː ʋ
olje	òː l j ɛ
oltar	ɔ l t àː r
oman	óː m a n
on	ɔ́ n
ona	ɔ̀ː n a
one	ɔ̀ː n ɛ
oni	ɔ̀ː n i
ono	ɔ̀ː n ɔ
opat	ɔ p áː t
opatija	ɔ p a t íː j a
opatinja	ɔ p áː t i n j a
opazovati	ɔ p a z ɔ ʋ àː t i
opeka	ɔ p éː k a
opeklina	ɔ p ɛ k l ìː n a
opereta	ɔ p ɛ r éː t a
opica	óː p i t͡s a
opomba	ɔ p óː m b a
oporoka	ɔ p ɔ r óː k a
oprostite	ɔ p r ɔ s t íː t ɛ
optika	òː p t i k a
optičen	òː p t i t͡ʃ ə n
opuščaj	ɔ p u ʃ t͡ʃ áː j
orakelj	ɔ r àː k ə l
oranža	ɔ r áː n ʒ a
oranžen	ɔ r áː n ʒ ə n
oreh	ɔ̀ː r ɛ x
orel	ɔ̀ː r ə ʋ
organizacija	ɔ r ɡ a n i z àː t͡s i j a
orgazem	ɔ r ɡ àː z ə m
orgazmičen	ɔ r ɡ àː z m i t͡ʃ ə n
orgiastičen	ɔ r ɡ i àː s t i t͡ʃ ə n
orgija	òː r ɡ i j a
orgle	óː r ɡ l ɛ
orhideja	ɔ r x i d ɛ́ː j a
orjak	ɔ r j àː k
orlič	ɔ r l í t͡ʃ
orodje	ɔ r óː d j ɛ
orodnik	ɔ r óː d n i k
os	óː s
osa	ɔ̀ː s a
oseba	ɔ s éː b a
oseben	ɔ s éː b ə n
osebnost	ɔ s éː b n ɔ s t
osel	ɔ̀ː s ə ʋ
osem	òː s ə m
osemdeset	òː s ə m d ɛ s ɛ t
osemnajst	òː s ə m n a j s t
osemnajst	ɔ s ə m n àː j s t
osmij	òː s m i j
osnoven	ɔ s n ɔ́ː ʋ ə n
osnovnejši	ɔ s n ɔ́ː ʋ n ɛ j ʃ i
osončje	ɔ s óː n t͡ʃ j ɛ
ost	óː s t
oster	òː s t ə r
ostriga	ɔ s t r ìː ɡ a
ostriga	ɔ s t r íː ɡ a
ostrivec	ɔ s t r íː ʋ ə t͡s
otava	ɔ t àː ʋ a
oteti	ɔ t èː t i
otok	ɔ̀ː t ɔ k
otomanski	ɔ t ɔ m áː n s k i
otrok	ɔ t r ɔ́ k
otroče	ɔ t r ɔ t͡ʃ ɛ́
otročji	ɔ t r òː t͡ʃ j i
otrpniti	ɔ t ə̀ r p n i t i
otvoriti	ɔ t ʋ òː r i t i
otvoriti	ɔ t ʋ óː r i t i
ovca	ɔ̀ː ʋ t͡s a
oven	ɔ̀ː ʋ ə n
oves	ɔ̀ː ʋ ə s
ovratnik	ɔ ʋ r áː t n i k
ovčar	ɔ ʋ t͡ʃ àː r
ozek	òː z ə k
oziroma	ɔ z íː r ɔ m a
oznaka	ɔ z n áː k a
oče	ɔ̀ː t͡ʃ ɛ
očim	òː t͡ʃ i m
očim	óː t͡ʃ i m
očiten	ɔ t͡ʃ ìː t ə n
očitnejši	ɔ t͡ʃ ìː t n ɛ j ʃ i
ošiliti	ɔ ʃ ìː l i t i
ožemati	ɔ ʒ éː m a t i
ožeti	ɔ ʒ èː t i
ožji	óː ʒ j i
pa	p a
padalo	p a d àː l ɔ
padati	p àː d a t i
padati	p áː d a t i
padec	p áː d ə t͡s
paglavec	p àː ɡ l a ʋ ə t͡s
pajek	p áː j ə k
paladij	p a l àː d i j
paladin	p a l a d íː n
palača	p a l àː t͡ʃ a
palec	p áː l ə t͡s
paleolitik	p a l ɛ ɔ l ìː t i k
palestina	p a l ɛ s t íː n a
palimpsest	p a l i m p s éː s t
palindrom	p a l i n d r óː m
palma	p áː l m a
palčnik	p áː ʋ t͡ʃ n i k
pamet	p àː m ɛ t
panj	p áː n
papagaj	p a p a ɡ áː j
papež	p áː p ɛ ʃ
papiga	p áː p i ɡ a
papir	p a p íː r
par	p àː r
paradižnik	p a r a d íː ʒ n i k
paradoks	p a r a d óː k s
paranoja	p a r a n óː j a
parfum	p a r f úː m
pariz	p a r íː s
past	p áː s t
pasti	p àː s t i
pastir	p a s t ìː r
patologija	p a t ɔ l ɔ ɡ íː j a
patološki	p a t ɔ l óː ʃ k i
pav	p áː ʋ
pavel	p áː ʋ ə l
pazduha	p áː z d u x a
pedagogika	p ɛ d a ɡ òː ɡ i k a
pegatka	p ɛ ɡ áː t k a
pehati	p éː x a t i
pehati	p ə x àː t i
pek	p èː k
pek	p éː k
pekel	p ə k ə́ ʋ
pekel	p ə̀ k ə ʋ
peljati	p ɛ l j àː t i
pena	p èː n a
penis	p éː n i s
pepel	p ɛ p éː ʋ
pepelka	p ɛ p éː l k a
pero	p ɛ r óː
peron	p ɛ r óː n
perut	p ɛ r úː t
perutnina	p ɛ r u t n ìː n a
perverzija	p ɛ r ʋ ɛ r z íː j a
perverzija	p ɛ r ʋ ɛ̀ː r z i j a
pes	p ə́ s
pesek	p èː s ə k
pesem	p éː s ə m
pesnik	p éː s n i k
pest	p éː s t
pester	p èː s t ə r
pestič	p ɛ s t í t͡ʃ
pestrejši	p èː s t r ɛ j ʃ i
pet	p éː t
peta	p ɛ̀ː t a
petdeset	p éː d d ɛ s ɛ t
petek	p èː t ə k
petelin	p ɛ t ɛ̀ː l i n
peter	p èː t ə r
peteršilj	p ɛ t ɛ r ʃ í l
peteršilj	p ɛ t ɛ r ʃ íː l
peti	p èː t i
peti	p ɛ̀ː t i
petnajst	p éː t n a j s t
petnajst	p ɛ t n àː j s t
pevec	p èː ʋ ə t͡s
peč	p éː t͡ʃ
pečat	p ɛ t͡ʃ áː t
peči	p ɛ̀ː t͡ʃ i
phati	p x àː t i
pi	p íː
pianist	p i j a n íː s t
pica	p ìː t͡s a
pica	p íː t͡s a
pihati	p ìː x a t i
pijavka	p i j áː ʋ k a
pijača	p i j àː t͡ʃ a
pikapolonica	p i k a p ɔ l óː n i t͡s a
pila	p ìː l a
pingvin	p i n ɡ ʋ íː n
pipa	p ìː p a
pira	p ìː r a
piramida	p i r a m íː d a
pisarna	p i s áː r n a
pisatelj	p i s áː t ɛ l
pisati	p i s àː t i
pisati	p ìː s a t i
pismo	p ìː s m ɔ
pistacija	p i s t àː t͡s i j a
pita	p ìː t a
pitagora	p i t àː ɡ ɔ r a
piti	p ìː t i
piton	p i t óː n
pivo	p ìː ʋ ɔ
pizda	p ìː z d a
pizda	p íː z d a
piščanec	p i ʃ t͡ʃ àː n ə t͡s
plamen	p l àː m ɛ n
planet	p l a n éː t
platana	p l a t áː n a
platina	p l áː t i n a
platno	p l àː t n ɔ
plavati	p l áː ʋ a t i
plaz	p l áː s
plačati	p l a t͡ʃ àː t i
plačati	p l àː t͡ʃ a t i
plašč	p l àː ʃ t͡ʃ
plaža	p l àː ʒ a
ples	p l éː s
plesati	p l èː s a t i
plesati	p l ɛ s àː t i
plesen	p l éː s ə n
plesti	p l ɛ̀ː s t i
pleti	p l èː t i
pleva	p l èː ʋ a
pljuča	p l j ùː t͡ʃ a
pljučnica	p l j úː t͡ʃ n i t͡s a
plod	p l óː t
ploden	p l òː d ə n
plodnejši	p l òː d n ɛ j ʃ i
pločevinka	p l ɔ t͡ʃ ɛ ʋ íː n k a
plug	p l ú k
plug	p l úː k
pluta	p l ùː t a
pluti	p l ùː t i
pluton	p l úː t ɔ n
plutonij	p l u t òː n i j
po	p ɔ
pobrati	p ɔ b r àː t i
poceni	p ɔ t͡s èː n i
pod	p ɔ́ t
podaljšati	p ɔ d áː l ʃ a t i
podaljšava	p ɔ d a l ʃ áː ʋ a
podel	p ɔ̀ː d ə ʋ
podgana	p ɔ d ɡ àː n a
podkev	p ɔ̀ː t k ə ʋ
podkovati	p ɔ t k ɔ ʋ àː t i
podla	p ɔ̀ː d l a
podlasica	p ɔ d l àː s i t͡s a
podlejši	p ɔ̀ː d l ɛ j ʃ i
podleči	p ɔ d l èː t͡ʃ i
podmornica	p ɔ d m óː r n i t͡s a
podnebje	p ɔ d n éː b j ɛ
podoba	p ɔ d óː b a
podoben	p ɔ d òː b ə n
podobnejši	p ɔ d òː b n ɛ j ʃ i
podpičje	p ɔ́ t p íː t͡ʃ j ɛ
podroben	p ɔ d r óː b ə n
podrobnejši	p ɔ d r óː b n ɛ j ʃ i
podrobnost	p ɔ d r óː b n ɔ s t
pofukan	p ɔ f úː k a n
pofukati	p ɔ f úː k a t i
pogača	p ɔ ɡ àː t͡ʃ a
pogodba	p ɔ ɡ óː d b a
pogoj	p ɔ ɡ ɔ́ j
pogojnik	p ɔ ɡ óː j n i k
pogoltniti	p ɔ ɡ ɔ̀ː ʋ t n i t i
pogosteje	p ɔ ɡ óː s t ɛ j ɛ
pogostejše	p ɔ ɡ óː s t ɛ j ʃ ɛ
pogosto	p ɔ ɡ óː s t ɔ
pogovarjati	p ɔ ɡ ɔ ʋ áː r j a t i
pogovor	p ɔ ɡ ɔ́ː ʋ ɔ r
pogovoren	p ɔ ɡ ɔ́ː ʋ ɔ r ə n
pogovoriti	p ɔ ɡ ɔ ʋ ɔ r ìː t i
pogovoriti	p ɔ ɡ ɔ ʋ ɔ r íː t i
pogrešati	p ɔ ɡ r èː ʃ a t i
pogum	p ɔ ɡ úː m
pogumen	p ɔ ɡ ùː m ə n
pogumnejši	p ɔ ɡ ùː m n ɛ j ʃ i
pohištvo	p ɔ x íː ʃ t ʋ ɔ
pohorje	p óː x ɔ r j ɛ
pojasniti	p ɔ j a s n ìː t i
pojasniti	p ɔ j a s n íː t i
pojasniti	p ɔ j àː s n i t i
pojasniti	p ɔ j áː s n i t i
pojutrišnjem	p ɔ j úː t r i ʃ n j ɛ m
pokazati	p ɔ k a z àː t i
pokazati	p ɔ k àː z a t i
poker	p òː k ə r
poklekniti	p ɔ k l èː k n i t i
poklekniti	p ɔ k l ɛ k n ìː t i
poklekniti	p ɔ k l ɛ k n íː t i
poklic	p ɔ k l íː t͡s
poklicati	p ɔ k l ìː t͡s a t i
pokol	p ɔ k ɔ́ l
pokop	p ɔ k ɔ́ p
pokopališče	p ɔ k ɔ p a l ìː ʃ t͡ʃ ɛ
pokrov	p ɔ k r ɔ́ ʋ
polbrat	p ɔ́ː ʋ b r á t
poldan	p ɔ́ː ʋ d a n
polenovka	p ɔ l èː n ɔ ʋ k a
poletje	p ɔ l éː t j ɛ
polh	p ɔ̀ː ʋ x
polh	p ɔ́ː ʋ x
polica	p ɔ l ìː t͡s a
policist	p ɔ l i t͡s íː s t
policistka	p ɔ l i t͡s íː s t k a
politeizem	p ɔ l i t ɛ ìː z ə m
polizati	p ɔ l i z àː t i
polizati	p ɔ l ìː z a t i
poljak	p ɔ l j àː k
poljakinja	p ɔ l j àː k i n j a
poljanšek	p ɔ l j àː n ʃ ə k
polje	p óː l j ɛ
polje	p ɔ l j éː
poljedelstvo	p ɔ l j ɛ d éː l s t ʋ ɔ
poljska	p óː l s k a
poljski	p óː l s k i
poljsko	p óː l s k ɔ
poljub	p ɔ l j úː p
poljubiti	p ɔ l j u b ìː t i
poljubiti	p ɔ l j u b íː t i
poljubiti	p ɔ l j ùː b i t i
poljubiti	p ɔ l j úː b i t i
poljščina	p óː l ʃ t͡ʃ i n a
polkovnica	p ɔ l k ɔ́ː ʋ n i t͡s a
polmer	p ɔ l m éː r
polmer	p ɔ ʋ m éː r
poln	p ɔ́ː ʋ n
polnejši	p ɔ̀ː ʋ n ɛ j ʃ i
polnoč	p ɔ́ː ʋ n ɔ t͡ʃ
polonij	p ɔ l òː n i j
polotok	p óː l ɔ t ɔ k
polotok	p ɔ l ɔ t ɔ́ k
polovica	p ɔ l ɔ ʋ ìː t͡s a
položaj	p ɔ l ɔ ʒ áː j
polzeti	p ɔ ʋ z èː t i
polž	p ɔ̀ː ʋ ʃ
polž	p ɔ́ː ʋ ʃ
pomagati	p ɔ m a ɡ àː t i
pomagati	p ɔ m àː ɡ a t i
pomaranča	p ɔ m a r áː n t͡ʃ a
pomemben	p ɔ m èː m b ə n
pomemben	p ɔ m éː m b ə n
pomembnejši	p ɔ m èː m b n ɛ j ʃ i
pomembnejši	p ɔ m éː m b n ɛ j ʃ i
pomembnost	p ɔ m èː m b n ɔ s t
pomembnost	p ɔ m éː m b n ɔ s t
pomen	p ɔ m ɛ́ n
pomenoslovje	p ɔ m ɛ n ɔ s l ɔ́ː ʋ j ɛ
pomenski	p ɔ m éː n s k i
pomlad	p ɔ m l áː t
pomniti	p óː m n i t i
pomoč	p ɔ m óː t͡ʃ
pomočnik	p ɔ m ɔ t͡ʃ n ìː k
ponarediti	p ɔ n a r ɛ d ìː t i
ponarediti	p ɔ n a r ɛ d íː t i
ponedeljek	p ɔ n ɛ d éː l j ə k
ponos	p ɔ n ɔ́ s
popačenka	p ɔ p áː t͡ʃ ɛ n k a
popek	p óː p ə k
poper	p ɔ̀ː p ə r
poplava	p ɔ p l áː ʋ a
popoldan	p ɔ p ɔ́ː ʋ d a n
popolnoma	p ɔ p ɔ́ː ʋ n ɔ m a
por	p óː r
por	p ɔ́ r
porcelan	p ɔ r t͡s ɛ l áː n
pornograf	p ɔ r n ɔ ɡ r áː f
pornografija	p ɔ r n ɔ ɡ r a f íː j a
pornografski	p ɔ r n ɔ ɡ r áː f s k i
porod	p ɔ r ɔ́ t
porod	p ɔ̀ː r ɔ t
poročen	p ɔ r óː t͡ʃ ə n
poročen	p ɔ r ɔ t͡ʃ ɛ́ n
poročilo	p ɔ r ɔ t͡ʃ ìː l ɔ
poročnica	p ɔ r óː t͡ʃ n i t͡s a
poročnik	p ɔ r óː t͡ʃ n i k
portoriko	p ɔ r t ɔ r íː k ɔ
portret	p ɔ r t r éː t
portugalec	p ɔ r t u ɡ áː l ə t͡s
portugalka	p ɔ r t u ɡ áː l k a
portugalska	p ɔ r t u ɡ áː l s k a
portugalski	p ɔ r t u ɡ áː l s k i
portugalsko	p ɔ r t u ɡ áː l s k ɔ
portugalščina	p ɔ r t u ɡ áː l ʃ t͡ʃ i n a
posameznik	p ɔ s áː m ɛ z n i k
posebej	p ɔ s éː b ɛ j
posel	p ɔ̀ː s ə ʋ
poskusiti	p ɔ s k ùː s i t i
poskušati	p ɔ s k ùː ʃ a t i
poslati	p ɔ s l àː t i
poslušati	p ɔ s l u ʃ àː t i
poslušati	p ɔ s l ùː ʃ a t i
posoditi	p ɔ s òː d i t i
posoditi	p ɔ s ɔ d ìː t i
posoditi	p ɔ s ɔ d íː t i
posodobiti	p ɔ s ɔ d ɔ̀ː b i t i
posodobiti	p ɔ s ɔ d ɔ́ː b i t i
pospešek	p ɔ s p éː ʃ ə k
post	p ɔ́ s t
postaja	p ɔ s t áː j a
postati	p ɔ s t àː t i
postelja	p òː s t ɛ l j a
posteljica	p òː s t ɛ l j i t͡s a
postrv	p ɔ s t ə́ r ʋ
pot	p òː t
pot	p óː t
potegovati	p ɔ t ɛ ɡ ɔ ʋ àː t i
potem	p ɔ t éː m
potem	p ɔ t ɛ́ m
potok	p ɔ̀ː t ɔ k
potreben	p ɔ t r èː b ə n
potrebnejši	p ɔ t r èː b n ɛ j ʃ i
potrebovati	p ɔ t r ɛ b ɔ ʋ àː t i
potres	p ɔ t r ɛ́ s
potrpežljiv	p ɔ t ə r p ɛ ʒ l j ìː ʋ
potrpežljiv	p ɔ t ə r p ɛ ʒ l j íː ʋ
potrpežljivejši	p ɔ t ə r p ɛ ʒ l j ìː ʋ ɛ j ʃ i
potrpežljivost	p ɔ t ə r p ɛ ʒ l j ìː ʋ ɔ s t
poudariti	p ɔ u d àː r i t i
povednik	p ɔ ʋ éː d n i k
povratnik	p ɔ ʋ r áː t n i k
površina	p ɔ ʋ ə r ʃ ìː n a
pozabiti	p ɔ z a b ìː t i
pozabiti	p ɔ z a b íː t i
pozabiti	p ɔ z àː b i t i
pozavna	p ɔ z áː ʋ n a
pozdrav	p ɔ z d r á ʋ
pozen	p ɔ̀ː z ə n
pozitron	p ɔ z i t r óː n
poznati	p ɔ z n àː t i
pozno	p ɔ̀ː z n ɔ
pozornost	p ɔ z òː r n ɔ s t
počasi	p ɔ t͡ʃ áː s i
počasneje	p ɔ t͡ʃ a s n ɛ́ː j ɛ
počasneje	p ɔ t͡ʃ àː s n ɛ j ɛ
počasno	p ɔ t͡ʃ àː s n ɔ
počitek	p ɔ t͡ʃ íː t ə k
počiti	p òː t͡ʃ i t i
počiti	p ɔ t͡ʃ ìː t i
počivati	p ɔ t͡ʃ ìː ʋ a t i
požar	p ɔ ʒ áː r
prababica	p r áː b àː b i t͡s a
praded	p r áː d éː t
praded	p r áː d ɛ́ t
praga	p r àː ɡ a
pragermanščina	p r áː ɡ ɛ r m áː n ʃ t͡ʃ i n a
prah	p r áː x
prakrt	p r áː k ə r t
praporščak	p r a p ɔ r ʃ t͡ʃ àː k
praporščakinja	p r a p ɔ r ʃ t͡ʃ àː k i n j a
praprot	p r àː p r ɔ t
prase	p r a s ɛ́
prase	p r àː s ɛ
praslovanski	p r áː s l ɔ ʋ áː n s k i
praslovanščina	p r áː s l ɔ ʋ áː n ʃ t͡ʃ i n a
prati	p r àː t i
pravica	p r a ʋ ìː t͡s a
pravilen	p r a ʋ íː l ə n
pravilneje	p r a ʋ íː l n ɛ j ɛ
pravilnejše	p r a ʋ íː l n ɛ j ʃ ɛ
pravilno	p r a ʋ íː l n ɔ
pravičen	p r a ʋ ìː t͡ʃ ə n
pravičen	p r a ʋ íː t͡ʃ ə n
pravičnost	p r a ʋ ìː t͡ʃ n ɔ s t
pravičnost	p r a ʋ íː t͡ʃ n ɔ s t
pravkar	p r á ʋ k a r
pravo	p r áː ʋ ɔ
pravopis	p r a ʋ ɔ p íː s
prazen	p r àː z ə n
prazeodim	p r a z ɛ ɔ d íː m
prazniti	p r a z n ìː t i
prazniti	p r a z n íː t i
prazniti	p r àː z n i t i
prašati	p r a ʃ àː t i
prašati	p r àː ʃ a t i
prašič	p r àː ʃ i t͡ʃ
prašnik	p r áː ʃ n i k
praštevilo	p r áː ʃ t ɛ ʋ ìː l ɔ
pražiti	p r àː ʒ i t i
prebava	p r ɛ b áː ʋ a
prebiti	p r ɛ b ìː t i
prebivalec	p r ɛ b i ʋ áː l ə t͡s
pred	p r ɛ t
predal	p r ɛ d áː l
predhodnik	p r ɛ d x óː d n i k
predlagati	p r ɛ d l áː ɡ a t i
predlog	p r ɛ̀ː d l ɔ k
predmet	p r ɛ̀ː d m ɛ t
prednik	p r éː d n i k
predpona	p r ɛ t p óː n a
predpreteklik	p r ɛ́ t p r ɛ t ɛ̀ː k l i k
predsednik	p r ɛ t s éː d n i k
predvideti	p r ɛ d ʋ ìː d ɛ t i
predvidljiv	p r ɛ d ʋ i d l j ìː ʋ
predvidljiv	p r ɛ d ʋ i d l j íː ʋ
predvidljivost	p r ɛ d ʋ i d l j ìː ʋ ɔ s t
prehlad	p r ɛ x l á t
preja	p r ɛ̀ː j a
preja	p r ɛ́ː j a
prekletstvo	p r ɛ k l éː t s t ʋ ɔ
premena	p r ɛ m éː n a
premeniti	p r ɛ m ɛ n ìː t i
premeniti	p r ɛ m ɛ n íː t i
preobrat	p r ɛ ɔ b r à t
prepelica	p r ɛ p ɛ l ìː t͡s a
preproga	p r ɛ p r òː ɡ a
preproga	p r ɛ p r óː ɡ a
prepucij	p r ɛ p ùː t͡s i j
prepustnica	p r ɛ p úː s t n i t͡s a
presenetiti	p r ɛ s ɛ n èː t i t i
presenetiti	p r ɛ s ɛ n éː t i t i
presenečenje	p r ɛ s ɛ n éː t͡ʃ ɛ n j ɛ
presredek	p r ɛ s r éː d ə k
presti	p r èː s t i
presti	p r ɛ̀ː s t i
prestol	p r ɛ̀ː s t ɔ l
prestolnica	p r ɛ s t óː l n i t͡s a
preteklik	p r ɛ t ɛ̀ː k l i k
prevajalec	p r ɛ ʋ a j áː l ə t͡s
prevesti	p r ɛ ʋ èː s t i
prevesti	p r ɛ ʋ ɛ̀ː s t i
prevod	p r ɛ ʋ ɔ́ t
prevod	p r ɛ̀ː ʋ ɔ t
prevodnik	p r ɛ ʋ óː d n i k
preživeti	p r ɛ ʒ i ʋ èː t i
prga	p ə̀ r ɡ a
prha	p ə̀ r x a
pri	p r i
priden	p r ìː d ə n
pridevnik	p r i d éː ʋ n i k
pridevniški	p r i d éː ʋ n i ʃ k i
pridnejši	p r ìː d n ɛ j ʃ i
prihajati	p r i x áː j a t i
prihodnji	p r i x óː d n j i
prihodnjik	p r i x óː d n j i k
prihodnost	p r i x óː d n ɔ s t
priimek	p r i íː m ə k
prijatelj	p r i j áː t ɛ l
prijateljica	p r i j áː t ɛ l j i t͡s a
prijateljski	p r i j áː t ɛ l s k i
prijateljstvo	p r i j áː t ɛ l s t ʋ ɔ
prijaviti	p r i j àː ʋ i t i
prijazen	p r i j àː z ə n
prijaznejši	p r i j àː z n ɛ j ʃ i
prijeten	p r i j èː t ə n
priložnost	p r i l òː ʒ n ɔ s t
primer	p r i m éː r
primež	p r ìː m ɛ ʃ
primež	p r íː m ɛ ʃ
princ	p r íː n t͡s
princesa	p r i n t͡s éː s a
pripeti	p r i p èː t i
pripona	p r i p óː n a
priponski	p r i p óː n s k i
prisega	p r i s éː ɡ a
prislov	p r i s l ɔ́ ʋ
prisotnost	p r i s ɔ̀ː t n ɔ s t
prispevek	p r i s p éː ʋ ə k
pristati	p r i s t àː t i
priti	p r ìː t i
pritisk	p r i t íː s k
priznati	p r i z n àː t i
priznavati	p r i z n áː ʋ a t i
priča	p r ìː t͡ʃ a
pričakovati	p r i t͡ʃ a k ɔ ʋ àː t i
prižnica	p r ìː ʒ n i t͡s a
prižnica	p r íː ʒ n i t͡s a
profesor	p r ɔ f éː s ɔ r
programje	p r ɔ ɡ r áː m j ɛ
programski	p r ɔ ɡ r áː m s k i
prometij	p r ɔ m èː t i j
prosim	p r òː s i m
prositi	p r ɔ s ìː t i
prositi	p r ɔ s íː t i
prost	p r ɔ́ s t
prostata	p r óː s t a t a
prostitucija	p r ɔ s t i t ùː t͡s i j a
prostor	p r ɔ̀ː s t ɔ r
prostornina	p r ɔ s t ɔ r n ìː n a
prostorski	p r ɔ s t òː r s k i
prostorski	p r ɔ s t óː r s k i
protaktinij	p r ɔ t a k t ìː n i j
protipomenka	p r óː t i p ɔ m éː n k a
prst	p ə́ r s t
prstan	p ə̀ r s t a n
prstanec	p ə̀ r s t a n ə t͡s
prt	p ə́ r t
