idila	i d íː l a
igla	íː ɡ l a
iglica	íː ɡ l i t͡s a
iglokožec	i ɡ l ɔ k óː ʒ ə t͡s
igo	i ɡ óː
igra	íː ɡ r a
igralec	i ɡ r áː l ə t͡s
igrati	i ɡ r àː t i
igrača	i ɡ r àː t͡ʃ a
ime	i m éː
imenovalnik	i m ɛ n ɔ ʋ áː l n i k
imenovati	i m ɛ n ɔ ʋ àː t i
imeti	i m èː t i
in	i n
indij	ìː n d i j
indija	ìː n d i j a
indijec	íː n d i j ə t͡s
indijka	ìː n d i j k a
indijski	ìː n d i j s k i
indonezija	i n d ɔ n èː z i j a
informatik	i n f ɔ r m àː t i k
ingver	ìː n ɡ ʋ ɛ r
ingver	íː n ɡ ʋ ɛ r
insekt	i n s éː k t
instrumental	i n s t r u m ɛ n t áː l
instrumental	íː n s t r u m ɛ n t a l
instrumentalen	i n s t r u m ɛ n t áː l ə n
invazija	i n ʋ a z íː j a
inštitut	i n ʃ t i t úː t
irak	i r áː k
irec	íː r ə t͡s
iridij	i r ìː d i j
irka	íː r k a
ironija	i r ɔ n íː j a
irska	íː r s k a
irski	íː r s k i
irsko	íː r s k ɔ
irščina	íː r ʃ t͡ʃ i n a
iskati	i s k àː t i
iskra	ìː s k r a
islam	íː s l a m
islandija	i s l àː n d i j a
islandski	i s l áː n t s k i
istanbul	íː s t a n b u l
isti	íː s t i
istra	íː s t r a
italija	i t àː l i j a
italijan	i t a l i j á n
italijan	i t a l i j áː n
italijanka	i t a l i j áː n k a
italijanski	i t a l i j áː n s k i
italijansko	i t a l i j áː n s k ɔ
italijanščina	i t a l i j áː n ʃ t͡ʃ i n a
iterbij	i t ɛ̀ː r b i j
iti	ìː t i
iti	íː t i
itrij	ìː t r i j
ivan	íː ʋ a n
iz	i s
izbira	i z b íː r a
izboljšava	i z b ɔ l ʃ áː ʋ a
izbrati	i z b r àː t i
izdajalec	i z d a j áː l ə t͡s
izdati	i z d àː t i
izglagolski	i z ɡ l àː ɡ ɔ l s k i
izgovoriti	i z ɡ ɔ ʋ ɔ r ìː t i
izgovoriti	i z ɡ ɔ ʋ ɔ r íː t i
izgovorjava	i z ɡ ɔ ʋ ɔ r j áː ʋ a
izgubiti	i z ɡ u b ìː t i
izgubiti	i z ɡ u b íː t i
izključiti	i s k l j ùː t͡ʃ i t i
izklopiti	i s k l òː p i t i
izklopiti	i s k l óː p i t i
izklopiti	i s k l ɔ p ìː t i
izklopiti	i s k l ɔ p íː t i
izkrcanje	íː s k ə r t͡s àː n j ɛ
izložba	i z l óː ʒ b a
izmena	i z m ɛ́ː n a
izmolsti	i z m ɔ̀ː ʋ s t i
izpeljanka	i s p ɛ l j àː n k a
izpeljati	i s p ɛ l j àː t i
izposoditi	i s p ɔ s òː d i t i
izposoditi	i s p ɔ s ɔ d ìː t i
izposoditi	i s p ɔ s ɔ d íː t i
izpuščaj	i s p u ʃ t͡ʃ áː j
izrael	íː z r a ɛ l
izraz	i z r á s
izsiljevalski	i s s i l j ɛ ʋ áː l s k i
izsiljevalski	i s s i l j ɛ ʋ áː ʋ s k i
izuti	i z ùː t i
izvijač	i z ʋ i j àː t͡ʃ
izvir	i z ʋ íː r
ja	j àː
ja	j áː
jablana	j àː b l a n a
jablana	j áː b l a n a
jabolko	j àː b ɔ ʋ k ɔ
jadro	j àː d r ɔ
jadro	j áː d r ɔ
jagnje	j àː ɡ n j ɛ
jagnjec	j àː ɡ n j ɛ t͡s
jagnjec	j áː ɡ n j ɛ t͡s
jagnjetina	j a ɡ n j ɛ t ìː n a
jagnjetina	j àː ɡ n j ɛ t i n a
jagoda	j àː ɡ ɔ d a
jahati	j àː x a t i
jahati	j áː x a t i
jajce	j àː j t͡s ɛ
jajčevec	j àː j t͡ʃ ɛ ʋ ə t͡s
jajčevec	j áː j t͡ʃ ɛ ʋ ə t͡s
jajčnik	j áː j t͡ʃ n i k
jak	j áː k
jakac	j áː k a t͡s
jama	j àː m a
jamajka	j a m áː j k a
janez	j àː n ɛ s
janež	j àː n ɛ ʃ
jantar	j àː n t a r
jantar	j áː n t a r
januar	j áː n u a r
janšizem	j a n ʃ i z ɛ m
japonska	j a p óː n s k a
jarek	j àː r ə k
jarek	j áː r ə k
jarem	j àː r ə m
jasen	j àː s ə n
jasnejši	j a s n ɛ́ː j ʃ i
jasnejši	j àː s n ɛ j ʃ i
jasniti	j a s n ìː t i
jasniti	j a s n íː t i
jaspis	j áː s p i s
jaspisen	j áː s p i s ə n
jastreb	j áː s t r ɛ p
javiti	j àː ʋ i t i
javor	j àː ʋ ɔ r
jaz	j á s
jazbec	j áː z b ə t͡s
jazon	j áː z ɔ n
je	j èː
je	j ɛ́
jebati	j éː b a t i
jebati	j ɛ́ː b a t i
jedec	j éː d ə t͡s
jegulja	j ɛ ɡ ùː l j a
jeklo	j ɛ̀ː k l ɔ
jelen	j ɛ̀ː l ɛ n
jelena	j ɛ l éː n a
jelka	j èː l k a
jelša	j èː ʋ ʃ a
jemati	j ɛ m àː t i
jemen	j èː m ə n
jerebica	j ɛ r ɛ b ìː t͡s a
jeremija	j ɛ r ɛ m íː j a
jeruzalem	j ɛ r úː z a l ɛ m
jesen	j ɛ s éː n
jesen	j ɛ̀ː s ɛ n
jesti	j èː s t i
jeti	j èː t i
jetika	j èː t i k a
jetra	j èː t r a
jeza	j èː z a
jezen	j èː z ə n
jezero	j éː z ɛ r ɔ
jezik	j ɛ̀ː z i k
jezikoslovec	j ɛ z i k ɔ s l ɔ́ː ʋ ə t͡s
jezikoslovje	j ɛ z i k ɔ s l ɔ́ː ʋ j ɛ
jeznejši	j èː z n ɛ j ʃ i
jezus	j éː z u s
ječmen	j ɛ̀ː t͡ʃ m ɛ n
jež	j èː ʃ
jež	j éː ʃ
ježevec	j èː ʒ ɛ ʋ ə t͡s
ježevec	j éː ʒ ɛ ʋ ə t͡s
jod	j óː t
joga	j óː ɡ a
jogurt	j óː ɡ u r t
jokati	j òː k a t i
jokati	j ɔ k àː t i
jordanija	j ɔ r d àː n i j a
jordanski	j ɔ r d áː n s k i
jože	j óː ʒ ɛ
jožef	j óː ʒ ɛ f
judovstvo	j ùː d ɔ ʋ s t ʋ ɔ
jug	j ú k
jug	j úː k
jugoslavija	j u ɡ ɔ s l àː ʋ i j a
juha	j ùː x a
julij	j ùː l i j
junij	j ùː n i j
jupiter	j úː p i t ə r
jur	j ùː r
jurij	j ùː r i j
jutri	j úː t r i
jutro	j ùː t r ɔ
juvan	j úː ʋ a n
južen	j ùː ʒ ə n
južina	j ùː ʒ i n a
južnejši	j ùː ʒ n ɛ j ʃ i
južnoameriški	j u ʒ n ɔ a m ɛ́ː r i ʃ k i
južnoslovanski	j u ʒ n ɔ s l ɔ ʋ áː n s k i
kad	k á t
kadar	k á d a r
kadilo	k a d ìː l ɔ
kaditi	k a d ìː t i
kaditi	k a d íː t i
kadmij	k àː d m i j
kaj	k àː j
kaj	k á j
kajak	k áː j a k
kako	k a k òː
kako	k a k óː
kakor	k á k ɔ r
kakovost	k a k ɔ̀ː ʋ ɔ s t
kakšen	k àː k ʃ ə n
kakšen	k áː k ʃ ə n
kalcij	k àː l t͡s i j
kalifornij	k a l i f òː r n i j
kalifornija	k a l i f òː r n i j a
kalij	k àː l i j
kaliti	k a l ìː t i
kaliti	k a l íː t i
kamela	k a m éː l a
kamen	k àː m ə n
kamerun	k áː m ɛ r u n
kamin	k a m íː n
kamion	k a m i j óː n
kanada	k áː n a d a
kanjon	k áː n j ɔ n
kapati	k àː p a t i
kapetan	k a p éː t a n
kapetanka	k a p éː t a n k a
kapitalist	k a p i t a l íː s t
kapitalizem	k a p i t a l ìː z ə m
kaplja	k àː p l j a
kapsula	k áː p s u l a
karamela	k a r a m éː l a
kardinal	k a r d i n áː l
karel	k àː r ə l
karta	k áː r t a
kartagina	k a r t áː ɡ i n a
katalonija	k a t a l òː n i j a
katalonski	k a t a l óː n s k i
katalonščina	k a t a l óː n ʃ t͡ʃ i n a
katedrala	k a t ɛ d r áː l a
kategorialen	k a t ɛ ɡ ɔ r i j áː l ə n
kategorija	k a t ɛ ɡ ɔ r íː j a
kateter	k a t èː t ə r
kava	k àː ʋ a
kavarna	k a ʋ áː r n a
kavka	k áː ʋ k a
kavkaz	k a ʋ k áː s
kavsati	k áː ʋ s a t i
kavčič	k áː ʋ t͡ʃ i t͡ʃ
kazahstan	k áː z a x s t a n
kazalec	k a z áː l ə t͡s
kazati	k a z àː t i
kazati	k àː z a t i
kazen	k áː z ə n
kaznovati	k a z n ɔ ʋ àː t i
kača	k àː t͡ʃ a
kašelj	k àː ʃ ə l
kašljati	k áː ʃ l j a t i
kašča	k àː ʃ t͡ʃ a
kdaj	ɡ d àː j
kdaj	ɡ d á j
kdaj	ɡ d áː j
kdo	ɡ d òː
kdo	ɡ d óː
kdor	ɡ d óː r
kdor	ɡ d ɔ́ r
kelih	k èː l i x
kelt	k éː l t
kemija	k ɛ m íː j a
kenguru	k ɛ n ɡ u r úː
kenija	k èː n i j a
kenta	k éː n t a
ker	k ɛ r
kern	k ɛ́ː r n
kersnik	k ɛ r s n ìː k
ki	k i
kikiriki	k i k i r i k íː
kilometer	k i l ɔ m èː t ə r
kinin	k i n íː n
kino	k íː n ɔ
kip	k íː p
kirij	k i r ìː j
kis	k íː s
kisel	k ìː s ə ʋ
kisik	k i s íː k
kislina	k i s l ìː n a
kit	k íː t
kita	k ìː t a
kitajec	k i t áː j ə t͡s
kitajka	k i t áː j k a
kitajska	k i t áː j s k a
kitajski	k i t áː j s k i
kitajščina	k i t áː j ʃ t͡ʃ i n a
kitara	k i t áː r a
kje	k j èː
kje	k j éː
kjer	k j éː r
kladivce	k l a d ìː ʋ t͡s ɛ
kladivce	k l a d íː ʋ t͡s ɛ
kladivce	k l àː d i ʋ t͡s ɛ
kladivo	k l a d ìː ʋ ɔ
kladivo	k l àː d i ʋ ɔ
klarinet	k l a r i n éː t
klas	k l áː s
klasičen	k l àː s i t͡ʃ ə n
klasti	k l àː s t i
klati	k l àː t i
klavir	k l a ʋ íː r
klen	k l è n
klen	k l éː n
klen	k l ɛ̀ n
kleopatra	k l ɛ óː p a t r a
klepati	k l ɛ p àː t i
klepec	k l ɛ̀ː p ə t͡s
klečati	k l ɛ t͡ʃ àː t i
klešče	k l èː ʃ t͡ʃ ɛ
klic	k l íː t͡s
klicaj	k l i t͡s áː j
klicati	k l ìː t͡s a t i
klima	k l ìː m a
klima	k l íː m a
klitoris	k l íː t ɔ r i s
kljukica	k l j ùː k i t͡s a
kljun	k l j úː n
kljunaš	k l j u n àː ʃ
ključ	k l j ùː t͡ʃ
ključavnica	k l j u t͡ʃ áː ʋ n i t͡s a
ključiti	k l j ùː t͡ʃ i t i
klobasa	k l ɔ b àː s a
klobuk	k l ɔ b ùː k
klobučar	k l ɔ b u t͡ʃ àː r
klofuta	k l ɔ f ùː t a
klokan	k l óː k a n
klop	k l óː p
klop	k l ɔ́ p
klopotača	k l ɔ p ɔ t àː t͡ʃ a
klor	k l óː r
klorofil	k l ɔ r ɔ f íː l
klovn	k l ɔ̀ː ʋ n
klošar	k l óː ʃ a r
klošar	k l ɔ ʃ àː r
klošč	k l ɔ́ ʃ t͡ʃ
kmalu	k m áː l u
kmet	k m ɛ́ t
kmetija	k m ɛ t íː j a
kneginja	k n éː ɡ i n j a
knez	k n éː s
knjiga	k n j ìː ɡ a
knjigarna	k n j i ɡ áː r n a
književnost	k n j i ʒ éː ʋ n ɔ s t
ko	k ɔ
kobalt	k óː b a l t
kobarid	k ɔ b a r íː t
kobila	k ɔ b ìː l a
kobilica	k ɔ b ìː l i t͡s a
kocka	k óː t͡s k a
kockati	k óː t͡s k a t i
koder	k òː d ə r
kokalj	k òː k a l
kokolj	k òː k ɔ l
kokot	k ɔ k óː t
kokoš	k ɔ k óː ʃ
kola	k óː l a
kola	k ɔ̀ː l a
kolcanje	k ɔ̀ː u̯ t͡s a n j ɛ
kolcanje	k ɔ́ː u̯ t͡s a n j ɛ
koledar	k ɔ l ɛ d àː r
koledž	k óː l ɛ t ʃ
koleno	k ɔ l èː n ɔ
kolesariti	k ɔ l ɛ s àː r i t i
kolidž	k óː l i t ʃ
koliko	k òː l i k ɔ
koliko	k óː l i k ɔ
količina	k ɔ l i t͡ʃ ìː n a
kolo	k óː l ɔ
kolo	k ɔ l óː
komaj	k óː m a j
komar	k ɔ m àː r
komarček	k ɔ m àː r t͡ʃ ə k
komarček	k ɔ m áː r t͡ʃ ə k
komet	k ɔ m éː t
komolec	k ɔ m óː l ə t͡s
komori	k ɔ m óː r i
kompas	k óː m p a s
kompas	k ɔ m p áː s
komunizem	k ɔ m u n ìː z ə m
kondom	k ɔ n d óː m
konec	k ɔ̀ː n ə t͡s
konj	k ɔ́ n
konkreten	k ɔ n k r éː t ə n
konkretno	k ɔ n k r éː t n ɔ
kontinent	k ɔ n t i n ɛ́ n t
kontrabas	k óː n t r a b áː s
končati	k ɔ n t͡ʃ àː t i
končen	k ɔ̀ː n t͡ʃ ə n
končno	k ɔ̀ː n t͡ʃ n ɔ
kop	k óː p
kopalnica	k ɔ p áː l n i t͡s a
kopati	k òː p a t i
kopati	k ɔ p àː t i
kopel	k òː p ɛ ʋ
kopel	k ɔ p éː l
koper	k òː p ə r
koper	k ɔ̀ː p ə r
kopito	k ɔ p ìː t ɔ
kopje	k òː p j ɛ
kopno	k óː p n ɔ
kopno	k ɔ̀ː p n ɔ
kopno	k ɔ́ː p n ɔ
korak	k ɔ r áː k
koreja	k ɔ r ɛ́ː j a
koren	k ɔ r éː n
korenina	k ɔ r ɛ n ìː n a
korenje	k ɔ r éː n j ɛ
korenje	k ɔ r ɛ̀ː n j ɛ
korošec	k ɔ r óː ʃ ə t͡s
koroška	k ɔ r óː ʃ k a
koruza	k ɔ r ùː z a
kos	k óː s
kosilo	k ɔ s ìː l ɔ
kosinus	k óː s i n u s
kosinus	k óː z i n u s
kosinus	k ɔ́ s íː n u s
kositer	k ɔ s ìː t ə r
kositi	k òː s i t i
kositi	k ɔ s ìː t i
kositi	k ɔ s íː t i
kosmulja	k ɔ s m ùː l j a
kost	k óː s t
kostanj	k ɔ̀ː s t a n
kostnica	k óː s t n i t͡s a
kot	k òː t
kot	k ɔ t
kovanec	k ɔ ʋ àː n ə t͡s
kovati	k ɔ ʋ àː t i
kovač	k ɔ ʋ àː t͡ʃ
kovinski	k ɔ ʋ íː n s k i
kovnica	k ɔ́ː ʋ n i t͡s a
koza	k ɔ̀ː z a
kozarec	k ɔ z áː r ə t͡s
kozel	k ɔ̀ː z ə ʋ
kozmologija	k ɔ z m ɔ l ɔ ɡ íː j a
kozorog	k ɔ z ɔ r óː k
kočija	k ɔ t͡ʃ íː j a
koš	k ɔ́ ʃ
košara	k ɔ ʃ áː r a
košarka	k ɔ ʃ áː r k a
koža	k òː ʒ a
kraj	k r á j
krajina	k r àː j i n a
krajina	k r áː j i n a
krajšava	k r a j ʃ áː ʋ a
krajši	k r áː j ʃ i
kralj	k r àː l
kraljestvo	k r a l j éː s t ʋ ɔ
kraljevina	k r a l j ɛ ʋ ìː n a
kraljica	k r a l j ìː t͡s a
krap	k r á p
kras	k r á s
kras	k r áː s
krastača	k r a s t àː t͡ʃ a
krasti	k r àː s t i
kratek	k r àː t ə k
krater	k r àː t ɛ r
kratica	k r a t ìː t͡s a
kratkovaloven	k r a t k ɔ ʋ a l ɔ́ː ʋ ə n
krava	k r àː ʋ a
kravžati	k r áː ʋ ʒ a t i
kreda	k r éː d a
krema	k r éː m a
krempelj	k r èː m p ə l
kreniti	k r ɛ n ìː t i
kreniti	k r ɛ n íː t i
kres	k r éː s
kreta	k r éː t a
kri	k r íː
krik	k r íː k
krilo	k r ìː l ɔ
kripton	k r íː p t ɔ n
kristal	k r i s t áː l
kristalizacija	k r i s t a l i z àː t͡s i j a
kristjan	k r i s t j áː n
kristus	k r íː s t u s
kriti	k r ìː t i
krivda	k r íː ʋ d a
krivoverec	k r i ʋ ɔ ʋ éː r ə t͡s
križ	k r ìː ʃ
križanje	k r ìː ʒ a n j ɛ
križanje	k r íː ʒ a n j ɛ
križanka	k r íː ʒ a n k a
krma	k ə̀ r m a
krog	k r óː k
krog	k r ɔ k
krogla	k r óː ɡ l a
krojač	k r ɔ j àː t͡ʃ
krokar	k r óː k a r
krom	k r óː m
krom	k r ɔ́ m
krompir	k r ɔ m p ìː r
krompir	k r ɔ m p íː r
krona	k r óː n a
kronati	k r óː n a t i
krst	k ə́ r s t
krsta	k ə̀ r s t a
krt	k ə́ r t
kruh	k r ú x
krut	k r úː t
krutejši	k r ùː t ɛ j ʃ i
krutejši	k r úː t ɛ j ʃ i
krvaveti	k ə r ʋ a ʋ èː t i
krzno	k ə́ r z n ɔ
krč	k ə̀ r t͡ʃ
krč	k ə́ r t͡ʃ
krščanstvo	k ə r ʃ t͡ʃ áː n s t ʋ ɔ
ksenofobija	k s ɛ n ɔ f ɔ b íː j a
ksenon	k s éː n ɔ n
ksilofon	k s i l ɔ f óː n
kuba	k úː b a
kuga	k ùː ɡ a
kuhar	k úː x a r
kuhati	k ùː x a t i
kuhinja	k ùː x i n j a
kukavica	k ùː k a ʋ i t͡s a
kuna	k ùː n a
kunec	k ùː n ə t͡s
kunec	k úː n ə t͡s
kup	k ú p
kupa	k ùː p a
kupiti	k u p ìː t i
kupiti	k u p íː t i
kupiti	k ùː p i t i
kupovati	k u p ɔ ʋ àː t i
kura	k ùː r a
kurba	k úː r b a
kurdščina	k úː r t ʃ t͡ʃ i n a
kurec	k úː r ə t͡s
kurva	k úː r ʋ a
kuščar	k ùː ʃ t͡ʃ a r
kuščar	k úː ʃ t͡ʃ a r
kuža	k úː ʒ a
kvadrat	k ʋ a d r áː t
kvar	k ʋ áː r
kvark	k ʋ áː r k
kvartet	k ʋ a r t éː t
kvas	k ʋ áː s
labod	l a b óː t
ladja	l àː d j a
lagati	l a ɡ àː t i
lahek	l àː x ə k
lahko	l a x k óː
lajati	l áː j a t i
lama	l àː m a
lani	l àː n i
lantan	l a n t áː n
las	l áː s
last	l áː s t
lasten	l àː s t ə n
lastnina	l a s t n ìː n a
lastnost	l a s t n óː s t
lastovica	l àː s t ɔ ʋ i t͡s a
lastovka	l àː s t ɔ ʋ k a
latinica	l a t íː n i t͡s a
latinski	l a t íː n s k i
latinščina	l a t íː n ʃ t͡ʃ i n a
latvija	l àː t ʋ i j a
latvijec	l àː t ʋ i j ə t͡s
latvijka	l àː t ʋ i j k a
latvijski	l àː t ʋ i j s k i
latvijsko	l àː t ʋ i j s k ɔ
latvijščina	l àː t ʋ i j ʃ t͡ʃ i n a
lavrencij	l a ʋ r èː n t͡s i j
lačen	l àː t͡ʃ ə n
laž	l áː ʃ
lažji	l áː ʒ j i
lažnivec	l a ʒ n íː ʋ ə t͡s
le	l ɛ́
led	l éː t
ledenik	l ɛ d ɛ n ìː k
legendaren	l ɛ ɡ ɛ n d áː r ə n
leha	l èː x a
lek	l éː k
lemež	l éː m ɛ ʃ
lemež	l ɛ̀ː m ɛ ʃ
len	l éː n
len	l ɛ́ n
lenivec	l ɛ n íː ʋ ə t͡s
leon	l éː ɔ n
lep	l éː p
lepiti	l èː p i t i
lepiti	l ɛ p ìː t i
lepiti	l ɛ p íː t i
lepota	l ɛ p ɔ̀ː t a
lepši	l éː p ʃ i
les	l éː s
leska	l èː s k a
lesketati	l ɛ s k ɛ t àː t i
lesti	l èː s t i
lestvica	l èː s t ʋ i t͡s a
let	l ɛ́ t
letališče	l ɛ t a l ìː ʃ t͡ʃ ɛ
letalo	l ɛ t àː l ɔ
leten	l éː t ə n
leteti	l ɛ t èː t i
leto	l èː t ɔ
lev	l ɛ́ ʋ
levinja	l ɛ ʋ ìː n j a
levinja	l ɛ̀ː ʋ i n j a
levinja	l ɛ́ː ʋ i n j a
lezbijka	l èː z b i j k a
leči	l èː t͡ʃ i
lešnik	l èː ʃ n i k
ležaj	l ɛ ʒ áː j
ležati	l ɛ ʒ àː t i
libanon	l íː b a n ɔ n
liberija	l i b ɛ̀ː r i j a
libidinozen	l i b i d i n óː z ə n
libido	l íː b i d ɔ
libija	l ìː b i j a
lice	l ìː t͡s ɛ
lice	l íː t͡s ɛ
liga	l ìː ɡ a
lijak	l i j àː k
likalnik	l i k áː l n i k
likati	l íː k a t i
limona	l i m óː n a
limonada	l i m ɔ n áː d a
lipa	l ìː p a
lipovec	l ìː p ɔ ʋ ə t͡s
lira	l íː r a
lisica	l i s ìː t͡s a
lisička	l i s ìː t͡ʃ k a
list	l íː s t
liter	l ìː t ə r
literatura	l i t ɛ r a t úː r a
liti	l ìː t i
litij	l ìː t i j
litovec	l ìː t ɔ ʋ ə t͡s
litovka	l ìː t ɔ ʋ k a
litovski	l íː t ɔ ʋ s k i
litovsko	l íː t ɔ ʋ s k ɔ
litovščina	l ìː t ɔ ʋ ʃ t͡ʃ i n a
liturgija	l i t u r ɡ íː j a
litva	l íː t ʋ a
lizati	l i z àː t i
lizati	l ìː z a t i
lizbona	l i z b óː n a
ličinka	l i t͡ʃ íː n k a
ličnica	l íː t͡ʃ n i t͡s a
lišaj	l i ʃ áː j
ljubezen	l j u b éː z ə n
ljubeč	l j u b ɛ́ t͡ʃ
ljubit	l j ùː b i t
ljubiti	l j u b ìː t i
ljubiti	l j u b íː t i
ljubiti	l j ùː b i t i
ljubiti	l j úː b i t i
ljubljana	l j u b l j àː n a
ljubljenje	l j ùː b l j ɛ n j ɛ
ljubljenje	l j úː b l j ɛ n j ɛ
ljubosumen	l j u b ɔ s ùː m ə n
ljubosumnejši	l j u b ɔ s ùː m n ɛ j ʃ i
ljubosumnost	l j u b ɔ s ùː m n ɔ s t
ljudski	l j úː t s k i
lobanja	l ɔ b àː n j a
log	l óː k
lok	l óː k
lokacija	l ɔ k àː t͡s i j a
lokativ	l óː k a t i ʋ
lokomotiva	l ɔ k ɔ m ɔ t íː ʋ a
lom	l ɔ́ m
lombardija	l ɔ m b a r d íː j a
lomiti	l ɔ m ìː t i
lomiti	l ɔ m íː t i
lonec	l ɔ̀ː n ə t͡s
lopata	l ɔ p àː t a
lopov	l óː p ɔ ʋ
lopov	l ɔ́ː p ɔ ʋ
los	l óː s
losos	l óː s ɔ s
lotos	l óː t ɔ s
lovec	l ɔ̀ː ʋ ə t͡s
loviti	l ɔ ʋ ìː t i
loviti	l ɔ ʋ íː t i
lovka	l ɔ́ː ʋ k a
ločevati	l ɔ t͡ʃ ɛ ʋ àː t i
ločiti	l òː t͡ʃ i t i
ločiti	l ɔ t͡ʃ ìː t i
ločiti	l ɔ t͡ʃ íː t i
lubenica	l úː b ɛ n i t͡s a
lubje	l ùː b j ɛ
lug	l ùː k
lug	l úː k
luka	l ùː k a
luknja	l úː k n j a
luksemburg	l úː k s ɛ m b u r k
luksemburški	l u k s ɛ m b úː r ʃ k i
luksemburški	l úː k s ɛ m b u r ʃ k i
lulček	l úː l t͡ʃ ə k
luna	l ùː n a
lunaren	l u n áː r ə n
luska	l ùː s k a
lutecij	l u t èː t͡s i j
luteranec	l u t ɛ r áː n ə t͡s
lutnja	l úː t n j a
luč	l ùː t͡ʃ
luč	l úː t͡ʃ
m	ɛ m
macesen	m a t͡s ɛ̀ː s ə n
madžar	m a d͡ʒ áː r
madžarka	m a d͡ʒ áː r k a
madžarska	m a d͡ʒ áː r s k a
madžarski	m a d͡ʒ áː r s k i
madžarsko	m a d͡ʒ áː r s k ɔ
madžarščina	m a d͡ʒ áː r ʃ t͡ʃ i n a
mafija	m àː f i j a
magnezij	m a ɡ n éː z i j
mah	m áː x
maj	m àː j
maja	m àː j a
majati	m a j àː t i
majati	m àː j a t i
majhen	m áː j x ə n
majoneza	m a j ɔ n éː z a
majorka	m a j óː r k a
mak	m á k
mak	m áː k
makedonec	m a k ɛ d óː n ə t͡s
makedonija	m a k ɛ d òː n i j a
makedonka	m a k ɛ d óː n k a
makedonski	m a k ɛ d óː n s k i
makedonščina	m a k ɛ d óː n ʃ t͡ʃ i n a
maklen	m a k l ɛ́ n
malarija	m a l àː r i j a
maldivi	m a l d íː ʋ i
malezija	m a l èː z i j a
malina	m a l ìː n a
malo	m àː l ɔ
malta	m áː l t a
malte	m áː l t ɛ
malteški	m a l t éː ʃ k i
malteško	m a l t éː ʃ k ɔ
malteščina	m a l t éː ʃ t͡ʃ i n a
maltežan	m a l t ɛ ʒ á n
maltežan	m a l t ɛ ʒ áː n
maltežanka	m a l t ɛ ʒ áː n k a
malti	m áː l t i
malto	m áː l t ɔ
mamilo	m a m ìː l ɔ
mamut	m áː m u t
mandolina	m a n d ɔ l íː n a
mangan	m a n ɡ áː n
manjkati	m áː n k a t i
manjšalnica	m a n ʃ áː l n i t͡s a
manjši	m áː n ʃ i
marec	m àː r ə t͡s
marelica	m a r éː l i t͡s a
marija	m a r íː j a
marjan	m áː r j a n
marko	m àː r k ɔ
maroko	m a r óː k ɔ
mars	m áː r s
masa	m áː s a
maslo	m àː s l ɔ
masturbacija	m a s t u r b àː t͡s i j a
masturbirati	m a s t u r b íː r a t i
matej	m a t ɛ́ː j
matematika	m a t ɛ m àː t i k a
materen	m áː t ɛ r ə n
maternica	m áː t ɛ r n i t͡s a
mati	m àː t i
matica	m áː t i t͡s a
mavec	m àː ʋ ə t͡s
mavretanija	m a ʋ r ɛ t àː n i j a
mavrica	m áː ʋ r i t͡s a
mačeha	m àː t͡ʃ ɛ x a
maček	m àː t͡ʃ ə k
mačka	m áː t͡ʃ k a
maša	m àː ʃ a
me	m éː
med	m éː t
med	m ɛ t
meden	m ɛ d éː n
medenica	m ɛ d ɛ n ìː t͡s a
medicina	m ɛ d i t͡s íː n a
medved	m ɛ̀ː d ʋ ɛ t
medvedka	m ɛ d ʋ éː t k a
megavat	m éː ɡ a ʋ áː t
megla	m ə ɡ l á
megla	m ə̀ ɡ l a
meglica	m ə ɡ l ìː t͡s a
meh	m éː x
mehaničen	m ɛ x àː n i t͡ʃ ə n
mehek	m ɛ̀ː x ə k
mehika	m éː x i k a
mehkužec	m ɛ x k úː ʒ ə t͡s
mehur	m ɛ x ùː r
meja	m ɛ̀ː j a
mejak	m ɛ j àː k
mejiti	m ɛ j ìː t i
mejiti	m ɛ j íː t i
meka	m èː k a
melancana	m ɛ l a n t͡s áː n a
melodija	m ɛ l ɔ d íː j a
mendelevij	m ɛ n d ɛ l èː ʋ i j
menih	m ə n ìː x
menih	m ɛ n ìː x
meniti	m èː n i t i
meniti	m ɛ n ìː t i
meniti	m ɛ n íː t i
menjati	m èː n j a t i
menjati	m ɛ n j àː t i
meriti	m èː r i t i
merjasec	m ɛ r j àː s ə t͡s
merkur	m ɛ r k úː r
mesar	m ɛ s àː r
mesec	m éː s ə t͡s
mesija	m ɛ s íː j a
meso	m ɛ s óː
mesojedec	m ɛ s ɔ j éː d ə t͡s
mesti	m èː s t i
mesti	m ɛ̀ː s t i
mestnik	m éː s t n i k
mesto	m èː s t ɔ
met	m ɛ́ t
meta	m éː t a
metafizika	m ɛ t a f ìː z i k a
metati	m ɛ t àː t i
metež	m éː t ɛ ʃ
meti	m èː t i
metla	m ɛ̀ː t l a
metulj	m ɛ t ùː l
mezeg	m ə z ə́ k
mezeg	m ə̀ z ə k
mezinec	m ɛ z íː n ə t͡s
mezon	m ɛ z óː n
meč	m ɛ́ t͡ʃ
mečji	m éː t͡ʃ j i
mešati	m èː ʃ a t i
mešati	m ɛ ʃ àː t i
mi	m íː
miha	m ìː x a
mihael	m íː x a ɛ l
mihaela	m íː x a ɛ l a
mil	m íː l
milijon	m i l i j óː n
milimeter	m i l i m èː t ə r
milisekunda	m íː l i s ɛ k úː n d a
militi	m ìː l i t i
militi	m íː l i t i
miličnica	m i l íː t͡ʃ n i t͡s a
miličnik	m i l íː t͡ʃ n i k
milo	m ìː l ɔ
mina	m íː n a
mineralogija	m i n ɛ r a l ɔ ɡ íː j a
miniti	m i n ìː t i
miniti	m i n íː t i
minuta	m i n úː t a
mir	m íː r
mirta	m ìː r t a
misel	m íː s ə ʋ
misliti	m ìː s l i t i
miti	m ìː t i
mitologija	m i t ɔ l ɔ ɡ íː j a
mitološki	m i t ɔ l óː ʃ k i
miza	m ìː z a
mizantropija	m i z a n t r ɔ p íː j a
miš	m í ʃ
mišica	m íː ʃ i t͡s a
mišičen	m íː ʃ i t͡ʃ ə n
mišjak	m íː ʃ j a k
miška	m íː ʃ k a
mjanmar	m j a n m áː r
mlad	m l áː t
mladina	m l a d ìː n a
mladič	m l a d í t͡ʃ
mladost	m l a d óː s t
mlajši	m l áː j ʃ i
mleko	m l èː k ɔ
mlesti	m l èː s t i
mleti	m l èː t i
mlečen	m l èː t͡ʃ ə n
mlin	m l íː n
množina	m n ɔ ʒ ìː n a
moder	m òː d ə r
modernizirati	m ɔ d ɛ r n i z íː r a t i
modnik	m óː d n i k
modo	m òː d ɔ
modo	m óː d ɔ
modrec	m óː d r ə t͡s
modrejši	m òː d r ɛ j ʃ i
modrejši	m ɔ d r ɛ́ː j ʃ i
modrost	m òː d r ɔ s t
modrost	m ɔ d r óː s t
mogoče	m ɔ ɡ òː t͡ʃ ɛ
mohamed	m òː x a m ɛ t
mohar	m ɔ̀ː x a r
moj	m òː j
mojzes	m óː j z ɛ s
moka	m òː k a
moker	m òː k ə r
moldavija	m ɔ l d àː ʋ i j a
molekula	m ɔ l éː k u l a
molibden	m ɔ l i b d éː n
molitev	m ɔ l íː t ə ʋ
moliti	m ɔ l ìː t i
moliti	m ɔ l íː t i
molsti	m ɔ̀ː ʋ s t i
molčati	m ɔ ʋ t͡ʃ àː t i
monako	m ɔ n áː k ɔ
monom	m ɔ n óː m
monoteizem	m ɔ n ɔ t ɛ ìː z ə m
morati	m óː r a t i
moravec	m ɔ r àː ʋ ə t͡s
morda	m ɔ r d á
moriti	m ɔ r ìː t i
moriti	m ɔ r íː t i
morje	m óː r j ɛ
morje	m ɔ r j éː
mornarica	m ɔ r n áː r i t͡s a
mornarka	m ɔ r n àː r k a
morski	m ɔ̀ː r s k i
moskva	m óː s k ʋ a
most	m óː s t
motika	m ɔ t íː k a
motor	m óː t ɔ r
moč	m óː t͡ʃ
moča	m òː t͡ʃ a
močerad	m ɔ t͡ʃ ɛ r á t
moči	m ɔ̀ː t͡ʃ i
močvirje	m ɔ t͡ʃ ʋ íː r j ɛ
mošeja	m ɔ ʃ ɛ́ː j a
moški	m ɔ̀ː ʃ k i
mošt	m ɔ́ ʃ t
mož	m óː ʃ
možen	m òː ʒ ə n
možgani	m ɔ ʒ ɡ áː n i
možnar	m òː ʒ n a r
možnost	m òː ʒ n ɔ s t
mravlja	m r àː ʋ l j a
mravlja	m r áː ʋ l j a
mraz	m r á s
mreti	m r èː t i
mreža	m r èː ʒ a
mrhovina	m ə r x ɔ ʋ ìː n a
mrkev	m ə̀ r k ə ʋ
mrkva	m ə̀ r k ʋ a
mrož	m r óː ʃ
mrtev	m ə̀ r t ə ʋ
muditi	m u d ìː t i
muditi	m u d íː t i
muflon	m u f l óː n
muha	m ùː x a
mujezin	m u j ɛ z íː n
mula	m ùː l a
mulj	m úː l
mungo	m úː n ɡ ɔ
murva	m úː r ʋ a
muskularen	m u s k u l áː r ə n
musliman	m u s l i m áː n
muslimanka	m u s l i m áː n k a
muslimanski	m u s l i m áː n s k i
muzej	m u z ɛ́ː j
muzikalen	m u z i k áː l ə n
muzikologija	m u z i k ɔ l ɔ ɡ íː j a
mušnica	m úː ʃ n i t͡s a
na	n a
nad	n a t
nadlegovati	n a d l ɛ ɡ ɔ ʋ àː t i
nadporočnica	n a t p ɔ r óː t͡ʃ n i t͡s a
nadporočnik	n a t p ɔ r óː t͡ʃ n i k
nadzorovati	n a d z ɔ r ɔ ʋ àː t i
naenkrat	n a ɛ̀ː n k r a t
nafta	n áː f t a
nag	n áː k
nagel	n àː ɡ ə ʋ
nagelj	n àː ɡ ə l
naglas	n a ɡ l á s
naglejši	n àː ɡ l ɛ j ʃ i
najabsurdnejši	n á j a p s úː r d n ɛ j ʃ i
najbednejši	n á j b èː d n ɛ j ʃ i
najbelejši	n á j b ɛ l ɛ́ː j ʃ i
najbetežnejši	n á j b ɛ t èː ʒ n ɛ j ʃ i
najbliže	n á j b l íː ʒ ɛ
najbližje	n á j b l íː ʒ j ɛ
najbogatejši	n á j b ɔ ɡ a t ɛ́ː j ʃ i
najbolj	n á j b ɔ l
najbolje	n á j b óː l j ɛ
najboljše	n á j b óː l ʃ ɛ
najboljši	n á j b óː l ʃ i
najbradatejši	n á j b r a d àː t ɛ j ʃ i
najbrihtnejši	n á j b r ìː x t n ɛ j ʃ i
najbudnejši	n á j b ùː d n ɛ j ʃ i
najdalj	n á j d á l
najdaljši	n á j d áː l ʃ i
najdebelejši	n á j d ɛ b ɛ l ɛ́ː j ʃ i
najdejavnejši	n á j d ɛ j àː ʋ n ɛ j ʃ i
najdejavnejši	n á j d ɛ j áː ʋ n ɛ j ʃ i
najdolgočasnejši	n á j d ɔ l ɡ ɔ t͡ʃ àː s n ɛ j ʃ i
najdražji	n á j d r áː ʒ j i
najglasnejši	n á j ɡ l a s n ɛ́ː j ʃ i
najglušji	n á j ɡ l úː ʃ j i
najgrji	n á j ɡ ə́ r j i
najgrozljivejši	n á j ɡ r ɔ z l j ìː ʋ ɛ j ʃ i
najgrši	n á j ɡ ə́ r ʃ i
najhitreje	n á j x i t r ɛ̀ː j ɛ
najhitrejše	n á j x i t r ɛ̀ː j ʃ ɛ
najhujši	n á j x úː j ʃ i
najin	n áː j i n
najjasnejši	n á j j a s n ɛ́ː j ʃ i
najjasnejši	n á j j àː s n ɛ j ʃ i
najjeznejši	n á j j èː z n ɛ j ʃ i
najkrajši	n á j k r áː j ʃ i
najkrutejši	n á j k r ùː t ɛ j ʃ i
najkrutejši	n á j k r úː t ɛ j ʃ i
najlažji	n á j l áː ʒ j i
najlepši	n á j l éː p ʃ i
najljubosumnejši	n á j l j u b ɔ s ùː m n ɛ j ʃ i
najmanjši	n á j m áː n ʃ i
najmečji	n á j m éː t͡ʃ j i
najmlajši	n á j m l áː j ʃ i
najmodrejši	n á j m òː d r ɛ j ʃ i
najmodrejši	n á j m ɔ d r ɛ́ː j ʃ i
