ࢳ	ŋ	0
ࢳ	ŋ a	0
ࢴ	ɡ	0
ࢴ	ɡ a	0
அஃகம்	ʔ a ɡ a m	0
அகங்காரம்	ʔ a ɡ a ŋ ɡ aː ɾ̪ a m	62
அகங்கை	ʔ a ɡ a ŋ ɡ a ɪ̯	0
அகதி	ʔ a ɡ a d̪ i	137
அகத்தாழம்	ʔ a ɡ a t̪ː aː ɻ a m	0
அகத்துக்காரர்	ʔ a ɡ a t̪ː u kː aː ɾ̪ a ɾ̪	0
அகத்துக்காரி	ʔ a ɡ a t̪ː u kː aː ɾ̪ i	4
அகந்தை	ʔ a ɡ a n̪ d̪ a ɪ̯	17
அகப்பு	ʔ a ɡ a pː u	0
அகப்பை	ʔ a ɡ a pː a ɪ̯	7
அகம்	ʔ a ɡ a m	91
அகரமுதலி	ʔ a ɡ a ɾ̪ a m u d̪ a l̪ i	7
அகரம்	ʔ a ɡ a ɾ̪ a m	54
அகரவரிசை	ʔ a ɡ a ɾ̪ a ʋ a ɾ̪ i s a ɪ̯	5
அகராதி	ʔ a ɡ a ɾ̪ aː d̪ i	144
அகற்று	ʔ a ɡ a ʈː ɾ u	3
அகலம்	ʔ a ɡ a l̪ a m	135
அகழி	ʔ a ɡ a ɻ i	11
அகவன்மகள்	ʔ a ɡ a ʋ a n m a ɡ a ɭ	0
அக்கச்சி	ʔ a kː a t͡ʃː i	1
அக்கா	ʔ a kː aː	595
அக்காமார்	ʔ a kː aː m aː ɾ̪	3
அக்காள்	ʔ a kː aː ɭ	77
அக்கினி	ʔ a kː i n i	43
அக்கினிகர்ப்பம்	ʔ a kː i n i ɡ a ɾ̪ pː a m	0
அக்கினிகுண்டம்	ʔ a kː i n i ɡ u ɳ ɖ a m	0
அக்கினிகோத்திரம்	ʔ a kː i n i ɡ oː t̪ː i ɾ̪ a m	0
அக்கினிச்சுவாலை	ʔ a kː i n i t͡ʃː u ʋ aː l̪ a ɪ̯	0
அக்கினித்தம்பம்	ʔ a kː i n i t̪ː a m b a m	0
அக்கினியாஸ்திரம்	ʔ a kː i n i j aː s t̪ i ɾ̪ a m	0
அக்கு	ʔ a kː u	18
அக்குள்	ʔ a kː u ɭ	12
அக்கை	ʔ a kː a ɪ̯	1
அக்கைச்சி	ʔ a kː a ɪ̯ t͡ʃː i	0
அங்கம்	ʔ a ŋ ɡ a m	397
அங்குலி	ʔ a ŋ ɡ u l̪ i	0
அஞ்ஞை	ʔ a ɲː a ɪ̯	0
அடங்கு	ʔ a ɖ a ŋ ɡ u	2
அடவி	ʔ a ɖ a ʋ i	0
அடி	ʔ a ɖ i	2080
அடிகேயா	ʔ a ɖ i ɡ eː j aː	0
அடிக்கடி	ʔ a ɖ i kː a ɖ i	2097
அடித்தளம்	ʔ a ɖ i t̪ː a ɭ a m	104
அடிமை	ʔ a ɖ i m a ɪ̯	322
அடுத்த	ʔ a ɖ u t̪ː a	6548
அடுப்பு	ʔ a ɖ u pː u	69
அடைக்காய்	ʔ a ɖ a ɪ̯ kː aː j	0
அட்டை	ʔ a ʈː a ɪ̯	425
அணிகம்	ʔ a ɳ i ɡ a m	0
அணில்	ʔ a ɳ i l̪	63
அணு	ʔ a ɳ u	1293
அண்டை	ʔ a ɳ ɖ a ɪ̯	223
அண்ணன்	ʔ a ɳː a n	799
அண்ணா	ʔ a ɳː aː	1503
அண்ணி	ʔ a ɳː i	91
அதிகாரம்	ʔ a d̪ i ɡ aː ɾ̪ a m	690
அது	ʔ a d̪ u	20129
அத்தியாபகன்	ʔ a t̪ː i j aː b a ɡ a n	0
அத்தை	ʔ a t̪ː a ɪ̯	399
அனுபவம்	ʔ a n u b a ʋ a m	1094
அனுமன்	ʔ a n u m a n	117
அன்னம்	ʔ a nː a m	84
அன்பளிப்பு	ʔ a n p a ɭ i pː u	34
அன்பு	ʔ a n p u	1183
அப்பம்	ʔ a pː a m	25
அப்பா	ʔ a pː aː	3401
அப்பால்	ʔ a pː aː l̪	455
அப்புறம்	ʔ a pː u r a m	1373
அமிர்தம்	ʔ a m i ɾ̪ t̪ a m	49
அமெரிக்கா	ʔ a m e ɾ̪ i kː aː	1833
அமைதி	ʔ a m a ɪ̯ t̪ i	764
அமையம்	ʔ a m a ɪ̯ j a m	1
அம்மா	ʔ a mː aː	4381
அம்மாய்	ʔ a mː aː j	0
அயோத்தி	ʔ a j oː t̪ː i	85
அரசன்	ʔ a ɾ̪ a s a n	337
அரசாங்கம்	ʔ a ɾ̪ a s aː ŋ ɡ a m	1402
அரசு	ʔ a ɾ̪ a s u	11142
அரவிந்தம்	ʔ a ɾ̪ a ʋ i n̪ d̪ a m	2
அரிசி	ʔ a ɾ̪ i s i	1320
அரிவாள்	ʔ a ɾ̪ i ʋ aː ɭ	68
அரிவாள்மணை	ʔ a ɾ̪ i ʋ aː ɭ m a ɳ a ɪ̯	1
அருகு	ʔ a ɾ̪ u ɡ u	1
அரைநெல்லி	ʔ a ɾ̪ a ɪ̯ n̪ e l̪ː i	0
அர்ஜுனன்	ʔ a ɾ̪ d͡ʑ u n a n	64
அறிவாய்வியல்	ʔ a r i ʋ aː j ʋ i j a l̪	0
அறிவி	ʔ a r i ʋ i	6
அறிவியல்	ʔ a r i ʋ i j a l̪	2077
அறிவு	ʔ a r i ʋ u	1299
அறுகோணம்	ʔ a r u ɡ oː ɳ a m	1
அறை	ʔ a r a ɪ̯	655
அற்பகதம்	ʔ a r p a ɡ a d̪ a m	0
அலகு	ʔ a l̪ a ɡ u	51
அலுவல்	ʔ a l̪ u ʋ a l̪	55
அலை	ʔ a l̪ a ɪ̯	450
அலைப்	ʔ a l̪ a ɪ̯ p	8
அலைப்பு	ʔ a l̪ a ɪ̯ pː u	1
அலைப்பேசி	ʔ a l̪ a ɪ̯ pː eː s i	0
அல்	ʔ a l̪	296
அளவை	ʔ a ɭ a ʋ a ɪ̯	304
அளி	ʔ a ɭ i	3
அளேரியம்	ʔ a ɭ eː ɾ̪ i j a m	0
அழிவு	ʔ a ɻ i ʋ u	159
அழு	ʔ a ɻ u	8
அவசியம்	ʔ a ʋ a s i j a m	1746
அவதாரம்	ʔ a ʋ a d̪ aː ɾ̪ a m	164
அவதி	ʔ a ʋ a d̪ i	66
அவன்	ʔ a ʋ a n	14283
அவரை	ʔ a ʋ a ɾ̪ a ɪ̯	3782
அவல்	ʔ a ʋ a l̪	44
அவள்	ʔ a ʋ a ɭ	10388
அவுஸ்திரேலியா	ʔ a ʋ u s t̪ i ɾ̪ eː l̪ i j aː	109
அவை	ʔ a ʋ a ɪ̯	3846
ஆ	ʔ aː	725
ஆக்கம்	ʔ aː kː a m	95
ஆங்கிலம்	ʔ aː ŋ ɡ i l̪ a m	594
ஆடம்பரம்	ʔ aː ɖ a m b a ɾ̪ a m	25
ஆடல்	ʔ aː ɖ a l̪	52
ஆடு	ʔ aː ɖ u	335
ஆடை	ʔ aː ɖ a ɪ̯	468
ஆட்சி	ʔ aː ʈ t͡ʃ i	1559
ஆட்டன்	ʔ aː ʈː a n	1
ஆட்டுப்பால்	ʔ aː ʈː u pː aː l̪	5
ஆணவம்	ʔ aː ɳ a ʋ a m	64
ஆண்	ʔ aː ɳ	1455
ஆண்குறி	ʔ aː ɳ k u r i	15
ஆண்டவன்	ʔ aː ɳ ɖ a ʋ a n	142
ஆண்டு	ʔ aː ɳ ɖ u	8597
ஆண்பால்	ʔ aː ɳ p aː l̪	19
ஆதாம்	ʔ aː d̪ aː m	31
ஆந்தை	ʔ aː n̪ d̪ a ɪ̯	23
ஆபரணம்	ʔ aː b a ɾ̪ a ɳ a m	20
ஆபிச்	ʔ aː b i t͡ʃ	0
ஆமை	ʔ aː m a ɪ̯	93
ஆயர்	ʔ aː j a ɾ̪	51
ஆயிரம்	ʔ aː j i ɾ̪ a m	5097
ஆயுதம்	ʔ aː j u d̪ a m	349
ஆய்	ʔ aː j	13
ஆய்வு	ʔ aː j ʋ u	2065
ஆரம்	ʔ aː ɾ̪ a m	47
ஆர்த்தி	ʔ aː ɾ̪ t̪ː i	48
ஆர்மீனியா	ʔ aː ɾ̪ m iː n i j aː	2
ஆறு	ʔ aː r u	2249
ஆளி	ʔ aː ɭ i	2
ஆள்	ʔ aː ɭ	977
ஆழிப்பேரலை	ʔ aː ɻ i pː eː ɾ̪ a l̪ a ɪ̯	6
ஆவல்	ʔ aː ʋ a l̪	162
ஆஸ்திரேலியா	ʔ aː s t̪ i ɾ̪ eː l̪ i j aː	602
இ	ʔ i	748
இங்குஷேத்தியா	ʔ i ŋ ɡ u ʂ eː t̪ː i j aː	0
இங்கே	ʔ i ŋ ɡ eː	3111
இசை	ʔ i s a ɪ̯	1772
இசைக்கருவி	ʔ i s a ɪ̯ kː a ɾ̪ u ʋ i	14
இசைப்பாட்டு	ʔ i s a ɪ̯ pː aː ʈː u	2
இசைவு	ʔ i s a ɪ̯ ʋ u	30
இஞ்சி	ʔ i ɲ d͡ʑ i	189
இடி	ʔ i ɖ i	148
இடியப்பம்	ʔ i ɖ i j a pː a m	6
இடியாப்பம்	ʔ i ɖ i j aː pː a m	17
இடு	ʔ i ɖ u	15
இடுப்பு	ʔ i ɖ u pː u	113
இடையினம்	ʔ i ɖ a ɪ̯ j i n a m	1
இட்டம்	ʔ i ʈː a m	2
இட்டு	ʔ i ʈː u	236
இட்லி	ʔ i ʈ l̪ i	201
இணை	ʔ i ɳ a ɪ̯	527
இதயம்	ʔ i d̪ a j a m	520
இது	ʔ i d̪ u	23361
இந்தி	ʔ i n̪ d̪ i	544
இந்தியர்	ʔ i n̪ d̪ i j a ɾ̪	191
இந்தியா	ʔ i n̪ d̪ i j aː	5744
இந்து	ʔ i n̪ d̪ u	2324
இனப்படுகொலை	ʔ i n a pː a ɖ u ɡ o l̪ a ɪ̯	51
இனம்	ʔ i n a m	735
இன்பம்	ʔ i n p a m	287
இன்று	ʔ i n r u	13104
இப்போது	ʔ i pː oː d̪ u	7372
இயங்குதளம்	ʔ i j a ŋ ɡ u d̪ a ɭ a m	12
இயம்	ʔ i j a m	0
இயல்	ʔ i j a l̪	227
இயல்பு	ʔ i j a l̪ p u	410
இயல்புகணம்	ʔ i j a l̪ p u ɡ a ɳ a m	0
இயேசு	ʔ i j eː s u	135
இரசாயனம்	ʔ i ɾ̪ a s aː j a n a m	9
இரண்டு	ʔ i ɾ̪ a ɳ ɖ u	11103
இரவு	ʔ i ɾ̪ a ʋ u	3266
இராகம்	ʔ i ɾ̪ aː ɡ a m	8
இராசகுமாரி	ʔ i ɾ̪ aː s a ɡ u m aː ɾ̪ i	0
இராசி	ʔ i ɾ̪ aː s i	0
இராமாயணம்	ʔ i ɾ̪ aː m aː j a ɳ a m	45
இரு	ʔ i ɾ̪ u	4975
இருபால்சேர்க்கை	ʔ i ɾ̪ u b aː l̪ t͡ʃ eː ɾ̪ kː a ɪ̯	0
இருமல்	ʔ i ɾ̪ u m a l̪	100
இரும்பு	ʔ i ɾ̪ u m b u	532
இரை	ʔ i ɾ̪ a ɪ̯	55
இரைப்பை	ʔ i ɾ̪ a ɪ̯ pː a ɪ̯	13
இறகு	ʔ i r a ɡ u	33
இறக்கை	ʔ i r a kː a ɪ̯	58
இறால்	ʔ i r aː l̪	101
இறைச்சி	ʔ i r a ɪ̯ t͡ʃː i	168
இலக்கணம்	ʔ i l̪ a kː a ɳ a m	169
இலக்கிய	ʔ i l̪ a kː i j a	2624
இலக்கியம்	ʔ i l̪ a kː i j a m	1272
இலக்கு	ʔ i l̪ a kː u	541
இலங்கை	ʔ i l̪ a ŋ ɡ a ɪ̯	4208
இலட்சம்	ʔ i l̪ a ʈ t͡ʃ a m	194
இலட்சுமணன்	ʔ i l̪ a ʈ t͡ʃ u m a ɳ a n	17
இலத்தீன்	ʔ i l̪ a t̪ː iː n	37
இலவசம்	ʔ i l̪ a ʋ a s a m	133
இலை	ʔ i l̪ a ɪ̯	368
இல்	ʔ i l̪	1490
இல்லகம்	ʔ i l̪ː a ɡ a m	0
இல்லக்கிழத்தி	ʔ i l̪ː a kː i ɻ a t̪ː i	0
இல்லத்தரசி	ʔ i l̪ː a t̪ː a ɾ̪ a s i	9
இல்லம்	ʔ i l̪ː a m	221
இல்லாள்	ʔ i l̪ː aː ɭ	6
இல்லை	ʔ i l̪ː a ɪ̯	17217
இள	ʔ i ɭ a	64
இளநீர்	ʔ i ɭ a n̪ iː ɾ̪	93
இழப்பு	ʔ i ɻ a pː u	639
இஸ்லாமாபாத்	ʔ i s l̪ aː m aː b aː t̪	57
ஈ	ʔ iː	638
ஈகை	ʔ iː ɡ a ɪ̯	6
ஈடு	ʔ iː ɖ u	363
ஈட்டு	ʔ iː ʈː u	0
ஈனில்	ʔ iː n i l̪	0
ஈரல்	ʔ iː ɾ̪ a l̪	23
ஈழம்	ʔ iː ɻ a m	82
உ	ʔ u	92
உஃப	ʔ u f a	0
உகளம்	ʔ u ɡ a ɭ a m	0
உசுபெக்கிசுத்தான்	ʔ u s u b e kː i s u t̪ː aː n	0
உச்சரிப்பு	ʔ u t͡ʃː a ɾ̪ i pː u	57
உச்சி	ʔ u t͡ʃː i	144
உடம்பு	ʔ u ɖ a m b u	555
உடல்	ʔ u ɖ a l̪	3327
உடுக்கை	ʔ u ɖ u kː a ɪ̯	27
உணவு	ʔ u ɳ a ʋ u	2664
உண்	ʔ u ɳ	20
உண்மை	ʔ u ɳ m a ɪ̯	2624
உதடு	ʔ u d̪ a ɖ u	64
உதவி	ʔ u d̪ a ʋ i	2773
உதவு	ʔ u d̪ a ʋ u	6
உத்தரி	ʔ u t̪ː a ɾ̪ i	1
உன்	ʔ u n	4970
உப்பு	ʔ u pː u	706
உம்	ʔ u m	133
உயரம்	ʔ u j a ɾ̪ a m	415
உயிரணு	ʔ u j i ɾ̪ a ɳ u	3
உயிரியல்	ʔ u j i ɾ̪ i j a l̪	217
உயிரிழப்பு	ʔ u j i ɾ̪ i ɻ a pː u	40
உயிரெழுத்து	ʔ u j i ɾ̪ e ɻ u t̪ː u	11
உயிர்	ʔ u j i ɾ̪	1869
உயிர்த்தெழு	ʔ u j i ɾ̪ t̪ː e ɻ u	0
உயிர்வேதியியல்	ʔ u j i ɾ̪ ʋ eː d̪ i j i j a l̪	5
உரிமை	ʔ u ɾ̪ i m a ɪ̯	1697
உருசியா	ʔ u ɾ̪ u s i j aː	1
உரை	ʔ u ɾ̪ a ɪ̯	630
உரோம்	ʔ u ɾ̪ oː m	0
உறக்கம்	ʔ u r a kː a m	141
உலகம்	ʔ u l̪ a ɡ a m	2287
உலோகம்	ʔ u l̪ oː ɡ a m	73
உளவு	ʔ u ɭ a ʋ u	177
உள்	ʔ u ɭ	657
உள்ளங்கை	ʔ u ɭː a ŋ ɡ a ɪ̯	53
உழவர்	ʔ u ɻ a ʋ a ɾ̪	144
உழவு	ʔ u ɻ a ʋ u	71
உவமை	ʔ u ʋ a m a ɪ̯	70
உவர்மம்	ʔ u ʋ a ɾ̪ m a m	0
ஊடகம்	ʔ uː ɖ a ɡ a m	88
ஊட்டி	ʔ uː ʈː i	222
ஊதியம்	ʔ uː d̪ i j a m	217
ஊது	ʔ uː d̪ u	7
ஊத்தப்பம்	ʔ uː t̪ː a pː a m	9
ஊனம்	ʔ uː n a m	39
ஊர்	ʔ uː ɾ̪	1756
ஊர்காவல்	ʔ uː ɾ̪ k aː ʋ a l̪	5
ஊர்க்கதை	ʔ uː ɾ̪ kː a d̪ a ɪ̯	11
ஊர்வன	ʔ uː ɾ̪ ʋ a n a	15
ஊறுகாய்	ʔ uː r u ɡ aː j	57
ஊற்று	ʔ uː ʈː ɾ u	53
ஊழல்	ʔ uː ɻ a l̪	808
எஃகு	ʔ e ɡ u	21
எங்கே	ʔ e ŋ ɡ eː	1468
எசுத்தோனியா	ʔ e s u t̪ː oː n i j aː	0
எடு	ʔ e ɖ u	48
எட்டு	ʔ e ʈː u	1084
எண்ணங்கள்	ʔ e ɳː a ŋ ɡ a ɭ	310
எண்ணம்	ʔ e ɳː a m	1311
எதிர்பால்சேர்க்கை	ʔ e d̪ i ɾ̪ p aː l̪ t͡ʃ eː ɾ̪ kː a ɪ̯	0
என்	ʔ e n	21556
என்ன	ʔ e nː a	13327
எப்படி	ʔ e pː a ɖ i	6540
எமன்	ʔ e m a n	45
எரி	ʔ e ɾ̪ i	70
எரிமலை	ʔ e ɾ̪ i m a l̪ a ɪ̯	116
எருது	ʔ e ɾ̪ u d̪ u	18
எருமை	ʔ e ɾ̪ u m a ɪ̯	106
எறும்பு	ʔ e r u m b u	55
எற்பாடு	ʔ e r p aː ɖ u	4
எலி	ʔ e l̪ i	165
எலும்பு	ʔ e l̪ u m b u	148
எழுது	ʔ e ɻ u d̪ u	74
எழுத்து	ʔ e ɻ u t̪ː u	1121
எழுவாய்	ʔ e ɻ u ʋ aː j	8
எஸ்பெராண்டோ	ʔ e s p e ɾ̪ aː ɳ ɖ oː	0
ஏ	ʔ eː	1605
ஏணி	ʔ eː ɳ i	22
ஏன்	ʔ eː n	4839
ஏப்ரல்	ʔ eː p ɾ̪ a l̪	1455
ஏரி	ʔ eː ɾ̪ i	170
ஏலக்காய்	ʔ eː l̪ a kː aː j	267
ஏலம்	ʔ eː l̪ a m	492
ஏழு	ʔ eː ɻ u	1328
ஏவாள்	ʔ eː ʋ aː ɭ	22
ஐ	ʔ a ɪ̯	1438
ஐதரசன்	ʔ a ɪ̯ t̪ a ɾ̪ a s a n	3
ஐநூறு	ʔ a ɪ̯ n̪ uː r u	117
ஐந்து	ʔ a ɪ̯ n̪ d̪ u	2930
ஐம்பது	ʔ a ɪ̯ m b a d̪ u	538
ஐம்பொன்	ʔ a ɪ̯ m b o n	19
ஐயம்	ʔ a ɪ̯ j a m	199
ஐரோப்பா	ʔ a ɪ̯ ɾ̪ oː pː aː	202
ஒ	ʔ o	52
ஒகையோ	ʔ o ɡ a ɪ̯ j oː	0
ஒடி	ʔ o ɖ i	29
ஒட்டகம்	ʔ o ʈː a ɡ a m	38
ஒன்பது	ʔ o n p a d̪ u	772
ஒன்று	ʔ o n r u	6995
ஒரு	ʔ o ɾ̪ u	92398
ஒற்றுமை	ʔ o ʈː ɾ u m a ɪ̯	272
ஒலி	ʔ o l̪ i	600
ஒளி	ʔ o ɭ i	850
ஒழுக்கம்	ʔ o ɻ u kː a m	222
ஒவ்வாமை	ʔ o ʋː aː m a ɪ̯	42
ஓ	ʔ oː	679
ஓடம்	ʔ oː ɖ a m	15
ஓடு	ʔ oː ɖ u	112
ஓடை	ʔ oː ɖ a ɪ̯	33
ஓட்டல்	ʔ oː ʈː a l̪	372
ஓது	ʔ oː d̪ u	2
ஓநாய்	ʔ oː n̪ aː j	36
ஔ	ʔ a ʊ̯	3
ஔடதம்	ʔ a ʊ̯ ʈ a d̪ a m	1
ககனம்	k a ɡ a n a m	0
கங்கு	k a ŋ ɡ u	13
கஞ்சாவை	k a ɲ d͡ʑ aː ʋ a ɪ̯	8
கடற்கரை	k a ɖ a r k a ɾ̪ a ɪ̯	448
கடல்	k a ɖ a l̪	1688
கடல்நீர்	k a ɖ a l̪ n̪ iː ɾ̪	31
கடவுள்	k a ɖ a ʋ u ɭ	1660
கடி	k a ɖ i	38
கடிகாரம்	k a ɖ i ɡ aː ɾ̪ a m	85
கடிதம்	k a ɖ i d̪ a m	1847
கடுங்கோபம்	k a ɖ u ŋ ɡ oː b a m	9
கடுதாசி	k a ɖ u d̪ aː s i	30
கடை	k a ɖ a ɪ̯	1088
கடைவாய்ப்பல்	k a ɖ a ɪ̯ ʋ aː j pː a l̪	1
கட்சி	k a ʈ t͡ʃ i	3030
கட்டில்	k a ʈː i l̪	174
கட்டு	k a ʈː u	191
கணம்	k a ɳ a m	412
கணவன்	k a ɳ a ʋ a n	1383
கணிதம்	k a ɳ i d̪ a m	170
கணினி	k a ɳ i n i	544
கணையாழி	k a ɳ a ɪ̯ j aː ɻ i	91
கண்	k a ɳ	1645
கண்ணாடி	k a ɳː aː ɖ i	575
கண்ணீர்	k a ɳː iː ɾ̪	816
கண்மாய்	k a ɳ m aː j	48
கதவு	k a d̪ a ʋ u	474
கதை	k a d̪ a ɪ̯	4219
கத்தரிக்காய்	k a t̪ː a ɾ̪ i kː aː j	64
கத்தி	k a t̪ː i	286
கத்திரி	k a t̪ː i ɾ̪ i	22
கத்திரிக்காய்	k a t̪ː i ɾ̪ i kː aː j	32
கந்தகம்	k a n̪ d̪ a ɡ a m	10
கனடா	k a n a ɖ aː	1235
கன்னடம்	k a nː a ɖ a m	88
கன்னம்	k a nː a m	50
கன்று	k a n r u	61
கப்பல்	k a pː a l̪	821
கமலம்	k a m a l̪ a m	62
கயிறு	k a j i r u	186
கரடி	k a ɾ̪ a ɖ i	82
கரண்டி	k a ɾ̪ a ɳ ɖ i	102
கரி	k a ɾ̪ i	65
கரிமம்	k a ɾ̪ i m a m	0
கரு	k a ɾ̪ u	296
கருப்பு	k a ɾ̪ u pː u	398
கருப்பை	k a ɾ̪ u pː a ɪ̯	44
கருமம்	k a ɾ̪ u m a m	16
கருமையான	k a ɾ̪ u m a ɪ̯ j aː n a	7
கரும்பு	k a ɾ̪ u m b u	430
கருவி	k a ɾ̪ u ʋ i	325
கர்த்தர்	k a ɾ̪ t̪ː a ɾ̪	34
கர்நாடகம்	k a ɾ̪ n̪ aː ɖ a ɡ a m	63
கறவை	k a r a ʋ a ɪ̯	25
கறி	k a r i	134
கறுவா	k a r u ʋ aː	3
கற்பூரம்	k a r p uː ɾ̪ a m	51
கலகம்	k a l̪ a ɡ a m	96
கலம்	k a l̪ a m	26
கலயம்	k a l̪ a j a m	6
கலை	k a l̪ a ɪ̯	1742
கலைக்களஞ்சியம்	k a l̪ a ɪ̯ kː a ɭ a ɲ d͡ʑ i j a m	12
கலைச்சொல்	k a l̪ a ɪ̯ t͡ʃː o l̪	9
கலைஞர்	k a l̪ a ɪ̯ ɲ a ɾ̪	890
கல்	k a l̪	529
கல்யாணம்	k a l̪ j aː ɳ a m	1341
கல்லீரல்	k a l̪ː iː ɾ̪ a l̪	51
கல்வி	k a l̪ ʋ i	2822
கல்விக்கூடம்	k a l̪ ʋ i kː uː ɖ a m	4
களம்	k a ɭ a m	383
களவு	k a ɭ a ʋ u	81
களை	k a ɭ a ɪ̯	902
கள்ளம்	k a ɭː a m	15
கழித்தல்	k a ɻ i t̪ː a l̪	16
கழுவு	k a ɻ u ʋ u	2
கவிஞர்	k a ʋ i ɲ a ɾ̪	1390
கவிதை	k a ʋ i d̪ a ɪ̯	2788
காகம்	k aː ɡ a m	86
காகிதம்	k aː ɡ i d̪ a m	110
காக்கை	k aː kː a ɪ̯	74
காசு	k aː s u	1140
காடு	k aː ɖ u	282
காடைக்கண்ணி	k aː ɖ a ɪ̯ kː a ɳː i	0
காதணி	k aː d̪ a ɳ i	10
காதல்	k aː d̪ a l̪	2593
காது	k aː d̪ u	388
காந்தம்	k aː n̪ d̪ a m	22
கானலி	k aː n a l̪ i	1
காபி	k aː b i	770
காபூல்	k aː b uː l̪	36
காப்ச்சா	k aː p t͡ʃː aː	0
காப்பியம்	k aː pː i j a m	46
காமம்	k aː m a m	252
காய்	k aː j	209
காய்கறி	k aː j k a r i	439
காரம்	k aː ɾ̪ a m	60
காராமணி	k aː ɾ̪ aː m a ɳ i	4
கார்த்தூம்	k aː ɾ̪ t̪ː uː m	0
கார்மம்	k aː ɾ̪ m a m	0
காறையெலும்பு	k aː r a ɪ̯ j e l̪ u m b u	0
காற்றழுத்தமானி	k aː ʈː ɾ a ɻ u t̪ː a m aː n i	0
காற்று	k aː ʈː ɾ u	892
காலணி	k aː l̪ a ɳ i	38
காலம்	k aː l̪ a m	4021
காலை	k aː l̪ a ɪ̯	4496
கால்	k aː l̪	1720
காளான்	k aː ɭ aː n	52
காளை	k aː ɭ a ɪ̯	125
காவல்	k aː ʋ a l̪	1516
காவு	k aː ʋ u	68
கிட்ட	k i ʈː a	469
கித்தார்	k i t̪ː aː ɾ̪	4
கிராம்பு	k i ɾ̪ aː m b u	43
கிருட்டிணன்	k i ɾ̪ u ʈː i ɳ a n	11
கிரேக்கம்	k i ɾ̪ eː kː a m	13
கிறிஸ்துமஸ்	k i r i s t̪ u m a s	219
கிளவி	k i ɭ a ʋ i	6
கிளி	k i ɭ i	142
கிளிமெண்டி	k i ɭ i m e ɳ ɖ i	0
கிளை	k i ɭ a ɪ̯	422
கிழக்கு	k i ɻ a kː u	1256
கிழங்கு	k i ɻ a ŋ ɡ u	143
கிழவன்	k i ɻ a ʋ a n	174
கிழவி	k i ɻ a ʋ i	242
கீழே	k iː ɻ eː	2865
கீழ்	k iː ɻ	2182
குங்குமப்பூ	k u ŋ ɡ u m a pː uː	23
குங்குமம்	k u ŋ ɡ u m a m	80
குஞ்சி	k u ɲ d͡ʑ i	0
குடம்	k u ɖ a m	75
குடல்வால்	k u ɖ a l̪ ʋ aː l̪	1
குடி	k u ɖ i	404
குடிசை	k u ɖ i s a ɪ̯	213
குடிநீர்	k u ɖ i n̪ iː ɾ̪	609
குடில்	k u ɖ i l̪	44
குடும்பம்	k u ɖ u m b a m	1094
குடை	k u ɖ a ɪ̯	147
குட்டி	k u ʈː i	523
குணம்	k u ɳ a m	496
குண்டம்	k u ɳ ɖ a m	22
குண்டி	k u ɳ ɖ i	11
குதிரை	k u d̪ i ɾ̪ a ɪ̯	545
குன்றின்	k u n r i n	46
குன்று	k u n r u	30
குப்பி	k u pː i	23
குமாரத்தி	k u m aː ɾ̪ a t̪ː i	3
குமாரன்	k u m aː ɾ̪ a n	21
குமார்	k u m aː ɾ̪	917
குமிழி	k u m i ɻ i	10
கும்பிடு	k u m b i ɖ u	41
குயவன்	k u j a ʋ a n	20
குரங்கு	k u ɾ̪ a ŋ ɡ u	192
குரல்	k u ɾ̪ a l̪	2407
குரல்வளை	k u ɾ̪ a l̪ ʋ a ɭ a ɪ̯	6
குரு	k u ɾ̪ u	927
குருகுலம்	k u ɾ̪ u ɡ u l̪ a m	14
குருடன்	k u ɾ̪ u ɖ a n	65
குருடு	k u ɾ̪ u ɖ u	14
குருதி	k u ɾ̪ u d̪ i	93
குருத்து	k u ɾ̪ u t̪ː u	20
குறங்கு	k u r a ŋ ɡ u	1
குறி	k u r i	364
குறுமை	k u r u m a ɪ̯	0
குலம்	k u l̪ a m	139
குலை	k u l̪ a ɪ̯	36
குள்ளம்	k u ɭː a m	1
குழி	k u ɻ i	140
குழிவு	k u ɻ i ʋ u	0
குவளை	k u ʋ a ɭ a ɪ̯	66
குவார்ட்சு	k u ʋ aː ɾ̪ ʈ t͡ʃ u	0
குவியம்	k u ʋ i j a m	12
குவியல்	k u ʋ i j a l̪	45
கூகை	k uː ɡ a ɪ̯	12
கூடம்	k uː ɖ a m	140
கூடாரத்தில்	k uː ɖ aː ɾ̪ a t̪ː i l̪	23
கூடு	k uː ɖ u	142
கூடை	k uː ɖ a ɪ̯	72
கூட்டம்	k uː ʈː a m	2670
கூட்டல்	k uː ʈː a l̪	33
கூத்தாட	k uː t̪ː aː ɖ a	4
கூத்து	k uː t̪ː u	141
கூனைப்பூ	k uː n a ɪ̯ pː uː	0
கூரைவீடு	k uː ɾ̪ a ɪ̯ ʋ iː ɖ u	3
கூறு	k uː r u	164
கூறை	k uː r a ɪ̯	11
கூலம்	k uː l̪ a m	0
கூளி	k uː ɭ i	0
கெட்ட	k e ʈː a	579
கேரளம்	k eː ɾ̪ a ɭ a m	64
கை	k a ɪ̯	2188
கைப்பை	k a ɪ̯ pː a ɪ̯	21
கொக்கு	k o kː u	36
கொசு	k o s u	99
கொஞ்சம்	k o ɲ d͡ʑ a m	4574
கொண்டாட்டம்	k o ɳ ɖ aː ʈː a m	171
கொம்பு	k o m b u	76
கொள்ளை	k o ɭː a ɪ̯	848
கொழும்பு	k o ɻ u m b u	769
கோ	k oː	424
கோடரி	k oː ɖ a ɾ̪ i	16
கோடி	k oː ɖ i	8199
கோடிமுனை	k oː ɖ i m u n a ɪ̯	0
கோட்டம்	k oː ʈː a m	30
கோட்டை	k oː ʈː a ɪ̯	494
கோணவியல்	k oː ɳ a ʋ i j a l̪	1
கோபம்	k oː b a m	1166
கோபுரம்	k oː b u ɾ̪ a m	160
கோப்பை	k oː pː a ɪ̯	1218
கோமான்	k oː m aː n	17
கோமி	k oː m i	1
கோயம்புத்தூர்	k oː j a m b u t̪ː uː ɾ̪	1387
கோயில்	k oː j i l̪	2541
கோழி	k oː ɻ i	325
கோவைக்காய்	k oː ʋ a ɪ̯ kː aː j	0
சகோதரி	t͡ʃ a ɡ oː d̪ a ɾ̪ i	215
சக்கரை	t͡ʃ a kː a ɾ̪ a ɪ̯	36
சங்கம்	t͡ʃ a ŋ ɡ a m	1052
சட்டி	t͡ʃ a ʈː i	27
சட்டை	t͡ʃ a ʈː a ɪ̯	413
சட்னி	t͡ʃ a ʈ n i	40
சணல்	t͡ʃ a ɳ a l̪	44
சண்டை	t͡ʃ a ɳ ɖ a ɪ̯	930
சதுரங்கம்	t͡ʃ a d̪ u ɾ̪ a ŋ ɡ a m	14
சத்தியம்	t͡ʃ a t̪ː i j a m	180
சந்தனம்	t͡ʃ a n̪ d̪ a n a m	68
சந்திப்பு	t͡ʃ a n̪ d̪ i pː u	613
சனி	t͡ʃ a n i	405
சப்பாத்தி	t͡ʃ a pː aː t̪ː i	74
சப்போட்டா	t͡ʃ a pː oː ʈː aː	12
சமசுகிருதம்	t͡ʃ a m a s u ɡ i ɾ̪ u d̪ a m	8
சமயம்	t͡ʃ a m a j a m	2025
சமோசா	t͡ʃ a m oː s aː	13
சம்பளம்	t͡ʃ a m b a ɭ a m	829
சரி	t͡ʃ a ɾ̪ i	4005
சர்க்கரை	t͡ʃ a ɾ̪ kː a ɾ̪ a ɪ̯	1607
சலவைக்காரர்	t͡ʃ a l̪ a ʋ a ɪ̯ kː aː ɾ̪ a ɾ̪	0
சாதம்	t͡ʃ aː d̪ a m	202
சாப்பாட்டுக்கடை	t͡ʃ aː pː aː ʈː u kː a ɖ a ɪ̯	7
சாம்பல்	t͡ʃ aː m b a l̪	231
சாயங்காலம்	t͡ʃ aː j a ŋ ɡ aː l̪ a m	104
சாறு	t͡ʃ aː r u	149
சாலி	t͡ʃ aː l̪ i	21
சாலை	t͡ʃ aː l̪ a ɪ̯	1520
சாளரம்	t͡ʃ aː ɭ a ɾ̪ a m	20
சாவி	t͡ʃ aː ʋ i	124
சிகப்பு	t͡ʃ i ɡ a pː u	78
சிகரட்	t͡ʃ i ɡ a ɾ̪ a ʈ	58
சிகரம்	t͡ʃ i ɡ a ɾ̪ a m	95
சிங்கப்பூர்	t͡ʃ i ŋ ɡ a pː uː ɾ̪	821
சிங்கம்	t͡ʃ i ŋ ɡ a m	315
சிசு	t͡ʃ i s u	50
சிதறியம்	t͡ʃ i d̪ a r i j a m	0
சிநேகிதன்	t͡ʃ i n̪ eː ɡ i d̪ a n	40
சினை	t͡ʃ i n a ɪ̯	28
சினைப்பை	t͡ʃ i n a ɪ̯ pː a ɪ̯	1
சின்டி	t͡ʃ i n ʈ i	8
சின்ன	t͡ʃ i nː a	1898
சிரித்தை	t͡ʃ i ɾ̪ i t̪ː a ɪ̯	0
சிரிப்பு	t͡ʃ i ɾ̪ i pː u	579
சிற	t͡ʃ i r a	1
சிறகு	t͡ʃ i r a ɡ u	68
சிறுகதை	t͡ʃ i r u ɡ a d̪ a ɪ̯	721
சிறுநீரகம்	t͡ʃ i r u n̪ iː ɾ̪ a ɡ a m	68
சிறுமை	t͡ʃ i r u m a ɪ̯	27
சிறுவன்	t͡ʃ i r u ʋ a n	523
சிலந்தி	t͡ʃ i l̪ a n̪ d̪ i	74
சீக்கிரம்	t͡ʃ iː kː i ɾ̪ a m	486
சீடை	t͡ʃ iː ɖ a ɪ̯	5
சீரகம்	t͡ʃ iː ɾ̪ a ɡ a m	93
சீழ்	t͡ʃ iː ɻ	21
சுட்டாமுட்டி	t͡ʃ u ʈː aː m u ʈː i	0
சுட்டுவிரல்	t͡ʃ u ʈː u ʋ i ɾ̪ a l̪	8
சுண்டெலி	t͡ʃ u ɳ ɖ e l̪ i	13
சுண்ணம்	t͡ʃ u ɳː a m	2
சுதந்தரம்	t͡ʃ u d̪ a n̪ d̪ a ɾ̪ a m	13
சுந்தரம்	t͡ʃ u n̪ d̪ a ɾ̪ a m	448
சுனாமி	t͡ʃ u n aː m i	349
சுனை	t͡ʃ u n a ɪ̯	12
