ࢳ	ŋ	0
மெல்	m e l̪	25
மெல்லினம்	m e l̪ː i n a m	2
மெல்லிய	m e l̪ː i j a	581
மேகம்	m eː ɡ a m	124
மேசை	m eː s a ɪ̯	131
மேஜை	m eː d͡ʑ a ɪ̯	147
மேற்கு	m eː r k u	1048
மேலும்	m eː l̪ u m	12373
மேல்	m eː l̪	5528
மை	m a ɪ̯	277
மைதா	m a ɪ̯ t̪ aː	115
மொழி	m o ɻ i	2667
மொழிபெயர்ப்பு	m o ɻ i b e j a ɾ̪ pː u	378
மொழியியல்	m o ɻ i j i j a l̪	90
மோசம்	m oː s a m	106
மோதிரம்	m oː d̪ i ɾ̪ a m	87
யமன்	j a m a n	10
யானை	j aː n a ɪ̯	559
யாமம்	j aː m a m	5
யார்	j aː ɾ̪	3362
யுத்தம்	j u t̪ː a m	418
யோனி	j oː n i	20
ரகசியம்	ɾ̪ a ɡ a s i j a m	233
ரசம்	ɾ̪ a s a m	92
ரவை	ɾ̪ a ʋ a ɪ̯	82
ரஷ்யா	ɾ̪ a ʂ j aː	205
ருசரகம்	ɾ̪ u s a ɾ̪ a ɡ a m	0
ரூபாய்	ɾ̪ uː b aː j	7764
ரொட்டி	ɾ̪ o ʈː i	94
ரோகம்	ɾ̪ oː ɡ a m	8
ரோம்	ɾ̪ oː m	92
லக்ஷம்	l̪ a k ʂ a m	9
லட்சம்	l̪ a ʈ t͡ʃ a m	5181
லட்டு	l̪ a ʈː u	85
லாடம்	l̪ aː ɖ a m	17
லிஸ்பன்	l̪ i s p a n	5
லீக்டன்ஸ்டைன்	l̪ iː k ʈ a n s ʈ a ɪ̯ n	0
லுங்கி	l̪ u ŋ ɡ i	18
வகு	ʋ a ɡ u	1
வகுத்தல்	ʋ a ɡ u t̪ː a l̪	7
வகை	ʋ a ɡ a ɪ̯	1628
வங்காளதேசம்	ʋ a ŋ ɡ aː ɭ a d̪ eː s a m	20
வங்காளம்	ʋ a ŋ ɡ aː ɭ a m	57
வடக்கு	ʋ a ɖ a kː u	695
வடிவியல்	ʋ a ɖ i ʋ i j a l̪	10
வடை	ʋ a ɖ a ɪ̯	133
வடைப்பருப்பு	ʋ a ɖ a ɪ̯ pː a ɾ̪ u pː u	0
வணக்கம்	ʋ a ɳ a kː a m	532
வண்ணத்துப்பூச்சி	ʋ a ɳː a t̪ː u pː uː t͡ʃː i	16
வண்ணாத்திப்பூச்சி	ʋ a ɳː aː t̪ː i pː uː t͡ʃː i	2
வனம்	ʋ a n a m	106
வன்தங்கம்	ʋ a n t̪ a ŋ ɡ a m	0
வன்பொருள்	ʋ a n p o ɾ̪ u ɭ	6
வன்மை	ʋ a n m a ɪ̯	20
வன்வெள்ளி	ʋ a n ʋ e ɭː i	0
வம்சம்	ʋ a m t͡ʃ a m	125
வரவேற்கிறேன்	ʋ a ɾ̪ a ʋ eː r k i r eː n	44
வருகமஞ்சள்	ʋ a ɾ̪ u ɡ a m a ɲ d͡ʑ a ɭ	0
வருடம்	ʋ a ɾ̪ u ɖ a m	1958
வருணன்	ʋ a ɾ̪ u ɳ a n	27
வருஷம்	ʋ a ɾ̪ u ʂ a m	464
வரை	ʋ a ɾ̪ a ɪ̯	11482
வலி	ʋ a l̪ i	829
வலிப்பு	ʋ a l̪ i pː u	76
வல்லினம்	ʋ a l̪ː i n a m	10
வல்லை	ʋ a l̪ː a ɪ̯	3
வளமை	ʋ a ɭ a m a ɪ̯	46
வளம்	ʋ a ɭ a m	346
வளர்ச்சி	ʋ a ɭ a ɾ̪ t͡ʃː i	2736
வளையல்	ʋ a ɭ a ɪ̯ j a l̪	75
வழி	ʋ a ɻ i	3084
வா	ʋ aː	1035
வாக்காளர்	ʋ aː kː aː ɭ a ɾ̪	191
வாக்கியம்	ʋ aː kː i j a m	99
வாக்கு	ʋ aː kː u	546
வாந்தி	ʋ aː n̪ d̪ i	120
வானம்	ʋ aː n a m	372
வானவில்	ʋ aː n a ʋ i l̪	62
வானியல்	ʋ aː n i j a l̪	254
வாய்	ʋ aː j	977
வாரம்	ʋ aː ɾ̪ a m	2332
வார்த்தை	ʋ aː ɾ̪ t̪ː a ɪ̯	1268
வால்	ʋ aː l̪	213
வாள்	ʋ aː ɭ	143
வாழைப்பழம்	ʋ aː ɻ a ɪ̯ pː a ɻ a m	58
விடுவி	ʋ i ɖ u ʋ i	0
விண்கலம்	ʋ i ɳ k a l̪ a m	54
விண்ணுளவி	ʋ i ɳː u ɭ a ʋ i	97
விண்மீன்	ʋ i ɳ m iː n	152
விதை	ʋ i d̪ a ɪ̯	269
விதைப்பை	ʋ i d̪ a ɪ̯ pː a ɪ̯	1
விநாடி	ʋ i n̪ aː ɖ i	49
விந்து	ʋ i n̪ d̪ u	28
வினவு	ʋ i n a ʋ u	5
வினா	ʋ i n aː	117
வினை	ʋ i n a ɪ̯	139
வினைச்சொல்	ʋ i n a ɪ̯ t͡ʃː o l̪	2
வினைவியம்	ʋ i n a ɪ̯ ʋ i j a m	0
விமானம்	ʋ i m aː n a m	986
வியாழன்	ʋ i j aː ɻ a n	192
விரல்	ʋ i ɾ̪ a l̪	405
விரைவில்	ʋ i ɾ̪ a ɪ̯ ʋ i l̪	2712
விலங்கியல்	ʋ i l̪ a ŋ ɡ i j a l̪	84
விலங்கு	ʋ i l̪ a ŋ ɡ u	151
விலயம்	ʋ i l̪ a j a m	0
விலை	ʋ i l̪ a ɪ̯	12922
வில்	ʋ i l̪	392
விவசாயி	ʋ i ʋ a s aː j i	263
வீடு	ʋ iː ɖ u	3635
வீட்டுக்காரி	ʋ iː ʈː u kː aː ɾ̪ i	26
வெங்காயம்	ʋ e ŋ ɡ aː j a m	603
வெடிமருந்து	ʋ e ɖ i m a ɾ̪ u n̪ d̪ u	26
வெட்டுக்கிளி	ʋ e ʈː u kː i ɭ i	9
வெண்டை	ʋ e ɳ ɖ a ɪ̯	13
வெற்றிலை	ʋ e ʈː ɾ i l̪ a ɪ̯	179
வெல்லம்	ʋ e l̪ː a m	202
வெள்ளரி	ʋ e ɭː a ɾ̪ i	15
வெள்ளி	ʋ e ɭː i	1092
வேட்டி	ʋ eː ʈː i	222
வேதம்	ʋ eː d̪ a m	262
வேதியியல்	ʋ eː d̪ i j i j a l̪	132
வேப்பமரம்	ʋ eː pː a m a ɾ̪ a m	16
வேம்பு	ʋ eː m b u	38
வேர்	ʋ eː ɾ̪	168
வேர்வை	ʋ eː ɾ̪ ʋ a ɪ̯	24
வேறு	ʋ eː r u	7304
வேறுபாடு	ʋ eː r u b aː ɖ u	460
வேற்றுமை	ʋ eː ʈː ɾ u m a ɪ̯	128
வேலை	ʋ eː l̪ a ɪ̯	7774
வேலைக்காரன்	ʋ eː l̪ a ɪ̯ kː aː ɾ̪ a n	50
வேலையாள்	ʋ eː l̪ a ɪ̯ j aː ɭ	27
வைப்பு	ʋ a ɪ̯ pː u	127
வௌவால்	ʋ a ʊ̯ ʋ aː l̪	6
ஸ்தலம்	s t̪ a l̪ a m	26
ஸ்ரீ	s ɾ̪ iː	1019
ஹக்காசியா	h a kː aː s i j aː	0
ஹொங்கொங்	h o ŋ ɡ o ŋ	2
ா	a	24
ி	i	12
ீ	iː	5
ு	u	2
ூ	uː	0
ெ	e	77
ே	eː	66
ை	a i	8
