ހ	h
ހަނދު	h əⁿ d̪ u
ހަރިޔާނާ	h ə ɾ i j əː n əː
ހަތަރު	h ə t ə ɾ u
ހަތް	h ə t̪
ހަސްފަތާލު	h ə s̺ f ə t̪ əː l u
ހިންނަވަރު	h i n̪ː ə ʋ ə ɾ u
ހިރި	h i ɾ i
ހުޅުމާލެ	h u ɭ u m əː l e
ނ	n̪
ނައިފަރު	n̪ æː f ə ɾ u
ނަވާރަ	n̪ ə ʋ əː ɾ ə
ނަގަރު	n̪ ə ɡ ə ɾ u
ނާގަލޭންޑު	n əː ɡ ə l eː n̪ ɖ u
ނިއްރު	n i ɾː u
ނޮވެމްބަރު	n o ʋ e m b ə ɾ u
ރަށް	ɾ ə h
ރަށްވެހި	ɾ ə ʂ ʋ e h i
ރަދުން	ɾ ə d̪ u n̪
ރާހި	ɾ əː h i
ރާއްޖެ	ɾ əː d ʒː e
ރާދަ	ɾ əː d̪ ə
ރާޖަސްތާން	ɾ əː d͡ʒ ə s̺ t̪ əː n̪
ރިޔާޟިއްޔާތު	ɾ i j əː dˤ i jː əː t̪ u
ރުއް	ɾ u h
ރުފިޔާ	ɾ u f i j əː
ބަށި	b ə ʂ i
ބަނދަރު	b əⁿ d̪ ə ɾ u
ބަންޑާރައިން	b ə n d̪ əː ɾ æː n̪
ބައިސްކަލު	b æː s̺ k ə l u
ބައްޕަ	b ə pː ə
ބަޙްރައިން	b ə ħ ɾ æː n̪
ބާރަ	b əː ɾ ə
ބިހާރު	b i h əː ɾ u
ބިން	b i n̪
ބިސް	b i s̺
ބުވަނަ	b u ʋ ə n̪ ə
ބުދު	b u d̪ u
ބޭބެ	b eː b e
ކަރުކަށަ	k ə ɾ u k ə ʂ ə
ކަރްނާޓަކާ	k ə ɾ n̪ əː ʈ ə k əː
ކާންޏަ	k əː ɲː ə
ކާކު	k əː k i
ކާފޫރު	k əː f uː ɾ u
ކުންބަ	k u n̪ b ə
ކުރުނބާ	k u ɾ uᵐ b əː
ކުޅުދުއްފުށި	k u ɭ u d̪ u fː u ʂ i
ކްރޯރް	k ɾ oː ɾ
އަށާރަ	ə ʂ ə ɾ ə
އަނބު	əᵐ b u
އަންމަ	ə mː ə
އަވަށް	ə ʋ ə h
އަފަ	ə f ə
އަފްޣާނިސްތާން	ə f ɣ əː n̪ i s̺ t̪ əː n̪
އަތޮޅު	ə t̪ o ɭ u
އަލިފުބާ	ə l i f u b əː
އާފަލު	əː f ə l u
އާދިއްތަ	əː d̪ i t̪ː ə
އިރާގް	i ɾ əː ɡ
އިރު	i ɾ u
އިބަ	i b ə
އިސަބަ	i s̺ ə b ə
އިސްލާމް	i s̺ l ə m
އީސާގެފާނު	iː s̺ əː ɡ e f əː n u
އުއްތަރުކަންދު	u t̪ː ə ɾ u k ə n̪ d̪ u
އުތުރު	u t̪ u ɾ u
އެ	e
އެކެއް	e k e h
އެމެރިކާ	e m e ɾ i k əː
އެފްރިކާ	e f ɾ i k əː
އެގަރަ	e ɡ ə ɾ ə
އެޕްރީލް	e p ɾ i l
އޭޝިއާ	eː ʃ i əː
އޮނަތިރީސް	o n ə t̪ i ɾ iː s̺
އޮރިއްސާ	o ɾ i s̺ː əː
އޮޅުދޫކަރަ	o ɭ u d̪ uː k ə ɾ ə
އޮކްޓޫބަރު	o k ʈ uː b ə ɾ u
ވިރުސިކަ	ʋ i ɾ u s̺ i k ə
ވެހި	ʋ e h i
މަ	m ə
މަހާރާޝްތުރާ	m ə h əː ɾ əː ʃ t̪ u ɾ əː
މަނިޕޫރު	m ə n̪ i p uː ɾ u
މަކަރަ	m ə k ə ɾ ə
މަލިކު	m ə l i k u
މަސީހީދީން	m ə s̺ i h iː d̪ iː n̪
މަޑުލަ	m ə ɖ u l ə
މާރޗް	m əː ɾ t ʃ
މާދަރީ	m əː d̪ ə ɾ iː
މާތާޕިތާ	m əː t̪ əː p i t̪ əː
މި	m i
މިތުނަ	m i t̪ u n̪ ə
މިޔަރު	m i j ə ɾ u
މިޞްރު	m i sˤ ɾ u
މީންޏަ	m iː ɲ ɲ ə
މުންނާރު	m u n̪ː əː ɾ u
މޭސަ	m eː s̺ ə
ފަނަރަ	f ə n ə ɾ ə
ފަކުސަމަ	f ə k u s̺ ə m ə
ފައްޅި	f ə ɭː i
ފާލަން	f əː l ə n̪
ފުރާ	f u ɾ əː
ފުވައްމުލައް	f u ʋ ə mː u l e h
ފޫރުއްބަ	f uː ɾ u bː ə
ފެބްރުއަރީ	f e b r u ə ɾ iː
ދ	d̪
ދަނަ	d̪ ə n̪ ə
ދަރުމަ	d̪ ə ɾ u m ə
ދަރުޝަނަ	d̪ ə ɾ u ʃ ə n̪ ə
ދިއްދޫ	d̪ i d̪ː uː
ދިވެހިރާއްޖެ	d̪ i ʋ e h i ɾ əː d ʒː e
ދީން	d̪ iː n̪
ދުނިޔެ	d̪ u n̪ i j e
ދުއްކާނު	d̪ u kː əː n̪ u
ދުވަސް	d̪ u ʋ ə s̺
ދުވާފަރު	d̪ u ʋ əː f ə ɾ u
ދޫ	d̪ uː
ދެކުނު	d̪ e k u ɾ u
ތ	t̪
ތައިވާން	t̪ æː ʋ əː n̪
ތިނަދޫ	t̪ i n̪ ə d̪ uː
ތިރީސް	t̪ i ɾ iː s̺
ތުރިޕޫރާ	t̪ u ɾ i p uː ɾ aː
ތުލަ	t̪ u l ə
ތެޔޮ	t̪ e j o
ތޭރަ	t eː ɾ ə
ލިނބޯ	l iᵐ b oː
ލީބިޔާ	l iː b i j əː
ގަން	ɡ ə n̪
ގަސް	ɡ ə s̺
ގުރީންލޭންޑު	ɡ u ɾ iː n̪ l e n̪ ɖ u
ގުޖުރާތު	ɡ u d ʒ ɾ əː t̪
ގެ	ɡ e
ގޮމަށި	ɡ o m ə ʂ i
ޏަމްޏަމް	ɲ ə m ɲ ə m
ސ	s̺
ސަހަރު	s̺ ə h ə ɾ u
ސަތާރަ	s ə t əː ɾ ə
ސިންހަ	s̺ i n̪ h ə
ސީނުކަރަ	s̺ iː n̪ u k ə ɾ ə
ސުކުން	s̺ u k u n̪
ސެޕްޓެމްބަރު	s e p ʈ e m b ə ɾ u
ސޭބޫ	s̺ eː b uː
ސްކޫލު	s̺ k uː l u
ޑިސެމްބަރު	ɖ i s e m b ə ɾ u
ޒ	z̺
ޔަމަން	j ə m ə n̪
ޔޫރަޕު	j uː ɾ ə p u
ޕާކިސްތާން	p əː k i s̺ t̪ əː n̪
ޖަންގަލި	d͡ʒ ə n̪ ɡ ə l i
ޖަރްކަންދު	d͡ʒ ə ɾ k ə n̪ d̪ u
ޖުލައި	d ʒ u l æː
ޖެނުއަރީ	d ʒ e n u ə ɾ iː
ޝަހަރު	ʃ ə h ə ɾ u
ޝަރީޢަތް	ʃ ə ɾ iː ʕ ə t̪
ޝްރީ	ʃ ɾ iː
ޢަރަބި	ʕ ə ɾ ə b i
ޢުމާން	ʕ u m əː n̪
ޤުރުއާން	q u ɾ u əː n̪
