abas	a b a s
abuk	a b u k
achang	a t͡ʃ a ŋ
ai	a i ʔ
ai	a ɛ ʔ
ajar	a d͡ʒ a r
aki	a k i ʔ
alah	a l a h
amai	a m a i
amat	a m a t
ambi	a m b i ʔ
anang	a n a ŋ
anchur	a n t͡ʃ ʊ r
angat	a ŋ a t
angkat	a ŋ k a t
angus	a ŋ u s
apai	a p a i̯
aplikasyen	a p l i k a s j e n
aram	a r a m
arap	a r a p
asi	a s i
asi	a s i ʔ
ati	a t i
atmosfera	ə t m o s f e r a
awak	a w ə a k
awakka	a w ə a k k a
aya	a j a ʔ
bacha	b a t͡ʃ a
bagas	b a ɡ a s
bai	b a i ʔ
bajik	b a d͡ʒ i ə ʔ
baka	b a k a
bala	b a l a
banda	b a n d a
bansa	b a n s a
baruh	b a r u ə h
bateri	b a t ə r i
bejalai	b ə d͡ʒ a l a i
belaki	b ə l a k i
belanda	b ə l a n d a
belanda	b ə l a n d a ʔ
beli	b e l i ʔ
beli	b ə l i
bepeniri	b ə p ə n i r i ʔ
berandau	b ə r a n d a u
berap	b ə r a p
besentuk	b ə s ə n t u ʔ
betan	b ə t a n
betemu	b ə t ə m u
beterang	b ə t ə r ə a ŋ
bir	b i r
biro	b i r o
biru	b i r u
bisi	b i s i ʔ
blok	b l u ə k
bol	b u l
bom	b o m
buka	b u k a
bulih	b u l i ə h
bumai	b u m a i
bungai	b u ŋ a i
burak	b u r ə a k
butul	b u t u l
buyah	b u j a h
chabi	t͡ʃ a b i ʔ
chara	t͡ʃ a r a
chelum	t ʃ ə l u ə m
cherita	t͡ʃ ə r i t a
chit	t͡ʃ i t
chok	t ʃ o k
chukup	t͡ʃ u k u p
chunto	t͡ʃ u n t o
chura	t ʃ u r ə a ʔ
dagin	d a ɡ i n
dalam	d a l a m
dan	d a n
daun	d a u n
demalam	d ə m a l a m
deriba	d ə r i b a
dia	d i a ʔ
diatu	d i a t u ʔ
dik	d i k
din	d i n
dinga	d i ŋ a
ditu	d i t u ʔ
dosa	d o s a
dunya	d u ɲ a
ejip	i d ʒ i p
emperaja	ə m p ə r a d͡ʒ a
emperan	ə m p e r a n
endaraja	ə n d a r a d͡ʒ a
engkakah	ə ŋ k a k a h
ensana	ə n s a n a ʔ
ensikal	ə n s i k a l
entadu	ə n t a d u ʔ
entekai	ə n t e k a i
eropah	e r o p a h
filipina	f i l i p i n a
gadung	ɡ a d u ə ŋ
gaga	ɡ a ɡ a
gaga	ɡ a ɡ a ʔ
gali	ɡ a l i ʔ
gaya	ɡ a j a
gelas	ɡ ə l a s
genteran	ɡ ə n t ə r a n
genturung	ɡ ə n t u r u ŋ
gerai	ɡ ə r a i̯
gerempung	ɡ ə r ə m p u ə ŋ
gerija	ɡ ə r i d ʒ a
gerika	ɡ ə r i k a
gula	ɡ u l a
iban	i b a n
idung	i d u ŋ
indai	i n d a i̯
indu	i n d u ʔ
informasyen	i n f o r m a s j ɛ n
ini	i n i ə ʔ
injin	i n j i n
ipul	i p u ə l
israel	i s r a e l
itali	i t a l i
iya	i j a
jai	d͡ʒ a e ʔ
jaku	d͡ʒ a k u ʔ
jalai	d͡ʒ a l a i
jampat	d͡ʒ a m p a t
jantung	d͡ʒ a n t u ŋ
jauh	d͡ʒ a u h
jenila	d͡ʒ ə n i l a
jepu	d͡ʒ ə p u ə ʔ
jereman	d ʒ ə r ə m ə n
jipun	d ʒ i p u n
jugam	d͡ʒ u ɡ a m
kaban	k a b a n
kad	k a d
kalas	k a l a s
kami	k a m i
kampung	k a m p ʊ ŋ
kanada	k a n a d a
kebuah	k ə b u a h
kedai	k ə d a i̯
kek	k ɛ k
kelab	k ə l a b
kelas	k ə l a s
kemanti	k ə m a n t i ʔ
kepala	k ə p a l a ʔ
keterubah	k ə t ə r u b a h
kitai	k i t a i
kompeni	k o m p ə n i
komunikasyen	k o m ʊ n i k a s j ɛ n
kuda	k u d a
kudi	k u d i ʔ
kuning	k u n i ə ŋ
kupi	k u p i
laki	l a k i
lama	l a m a ʔ
lambar	l a m b a r
langit	l a ŋ i t
latak	l a t ə a k
lawa	l a w a
lelengau	l ə l ə ŋ a u
lia	l i a ʔ
librari	l i b r a r i
lumur	l u m u r
lutur	l u t u r
mai	m a i ʔ
malam	m a l a m
manah	m a n a h
manis	m a n i s
manyi	m a ɲ i ʔ
mar	m a r
masedonia	m a ʃ ə d o n i a
maya	m a j a
mayau	m a j a u̯
meli	m e l i
melikat	m ə l i k a t
menira	m ə n i r a
menua	m ə n u a
menyadi	m ə ɲ a d i ʔ
merap	m ə r a p
mesin	m ə s i n
mija	m i d͡ʒ a
mipau	m i p a u
mirah	m i r a h
mit	m i t
mua	m u a
munyi	m u ɲ i
mupuk	m u p u ə k
nanas	n a n a s
nanga	n a ŋ a
nangka	n a ŋ k a ʔ
nembiak	n ə m b i ə a k
nemu	n ə m u
nerang	n ə r ə a ŋ
ngelala	ŋ ə l a l a
ngelaluka	ŋ ə l a l u k a
ngeli	ŋ ə l i ʔ
ngemanahka	ŋ ə m a n a h k a
ngetau	ŋ ə t a u
ngulihka	ŋ u l i ə h k a
nyiur	ɲ i u r
orang	u ə r a ə ŋ
padah	p a d ə a h
padi	p a d i
pam	p a m
panas	p a n a s
parai	p a r a i
peda	p ə d a ʔ
pelastik	p ə l a s t i k
peluh	p ə l u h
pemakai	p ə m a k a i
pemanah	p ə m a n a ə h
penanggul	p ə n a ŋ ɡ u l
penemu	p ə n e m u
penerang	p ə n ə r ə a ŋ
pengada	p ə ŋ a d a
pengaga	p ə ŋ a ɡ a
pengagai	p ə ŋ a ɡ a i
pengajar	p ə ŋ a d͡ʒ a r
pengarap	p ə ŋ a r a p
pengawa	p ə ŋ a w a ʔ
pengerindu	p ə ŋ ə r i n d u ʔ
penusah	p ə n u s a h
penyauh	p ə ɲ a u h
peranchis	p ə r a n t ʃ i s
perintah	p ə r ɪ n t ə a h
petang	p ə t ə a ŋ
pinsil	p i n s i ə l
pinta	p i n t a ʔ
pisang	p i s a ŋ
presiden	p r ɛ s i d ə n
primari	p r i m ə r i
puji	p u d͡ʒ i
pusu	p u s u ʔ
ragak	r a ɡ ə a k
raja	r a d͡ʒ a
rajang	r a d͡ʒ ə a ŋ
rami	r a m i
randau	r a n d a u
regang	r ə ɡ ə a ŋ
regas	r ə ɡ a s
remaung	r ə m a u ŋ
reti	r ə t i
rian	r i a n
rindu	r i n d u ʔ
rumput	r u m p u t
ruti	r u t i
sabak	s a b ə a k
sabun	s a b ʊ n
salah	s a l ə a h
sayur	s a j u r
sebaka	s ə b a k a
sebedau	s ə b ə d a u
sekelim	s ə k ə l i m
seleju	s ə l ə d͡ʒ u
semalam	s ə m a l a m
semangka	s ə m a ŋ k a
sempama	s ə m p a m a
semua	s ə m u a
sengong	s ə ŋ u ə ŋ
sentuk	s ə n t u ʔ
serega	s ə r ə ɡ a
seruran	s ə r u r a n
setem	s ə t ɛ m
setor	s ə t o r
sida	s i d a ʔ
sipat	s i p a t
siria	s i r i a
sitan	s i t a n
stail	s t a i l
suba	s u b a ʔ
sungai	s u ŋ a i̯
tagang	t a ɡ ə a ŋ
talipaun	t a l i p a u n
tama	t a m a ʔ
tambai	t a m b a i
tan	t a n
tanam	t a n a m
tanda	t a n d a
tanda	t a n d a ʔ
tang	t a ə ŋ
tangan	t a ŋ a n
tarik	t a r i ə k
taring	t a r i ə ŋ
taris	t a r i s
tau	t a u ʔ
tauk	t a u ʔ
tauka	t a u k a
taun	t a u n
teknologi	t ɛ k n o l o ɡ i
televisyen	t e l e v i ʃ ə n
temedak	t ə m ə d ə a k
temu	t ə m u
tenggau	t ə ŋ ɡ a u̯
terebai	t ə r ə b a i
terima	t ə r i m a ʔ
ti	t i ʔ
tin	t i n
tinggi	t i ŋ ɡ i ʔ
tingki	t i ŋ k i
tiun	t i u n
tu	t u ʔ
tua	t u a
tuchuk	t u t͡ʃ u ə ʔ
tulis	t u l i s
tumu	t u m u
tusah	t u s a h
ukai	u k a i̯
universiti	j u n i v ə r s i t i
wad	w a d
